,Ad Name,Adset Name,Creative Type,Spend In USD,Impressions,First Ad Spend Date,Last Ad Spend Date,Days ad spending
1,CB_2025_Jan_FB_3736_LZ-VU_V01_4x5_IMG_EN_Opti_C-NegativeMark_Evergreen_CTA-NONE_Angle-Cort_M-NONE_VL-None_G-NONE_P-NONE_S-NONE_FB3251V01,ðŸŒ¶ï¸ || US || ASC+ || ->CC141 || VIDEO Only || US+CA || 0% EXISTING CAP || 7C || 07/08.24  Ad set,SHARE,"$19,029","828,896",2025-02-04,2025-02-17,13
2,Dynamic_Creative_CA_Flow,WC || CA || DYNAMIC CREATIVE || ADV+ audience || 7C || 17.04.2024 || BIG BUDGET,SHARE,"$12,582","759,180",2024-04-17,2025-02-27,316
3,CB_2025_Jan_FB_3723_SO_V07_4x5_IMG_EN_New_C-NONE_Evergreen_CTA-SALE_Angle-W_M-NONE_VL-None_G-NONE_P-NONE_S-NONE,ðŸŒ¶ï¸ || US || ASC+ || ->CC141 || VIDEO Only || US+CA || 0% EXISTING CAP || 7C || 07/08.24  Ad set,SHARE,"$10,550","679,954",2025-02-04,2025-03-27,51
4,CB_2024_Dec_FB_3619_VK-JT_V02_4x5_VID_EN_New_C-BulletPoints_Sale_CTA-NY_Angle-W-B-C_M-NONE_VL-None_G-NONE_P-OG_S-NONE - Copy,ðŸ’°WC || US || Advantage+ || BIG BUDGET || CC101->105->109->112->114-116->117 || BROAD || ABO || 1C || 17/01/24 RELAUNCHED Ad set,SHARE,"$8,999","151,222",2024-12-27,2025-02-06,41
5,CB_2025_Jan_FB_3705_VK_V02_4x5_IMG_EN_New_C-BulletPoints_Sale_CTA-NY_Angle-W-B-C_M-NONE_VL-None_G-NONE_P-OG_S-NONE,ðŸŒ¶ï¸ || US || ASC+ || ->CC141 || VIDEO Only || US+CA || 0% EXISTING CAP || 7C || 07/08.24  Ad set,SHARE,"$8,404","542,460",2025-01-30,2025-02-19,20
6,CB_2023_Apr_FB_1989_RS_V08_9x16_VID_EN_Opti_C-Trend_CTA-SMR_Pain-W_M-MIX_VL-30s_TR-None_G-MF_P-None,ðŸŒ¶ï¸ || US || ASC+ || ->CC141 || VIDEO Only || US+CA || 0% EXISTING CAP || 7C || 07/08.24  Ad set,VIDEO,"$8,367","459,435",2024-08-07,2025-03-24,229
7,CB_2025_Jan_FB_3750_LZ-VU_V03_4x5_IMG_EN_Opti_C-NegativeMark_Evergreen_CTA-NONE_Angle-W_M-NONE_VL-None_G-NONE_P-NONE_S-NONE_FB3251V01,ðŸŒ¶ï¸ || US || ASC+ || ->CC141 || VIDEO Only || US+CA || 0% EXISTING CAP || 7C || 07/08.24  Ad set,SHARE,"$5,189","216,019",2025-01-24,2025-02-07,14
8,CB_2025_Jan_FB_3736_LZ-VU_V01_4x5_IMG_EN_Opti_C-NegativeMark_Evergreen_CTA-NONE_Angle-Cort_M-NONE_VL-None_G-NONE_P-NONE_S-NONE_FB3251V01,CBV2 || US || Manual Bid: ROAS GOAL: 0.9 -> 1.00 || 7DC || 22/01/2025,SHARE,"$5,029","165,120",2025-01-22,2025-02-14,23
9,CB_2023_Jul_FB_2217_IB_V04_9x16_VID_EN_Opti_C-Pointing_CTA-SMR_Pain-W-B_M-TRC_VL-30s_TR-None_G-F_P-None_S-FRIGGA,ðŸŒ¶ï¸ || US || ASC+ || ->CC141 || VIDEO Only || US+CA || 0% EXISTING CAP || 7C || 07/08.24  Ad set,VIDEO,"$4,898","192,284",2024-08-07,2025-03-27,232
10,CB_2024_Aug_FB_3097_VK-DP_V03_9x16_VID_EN_Opti_C-Benefits_CTA-SMR_Pain-W-B_M-MIX_VL-45s_TR-None_G-MF_P-OG_S-WHAT_FB2516V13,ðŸŒ¶ï¸ || US || ASC+ || ->CC141 || VIDEO Only || US+CA || 0% EXISTING CAP || 7C || 07/08.24  Ad set,VIDEO,"$4,431","201,533",2024-09-04,2025-03-27,204
11,CB_2024_Aug_FB_3090_DT-DP_V02_9x16_VID_EN_Opti_C-MakingOf_CTA-CTA_Pain-W-B-C_M-POW_VL-45s_TR-None_G-M_P-OG_S-Moon_FB3029V04,ðŸŒ¶ï¸ || US || ASC+ || ->CC141 || VIDEO Only || US+CA || 0% EXISTING CAP || 7C || 07/08.24  Ad set,VIDEO,"$3,709","163,261",2025-01-17,2025-03-03,45
12,CB_2025_Jan_FB_3740_SO-DP_V03_4x5_IMG_EN_Opti_C-Headline_Evergreen_CTA-NONE_Angle-W_M-NONE_VL-None_G-NONE_P-OG_S-NONE_3608V03,ðŸŒ¶ï¸ || US || ASC+ || ->CC141 || VIDEO Only || US+CA || 0% EXISTING CAP || 7C || 07/08.24  Ad set,SHARE,"$3,558","251,290",2025-02-04,2025-03-03,27
13,CB_2023_Jul_FB_2284_DA_V05_9x16_VID_EN_Opti_C-Sale_CTA-SMR_Pain-W_M-JANW_VL-30s_TR-None_G-M_P-None_S-WHAT_FB2103V02,ðŸŒ¶ï¸ || US || ASC+ || ->CC141 || VIDEO Only || US+CA || 0% EXISTING CAP || 7C || 07/08.24  Ad set,VIDEO,"$2,600","117,824",2024-08-07,2025-03-27,232
14,CB_2025_Jan_FB_3656_JT_V02_4x5_IMG_EN_New_C-Headline_Seasonal_CTA-70_Angle-W_M-NONE_VL-None_G-NONE_P-OG_S-NONE,ðŸŒ¶ï¸ || US || ASC+ || ->CC141 || VIDEO Only || US+CA || 0% EXISTING CAP || 7C || 07/08.24  Ad set,SHARE,"$2,205","95,026",2025-01-13,2025-03-04,50
15,CB_2023_Jul_FB_2226_MB_V04_9x16_VID_EN_Opti_C-Testim_CTA-SMR_Pain-W_M-MIX_VL-30s_TR-None_G-F_P-None_S-Starry,ðŸŒ¶ï¸ || US || ASC+ || ->CC141 || VIDEO Only || US+CA || 0% EXISTING CAP || 7C || 07/08.24  Ad set,VIDEO,"$2,153","77,299",2024-10-28,2025-03-27,150
16,CB_2024_Jan_FB_2764_RS_V04_9x16_VID_EN_Opti_C-SingleTesti_CTA-SALE_Pain-W_M-TRC_VL-45s_TR-None_G-F_P-OG_S-MOON_FB2263V04,EU (UK) || 2764 || Trinity Results Too Fast || 1C || 08/01/2025w02,VIDEO,"$1,989","77,019",2025-01-08,2025-03-27,78
17,CB_2024_Nov_FB_3264_LZ_V29_4x5_VID_EN_Opti_C-NegativeMark_Sale_CTA-BF_Angle-W-B_M-LRNS_VL-30s_G-M_P-OG_S-NONE,ðŸŒ¶ï¸ || US || ASC+ || ->CC141 || VIDEO Only || US+CA || 0% EXISTING CAP || 7C || 07/08.24  Ad set,VIDEO,"$1,935","88,426",2024-12-04,2025-03-27,113
18,CB_2023_Apr_FB_1989_RS_V08_9x16_VID_EN_Opti_C-Trend_CTA-SMR_Pain-W_M-MIX_VL-30s_TR-None_G-MF_P-None,ASC+ || VIDEO Only || US || 0% EXISTING CAP || 1C || 08.12.24  Ad set,VIDEO,"$1,900","84,442",2025-01-30,2025-02-05,6
19,CB_2024_Sep_FB_3175_DA-KB_V04_1x1_IMG_EN_New_C-ADVRT_Evergreen_CTA-NONE_Angle-W_M-NONE_VL-None_G-NONE_P-CBV2_S-NONE_blog_colonbroomvsmammoth_cv_en,CBV2 || Advantage+ || Advertorial || Higher pricing || US || 0% EXISTING CAP || BROAD || 7C || 20/01/25  Campaign Ad set,SHARE,"$1,836","70,469",2025-01-20,2025-03-27,66
20,CB_2023_Jul_FB_2217_IB_V04_9x16_VID_EN_Opti_C-Pointing_CTA-SMR_Pain-W-B_M-TRC_VL-30s_TR-None_G-F_P-None_S-FRIGGA,ASC+ || VIDEO Only || US || 0% EXISTING CAP || 1C || 08.12.24  Ad set,VIDEO,"$1,824","55,174",2024-12-08,2025-02-05,59
21,CB_2025_Jan_FB_3072_V01_4x5_IMG_EN_New_C-Headline_Seasonal_CTA-None_Angle-W_M-NONE_VL-None_G-NONE_P-OG_S-NONE,AU || Fixed || 3072 EU adaptations || 1C || 20/01/2025w04,SHARE,"$1,732","50,874",2025-01-22,2025-02-14,23
22,CB_2023_May_FB_2263_MB_V04_9x16_VID_EN_New_C-Sale_CTA-SMR_Pain-W_M-JOG_VL-45s_TR-None_G-M-F_P-None_S-Moon,ðŸŒ¶ï¸ || US || ASC+ || ->CC141 || VIDEO Only || US+CA || 0% EXISTING CAP || 7C || 07/08.24  Ad set,VIDEO,"$1,723","51,904",2024-08-07,2025-03-27,232
23,CB_2025_Jan_FB_3740_SO-DP_V03_4x5_IMG_EN_Opti_C-Headline_Evergreen_CTA-NONE_Angle-W_M-NONE_VL-None_G-NONE_P-OG_S-NONE_3608V03,3745 - 3661 Methane Balloon OPTI || Enhancements: OFF || CBV1 || Batch 1 || 1C || 30/01/25w05 || Kostas,SHARE,"$1,629","97,850",2025-01-30,2025-02-13,14
24,CB_2024_Feb_FB_2814_MB-DP_V07_1x1_IMG_EN_New_C-WeightLoss_CTA-CTA_Pain-W-B-C_M-NONE_VL-None_TR-None_G-F_P-V2_S-NONE_2410V06,AU || clinically proven opti || 1C || 23/01/2025w04 || 1C || 20/01/2025w04,SHARE,"$1,561","60,617",2025-01-23,2025-02-12,20
25,CB_2024_Jan_FB_2764_RS_V04_9x16_VID_EN_Opti_C-SingleTesti_CTA-SALE_Pain-W_M-TRC_VL-45s_TR-None_G-F_P-OG_S-MOON_FB2263V04_Page_Personal_Coach,AU || Page: Branded & 3rd Party || 2764 || Trinity Results Too Fast || 1C || 10/01/2025w02,VIDEO,"$1,370","32,221",2025-01-10,2025-03-27,76
26,CB_2025_Jan_FB_3723_SO_V04_4x5_IMG_EN_New_C-NONE_Evergreen_CTA-SALE_Angle-W_M-NONE_VL-None_G-NONE_P-NONE_S-NONE,3723 - Notion Idea #92 MAN BOOBS || Enhancements: OFF || CBV1 || Batch 1 || 1C || 28/01/25w05 || Kostas,SHARE,"$1,359","118,432",2025-01-28,2025-02-21,24
27,CB_2025_Jan_FB_3723_SO_V18_4x5_IMG_EN_New_C-NONE_Evergreen_CTA-SALE_Angle-W_M-NONE_VL-None_G-NONE_P-NONE_S-NONE,3723 - Notion Idea #92 MAN BOOBS || Enhancements: OFF || CBV1 || Batch 4 || 1C || 28/01/25w05 || Kostas,SHARE,"$1,293","105,688",2025-01-28,2025-03-07,38
28,CB_2025_Jan_FB_3723_SO_V07_4x5_IMG_EN_New_C-NONE_Evergreen_CTA-SALE_Angle-W_M-NONE_VL-None_G-NONE_P-NONE_S-NONE,3723 - Notion Idea #92 MAN BOOBS || Enhancements: OFF || CBV1 || Batch 2 || 1C || 28/01/25w05 || Kostas,SHARE,"$1,288","102,861",2025-01-28,2025-02-13,16
29,CB_2025_Jan_FB_3662_CHUB_V01_1x1_IMG_EN_New_C-NONE_CTA-NONE_Angle-C_M-NONE_VL-None_TR-None_G-NONE_P-NONE_S-NONE.jpg,ðŸŒ¶ï¸ || US || ASC+ || ->CC141 || VIDEO Only || US+CA || 0% EXISTING CAP || 7C || 07/08.24  Ad set,SHARE,"$1,269","62,749",2025-01-13,2025-03-04,50
30,CB_2024_Jul_FB_3043_VK-DP_V03_9x16_VID_EN_Opti_C-Dance_CTA-SMR_Pain-W-B_M-POW_VL-30s_TR-None_G-M_P-OG_S-WHAT_FB3030V01,ðŸŒ¶ï¸ || US || ASC+ || ->CC141 || VIDEO Only || US+CA || 0% EXISTING CAP || 7C || 07/08.24  Ad set,VIDEO,"$1,246","78,148",2024-08-27,2025-03-03,188
31,CB_2025_Jan_FB_3746_CHUB-AA_V06_4x5_IMG_EN_Opti_C-NONE_CTA-NONE_Angle-C_M-NONE_VL-None_TR-None_G-NONE_P-NONE_S-NONE,3746 â€“ 3660 G-nugget OPTI v3 || Enhancements: OFF || CBV1 || Batch 2 || 1C || 30/01/25w05 || Kostas,SHARE,"$1,199","72,077",2025-01-30,2025-02-14,15
32,CB_2025_Jan_FB_3742_SO-DP-KB_V01_4x5_IMG_EN_Opti_C-NONE_Evergreen_CTA-SALE_Angle-W_M-NONE_VL-None_G-NONE_P-CBV2_S-NONE3665V01,3742 -  3665_V01 OPTI for PREMIUM 3 || 1C || 31/01/2025w05,SHARE,"$1,134","53,671",2025-01-31,2025-02-10,10
33,CB_2024_Nov_FB_3264_LZ_V31_4x5_VID_EN_Opti_C-MakingOf_Sale_CTA-BF_Angle-W-B_M-CRAZY_VL-45s_G-M_P-OG_S-NEW_FB3004V02,ASC+ || VIDEO Only || US || 0% EXISTING CAP || 1C || 08.12.24  Ad set,VIDEO,"$1,111","40,818",2024-12-08,2025-02-05,59
34,CB_2024_Aug_FB_3097_VK-DP_V03_9x16_VID_EN_Opti_C-Benefits_CTA-SMR_Pain-W-B_M-MIX_VL-45s_TR-None_G-MF_P-OG_S-WHAT_FB2516V13,CB || US || Funnel A: React || 7DC || 04/02/2025,VIDEO,"$1,110","36,886",2025-02-05,2025-02-17,12
35,CB_2025_Jan_FB_3711_DT_V03_4x5_VID_EN_Opti_C-Sale_Sale_CTA-VDAY_Angle-W_M-JOG_VL-30s_G-M-F_P-OG_S-What_FB2103V02,3711 - VDAY top ads 2024 opti 3 || Enhancements: OFF || CBV1 || Batch 1 || 1C || 29/01/25w05 || Kostas,SHARE,"$1,097","68,726",2025-01-29,2025-02-09,11
36,CB_2025_Jan_FB_3718_CHUB_V08_4x5_IMG_EN_Opti_C-NONE_CTA-NONE_Angle-C_M-NONE_VL-None_TR-None_G-M_P-OG_S-NONE,3718 - Looking 15 people OPTI || Enhancements: OFF || CBV1 || Batch 3 || 1C || 29/01/25w05 || Kostas,SHARE,"$1,062","55,125",2025-01-29,2025-02-08,10
37,CB_2024_Aug_FB_3097_VK-DP_V03_9x16_VID_EN_Opti_C-Benefits_CTA-SMR_Pain-W-B_M-MIX_VL-45s_TR-None_G-MF_P-OG_S-WHAT_FB2516V13,CB || US || Funnel B: Shopify || 7DC || 04/02/2025,VIDEO,"$1,017","32,922",2025-02-05,2025-02-17,12
38,CB_2023_Aug_FB_2295_MB_V01_1x1_VID_EN_Opti_C-GIF_CTA-CTA_Pain-W-B_M-None_VL-10s_TR-None_G-None_P-None_S-None,CA || COST CAP 92->93 || 7C || 10/05/24 || V1,VIDEO,$947,"48,367",2024-05-10,2025-02-27,293
39,CB_2025_Jan_FB_3704_SO_V02_4x5_IMG_EN_New_C-Headline_Evergreen_CTA-NONE_Angle-W-B-C_M-NONE_VL-None_G-NONE_P-NONE_S-NON,3704 - Notion Idea #89 FOR REAL MEN || Enhancements: OFF || CBV1 || Batch 1 || 1C || 26/01/25w05 || Kostas,SHARE,$937,"37,915",2025-01-26,2025-02-08,13
40,CB_2024_Sep_FB_3175_DA-KB_V03_1x1_IMG_EN_New_C-ADVRT_Evergreen_CTA-NONE_Angle-W_M-NONE_VL-None_G-NONE_P-CBV2_S-NONE_blog_colonbroomvsmammoth_cv_en,CBV2 || Advantage+ || Advertorial || Higher pricing || US || 0% EXISTING CAP || BROAD || 7C || 20/01/25  Campaign Ad set,SHARE,$875,"33,460",2025-01-20,2025-03-27,66
41,CB_2025_Jan_FB_3779_VK-DP_V02_1x1_VID_EN_Opti_C-BulletPoints_Evergreen_CTA-70_Angle-W-B-C_M-NONE_VL-None_G-F_P-OG_S-NEW_FB3705V02,3779 - opti 3705 || Enhancements: OFF || CBV1 || Batch 1 || 1C || 04/02/25w06 || Kostas,SHARE,$866,"61,087",2025-02-04,2025-03-20,44
42,CB_2025_Jan_FB_3742_SO-DP-KB_V01_4x5_IMG_EN_Opti_C-NONE_Evergreen_CTA-SALE_Angle-W_M-NONE_VL-None_G-NONE_P-CBV2_S-NONE3665V01,3742 -  3665_V01 OPTI for PREMIUM 2 || Batch 1 || 1C || 29/01/2025w05,SHARE,$849,"45,898",2025-01-30,2025-02-10,11
43,CB_2023_Oct_FB_2516_VK_V13_9x16_VID_EN_Opti_C-Benefits_CTA-AUTUM_Pain-W-B_M-PASQ_VL-30s_TR-None_G-M_P-Plan_S-WHAT,ðŸŒ¶ï¸ || US || ASC+ || ->CC141 || VIDEO Only || US+CA || 0% EXISTING CAP || 7C || 07/08.24  Ad set,VIDEO,$807,"27,986",2024-12-19,2025-03-27,98
44,CB_2025_Jan_FB_3740_SO-DP_V03_4x5_IMG_EN_Opti_C-Headline_Evergreen_CTA-NONE_Angle-W_M-NONE_VL-None_G-NONE_P-OG_S-NONE_3608V03,3740 - 3608_v03 OPTI || Enhancements: OFF || CBV1 || Batch 1 || 1C || 29/01/25w05 || Kostas,SHARE,$804,"48,362",2025-01-29,2025-02-11,13
45,CB_2025_Jan_FB_3738_SO-DP_V03_4x5_IMG_EN_Opti_C-NONE_Evergreen_CTA-SALE_Angle-W_M-NONE_VL-None_G-NONE_P-NONE_S-NONE3665V01,3738 - 3665_V01 OPTI || Enhancements: OFF || CBV1 || Batch 1 || 1C || 29/01/25w05 || Kostas,SHARE,$787,"57,368",2025-01-29,2025-02-22,24
46,CB_2024_Dec_FB_3619_VK-JT_V02_4x5_VID_EN_New_C-BulletPoints_Sale_CTA-NY_Angle-W-B-C_M-NONE_VL-None_G-NONE_P-OG_S-NONE,ðŸŒ¶ï¸ || US || ASC+ || ->CC141 || VIDEO Only || US+CA || 0% EXISTING CAP || 7C || 07/08.24  Ad set,SHARE,$772,"46,314",2024-12-27,2025-03-27,90
47,CB_2023_Jul_FB_2217_IB_V04_9x16_VID_EN_Opti_C-Pointing_CTA-SMR_Pain-W-B_M-TRC_VL-30s_TR-None_G-F_P-None_S-FRIGGA,CBV2 || AU || ðŸ’° Advantage+ || US || BROAD || 7C || Existing_customer_5% || 19/12/24 Ad set,VIDEO,$771,"21,573",2024-12-19,2025-03-24,95
48,CB_2025_Jan_FB_3735_VK_V02_4x5_VID_EN_New_C-BulletPoints_Sale_CTA-NY_Angle-W-B-C_M-NONE_VL-None_G-NONE_P-OG_S-NONE,3735 - OPTI 3619 -VK || Enhancements: OFF || CBV1 || Batch 1 || 1C || 29/01/25w05 || Kostas,SHARE,$753,"42,142",2025-01-29,2025-02-07,9
49,CB_2025_Jan_FB_3718_CHUB_V05_4x5_IMG_EN_Opti_C-NONE_CTA-NONE_Angle-C_M-NONE_VL-None_TR-None_G-M_P-OG_S-NONE,3718 - Looking 15 people OPTI || Enhancements: OFF || CBV1 || Batch 2 || 1C || 29/01/25w05 || Kostas,SHARE,$692,"44,174",2025-01-29,2025-02-20,22
50,CB_2023_Jul_FB_2217_IB_V04_9x16_VID_EN_Opti_C-Pointing_CTA-SMR_Pain-W-B_M-TRC_VL-30s_TR-None_G-F_P-None_S-FRIGGA - Copy,CB || US || Funnel B: Shopify || 7DC || 04/02/2025,VIDEO,$680,"19,482",2025-02-05,2025-02-17,12
51,CB_2025_Jan_FB_3747_CHUB-AA_V03_9x16_IMG_EN_Opti_C-NONE_CTA-NONE_Angle-Sale_M-NONE_VL-None_TR-None_G-NONE_P-OG_S-NONE,3747 Clean Sale [HB winner ITR] CHUB || Enhancements: OFF || CBV1 || Batch Ä… || 1C || 02/02/25w06 || Kostas,SHARE,$679,"29,448",2025-02-02,2025-03-27,53
52,CB_2025_Jan_FB_3781_LZ-DP_V04_9x16_GIF_EN_Opti_C-Headline_Evergreen_CTA-NONE_Angle-W_M-NONE_VL-15s_G-NONE_P-OG_S-NEW_FB3608V03,3781 - Hypnosis GIF opti || Enhancements: OFF || CBV1 || Batch 1 || 1C || 04/02/25w06 || Kostas,SHARE,$671,"24,095",2025-02-04,2025-02-11,7
53,CB_2023_Jul_FB_2217_IB_V04_9x16_VID_EN_Opti_C-Pointing_CTA-SMR_Pain-W-B_M-TRC_VL-30s_TR-None_G-F_P-None_S-FRIGGA - Copy,CB || US || Funnel A: React || 7DC || 04/02/2025,VIDEO,$619,"18,473",2025-02-05,2025-02-17,12
54,CB_2024_Jan_FB_2784_RS_V02_9x16_VID_EN_Opti_C-Pointing_CTA-SALE_Pain-W_M-JOG_VL-30s_TR-None_G-F_P-OG_S-OLLIE_FB2181V01,CBV2 || EU (UK) || ðŸ’° Advantage+ || US || BROAD || 7C || Existing_customer_5% || 15/12/24 Ad set,VIDEO,$591,"21,314",2025-01-09,2025-03-27,77
55,CB_2024_Feb_FB_2814_MB-DP_V05_1x1_IMG_EN_New_C-WeightLoss_CTA-None_Pain-W-B-C_M-NONE_VL-None_TR-None_G-NONE_P-V2_S-NONE,EU (UK) || clinically proven opti || 1C || 23/01/2025w04,SHARE,$584,"33,006",2025-01-23,2025-03-10,46
56,CB_2025_Jan_FB_3738_SO-DP_V04_4x5_IMG_EN_Opti_C-NONE_Evergreen_CTA-SALE_Angle-W_M-NONE_VL-None_G-NONE_P-NONE_S-NONE3665V01,3738 - 3665_V01 OPTI || Enhancements: OFF || CBV1 || Batch 1 || 1C || 29/01/25w05 || Kostas,SHARE,$581,"39,435",2025-01-29,2025-02-22,24
57,CB_2025_Jan_FB_3741_LZ-JG_V01_4x5_IMG_EN_Opti_C-Headline_Evergreen_CTA-NONE_Angle-W_M-NONE_VL-None_G-NONE_P-CBV2_S-NONE_FB3357V01,AU || 3741 - V2 dom perignon 2 || 1C || 29/01/2025w05,SHARE,$574,"31,410",2025-01-30,2025-02-20,21
58,CB_2023_Dec_FB_2696_RS_V03_9x16_VID_EN_Opti_C-Sale_CTA-NY65_Pain-W-B_M-JANW_VL-30s_TR-None_G-M_P-OG_S-WHAT_FB2284V05,CBV2 || AU || ðŸ’° Advantage+ || US || BROAD || 7C || Existing_customer_5% || 19/12/24 Ad set,VIDEO,$560,"19,691",2025-01-13,2025-03-27,73
59,CB_2024_Aug_FB_3090_DT-DP_V02_9x16_VID_EN_Opti_C-MakingOf_CTA-CTA_Pain-W-B-C_M-POW_VL-45s_TR-None_G-M_P-OG_S-Moon_FB3029V04,CBV2 || EU (UK) || ðŸ’° Advantage+ || US || BROAD || 7C || Existing_customer_5% || 15/12/24 Ad set,SHARE,$543,"28,859",2024-12-19,2025-03-27,98
60,CB_2025_Jan_FB_3731_DT-DP_V04_4x5_IMG_EN_New_C-Headline_Evergreen_CTA-NONE_Angle-W_M-NONE_VL-None_G-NONE_P-OG_S-NONE,3731 - New idea mom belly || Enhancements: OFF || CBV1 || Batch 1 || 1C || 29/01/25w05 || Kostas,SHARE,$538,"26,421",2025-01-29,2025-02-07,9
61,CB_2025_Jan_FB_3736_LZ-VU_V01_4x5_IMG_EN_Opti_C-NegativeMark_Evergreen_CTA-NONE_Angle-Cort_M-NONE_VL-None_G-NONE_P-NONE_S-NONE_FB3251V01,3750 - bioma ripoff march soft version || Enhancements: OFF || CBV1 || Batch 1 || 1C || 24/01/25w04 || Kostas,SHARE,$529,"15,849",2025-02-04,2025-02-18,14
62,CB_2025_Jan_FB_3740_SO-DP_V01_4x5_IMG_EN_Opti_C-Headline_Evergreen_CTA-NONE_Angle-W_M-NONE_VL-None_G-NONE_P-OG_S-NONE_3608V03,3740 - 3608_v03 OPTI || Enhancements: OFF || CBV1 || Batch 1 || 1C || 29/01/25w05 || Kostas,SHARE,$518,"35,654",2025-01-29,2025-02-11,13
63,CB_2024_Jan_FB_2764_RS_V04_9x16_VID_EN_Opti_C-SingleTesti_CTA-SALE_Pain-W_M-TRC_VL-45s_TR-None_G-F_P-OG_S-MOON_FB2263V04_Page_Personal_Coach,CBV2 || AU || ðŸ’° Advantage+ || US || BROAD || 7C || Existing_customer_5% || 19/12/24 Ad set,VIDEO,$513,"10,519",2025-01-16,2025-03-27,70
64,CB_2024_Feb_FB_2812_MB-RP_V07_9x16_VID_EN_Opti_C-Sale_CTA-C65_Pain-W_M-NONE_VL-30s_TR-None_G-MF_P-Plan_S-NEW_FB2601V04_1,ðŸŒ¶ï¸ || US || ASC+ || ->CC141 || VIDEO Only || US+CA || 0% EXISTING CAP || 7C || 07/08.24  Ad set,VIDEO,$509,"22,892",2025-02-02,2025-02-14,12
65,CB_2025_Jan_FB_3742_SO-DP-KB_V06_4x5_IMG_EN_Opti_C-NONE_Evergreen_CTA-SALE_Angle-W_M-NONE_VL-None_G-NONE_P-CBV2_S-NONE3665V01,3742 -  3665_V01 OPTI for PREMIUM 2 || Batch 2 || 1C || 31/01/2025w05,SHARE,$502,"37,165",2025-01-31,2025-02-18,18
66,CB_2024_Dec_FB_3619_VK-JT_V02_4x5_VID_EN_New_C-BulletPoints_Sale_CTA-NY_Angle-W-B-C_M-NONE_VL-None_G-NONE_P-OG_S-NONE - Copy,CB || US || Funnel B: Shopify || 7DC || 04/02/2025,SHARE,$489,"20,327",2025-02-05,2025-02-17,12
67,CB_2024_Dec_FB_3601_VK-DP_V09_4x5_VID_EN_Opti_C-Dance_CTA-NY_Pain-W-B_M-JOG_VL-30s_TR-None_G-F_P-OG_S-WHAT_FB3045V01,ðŸŒ¶ï¸ || US || ASC+ || ->CC141 || VIDEO Only || US+CA || 0% EXISTING CAP || 7C || 07/08.24  Ad set,VIDEO,$487,"11,656",2024-12-27,2025-02-14,49
68,CB_2023_May_FB_2263_MB_V04_9x16_VID_EN_New_C-Sale_CTA-SMR_Pain-W_M-JOG_VL-45s_TR-None_G-M-F_P-None_S-Moon,CBV2 || AU || ðŸ’° Advantage+ || US || BROAD || 7C || Existing_customer_5% || 19/12/24 Ad set,VIDEO,$482,"12,460",2024-12-19,2025-03-27,98
69,CB_2025_Jan_FB_3746_CHUB-AA_V07_4x5_IMG_EN_Opti_C-NONE_CTA-NONE_Angle-C_M-NONE_VL-None_TR-None_G-NONE_P-NONE_S-NONE,3746 â€“ 3660 G-nugget OPTI v3 || Enhancements: OFF || CBV1 || Batch 2 || 1C || 30/01/25w05 || Kostas,SHARE,$468,"24,938",2025-01-30,2025-02-14,15
70,CB_2025_Jan_FB_3759_VK_V05_4x5_VID_EN_New_C-BulletPoints_Evergreen_CTA-NONE_Angle-W-B-C_M-NONE_VL-15s_G-M_P-OG_S-NEW,3761 - testis to to video 3722 || Enhancements: OFF || CBV1 || Batch 2 || 1C || 03/02/25w06 || Kostas,SHARE,$465,"25,585",2025-02-04,2025-02-11,7
71,CB_2025_Jan_FB_3766_SO_V01_4x5_IMG_EN_Opti_C-Headline_Evergreen_CTA-NONE_Angle-W-B-C_M-NONE_VL-None_G-NONE_P-NONE_S-NONE_3700V08,3766 - 3700 copy opti || Enhancements: OFF || CBV1 || Batch 1 || 1C || 03/02/25w06 || Kostas,SHARE,$462,"32,781",2025-02-04,2025-02-22,18
72,CB_2024_Dec_FB_3619_VK-JT_V02_4x5_VID_EN_New_C-BulletPoints_Sale_CTA-NY_Angle-W-B-C_M-NONE_VL-None_G-NONE_P-OG_S-NONE - Copy,CB || US || Funnel A: React || 7DC || 04/02/2025,SHARE,$462,"18,961",2025-02-05,2025-02-17,12
73,CB_2023_Dec_FB_2712_RS-DP_V02_1x1_VID_EN_Opti_C-WrittenTesti_CTA-SALE_Pain-W-B-C_M-NONE_VL-None_TR-None_G-NONE_P-V2_S-NONE_FB2227V08,CBV2 || EU (UK) || ðŸ’° Advantage+ || US || BROAD || 7C || Existing_customer_5% || 15/12/24 Ad set,SHARE,$444,"21,568",2024-12-15,2025-03-27,102
74,CB_2025_Jan_FB_3736_LZ-VU_V01_4x5_IMG_EN_Opti_C-NegativeMark_Evergreen_CTA-NONE_Angle-Cort_M-NONE_VL-None_G-NONE_P-NONE_S-NONE_FB3251V01,EU (UK) ||  EU adaptation || 3736 - Bioma ripoff march opti || 1C || 21/01/2025w04,SHARE,$428,"20,450",2025-01-21,2025-02-04,14
75,CB_2025_Jan_FB_3687_DT_V04_4x5_VID_EN_Opti_C-MakingOf_Sale_CTA-VDAY_Angle-W-B-C_M-POW_VL-45s_G-M_P-OG_S-Moon_FB3090V02,3687 - Valentine_s Day Opti 3090 || Enhancements: OFF || CBV1 || Batch Ä… || 1C || 02/02/25w06 || Kostas,SHARE,$427,"25,403",2025-02-02,2025-02-19,17
76,CB_2025_Jan_FB_3718_CHUB_V02_4x5_IMG_EN_Opti_C-NONE_CTA-NONE_Angle-C_M-NONE_VL-None_TR-None_G-M_P-OG_S-NONE,3718 - Looking 15 people OPTI || Enhancements: OFF || CBV1 || Batch 1 || 1C || 29/01/25w05 || Kostas,SHARE,$415,"19,760",2025-01-29,2025-02-07,9
77,CB_2023_Dec_FB_2712_RS-DP_V02_1x1_VID_EN_Opti_C-WrittenTesti_CTA-SALE_Pain-W-B-C_M-NONE_VL-None_TR-None_G-NONE_P-V2_S-NONE_FB2227V08,CBV2 || AU || ðŸ’° Advantage+ || US || BROAD || 7C || Existing_customer_5% || 19/12/24 Ad set,SHARE,$414,"14,348",2024-12-19,2025-03-27,98
78,CB_2024_Dec_FB_3639_CHUB_V03_1x1_IMG_EN_New_C-NONE_CTA-NONE_Angle-W_M-NONE_VL-None_TR-None_G-NONE_P-NONE_S-NONE,CBV2 || US || Manual Bid: ROAS GOAL: 0.9 -> 1.00 || 7DC || 22/01/2025,SHARE,$399,"13,934",2025-01-22,2025-02-11,20
79,CB_2023_Dec_FB_2696_RS_V03_9x16_VID_EN_Opti_C-Sale_CTA-NY65_Pain-W-B_M-JANW_VL-30s_TR-None_G-M_P-OG_S-WHAT_FB2284V05,US || Manual Bid: ROAS GOAL: 1.1 -> 1.2 || 7DC || 28/01/2025,VIDEO,$381,"18,919",2025-01-28,2025-02-11,14
80,CB_2025_Jan_FB_3771_VK-DP_V01_9x16_VID_EN_New_C-BulletPoints_Evergreen_CTA-NONE_Angle-W-B-C_M-MAG_VL-15s_G-M_P-OG_S-NEW,3771 - New idea spot the lie for CB V1 - DP-VK || Enhancements: OFF || CBV1 || Batch 1 || 1C || 04/02/25w06 || Kostas,VIDEO,$372,"16,209",2025-02-04,2025-02-11,7
81,CB_2023_Jul_FB_2217_IB_V04_9x16_VID_EN_Opti_C-Pointing_CTA-SMR_Pain-W-B_M-TRC_VL-30s_TR-None_G-F_P-None_S-FRIGGA,CBV2 || EU (UK) || ðŸ’° Advantage+ || US || BROAD || 7C || Existing_customer_5% || 15/12/24 Ad set,VIDEO,$372,"18,888",2024-12-18,2025-03-27,99
82,CB_2023_Nov_FB_2649_VK_V06_9x16_VID_EN_Opti_C-Sale_CTA-C65_Pain-W_M-NONE_VL-30s_TR-None_G-MF_P-Plan_S-NEW_FB2601V04,ðŸ’°WC || US || Advantage+ || BIG BUDGET || CC101->105->109->112->114-116->117 || BROAD || ABO || 1C || 17/01/24 RELAUNCHED Ad set,VIDEO,$359,"13,924",2024-01-17,2025-02-06,386
83,CB_2025_Jan_FB_3741_LZ-JG_V01_4x5_IMG_EN_Opti_C-Headline_Evergreen_CTA-NONE_Angle-W_M-NONE_VL-None_G-NONE_P-CBV2_S-NONE_FB3357V01,CBV2 || US || Manual Bid: ROAS GOAL: 0.9 -> 1.00 || 7DC || 22/01/2025,SHARE,$346,"15,156",2025-01-22,2025-03-27,64
84,CB_2025_Jan_FB_3781_LZ-DP_V06_9x16_GIF_EN_Opti_C-Headline_Evergreen_CTA-SALE_Angle-W_M-NONE_VL-15s_G-NONE_P-OG_S-NEW_FB3608V03,3781 - Hypnosis GIF opti || Enhancements: OFF || CBV1 || Batch 2 || 1C || 04/02/25w06 || Kostas,SHARE,$341,"13,010",2025-02-04,2025-02-08,4
85,CB_2023_May_FB_2263_MB_V04_9x16_VID_EN_New_C-Sale_CTA-SMR_Pain-W_M-JOG_VL-45s_TR-None_G-M-F_P-None_S-Moon,ðŸ’°WC || US || Advantage+ || BIG BUDGET || CC101->105->109->112->114-116->117 || BROAD || ABO || 1C || 17/01/24 RELAUNCHED Ad set,VIDEO,$332,"10,025",2024-01-17,2025-02-06,386
86,CB_2025_Jan_FB_3724_CHUB-AA_V02_4x5_IMG_EN_New_C-NONE_CTA-NONE_Angle-C_M-NONE_VL-None_TR-None_G-M_P-OG_S-NONE,3724 Get Regular CHUB || Enhancements: OFF || CBV1 || Batch 1 || 1C || 29/01/25w05 || Kostas,SHARE,$326,"19,811",2025-01-29,2025-02-13,15
87,CB_2025_Jan_FB_3767_VK-DP_V02_9x16_VID_EN_New_C-BulletPoints_Evergreen_CTA-NONE_Angle-W-B-C_M-NONE_VL-15s_G-M_P-OG_S-NEW,3767 - Short video new idea CB V1 - DP || Enhancements: OFF || CBV1 || Batch 1 || 1C || 03/02/25w06 || Kostas,VIDEO,$315,"17,609",2025-02-04,2025-02-11,7
88,CB_2025_Jan_FB_3072_V01_4x5_IMG_EN_New_C-Headline_Seasonal_CTA-None_Angle-W_M-NONE_VL-None_G-NONE_P-OG_S-NONE,CBV2 || AU || ðŸ’° Advantage+ || US || BROAD || 7C || Existing_customer_5% || 19/12/24 Ad set,SHARE,$306,"9,186",2025-01-22,2025-02-07,16
89,CB_2025_Jan_FB_3742_SO-DP-KB_V05_4x5_IMG_EN_Opti_C-NONE_Evergreen_CTA-SALE_Angle-W_M-NONE_VL-None_G-NONE_P-CBV2_S-NONE3665V01,3742 -  3665_V01 OPTI for PREMIUM 2 || Batch 2 || 1C || 31/01/2025w05,SHARE,$303,"20,395",2025-01-31,2025-02-18,18
90,CB_2024_Jan_FB_2764_RS_V04_9x16_VID_EN_Opti_C-SingleTesti_CTA-SALE_Pain-W_M-TRC_VL-45s_TR-None_G-F_P-OG_S-MOON_FB2263V04_Page_Personal_Coach,US || Manual Bid: ROAS GOAL: 1.1 -> 1.2 || 7DC || 28/01/2025,VIDEO,$300,"7,204",2025-01-28,2025-02-11,14
91,CB_2023_Jul_FB_2217_IB_V04_9x16_VID_EN_Opti_C-Pointing_CTA-SMR_Pain-W-B_M-TRC_VL-30s_TR-None_G-F_P-None_S-FRIGGA,US || Manual Bid || BFCM || COST CAP 91 || 1C || 15/11/24,VIDEO,$297,"9,762",2024-11-15,2025-02-27,104
92,CB_2025_Jan_FB_3778_DT-DP_V04_9x16_VID_EN_Opti_C-Benefits_Sale_CTA-70_Angle-W-B_M-MAN_VL-45s_G-M_P-OG_S-WHAT_FB3097V03,3778 - Opti 3097 || Enhancements: OFF || CBV1 || Batch 1 || 1C || 04/02/25w06 || Kostas,VIDEO,$292,"13,499",2025-02-04,2025-02-11,7
93,CB_2025_Jan_FB_3776_DT-DP_V03_9x16_VID_EN_New_C-SplitScreen_Sale_CTA-70_Angle-W_M-NONE_VL-15s_G-NONE_P-OG_S-NEW,3776 - New Idea - post pregnancy weight loss || Enhancements: OFF || CBV1 || Batch 1 || 1C || 04/02/25w06 || Kostas,VIDEO,$290,"10,440",2025-02-04,2025-02-11,7
94,CB_2024_Sep_FB_3175_DA-KB_V01_1x1_IMG_EN_New_C-ADVRT_Evergreen_CTA-NONE_Angle-W_M-NONE_VL-None_G-NONE_P-CBV2_S-NONE_blog_colonbroomvsmammoth_cv_en,CBV2 || Advantage+ || Advertorial || Higher pricing || US || 0% EXISTING CAP || BROAD || 7C || 20/01/25  Campaign Ad set,SHARE,$272,"13,550",2025-01-20,2025-03-27,66
95,CB_2024_Feb_FB_2814_MB-DP_V07_1x1_IMG_EN_New_C-WeightLoss_CTA-CTA_Pain-W-B-C_M-NONE_VL-None_TR-None_G-F_P-V2_S-NONE_2410V06,EU (UK) || clinically proven opti || 1C || 23/01/2025w04,SHARE,$254,"11,235",2025-01-23,2025-03-10,46
96,CB_2025_Jan_FB_3726_LZ-JG_V01_4x5_IMG_EN_Opti_C-Headline_Evergreen_CTA-NONE_Angle-W_M-NONE_VL-None_G-NONE_P-OG_S-NONE_FB3357V01,ðŸŒ¶ï¸ || US || ASC+ || ->CC141 || VIDEO Only || US+CA || 0% EXISTING CAP || 7C || 07/08.24  Ad set,SHARE,$251,"14,165",2025-01-27,2025-02-03,7
97,CB_2025_Jan_FB_3769_DT-JT_V03_9x16_VID_EN_Opti_C-BulletPoints_Sale_CTA-70_Angle-W-B-C_M-POW_VL-30s_G-F_P-OG_S-NEW_3666V03,3769 - Opti 3666 || Enhancements: OFF || CBV1 || Batch 1 || 1C || 04/02/25w06 || Kostas,VIDEO,$248,"11,673",2025-02-04,2025-02-11,7
98,CB_2025_Jan_FB_3781_LZ-DP_V07_9x16_GIF_EN_Opti_C-Headline_Evergreen_CTA-SALE_Angle-W_M-NONE_VL-15s_G-NONE_P-OG_S-NEW_FB3608V03,3781 - Hypnosis GIF opti || Enhancements: OFF || CBV1 || Batch 2 || 1C || 04/02/25w06 || Kostas,VIDEO,$242,"7,576",2025-02-04,2025-02-08,4
99,CB_2025_Jan_FB_3716_CHUB_V01_4x5_IMG_EN_Opti_C-NONE_CTA-NONE_Angle-C_M-NONE_VL-None_TR-None_G-M_P-OG_S-NONE,3716 - Valentines day event OPTI || Enhancements: OFF || CBV1 || Batch 2 || 1C || 29/01/25w05 || Kostas,SHARE,$241,"11,332",2025-01-29,2025-02-09,11
100,CB_2025_Jan_FB_3716_CHUB_V02_4x5_IMG_EN_Opti_C-NONE_CTA-NONE_Angle-C_M-NONE_VL-None_TR-None_G-M_P-OG_S-NONE,3716 - Valentines day event OPTI || Enhancements: OFF || CBV1 || Batch 2 || 1C || 29/01/25w05 || Kostas,SHARE,$235,"12,812",2025-01-29,2025-02-09,11
101,CB_2025_Jan_FB_3772_DT-DP_V01_4x5_VID_EN_New_C-SplitScreen_Sale_CTA-70_Angle-W_M-NONE_VL-15s_G-NONE_P-OG_S-NEW,3772 - Split-screen ads_VID CB V1 || Enhancements: OFF || CBV1 || Batch 1 || 1C || 04/02/25w06 || Kostas,VIDEO,$232,"7,885",2025-02-04,2025-02-11,7
102,CB_2023_May_FB_2144_MB_V02_9x16_VID_EN_Opti_C-Sale_CTA-SMR_Pain-W_M-JOG_VL-30s_TR-None_G-M-F_P-None_S-What,CA || COST CAP 92->93 || 7C || 10/05/24 || V1,VIDEO,$232,"14,765",2024-05-10,2025-02-27,293
103,CB_2025_Jan_FB_3072_V02_4x5_IMG_EN_New_C-Headline_Seasonal_CTA-None_Angle-W_M-NONE_VL-None_G-NONE_P-OG_S-NONE,AU || Fixed || 3072 EU adaptations || 1C || 20/01/2025w04,SHARE,$231,"9,249",2025-01-20,2025-02-14,25
104,CB_2024_Nov_FB_3264_LZ_V31_4x5_VID_EN_Opti_C-MakingOf_Sale_CTA-BF_Angle-W-B_M-CRAZY_VL-45s_G-M_P-OG_S-NEW_FB3004V02,CBV2 || EU (UK) || ðŸ’° Advantage+ || US || BROAD || 7C || Existing_customer_5% || 15/12/24 Ad set,VIDEO,$230,"12,582",2024-12-19,2025-03-27,98
105,CB_2025_Jan_FB_3742_SO-DP-KB_V04_4x5_IMG_EN_Opti_C-NONE_Evergreen_CTA-SALE_Angle-W_M-NONE_VL-None_G-NONE_P-CBV2_S-NONE3665V01,3742 -  3665_V01 OPTI for PREMIUM 2 || Batch 2 || 1C || 31/01/2025w05,SHARE,$224,"15,127",2025-01-31,2025-02-18,18
106,CB_2023_Jul_FB_2217_IB_V04_9x16_VID_EN_Opti_C-Pointing_CTA-SMR_Pain-W-B_M-TRC_VL-30s_TR-None_G-F_P-None_S-FRIGGA,ðŸ’°WC || US || Advantage+ || BIG BUDGET || CC101->105->109->112->114-116->117 || BROAD || ABO || 1C || 17/01/24 RELAUNCHED Ad set,VIDEO,$209,"6,512",2024-01-17,2025-02-06,386
107,CB_2022_Mar3_FB_713_IK_V04_1x1_IMG_EN_Opti_C-WrittenTesti_HE-98_A-ExtremeBodyVisualization_HK-bodypart_Pain-W_CLR-PURPLE_BG-IMAGE_ME-MIX_MA-YOUNG,US || Manual Bid || BFCM || ROAS GOAL: 1.4 || 1C || 15/11/24,SHARE,$209,"9,214",2024-11-15,2025-02-27,104
108,CB_2024_Dec_FB_3601_VK-DP_V09_4x5_VID_EN_Opti_C-Dance_CTA-NY_Pain-W-B_M-JOG_VL-30s_TR-None_G-F_P-OG_S-WHAT_FB3045V01,CBV2 || AU || ðŸ’° Advantage+ || US || BROAD || 7C || Existing_customer_5% || 19/12/24 Ad set,SHARE,$207,"6,721",2025-01-03,2025-03-27,83
109,CB_2025_Jan_FB_3742_SO-DP-KB_V03_4x5_IMG_EN_Opti_C-NONE_Evergreen_CTA-SALE_Angle-W_M-NONE_VL-None_G-NONE_P-CBV2_S-NONE3665V01,3742 -  3665_V01 OPTI for PREMIUM 3 || 1C || 31/01/2025w05,SHARE,$205,"10,435",2025-01-31,2025-02-10,10
110,CB_2023_May_FB_2263_MB_V04_9x16_VID_EN_New_C-Sale_CTA-SMR_Pain-W_M-JOG_VL-45s_TR-None_G-M-F_P-None_S-Moon,US || Manual Bid: ROAS GOAL: 1.1 -> 1.2 || 7DC || 28/01/2025,VIDEO,$205,"5,009",2025-01-28,2025-02-11,14
111,CB_2025_Jan_FB_3767_VK-DP_V05_9x16_VID_EN_New_C-BulletPoints_Evergreen_CTA-NONE_Angle-W-B-C_M-TRC_VL-15s_G-M_P-OG_S-NEW,3767 - Short video new idea CB V1 - DP || Enhancements: OFF || CBV1 || Batch 2 || 1C || 03/02/25w06 || Kostas,VIDEO,$201,"11,004",2025-02-04,2025-02-13,9
112,CB_2024_Jan_FB_2764_RS_V04_9x16_VID_EN_Opti_C-SingleTesti_CTA-SALE_Pain-W_M-TRC_VL-45s_TR-None_G-F_P-OG_S-MOON_FB2263V04,CBV2 || EU (UK) || ðŸ’° Advantage+ || US || BROAD || 7C || Existing_customer_5% || 15/12/24 Ad set,VIDEO,$201,"8,277",2025-02-04,2025-03-14,38
113,CB_2025_Jan_FB_3072_V01_4x5_IMG_EN_New_C-Headline_Seasonal_CTA-None_Angle-W_M-NONE_VL-None_G-NONE_P-OG_S-NONE,US || Manual Bid: ROAS GOAL: 1.1 -> 1.2 || 7DC || 28/01/2025,SHARE,$200,"4,997",2025-01-28,2025-02-11,14
114,CB_2024_Dec_FB_3592_VK-DP_V10_4x5_VID_EN_New_C-BulletPoints_Sale_CTA-SALE_Angle-W-B-C_M-NONE_VL-30s_G-F_P-OG_S-NEW - Copy,ðŸŒ¶ï¸ || US || ASC+ || ->CC141 || VIDEO Only || US+CA || 0% EXISTING CAP || 7C || 07/08.24  Ad set,VIDEO,$199,"8,729",2024-12-21,2025-03-27,96
115,CB_2025_Jan_FB_3776_DT-DP_V01_9x16_VID_EN_New_C-SplitScreen_Sale_CTA-70_Angle-W_M-NONE_VL-15s_G-NONE_P-OG_S-NEW,3776 - New Idea - post pregnancy weight loss || Enhancements: OFF || CBV1 || Batch 1 || 1C || 04/02/25w06 || Kostas,VIDEO,$196,"9,387",2025-02-04,2025-02-11,7
116,CB_2025_Jan_FB_3759_VK_V11_4x5_VID_EN_New_C-BulletPoints_Evergreen_CTA-NONE_Angle-W-B-C_M-NONE_VL-15s_G-M_P-OG_S-NEW,3761 - testis to to video 3722 || Enhancements: OFF || CBV1 || Batch 3 || 1C || 03/02/25w06 || Kostas,SHARE,$194,"10,595",2025-02-04,2025-02-11,7
117,CB_2025_Jan_FB_3778_DT-DP_V02_9x16_VID_EN_Opti_C-Benefits_Sale_CTA-70_Angle-W-B_M-MAN_VL-45s_G-M_P-OG_S-WHAT_FB3097V03,3778 - Opti 3097 || Enhancements: OFF || CBV1 || Batch 1 || 1C || 04/02/25w06 || Kostas,VIDEO,$193,"8,208",2025-02-04,2025-02-11,7
118,CB_2025_Jan_FB_3759_VK_V10_4x5_VID_EN_New_C-BulletPoints_Evergreen_CTA-NONE_Angle-W-B-C_M-NONE_VL-15s_G-M_P-OG_S-NEW,3761 - testis to to video 3722 || Enhancements: OFF || CBV1 || Batch 3 || 1C || 03/02/25w06 || Kostas,SHARE,$192,"12,962",2025-02-04,2025-02-11,7
119,CB_2025_Jan_FB_3772_DT-DP_V03_4x5_VID_EN_New_C-SplitScreen_Sale_CTA-70_Angle-W_M-NONE_VL-15s_G-NONE_P-OG_S-NEW,3772 - Split-screen ads_VID CB V1 || Enhancements: OFF || CBV1 || Batch 1 || 1C || 04/02/25w06 || Kostas,VIDEO,$189,"7,088",2025-02-04,2025-02-11,7
120,CB_2024_Jan_FB_2762_IK_V05_1x1_IMG_EN_New_C-WrittenTesti_CTA-CTA_Pain-W-B-C_M-NONE_VL-None_TR-None_G-NONE_P-V2_S-NONE,CBV2 || EU (UK) || ðŸ’° Advantage+ || US || BROAD || 7C || Existing_customer_5% || 15/12/24 Ad set,SHARE,$188,"8,041",2024-12-15,2025-03-27,102
121,CB_2025_Jan_FB_3750_LZ-VU_V05_4x5_IMG_EN_Opti_C-NegativeMark_Evergreen_CTA-NONE_Angle-W_M-NONE_VL-None_G-NONE_P-NONE_S-NONE_FB3251V01,3750 - bioma ripoff march soft version || Enhancements: OFF || CBV1 || Batch 1 || 1C || 24/01/25w04 || Kostas,SHARE,$188,"6,133",2025-01-24,2025-02-17,24
122,CB_2025_Jan_FB_3765_SO-JT_V02_1x1_IMG_EN_New_C-Headline_Evergreen_CTA-NONE_Angle-W_M-NONE_VL-None_G-NONE_P-NONE_S-NONE,3765 - SUGAR DETOX 2 IMG || Enhancements: OFF || CBV1 || Batch Ä… || 1C || 02/02/25w06 || Kostas,SHARE,$184,"10,347",2025-02-02,2025-02-07,5
123,CB_2025_Jan_FB_3759_VK_V01_4x5_VID_EN_New_C-BulletPoints_Evergreen_CTA-NONE_Angle-W-B-C_M-NONE_VL-15s_G-M_P-OG_S-NEW,3761 - testis to to video 3722 || Enhancements: OFF || CBV1 || Batch 1 || 1C || 03/02/25w06 || Kostas,SHARE,$184,"6,687",2025-02-04,2025-02-11,7
124,CB_2025_Jan_FB_3771_VK-DP_V07_9x16_VID_EN_New_C-BulletPoints_Evergreen_CTA-70_Angle-W-B-C_M-GLAD_VL-30s_G-F_P-OG_S-NEW,3771 - New idea spot the lie for CB V1 - DP-VK || Enhancements: OFF || CBV1 || Batch 2 || 1C || 04/02/25w06 || Kostas,SHARE,$183,"9,523",2025-02-04,2025-02-11,7
125,CB_2025_Jan_FB_3745_CHUB_V01_4x5_IMG_EN_Opti_C-NONE_CTA-NONE_Angle-B_M-NONE_VL-None_TR-None_G-F_P-OG_S-NONE,3745 - 3661 Methane Balloon OPTI || Enhancements: OFF || CBV1 || Batch 1 || 1C || 30/01/25w05 || Kostas,SHARE,$182,"12,089",2025-01-30,2025-02-13,14
126,CB_2025_Jan_FB_3742_SO-DP-KB_V02_4x5_IMG_EN_Opti_C-NONE_Evergreen_CTA-SALE_Angle-W_M-NONE_VL-None_G-NONE_P-CBV2_S-NONE3665V01,3742 -  3665_V01 OPTI for PREMIUM 3 || 1C || 31/01/2025w05,SHARE,$182,"10,214",2025-01-31,2025-02-10,10
127,CB_2025_Jan_FB_3771_VK-DP_V06_9x16_VID_EN_New_C-BulletPoints_Evergreen_CTA-70_Angle-W-B-C_M-GLAD_VL-30s_G-F_P-OG_S-NEW,3771 - New idea spot the lie for CB V1 - DP-VK || Enhancements: OFF || CBV1 || Batch 2 || 1C || 04/02/25w06 || Kostas,SHARE,$182,"7,911",2025-02-04,2025-02-11,7
128,CB_2025_Jan_FB_3767_VK-DP_V08_9x16_VID_EN_New_C-BulletPoints_Evergreen_CTA-NONE_Angle-W-B-C_M-TRC_VL-15s_G-M_P-OG_S-NEW,3767 - Short video new idea CB V1 - DP || Enhancements: OFF || CBV1 || Batch 2 || 1C || 03/02/25w06 || Kostas,VIDEO,$181,"9,994",2025-02-04,2025-02-13,9
129,IM_CB1.png,US || VSL || Aff's image + Taboola ad || Batch 1 || Landing: new5/pre-1 || 1C || 28/01/25,SHARE,$171,"8,130",2025-01-28,2025-02-05,8
130,CB_2024_Feb_FB_2812_MB-RP_V07_9x16_VID_EN_Opti_C-Sale_CTA-C65_Pain-W_M-NONE_VL-30s_TR-None_G-MF_P-Plan_S-NEW_FB2601V04_1,ASC+ || VIDEO Only || US || 0% EXISTING CAP || 1C || 08.12.24  Ad set,VIDEO,$165,"5,348",2024-12-19,2025-02-05,48
131,CB_2025_Jan_FB_3769_DT-JT_V02_9x16_VID_EN_Opti_C-BulletPoints_Sale_CTA-70_Angle-W-B-C_M-POW_VL-30s_G-F_P-OG_S-NEW_3666V03,3769 - Opti 3666 || Enhancements: OFF || CBV1 || Batch 1 || 1C || 04/02/25w06 || Kostas,VIDEO,$161,"8,536",2025-02-04,2025-02-11,7
132,CB_2025_Jan_FB_3687_DT_V02_4x5_VID_EN_Opti_C-MakingOf_Sale_CTA-VDAY_Angle-W-B-C_M-POW_VL-45s_G-M_P-OG_S-Moon_FB3090V02,3687 - Valentine_s Day Opti 3090 || Enhancements: OFF || CBV1 || Batch Ä… || 1C || 02/02/25w06 || Kostas,SHARE,$158,"7,880",2025-02-02,2025-02-19,17
133,CB_2025_Jan_FB_3709_VK-JT_V03_4x5_IMG_EN_New_C-BulletPoints_Sale_CTA-NY_Angle-W-B-C_M-NONE_VL-None_G-M_P-OG_S-NONE,3709 -Notion Sigma male #109 VK-JT || Enhancements: OFF || CBV1 || Batch 1 || 1C || 29/01/25w05 || Kostas,SHARE,$157,"8,991",2025-01-29,2025-02-05,7
134,CB_2025_Feb_FB_3782_CHUB_V06_9x16_VID_EN_New_C-NONE_CTA-NONE_Angle-None_M-NONE_VL-None_TR-None_G-NONE_P-NONE_S-NONE,3782 - Political weight loss journey CHUB || Enhancements: OFF || CBV1 || Batch 2 || 1C || 06/02/25w06 || Kostas,VIDEO,$154,"10,021",2025-02-06,2025-02-08,2
135,CB_2023_Dec_FB_2670_MB-RP_V02_9x16_VID_EN_Opti_C-Sale_CTA-XMAS65_Pain-W_M-JOG_VL-30s_TR-None,ðŸ’°WC || US || Advantage+ || BIG BUDGET || CC101->105->109->112->114-116->117 || BROAD || ABO || 1C || 17/01/24 RELAUNCHED Ad set,VIDEO,$151,"5,306",2024-01-17,2025-02-06,386
136,CB_2025_Jan_FB_3731_DT-DP_V02_4x5_IMG_EN_New_C-Headline_Evergreen_CTA-NONE_Angle-W_M-NONE_VL-None_G-NONE_P-OG_S-NONE,3731 - New idea mom belly || Enhancements: OFF || CBV1 || Batch 1 || 1C || 29/01/25w05 || Kostas,SHARE,$150,"6,999",2025-01-29,2025-02-07,9
137,CB_2025_Feb_FB_3782_CHUB_V04_9x16_VID_EN_New_C-NONE_CTA-NONE_Angle-None_M-NONE_VL-None_TR-None_G-NONE_P-NONE_S-NONE,3782 - Political weight loss journey CHUB || Enhancements: OFF || CBV1 || Batch 2 || 1C || 06/02/25w06 || Kostas,VIDEO,$150,"7,975",2025-02-06,2025-02-21,15
138,CB_2024_Sep_FB_3175_DA-KB_V02_1x1_IMG_EN_New_C-ADVRT_Evergreen_CTA-NONE_Angle-W_M-NONE_VL-None_G-NONE_P-CBV2_S-NONE_blog_colonbroomvsmammoth_cv_en,CBV2 || Advantage+ || Advertorial || Higher pricing || US || 0% EXISTING CAP || BROAD || 7C || 20/01/25  Campaign Ad set,SHARE,$149,"8,809",2025-01-20,2025-03-27,66
139,CB_2025_Jan_FB_3765_SO-JT_V01_1x1_IMG_EN_New_C-Headline_Evergreen_CTA-NONE_Angle-W_M-NONE_VL-None_G-NONE_P-NONE_S-NONE,3765 - SUGAR DETOX 2 IMG || Enhancements: OFF || CBV1 || Batch Ä… || 1C || 02/02/25w06 || Kostas,SHARE,$148,"9,805",2025-02-02,2025-02-07,5
140,CB_2023_Oct_FB_2516_VK_V13_9x16_VID_EN_Opti_C-Benefits_CTA-AUTUM_Pain-W-B_M-PASQ_VL-30s_TR-None_G-M_P-Plan_S-WHAT,ASC+ || VIDEO Only || US || 0% EXISTING CAP || 1C || 08.12.24  Ad set,VIDEO,$146,"4,717",2024-12-20,2025-02-05,47
141,CB_2025_Jan_FB_3771_VK-DP_V07_9x16_VID_EN_New_C-BulletPoints_Evergreen_CTA-70_Angle-W-B-C_M-GLAD_VL-30s_G-F_P-OG_S-NEW,3771 - New idea spot the lie for CB V1 - DP-VK || Enhancements: OFF || CBV1 || Batch 2 || 1C || 04/02/25w06 || Kostas,VIDEO,$146,"6,377",2025-02-04,2025-02-11,7
142,CB_2024_Nov_FB_3264_LZ_V29_4x5_VID_EN_Opti_C-NegativeMark_Sale_CTA-BF_Angle-W-B_M-LRNS_VL-30s_G-M_P-OG_S-NONE - Copy,ASC+ || VIDEO Only || US || 0% EXISTING CAP || 1C || 08.12.24  Ad set,VIDEO,$141,"4,946",2025-01-30,2025-02-05,6
143,CB_2025_Jan_FB_3731_DT-DP_V03_4x5_IMG_EN_New_C-Headline_Evergreen_CTA-NONE_Angle-W_M-NONE_VL-None_G-NONE_P-OG_S-NONE,3731 - New idea mom belly || Enhancements: OFF || CBV1 || Batch 1 || 1C || 29/01/25w05 || Kostas,SHARE,$135,"6,839",2025-01-29,2025-02-07,9
144,CB_2025_Jan_FB_3711_DT_V02_4x5_VID_EN_Opti_C-Pointing_Sale_CTA-VDAY_Angle-W-B_M-TRC_VL-30s_G-F_P-OG_S-FRIGGA_FB2217V04,3711 - VDAY top ads 2024 opti 3 || Enhancements: OFF || CBV1 || Batch 1 || 1C || 29/01/25w05 || Kostas,SHARE,$135,"5,606",2025-01-29,2025-02-09,11
145,CB_2025_Jan_FB_3781_LZ-DP_V02_9x16_GIF_EN_Opti_C-Headline_Evergreen_CTA-NONE_Angle-W_M-NONE_VL-15s_G-NONE_P-OG_S-NEW_FB3608V03,3781 - Hypnosis GIF opti || Enhancements: OFF || CBV1 || Batch 1 || 1C || 04/02/25w06 || Kostas,SHARE,$131,"5,811",2025-02-04,2025-02-11,7
146,CB_2025_Jan_FB_3769_DT-JT_V01_9x16_VID_EN_Opti_C-BulletPoints_Sale_CTA-70_Angle-W-B-C_M-POW_VL-30s_G-F_P-OG_S-NEW_3666V03,3769 - Opti 3666 || Enhancements: OFF || CBV1 || Batch 1 || 1C || 04/02/25w06 || Kostas,VIDEO,$130,"6,086",2025-02-04,2025-02-11,7
147,CB_2025_Jan_FB_3759_VK_V12_4x5_VID_EN_New_C-BulletPoints_Evergreen_CTA-NONE_Angle-W-B-C_M-NONE_VL-15s_G-M_P-OG_S-NEW,3761 - testis to to video 3722 || Enhancements: OFF || CBV1 || Batch 3 || 1C || 03/02/25w06 || Kostas,SHARE,$129,"7,060",2025-02-04,2025-02-11,7
148,CB_2025_Jan_FB_3759_VK_V03_4x5_VID_EN_New_C-BulletPoints_Evergreen_CTA-NONE_Angle-W-B-C_M-NONE_VL-15s_G-M_P-OG_S-NEW,3761 - testis to to video 3722 || Enhancements: OFF || CBV1 || Batch 1 || 1C || 03/02/25w06 || Kostas,SHARE,$129,"6,161",2025-02-04,2025-02-11,7
149,CB_2025_Jan_FB_3737_DT_V03_4x5_IMG_EN_New_C-BulletPoints_Evergreen_CTA-NONE_Angle-W_M-NONE_VL-None_G-NONE_P-OG_S-NONE_FB3682V03,3737 - Opti 3682 || Enhancements: OFF || CBV1 || Batch 1 || 1C || 29/01/25w05 || Kostas,SHARE,$127,"7,496",2025-01-29,2025-02-05,7
150,CB_2025_Jan_FB_3741_LZ-JG_V02_4x5_IMG_EN_Opti_C-Headline_Evergreen_CTA-NONE_Angle-W_M-NONE_VL-None_G-NONE_P-CBV2_S-NONE_FB3357V01,AU || 3741 - V2 dom perignon 2 || 1C || 29/01/2025w05,SHARE,$126,"7,357",2025-01-30,2025-02-20,21
151,CB_2025_Jan_FB_3759_VK_V04_4x5_VID_EN_New_C-BulletPoints_Evergreen_CTA-NONE_Angle-W-B-C_M-NONE_VL-15s_G-M_P-OG_S-NEW,3761 - testis to to video 3722 || Enhancements: OFF || CBV1 || Batch 1 || 1C || 03/02/25w06 || Kostas,SHARE,$121,"7,019",2025-02-04,2025-02-11,7
152,CB_2025_Jan_FB_3772_DT-DP_V04_4x5_VID_EN_New_C-SplitScreen_Sale_CTA-70_Angle-W_M-NONE_VL-15s_G-NONE_P-OG_S-NEW,3772 - Split-screen ads_VID CB V1 || Enhancements: OFF || CBV1 || Batch 1 || 1C || 04/02/25w06 || Kostas,VIDEO,$121,"4,763",2025-02-04,2025-02-11,7
153,CB_2025_Jan_FB_3716_CHUB_V04_4x5_IMG_EN_Opti_C-NONE_CTA-NONE_Angle-C_M-NONE_VL-None_TR-None_G-M_P-OG_S-NONE,3716 - Valentines day event OPTI || Enhancements: OFF || CBV1 || Batch 2 || 1C || 29/01/25w05 || Kostas,SHARE,$120,"5,193",2025-01-29,2025-02-09,11
154,CB_2025_Jan_FB_3759_VK_V02_4x5_VID_EN_New_C-BulletPoints_Evergreen_CTA-NONE_Angle-W-B-C_M-NONE_VL-15s_G-M_P-OG_S-NEW,3761 - testis to to video 3722 || Enhancements: OFF || CBV1 || Batch 1 || 1C || 03/02/25w06 || Kostas,SHARE,$118,"7,545",2025-02-04,2025-02-11,7
155,CB_2025_Jan_FB_3704_SO_V01_4x5_IMG_EN_New_C-Headline_Evergreen_CTA-NONE_Angle-W-B-C_M-NONE_VL-None_G-NONE_P-NONE_S-NONE,3704 - Notion Idea #89 FOR REAL MEN || Enhancements: OFF || CBV1 || Batch 1 || 1C || 26/01/25w05 || Kostas,SHARE,$116,"3,690",2025-01-26,2025-02-08,13
156,CB_2025_Jan_FB_3742_SO-DP-KB_V03_4x5_IMG_EN_Opti_C-NONE_Evergreen_CTA-SALE_Angle-W_M-NONE_VL-None_G-NONE_P-CBV2_S-NONE3665V01,3742 -  3665_V01 OPTI for PREMIUM 2 || Batch 1 || 1C || 29/01/2025w05,SHARE,$115,"6,628",2025-01-30,2025-02-10,11
157,CB_2025_Jan_FB_3767_VK-DP_V03_9x16_VID_EN_New_C-BulletPoints_Evergreen_CTA-NONE_Angle-W-B-C_M-NONE_VL-15s_G-M_P-OG_S-NEW,3767 - Short video new idea CB V1 - DP || Enhancements: OFF || CBV1 || Batch 1 || 1C || 03/02/25w06 || Kostas,VIDEO,$114,"5,645",2025-02-04,2025-02-11,7
158,CB_2025_Jan_FB_3767_VK-DP_V04_9x16_VID_EN_New_C-BulletPoints_Evergreen_CTA-NONE_Angle-W-B-C_M-NONE_VL-15s_G-M_P-OG_S-NEW,3767 - Short video new idea CB V1 - DP || Enhancements: OFF || CBV1 || Batch 1 || 1C || 03/02/25w06 || Kostas,VIDEO,$112,"5,999",2025-02-04,2025-02-11,7
159,CB_2025_Jan_FB_3735_VK_V04_4x5_VID_EN_New_C-BulletPoints_Sale_CTA-NY_Angle-W-B-C_M-NONE_VL-None_G-NONE_P-OG_S-NONE,3735 - OPTI 3619 -VK || Enhancements: OFF || CBV1 || Batch 1 || 1C || 29/01/25w05 || Kostas,SHARE,$111,"7,740",2025-01-29,2025-02-07,9
160,CB_2023_Jul_FB_2284_DA_V05_9x16_VID_EN_Opti_C-Sale_CTA-SMR_Pain-W_M-JANW_VL-30s_TR-None_G-M_P-None_S-WHAT_FB2103V02 - Copy,ASC+ || VIDEO Only || US || 0% EXISTING CAP || 1C || 08.12.24  Ad set,VIDEO,$106,"4,194",2025-01-30,2025-02-05,6
161,IM_CB1.png,US || VSL || Aff's image + Taboola ad || Batch 1 || Landing: /quiz/pre-1 || 1C || 30/01/25,SHARE,$101,"5,773",2025-01-30,2025-02-04,5
162,CB_2025_Jan_FB_3750_LZ-VU_V01_4x5_IMG_EN_Opti_C-NegativeMark_Evergreen_CTA-NONE_Angle-W_M-NONE_VL-None_G-NONE_P-NONE_S-NONE_FB3251V01,3750 - bioma ripoff march soft version || Enhancements: OFF || CBV1 || Batch 1 || 1C || 24/01/25w04 || Kostas,SHARE,$100,"2,998",2025-01-24,2025-02-17,24
163,CB_2025_Jan_FB_3767_VK-DP_V07_9x16_VID_EN_New_C-BulletPoints_Evergreen_CTA-NONE_Angle-W-B-C_M-TRC_VL-15s_G-M_P-OG_S-NEW,3767 - Short video new idea CB V1 - DP || Enhancements: OFF || CBV1 || Batch 2 || 1C || 03/02/25w06 || Kostas,VIDEO,$100,"4,998",2025-02-04,2025-02-13,9
164,CB_2022_Nov_FB_1218_RS_V15_9x16_IMG_EN_Opti_C-Sale_CTA-BLACK_Pain-W_M-NONE_VL-None FB1671V08,US || Manual Bid || BFCM || ROAS GOAL: 1.4 || 1C || 15/11/24,SHARE,$98,"2,673",2024-11-15,2025-02-27,104
165,CB_2025_Jan_FB_3746_CHUB-AA_V08_4x5_IMG_EN_Opti_C-NONE_CTA-NONE_Angle-C_M-NONE_VL-None_TR-None_G-NONE_P-NONE_S-NONE,3746 â€“ 3660 G-nugget OPTI v3 || Enhancements: OFF || CBV1 || Batch 2 || 1C || 30/01/25w05 || Kostas,SHARE,$95,"5,133",2025-01-30,2025-02-14,15
166,CB_2025_Jan_FB_3771_VK-DP_V03_9x16_VID_EN_New_C-BulletPoints_Evergreen_CTA-NONE_Angle-W-B-C_M-MAG_VL-15s_G-M_P-OG_S-NEW,3771 - New idea spot the lie for CB V1 - DP-VK || Enhancements: OFF || CBV1 || Batch 1 || 1C || 04/02/25w06 || Kostas,VIDEO,$93,"5,252",2025-02-04,2025-02-11,7
167,CB_2025_Feb_FB_3782_CHUB_V01_9x16_VID_EN_New_C-NONE_CTA-NONE_Angle-None_M-NONE_VL-None_TR-None_G-NONE_P-NONE_S-NONE,3782 - Political weight loss journey CHUB || Enhancements: OFF || CBV1 || Batch 1 || 1C || 06/02/25w06 || Kostas,VIDEO,$92,"6,567",2025-02-06,2025-02-07,1
168,CB_2025_Jan_FB_3765_SO-JT_V04_1x1_IMG_EN_New_C-Headline_Evergreen_CTA-NONE_Angle-W_M-NONE_VL-None_G-NONE_P-NONE_S-NONE,3765 - SUGAR DETOX 2 IMG || Enhancements: OFF || CBV1 || Batch Ä… || 1C || 02/02/25w06 || Kostas,SHARE,$90,"4,498",2025-02-02,2025-02-07,5
169,CB_2025_Jan_FB_3737_DT_V01_4x5_IMG_EN_New_C-BulletPoints_Evergreen_CTA-NONE_Angle-W_M-NONE_VL-None_G-NONE_P-OG_S-NONE_FB3682V03,3737 - Opti 3682 || Enhancements: OFF || CBV1 || Batch 1 || 1C || 29/01/25w05 || Kostas,SHARE,$89,"5,325",2025-01-29,2025-02-05,7
170,CB_2025_Jan_FB_3687_DT_V03_4x5_VID_EN_Opti_C-MakingOf_Sale_CTA-VDAY_Angle-W-B-C_M-POW_VL-45s_G-M_P-OG_S-Moon_FB3090V02,3687 - Valentine_s Day Opti 3090 || Enhancements: OFF || CBV1 || Batch Ä… || 1C || 02/02/25w06 || Kostas,SHARE,$89,"5,288",2025-02-02,2025-02-19,17
171,CB_2025_Jan_FB_3072_V02_4x5_IMG_EN_New_C-Headline_Seasonal_CTA-None_Angle-W_M-NONE_VL-None_G-NONE_P-OG_S-NONE,CBV2 || EU (UK) || ðŸ’° Advantage+ || US || BROAD || 7C || Existing_customer_5% || 15/12/24 Ad set,SHARE,$87,"4,122",2025-01-17,2025-03-14,56
172,CB_2025_Jan_FB_3736_LZ-VU_V01_4x5_IMG_EN_Opti_C-NegativeMark_Evergreen_CTA-NONE_Angle-Cort_M-NONE_VL-None_G-NONE_P-NONE_S-NONE_FB3251V01,CBV2 || EU (UK) || ðŸ’° Advantage+ || US || BROAD || 7C || Existing_customer_5% || 15/12/24 Ad set,SHARE,$84,"3,668",2025-01-22,2025-02-04,13
173,CB_2024_Dec_FB_3608_LZ-DP_V03_4x5_IMG_EN_New_C-Headline_Evergreen_CTA-NONE_Angle-W_M-NONE_VL-None_G-NONE_P-OG_S-NONE,3608 - CB_IMG_ notion #17 hypnosis || Enhancements: OFF || CBV1 || Batch 1 || 1C || 13/01/25w03 || Kostas,SHARE,$83,"3,832",2025-01-13,2025-02-03,21
174,CB_2023_Jul_FB_2217_IB_V04_9x16_VID_EN_Opti_C-Pointing_CTA-SMR_Pain-W-B_M-TRC_VL-30s_TR-None_G-F_P-None_S-FRIGGA,US || Manual Bid: ROAS GOAL: 1.1 -> 1.2 || 7DC || 28/01/2025,VIDEO,$82,"2,461",2025-01-28,2025-02-11,14
175,CB_2025_Jan_FB_3791_CHUB_V01_9x16_VID_EN_New_C-NONE_CTA-NONE_Angle-W_M-NONE_VL-None_TR-None_G-NONE_P-NONE_S-NONE,3791 - TrumpTweets CHUB || Enhancements: OFF || CBV1 || Batch 1 || 1C || 06/02/25w06 || Kostas,VIDEO,$80,"5,214",2025-02-06,2025-02-07,1
176,CB_2025_Jan_FB_3724_CHUB-AA_V04_4x5_IMG_EN_New_C-NONE_CTA-NONE_Angle-C_M-NONE_VL-None_TR-None_G-M_P-none_S-NONE,3724 Get Regular CHUB || Enhancements: OFF || CBV1 || Batch 1 || 1C || 29/01/25w05 || Kostas,SHARE,$79,"4,967",2025-01-29,2025-02-13,15
177,CB_2025_Jan_FB_3767_VK-DP_V06_9x16_VID_EN_New_C-BulletPoints_Evergreen_CTA-NONE_Angle-W-B-C_M-TRC_VL-15s_G-M_P-OG_S-NEW,3767 - Short video new idea CB V1 - DP || Enhancements: OFF || CBV1 || Batch 2 || 1C || 03/02/25w06 || Kostas,VIDEO,$77,"4,576",2025-02-04,2025-02-13,9
178,CB_2025_Jan_FB_3723_SO_V10_4x5_IMG_EN_New_C-NONE_Evergreen_CTA-SALE_Angle-W_M-NONE_VL-None_G-NONE_P-NONE_S-NONE,3723 - Notion Idea #92 MAN BOOBS || Enhancements: OFF || CBV1 || Batch 2 || 1C || 28/01/25w05 || Kostas,SHARE,$77,"5,785",2025-01-28,2025-02-18,21
179,CB_2024_Jan_FB_2717_MB-RP_V26_9x16_VID_EN_New_C-Buzz_CTA-SALE_Pain-W-B-C_M-MIX_VL-45s_TR-None_G-MF_P-Method_S-NONE,CA || COST CAP 92->93 || 7C || 10/05/24 || V1,VIDEO,$77,"4,113",2024-08-22,2025-02-27,189
180,CB_2025_Jan_FB_3759_VK_V08_4x5_VID_EN_New_C-BulletPoints_Evergreen_CTA-NONE_Angle-W-B-C_M-NONE_VL-15s_G-M_P-OG_S-NEW,3761 - testis to to video 3722 || Enhancements: OFF || CBV1 || Batch 2 || 1C || 03/02/25w06 || Kostas,SHARE,$76,"3,991",2025-02-04,2025-02-11,7
181,CB_2025_Jan_FB_3771_VK-DP_V02_9x16_VID_EN_New_C-BulletPoints_Evergreen_CTA-NONE_Angle-W-B-C_M-MAG_VL-15s_G-M_P-OG_S-NEW,3771 - New idea spot the lie for CB V1 - DP-VK || Enhancements: OFF || CBV1 || Batch 1 || 1C || 04/02/25w06 || Kostas,VIDEO,$73,"3,668",2025-02-04,2025-02-11,7
182,CB_2025_Jan_FB_3726_LZ-JG_V01_4x5_IMG_EN_Opti_C-Headline_Evergreen_CTA-NONE_Angle-W_M-NONE_VL-None_G-NONE_P-OG_S-NONE_FB3357V01,3726 - domperignon opti || Enhancements: OFF || CBV1 || Batch 1 || 7C || 22/01/25w04,SHARE,$69,"2,605",2025-01-22,2025-02-03,12
183,CB_2025_Jan_FB_3746_CHUB-AA_V05_4x5_IMG_EN_Opti_C-NONE_CTA-NONE_Angle-C_M-NONE_VL-None_TR-None_G-NONE_P-NONE_S-NONE,3746 â€“ 3660 G-nugget OPTI v3 || Enhancements: OFF || CBV1 || Batch 2 || 1C || 30/01/25w05 || Kostas,SHARE,$68,"3,932",2025-01-30,2025-02-14,15
184,CB_2025_Jan_FB_3742_SO-DP-KB_V02_4x5_IMG_EN_Opti_C-NONE_Evergreen_CTA-SALE_Angle-W_M-NONE_VL-None_G-NONE_P-CBV2_S-NONE3665V01,3742 -  3665_V01 OPTI for PREMIUM 2 || Batch 1 || 1C || 29/01/2025w05,SHARE,$66,"3,760",2025-01-30,2025-02-10,11
185,CB_2025_Jan_FB_3781_LZ-DP_V01_9x16_GIF_EN_Opti_C-Headline_Evergreen_CTA-NONE_Angle-W_M-NONE_VL-15s_G-NONE_P-OG_S-NEW_FB3608V03,3781 - Hypnosis GIF opti || Enhancements: OFF || CBV1 || Batch 1 || 1C || 04/02/25w06 || Kostas,SHARE,$66,"2,763",2025-02-04,2025-02-11,7
186,CB_2025_Jan_FB_3776_DT-DP_V02_9x16_VID_EN_New_C-SplitScreen_Sale_CTA-70_Angle-W_M-NONE_VL-15s_G-NONE_P-OG_S-NEW,3776 - New Idea - post pregnancy weight loss || Enhancements: OFF || CBV1 || Batch 1 || 1C || 04/02/25w06 || Kostas,VIDEO,$64,"3,662",2025-02-04,2025-02-11,7
187,CB_2025_Jan_FB_3716_CHUB_V03_4x5_IMG_EN_Opti_C-NONE_CTA-NONE_Angle-C_M-NONE_VL-None_TR-None_G-M_P-OG_S-NONE,3716 - Valentines day event OPTI || Enhancements: OFF || CBV1 || Batch 2 || 1C || 29/01/25w05 || Kostas,SHARE,$61,"2,749",2025-01-29,2025-02-09,11
188,Taboola - ColonB 3.webp,US || VSL || Aff's image + Taboola ad || Batch 1 || Landing: new5/pre-1 || 1C || 28/01/25,SHARE,$61,"1,993",2025-01-28,2025-02-05,8
189,CB_2022_Mar3_FB_713_IK_V04_1x1_IMG_EN_Opti_C-WrittenTesti_HE-98_A-ExtremeBodyVisualization_HK-bodypart_Pain-W_CLR-PURPLE_BG-IMAGE_ME-MIX_MA-YOUNG,US || Manual Bid || BFCM || COST CAP 91 || 1C || 15/11/24,SHARE,$59,"3,469",2024-11-15,2025-02-27,104
190,CB_2025_Feb_FB_3780_DT-DP_V04_9x16_VID_EN_Opti_C-MakingOf_Sale_CTA-70_Angle-W-B_M-CRAZY_VL-45s_G-M_P-OG_S-NEW_FB3264V31,3780 - Crazy Trainer Hookerization || Enhancements: OFF || CBV1 || Batch 1 || 1C || 09/02/25w07 || Kostas,SHARE,$59,"3,290",2025-02-09,2025-02-15,6
191,CB_2023_May_FB_2103_MB_V02_9x16_VID_EN_Opti_C-Sale_CTA-SMR_Pain-W_M-JOG_VL-30s_TR-None_G-M-F_P-None_S-What,US || Manual Bid || BFCM || COST CAP 91 || 1C || 15/11/24,VIDEO,$58,"1,877",2024-11-15,2025-02-27,104
192,CB_2025_Jan_FB_3778_DT-DP_V03_9x16_VID_EN_Opti_C-Benefits_Sale_CTA-70_Angle-W-B_M-MAN_VL-45s_G-M_P-OG_S-WHAT_FB3097V03,3778 - Opti 3097 || Enhancements: OFF || CBV1 || Batch 1 || 1C || 04/02/25w06 || Kostas,SHARE,$58,"3,232",2025-02-04,2025-02-11,7
193,CB_2024_Nov_FB_3264_LZ_V31_4x5_VID_EN_Opti_C-MakingOf_Sale_CTA-BF_Angle-W-B_M-CRAZY_VL-45s_G-M_P-OG_S-NEW_FB3004V02,CBV2 || AU || ðŸ’° Advantage+ || US || BROAD || 7C || Existing_customer_5% || 19/12/24 Ad set,VIDEO,$58,"1,989",2024-12-19,2025-03-27,98
194,CB_2025_Jan_FB_3709_VK-JT_V01_4x5_IMG_EN_New_C-BulletPoints_Sale_CTA-NY_Angle-W-B-C_M-NONE_VL-None_G-M_P-OG_S-NONE,3709 -Notion Sigma male #109 VK-JT || Enhancements: OFF || CBV1 || Batch 1 || 1C || 29/01/25w05 || Kostas,SHARE,$57,"3,335",2025-01-29,2025-02-05,7
195,CB_2025_Feb_FB_3782_CHUB_V02_9x16_VID_EN_New_C-NONE_CTA-NONE_Angle-None_M-NONE_VL-None_TR-None_G-NONE_P-NONE_S-NONE,3782 - Political weight loss journey CHUB || Enhancements: OFF || CBV1 || Batch 1 || 1C || 06/02/25w06 || Kostas,VIDEO,$57,"3,234",2025-02-06,2025-02-07,1
196,CB_2025_Jan_FB_3705_VK_V04_4x5_IMG_EN_New_C-BulletPoints_Sale_CTA-NY_Angle-W-B-C_M-NONE_VL-None_G-NONE_P-OG_S-NONE,3705 - #87 Struggling with Dad Bod_ - VK || Enhancements: OFF || CBV1 || Batch 1 || 1C || 22/01/25w04 || Kostas,SHARE,$55,"2,957",2025-01-22,2025-02-03,12
197,CB_2025_Jan_FB_3723_SO_V17_4x5_IMG_EN_New_C-NONE_Evergreen_CTA-SALE_Angle-W_M-NONE_VL-None_G-NONE_P-NONE_S-NONE,3723 - Notion Idea #92 MAN BOOBS || Enhancements: OFF || CBV1 || Batch 4 || 1C || 28/01/25w05 || Kostas,SHARE,$53,"3,109",2025-01-28,2025-03-07,38
198,CB_2025_Jan_FB_3742_SO-DP-KB_V01_4x5_IMG_EN_Opti_C-NONE_Evergreen_CTA-SALE_Angle-W_M-NONE_VL-None_G-NONE_P-CBV2_S-NONE3665V01,CBV2 || EU (UK) || ðŸ’° Advantage+ || US || BROAD || 7C || Existing_customer_5% || 15/12/24 Ad set,SHARE,$52,"3,094",2025-02-04,2025-03-27,51
199,CB_2025_Jan_FB_3781_LZ-DP_V03_9x16_GIF_EN_Opti_C-Headline_Evergreen_CTA-NONE_Angle-W_M-NONE_VL-15s_G-NONE_P-OG_S-NEW_FB3608V03,3781 - Hypnosis GIF opti || Enhancements: OFF || CBV1 || Batch 1 || 1C || 04/02/25w06 || Kostas,SHARE,$50,"2,317",2025-02-04,2025-02-11,7
200,CB_2025_Jan_FB_3759_VK_V09_4x5_VID_EN_New_C-BulletPoints_Evergreen_CTA-NONE_Angle-W-B-C_M-NONE_VL-15s_G-M_P-OG_S-NEW,3761 - testis to to video 3722 || Enhancements: OFF || CBV1 || Batch 3 || 1C || 03/02/25w06 || Kostas,SHARE,$49,"2,298",2025-02-04,2025-02-11,7
201,CB_2025_Jan_FB_3766_SO_V02_4x5_IMG_EN_Opti_C-Headline_Evergreen_CTA-NONE_Angle-W-B-C_M-NONE_VL-None_G-NONE_P-NONE_S-NONE_3700V08,3766 - 3700 copy opti || Enhancements: OFF || CBV1 || Batch 1 || 1C || 03/02/25w06 || Kostas,SHARE,$42,"2,538",2025-02-04,2025-02-22,18
202,CB_2025_Jan_FB_3771_VK-DP_V05_9x16_VID_EN_New_C-BulletPoints_Evergreen_CTA-70_Angle-W-B-C_M-GLAD_VL-30s_G-F_P-OG_S-NEW,3771 - New idea spot the lie for CB V1 - DP-VK || Enhancements: OFF || CBV1 || Batch 2 || 1C || 04/02/25w06 || Kostas,VIDEO,$41,"1,959",2025-02-04,2025-02-11,7
203,CB_2024_Dec_FB_3601_VK-DP_V09_4x5_VID_EN_Opti_C-Dance_CTA-NY_Pain-W-B_M-JOG_VL-30s_TR-None_G-F_P-OG_S-WHAT_FB3045V01 - Copy,ðŸ’°WC || US || Advantage+ || BIG BUDGET || CC101->105->109->112->114-116->117 || BROAD || ABO || 1C || 17/01/24 RELAUNCHED Ad set,VIDEO,$38,"1,151",2024-12-27,2025-02-06,41
204,IM_CB1.png,US || VSL || Aff's image + Taboola ad || Batch 1 || Landing: new6/pre-1 || 1C || 28/01/25,SHARE,$38,"1,958",2025-01-28,2025-02-03,6
205,CB_2025_Jan_FB_3791_CHUB_V02_9x16_VID_EN_New_C-NONE_CTA-NONE_Angle-W_M-NONE_VL-None_TR-None_G-NONE_P-NONE_S-NONE,3791 - TrumpTweets CHUB || Enhancements: OFF || CBV1 || Batch 1 || 1C || 06/02/25w06 || Kostas,VIDEO,$37,"2,546",2025-02-06,2025-02-07,1
206,CB_2024_Mar_FB_2888_JG_V02_9x16_IMG_EN_Opti_C-Benefits_CTA-NONE_Pain-W_M-NONE_VL-None_TR-None_G-NONE_P-V2_S-NONE,CBV2 || AU || ðŸ’° Advantage+ || US || BROAD || 7C || Existing_customer_5% || 19/12/24 Ad set,SHARE,$37,"2,487",2024-12-19,2025-03-27,98
207,Taboola - ColonB 3.webp,US || VSL || Aff's image + Taboola ad || Batch 1 || Landing: /quiz/pre-1 || 1C || 30/01/25,SHARE,$37,"1,403",2025-01-30,2025-02-04,5
208,CB_2025_Jan_FB_3770_CHUB_V02_9x16_VID_EN_New_C-NONE_CTA-NONE_Angle-None_M-NONE_VL-None_TR-None_G-NONE_P-NONE_S-NONE,3770 - HM4Things CHUB || Enhancements: OFF || CBV1 || Batch 1 || 1C || 09/02/25w07 || Kostas,VIDEO,$36,"2,280",2025-02-09,2025-02-14,5
209,CB_2024_Feb_FB_2834_DA_V02_4x5_IMG_EN_Opti_C-SingleTesti_CTA-NONE_Pain-W_M-NONE_VL-None_TR-None_G-NONE_P-V2_S-NONE_FB2759V04,CBV2 || AU || ðŸ’° Advantage+ || US || BROAD || 7C || Existing_customer_5% || 19/12/24 Ad set,SHARE,$35,"1,313",2024-12-19,2025-03-27,98
210,CB_2025_Jan_FB_3725_CHUB_V01_9x16_VID_EN_New_C-NONE_CTA-NONE_Angle-C_M-NONE_VL-30s_TR-None_G-M_P-OG_S-NONE,3725 - Drawing video || Enhancements: OFF || CBV1 || Batch 1 || 1C || 29/01/25w05 || Kostas,VIDEO,$34,"1,158",2025-01-29,2025-02-03,5
211,CB_2025_Jan_FB_3732_SO-JT_V04_4x5_IMG_EN_New_C-Headline_Evergreen_CTA-NONE_Angle-Detox_M-NONE_VL-None_G-NONE_P-NONE_S-NONE,3732 - CB - Cortisol detox || Enhancements: OFF || CBV1 || Batch 1 || 1C || 29/01/25w05 || Kostas,SHARE,$34,"1,511",2025-01-29,2025-02-03,5
212,CB_2025_Jan_FB_3731_DT-DP_V01_4x5_IMG_EN_New_C-Headline_Evergreen_CTA-NONE_Angle-W_M-NONE_VL-None_G-NONE_P-OG_S-NONE,3731 - New idea mom belly || Enhancements: OFF || CBV1 || Batch 1 || 1C || 29/01/25w05 || Kostas,SHARE,$34,"2,029",2025-01-29,2025-02-07,9
213,CB_2025_Jan_FB_3740_SO-DP_V04_4x5_IMG_EN_Opti_C-Headline_Evergreen_CTA-NONE_Angle-W_M-NONE_VL-None_G-NONE_P-OG_S-NONE_3608V03,3740 - 3608_v03 OPTI || Enhancements: OFF || CBV1 || Batch 1 || 1C || 29/01/25w05 || Kostas,SHARE,$32,"3,178",2025-01-29,2025-02-11,13
214,CB_2025_Jan_FB_3786_LZ_V01_1x1_IMG_EN_New_C-Educational_Evergreen_CTA-SALE_Angle-GH_M-NONE_VL-None_G-NONE_P-OG_S-NONE,3786 - #92 Notion idea gamers' diet || Enhancements: OFF || CBV1 || Batch 1 || 7C || 09/02/25w07 || Kostas,SHARE,$32,"1,498",2025-02-09,2025-02-17,8
215,CB_2025_Feb_FB_3784_SO-RP_V08_4x5_IMG_EN_Opti_C-Headline_Evergreen_CTA-NONE_Angle-W_M-NONE_VL-None_G-NONE_P-OG_S-NONE_FB3726V01,3784 - 3726 ad copy opti || Enhancements: OFF || CBV1 || Batch 2 || 1C || 09/02/25w07 || Kostas,SHARE,$31,"1,964",2025-02-09,2025-02-12,3
216,CB_2025_Jan_FB_3779_VK-DP_V04_1x1_VID_EN_Opti_C-BulletPoints_Evergreen_CTA-70_Angle-W-B-C_M-NONE_VL-None_G-F_P-OG_S-NEW_FB3705V02,3779 - opti 3705 || Enhancements: OFF || CBV1 || Batch 1 || 1C || 04/02/25w06 || Kostas,SHARE,$31,"1,577",2025-02-04,2025-03-20,44
217,CB_2024_Dec_FB_3601_VK-DP_V09_4x5_VID_EN_Opti_C-Dance_CTA-NY_Pain-W-B_M-JOG_VL-30s_TR-None_G-F_P-OG_S-WHAT_FB3045V01,ASC+ || VIDEO Only || US || 0% EXISTING CAP || 1C || 08.12.24  Ad set,VIDEO,$30,590,2024-12-25,2025-02-05,42
218,CB_2023_May_FB_2103_MB_V02_9x16_VID_EN_Opti_C-Sale_CTA-SMR_Pain-W_M-JOG_VL-30s_TR-None_G-M-F_P-None_S-What,US || Manual Bid || BFCM || ROAS GOAL: 1.4 || 1C || 15/11/24,VIDEO,$30,644,2024-11-15,2025-02-27,104
219,CB_2024_Feb_FB_2814_MB-DP_V05_1x1_IMG_EN_New_C-WeightLoss_CTA-None_Pain-W-B-C_M-NONE_VL-None_TR-None_G-NONE_P-V2_S-NONE,CBV2 || EU (UK) || ðŸ’° Advantage+ || US || BROAD || 7C || Existing_customer_5% || 15/12/24 Ad set,SHARE,$30,"1,064",2025-01-31,2025-03-27,55
220,CB_2025_Jan_FB_3709_VK-JT_V02_4x5_IMG_EN_New_C-BulletPoints_Sale_CTA-NY_Angle-W-B-C_M-NONE_VL-None_G-M_P-OG_S-NONE,3709 -Notion Sigma male #109 VK-JT || Enhancements: OFF || CBV1 || Batch 1 || 1C || 29/01/25w05 || Kostas,SHARE,$29,"1,744",2025-01-29,2025-02-05,7
221,CB_2025_Jan_FB_3687_DT_V01_4x5_VID_EN_Opti_C-MakingOf_Sale_CTA-VDAY_Angle-W-B-C_M-POW_VL-45s_G-M_P-OG_S-Moon_FB3090V02,3687 - Valentine_s Day Opti 3090 || Enhancements: OFF || CBV1 || Batch Ä… || 1C || 02/02/25w06 || Kostas,SHARE,$29,"1,457",2025-02-02,2025-02-19,17
222,CB_2025_Jan_FB_3766_SO_V04_4x5_IMG_EN_Opti_C-Headline_Evergreen_CTA-NONE_Angle-W-B-C_M-NONE_VL-None_G-NONE_P-NONE_S-NONE_3700V08,3766 - 3700 copy opti || Enhancements: OFF || CBV1 || Batch 1 || 1C || 03/02/25w06 || Kostas,SHARE,$28,"2,016",2025-02-04,2025-02-22,18
223,CB_2023_Nov_FB_2648_DT_V01_1x1_GIF_EN_Opti_C-Sale_CTA-XMAS_None_M-NONE_VL-None_TR-None_G-NONE_P-OG_S-NONE,ðŸ’°WC || US || Advantage+ || BIG BUDGET || CC101->105->109->112->114-116->117 || BROAD || ABO || 1C || 17/01/24 RELAUNCHED Ad set,VIDEO,$28,532,2024-01-17,2025-02-06,386
224,CB_2024_Nov_FB_3305_SO-DP_V02_4x5_VID_EN_Opti_C-Sale_CTA-BF_Pain-W_M-Chris_VL-30s_TR-None_G-MF_P-Plan_S-NEW_FB2601V07,CBV2 || AU || ðŸ’° Advantage+ || US || BROAD || 7C || Existing_customer_5% || 19/12/24 Ad set,VIDEO,$28,961,2024-12-19,2025-03-27,98
225,CB_2025_Feb_FB_3784_SO-RP_V05_4x5_IMG_EN_Opti_C-Headline_Evergreen_CTA-NONE_Angle-W_M-NONE_VL-None_G-NONE_P-OG_S-NONE_FB3726V01,3784 - 3726 ad copy opti || Enhancements: OFF || CBV1 || Batch 1 || 1C || 09/02/25w07 || Kostas,SHARE,$27,"1,515",2025-02-09,2025-02-17,8
226,CB_2024_Oct_FB_3182_ZS-GC_V13_1x1_IMG_EN_New_C-UsVsThem_Evergreen_CTA-NONE_Angle-B-C_M-NONE_VL-None_G-NONE_P-OG_S-NONE,CBV2 || AU || ðŸ’° Advantage+ || US || BROAD || 7C || Existing_customer_5% || 19/12/24 Ad set,SHARE,$26,"1,278",2024-12-19,2025-03-27,98
227,CB_2025_Jan_FB_3737_DT_V02_4x5_IMG_EN_New_C-BulletPoints_Evergreen_CTA-NONE_Angle-W_M-NONE_VL-None_G-NONE_P-OG_S-NONE_FB3682V03,3737 - Opti 3682 || Enhancements: OFF || CBV1 || Batch 1 || 1C || 29/01/25w05 || Kostas,SHARE,$26,"1,956",2025-01-29,2025-02-05,7
228,CB_2025_Jan_FB_3717_CHUB_V04_4x5_IMG_EN_New_C-NONE_CTA-NONE_Angle-C_M-NONE_VL-None_TR-None_G-M_P-OG_S-NONE,3717 - Lunar New Year sale || Enhancements: OFF || CBV1 || Batch 1 || 1C || 29/01/25w05 || Kostas,SHARE,$25,"1,147",2025-01-29,2025-02-03,5
229,CB_2025_FEB_FB_3666_VK-JT_V03_4x5_VID_EN_NEW_C-BulletPoints_Sale_CTA-NY_Angle-W-B-C_M-TRC_VL-30s_G-F_P-OG_S-NEW,ðŸŒ¶ï¸ || US || ASC+ || ->CC141 || VIDEO Only || US+CA || 0% EXISTING CAP || 7C || 07/08.24  Ad set,VIDEO,$24,"1,120",2025-01-20,2025-03-19,58
230,CB_2025_Jan_FB_3781_LZ-DP_V05_9x16_GIF_EN_Opti_C-Headline_Evergreen_CTA-NONE_Angle-W_M-NONE_VL-15s_G-NONE_P-OG_S-NEW_FB3608V03,3781 - Hypnosis GIF opti || Enhancements: OFF || CBV1 || Batch 2 || 1C || 04/02/25w06 || Kostas,SHARE,$24,892,2025-02-04,2025-02-08,4
231,CB_2025_Feb_FB_3792_SO-RP_V03_1x1_IMG_EN_Opti_C-NegativeMark_Sale_CTA-Vday_Angle-Cort_M-NONE_VL-None_G-NONE_P-NONE_S-NONE_FB3251V02,3792 - 3072 Valentines opti IMG || Enhancements: OFF || CBV1 || Batch 1 || 1C || 09/02/25w07 || Kostas,SHARE,$24,914,2025-02-09,2025-02-16,7
232,CB_2024_Feb_FB_2834_DA_V04_4x5_IMG_EN_Opti_C-SingleTesti_CTA-NONE_Pain-W_M-NONE_VL-None_TR-None_G-NONE_P-V2_S-NONE_FB2759V04,CBV2 || AU || ðŸ’° Advantage+ || US || BROAD || 7C || Existing_customer_5% || 19/12/24 Ad set,SHARE,$23,980,2024-12-19,2025-03-27,98
233,CB_2025_Jan_FB_3723_SO_V19_4x5_IMG_EN_New_C-NONE_Evergreen_CTA-SALE_Angle-W_M-NONE_VL-None_G-NONE_P-NONE_S-NONE,3723 - Notion Idea #92 MAN BOOBS || Enhancements: OFF || CBV1 || Batch 4 || 1C || 28/01/25w05 || Kostas,SHARE,$23,"1,622",2025-01-28,2025-03-11,42
234,CB_2024_Mar_FB_2888_JG_V01_9x16_IMG_EN_Opti_C-Benefits_CTA-NONE_Pain-W_M-NONE_VL-None_TR-None_G-NONE_P-V2_S-NONE,CBV2 || AU || ðŸ’° Advantage+ || US || BROAD || 7C || Existing_customer_5% || 19/12/24 Ad set,SHARE,$23,917,2024-12-19,2025-03-27,98
235,CB_2025_Feb_FB_3792_SO-RP_V06_1x1_IMG_EN_Opti_C-NegativeMark_Sale_CTA-Vday_Angle-Cort_M-NONE_VL-None_G-NONE_P-NONE_S-NONE_FB3251V02,3792 - 3072 Valentines opti IMG || Enhancements: OFF || CBV1 || Batch 2 || 1C || 09/02/25w07 || Kostas,SHARE,$23,769,2025-02-09,2025-02-17,8
236,CB_2025_Jan_FB_3773_CHUB_V01_9x16_VID_EN_New_C-NONE_CTA-NONE_Angle-None_M-NONE_VL-None_TR-None_G-NONE_P-NONE_S-NONE,3773 - MessageVideos || Enhancements: OFF || CBV1 || Batch 1 || 1C || 09/02/25w07 || Kostas,SHARE,$21,964,2025-02-09,2025-02-14,5
237,CB_2025_Jan_FB_3781_LZ-DP_V08_9x16_GIF_EN_Opti_C-NegativeMark_Evergreen_CTA-SALE_Angle-W_M-NONE_VL-15s_G-NONE_P-OG_S-NEW_FB3608V03,3781 - Hypnosis GIF opti || Enhancements: OFF || CBV1 || Batch 2 || 1C || 04/02/25w06 || Kostas,SHARE,$21,"1,034",2025-02-04,2025-02-08,4
238,CB_2025_Jan_FB_3724_CHUB-AA_V01_4x5_IMG_EN_New_C-NONE_CTA-NONE_Angle-C_M-NONE_VL-None_TR-None_G-M_P-OG_S-NONE,3724 Get Regular CHUB || Enhancements: OFF || CBV1 || Batch 1 || 1C || 29/01/25w05 || Kostas,SHARE,$21,"1,513",2025-01-29,2025-02-13,15
239,CB_2024_Oct_FB_3251_LZ-VU_V01_1x1_IMG_EN_New_C-NegativeMark_Evergreen_CTA-NONE_Angle-Cort_M-NONE_VL-None_G-NONE_P-NONE_S-NONE.png,US || Manual Bid || BFCM || ROAS GOAL: 1.4 || 1C || 15/11/24,SHARE,$21,677,2024-11-15,2025-02-27,104
240,CB_2025_Jan_FB_3772_DT-DP_V02_4x5_VID_EN_New_C-SplitScreen_Sale_CTA-70_Angle-W_M-NONE_VL-15s_G-NONE_P-OG_S-NEW,3772 - Split-screen ads_VID CB V1 || Enhancements: OFF || CBV1 || Batch 1 || 1C || 04/02/25w06 || Kostas,VIDEO,$20,730,2025-02-04,2025-02-11,7
241,CB_2025_Jan_FB_3723_SO_V09_4x5_IMG_EN_New_C-NONE_Evergreen_CTA-SALE_Angle-W_M-NONE_VL-None_G-NONE_P-NONE_S-NONE,3723 - Notion Idea #92 MAN BOOBS || Enhancements: OFF || CBV1 || Batch 2 || 1C || 28/01/25w05 || Kostas,SHARE,$19,"1,900",2025-01-28,2025-02-18,21
242,CB_2025_Jan_FB_3769_DT-JT_V01_9x16_VID_EN_Opti_C-BulletPoints_Sale_CTA-70_Angle-W-B-C_M-POW_VL-30s_G-F_P-OG_S-NEW_3666V03,3769 - Opti 3666 || Enhancements: OFF || CBV1 || Batch 1 || 1C || 04/02/25w06 || Kostas,VIDEO,$19,853,2025-02-04,2025-02-10,6
243,CB_2025_Jan_FB_3770_CHUB_V01_9x16_VID_EN_New_C-NONE_CTA-NONE_Angle-None_M-NONE_VL-None_TR-None_G-NONE_P-NONE_S-NONE,3770 - HM4Things CHUB || Enhancements: OFF || CBV1 || Batch 1 || 1C || 09/02/25w07 || Kostas,VIDEO,$19,890,2025-02-09,2025-02-14,5
244,CB_2025_Jan_FB_3766_SO_V03_4x5_IMG_EN_Opti_C-Headline_Evergreen_CTA-NONE_Angle-W-B-C_M-NONE_VL-None_G-NONE_P-NONE_S-NONE_3700V08,3766 - 3700 copy opti || Enhancements: OFF || CBV1 || Batch 1 || 1C || 03/02/25w06 || Kostas,SHARE,$19,"1,452",2025-02-04,2025-02-22,18
245,CB_2025_Jan_FB_3726_LZ-JG_V04_4x5_IMG_EN_Opti_C-Headline_Evergreen_CTA-NONE_Angle-W_M-NONE_VL-None_G-NONE_P-OG_S-NONE_FB3357V01,3726 - domperignon opti || Enhancements: OFF || CBV1 || Batch 1 || 7C || 22/01/25w04,SHARE,$19,679,2025-01-22,2025-02-03,12
246,CB_2025_Jan_FB_3786_LZ_V02_1x1_IMG_EN_New_C-Educational_Evergreen_CTA-SALE_Angle-GH_M-NONE_VL-None_G-NONE_P-OG_S-NONE,3786 - #92 Notion idea gamers' diet || Enhancements: OFF || CBV1 || Batch 1 || 7C || 09/02/25w07 || Kostas,SHARE,$19,922,2025-02-09,2025-02-17,8
247,CB_2025_Jan_FB_3759_VK_V06_4x5_VID_EN_New_C-BulletPoints_Evergreen_CTA-NONE_Angle-W-B-C_M-NONE_VL-15s_G-M_P-OG_S-NEW,3761 - testis to to video 3722 || Enhancements: OFF || CBV1 || Batch 2 || 1C || 03/02/25w06 || Kostas,SHARE,$18,826,2025-02-04,2025-02-10,6
248,CB_2025_Jan_FB_3711_DT_V01_4x5_VID_EN_Opti_C-Sale_Sale_CTA-VDAY_Angle-W_M-JOG_VL-45s_G-M-F_P-OG_S-Moon_FB2263V04,3711 - VDAY top ads 2024 opti 3 || Enhancements: OFF || CBV1 || Batch 1 || 1C || 29/01/25w05 || Kostas,SHARE,$17,883,2025-01-29,2025-02-09,11
249,CB_2025_Jan_FB_3791_CHUB_V03_9x16_VID_EN_New_C-NONE_CTA-NONE_Angle-W_M-NONE_VL-None_TR-None_G-NONE_P-NONE_S-NONE,3791 - TrumpTweets CHUB || Enhancements: OFF || CBV1 || Batch 1 || 1C || 06/02/25w06 || Kostas,VIDEO,$17,"1,096",2025-02-06,2025-02-07,1
250,CB_2025_Jan_FB_3773_CHUB_V02_9x16_VID_EN_New_C-NONE_CTA-NONE_Angle-None_M-NONE_VL-None_TR-None_G-NONE_P-NONE_S-NONE,3773 - MessageVideos || Enhancements: OFF || CBV1 || Batch 1 || 1C || 09/02/25w07 || Kostas,VIDEO,$17,999,2025-02-09,2025-02-14,5
251,CB_2024_Aug_FB_3097_VK-DP_V03_9x16_VID_EN_Opti_C-Benefits_CTA-SMR_Pain-W-B_M-MIX_VL-45s_TR-None_G-MF_P-OG_S-WHAT_FB2516V13,DISCONTINUED || CB || US || Funnel A: React || 7DC || 04/02/2025,VIDEO,$16,369,2025-02-04,2025-02-04,0
252,CB_2024_Oct_FB_3251_LZ-VU_V01_1x1_IMG_EN_New_C-NegativeMark_Evergreen_CTA-NONE_Angle-Cort_M-NONE_VL-None_G-NONE_P-NONE_S-NONE.png,US || Manual Bid || BFCM || COST CAP 91 || 1C || 15/11/24,SHARE,$16,519,2024-11-15,2025-02-27,104
253,CB_2024_Dec_FB_3619_VK-JT_V02_4x5_VID_EN_New_C-BulletPoints_Sale_CTA-NY_Angle-W-B-C_M-NONE_VL-None_G-NONE_P-OG_S-NONE - Copy,DISCONTINUED || CB || US || Funnel A: React || 7DC || 04/02/2025,SHARE,$16,675,2025-02-04,2025-02-04,0
254,CB_2025_Jan_FB_3767_VK-DP_V01_9x16_VID_EN_New_C-BulletPoints_Evergreen_CTA-NONE_Angle-W-B-C_M-NONE_VL-15s_G-M_P-OG_S-NEW,3767 - Short video new idea CB V1 - DP || Enhancements: OFF || CBV1 || Batch 1 || 1C || 03/02/25w06 || Kostas,VIDEO,$15,677,2025-02-04,2025-02-11,7
255,CB_2025_Jan_FB_3704_SO_V05_4x5_IMG_EN_New_C-Headline_Evergreen_CTA-NONE_Angle-W-B-C_M-NONE_VL-None_G-NONE_P-NONE_S-NONE,3704 - Notion Idea #89 FOR REAL MEN || Enhancements: OFF || CBV1 || Batch 1 || 1C || 26/01/25w05 || Kostas,SHARE,$15,640,2025-01-26,2025-02-08,13
256,CB_2025_Jan_FB_3773_CHUB_V03_9x16_VID_EN_New_C-NONE_CTA-NONE_Angle-None_M-NONE_VL-None_TR-None_G-NONE_P-NONE_S-NONE,3773 - MessageVideos || Enhancements: OFF || CBV1 || Batch 1 || 1C || 09/02/25w07 || Kostas,SHARE,$15,866,2025-02-09,2025-02-14,5
257,CB_2025_Jan_FB_3740_SO-DP_V02_4x5_IMG_EN_Opti_C-Headline_Evergreen_CTA-NONE_Angle-W_M-NONE_VL-None_G-NONE_P-OG_S-NONE_3608V03,3740 - 3608_v03 OPTI || Enhancements: OFF || CBV1 || Batch 1 || 1C || 29/01/25w05 || Kostas,SHARE,$14,986,2025-01-29,2025-02-11,13
258,CB_2025_Jan_FB_3765_SO-JT_V03_1x1_IMG_EN_New_C-Headline_Evergreen_CTA-NONE_Angle-W_M-NONE_VL-None_G-NONE_P-NONE_S-NONE,3765 - SUGAR DETOX 2 IMG || Enhancements: OFF || CBV1 || Batch Ä… || 1C || 02/02/25w06 || Kostas,SHARE,$14,870,2025-02-02,2025-02-07,5
259,CB_2025_Feb_FB_3784_SO-RP_V07_4x5_IMG_EN_Opti_C-Headline_Evergreen_CTA-NONE_Angle-W_M-NONE_VL-None_G-NONE_P-OG_S-NONE_FB3726V01,3784 - 3726 ad copy opti || Enhancements: OFF || CBV1 || Batch 2 || 1C || 09/02/25w07 || Kostas,SHARE,$12,839,2025-02-09,2025-02-26,17
260,CB_2024_Aug_FB_3097_VK-DP_V03_9x16_VID_EN_Opti_C-Benefits_CTA-SMR_Pain-W-B_M-MIX_VL-45s_TR-None_G-MF_P-OG_S-WHAT_FB2516V13,DISCONTINUED || CB || US || Funnel B: Shopify || 7DC || 04/02/2025,VIDEO,$12,287,2025-02-04,2025-02-04,0
261,CB_2024_Dec_FB_3619_VK-JT_V02_4x5_VID_EN_New_C-BulletPoints_Sale_CTA-NY_Angle-W-B-C_M-NONE_VL-None_G-NONE_P-OG_S-NONE - Copy,DISCONTINUED || CB || US || Funnel B: Shopify || 7DC || 04/02/2025,SHARE,$12,607,2025-02-04,2025-02-04,0
262,IM_CB5.png,US || VSL || Aff's image + Taboola ad || Batch 1 || Landing: new5/pre-1 || 1C || 28/01/25,SHARE,$12,473,2025-01-28,2025-02-05,8
263,CB_2025_Feb_FB_3784_SO-RP_V10_4x5_IMG_EN_Opti_C-Headline_Evergreen_CTA-NONE_Angle-W_M-NONE_VL-None_G-NONE_P-OG_S-NONE_FB3726V01,3784 - 3726 ad copy opti || Enhancements: OFF || CBV1 || Batch 2 || 1C || 09/02/25w07 || Kostas,SHARE,$12,674,2025-02-09,2025-02-26,17
264,CB_2025_Feb_FB_3792_SO-RP_V05_1x1_IMG_EN_Opti_C-NegativeMark_Sale_CTA-Vday_Angle-Cort_M-NONE_VL-None_G-NONE_P-NONE_S-NONE_FB3251V02,3792 - 3072 Valentines opti IMG || Enhancements: OFF || CBV1 || Batch 1 || 1C || 09/02/25w07 || Kostas,SHARE,$11,373,2025-02-09,2025-02-16,7
265,CB_2022_Nov_FB_1218_RS_V15_9x16_IMG_EN_Opti_C-Sale_CTA-BLACK_Pain-W_M-NONE_VL-None FB1671V08,US || Manual Bid || BFCM || COST CAP 91 || 1C || 15/11/24,SHARE,$11,391,2024-11-15,2025-02-27,104
266,CB_2025_Jan_FB_3771_VK-DP_V04_9x16_VID_EN_New_C-BulletPoints_Evergreen_CTA-NONE_Angle-W-B-C_M-MAG_VL-15s_G-M_P-OG_S-NEW 2,3771 - New idea spot the lie for CB V1 - DP-VK || Enhancements: OFF || CBV1 || Batch 1 || 1C || 04/02/25w06 || Kostas,VIDEO,$11,781,2025-02-04,2025-02-11,7
267,CB_2025_Jan_FB_3745_CHUB_V02_4x5_IMG_EN_Opti_C-NONE_CTA-NONE_Angle-B_M-NONE_VL-None_TR-None_G-F_P-OG_S-NONE,3745 - 3661 Methane Balloon OPTI || Enhancements: OFF || CBV1 || Batch 1 || 1C || 30/01/25w05 || Kostas,SHARE,$11,897,2025-01-30,2025-02-13,14
268,CB_2025_Feb_FB_3792_SO-RP_V10_1x1_IMG_EN_Opti_C-NegativeMark_Sale_CTA-Vday_Angle-Cort_M-NONE_VL-None_G-NONE_P-NONE_S-NONE_FB3251V02,3792 - 3072 Valentines opti IMG || Enhancements: OFF || CBV1 || Batch 2 || 1C || 09/02/25w07 || Kostas,SHARE,$10,351,2025-02-09,2025-02-17,8
269,CB_2025_Feb_FB_3784_SO-RP_V06_4x5_IMG_EN_Opti_C-Headline_Evergreen_CTA-NONE_Angle-W_M-NONE_VL-None_G-NONE_P-OG_S-NONE_FB3726V01,3784 - 3726 ad copy opti || Enhancements: OFF || CBV1 || Batch 2 || 1C || 09/02/25w07 || Kostas,SHARE,$10,735,2025-02-09,2025-02-26,17
270,CB_2023_Jul_FB_2217_IB_V04_9x16_VID_EN_Opti_C-Pointing_CTA-SMR_Pain-W-B_M-TRC_VL-30s_TR-None_G-F_P-None_S-FRIGGA,US || Manual Bid || BFCM || COST CAP 81 || 1C || 15/11/24,VIDEO,$10,325,2024-11-15,2025-03-16,121
271,CB_2025_Jan_FB_3717_CHUB_V01_4x5_IMG_EN_New_C-NONE_CTA-NONE_Angle-C_M-NONE_VL-None_TR-None_G-M_P-OG_S-NONE,3717 - Lunar New Year sale || Enhancements: OFF || CBV1 || Batch 1 || 1C || 29/01/25w05 || Kostas,SHARE,$9,448,2025-01-29,2025-02-03,5
272,CB_2025_Feb_FB_3780_DT-DP_V01_9x16_VID_EN_Opti_C-MakingOf_Sale_CTA-70_Angle-W-B_M-CRAZY_VL-45s_G-M_P-OG_S-NEW_FB3264V31,3780 - Crazy Trainer Hookerization || Enhancements: OFF || CBV1 || Batch 1 || 1C || 09/02/25w07 || Kostas,SHARE,$9,594,2025-02-09,2025-02-15,6
273,CB_2024_Dec_FB_3666_VK-JT_V03_4x5_VID_EN_Opti_C-BulletPoints_Sale_CTA-NY_Angle-W-B-C_M-TRC_VL-30s_G-F_P-OG_S-NEW,ASC+ || VIDEO Only || US || 0% EXISTING CAP || 1C || 08.12.24  Ad set,VIDEO,$9,304,2025-01-11,2025-02-05,25
274,CB_2025_Jan_FB_3747_CHUB-AA_V01_4x5_IMG_EN_Opti_C-NONE_CTA-NONE_Angle-Sale_M-NONE_VL-None_TR-None_G-NONE_P-OG_S-NONE,3747 Clean Sale [HB winner ITR] CHUB || Enhancements: OFF || CBV1 || Batch Ä… || 1C || 02/02/25w06 || Kostas,SHARE,$9,485,2025-02-02,2025-03-27,53
275,CB_2025_Jan_FB_3770_CHUB_V03_9x16_VID_EN_New_C-NONE_CTA-NONE_Angle-None_M-NONE_VL-None_TR-None_G-NONE_P-NONE_S-NONE,3770 - HM4Things CHUB || Enhancements: OFF || CBV1 || Batch 1 || 1C || 09/02/25w07 || Kostas,VIDEO,$9,364,2025-02-09,2025-02-14,5
276,CB_2023_Jul_FB_2226_MB_V04_9x16_VID_EN_Opti_C-Testim_CTA-SMR_Pain-W_M-MIX_VL-30s_TR-None_G-F_P-None_S-Starry,US || Manual Bid || BFCM || ROAS GOAL: 1.4 || 1C || 15/11/24,VIDEO,$8,232,2024-11-15,2025-02-27,104
277,Taboola - ColonB 3.webp,US || VSL || Aff's image + Taboola ad || Batch 1 || Landing: new6/pre-1 || 1C || 28/01/25,SHARE,$8,277,2025-01-28,2025-02-03,6
278,CB_2025_Jan_FB_3718_CHUB_V03_4x5_IMG_EN_Opti_C-NONE_CTA-NONE_Angle-C_M-NONE_VL-None_TR-None_G-M_P-OG_S-NONE,3718 - Looking 15 people OPTI || Enhancements: OFF || CBV1 || Batch 1 || 1C || 29/01/25w05 || Kostas,SHARE,$8,443,2025-01-29,2025-02-07,9
279,CB_2025_Feb_FB_3792_SO-RP_V01_1x1_IMG_EN_Opti_C-NegativeMark_Sale_CTA-Vday_Angle-Cort_M-NONE_VL-None_G-NONE_P-NONE_S-NONE_FB3251V02,3792 - 3072 Valentines opti IMG || Enhancements: OFF || CBV1 || Batch 1 || 1C || 09/02/25w07 || Kostas,SHARE,$8,221,2025-02-09,2025-02-16,7
280,CB_2025_Feb_FB_3784_SO-RP_V03_4x5_IMG_EN_Opti_C-Headline_Evergreen_CTA-NONE_Angle-W_M-NONE_VL-None_G-NONE_P-OG_S-NONE_FB3726V01,3784 - 3726 ad copy opti || Enhancements: OFF || CBV1 || Batch 1 || 1C || 09/02/25w07 || Kostas,SHARE,$8,442,2025-02-09,2025-02-17,8
281,CB_2025_Feb_FB_3792_SO-RP_V09_1x1_IMG_EN_Opti_C-NegativeMark_Sale_CTA-Vday_Angle-Cort_M-NONE_VL-None_G-NONE_P-NONE_S-NONE_FB3251V02,3792 - 3072 Valentines opti IMG || Enhancements: OFF || CBV1 || Batch 2 || 1C || 09/02/25w07 || Kostas,SHARE,$8,314,2025-02-09,2025-02-17,8
282,CB_2023_Jul_FB_2226_MB_V04_9x16_VID_EN_Opti_C-Testim_CTA-SMR_Pain-W_M-MIX_VL-30s_TR-None_G-F_P-None_S-Starry,US || Manual Bid || BFCM || COST CAP 91 || 1C || 15/11/24,VIDEO,$8,240,2024-11-15,2025-02-27,104
283,CB_2024_Mar_FB_2888_JG_V03_9x16_IMG_EN_Opti_C-Benefits_CTA-NONE_Pain-W_M-NONE_VL-None_TR-None_G-NONE_P-V2_S-NONE,CBV2 || AU || ðŸ’° Advantage+ || US || BROAD || 7C || Existing_customer_5% || 19/12/24 Ad set,SHARE,$8,250,2024-12-19,2025-03-27,98
284,CB_2025_Jan_FB_3718_CHUB_V01_4x5_IMG_EN_Opti_C-NONE_CTA-NONE_Angle-C_M-NONE_VL-None_TR-None_G-M_P-OG_S-NONE,3718 - Looking 15 people OPTI || Enhancements: OFF || CBV1 || Batch 1 || 1C || 29/01/25w05 || Kostas,SHARE,$8,426,2025-01-29,2025-02-07,9
285,CB_2025_Feb_FB_3792_SO-RP_V07_1x1_IMG_EN_Opti_C-NegativeMark_Sale_CTA-Vday_Angle-Cort_M-NONE_VL-None_G-NONE_P-NONE_S-NONE_FB3251V02,3792 - 3072 Valentines opti IMG || Enhancements: OFF || CBV1 || Batch 2 || 1C || 09/02/25w07 || Kostas,SHARE,$7,356,2025-02-09,2025-02-17,8
286,CB_2025_Feb_FB_3784_SO-RP_V02_4x5_IMG_EN_Opti_C-Headline_Evergreen_CTA-NONE_Angle-W_M-NONE_VL-None_G-NONE_P-OG_S-NONE_FB3726V01,3784 - 3726 ad copy opti || Enhancements: OFF || CBV1 || Batch 1 || 1C || 09/02/25w07 || Kostas,SHARE,$7,291,2025-02-09,2025-02-17,8
287,CB_2025_Jan_FB_3723_SO_V01_4x5_IMG_EN_New_C-NONE_Evergreen_CTA-SALE_Angle-W_M-NONE_VL-None_G-NONE_P-NONE_S-NONE,3723 - Notion Idea #92 MAN BOOBS || Enhancements: OFF || CBV1 || Batch 1 || 1C || 28/01/25w05 || Kostas,SHARE,$7,471,2025-01-28,2025-02-24,27
288,CB_2025_Feb_FB_3792_SO-RP_V04_1x1_IMG_EN_Opti_C-NegativeMark_Sale_CTA-Vday_Angle-Cort_M-NONE_VL-None_G-NONE_P-NONE_S-NONE_FB3251V02,3792 - 3072 Valentines opti IMG || Enhancements: OFF || CBV1 || Batch 1 || 1C || 09/02/25w07 || Kostas,SHARE,$6,217,2025-02-09,2025-02-16,7
289,CB_2025_Jan_FB_3750_LZ-VU_V04_4x5_IMG_EN_Opti_C-NegativeMark_Evergreen_CTA-NONE_Angle-W_M-NONE_VL-None_G-NONE_P-NONE_S-NONE_FB3251V01,3750 - bioma ripoff march soft version || Enhancements: OFF || CBV1 || Batch 1 || 1C || 24/01/25w04 || Kostas,SHARE,$6,255,2025-01-24,2025-02-17,24
290,IM_CB5.png,US || VSL || Aff's image + Taboola ad || Batch 1 || Landing: /quiz/pre-1 || 1C || 30/01/25,SHARE,$6,282,2025-01-30,2025-02-04,5
291,CB_2024_Dec_FB_3592_VK-DP_V09_4x5_VID_EN_New_C-BulletPoints_Sale_CTA-SALE_Angle-W-B-C_M-NONE_VL-30s_G-F_P-OG_S-WHAT - Copy,ASC+ || VIDEO Only || US || 0% EXISTING CAP || 1C || 08.12.24  Ad set,VIDEO,$6,241,2024-12-20,2025-02-05,47
292,CB_2025_Jan_FB_3779_VK-DP_V01_1x1_VID_EN_Opti_C-BulletPoints_Evergreen_CTA-70_Angle-W-B-C_M-NONE_VL-None_G-F_P-OG_S-NEW_FB3705V02,3779 - opti 3705 || Enhancements: OFF || CBV1 || Batch 1 || 1C || 04/02/25w06 || Kostas,SHARE,$6,366,2025-02-04,2025-03-20,44
293,CB_2025_Feb_FB_3782_CHUB_V03_9x16_VID_EN_New_C-NONE_CTA-NONE_Angle-None_M-NONE_VL-None_TR-None_G-NONE_P-NONE_S-NONE,3782 - Political weight loss journey CHUB || Enhancements: OFF || CBV1 || Batch 2 || 1C || 06/02/25w06 || Kostas,VIDEO,$6,369,2025-02-06,2025-02-07,1
294,CB_2025_Feb_FB_3784_SO-RP_V04_4x5_IMG_EN_Opti_C-Headline_Evergreen_CTA-NONE_Angle-W_M-NONE_VL-None_G-NONE_P-OG_S-NONE_FB3726V01,3784 - 3726 ad copy opti || Enhancements: OFF || CBV1 || Batch 1 || 1C || 09/02/25w07 || Kostas,SHARE,$5,345,2025-02-09,2025-02-17,8
295,CB_2025_Feb_FB_3784_SO-RP_V01_4x5_IMG_EN_Opti_C-Headline_Evergreen_CTA-NONE_Angle-W_M-NONE_VL-None_G-NONE_P-OG_S-NONE_FB3726V01,3784 - 3726 ad copy opti || Enhancements: OFF || CBV1 || Batch 1 || 1C || 09/02/25w07 || Kostas,SHARE,$5,299,2025-02-09,2025-02-17,8
296,CB_2025_Feb_FB_3792_SO-RP_V02_1x1_IMG_EN_Opti_C-NegativeMark_Sale_CTA-Vday_Angle-Cort_M-NONE_VL-None_G-NONE_P-NONE_S-NONE_FB3251V02,3792 - 3072 Valentines opti IMG || Enhancements: OFF || CBV1 || Batch 1 || 1C || 09/02/25w07 || Kostas,SHARE,$5,78,2025-02-09,2025-02-16,7
297,CB_2025_Feb_FB_3792_SO-RP_V08_1x1_IMG_EN_Opti_C-NegativeMark_Sale_CTA-Vday_Angle-Cort_M-NONE_VL-None_G-NONE_P-NONE_S-NONE_FB3251V02,3792 - 3072 Valentines opti IMG || Enhancements: OFF || CBV1 || Batch 2 || 1C || 09/02/25w07 || Kostas,SHARE,$4,194,2025-02-09,2025-02-17,8
298,CB_2024_Jan_FB_2762_IK_V04_1x1_IMG_EN_New_C-WrittenTesti_CTA-CTA_Pain-W-B-C_M-NONE_VL-None_TR-None_G-NONE_P-V2_S-NONE,CBV2 || AU || ðŸ’° Advantage+ || US || BROAD || 7C || Existing_customer_5% || 19/12/24 Ad set,SHARE,$4,138,2024-12-19,2025-03-27,98
299,CB_2025_Jan_FB_3726_LZ-JG_V02_4x5_IMG_EN_Opti_C-Headline_Evergreen_CTA-NONE_Angle-W_M-NONE_VL-None_G-NONE_P-OG_S-NONE_FB3357V01,3726 - domperignon opti || Enhancements: OFF || CBV1 || Batch 1 || 7C || 22/01/25w04,SHARE,$4,146,2025-01-22,2025-02-03,12
300,CB_2023_Dec_FB_2694_DT-DP_V17_1x1_GIF_EN_New_C-NONE_CTA-NY65_None_M-NONE_VL-15s_TR-None_G-NONE_P-OG_S-NONE,ðŸ’°WC || US || Advantage+ || BIG BUDGET || CC101->105->109->112->114-116->117 || BROAD || ABO || 1C || 17/01/24 RELAUNCHED Ad set,VIDEO,$4,82,2024-01-18,2025-02-06,385
301,CB_2023_Oct_FB_2516_VK_V13_9x16_VID_EN_Opti_C-Benefits_CTA-AUTUM_Pain-W-B_M-PASQ_VL-30s_TR-None_G-M_P-Plan_S-WHAT,ðŸ’°WC || US || Advantage+ || BIG BUDGET || CC101->105->109->112->114-116->117 || BROAD || ABO || 1C || 17/01/24 RELAUNCHED Ad set,VIDEO,$4,148,2024-01-17,2025-02-06,386
302,IM_CB5.png,US || VSL || Aff's image + Taboola ad || Batch 1 || Landing: new6/pre-1 || 1C || 28/01/25,SHARE,$4,156,2025-01-28,2025-02-03,6
303,CB_2024_Dec_FB_3622_LZ-KB_V03_4x5_IMG_EN_Opti_C-NONE_Sale_CTA-XMAS_Angle-GH_M-NONE_VL-None_G-NONE_P-OG_S-NONE_FB2227V08 - Copy,US || Manual Bid || BID CAP 111 || 1C || 21/12/24,SHARE,$4,84,2024-12-22,2025-03-26,94
304,CB_2025_Jan_FB_3735_VK_V01_4x5_VID_EN_New_C-BulletPoints_Sale_CTA-NY_Angle-W-B-C_M-NONE_VL-None_G-NONE_P-OG_S-NONE,3735 - OPTI 3619 -VK || Enhancements: OFF || CBV1 || Batch 1 || 1C || 29/01/25w05 || Kostas,SHARE,$4,307,2025-01-29,2025-02-07,9
305,CB_2025_Feb_FB_3782_CHUB_V05_9x16_VID_EN_New_C-NONE_CTA-NONE_Angle-None_M-NONE_VL-None_TR-None_G-NONE_P-NONE_S-NONE,3782 - Political weight loss journey CHUB || Enhancements: OFF || CBV1 || Batch 1 || 1C || 06/02/25w06 || Kostas,VIDEO,$4,213,2025-02-06,2025-02-07,1
306,CB_2025_Jan_FB_3723_SO_V03_4x5_IMG_EN_New_C-NONE_Evergreen_CTA-SALE_Angle-W_M-NONE_VL-None_G-NONE_P-NONE_S-NONE,3723 - Notion Idea #92 MAN BOOBS || Enhancements: OFF || CBV1 || Batch 1 || 1C || 28/01/25w05 || Kostas,SHARE,$4,279,2025-01-28,2025-02-24,27
307,CB_2025_Jan_FB_3778_DT-DP_V01_9x16_VID_EN_Opti_C-Benefits_Sale_CTA-70_Angle-W-B_M-MAN_VL-45s_G-M_P-OG_S-WHAT_FB3097V03,3778 - Opti 3097 || Enhancements: OFF || CBV1 || Batch 1 || 1C || 04/02/25w06 || Kostas,VIDEO,$4,261,2025-02-04,2025-02-11,7
308,CB_2023_Jul_FB_2217_IB_V04_9x16_VID_EN_Opti_C-Pointing_CTA-SMR_Pain-W-B_M-TRC_VL-30s_TR-None_G-F_P-None_S-FRIGGA - Copy,DISCONTINUED || CB || US || Funnel A: React || 7DC || 04/02/2025,VIDEO,$4,83,2025-02-04,2025-02-04,0
309,CB_2025_Jan_FB_3717_CHUB_V03_4x5_IMG_EN_New_C-NONE_CTA-NONE_Angle-C_M-NONE_VL-None_TR-None_G-M_P-OG_S-NONE,3717 - Lunar New Year sale || Enhancements: OFF || CBV1 || Batch 1 || 1C || 29/01/25w05 || Kostas,SHARE,$4,173,2025-01-29,2025-02-03,5
310,CB_2025_Jan_FB_3786_LZ_V03_1x1_IMG_EN_New_C-Educational_Evergreen_CTA-SALE_Angle-GH_M-NONE_VL-None_G-NONE_P-OG_S-NONE,3786 - #92 Notion idea gamers' diet || Enhancements: OFF || CBV1 || Batch 1 || 7C || 09/02/25w07 || Kostas,SHARE,$3,196,2025-02-09,2025-02-17,8
311,CB_2025_Jan_FB_3738_SO-DP_V01_4x5_IMG_EN_Opti_C-NONE_Evergreen_CTA-SALE_Angle-W_M-NONE_VL-None_G-NONE_P-NONE_S-NONE3665V01,3738 - 3665_V01 OPTI || Enhancements: OFF || CBV1 || Batch 1 || 1C || 29/01/25w05 || Kostas,SHARE,$3,249,2025-01-29,2025-02-22,24
312,CB_2025_Feb_FB_3784_SO-RP_V09_4x5_IMG_EN_Opti_C-Headline_Evergreen_CTA-NONE_Angle-W_M-NONE_VL-None_G-NONE_P-OG_S-NONE_FB3726V01,3784 - 3726 ad copy opti || Enhancements: OFF || CBV1 || Batch 2 || 1C || 09/02/25w07 || Kostas,SHARE,$3,255,2025-02-09,2025-02-26,17
313,CB_2025_Feb_FB_3780_DT-DP_V02_9x16_VID_EN_Opti_C-MakingOf_Sale_CTA-70_Angle-W-B_M-CRAZY_VL-45s_G-M_P-OG_S-NEW_FB3264V31,3780 - Crazy Trainer Hookerization || Enhancements: OFF || CBV1 || Batch 1 || 1C || 09/02/25w07 || Kostas,VIDEO,$3,151,2025-02-09,2025-02-15,6
314,CB_2025_Jan_FB_3786_LZ_V04_1x1_IMG_EN_New_C-Educational_Evergreen_CTA-SALE_Angle-GH_M-NONE_VL-None_G-NONE_P-OG_S-NONE,3786 - #92 Notion idea gamers' diet || Enhancements: OFF || CBV1 || Batch 1 || 7C || 09/02/25w07 || Kostas,SHARE,$3,127,2025-02-09,2025-02-17,8
315,CB_2025_Jan_FB_3711_DT_V04_4x5_VID_EN_Opti_C-Dance_Sale_CTA-VDAY_Angle-W_M-MIX_VL-45s_G-F_P-OG_S-STARRY_FB1998V02,3711 - VDAY top ads 2024 opti 3 || Enhancements: OFF || CBV1 || Batch 1 || 1C || 29/01/25w05 || Kostas,SHARE,$2,120,2025-01-29,2025-02-07,9
316,CB_2025_Jan_FB_3723_SO_V08_4x5_IMG_EN_New_C-NONE_Evergreen_CTA-SALE_Angle-W_M-NONE_VL-None_G-NONE_P-NONE_S-NONE,3723 - Notion Idea #92 MAN BOOBS || Enhancements: OFF || CBV1 || Batch 2 || 1C || 28/01/25w05 || Kostas,SHARE,$2,233,2025-01-28,2025-02-18,21
317,CB_2024_Dec_FB_3611_CHUB_V05_4x5_IMG_EN_Opti_C-Headline_CTA-NONE_Angle-C_P-NONE_S-NONE - Copy,US || Manual Bid || BID CAP 111 || 1C || 21/12/24,SHARE,$2,140,2024-12-27,2025-03-24,87
318,CB_2025_Jan_FB_3747_CHUB-AA_V02_9x16_IMG_EN_Opti_C-NONE_CTA-NONE_Angle-Sale_M-NONE_VL-None_TR-None_G-NONE_P-OG_S-NONE,3747 Clean Sale [HB winner ITR] CHUB || Enhancements: OFF || CBV1 || Batch Ä… || 1C || 02/02/25w06 || Kostas,SHARE,$2,98,2025-02-02,2025-03-27,53
319,CB_2025_Jan_FB_3732_SO-JT_V03_4x5_IMG_EN_New_C-Headline_Evergreen_CTA-NONE_Angle-Detox_M-NONE_VL-None_G-NONE_P-NONE_S-NONE,3732 - CB - Cortisol detox || Enhancements: OFF || CBV1 || Batch 1 || 1C || 29/01/25w05 || Kostas,SHARE,$2,119,2025-01-29,2025-02-03,5
320,CB_2025_Jan_FB_3726_LZ-JG_V03_4x5_IMG_EN_Opti_C-Headline_Evergreen_CTA-NONE_Angle-W_M-NONE_VL-None_G-NONE_P-OG_S-NONE_FB3357V01,3726 - domperignon opti || Enhancements: OFF || CBV1 || Batch 1 || 7C || 22/01/25w04,SHARE,$2,55,2025-01-22,2025-02-03,12
321,CB_2025_Jan_FB_3732_SO-JT_V01_4x5_IMG_EN_New_C-Headline_Evergreen_CTA-NONE_Angle-Detox_M-NONE_VL-None_G-NONE_P-NONE_S-NONE,3732 - CB - Cortisol detox || Enhancements: OFF || CBV1 || Batch 1 || 1C || 29/01/25w05 || Kostas,SHARE,$2,148,2025-01-29,2025-02-03,5
322,CB_2025_Jan_FB_3709_VK-JT_V04_4x5_IMG_EN_New_C-BulletPoints_Sale_CTA-NY_Angle-W-B-C_M-NONE_VL-None_G-M_P-OG_S-NONE,3709 -Notion Sigma male #109 VK-JT || Enhancements: OFF || CBV1 || Batch 1 || 1C || 29/01/25w05 || Kostas,SHARE,$2,103,2025-01-29,2025-02-05,7
323,CB_2025_Jan_FB_3723_SO_V02_4x5_IMG_EN_New_C-NONE_Evergreen_CTA-SALE_Angle-W_M-NONE_VL-None_G-NONE_P-NONE_S-NONE,3723 - Notion Idea #92 MAN BOOBS || Enhancements: OFF || CBV1 || Batch 1 || 1C || 28/01/25w05 || Kostas,SHARE,$1,119,2025-01-28,2025-02-24,27
324,CB_2023_Dec_FB_2706_RS_V09_9x16_VID_EN_Opti_C-Sale_CTA-NY56_Pain-W_M-JOG_VL-30s_TR-None_G-F_P-OG_S-WHAT_FB1404V02,ðŸ’°WC || US || Advantage+ || BIG BUDGET || CC101->105->109->112->114-116->117 || BROAD || ABO || 1C || 17/01/24 RELAUNCHED Ad set,VIDEO,$1,49,2024-01-17,2025-02-05,385
325,CB_2025_Jan_FB_3747_CHUB-AA_V04_9x16_IMG_EN_Opti_C-NONE_CTA-NONE_Angle-Sale_M-NONE_VL-None_TR-None_G-NONE_P-OG_S-NONE,3747 Clean Sale [HB winner ITR] CHUB || Enhancements: OFF || CBV1 || Batch Ä… || 1C || 02/02/25w06 || Kostas,SHARE,$1,72,2025-02-02,2025-03-27,53
326,CB_2025_Jan_FB_3705_VK_V02_4x5_IMG_EN_New_C-BulletPoints_Sale_CTA-NY_Angle-W-B-C_M-NONE_VL-None_G-NONE_P-OG_S-NONE,3705 - #87 Struggling with Dad Bod_ - VK || Enhancements: OFF || CBV1 || Batch 1 || 1C || 22/01/25w04 || Kostas,SHARE,$1,84,2025-01-22,2025-02-03,12
327,CB_2025_Jan_FB_3779_VK-DP_V03_1x1_VID_EN_Opti_C-BulletPoints_Evergreen_CTA-70_Angle-W-B-C_M-NONE_VL-None_G-F_P-OG_S-NEW_FB3705V02,3779 - opti 3705 || Enhancements: OFF || CBV1 || Batch 1 || 1C || 04/02/25w06 || Kostas,SHARE,$1,72,2025-02-04,2025-03-20,44
328,CB_2023_Dec_FB_2696_RS_V02_9x16_VID_EN_Opti_C-Sale_CTA-XMAS65_Pain-W-B_M-JANW_VL-30s_TR-None_G-MF_P-OG_S-WHAT_FB2284V05,ðŸ’°WC || US || Advantage+ || BIG BUDGET || CC101->105->109->112->114-116->117 || BROAD || ABO || 1C || 17/01/24 RELAUNCHED Ad set,VIDEO,$1,42,2024-01-17,2025-02-06,386
329,CB_2025_Jan_FB_3737_DT_V04_4x5_IMG_EN_New_C-BulletPoints_Evergreen_CTA-NONE_Angle-W_M-NONE_VL-None_G-NONE_P-OG_S-NONE_FB3682V03,3737 - Opti 3682 || Enhancements: OFF || CBV1 || Batch 1 || 1C || 29/01/25w05 || Kostas,SHARE,$1,77,2025-01-29,2025-02-05,7
330,CB_2025_Jan_FB_3735_VK_V03_4x5_VID_EN_New_C-BulletPoints_Sale_CTA-NY_Angle-W-B-C_M-NONE_VL-None_G-NONE_P-OG_S-NONE,3735 - OPTI 3619 -VK || Enhancements: OFF || CBV1 || Batch 1 || 1C || 29/01/25w05 || Kostas,SHARE,$1,90,2025-01-29,2025-02-07,9
331,CB_2023_Jul_FB_2217_IB_V04_9x16_VID_EN_Opti_C-Pointing_CTA-SMR_Pain-W-B_M-TRC_VL-30s_TR-None_G-F_P-None_S-FRIGGA - Copy,DISCONTINUED || CB || US || Funnel B: Shopify || 7DC || 04/02/2025,VIDEO,$1,38,2025-02-04,2025-02-04,0
332,CB_2025_Feb_FB_3780_DT-DP_V03_9x16_VID_EN_Opti_C-MakingOf_Sale_CTA-70_Angle-W-B_M-CRAZY_VL-45s_G-M_P-OG_S-NEW_FB3264V31,3780 - Crazy Trainer Hookerization || Enhancements: OFF || CBV1 || Batch 1 || 1C || 09/02/25w07 || Kostas,VIDEO,$1,55,2025-02-09,2025-02-15,6
333,CB_2025_Jan_FB_3745_CHUB_V03_4x5_IMG_EN_Opti_C-NONE_CTA-NONE_Angle-B_M-NONE_VL-None_TR-None_G-F_P-OG_S-NONE,3745 - 3661 Methane Balloon OPTI || Enhancements: OFF || CBV1 || Batch 1 || 1C || 30/01/25w05 || Kostas,SHARE,$1,66,2025-01-30,2025-02-10,11
334,CB_2023_Jul_FB_2217_IB_V04_9x16_VID_EN_Opti_C-Pointing_CTA-SMR_Pain-W-B_M-TRC_VL-30s_TR-None_G-F_P-None_S-FRIGGA,US || Manual Bid || BFCM || COST CAP 71 || 1C || 15/11/24,VIDEO,$1,22,2024-11-15,2025-03-27,132
335,CB_2025_Jan_FB_3704_SO_V04_4x5_IMG_EN_New_C-Headline_Evergreen_CTA-NONE_Angle-W-B-C_M-NONE_VL-None_G-NONE_P-NONE_S-NONE,3704 - Notion Idea #89 FOR REAL MEN || Enhancements: OFF || CBV1 || Batch 1 || 1C || 26/01/25w05 || Kostas,SHARE,$1,25,2025-01-26,2025-02-08,13
336,CB_2023_Nov_FB_2675_DT_V01_9x16_VID_EN_Opti_C-Pointing_CTA-XMAS65_Pain-W_M-SEAN_VL-30s_TR-None_G-M_P-NONE_S-YARIN_FB2396V02,ðŸ’°WC || US || Advantage+ || BIG BUDGET || CC101->105->109->112->114-116->117 || BROAD || ABO || 1C || 17/01/24 RELAUNCHED Ad set,VIDEO,$1,23,2024-01-17,2025-02-06,386
337,CB_2025_Jan_FB_3723_SO_V20_4x5_IMG_EN_New_C-NONE_Evergreen_CTA-SALE_Angle-W_M-NONE_VL-None_G-NONE_P-NONE_S-NONE,3723 - Notion Idea #92 MAN BOOBS || Enhancements: OFF || CBV1 || Batch 4 || 1C || 28/01/25w05 || Kostas,SHARE,$1,34,2025-01-28,2025-03-11,42
338,CB_2024_Dec_FB_3608_LZ-DP_V04_4x5_IMG_EN_New_C-Headline_Evergreen_CTA-NONE_Angle-W_M-NONE_VL-None_G-NONE_P-OG_S-NONE,3608 - CB_IMG_ notion #17 hypnosis || Enhancements: OFF || CBV1 || Batch 1 || 1C || 13/01/25w03 || Kostas,SHARE,$0,24,2025-01-13,2025-02-03,21
339,CB_2023_Jul_FB_2217_IB_V04_9x16_VID_EN_Opti_C-Pointing_CTA-SMR_Pain-W-B_M-TRC_VL-30s_TR-None_G-F_P-None_S-FRIGGA,US || Manual Bid || BID CAP 111 || 1C || 21/12/24,VIDEO,$0,15,2024-12-22,2025-03-24,92
340,CB_2025_Jan_FB_3711_DT_V05_4x5_VID_EN_Opti_C-MakingOf_Sale_CTA-VDAY_Angle-W-B-C_M-JOG_VL-45s_G-F_P-OG_S-MOON_FB3252V04,3711 - VDAY top ads 2024 opti 3 || Enhancements: OFF || CBV1 || Batch 1 || 1C || 29/01/25w05 || Kostas,SHARE,$0,43,2025-01-29,2025-02-07,9
341,CB_2025_Jan_FB_3718_CHUB_V06_4x5_IMG_EN_Opti_C-NONE_CTA-NONE_Angle-C_M-NONE_VL-None_TR-None_G-M_P-OG_S-NONE,3718 - Looking 15 people OPTI || Enhancements: OFF || CBV1 || Batch 2 || 1C || 29/01/25w05 || Kostas,SHARE,$0,20,2025-01-29,2025-02-20,22
342,CB_2025_Jan_FB_3723_SO_V16_4x5_IMG_EN_New_C-NONE_Evergreen_CTA-SALE_Angle-W_M-NONE_VL-None_G-NONE_P-NONE_S-NONE,3723 - Notion Idea #92 MAN BOOBS || Enhancements: OFF || CBV1 || Batch 4 || 1C || 28/01/25w05 || Kostas,SHARE,$0,29,2025-01-28,2025-03-11,42
343,CB_2023_Nov_FB_2664_MB_V08_9x16_VID_EN_Opti_C-Testim_CTA-XMAS65_Pain-W_M-MIX_VL-30s_TR-None_G-F_P-None_S-Starry,ðŸ’°WC || US || Advantage+ || BIG BUDGET || CC101->105->109->112->114-116->117 || BROAD || ABO || 1C || 17/01/24 RELAUNCHED Ad set,VIDEO,$0,8,2024-01-17,2025-02-04,384
344,CB_2025_Jan_FB_3717_CHUB_V02_4x5_IMG_EN_New_C-NONE_CTA-NONE_Angle-C_M-NONE_VL-None_TR-None_G-M_P-OG_S-NONE,3717 - Lunar New Year sale || Enhancements: OFF || CBV1 || Batch 1 || 1C || 29/01/25w05 || Kostas,SHARE,$0,24,2025-01-29,2025-02-03,5
345,CB_2025_Jan_FB_3732_SO-JT_V02_4x5_IMG_EN_New_C-Headline_Evergreen_CTA-NONE_Angle-Detox_M-NONE_VL-None_G-NONE_P-NONE_S-NONE,3732 - CB - Cortisol detox || Enhancements: OFF || CBV1 || Batch 1 || 1C || 29/01/25w05 || Kostas,SHARE,$0,11,2025-01-29,2025-02-03,5
346,CB_2025_Jan_FB_3704_SO_V03_4x5_IMG_EN_New_C-Headline_Evergreen_CTA-NONE_Angle-W-B-C_M-NONE_VL-None_G-NONE_P-NONE_S-NONE,3704 - Notion Idea #89 FOR REAL MEN || Enhancements: OFF || CBV1 || Batch 1 || 1C || 26/01/25w05 || Kostas,SHARE,$0,23,2025-01-26,2025-02-08,13
347,CB_2022_Mar3_FB_713_IK_V04_1x1_IMG_EN_Opti_C-WrittenTesti_HE-98_A-ExtremeBodyVisualization_HK-bodypart_Pain-W_CLR-PURPLE_BG-IMAGE_ME-MIX_MA-YOUNG,US || Manual Bid || BFCM || COST CAP 81 || 1C || 15/11/24,SHARE,$0,13,2024-11-15,2025-03-26,131
348,CB_2023_Dec_FB_2721_DA-RP_V01_9x16_VID_EN_Opti_C-Sale_CTA-65_Pain-W-B_M-HIL_VL-45s_TR-None_G-F_P-Plan_S-NEW_FB2558V02 - Copy,ðŸ’°WC || US || Advantage+ || BIG BUDGET || CC101->105->109->112->114-116->117 || BROAD || ABO || 1C || 17/01/24 RELAUNCHED Ad set,VIDEO,$0,6,2024-01-21,2025-02-04,380
349,CB_2024_Dec_FB_3608_LZ-DP_V01_4x5_IMG_EN_New_C-Headline_Evergreen_CTA-NONE_Angle-W_M-NONE_VL-None_G-NONE_P-OG_S-NONE,3608 - CB_IMG_ notion #17 hypnosis || Enhancements: OFF || CBV1 || Batch 1 || 1C || 13/01/25w03 || Kostas,SHARE,$0,8,2025-01-13,2025-02-03,21
350,CB_2025_Jan_FB_3718_CHUB_V07_4x5_IMG_EN_Opti_C-NONE_CTA-NONE_Angle-C_M-NONE_VL-None_TR-None_G-M_P-OG_S-NONE,3718 - Looking 15 people OPTI || Enhancements: OFF || CBV1 || Batch 3 || 1C || 29/01/25w05 || Kostas,SHARE,$0,5,2025-01-29,2025-02-05,7
351,CB_2025_Jan_FB_3705_VK_V01_4x5_IMG_EN_New_C-BulletPoints_Sale_CTA-NY_Angle-W-B-C_M-NONE_VL-None_G-NONE_P-OG_S-NONE,3705 - #87 Struggling with Dad Bod_ - VK || Enhancements: OFF || CBV1 || Batch 1 || 1C || 22/01/25w04 || Kostas,SHARE,$0,4,2025-01-22,2025-02-03,12
352,CB_2024_Oct_FB_3251_LZ-VU_V01_1x1_IMG_EN_New_C-NegativeMark_Evergreen_CTA-NONE_Angle-Cort_M-NONE_VL-None_G-NONE_P-NONE_S-NONE.png,US || Manual Bid || BID CAP 111 || 1C || 21/12/24,SHARE,$0,2,2024-12-26,2025-02-16,52
353,CB_2024_Oct_FB_3251_LZ-VU_V01_1x1_IMG_EN_New_C-NegativeMark_Evergreen_CTA-NONE_Angle-Cort_M-NONE_VL-None_G-NONE_P-NONE_S-NONE.png,US || Manual Bid || BFCM || COST CAP 81 || 1C || 15/11/24,SHARE,$0,1,2024-11-15,2025-03-17,122
354,CB_2025_Jan_FB_3723_SO_V05_4x5_IMG_EN_New_C-NONE_Evergreen_CTA-SALE_Angle-W_M-NONE_VL-None_G-NONE_P-NONE_S-NONE,3723 - Notion Idea #92 MAN BOOBS || Enhancements: OFF || CBV1 || Batch 1 || 1C || 28/01/25w05 || Kostas,SHARE,$0,4,2025-01-28,2025-02-24,27
355,CB_2022_Mar3_FB_713_IK_V04_1x1_IMG_EN_Opti_C-WrittenTesti_HE-98_A-ExtremeBodyVisualization_HK-bodypart_Pain-W_CLR-PURPLE_BG-IMAGE_ME-MIX_MA-YOUNG,US || Manual Bid || BFCM || COST CAP 71 || 1C || 15/11/24,SHARE,$0,1,2024-11-15,2025-03-27,132
356,CB_2024_Dec_FB_3608_LZ-DP_V02_4x5_IMG_EN_New_C-Headline_Evergreen_CTA-NONE_Angle-W_M-NONE_VL-None_G-NONE_P-OG_S-NONE,3608 - CB_IMG_ notion #17 hypnosis || Enhancements: OFF || CBV1 || Batch 1 || 1C || 13/01/25w03 || Kostas,SHARE,$0,1,2025-01-13,2025-02-03,21
357,CB_2025_Jan_FB_3718_CHUB_V09_4x5_IMG_EN_Opti_C-NONE_CTA-NONE_Angle-C_M-NONE_VL-None_TR-None_G-M_P-OG_S-NONE,3718 - Looking 15 people OPTI || Enhancements: OFF || CBV1 || Batch 3 || 1C || 29/01/25w05 || Kostas,SHARE,$0,1,2025-01-29,2025-02-06,8
358,CB_2023_May_FB_2103_MB_V02_9x16_VID_EN_Opti_C-Sale_CTA-SMR_Pain-W_M-JOG_VL-30s_TR-None_G-M-F_P-None_S-What,US || Manual Bid || BID CAP 111 || 1C || 21/12/24,VIDEO,$0,1,2024-12-28,2025-03-27,89
