,Ad Name,Adset Name,Creative Type,Spend In USD,Impressions,First Ad Spend Date,Last Ad Spend Date,Days ad spending
1,CB_2025_Jan_FB_3723_SO_V04_4x5_IMG_EN_New_C-NONE_Evergreen_CTA-SALE_Angle-W_M-NONE_VL-None_G-NONE_P-NONE_S-NONE,🌶️ || US || ASC+ || ->CC141 || VIDEO Only || US+CA || 0% EXISTING CAP || 7C || 07/08.24  Ad set,SHARE,"$19,661","1,603,477",2025-02-12,2025-03-27,43
2,Dynamic_Creative_CA_Flow,WC || CA || DYNAMIC CREATIVE || ADV+ audience || 7C || 17.04.2024 || BIG BUDGET,SHARE,"$12,418","703,658",2024-04-17,2025-02-27,316
3,CB_2025_Jan_FB_3779_VK-DP_V02_1x1_VID_EN_Opti_C-BulletPoints_Evergreen_CTA-70_Angle-W-B-C_M-NONE_VL-None_G-F_P-OG_S-NEW_FB3705V02,🌶️ || US || ASC+ || ->CC141 || VIDEO Only || US+CA || 0% EXISTING CAP || 7C || 07/08.24  Ad set,SHARE,"$12,020","761,205",2025-02-12,2025-03-19,35
4,CB_2025_Jan_FB_3718_CHUB_V05_4x5_IMG_EN_Opti_C-NONE_CTA-NONE_Angle-C_M-NONE_VL-None_TR-None_G-M_P-OG_S-NONE,🌶️ || US || ASC+ || ->CC141 || VIDEO Only || US+CA || 0% EXISTING CAP || 7C || 07/08.24  Ad set,SHARE,"$11,049","747,721",2025-02-12,2025-03-03,19
5,CB_2023_Apr_FB_1989_RS_V08_9x16_VID_EN_Opti_C-Trend_CTA-SMR_Pain-W_M-MIX_VL-30s_TR-None_G-MF_P-None,🌶️ || US || ASC+ || ->CC141 || VIDEO Only || US+CA || 0% EXISTING CAP || 7C || 07/08.24  Ad set,VIDEO,"$9,765","552,842",2024-08-07,2025-03-24,229
6,CB_2025_Feb_FB_3818_LZ-VU_V04_1x1_IMG_EN_Opti_C-Headline_Evergreen_CTA-NONE_Angle-Cort_M-NONE_VL-None_G-NONE_P-NONE_S-NONE_FB3251V01,🌶️ || US || ASC+ || ->CC141 || VIDEO Only || US+CA || 0% EXISTING CAP || 7C || 07/08.24  Ad set,SHARE,"$9,196","484,785",2025-02-17,2025-03-03,14
7,CB_2025_Jan_FB_3747_CHUB-AA_V03_9x16_IMG_EN_Opti_C-NONE_CTA-NONE_Angle-Sale_M-NONE_VL-None_TR-None_G-NONE_P-OG_S-NONE,🌶️ || US || ASC+ || ->CC141 || VIDEO Only || US+CA || 0% EXISTING CAP || 7C || 07/08.24  Ad set,SHARE,"$7,761","469,819",2025-02-20,2025-02-22,2
8,Dynamic_Creative_Statics_CA_Flow,WC || CA || DYNAMIC CREATIVE Static winners || ADV+ audience || 7C || 16.02.2025,SHARE,"$6,054","558,870",2025-02-16,2025-03-27,39
9,CB_2023_Jul_FB_2217_IB_V04_9x16_VID_EN_Opti_C-Pointing_CTA-SMR_Pain-W-B_M-TRC_VL-30s_TR-None_G-F_P-None_S-FRIGGA,🌶️ || US || ASC+ || ->CC141 || VIDEO Only || US+CA || 0% EXISTING CAP || 7C || 07/08.24  Ad set,VIDEO,"$5,667","218,718",2024-08-07,2025-03-27,232
10,CB_2023_Jul_FB_2284_DA_V05_9x16_VID_EN_Opti_C-Sale_CTA-SMR_Pain-W_M-JANW_VL-30s_TR-None_G-M_P-None_S-WHAT_FB2103V02,🌶️ || US || ASC+ || ->CC141 || VIDEO Only || US+CA || 0% EXISTING CAP || 7C || 07/08.24  Ad set,VIDEO,"$4,821","249,960",2024-08-07,2025-03-27,232
11,CB_2024_Aug_FB_3097_VK-DP_V03_9x16_VID_EN_Opti_C-Benefits_CTA-SMR_Pain-W-B_M-MIX_VL-45s_TR-None_G-MF_P-OG_S-WHAT_FB2516V13,🌶️ || US || ASC+ || ->CC141 || VIDEO Only || US+CA || 0% EXISTING CAP || 7C || 07/08.24  Ad set,VIDEO,"$4,608","245,340",2024-09-04,2025-03-27,204
12,CB_2025_Jan_FB_3723_SO_V07_4x5_IMG_EN_New_C-NONE_Evergreen_CTA-SALE_Angle-W_M-NONE_VL-None_G-NONE_P-NONE_S-NONE,🌶️ || US || ASC+ || ->CC141 || VIDEO Only || US+CA || 0% EXISTING CAP || 7C || 07/08.24  Ad set,SHARE,"$3,735","248,846",2025-02-04,2025-03-27,51
13,CB_2024_Aug_FB_3090_DT-DP_V02_9x16_VID_EN_Opti_C-MakingOf_CTA-CTA_Pain-W-B-C_M-POW_VL-45s_TR-None_G-M_P-OG_S-Moon_FB3029V04,🌶️ || US || ASC+ || ->CC141 || VIDEO Only || US+CA || 0% EXISTING CAP || 7C || 07/08.24  Ad set,VIDEO,"$3,502","155,750",2025-01-17,2025-03-03,45
14,CB_2025_Jan_FB_3740_SO-DP_V03_4x5_IMG_EN_Opti_C-Headline_Evergreen_CTA-NONE_Angle-W_M-NONE_VL-None_G-NONE_P-OG_S-NONE_3608V03,🌶️ || US || ASC+ || ->CC141 || VIDEO Only || US+CA || 0% EXISTING CAP || 7C || 07/08.24  Ad set,SHARE,"$3,442","209,794",2025-02-04,2025-03-03,27
15,CB_2025_Jan_FB_3766_SO_V01_4x5_IMG_EN_Opti_C-Headline_Evergreen_CTA-NONE_Angle-W-B-C_M-NONE_VL-None_G-NONE_P-NONE_S-NONE_3700V08,🌶️ || US || ASC+ || ->CC141 || VIDEO Only || US+CA || 0% EXISTING CAP || 7C || 07/08.24  Ad set,SHARE,"$3,257","297,385",2025-02-18,2025-02-27,9
16,CB_2023_Jul_FB_2226_MB_V04_9x16_VID_EN_Opti_C-Testim_CTA-SMR_Pain-W_M-MIX_VL-30s_TR-None_G-F_P-None_S-Starry,🌶️ || US || ASC+ || ->CC141 || VIDEO Only || US+CA || 0% EXISTING CAP || 7C || 07/08.24  Ad set,VIDEO,"$2,632","101,689",2024-10-28,2025-03-27,150
17,CB_2023_May_FB_2103_MB_V02_9x16_VID_EN_Opti_C-Sale_CTA-SMR_Pain-W_M-JOG_VL-30s_TR-None_G-M-F_P-None_S-What,US || Manual Bid || BFCM || ROAS GOAL: 1.4 || 1C || 15/11/24,VIDEO,"$2,474","84,391",2024-11-15,2025-02-27,104
18,CB_2024_Sep_FB_3175_DA-KB_V04_1x1_IMG_EN_New_C-ADVRT_Evergreen_CTA-NONE_Angle-W_M-NONE_VL-None_G-NONE_P-CBV2_S-NONE_blog_colonbroomvsmammoth_cv_en,CBV2 || Advantage+ || Advertorial || Higher pricing || US || 0% EXISTING CAP || BROAD || 7C || 20/01/25  Campaign Ad set,SHARE,"$2,437","92,737",2025-01-20,2025-03-27,66
19,CB_2025_Jan_FB_3742_SO-DP-KB_V06_4x5_IMG_EN_Opti_C-NONE_Evergreen_CTA-SALE_Angle-W_M-NONE_VL-None_G-NONE_P-CBV2_S-NONE3665V01,CBV2 || US || Manual Bid: ROAS GOAL: 1.00 -> 1.1 || 7DC || 22/01/2025,SHARE,"$2,170","100,882",2025-02-11,2025-03-27,44
20,CB_2024_Jan_FB_2764_RS_V04_9x16_VID_EN_Opti_C-SingleTesti_CTA-SALE_Pain-W_M-TRC_VL-45s_TR-None_G-F_P-OG_S-MOON_FB2263V04,EU (UK) || 2764 || Trinity Results Too Fast || 1C || 08/01/2025w02,VIDEO,"$1,990","70,257",2025-01-08,2025-03-27,78
21,CB_2025_Jan_FB_3723_SO_V18_4x5_IMG_EN_New_C-NONE_Evergreen_CTA-SALE_Angle-W_M-NONE_VL-None_G-NONE_P-NONE_S-NONE,🌶️ || US || ASC+ || ->CC141 || VIDEO Only || US+CA || 0% EXISTING CAP || 7C || 07/08.24  Ad set,SHARE,"$1,656","116,907",2025-02-12,2025-02-19,7
22,CB_2024_Nov_FB_3264_LZ_V29_4x5_VID_EN_Opti_C-NegativeMark_Sale_CTA-BF_Angle-W-B_M-LRNS_VL-30s_G-M_P-OG_S-NONE,🌶️ || US || ASC+ || ->CC141 || VIDEO Only || US+CA || 0% EXISTING CAP || 7C || 07/08.24  Ad set,VIDEO,"$1,632","73,662",2024-12-04,2025-03-27,113
23,CB_2025_Jan_FB_3723_SO_V18_4x5_IMG_EN_New_C-NONE_Evergreen_CTA-SALE_Angle-W_M-NONE_VL-None_G-NONE_P-NONE_S-NONE,3723 - Notion Idea #92 MAN BOOBS || Enhancements: OFF || CBV1 || Batch 4 || 1C || 28/01/25w05 || Kostas,SHARE,"$1,574","109,412",2025-01-28,2025-03-07,38
24,CB_2023_Aug_FB_2295_MB_V01_1x1_VID_EN_Opti_C-GIF_CTA-CTA_Pain-W-B_M-None_VL-10s_TR-None_G-None_P-None_S-None,CA || COST CAP 92->93 || 7C || 10/05/24 || V1,VIDEO,"$1,516","80,800",2024-05-10,2025-02-27,293
25,CB_2024_Sep_FB_3175_DA-KB_V03_1x1_IMG_EN_New_C-ADVRT_Evergreen_CTA-NONE_Angle-W_M-NONE_VL-None_G-NONE_P-CBV2_S-NONE_blog_colonbroomvsmammoth_cv_en,CBV2 || Advantage+ || Advertorial || Higher pricing || US || 0% EXISTING CAP || BROAD || 7C || 20/01/25  Campaign Ad set,SHARE,"$1,472","50,913",2025-01-20,2025-03-27,66
26,CB_2023_May_FB_2263_MB_V04_9x16_VID_EN_New_C-Sale_CTA-SMR_Pain-W_M-JOG_VL-45s_TR-None_G-M-F_P-None_S-Moon,🌶️ || US || ASC+ || ->CC141 || VIDEO Only || US+CA || 0% EXISTING CAP || 7C || 07/08.24  Ad set,VIDEO,"$1,391","44,921",2024-08-07,2025-03-27,232
27,CB_2024_Jan_FB_2764_RS_V04_9x16_VID_EN_Opti_C-SingleTesti_CTA-SALE_Pain-W_M-TRC_VL-45s_TR-None_G-F_P-OG_S-MOON_FB2263V04_Page_Personal_Coach,AU || Page: Branded & 3rd Party || 2764 || Trinity Results Too Fast || 1C || 10/01/2025w02,VIDEO,"$1,357","34,175",2025-01-10,2025-03-27,76
28,CB_2025_Jan_FB_3723_SO_V04_4x5_IMG_EN_New_C-NONE_Evergreen_CTA-SALE_Angle-W_M-NONE_VL-None_G-NONE_P-NONE_S-NONE,3723 - Notion Idea #92 MAN BOOBS || Enhancements: OFF || CBV1 || Batch 1 || 1C || 28/01/25w05 || Kostas,SHARE,"$1,256","80,091",2025-01-28,2025-02-21,24
29,CB_2025_Feb_FB_3827_LZ_V01_1x1_IMG_EN_Opti_C-Headline_Evergreen_CTA-NONE_Angle-W_M-NONE_VL-None_G-M_P-CBV2_S-NONE_FB3723V04,3827 - V2 img winner opti || Batch 1 || 7C || 18/02/2025w08,SHARE,"$1,222","95,523",2025-02-18,2025-02-25,7
30,CB_2025_Jan_FB_3705_VK_V02_4x5_IMG_EN_New_C-BulletPoints_Sale_CTA-NY_Angle-W-B-C_M-NONE_VL-None_G-NONE_P-OG_S-NONE,🌶️ || US || ASC+ || ->CC141 || VIDEO Only || US+CA || 0% EXISTING CAP || 7C || 07/08.24  Ad set,SHARE,"$1,141","61,579",2025-01-30,2025-02-19,20
31,CB_2025_Jan_FB_3779_VK-DP_V02_1x1_VID_EN_Opti_C-BulletPoints_Evergreen_CTA-70_Angle-W-B-C_M-NONE_VL-None_G-F_P-OG_S-NEW_FB3705V02,3779 - opti 3705 || Enhancements: OFF || CBV1 || Batch 1 || 1C || 04/02/25w06 || Kostas,SHARE,"$1,137","63,939",2025-02-04,2025-03-20,44
32,CB_2025_Feb_FB_3827_LZ_V04_1x1_IMG_EN_Opti_C-Headline_Evergreen_CTA-SALE_Angle-W_M-NONE_VL-None_G-M_P-CBV2_S-NONE_FB3779V02,CBV2 || US || Manual Bid: ROAS GOAL: 1.00 -> 1.1 || 7DC || 22/01/2025,SHARE,"$1,136","50,820",2025-02-18,2025-03-27,37
33,CB_2024_Jul_FB_3043_VK-DP_V03_9x16_VID_EN_Opti_C-Dance_CTA-SMR_Pain-W-B_M-POW_VL-30s_TR-None_G-M_P-OG_S-WHAT_FB3030V01,🌶️ || US || ASC+ || ->CC141 || VIDEO Only || US+CA || 0% EXISTING CAP || 7C || 07/08.24  Ad set,VIDEO,"$1,120","65,926",2024-08-27,2025-03-03,188
34,CB_2025_Jan_FB_3747_CHUB-AA_V03_9x16_IMG_EN_Opti_C-NONE_CTA-NONE_Angle-Sale_M-NONE_VL-None_TR-None_G-NONE_P-OG_S-NONE,3747 Clean Sale [HB winner ITR] CHUB || Enhancements: OFF || CBV1 || Batch ą || 1C || 02/02/25w06 || Kostas,SHARE,"$1,084","40,776",2025-02-02,2025-03-27,53
35,CB_2025_Feb_FB_3787_CHUB_V01_9x16_VID_EN_New_C-NONE_CTA-NONE_Angle-None_M-NONE_VL-None_TR-None_G-NONE_P-NONE_S-NONE,3787 - DadBod Messaging CHUB || Enhancements: OFF || CBV1 || Batch 1 || 7DC || 16/02/25w08 || Kostas,SHARE,"$1,075","40,121",2025-02-16,2025-02-24,8
36,CB_2025_Jan_FB_3656_JT_V02_4x5_IMG_EN_New_C-Headline_Seasonal_CTA-70_Angle-W_M-NONE_VL-None_G-NONE_P-OG_S-NONE,🌶️ || US || ASC+ || ->CC141 || VIDEO Only || US+CA || 0% EXISTING CAP || 7C || 07/08.24  Ad set,SHARE,$960,"42,391",2025-01-13,2025-03-04,50
37,CB_2025_Feb_FB_3787_CHUB_V01_9x16_VID_EN_New_C-NONE_CTA-NONE_Angle-None_M-NONE_VL-None_TR-None_G-NONE_P-NONE_S-NONE,🌶️ || US || ASC+ || ->CC141 || VIDEO Only || US+CA || 0% EXISTING CAP || 7C || 07/08.24  Ad set,VIDEO,$945,"53,539",2025-02-21,2025-03-19,26
38,CB_2023_Jul_FB_2217_IB_V04_9x16_VID_EN_Opti_C-Pointing_CTA-SMR_Pain-W-B_M-TRC_VL-30s_TR-None_G-F_P-None_S-FRIGGA,US || Manual Bid || BFCM || COST CAP 91 || 1C || 15/11/24,VIDEO,$926,"32,721",2024-11-15,2025-02-27,104
39,CB_2025_Jan_FB_3736_LZ-VU_V01_4x5_IMG_EN_Opti_C-NegativeMark_Evergreen_CTA-NONE_Angle-Cort_M-NONE_VL-None_G-NONE_P-NONE_S-NONE_FB3251V01,🌶️ || US || ASC+ || ->CC141 || VIDEO Only || US+CA || 0% EXISTING CAP || 7C || 07/08.24  Ad set,SHARE,$886,"35,616",2025-02-04,2025-02-17,13
40,CB_2023_Oct_FB_2516_VK_V13_9x16_VID_EN_Opti_C-Benefits_CTA-AUTUM_Pain-W-B_M-PASQ_VL-30s_TR-None_G-M_P-Plan_S-WHAT,🌶️ || US || ASC+ || ->CC141 || VIDEO Only || US+CA || 0% EXISTING CAP || 7C || 07/08.24  Ad set,VIDEO,$850,"31,401",2024-12-19,2025-03-27,98
41,CB_2025_Jan_FB_3718_CHUB_V05_4x5_IMG_EN_Opti_C-NONE_CTA-NONE_Angle-C_M-NONE_VL-None_TR-None_G-M_P-OG_S-NONE,3718_CHUB || Batch 1 || 7DC || 12/02/2025w07,SHARE,$838,"53,144",2025-02-12,2025-02-25,13
42,CB_2024_Jan_FB_2784_RS_V02_9x16_VID_EN_Opti_C-Pointing_CTA-SALE_Pain-W_M-JOG_VL-30s_TR-None_G-F_P-OG_S-OLLIE_FB2181V01,CBV2 || EU (UK) || 💰 Advantage+ || US || BROAD || 7C || Existing_customer_5% || 15/12/24 Ad set,VIDEO,$812,"33,902",2025-01-09,2025-03-27,77
43,CB_2025_Feb_FB_3818_LZ-VU_V04_1x1_IMG_EN_Opti_C-Headline_Evergreen_CTA-NONE_Angle-Cort_M-NONE_VL-None_G-NONE_P-NONE_S-NONE_FB3251V01,3818 - It_s not cheap Months+holidays: April || Enhancements: OFF || CBV1 || Batch 1 || 7DC || 13/02/25w07 || Kostas,SHARE,$804,"31,224",2025-02-13,2025-02-28,15
44,CB_2024_Feb_FB_2814_MB-DP_V05_1x1_IMG_EN_New_C-WeightLoss_CTA-None_Pain-W-B-C_M-NONE_VL-None_TR-None_G-NONE_P-V2_S-NONE,EU (UK) || clinically proven opti || 1C || 23/01/2025w04,SHARE,$676,"29,641",2025-01-23,2025-03-10,46
45,CB_2025_Feb_FB_3827_LZ_V04_1x1_IMG_EN_Opti_C-Headline_Evergreen_CTA-SALE_Angle-W_M-NONE_VL-None_G-M_P-CBV2_S-NONE_FB3779V02,3827 - V2 img winner opti || Batch 2 || 7C || 18/02/2025w08,SHARE,$645,"40,466",2025-02-18,2025-02-25,7
46,CB_2025_Feb_FB_3827_LZ_V01_1x1_IMG_EN_Opti_C-Headline_Evergreen_CTA-NONE_Angle-W_M-NONE_VL-None_G-M_P-CBV2_S-NONE_FB3723V04,CBV2 || US || Manual Bid: ROAS GOAL: 1.00 -> 1.1 || 7DC || 22/01/2025,SHARE,$621,"34,364",2025-02-18,2025-03-27,37
47,CB_2025_Feb_FB_3819_DT_V02_9x16_GIF_EN_Opti_C-NONE_Evergreen_CTA-None_Angle-W_M-NONE_VL-None_G-NONE_P-NONE_S-New_FB3723V04,3819 - #7 Goodbye Man boobs || Enhancements: OFF || CBV1 || Batch 1 || 7DC || 14/02/25w07 || Kostas,SHARE,$616,"33,266",2025-02-14,2025-02-22,8
48,CB_2025_Jan_FB_3738_SO-DP_V04_4x5_IMG_EN_Opti_C-NONE_Evergreen_CTA-SALE_Angle-W_M-NONE_VL-None_G-NONE_P-NONE_S-NONE3665V01,3738 - 3665_V01 OPTI || Enhancements: OFF || CBV1 || Batch 1 || 1C || 29/01/25w05 || Kostas,SHARE,$603,"35,895",2025-01-29,2025-02-22,24
49,CB_2025_Jan_FB_3738_SO-DP_V03_4x5_IMG_EN_Opti_C-NONE_Evergreen_CTA-SALE_Angle-W_M-NONE_VL-None_G-NONE_P-NONE_S-NONE3665V01,3738 - 3665_V01 OPTI || Enhancements: OFF || CBV1 || Batch 1 || 1C || 29/01/25w05 || Kostas,SHARE,$597,"36,411",2025-01-29,2025-02-22,24
50,CB_2025_Jan_FB_3723_SO_V07_4x5_IMG_EN_New_C-NONE_Evergreen_CTA-SALE_Angle-W_M-NONE_VL-None_G-NONE_P-NONE_S-NONE,CBV2 || US || Manual Bid: ROAS GOAL: 1.00 -> 1.1 || 7DC || 22/01/2025,SHARE,$593,"31,057",2025-02-11,2025-03-27,44
51,CB_2025_Feb_FB_3827_LZ_V04_1x1_IMG_EN_Opti_C-Headline_Evergreen_CTA-SALE_Angle-W_M-NONE_VL-None_G-M_P-CBV2_S-NONE_FB3779V02,3827 - V2 img winner opti || Batch 2 || 7C || 18/02/2025w08,SHARE,$585,"37,320",2025-02-18,2025-03-07,17
52,CB_2022_Nov_FB_1218_RS_V15_9x16_IMG_EN_Opti_C-Sale_CTA-BLACK_Pain-W_M-NONE_VL-None FB1671V08,US || Manual Bid || BFCM || ROAS GOAL: 1.4 || 1C || 15/11/24,SHARE,$576,"15,670",2024-11-15,2025-02-27,104
53,CB_2025_Feb_FB_3821_SO-KB-JG_V13_4x5_IMG_EN_Opti_C-NONE_Evergreen_CTA-SALE_Angle-W_M-NONE_VL-None_G-NONE_P-NONE_S-NONE_FB3723V07,3812 - 3723 Man Boobs Opti || Enhancements: OFF || CBV1 || Batch 4 || 7C || 19/02/25w08 || Kostas,SHARE,$574,"34,986",2025-02-18,2025-02-24,6
54,CB_2025_Feb_FB_3793_VK-DP_V01_1x1_VID_EN_Opti_C-BulletPoints_Evergreen_CTA-70_Angle-W-B-C_M-NONE_VL-None_G-F_P-OG_S-NEW_FB3705V02,3793 -  3705 test opti || Enhancements: OFF || CBV1 || Batch 1 || 1C || 11/02/25w07 || Kostas,SHARE,$523,"23,800",2025-02-11,2025-02-28,17
55,CB_2025_Jan_FB_3766_SO_V01_4x5_IMG_EN_Opti_C-Headline_Evergreen_CTA-NONE_Angle-W-B-C_M-NONE_VL-None_G-NONE_P-NONE_S-NONE_3700V08,3766 - 3700 copy opti || Enhancements: OFF || CBV1 || Batch 1 || 1C || 03/02/25w06 || Kostas,SHARE,$522,"29,723",2025-02-04,2025-02-22,18
56,CB_2024_Nov_FB_3336_CH_V17_1x1_IMG_EN_Opti_C-Headline_CTA-NONE_Angle-C_P-NONE,3336 Creative Hub – Golden nuggets V1 - Opti [Not tested] || Enhancements: OFF || CBV1 || Batch 1 || 1C || 11/02/25w07 || Kostas,SHARE,$514,"31,262",2025-02-11,2025-02-21,10
57,CB_2025_Feb_FB_3799_SO-KB_V07_1x1_IMG_EN_New_C-A-Compare_Evergreen_CTA-NONE_Angle-W_M-NONE_VL-None_G-NONE_P-OG_S-NONE,3799 - Don_t change your habits || Enhancements: OFF || CBV1 || Batch 2 || 7DC || 12/02/25w07 || Kostas,SHARE,$510,"16,039",2025-02-12,2025-02-21,9
58,CB_2025_Feb_FB_3811_DT_V04_9x16_VID_EN_Opti_C-Sale_Sale_CTA-70_Angle-W_M-JOG_VL-45s_G-M-F_P-OG_S-Moon_FB2263V04,3811 - #133 Green screen timeframe hooks || Enhancements: OFF || CBV1 || Batch 1 || 7C || 19/02/25w08 || Kostas,VIDEO,$504,"14,306",2025-02-19,2025-03-11,20
59,CB_2025_Jan_FB_3723_SO_V17_4x5_IMG_EN_New_C-NONE_Evergreen_CTA-SALE_Angle-W_M-NONE_VL-None_G-NONE_P-NONE_S-NONE,3723 - Notion Idea #92 MAN BOOBS || Enhancements: OFF || CBV1 || Batch 4 || 1C || 28/01/25w05 || Kostas,SHARE,$475,"31,175",2025-01-28,2025-03-07,38
60,CB_2025_Feb_FB_3817_SO_V01_4x5_IMG_EN_Opti_C-NONE_Evergreen_CTA-SALE_Angle-W_M-NONE_VL-None_G-NONE_P-NONE_S-NONE_FB3723V07,CBV2 || AU || 💰 Advantage+ || US || BROAD || 7C || Existing_customer_5% || 19/12/24 Ad set,SHARE,$461,"28,254",2025-02-14,2025-03-27,41
61,CB_2025_Feb_FB_3812_SO_V03_4x5_IMG_EN_Opti_C-NONE_Evergreen_CTA-SALE_Angle-W_M-NONE_VL-None_G-NONE_P-NONE_S-NONE_FB3723V07,3812 - 3723 Man Boobs Opti || Enhancements: OFF || CBV1 || Batch 1 || 1C || 11/02/25w07 || Kostas,SHARE,$450,"29,303",2025-02-11,2025-02-26,15
62,CB_2024_Dec_FB_3601_VK-DP_V09_4x5_VID_EN_Opti_C-Dance_CTA-NY_Pain-W-B_M-JOG_VL-30s_TR-None_G-F_P-OG_S-WHAT_FB3045V01,CBV2 || AU || 💰 Advantage+ || US || BROAD || 7C || Existing_customer_5% || 19/12/24 Ad set,SHARE,$434,"14,424",2025-01-03,2025-03-27,83
63,CB_2025_Jan_FB_3662_CHUB_V01_1x1_IMG_EN_New_C-NONE_CTA-NONE_Angle-C_M-NONE_VL-None_TR-None_G-NONE_P-NONE_S-NONE.jpg,🌶️ || US || ASC+ || ->CC141 || VIDEO Only || US+CA || 0% EXISTING CAP || 7C || 07/08.24  Ad set,SHARE,$426,"23,154",2025-01-13,2025-03-04,50
64,CB_2024_Dec_FB_3619_VK-JT_V02_4x5_VID_EN_New_C-BulletPoints_Sale_CTA-NY_Angle-W-B-C_M-NONE_VL-None_G-NONE_P-OG_S-NONE,🌶️ || US || ASC+ || ->CC141 || VIDEO Only || US+CA || 0% EXISTING CAP || 7C || 07/08.24  Ad set,SHARE,$425,"22,060",2024-12-27,2025-03-27,90
65,CB_2025_Feb_FB_3817_SO_V01_4x5_IMG_EN_Opti_C-NONE_Evergreen_CTA-SALE_Angle-W_M-NONE_VL-None_G-NONE_P-NONE_S-NONE_FB3723V07,3817 - Opti Colonbroom premium bottle FB3723V07|| 7DC || 12/02/2025w07,SHARE,$424,"36,688",2025-02-12,2025-02-20,8
66,CB_2025_Jan_FB_3718_CHUB_V05_4x5_IMG_EN_Opti_C-NONE_CTA-NONE_Angle-C_M-NONE_VL-None_TR-None_G-M_P-OG_S-NONE,3718_CHUB || Batch 1 || 7DC || 12/02/2025w07,SHARE,$423,"20,655",2025-02-12,2025-02-20,8
67,CB_2025_Feb_FB_3816_VK-JT_V04_1x1_IMG_EN_New_C-BulletPoints_Evergreen_CTA-70_Angle-W-B-C_M-JOG_VL-None_G-NONE_P-OG_S-NEW_FB3656V02,3822 - OPTI 3656 -VK || Enhancements: OFF || CBV1 || Batch 1 || 7C || 19/02/25w08 || Kostas,SHARE,$415,"17,978",2025-02-19,2025-02-25,6
68,CB_2024_Sep_FB_3175_DA-KB_V01_1x1_IMG_EN_New_C-ADVRT_Evergreen_CTA-NONE_Angle-W_M-NONE_VL-None_G-NONE_P-CBV2_S-NONE_blog_colonbroomvsmammoth_cv_en,CBV2 || Advantage+ || Advertorial || Higher pricing || US || 0% EXISTING CAP || BROAD || 7C || 20/01/25  Campaign Ad set,SHARE,$412,"16,658",2025-01-20,2025-03-27,66
69,CB_2025_Feb_FB_3782_CHUB_V04_9x16_VID_EN_New_C-NONE_CTA-NONE_Angle-None_M-NONE_VL-None_TR-None_G-NONE_P-NONE_S-NONE,3782 - Political weight loss journey CHUB || Enhancements: OFF || CBV1 || Batch 2 || 1C || 06/02/25w06 || Kostas,VIDEO,$404,"18,056",2025-02-06,2025-02-21,15
70,CB_2023_Jul_FB_2217_IB_V04_9x16_VID_EN_Opti_C-Pointing_CTA-SMR_Pain-W-B_M-TRC_VL-30s_TR-None_G-F_P-None_S-FRIGGA,CBV2 || AU || 💰 Advantage+ || US || BROAD || 7C || Existing_customer_5% || 19/12/24 Ad set,VIDEO,$401,"10,863",2024-12-19,2025-03-24,95
71,CB_2025_Feb_FB_3817_SO_V01_4x5_IMG_EN_Opti_C-NONE_Evergreen_CTA-SALE_Angle-W_M-NONE_VL-None_G-NONE_P-NONE_S-NONE_FB3723V07,3817 - Opti Colonbroom premium bottle FB3723V07 || Batch 1 || 7DC || 12/02/2025w07,SHARE,$399,"33,037",2025-02-12,2025-02-20,8
72,CB_2025_Feb_FB_3821_SO-KB-JG_V11_4x5_IMG_EN_Opti_C-NONE_Evergreen_CTA-SALE_Angle-W_M-NONE_VL-None_G-NONE_P-NONE_S-NONE_FB3723V07,3821 - Man boobs Opti || Enhancements: OFF || CBV1 || Batch 3 || 7C || 19/02/25w08 || Kostas,SHARE,$393,"25,006",2025-02-19,2025-03-09,18
73,CB_2023_Dec_FB_2712_RS-DP_V02_1x1_VID_EN_Opti_C-WrittenTesti_CTA-SALE_Pain-W-B-C_M-NONE_VL-None_TR-None_G-NONE_P-V2_S-NONE_FB2227V08,CBV2 || EU (UK) || 💰 Advantage+ || US || BROAD || 7C || Existing_customer_5% || 15/12/24 Ad set,SHARE,$387,"16,415",2024-12-15,2025-03-27,102
74,CB_2025_Jan_FB_3777_CHUB-KZ_V03_4x5_IMG_EN_Opti_C-NONE_CTA-NONE_Angle-C_M-NONE_VL-None_TR-None_G-NONE_P-NONE_S-NONE,3777 - 3696 Opti || Enhancements: OFF || CBV1 || Batch 1 || 1C || 11/02/25w07 || Kostas,SHARE,$386,"20,458",2025-02-11,2025-02-21,10
75,CB_2025_Jan_FB_3723_SO_V01_4x5_IMG_EN_New_C-NONE_Evergreen_CTA-SALE_Angle-W_M-NONE_VL-None_G-NONE_P-NONE_S-NONE,3723 - Notion Idea #92 MAN BOOBS || Enhancements: OFF || CBV1 || Batch 1 || 1C || 28/01/25w05 || Kostas,SHARE,$383,"28,033",2025-01-28,2025-02-24,27
76,CB_2025_Feb_FB_3784_SO-RP_V07_4x5_IMG_EN_Opti_C-Headline_Evergreen_CTA-NONE_Angle-W_M-NONE_VL-None_G-NONE_P-OG_S-NONE_FB3726V01,3784 - 3726 ad copy opti || Enhancements: OFF || CBV1 || Batch 2 || 1C || 09/02/25w07 || Kostas,SHARE,$370,"17,970",2025-02-09,2025-02-26,17
77,CB_2024_Aug_FB_3090_DT-DP_V02_9x16_VID_EN_Opti_C-MakingOf_CTA-CTA_Pain-W-B-C_M-POW_VL-45s_TR-None_G-M_P-OG_S-Moon_FB3029V04,CBV2 || EU (UK) || 💰 Advantage+ || US || BROAD || 7C || Existing_customer_5% || 15/12/24 Ad set,SHARE,$359,"17,313",2024-12-19,2025-03-27,98
78,CB_2022_Mar3_FB_713_IK_V04_1x1_IMG_EN_Opti_C-WrittenTesti_HE-98_A-ExtremeBodyVisualization_HK-bodypart_Pain-W_CLR-PURPLE_BG-IMAGE_ME-MIX_MA-YOUNG,US || Manual Bid || BFCM || ROAS GOAL: 1.4 || 1C || 15/11/24,SHARE,$337,"12,662",2024-11-15,2025-02-27,104
79,CB_2024_Oct_FB_3252_VK-DP_V04_4x5_VID_EN_Opti_C-MakingOf_Evergreen_CTA-SALE_Angle-W-B-C_M-JOG_VL-45s_G-F_P-OG_S-MOON_FB3090V02,🌶️ || US || ASC+ || ->CC141 || VIDEO Only || US+CA || 0% EXISTING CAP || 7C || 07/08.24  Ad set,VIDEO,$337,"15,729",2024-11-07,2025-03-27,140
80,CB_2023_Jul_FB_2217_IB_V04_9x16_VID_EN_Opti_C-Pointing_CTA-SMR_Pain-W-B_M-TRC_VL-30s_TR-None_G-F_P-None_S-FRIGGA,CBV2 || EU (UK) || 💰 Advantage+ || US || BROAD || 7C || Existing_customer_5% || 15/12/24 Ad set,VIDEO,$335,"16,289",2024-12-18,2025-03-27,99
81,CB_2023_May_FB_2263_MB_V04_9x16_VID_EN_New_C-Sale_CTA-SMR_Pain-W_M-JOG_VL-45s_TR-None_G-M-F_P-None_S-Moon,CBV2 || AU || 💰 Advantage+ || US || BROAD || 7C || Existing_customer_5% || 19/12/24 Ad set,VIDEO,$332,"9,789",2024-12-19,2025-03-27,98
82,CB_2025_Jan_FB_3718_CHUB_V05_4x5_IMG_EN_Opti_C-NONE_CTA-NONE_Angle-C_M-NONE_VL-None_TR-None_G-M_P-OG_S-NONE,3718 - Looking 15 people OPTI || Enhancements: OFF || CBV1 || Batch 2 || 1C || 29/01/25w05 || Kostas,SHARE,$326,"20,788",2025-01-29,2025-02-20,22
83,CB_2025_Feb_FB_3820_LZ_V02_9x16_VID_EN_Opti_C-Testimonial_Evergreen_CTA-SALE_Angle-W-B-C_M-TRC_VL-30s_G-F_P-OG_S-FRIGGA_FB2217V04_1,3820 - Calorie deficit hooks || Enhancements: OFF || CBV1 || Batch 1 || 7C || 19/02/25w08 || Kostas,VIDEO,$312,"11,815",2025-02-19,2025-02-24,5
84,CB_2025_Feb_FB_3817_SO_V01_4x5_IMG_EN_Opti_C-NONE_Evergreen_CTA-SALE_Angle-W_M-NONE_VL-None_G-NONE_P-NONE_S-NONE_FB3723V07,CBV2 || EU (UK) || 💰 Advantage+ || US || BROAD || 7C || Existing_customer_5% || 15/12/24 Ad set,SHARE,$310,"18,655",2025-02-14,2025-03-27,41
85,CB_2025_Feb_FB_3812_SO_V12_4x5_IMG_EN_Opti_C-NONE_Evergreen_CTA-SALE_Angle-W_M-NONE_VL-None_G-NONE_P-NONE_S-NONE_FB3723V07,3812 - 3723 Man Boobs Opti || Enhancements: OFF || CBV1 || Batch 3 || 1C || 11/02/25w07 || Kostas,SHARE,$300,"17,780",2025-02-11,2025-02-22,11
86,CB_2025_Jan_FB_3655_DT-JT_V02_9x16_VID_EN_New_C-Educational_Sale_CTA-NY_Angle-W_M-MIX_VL-45s_G-MF_P-OG_S-NEW,3655 - CB PODCAST EDU BRIEF - NYNM || Enhancements: OFF || CBV1 || Batch 1 || 7C || 19/02/25w08 || Kostas,VIDEO,$296,"12,978",2025-02-19,2025-02-22,3
87,CB_2023_Dec_FB_2712_RS-DP_V02_1x1_VID_EN_Opti_C-WrittenTesti_CTA-SALE_Pain-W-B-C_M-NONE_VL-None_TR-None_G-NONE_P-V2_S-NONE_FB2227V08,CBV2 || AU || 💰 Advantage+ || US || BROAD || 7C || Existing_customer_5% || 19/12/24 Ad set,SHARE,$293,"9,546",2024-12-19,2025-03-27,98
88,CB_2025_Feb_FB_3812_SO_V07_4x5_IMG_EN_Opti_C-NONE_Evergreen_CTA-SALE_Angle-W_M-NONE_VL-None_G-NONE_P-NONE_S-NONE_FB3723V07,3812 - 3723 Man Boobs Opti || Enhancements: OFF || CBV1 || Batch 2 || 1C || 11/02/25w07 || Kostas,SHARE,$279,"19,340",2025-02-11,2025-02-21,10
89,CB_2025_Jan_FB_3736_LZ-VU_V01_4x5_IMG_EN_Opti_C-NegativeMark_Evergreen_CTA-NONE_Angle-Cort_M-NONE_VL-None_G-NONE_P-NONE_S-NONE_FB3251V01,3750 - bioma ripoff march soft version || Enhancements: OFF || CBV1 || Batch 1 || 1C || 24/01/25w04 || Kostas,SHARE,$272,"7,935",2025-02-04,2025-02-18,14
90,CB_2025_Feb_FB_3812_SO_V05_4x5_IMG_EN_Opti_C-NONE_Evergreen_CTA-SALE_Angle-W_M-NONE_VL-None_G-NONE_P-NONE_S-NONE_FB3723V07,3812 - 3723 Man Boobs Opti || Enhancements: OFF || CBV1 || Batch 5 || 7C || 19/02/25w08 || Kostas,SHARE,$256,"18,254",2025-02-19,2025-02-24,5
91,CB_2024_Jan_FB_2764_RS_V04_9x16_VID_EN_Opti_C-SingleTesti_CTA-SALE_Pain-W_M-TRC_VL-45s_TR-None_G-F_P-OG_S-MOON_FB2263V04_Page_Personal_Coach,CBV2 || AU || 💰 Advantage+ || US || BROAD || 7C || Existing_customer_5% || 19/12/24 Ad set,VIDEO,$256,"5,071",2025-01-16,2025-03-27,70
92,CB_2023_May_FB_2103_MB_V02_9x16_VID_EN_Opti_C-Sale_CTA-SMR_Pain-W_M-JOG_VL-30s_TR-None_G-M-F_P-None_S-What,US || Manual Bid || BFCM || COST CAP 91 || 1C || 15/11/24,VIDEO,$239,"8,308",2024-11-15,2025-02-27,104
93,CB_2025_Feb_FB_3821_SO-KB-JG_V03_4x5_IMG_EN_Opti_C-NONE_Evergreen_CTA-SALE_Angle-W_M-NONE_VL-None_G-NONE_P-NONE_S-NONE_FB3723V07,3821 - Man boobs Opti || Enhancements: OFF || CBV1 || Batch 1 || 7C || 19/02/25w08 || Kostas,SHARE,$239,"13,943",2025-02-19,2025-02-22,3
94,CB_2023_Dec_FB_2696_RS_V03_9x16_VID_EN_Opti_C-Sale_CTA-NY65_Pain-W-B_M-JANW_VL-30s_TR-None_G-M_P-OG_S-WHAT_FB2284V05,CBV2 || AU || 💰 Advantage+ || US || BROAD || 7C || Existing_customer_5% || 19/12/24 Ad set,VIDEO,$239,"9,080",2025-01-13,2025-03-27,73
95,CB_2025_Jan_FB_3741_LZ-JG_V01_4x5_IMG_EN_Opti_C-Headline_Evergreen_CTA-NONE_Angle-W_M-NONE_VL-None_G-NONE_P-CBV2_S-NONE_FB3357V01,AU || 3741 - V2 dom perignon 2 || 1C || 29/01/2025w05,SHARE,$235,"9,009",2025-01-30,2025-02-20,21
96,CB_2025_Feb_FB_3812_SO_V01_4x5_IMG_EN_Opti_C-NONE_Evergreen_CTA-SALE_Angle-W_M-NONE_VL-None_G-NONE_P-NONE_S-NONE_FB3723V07,3812 - 3723 Man Boobs Opti || Enhancements: OFF || CBV1 || Batch 1 || 1C || 11/02/25w07 || Kostas,SHARE,$223,"17,572",2025-02-11,2025-02-26,15
97,CB_2024_Sep_FB_3175_DA-KB_V02_1x1_IMG_EN_New_C-ADVRT_Evergreen_CTA-NONE_Angle-W_M-NONE_VL-None_G-NONE_P-CBV2_S-NONE_blog_colonbroomvsmammoth_cv_en,CBV2 || Advantage+ || Advertorial || Higher pricing || US || 0% EXISTING CAP || BROAD || 7C || 20/01/25  Campaign Ad set,SHARE,$217,"11,104",2025-01-20,2025-03-27,66
98,CB_2025_Feb_FB_3820_LZ_V01_9x16_VID_EN_Opti_C-Testimonial_Evergreen_CTA-SALE_Angle-W-B-C_M-TRC_VL-30s_G-F_P-OG_S-FRIGGA_FB2217V04,3820 - Calorie deficit hooks || Enhancements: OFF || CBV1 || Batch 1 || 7C || 19/02/25w08 || Kostas,VIDEO,$205,"10,755",2025-02-19,2025-02-26,7
99,CB_2025_Jan_FB_3798_CHUB_V01_9x16_VID_EN_New_C-NONE_CTA-NONE_Angle-None_M-NONE_VL-None_TR-None_G-NONE_P-NONE_S-NONE,3798 - ConfusedDog CHUB 2 || Enhancements: OFF || CBV1 || Batch 1 || 7DC || 16/02/25w08 || Kostas,VIDEO,$202,"11,786",2025-02-16,2025-02-20,4
100,CB_2025_Feb_FB_3784_SO-RP_V10_4x5_IMG_EN_Opti_C-Headline_Evergreen_CTA-NONE_Angle-W_M-NONE_VL-None_G-NONE_P-OG_S-NONE_FB3726V01,3784 - 3726 ad copy opti || Enhancements: OFF || CBV1 || Batch 2 || 1C || 09/02/25w07 || Kostas,SHARE,$192,"9,579",2025-02-09,2025-02-26,17
101,CB_2025_Feb_FB_3812_SO_V04_4x5_IMG_EN_Opti_C-NONE_Evergreen_CTA-SALE_Angle-W_M-NONE_VL-None_G-NONE_P-NONE_S-NONE_FB3723V07,3812 - 3723 Man Boobs Opti || Enhancements: OFF || CBV1 || Batch 1 || 1C || 11/02/25w07 || Kostas,SHARE,$188,"11,913",2025-02-11,2025-02-26,15
102,CB_2025_Feb_FB_3812_SO_V08_4x5_IMG_EN_Opti_C-NONE_Evergreen_CTA-SALE_Angle-W_M-NONE_VL-None_G-NONE_P-NONE_S-NONE_FB3723V07,3812 - 3723 Man Boobs Opti || Enhancements: OFF || CBV1 || Batch 2 || 1C || 11/02/25w07 || Kostas,SHARE,$187,"11,791",2025-02-11,2025-02-21,10
103,CB_2023_May_FB_2144_MB_V02_9x16_VID_EN_Opti_C-Sale_CTA-SMR_Pain-W_M-JOG_VL-30s_TR-None_G-M-F_P-None_S-What,CA || COST CAP 92->93 || 7C || 10/05/24 || V1,VIDEO,$184,"11,493",2024-05-10,2025-02-27,293
104,CB_2025_Feb_FB_3813_SO_V01_9x16_VID_EN_New_C-NONE_Evergreen_CTA-NONE_Angle-W_M-NONE_VL-30s_G-None_P-OG_S-NEW,3813 - Notion Ideas #142 “Plate Saturation” || Enhancements: OFF || CBV1 || Batch 1 || 7C || 19/02/25w08 || Kostas,SHARE,$184,"7,449",2025-02-19,2025-02-22,3
105,CB_2025_Jan_FB_3723_SO_V02_4x5_IMG_EN_New_C-NONE_Evergreen_CTA-SALE_Angle-W_M-NONE_VL-None_G-NONE_P-NONE_S-NONE,3723 - Notion Idea #92 MAN BOOBS || Enhancements: OFF || CBV1 || Batch 1 || 1C || 28/01/25w05 || Kostas,SHARE,$176,"15,167",2025-01-28,2025-02-24,27
106,CB_2025_Feb_FB_3806_SO-KB_V03_1x1_IMG_EN_New_C-A-Compare_Evergreen_CTA-NONE_Angle-W_M-NONE_VL-None_G-NONE_P-OG_S-NONE,"3806 - Brief Results, not resolutions || Enhancements: OFF || CBV1 || Batch 1 || 7DC || 12/02/25w07 || Kostas",SHARE,$175,"6,274",2025-02-12,2025-02-18,6
107,CB_2025_Feb_FB_3815_LZ_V01_9x16_VID_EN_New_C-Testimonial_Evergreen_CTA-SALE_Angle-GH_M-NONE_VL-15s_G-M_P-NONE_S-NEW,3815 - #129 Notion idea how it feels || Enhancements: OFF || CBV1 || Batch 1 || 7C || 19/02/25w08 || Kostas,VIDEO,$174,"10,760",2025-02-19,2025-02-22,3
108,CB_2025_Feb_FB_3812_SO_V07_4x5_IMG_EN_Opti_C-NONE_Evergreen_CTA-SALE_Angle-W_M-NONE_VL-None_G-NONE_P-NONE_S-NONE_FB3723V07,3812 - 3723 Man Boobs Opti || Enhancements: OFF || CBV1 || Batch 5 || 7C || 19/02/25w08 || Kostas,SHARE,$169,"10,633",2025-02-19,2025-02-24,5
109,CB_2025_Jan_FB_3723_SO_V10_4x5_IMG_EN_New_C-NONE_Evergreen_CTA-SALE_Angle-W_M-NONE_VL-None_G-NONE_P-NONE_S-NONE,3723 - Notion Idea #92 MAN BOOBS || Enhancements: OFF || CBV1 || Batch 2 || 1C || 28/01/25w05 || Kostas,SHARE,$169,"11,210",2025-01-28,2025-02-18,21
110,CB_2024_Nov_FB_3264_LZ_V31_4x5_VID_EN_Opti_C-MakingOf_Sale_CTA-BF_Angle-W-B_M-CRAZY_VL-45s_G-M_P-OG_S-NEW_FB3004V02,CBV2 || EU (UK) || 💰 Advantage+ || US || BROAD || 7C || Existing_customer_5% || 15/12/24 Ad set,VIDEO,$169,"7,882",2024-12-19,2025-03-27,98
111,CB_2025_Feb_FB_3799_SO-KB_V03_1x1_IMG_EN_New_C-A-Compare_Evergreen_CTA-NONE_Angle-W_M-NONE_VL-None_G-NONE_P-OG_S-NONE,3799 - Don_t change your habits || Enhancements: OFF || CBV1 || Batch 1 || 7DC || 12/02/25w07 || Kostas,SHARE,$168,"6,916",2025-02-12,2025-02-18,6
112,CB_2025_Jan_FB_3742_SO-DP-KB_V06_4x5_IMG_EN_Opti_C-NONE_Evergreen_CTA-SALE_Angle-W_M-NONE_VL-None_G-NONE_P-CBV2_S-NONE3665V01,3742 -  3665_V01 OPTI for PREMIUM 2 || Batch 2 || 1C || 31/01/2025w05,SHARE,$161,"9,022",2025-01-31,2025-02-18,18
113,CB_2024_Dec_FB_3592_VK-DP_V10_4x5_VID_EN_New_C-BulletPoints_Sale_CTA-SALE_Angle-W-B-C_M-NONE_VL-30s_G-F_P-OG_S-NEW - Copy,🌶️ || US || ASC+ || ->CC141 || VIDEO Only || US+CA || 0% EXISTING CAP || 7C || 07/08.24  Ad set,VIDEO,$161,"7,372",2024-12-21,2025-03-27,96
114,CB_2024_Feb_FB_2814_MB-DP_V07_1x1_IMG_EN_New_C-WeightLoss_CTA-CTA_Pain-W-B-C_M-NONE_VL-None_TR-None_G-F_P-V2_S-NONE_2410V06,EU (UK) || clinically proven opti || 1C || 23/01/2025w04,SHARE,$158,"6,630",2025-01-23,2025-03-10,46
115,CB_2025_Feb_FB_3812_SO_V10_4x5_IMG_EN_Opti_C-NONE_Evergreen_CTA-SALE_Angle-W_M-NONE_VL-None_G-NONE_P-NONE_S-NONE_FB3723V07,3812 - 3723 Man Boobs Opti || Enhancements: OFF || CBV1 || Batch 3 || 1C || 11/02/25w07 || Kostas,SHARE,$156,"9,943",2025-02-11,2025-02-22,11
116,CB_2025_Jan_FB_3742_SO-DP-KB_V06_4x5_IMG_EN_Opti_C-NONE_Evergreen_CTA-SALE_Angle-W_M-NONE_VL-None_G-NONE_P-CBV2_S-NONE3665V01,CBV2 || EU (UK) || 💰 Advantage+ || US || BROAD || 7C || Existing_customer_5% || 15/12/24 Ad set,SHARE,$156,"7,217",2025-02-18,2025-03-18,28
117,CB_2025_Feb_FB_3812_SO_V11_4x5_IMG_EN_Opti_C-NONE_Evergreen_CTA-SALE_Angle-W_M-NONE_VL-None_G-NONE_P-NONE_S-NONE_FB3723V07,3812 - 3723 Man Boobs Opti || Enhancements: OFF || CBV1 || Batch 3 || 1C || 11/02/25w07 || Kostas,SHARE,$155,"11,200",2025-02-11,2025-02-22,11
118,CB_2025_Feb_FB_3813_SO_V05_9x16_VID_EN_New_C-NONE_Evergreen_CTA-NONE_Angle-W_M-NONE_VL-30s_G-None_P-OG_S-NEW,3813 - Notion Ideas #142 “Plate Saturation” || Enhancements: OFF || CBV1 || Batch 2 || 7C || 19/02/25w08 || Kostas,SHARE,$144,"5,836",2025-02-19,2025-02-22,3
119,CB_2025_Jan_FB_3798_CHUB_V03_9x16_VID_EN_New_C-NONE_CTA-NONE_Angle-None_M-NONE_VL-None_TR-None_G-NONE_P-NONE_S-NONE,3798 - ConfusedDog CHUB 2 || Enhancements: OFF || CBV1 || Batch 1 || 7DC || 16/02/25w08 || Kostas,VIDEO,$135,"6,426",2025-02-16,2025-02-20,4
120,CB_2025_Jan_FB_3687_DT_V01_4x5_VID_EN_Opti_C-MakingOf_Sale_CTA-VDAY_Angle-W-B-C_M-POW_VL-45s_G-M_P-OG_S-Moon_FB3090V02,3687 - Valentine_s Day Opti 3090 || Enhancements: OFF || CBV1 || Batch ą || 1C || 02/02/25w06 || Kostas,SHARE,$134,"6,885",2025-02-02,2025-02-19,17
121,CB_2025_Feb_FB_3784_SO-RP_V06_4x5_IMG_EN_Opti_C-Headline_Evergreen_CTA-NONE_Angle-W_M-NONE_VL-None_G-NONE_P-OG_S-NONE_FB3726V01,3784 - 3726 ad copy opti || Enhancements: OFF || CBV1 || Batch 2 || 1C || 09/02/25w07 || Kostas,SHARE,$132,"8,199",2025-02-09,2025-02-26,17
122,CB_2025_Feb_FB_3815_LZ_V03_9x16_VID_EN_New_C-Testimonial_Evergreen_CTA-SALE_Angle-GH_M-Danny_VL-15s_G-M_P-OG_S-NEW,3815 - #129 Notion idea how it feels || Enhancements: OFF || CBV1 || Batch 1 || 7C || 19/02/25w08 || Kostas,VIDEO,$128,"8,792",2025-02-19,2025-02-22,3
123,CB_2025_Feb_FB_3812_SO_V08_4x5_IMG_EN_Opti_C-NONE_Evergreen_CTA-SALE_Angle-W_M-NONE_VL-None_G-NONE_P-NONE_S-NONE_FB3723V07,3812 - 3723 Man Boobs Opti || Enhancements: OFF || CBV1 || Batch 5 || 7C || 19/02/25w08 || Kostas,SHARE,$126,"7,623",2025-02-19,2025-02-24,5
124,CB_2025_Jan_FB_3741_LZ-JG_V01_4x5_IMG_EN_Opti_C-Headline_Evergreen_CTA-NONE_Angle-W_M-NONE_VL-None_G-NONE_P-CBV2_S-NONE_FB3357V01,CBV2 || US || Manual Bid: ROAS GOAL: 1.00 -> 1.1 || 7DC || 22/01/2025,SHARE,$123,"4,127",2025-01-22,2025-03-27,64
125,CB_2025_Feb_FB_3821_SO-KB-JG_V09_4x5_IMG_EN_Opti_C-NONE_Evergreen_CTA-SALE_Angle-W_M-NONE_VL-None_G-NONE_P-NONE_S-NONE_FB3723V07,3821 - Man boobs Opti || Enhancements: OFF || CBV1 || Batch 3 || 7C || 19/02/25w08 || Kostas,SHARE,$122,"8,034",2025-02-19,2025-03-09,18
126,CB_2024_Nov_FB_3264_LZ_V31_4x5_VID_EN_Opti_C-MakingOf_Sale_CTA-BF_Angle-W-B_M-CRAZY_VL-45s_G-M_P-OG_S-NEW_FB3004V02,CBV2 || AU || 💰 Advantage+ || US || BROAD || 7C || Existing_customer_5% || 19/12/24 Ad set,VIDEO,$121,"3,689",2024-12-19,2025-03-27,98
127,CB_2025_Jan_FB_3741_LZ-JG_V02_4x5_IMG_EN_Opti_C-Headline_Evergreen_CTA-NONE_Angle-W_M-NONE_VL-None_G-NONE_P-CBV2_S-NONE_FB3357V01,AU || 3741 - V2 dom perignon 2 || 1C || 29/01/2025w05,SHARE,$120,"5,161",2025-01-30,2025-02-20,21
128,CB_2025_Feb_FB_3801_SO-KB_V11_1x1_IMG_EN_New_C-A-Compare_Evergreen_CTA-NONE_Angle-W_M-NONE_VL-None_G-NONE_P-OG_S-NONE,3801 - America_s favorite meal ads || Enhancements: OFF || CBV1 || Batch 3 || 7DC || 12/02/25w07 || Kostas,SHARE,$120,"3,706",2025-02-12,2025-02-18,6
129,CB_2024_Jan_FB_2762_IK_V05_1x1_IMG_EN_New_C-WrittenTesti_CTA-CTA_Pain-W-B-C_M-NONE_VL-None_TR-None_G-NONE_P-V2_S-NONE,CBV2 || EU (UK) || 💰 Advantage+ || US || BROAD || 7C || Existing_customer_5% || 15/12/24 Ad set,SHARE,$111,"3,923",2024-12-15,2025-03-27,102
130,CB_2025_Feb_FB_3816_VK-JT_V02_1x1_IMG_EN_New_C-BulletPoints_Evergreen_CTA-70_Angle-W-B-C_M-JOG_VL-None_G-NONE_P-OG_S-NEW_FB3656V02,3822 - OPTI 3656 -VK || Enhancements: OFF || CBV1 || Batch 1 || 7C || 19/02/25w08 || Kostas,SHARE,$108,"3,798",2025-02-19,2025-02-26,7
131,CB_2025_Jan_FB_3723_SO_V03_4x5_IMG_EN_New_C-NONE_Evergreen_CTA-SALE_Angle-W_M-NONE_VL-None_G-NONE_P-NONE_S-NONE,3723 - Notion Idea #92 MAN BOOBS || Enhancements: OFF || CBV1 || Batch 1 || 1C || 28/01/25w05 || Kostas,SHARE,$105,"8,244",2025-01-28,2025-02-24,27
132,CB_2025_Feb_FB_3793_VK-DP_V04_1x1_VID_EN_Opti_C-BulletPoints_Evergreen_CTA-70_Angle-W-B-C_M-NONE_VL-None_G-F_P-OG_S-NEW_FB3705V02,3793 -  3705 test opti || Enhancements: OFF || CBV1 || Batch 1 || 1C || 11/02/25w07 || Kostas,SHARE,$101,"4,492",2025-02-11,2025-02-28,17
133,CB_2025_Feb_FB_3787_CHUB_V03_9x16_VID_EN_New_C-NONE_CTA-NONE_Angle-None_M-NONE_VL-None_TR-None_G-NONE_P-NONE_S-NONE,3787 - DadBod Messaging CHUB || Enhancements: OFF || CBV1 || Batch 1 || 7DC || 16/02/25w08 || Kostas,SHARE,$97,"3,066",2025-02-16,2025-02-24,8
134,CB_2025_Feb_FB_3827_LZ_V02_1x1_IMG_EN_Opti_C-Headline_Evergreen_CTA-NONE_Angle-W_M-NONE_VL-None_G-M_P-CBV2_S-NONE_FB3723V18,3827 - V2 img winner opti || Batch 1 || 7C || 18/02/2025w08,SHARE,$95,"6,478",2025-02-18,2025-02-25,7
135,CB_2025_Feb_FB_3808_VK-DP_V01_9x16_VID_EN_New_C-BulletPoints_Evergreen_CTA-70_Angle-W-B-C_M-NONE_VL-None_G-F_P-OG_S-NEW,3808 - Lose your _but_ idea - VK-DP|| Enhancements: OFF || CBV1 || Batch 1 || 7C || 19/02/25w08 || Kostas,SHARE,$94,"2,006",2025-02-19,2025-02-22,3
136,CB_2025_Feb_FB_3808_VK-DP_V04_9x16_VID_EN_New_C-BulletPoints_Evergreen_CTA-70_Angle-W-B-C_M-NONE_VL-None_G-F_P-OG_S-NEW,3808 - Lose your _but_ idea - VK-DP|| Enhancements: OFF || CBV1 || Batch 1 || 7C || 19/02/25w08 || Kostas,SHARE,$94,"3,958",2025-02-19,2025-02-22,3
137,CB_2023_May_FB_2103_MB_V02_9x16_VID_EN_Opti_C-Sale_CTA-SMR_Pain-W_M-JOG_VL-30s_TR-None_G-M-F_P-None_S-What,US || Manual Bid || BFCM || COST CAP 71 || 1C || 15/11/24,VIDEO,$89,"2,732",2024-11-15,2025-03-27,132
138,CB_2025_Feb_FB_3813_SO_V07_9x16_VID_EN_New_C-NONE_Evergreen_CTA-NONE_Angle-W_M-NONE_VL-30s_G-None_P-OG_S-NEW,3813 - Notion Ideas #142 “Plate Saturation” || Enhancements: OFF || CBV1 || Batch 2 || 7C || 19/02/25w08 || Kostas,VIDEO,$87,"3,189",2025-02-19,2025-02-22,3
139,CB_2025_Jan_FB_3072_V02_4x5_IMG_EN_New_C-Headline_Seasonal_CTA-None_Angle-W_M-NONE_VL-None_G-NONE_P-OG_S-NONE,CBV2 || EU (UK) || 💰 Advantage+ || US || BROAD || 7C || Existing_customer_5% || 15/12/24 Ad set,SHARE,$86,"3,757",2025-01-17,2025-03-14,56
140,CB_2024_Aug_FB_3097_VK-DP_V03_9x16_VID_EN_Opti_C-Benefits_CTA-SMR_Pain-W-B_M-MIX_VL-45s_TR-None_G-MF_P-OG_S-WHAT_FB2516V13,CB || US || Funnel A: React || 7DC || 04/02/2025,VIDEO,$79,"3,076",2025-02-05,2025-02-17,12
141,CB_2025_Feb_FB_3821_SO-KB-JG_V04_4x5_IMG_EN_Opti_C-NONE_Evergreen_CTA-SALE_Angle-W_M-NONE_VL-None_G-NONE_P-NONE_S-NONE_FB3723V07,3821 - Man boobs Opti || Enhancements: OFF || CBV1 || Batch 1 || 7C || 19/02/25w08 || Kostas,SHARE,$78,"5,001",2025-02-19,2025-02-22,3
142,CB_2025_Feb_FB_3808_VK-DP_V03_9x16_VID_EN_New_C-BulletPoints_Evergreen_CTA-70_Angle-W-B-C_M-NONE_VL-None_G-F_P-OG_S-NEW,3808 - Lose your _but_ idea - VK-DP|| Enhancements: OFF || CBV1 || Batch 1 || 7C || 19/02/25w08 || Kostas,SHARE,$77,"2,823",2025-02-19,2025-02-22,3
143,CB_2025_Feb_FB_3813_SO_V02_9x16_VID_EN_New_C-NONE_Evergreen_CTA-NONE_Angle-W_M-NONE_VL-30s_G-None_P-OG_S-NEW,3813 - Notion Ideas #142 “Plate Saturation” || Enhancements: OFF || CBV1 || Batch 1 || 7C || 19/02/25w08 || Kostas,VIDEO,$76,"3,536",2025-02-19,2025-02-22,3
144,CB_2023_Jul_FB_2217_IB_V04_9x16_VID_EN_Opti_C-Pointing_CTA-SMR_Pain-W-B_M-TRC_VL-30s_TR-None_G-F_P-None_S-FRIGGA,US || Manual Bid || BFCM || COST CAP 71 || 1C || 15/11/24,VIDEO,$76,"2,536",2024-11-15,2025-03-27,132
145,CB_2025_Feb_FB_3808_VK-DP_V02_9x16_VID_EN_New_C-BulletPoints_Evergreen_CTA-70_Angle-W-B-C_M-NONE_VL-None_G-F_P-OG_S-NEW,3808 - Lose your _but_ idea - VK-DP|| Enhancements: OFF || CBV1 || Batch 1 || 7C || 19/02/25w08 || Kostas,SHARE,$75,"2,562",2025-02-19,2025-02-22,3
146,CB_2024_Feb_FB_2834_DA_V04_4x5_IMG_EN_Opti_C-SingleTesti_CTA-NONE_Pain-W_M-NONE_VL-None_TR-None_G-NONE_P-V2_S-NONE_FB2759V04,CBV2 || AU || 💰 Advantage+ || US || BROAD || 7C || Existing_customer_5% || 19/12/24 Ad set,SHARE,$73,"2,387",2024-12-19,2025-03-27,98
147,CB_2025_Jan_FB_3798_CHUB_V02_9x16_VID_EN_New_C-NONE_CTA-NONE_Angle-None_M-NONE_VL-None_TR-None_G-NONE_P-NONE_S-NONE,3798 - ConfusedDog CHUB 2 || Enhancements: OFF || CBV1 || Batch 1 || 7DC || 16/02/25w08 || Kostas,VIDEO,$71,"3,255",2025-02-16,2025-02-20,4
148,CB_2024_Aug_FB_3097_VK-DP_V03_9x16_VID_EN_Opti_C-Benefits_CTA-SMR_Pain-W-B_M-MIX_VL-45s_TR-None_G-MF_P-OG_S-WHAT_FB2516V13,CB || US || Funnel B: Shopify || 7DC || 04/02/2025,VIDEO,$70,"2,408",2025-02-05,2025-02-17,12
149,CB_2025_Feb_FB_3827_LZ_V03_1x1_IMG_EN_Opti_C-Headline_Evergreen_CTA-SALE_Angle-W_M-NONE_VL-None_G-M_P-CBV2_S-NONE_FB3705V02,3827 - V2 img winner opti || Batch 2 || 7C || 18/02/2025w08,SHARE,$70,"3,204",2025-02-18,2025-03-07,17
150,CB_2023_Jul_FB_2226_MB_V04_9x16_VID_EN_Opti_C-Testim_CTA-SMR_Pain-W_M-MIX_VL-30s_TR-None_G-F_P-None_S-Starry,US || Manual Bid || BFCM || ROAS GOAL: 1.4 || 1C || 15/11/24,VIDEO,$62,"1,523",2024-11-15,2025-02-27,104
151,CB_2025_Feb_FB_3813_SO_V08_9x16_VID_EN_New_C-NONE_Evergreen_CTA-NONE_Angle-W_M-NONE_VL-30s_G-None_P-OG_S-NEW,3813 - Notion Ideas #142 “Plate Saturation” || Enhancements: OFF || CBV1 || Batch 2 || 7C || 19/02/25w08 || Kostas,VIDEO,$62,"1,999",2025-02-19,2025-02-22,3
152,CB_2024_Nov_FB_3305_SO-DP_V02_4x5_VID_EN_Opti_C-Sale_CTA-BF_Pain-W_M-Chris_VL-30s_TR-None_G-MF_P-Plan_S-NEW_FB2601V07,CBV2 || AU || 💰 Advantage+ || US || BROAD || 7C || Existing_customer_5% || 19/12/24 Ad set,VIDEO,$61,"2,055",2024-12-19,2025-03-27,98
153,CB_2025_Jan_FB_3723_SO_V09_4x5_IMG_EN_New_C-NONE_Evergreen_CTA-SALE_Angle-W_M-NONE_VL-None_G-NONE_P-NONE_S-NONE,3723 - Notion Idea #92 MAN BOOBS || Enhancements: OFF || CBV1 || Batch 2 || 1C || 28/01/25w05 || Kostas,SHARE,$58,"4,604",2025-01-28,2025-02-18,21
154,CB_2025_Feb_FB_3827_LZ_V02_1x1_IMG_EN_Opti_C-Headline_Evergreen_CTA-NONE_Angle-W_M-NONE_VL-None_G-M_P-CBV2_S-NONE_FB3723V18,CBV2 || US || Manual Bid: ROAS GOAL: 1.00 -> 1.1 || 7DC || 22/01/2025,SHARE,$56,"2,671",2025-02-18,2025-03-27,37
155,CB_2025_Feb_FB_3813_SO_V04_9x16_VID_EN_New_C-NONE_Evergreen_CTA-NONE_Angle-W_M-NONE_VL-30s_G-None_P-OG_S-NEW,3813 - Notion Ideas #142 “Plate Saturation” || Enhancements: OFF || CBV1 || Batch 1 || 7C || 19/02/25w08 || Kostas,SHARE,$54,"2,129",2025-02-19,2025-02-22,3
156,CB_2024_Jan_FB_2764_RS_V04_9x16_VID_EN_Opti_C-SingleTesti_CTA-SALE_Pain-W_M-TRC_VL-45s_TR-None_G-F_P-OG_S-MOON_FB2263V04,CBV2 || EU (UK) || 💰 Advantage+ || US || BROAD || 7C || Existing_customer_5% || 15/12/24 Ad set,VIDEO,$53,"1,772",2025-02-04,2025-03-14,38
157,CB_2025_Jan_FB_3777_CHUB-KZ_V01_4x5_IMG_EN_Opti_C-NONE_CTA-NONE_Angle-C_M-NONE_VL-None_TR-None_G-NONE_P-NONE_S-NONE,3777 - 3696 Opti || Enhancements: OFF || CBV1 || Batch 1 || 1C || 11/02/25w07 || Kostas,SHARE,$53,"3,351",2025-02-11,2025-02-21,10
158,CB_2025_Feb_FB_3813_SO_V06_9x16_VID_EN_New_C-NONE_Evergreen_CTA-NONE_Angle-W_M-NONE_VL-30s_G-None_P-OG_S-NEW,3813 - Notion Ideas #142 “Plate Saturation” || Enhancements: OFF || CBV1 || Batch 2 || 7C || 19/02/25w08 || Kostas,VIDEO,$52,"2,242",2025-02-19,2025-02-22,3
159,CB_2025_Jan_FB_3742_SO-DP-KB_V04_4x5_IMG_EN_Opti_C-NONE_Evergreen_CTA-SALE_Angle-W_M-NONE_VL-None_G-NONE_P-CBV2_S-NONE3665V01,3742 -  3665_V01 OPTI for PREMIUM 2 || Batch 2 || 1C || 31/01/2025w05,SHARE,$51,"2,616",2025-01-31,2025-02-18,18
160,CB_2025_Jan_FB_3687_DT_V02_4x5_VID_EN_Opti_C-MakingOf_Sale_CTA-VDAY_Angle-W-B-C_M-POW_VL-45s_G-M_P-OG_S-Moon_FB3090V02,3687 - Valentine_s Day Opti 3090 || Enhancements: OFF || CBV1 || Batch ą || 1C || 02/02/25w06 || Kostas,SHARE,$51,"2,313",2025-02-02,2025-02-19,17
161,CB_2025_Jan_FB_3687_DT_V04_4x5_VID_EN_Opti_C-MakingOf_Sale_CTA-VDAY_Angle-W-B-C_M-POW_VL-45s_G-M_P-OG_S-Moon_FB3090V02,3687 - Valentine_s Day Opti 3090 || Enhancements: OFF || CBV1 || Batch ą || 1C || 02/02/25w06 || Kostas,SHARE,$50,"2,501",2025-02-02,2025-02-19,17
162,CB_2025_Feb_FB_3801_SO-KB_V04_1x1_IMG_EN_New_C-A-Compare_Evergreen_CTA-NONE_Angle-W_M-NONE_VL-None_G-NONE_P-OG_S-NONE,3801 - America_s favorite meal ads || Enhancements: OFF || CBV1 || Batch 1 || 7DC || 12/02/25w07 || Kostas,SHARE,$49,"2,625",2025-02-12,2025-02-17,5
163,CB_2025_Feb_FB_3821_SO-KB-JG_V16_4x5_IMG_EN_Opti_C-NONE_Evergreen_CTA-SALE_Angle-W_M-NONE_VL-None_G-NONE_P-NONE_S-NONE_FB3723V07,3812 - 3723 Man Boobs Opti || Enhancements: OFF || CBV1 || Batch 4 || 7C || 19/02/25w08 || Kostas,SHARE,$46,"2,277",2025-02-18,2025-02-24,6
164,CB_2025_Feb_FB_3801_SO-KB_V10_1x1_IMG_EN_New_C-A-Compare_Evergreen_CTA-NONE_Angle-W_M-NONE_VL-None_G-NONE_P-OG_S-NONE,3801 - America_s favorite meal ads || Enhancements: OFF || CBV1 || Batch 3 || 7DC || 12/02/25w07 || Kostas,SHARE,$46,"1,379",2025-02-12,2025-02-18,6
165,CB_2024_Jan_FB_2717_MB-RP_V26_9x16_VID_EN_New_C-Buzz_CTA-SALE_Pain-W-B-C_M-MIX_VL-45s_TR-None_G-MF_P-Method_S-NONE,CA || COST CAP 92->93 || 7C || 10/05/24 || V1,VIDEO,$44,"2,119",2024-08-22,2025-02-27,189
166,CB_2025_Feb_FB_3801_SO-KB_V07_1x1_IMG_EN_New_C-A-Compare_Evergreen_CTA-NONE_Angle-W_M-NONE_VL-None_G-NONE_P-OG_S-NONE,3801 - America_s favorite meal ads || Enhancements: OFF || CBV1 || Batch 2 || 7DC || 12/02/25w07 || Kostas,SHARE,$43,"1,214",2025-02-12,2025-02-17,5
167,CB_2025_Jan_FB_3740_VK-DP_V04_4x5_IMG_EN_Opti_C-Headline_Evergreen_CTA-NONE_Angle-W_M-NONE_VL-None_G-NONE_P-OG_S-NONE_FB3723V07,3797 - Man boobs-dad bod angle_IMG CB V1 - VK || Enhancements: OFF || CBV1 || Batch 1 || 7DC || 11/02/25w07 || Kostas,SHARE,$43,"1,990",2025-02-11,2025-02-17,6
168,CB_2024_Mar_FB_2888_JG_V02_9x16_IMG_EN_Opti_C-Benefits_CTA-NONE_Pain-W_M-NONE_VL-None_TR-None_G-NONE_P-V2_S-NONE,CBV2 || AU || 💰 Advantage+ || US || BROAD || 7C || Existing_customer_5% || 19/12/24 Ad set,SHARE,$42,"1,699",2024-12-19,2025-03-27,98
169,CB_2025_Feb_FB_3812_SO_V09_4x5_IMG_EN_Opti_C-NONE_Evergreen_CTA-SALE_Angle-W_M-NONE_VL-None_G-NONE_P-NONE_S-NONE_FB3723V07,3812 - 3723 Man Boobs Opti || Enhancements: OFF || CBV1 || Batch 3 || 1C || 11/02/25w07 || Kostas,SHARE,$42,"2,774",2025-02-11,2025-02-22,11
170,CB_2023_Jul_FB_2217_IB_V04_9x16_VID_EN_Opti_C-Pointing_CTA-SMR_Pain-W-B_M-TRC_VL-30s_TR-None_G-F_P-None_S-FRIGGA - Copy,CB || US || Funnel A: React || 7DC || 04/02/2025,VIDEO,$42,"1,300",2025-02-05,2025-02-17,12
171,CB_2025_Feb_FB_3796_LZ-DP_V03_9x16_VID_EN_New_C-Testimonial_Evergreen_CTA-SALE_Angle-W-B_M-TIFF_VL-45s_G-F_P-OG_S-NEW.mp4,3796 - CB ads everywhere || Enhancements: OFF || CBV1 || Batch 1 || 1C || 11/02/25w07 || Kostas,SHARE,$42,"1,922",2025-02-11,2025-02-17,6
172,CB_2025_Feb_FB_3809_LZ-JT_V03_1x1_IMG_EN_New_C-Educational_Evergreen_CTA-NONE_Angle-Cort_M-NONE_VL-None_G-NONE_P-NONE_S-NONE,3809 - 30 day detox RED 40 LBS || Enhancements: OFF || CBV1 || Batch 1 || 7DC || 12/02/25w07 || Kostas,SHARE,$42,"1,970",2025-02-12,2025-02-17,5
173,CB_2025_Feb_FB_3821_SO-KB-JG_V15_4x5_IMG_EN_Opti_C-NONE_Evergreen_CTA-SALE_Angle-W_M-NONE_VL-None_G-NONE_P-NONE_S-NONE_FB3723V07,3812 - 3723 Man Boobs Opti || Enhancements: OFF || CBV1 || Batch 4 || 7C || 19/02/25w08 || Kostas,SHARE,$41,"2,356",2025-02-18,2025-02-24,6
174,CB_2023_Jul_FB_2217_IB_V04_9x16_VID_EN_Opti_C-Pointing_CTA-SMR_Pain-W-B_M-TRC_VL-30s_TR-None_G-F_P-None_S-FRIGGA - Copy,CB || US || Funnel B: Shopify || 7DC || 04/02/2025,VIDEO,$41,"1,108",2025-02-05,2025-02-17,12
175,CB_2024_Dec_FB_3619_VK-JT_V02_4x5_VID_EN_New_C-BulletPoints_Sale_CTA-NY_Angle-W-B-C_M-NONE_VL-None_G-NONE_P-OG_S-NONE - Copy,CB || US || Funnel B: Shopify || 7DC || 04/02/2025,SHARE,$40,"1,621",2025-02-05,2025-02-17,12
176,CB_2025_Feb_FB_3815_LZ_V02_9x16_VID_EN_New_C-Testimonial_Evergreen_CTA-SALE_Angle-GH_M-NONE_VL-15s_G-M_P-NONE_S-NEW,3815 - #129 Notion idea how it feels || Enhancements: OFF || CBV1 || Batch 1 || 7C || 19/02/25w08 || Kostas,VIDEO,$40,"2,217",2025-02-19,2025-02-22,3
177,CB_2025_Feb_FB_3811_DT_V02_9x16_VID_EN_Opti_C-Pointing_Sale_CTA-70_Angle-W_M-JOG_VL-30s_G-F_P-OG_S-New_FB2103V02,3811 - #133 Green screen timeframe hooks || Enhancements: OFF || CBV1 || Batch 1 || 7C || 19/02/25w08 || Kostas,VIDEO,$39,"1,705",2025-02-19,2025-03-12,21
178,CB_2025_Feb_FB_3806_SO-KB_V07_1x1_IMG_EN_New_C-A-Compare_Evergreen_CTA-NONE_Angle-W_M-NONE_VL-None_G-NONE_P-OG_S-NONE,"3806 - Brief Results, not resolutions || Enhancements: OFF || CBV1 || Batch 2 || 7DC || 12/02/25w07 || Kostas",SHARE,$36,"1,267",2025-02-12,2025-02-17,5
179,CB_2025_Jan_FB_3723_SO_V05_4x5_IMG_EN_New_C-NONE_Evergreen_CTA-SALE_Angle-W_M-NONE_VL-None_G-NONE_P-NONE_S-NONE,3723 - Notion Idea #92 MAN BOOBS || Enhancements: OFF || CBV1 || Batch 1 || 1C || 28/01/25w05 || Kostas,SHARE,$36,"2,934",2025-01-28,2025-02-24,27
180,CB_2025_Feb_FB_3792_SO-RP_V06_1x1_IMG_EN_Opti_C-NegativeMark_Sale_CTA-Vday_Angle-Cort_M-NONE_VL-None_G-NONE_P-NONE_S-NONE_FB3251V02,3792 - 3072 Valentines opti IMG || Enhancements: OFF || CBV1 || Batch 2 || 1C || 09/02/25w07 || Kostas,SHARE,$35,"1,654",2025-02-09,2025-02-17,8
181,CB_2025_Jan_FB_3747_CHUB-AA_V01_4x5_IMG_EN_Opti_C-NONE_CTA-NONE_Angle-Sale_M-NONE_VL-None_TR-None_G-NONE_P-OG_S-NONE,3747 Clean Sale [HB winner ITR] CHUB || Enhancements: OFF || CBV1 || Batch ą || 1C || 02/02/25w06 || Kostas,SHARE,$35,"1,709",2025-02-02,2025-03-27,53
182,CB_2025_Feb_FB_3808_VK-DP_V01_9x16_VID_EN_New_C-BulletPoints_Evergreen_CTA-70_Angle-W-B-C_M-NONE_VL-None_G-F_P-OG_S-NEW,3655 - CB PODCAST EDU BRIEF - NYNM || Enhancements: OFF || CBV1 || Batch 1 || 7C || 19/02/25w08 || Kostas,VIDEO,$35,"1,494",2025-02-19,2025-02-22,3
183,CB_2025_Feb_FB_3820_LZ_V03_9x16_VID_EN_Opti_C-Testimonial_Evergreen_CTA-SALE_Angle-W-B-C_M-TRC_VL-30s_G-F_P-OG_S-FRIGGA_FB2217V04_1,3820 - Calorie deficit hooks || Enhancements: OFF || CBV1 || Batch 1 || 7C || 19/02/25w08 || Kostas,VIDEO,$34,"1,376",2025-02-19,2025-02-26,7
184,CB_2025_Feb_FB_3813_SO_V03_9x16_VID_EN_New_C-NONE_Evergreen_CTA-NONE_Angle-W_M-NONE_VL-30s_G-None_P-OG_S-NEW,3813 - Notion Ideas #142 “Plate Saturation” || Enhancements: OFF || CBV1 || Batch 1 || 7C || 19/02/25w08 || Kostas,VIDEO,$34,"1,569",2025-02-19,2025-02-22,3
185,CB_2025_Feb_FB_3793_VK-DP_V07_1x1_VID_EN_Opti_C-BulletPoints_Evergreen_CTA-70_Angle-W-B-C_M-NONE_VL-None_G-F_P-OG_S-NEW_FB3705V02,3793 -  3705 test opti || Enhancements: OFF || CBV1 || Batch 2 || 1C || 11/02/25w07 || Kostas,SHARE,$34,"1,791",2025-02-11,2025-02-17,6
186,CB_2025_Feb_FB_3804_LZ-KB_V01_1x1_VID_EN_New_C-BulletPoints_Evergreen_CTA-NONE_Angle-W-B_M-NONE_VL-None_G-NONE_P-NONE_S-NONE,3804 - fit back into your jeans || Enhancements: OFF || CBV1 || Batch 1 || 7DC || 12/02/25w07 || Kostas,SHARE,$34,"1,163",2025-02-12,2025-02-17,5
187,CB_2025_Feb_FB_3787_CHUB_V02_9x16_VID_EN_New_C-NONE_CTA-NONE_Angle-None_M-NONE_VL-None_TR-None_G-NONE_P-NONE_S-NONE,3787 - DadBod Messaging CHUB || Enhancements: OFF || CBV1 || Batch 1 || 7DC || 16/02/25w08 || Kostas,VIDEO,$34,"1,702",2025-02-16,2025-02-24,8
188,CB_2025_Feb_FB_3812_SO_V06_4x5_IMG_EN_Opti_C-NONE_Evergreen_CTA-SALE_Angle-W_M-NONE_VL-None_G-NONE_P-NONE_S-NONE_FB3723V07,3812 - 3723 Man Boobs Opti || Enhancements: OFF || CBV1 || Batch 2 || 1C || 11/02/25w07 || Kostas,SHARE,$33,"2,361",2025-02-11,2025-02-21,10
189,CB_2025_Feb_FB_3818_LZ-VU_V26_1x1_IMG_EN_Opti_C-Headline_Evergreen_CTA-NONE_Angle-Cort_M-NONE_VL-None_G-NONE_P-NONE_S-NONE_FB3251V01,3818 - It_s not cheap Months+holidays: April || Enhancements: OFF || CBV1 || Batch 1 || 7DC || 13/02/25w07 || Kostas,SHARE,$31,875,2025-02-13,2025-02-28,15
190,CB_2025_Jan_FB_3723_SO_V19_4x5_IMG_EN_New_C-NONE_Evergreen_CTA-SALE_Angle-W_M-NONE_VL-None_G-NONE_P-NONE_S-NONE,3723 - Notion Idea #92 MAN BOOBS || Enhancements: OFF || CBV1 || Batch 4 || 1C || 28/01/25w05 || Kostas,SHARE,$30,"1,769",2025-01-28,2025-03-11,42
191,CB_2024_Feb_FB_2834_DA_V02_4x5_IMG_EN_Opti_C-SingleTesti_CTA-NONE_Pain-W_M-NONE_VL-None_TR-None_G-NONE_P-V2_S-NONE_FB2759V04,CBV2 || AU || 💰 Advantage+ || US || BROAD || 7C || Existing_customer_5% || 19/12/24 Ad set,SHARE,$30,"1,202",2024-12-19,2025-03-27,98
192,CB_2025_Jan_FB_3786_LZ_V01_1x1_IMG_EN_New_C-Educational_Evergreen_CTA-SALE_Angle-GH_M-NONE_VL-None_G-NONE_P-OG_S-NONE,3786 - #92 Notion idea gamers' diet || Enhancements: OFF || CBV1 || Batch 1 || 7C || 09/02/25w07 || Kostas,SHARE,$29,"1,232",2025-02-09,2025-02-17,8
193,CB_2025_Jan_FB_3742_SO-DP-KB_V01_4x5_IMG_EN_Opti_C-NONE_Evergreen_CTA-SALE_Angle-W_M-NONE_VL-None_G-NONE_P-CBV2_S-NONE3665V01,CBV2 || EU (UK) || 💰 Advantage+ || US || BROAD || 7C || Existing_customer_5% || 15/12/24 Ad set,SHARE,$28,"1,049",2025-02-04,2025-03-27,51
194,CB_2023_Jul_FB_2226_MB_V04_9x16_VID_EN_Opti_C-Testim_CTA-SMR_Pain-W_M-MIX_VL-30s_TR-None_G-F_P-None_S-Starry,US || Manual Bid || BFCM || COST CAP 91 || 1C || 15/11/24,VIDEO,$28,894,2024-11-15,2025-02-27,104
195,CB_2024_Dec_FB_3619_VK-JT_V02_4x5_VID_EN_New_C-BulletPoints_Sale_CTA-NY_Angle-W-B-C_M-NONE_VL-None_G-NONE_P-OG_S-NONE - Copy,CB || US || Funnel A: React || 7DC || 04/02/2025,SHARE,$27,"1,154",2025-02-05,2025-02-17,12
196,CB_2025_Feb_FB_3812_SO_V05_4x5_IMG_EN_Opti_C-NONE_Evergreen_CTA-SALE_Angle-W_M-NONE_VL-None_G-NONE_P-NONE_S-NONE_FB3723V07,3812 - 3723 Man Boobs Opti || Enhancements: OFF || CBV1 || Batch 2 || 1C || 11/02/25w07 || Kostas,SHARE,$27,"1,927",2025-02-11,2025-02-21,10
197,CB_2025_Feb_FB_3782_CHUB_V04_9x16_VID_EN_New_C-NONE_CTA-NONE_Angle-None_M-NONE_VL-None_TR-None_G-NONE_P-NONE_S-NONE,Relaunch - 3782 - Political weight loss journey CHUB || Enhancements: OFF || CBV1 || Batch 2 || 1C || 11/02/25w07 || Kostas,VIDEO,$27,"1,256",2025-02-10,2025-02-17,7
198,CB_2025_Feb_FB_3784_SO-RP_V03_4x5_IMG_EN_Opti_C-Headline_Evergreen_CTA-NONE_Angle-W_M-NONE_VL-None_G-NONE_P-OG_S-NONE_FB3726V01,3784 - 3726 ad copy opti || Enhancements: OFF || CBV1 || Batch 1 || 1C || 09/02/25w07 || Kostas,SHARE,$26,748,2025-02-09,2025-02-17,8
199,CB_2025_Feb_FB_3821_SO-KB-JG_V10_4x5_IMG_EN_Opti_C-NONE_Evergreen_CTA-SALE_Angle-W_M-NONE_VL-None_G-NONE_P-NONE_S-NONE_FB3723V07,3821 - Man boobs Opti || Enhancements: OFF || CBV1 || Batch 3 || 7C || 19/02/25w08 || Kostas,SHARE,$25,"1,544",2025-02-19,2025-03-09,18
200,CB_2024_Oct_FB_3251_LZ-VU_V01_1x1_IMG_EN_New_C-NegativeMark_Evergreen_CTA-NONE_Angle-Cort_M-NONE_VL-None_G-NONE_P-NONE_S-NONE.png,US || Manual Bid || BFCM || ROAS GOAL: 1.4 || 1C || 15/11/24,SHARE,$24,689,2024-11-15,2025-02-27,104
201,CB_2025_Feb_FB_3807_DT-DP_V01_9x16_VID_EN_Opti_C-Pointing_Sale_CTA-70_Angle-W-B_M-TRC_VL-30s_G-F_P-OG_S-FRIGGA_FB2217V04,3807 - Green screen reaction test || Enhancements: OFF || CBV1 || Batch 2 || 7DC || 12/02/25w07 || Kostas,SHARE,$24,952,2025-02-12,2025-02-17,5
202,CB_2025_FEB_FB_3666_VK-JT_V03_4x5_VID_EN_NEW_C-BulletPoints_Sale_CTA-NY_Angle-W-B-C_M-TRC_VL-30s_G-F_P-OG_S-NEW,🌶️ || US || ASC+ || ->CC141 || VIDEO Only || US+CA || 0% EXISTING CAP || 7C || 07/08.24  Ad set,VIDEO,$23,"1,054",2025-01-20,2025-03-19,58
203,CB_2025_Feb_FB_3812_SO_V06_4x5_IMG_EN_Opti_C-NONE_Evergreen_CTA-SALE_Angle-W_M-NONE_VL-None_G-NONE_P-NONE_S-NONE_FB3723V07,3812 - 3723 Man Boobs Opti || Enhancements: OFF || CBV1 || Batch 5 || 7C || 19/02/25w08 || Kostas,SHARE,$21,"1,437",2025-02-19,2025-02-24,5
204,CB_2025_Feb_FB_3793_VK-DP_V03_1x1_VID_EN_Opti_C-BulletPoints_Evergreen_CTA-70_Angle-W-B-C_M-NONE_VL-None_G-F_P-OG_S-NEW_FB3705V02,3793 -  3705 test opti || Enhancements: OFF || CBV1 || Batch 1 || 1C || 11/02/25w07 || Kostas,SHARE,$20,815,2025-02-11,2025-02-28,17
205,CB_2024_Oct_FB_3182_ZS-GC_V13_1x1_IMG_EN_New_C-UsVsThem_Evergreen_CTA-NONE_Angle-B-C_M-NONE_VL-None_G-NONE_P-OG_S-NONE,CBV2 || AU || 💰 Advantage+ || US || BROAD || 7C || Existing_customer_5% || 19/12/24 Ad set,SHARE,$20,744,2024-12-19,2025-03-27,98
206,CB_2025_Feb_FB_3816_VK-JT_V03_1x1_IMG_EN_New_C-BulletPoints_Evergreen_CTA-70_Angle-W-B-C_M-JOG_VL-None_G-NONE_P-OG_S-NEW_FB3656V02,3822 - OPTI 3656 -VK || Enhancements: OFF || CBV1 || Batch 1 || 7C || 19/02/25w08 || Kostas,SHARE,$19,553,2025-02-19,2025-02-26,7
207,CB_2024_Feb_FB_2814_MB-DP_V05_1x1_IMG_EN_New_C-WeightLoss_CTA-None_Pain-W-B-C_M-NONE_VL-None_TR-None_G-NONE_P-V2_S-NONE,CBV2 || EU (UK) || 💰 Advantage+ || US || BROAD || 7C || Existing_customer_5% || 15/12/24 Ad set,SHARE,$18,566,2025-01-31,2025-03-27,55
208,CB_2025_Feb_FB_3819_DT_V03_9x16_GIF_EN_Opti_C-NONE_Evergreen_CTA-None_Angle-W_M-NONE_VL-None_G-NONE_P-NONE_S-New_FB3723V04,3819 - #7 Goodbye Man boobs || Enhancements: OFF || CBV1 || Batch 1 || 7DC || 14/02/25w07 || Kostas,SHARE,$18,790,2025-02-14,2025-02-22,8
209,CB_2025_Feb_FB_3821_SO-KB-JG_V01_4x5_IMG_EN_Opti_C-NONE_Evergreen_CTA-SALE_Angle-W_M-NONE_VL-None_G-NONE_P-NONE_S-NONE_FB3723V07,3821 - Man boobs Opti || Enhancements: OFF || CBV1 || Batch 1 || 7C || 19/02/25w08 || Kostas,SHARE,$17,983,2025-02-19,2025-02-22,3
210,CB_2025_Feb_FB_3807_DT-DP_V04_9x16_VID_EN_Opti_C-Pointing_Sale_CTA-70_Angle-W_M-TRC_VL-30s_G-F_P-OG_S-WHAT_FB3030V05,3807 - Green screen reaction test || Enhancements: OFF || CBV1 || Batch 2 || 7DC || 12/02/25w07 || Kostas,SHARE,$17,572,2025-02-12,2025-02-17,5
211,CB_2025_Feb_FB_3827_LZ_V03_1x1_IMG_EN_Opti_C-Headline_Evergreen_CTA-SALE_Angle-W_M-NONE_VL-None_G-M_P-CBV2_S-NONE_FB3705V02,CBV2 || US || Manual Bid: ROAS GOAL: 1.00 -> 1.1 || 7DC || 22/01/2025,SHARE,$16,706,2025-02-18,2025-03-27,37
212,CB_2025_Feb_FB_3827_LZ_V03_1x1_IMG_EN_Opti_C-Headline_Evergreen_CTA-SALE_Angle-W_M-NONE_VL-None_G-M_P-CBV2_S-NONE_FB3705V02,3827 - V2 img winner opti || Batch 2 || 7C || 18/02/2025w08,SHARE,$16,968,2025-02-18,2025-03-27,37
213,CB_2025_Feb_FB_3793_VK-DP_V02_1x1_VID_EN_Opti_C-BulletPoints_Evergreen_CTA-70_Angle-W-B-C_M-NONE_VL-None_G-F_P-OG_S-NEW_FB3705V02,3793 -  3705 test opti || Enhancements: OFF || CBV1 || Batch 1 || 1C || 11/02/25w07 || Kostas,SHARE,$16,875,2025-02-11,2025-02-28,17
214,CB_2025_Feb_FB_3821_SO-KB-JG_V02_4x5_IMG_EN_Opti_C-NONE_Evergreen_CTA-SALE_Angle-W_M-NONE_VL-None_G-NONE_P-NONE_S-NONE_FB3723V07,3821 - Man boobs Opti || Enhancements: OFF || CBV1 || Batch 1 || 7C || 19/02/25w08 || Kostas,SHARE,$15,640,2025-02-19,2025-02-22,3
215,CB_2024_Mar_FB_2888_JG_V01_9x16_IMG_EN_Opti_C-Benefits_CTA-NONE_Pain-W_M-NONE_VL-None_TR-None_G-NONE_P-V2_S-NONE,CBV2 || AU || 💰 Advantage+ || US || BROAD || 7C || Existing_customer_5% || 19/12/24 Ad set,SHARE,$14,394,2024-12-19,2025-03-27,98
216,CB_2025_Feb_FB_3821_SO-KB-JG_V14_4x5_IMG_EN_Opti_C-NONE_Evergreen_CTA-SALE_Angle-W_M-NONE_VL-None_G-NONE_P-NONE_S-NONE_FB3723V07,3812 - 3723 Man Boobs Opti || Enhancements: OFF || CBV1 || Batch 4 || 7C || 19/02/25w08 || Kostas,SHARE,$14,863,2025-02-18,2025-02-24,6
217,CB_2024_Mar_FB_2888_JG_V03_9x16_IMG_EN_Opti_C-Benefits_CTA-NONE_Pain-W_M-NONE_VL-None_TR-None_G-NONE_P-V2_S-NONE,CBV2 || AU || 💰 Advantage+ || US || BROAD || 7C || Existing_customer_5% || 19/12/24 Ad set,SHARE,$13,473,2024-12-19,2025-03-27,98
218,CB_2022_Mar3_FB_713_IK_V04_1x1_IMG_EN_Opti_C-WrittenTesti_HE-98_A-ExtremeBodyVisualization_HK-bodypart_Pain-W_CLR-PURPLE_BG-IMAGE_ME-MIX_MA-YOUNG,US || Manual Bid || BFCM || COST CAP 91 || 1C || 15/11/24,SHARE,$13,688,2024-11-15,2025-02-27,104
219,CB_2025_Feb_FB_3804_LZ-KB_V04_1x1_VID_EN_New_C-BulletPoints_Evergreen_CTA-NONE_Angle-GH_M-NONE_VL-None_G-NONE_P-NONE_S-NONE,3804 - fit back into your jeans || Enhancements: OFF || CBV1 || Batch 1 || 7DC || 12/02/25w07 || Kostas,SHARE,$12,380,2025-02-12,2025-02-17,5
220,CB_2025_Jan_FB_3655_DT-JT_V03_9x16_VID_EN_New_C-Educational_Sale_CTA-NY_Angle-W_M-MIX_VL-45s_G-MF_P-OG_S-NEW,3655 - CB PODCAST EDU BRIEF - NYNM || Enhancements: OFF || CBV1 || Batch 1 || 7C || 19/02/25w08 || Kostas,VIDEO,$12,515,2025-02-19,2025-02-22,3
221,CB_2023_Jul_FB_2217_IB_V04_9x16_VID_EN_Opti_C-Pointing_CTA-SMR_Pain-W-B_M-TRC_VL-30s_TR-None_G-F_P-None_S-FRIGGA,US || Manual Bid || BFCM || COST CAP 81 || 1C || 15/11/24,VIDEO,$11,404,2024-11-15,2025-03-16,121
222,CB_2025_Feb_FB_3793_VK-DP_V06_1x1_VID_EN_Opti_C-BulletPoints_Evergreen_CTA-70_Angle-W-B-C_M-NONE_VL-None_G-F_P-OG_S-NEW_FB3705V02,3793 -  3705 test opti || Enhancements: OFF || CBV1 || Batch 2 || 1C || 11/02/25w07 || Kostas,SHARE,$11,466,2025-02-11,2025-02-17,6
223,CB_2025_Feb_FB_3816_VK-JT_V01_1x1_IMG_EN_New_C-BulletPoints_Evergreen_CTA-70_Angle-W-B-C_M-JOG_VL-None_G-NONE_P-OG_S-NEW_FB3656V02,3822 - OPTI 3656 -VK || Enhancements: OFF || CBV1 || Batch 1 || 7C || 19/02/25w08 || Kostas,SHARE,$10,412,2025-02-19,2025-02-26,7
224,CB_2025_Feb_FB_3806_SO-KB_V08_1x1_IMG_EN_New_C-A-Compare_Evergreen_CTA-NONE_Angle-W_M-NONE_VL-None_G-NONE_P-OG_S-NONE,"3806 - Brief Results, not resolutions || Enhancements: OFF || CBV1 || Batch 2 || 7DC || 12/02/25w07 || Kostas",SHARE,$10,385,2025-02-12,2025-02-17,5
225,CB_2025_Feb_FB_3799_SO-KB_V08_1x1_IMG_EN_New_C-A-Compare_Evergreen_CTA-NONE_Angle-W_M-NONE_VL-None_G-NONE_P-OG_S-NONE,3799 - Don_t change your habits || Enhancements: OFF || CBV1 || Batch 2 || 7DC || 12/02/25w07 || Kostas,SHARE,$9,345,2025-02-12,2025-02-21,9
226,CB_2025_Jan_FB_3779_VK-DP_V04_1x1_VID_EN_Opti_C-BulletPoints_Evergreen_CTA-70_Angle-W-B-C_M-NONE_VL-None_G-F_P-OG_S-NEW_FB3705V02,3779 - opti 3705 || Enhancements: OFF || CBV1 || Batch 1 || 1C || 04/02/25w06 || Kostas,SHARE,$9,557,2025-02-04,2025-03-20,44
227,CB_2025_Feb_FB_3819_DT_V04_9x16_GIF_EN_Opti_C-NONE_Evergreen_CTA-None_Angle-W_M-NONE_VL-None_G-NONE_P-NONE_S-New_FB3723V04,3819 - #7 Goodbye Man boobs || Enhancements: OFF || CBV1 || Batch 1 || 7DC || 14/02/25w07 || Kostas,SHARE,$9,370,2025-02-14,2025-02-20,6
228,CB_2023_Jul_FB_2217_IB_V04_9x16_VID_EN_Opti_C-Pointing_CTA-SMR_Pain-W-B_M-TRC_VL-30s_TR-None_G-F_P-None_S-FRIGGA,US || Manual Bid || BID CAP 111 || 1C || 21/12/24,VIDEO,$9,295,2024-12-22,2025-03-24,92
229,CB_2024_Nov_FB_3336_CH_V18_1x1_IMG_EN_Opti_C-Headline_CTA-NONE_Angle-C_P-OG,3336 Creative Hub – Golden nuggets V1 - Opti [Not tested] || Enhancements: OFF || CBV1 || Batch 1 || 1C || 11/02/25w07 || Kostas,SHARE,$9,482,2025-02-11,2025-02-21,10
230,CB_2025_Jan_FB_3723_SO_V08_4x5_IMG_EN_New_C-NONE_Evergreen_CTA-SALE_Angle-W_M-NONE_VL-None_G-NONE_P-NONE_S-NONE,3723 - Notion Idea #92 MAN BOOBS || Enhancements: OFF || CBV1 || Batch 2 || 1C || 28/01/25w05 || Kostas,SHARE,$9,543,2025-01-28,2025-02-18,21
231,CB_2025_Jan_FB_3738_SO-DP_V01_4x5_IMG_EN_Opti_C-NONE_Evergreen_CTA-SALE_Angle-W_M-NONE_VL-None_G-NONE_P-NONE_S-NONE3665V01,3738 - 3665_V01 OPTI || Enhancements: OFF || CBV1 || Batch 1 || 1C || 29/01/25w05 || Kostas,SHARE,$9,641,2025-01-29,2025-02-22,24
232,CB_2025_Feb_FB_3815_LZ_V04_9x16_VID_EN_New_C-Testimonial_Evergreen_CTA-SALE_Angle-GH_M-Danny_VL-15s_G-M_P-OG_S-NEW,3815 - #129 Notion idea how it feels || Enhancements: OFF || CBV1 || Batch 1 || 7C || 19/02/25w08 || Kostas,VIDEO,$8,512,2025-02-19,2025-02-22,3
233,CB_2023_Jul_FB_2226_MB_V04_9x16_VID_EN_Opti_C-Testim_CTA-SMR_Pain-W_M-MIX_VL-30s_TR-None_G-F_P-None_S-Starry,US || Manual Bid || BFCM || COST CAP 71 || 1C || 15/11/24,VIDEO,$8,216,2024-11-15,2025-03-27,132
234,CB_2022_Nov_FB_1218_RS_V15_9x16_IMG_EN_Opti_C-Sale_CTA-BLACK_Pain-W_M-NONE_VL-None FB1671V08,US || Manual Bid || BFCM || COST CAP 91 || 1C || 15/11/24,SHARE,$8,228,2024-11-15,2025-02-27,104
235,CB_2025_Jan_FB_3747_CHUB-AA_V02_9x16_IMG_EN_Opti_C-NONE_CTA-NONE_Angle-Sale_M-NONE_VL-None_TR-None_G-NONE_P-OG_S-NONE,3747 Clean Sale [HB winner ITR] CHUB || Enhancements: OFF || CBV1 || Batch ą || 1C || 02/02/25w06 || Kostas,SHARE,$6,213,2025-02-02,2025-03-27,53
236,CB_2024_Nov_FB_3336_CH_V16_1x1_IMG_EN_Opti_C-Headline_CTA-NONE_Angle-C_P-NONE,3336 Creative Hub – Golden nuggets V1 - Opti [Not tested] || Enhancements: OFF || CBV1 || Batch 1 || 1C || 11/02/25w07 || Kostas,SHARE,$6,361,2025-02-11,2025-02-21,10
237,CB_2025_Jan_FB_3723_SO_V20_4x5_IMG_EN_New_C-NONE_Evergreen_CTA-SALE_Angle-W_M-NONE_VL-None_G-NONE_P-NONE_S-NONE,3723 - Notion Idea #92 MAN BOOBS || Enhancements: OFF || CBV1 || Batch 4 || 1C || 28/01/25w05 || Kostas,SHARE,$6,418,2025-01-28,2025-03-11,42
238,CB_2025_Jan_FB_3742_SO-DP-KB_V05_4x5_IMG_EN_Opti_C-NONE_Evergreen_CTA-SALE_Angle-W_M-NONE_VL-None_G-NONE_P-CBV2_S-NONE3665V01,3742 -  3665_V01 OPTI for PREMIUM 2 || Batch 2 || 1C || 31/01/2025w05,SHARE,$5,275,2025-01-31,2025-02-18,18
239,CB_2025_Feb_FB_3811_DT_V01_9x16_VID_EN_Opti_C-Pointing_Sale_CTA-70_Angle-W_M-JOG_VL-30s_G-F_P-OG_S-New_FB2103V02,3811 - #133 Green screen timeframe hooks || Enhancements: OFF || CBV1 || Batch 1 || 7C || 19/02/25w08 || Kostas,VIDEO,$5,260,2025-02-19,2025-03-12,21
240,CB_2025_Feb_FB_3809_LZ-JT_V04_1x1_IMG_EN_New_C-Educational_Evergreen_CTA-NONE_Angle-W_M-NONE_VL-None_G-NONE_P-NONE_S-NONE,3809 - 30 day detox RED 40 LBS || Enhancements: OFF || CBV1 || Batch 1 || 7DC || 12/02/25w07 || Kostas,SHARE,$5,220,2025-02-12,2025-02-17,5
241,CB_2025_Feb_FB_3801_SO-KB_V12_1x1_IMG_EN_New_C-A-Compare_Evergreen_CTA-NONE_Angle-W_M-NONE_VL-None_G-NONE_P-OG_S-NONE,3801 - America_s favorite meal ads || Enhancements: OFF || CBV1 || Batch 3 || 7DC || 12/02/25w07 || Kostas,SHARE,$5,134,2025-02-12,2025-02-18,6
242,CB_2025_Jan_FB_3777_CHUB-KZ_V02_4x5_IMG_EN_Opti_C-NONE_CTA-NONE_Angle-C_M-NONE_VL-None_TR-None_G-NONE_P-NONE_S-NONE,3777 - 3696 Opti || Enhancements: OFF || CBV1 || Batch 1 || 1C || 11/02/25w07 || Kostas,SHARE,$4,273,2025-02-11,2025-02-21,10
243,CB_2025_Feb_FB_3820_LZ_V04_9x16_VID_EN_Opti_C-Testimonial_Evergreen_CTA-SALE_Angle-W-B-C_M-TRC_VL-30s_G-F_P-OG_S-FRIGGA_FB2217V04,3820 - Calorie deficit hooks || Enhancements: OFF || CBV1 || Batch 1 || 7C || 19/02/25w08 || Kostas,VIDEO,$4,187,2025-02-19,2025-02-26,7
244,CB_2025_Feb_FB_3784_SO-RP_V02_4x5_IMG_EN_Opti_C-Headline_Evergreen_CTA-NONE_Angle-W_M-NONE_VL-None_G-NONE_P-OG_S-NONE_FB3726V01,3784 - 3726 ad copy opti || Enhancements: OFF || CBV1 || Batch 1 || 1C || 09/02/25w07 || Kostas,SHARE,$4,176,2025-02-09,2025-02-17,8
245,CB_2024_Oct_FB_3251_LZ-VU_V01_1x1_IMG_EN_New_C-NegativeMark_Evergreen_CTA-NONE_Angle-Cort_M-NONE_VL-None_G-NONE_P-NONE_S-NONE.png,US || Manual Bid || BFCM || COST CAP 71 || 1C || 15/11/24,SHARE,$4,138,2024-11-15,2025-03-26,131
246,CB_2025_Jan_FB_3766_SO_V03_4x5_IMG_EN_Opti_C-Headline_Evergreen_CTA-NONE_Angle-W-B-C_M-NONE_VL-None_G-NONE_P-NONE_S-NONE_3700V08,3766 - 3700 copy opti || Enhancements: OFF || CBV1 || Batch 1 || 1C || 03/02/25w06 || Kostas,SHARE,$4,258,2025-02-04,2025-02-22,18
247,CB_2025_Feb_FB_3801_SO-KB_V08_1x1_IMG_EN_New_C-A-Compare_Evergreen_CTA-NONE_Angle-W_M-NONE_VL-None_G-NONE_P-OG_S-NONE,3801 - America_s favorite meal ads || Enhancements: OFF || CBV1 || Batch 2 || 7DC || 12/02/25w07 || Kostas,SHARE,$4,82,2025-02-12,2025-02-17,5
248,CB_2025_Feb_FB_3812_SO_V02_4x5_IMG_EN_Opti_C-NONE_Evergreen_CTA-SALE_Angle-W_M-NONE_VL-None_G-NONE_P-NONE_S-NONE_FB3723V07,3812 - 3723 Man Boobs Opti || Enhancements: OFF || CBV1 || Batch 1 || 1C || 11/02/25w07 || Kostas,SHARE,$4,226,2025-02-11,2025-02-26,15
249,CB_2025_Feb_FB_3819_DT_V01_9x16_GIF_EN_Opti_C-NONE_Evergreen_CTA-None_Angle-W_M-NONE_VL-None_G-NONE_P-NONE_S-New_FB3723V04,3819 - #7 Goodbye Man boobs || Enhancements: OFF || CBV1 || Batch 1 || 7DC || 14/02/25w07 || Kostas,SHARE,$4,172,2025-02-14,2025-02-21,7
250,CB_2025_Feb_FB_3784_SO-RP_V05_4x5_IMG_EN_Opti_C-Headline_Evergreen_CTA-NONE_Angle-W_M-NONE_VL-None_G-NONE_P-OG_S-NONE_FB3726V01,3784 - 3726 ad copy opti || Enhancements: OFF || CBV1 || Batch 1 || 1C || 09/02/25w07 || Kostas,SHARE,$3,187,2025-02-09,2025-02-17,8
251,CB_2025_Jan_FB_3766_SO_V02_4x5_IMG_EN_Opti_C-Headline_Evergreen_CTA-NONE_Angle-W-B-C_M-NONE_VL-None_G-NONE_P-NONE_S-NONE_3700V08,3766 - 3700 copy opti || Enhancements: OFF || CBV1 || Batch 1 || 1C || 03/02/25w06 || Kostas,SHARE,$3,231,2025-02-04,2025-02-22,18
252,CB_2025_Feb_FB_3811_DT_V03_9x16_VID_EN_Opti_C-Sale_Sale_CTA-70_Angle-W_M-JOG_VL-45s_G-M-F_P-OG_S-Moon_FB2263V04,3811 - #133 Green screen timeframe hooks || Enhancements: OFF || CBV1 || Batch 1 || 7C || 19/02/25w08 || Kostas,VIDEO,$3,153,2025-02-19,2025-03-11,20
253,CB_2025_Jan_FB_3777_CHUB-KZ_V04_4x5_IMG_EN_Opti_C-NONE_CTA-NONE_Angle-C_M-NONE_VL-None_TR-None_G-NONE_P-NONE_S-NONE,3777 - 3696 Opti || Enhancements: OFF || CBV1 || Batch 1 || 1C || 11/02/25w07 || Kostas,SHARE,$3,228,2025-02-11,2025-02-21,10
254,CB_2024_Dec_FB_3622_LZ-KB_V03_4x5_IMG_EN_Opti_C-NONE_Sale_CTA-XMAS_Angle-GH_M-NONE_VL-None_G-NONE_P-OG_S-NONE_FB2227V08 - Copy,US || Manual Bid || BID CAP 111 || 1C || 21/12/24,SHARE,$3,128,2024-12-22,2025-03-26,94
255,CB_2025_Feb_FB_3801_SO-KB_V09_1x1_IMG_EN_New_C-A-Compare_Evergreen_CTA-NONE_Angle-W_M-NONE_VL-None_G-NONE_P-OG_S-NONE,3801 - America_s favorite meal ads || Enhancements: OFF || CBV1 || Batch 3 || 7DC || 12/02/25w07 || Kostas,SHARE,$3,140,2025-02-12,2025-02-18,6
256,CB_2025_Jan_FB_3786_LZ_V02_1x1_IMG_EN_New_C-Educational_Evergreen_CTA-SALE_Angle-GH_M-NONE_VL-None_G-NONE_P-OG_S-NONE,3786 - #92 Notion idea gamers' diet || Enhancements: OFF || CBV1 || Batch 1 || 7C || 09/02/25w07 || Kostas,SHARE,$2,99,2025-02-09,2025-02-17,8
257,CB_2025_Jan_FB_3779_VK-DP_V01_1x1_VID_EN_Opti_C-BulletPoints_Evergreen_CTA-70_Angle-W-B-C_M-NONE_VL-None_G-F_P-OG_S-NEW_FB3705V02,3779 - opti 3705 || Enhancements: OFF || CBV1 || Batch 1 || 1C || 04/02/25w06 || Kostas,SHARE,$2,122,2025-02-04,2025-03-20,44
258,CB_2025_Feb_FB_3782_CHUB_V06_9x16_VID_EN_New_C-NONE_CTA-NONE_Angle-None_M-NONE_VL-None_TR-None_G-NONE_P-NONE_S-NONE,Relaunch - 3782 - Political weight loss journey CHUB || Enhancements: OFF || CBV1 || Batch 2 || 1C || 11/02/25w07 || Kostas,VIDEO,$2,86,2025-02-10,2025-02-17,7
259,CB_2025_Feb_FB_3792_SO-RP_V07_1x1_IMG_EN_Opti_C-NegativeMark_Sale_CTA-Vday_Angle-Cort_M-NONE_VL-None_G-NONE_P-NONE_S-NONE_FB3251V02,3792 - 3072 Valentines opti IMG || Enhancements: OFF || CBV1 || Batch 2 || 1C || 09/02/25w07 || Kostas,SHARE,$2,137,2025-02-09,2025-02-17,8
260,CB_2025_Feb_FB_3784_SO-RP_V01_4x5_IMG_EN_Opti_C-Headline_Evergreen_CTA-NONE_Angle-W_M-NONE_VL-None_G-NONE_P-OG_S-NONE_FB3726V01,3784 - 3726 ad copy opti || Enhancements: OFF || CBV1 || Batch 1 || 1C || 09/02/25w07 || Kostas,SHARE,$2,100,2025-02-09,2025-02-17,8
261,CB_2025_Feb_FB_3799_SO-KB_V05_1x1_IMG_EN_New_C-A-Compare_Evergreen_CTA-NONE_Angle-W_M-NONE_VL-None_G-NONE_P-OG_S-NONE,3799 - Don_t change your habits || Enhancements: OFF || CBV1 || Batch 2 || 7DC || 12/02/25w07 || Kostas,SHARE,$2,91,2025-02-12,2025-02-21,9
262,CB_2025_Feb_FB_3801_SO-KB_V03_1x1_IMG_EN_New_C-A-Compare_Evergreen_CTA-NONE_Angle-W_M-NONE_VL-None_G-NONE_P-OG_S-NONE,3801 - America_s favorite meal ads || Enhancements: OFF || CBV1 || Batch 1 || 7DC || 12/02/25w07 || Kostas,SHARE,$2,59,2025-02-12,2025-02-17,5
263,CB_2025_Feb_FB_3799_SO-KB_V06_1x1_IMG_EN_New_C-A-Compare_Evergreen_CTA-NONE_Angle-W_M-NONE_VL-None_G-NONE_P-OG_S-NONE,3799 - Don_t change your habits || Enhancements: OFF || CBV1 || Batch 2 || 7DC || 12/02/25w07 || Kostas,SHARE,$2,69,2025-02-12,2025-02-21,9
264,CB_2024_Jan_FB_2762_IK_V04_1x1_IMG_EN_New_C-WrittenTesti_CTA-CTA_Pain-W-B-C_M-NONE_VL-None_TR-None_G-NONE_P-V2_S-NONE,CBV2 || AU || 💰 Advantage+ || US || BROAD || 7C || Existing_customer_5% || 19/12/24 Ad set,SHARE,$2,58,2024-12-19,2025-03-27,98
265,CB_2024_Oct_FB_3251_LZ-VU_V01_1x1_IMG_EN_New_C-NegativeMark_Evergreen_CTA-NONE_Angle-Cort_M-NONE_VL-None_G-NONE_P-NONE_S-NONE.png,US || Manual Bid || BFCM || COST CAP 91 || 1C || 15/11/24,SHARE,$2,67,2024-11-15,2025-02-27,104
266,CB_2025_Jan_FB_3747_CHUB-AA_V04_9x16_IMG_EN_Opti_C-NONE_CTA-NONE_Angle-Sale_M-NONE_VL-None_TR-None_G-NONE_P-OG_S-NONE,3747 Clean Sale [HB winner ITR] CHUB || Enhancements: OFF || CBV1 || Batch ą || 1C || 02/02/25w06 || Kostas,SHARE,$2,60,2025-02-02,2025-03-27,53
267,CB_2025_Jan_FB_3718_CHUB_V06_4x5_IMG_EN_Opti_C-NONE_CTA-NONE_Angle-C_M-NONE_VL-None_TR-None_G-M_P-OG_S-NONE,3718 - Looking 15 people OPTI || Enhancements: OFF || CBV1 || Batch 2 || 1C || 29/01/25w05 || Kostas,SHARE,$1,91,2025-01-29,2025-02-20,22
268,CB_2025_Feb_FB_3784_SO-RP_V09_4x5_IMG_EN_Opti_C-Headline_Evergreen_CTA-NONE_Angle-W_M-NONE_VL-None_G-NONE_P-OG_S-NONE_FB3726V01,3784 - 3726 ad copy opti || Enhancements: OFF || CBV1 || Batch 2 || 1C || 09/02/25w07 || Kostas,SHARE,$1,52,2025-02-09,2025-02-26,17
269,CB_2025_Feb_FB_3806_SO-KB_V04_1x1_IMG_EN_New_C-A-Compare_Evergreen_CTA-NONE_Angle-W_M-NONE_VL-None_G-NONE_P-OG_S-NONE,"3806 - Brief Results, not resolutions || Enhancements: OFF || CBV1 || Batch 1 || 7DC || 12/02/25w07 || Kostas",SHARE,$1,74,2025-02-12,2025-02-18,6
270,CB_2025_Jan_FB_3766_SO_V04_4x5_IMG_EN_Opti_C-Headline_Evergreen_CTA-NONE_Angle-W-B-C_M-NONE_VL-None_G-NONE_P-NONE_S-NONE_3700V08,3766 - 3700 copy opti || Enhancements: OFF || CBV1 || Batch 1 || 1C || 03/02/25w06 || Kostas,SHARE,$1,72,2025-02-04,2025-02-22,18
271,CB_2025_Feb_FB_3804_LZ-KB_V02_1x1_VID_EN_New_C-BulletPoints_Evergreen_CTA-NONE_Angle-GH_M-NONE_VL-None_G-NONE_P-NONE_S-NONE,3804 - fit back into your jeans || Enhancements: OFF || CBV1 || Batch 1 || 7DC || 12/02/25w07 || Kostas,SHARE,$1,38,2025-02-12,2025-02-17,5
272,CB_2024_Nov_FB_3336_CH_V15_1x1_IMG_EN_Opti_C-Headline_CTA-NONE_Angle-C_P-NONE,3336 Creative Hub – Golden nuggets V1 - Opti [Not tested] || Enhancements: OFF || CBV1 || Batch 1 || 1C || 11/02/25w07 || Kostas,SHARE,$1,53,2025-02-11,2025-02-21,10
273,CB_2025_Feb_FB_3799_SO-KB_V04_1x1_IMG_EN_New_C-A-Compare_Evergreen_CTA-NONE_Angle-W_M-NONE_VL-None_G-NONE_P-OG_S-NONE,3799 - Don_t change your habits || Enhancements: OFF || CBV1 || Batch 1 || 7DC || 12/02/25w07 || Kostas,SHARE,$1,55,2025-02-12,2025-02-18,6
274,CB_2025_Jan_FB_3740_VK-DP_V03_4x5_IMG_EN_Opti_C-Headline_Evergreen_CTA-NONE_Angle-W_M-NONE_VL-None_G-NONE_P-OG_S-NONE_3608V03,3797 - Man boobs-dad bod angle_IMG CB V1 - VK || Enhancements: OFF || CBV1 || Batch 1 || 7DC || 11/02/25w07 || Kostas,SHARE,$1,53,2025-02-11,2025-02-17,6
275,CB_2025_Feb_FB_3801_SO-KB_V05_1x1_IMG_EN_New_C-A-Compare_Evergreen_CTA-NONE_Angle-W_M-NONE_VL-None_G-NONE_P-OG_S-NONE,3801 - America_s favorite meal ads || Enhancements: OFF || CBV1 || Batch 2 || 7DC || 12/02/25w07 || Kostas,SHARE,$1,7,2025-02-12,2025-02-17,5
276,CB_2025_Feb_FB_3784_SO-RP_V04_4x5_IMG_EN_Opti_C-Headline_Evergreen_CTA-NONE_Angle-W_M-NONE_VL-None_G-NONE_P-OG_S-NONE_FB3726V01,3784 - 3726 ad copy opti || Enhancements: OFF || CBV1 || Batch 1 || 1C || 09/02/25w07 || Kostas,SHARE,$1,64,2025-02-09,2025-02-17,8
277,CB_2025_Jan_FB_3723_SO_V16_4x5_IMG_EN_New_C-NONE_Evergreen_CTA-SALE_Angle-W_M-NONE_VL-None_G-NONE_P-NONE_S-NONE,3723 - Notion Idea #92 MAN BOOBS || Enhancements: OFF || CBV1 || Batch 4 || 1C || 28/01/25w05 || Kostas,SHARE,$1,74,2025-01-28,2025-03-11,42
278,CB_2025_Feb_FB_3799_SO-KB_V01_1x1_IMG_EN_New_C-A-Compare_Evergreen_CTA-NONE_Angle-W_M-NONE_VL-None_G-NONE_P-OG_S-NONE - Copy,3799 - Don_t change your habits || Enhancements: OFF || CBV1 || Batch 1 || 7DC || 12/02/25w07 || Kostas,SHARE,$1,49,2025-02-12,2025-02-18,6
279,CB_2025_Feb_FB_3793_VK-DP_V05_1x1_VID_EN_Opti_C-BulletPoints_Evergreen_CTA-70_Angle-W-B-C_M-NONE_VL-None_G-F_P-OG_S-NEW_FB3705V02,3793 -  3705 test opti || Enhancements: OFF || CBV1 || Batch 2 || 1C || 11/02/25w07 || Kostas,SHARE,$1,60,2025-02-11,2025-02-17,6
280,CB_2025_Feb_FB_3799_SO-KB_V02_1x1_IMG_EN_New_C-A-Compare_Evergreen_CTA-NONE_Angle-W_M-NONE_VL-None_G-NONE_P-OG_S-NONE,3799 - Don_t change your habits || Enhancements: OFF || CBV1 || Batch 1 || 7DC || 12/02/25w07 || Kostas,SHARE,$1,42,2025-02-12,2025-02-18,6
281,CB_2025_Feb_FB_3804_LZ-KB_V03_1x1_VID_EN_New_C-BulletPoints_Evergreen_CTA-NONE_Angle-GH_M-NONE_VL-None_G-NONE_P-NONE_S-NONE,3804 - fit back into your jeans || Enhancements: OFF || CBV1 || Batch 1 || 7DC || 12/02/25w07 || Kostas,SHARE,$1,33,2025-02-12,2025-02-17,5
282,CB_2022_Mar3_FB_713_IK_V04_1x1_IMG_EN_Opti_C-WrittenTesti_HE-98_A-ExtremeBodyVisualization_HK-bodypart_Pain-W_CLR-PURPLE_BG-IMAGE_ME-MIX_MA-YOUNG,US || Manual Bid || BFCM || COST CAP 71 || 1C || 15/11/24,SHARE,$1,39,2024-11-15,2025-03-27,132
283,CB_2025_Jan_FB_3786_LZ_V04_1x1_IMG_EN_New_C-Educational_Evergreen_CTA-SALE_Angle-GH_M-NONE_VL-None_G-NONE_P-OG_S-NONE,3786 - #92 Notion idea gamers' diet || Enhancements: OFF || CBV1 || Batch 1 || 7C || 09/02/25w07 || Kostas,SHARE,$1,29,2025-02-09,2025-02-17,8
284,CB_2025_Feb_FB_3796_LZ-DP_V04_9x16_VID_EN_New_C-Testimonial_Evergreen_CTA-SALE_Angle-W-B_M-TIFF_VL-45s_G-F_P-OG_S-NEW,3796 - CB ads everywhere || Enhancements: OFF || CBV1 || Batch 1 || 1C || 11/02/25w07 || Kostas,VIDEO,$1,30,2025-02-11,2025-02-17,6
285,CB_2025_Feb_FB_3796_LZ-DP_V02_9x16_VID_EN_New_C-Testimonial_Evergreen_CTA-SALE_Angle-W-B_M-TIFF_VL-45s_G-F_P-OG_S-NEW,3796 - CB ads everywhere || Enhancements: OFF || CBV1 || Batch 1 || 1C || 11/02/25w07 || Kostas,VIDEO,$1,25,2025-02-11,2025-02-17,6
286,CB_2025_Feb_FB_3809_LZ-JT_V02_1x1_IMG_EN_New_C-Educational_Evergreen_CTA-NONE_Angle-C_M-NONE_VL-None_G-NONE_P-NONE_S-NONE,3809 - 30 day detox RED 40 LBS || Enhancements: OFF || CBV1 || Batch 1 || 7DC || 12/02/25w07 || Kostas,SHARE,$1,18,2025-02-12,2025-02-17,5
287,CB_2025_Jan_FB_3786_LZ_V03_1x1_IMG_EN_New_C-Educational_Evergreen_CTA-SALE_Angle-GH_M-NONE_VL-None_G-NONE_P-OG_S-NONE,3786 - #92 Notion idea gamers' diet || Enhancements: OFF || CBV1 || Batch 1 || 7C || 09/02/25w07 || Kostas,SHARE,$1,36,2025-02-09,2025-02-17,8
288,CB_2025_Jan_FB_3687_DT_V03_4x5_VID_EN_Opti_C-MakingOf_Sale_CTA-VDAY_Angle-W-B-C_M-POW_VL-45s_G-M_P-OG_S-Moon_FB3090V02,3687 - Valentine_s Day Opti 3090 || Enhancements: OFF || CBV1 || Batch ą || 1C || 02/02/25w06 || Kostas,SHARE,$1,42,2025-02-02,2025-02-19,17
289,CB_2025_Feb_FB_3797_VK-DP_V01_1x1_IMG_EN_Opti_C-BulletPoints_Evergreen_CTA-70_Angle-W-B-C_M-NONE_VL-None_G-F_P-OG_S-NEW_FB3639V03,3797 - Man boobs-dad bod angle_IMG CB V1 - VK || Enhancements: OFF || CBV1 || Batch 1 || 7DC || 11/02/25w07 || Kostas,SHARE,$0,27,2025-02-11,2025-02-17,6
290,CB_2025_Feb_FB_3796_LZ-DP_V01_9x16_VID_EN_New_C-Testimonial_Evergreen_CTA-SALE_Angle-W-B_M-TIFF_VL-45s_G-F_P-OG_S-NEW,3796 - CB ads everywhere || Enhancements: OFF || CBV1 || Batch 1 || 1C || 11/02/25w07 || Kostas,SHARE,$0,34,2025-02-11,2025-02-17,6
291,CB_2025_Feb_FB_3801_SO-KB_V06_1x1_IMG_EN_New_C-A-Compare_Evergreen_CTA-NONE_Angle-W_M-NONE_VL-None_G-NONE_P-OG_S-NONE,3801 - America_s favorite meal ads || Enhancements: OFF || CBV1 || Batch 2 || 7DC || 12/02/25w07 || Kostas,SHARE,$0,10,2025-02-12,2025-02-17,5
292,CB_2025_Feb_FB_3807_DT-DP_V03_9x16_VID_EN_Opti_C-Testimonial_CTA-70_Angle-W_M-TRC_VL-45s_G-F_P-OG_S-MOON_FB2865V04,3807 - Green screen reaction test || Enhancements: OFF || CBV1 || Batch 2 || 7DC || 12/02/25w07 || Kostas,VIDEO,$0,16,2025-02-12,2025-02-17,5
293,CB_2025_Feb_FB_3799_SO-KB_V01_1x1_IMG_EN_New_C-A-Compare_Evergreen_CTA-NONE_Angle-W_M-NONE_VL-None_G-NONE_P-OG_S-NONE,3801 - America_s favorite meal ads || Enhancements: OFF || CBV1 || Batch 1 || 7DC || 12/02/25w07 || Kostas,SHARE,$0,10,2025-02-12,2025-02-17,5
294,CB_2025_Feb_FB_3806_SO-KB_V02_1x1_IMG_EN_New_C-A-Compare_Evergreen_CTA-NONE_Angle-W_M-NONE_VL-None_G-NONE_P-OG_S-NONE,"3806 - Brief Results, not resolutions || Enhancements: OFF || CBV1 || Batch 1 || 7DC || 12/02/25w07 || Kostas",SHARE,$0,9,2025-02-12,2025-02-18,6
295,CB_2025_Jan_FB_3750_LZ-VU_V05_4x5_IMG_EN_Opti_C-NegativeMark_Evergreen_CTA-NONE_Angle-W_M-NONE_VL-None_G-NONE_P-NONE_S-NONE_FB3251V01,3750 - bioma ripoff march soft version || Enhancements: OFF || CBV1 || Batch 1 || 1C || 24/01/25w04 || Kostas,SHARE,$0,14,2025-01-24,2025-02-17,24
296,CB_2025_Feb_FB_3792_SO-RP_V08_1x1_IMG_EN_Opti_C-NegativeMark_Sale_CTA-Vday_Angle-Cort_M-NONE_VL-None_G-NONE_P-NONE_S-NONE_FB3251V02,3792 - 3072 Valentines opti IMG || Enhancements: OFF || CBV1 || Batch 2 || 1C || 09/02/25w07 || Kostas,SHARE,$0,9,2025-02-09,2025-02-17,8
297,CB_2025_Feb_FB_3809_LZ-JT_V01_1x1_IMG_EN_New_C-Educational_Evergreen_CTA-NONE_Angle-GH_M-NONE_VL-None_G-NONE_P-NONE_S-NONE,3809 - 30 day detox RED 40 LBS || Enhancements: OFF || CBV1 || Batch 1 || 7DC || 12/02/25w07 || Kostas,SHARE,$0,14,2025-02-12,2025-02-17,5
298,CB_2025_Feb_FB_3799_SO-KB_V02_1x1_IMG_EN_New_C-A-Compare_Evergreen_CTA-NONE_Angle-W_M-NONE_VL-None_G-NONE_P-OG_S-NONE,3801 - America_s favorite meal ads || Enhancements: OFF || CBV1 || Batch 1 || 7DC || 12/02/25w07 || Kostas,SHARE,$0,9,2025-02-12,2025-02-17,5
299,CB_2024_Dec_FB_3611_CHUB_V05_4x5_IMG_EN_Opti_C-Headline_CTA-NONE_Angle-C_P-NONE_S-NONE - Copy,US || Manual Bid || BID CAP 111 || 1C || 21/12/24,SHARE,$0,7,2024-12-27,2025-03-24,87
300,CB_2025_Feb_FB_3792_SO-RP_V10_1x1_IMG_EN_Opti_C-NegativeMark_Sale_CTA-Vday_Angle-Cort_M-NONE_VL-None_G-NONE_P-NONE_S-NONE_FB3251V02,3792 - 3072 Valentines opti IMG || Enhancements: OFF || CBV1 || Batch 2 || 1C || 09/02/25w07 || Kostas,SHARE,$0,4,2025-02-09,2025-02-17,8
301,CB_2024_Nov_FB_3336_CH_V14_1x1_IMG_EN_Opti_C-Headline_CTA-NONE_Angle-C_P-NONE - Copy,3336 Creative Hub – Golden nuggets V1 - Opti [Not tested] || Enhancements: OFF || CBV1 || Batch 1 || 1C || 11/02/25w07 || Kostas,SHARE,$0,9,2025-02-11,2025-02-20,9
302,CB_2023_May_FB_2103_MB_V02_9x16_VID_EN_Opti_C-Sale_CTA-SMR_Pain-W_M-JOG_VL-30s_TR-None_G-M-F_P-None_S-What,US || Manual Bid || BID CAP 111 || 1C || 21/12/24,VIDEO,$0,7,2024-12-28,2025-03-27,89
303,CB_2025_Jan_FB_3718_CHUB_V04_4x5_IMG_EN_Opti_C-NONE_CTA-NONE_Angle-C_M-NONE_VL-None_TR-None_G-M_P-OG_S-NONE,3718 - Looking 15 people OPTI || Enhancements: OFF || CBV1 || Batch 2 || 1C || 29/01/25w05 || Kostas,SHARE,$0,6,2025-01-30,2025-02-20,21
304,CB_2025_Feb_FB_3793_VK-DP_V08_1x1_VID_EN_Opti_C-BulletPoints_Evergreen_CTA-70_Angle-W-B-C_M-NONE_VL-None_G-F_P-OG_S-NEW_FB3705V02,3793 -  3705 test opti || Enhancements: OFF || CBV1 || Batch 2 || 1C || 11/02/25w07 || Kostas,SHARE,$0,4,2025-02-11,2025-02-17,6
305,CB_2025_Feb_FB_3806_SO-KB_V01_1x1_IMG_EN_New_C-A-Compare_Evergreen_CTA-NONE_Angle-W_M-NONE_VL-None_G-NONE_P-OG_S-NONE,"3806 - Brief Results, not resolutions || Enhancements: OFF || CBV1 || Batch 1 || 7DC || 12/02/25w07 || Kostas",SHARE,$0,6,2025-02-12,2025-02-18,6
306,CB_2025_Feb_FB_3782_CHUB_V03_9x16_VID_EN_New_C-NONE_CTA-NONE_Angle-None_M-NONE_VL-None_TR-None_G-NONE_P-NONE_S-NONE,Relaunch - 3782 - Political weight loss journey CHUB || Enhancements: OFF || CBV1 || Batch 2 || 1C || 11/02/25w07 || Kostas,VIDEO,$0,5,2025-02-10,2025-02-17,7
307,CB_2025_Feb_FB_3806_SO-KB_V06_1x1_IMG_EN_New_C-A-Compare_Evergreen_CTA-NONE_Angle-W_M-NONE_VL-None_G-NONE_P-OG_S-NONE,"3806 - Brief Results, not resolutions || Enhancements: OFF || CBV1 || Batch 2 || 7DC || 12/02/25w07 || Kostas",SHARE,$0,4,2025-02-12,2025-02-17,5
308,CB_2023_Jul_FB_2226_MB_V04_9x16_VID_EN_Opti_C-Testim_CTA-SMR_Pain-W_M-MIX_VL-30s_TR-None_G-F_P-None_S-Starry,US || Manual Bid || BID CAP 111 || 1C || 21/12/24,VIDEO,$0,1,2024-12-27,2025-03-11,74
309,CB_2025_Feb_FB_3807_DT-DP_V02_9x16_VID_EN_Opti_C-Testimonial_Sale_CTA-70_Angle-W_M-MIX_VL-30s_G-F_P-OG_S-Starry_FB2226V04,3807 - Green screen reaction test || Enhancements: OFF || CBV1 || Batch 2 || 7DC || 12/02/25w07 || Kostas,VIDEO,$0,3,2025-02-12,2025-02-17,5
310,CB_2025_Feb_FB_3797_VK-DP_V02_1x1_IMG_EN_Opti_C-BulletPoints_Evergreen_CTA-70_Angle-W-B-C_M-NONE_VL-None_G-F_P-OG_S-NEW_FB3726V01,3797 - Man boobs-dad bod angle_IMG CB V1 - VK || Enhancements: OFF || CBV1 || Batch 1 || 7DC || 11/02/25w07 || Kostas,SHARE,$0,1,2025-02-11,2025-02-17,6
311,CB_2025_Jan_FB_3779_VK-DP_V03_1x1_VID_EN_Opti_C-BulletPoints_Evergreen_CTA-70_Angle-W-B-C_M-NONE_VL-None_G-F_P-OG_S-NEW_FB3705V02,3779 - opti 3705 || Enhancements: OFF || CBV1 || Batch 1 || 1C || 04/02/25w06 || Kostas,SHARE,$0,3,2025-02-04,2025-03-20,44
312,CB_2025_Jan_FB_3750_LZ-VU_V01_4x5_IMG_EN_Opti_C-NegativeMark_Evergreen_CTA-NONE_Angle-W_M-NONE_VL-None_G-NONE_P-NONE_S-NONE_FB3251V01,3750 - bioma ripoff march soft version || Enhancements: OFF || CBV1 || Batch 1 || 1C || 24/01/25w04 || Kostas,SHARE,$0,3,2025-01-24,2025-02-17,24
313,CB_2025_Jan_FB_3750_LZ-VU_V04_4x5_IMG_EN_Opti_C-NegativeMark_Evergreen_CTA-NONE_Angle-W_M-NONE_VL-None_G-NONE_P-NONE_S-NONE_FB3251V01,3750 - bioma ripoff march soft version || Enhancements: OFF || CBV1 || Batch 1 || 1C || 24/01/25w04 || Kostas,SHARE,$0,1,2025-01-24,2025-02-17,24
314,CB_2025_Feb_FB_3806_SO-KB_V05_1x1_IMG_EN_New_C-A-Compare_Evergreen_CTA-NONE_Angle-W_M-NONE_VL-None_G-NONE_P-OG_S-NONE,"3806 - Brief Results, not resolutions || Enhancements: OFF || CBV1 || Batch 2 || 7DC || 12/02/25w07 || Kostas",SHARE,$0,7,2025-02-12,2025-02-17,5
315,CB_2024_Oct_FB_3251_LZ-VU_V01_1x1_IMG_EN_New_C-NegativeMark_Evergreen_CTA-NONE_Angle-Cort_M-NONE_VL-None_G-NONE_P-NONE_S-NONE.png,US || Manual Bid || BFCM || COST CAP 81 || 1C || 15/11/24,SHARE,$0,1,2024-11-15,2025-03-17,122
316,CB_2025_Feb_FB_3792_SO-RP_V09_1x1_IMG_EN_Opti_C-NegativeMark_Sale_CTA-Vday_Angle-Cort_M-NONE_VL-None_G-NONE_P-NONE_S-NONE_FB3251V02,3792 - 3072 Valentines opti IMG || Enhancements: OFF || CBV1 || Batch 2 || 1C || 09/02/25w07 || Kostas,SHARE,$0,1,2025-02-09,2025-02-17,8
317,CB_2022_Mar3_FB_713_IK_V04_1x1_IMG_EN_Opti_C-WrittenTesti_HE-98_A-ExtremeBodyVisualization_HK-bodypart_Pain-W_CLR-PURPLE_BG-IMAGE_ME-MIX_MA-YOUNG,US || Manual Bid || BFCM || COST CAP 81 || 1C || 15/11/24,SHARE,$0,1,2024-11-15,2025-03-26,131
