,Ad Name,Adset Name,Creative Type,Spend In USD,Impressions,First Ad Spend Date,Last Ad Spend Date,Days ad spending
1,CB_2025_Feb_FB_3883_LZ-RP_V05_9x16_VID_EN_Opti_C-BulletPoints_Evergreen_CTA-SALE_Angle-W_M-JANW_VL-30s_G-M_P-OG_S-WHAT_FB2284V05,ðŸŒ¶ï¸  || ASC+ || US || 0% EXISTING CAP || 7C || 15/05/2025  Campaign Ad set,VIDEO,"$12,367","488,674",2025-05-15,2025-06-16,32
2,CB_2025_Jan_FB_3748_VK-DP_V01_4x5_IMG_EN_New_C-BulletPoints_Sale_CTA-NY_Angle-W-B-C_M-NONE_VL-None_G-M_P-OG_S-NONE,GLP-1 ðŸ’œ || ASC+ || US || 5% EXISTING CAP || 7C || 29/05/2025 Ad set,SHARE,"$11,390","312,648",2025-06-02,2025-06-16,14
3,CB_2025_Jan_FB_3751_VK-DP_V01_4x5_IMG_EN_New_C-BulletPoints_Sale_CTA-NY_Angle-W-B-C_M-NONE_VL-None_G-M_P-GLP1_S-NONE,GLP-1 ðŸ’œ || ASC+ || US || 5% EXISTING CAP || 7C || 29/05/2025 Ad set,SHARE,"$10,645","370,432",2025-06-02,2025-06-16,14
4,CB_2025_Jun_FB_4159_VK_V09_4x5_IMG_EN_New_C-BulletPoints_Evergreen_CTA-SALE_Angle-W-B-C_M-NONE_VL-None_G-M_P-OG_S-NONE,ðŸŒ¶ï¸  || ASC+ || US || 0% EXISTING CAP || 7C || 15/05/2025  Campaign Ad set,SHARE,"$10,137","472,546",2025-06-13,2025-06-16,3
5,CB_2025_May_FB_4100_SO-KB_V02_4x5_IMG_EN_New_C-Headline_Evergreen_CTA-NONE_Angle-W_M-NONE_VL-None_G-NONE_P-OG_S-NONE,ðŸŒ¶ï¸  || ASC+ || US || 0% EXISTING CAP || 7C || 15/05/2025  Campaign Ad set,SHARE,"$8,004","312,663",2025-06-03,2025-06-16,13
6,CB_2025_Jan_FB_3723_SO_V04_4x5_IMG_EN_New_C-NONE_Evergreen_CTA-SALE_Angle-W_M-NONE_VL-None_G-NONE_P-NONE_S-NONE - Copy,ðŸŒ¶ï¸  || ASC+ || US || 0% EXISTING CAP || 7C || 15/05/2025  Campaign Ad set,SHARE,"$7,427","427,025",2025-05-15,2025-06-16,32
7,CB_2023_Jul_FB_2217_IB_V04_9x16_VID_EN_Opti_C-Pointing_CTA-SMR_Pain-W-B_M-TRC_VL-30s_TR-None_G-F_P-None_S-FRIGGA - Copy,ðŸŒ¶ï¸  || ASC+ || US || 0% EXISTING CAP || 7C || 15/05/2025  Campaign Ad set,VIDEO,"$7,164","216,970",2025-05-15,2025-06-16,32
8,Dynamic_Creative_Statics_CA_Flow,WC || CA || DYNAMIC CREATIVE Static winners || ADV+ audience || 7C || 16.02.2025,SHARE,"$7,032","482,073",2025-02-16,2025-06-16,120
9,CB_2023_May_FB_2103_MB_V02_9x16_VID_EN_Opti_C-Sale_CTA-SMR_Pain-W_M-JOG_VL-30s_TR-None_G-M-F_P-None_S-What - Copy,ðŸŒ¶ï¸  || ASC+ || US || 0% EXISTING CAP || 7C || 15/05/2025  Campaign Ad set,VIDEO,"$6,038","160,462",2025-05-15,2025-06-16,32
10,CB_2025_May_FB_4091_LZ-VG_V02_4x5_IMG_EN_Opti_C-Sale_Sale_CTA-MEMO_Angle-Cort_M-NONE_VL-None_G-NONE_P-OG_S-NONE_FB4065_V04,ðŸŒ¶ï¸  || ASC+ || US || 0% EXISTING CAP || 7C || 15/05/2025  Campaign Ad set,SHARE,"$5,947","224,866",2025-06-08,2025-06-12,4
11,CB_2025_May_FB_4091_LZ-VG_V01_4x5_IMG_EN_Opti_C-Sale_Sale_CTA-MEMO_Angle-None_M-NONE_VL-None_G-NONE_P-OG_S-NONE_FB3907V03,ðŸŒ¶ï¸  || ASC+ || US || 0% EXISTING CAP || 7C || 15/05/2025  Campaign Ad set,SHARE,"$5,832","224,869",2025-05-26,2025-06-14,19
12,CB_2025_Jan_FB_3748_VK-DP_V01_4x5_IMG_EN_New_C-BulletPoints_Sale_CTA-NY_Angle-W-B-C_M-NONE_VL-None_G-M_P-OG_S-NONE,GLP-1 ðŸ’œ || ASC+ || CA || 5% EXISTING CAP || 7C || 29/05/2025 Ad set,SHARE,"$5,543","285,326",2025-06-10,2025-06-16,6
13,CB_2025_May_FB_4120_DT_V08_4x5_IMG_EN_New_C-Headline_Evergreen_CTA-65_Angle-W-B-C_M-NONE_VL-None_G-NONE_P-OG_S-NONE,ðŸŒ¶ï¸  || ASC+ || US || 0% EXISTING CAP || 7C || 15/05/2025  Campaign Ad set,SHARE,"$5,363","243,776",2025-06-08,2025-06-14,6
14,CB_2025_Mar_FB_3914_DT-DP_V01_9x16_VID_EN_New_C-Trend_Sale_CTA-SPRNG_Angle-W-B-C_M-JOG_VL-30s_G-F_P-OG_S-NEW,ðŸŒ¶ï¸  || ASC+ || US || 0% EXISTING CAP || 7C || 15/05/2025  Campaign Ad set,VIDEO,"$4,337","138,353",2025-05-15,2025-06-16,32
15,CB_2023_Apr_FB_1989_RS_V08_9x16_VID_EN_Opti_C-Trend_CTA-SMR_Pain-W_M-MIX_VL-30s_TR-None_G-MF_P-None,ðŸŒ¶ï¸  || ASC+ || US || 0% EXISTING CAP || 7C || 15/05/2025  Campaign Ad set,VIDEO,"$4,167","128,881",2025-05-15,2025-06-16,32
16,CB_2025_Jun_FB_4145_DT-KB_V08_4x5_IMG_EN_Opti_C-NONE_SALE_CTA-65_Angle-W_M-NONE_VL-None_G-NONE_P-NONE_S-NONE_FB3812V03 - CC,ðŸ‘¨ || Father's Day || Bundle offer  || ASC+ || US || 0% EXISTING CAP || 7C || 07/06/2025 Ad set,SHARE,"$3,773","185,639",2025-06-07,2025-06-16,9
17,CB_2025_Jan_FB_3748_VK-DP_V02_4x5_IMG_EN_New_C-BulletPoints_Sale_CTA-NY_Angle-W-B-C_M-NONE_VL-None_G-M_P-OG_S-NONE.png - Copy,3748 - winner ads opti - GLP1 - VK-DP || Enhancements: OFF || GLP-1 || Batch 1 || 7C || 20/02/25w09 || Valentinas,SHARE,"$2,660","87,797",2025-02-24,2025-06-16,112
18,CB_2025_Feb_FB_3827_LZ_V04_1x1_IMG_EN_Opti_C-Headline_Evergreen_CTA-SALE_Angle-W_M-NONE_VL-None_G-M_P-CBV2_S-NONE_FB3779V02,CBV2 || US || Manual Bid: ROAS GOAL: 1.00 -> 1.1 || 7DC || 22/01/2025,SHARE,"$2,616","87,785",2025-02-18,2025-06-16,118
19,CB_2025_May_FB_4086_SO_V01_4x5_IMG_EN_New_C-NONE_Evergreen_CTA-NONE_Angle-W_M-NONE_VL-None_G-NONE_P-OG_S-NONE,âš«ï¸ US || CBV2 || Advantage+ || 7C || BROAD || Existing_customer_0% || || 24/04/25 Ad set,SHARE,"$2,488","119,998",2025-05-20,2025-06-16,27
20,CB_2025_Jan_FB_3748_VK-DP_V01_4x5_IMG_EN_New_C-BulletPoints_Sale_CTA-NY_Angle-W-B-C_M-NONE_VL-None_G-M_P-OG_S-NONE,3748 - winner ads opti - GLP1 - VK-DP || Enhancements: OFF || GLP-1 Booster || 7C1V || 30/05/25w22,SHARE,"$2,440","68,167",2025-05-30,2025-06-16,17
21,CB_2023_May_FB_2263_MB_V04_9x16_VID_EN_New_C-Sale_CTA-SMR_Pain-W_M-JOG_VL-45s_TR-None_G-M-F_P-None_S-Moon - Copy,ðŸŒ¶ï¸  || ASC+ || US || 0% EXISTING CAP || 7C || 15/05/2025  Campaign Ad set,VIDEO,"$2,363","61,611",2025-05-15,2025-06-14,30
22,CB_2025_Jun_FB_4145_DT-KB_V04_4x5_IMG_EN_Opti_C-NONE_Sale_CTA-65_Angle-W-B-C_M-NONE_VL-None_G-NONE_P-OG_S-NONE_FB3924V03 - BIOMA,ðŸ‘¨ || Father's Day || Bundle offer  || ASC+ || US || 0% EXISTING CAP || 7C || 07/06/2025 Ad set,SHARE,"$2,316","103,232",2025-06-07,2025-06-11,4
23,CB_2024_Apr_FB_2970_RS_V02_1x1_GIF_EN_Opti_C-WrittenTesti_CTA-CTA_Pain-W_M-NONE_VL-7s_TR-None_G-NONE_P-V2_S-NEW,CBV2 || US || Manual Bid: ROAS GOAL: 1.00 -> 1.1 || 7DC || 22/01/2025,VIDEO,"$2,242","69,282",2025-03-27,2025-06-16,81
24,CB_2024_Sep_FB_3175_DA-KB_V04_1x1_IMG_EN_New_C-ADVRT_Evergreen_CTA-NONE_Angle-W_M-NONE_VL-None_G-NONE_P-CBV2_S-NONE_blog_colonbroomvsmammoth_cv_en,CBV2 || Advantage+ || Advertorial || Higher pricing || US || 0% EXISTING CAP || BROAD || 7C || 20/01/25  Campaign Ad set,SHARE,"$2,200","87,368",2025-01-20,2025-06-16,147
25,CB_2025_May_FB_4100_SO_V02_4x5_IMG_EN_New_C-Headline_Evergreen_CTA-NONE_Angle-W_M-NONE_VL-None_G-NONE_P-OG_S-NONE,CA || ASC+ || 0% EXISTING || 7DC || 12.05.2025 RESTART Ad set,SHARE,"$2,165","167,978",2025-06-05,2025-06-16,11
26,CB_2025_May_FB_4140_SO-VG_V09_4x5_IMG_EN_Opti_C-NONE_Evergreen_CTA-NONE_Angle-W_M-NONE_VL-None_G-NONE_P-OG_S-NONE_FB4040V09 - BIOMA,ðŸ‘¨ || Father's Day || Bundle offer  || ASC+ || US || 0% EXISTING CAP || 7C || 07/06/2025 Ad set,SHARE,"$2,150","88,144",2025-06-07,2025-06-16,9
27,CB_2025_Jan_FB_3751_VK-DP_V01_4x5_IMG_EN_New_C-BulletPoints_Sale_CTA-NY_Angle-W-B-C_M-NONE_VL-None_G-M_P-GLP1_S-NONE,3751 - opti 3608 GLP1 - VK-DP || Batch 1 || Enhancements: OFF || GLP-1 Booster || 7C1V || 30/05/25w22,SHARE,"$2,142","80,891",2025-05-30,2025-06-16,17
28,CB_2025_May_FB_4093_LZ-VG_V02_4x5_IMG_EN_New_C-Headline_Sale_CTA-MEMO_Angle-W_M-NONE_VL-None_G-NONE_P-OG_S-NONE,ðŸŒ¶ï¸  || ASC+ || US || 0% EXISTING CAP || 7C || 15/05/2025  Campaign Ad set,SHARE,"$2,112","64,125",2025-05-26,2025-06-14,19
29,CB_2024_Aug_FB_3097_VK-DP_V03_9x16_VID_EN_Opti_C-Benefits_CTA-SMR_Pain-W-B_M-MIX_VL-45s_TR-None_G-MF_P-OG_S-WHAT_FB2516V13,ðŸŒ¶ï¸  || ASC+ || US || 0% EXISTING CAP || 7C || 15/05/2025  Campaign Ad set,VIDEO,"$2,022","77,817",2025-05-15,2025-06-16,32
30,CB_2025_Jun_FB_4159_VK_V09_4x5_IMG_EN_New_C-BulletPoints_Evergreen_CTA-SALE_Angle-W-B-C_M-NONE_VL-None_G-M_P-OG_S-NONE,CA || ASC+ || 0% EXISTING || 7DC || 12.05.2025 RESTART Ad set,SHARE,"$2,012","193,402",2025-06-14,2025-06-16,2
31,CB_2025_Jan_FB_3751_VK-DP_V01_4x5_IMG_EN_New_C-BulletPoints_Sale_CTA-NY_Angle-W-B-C_M-NONE_VL-None_G-M_P-GLP1_S-NONE,GLP-1 ðŸ’œ || ASC+ || CA || 5% EXISTING CAP || 7C || 29/05/2025 Ad set,SHARE,"$1,981","103,520",2025-06-10,2025-06-16,6
32,CB_2025_May_FB_4143_DT_V04_4x5_IMG_EN_New_C-Headline_Evergreen_CTA-65_Angle-W_M-NONE_VL-None_G-NONE_P-OG_S-NONE,ðŸŒ¶ï¸  || ASC+ || US || 0% EXISTING CAP || 7C || 15/05/2025  Campaign Ad set,SHARE,"$1,938","81,998",2025-06-06,2025-06-14,8
33,CB_2024_Sep_FB_3175_DA-KB_V04_1x1_IMG_EN_New_C-ADVRT_Evergreen_CTA-NONE_Angle-W_M-NONE_VL-None_G-NONE_P-CBV2_S-NONE_blog_colonbroomvsmammothhighprice3_cv_en,CBV2 || Advantage+ || Advertorial || Higher pricing || US || 0% EXISTING CAP || BROAD || 7C || 20/01/25  Campaign Ad set,SHARE,"$1,925","76,103",2025-04-16,2025-06-16,61
34,CB_2025_Jan_FB_3751_VK-DP_V01_4x5_IMG_EN_New_C-BulletPoints_Sale_CTA-NY_Angle-W-B-C_M-NONE_VL-None_G-M_P-GLP1_S-NONE,GLP-1 ðŸ’œ || ASC+ || UK || 5% EXISTING CAP || 7C || 29/05/2025 Ad set,SHARE,"$1,922","68,122",2025-06-10,2025-06-16,6
35,CB_2024_Aug_FB_3090_DT-DP_V02_9x16_VID_EN_Opti_C-MakingOf_CTA-CTA_Pain-W-B-C_M-POW_VL-45s_TR-None_G-M_P-OG_S-Moon_FB3029V04,ðŸŒ¶ï¸  || ASC+ || US || 0% EXISTING CAP || 7C || 15/05/2025  Campaign Ad set,VIDEO,"$1,864","67,765",2025-05-15,2025-06-16,32
36,CB_2025_Jan_FB_3748_VK-DP_V01_4x5_IMG_EN_New_C-BulletPoints_Sale_CTA-NY_Angle-W-B-C_M-NONE_VL-None_G-M_P-OG_S-NONE,GLP-1 ðŸ’œ || ASC+ || UK || 5% EXISTING CAP || 7C || 29/05/2025 Ad set,SHARE,"$1,830","65,769",2025-06-10,2025-06-13,3
37,CB_2025_Feb_FB_3774_SO-JT_V05_1x1_IMG_EN_New_C-Headline_Evergreen_CTA-NONE_Angle-W_M-NONE_VL-15s_G-NONE_P-GLP1_S-NONE,3774 - #114 SMASH GLP IMG || Batch 2 || Enhancements: OFF || GLP-1 Booster || 7C1V || 09/06/25w23,SHARE,"$1,766","61,267",2025-06-09,2025-06-16,7
38,CB_2025_Apr_FB_4054_LZ-DP_V01_9x16_VID_EN_Opti_C-MakingOf_Sale_CTA-SALE_Angle-W_M-PASQ_VL-30s_G-M_P-OG_S-NEW_FB3995V01,CA || ASC+ || 0% EXISTING || 7DC || 12.05.2025 RESTART Ad set,VIDEO,"$1,728","143,524",2025-05-14,2025-06-16,33
39,CB_2023_Dec_FB_2712_RS-DP_V02_1x1_VID_EN_Opti_C-WrittenTesti_CTA-SALE_Pain-W-B-C_M-NONE_VL-None_TR-None_G-NONE_P-V2_S-NONE_FB2227V08,CBV2 || EU (UK) || ðŸ’° Advantage+ || US || BROAD || 7C || Existing_customer_5% || 15/12/24 Ad set,VIDEO,"$1,721","71,138",2025-03-31,2025-06-16,77
40,CB_2023_Sep_FB_2429_DT_V03_9x16_VID_EN_Opti_C-Sale_CTA-CTA_Pain-W_M-MIX_VL-45s_TR-None_G-MF_P-V2_S-WHAT - Copy,âš«ï¸ US || CBV2 || Advantage+ || 7C || BROAD || Existing_customer_0% || || 24/04/25 Ad set,VIDEO,"$1,720","70,250",2025-04-24,2025-06-16,53
41,CB_2025_Feb_FB_3774_SO-JT_V03_1x1_IMG_EN_New_C-Headline_Evergreen_CTA-NONE_Angle-W_M-NONE_VL-15s_G-NONE_P-GLP1_S-NONE,3774 - #114 SMASH GLP IMG || Batch 1 || Enhancements: OFF || GLP-1 Booster || 7C1V || 09/06/25w23,SHARE,"$1,690","40,825",2025-06-09,2025-06-16,7
42,CB_2025_May_FB_4143_DT_V03_4x5_IMG_EN_New_C-Headline_Evergreen_CTA-65_Angle-W_M-NONE_VL-None_G-NONE_P-OG_S-NONE,ðŸŒ¶ï¸  || ASC+ || US || 0% EXISTING CAP || 7C || 15/05/2025  Campaign Ad set,SHARE,"$1,631","76,051",2025-06-14,2025-06-16,2
43,CB_2024_Aug_FB_3090_DT-DP_V02_9x16_VID_EN_Opti_C-MakingOf_CTA-CTA_Pain-W-B-C_M-POW_VL-45s_TR-None_G-M_P-OG_S-Moon_FB3029V04,âš«ï¸ US || CBV2 || Advantage+ || 7C || BROAD || Existing_customer_0% || || 24/04/25 Ad set,VIDEO,"$1,596","62,407",2025-04-24,2025-06-16,53
44,CB_2025_Jan_FB_3756_VK-DP_V01_4x5_IMG_EN_New_C-BulletPoints_Evergreen_CTA-NONE_Angle-W-B-C_M-NONE_VL-None_G-M_P-GLP1_S-NONE,3756 - opti 2834 GLP1 || Batch 1 || Enhancements: OFF || GLP-1 Booster || 7C1V || 30/05/25w22,SHARE,"$1,436","34,559",2025-05-30,2025-06-14,15
45,CB_2025_Jan_FB_3753_SO_V01_4x5_IMG_EN_New_C-Headline_Evergreen_CTA-NONE_Angle-W_M-NONE_VL-None_G-NONE_P-GLP1_S-NONE,3753 - Notion Idea #111 â€œDualâ€Benefit Vennâ€ || Batch 1 || Enhancements: OFF || GLP-1 Booster || 7C1V || 02/06/25w23,SHARE,"$1,333","35,677",2025-06-03,2025-06-16,13
46,CB_2025_Jun_FB_4171_DT_V03_9x16_VID_EN_Opti_C-MakingOf_Sale_CTA-65_Angle-W-B_M-CRAZY_VL-45s_G-M_P-OG_S-NEW_FB3264V31 - BIOMA,ðŸ‘¨ || Father's Day || Bundle offer  || ASC+ || US || 0% EXISTING CAP || 7C || 07/06/2025 Ad set,VIDEO,"$1,302","59,226",2025-06-07,2025-06-16,9
47,CB_2025_Jan_FB_3763_SO-DP_V04_1x1_IMG_EN_New_C-Headline_Evergreen_CTA-NONE_Angle-W_M-NONE_VL-None_G-NONE_P-GLP1_S-NONE,3763 - #117 Notion idea GLP IMG || Batch 1 || Enhancements: OFF || GLP-1 Booster || 7C1V || 09/06/25w23,SHARE,"$1,302","27,072",2025-06-09,2025-06-16,7
48,CB_2023_Aug_FB_2369_DA_V04_9x16_GIF_EN_New_C-Benefits_CTA-DISCOUNT_Pain-W-B_M-NONE_VL-15s_TR-None_G-NONE_P-V2_S-NEW,CBV2 || US || Manual Bid: ROAS GOAL: 1.00 -> 1.1 || 7DC || 22/01/2025,VIDEO,"$1,290","53,087",2025-04-28,2025-06-16,49
49,CB_2025_Jun_FB_4171_DT_V03_9x16_VID_EN_Opti_C-MakingOf_Sale_CTA-65_Angle-W-B_M-CRAZY_VL-45s_G-M_P-OG_S-NEW_FB3264V31 - CC,ðŸ‘¨ || Father's Day || Bundle offer  || ASC+ || US || 0% EXISTING CAP || 7C || 07/06/2025 Ad set,VIDEO,"$1,251","56,905",2025-06-07,2025-06-16,9
50,CB_2025_May_FB_4114_LZ-VG_V07_4x5_IMG_EN_New_C-Headline_Evergreen_CTA-NONE_Angle-C_M-NONE_VL-None_G-M_P-NONE_S-NONE,ðŸŒ¶ï¸  || ASC+ || US || 0% EXISTING CAP || 7C || 15/05/2025  Campaign Ad set,SHARE,"$1,204","53,799",2025-06-14,2025-06-16,2
51,CB_2025_Feb_FB_3774_SO-JT_V06_1x1_IMG_EN_New_C-Headline_Evergreen_CTA-NONE_Angle-W_M-NONE_VL-15s_G-NONE_P-GLP1_S-NONE,GLP-1 ðŸ’œ || ASC+ || US || 5% EXISTING CAP || 7C || 29/05/2025 Ad set,SHARE,"$1,192","31,938",2025-06-12,2025-06-16,4
52,CB_2025_Jan_FB_3748_VK-DP_V01_4x5_IMG_EN_New_C-BulletPoints_Sale_CTA-NY_Angle-W-B-C_M-NONE_VL-None_G-M_P-OG_S-NONE,GLP-1 ðŸ’œ || ASC+ || EU  || 7C || 14/06/2025 Ad set,SHARE,"$1,189","43,040",2025-06-14,2025-06-16,2
53,CB_2025_Mar_FB_3914_DT-DP_V01_9x16_VID_EN_New_C-Trend_Sale_CTA-SPRNG_Angle-W-B-C_M-JOG_VL-30s_G-F_P-OG_S-NEW,CA || ASC+ || 0% EXISTING || 7DC || 12.05.2025 RESTART Ad set,VIDEO,"$1,184","75,462",2025-05-12,2025-06-16,35
54,CB_2025_Feb_FB_3817_SO_V01_4x5_IMG_EN_Opti_C-NONE_Evergreen_CTA-SALE_Angle-W_M-NONE_VL-None_G-NONE_P-NONE_S-NONE_FB3723V07,CBV2 || EU (UK) || ðŸ’° Advantage+ || US || BROAD || 7C || Existing_customer_5% || 15/12/24 Ad set,SHARE,"$1,153","68,341",2025-02-14,2025-06-16,122
55,CB_2025_May_FB_4140_SO-VG_V12_4x5_IMG_EN_Opti_C-NONE_Evergreen_CTA-NONE_Angle-W_M-NONE_VL-None_G-NONE_P-OG_S-NONE_FB4040V09 - BIOMA,ðŸ‘¨ || Father's Day || Bundle offer  || ASC+ || US || 0% EXISTING CAP || 7C || 07/06/2025 Ad set,SHARE,"$1,149","49,999",2025-06-07,2025-06-12,5
56,CB_2025_May_FB_4086_SO_V01_4x5_IMG_EN_New_C-NONE_Evergreen_CTA-NONE_Angle-W_M-NONE_VL-None_G-NONE_P-OG_S-NONE,CBV2 || EU (UK) || ðŸ’° Advantage+ || US || BROAD || 7C || Existing_customer_5% || 15/12/24 Ad set,SHARE,"$1,147","73,502",2025-05-25,2025-06-16,22
57,CB_2025_Jun_FB_4145_DT-KB_V06_4x5_IMG_EN_Opti_C-BulletPoints_Sale_CTA-65_Angle-W-B-C_M-NONE_VL-None_G-M_P-OG_S-NONE_FB3891V05 - CC,ðŸ‘¨ || Father's Day || Bundle offer  || ASC+ || US || 0% EXISTING CAP || 7C || 07/06/2025 Ad set,SHARE,"$1,124","60,817",2025-06-07,2025-06-16,9
58,CB_2025_Apr_FB_4066_SO_V09_4x5_IMG_EN_Opti_C-NONE_Evergreen_CTA-NONE_Angle-W-B-C_M-NONE_VL-None_G-NONE_P-OG_S-NONE_FB3950V16,CA || ASC+ || 0% EXISTING || 7DC || 12.05.2025 RESTART Ad set,SHARE,"$1,070","88,873",2025-05-13,2025-06-14,32
59,CB_2025_Jan_FB_3754_SO_V17_4x5_IMG_EN_New_C-Headline_Evergreen_CTA-NONE_Angle-W_M-NONE_VL-None_G-NONE_P-GLP1_S-NONE,3754 - Notion Idea #113 â€œLiposuction US-Clinics Rip Offâ€ || Batch 5 || Enhancements: OFF || GLP-1 Booster || 7C1V || 02/06/25w23,SHARE,"$1,065","40,116",2025-06-03,2025-06-14,11
60,CB_2025_Jan_FB_3723_SO_V04_4x5_IMG_EN_New_C-NONE_Evergreen_CTA-SALE_Angle-W_M-NONE_VL-None_G-NONE_P-NONE_S-NONE,CA || ASC+ || 0% EXISTING || 7DC || 12.05.2025 RESTART Ad set,SHARE,"$1,038","105,965",2025-05-12,2025-06-14,33
61,CB_2025_May_FB_4132_VK-DP_V01_9x16_VID_EN_New_C-BulletPoints_Evergreen_CTA-SALE_Angle-W-B-C_M-POW_VL-30s_G-M_P-OG_S-MOON,4132 - GLP benefit VID || Enhancements: OFF || CBV1 || Batch 1 || 7C || 02/06/25w23,VIDEO,"$1,004","35,030",2025-06-02,2025-06-16,14
62,CB_2025_Jan_FB_3742_SO-DP-KB_V06_4x5_IMG_EN_Opti_C-NONE_Evergreen_CTA-SALE_Angle-W_M-NONE_VL-None_G-NONE_P-CBV2_S-NONE3665V01,CBV2 || US || Manual Bid: ROAS GOAL: 1.00 -> 1.1 || 7DC || 22/01/2025,SHARE,$998,"43,258",2025-02-11,2025-06-16,125
63,CB_2025_May_FB_4114_LZ-VG_V07_4x5_IMG_EN_New_C-Headline_Evergreen_CTA-NONE_Angle-C_M-NONE_VL-None_G-M_P-NONE_S-NONE,4114 - FOMO angle || Enhancements: OFF || CBV1 || Batch 3 || 7C || 02/06/25w23,SHARE,$952,"51,769",2025-06-02,2025-06-16,14
64,CB_2025_Feb_FB_3774_SO-JT_V06_1x1_IMG_EN_New_C-Headline_Evergreen_CTA-NONE_Angle-W_M-NONE_VL-15s_G-NONE_P-GLP1_S-NONE,3774 - #114 SMASH GLP IMG || Batch 2 || Enhancements: OFF || GLP-1 Booster || 7C1V || 09/06/25w23,SHARE,$943,"44,886",2025-06-09,2025-06-12,3
65,CB_2025_Apr_FB_3996_DT-DP_V01_9x16_VID_EN_Opti_C-MakingOf_Evergreen_CTA-CTA_Angle-W-B_M-CRAZY_VL-45s_G-M_P-OG_S-NEW_FB3022V03,CBV2 || EU (UK) || ðŸ’° Advantage+ || US || BROAD || 7C || Existing_customer_5% || 15/12/24 Ad set,VIDEO,$932,"48,956",2025-04-22,2025-06-16,55
66,CB_2025_Apr_FB_4067_LZ_V03_4x5_IMG_EN_Opti_C-Price_Sale_CTA-SALE_Angle-None_M-NONE_VL-None_G-NONE_P-OG_S-NONE_FB3907V03,CA || ASC+ || 0% EXISTING || 7DC || 12.05.2025 RESTART Ad set,SHARE,$926,"46,757",2025-05-13,2025-06-14,32
67,CB_2025_Feb_FB_3883_LZ-RP_V05_9x16_VID_EN_Opti_C-BulletPoints_Evergreen_CTA-SALE_Angle-W_M-JANW_VL-30s_G-M_P-OG_S-WHAT_FB2284V05,CBV2 || EU (UK) || ðŸ’° Advantage+ || US || BROAD || 7C || Existing_customer_5% || 15/12/24 Ad set,SHARE,$904,"49,489",2025-04-01,2025-06-16,76
68,CB_2025_Apr_FB_4040_SO_V09_4x5_IMG_EN_New_C-NONE_Evergreen_CTA-SALE_Angle-W_M-NONE_VL-None_G-NONE_P-NONE_S-NONE,CA || INTEREST: UPCOMING BIRTHDAY || 7C || 11/05/25,SHARE,$899,"49,108",2025-05-28,2025-06-16,19
69,CB_2025_Feb_FB_3883_LZ-RP_V05_9x16_VID_EN_Opti_C-BulletPoints_Evergreen_CTA-SALE_Angle-W_M-JANW_VL-30s_G-M_P-OG_S-WHAT_FB2284V05,ASC+ || Angler Predictive Conversions API - Challanger A || BAU || 7DC || 10/06/2025 Ad set,VIDEO,$898,"39,285",2025-06-10,2025-06-16,6
70,CB_2025_May_FB_4104_DT-VG_V05_4x5_IMG_EN_New_C-Headline_Evergreen_CTA-65_Angle-W-B-C_M-NONE_VL-None_G-NONE_P-OG_S-NONE,âš«ï¸ US || CBV2 || Advantage+ || 7C || BROAD || Existing_customer_0% || || 24/04/25 Ad set,SHARE,$880,"45,776",2025-05-31,2025-06-16,16
71,CB_2025_May_FB_4091_LZ-VG_V02_4x5_IMG_EN_Opti_C-Sale_Sale_CTA-MEMO_Angle-Cort_M-NONE_VL-None_G-NONE_P-OG_S-NONE_FB4065_V04,4091 - memorial day opti statics || Batch 1 || Enhancements: OFF || CBV1 || 7C || 24/05/25w21,SHARE,$840,"30,436",2025-05-24,2025-06-11,18
72,CB_2025_Jun_FB_4159_VK_V09_4x5_IMG_EN_New_C-BulletPoints_Evergreen_CTA-SALE_Angle-W-B-C_M-NONE_VL-None_G-M_P-OG_S-NONE,4159 - obsessed is understatement - VK || Enhancements: OFF || CBV1 || Batch 3 || 7C || 09/06/25w24,SHARE,$837,"46,768",2025-06-09,2025-06-16,7
73,CB_2025_Jun_FB_4145_SO_V12_4x5_IMG_EN_Opti_C-NONE_Evergreen_CTA-NONE_Angle-W-B-C_M-NONE_VL-None_G-NONE_P-OG_S-NONE_FB3950V16,4145 - FB3950V16 Opti || Enhancements: OFF || CBV1 || Batch 3 || 7C || 09/06/25w24,SHARE,$829,"32,718",2025-06-09,2025-06-16,7
74,CB_2025_Feb_FB_3774_SO-JT_V05_1x1_IMG_EN_New_C-Headline_Evergreen_CTA-NONE_Angle-W_M-NONE_VL-15s_G-NONE_P-GLP1_S-NONE,GLP-1 ðŸ’œ || ASC+ || US || 5% EXISTING CAP || 7C || 29/05/2025 Ad set,SHARE,$822,"26,982",2025-06-14,2025-06-16,2
75,CB_2025_Feb_FB_3789_VK_V01_1x1_IMG_EN_NEW_C-BulletPoints_Evergreen_CTA-70_Angle-W-B-C_M-NONE_VL-None_G-F_P-GLP1_S-NEW,3789 - Notion #114 Costs Less Than a Doughnut GLP VK || Batch 1 || Enhancements: OFF || GLP-1 Booster || 7C1V || 09/06/25w23,SHARE,$814,"24,486",2025-06-09,2025-06-12,3
76,CB_2025_Jun_FB_4156_DT_V04_9x16_VID_EN_New_C-Testimonial_Evergreen_CTA-65_Angle-W-B-C_M-JAS_VL-30s_G-M_P-OG_S-NEW,4156 - Introducing Jason || Enhancements: OFF || CBV1 || Batch 3-4 || 7C || 09/06/25w24,VIDEO,$791,"35,916",2025-06-09,2025-06-16,7
77,CB_2023_May_FB_2263_MB_V04_9x16_VID_EN_New_C-Sale_CTA-SMR_Pain-W_M-JOG_VL-45s_TR-None_G-M-F_P-None_S-Moon,CA || ASC+ || 0% EXISTING || 7DC || 12.05.2025 RESTART Ad set,VIDEO,$745,"39,881",2025-05-12,2025-06-14,33
78,CB_2025_Jun_FB_4168_SO-JG_V02_4x5_IMG_EN_New_C-Headline_Evergreen_CTA-NONE_Angle-W_M-NONE_VL-None_G-NONE_P-OG_S-NONE,4168 - #154_IMG_Another you || Enhancements: OFF || CBV1 || Batch 1 || 7C || 09/06/25w24,SHARE,$723,"35,164",2025-06-09,2025-06-16,7
79,CB_2025_Jun_FB_4176_SO-KB_V10_4x5_IMG_EN_Opti_C-Headline_Evergreen_CTA-NONE_Angle-W_M-NONE_VL-None_G-NONE_P-OG_S-NONE_FB4100V02,4176 - FB4100V02 Opti || Enhancements: OFF || CBV1 || Batch 3 || 7C || 09/06/25w24,SHARE,$710,"32,243",2025-06-09,2025-06-16,7
80,CB_2025_Feb_FB_3788_SO-JT_V01_1x1_IMG_EN_New_C-Headline_Evergreen_CTA-NONE_Angle-W_M-NONE_VL-15s_G-NONE_P-GLP1_S-NONE,3788 - Notion Idea #121 FUEL GLP IMG || Batch 1 || Enhancements: OFF || GLP-1 Booster || 7C1V || 09/06/25w23,SHARE,$702,"14,764",2025-06-09,2025-06-12,3
81,CB_2025_May_FB_4143_DT_V03_4x5_IMG_EN_New_C-Headline_Evergreen_CTA-65_Angle-W_M-NONE_VL-None_G-NONE_P-OG_S-NONE,4143 - Hormonal weight || Enhancements: OFF || CBV1 || Batch 1 || 7C || 02/06/25w23,SHARE,$668,"31,595",2025-06-02,2025-06-16,14
82,CB_2025_Jun_FB_4201_LZ-VU_V02_9x16_GIF_EN_New_C-Sale_Evergreen_CTA-SALE_Angle-None_M-NONE_VL-7s_G-NONE_P-Combo_S-NONE,CC and Bioma end cards as ads || Enhancements: OFF || CBV1 || Batch 1 || 7C || 12/06/25w24,SHARE,$661,"23,563",2025-06-12,2025-06-16,4
83,CB_2025_Jun_FB_4176_SO-KB_V05_4x5_IMG_EN_Opti_C-Headline_Evergreen_CTA-NONE_Angle-W_M-NONE_VL-None_G-NONE_P-OG_S-NONE_FB4100V02,4176 - FB4100V02 Opti || Enhancements: OFF || CBV1 || Batch 2 || 7C || 09/06/25w24,SHARE,$659,"26,192",2025-06-09,2025-06-16,7
84,CB_2024_Dec_FB_3601_VK-DP_V09_4x5_VID_EN_Opti_C-Dance_CTA-NY_Pain-W-B_M-JOG_VL-30s_TR-None_G-F_P-OG_S-WHAT_FB3045V01 - Copy,ðŸŒ¶ï¸  || ASC+ || US || 0% EXISTING CAP || 7C || 15/05/2025  Campaign Ad set,VIDEO,$659,"19,113",2025-05-15,2025-06-16,32
85,CB_2025_Mar_FB_3914_DT-DP_V01_9x16_VID_EN_New_C-Trend_Sale_CTA-SPRNG_Angle-W-B-C_M-JOG_VL-30s_G-F_P-OG_S-NEW,CBV2 || EU (UK) || ðŸ’° Advantage+ || US || BROAD || 7C || Existing_customer_5% || 15/12/24 Ad set,VIDEO,$640,"33,691",2025-04-01,2025-06-16,76
86,CB_2023_Jul_FB_2217_IB_V04_9x16_VID_EN_Opti_C-Pointing_CTA-SMR_Pain-W-B_M-TRC_VL-30s_TR-None_G-F_P-None_S-FRIGGA,CBV2 || EU (UK) || ðŸ’° Advantage+ || US || BROAD || 7C || Existing_customer_5% || 15/12/24 Ad set,VIDEO,$637,"28,499",2024-12-18,2025-06-16,180
87,CB_2024_Jan_FB_2762_IK_V05_1x1_IMG_EN_New_C-WrittenTesti_CTA-CTA_Pain-W-B-C_M-NONE_VL-None_TR-None_G-NONE_P-V2_S-NONE,CBV2 || EU (UK) || ðŸ’° Advantage+ || US || BROAD || 7C || Existing_customer_5% || 15/12/24 Ad set,SHARE,$625,"24,549",2024-12-15,2025-06-16,183
88,CB_2025_May_FB_4080_LZ-VG_V01_4x5_IMG_EN_New_C-Headline_Evergreen_CTA-NONE_Angle-W_M-NONE_VL-None_G-M_P-OG_S-NONE,ASC+ || Angler Predictive Conversions API - Challanger A || 7DC || 10/06/2025 Campaign Ad set,SHARE,$577,"29,214",2025-06-10,2025-06-16,6
89,CB_2025_Apr_FB_3975_LZ_V03_9x16_VID_EN_New_C-Testimonial_Evergreen_CTA-SALE_Angle-W_M-LAURA_VL-15s_G-F_P-OG_S-NEW,CA || ASC+ || 0% EXISTING || 7DC || 12.05.2025 RESTART Ad set,VIDEO,$569,"40,192",2025-05-12,2025-06-14,33
90,CB_2025_Jun_FB_4162_VK-RP_V02_4x5_IMG_EN_New_C-BulletPoints_Evergreen_CTA-SALE_Angle-W-B-C_M-NONE_VL-None_G-M_P-OG_S-NONE,4162 - #157 Shrek vs. Prince Charming -VK-RP || Enhancements: OFF || CBV1 || Batch 1 || 7C || 09/06/25w24,SHARE,$565,"26,797",2025-06-09,2025-06-14,5
91,CB_2025_Feb_FB_3883_LZ-RP_V05_9x16_VID_EN_Opti_C-BulletPoints_Evergreen_CTA-SALE_Angle-W_M-JANW_VL-30s_G-M_P-OG_S-WHAT_FB2284V05,ASC+ || Angler Predictive Conversions API - Challanger B || 7DC || 10/06/2025 Campaign Ad set,VIDEO,$565,"18,970",2025-06-10,2025-06-16,6
92,CB_2025_Jun_FB_4145_DT-KB_V09_4x5_IMG_EN_Opti_C-Testimonial_Sale_CTA-65_Angle-W_M-NONE_VL-None_G-NONE_P-NONE_S-NONE_FB713V04 - BIOMA,ðŸ‘¨ || Father's Day || Bundle offer  || ASC+ || US || 0% EXISTING CAP || 7C || 07/06/2025 Ad set,SHARE,$561,"15,234",2025-06-07,2025-06-16,9
93,CB_2025_Jun_FB_4161_DT-JG_V03_4x5_IMG_EN_New_C-Headline_Evergreen_CTA-NONE_Angle-W_M-NONE_VL-None_G-NONE_P-OG_S-NONE,4161 - Smoked Moobs #156 || Enhancements: OFF || CBV1 || Batch 2 || 7C || 09/06/25w24,SHARE,$550,"31,220",2025-06-09,2025-06-14,5
94,CB_2025_May_FB_4100_SO_V02_4x5_IMG_EN_New_C-Headline_Evergreen_CTA-NONE_Angle-W_M-NONE_VL-None_G-NONE_P-OG_S-NONE,ASC+ || Angler Predictive Conversions API - Challanger A || 7DC || 10/06/2025 Campaign Ad set,SHARE,$549,"19,656",2025-06-10,2025-06-16,6
95,CB_2025_Jun_FB_4175_SO_V08_4x5_IMG_EN_New_C-Headline_Evergreen_CTA-NONE_Angle-W_M-NONE_VL-None_G-NONE_P-OG_S-NONE,4175 - Vintage Collage IMG || Enhancements: OFF || CBV1 || Batch 2 || 7C || 09/06/25w24,SHARE,$546,"18,026",2025-06-09,2025-06-16,7
96,CB_2024_Aug_FB_3090_DT-DP_V02_9x16_VID_EN_Opti_C-MakingOf_CTA-CTA_Pain-W-B-C_M-POW_VL-45s_TR-None_G-M_P-OG_S-Moon_FB3029V04,CBV2 || EU (UK) || ðŸ’° Advantage+ || US || BROAD || 7C || Existing_customer_5% || 15/12/24 Ad set,SHARE,$545,"33,099",2024-12-19,2025-06-16,179
97,CB_2025_Jan_FB_3768_SO-JT_V04_1x1_IMG_EN_New_C-Headline_Evergreen_CTA-NONE_Angle-W_M-NONE_VL-None_G-NONE_P-GLP1_S-NONE,3768 - AWARENESS / GLP-1 / PLATEU BREAKER IMG || Batch 1 || Enhancements: OFF || GLP-1 Booster || 7C1V || 09/06/25w23,SHARE,$536,"14,966",2025-06-09,2025-06-12,3
98,CB_2025_Feb_FB_3789_VK_V01_1x1_IMG_EN_NEW_C-BulletPoints_Evergreen_CTA-70_Angle-W-B-C_M-NONE_VL-None_G-F_P-GLP1_S-NONE.png,3790 - #115 What I Ate Before vs. What I Eat Now - VK || Batch 1 || Enhancements: OFF || GLP-1 Booster || 7C1V || 09/06/25w23,SHARE,$534,"14,760",2025-06-09,2025-06-11,2
99,CB_2025_Jun_FB_4173_LZ_V07_4x5_IMG_EN_New_C-Headline_Evergreen_CTA-NONE_Angle-W_M-NONE_VL-None_G-NONE_P-NONE_S-NONE,4173 - Block Number  || Enhancements: OFF || CBV1 || Batch 2 || 7C || 09/06/25w24,SHARE,$531,"21,303",2025-06-09,2025-06-16,7
100,CB_2025_Jun_FB_4175_SO_V02_4x5_IMG_EN_New_C-Headline_Evergreen_CTA-NONE_Angle-W_M-NONE_VL-None_G-NONE_P-OG_S-NONE,4175 - Vintage Collage IMG || Enhancements: OFF || CBV1 || Batch 1 || 7C || 09/06/25w24,SHARE,$511,"13,816",2025-06-09,2025-06-14,5
101,CB_2025_May_FB_4093_LZ-VG_V02_4x5_IMG_EN_New_C-Headline_Sale_CTA-MEMO_Angle-W_M-NONE_VL-None_G-NONE_P-OG_S-NONE,CA || ASC+ || 0% EXISTING || 7DC || 12.05.2025 RESTART Ad set,SHARE,$509,"28,947",2025-05-27,2025-06-14,18
102,CB_2025_Feb_FB_3827_LZ_V02_1x1_IMG_EN_Opti_C-Headline_Evergreen_CTA-NONE_Angle-W_M-NONE_VL-None_G-M_P-CBV2_S-NONE_FB3723V18,CBV2 || US || Manual Bid: ROAS GOAL: 1.00 -> 1.1 || 7DC || 22/01/2025,SHARE,$500,"22,444",2025-02-18,2025-06-16,118
103,CB_2025_Jan_FB_3760_DT-DP_V01_9x16_VID_EN_New_C-Trend_Sale_CTA-70_Angle-W-C_M-MAG_VL-30s_G-M_P-GLP1_S-NEW,3760 - #110 Notion idea Lie || Batch 1 || Enhancements: OFF || GLP-1 Booster || 7C1V || 09/06/25w23,VIDEO,$491,"10,055",2025-06-09,2025-06-12,3
104,CB_2025_Apr_FB_3975_LZ_V03_9x16_VID_EN_New_C-Testimonial_Evergreen_CTA-SALE_Angle-W_M-LAURA_VL-15s_G-F_P-OG_S-NEW,CBV2 || EU (UK) || ðŸ’° Advantage+ || US || BROAD || 7C || Existing_customer_5% || 15/12/24 Ad set,VIDEO,$482,"26,079",2025-04-14,2025-06-16,63
105,CB_2025_May_FB_4132_VK-DP_V01_9x16_VID_EN_New_C-BulletPoints_Evergreen_CTA-SALE_Angle-W-B-C_M-POW_VL-30s_G-M_P-OG_S-MOON,ðŸŒ¶ï¸  || ASC+ || US || 0% EXISTING CAP || 7C || 15/05/2025  Campaign Ad set,VIDEO,$479,"17,684",2025-06-13,2025-06-16,3
106,CB_2025_Jun_FB_4164_LZ-VG_V01_4x5_IMG_EN_New_C-Educational_Evergreen_CTA-NONE_Angle-GH_M-NONE_VL-None_G-NONE_P-NONE_S-NONE,4164 - liver angle 3999 opti || Enhancements: OFF || CBV1 || Batch 2 || 7C || 09/06/25w24,SHARE,$477,"28,264",2025-06-09,2025-06-13,4
107,CB_2025_Jun_FB_4169_DT-DP_V04_9x16_VID_EN_New_C-SocialProof_Evergreen_CTA-65_Angle-W-B-C_M-MAN_VL-30s_G-MF_P-OG_S-NEW,"4169 - 3 reasons why, GF POV || Enhancements: OFF || CBV1 || Batch 1 || 7C || 09/06/25w24",VIDEO,$476,"19,550",2025-06-09,2025-06-14,5
108,CB_2025_Jun_FB_4161_DT-VG_V11_9x16_VID_EN_New_C-BulletPoints_Evergreen_CTA-NONE_Angle-W-B-C_M-MIX_VL-15s_G-M_P-OG_S-NEW,4167 - #158 Ohealth Copy_MIX painpoints || Enhancements: OFF || CBV1 || Batch 3 || 7C || 09/06/25w24,VIDEO,$464,"17,199",2025-06-09,2025-06-14,5
109,CB_2025_Jan_FB_3723_SO_V07_4x5_IMG_EN_New_C-NONE_Evergreen_CTA-SALE_Angle-W_M-NONE_VL-None_G-NONE_P-NONE_S-NONE,CBV2 || US || Manual Bid: ROAS GOAL: 1.00 -> 1.1 || 7DC || 22/01/2025,SHARE,$461,"20,478",2025-02-11,2025-06-16,125
110,CB_2025_Jun_FB_4162_VK-RP_V13_4x5_IMG_EN_New_C-BulletPoints_Evergreen_CTA-SALE_Angle-W-B-C_M-NONE_VL-None_G-M_P-OG_S-NONE,4162 - #157 Shrek vs. Prince Charming -VK-RP || Enhancements: OFF || CBV1 || Batch 3 || 7C || 09/06/25w24,SHARE,$460,"18,108",2025-06-09,2025-06-14,5
111,CB_2023_Aug_FB_2295_MB_V01_1x1_VID_EN_Opti_C-GIF_CTA-CTA_Pain-W-B_M-None_VL-10s_TR-None_G-None_P-None_S-None,CA || INTEREST: UPCOMING BIRTHDAY || 7C || 11/05/25,VIDEO,$457,"24,794",2025-05-12,2025-06-16,35
112,CB_2025_May_FB_4146_DT_V04_9x16_VID_EN_New_C-BeforeAfter_Evergreen_CTA-SALE_Angle-W_M-JOG_VL-45s_G-F_P-OG_S-MOON,4146 - I was fat || Enhancements: OFF || CBV1 || Batch 1 || 7C || 09/06/25w24,VIDEO,$457,"18,093",2025-06-09,2025-06-16,7
113,CB_2023_Jul_FB_2284_DA_V05_9x16_VID_EN_Opti_C-Sale_CTA-SMR_Pain-W_M-JANW_VL-30s_TR-None_G-M_P-None_S-WHAT_FB2103V02,CA || ASC+ || 0% EXISTING || 7DC || 12.05.2025 RESTART Ad set,VIDEO,$455,"20,659",2025-05-12,2025-06-16,35
114,CB_2025_Jan_FB_3753_SO_V04_4x5_IMG_EN_New_C-Headline_Evergreen_CTA-NONE_Angle-W_M-NONE_VL-None_G-NONE_P-GLP1_S-NONE,3753 - Notion Idea #111 â€œDualâ€Benefit Vennâ€ || Batch 1 || Enhancements: OFF || GLP-1 Booster || 7C1V || 02/06/25w23,SHARE,$453,"8,261",2025-06-03,2025-06-16,13
115,CB_2025_May_FB_4149_DT-VG_V02_9x16_VID_EN_Opti_C-Testimonial_Evergreen_CTA-SALE_Angle-W_M-MOOD_VL-30s_G-M_P-OG_S-WOOD_FB3860V03,ðŸ‘¨ || Father's Day || Bundle offer  || ASC+ || US || 0% EXISTING CAP || 7C || 07/06/2025 Ad set,VIDEO,$447,"22,384",2025-06-09,2025-06-16,7
116,CB_2025_Jun_FB_4159_VK_V07_4x5_IMG_EN_New_C-BulletPoints_Evergreen_CTA-SALE_Angle-W-B-C_M-NONE_VL-None_G-M_P-OG_S-NONE,4159 - obsessed is understatement - VK || Enhancements: OFF || CBV1 || Batch 2 || 7C || 09/06/25w24,SHARE,$446,"16,016",2025-06-09,2025-06-14,5
117,CB_2025_Jun_FB_4161_DT-VG_V07_9x16_VID_EN_New_C-BulletPoints_Evergreen_CTA-NONE_Angle-W-B-C_M-MIX_VL-15s_G-M_P-OG_S-NEW,4167 - #158 Ohealth Copy_MIX painpoints || Enhancements: OFF || CBV1 || Batch 2 || 7C || 09/06/25w24,VIDEO,$445,"18,054",2025-06-09,2025-06-16,7
118,CB_2025_May_FB_4120_DT_V08_4x5_IMG_EN_New_C-Headline_Evergreen_CTA-65_Angle-W-B-C_M-NONE_VL-None_G-NONE_P-OG_S-NONE,"4120 - #138 The Monkey, The Bear and The Ugly || Enhancements: OFF || CBV1 || Batch 2 || 7C || 02/06/25w23",SHARE,$432,"16,135",2025-06-02,2025-06-14,12
119,CB_2025_May_FB_4100_SO_V02_4x5_IMG_EN_New_C-Headline_Evergreen_CTA-NONE_Angle-W_M-NONE_VL-None_G-NONE_P-OG_S-NONE,ASC+ || Angler Predictive Conversions API - Challanger B || 7DC || 10/06/2025 Campaign Ad set,SHARE,$428,"15,431",2025-06-10,2025-06-16,6
120,CB_2025_Jun_FB_4179_LZ-KB_V03_4x5_IMG_EN_New_C-BeforeAfter_Evergreen_CTA-65_Angle-W-B_M-NONE_VL-None_G-M_P-OG_S-NONE,4179 - Puzzle piece || Enhancements: OFF || CBV1 || Batch 1 || 7C || 09/06/25w24,SHARE,$422,"21,871",2025-06-09,2025-06-16,7
121,CB_2025_Jun_FB_4173_LZ_V04_4x5_IMG_EN_New_C-Headline_Evergreen_CTA-NONE_Angle-W_M-NONE_VL-None_G-NONE_P-NONE_S-NONE,4173 - Block Number  || Enhancements: OFF || CBV1 || Batch 1 || 7C || 09/06/25w24,SHARE,$422,"25,752",2025-06-09,2025-06-14,5
122,CB_2025_May_FB_4158_VK-VG_V12_4x5_VID_EN_Opti_C-Headline_Evergreen_CTA-SALE_Angle-W-B-C_M-NONE_VL-None_G-M_P-OG_S-NONE_FB4104V05,4158 - 4104_V05_VG Opti - VK || Enhancements: OFF || CBV1 || Batch 3-4 || 7C || 09/06/25w24,SHARE,$420,"23,934",2025-06-09,2025-06-16,7
123,CB_2025_Jun_FB_4159_VK_V04_4x5_IMG_EN_New_C-BulletPoints_Evergreen_CTA-SALE_Angle-W-B-C_M-NONE_VL-None_G-M_P-OG_S-NONE,4159 - obsessed is understatement - VK || Enhancements: OFF || CBV1 || Batch 1 || 7C || 09/06/25w24,SHARE,$420,"21,045",2025-06-09,2025-06-13,4
124,CB_2025_May_FB_4149_DT-VG_V04_9x16_VID_EN_Opti_C-Testimonial_Evergreen_CTA-SALE_Angle-W_M-MOOD_VL-30s_G-M_P-OG_S-WOOD_FB3860V03,ðŸ‘¨ || Father's Day || Bundle offer  || ASC+ || US || 0% EXISTING CAP || 7C || 07/06/2025 Ad set,VIDEO,$418,"17,669",2025-06-09,2025-06-12,3
125,CB_2025_Jun_FB_4152_SO-VG_V01_4x5_IMG_EN_New_C-Headline_Evergreen_CTA-NONE_Angle-W_M-NONE_VL-0s_G-NONE_P-OG_S-NONE,4152 - Lose X amount by getting regularâ€”daily IMG || Enhancements: OFF || CBV1 || Batch 1 || 7C || 09/06/25w24,SHARE,$416,"11,517",2025-06-09,2025-06-14,5
126,CB_2025_Jun_FB_4163_VK_V07_4x5_IMG_EN_Opti_C-BulletPoints_Evergreen_CTA-SALE_Angle-W-B-C_M-NONE_VL-None_G-M_P-OG_S-NONE_FB4110V03,4163 - opti 4112 - VK || Enhancements: OFF || CBV1 || Batch 2 || 7C || 09/06/25w24,SHARE,$415,"20,984",2025-06-09,2025-06-13,4
127,CB_2025_Jan_FB_3751_VK-DP_V01_4x5_IMG_EN_New_C-BulletPoints_Sale_CTA-NY_Angle-W-B-C_M-NONE_VL-None_G-M_P-GLP1_S-NONE,GLP-1 ðŸ’œ || ASC+ || EU  || 7C || 14/06/2025 Ad set,SHARE,$413,"19,174",2025-06-14,2025-06-16,2
128,CB_2025_Jun_FB_4170_LZ_V01_4x5_IMG_EN_New_C-Headline_Evergreen_CTA-65_Angle-GH_M-NONE_VL-None_G-NONE_P-OG_S-NONE,4170 - Domino effect  || Enhancements: OFF || CBV1 || Batch 1 || 7C || 09/06/25w24,SHARE,$413,"14,680",2025-06-09,2025-06-14,5
129,CB_2025_Jun_FB_4165_VK-VG_V02_9x16_VID_EN_New_C-BulletPoints_Evergreen_CTA-SALE_Angle-W-B-C_M-MAN_VL-30s_G-M_P-OG_S-NEW,4165 - bloating_dietfails_VG - VK || Enhancements: OFF || CBV1 || Batch 1-3 || 7C || 09/06/25w24,VIDEO,$412,"19,953",2025-06-09,2025-06-14,5
130,CB_2025_Jan_FB_3744_SO_V06_4x5_IMG_EN_New_C-Headline_Evergreen_CTA-NONE_Angle-W_M-NONE_VL-None_G-NONE_P-GLP1_S-NONE,3744 - Notion Idea #112 â€œTight shirtâ€™s system alertâ€ || Batch 2 || Enhancements: OFF || GLP-1 Booster || 7C1V || 02/06/25w23,SHARE,$412,"10,661",2025-06-03,2025-06-12,9
131,CB_2025_May_FB_4080_LZ-VG_V01_4x5_IMG_EN_New_C-Headline_Evergreen_CTA-NONE_Angle-W_M-NONE_VL-None_G-M_P-OG_S-NONE,ASC+ || Angler Predictive Conversions API - Challanger B || 7DC || 10/06/2025 Campaign Ad set,SHARE,$410,"19,736",2025-06-10,2025-06-16,6
132,CB_2025_Mar_FB_3911_DT_V03_9x16_VID_EN_Opti_C-SingleTesti_Sale_CTA-Patrick_Angle-W_M-TRC_VL-45s_G-F_P-OG_S-MOON_FB2764V04,CBV2 || EU (UK) || ðŸ’° Advantage+ || US || BROAD || 7C || Existing_customer_5% || 15/12/24 Ad set,VIDEO,$404,"19,065",2025-03-17,2025-06-16,91
133,CB_2025_Mar_FB_3919_LZ_V01_1x1_IMG_EN_Opti_C-Headline_Evergreen_CTA-NONE_Angle-Horm_M-NONE_VL-30s_G-M_P-OG_S-NONE_FB3891V05,CA || ASC+ || 0% EXISTING || 7DC || 12.05.2025 RESTART Ad set,SHARE,$400,"32,275",2025-05-12,2025-06-16,35
134,CB_2025_Jun_FB_4156_DT_V04_9x16_VID_EN_New_C-Testimonial_Evergreen_CTA-65_Angle-W-B-C_M-JAS_VL-30s_G-M_P-OG_S-NEW,ðŸŒ¶ï¸  || ASC+ || US || 0% EXISTING CAP || 7C || 15/05/2025  Campaign Ad set,VIDEO,$396,"14,091",2025-06-14,2025-06-16,2
135,CB_2025_Jun_FB_4145_SO_V06_4x5_IMG_EN_Opti_C-NONE_Evergreen_CTA-NONE_Angle-W-B-C_M-NONE_VL-None_G-NONE_P-OG_S-NONE_FB3950V16,4145 - FB3950V16 Opti || Enhancements: OFF || CBV1 || Batch 2 || 7C || 09/06/25w24,SHARE,$394,"19,424",2025-06-09,2025-06-14,5
136,CB_2025_Jun_FB_4162_VK-RP_V05_4x5_IMG_EN_New_C-BulletPoints_Evergreen_CTA-SALE_Angle-W-B-C_M-NONE_VL-None_G-M_P-OG_S-NONE,4162 - #157 Shrek vs. Prince Charming -VK-RP || Enhancements: OFF || CBV1 || Batch 2 || 7C || 09/06/25w24,SHARE,$391,"18,056",2025-06-09,2025-06-14,5
137,CB_2025_Jun_FB_4145_SO_V03_4x5_IMG_EN_Opti_C-NONE_Evergreen_CTA-NONE_Angle-W-B-C_M-NONE_VL-None_G-NONE_P-OG_S-NONE_FB3950V16,4145 - FB3950V16 Opti || Enhancements: OFF || CBV1 || Batch 1 || 7C || 09/06/25w24,SHARE,$389,"20,674",2025-06-09,2025-06-16,7
138,CB_2025_May_FB_4120_DT_V06_4x5_IMG_EN_New_C-Headline_Evergreen_CTA-65_Angle-W-B-C_M-NONE_VL-None_G-NONE_P-OG_S-NONE,"4120 - #138 The Monkey, The Bear and The Ugly || Enhancements: OFF || CBV1 || Batch 2 || 7C || 02/06/25w23",SHARE,$387,"19,024",2025-06-02,2025-06-16,14
139,CB_2025_Feb_FB_3883_LZ-RP_V05_9x16_VID_EN_Opti_C-BulletPoints_Evergreen_CTA-SALE_Angle-W_M-JANW_VL-30s_G-M_P-OG_S-WHAT_FB2284V05,CA || INTEREST: UPCOMING BIRTHDAY || 7C || 11/05/25,VIDEO,$385,"24,889",2025-05-12,2025-06-16,35
140,CB_2025_Jan_FB_3783_LZ_V03_1x1_IMG_EN_New_C-BulletPoints_Evergreen_CTA-NONE_Angle-W_M-NONE_VL-None_G-NONE_P-GLP1_S-NONE,3783 - #124 Notion idea ChatGLP || Batch 1 || Enhancements: OFF || GLP-1 Booster || 7C1V || 09/06/25w23,SHARE,$380,"9,349",2025-06-09,2025-06-12,3
141,CB_2023_Jul_FB_2217_IB_V04_9x16_VID_EN_Opti_C-Pointing_CTA-SMR_Pain-W-B_M-TRC_VL-30s_TR-None_G-F_P-None_S-FRIGGA,US || Manual Bid || BFCM || COST CAP 71 || 1C || 15/11/24,VIDEO,$364,"15,767",2024-11-15,2025-06-16,213
142,CB_2025_May_FB_4080_LZ-VG_V01_4x5_IMG_EN_New_C-Headline_Evergreen_CTA-NONE_Angle-W_M-NONE_VL-None_G-M_P-OG_S-NONE,ASC+ || Angler Predictive Conversions API - Challanger A || BAU || 7DC || 10/06/2025 Ad set,SHARE,$364,"18,336",2025-06-10,2025-06-16,6
143,CB_2025_Jan_FB_3739_DT_V09_4x5_VID_EN_Opti_C-Testimonial_Sale_CTA-70_Angle-W-B_M-MIX_VL-45s_G-MF_P-GLP1_S-MOON_FB3278V05,3739 - GLP1 winner ads opti  Batch 2 || Enhancements: OFF || GLP-1 Booster || 7C || 30/05/25w22,SHARE,$352,"7,799",2025-05-30,2025-06-14,15
144,CB_2025_May_FB_4150_DT-KB_V03_4x5_IMG_EN_New_C-Headline_Sale_CTA-65_Angle-None_M-MIX_VL-None_G-M_P-OG_S-NONE,ðŸ‘¨ || Father's Day || Bundle offer  || ASC+ || US || 0% EXISTING CAP || 7C || 07/06/2025 Ad set,SHARE,$351,"11,643",2025-06-09,2025-06-16,7
145,CB_2025_Jan_FB_3739_DT_V08_4x5_VID_EN_Opti_C-BulletPoints_Sale_CTA-70_Angle-W-B_M-MIX_VL-45s_G-MF_P-GLP1_S-WHAT_FB3311V10,GLP-1 ðŸ’œ || ASC+ || CA || 5% EXISTING CAP || 7C || 29/05/2025 Ad set,VIDEO,$343,"12,270",2025-06-10,2025-06-16,6
146,CB_2025_May_FB_4158_VK-VG_V05_4x5_VID_EN_Opti_C-Headline_Evergreen_CTA-SALE_Angle-W-B-C_M-NONE_VL-None_G-M_P-OG_S-NONE_FB4104V05,4158 - 4104_V05_VG Opti - VK || Enhancements: OFF || CBV1 || Batch 1-2 || 7C || 09/06/25w24,SHARE,$341,"14,248",2025-06-09,2025-06-13,4
147,CB_2025_Mar_FB_3903_VK_V01_9x16_VID_EN_New_C-BulletPoints_Evergreen_CTA-65_Angle-W-B-C_M-MIX_VL-30s_G-MF_P-OG_S-NEW,CA || ASC+ || 0% EXISTING || 7DC || 12.05.2025 RESTART Ad set,VIDEO,$340,"20,670",2025-05-12,2025-06-16,35
148,CB_2024_Feb_FB_2814_MB-DP_V05_1x1_IMG_EN_New_C-WeightLoss_CTA-None_Pain-W-B-C_M-NONE_VL-None_TR-None_G-NONE_P-V2_S-NONE,CBV2 || EU (UK) || ðŸ’° Advantage+ || US || BROAD || 7C || Existing_customer_5% || 15/12/24 Ad set,SHARE,$335,"14,503",2025-01-31,2025-06-16,136
149,CB_2025_Jan_FB_3739_DT_V07_4x5_VID_EN_Opti_C-Testimonial_Sale_CTA-70_Angle-W_M-MIX_VL-45s_G-MF_P-GLP1_S-MOON_FB2823V03,3739 - GLP1 winner ads opti  Batch 2 || Enhancements: OFF || GLP-1 Booster || 7C || 30/05/25w22,SHARE,$332,"8,088",2025-05-30,2025-06-12,13
150,CB_2025_Jan_FB_3783_LZ_V04_1x1_IMG_EN_New_C-BulletPoints_Evergreen_CTA-NONE_Angle-W_M-NONE_VL-None_G-NONE_P-GLP1_S-NONE,3783 - #124 Notion idea ChatGLP || Batch 1 || Enhancements: OFF || GLP-1 Booster || 7C1V || 09/06/25w23,SHARE,$327,"8,320",2025-06-09,2025-06-12,3
151,CB_2025_Jun_FB_4176_SO-KB_V01_4x5_IMG_EN_Opti_C-Headline_Evergreen_CTA-NONE_Angle-W_M-NONE_VL-None_G-NONE_P-OG_S-NONE_FB4100V02,4176 - FB4100V02 Opti || Enhancements: OFF || CBV1 || Batch 1 || 7C || 09/06/25w24,SHARE,$324,"16,049",2025-06-09,2025-06-16,7
152,CB_2025_Apr_FB_4066_SO_V09_4x5_IMG_EN_Opti_C-NONE_Evergreen_CTA-NONE_Angle-W-B-C_M-NONE_VL-None_G-NONE_P-OG_S-NONE_FB3950V16,CBV2 || EU (UK) || ðŸ’° Advantage+ || US || BROAD || 7C || Existing_customer_5% || 15/12/24 Ad set,SHARE,$321,"17,204",2025-05-25,2025-06-16,22
153,CB_2025_Jan_FB_3756_VK-DP_V03_4x5_IMG_EN_New_C-BulletPoints_Evergreen_CTA-NONE_Angle-W-B-C_M-NONE_VL-None_G-M_P-GLP1_S-NONE,GLP-1 ðŸ’œ || ASC+ || US || 5% EXISTING CAP || 7C || 29/05/2025 Ad set,SHARE,$318,"6,797",2025-06-02,2025-06-16,14
154,CB_2025_Jun_FB_4161_DT-VG_V03_9x16_VID_EN_New_C-BulletPoints_Evergreen_CTA-NONE_Angle-W-B-C_M-MIX_VL-15s_G-M_P-OG_S-NEW,4167 - #158 Ohealth Copy_MIX painpoints || Enhancements: OFF || CBV1 || Batch 1 || 7C || 09/06/25w24,VIDEO,$315,"13,680",2025-06-09,2025-06-14,5
155,CB_2025_May_FB_4146_DT_V01_9x16_VID_EN_New_C-BeforeAfter_Evergreen_CTA-SALE_Angle-W_M-JOG_VL-45s_G-F_P-OG_S-MOON,4146 - I was fat || Enhancements: OFF || CBV1 || Batch 1 || 7C || 09/06/25w24,VIDEO,$314,"12,231",2025-06-09,2025-06-16,7
156,CB_2025_Jun_FB_4179_LZ-KB_V02_4x5_IMG_EN_New_C-BeforeAfter_Evergreen_CTA-65_Angle-W-B_M-NONE_VL-None_G-M_P-OG_S-NONE,4179 - Puzzle piece || Enhancements: OFF || CBV1 || Batch 1 || 7C || 09/06/25w24,SHARE,$299,"12,390",2025-06-09,2025-06-14,5
157,CB_2025_Jun_FB_4160_SO_V02_9x16_VID_EN_Opti_C-NONE_Evergreen_CTA-65_Angle-W-B-C_M-NONE_VL-20s_G-F_P-OG_S-NEW_FB3967V10,4160 - FB3967V10 Opti || Enhancements: OFF || CBV1 || Batch 1-3 || 7C || 09/06/25w24,VIDEO,$294,"13,417",2025-06-09,2025-06-14,5
158,CB_2025_Jan_FB_3744_SO_V05_4x5_IMG_EN_New_C-Headline_Evergreen_CTA-NONE_Angle-W_M-NONE_VL-None_G-NONE_P-GLP1_S-NONE,3744 - Notion Idea #112 â€œTight shirtâ€™s system alertâ€ || Batch 2 || Enhancements: OFF || GLP-1 Booster || 7C1V || 02/06/25w23,SHARE,$291,"4,501",2025-06-03,2025-06-12,9
159,CB_2025_Jun_FB_4145_SO_V01_4x5_IMG_EN_Opti_C-NONE_Evergreen_CTA-NONE_Angle-W-B-C_M-NONE_VL-None_G-NONE_P-OG_S-NONE_FB3950V16,4145 - FB3950V16 Opti || Enhancements: OFF || CBV1 || Batch 1 || 7C || 09/06/25w24,SHARE,$291,"14,448",2025-06-09,2025-06-16,7
160,CB_2025_Jun_FB_4174_LZ-VG_V02_9x16_GIF_EN_Opti_C-Headline_Evergreen_CTA-65_Angle-W_M-NONE_VL-None_G-M_P-OG_S-NONE_FB4093V02,4174 - navy seal winner gifification || Enhancements: OFF || CBV1 || Batch 1 || 7C || 09/06/25w24,VIDEO,$290,"8,682",2025-06-09,2025-06-14,5
161,CB_2025_Jan_FB_3760_DT-DP_V02_9x16_VID_EN_New_C-Trend_Sale_CTA-70_Angle-W-C_M-MAG_VL-30s_G-M_P-GLP1_S-NEW,3760 - #110 Notion idea Lie || Batch 1 || Enhancements: OFF || GLP-1 Booster || 7C1V || 09/06/25w23,VIDEO,$289,"5,874",2025-06-09,2025-06-12,3
162,CB_2025_Jun_FB_4163_VK_V02_4x5_IMG_EN_Opti_C-BulletPoints_Evergreen_CTA-SALE_Angle-W-B-C_M-NONE_VL-None_G-M_P-OG_S-NONE_FB4110V03,4163 - opti 4112 - VK || Enhancements: OFF || CBV1 || Batch 1 || 7C || 09/06/25w24,SHARE,$286,"15,774",2025-06-09,2025-06-14,5
163,CB_2025_Jan_FB_3742_SO-DP-KB_V01_4x5_IMG_EN_Opti_C-NONE_Evergreen_CTA-SALE_Angle-W_M-NONE_VL-None_G-NONE_P-CBV2_S-NONE3665V01,CBV2 || EU (UK) || ðŸ’° Advantage+ || US || BROAD || 7C || Existing_customer_5% || 15/12/24 Ad set,SHARE,$284,"12,943",2025-02-04,2025-06-16,132
164,CB_2025_Jan_FB_3753_SO_V01_4x5_IMG_EN_New_C-Headline_Evergreen_CTA-NONE_Angle-W_M-NONE_VL-None_G-NONE_P-GLP1_S-NONE,GLP-1 ðŸ’œ || ASC+ || US || 5% EXISTING CAP || 7C || 29/05/2025 Ad set,SHARE,$278,"9,545",2025-06-08,2025-06-16,8
165,CB_2025_Jan_FB_3739_DT_V08_4x5_VID_EN_Opti_C-BulletPoints_Sale_CTA-70_Angle-W-B_M-MIX_VL-45s_G-MF_P-GLP1_S-WHAT_FB3311V10,GLP-1 ðŸ’œ || ASC+ || UK || 5% EXISTING CAP || 7C || 29/05/2025 Ad set,VIDEO,$275,"4,492",2025-06-10,2025-06-16,6
166,CB_2025_Jan_FB_3763_SO-DP_V02_1x1_IMG_EN_New_C-Headline_Evergreen_CTA-NONE_Angle-W_M-NONE_VL-None_G-NONE_P-GLP1_S-NONE,3763 - #117 Notion idea GLP IMG || Batch 1 || Enhancements: OFF || GLP-1 Booster || 7C1V || 09/06/25w23,SHARE,$272,"7,596",2025-06-09,2025-06-16,7
167,CB_2025_Jan_FB_3763_SO-DP_V03_1x1_IMG_EN_New_C-Headline_Evergreen_CTA-NONE_Angle-W_M-NONE_VL-None_G-NONE_P-GLP1_S-NONE,3763 - #117 Notion idea GLP IMG || Batch 1 || Enhancements: OFF || GLP-1 Booster || 7C1V || 09/06/25w23,SHARE,$271,"6,352",2025-06-09,2025-06-14,5
168,CB_2025_Feb_FB_3883_LZ-RP_V05_9x16_VID_EN_Opti_C-BulletPoints_Evergreen_CTA-SALE_Angle-W_M-JANW_VL-30s_G-M_P-OG_S-WHAT_FB2284V05,ASC+ || Angler Predictive Conversions API - Challanger A || 7DC || 10/06/2025 Campaign Ad set,VIDEO,$271,"8,722",2025-06-10,2025-06-16,6
169,CB_2025_Jun_FB_4163_VK_V01_4x5_IMG_EN_Opti_C-BulletPoints_Evergreen_CTA-SALE_Angle-W-B-C_M-NONE_VL-None_G-M_P-OG_S-NONE_FB4110V03,4163 - opti 4112 - VK || Enhancements: OFF || CBV1 || Batch 1 || 7C || 09/06/25w24,SHARE,$266,"14,547",2025-06-09,2025-06-14,5
170,CB_2025_Jan_FB_3739_DT_V10_4x5_VID_EN_Opti_C-Dance_Sale_CTA-70_Angle-W-B_M-MIX_VL-45s_G-MF_P-GLP1_S-WHAT_FB3278V03,3739 - GLP1 winner ads opti  Batch 2 || Enhancements: OFF || GLP-1 Booster || 7C || 30/05/25w22,SHARE,$252,"4,939",2025-05-30,2025-06-14,15
171,CB_2025_Jan_FB_3753_SO_V02_4x5_IMG_EN_New_C-Headline_Evergreen_CTA-NONE_Angle-W_M-NONE_VL-None_G-NONE_P-GLP1_S-NONE,3753 - Notion Idea #111 â€œDualâ€Benefit Vennâ€ || Batch 1 || Enhancements: OFF || GLP-1 Booster || 7C1V || 02/06/25w23,SHARE,$240,"4,914",2025-06-03,2025-06-16,13
172,CB_2025_May_FB_4080_LZ-VG_V03_4x5_IMG_EN_New_C-Headline_Evergreen_CTA-NONE_Angle-W_M-NONE_VL-None_G-M_P-OG_S-NONE,CA || ASC+ || 0% EXISTING || 7DC || 12.05.2025 RESTART Ad set,SHARE,$237,"17,534",2025-05-19,2025-06-16,28
173,CB_2025_Apr_FB_4070_KB_V03_4x5_VID_EN_New_C-NONE_CTA-SALE_Angle-None_M-NONE_VL-None_TR-None_G-F_P-OG_S-NONE,CA || ASC+ || 0% EXISTING || 7DC || 12.05.2025 RESTART Ad set,SHARE,$232,"17,150",2025-05-13,2025-06-16,34
174,CB_2025_May_FB_4077_VK-VG_V03_4x5_IMG_EN_New_C-Trend_Evergreen_CTA-NONE_Angle-W-B-C_M-NONE_VL-None_G-F_P-OG_S-NONE_FB3827V04,CA || ASC+ || 0% EXISTING || 7DC || 12.05.2025 RESTART Ad set,SHARE,$210,"12,884",2025-05-13,2025-06-16,34
175,CB_2025_Jan_FB_3768_SO-JT_V03_1x1_IMG_EN_New_C-Headline_Evergreen_CTA-NONE_Angle-W_M-NONE_VL-None_G-NONE_P-GLP1_S-NONE,3768 - AWARENESS / GLP-1 / PLATEU BREAKER IMG || Batch 1 || Enhancements: OFF || GLP-1 Booster || 7C1V || 09/06/25w23,SHARE,$209,"4,515",2025-06-09,2025-06-11,2
176,CB_2025_May_FB_4143_DT_V01_4x5_IMG_EN_New_C-Headline_Evergreen_CTA-65_Angle-W_M-NONE_VL-None_G-NONE_P-OG_S-NONE,4143 - Hormonal weight || Enhancements: OFF || CBV1 || Batch 1 || 7C || 02/06/25w23,SHARE,$208,"9,543",2025-06-02,2025-06-16,14
177,CB_2025_Jun_FB_4176_SO-KB_V04_4x5_IMG_EN_Opti_C-Headline_Evergreen_CTA-NONE_Angle-W_M-NONE_VL-None_G-NONE_P-OG_S-NONE_FB4100V02,4176 - FB4100V02 Opti || Enhancements: OFF || CBV1 || Batch 1 || 7C || 09/06/25w24,SHARE,$207,"8,083",2025-06-09,2025-06-16,7
178,CB_2024_Jan_FB_2784_RS_V02_9x16_VID_EN_Opti_C-Pointing_CTA-SALE_Pain-W_M-JOG_VL-30s_TR-None_G-F_P-OG_S-OLLIE_FB2181V01,CBV2 || EU (UK) || ðŸ’° Advantage+ || US || BROAD || 7C || Existing_customer_5% || 15/12/24 Ad set,VIDEO,$205,"6,923",2025-01-09,2025-06-16,158
179,CB_2025_Jan_FB_3753_SO_V03_4x5_IMG_EN_New_C-Headline_Evergreen_CTA-NONE_Angle-W_M-NONE_VL-None_G-NONE_P-GLP1_S-NONE,3753 - Notion Idea #111 â€œDualâ€Benefit Vennâ€ || Batch 1 || Enhancements: OFF || GLP-1 Booster || 7C1V || 02/06/25w23,SHARE,$203,"5,097",2025-06-03,2025-06-10,7
180,CB_2025_May_FB_4158_VK-VG_V10_4x5_VID_EN_Opti_C-Headline_Evergreen_CTA-SALE_Angle-W-B-C_M-NONE_VL-None_G-M_P-OG_S-NONE_FB4104V05,4158 - 4104_V05_VG Opti - VK || Enhancements: OFF || CBV1 || Batch 3-4 || 7C || 09/06/25w24,SHARE,$189,"10,208",2025-06-09,2025-06-16,7
181,CB_2025_Jan_FB_3751_VK-DP_V02_4x5_IMG_EN_New_C-BulletPoints_Sale_CTA-NY_Angle-W-B-C_M-NONE_VL-None_G-M_P-GLP1_S-NONE,3751 - opti 3608 GLP1 - VK-DP || Batch 1 || Enhancements: OFF || GLP-1 Booster || 7C1V || 30/05/25w22,SHARE,$188,"6,305",2025-05-30,2025-06-16,17
182,CB_2025_May_FB_4120_DT_V07_4x5_IMG_EN_New_C-Headline_Evergreen_CTA-65_Angle-W-B-C_M-NONE_VL-None_G-NONE_P-OG_S-NONE,"4120 - #138 The Monkey, The Bear and The Ugly || Enhancements: OFF || CBV1 || Batch 2 || 7C || 02/06/25w23",SHARE,$187,"7,390",2025-06-02,2025-06-16,14
183,CB_2025_Feb_FB_3774_SO-JT_V04_1x1_IMG_EN_New_C-Headline_Evergreen_CTA-NONE_Angle-W_M-NONE_VL-15s_G-NONE_P-GLP1_S-NONE,3774 - #114 SMASH GLP IMG || Batch 2 || Enhancements: OFF || GLP-1 Booster || 7C1V || 09/06/25w23,SHARE,$180,"4,453",2025-06-09,2025-06-16,7
184,CB_2025_Jun_FB_4169_DT-DP_V03_9x16_VID_EN_New_C-SocialProof_Evergreen_CTA-65_Angle-W-B-C_M-MAN_VL-30s_G-MF_P-OG_S-NEW,"4169 - 3 reasons why, GF POV || Enhancements: OFF || CBV1 || Batch 1 || 7C || 09/06/25w24",VIDEO,$174,"6,840",2025-06-09,2025-06-16,7
185,CB_2025_Jan_FB_3739_DT_V06_4x5_VID_EN_Opti_C-Testimonial_Sale_CTA-70_Angle-W_M-MIX_VL-45s_G-MF_P-GLP1_S-MOON_FB2764V05,3739 - GLP1 winner ads opti  Batch 2 || Enhancements: OFF || GLP-1 Booster || 7C || 30/05/25w22,SHARE,$173,"3,506",2025-05-30,2025-06-10,11
186,CB_2025_May_FB_4091_LZ-VG_V01_4x5_IMG_EN_Opti_C-Sale_Sale_CTA-MEMO_Angle-None_M-NONE_VL-None_G-NONE_P-OG_S-NONE_FB3907V03,ASC+ || Angler Predictive Conversions API - Challanger B || 7DC || 10/06/2025 Campaign Ad set,SHARE,$169,"5,680",2025-06-10,2025-06-16,6
187,CB_2025_May_FB_4140_SO-VG_V04_4x5_IMG_EN_Opti_C-NONE_Evergreen_CTA-NONE_Angle-W_M-NONE_VL-None_G-NONE_P-OG_S-NONE_FB3950V11 - CC,ðŸ‘¨ || Father's Day || Bundle offer  || ASC+ || US || 0% EXISTING CAP || 7C || 07/06/2025 Ad set,SHARE,$168,"7,840",2025-06-07,2025-06-16,9
188,CB_2025_Jan_FB_3756_VK-DP_V03_4x5_IMG_EN_New_C-BulletPoints_Evergreen_CTA-NONE_Angle-W-B-C_M-NONE_VL-None_G-M_P-GLP1_S-NONE,3756 - opti 2834 GLP1 || Batch 1 || Enhancements: OFF || GLP-1 Booster || 7C1V || 30/05/25w22,SHARE,$168,"5,795",2025-05-30,2025-06-12,13
189,CB_2025_Feb_FB_3827_LZ_V03_1x1_IMG_EN_Opti_C-Headline_Evergreen_CTA-SALE_Angle-W_M-NONE_VL-None_G-M_P-CBV2_S-NONE_FB3705V02,âš«ï¸ US || CBV2 || Advantage+ || 7C || BROAD || Existing_customer_0% || || 24/04/25 Ad set,SHARE,$165,"4,231",2025-04-25,2025-06-16,52
190,CB_2025_May_FB_4091_LZ-VG_V01_4x5_IMG_EN_Opti_C-Sale_Sale_CTA-MEMO_Angle-None_M-NONE_VL-None_G-NONE_P-OG_S-NONE_FB3907V03,ASC+ || Angler Predictive Conversions API - Challanger A || BAU || 7DC || 10/06/2025 Ad set,SHARE,$163,"5,563",2025-06-10,2025-06-16,6
191,CB_2025_May_FB_4091_LZ-VG_V01_4x5_IMG_EN_Opti_C-Sale_Sale_CTA-MEMO_Angle-None_M-NONE_VL-None_G-NONE_P-OG_S-NONE_FB3907V03,4091 - memorial day opti statics || Batch 1 || Enhancements: OFF || CBV1 || 7C || 24/05/25w21,SHARE,$161,"5,655",2025-05-24,2025-06-11,18
192,CB_2025_Jun_FB_4161_DT-VG_V05_9x16_VID_EN_New_C-BulletPoints_Evergreen_CTA-NONE_Angle-W-B-C_M-MIX_VL-15s_G-M_P-OG_S-NEW,4167 - #158 Ohealth Copy_MIX painpoints || Enhancements: OFF || CBV1 || Batch 2 || 7C || 09/06/25w24,VIDEO,$160,"6,447",2025-06-09,2025-06-16,7
193,CB_2025_Jun_FB_4174_LZ-VG_V03_9x16_GIF_EN_Opti_C-Headline_Evergreen_CTA-65_Angle-W_M-NONE_VL-None_G-M_P-OG_S-NONE_FB4093V02,4174 - navy seal winner gifification || Enhancements: OFF || CBV1 || Batch 1 || 7C || 09/06/25w24,VIDEO,$160,"4,451",2025-06-09,2025-06-14,5
194,CB_2025_Feb_FB_3827_LZ_V03_1x1_IMG_EN_Opti_C-Headline_Evergreen_CTA-SALE_Angle-W_M-NONE_VL-None_G-M_P-CBV2_S-NONE_FB3705V02,CBV2 || US || Manual Bid: ROAS GOAL: 1.00 -> 1.1 || 7DC || 22/01/2025,SHARE,$160,"6,390",2025-02-18,2025-06-16,118
195,CB_2025_May_FB_4091_LZ-VG_V01_4x5_IMG_EN_Opti_C-Sale_Sale_CTA-MEMO_Angle-None_M-NONE_VL-None_G-NONE_P-OG_S-NONE_FB3907V03,ASC+ || Angler Predictive Conversions API - Challanger A || 7DC || 10/06/2025 Campaign Ad set,SHARE,$156,"5,636",2025-06-10,2025-06-16,6
196,CB_2025_Jun_FB_4170_LZ_V03_4x5_IMG_EN_New_C-Headline_Evergreen_CTA-65_Angle-GH_M-NONE_VL-None_G-NONE_P-OG_S-NONE,4170 - Domino effect  || Enhancements: OFF || CBV1 || Batch 1 || 7C || 09/06/25w24,SHARE,$153,"6,279",2025-06-09,2025-06-14,5
197,CB_2025_Feb_FB_3789_VK_V02_1x1_IMG_EN_NEW_C-BulletPoints_Evergreen_CTA-70_Angle-W-B-C_M-NONE_VL-None_G-F_P-GLP1_S-NONE.png,3790 - #115 What I Ate Before vs. What I Eat Now - VK || Batch 1 || Enhancements: OFF || GLP-1 Booster || 7C1V || 09/06/25w23,SHARE,$153,"4,457",2025-06-09,2025-06-12,3
198,CB_2025_Jan_FB_3757_LZ-DP_V15_4x5_VID_EN_Opti_C-BulletPoints_Evergreen_CTA-NONE_Angle-W-B-C_M-KAIT_VL-30s_G-F_P-GLP1_S-NEW_FB3592V10,3757 - GLP1 video winner opti Batch 3+4 || Batch 3 || Enhancements: OFF || GLP-1 Booster || 7C1V || 30/05/25w22,SHARE,$151,"3,941",2025-05-30,2025-06-10,11
199,CB_2025_Jun_FB_4161_DT-VG_V08_9x16_VID_EN_New_C-BulletPoints_Evergreen_CTA-NONE_Angle-W-B-C_M-MIX_VL-15s_G-M_P-OG_S-NEW,4167 - #158 Ohealth Copy_MIX painpoints || Enhancements: OFF || CBV1 || Batch 2 || 7C || 09/06/25w24,VIDEO,$151,"4,861",2025-06-09,2025-06-16,7
200,CB_2025_May_FB_4100_SO_V02_4x5_IMG_EN_New_C-Headline_Evergreen_CTA-NONE_Angle-W_M-NONE_VL-None_G-NONE_P-OG_S-NONE,ASC+ || Angler Predictive Conversions API - Challanger A || BAU || 7DC || 10/06/2025 Ad set,SHARE,$151,"5,974",2025-06-10,2025-06-16,6
201,CB_2025_Jun_FB_4176_SO-KB_V03_4x5_IMG_EN_Opti_C-Headline_Evergreen_CTA-NONE_Angle-W_M-NONE_VL-None_G-NONE_P-OG_S-NONE_FB4100V02,4176 - FB4100V02 Opti || Enhancements: OFF || CBV1 || Batch 1 || 7C || 09/06/25w24,SHARE,$149,"6,451",2025-06-09,2025-06-16,7
202,CB_2025_May_FB_4115_SO_V02_4x5_IMG_EN_New_C-Headline_Evergreen_CTA-NONE_Angle-W_M-NONE_VL-None_G-NONE_P-OG_S-NONE,4115 - #146 Cravings || Enhancements: OFF || CBV1 || Batch 1-2 || 7C || 02/06/25w23,SHARE,$149,"7,024",2025-06-02,2025-06-10,8
203,CB_2025_Feb_FB_3774_SO-JT_V02_1x1_IMG_EN_New_C-Headline_Evergreen_CTA-NONE_Angle-W_M-NONE_VL-15s_G-NONE_P-GLP1_S-NONE,3774 - #114 SMASH GLP IMG || Batch 1 || Enhancements: OFF || GLP-1 Booster || 7C1V || 09/06/25w23,SHARE,$148,"4,454",2025-06-09,2025-06-12,3
204,CB_2025_Jan_FB_3756_VK-DP_V03_4x5_IMG_EN_New_C-BulletPoints_Evergreen_CTA-NONE_Angle-W-B-C_M-NONE_VL-None_G-M_P-GLP1_S-NONE,GLP-1 ðŸ’œ || ASC+ || CA || 5% EXISTING CAP || 7C || 29/05/2025 Ad set,SHARE,$146,"3,465",2025-06-10,2025-06-16,6
205,CB_2024_Dec_FB_3619_VK-JT_V02_4x5_VID_EN_New_C-BulletPoints_Sale_CTA-NY_Angle-W-B-C_M-NONE_VL-None_G-NONE_P-OG_S-NONE - Copy,ðŸŒ¶ï¸  || ASC+ || US || 0% EXISTING CAP || 7C || 15/05/2025  Campaign Ad set,SHARE,$146,"7,216",2025-05-15,2025-06-16,32
206,CB_2024_Nov_FB_3264_LZ_V31_4x5_VID_EN_Opti_C-MakingOf_Sale_CTA-BF_Angle-W-B_M-CRAZY_VL-45s_G-M_P-OG_S-NEW_FB3004V02,CBV2 || EU (UK) || ðŸ’° Advantage+ || US || BROAD || 7C || Existing_customer_5% || 15/12/24 Ad set,VIDEO,$143,"6,622",2024-12-19,2025-06-16,179
207,CB_2025_Jan_FB_3757_LZ-DP_V14_94x5_VID_EN_Opti_C-Dance_Evergreen_CTA-NONE_Angle-W-B_M-Nonie_VL-30s_G-F_P-GLP1_S-WHAT_FB3164V03,3757 - GLP1 video winner opti Batch 3+4 || Batch 3 || Enhancements: OFF || GLP-1 Booster || 7C1V || 30/05/25w22,SHARE,$143,"4,348",2025-05-30,2025-06-10,11
208,CB_2025_May_FB_4104_DT-VG_V08_4x5_IMG_EN_New_C-Headline_Evergreen_CTA-65_Angle-W-B-C_M-NONE_VL-None_G-NONE_P-OG_S-NONE,4104 -W-L JellyBelly IMG || Enhancements: OFF || CBV1 || Batch 2 || 7C || 19/05/25w21,SHARE,$142,"7,989",2025-05-19,2025-06-10,22
209,CB_2025_Feb_FB_3789_VK_V03_1x1_IMG_EN_NEW_C-BulletPoints_Evergreen_CTA-70_Angle-W-B-C_M-NONE_VL-None_G-F_P-GLP1_S-NONE,3790 - #115 What I Ate Before vs. What I Eat Now - VK || Batch 1 || Enhancements: OFF || GLP-1 Booster || 7C1V || 09/06/25w23,SHARE,$141,"3,551",2025-06-09,2025-06-12,3
210,CB_2025_May_FB_4149_DT-VG_V03_9x16_VID_EN_Opti_C-Testimonial_Evergreen_CTA-SALE_Angle-W_M-MOOD_VL-30s_G-M_P-OG_S-WOOD_FB3860V03,ðŸ‘¨ || Father's Day || Bundle offer  || ASC+ || US || 0% EXISTING CAP || 7C || 07/06/2025 Ad set,VIDEO,$141,"6,659",2025-06-09,2025-06-16,7
211,CB_2025_May_FB_4140_SO-VG_V10_4x5_IMG_EN_Opti_C-NONE_Evergreen_CTA-NONE_Angle-W_M-NONE_VL-None_G-NONE_P-OG_S-NONE_FB4040V09 - BIOMA,ðŸ‘¨ || Father's Day || Bundle offer  || ASC+ || US || 0% EXISTING CAP || 7C || 07/06/2025 Ad set,SHARE,$140,"5,222",2025-06-07,2025-06-10,3
212,CB_2025_May_FB_4150_DT-KB_V06_4x5_IMG_EN_New_C-Headline_Sale_CTA-65_Angle-None_M-MIX_VL-None_G-M_P-OG_S-NONE,ðŸ‘¨ || Father's Day || Bundle offer  || ASC+ || US || 0% EXISTING CAP || 7C || 07/06/2025 Ad set,SHARE,$136,"5,088",2025-06-09,2025-06-16,7
213,CB_2025_Jan_FB_3744_SO_V07_4x5_IMG_EN_New_C-Headline_Evergreen_CTA-NONE_Angle-W_M-NONE_VL-None_G-NONE_P-GLP1_S-NONE,GLP-1 ðŸ’œ || ASC+ || CA || 5% EXISTING CAP || 7C || 29/05/2025 Ad set,SHARE,$135,"3,712",2025-06-10,2025-06-14,4
214,CB_2025_Jan_FB_3753_SO_V05_4x5_IMG_EN_New_C-Headline_Evergreen_CTA-NONE_Angle-W_M-NONE_VL-None_G-NONE_P-GLP1_S-NONE,3753 - Notion Idea #111 â€œDualâ€Benefit Vennâ€ || Batch 1 || Enhancements: OFF || GLP-1 Booster || 7C1V || 02/06/25w23,SHARE,$135,"2,865",2025-06-03,2025-06-10,7
215,CB_2023_May_FB_2144_MB_V02_9x16_VID_EN_Opti_C-Sale_CTA-SMR_Pain-W_M-JOG_VL-30s_TR-None_G-M-F_P-None_S-What,CA || INTEREST: UPCOMING BIRTHDAY || 7C || 11/05/25,VIDEO,$132,"8,273",2025-05-12,2025-06-16,35
216,CB_2025_Jun_FB_4162_VK-RP_V08_4x5_IMG_EN_New_C-BulletPoints_Evergreen_CTA-SALE_Angle-W-B-C_M-NONE_VL-None_G-M_P-OG_S-NONE,4162 - #157 Shrek vs. Prince Charming -VK-RP || Enhancements: OFF || CBV1 || Batch 2 || 7C || 09/06/25w24,SHARE,$130,"4,866",2025-06-09,2025-06-14,5
217,CB_2025_Jun_FB_4161_DT-VG_V02_9x16_VID_EN_New_C-BulletPoints_Evergreen_CTA-NONE_Angle-W-B-C_M-MIX_VL-15s_G-M_P-OG_S-NEW,4167 - #158 Ohealth Copy_MIX painpoints || Enhancements: OFF || CBV1 || Batch 1 || 7C || 09/06/25w24,VIDEO,$129,"5,441",2025-06-09,2025-06-14,5
218,CB_2025_May_FB_4143_DT_V04_4x5_IMG_EN_New_C-Headline_Evergreen_CTA-65_Angle-W_M-NONE_VL-None_G-NONE_P-OG_S-NONE,4143 - Hormonal weight || Enhancements: OFF || CBV1 || Batch 1 || 7C || 02/06/25w23,SHARE,$128,"5,801",2025-06-02,2025-06-12,10
219,CB_2025_Jan_FB_3757_LZ-DP_V20_9x16_VID_EN_Opti_C-NegativeMark_Evergreen_CTA-NONE_Angle-W-B_M-MAG_VL-45s_G-F_P-GLP1_S-WHAT_FB3311V14.mp4,3757 - GLP1 video winner opti Batch 3+4 || Enhancements: OFF || GLP-1 || Batch 4 || 7C || 24/02/25w09 || Valentinas,VIDEO,$127,"3,308",2025-02-24,2025-06-09,105
220,CB_2025_Jun_FB_4156_DT_V01_9x16_VID_EN_New_C-Testimonial_Evergreen_CTA-65_Angle-W-B-C_M-JAS_VL-30s_G-M_P-OG_S-NEW,4156 - Introducing Jason || Enhancements: OFF || CBV1 || Batch 3-4 || 7C || 09/06/25w24,VIDEO,$124,"4,992",2025-06-09,2025-06-10,1
221,CB_2025_Jun_FB_4151_DT-KB_V06_4x5_IMG_EN_New_C-NONE_Sale_CTA-65_Angle-W-B_M-NONE_VL-None_G-NONE_P-OG_S-NONE_FB2959V07 - CC,ðŸ‘¨ || Father's Day || Bundle offer  || ASC+ || US || 0% EXISTING CAP || 7C || 07/06/2025 Ad set,SHARE,$123,"3,576",2025-06-07,2025-06-16,9
222,CB_2025_Jan_FB_3753_SO_V01_4x5_IMG_EN_New_C-Headline_Evergreen_CTA-NONE_Angle-W_M-NONE_VL-None_G-NONE_P-GLP1_S-NONE,GLP-1 ðŸ’œ || ASC+ || CA || 5% EXISTING CAP || 7C || 29/05/2025 Ad set,SHARE,$123,"5,106",2025-06-10,2025-06-16,6
223,CB_2025_Jun_FB_4173_LZ_V06_4x5_IMG_EN_New_C-Headline_Evergreen_CTA-NONE_Angle-C_M-NONE_VL-None_G-NONE_P-NONE_S-NONE,4173 - Block Number  || Enhancements: OFF || CBV1 || Batch 2 || 7C || 09/06/25w24,SHARE,$122,"5,371",2025-06-09,2025-06-16,7
224,CB_2025_Jun_FB_4145_SO_V10_4x5_IMG_EN_Opti_C-NONE_Evergreen_CTA-NONE_Angle-W-B-C_M-NONE_VL-None_G-NONE_P-OG_S-NONE_FB3950V16,4145 - FB3950V16 Opti || Enhancements: OFF || CBV1 || Batch 2 || 7C || 09/06/25w24,SHARE,$121,"5,763",2025-06-09,2025-06-14,5
225,CB_2025_Jun_FB_4174_LZ-VG_V01_9x16_GIF_EN_Opti_C-Headline_Evergreen_CTA-65_Angle-W_M-NONE_VL-None_G-M_P-OG_S-NONE_FB4093V02,4174 - navy seal winner gifification || Enhancements: OFF || CBV1 || Batch 1 || 7C || 09/06/25w24,VIDEO,$121,"3,671",2025-06-09,2025-06-14,5
226,CB_2025_Jun_FB_4159_VK_V06_4x5_IMG_EN_New_C-BulletPoints_Evergreen_CTA-SALE_Angle-W-B-C_M-NONE_VL-None_G-M_P-OG_S-NONE,4159 - obsessed is understatement - VK || Enhancements: OFF || CBV1 || Batch 2 || 7C || 09/06/25w24,SHARE,$118,"3,958",2025-06-09,2025-06-14,5
227,CB_2025_May_FB_4101_VK-DP_V03_4x5_IMG_EN_New_C-BulletPoints_Evergreen_CTA-SALE_Angle-Energy_M-NONE_VL-None_G-M_P-OG_S-NONE,CA || ASC+ || 0% EXISTING || 7DC || 12.05.2025 RESTART Ad set,SHARE,$114,"9,557",2025-05-22,2025-06-09,18
228,CB_2025_Jun_FB_4173_LZ_V02_4x5_IMG_EN_New_C-Headline_Evergreen_CTA-NONE_Angle-C_M-NONE_VL-None_G-NONE_P-NONE_S-NONE,4173 - Block Number  || Enhancements: OFF || CBV1 || Batch 1 || 7C || 09/06/25w24,SHARE,$110,"6,338",2025-06-09,2025-06-14,5
229,CB_2025_Jan_FB_3741_LZ-JG_V01_4x5_IMG_EN_Opti_C-Headline_Evergreen_CTA-NONE_Angle-W_M-NONE_VL-None_G-NONE_P-CBV2_S-NONE_FB3357V01,CBV2 || US || Manual Bid: ROAS GOAL: 1.00 -> 1.1 || 7DC || 22/01/2025,SHARE,$110,"4,482",2025-01-22,2025-06-16,145
230,CB_2025_Jun_FB_4152_SO-VG_V04_4x5_IMG_EN_New_C-Headline_Evergreen_CTA-NONE_Angle-W_M-NONE_VL-0s_G-NONE_P-OG_S-NONE,4152 - Lose X amount by getting regularâ€”daily IMG || Enhancements: OFF || CBV1 || Batch 1 || 7C || 09/06/25w24,SHARE,$109,"3,110",2025-06-09,2025-06-14,5
231,CB_2025_Jun_FB_4175_SO_V07_4x5_IMG_EN_New_C-Headline_Evergreen_CTA-NONE_Angle-W_M-NONE_VL-None_G-NONE_P-OG_S-NONE,4175 - Vintage Collage IMG || Enhancements: OFF || CBV1 || Batch 2 || 7C || 09/06/25w24,SHARE,$108,"3,570",2025-06-09,2025-06-16,7
232,CB_2025_Jun_FB_4175_SO_V06_4x5_IMG_EN_New_C-Headline_Evergreen_CTA-NONE_Angle-W_M-NONE_VL-None_G-NONE_P-OG_S-NONE,4175 - Vintage Collage IMG || Enhancements: OFF || CBV1 || Batch 2 || 7C || 09/06/25w24,SHARE,$107,"4,066",2025-06-09,2025-06-16,7
233,CB_2025_May_FB_4140_SO-VG_V11_4x5_IMG_EN_Opti_C-NONE_Evergreen_CTA-NONE_Angle-W_M-NONE_VL-None_G-NONE_P-OG_S-NONE_FB4040V09 - BIOMA,ðŸ‘¨ || Father's Day || Bundle offer  || ASC+ || US || 0% EXISTING CAP || 7C || 07/06/2025 Ad set,SHARE,$107,"4,314",2025-06-07,2025-06-16,9
234,CB_2025_Jun_FB_4173_LZ_V08_4x5_IMG_EN_New_C-Headline_Evergreen_CTA-NONE_Angle-W_M-NONE_VL-None_G-NONE_P-NONE_S-NONE,4173 - Block Number  || Enhancements: OFF || CBV1 || Batch 2 || 7C || 09/06/25w24,SHARE,$103,"4,827",2025-06-09,2025-06-16,7
235,CB_2025_Jun_FB_4145_DT-KB_V08_4x5_IMG_EN_Opti_C-NONE_SALE_CTA-65_Angle-W_M-NONE_VL-None_G-NONE_P-NONE_S-NONE_FB3812V03 - BIOMA,ðŸ‘¨ || Father's Day || Bundle offer  || ASC+ || US || 0% EXISTING CAP || 7C || 07/06/2025 Ad set,SHARE,$103,"4,343",2025-06-07,2025-06-16,9
236,CB_2025_Jun_FB_4154_DT-KB_V01_4x5_IMG_EN_Opti_C-NONE_Sale_CTA-65_ngle-W-B_M-NONE_VL-None_G-NONE_P-OG_S-NONE_FB2959V07 - BIOMA,ðŸ‘¨ || Father's Day || Bundle offer  || ASC+ || US || 0% EXISTING CAP || 7C || 07/06/2025 Ad set,SHARE,$102,"2,998",2025-06-07,2025-06-16,9
237,CB_2025_Jan_FB_3757_LZ-DP_V18_4x5_VID_EN_Opti_C-NegativeMark_Evergreen_CTA-NONE_Angle-W_M-MAG_VL-45s_G-F_P-GLP1_S-MOON_FB3311V13,GLP-1 ðŸ’œ || ASC+ || CA || 5% EXISTING CAP || 7C || 29/05/2025 Ad set,VIDEO,$101,"2,469",2025-06-10,2025-06-16,6
238,CB_2025_Jun_FB_4176_SO-KB_V06_4x5_IMG_EN_Opti_C-Headline_Evergreen_CTA-NONE_Angle-W_M-NONE_VL-None_G-NONE_P-OG_S-NONE_FB4100V02,4176 - FB4100V02 Opti || Enhancements: OFF || CBV1 || Batch 2 || 7C || 09/06/25w24,SHARE,$100,"4,721",2025-06-09,2025-06-16,7
239,CB_2025_Jan_FB_3757_LZ-DP_V18_4x5_VID_EN_Opti_C-NegativeMark_Evergreen_CTA-NONE_Angle-W_M-MAG_VL-45s_G-F_P-GLP1_S-MOON_FB3311V13,GLP-1 ðŸ’œ || ASC+ || US || 5% EXISTING CAP || 7C || 29/05/2025 Ad set,VIDEO,$99,"2,822",2025-06-02,2025-06-16,14
240,CB_2025_Jan_FB_3744_SO_V07_4x5_IMG_EN_New_C-Headline_Evergreen_CTA-NONE_Angle-W_M-NONE_VL-None_G-NONE_P-GLP1_S-NONE,GLP-1 ðŸ’œ || ASC+ || US || 5% EXISTING CAP || 7C || 29/05/2025 Ad set,SHARE,$98,"2,430",2025-06-07,2025-06-16,9
241,CB_2025_Jun_FB_4169_DT-DP_V01_9x16_VID_EN_New_C-SocialProof_Evergreen_CTA-65_Angle-W-B-C_M-MAN_VL-30s_G-MF_P-OG_S-NEW,"4169 - 3 reasons why, GF POV || Enhancements: OFF || CBV1 || Batch 1 || 7C || 09/06/25w24",VIDEO,$98,"4,206",2025-06-09,2025-06-16,7
242,CB_2025_Jan_FB_3757_LZ-DP_V13_4x5_VID_EN_Opti_C-Pointing_Evergreen_CTA-NONE_Angle-W-B-C_M-Nonie_VL-30s_G-F_P-GLP1_S-WHAT_FB3164V01,3757 - GLP1 video winner opti Batch 3+4 || Batch 3 || Enhancements: OFF || GLP-1 Booster || 7C1V || 30/05/25w22,SHARE,$98,"2,639",2025-05-30,2025-06-10,11
243,CB_2025_Jun_FB_4176_SO-KB_V02_4x5_IMG_EN_Opti_C-Headline_Evergreen_CTA-NONE_Angle-W_M-NONE_VL-None_G-NONE_P-OG_S-NONE_FB4100V02,4176 - FB4100V02 Opti || Enhancements: OFF || CBV1 || Batch 1 || 7C || 09/06/25w24,SHARE,$98,"4,138",2025-06-09,2025-06-16,7
244,CB_2025_May_FB_4158_VK-VG_V11_4x5_VID_EN_Opti_C-Headline_Evergreen_CTA-SALE_Angle-W-B-C_M-NONE_VL-None_G-M_P-OG_S-NONE_FB4104V05,4158 - 4104_V05_VG Opti - VK || Enhancements: OFF || CBV1 || Batch 3-4 || 7C || 09/06/25w24,SHARE,$96,"5,364",2025-06-09,2025-06-16,7
245,CB_2025_Jun_FB_4165_VK-VG_V04_9x16_VID_EN_New_C-BulletPoints_Evergreen_CTA-SALE_Angle-W-B-C_M-MAN_VL-30s_G-M_P-OG_S-NEW,4165 - bloating_dietfails_VG - VK || Enhancements: OFF || CBV1 || Batch 1-3 || 7C || 09/06/25w24,VIDEO,$94,"4,663",2025-06-09,2025-06-14,5
246,CB_2025_Jan_FB_3763_SO-DP_V01_1x1_IMG_EN_New_C-Headline_Evergreen_CTA-NONE_Angle-W_M-NONE_VL-None_G-NONE_P-GLP1_S-NONE,3763 - #117 Notion idea GLP IMG || Batch 1 || Enhancements: OFF || GLP-1 Booster || 7C1V || 09/06/25w23,SHARE,$90,"2,445",2025-06-09,2025-06-16,7
247,CB_2025_Jun_FB_4161_DT-VG_V04_9x16_VID_EN_New_C-BulletPoints_Evergreen_CTA-NONE_Angle-W-B-C_M-MIX_VL-15s_G-M_P-OG_S-NEW,4167 - #158 Ohealth Copy_MIX painpoints || Enhancements: OFF || CBV1 || Batch 1 || 7C || 09/06/25w24,VIDEO,$88,"3,222",2025-06-09,2025-06-14,5
248,CB_2025_Jun_FB_4145_DT-KB_V04_4x5_IMG_EN_Opti_C-NONE_Sale_CTA-65_Angle-W-B-C_M-NONE_VL-None_G-NONE_P-OG_S-NONE_FB3924V03 - CC,ðŸ‘¨ || Father's Day || Bundle offer  || ASC+ || US || 0% EXISTING CAP || 7C || 07/06/2025 Ad set,SHARE,$83,"2,534",2025-06-07,2025-06-16,9
249,CB_2025_Feb_FB_3774_SO-JT_V01_1x1_IMG_EN_New_C-Headline_Evergreen_CTA-NONE_Angle-W_M-NONE_VL-15s_G-NONE_P-GLP1_S-NONE,3774 - #114 SMASH GLP IMG || Batch 1 || Enhancements: OFF || GLP-1 Booster || 7C1V || 09/06/25w23,SHARE,$83,"2,213",2025-06-09,2025-06-16,7
250,CB_2025_Jan_FB_3783_LZ_V01_1x1_IMG_EN_New_C-BulletPoints_Evergreen_CTA-NONE_Angle-W_M-NONE_VL-None_G-NONE_P-GLP1_S-NONE,3783 - #124 Notion idea ChatGLP || Batch 1 || Enhancements: OFF || GLP-1 Booster || 7C1V || 09/06/25w23,SHARE,$82,"2,596",2025-06-09,2025-06-12,3
251,CB_2025_Jun_FB_4151_DT-KB_V04_4x5_IMG_EN_New_C-NONE_Sale_CTA-65_Angle-W-B_M-NONE_VL-None_G-NONE_P-OG_S-NONE_FB2959V07 - CC,ðŸ‘¨ || Father's Day || Bundle offer  || ASC+ || US || 0% EXISTING CAP || 7C || 07/06/2025 Ad set,SHARE,$82,"3,106",2025-06-07,2025-06-16,9
252,CB_2025_Jan_FB_3768_SO-JT_V01_1x1_IMG_EN_New_C-Headline_Evergreen_CTA-NONE_Angle-W_M-NONE_VL-None_G-NONE_P-GLP1_S-NONE,3768 - AWARENESS / GLP-1 / PLATEU BREAKER IMG || Batch 1 || Enhancements: OFF || GLP-1 Booster || 7C1V || 09/06/25w23,SHARE,$81,"1,726",2025-06-09,2025-06-12,3
253,CB_2025_Jun_FB_4201_LZ-VU_V01_9x16_GIF_EN_New_C-Sale_Evergreen_CTA-SALE_Angle-None_M-NONE_VL-7s_G-NONE_P-Combo_S-NONE,CC and Bioma end cards as ads || Enhancements: OFF || CBV1 || Batch 1 || 7C || 12/06/25w24,SHARE,$78,"2,536",2025-06-12,2025-06-16,4
254,CB_2025_Jun_FB_4164_LZ-VG_V03_4x5_IMG_EN_New_C-Headline_Evergreen_CTA-65_Angle-GH_M-NONE_VL-None_G-NONE_P-OG_S-NONE,4164 - liver angle 3999 opti || Enhancements: OFF || CBV1 || Batch 2 || 7C || 09/06/25w24,SHARE,$76,"2,895",2025-06-09,2025-06-14,5
255,CB_2025_May_FB_4080_LZ-VG_V03_4x5_IMG_EN_New_C-Headline_Evergreen_CTA-NONE_Angle-W_M-NONE_VL-None_G-M_P-OG_S-NONE - Copy,âš«ï¸ US || CBV2 || Advantage+ || 7C || BROAD || Existing_customer_0% || || 24/04/25 Ad set,SHARE,$76,"3,587",2025-05-20,2025-06-16,27
256,CB_2025_Feb_FB_3789_VK_V02_1x1_IMG_EN_NEW_C-BulletPoints_Evergreen_CTA-70_Angle-W-B-C_M-NONE_VL-None_G-F_P-GLP1_S-NEW,3789 - Notion #114 Costs Less Than a Doughnut GLP VK || Batch 1 || Enhancements: OFF || GLP-1 Booster || 7C1V || 09/06/25w23,SHARE,$74,"1,940",2025-06-09,2025-06-12,3
257,CB_2025_Jun_FB_4154_DT-KB_V02_4x5_IMG_EN_Opti_C-Price_Sale_CTA-65_Angle-None_M-NONE_VL-None_G-NONE_P-OG_S-NONE_FB3907V03 - BIOMA,ðŸ‘¨ || Father's Day || Bundle offer  || ASC+ || US || 0% EXISTING CAP || 7C || 07/06/2025 Ad set,SHARE,$73,"1,917",2025-06-07,2025-06-16,9
258,CB_2025_Jun_FB_4176_SO-KB_V09_4x5_IMG_EN_Opti_C-Headline_Evergreen_CTA-NONE_Angle-W_M-NONE_VL-None_G-NONE_P-OG_S-NONE_FB4100V02,4176 - FB4100V02 Opti || Enhancements: OFF || CBV1 || Batch 3 || 7C || 09/06/25w24,SHARE,$72,"2,113",2025-06-09,2025-06-16,7
259,CB_2025_May_FB_4114_LZ-VG_V09_4x5_IMG_EN_New_C-Headline_Evergreen_CTA-NONE_Angle-C_M-NONE_VL-None_G-M_P-NONE_S-NONE,4114 - FOMO angle || Enhancements: OFF || CBV1 || Batch 3 || 7C || 02/06/25w23,SHARE,$71,"3,559",2025-06-02,2025-06-16,14
260,CB_2025_Jan_FB_3768_SO-JT_V02_1x1_IMG_EN_New_C-Headline_Evergreen_CTA-NONE_Angle-W_M-NONE_VL-None_G-NONE_P-GLP1_S-NONE,3768 - AWARENESS / GLP-1 / PLATEU BREAKER IMG || Batch 1 || Enhancements: OFF || GLP-1 Booster || 7C1V || 09/06/25w23,SHARE,$68,"2,319",2025-06-09,2025-06-12,3
261,CB_2025_Jun_FB_4159_VK_V10_4x5_IMG_EN_New_C-BulletPoints_Evergreen_CTA-SALE_Angle-W-B-C_M-NONE_VL-None_G-M_P-OG_S-NONE,4159 - obsessed is understatement - VK || Enhancements: OFF || CBV1 || Batch 3 || 7C || 09/06/25w24,SHARE,$67,"3,634",2025-06-09,2025-06-16,7
262,CB_2025_Feb_FB_3788_SO-JT_V03_1x1_IMG_EN_New_C-Headline_Evergreen_CTA-NONE_Angle-W_M-NONE_VL-15s_G-NONE_P-GLP1_S-NONE,3788 - Notion Idea #121 FUEL GLP IMG || Batch 1 || Enhancements: OFF || GLP-1 Booster || 7C1V || 09/06/25w23,SHARE,$67,"1,459",2025-06-09,2025-06-12,3
263,CB_2025_Feb_FB_3827_LZ_V03_1x1_IMG_EN_Opti_C-Headline_Evergreen_CTA-SALE_Angle-W_M-NONE_VL-None_G-M_P-CBV2_S-NONE_FB3705V02,âš«ï¸ US || CBV2 || Advantage+ || 7C || BROAD || Existing_customer_0% || || 24/04/25 Ad set,SHARE,$66,"2,074",2025-04-24,2025-06-16,53
264,CB_2025_Jun_FB_4145_SO_V11_4x5_IMG_EN_Opti_C-NONE_Evergreen_CTA-NONE_Angle-W-B-C_M-NONE_VL-None_G-NONE_P-OG_S-NONE_FB3950V16,4145 - FB3950V16 Opti || Enhancements: OFF || CBV1 || Batch 3 || 7C || 09/06/25w24,SHARE,$65,"2,816",2025-06-09,2025-06-16,7
265,CB_2025_May_FB_4158_VK-VG_V02_4x5_VID_EN_Opti_C-Headline_Evergreen_CTA-SALE_Angle-W-B-C_M-NONE_VL-None_G-M_P-OG_S-NONE_FB4104V05,4158 - 4104_V05_VG Opti - VK || Enhancements: OFF || CBV1 || Batch 1-2 || 7C || 09/06/25w24,SHARE,$63,"2,461",2025-06-09,2025-06-13,4
266,CB_2024_Sep_FB_3135_DA-DP_V01_4x5_VID_EN_Opti_C-Pointing_Evergreen_CTA-DISCOUNT_Angle-W-B_M-ALEX_VL-30s_G-M_P-OG_S-MOON_FB3096V03,ðŸŒ¶ï¸  || ASC+ || US || 0% EXISTING CAP || 7C || 15/05/2025  Campaign Ad set,VIDEO,$62,"2,693",2025-05-15,2025-06-16,32
267,CB_2024_Oct_FB_3189_DA_V02_4x5_VID_EN_Opti_C-SingleTesti_Sale_CTA-HLWN_Angle-W_M-TRC_VL-45s_G-F_P-OG_S-MOON_FB2764V04 - Copy,ðŸŒ¶ï¸  || ASC+ || US || 0% EXISTING CAP || 7C || 15/05/2025  Campaign Ad set,SHARE,$62,"1,924",2025-05-15,2025-06-16,32
268,CB_2025_Jun_FB_4163_VK_V08_4x5_IMG_EN_Opti_C-BulletPoints_Evergreen_CTA-SALE_Angle-W-B-C_M-NONE_VL-None_G-M_P-OG_S-NONE_FB4110V03,4163 - opti 4112 - VK || Enhancements: OFF || CBV1 || Batch 2 || 7C || 09/06/25w24,SHARE,$61,"2,447",2025-06-09,2025-06-13,4
269,CB_2025_Jun_FB_4160_SO_V03_9x16_VID_EN_Opti_C-NONE_Evergreen_CTA-65_Angle-W-B-C_M-NONE_VL-20s_G-F_P-OG_S-NEW_FB3967V10,4160 - FB3967V10 Opti || Enhancements: OFF || CBV1 || Batch 1-3 || 7C || 09/06/25w24,VIDEO,$61,"3,487",2025-06-09,2025-06-14,5
270,CB_2025_Jun_FB_4159_VK_V02_4x5_IMG_EN_New_C-BulletPoints_Evergreen_CTA-SALE_Angle-W-B-C_M-NONE_VL-None_G-M_P-OG_S-NONE,4159 - obsessed is understatement - VK || Enhancements: OFF || CBV1 || Batch 1 || 7C || 09/06/25w24,SHARE,$58,"2,292",2025-06-09,2025-06-13,4
271,CB_2025_Jun_FB_4145_SO_V05_4x5_IMG_EN_Opti_C-NONE_Evergreen_CTA-NONE_Angle-W-B-C_M-NONE_VL-None_G-NONE_P-OG_S-NONE_FB3950V16,4145 - FB3950V16 Opti || Enhancements: OFF || CBV1 || Batch 1 || 7C || 09/06/25w24,SHARE,$58,"2,929",2025-06-09,2025-06-16,7
272,CB_2024_Sep_FB_3175_DA-KB_V02_1x1_IMG_EN_New_C-ADVRT_Evergreen_CTA-NONE_Angle-W_M-NONE_VL-None_G-NONE_P-CBV2_S-NONE_blog_colonbroomvsmammoth_cv_en,CBV2 || Advantage+ || Advertorial || Higher pricing || US || 0% EXISTING CAP || BROAD || 7C || 20/01/25  Campaign Ad set,SHARE,$56,"3,372",2025-01-20,2025-06-16,147
273,CB_2025_Jun_FB_4154_DT-KB_V03_4x5_IMG_EN_Opti_C-Headline_Sale_CTA-65_Angle-W_M-NONE_VL-None_G-NONE_P-OG_S-NONE_3608V03 - BIOMA,ðŸ‘¨ || Father's Day || Bundle offer  || ASC+ || US || 0% EXISTING CAP || 7C || 07/06/2025 Ad set,SHARE,$56,"1,568",2025-06-07,2025-06-16,9
274,CB_2025_Jun_FB_4161_DT-VG_V01_9x16_VID_EN_New_C-BulletPoints_Evergreen_CTA-NONE_Angle-W-B-C_M-MIX_VL-15s_G-M_P-OG_S-NEW,4167 - #158 Ohealth Copy_MIX painpoints || Enhancements: OFF || CBV1 || Batch 1 || 7C || 09/06/25w24,VIDEO,$52,"1,792",2025-06-10,2025-06-14,4
275,CB_2025_Jun_FB_4159_VK_V11_4x5_IMG_EN_New_C-BulletPoints_Evergreen_CTA-SALE_Angle-W-B-C_M-NONE_VL-None_G-M_P-OG_S-NONE,4159 - obsessed is understatement - VK || Enhancements: OFF || CBV1 || Batch 3 || 7C || 09/06/25w24,SHARE,$52,"2,256",2025-06-09,2025-06-16,7
276,CB_2025_Jun_FB_4161_DT-VG_V10_9x16_VID_EN_New_C-BulletPoints_Evergreen_CTA-NONE_Angle-W-B-C_M-MIX_VL-15s_G-M_P-OG_S-NEW,4167 - #158 Ohealth Copy_MIX painpoints || Enhancements: OFF || CBV1 || Batch 3 || 7C || 09/06/25w24,VIDEO,$52,"1,926",2025-06-09,2025-06-14,5
277,CB_2025_Jun_FB_4154_DT-KB_V02_4x5_IMG_EN_Opti_C-Price_Sale_CTA-65_Angle-None_M-NONE_VL-None_G-NONE_P-OG_S-NONE_FB3907V03 - CC,ðŸ‘¨ || Father's Day || Bundle offer  || ASC+ || US || 0% EXISTING CAP || 7C || 07/06/2025 Ad set,SHARE,$51,"1,582",2025-06-07,2025-06-16,9
278,CB_2025_Feb_FB_3788_SO-JT_V02_1x1_IMG_EN_New_C-Headline_Evergreen_CTA-NONE_Angle-W_M-NONE_VL-15s_G-NONE_P-GLP1_S-NONE,3788 - Notion Idea #121 FUEL GLP IMG || Batch 1 || Enhancements: OFF || GLP-1 Booster || 7C1V || 09/06/25w23,SHARE,$51,"1,456",2025-06-09,2025-06-12,3
279,CB_2025_Jun_FB_4175_SO_V03_4x5_IMG_EN_New_C-Headline_Evergreen_CTA-NONE_Angle-W_M-NONE_VL-None_G-NONE_P-OG_S-NONE,4175 - Vintage Collage IMG || Enhancements: OFF || CBV1 || Batch 1 || 7C || 09/06/25w24,SHARE,$51,"2,470",2025-06-09,2025-06-14,5
280,CB_2025_Jun_FB_4145_SO_V13_4x5_IMG_EN_Opti_C-NONE_Evergreen_CTA-NONE_Angle-W-B-C_M-NONE_VL-None_G-NONE_P-OG_S-NONE_FB3950V16,4145 - FB3950V16 Opti || Enhancements: OFF || CBV1 || Batch 3 || 7C || 09/06/25w24,SHARE,$49,"1,983",2025-06-09,2025-06-16,7
281,CB_2025_Jun_FB_4160_SO_V09_9x16_VID_EN_Opti_C-NONE_Evergreen_CTA-65_Angle-W-B-C_M-NONE_VL-20s_G-F_P-OG_S-NEW_FB3967V10,4160 - FB3967V10 Opti || Enhancements: OFF || CBV1 || Batch 1-3 || 7C || 09/06/25w24,VIDEO,$49,"2,487",2025-06-09,2025-06-14,5
282,CB_2024_Nov_FB_3305_SO-DP_V02_4x5_VID_EN_Opti_C-Sale_CTA-BF_Pain-W_M-Chris_VL-30s_TR-None_G-MF_P-Plan_S-NEW_FB2601V07 - Copy,ðŸŒ¶ï¸  || ASC+ || US || 0% EXISTING CAP || 7C || 15/05/2025  Campaign Ad set,VIDEO,$48,"1,512",2025-05-15,2025-06-09,25
283,CB_2025_Jun_FB_4160_SO_V08_9x16_VID_EN_Opti_C-NONE_Evergreen_CTA-65_Angle-W-B-C_M-NONE_VL-20s_G-F_P-OG_S-NEW_FB3967V10,4160 - FB3967V10 Opti || Enhancements: OFF || CBV1 || Batch 1-3 || 7C || 09/06/25w24,VIDEO,$47,"2,517",2025-06-09,2025-06-14,5
284,CB_2025_Jun_FB_4165_VK-VG_V03_9x16_VID_EN_New_C-BulletPoints_Evergreen_CTA-SALE_Angle-W-B-C_M-MAN_VL-30s_G-M_P-OG_S-NEW,4165 - bloating_dietfails_VG - VK || Enhancements: OFF || CBV1 || Batch 1-3 || 7C || 09/06/25w24,VIDEO,$46,"1,940",2025-06-09,2025-06-14,5
285,CB_2025_Jun_FB_4151_DT-KB_V05_4x5_IMG_EN_New_C-NONE_Sale_CTA-65_Angle-W-B_M-NONE_VL-None_G-NONE_P-OG_S-NONE_FB2959V07 - BIOMA,ðŸ‘¨ || Father's Day || Bundle offer  || ASC+ || US || 0% EXISTING CAP || 7C || 07/06/2025 Ad set,SHARE,$45,"1,460",2025-06-07,2025-06-16,9
286,CB_2025_May_FB_4150_DT-KB_V04_4x5_IMG_EN_New_C-Headline_Sale_CTA-65_Angle-None_M-MIX_VL-None_G-M_P-OG_S-NONE,ðŸ‘¨ || Father's Day || Bundle offer  || ASC+ || US || 0% EXISTING CAP || 7C || 07/06/2025 Ad set,SHARE,$45,"1,559",2025-06-09,2025-06-16,7
287,CB_2025_Jun_FB_4160_SO_V06_9x16_VID_EN_Opti_C-NONE_Evergreen_CTA-65_Angle-W-B-C_M-NONE_VL-20s_G-F_P-OG_S-NEW_FB3967V10,4160 - FB3967V10 Opti || Enhancements: OFF || CBV1 || Batch 1-3 || 7C || 09/06/25w24,VIDEO,$45,"2,259",2025-06-09,2025-06-14,5
288,CB_2025_May_FB_4158_VK-VG_V09_4x5_VID_EN_Opti_C-Headline_Evergreen_CTA-SALE_Angle-W-B-C_M-NONE_VL-None_G-M_P-OG_S-NONE_FB4104V05,4158 - 4104_V05_VG Opti - VK || Enhancements: OFF || CBV1 || Batch 3-4 || 7C || 09/06/25w24,SHARE,$45,"2,133",2025-06-09,2025-06-16,7
289,CB_2025_Jan_FB_3756_VK-DP_V03_4x5_IMG_EN_New_C-BulletPoints_Evergreen_CTA-NONE_Angle-W-B-C_M-NONE_VL-None_G-M_P-GLP1_S-NONE,GLP-1 ðŸ’œ || ASC+ || UK || 5% EXISTING CAP || 7C || 29/05/2025 Ad set,SHARE,$45,806,2025-06-10,2025-06-16,6
290,CB_2025_Jan_FB_3760_DT-DP_V04_9x16_VID_EN_New_C-Trend_Sale_CTA-70_Angle-W-C_M-MAG_VL-30s_G-M_P-GLP1_S-NEW,3760 - #110 Notion idea Lie || Batch 1 || Enhancements: OFF || GLP-1 Booster || 7C1V || 09/06/25w23,VIDEO,$45,749,2025-06-09,2025-06-12,3
291,CB_2025_Jun_FB_4151_DT-KB_V08_4x5_IMG_EN_New_C-NONE_Sale_CTA-65_Angle-W-B_M-NONE_VL-None_G-NONE_P-OG_S-NONE_FB2959V07 - BIOMA,ðŸ‘¨ || Father's Day || Bundle offer  || ASC+ || US || 0% EXISTING CAP || 7C || 07/06/2025 Ad set,SHARE,$44,"1,993",2025-06-07,2025-06-16,9
292,CB_2025_May_FB_4140_SO-VG_V01_4x5_IMG_EN_Opti_C-NONE_Evergreen_CTA-NONE_Angle-W_M-NONE_VL-None_G-NONE_P-OG_S-NONE_FB3950V11 - CC,ðŸ‘¨ || Father's Day || Bundle offer  || ASC+ || US || 0% EXISTING CAP || 7C || 07/06/2025 Ad set,SHARE,$44,"2,056",2025-06-07,2025-06-16,9
293,CB_2025_May_FB_4080_LZ-VG_V03_4x5_IMG_EN_New_C-Headline_Evergreen_CTA-NONE_Angle-W_M-NONE_VL-None_G-M_P-OG_S-NONE,âš«ï¸ US || CBV2 || Advantage+ || 7C || BROAD || Existing_customer_0% || || 24/04/25 Ad set,SHARE,$44,"1,798",2025-05-19,2025-06-16,28
294,CB_2025_Jan_FB_3760_DT-DP_V03_9x16_VID_EN_New_C-Trend_Sale_CTA-70_Angle-W-C_M-MAG_VL-30s_G-M_P-GLP1_S-NEW,3760 - #110 Notion idea Lie || Batch 1 || Enhancements: OFF || GLP-1 Booster || 7C1V || 09/06/25w23,VIDEO,$43,880,2025-06-09,2025-06-12,3
295,CB_2025_Jun_FB_4145_SO_V09_4x5_IMG_EN_Opti_C-NONE_Evergreen_CTA-NONE_Angle-W-B-C_M-NONE_VL-None_G-NONE_P-OG_S-NONE_FB3950V16,4145 - FB3950V16 Opti || Enhancements: OFF || CBV1 || Batch 2 || 7C || 09/06/25w24,SHARE,$40,"1,783",2025-06-09,2025-06-14,5
296,CB_2025_Apr_FB_4029_LZ-VU_V03_4x5_IMG_EN_Opti_C-Trend_Evergreen_CTA-NONE_Angle-W_M-NONE_VL-None_G-NONE_P-OG_S-NONE_FB3671V03,CA || ASC+ || 0% EXISTING || 7DC || 12.05.2025 RESTART Ad set,SHARE,$39,"3,044",2025-05-14,2025-06-16,33
297,CB_2025_May_FB_4140_SO-VG_V04_4x5_IMG_EN_Opti_C-NONE_Evergreen_CTA-NONE_Angle-W_M-NONE_VL-None_G-NONE_P-OG_S-NONE_FB3950V11 - BIOMA,ðŸ‘¨ || Father's Day || Bundle offer  || ASC+ || US || 0% EXISTING CAP || 7C || 07/06/2025 Ad set,SHARE,$39,"1,993",2025-06-07,2025-06-16,9
298,CB_2025_Jun_FB_4179_LZ-KB_V01_4x5_IMG_EN_New_C-BeforeAfter_Evergreen_CTA-65_Angle-W-B_M-NONE_VL-None_G-M_P-OG_S-NONE,4179 - Puzzle piece || Enhancements: OFF || CBV1 || Batch 1 || 7C || 09/06/25w24,SHARE,$38,"1,910",2025-06-09,2025-06-16,7
299,CB_2025_Jun_FB_4165_VK-VG_V01_9x16_VID_EN_New_C-BulletPoints_Evergreen_CTA-SALE_Angle-W-B-C_M-MAN_VL-30s_G-M_P-OG_S-NEW,4165 - bloating_dietfails_VG - VK || Enhancements: OFF || CBV1 || Batch 1-3 || 7C || 09/06/25w24,VIDEO,$37,"1,469",2025-06-09,2025-06-14,5
300,CB_2025_Jun_FB_4162_VK-RP_V12_4x5_IMG_EN_New_C-BulletPoints_Evergreen_CTA-SALE_Angle-W-B-C_M-NONE_VL-None_G-M_P-OG_S-NONE,4162 - #157 Shrek vs. Prince Charming -VK-RP || Enhancements: OFF || CBV1 || Batch 3 || 7C || 09/06/25w24,SHARE,$36,"2,168",2025-06-09,2025-06-14,5
301,CB_2025_Jan_FB_3739_DT_V08_4x5_VID_EN_Opti_C-BulletPoints_Sale_CTA-70_Angle-W-B_M-MIX_VL-45s_G-MF_P-GLP1_S-WHAT_FB3311V10,GLP-1 ðŸ’œ || ASC+ || US || 5% EXISTING CAP || 7C || 29/05/2025 Ad set,VIDEO,$36,766,2025-06-02,2025-06-16,14
302,CB_2025_Jun_FB_4156_DT_V03_9x16_VID_EN_New_C-Testimonial_Evergreen_CTA-65_Angle-W-B-C_M-JAS_VL-30s_G-M_P-OG_S-NEW,4156 - Introducing Jason || Enhancements: OFF || CBV1 || Batch 3-4 || 7C || 09/06/25w24,VIDEO,$35,"1,594",2025-06-09,2025-06-16,7
303,CB_2025_Jun_FB_4145_SO_V02_4x5_IMG_EN_Opti_C-NONE_Evergreen_CTA-NONE_Angle-W-B-C_M-NONE_VL-None_G-NONE_P-OG_S-NONE_FB3950V16,4145 - FB3950V16 Opti || Enhancements: OFF || CBV1 || Batch 1 || 7C || 09/06/25w24,SHARE,$35,"1,674",2025-06-09,2025-06-16,7
304,CB_2025_Jun_FB_4161_DT-VG_V12_9x16_VID_EN_New_C-BulletPoints_Evergreen_CTA-NONE_Angle-W-B-C_M-MIX_VL-15s_G-M_P-OG_S-NEW,4167 - #158 Ohealth Copy_MIX painpoints || Enhancements: OFF || CBV1 || Batch 3 || 7C || 09/06/25w24,VIDEO,$35,"1,487",2025-06-09,2025-06-14,5
305,CB_2025_May_FB_4158_VK-VG_V08_4x5_VID_EN_Opti_C-Headline_Evergreen_CTA-SALE_Angle-W-B-C_M-NONE_VL-None_G-M_P-OG_S-NONE_FB4104V05,4158 - 4104_V05_VG Opti - VK || Enhancements: OFF || CBV1 || Batch 3-4 || 7C || 09/06/25w24,SHARE,$35,"1,477",2025-06-09,2025-06-16,7
306,CB_2025_Jun_FB_4152_SO-VG_V03_4x5_IMG_EN_New_C-Headline_Evergreen_CTA-NONE_Angle-W_M-NONE_VL-0s_G-NONE_P-OG_S-NONE,4152 - Lose X amount by getting regularâ€”daily IMG || Enhancements: OFF || CBV1 || Batch 1 || 7C || 09/06/25w24,SHARE,$34,"1,144",2025-06-09,2025-06-14,5
307,CB_2025_Jun_FB_4145_SO_V15_4x5_IMG_EN_Opti_C-NONE_Evergreen_CTA-NONE_Angle-W-B-C_M-NONE_VL-None_G-NONE_P-OG_S-NONE_FB3950V16,4145 - FB3950V16 Opti || Enhancements: OFF || CBV1 || Batch 3 || 7C || 09/06/25w24,SHARE,$34,"1,682",2025-06-09,2025-06-16,7
308,CB_2025_Mar_FB_3949_VK-DP_V01_9x16_VID_EN_New_C-NONE_Evergreen_CTA-NONE_Angle-W-B-C_M-TYL_VL-None_G-M_P-OG_S-NONE,CA || ASC+ || 0% EXISTING || 7DC || 12.05.2025 RESTART Ad set,VIDEO,$33,"1,987",2025-05-12,2025-06-16,35
309,CB_2025_Jun_FB_4162_VK-RP_V06_4x5_IMG_EN_New_C-BulletPoints_Evergreen_CTA-SALE_Angle-W-B-C_M-NONE_VL-None_G-M_P-OG_S-NONE,4162 - #157 Shrek vs. Prince Charming -VK-RP || Enhancements: OFF || CBV1 || Batch 2 || 7C || 09/06/25w24,SHARE,$33,"1,158",2025-06-09,2025-06-14,5
310,CB_2025_Jun_FB_4160_SO_V07_9x16_VID_EN_Opti_C-NONE_Evergreen_CTA-65_Angle-W-B-C_M-NONE_VL-20s_G-F_P-OG_S-NEW_FB3967V10,4160 - FB3967V10 Opti || Enhancements: OFF || CBV1 || Batch 1-3 || 7C || 09/06/25w24,VIDEO,$33,"1,348",2025-06-09,2025-06-14,5
311,CB_2025_Jun_FB_4162_VK-RP_V11_4x5_IMG_EN_New_C-BulletPoints_Evergreen_CTA-SALE_Angle-W-B-C_M-NONE_VL-None_G-M_P-OG_S-NONE,4162 - #157 Shrek vs. Prince Charming -VK-RP || Enhancements: OFF || CBV1 || Batch 3 || 7C || 09/06/25w24,SHARE,$33,"1,584",2025-06-09,2025-06-14,5
312,CB_2025_May_FB_4140_SO-VG_V15_4x5_IMG_EN_Opti_C-NONE_Evergreen_CTA-NONE_Angle-W_M-NONE_VL-None_G-NONE_P-OG_S-NONE_FB4086V01 - BIOMA,ðŸ‘¨ || Father's Day || Bundle offer  || ASC+ || US || 0% EXISTING CAP || 7C || 07/06/2025 Ad set,SHARE,$33,"1,615",2025-06-07,2025-06-16,9
313,CB_2025_Jun_FB_4162_VK-RP_V10_4x5_IMG_EN_New_C-BulletPoints_Evergreen_CTA-SALE_Angle-W-B-C_M-NONE_VL-None_G-M_P-OG_S-NONE,4162 - #157 Shrek vs. Prince Charming -VK-RP || Enhancements: OFF || CBV1 || Batch 3 || 7C || 09/06/25w24,SHARE,$32,"1,526",2025-06-09,2025-06-14,5
314,CB_2025_May_FB_4158_VK-VG_V06_4x5_VID_EN_Opti_C-Headline_Evergreen_CTA-SALE_Angle-W-B-C_M-NONE_VL-None_G-M_P-OG_S-NONE_FB4104V05,4158 - 4104_V05_VG Opti - VK || Enhancements: OFF || CBV1 || Batch 1-2 || 7C || 09/06/25w24,SHARE,$32,"1,536",2025-06-09,2025-06-13,4
315,CB_2024_Sep_FB_3175_DA-KB_V01_1x1_IMG_EN_New_C-ADVRT_Evergreen_CTA-NONE_Angle-W_M-NONE_VL-None_G-NONE_P-CBV2_S-NONE_blog_colonbroomvsmammoth_cv_en,CBV2 || Advantage+ || Advertorial || Higher pricing || US || 0% EXISTING CAP || BROAD || 7C || 20/01/25  Campaign Ad set,SHARE,$32,"1,864",2025-01-20,2025-06-16,147
316,CB_2025_Jan_FB_3739_DT_V08_4x5_VID_EN_Opti_C-BulletPoints_Sale_CTA-70_Angle-W-B_M-MIX_VL-45s_G-MF_P-GLP1_S-WHAT_FB3311V10,GLP-1 ðŸ’œ || ASC+ || EU  || 7C || 14/06/2025 Ad set,VIDEO,$32,822,2025-06-14,2025-06-16,2
317,CB_2025_Jun_FB_4159_VK_V12_4x5_IMG_EN_New_C-BulletPoints_Evergreen_CTA-SALE_Angle-W-B-C_M-NONE_VL-None_G-M_P-OG_S-NONE,4159 - obsessed is understatement - VK || Enhancements: OFF || CBV1 || Batch 3 || 7C || 09/06/25w24,SHARE,$31,"1,288",2025-06-09,2025-06-15,6
318,CB_2025_May_FB_4143_DT_V02_4x5_IMG_EN_New_C-Headline_Evergreen_CTA-65_Angle-W_M-NONE_VL-None_G-NONE_P-OG_S-NONE,4143 - Hormonal weight || Enhancements: OFF || CBV1 || Batch 1 || 7C || 02/06/25w23,SHARE,$31,"1,554",2025-06-02,2025-06-16,14
319,CB_2025_Jan_FB_3757_LZ-DP_V14_94x5_VID_EN_Opti_C-Dance_Evergreen_CTA-NONE_Angle-W-B_M-Nonie_VL-30s_G-F_P-GLP1_S-WHAT_FB3164V03,GLP-1 ðŸ’œ || ASC+ || US || 5% EXISTING CAP || 7C || 29/05/2025 Ad set,VIDEO,$31,867,2025-06-03,2025-06-16,13
320,CB_2025_Jan_FB_3783_LZ_V02_1x1_IMG_EN_New_C-BulletPoints_Evergreen_CTA-NONE_Angle-W_M-NONE_VL-None_G-NONE_P-GLP1_S-NONE,3783 - #124 Notion idea ChatGLP || Batch 1 || Enhancements: OFF || GLP-1 Booster || 7C1V || 09/06/25w23,SHARE,$30,"1,121",2025-06-09,2025-06-12,3
321,CB_2025_Jun_FB_4151_DT-KB_V01_4x5_IMG_EN_New_C-NONE_Sale_CTA-65_Angle-W-B_M-NONE_VL-None_G-NONE_P-OG_S-NONE_FB2959V07 - BIOMA,ðŸ‘¨ || Father's Day || Bundle offer  || ASC+ || US || 0% EXISTING CAP || 7C || 07/06/2025 Ad set,SHARE,$30,945,2025-06-07,2025-06-16,9
322,CB_2025_Jan_FB_3744_SO_V07_4x5_IMG_EN_New_C-Headline_Evergreen_CTA-NONE_Angle-W_M-NONE_VL-None_G-NONE_P-GLP1_S-NONE,GLP-1 ðŸ’œ || ASC+ || UK || 5% EXISTING CAP || 7C || 29/05/2025 Ad set,SHARE,$30,474,2025-06-10,2025-06-14,4
323,CB_2025_May_FB_4104_DT-VG_V06_4x5_IMG_EN_New_C-Headline_Evergreen_CTA-65_Angle-W-B-C_M-NONE_VL-None_G-NONE_P-OG_S-NONE,4104 -W-L JellyBelly IMG || Enhancements: OFF || CBV1 || Batch 2 || 7C || 19/05/25w21,SHARE,$30,"1,621",2025-05-19,2025-06-10,22
324,CB_2025_Jun_FB_4168_SO-JG_V04_4x5_IMG_EN_New_C-Headline_Evergreen_CTA-NONE_Angle-W_M-NONE_VL-None_G-NONE_P-OG_S-NONE,4168 - #154_IMG_Another you || Enhancements: OFF || CBV1 || Batch 1 || 7C || 09/06/25w24,SHARE,$29,"1,116",2025-06-09,2025-06-14,5
325,CB_2025_Jun_FB_4175_SO_V05_4x5_IMG_EN_New_C-Headline_Evergreen_CTA-NONE_Angle-W_M-NONE_VL-None_G-NONE_P-OG_S-NONE,4175 - Vintage Collage IMG || Enhancements: OFF || CBV1 || Batch 2 || 7C || 09/06/25w24,SHARE,$29,"1,042",2025-06-09,2025-06-16,7
326,CB_2025_Jun_FB_4171_DT_V01_9x16_VID_EN_Opti_C-MakingOf_Sale_CTA-65_Angle-W-B-C_M-POW_VL-45s_G-M_P-OG_S-Moon_FB3090V02 - CC,ðŸ‘¨ || Father's Day || Bundle offer  || ASC+ || US || 0% EXISTING CAP || 7C || 07/06/2025 Ad set,VIDEO,$29,"1,231",2025-06-07,2025-06-16,9
327,CB_2025_Jun_FB_4173_LZ_V05_4x5_IMG_EN_New_C-Headline_Evergreen_CTA-NONE_Angle-W_M-NONE_VL-None_G-NONE_P-NONE_S-NONE,4173 - Block Number  || Enhancements: OFF || CBV1 || Batch 2 || 7C || 09/06/25w24,SHARE,$28,"1,040",2025-06-09,2025-06-16,7
328,CB_2025_Jun_FB_4161_DT-VG_V06_9x16_VID_EN_New_C-BulletPoints_Evergreen_CTA-NONE_Angle-W-B-C_M-MIX_VL-15s_G-M_P-OG_S-NEW,4167 - #158 Ohealth Copy_MIX painpoints || Enhancements: OFF || CBV1 || Batch 2 || 7C || 09/06/25w24,VIDEO,$28,"1,450",2025-06-09,2025-06-16,7
329,CB_2025_Jun_FB_4164_LZ-VG_V02_4x5_IMG_EN_New_C-Headline_Evergreen_CTA-65_Angle-GH_M-NONE_VL-None_G-NONE_P-OG_S-NONE,4164 - liver angle 3999 opti || Enhancements: OFF || CBV1 || Batch 2 || 7C || 09/06/25w24,SHARE,$28,957,2025-06-09,2025-06-14,5
330,CB_2025_May_FB_4149_DT-VG_V01_9x16_VID_EN_Opti_C-Testimonial_Evergreen_CTA-SALE_Angle-W_M-MOOD_VL-30s_G-M_P-OG_S-WOOD_FB3860V03,ðŸ‘¨ || Father's Day || Bundle offer  || ASC+ || US || 0% EXISTING CAP || 7C || 07/06/2025 Ad set,VIDEO,$27,965,2025-06-09,2025-06-16,7
331,CB_2025_Jun_FB_4145_SO_V08_4x5_IMG_EN_Opti_C-NONE_Evergreen_CTA-NONE_Angle-W-B-C_M-NONE_VL-None_G-NONE_P-OG_S-NONE_FB3950V16,4145 - FB3950V16 Opti || Enhancements: OFF || CBV1 || Batch 2 || 7C || 09/06/25w24,SHARE,$26,"1,311",2025-06-09,2025-06-14,5
332,CB_2025_May_FB_4140_SO-VG_V13_4x5_IMG_EN_Opti_C-NONE_Evergreen_CTA-NONE_Angle-W_M-NONE_VL-None_G-NONE_P-OG_S-NONE_FB4086V01 - BIOMA,ðŸ‘¨ || Father's Day || Bundle offer  || ASC+ || US || 0% EXISTING CAP || 7C || 07/06/2025 Ad set,SHARE,$26,"1,459",2025-06-07,2025-06-16,9
333,CB_2025_Jan_FB_3739_DT_V01_4x5_VID_EN_Opti_C-NegativeMark_Sale_CTA-70_Angle-W_M-MIX_VL-45s_G-MF_P-GLP1_S-MOON_FB2263V05,GLP-1 ðŸ’œ || ASC+ || UK || 5% EXISTING CAP || 7C || 29/05/2025 Ad set,VIDEO,$26,361,2025-06-10,2025-06-16,6
334,CB_2025_May_FB_4140_SO-VG_V08_4x5_IMG_EN_Opti_C-NONE_Evergreen_CTA-NONE_Angle-W_M-NONE_VL-None_G-NONE_P-OG_S-NONE_FB3961V07 - CC,ðŸ‘¨ || Father's Day || Bundle offer  || ASC+ || US || 0% EXISTING CAP || 7C || 07/06/2025 Ad set,SHARE,$26,"1,365",2025-06-07,2025-06-16,9
335,CB_2025_Jun_FB_4161_DT-JG_V04_4x5_IMG_EN_New_C-Headline_Evergreen_CTA-NONE_Angle-W_M-NONE_VL-None_G-NONE_P-OG_S-NONE,4161 - Smoked Moobs #156 || Enhancements: OFF || CBV1 || Batch 2 || 7C || 09/06/25w24,SHARE,$25,"1,110",2025-06-09,2025-06-13,4
336,CB_2025_Jun_FB_4160_SO_V05_9x16_VID_EN_Opti_C-NONE_Evergreen_CTA-65_Angle-W-B-C_M-NONE_VL-20s_G-F_P-OG_S-NEW_FB3967V10,4160 - FB3967V10 Opti || Enhancements: OFF || CBV1 || Batch 1-3 || 7C || 09/06/25w24,VIDEO,$25,"1,260",2025-06-10,2025-06-14,4
337,CB_2025_Jun_FB_4152_SO-VG_V02_4x5_IMG_EN_New_C-Headline_Evergreen_CTA-NONE_Angle-W_M-NONE_VL-0s_G-NONE_P-OG_S-NONE,4152 - Lose X amount by getting regularâ€”daily IMG || Enhancements: OFF || CBV1 || Batch 1 || 7C || 09/06/25w24,SHARE,$25,848,2025-06-09,2025-06-14,5
338,CB_2025_Feb_FB_3788_SO-JT_V04_1x1_IMG_EN_New_C-Headline_Evergreen_CTA-NONE_Angle-W_M-NONE_VL-15s_G-NONE_P-GLP1_S-NONE,3788 - Notion Idea #121 FUEL GLP IMG || Batch 1 || Enhancements: OFF || GLP-1 Booster || 7C1V || 09/06/25w23,SHARE,$24,526,2025-06-09,2025-06-12,3
339,CB_2025_Jun_FB_4168_SO-JG_V01_4x5_IMG_EN_New_C-Headline_Evergreen_CTA-NONE_Angle-W_M-NONE_VL-None_G-NONE_P-OG_S-NONE,4168 - #154_IMG_Another you || Enhancements: OFF || CBV1 || Batch 1 || 7C || 09/06/25w24,SHARE,$24,990,2025-06-09,2025-06-15,6
340,CB_2025_Jan_FB_3753_SO_V01_4x5_IMG_EN_New_C-Headline_Evergreen_CTA-NONE_Angle-W_M-NONE_VL-None_G-NONE_P-GLP1_S-NONE,GLP-1 ðŸ’œ || ASC+ || UK || 5% EXISTING CAP || 7C || 29/05/2025 Ad set,SHARE,$23,601,2025-06-10,2025-06-16,6
341,CB_2025_Jun_FB_4169_DT-DP_V02_9x16_VID_EN_New_C-SocialProof_Evergreen_CTA-65_Angle-W-B-C_M-MAN_VL-30s_G-MF_P-OG_S-NEW,"4169 - 3 reasons why, GF POV || Enhancements: OFF || CBV1 || Batch 1 || 7C || 09/06/25w24",VIDEO,$23,962,2025-06-09,2025-06-16,7
342,CB_2025_Jun_FB_4163_VK_V04_4x5_IMG_EN_Opti_C-BulletPoints_Evergreen_CTA-SALE_Angle-W-B-C_M-NONE_VL-None_G-M_P-OG_S-NONE_FB4110V03,4163 - opti 4112 - VK || Enhancements: OFF || CBV1 || Batch 1 || 7C || 09/06/25w24,SHARE,$23,903,2025-06-09,2025-06-14,5
343,CB_2025_Jun_FB_4175_SO_V08_4x5_IMG_EN_New_C-Headline_Evergreen_CTA-NONE_Angle-W_M-NONE_VL-None_G-NONE_P-OG_S-NONE,ðŸŒ¶ï¸  || ASC+ || US || 0% EXISTING CAP || 7C || 15/05/2025  Campaign Ad set,SHARE,$22,655,2025-06-14,2025-06-16,2
344,CB_2025_May_FB_4158_VK-VG_V01_4x5_VID_EN_Opti_C-Headline_Evergreen_CTA-SALE_Angle-W-B-C_M-NONE_VL-None_G-M_P-OG_S-NONE_FB4104V05,4158 - 4104_V05_VG Opti - VK || Enhancements: OFF || CBV1 || Batch 1-2 || 7C || 09/06/25w24,SHARE,$22,891,2025-06-09,2025-06-13,4
345,CB_2025_May_FB_4150_DT-KB_V02_4x5_IMG_EN_New_C-Headline_Sale_CTA-65_Angle-None_M-MIX_VL-None_G-M_P-OG_S-NONE,ðŸ‘¨ || Father's Day || Bundle offer  || ASC+ || US || 0% EXISTING CAP || 7C || 07/06/2025 Ad set,SHARE,$22,630,2025-06-09,2025-06-16,7
346,CB_2025_Jun_FB_4156_DT_V02_9x16_VID_EN_New_C-Testimonial_Evergreen_CTA-65_Angle-W-B-C_M-JAS_VL-30s_G-M_P-OG_S-NEW,4156 - Introducing Jason || Enhancements: OFF || CBV1 || Batch 3-4 || 7C || 09/06/25w24,VIDEO,$22,790,2025-06-09,2025-06-15,6
347,CB_2025_May_FB_4158_VK-VG_V03_4x5_VID_EN_Opti_C-Headline_Evergreen_CTA-SALE_Angle-W-B-C_M-NONE_VL-None_G-M_P-OG_S-NONE_FB4104V05,4158 - 4104_V05_VG Opti - VK || Enhancements: OFF || CBV1 || Batch 1-2 || 7C || 09/06/25w24,SHARE,$21,873,2025-06-09,2025-06-13,4
348,CB_2025_Jun_FB_4160_SO_V04_9x16_VID_EN_Opti_C-NONE_Evergreen_CTA-65_Angle-W-B-C_M-NONE_VL-20s_G-F_P-OG_S-NEW_FB3967V10,4160 - FB3967V10 Opti || Enhancements: OFF || CBV1 || Batch 1-3 || 7C || 09/06/25w24,VIDEO,$21,"1,187",2025-06-09,2025-06-14,5
349,CB_2025_Jun_FB_4161_DT-VG_V09_9x16_VID_EN_New_C-BulletPoints_Evergreen_CTA-NONE_Angle-W-B-C_M-MIX_VL-15s_G-M_P-OG_S-NEW,4167 - #158 Ohealth Copy_MIX painpoints || Enhancements: OFF || CBV1 || Batch 3 || 7C || 09/06/25w24,VIDEO,$21,946,2025-06-09,2025-06-14,5
350,CB_2025_Jun_FB_4173_LZ_V03_4x5_IMG_EN_New_C-Headline_Evergreen_CTA-NONE_Angle-W_M-NONE_VL-None_G-NONE_P-NONE_S-NONE,4173 - Block Number  || Enhancements: OFF || CBV1 || Batch 1 || 7C || 09/06/25w24,SHARE,$21,"1,139",2025-06-09,2025-06-14,5
351,CB_2025_Jun_FB_4157_SO-KB_V04_4x5_IMG_EN_New_C-Headline_Evergreen_CTA-NONE_Angle-W_M-NONE_VL-None_G-NONE_P-OG_S-NONE,ðŸ‘¨ || Father's Day || Bundle offer  || ASC+ || US || 0% EXISTING CAP || 7C || 07/06/2025 Ad set,SHARE,$20,719,2025-06-09,2025-06-16,7
352,CB_2025_Feb_FB_3789_VK_V03_1x1_IMG_EN_NEW_C-BulletPoints_Evergreen_CTA-70_Angle-W-B-C_M-NONE_VL-None_G-F_P-GLP1_S-NONE,3789 - Notion #114 Costs Less Than a Doughnut GLP VK || Batch 1 || Enhancements: OFF || GLP-1 Booster || 7C1V || 09/06/25w23,SHARE,$20,678,2025-06-09,2025-06-12,3
353,CB_2025_Jan_FB_3744_SO_V07_4x5_IMG_EN_New_C-Headline_Evergreen_CTA-NONE_Angle-W_M-NONE_VL-None_G-NONE_P-GLP1_S-NONE,GLP-1 ðŸ’œ || ASC+ || EU  || 7C || 14/06/2025 Ad set,SHARE,$20,549,2025-06-14,2025-06-16,2
354,CB_2025_Jan_FB_3756_VK-DP_V03_4x5_IMG_EN_New_C-BulletPoints_Evergreen_CTA-NONE_Angle-W-B-C_M-NONE_VL-None_G-M_P-GLP1_S-NONE,GLP-1 ðŸ’œ || ASC+ || EU  || 7C || 14/06/2025 Ad set,SHARE,$20,656,2025-06-14,2025-06-16,2
355,CB_2025_May_FB_4150_DT-KB_V05_4x5_IMG_EN_New_C-Headline_Sale_CTA-65_Angle-None_M-MIX_VL-None_G-M_P-OG_S-NONE,ðŸ‘¨ || Father's Day || Bundle offer  || ASC+ || US || 0% EXISTING CAP || 7C || 07/06/2025 Ad set,SHARE,$20,566,2025-06-09,2025-06-16,7
356,CB_2025_Apr_FB_4028_LZ-DT_V02_9x16_VID_EN_New_C-BulletPoints_Sale_CTA-SPRING_Angle-W-B-C_M-MAG_VL-30s_G-F_P-OG_S-STARRY,CBV2 || US || Manual Bid: ROAS GOAL: 1.00 -> 1.1 || 7DC || 22/01/2025,VIDEO,$19,814,2025-04-28,2025-06-16,49
357,CB_2025_Jun_FB_4145_DT-KB_V07_4x5_IMG_EN_Opti_C-NONE_Sale_CTA-65_Angle-W_M-NONE_VL-None_G-NONE_P-NONE_S-NONE_FB3723V04 - BIOMA,ðŸ‘¨ || Father's Day || Bundle offer  || ASC+ || US || 0% EXISTING CAP || 7C || 07/06/2025 Ad set,SHARE,$18,721,2025-06-07,2025-06-16,9
358,CB_2025_Jun_FB_4159_VK_V08_4x5_IMG_EN_New_C-BulletPoints_Evergreen_CTA-SALE_Angle-W-B-C_M-NONE_VL-None_G-M_P-OG_S-NONE,4159 - obsessed is understatement - VK || Enhancements: OFF || CBV1 || Batch 2 || 7C || 09/06/25w24,SHARE,$18,507,2025-06-10,2025-06-14,4
359,CB_2025_Jun_FB_4179_LZ-KB_V04_4x5_IMG_EN_New_C-BeforeAfter_Evergreen_CTA-65_Angle-W-B_M-NONE_VL-None_G-M_P-OG_S-NONE,4179 - Puzzle piece || Enhancements: OFF || CBV1 || Batch 1 || 7C || 09/06/25w24,SHARE,$18,815,2025-06-09,2025-06-16,7
360,CB_2025_Jun_FB_4176_SO-KB_V08_4x5_IMG_EN_Opti_C-Headline_Evergreen_CTA-NONE_Angle-W_M-NONE_VL-None_G-NONE_P-OG_S-NONE_FB4100V02,4176 - FB4100V02 Opti || Enhancements: OFF || CBV1 || Batch 2 || 7C || 09/06/25w24,SHARE,$18,440,2025-06-09,2025-06-16,7
361,CB_2025_May_FB_4140_SO-VG_V03_4x5_IMG_EN_Opti_C-NONE_Evergreen_CTA-NONE_Angle-W_M-NONE_VL-None_G-NONE_P-OG_S-NONE_FB3950V11 - BIOMA,ðŸ‘¨ || Father's Day || Bundle offer  || ASC+ || US || 0% EXISTING CAP || 7C || 07/06/2025 Ad set,SHARE,$18,899,2025-06-07,2025-06-16,9
362,CB_2025_Jun_FB_4157_SO-KB_V06_4x5_IMG_EN_New_C-Headline_Evergreen_CTA-NONE_Angle-W_M-NONE_VL-None_G-NONE_P-OG_S-NONE,ðŸ‘¨ || Father's Day || Bundle offer  || ASC+ || US || 0% EXISTING CAP || 7C || 07/06/2025 Ad set,SHARE,$17,623,2025-06-09,2025-06-15,6
363,CB_2025_May_FB_4140_SO-VG_V11_4x5_IMG_EN_Opti_C-NONE_Evergreen_CTA-NONE_Angle-W_M-NONE_VL-None_G-NONE_P-OG_S-NONE_FB4040V09 - CC,ðŸ‘¨ || Father's Day || Bundle offer  || ASC+ || US || 0% EXISTING CAP || 7C || 07/06/2025 Ad set,SHARE,$17,745,2025-06-07,2025-06-16,9
364,CB_2025_May_FB_4140_SO-VG_V07_4x5_IMG_EN_Opti_C-NONE_Evergreen_CTA-NONE_Angle-W_M-NONE_VL-None_G-NONE_P-OG_S-NONE_FB3961V07 - CC,ðŸ‘¨ || Father's Day || Bundle offer  || ASC+ || US || 0% EXISTING CAP || 7C || 07/06/2025 Ad set,SHARE,$17,805,2025-06-07,2025-06-16,9
365,CB_2025_Jun_FB_4145_SO_V04_4x5_IMG_EN_Opti_C-NONE_Evergreen_CTA-NONE_Angle-W-B-C_M-NONE_VL-None_G-NONE_P-OG_S-NONE_FB3950V16,4145 - FB3950V16 Opti || Enhancements: OFF || CBV1 || Batch 1 || 7C || 09/06/25w24,SHARE,$17,927,2025-06-09,2025-06-16,7
366,CB_2025_May_FB_4132_VK-DP_V04_9x16_VID_EN_New_C-BulletPoints_Evergreen_CTA-SALE_Angle-W-B-C_M-POW_VL-30s_G-M_P-OG_S-NEW,4132 - GLP benefit VID || Enhancements: OFF || CBV1 || Batch 1 || 7C || 02/06/25w23,VIDEO,$16,600,2025-06-02,2025-06-16,14
367,CB_2025_Jun_FB_4151_DT-KB_V07_4x5_IMG_EN_New_C-NONE_Sale_CTA-65_Angle-W-B_M-NONE_VL-None_G-NONE_P-OG_S-NONE_FB2959V07 - BIOMA,ðŸ‘¨ || Father's Day || Bundle offer  || ASC+ || US || 0% EXISTING CAP || 7C || 07/06/2025 Ad set,SHARE,$16,467,2025-06-07,2025-06-16,9
368,CB_2025_Jun_FB_4162_VK-RP_V09_4x5_IMG_EN_New_C-BulletPoints_Evergreen_CTA-SALE_Angle-W-B-C_M-NONE_VL-None_G-M_P-OG_S-NONE,4162 - #157 Shrek vs. Prince Charming -VK-RP || Enhancements: OFF || CBV1 || Batch 3 || 7C || 09/06/25w24,SHARE,$16,781,2025-06-09,2025-06-14,5
369,CB_2025_Jan_FB_3756_VK-DP_V04_4x5_IMG_EN_New_C-BulletPoints_Evergreen_CTA-NONE_Angle-W-B-C_M-NONE_VL-None_G-M_P-GLP1_S-NONE,3756 - opti 2834 GLP1 || Batch 1 || Enhancements: OFF || GLP-1 Booster || 7C1V || 30/05/25w22,SHARE,$15,423,2025-05-30,2025-06-14,15
370,CB_2025_Jun_FB_4145_DT-KB_V05_4x5_IMG_EN_Opti_C-Sale_Sale_CTA-65_Angle-None_M-NONE_VL-None_G-NONE_P-None_S-NONE_FB2227V08 - BIOMA,ðŸ‘¨ || Father's Day || Bundle offer  || ASC+ || US || 0% EXISTING CAP || 7C || 07/06/2025 Ad set,SHARE,$15,584,2025-06-07,2025-06-16,9
371,CB_2025_Feb_FB_3774_SO-JT_V07_1x1_IMG_EN_New_C-Headline_Evergreen_CTA-NONE_Angle-W_M-NONE_VL-15s_G-NONE_P-GLP1_S-NONE,3774 - #114 SMASH GLP IMG || Batch 2 || Enhancements: OFF || GLP-1 Booster || 7C1V || 09/06/25w23,SHARE,$15,339,2025-06-09,2025-06-16,7
372,CB_2025_Jun_FB_4173_LZ_V01_4x5_IMG_EN_New_C-Headline_Evergreen_CTA-NONE_Angle-W_M-NONE_VL-None_G-NONE_P-NONE_S-NONE,4173 - Block Number  || Enhancements: OFF || CBV1 || Batch 1 || 7C || 09/06/25w24,SHARE,$14,833,2025-06-09,2025-06-14,5
373,CB_2025_Jan_FB_3751_VK-DP_V04_4x5_IMG_EN_New_C-BulletPoints_Sale_CTA-NY_Angle-W-B-C_M-NONE_VL-None_G-M_P-GLP1_S-NONE,3751 - opti 3608 GLP1 - VK-DP || Batch 1 || Enhancements: OFF || GLP-1 Booster || 7C1V || 30/05/25w22,SHARE,$14,395,2025-05-30,2025-06-16,17
374,CB_2023_Dec_FB_2712_RS-DP_V02_1x1_VID_EN_Opti_C-WrittenTesti_CTA-SALE_Pain-W-B-C_M-NONE_VL-None_TR-None_G-NONE_P-V2_S-NONE_FB2227V08,âš«ï¸ US || CBV2 || Advantage+ || 7C || BROAD || Existing_customer_0% || || 24/04/25 Ad set,VIDEO,$13,328,2025-04-24,2025-06-16,53
375,CB_2025_May_FB_4146_DT_V02_9x16_VID_EN_New_C-BeforeAfter_Evergreen_CTA-SALE_Angle-W_M-JOG_VL-45s_G-F_P-OG_S-MOON,4146 - I was fat || Enhancements: OFF || CBV1 || Batch 1 || 7C || 09/06/25w24,VIDEO,$13,525,2025-06-09,2025-06-16,7
376,CB_2025_May_FB_4140_SO_V05_4x5_IMG_EN_Opti_C-NONE_Evergreen_CTA-NONE_Angle-W_M-NONE_VL-None_G-NONE_P-OG_S-NONE_FB3950V11 - CC,ðŸ‘¨ || Father's Day || Bundle offer  || ASC+ || US || 0% EXISTING CAP || 7C || 07/06/2025 Ad set,SHARE,$13,678,2025-06-07,2025-06-16,9
377,CB_2025_May_FB_4140_SO-VG_V16_4x5_IMG_EN_Opti_C-NONE_Evergreen_CTA-NONE_Angle-W_M-NONE_VL-None_G-NONE_P-OG_S-NONE_FB4086V01 - CC,ðŸ‘¨ || Father's Day || Bundle offer  || ASC+ || US || 0% EXISTING CAP || 7C || 07/06/2025 Ad set,SHARE,$13,667,2025-06-07,2025-06-16,9
378,CB_2025_Jun_FB_4159_VK_V03_4x5_IMG_EN_New_C-BulletPoints_Evergreen_CTA-SALE_Angle-W-B-C_M-NONE_VL-None_G-M_P-OG_S-NONE,4159 - obsessed is understatement - VK || Enhancements: OFF || CBV1 || Batch 1 || 7C || 09/06/25w24,SHARE,$12,416,2025-06-09,2025-06-12,3
379,CB_2025_Jun_FB_4163_VK_V06_4x5_IMG_EN_Opti_C-BulletPoints_Evergreen_CTA-SALE_Angle-W-B-C_M-NONE_VL-None_G-M_P-OG_S-NONE_FB4110V03,4163 - opti 4112 - VK || Enhancements: OFF || CBV1 || Batch 2 || 7C || 09/06/25w24,SHARE,$12,516,2025-06-09,2025-06-13,4
380,CB_2025_Jun_FB_4159_VK_V05_4x5_IMG_EN_New_C-BulletPoints_Evergreen_CTA-SALE_Angle-W-B-C_M-NONE_VL-None_G-M_P-OG_S-NONE,4159 - obsessed is understatement - VK || Enhancements: OFF || CBV1 || Batch 2 || 7C || 09/06/25w24,SHARE,$12,483,2025-06-09,2025-06-14,5
381,CB_2025_May_FB_4140_SO-VG_V07_4x5_IMG_EN_Opti_C-NONE_Evergreen_CTA-NONE_Angle-W_M-NONE_VL-None_G-NONE_P-OG_S-NONE_FB3961V07 - BIOMA,ðŸ‘¨ || Father's Day || Bundle offer  || ASC+ || US || 0% EXISTING CAP || 7C || 07/06/2025 Ad set,SHARE,$12,660,2025-06-07,2025-06-16,9
382,CB_2025_May_FB_4120_DT_V05_4x5_IMG_EN_New_C-Headline_Evergreen_CTA-65_Angle-W-B-C_M-NONE_VL-None_G-NONE_P-OG_S-NONE,"4120 - #138 The Monkey, The Bear and The Ugly || Enhancements: OFF || CBV1 || Batch 2 || 7C || 02/06/25w23",SHARE,$11,535,2025-06-02,2025-06-16,14
383,CB_2025_Jan_FB_3757_LZ-DP_V14_94x5_VID_EN_Opti_C-Dance_Evergreen_CTA-NONE_Angle-W-B_M-Nonie_VL-30s_G-F_P-GLP1_S-WHAT_FB3164V03,GLP-1 ðŸ’œ || ASC+ || CA || 5% EXISTING CAP || 7C || 29/05/2025 Ad set,VIDEO,$11,360,2025-06-10,2025-06-16,6
384,CB_2025_Jan_FB_3757_LZ-DP_V18_4x5_VID_EN_Opti_C-NegativeMark_Evergreen_CTA-NONE_Angle-W_M-MAG_VL-45s_G-F_P-GLP1_S-MOON_FB3311V13,GLP-1 ðŸ’œ || ASC+ || UK || 5% EXISTING CAP || 7C || 29/05/2025 Ad set,VIDEO,$11,218,2025-06-10,2025-06-16,6
385,CB_2025_May_FB_4158_VK-VG_V04_4x5_VID_EN_Opti_C-Headline_Evergreen_CTA-SALE_Angle-W-B-C_M-NONE_VL-None_G-M_P-OG_S-NONE_FB4104V05,4158 - 4104_V05_VG Opti - VK || Enhancements: OFF || CBV1 || Batch 1-2 || 7C || 09/06/25w24,SHARE,$11,418,2025-06-09,2025-06-13,4
386,CB_2025_Jan_FB_3751_VK-DP_V03_4x5_IMG_EN_New_C-BulletPoints_Sale_CTA-NY_Angle-W-B-C_M-NONE_VL-None_G-M_P-GLP1_S-NONE,3751 - opti 3608 GLP1 - VK-DP || Batch 1 || Enhancements: OFF || GLP-1 Booster || 7C1V || 30/05/25w22,SHARE,$11,401,2025-05-30,2025-06-16,17
387,CB_2025_Jun_FB_4163_VK_V03_4x5_IMG_EN_Opti_C-BulletPoints_Evergreen_CTA-SALE_Angle-W-B-C_M-NONE_VL-None_G-M_P-OG_S-NONE_FB4110V03,4163 - opti 4112 - VK || Enhancements: OFF || CBV1 || Batch 1 || 7C || 09/06/25w24,SHARE,$10,428,2025-06-09,2025-06-14,5
