,Ad Name,Adset Name,Creative Type,Spend In USD,Impressions,First Ad Spend Date,Last Ad Spend Date,Days ad spending
1,Dynamic_Creative_CA_Flow,WC || CA || DYNAMIC CREATIVE || ADV+ audience || 7C || 17.04.2024 || BIG BUDGET,SHARE,"$12,634","785,904",2024-04-17,2025-02-27,316
2,CB_2025_Jan_FB_CANVA_LZ-VU_V01_1x1_IMG_EN_New_C-NegativeMark_Evergreen_CTA-NONE_Angle-Cort_M-NONE_VL-None_G-NONE_P-NONE_S-NONE,ðŸŒ¶ï¸ || US || ASC+ || ->CC141 || VIDEO Only || US+CA || 0% EXISTING CAP || 7C || 07/08.24  Ad set,SHARE,"$11,273","533,551",2025-01-17,2025-03-14,56
3,CB_2024_Aug_FB_3090_DT-DP_V02_9x16_VID_EN_Opti_C-MakingOf_CTA-CTA_Pain-W-B-C_M-POW_VL-45s_TR-None_G-M_P-OG_S-Moon_FB3029V04,ðŸŒ¶ï¸ || US || ASC+ || ->CC141 || VIDEO Only || US+CA || 0% EXISTING CAP || 7C || 07/08.24  Ad set,VIDEO,"$10,123","423,422",2025-01-17,2025-03-03,45
4,CB_2024_Aug_FB_3097_VK-DP_V03_9x16_VID_EN_Opti_C-Benefits_CTA-SMR_Pain-W-B_M-MIX_VL-45s_TR-None_G-MF_P-OG_S-WHAT_FB2516V13,ðŸŒ¶ï¸ || US || ASC+ || ->CC141 || VIDEO Only || US+CA || 0% EXISTING CAP || 7C || 07/08.24  Ad set,VIDEO,"$9,599","453,896",2024-09-04,2025-03-27,204
5,CB_2023_Jul_FB_2217_IB_V04_9x16_VID_EN_Opti_C-Pointing_CTA-SMR_Pain-W-B_M-TRC_VL-30s_TR-None_G-F_P-None_S-FRIGGA,ASC+ || VIDEO Only || US || 0% EXISTING CAP || 1C || 08.12.24  Ad set,VIDEO,"$7,561","207,047",2024-12-08,2025-02-05,59
6,CB_2023_May_FB_1999_LV_V01_9x16_VID_EN_New_C-Pointing_CTA-DISCOUNT_Pain-W_M-JOG_VL-30s_TR-None,ASC+ || VIDEO Only || US || 0% EXISTING CAP || 1C || 08.12.24  Ad set,VIDEO,"$7,091","207,274",2024-12-08,2025-01-27,50
7,CB_2024_Dec_FB_3622_LZ-DP_V03_4x5_IMG_EN_Opti_C-NONE_Sale_CTA-XMAS_Angle-GH_M-NONE_VL-None_G-NONE_P-OG_S-NONE_FB2227V08,ðŸŒ¶ï¸ || US || ASC+ || ->CC141 || VIDEO Only || US+CA || 0% EXISTING CAP || 7C || 07/08.24  Ad set,SHARE,"$5,178","178,528",2024-12-19,2025-01-27,39
8,CB_2024_Dec_FB_3639_CHUB_V03_1x1_IMG_EN_New_C-NONE_CTA-NONE_Angle-W_M-NONE_VL-None_TR-None_G-NONE_P-NONE_S-NONE,ðŸŒ¶ï¸ || US || ASC+ || ->CC141 || VIDEO Only || US+CA || 0% EXISTING CAP || 7C || 07/08.24  Ad set,SHARE,"$4,988","227,621",2025-01-06,2025-01-27,21
9,CB_2025_FEB_FB_3666_VK-JT_V03_4x5_VID_EN_NEW_C-BulletPoints_Sale_CTA-NY_Angle-W-B-C_M-TRC_VL-30s_G-F_P-OG_S-NEW,3666 - looksmaxing trend || Enhancements: OFF || CBV1 || Batch 1 || 1C || 07/01/25w02 || Kostas,SHARE,"$4,961","221,248",2025-01-07,2025-01-27,20
10,CB_2023_Jul_FB_2217_IB_V04_9x16_VID_EN_Opti_C-Pointing_CTA-SMR_Pain-W-B_M-TRC_VL-30s_TR-None_G-F_P-None_S-FRIGGA,ðŸŒ¶ï¸ || US || ASC+ || ->CC141 || VIDEO Only || US+CA || 0% EXISTING CAP || 7C || 07/08.24  Ad set,VIDEO,"$4,941","178,580",2024-08-07,2025-03-27,232
11,CB_2024_Feb_FB_2812_MB-RP_V07_9x16_VID_EN_Opti_C-Sale_CTA-C65_Pain-W_M-NONE_VL-30s_TR-None_G-MF_P-Plan_S-NEW_FB2601V04_1,ASC+ || VIDEO Only || US || 0% EXISTING CAP || 1C || 08.12.24  Ad set,VIDEO,"$4,771","200,017",2024-12-19,2025-02-05,48
12,CB_2024_Nov_FB_3264_LZ_V29_4x5_VID_EN_Opti_C-NegativeMark_Sale_CTA-BF_Angle-W-B_M-LRNS_VL-30s_G-M_P-OG_S-NONE,ASC+ || VIDEO Only || US || 0% EXISTING CAP || 1C || 08.12.24  Ad set,SHARE,"$4,399","182,052",2024-12-08,2025-01-27,50
13,CB_2024_Dec_FB_3608_LZ-DP_V03_4x5_IMG_EN_New_C-Headline_Evergreen_CTA-NONE_Angle-W_M-NONE_VL-None_G-NONE_P-OG_S-NONE,ðŸŒ¶ï¸ || US || ASC+ || ->CC141 || VIDEO Only || US+CA || 0% EXISTING CAP || 7C || 07/08.24  Ad set,SHARE,"$4,275","239,936",2025-01-20,2025-01-24,4
14,CB_2025_Jan_FB_3750_LZ-VU_V03_4x5_IMG_EN_Opti_C-NegativeMark_Evergreen_CTA-NONE_Angle-W_M-NONE_VL-None_G-NONE_P-NONE_S-NONE_FB3251V01,ðŸŒ¶ï¸ || US || ASC+ || ->CC141 || VIDEO Only || US+CA || 0% EXISTING CAP || 7C || 07/08.24  Ad set,SHARE,"$4,160","179,446",2025-01-24,2025-01-26,2
15,CB_2024_Nov_FB_3264_LZ_V31_4x5_VID_EN_Opti_C-MakingOf_Sale_CTA-BF_Angle-W-B_M-CRAZY_VL-45s_G-M_P-OG_S-NEW_FB3004V02,ASC+ || VIDEO Only || US || 0% EXISTING CAP || 1C || 08.12.24  Ad set,VIDEO,"$4,089","156,203",2024-12-08,2025-02-05,59
16,CB_2025_Jan_FB_3750_LZ-VU_V05_4x5_IMG_EN_Opti_C-NegativeMark_Evergreen_CTA-NONE_Angle-W_M-NONE_VL-None_G-NONE_P-NONE_S-NONE_FB3251V01,ðŸŒ¶ï¸ || US || ASC+ || ->CC141 || VIDEO Only || US+CA || 0% EXISTING CAP || 7C || 07/08.24  Ad set,SHARE,"$3,933","141,557",2025-01-24,2025-01-30,6
17,CB_2023_May_FB_2263_MB_V04_9x16_VID_EN_New_C-Sale_CTA-SMR_Pain-W_M-JOG_VL-45s_TR-None_G-M-F_P-None_S-Moon,ðŸŒ¶ï¸ || US || ASC+ || ->CC141 || VIDEO Only || US+CA || 0% EXISTING CAP || 7C || 07/08.24  Ad set,VIDEO,"$3,653","86,371",2024-08-07,2025-03-27,232
18,CB_2023_Oct_FB_2516_VK_V13_9x16_VID_EN_Opti_C-Benefits_CTA-AUTUM_Pain-W-B_M-PASQ_VL-30s_TR-None_G-M_P-Plan_S-WHAT,ðŸŒ¶ï¸ || US || ASC+ || ->CC141 || VIDEO Only || US+CA || 0% EXISTING CAP || 7C || 07/08.24  Ad set,VIDEO,"$2,902","119,649",2024-12-19,2025-03-27,98
19,CB_2023_Oct_FB_2516_VK_V13_9x16_VID_EN_Opti_C-Benefits_CTA-AUTUM_Pain-W-B_M-PASQ_VL-30s_TR-None_G-M_P-Plan_S-WHAT,ASC+ || VIDEO Only || US || 0% EXISTING CAP || 1C || 08.12.24  Ad set,VIDEO,"$2,787","81,991",2024-12-20,2025-02-05,47
20,CB_2024_Sep_FB_3175_DA-KB_V04_1x1_IMG_EN_New_C-ADVRT_Evergreen_CTA-NONE_Angle-W_M-NONE_VL-None_G-NONE_P-CBV2_S-NONE_blog_colonbroomvsmammoth_cv_en,CBV2 || Advantage+ || Advertorial || Higher pricing || US || 0% EXISTING CAP || BROAD || 7C || 20/01/25  Campaign Ad set,SHARE,"$2,518","105,059",2025-01-20,2025-03-27,66
21,CB_2025_Jan_FB_3750_LZ-VU_V03_4x5_IMG_EN_Opti_C-NegativeMark_Evergreen_CTA-NONE_Angle-W_M-NONE_VL-None_G-NONE_P-NONE_S-NONE_FB3251V01,ðŸŒ¶ï¸ || US || ASC+ || ->CC141 || VIDEO Only || US+CA || 0% EXISTING CAP || 7C || 07/08.24  Ad set,SHARE,"$2,501","94,020",2025-01-24,2025-02-07,14
22,CB_2024_Jan_FB_2764_RS_V04_9x16_VID_EN_Opti_C-SingleTesti_CTA-SALE_Pain-W_M-TRC_VL-45s_TR-None_G-F_P-OG_S-MOON_FB2263V04_Page_Personal_Coach,CBV2 || AU || ðŸ’° Advantage+ || US || BROAD || 7C || Existing_customer_5% || 19/12/24 Ad set,VIDEO,"$2,290","50,813",2025-01-16,2025-03-27,70
23,CB_2024_Jan_FB_2764_RS_V04_9x16_VID_EN_Opti_C-SingleTesti_CTA-SALE_Pain-W_M-TRC_VL-45s_TR-None_G-F_P-OG_S-MOON_FB2263V04_Page_Personal_Coach,AU || Page: Branded & 3rd Party || 2764 || Trinity Results Too Fast || 1C || 10/01/2025w02,VIDEO,"$2,006","42,239",2025-01-10,2025-03-27,76
24,CB_2024_Jan_FB_2764_RS_V04_9x16_VID_EN_Opti_C-SingleTesti_CTA-SALE_Pain-W_M-TRC_VL-45s_TR-None_G-F_P-OG_S-MOON_FB2263V04,EU (UK) || 2764 || Trinity Results Too Fast || 1C || 08/01/2025w02,VIDEO,"$1,995","77,937",2025-01-08,2025-03-27,78
25,CB_2024_Dec_FB_3619_VK-JT_V02_4x5_VID_EN_New_C-BulletPoints_Sale_CTA-NY_Angle-W-B-C_M-NONE_VL-None_G-NONE_P-OG_S-NONE,ðŸŒ¶ï¸ || US || ASC+ || ->CC141 || VIDEO Only || US+CA || 0% EXISTING CAP || 7C || 07/08.24  Ad set,SHARE,"$1,989","92,540",2024-12-27,2025-03-27,90
26,CB_2025_Jan_FB_3660_CHUB_V03_4x5_IMG_EN_New_C-NONE_CTA-NONE_Angle-C_M-NONE_VL-None_TR-None_G-NONE_P-NONE_S-NONE - Copy,US || Manual Bid: ROAS GOAL: 0.9 -> 1.00 || 7DC || 23/01/2025,SHARE,"$1,979","133,793",2025-01-23,2025-01-30,7
27,CB_2024_Nov_FB_3264_LZ_V31_4x5_VID_EN_Opti_C-MakingOf_Sale_CTA-BF_Angle-W-B_M-CRAZY_VL-45s_G-M_P-OG_S-NEW_FB3004V02,ðŸŒ¶ï¸ || US || ASC+ || ->CC141 || VIDEO Only || US+CA || 0% EXISTING CAP || 7C || 07/08.24  Ad set,VIDEO,"$1,945","91,892",2024-11-18,2025-01-24,67
28,CB_2024_Dec_FB_3608_LZ-DP_V03_4x5_IMG_EN_New_C-Headline_Evergreen_CTA-NONE_Angle-W_M-NONE_VL-None_G-NONE_P-OG_S-NONE,3608 - CB_IMG_ notion #17 hypnosis || Enhancements: OFF || CBV1 || Batch 1 || 1C || 13/01/25w03 || Kostas,SHARE,"$1,884","97,834",2025-01-13,2025-02-03,21
29,CB_2024_Aug_FB_3090_DT-DP_V02_9x16_VID_EN_Opti_C-MakingOf_CTA-CTA_Pain-W-B-C_M-POW_VL-45s_TR-None_G-M_P-OG_S-Moon_FB3029V04,CBV2 || Advantage+ || Only V1 Ads || US || 5% EXISTING CAP || BROAD || 7C || 30/12/24  Campaign Ad set,SHARE,"$1,631","89,404",2024-12-30,2025-01-22,23
30,Dynamic_Creative_3:2:2_Video_CA_Flow,WC || CA || DYNAMIC CREATIVE | 3:2:2 || New ads || ADV+ audience || 7C || 06.09.2024 || BIG BUDGET,SHARE,"$1,418","109,197",2024-09-08,2025-01-22,136
31,CB_2025_Jan_FB_3656_JT_V02_4x5_IMG_EN_New_C-Headline_Seasonal_CTA-70_Angle-W_M-NONE_VL-None_G-NONE_P-OG_S-NONE,ðŸŒ¶ï¸ || US || ASC+ || ->CC141 || VIDEO Only || US+CA || 0% EXISTING CAP || 7C || 07/08.24  Ad set,SHARE,"$1,416","70,690",2025-01-13,2025-03-04,50
32,CB_2025_Jan_FB_3736_LZ-VU_V01_4x5_IMG_EN_Opti_C-NegativeMark_Evergreen_CTA-NONE_Angle-Cort_M-NONE_VL-None_G-NONE_P-NONE_S-NONE_FB3251V01,CBV2 || US || Manual Bid: ROAS GOAL: 0.9 -> 1.00 || 7DC || 22/01/2025,SHARE,"$1,409","46,501",2025-01-22,2025-02-14,23
33,CB_2025_Jan_FB_3736_LZ-VU_V01_4x5_IMG_EN_Opti_C-NegativeMark_Evergreen_CTA-NONE_Angle-Cort_M-NONE_VL-None_G-NONE_P-NONE_S-NONE_FB3251V01,EU (UK) ||  EU adaptation || 3736 - Bioma ripoff march opti || 1C || 21/01/2025w04,SHARE,"$1,381","62,085",2025-01-21,2025-02-04,14
34,CB_2025_Jan_FB_3660_CHUB_V02_4x5_IMG_EN_New_C-NONE_CTA-NONE_Angle-C_M-NONE_VL-None_TR-None_G-NONE_P-NONE_S-NONE,3660 - G-nuggets winner ITR || Enhancements: OFF || CBV1 || Batch 1 || 1C || 14/01/25w03 || Kostas,SHARE,"$1,362","71,510",2025-01-14,2025-01-27,13
35,CB_2024_Jan_FB_2784_RS_V02_9x16_VID_EN_Opti_C-Pointing_CTA-SALE_Pain-W_M-JOG_VL-30s_TR-None_G-F_P-OG_S-OLLIE_FB2181V01,CBV2 || EU (UK) || ðŸ’° Advantage+ || US || BROAD || 7C || Existing_customer_5% || 15/12/24 Ad set,VIDEO,"$1,339","56,954",2025-01-09,2025-03-27,77
36,CB_2023_Nov_FB_2649_VK_V06_9x16_VID_EN_Opti_C-Sale_CTA-C65_Pain-W_M-NONE_VL-30s_TR-None_G-MF_P-Plan_S-NEW_FB2601V04,ðŸ’°WC || US || Advantage+ || BIG BUDGET || CC101->105->109->112->114-116->117 || BROAD || ABO || 1C || 17/01/24 RELAUNCHED Ad set,VIDEO,"$1,321","53,339",2024-01-17,2025-02-06,386
37,CB_2024_Sep_FB_3175_DA-KB_V04_1x1_IMG_EN_New_C-ADVRT_Evergreen_CTA-NONE_Angle-W_M-NONE_VL-None_G-NONE_P-CBV2_S-NONE_blog_colonbroomvsmammoth_cv_en,CBV2 || A/B Pricing: increased price || 3175 - CB vs Happy Mammoth advertorial || BROAD || 1C ||  22/11/24 || Kostas,SHARE,"$1,218","38,561",2024-12-22,2025-01-22,31
38,CB_2025_Jan_FB_3656_JT_V02_4x5_IMG_EN_New_C-Headline_Seasonal_CTA-70_Angle-W_M-NONE_VL-None_G-NONE_P-OG_S-NONE,AU || 3656 - we_re leaving || 1C || 15/01/2025w03,SHARE,"$1,173","42,986",2025-01-15,2025-01-27,12
39,Taboola - ColonB 3.webp,US || VSL || Aff's image || Batch 2 (mostly Taboola ads) || Landing: pre-1 || 1C || 19/01/25,SHARE,"$1,117","35,753",2025-01-19,2025-01-28,9
40,CB_2025_Jan_FB_3665_SO-DP_V01_4x5_IMG_EN_New_C-NONE_Evergreen_CTA-SALE_Angle-W_M-NONE_VL-None_G-NONE_P-NONE_S-NONE,3665 - Notion idea #72 || Enhancements: OFF || CBV1 || Batch 1 || 1C || 13/01/25w03 || Kostas,SHARE,"$1,102","61,704",2025-01-14,2025-01-24,10
41,CB_2025_Jan_FB_3695_KB_V02_4x5_IMG_EN_New_C-SocialProof_Sale_CTA-SALE_Angle-W-B-C_M-NONE_VL-None_G-NONE_P-OG_S-NONE,ðŸŒ¶ï¸ || US || ASC+ || ->CC141 || VIDEO Only || US+CA || 0% EXISTING CAP || 7C || 07/08.24  Ad set,SHARE,"$1,080","100,179",2025-01-21,2025-01-23,2
42,CB_2024_Dec_FB_3601_VK-DP_V09_4x5_VID_EN_Opti_C-Dance_CTA-NY_Pain-W-B_M-JOG_VL-30s_TR-None_G-F_P-OG_S-WHAT_FB3045V01,ASC+ || VIDEO Only || US || 0% EXISTING CAP || 1C || 08.12.24  Ad set,VIDEO,"$1,045","26,466",2024-12-25,2025-02-05,42
43,CB_2024_Dec_FB_3601_VK-DP_V09_4x5_VID_EN_Opti_C-Dance_CTA-NY_Pain-W-B_M-JOG_VL-30s_TR-None_G-F_P-OG_S-WHAT_FB3045V01,ðŸŒ¶ï¸ || US || ASC+ || ->CC141 || VIDEO Only || US+CA || 0% EXISTING CAP || 7C || 07/08.24  Ad set,VIDEO,"$1,013","29,982",2024-12-27,2025-02-14,49
44,CB_2025_Jan_FB_3661_CHUB_V03_1x1_IMG_EN_New_C-NONE_CTA-NONE_Angle-C_M-NONE_VL-None_TR-None_G-NONE_P-OG_S-NONE,3661 - Pop your methane balloon ITR. || Enhancements: OFF || CBV1 || Batch 1 || 1C || 14/01/25w03 || Kostas,SHARE,$991,"44,312",2025-01-14,2025-01-24,10
45,CB_2023_May_FB_2263_MB_V04_9x16_VID_EN_New_C-Sale_CTA-SMR_Pain-W_M-JOG_VL-45s_TR-None_G-M-F_P-None_S-Moon,ðŸ’°WC || US || Advantage+ || BIG BUDGET || CC101->105->109->112->114-116->117 || BROAD || ABO || 1C || 17/01/24 RELAUNCHED Ad set,VIDEO,$978,"26,104",2024-01-17,2025-02-06,386
46,CB_2023_Dec_FB_2696_RS_V03_9x16_VID_EN_Opti_C-Sale_CTA-NY65_Pain-W-B_M-JANW_VL-30s_TR-None_G-M_P-OG_S-WHAT_FB2284V05,CBV2 || AU || ðŸ’° Advantage+ || US || BROAD || 7C || Existing_customer_5% || 19/12/24 Ad set,VIDEO,$953,"39,469",2025-01-13,2025-03-27,73
47,CB_2024_Dec_FB_3592_VK-DP_V10_4x5_VID_EN_New_C-BulletPoints_Sale_CTA-SALE_Angle-W-B-C_M-NONE_VL-30s_G-F_P-OG_S-NEW - Copy,ðŸŒ¶ï¸ || US || ASC+ || ->CC141 || VIDEO Only || US+CA || 0% EXISTING CAP || 7C || 07/08.24  Ad set,VIDEO,$930,"40,738",2024-12-21,2025-03-27,96
48,CB_2025_Jan_FB_3702_VK_V01_4x5_IMG_EN_New_C-BulletPoints_Sale_CTA-NY_Angle-W-B-C_M-NONE_VL-None_G-NONE_P-OG_S-NONE,3702 - #88 I CAN lose fat without losing muscle! VK || Enhancements: OFF || CBV1 || Batch 1 || 1C || 21/01/25w04 || Kostas,SHARE,$902,"47,278",2025-01-21,2025-01-27,6
49,CB_2025_Jan_FB_3699_DT-DP_V03_4x5_IMG_EN_New_C-Headline_Evergreen_CTA-NONE_Angle-W-B_M-NONE_VL-None_G-NONE_P-OG_S-NONE,3699 - Notion idea #86 || Enhancements: OFF || CBV1 || Batch 1 || 1C || 21/01/25w04 || Kostas,SHARE,$892,"32,622",2025-01-21,2025-01-30,9
50,CB_2025_Jan_FB_3657_SO-JT_V04_4x5_VID_EN_New_C-NONE_Evergreen_CTA-NY_Angle-W_M-NONE_VL-15s_G-NONE_P-NONE_S-DooWop,ðŸŒ¶ï¸ || US || ASC+ || ->CC141 || VIDEO Only || US+CA || 0% EXISTING CAP || 7C || 07/08.24  Ad set,VIDEO,$883,"54,686",2025-01-09,2025-01-24,15
51,CB_2025_Jan_FB_3729_CHUB_V01_4x5_IMG_EN_New_C-NONE_CTA-NONE_Angle-C_M-NONE_VL-None_TR-None_G-NONE_P-OG_S-NONE,3729 - TikTokBan CHUB || Enhancements: OFF || CBV1 || Batch 1 || 1C || 20/01/25w03 || Kostas,SHARE,$843,"45,716",2025-01-20,2025-01-24,4
52,CB_2023_Aug_FB_2295_MB_V01_1x1_VID_EN_Opti_C-GIF_CTA-CTA_Pain-W-B_M-None_VL-10s_TR-None_G-None_P-None_S-None,CA || COST CAP 92->93 || 7C || 10/05/24 || V1,VIDEO,$843,"41,206",2024-05-10,2025-02-27,293
53,CB_2025_Jan_FB_3072_V01_4x5_IMG_EN_New_C-Headline_Seasonal_CTA-None_Angle-W_M-NONE_VL-None_G-NONE_P-OG_S-NONE,CBV2 || AU || ðŸ’° Advantage+ || US || BROAD || 7C || Existing_customer_5% || 19/12/24 Ad set,SHARE,$836,"22,585",2025-01-22,2025-02-07,16
54,IM_CB1.png,US || VSL || Aff's image || Landing: Directly to VSL || 1C || 16/01/25,SHARE,$803,"30,268",2025-01-16,2025-01-28,12
55,CB_2025_Jan_FB_3072_V01_4x5_IMG_EN_New_C-Headline_Seasonal_CTA-None_Angle-W_M-NONE_VL-None_G-NONE_P-OG_S-NONE,AU || Fixed || 3072 EU adaptations || 1C || 20/01/2025w04,SHARE,$756,"24,733",2025-01-22,2025-02-14,23
56,CB_2025_Jan_FB_3696_CHUB_V04_4x5_IMG_EN_New_C-NONE_CTA-NONE_Angle-C_M-NONE_VL-None_TR-None_G-NONE_P-OG_S-NONE,3696 Struggling with Poop rocks CHUB || Enhancements: OFF || CBV1 || Batch 1 || 1C || 22/01/25w04,SHARE,$726,"54,775",2025-01-22,2025-01-29,7
57,CB_2023_Dec_FB_2670_MB-RP_V02_9x16_VID_EN_Opti_C-Sale_CTA-XMAS65_Pain-W_M-JOG_VL-30s_TR-None,ðŸ’°WC || US || Advantage+ || BIG BUDGET || CC101->105->109->112->114-116->117 || BROAD || ABO || 1C || 17/01/24 RELAUNCHED Ad set,VIDEO,$718,"27,807",2024-01-17,2025-02-06,386
58,CB_2024_Aug_FB_3090_DT-DP_V02_9x16_VID_EN_Opti_C-MakingOf_CTA-CTA_Pain-W-B-C_M-POW_VL-45s_TR-None_G-M_P-OG_S-Moon_FB3029V04,CBV2 || EU (UK) || ðŸ’° Advantage+ || US || BROAD || 7C || Existing_customer_5% || 15/12/24 Ad set,SHARE,$698,"32,270",2024-12-19,2025-03-27,98
59,CB_2025_Jan_FB_3696_CHUB_V02_4x5_IMG_EN_New_C-NONE_CTA-NONE_Angle-C_M-NONE_VL-None_TR-None_G-NONE_P-NONE_S-NONE,3696 Struggling with Poop rocks CHUB || Enhancements: OFF || CBV1 || Batch 2 || 1C || 22/01/25w04,SHARE,$692,"37,967",2025-01-22,2025-02-02,11
60,CB_2023_Dec_FB_2712_RS-DP_V02_1x1_VID_EN_Opti_C-WrittenTesti_CTA-SALE_Pain-W-B-C_M-NONE_VL-None_TR-None_G-NONE_P-V2_S-NONE_FB2227V08,CBV2 || EU (UK) || ðŸ’° Advantage+ || US || BROAD || 7C || Existing_customer_5% || 15/12/24 Ad set,SHARE,$684,"28,008",2024-12-15,2025-03-27,102
61,CB_2025_Jan_FB_3660_CHUB_V03_4x5_IMG_EN_New_C-NONE_CTA-NONE_Angle-C_M-NONE_VL-None_TR-None_G-NONE_P-NONE_S-NONE - Copy,CBV2 || US || Manual Bid: ROAS GOAL: 0.9 -> 1.00 || 7DC || 22/01/2025,SHARE,$676,"45,698",2025-01-22,2025-01-27,5
62,CB_2025_Jan_FB_3726_LZ-JG_V01_4x5_IMG_EN_Opti_C-Headline_Evergreen_CTA-NONE_Angle-W_M-NONE_VL-None_G-NONE_P-OG_S-NONE_FB3357V01,3726 - domperignon opti || Enhancements: OFF || CBV1 || Batch 1 || 7C || 22/01/25w04,SHARE,$658,"21,894",2025-01-22,2025-02-03,12
63,CB_2024_Oct_FB_3252_VK-DP_V04_4x5_VID_EN_Opti_C-MakingOf_Evergreen_CTA-SALE_Angle-W-B-C_M-JOG_VL-45s_G-F_P-OG_S-MOON_FB3090V02,ðŸŒ¶ï¸ || US || ASC+ || ->CC141 || VIDEO Only || US+CA || 0% EXISTING CAP || 7C || 07/08.24  Ad set,VIDEO,$640,"19,031",2024-11-07,2025-03-27,140
64,CB_2025_Jan_FB_3708_JT_V04_4x5_IMG_EN_New_C-Headline_Evergreen_CTA-NONE_Angle_CR_P-OG,3708 - NO MORE CRAVINGS  || Enhancements: OFF || CBV1 || Batch 1 || 1C || 22/01/25w04 || Kostas,SHARE,$634,"33,069",2025-01-22,2025-01-27,5
65,CB_2025_Jan_FB_3736_LZ-VU_V01_4x5_IMG_EN_Opti_C-NegativeMark_Evergreen_CTA-NONE_Angle-Cort_M-NONE_VL-None_G-NONE_P-NONE_S-NONE_FB3251V01,CBV2 || EU (UK) || ðŸ’° Advantage+ || US || BROAD || 7C || Existing_customer_5% || 15/12/24 Ad set,SHARE,$622,"21,491",2025-01-22,2025-02-04,13
66,CB_2023_May_FB_2263_MB_V04_9x16_VID_EN_New_C-Sale_CTA-SMR_Pain-W_M-JOG_VL-45s_TR-None_G-M-F_P-None_S-Moon,CBV2 || AU || ðŸ’° Advantage+ || US || BROAD || 7C || Existing_customer_5% || 19/12/24 Ad set,VIDEO,$606,"15,120",2024-12-19,2025-03-27,98
67,CB_2025_Jan_FB_3694_DT-RP_V01_4x5_IMG_EN_New_C-BulletPoints_Evergreen_CTA-NONE_Angle-W_M-NONE_VL-None_G-None_P-OG_S-NONE,3694 - Weight_loss-batch_#6 || Enhancements: OFF || CBV1 || Batch 1 || 1C || 20/01/25w04 || Kostas,SHARE,$554,"13,623",2025-01-20,2025-01-24,4
68,CB_2025_Jan_FB_3695_KB_V02_4x5_IMG_EN_New_C-SocialProof_Sale_CTA-SALE_Angle-W-B-C_M-NONE_VL-None_G-NONE_P-OG_S-NONE,3695 - #105 â€œReddit postsâ€ California Fires || Enhancements: OFF || CBV1 || Batch 2 || 1C || 10/01/25w02 || Kostas,SHARE,$539,"36,712",2025-01-10,2025-01-22,12
69,CB_2025_Jan_FB_3662_CHUB_V01_1x1_IMG_EN_New_C-NONE_CTA-NONE_Angle-C_M-NONE_VL-None_TR-None_G-NONE_P-NONE_S-NONE.jpg,ðŸŒ¶ï¸ || US || ASC+ || ->CC141 || VIDEO Only || US+CA || 0% EXISTING CAP || 7C || 07/08.24  Ad set,SHARE,$515,"28,481",2025-01-13,2025-03-04,50
70,CB_2025_Jan_FB_3656_JT_V03_4x5_IMG_EN_New_C-Headline_Seasonal_CTA-70_Angle-W_M-NONE_VL-None_G-NONE_P-OG_S-NONE,AU || 3656 - we_re leaving || 1C || 15/01/2025w03,SHARE,$490,"18,955",2025-01-15,2025-01-27,12
71,CB_2024_Sep_FB_3175_DA-KB_V03_1x1_IMG_EN_New_C-ADVRT_Evergreen_CTA-NONE_Angle-W_M-NONE_VL-None_G-NONE_P-CBV2_S-NONE_blog_colonbroomvsmammoth_cv_en,CBV2 || Advantage+ || Advertorial || Higher pricing || US || 0% EXISTING CAP || BROAD || 7C || 20/01/25  Campaign Ad set,SHARE,$477,"15,168",2025-01-20,2025-03-27,66
72,CB_2025_Jan_FB_3683_SO_V03_4x5_IMG_EN_New_C-Headline_Evergreen_CTA-NONE_Angle-B_M-NONE_VL-None_G-NONE_P-NONE_S-NONE,3683 - Notion Idea #91 Belly Drums || Enhancements: OFF || CBV1 || Batch 1 || 1C || 19/01/25w04 || Kostas,SHARE,$474,"24,836",2025-01-19,2025-01-23,4
73,CB_2023_Jul_FB_2217_IB_V04_9x16_VID_EN_Opti_C-Pointing_CTA-SMR_Pain-W-B_M-TRC_VL-30s_TR-None_G-F_P-None_S-FRIGGA,CBV2 || AU || ðŸ’° Advantage+ || US || BROAD || 7C || Existing_customer_5% || 19/12/24 Ad set,VIDEO,$462,"11,991",2024-12-19,2025-03-24,95
74,CB_2025_Jan_FB_3700_SO_V08_4x5_IMG_EN_New_C-Headline_Evergreen_CTA-NONE_Angle-W-B-C_M-NONE_VL-None_G-NONE_P-NONE_S-NONE,3700 - Notion Idea #90 THE 5 RULES || Enhancements: OFF || CBV1 || Batch 1 || 1C || 21/01/25w04 || Kostas,SHARE,$455,"16,807",2025-01-21,2025-01-30,9
75,CB_2025_Jan_FB_3072_V02_4x5_IMG_EN_New_C-Headline_Seasonal_CTA-None_Angle-W_M-NONE_VL-None_G-NONE_P-OG_S-NONE,EU (UK) || 3072 EU adaptations || 1C || 15/01/2025w03,SHARE,$454,"21,910",2025-01-15,2025-01-22,7
76,CB_2025_Jan_FB_3660_CHUB_V03_4x5_IMG_EN_New_C-NONE_CTA-NONE_Angle-C_M-NONE_VL-None_TR-None_G-NONE_P-NONE_S-NONE,3660 - G-nuggets winner ITR || Enhancements: OFF || CBV1 || Batch 1 || 1C || 14/01/25w03 || Kostas,SHARE,$452,"21,063",2025-01-14,2025-01-27,13
77,CB_2024_Dec_FB_3666_VK-JT_V03_4x5_VID_EN_Opti_C-BulletPoints_Sale_CTA-NY_Angle-W-B-C_M-TRC_VL-30s_G-F_P-OG_S-NEW,EU (UK) || 3666 - looksmaxing trend || 1C || 15/01/2025w03,SHARE,$421,"23,083",2025-01-15,2025-01-22,7
78,CB_2024_Feb_FB_2814_MB-DP_V05_1x1_IMG_EN_New_C-WeightLoss_CTA-None_Pain-W-B-C_M-NONE_VL-None_TR-None_G-NONE_P-V2_S-NONE,AU || clinically proven opti || 1C || 23/01/2025w04 || 1C || 20/01/2025w04,SHARE,$415,"19,010",2025-01-23,2025-01-28,5
79,CB_2025_Jan_FB_3705_VK_V02_4x5_IMG_EN_New_C-BulletPoints_Sale_CTA-NY_Angle-W-B-C_M-NONE_VL-None_G-NONE_P-OG_S-NONE,3705 - #87 Struggling with Dad Bod_ - VK || Enhancements: OFF || CBV1 || Batch 1 || 1C || 22/01/25w04 || Kostas,SHARE,$409,"24,930",2025-01-22,2025-02-03,12
80,IM_CB4.png,US || VSL || Aff's image || Landing: Directly to VSL || 1C || 16/01/25,SHARE,$407,"12,351",2025-01-16,2025-01-28,12
81,CB_2024_Feb_FB_2814_MB-DP_V05_1x1_IMG_EN_New_C-WeightLoss_CTA-None_Pain-W-B-C_M-NONE_VL-None_TR-None_G-NONE_P-V2_S-NONE,EU (UK) || clinically proven opti || 1C || 23/01/2025w04,SHARE,$396,"20,769",2025-01-23,2025-03-10,46
82,CB_2025_Jan_FB_3714_LZ_V01_4x5_VID_EN_New_C-Testimonial_Sale_CTA-VDAY_Angle-W_M-MIX_VL-45s_G-F_P-OG_S-NEW,3714 - trisha paytas ad || Enhancements: OFF || CBV1 || Batch 1 || 1C || 21/01/25w04 || Kostas,SHARE,$385,"20,153",2025-01-21,2025-01-24,3
83,CB_2025_Jan_FB_3639_DT-DP_V04_1x1_IMG_EN_New_C-NONE_CTA-NONE_Angle-W_M-NONE_VL-None_TR-None_G-NONE_P-NONE_S-NONE_FB3639V03,3688 - Opti 3639 || Enhancements: OFF || CBV1 || Batch 1 || 1C || 19/01/25w04 || Kostas,SHARE,$380,"12,754",2025-01-19,2025-01-23,4
84,CB_2025_Jan_FB_3692_SO_V06_4x5_IMG_EN_New_C-Headline_Evergreen_CTA-NONE_Angle-W-B-C_M-NONE_VL-None_G-NONE_P-NONE_S-NONE,3692 - Notion Idea #91 SCULPT THE MAN || Enhancements: OFF || CBV1 || Batch 1 || 1C || 20/01/25w04 || Kostas,SHARE,$377,"8,497",2025-01-21,2025-01-27,6
85,CB_2025_Jan_FB_3072_V01_4x5_IMG_EN_New_C-Headline_Seasonal_CTA-None_Angle-W_M-NONE_VL-None_G-NONE_P-OG_S-NONE,CBV2 || EU (UK) || ðŸ’° Advantage+ || US || BROAD || 7C || Existing_customer_5% || 15/12/24 Ad set,SHARE,$370,"13,104",2025-01-16,2025-01-21,5
86,CB_2025_Jan_FB_3721_KB_V02_4x5_IMG_EN_New_C-SocialProof_Sale_CTA-SALE_Angle-W-B-C_M-NONE_VL-None_G-NONE_P-OG_S-NONE,3721 - 21.6% reads the first sentence || Enhancements: OFF || CBV1 || Batch 1 || 1C || 19/01/25w04 || Kostas,SHARE,$366,"14,149",2025-01-19,2025-01-23,4
87,CB_2025_Jan_FB_3682_DT-RP_V03_4x5_IMG_EN_New_C-BulletPoints_Evergreen_CTA-NONE_Angle-W_M-NONE_VL-None_G-NONE_P-OG_S-NONE,3682 - Weight_loss-batch_#4 || Enhancements: OFF || CBV1 || Batch 1 || 1C || 15/01/25w03 || Kostas,SHARE,$363,"15,025",2025-01-15,2025-01-22,7
88,CB_2024_Sep_FB_3175_DA-KB_V03_1x1_IMG_EN_New_C-ADVRT_Evergreen_CTA-NONE_Angle-W_M-NONE_VL-None_G-NONE_P-CBV2_S-NONE_blog_colonbroomvsmammoth_cv_en,CBV2 || A/B Pricing: increased price || 3175 - CB vs Happy Mammoth advertorial || BROAD || 1C ||  22/11/24 || Kostas,SHARE,$363,"11,249",2024-12-22,2025-01-22,31
89,CB_2025_Jan_FB_3713_SO_V08_4x5_IMG_EN_Opti_C-Headline_Evergreen_CTA-SALE_Angle-W-B-C_M-NONE_VL-None_G-NONE_P-NONE_S-NONE_3296V02,3713 - Tropical fruit Creative Opti 3296 || Enhancements: OFF || CBV1 || Batch 2 || 1C || 22/01/25w04 || Kostas,SHARE,$359,"21,936",2025-01-22,2025-01-26,4
90,CB_2023_Jul_FB_2217_IB_V04_9x16_VID_EN_Opti_C-Pointing_CTA-SMR_Pain-W-B_M-TRC_VL-30s_TR-None_G-F_P-None_S-FRIGGA,CBV2 || EU (UK) || ðŸ’° Advantage+ || US || BROAD || 7C || Existing_customer_5% || 15/12/24 Ad set,VIDEO,$349,"18,454",2024-12-18,2025-03-27,99
91,CB_2024_Sep_FB_3175_DA-KB_V01_1x1_IMG_EN_New_C-ADVRT_Evergreen_CTA-NONE_Angle-W_M-NONE_VL-None_G-NONE_P-CBV2_S-NONE_blog_colonbroomvsmammoth_cv_en,CBV2 || Advantage+ || Advertorial || Higher pricing || US || 0% EXISTING CAP || BROAD || 7C || 20/01/25  Campaign Ad set,SHARE,$329,"14,895",2025-01-20,2025-03-27,66
92,CB_2024_Jan_FB_2762_IK_V05_1x1_IMG_EN_New_C-WrittenTesti_CTA-CTA_Pain-W-B-C_M-NONE_VL-None_TR-None_G-NONE_P-V2_S-NONE,CBV2 || EU (UK) || ðŸ’° Advantage+ || US || BROAD || 7C || Existing_customer_5% || 15/12/24 Ad set,SHARE,$308,"11,478",2024-12-15,2025-03-27,102
93,CB_2025_Jan_FB_3706_DT-JG_V02_4x5_IMG_EN_New_C-Headline_Evergreen_CTA-NONE_Angle-W_M-NONE_VL-None_G-M_P-OG_S-NONE,3706 - #110 Notion || Enhancements: OFF || CBV1 || Batch 1 || 1C || 22/01/25w04 || Kostas,SHARE,$294,"17,350",2025-01-22,2025-01-27,5
94,CB_2024_Sep_FB_3175_DA-KB_V01_1x1_IMG_EN_New_C-ADVRT_Evergreen_CTA-NONE_Angle-W_M-NONE_VL-None_G-NONE_P-CBV2_S-NONE_blog_colonbroomvsmammoth_cv_en,CBV2 || A/B Pricing: increased price || 3175 - CB vs Happy Mammoth advertorial || BROAD || 1C ||  22/11/24 || Kostas,SHARE,$287,"12,041",2024-12-22,2025-01-22,31
95,CB_2023_Jul_FB_2217_IB_V04_9x16_VID_EN_Opti_C-Pointing_CTA-SMR_Pain-W-B_M-TRC_VL-30s_TR-None_G-F_P-None_S-FRIGGA,ðŸ’°WC || US || Advantage+ || BIG BUDGET || CC101->105->109->112->114-116->117 || BROAD || ABO || 1C || 17/01/24 RELAUNCHED Ad set,VIDEO,$286,"8,967",2024-01-17,2025-02-06,386
96,CB_2025_Jan_FB_3702_VK_V03_4x5_IMG_EN_New_C-BulletPoints_Sale_CTA-NY_Angle-W-B-C_M-NONE_VL-None_G-NONE_P-OG_S-NONE,3702 - #88 I CAN lose fat without losing muscle! VK || Enhancements: OFF || CBV1 || Batch 1 || 1C || 21/01/25w04 || Kostas,SHARE,$283,"10,253",2025-01-21,2025-01-24,3
97,CB_2025_Jan_FB_3683_SO_V09_4x5_IMG_EN_New_C-Headline_Evergreen_CTA-NONE_Angle-B_M-NONE_VL-None_G-NONE_P-NONE_S-NONE,3683 - Notion Idea #91 Belly Drums || Enhancements: OFF || CBV1 || Batch 2 || 1C || 19/01/25w04 || Kostas,SHARE,$281,"12,340",2025-01-19,2025-01-24,5
98,CB_2025_Jan_FB_3072_V02_4x5_IMG_EN_New_C-Headline_Seasonal_CTA-None_Angle-W_M-NONE_VL-None_G-NONE_P-OG_S-NONE,AU || Fixed || 3072 EU adaptations || 1C || 20/01/2025w04,SHARE,$280,"14,493",2025-01-20,2025-02-14,25
99,CB_2025_Jan_FB_3713_SO_V01_4x5_IMG_EN_Opti_C-Headline_Evergreen_CTA-SALE_Angle-W-B-C_M-NONE_VL-None_G-NONE_P-NONE_S-NONE3296V02,3713 - Tropical fruit Creative Opti 3296 || Enhancements: OFF || CBV1 || Batch 1 || 1C || 22/01/25w04 || Kostas,SHARE,$264,"15,465",2025-01-22,2025-01-27,5
100,CB_2025_Jan_FB_3695_CHUB_V01_4x5_IMG_EN_New_C-NONE_CTA-NONE_Angle-C_M-NONE_VL-None_TR-None_G-NONE_P-NONE_S-NONE,3695 Weight Loss Blocks CHUB || Enhancements: OFF || CBV1 || Batch 1 || 7C || 22/01/25w04,SHARE,$260,"12,035",2025-01-22,2025-01-26,4
101,CB_2023_Dec_FB_2712_RS-DP_V02_1x1_VID_EN_Opti_C-WrittenTesti_CTA-SALE_Pain-W-B-C_M-NONE_VL-None_TR-None_G-NONE_P-V2_S-NONE_FB2227V08,CBV2 || AU || ðŸ’° Advantage+ || US || BROAD || 7C || Existing_customer_5% || 19/12/24 Ad set,SHARE,$257,"9,226",2024-12-19,2025-03-27,98
102,CB_2025_Jan_FB_3713_SO_V02_4x5_IMG_EN_Opti_C-Headline_Evergreen_CTA-SALE_Angle-W-B-C_M-NONE_VL-None_G-NONE_P-NONE_S-NONE3296V02,3713 - Tropical fruit Creative Opti 3296 || Enhancements: OFF || CBV1 || Batch 1 || 1C || 22/01/25w04 || Kostas,SHARE,$255,"17,194",2025-01-22,2025-01-27,5
103,CB_2024_Oct_FB_3182_ZS-GC_V13_1x1_IMG_EN_New_C-UsVsThem_Evergreen_CTA-NONE_Angle-B-C_M-NONE_VL-None_G-NONE_P-OG_S-NONE,CBV2 || Advantage+ || Only V1 Ads || US || 5% EXISTING CAP || BROAD || 7C || 30/12/24  Campaign Ad set,SHARE,$247,"16,635",2024-12-30,2025-01-22,23
104,CB_2025_Jan_FB_3707_VK_V03_4x5_IMG_EN_New_C-BulletPoints_Sale_CTA-NY_Angle-W-B-C_M-NONE_VL-None_G-NONE_P-OG_S-NONE,3707 - #85 Comics || Enhancements: OFF || CBV1 || Batch 1 || 1C || 22/01/25w04 || Kostas,SHARE,$241,"17,428",2025-01-22,2025-01-26,4
105,CB_2025_Jan_FB_3703_DT-VU_V03_4x5_IMG_EN_New_C-Testimonial_Evergreen_CTA-NONE_Angle-W-B_M-NONE_VL-None_G-F_P-OG_S-NONE,3703 - Notion #84 Women talks about her man || Enhancements: OFF || CBV1 || Batch 1 || 1C || 21/01/25w04 || Kostas,SHARE,$234,"15,387",2025-01-21,2025-01-24,3
106,CB_2023_Jul_FB_2217_IB_V04_9x16_VID_EN_Opti_C-Pointing_CTA-SMR_Pain-W-B_M-TRC_VL-30s_TR-None_G-F_P-None_S-FRIGGA,CBV2 || Advantage+ || Only V1 Ads || US || 5% EXISTING CAP || BROAD || 7C || 30/12/24  Campaign Ad set,VIDEO,$234,"9,860",2024-12-30,2025-01-22,23
107,CB_2025_Jan_FB_3750_LZ-VU_V03_4x5_IMG_EN_Opti_C-NegativeMark_Evergreen_CTA-NONE_Angle-W_M-NONE_VL-None_G-NONE_P-NONE_S-NONE_FB3251V01,3750 - bioma ripoff march soft version || Enhancements: OFF || CBV1 || Batch 1 || 1C || 24/01/25w04 || Kostas,SHARE,$231,"6,199",2025-01-24,2025-01-28,4
108,CB_2024_Dec_FB_3608_LZ-DP_V03_4x5_IMG_EN_New_C-Headline_Evergreen_CTA-NONE_Angle-W_M-NONE_VL-None_G-NONE_P-OG_S-NONE,CBV2 || EU (UK) || ðŸ’° Advantage+ || US || BROAD || 7C || Existing_customer_5% || 15/12/24 Ad set,SHARE,$226,"10,952",2025-01-23,2025-01-31,8
109,CB_2025_Jan_FB_3684_CHUB_V03_4x5_IMG_EN_New_C-NONE_CTA-NONE_Angle-B_M-NONE_VL-30s_TR-None_G-M_P-NONE_S-NONE,3684 Stop scrolling belly CHUB  || Enhancements: OFF || CBV1 || Batch 1 || 1C || 19/01/25w04 || Kostas,SHARE,$222,"9,779",2025-01-19,2025-01-23,4
110,Taboola - ColonB - 17.jpg,US || VSL || Aff's image || Batch 2 (mostly Taboola ads) || Landing: pre-1 || 1C || 19/01/25,SHARE,$219,"9,448",2025-01-19,2025-01-28,9
111,CB_2025_Jan_FB_3695_VK-RP_V03_4x5_IMG_EN_New_C-BulletPoints_Sale_CTA-NY_Angle-W-B-C_M-NONE_VL-None_G-NONE_P-OG_S-NONE,3695 - Weight_loss-batch_#7 || Enhancements: OFF || CBV1 || Batch 1 || 1C || 21/01/25w04 || Kostas,SHARE,$217,"13,554",2025-01-21,2025-01-24,3
112,CB_2025_Jan_FB_3683_SO_V10_4x5_IMG_EN_New_C-Headline_Evergreen_CTA-NONE_Angle-B_M-NONE_VL-None_G-NONE_P-NONE_S-NONE,3683 - Notion Idea #91 Belly Drums || Enhancements: OFF || CBV1 || Batch 2 || 1C || 19/01/25w04 || Kostas,SHARE,$214,"8,503",2025-01-19,2025-01-24,5
113,CB_2025_Jan_FB_3726_LZ-JG_V03_4x5_IMG_EN_Opti_C-Headline_Evergreen_CTA-NONE_Angle-W_M-NONE_VL-None_G-NONE_P-OG_S-NONE_FB3357V01,3726 - domperignon opti || Enhancements: OFF || CBV1 || Batch 1 || 7C || 22/01/25w04,SHARE,$213,"5,745",2025-01-22,2025-02-03,12
114,CB_2025_Jan_FB_3707_VK_V01_4x5_IMG_EN_New_C-BulletPoints_Sale_CTA-NY_Angle-W-B-C_M-NONE_VL-None_G-NONE_P-OG_S-NONE,3707 - #85 Comics || Enhancements: OFF || CBV1 || Batch 1 || 1C || 22/01/25w04 || Kostas,SHARE,$210,"15,024",2025-01-22,2025-01-26,4
115,CB_2025_Jan_FB_3706_DT-JG_V03_4x5_IMG_EN_New_C-Headline_Evergreen_CTA-NONE_Angle-W_M-NONE_VL-None_G-M_P-OG_S-NONE,3706 - #110 Notion || Enhancements: OFF || CBV1 || Batch 1 || 1C || 22/01/25w04 || Kostas,SHARE,$203,"11,757",2025-01-22,2025-01-27,5
116,CB_2024_Nov_FB_3264_LZ_V31_4x5_VID_EN_Opti_C-MakingOf_Sale_CTA-BF_Angle-W-B_M-CRAZY_VL-45s_G-M_P-OG_S-NEW_FB3004V02,CBV2 || EU (UK) || ðŸ’° Advantage+ || US || BROAD || 7C || Existing_customer_5% || 15/12/24 Ad set,VIDEO,$195,"8,675",2024-12-19,2025-03-27,98
117,CB_2024_Dec_FB_CANVA_LZ-VU_V01_1x1_IMG_EN_New_C-NegativeMark_Evergreen_CTA-NONE_Angle-Cort_M-NONE_VL-None_G-NONE_P-NONE_S-NONE,US || Product Test | Product: CB Original ||| 1D || 14/01/2025,SHARE,$192,"7,210",2025-01-14,2025-01-20,6
118,CB_2024_Dec_FB_CANVA_LZ-VU_V01_1x1_IMG_EN_New_C-NegativeMark_Evergreen_CTA-NONE_Angle-Cort_M-NONE_VL-None_G-NONE_P-NONE_S-NONE,US || Product Test | Product: CB Premium ||| 1D || 14/01/2025,SHARE,$188,"6,368",2025-01-14,2025-01-20,6
119,CB_2025_Jan_FB_3682_DT-RP_V04_4x5_IMG_EN_New_C-BulletPoints_Evergreen_CTA-NONE_Angle-W_M-NONE_VL-None_G-NONE_P-OG_S-NONE,3682 - Weight_loss-batch_#4 || Enhancements: OFF || CBV1 || Batch 1 || 1C || 15/01/25w03 || Kostas,SHARE,$183,"6,908",2025-01-15,2025-01-22,7
120,CB_2025_Jan_FB_3705_VK_V03_4x5_IMG_EN_New_C-BulletPoints_Sale_CTA-NY_Angle-W-B-C_M-NONE_VL-None_G-NONE_P-OG_S-NONE,3705 - #87 Struggling with Dad Bod_ - VK || Enhancements: OFF || CBV1 || Batch 1 || 1C || 22/01/25w04 || Kostas,SHARE,$182,"10,295",2025-01-22,2025-01-30,8
121,CB_2024_Dec_FB_3666_VK-JT_V04_4x5_VID_EN_Opti_C-BulletPoints_Sale_CTA-NY_Angle-W-B-C_M-TRC_VL-30s_G-F_P-OG_S-NEW,3666 - looksmaxing trend || Enhancements: OFF || CBV1 || Batch 1 || 1C || 07/01/25w02 || Kostas,SHARE,$181,"8,882",2025-01-07,2025-01-30,23
122,CB_2025_Jan_FB_3707_VK_V02_4x5_IMG_EN_New_C-BulletPoints_Sale_CTA-NY_Angle-W-B-C_M-NONE_VL-None_G-NONE_P-OG_S-NONE,3707 - #85 Comics || Enhancements: OFF || CBV1 || Batch 1 || 1C || 22/01/25w04 || Kostas,SHARE,$180,"13,055",2025-01-22,2025-01-26,4
123,CB_2025_Jan_FB_3695_CHUB_V03_4x5_IMG_EN_New_C-NONE_CTA-NONE_Angle-C_M-NONE_VL-None_TR-None_G-NONE_P-NONE_S-NONE,3695 Weight Loss Blocks CHUB || Enhancements: OFF || CBV1 || Batch 1 || 7C || 22/01/25w04,SHARE,$170,"6,117",2025-01-22,2025-01-26,4
124,CB_2025_Jan_FB_3721_KB_V03_4x5_IMG_EN_New_C-SocialProof_Sale_CTA-SALE_Angle-W-B-C_M-NONE_VL-None_G-NONE_P-OG_S-NONE,3721 - 21.6% reads the first sentence || Enhancements: OFF || CBV1 || Batch 1 || 1C || 19/01/25w04 || Kostas,SHARE,$167,"7,918",2025-01-19,2025-01-23,4
125,CB_2025_Jan_FB_3698_DT-DP_V01_4x5_IMG_EN_New_C-Headline_Evergreen_CTA-NONE_Angle-W-B_M-NONE_VL-None_G-NONE_P-OG_S-NONE,3698 - Notion idea #101 || Enhancements: OFF || CBV1 || Batch 1 || 1C || 20/01/25w04 || Kostas,SHARE,$165,"4,618",2025-01-21,2025-01-24,3
126,CB_2025_Jan_FB_3700_SO_V07_4x5_IMG_EN_New_C-Headline_Evergreen_CTA-NONE_Angle-W-B-C_M-NONE_VL-None_G-NONE_P-NONE_S-NONE,3700 - Notion Idea #90 THE 5 RULES || Enhancements: OFF || CBV1 || Batch 1 || 1C || 21/01/25w04 || Kostas,SHARE,$164,"6,129",2025-01-21,2025-01-30,9
127,CB_2025_Jan_FB_3692_SO_V02_4x5_IMG_EN_New_C-Headline_Evergreen_CTA-NONE_Angle-W-B-C_M-NONE_VL-None_G-NONE_P-NONE_S-NONE,3692 - Notion Idea #91 SCULPT THE MAN || Enhancements: OFF || CBV1 || Batch 1 || 1C || 20/01/25w04 || Kostas,SHARE,$159,"4,398",2025-01-21,2025-01-27,6
128,CB_2025_Jan_FB_3655_JT_V02_4x5_IMG_EN_New_C-Headline_Seasonal_CTA-70_Angle-W_M-NONE_VL-None_G-NONE_P-OG_S-NONE,ðŸŒ¶ï¸ || US || ASC+ || ->CC141 || VIDEO Only || US+CA || 0% EXISTING CAP || 7C || 07/08.24  Ad set,SHARE,$156,"6,200",2025-01-13,2025-01-24,11
129,CB_2025_Jan_FB_3695_VK-RP_V02_4x5_IMG_EN_New_C-BulletPoints_Sale_CTA-NY_Angle-W-B-C_M-NONE_VL-None_G-NONE_P-OG_S-NONE,3695 - Weight_loss-batch_#7 || Enhancements: OFF || CBV1 || Batch 1 || 1C || 21/01/25w04 || Kostas,SHARE,$149,"10,683",2025-01-21,2025-01-24,3
130,CB_2025_Jan_FB_3698_DT-DP_V02_4x5_IMG_EN_New_C-Headline_Evergreen_CTA-NONE_Angle-W-B_M-NONE_VL-None_G-NONE_P-OG_S-NONE,3698 - Notion idea #101 || Enhancements: OFF || CBV1 || Batch 1 || 1C || 20/01/25w04 || Kostas,SHARE,$148,"4,492",2025-01-21,2025-01-24,3
131,CB_2025_Jan_FB_3695_CHUB_V04_4x5_IMG_EN_New_C-NONE_CTA-NONE_Angle-C_M-NONE_VL-None_TR-None_G-NONE_P-NONE_S-NONE,3695 Weight Loss Blocks CHUB || Enhancements: OFF || CBV1 || Batch 1 || 7C || 22/01/25w04,SHARE,$143,"5,035",2025-01-22,2025-01-26,4
132,CB_2025_Jan_FB_3726_LZ-JG_V04_4x5_IMG_EN_Opti_C-Headline_Evergreen_CTA-NONE_Angle-W_M-NONE_VL-None_G-NONE_P-OG_S-NONE_FB3357V01,3726 - domperignon opti || Enhancements: OFF || CBV1 || Batch 1 || 7C || 22/01/25w04,SHARE,$142,"6,026",2025-01-22,2025-02-03,12
133,CB_2025_Jan_FB_3706_DT-JG_V04_4x5_IMG_EN_New_C-Headline_Evergreen_CTA-NONE_Angle-W_M-NONE_VL-None_G-M_P-OG_S-NONE,3706 - #110 Notion || Enhancements: OFF || CBV1 || Batch 1 || 1C || 22/01/25w04 || Kostas,SHARE,$141,"8,117",2025-01-22,2025-01-27,5
134,CB_2025_Jan_FB_3692_SO_V05_4x5_IMG_EN_New_C-Headline_Evergreen_CTA-NONE_Angle-W-B-C_M-NONE_VL-None_G-NONE_P-NONE_S-NONE,3692 - Notion Idea #91 SCULPT THE MAN || Enhancements: OFF || CBV1 || Batch 1 || 1C || 20/01/25w04 || Kostas,SHARE,$141,"2,543",2025-01-21,2025-01-27,6
135,CB_2025_Jan_FB_3713_SO_V03_4x5_IMG_EN_Opti_C-Headline_Evergreen_CTA-SALE_Angle-W-B-C_M-NONE_VL-None_G-NONE_P-NONE_S-NONE3296V02,3713 - Tropical fruit Creative Opti 3296 || Enhancements: OFF || CBV1 || Batch 1 || 1C || 22/01/25w04 || Kostas,SHARE,$133,"8,602",2025-01-22,2025-01-27,5
136,CB_2025_Jan_FB_3713_SO_V06_4x5_IMG_EN_Opti_C-Headline_Evergreen_CTA-SALE_Angle-W-B-C_M-NONE_VL-None_G-NONE_P-NONE_S-NONE_3296V02,3713 - Tropical fruit Creative Opti 3296 || Enhancements: OFF || CBV1 || Batch 2 || 1C || 22/01/25w04 || Kostas,SHARE,$128,"8,426",2025-01-22,2025-01-26,4
137,CB_2022_Mar3_FB_713_IK_V04_1x1_IMG_EN_Opti_C-WrittenTesti_HE-98_A-ExtremeBodyVisualization_HK-bodypart_Pain-W_CLR-PURPLE_BG-IMAGE_ME-MIX_MA-YOUNG,US || Manual Bid || BFCM || ROAS GOAL: 1.4 || 1C || 15/11/24,SHARE,$128,"5,870",2024-11-15,2025-02-27,104
138,CB_2024_Feb_FB_2834_DA_V04_4x5_IMG_EN_Opti_C-SingleTesti_CTA-NONE_Pain-W_M-NONE_VL-None_TR-None_G-NONE_P-V2_S-NONE_FB2759V04,CBV2 || EU (UK) || ðŸ’° Advantage+ || US || BROAD || 7C || Existing_customer_5% || 15/12/24 Ad set,SHARE,$124,"5,761",2024-12-15,2025-01-31,47
139,CB_2025_Jan_FB_3072_V02_4x5_IMG_EN_New_C-Headline_Seasonal_CTA-None_Angle-W_M-NONE_VL-None_G-NONE_P-OG_S-NONE,CBV2 || EU (UK) || ðŸ’° Advantage+ || US || BROAD || 7C || Existing_customer_5% || 15/12/24 Ad set,SHARE,$124,"5,457",2025-01-17,2025-03-14,56
140,CB_2025_Jan_FB_3692_SO_V01_4x5_IMG_EN_New_C-Headline_Evergreen_CTA-NONE_Angle-W-B-C_M-NONE_VL-None_G-NONE_P-NONE_S-NONE,3692 - Notion Idea #91 SCULPT THE MAN || Enhancements: OFF || CBV1 || Batch 1 || 1C || 20/01/25w04 || Kostas,SHARE,$123,"2,657",2025-01-21,2025-01-27,6
141,CB_2025_Jan_FB_3706_DT-JG_V01_4x5_IMG_EN_New_C-Headline_Evergreen_CTA-NONE_Angle-W_M-NONE_VL-None_G-M_P-OG_S-NONE,3706 - #110 Notion || Enhancements: OFF || CBV1 || Batch 1 || 1C || 22/01/25w04 || Kostas,SHARE,$122,"6,988",2025-01-22,2025-01-27,5
142,CB_2025_Jan_FB_3750_LZ-VU_V02_4x5_IMG_EN_Opti_C-NegativeMark_Evergreen_CTA-NONE_Angle-W_M-NONE_VL-None_G-NONE_P-NONE_S-NONE_FB3251V01,3750 - bioma ripoff march soft version || Enhancements: OFF || CBV1 || Batch 1 || 1C || 24/01/25w04 || Kostas,SHARE,$119,"2,019",2025-01-24,2025-01-28,4
143,CB_2025_Jan_FB_3683_SO_V08_4x5_IMG_EN_New_C-Headline_Evergreen_CTA-NONE_Angle-B_M-NONE_VL-None_G-NONE_P-NONE_S-NONE,3683 - Notion Idea #91 Belly Drums || Enhancements: OFF || CBV1 || Batch 2 || 1C || 19/01/25w04 || Kostas,SHARE,$113,"5,348",2025-01-19,2025-01-24,5
144,IM_CB3.png,US || VSL || Aff's image || Landing: Directly to VSL || 1C || 16/01/25,SHARE,$107,"2,860",2025-01-16,2025-01-28,12
145,CB_2024_Nov_FB_3264_LZ_V31_4x5_VID_EN_Opti_C-MakingOf_Sale_CTA-BF_Angle-W-B_M-CRAZY_VL-45s_G-M_P-OG_S-NEW_FB3004V02,CBV2 || Advantage+ || Only V1 Ads || US || 5% EXISTING CAP || BROAD || 7C || 30/12/24  Campaign Ad set,VIDEO,$106,"3,541",2024-12-30,2025-01-22,23
146,CB_2025_Jan_FB_3684_CHUB_V04_4x5_IMG_EN_New_C-NONE_CTA-NONE_Angle-B_M-NONE_VL-30s_TR-None_G-M_P-NONE_S-NONE,3684 Stop scrolling belly CHUB  || Enhancements: OFF || CBV1 || Batch 1 || 1C || 19/01/25w04 || Kostas,SHARE,$105,"5,158",2025-01-19,2025-01-23,4
147,CB_2025_Jan_FB_3705_VK_V04_4x5_IMG_EN_New_C-BulletPoints_Sale_CTA-NY_Angle-W-B-C_M-NONE_VL-None_G-NONE_P-OG_S-NONE,3705 - #87 Struggling with Dad Bod_ - VK || Enhancements: OFF || CBV1 || Batch 1 || 1C || 22/01/25w04 || Kostas,SHARE,$102,"6,445",2025-01-22,2025-02-03,12
148,CB_2025_Jan_FB_3661_CHUB_V04_1x1_IMG_EN_New_C-NONE_CTA-NONE_Angle-C_M-NONE_VL-None_TR-None_G-NONE_P-OG_S-NONE,3661 - Pop your methane balloon ITR. || Enhancements: OFF || CBV1 || Batch 1 || 1C || 14/01/25w03 || Kostas,SHARE,$100,"2,771",2025-01-14,2025-01-24,10
149,CB_2025_Jan_FB_3713_SO_V04_4x5_IMG_EN_Opti_C-Headline_Evergreen_CTA-SALE_Angle-W-B-C_M-NONE_VL-None_G-NONE_P-NONE_S-NONE3296V02,3713 - Tropical fruit Creative Opti 3296 || Enhancements: OFF || CBV1 || Batch 1 || 1C || 22/01/25w04 || Kostas,SHARE,$100,"6,227",2025-01-22,2025-01-27,5
150,CB_2025_Jan_FB_3702_VK_V04_4x5_IMG_EN_New_C-BulletPoints_Sale_CTA-NY_Angle-W-B-C_M-NONE_VL-None_G-NONE_P-OG_S-NONE,3702 - #88 I CAN lose fat without losing muscle! VK || Enhancements: OFF || CBV1 || Batch 1 || 1C || 21/01/25w04 || Kostas,SHARE,$98,"3,805",2025-01-21,2025-01-24,3
151,CB_2025_Jan_FB_3726_LZ-JG_V02_4x5_IMG_EN_Opti_C-Headline_Evergreen_CTA-NONE_Angle-W_M-NONE_VL-None_G-NONE_P-OG_S-NONE_FB3357V01,3726 - domperignon opti || Enhancements: OFF || CBV1 || Batch 1 || 7C || 22/01/25w04,SHARE,$95,"3,328",2025-01-22,2025-02-03,12
152,CB_2025_Jan_FB_3661_CHUB_V03_1x1_IMG_EN_New_C-NONE_CTA-NONE_Angle-C_M-NONE_VL-None_TR-None_G-NONE_P-OG_S-NONE,ðŸŒ¶ï¸ || US || ASC+ || ->CC141 || VIDEO Only || US+CA || 0% EXISTING CAP || 7C || 07/08.24  Ad set,SHARE,$94,"4,661",2025-01-20,2025-01-24,4
153,CB_2025_Jan_FB_3692_SO_V04_4x5_IMG_EN_New_C-Headline_Evergreen_CTA-NONE_Angle-W-B-C_M-NONE_VL-None_G-NONE_P-NONE_S-NONE,3692 - Notion Idea #91 SCULPT THE MAN || Enhancements: OFF || CBV1 || Batch 1 || 1C || 20/01/25w04 || Kostas,SHARE,$91,"2,716",2025-01-21,2025-01-27,6
154,CB_2024_Apr_FB_2969_DT-RP_V02_9x16_IMG_EN_New_C-NONE_CTA-NONE_None_M-NONE_VL-None_TR-None_G-NONE_P-OG_S-NONE,ðŸŒ¶ï¸ || US || ASC+ || ->CC141 || VIDEO Only || US+CA || 0% EXISTING CAP || 7C || 07/08.24  Ad set,SHARE,$91,"6,015",2024-08-19,2025-01-24,158
155,CB_2025_Jan_FB_3703_DT-VU_V02_4x5_IMG_EN_New_C-Testimonial_Evergreen_CTA-NONE_Angle-W-B_M-NONE_VL-None_G-F_P-OG_S-NONE,3703 - Notion #84 Women talks about her man || Enhancements: OFF || CBV1 || Batch 1 || 1C || 21/01/25w04 || Kostas,SHARE,$86,"4,328",2025-01-21,2025-01-24,3
156,CB_2025_Jan_FB_3713_SO_V07_4x5_IMG_EN_Opti_C-Headline_Evergreen_CTA-SALE_Angle-W-B-C_M-NONE_VL-None_G-NONE_P-NONE_S-NONE_3296V02,3713 - Tropical fruit Creative Opti 3296 || Enhancements: OFF || CBV1 || Batch 2 || 1C || 22/01/25w04 || Kostas,SHARE,$84,"5,726",2025-01-22,2025-01-26,4
157,CB_2024_Dec_FB_3608_LZ-DP_V03_4x5_IMG_EN_New_C-Headline_Evergreen_CTA-NONE_Angle-W_M-NONE_VL-None_G-NONE_P-OG_S-NONE,US || Manual Bid: ROAS GOAL: 0.9 -> 1.00 || 7DC || 23/01/2025,SHARE,$83,"2,870",2025-01-23,2025-01-30,7
158,CB_2024_May_FB_3003_VK-DP_V03_9x16_VID_EN_Opti_C-Pointing_CTA-SALE_Pain-W-B-C_M-KAY_VL-30s_TR-None_G-F_P-OG_S-WHAT_FB2986V06,ðŸŒ¶ï¸ || US || ASC+ || ->CC141 || VIDEO Only || US+CA || 0% EXISTING CAP || 7C || 07/08.24  Ad set,VIDEO,$83,"4,276",2024-08-07,2025-01-24,170
159,CB_2025_Jan_FB_3695_VK-RP_V04_4x5_IMG_EN_New_C-BulletPoints_Sale_CTA-NY_Angle-W-B-C_M-NONE_VL-None_G-NONE_P-OG_S-NONE,3695 - Weight_loss-batch_#7 || Enhancements: OFF || CBV1 || Batch 1 || 1C || 21/01/25w04 || Kostas,SHARE,$83,"5,161",2025-01-21,2025-01-24,3
160,CB_2025_Jan_FB_3741_LZ-JG_V01_4x5_IMG_EN_Opti_C-Headline_Evergreen_CTA-NONE_Angle-W_M-NONE_VL-None_G-NONE_P-CBV2_S-NONE_FB3357V01,CBV2 || US || Manual Bid: ROAS GOAL: 0.9 -> 1.00 || 7DC || 22/01/2025,SHARE,$80,"6,083",2025-01-22,2025-03-27,64
161,CB_2024_Dec_FB_3639_CHUB_V03_1x1_IMG_EN_New_C-NONE_CTA-NONE_Angle-W_M-NONE_VL-None_TR-None_G-NONE_P-NONE_S-NONE,CBV2 || US || Manual Bid: ROAS GOAL: 0.9 -> 1.00 || 7DC || 22/01/2025,SHARE,$79,"4,296",2025-01-22,2025-02-11,20
162,CB_2023_May_FB_2144_MB_V02_9x16_VID_EN_Opti_C-Sale_CTA-SMR_Pain-W_M-JOG_VL-30s_TR-None_G-M-F_P-None_S-What,CA || COST CAP 92->93 || 7C || 10/05/24 || V1,VIDEO,$77,"4,486",2024-05-10,2025-02-27,293
163,CB_2025_Jan_FB_3700_SO_V04_4x5_IMG_EN_New_C-Headline_Evergreen_CTA-NONE_Angle-W-B-C_M-NONE_VL-None_G-NONE_P-NONE_S-NONE,3700 - Notion Idea #90 THE 5 RULES || Enhancements: OFF || CBV1 || Batch 1 || 1C || 21/01/25w04 || Kostas,SHARE,$75,"1,777",2025-01-21,2025-01-30,9
164,CB_2025_Jan_FB_3684_CHUB_V02_4x5_IMG_EN_New_C-NONE_CTA-NONE_Angle-B_M-NONE_VL-30s_TR-None_G-M_P-NONE_S-NONE,3684 Stop scrolling belly CHUB  || Enhancements: OFF || CBV1 || Batch 1 || 1C || 19/01/25w04 || Kostas,SHARE,$75,"2,844",2025-01-19,2025-01-23,4
165,CB_2025_Jan_FB_3684_CHUB_V07_4x5_IMG_EN_New_C-NONE_CTA-NONE_Angle-B_M-NONE_VL-30s_TR-None_G-M_P-NONE_S-NONE,3684 Stop scrolling belly CHUB  || Enhancements: OFF || CBV1 || Batch 1 || 1C || 19/01/25w04 || Kostas,SHARE,$74,"3,724",2025-01-19,2025-01-23,4
166,CB_2025_Jan_FB_3072_V01_4x5_IMG_EN_New_C-Headline_Seasonal_CTA-None_Angle-W_M-NONE_VL-None_G-NONE_P-OG_S-NONE,AU || 3072 EU adaptations || 1C || 15/01/2025w03,SHARE,$73,"2,473",2025-01-15,2025-01-20,5
167,CB_2025_Jan_FB_3683_SO_V07_4x5_IMG_EN_New_C-Headline_Evergreen_CTA-NONE_Angle-B_M-NONE_VL-None_G-NONE_P-NONE_S-NONE,3683 - Notion Idea #91 Belly Drums || Enhancements: OFF || CBV1 || Batch 2 || 1C || 19/01/25w04 || Kostas,SHARE,$73,"3,764",2025-01-19,2025-01-24,5
168,CB_2025_Jan_FB_3698_DT-DP_V04_4x5_IMG_EN_New_C-Headline_Evergreen_CTA-NONE_Angle-W-B_M-NONE_VL-None_G-NONE_P-OG_S-NONE,3698 - Notion idea #101 || Enhancements: OFF || CBV1 || Batch 1 || 1C || 20/01/25w04 || Kostas,SHARE,$72,"2,258",2025-01-21,2025-01-24,3
169,CB_2025_Jan_FB_3703_DT-VU_V04_4x5_IMG_EN_New_C-Testimonial_Evergreen_CTA-NONE_Angle-W-B_M-NONE_VL-None_G-F_P-OG_S-NONE,3703 - Notion #84 Women talks about her man || Enhancements: OFF || CBV1 || Batch 1 || 1C || 21/01/25w04 || Kostas,SHARE,$72,"4,058",2025-01-21,2025-01-24,3
170,CB_2025_Jan_FB_3700_SO_V09_4x5_IMG_EN_New_C-Headline_Evergreen_CTA-NONE_Angle-W-B-C_M-NONE_VL-None_G-NONE_P-NONE_S-NONE,3700 - Notion Idea #90 THE 5 RULES || Enhancements: OFF || CBV1 || Batch 1 || 1C || 21/01/25w04 || Kostas,SHARE,$72,"1,721",2025-01-21,2025-01-30,9
171,CB_2025_Jan_FB_3639_DT-DP_V02_1x1_IMG_EN_New_C-NONE_CTA-NONE_Angle-W_M-NONE_VL-None_TR-None_G-NONE_P-NONE_S-NONE_FB3639V03,3688 - Opti 3639 || Enhancements: OFF || CBV1 || Batch 1 || 1C || 19/01/25w04 || Kostas,SHARE,$72,"2,698",2025-01-19,2025-01-23,4
172,CB_2025_Jan_FB_3721_KB_V01_4x5_IMG_EN_New_C-SocialProof_Sale_CTA-SALE_Angle-W-B-C_M-NONE_VL-None_G-NONE_P-OG_S-NONE,3721 - 21.6% reads the first sentence || Enhancements: OFF || CBV1 || Batch 1 || 1C || 19/01/25w04 || Kostas,SHARE,$71,"2,493",2025-01-19,2025-01-23,4
173,CB_2025_Jan_FB_3713_SO_V05_4x5_IMG_EN_Opti_C-Headline_Evergreen_CTA-SALE_Angle-W-B-C_M-NONE_VL-None_G-NONE_P-NONE_S-NONE3296V02,3713 - Tropical fruit Creative Opti 3296 || Enhancements: OFF || CBV1 || Batch 2 || 1C || 22/01/25w04 || Kostas,SHARE,$71,"3,961",2025-01-22,2025-01-26,4
174,CB_2025_Jan_FB_3698_DT-DP_V03_4x5_IMG_EN_New_C-Headline_Evergreen_CTA-NONE_Angle-W-B_M-NONE_VL-None_G-NONE_P-OG_S-NONE,3698 - Notion idea #101 || Enhancements: OFF || CBV1 || Batch 1 || 1C || 20/01/25w04 || Kostas,SHARE,$71,"2,661",2025-01-21,2025-01-24,3
175,CB_2024_Feb_FB_2834_DA_V02_4x5_IMG_EN_Opti_C-SingleTesti_CTA-NONE_Pain-W_M-NONE_VL-None_TR-None_G-NONE_P-V2_S-NONE_FB2759V04,CBV2 || EU (UK) || ðŸ’° Advantage+ || US || BROAD || 7C || Existing_customer_5% || 15/12/24 Ad set,SHARE,$70,"2,891",2024-12-15,2025-01-31,47
176,CB_2025_Jan_FB_3705_VK_V01_4x5_IMG_EN_New_C-BulletPoints_Sale_CTA-NY_Angle-W-B-C_M-NONE_VL-None_G-NONE_P-OG_S-NONE,3705 - #87 Struggling with Dad Bod_ - VK || Enhancements: OFF || CBV1 || Batch 1 || 1C || 22/01/25w04 || Kostas,SHARE,$70,"3,483",2025-01-22,2025-02-03,12
177,CB_2025_Jan_FB_3707_VK-JT_V01_4x5_IMG_EN_New_C-BulletPoints_Sale_CTA-NY_Angle-W-B-C_M-NONE_VL-None_G-NONE_P-OG_S-NONE,3712 - #108 Comics ad - VK-JT || Enhancements: OFF || CBV1 || Batch 1 || 1C || 26/01/25w05 || Kostas,SHARE,$68,"3,579",2025-01-26,2025-01-29,3
178,CB_2023_Jul_FB_2226_MB_V04_9x16_VID_EN_Opti_C-Testim_CTA-SMR_Pain-W_M-MIX_VL-30s_TR-None_G-F_P-None_S-Starry,CBV2 || Advantage+ || Only V1 Ads || US || 5% EXISTING CAP || BROAD || 7C || 30/12/24  Campaign Ad set,SHARE,$67,"2,693",2024-12-30,2025-01-22,23
179,CB_2025_Jan_FB_3694_DT-RP_V02_9x16_IMG_EN_New_C-BulletPoints_Evergreen_CTA-NONE_Angle-W_M-NONE_VL-None_G-None_P-OG_S-NONE,3694 - Weight_loss-batch_#6 || Enhancements: OFF || CBV1 || Batch 1 || 1C || 20/01/25w04 || Kostas,SHARE,$65,"2,161",2025-01-20,2025-01-24,4
180,IM_CB5.png,US || VSL || Aff's image || Landing: Directly to VSL || 1C || 16/01/25,SHARE,$64,"2,196",2025-01-16,2025-01-28,12
181,CB_2025_Jan_FB_3700_SO_V06_4x5_IMG_EN_New_C-Headline_Evergreen_CTA-NONE_Angle-W-B-C_M-NONE_VL-None_G-NONE_P-NONE_S-NONE,3700 - Notion Idea #90 THE 5 RULES || Enhancements: OFF || CBV1 || Batch 1 || 1C || 21/01/25w04 || Kostas,SHARE,$63,"2,413",2025-01-21,2025-01-30,9
182,CB_2025_Jan_FB_3702_VK_V02_4x5_IMG_EN_New_C-BulletPoints_Sale_CTA-NY_Angle-W-B-C_M-NONE_VL-None_G-NONE_P-OG_S-NONE,3702 - #88 I CAN lose fat without losing muscle! VK || Enhancements: OFF || CBV1 || Batch 1 || 1C || 21/01/25w04 || Kostas,SHARE,$62,"1,847",2025-01-21,2025-01-24,3
183,Taboola - ColonB - 22.jpg,US || VSL || Aff's image || Batch 2 (mostly Taboola ads) || Landing: pre-1 || 1C || 19/01/25,SHARE,$61,"2,348",2025-01-19,2025-01-28,9
184,CB_2025_Jan_FB_3750_LZ-VU_V01_4x5_IMG_EN_Opti_C-NegativeMark_Evergreen_CTA-NONE_Angle-W_M-NONE_VL-None_G-NONE_P-NONE_S-NONE_FB3251V01,3750 - bioma ripoff march soft version || Enhancements: OFF || CBV1 || Batch 1 || 1C || 24/01/25w04 || Kostas,SHARE,$60,"2,106",2025-01-24,2025-02-17,24
185,CB_2025_Jan_FB_3703_DT-VU_V01_4x5_IMG_EN_New_C-Testimonial_Evergreen_CTA-NONE_Angle-W-B_M-NONE_VL-None_G-F_P-OG_S-NONE,3703 - Notion #84 Women talks about her man || Enhancements: OFF || CBV1 || Batch 1 || 1C || 21/01/25w04 || Kostas,SHARE,$59,"3,404",2025-01-21,2025-01-24,3
186,CB_2025_Jan_FB_3729_CHUB_V03_4x5_IMG_EN_New_C-NONE_CTA-NONE_Angle-C_M-NONE_VL-None_TR-None_G-NONE_P-OG_S-NONE,3729 - TikTokBan CHUB || Enhancements: OFF || CBV1 || Batch 1 || 1C || 20/01/25w03 || Kostas,SHARE,$58,"3,207",2025-01-20,2025-01-23,3
187,CB_2025_Jan_FB_3656_JT_V02_4x5_IMG_EN_New_C-Headline_Seasonal_CTA-70_Angle-W_M-NONE_VL-None_G-NONE_P-OG_S-NONE,EU (UK) || 3656 - we_re leaving || 1C || 15/01/2025w03,SHARE,$56,"2,611",2025-01-15,2025-01-20,5
188,CB_2024_Dec_FB_3639_CHUB_V02_1x1_IMG_EN_New_C-NONE_CTA-NONE_Angle-W_M-NONE_VL-None_TR-None_G-NONE_P-NONE_S-NONE,ðŸŒ¶ï¸ || US || ASC+ || ->CC141 || VIDEO Only || US+CA || 0% EXISTING CAP || 7C || 07/08.24  Ad set,SHARE,$55,"1,940",2025-01-09,2025-01-24,15
189,CB_2024_Nov_FB_3264_LZ_V31_4x5_VID_EN_Opti_C-MakingOf_Sale_CTA-BF_Angle-W-B_M-CRAZY_VL-45s_G-M_P-OG_S-NEW_FB3004V02,CBV2 || AU || ðŸ’° Advantage+ || US || BROAD || 7C || Existing_customer_5% || 19/12/24 Ad set,VIDEO,$54,"1,512",2024-12-19,2025-03-27,98
190,CB_2023_Dec_FB_2696_RS_V03_9x16_VID_EN_Opti_C-Sale_CTA-NY65_Pain-W-B_M-JANW_VL-30s_TR-None_G-M_P-OG_S-WHAT_FB2284V05,EU (UK) || 2696 || 1C || 08/01/2025w02,SHARE,$54,"2,332",2025-01-08,2025-01-20,12
191,CB_2025_Jan_FB_3639_DT-DP_V01_1x1_IMG_EN_New_C-NONE_CTA-NONE_Angle-W_M-NONE_VL-None_TR-None_G-NONE_P-NONE_S-NONE_FB3639V03,3688 - Opti 3639 || Enhancements: OFF || CBV1 || Batch 1 || 1C || 19/01/25w04 || Kostas,SHARE,$53,"2,362",2025-01-19,2025-01-23,4
192,CB_2024_Dec_FB_3608_LZ-DP_V04_4x5_IMG_EN_New_C-Headline_Evergreen_CTA-NONE_Angle-W_M-NONE_VL-None_G-NONE_P-OG_S-NONE,3608 - CB_IMG_ notion #17 hypnosis || Enhancements: OFF || CBV1 || Batch 1 || 1C || 13/01/25w03 || Kostas,SHARE,$51,"2,176",2025-01-13,2025-02-03,21
193,CB_2023_May_FB_1999_LV_V01_9x16_VID_EN_New_C-Pointing_CTA-DISCOUNT_Pain-W_M-JOG_VL-30s_TR-None,View Content || BROAD || 7C || 17/12/24,VIDEO,$51,"7,117",2024-12-17,2025-01-20,34
194,CB_2025_Jan_FB_3704_SO_V01_4x5_IMG_EN_New_C-Headline_Evergreen_CTA-NONE_Angle-W-B-C_M-NONE_VL-None_G-NONE_P-NONE_S-NONE,3704 - Notion Idea #89 FOR REAL MEN || Enhancements: OFF || CBV1 || Batch 1 || 1C || 26/01/25w05 || Kostas,SHARE,$51,"1,678",2025-01-26,2025-02-08,13
195,CB_2024_Sep_FB_3175_DA-KB_V02_1x1_IMG_EN_New_C-ADVRT_Evergreen_CTA-NONE_Angle-W_M-NONE_VL-None_G-NONE_P-CBV2_S-NONE_blog_colonbroomvsmammoth_cv_en,CBV2 || A/B Pricing: increased price || 3175 - CB vs Happy Mammoth advertorial || BROAD || 1C ||  22/11/24 || Kostas,SHARE,$50,"2,425",2024-12-22,2025-01-22,31
196,CB_2023_May_FB_2263_MB_V04_9x16_VID_EN_New_C-Sale_CTA-SMR_Pain-W_M-JOG_VL-45s_TR-None_G-M-F_P-None_S-Moon,ASC+ || VIDEO Only || US || 0% EXISTING CAP || 1C || 08.12.24  Ad set,VIDEO,$50,"1,436",2024-12-08,2025-01-20,43
197,CB_2025_Jan_FB_3720_DT-DP_V01_4x5_CAROUSEL_EN_New_C-BulletPoints_Evergreen_CTA-NONE_Angle-W_M-NONE_VL-None_G-NONE_P-OG_S-NONE_1,3720 - #99 Foods you can eat || Enhancements: OFF || CBV1 || Batch 1 || 1C || 26/01/25w05 || Kostas,SHARE,$50,"1,366",2025-01-26,2025-01-29,3
198,CB_2024_Nov_FB_3305_SO-DP_V02_4x5_VID_EN_Opti_C-Sale_CTA-BF_Pain-W_M-Chris_VL-30s_TR-None_G-MF_P-Plan_S-NEW_FB2601V07,CBV2 || Advantage+ || Only V1 Ads || US || 5% EXISTING CAP || BROAD || 7C || 30/12/24  Campaign Ad set,VIDEO,$47,"1,354",2024-12-30,2025-01-22,23
199,CB_2025_Jan_FB_3708_JT_V02_4x5_IMG_EN_New_C-Headline_Evergreen_CTA-NONE_Angle_CR_P-OG,3708 - NO MORE CRAVINGS  || Enhancements: OFF || CBV1 || Batch 1 || 1C || 22/01/25w04 || Kostas,SHARE,$47,"2,554",2025-01-22,2025-01-27,5
200,CB_2025_Jan_FB_3683_SO_V01_4x5_IMG_EN_New_C-Headline_Evergreen_CTA-NONE_Angle-B_M-NONE_VL-None_G-NONE_P-NONE_S-NONE,3683 - Notion Idea #91 Belly Drums || Enhancements: OFF || CBV1 || Batch 1 || 1C || 19/01/25w04 || Kostas,SHARE,$46,"2,373",2025-01-19,2025-01-23,4
201,CB_2025_Jan_FB_3729_CHUB_V04_4x5_IMG_EN_New_C-NONE_CTA-NONE_Angle-C_M-NONE_VL-None_TR-None_G-NONE_P-OG_S-NONE,3729 - TikTokBan CHUB || Enhancements: OFF || CBV1 || Batch 1 || 1C || 20/01/25w03 || Kostas,SHARE,$46,"2,368",2025-01-20,2025-01-24,4
202,CB_2025_Jan_FB_3719_LZ-JT_V04_4x5_IMG_EN_New_C-UsVsThem_Evergreen_CTA-NONE_Angle-W_M-NONE_VL-None_G-NONE_P-NONE_S-NONE,3719 - usvsthem receipts || Enhancements: OFF || CBV1 || Batch 1 || 1C || 26/01/25w05 || Kostas - Copy,SHARE,$45,"1,818",2025-01-26,2025-02-02,7
203,CB_2024_Dec_FB_3592_VK-DP_V09_4x5_VID_EN_New_C-BulletPoints_Sale_CTA-SALE_Angle-W-B-C_M-NONE_VL-30s_G-F_P-OG_S-WHAT - Copy,ASC+ || VIDEO Only || US || 0% EXISTING CAP || 1C || 08.12.24  Ad set,VIDEO,$45,"1,339",2024-12-20,2025-02-05,47
204,CB_2024_Dec_FB_3601_VK-DP_V09_4x5_VID_EN_Opti_C-Dance_CTA-NY_Pain-W-B_M-JOG_VL-30s_TR-None_G-F_P-OG_S-WHAT_FB3045V01,CBV2 || AU || ðŸ’° Advantage+ || US || BROAD || 7C || Existing_customer_5% || 19/12/24 Ad set,SHARE,$44,"1,243",2025-01-03,2025-03-27,83
205,CB_2024_Dec_FB_3584_VK-DP_V01_4x5_VID_EN_New_C-BulletPoints_Sale_CTA-SALE_Angle-W-B-C_M-NONE_VL-30s_G-M_P-OG_S-WHAT,ðŸŒ¶ï¸ || US || ASC+ || ->CC141 || VIDEO Only || US+CA || 0% EXISTING CAP || 7C || 07/08.24  Ad set,VIDEO,$44,"1,691",2025-01-06,2025-01-24,18
206,CB_2025_Jan_FB_3695_CHUB_V02_4x5_IMG_EN_New_C-NONE_CTA-NONE_Angle-C_M-NONE_VL-None_TR-None_G-NONE_P-NONE_S-NONE,3695 Weight Loss Blocks CHUB || Enhancements: OFF || CBV1 || Batch 1 || 7C || 22/01/25w04,SHARE,$44,"1,725",2025-01-22,2025-01-26,4
207,CB_2024_Dec_FB_3616_LZ-JG_V01_4x5_IMG_EN_Opti_C-Headline_Sale_CTA-XMAS_Angle-Cort_M-NONE_VL-None_G-NONE_P-NONE_S-NONE_FB3251V02,ðŸŒ¶ï¸ || US || ASC+ || ->CC141 || VIDEO Only || US+CA || 0% EXISTING CAP || 7C || 07/08.24  Ad set,SHARE,$44,"1,864",2024-12-20,2025-01-24,35
208,CB_2023_May_FB_2103_MB_V02_9x16_VID_EN_Opti_C-Sale_CTA-SMR_Pain-W_M-JOG_VL-30s_TR-None_G-M-F_P-None_S-What,US || Manual Bid || BFCM || ROAS GOAL: 1.4 || 1C || 15/11/24,VIDEO,$44,"1,026",2024-11-15,2025-02-27,104
209,CB_2024_Aug_FB_3110_DA_V01_4x5_VID_EN_Opti_C-Dance_CTA-LABOR_Pain-W-B_M-JOG_VL-30s_TR-None_G-F_P-OG_S-WHAT_FB3045V01,ðŸŒ¶ï¸ || US || ASC+ || ->CC141 || VIDEO Only || US+CA || 0% EXISTING CAP || 7C || 07/08.24  Ad set,VIDEO,$42,"1,170",2024-09-02,2025-01-24,144
210,CB_2025_Jan_FB_3715_SO-JT_V02_4x5_IMG_EN_New_C-Headline_Evergreen_CTA-SALE_Angle-W_M-NONE_VL-None_G-NONE_P-NONE_S-NONE,3715 - Notion Idea #107 In our DMs || Enhancements: OFF || CBV1 || Batch 1 || 1C || 26/01/25w05 || Kostas,SHARE,$42,"1,169",2025-01-26,2025-01-29,3
211,CB_2024_Dec_FB_3619_VK-JT_V02_4x5_VID_EN_New_C-BulletPoints_Sale_CTA-NY_Angle-W-B-C_M-NONE_VL-None_G-NONE_P-OG_S-NONE - Copy,ðŸ’°WC || US || Advantage+ || BIG BUDGET || CC101->105->109->112->114-116->117 || BROAD || ABO || 1C || 17/01/24 RELAUNCHED Ad set,SHARE,$42,"1,426",2024-12-27,2025-02-06,41
212,CB_2024_Jan_FB_2717_MB-RP_V26_9x16_VID_EN_New_C-Buzz_CTA-SALE_Pain-W-B-C_M-MIX_VL-45s_TR-None_G-MF_P-Method_S-NONE,CA || COST CAP 92->93 || 7C || 10/05/24 || V1,VIDEO,$41,"1,818",2024-08-22,2025-02-27,189
213,CB_2025_Jan_FB_3661_CHUB_V02_1x1_IMG_EN_New_C-NONE_CTA-NONE_Angle-C_M-NONE_VL-None_TR-None_G-NONE_P-OG_S-NONE,3661 - Pop your methane balloon ITR. || Enhancements: OFF || CBV1 || Batch 1 || 1C || 14/01/25w03 || Kostas,SHARE,$40,"1,627",2025-01-14,2025-01-24,10
214,CB_2023_Jul_FB_2226_MB_V04_9x16_VID_EN_Opti_C-Testim_CTA-SMR_Pain-W_M-MIX_VL-30s_TR-None_G-F_P-None_S-Starry,View Content || BROAD || 7C || 17/12/24,VIDEO,$39,"4,581",2024-12-17,2025-01-20,34
215,CB_2025_Jan_FB_3682_DT-RP_V03_4x5_IMG_EN_New_C-BulletPoints_Evergreen_CTA-NONE_Angle-W_M-NONE_VL-None_G-NONE_P-OG_S-NONE,ðŸŒ¶ï¸ || US || ASC+ || ->CC141 || VIDEO Only || US+CA || 0% EXISTING CAP || 7C || 07/08.24  Ad set,SHARE,$39,"2,404",2025-01-22,2025-01-24,2
216,CB_2024_Dec_FB_3608_LZ-DP_V04_4x5_IMG_EN_New_C-Headline_Evergreen_CTA-NONE_Angle-W_M-NONE_VL-None_G-NONE_P-OG_S-NONE,US || Manual Bid: ROAS GOAL: 0.9 -> 1.00 || 7DC || 23/01/2025,SHARE,$37,"1,326",2025-01-23,2025-01-30,7
217,CB_2025_Jan_FB_3639_DT-DP_V03_1x1_IMG_EN_New_C-NONE_CTA-NONE_Angle-W_M-NONE_VL-None_TR-None_G-NONE_P-NONE_S-NONE_FB3639V03,3688 - Opti 3639 || Enhancements: OFF || CBV1 || Batch 1 || 1C || 19/01/25w04 || Kostas,SHARE,$37,"1,236",2025-01-19,2025-01-23,4
218,CB_2025_Jan_FB_3708_JT_V03_4x5_IMG_EN_New_C-Headline_Evergreen_CTA-NONE_Angle_CR_P-OG,3708 - NO MORE CRAVINGS  || Enhancements: OFF || CBV1 || Batch 1 || 1C || 22/01/25w04 || Kostas,SHARE,$37,"2,101",2025-01-22,2025-01-27,5
219,CB_2025_Jan_FB_3682_DT-RP_V02_4x5_IMG_EN_New_C-BulletPoints_Evergreen_CTA-NONE_Angle-W_M-NONE_VL-None_G-NONE_P-OG_S-NONE,3682 - Weight_loss-batch_#4 || Enhancements: OFF || CBV1 || Batch 1 || 1C || 15/01/25w03 || Kostas,SHARE,$36,"1,214",2025-01-15,2025-01-22,7
220,CB_2024_Nov_FB_3305_SO-DP_V02_4x5_VID_EN_Opti_C-Sale_CTA-BF_Pain-W_M-Chris_VL-30s_TR-None_G-MF_P-Plan_S-NEW_FB2601V07,CBV2 || AU || ðŸ’° Advantage+ || US || BROAD || 7C || Existing_customer_5% || 19/12/24 Ad set,VIDEO,$36,"1,057",2024-12-19,2025-03-27,98
221,CB_2024_Feb_FB_2834_DA_V04_4x5_IMG_EN_Opti_C-SingleTesti_CTA-NONE_Pain-W_M-NONE_VL-None_TR-None_G-NONE_P-V2_S-NONE_FB2759V04,CBV2 || AU || ðŸ’° Advantage+ || US || BROAD || 7C || Existing_customer_5% || 19/12/24 Ad set,SHARE,$36,"1,330",2024-12-19,2025-03-27,98
222,CB_2025_Jan_FB_3683_SO_V06_4x5_IMG_EN_New_C-Headline_Evergreen_CTA-NONE_Angle-B_M-NONE_VL-None_G-NONE_P-NONE_S-NONE,3683 - Notion Idea #91 Belly Drums || Enhancements: OFF || CBV1 || Batch 2 || 1C || 19/01/25w04 || Kostas,SHARE,$35,"1,297",2025-01-19,2025-01-24,5
223,CB_2025_Jan_FB_3721_LZ-RP_V01_4x5_IMG_EN_New_C-Headline_Evergreen_CTA-NONE_Angle-W_M-NONE_VL-None_G-NONE_P-NONE_S-NONE,3721 - real men dont ad || Enhancements: OFF || CBV1 || Batch 1 || 1C || 26/01/25w05 || Kostas,SHARE,$35,"1,397",2025-01-26,2025-01-30,4
224,CB_2025_Jan_FB_3708_JT_V01_4x5_IMG_EN_New_C-Headline_Evergreen_CTA-NONE_Angle_CR_P-OG,3708 - NO MORE CRAVINGS  || Enhancements: OFF || CBV1 || Batch 1 || 1C || 22/01/25w04 || Kostas,SHARE,$35,"2,322",2025-01-22,2025-01-27,5
225,CB_2025_Jan_FB_3704_SO_V06_4x5_IMG_EN_New_C-Headline_Evergreen_CTA-NONE_Angle-W-B-C_M-NONE_VL-None_G-NONE_P-NONE_S-NONE,3704 - Notion Idea #89 FOR REAL MEN || Enhancements: OFF || CBV1 || Batch 2 || 1C || 26/01/25w05 || Kostas,SHARE,$35,"1,221",2025-01-26,2025-01-29,3
226,CB_2024_Dec_FB_3601_VK-DP_V09_4x5_VID_EN_Opti_C-Dance_CTA-NY_Pain-W-B_M-JOG_VL-30s_TR-None_G-F_P-OG_S-WHAT_FB3045V01,CBV2 || Advantage+ || Only V1 Ads || US || 5% EXISTING CAP || BROAD || 7C || 30/12/24  Campaign Ad set,VIDEO,$35,663,2024-12-30,2025-01-22,23
227,CB_2025_Jan_FB_3671_LZ-VU_V04_4x5_IMG_EN_New_C-Headline_Evergreen_CTA-NONE_Angle-W_M-NONE_VL-None_G-NONE_P-NONE_S-NONE_FB3306V04,AU || Page: Branded || 3671 - anti inflammatory diet opti || 1C || 13/01/2025,SHARE,$35,652,2025-01-13,2025-01-20,7
228,CB_2025_Jan_FB_3684_CHUB_V08_4x5_IMG_EN_New_C-NONE_CTA-NONE_Angle-B_M-NONE_VL-30s_TR-None_G-M_P-NONE_S-NONE,3684 Stop scrolling belly CHUB  || Enhancements: OFF || CBV1 || Batch 1 || 1C || 19/01/25w04 || Kostas,SHARE,$35,"1,377",2025-01-19,2025-01-23,4
229,CB_2025_Jan_FB_3710_SO-RP_V05_4x5_IMG_EN_New_C-Headline_Evergreen_CTA-SALE_Angle-W-B-C_M-NONE_VL-None_G-NONE_P-NONE_S-NONE,3711 - VDAY top ads 2024 opti || Enhancements: OFF || CBV1 || Batch 1 || 1C || 26/01/25w05 || Kostas,SHARE,$34,"1,071",2025-01-26,2025-01-30,4
230,CB_2024_Oct_FB_3251_LZ-VU_V01_1x1_IMG_EN_New_C-NegativeMark_Evergreen_CTA-NONE_Angle-Cort_M-NONE_VL-None_G-NONE_P-NONE_S-NONE.png,US || Manual Bid || BFCM || ROAS GOAL: 1.4 || 1C || 15/11/24,SHARE,$34,923,2024-11-15,2025-02-27,104
231,CB_2025_Jan_FB_3715_SO-JT_V01_4x5_IMG_EN_New_C-Headline_Evergreen_CTA-SALE_Angle-W_M-NONE_VL-None_G-NONE_P-NONE_S-NONE,3715 - Notion Idea #107 In our DMs || Enhancements: OFF || CBV1 || Batch 1 || 1C || 26/01/25w05 || Kostas,SHARE,$34,949,2025-01-26,2025-01-29,3
232,CB_2024_Oct_FB_3182_ZS-GC_V13_1x1_IMG_EN_New_C-UsVsThem_Evergreen_CTA-NONE_Angle-B-C_M-NONE_VL-None_G-NONE_P-OG_S-NONE,CBV2 || EU (UK) || ðŸ’° Advantage+ || US || BROAD || 7C || Existing_customer_5% || 15/12/24 Ad set,SHARE,$33,"1,765",2024-12-15,2025-01-31,47
233,CB_2025_Jan_FB_3697_JT_V03_4x5_IMG_EN_OPTI_C-NegativeMarketing_Sale_CTA-CTA_ANGLE-W-B-C_P-OG.png,3697 - yes its expensive (NY edition) || Enhancements: OFF || CBV1 || Batch 1 || 1C || 14/01/25w03 || Valentinas,SHARE,$33,"1,009",2025-01-15,2025-01-20,5
234,CB_2024_Feb_FB_2814_MB-DP_V07_1x1_IMG_EN_New_C-WeightLoss_CTA-CTA_Pain-W-B-C_M-NONE_VL-None_TR-None_G-F_P-V2_S-NONE_2410V06,EU (UK) || clinically proven opti || 1C || 23/01/2025w04,SHARE,$33,"1,051",2025-01-23,2025-03-10,46
235,CB_2024_Mar_FB_2888_JG_V02_9x16_IMG_EN_Opti_C-Benefits_CTA-NONE_Pain-W_M-NONE_VL-None_TR-None_G-NONE_P-V2_S-NONE,CBV2 || EU (UK) || ðŸ’° Advantage+ || US || BROAD || 7C || Existing_customer_5% || 15/12/24 Ad set,SHARE,$33,"1,917",2024-12-15,2025-01-31,47
236,CB_2025_Jan_FB_3671_LZ-VU_V02_4x5_IMG_EN_New_C-Headline_Evergreen_CTA-NONE_Angle-W_M-NONE_VL-None_G-NONE_P-NONE_S-NONE_FB3306V02,AU || Page: Branded || 3671 - anti inflammatory diet opti || 1C || 13/01/2025,SHARE,$32,"1,034",2025-01-13,2025-01-20,7
237,CB_2025_Jan_FB_3683_SO_V05_4x5_IMG_EN_New_C-Headline_Evergreen_CTA-NONE_Angle-B_M-NONE_VL-None_G-NONE_P-NONE_S-NONE,3683 - Notion Idea #91 Belly Drums || Enhancements: OFF || CBV1 || Batch 1 || 1C || 19/01/25w04 || Kostas,SHARE,$31,"1,438",2025-01-19,2025-01-23,4
238,CB_2025_Jan_FB_3714_LZ_V02_4x5_VID_EN_New_C-Testimonial_Sale_CTA-VDAY_Angle-W_M-MIX_VL-45s_G-F_P-OG_S-NEW,3714 - trisha paytas ad || Enhancements: OFF || CBV1 || Batch 1 || 1C || 21/01/25w04 || Kostas,SHARE,$30,"1,257",2025-01-21,2025-01-24,3
239,CB_2025_Jan_FB_3692_SO_V03_4x5_IMG_EN_New_C-Headline_Evergreen_CTA-NONE_Angle-W-B-C_M-NONE_VL-None_G-NONE_P-NONE_S-NONE,3692 - Notion Idea #91 SCULPT THE MAN || Enhancements: OFF || CBV1 || Batch 1 || 1C || 20/01/25w04 || Kostas,SHARE,$30,"1,434",2025-01-21,2025-01-27,6
240,CB_2025_Jan_FB_3720_DT-DP_V02_4x5_CAROUSEL_EN_New_C-BulletPoints_Evergreen_CTA-NONE_Angle-W_M-NONE_VL-None_G-NONE_P-OG_S-NONE_1,3720 - #99 Foods you can eat || Enhancements: OFF || CBV1 || Batch 1 || 1C || 26/01/25w05 || Kostas,SHARE,$30,544,2025-01-26,2025-01-29,3
241,CB_2025_Jan_FB_3704_SO_V02_4x5_IMG_EN_New_C-Headline_Evergreen_CTA-NONE_Angle-W-B-C_M-NONE_VL-None_G-NONE_P-NONE_S-NON,3704 - Notion Idea #89 FOR REAL MEN || Enhancements: OFF || CBV1 || Batch 1 || 1C || 26/01/25w05 || Kostas,SHARE,$29,878,2025-01-26,2025-02-08,13
242,CB_2024_Dec_FB_3666_VK-JT_V02_4x5_VID_EN_Opti_C-BulletPoints_Sale_CTA-NY_Angle-W-B-C_M-TRC_VL-30s_G-F_P-OG_S-FRIGGA,3666 - looksmaxing trend || Enhancements: OFF || CBV1 || Batch 1 || 1C || 07/01/25w02 || Kostas,SHARE,$29,785,2025-01-07,2025-01-30,23
243,CB_2024_Sep_FB_3175_DA-KB_V02_1x1_IMG_EN_New_C-ADVRT_Evergreen_CTA-NONE_Angle-W_M-NONE_VL-None_G-NONE_P-CBV2_S-NONE_blog_colonbroomvsmammoth_cv_en,CBV2 || Advantage+ || Advertorial || Higher pricing || US || 0% EXISTING CAP || BROAD || 7C || 20/01/25  Campaign Ad set,SHARE,$28,"1,463",2025-01-20,2025-03-27,66
244,CB_2025_Jan_FB_3719_LZ-JT_V02_4x5_IMG_EN_New_C-UsVsThem_Evergreen_CTA-NONE_Angle-W_M-NONE_VL-None_G-NONE_P-NONE_S-NONE,3719 - usvsthem receipts || Enhancements: OFF || CBV1 || Batch 1 || 1C || 26/01/25w05 || Kostas - Copy,SHARE,$28,"1,409",2025-01-26,2025-02-02,7
245,CB_2024_Feb_FB_2834_DA_V02_4x5_IMG_EN_Opti_C-SingleTesti_CTA-NONE_Pain-W_M-NONE_VL-None_TR-None_G-NONE_P-V2_S-NONE_FB2759V04,CBV2 || AU || ðŸ’° Advantage+ || US || BROAD || 7C || Existing_customer_5% || 19/12/24 Ad set,SHARE,$27,"1,178",2024-12-19,2025-03-27,98
246,CB_2025_Jan_FB_3696_CHUB_V01_4x5_IMG_EN_New_C-NONE_CTA-NONE_Angle-C_M-NONE_VL-None_TR-None_G-NONE_P-NONE_S-NONE,3696 Struggling with Poop rocks CHUB || Enhancements: OFF || CBV1 || Batch 2 || 1C || 22/01/25w04,SHARE,$27,"2,126",2025-01-22,2025-02-02,11
247,CB_2025_Jan_FB_3720_DT-DP_V03_4x5_CAROUSEL_EN_New_C-BulletPoints_Evergreen_CTA-NONE_Angle-W_M-NONE_VL-None_G-NONE_P-OG_S-NONE_1,3720 - #99 Foods you can eat || Enhancements: OFF || CBV1 || Batch 1 || 1C || 26/01/25w05 || Kostas,SHARE,$26,555,2025-01-26,2025-01-29,3
248,CB_2025_Jan_FB_3651_SO-JT_V03_4x5_IMG_EN_New_C-NONE_Evergreen_CTA-SALE_Angle-None_M-NONE_VL-None_G-NONE_P-NONE_S-NONE,ðŸŒ¶ï¸ || US || ASC+ || ->CC141 || VIDEO Only || US+CA || 0% EXISTING CAP || 7C || 07/08.24  Ad set,SHARE,$26,"1,296",2025-01-09,2025-01-24,15
249,CB_2025_Jan_FB_3710_SO-RP_V03_4x5_IMG_EN_New_C-Headline_Evergreen_CTA-SALE_Angle-W-B-C_M-NONE_VL-None_G-NONE_P-NONE_S-NONE,3711 - VDAY top ads 2024 opti || Enhancements: OFF || CBV1 || Batch 1 || 1C || 26/01/25w05 || Kostas,SHARE,$25,797,2025-01-26,2025-01-30,4
250,CB_2025_Jan_FB_3710_SO-RP_V04_4x5_IMG_EN_New_C-Headline_Evergreen_CTA-SALE_Angle-W-B-C_M-NONE_VL-None_G-NONE_P-NONE_S-NONE,3711 - VDAY top ads 2024 opti || Enhancements: OFF || CBV1 || Batch 1 || 1C || 26/01/25w05 || Kostas,SHARE,$25,620,2025-01-26,2025-01-30,4
251,CB_2025_Jan_FB_3684_CHUB_V06_4x5_IMG_EN_New_C-NONE_CTA-NONE_Angle-B_M-NONE_VL-30s_TR-None_G-M_P-NONE_S-NONE,3684 Stop scrolling belly CHUB  || Enhancements: OFF || CBV1 || Batch 1 || 1C || 19/01/25w04 || Kostas,SHARE,$25,"1,010",2025-01-19,2025-01-23,4
252,CB_2025_Jan_FB_3714_LZ_V04_4x5_VID_EN_New_C-Testimonial_Sale_CTA-VDAY_Angle-W_M-MIX_VL-30s_G-F_P-OG_S-NEW,3714 - trisha paytas ad || Enhancements: OFF || CBV1 || Batch 1 || 1C || 21/01/25w04 || Kostas,SHARE,$25,"1,092",2025-01-21,2025-01-24,3
253,CB_2025_Jan_FB_3698_DT-DP_V05_4x5_IMG_EN_New_C-Headline_Evergreen_CTA-NONE_Angle-W-B_M-NONE_VL-None_G-NONE_P-OG_S-NONE,3698 - Notion idea #101 || Enhancements: OFF || CBV1 || Batch 1 || 1C || 20/01/25w04 || Kostas,SHARE,$24,"1,003",2025-01-21,2025-01-24,3
254,CB_2025_Jan_FB_3704_SO_V10_4x5_IMG_EN_New_C-Headline_Evergreen_CTA-NONE_Angle-W-B-C_M-NONE_VL-None_G-NONE_P-NONE_S-NONE,3704 - Notion Idea #89 FOR REAL MEN || Enhancements: OFF || CBV1 || Batch 2 || 1C || 26/01/25w05 || Kostas,SHARE,$23,680,2025-01-26,2025-01-29,3
255,CB_2024_Nov_FB_3342_DT-DP_V05_4x5_VID_EN_Opti_C-Testimomial_Sale_CTA-CYBER_Angle-W_M-CLARA_VL-45s_G-F_P-OG_S-MOON_FB2865V05,ðŸŒ¶ï¸ || US || ASC+ || ->CC141 || VIDEO Only || US+CA || 0% EXISTING CAP || 7C || 07/08.24  Ad set,VIDEO,$23,830,2024-12-09,2025-01-24,46
256,CB_2025_Jan_FB_3693_LZ-JG_V02_4x5_IMG_EN_Opti_C-Headline_Evergreen_CTA-NONE_Angle-W_M-NONE_VL-None_G-NONE_P-NONE_S-NONE_FB3639V03,ðŸŒ¶ï¸ || US || ASC+ || ->CC141 || VIDEO Only || US+CA || 0% EXISTING CAP || 7C || 07/08.24  Ad set,SHARE,$23,"1,457",2025-01-13,2025-01-24,11
257,CB_2025_Jan_FB_3700_SO_V10_4x5_IMG_EN_New_C-Headline_Evergreen_CTA-NONE_Angle-W-B-C_M-NONE_VL-None_G-NONE_P-NONE_S-NONE,3700 - Notion Idea #90 THE 5 RULES || Enhancements: OFF || CBV1 || Batch 1 || 1C || 21/01/25w04 || Kostas,SHARE,$23,623,2025-01-21,2025-01-30,9
258,CB_2023_Jul_FB_2217_IB_V04_9x16_VID_EN_Opti_C-Pointing_CTA-SMR_Pain-W-B_M-TRC_VL-30s_TR-None_G-F_P-None_S-FRIGGA,US || Manual Bid || BFCM || COST CAP 91 || 1C || 15/11/24,VIDEO,$22,640,2024-11-15,2025-02-27,104
259,CB_2023_Oct_FB_2516_VK_V13_9x16_VID_EN_Opti_C-Benefits_CTA-AUTUM_Pain-W-B_M-PASQ_VL-30s_TR-None_G-M_P-Plan_S-WHAT,ðŸ’°WC || US || Advantage+ || BIG BUDGET || CC101->105->109->112->114-116->117 || BROAD || ABO || 1C || 17/01/24 RELAUNCHED Ad set,VIDEO,$22,877,2024-01-17,2025-02-06,386
260,CB_2025_Jan_FB_3704_SO_V08_4x5_IMG_EN_New_C-Headline_Evergreen_CTA-NONE_Angle-W-B-C_M-NONE_VL-None_G-NONE_P-NONE_S-NONE,3704 - Notion Idea #89 FOR REAL MEN || Enhancements: OFF || CBV1 || Batch 2 || 1C || 26/01/25w05 || Kostas,SHARE,$22,611,2025-01-26,2025-01-29,3
261,CB_2024_Oct_FB_3182_ZS-GC_V13_1x1_IMG_EN_New_C-UsVsThem_Evergreen_CTA-NONE_Angle-B-C_M-NONE_VL-None_G-NONE_P-OG_S-NONE,CBV2 || AU || ðŸ’° Advantage+ || US || BROAD || 7C || Existing_customer_5% || 19/12/24 Ad set,SHARE,$22,"1,093",2024-12-19,2025-03-27,98
262,CB_2023_Nov_FB_2648_DT_V01_1x1_GIF_EN_Opti_C-Sale_CTA-XMAS_None_M-NONE_VL-None_TR-None_G-NONE_P-OG_S-NONE,ðŸ’°WC || US || Advantage+ || BIG BUDGET || CC101->105->109->112->114-116->117 || BROAD || ABO || 1C || 17/01/24 RELAUNCHED Ad set,VIDEO,$21,291,2024-01-17,2025-02-06,386
263,CB_2025_Jan_FB_3704_SO_V05_4x5_IMG_EN_New_C-Headline_Evergreen_CTA-NONE_Angle-W-B-C_M-NONE_VL-None_G-NONE_P-NONE_S-NONE,3704 - Notion Idea #89 FOR REAL MEN || Enhancements: OFF || CBV1 || Batch 1 || 1C || 26/01/25w05 || Kostas,SHARE,$21,712,2025-01-26,2025-02-08,13
264,CB_2025_Jan_FB_3671_LZ-VU_V03_4x5_IMG_EN_New_C-Headline_Evergreen_CTA-NONE_Angle-W_M-NONE_VL-None_G-NONE_P-NONE_S-NONE_FB3306V03,AU || Page: Branded || 3671 - anti inflammatory diet opti || 1C || 13/01/2025,SHARE,$21,531,2025-01-13,2025-01-20,7
265,CB_2025_Jan_FB_3694_DT-RP_V03_9x16_IMG_EN_New_C-BulletPoints_Evergreen_CTA-NONE_Angle-W_M-NONE_VL-None_G-None_P-OG_S-NONE,3694 - Weight_loss-batch_#6 || Enhancements: OFF || CBV1 || Batch 1 || 1C || 20/01/25w04 || Kostas,SHARE,$21,745,2025-01-20,2025-01-23,3
266,CB_2024_Feb_FB_2814_MB-DP_V07_1x1_IMG_EN_New_C-WeightLoss_CTA-CTA_Pain-W-B-C_M-NONE_VL-None_TR-None_G-F_P-V2_S-NONE_2410V06,AU || clinically proven opti || 1C || 23/01/2025w04 || 1C || 20/01/2025w04,SHARE,$21,384,2025-01-23,2025-02-12,20
267,CB_2024_Mar_FB_2888_JG_V02_9x16_IMG_EN_Opti_C-Benefits_CTA-NONE_Pain-W_M-NONE_VL-None_TR-None_G-NONE_P-V2_S-NONE,CBV2 || AU || ðŸ’° Advantage+ || US || BROAD || 7C || Existing_customer_5% || 19/12/24 Ad set,SHARE,$21,"1,016",2024-12-19,2025-03-27,98
268,CB_2025_Jan_FB_3721_LZ-RP_V05_4x5_IMG_EN_New_C-Headline_Evergreen_CTA-NONE_Angle-W_M-NONE_VL-None_G-NONE_P-NONE_S-NONE,3721 - real men dont ad || Enhancements: OFF || CBV1 || Batch 1 || 1C || 26/01/25w05 || Kostas,SHARE,$20,651,2025-01-26,2025-01-30,4
269,CB_2025_Jan_FB_3697_JT_V02_4x5_IMG_EN_OPTI_C-NegativeMarketing_Sale_CTA-CTA_ANGLE-W-B-C_P-OG.png,3697 - yes its expensive (NY edition) || Enhancements: OFF || CBV1 || Batch 1 || 1C || 14/01/25w03 || Valentinas,SHARE,$20,538,2025-01-15,2025-01-20,5
270,CB_2025_Jan_FB_3700_SO_V01_4x5_IMG_EN_New_C-Headline_Evergreen_CTA-NONE_Angle-W-B-C_M-NONE_VL-None_G-NONE_P-NONE_S-NONE,3700 - Notion Idea #90 THE 5 RULES || Enhancements: OFF || CBV1 || Batch 1 || 1C || 21/01/25w04 || Kostas,SHARE,$20,588,2025-01-21,2025-01-30,9
271,CB_2025_Jan_FB_3651_SO-JT_V03_4x5_IMG_EN_New_C-NONE_Evergreen_CTA-SALE_Angle-None_M-NONE_VL-None_G-NONE_P-NONE_S-NONE,ðŸŒ¶ï¸ || US || ASC+ || ->CC141 || VIDEO Only || US+CA || 0% EXISTING CAP || 7C || 07/08.24  Ad set,SHARE,$19,"1,277",2025-01-13,2025-01-24,11
272,CB_2025_Jan_FB_3714_LZ_V03_4x5_VID_EN_New_C-Testimonial_Sale_CTA-VDAY_Angle-W_M-MIX_VL-45s_G-F_P-OG_S-NEW,3714 - trisha paytas ad || Enhancements: OFF || CBV1 || Batch 1 || 1C || 21/01/25w04 || Kostas,SHARE,$19,829,2025-01-21,2025-01-24,3
273,CB_2025_Jan_FB_3700_SO_V05_4x5_IMG_EN_New_C-Headline_Evergreen_CTA-NONE_Angle-W-B-C_M-NONE_VL-None_G-NONE_P-NONE_S-NONE,3700 - Notion Idea #90 THE 5 RULES || Enhancements: OFF || CBV1 || Batch 1 || 1C || 21/01/25w04 || Kostas,SHARE,$19,494,2025-01-21,2025-01-30,9
274,CB_2025_Jan_FB_3719_LZ-JT_V03_4x5_IMG_EN_New_C-UsVsThem_Evergreen_CTA-NONE_Angle-W_M-NONE_VL-None_G-NONE_P-NONE_S-NONE,3719 - usvsthem receipts || Enhancements: OFF || CBV1 || Batch 1 || 1C || 26/01/25w05 || Kostas - Copy,SHARE,$18,691,2025-01-26,2025-02-02,7
275,Taboola - ColonB - 7.png,US || VSL || Aff's image || Batch 2 (mostly Taboola ads) || Landing: pre-1 || 1C || 19/01/25,SHARE,$18,685,2025-01-19,2025-01-28,9
276,CB_2025_Jan_FB_3702_VK_V01_4x5_IMG_EN_New_C-BulletPoints_Sale_CTA-NY_Angle-W-B-C_M-NONE_VL-None_G-NONE_P-OG_S-NONE,3702 - #88 I CAN lose fat without losing muscle! VK || Enhancements: OFF || CBV1 || Batch 1 || 1C || 21/01/25w04 || Kostas,SHARE,$17,362,2025-01-21,2025-01-24,3
277,CB_2024_Dec_FB_3666_VK-JT_V04_4x5_VID_EN_Opti_C-BulletPoints_Sale_CTA-NY_Angle-W-B-C_M-TRC_VL-30s_G-F_P-OG_S-NEW,EU (UK) || 3666 - looksmaxing trend || 1C || 15/01/2025w03,SHARE,$17,551,2025-01-15,2025-01-22,7
278,CB_2024_Mar_FB_2888_JG_V03_9x16_IMG_EN_Opti_C-Benefits_CTA-NONE_Pain-W_M-NONE_VL-None_TR-None_G-NONE_P-V2_S-NONE,CBV2 || AU || ðŸ’° Advantage+ || US || BROAD || 7C || Existing_customer_5% || 19/12/24 Ad set,SHARE,$17,625,2024-12-19,2025-03-27,98
279,CB_2025_Jan_FB_3719_LZ-JT_V01_4x5_IMG_EN_New_C-UsVsThem_Evergreen_CTA-NONE_Angle-W_M-NONE_VL-None_G-NONE_P-NONE_S-NONE,3719 - usvsthem receipts || Enhancements: OFF || CBV1 || Batch 1 || 1C || 26/01/25w05 || Kostas - Copy,SHARE,$16,741,2025-01-26,2025-02-02,7
280,CB_2025_Jan_FB_3707_VK-JT_V03_4x5_IMG_EN_New_C-BulletPoints_Sale_CTA-NY_Angle-W-B-C_M-NONE_VL-None_G-NONE_P-OG_S-NONE,3712 - #108 Comics ad - VK-JT || Enhancements: OFF || CBV1 || Batch 1 || 1C || 26/01/25w05 || Kostas,SHARE,$15,770,2025-01-26,2025-01-29,3
281,CB_2025_Jan_FB_3704_SO_V03_4x5_IMG_EN_New_C-Headline_Evergreen_CTA-NONE_Angle-W-B-C_M-NONE_VL-None_G-NONE_P-NONE_S-NONE,3704 - Notion Idea #89 FOR REAL MEN || Enhancements: OFF || CBV1 || Batch 1 || 1C || 26/01/25w05 || Kostas,SHARE,$15,480,2025-01-26,2025-02-08,13
282,CB_2024_Mar_FB_2888_JG_V01_9x16_IMG_EN_Opti_C-Benefits_CTA-NONE_Pain-W_M-NONE_VL-None_TR-None_G-NONE_P-V2_S-NONE,CBV2 || AU || ðŸ’° Advantage+ || US || BROAD || 7C || Existing_customer_5% || 19/12/24 Ad set,SHARE,$15,504,2024-12-19,2025-03-27,98
283,CB_2025_Jan_FB_3684_CHUB_V05_4x5_IMG_EN_New_C-NONE_CTA-NONE_Angle-B_M-NONE_VL-30s_TR-None_G-M_P-NONE_S-NONE,3684 Stop scrolling belly CHUB  || Enhancements: OFF || CBV1 || Batch 1 || 1C || 19/01/25w04 || Kostas,SHARE,$14,432,2025-01-19,2025-01-23,4
284,CB_2025_Jan_FB_3682_DT-RP_V01_4x5_IMG_EN_New_C-BulletPoints_Evergreen_CTA-NONE_Angle-W_M-NONE_VL-None_G-NONE_P-OG_S-NONE,3682 - Weight_loss-batch_#4 || Enhancements: OFF || CBV1 || Batch 1 || 1C || 15/01/25w03 || Kostas,SHARE,$14,660,2025-01-15,2025-01-22,7
285,CB_2022_Mar3_FB_713_IK_V04_1x1_IMG_EN_Opti_C-WrittenTesti_HE-98_A-ExtremeBodyVisualization_HK-bodypart_Pain-W_CLR-PURPLE_BG-IMAGE_ME-MIX_MA-YOUNG,US || Manual Bid || BFCM || COST CAP 91 || 1C || 15/11/24,SHARE,$14,991,2024-11-15,2025-02-27,104
286,CB_2025_Jan_FB_3695_KB_V01_4x5_IMG_EN_New_C-SocialProof_Sale_CTA-SALE_Angle-W-B-C_M-NONE_VL-None_G-NONE_P-OG_S-NONE,3695 - #105 â€œReddit postsâ€ California Fires || Enhancements: OFF || CBV1 || Batch 2 || 1C || 10/01/25w02 || Kostas,SHARE,$14,679,2025-01-10,2025-01-22,12
287,CB_2025_Jan_FB_3721_LZ-RP_V02_4x5_IMG_EN_New_C-Headline_Evergreen_CTA-NONE_Angle-W_M-NONE_VL-None_G-NONE_P-NONE_S-NONE,3721 - real men dont ad || Enhancements: OFF || CBV1 || Batch 1 || 1C || 26/01/25w05 || Kostas,SHARE,$13,460,2025-01-26,2025-01-30,4
288,CB_2025_Jan_FB_3699_DT-DP_V02_4x5_IMG_EN_New_C-Headline_Evergreen_CTA-NONE_Angle-W-B_M-NONE_VL-None_G-NONE_P-OG_S-NONE,3699 - Notion idea #86 || Enhancements: OFF || CBV1 || Batch 1 || 1C || 21/01/25w04 || Kostas,SHARE,$13,582,2025-01-21,2025-01-30,9
289,CB_2024_Dec_FB_3666_VK-JT_V03_4x5_VID_EN_Opti_C-BulletPoints_Sale_CTA-NY_Angle-W-B-C_M-TRC_VL-30s_G-F_P-OG_S-NEW,ASC+ || VIDEO Only || US || 0% EXISTING CAP || 1C || 08.12.24  Ad set,VIDEO,$12,401,2025-01-11,2025-02-05,25
290,CB_2024_Nov_FB_3264_LZ_V31_4x5_VID_EN_Opti_C-MakingOf_Sale_CTA-BF_Angle-W-B_M-CRAZY_VL-45s_G-M_P-OG_S-NEW_FB3004V02,View Content || BROAD || 7C || 17/12/24,VIDEO,$12,951,2024-12-17,2025-01-20,34
291,CB_2024_Mar_FB_2888_JG_V03_9x16_IMG_EN_Opti_C-Benefits_CTA-NONE_Pain-W_M-NONE_VL-None_TR-None_G-NONE_P-V2_S-NONE,CBV2 || EU (UK) || ðŸ’° Advantage+ || US || BROAD || 7C || Existing_customer_5% || 15/12/24 Ad set,SHARE,$12,640,2024-12-15,2025-01-31,47
292,CB_2025_Jan_FB_3665_SO-DP_V02_4x5_IMG_EN_New_C-NONE_Evergreen_CTA-SALE_Angle-W_M-NONE_VL-None_G-NONE_P-NONE_S-NONE,3665 - Notion idea #72 || Enhancements: OFF || CBV1 || Batch 1 || 1C || 13/01/25w03 || Kostas,SHARE,$12,540,2025-01-14,2025-01-24,10
293,CB_2025_Jan_FB_3721_LZ-RP_V04_4x5_IMG_EN_New_C-Headline_Evergreen_CTA-NONE_Angle-W_M-NONE_VL-None_G-NONE_P-NONE_S-NONE,3721 - real men dont ad || Enhancements: OFF || CBV1 || Batch 1 || 1C || 26/01/25w05 || Kostas,SHARE,$11,359,2025-01-26,2025-01-30,4
294,CB_2023_Jul_FB_2217_IB_V04_9x16_VID_EN_Opti_C-Pointing_CTA-SMR_Pain-W-B_M-TRC_VL-30s_TR-None_G-F_P-None_S-FRIGGA - Copy 2,View Content || BROAD || 7C || 17/12/24,VIDEO,$11,"1,652",2024-12-17,2025-01-20,34
295,CB_2025_Jan_FB_3660_CHUB_V01_4x5_IMG_EN_New_C-NONE_CTA-NONE_Angle-C_M-NONE_VL-None_TR-None_G-NONE_P-NONE_S-NONE,3660 - G-nuggets winner ITR || Enhancements: OFF || CBV1 || Batch 1 || 1C || 14/01/25w03 || Kostas,SHARE,$11,487,2025-01-14,2025-01-27,13
296,CB_2024_Dec_FB_3639_CHUB_V03_1x1_IMG_EN_New_C-NONE_CTA-NONE_Angle-W_M-NONE_VL-None_TR-None_G-NONE_P-NONE_S-NONE,US || Product Test | Product: CB Premium ||| 1D || 14/01/2025,SHARE,$11,581,2025-01-14,2025-01-20,6
297,CB_2025_Jan_FB_3696_CHUB_V03_4x5_IMG_EN_New_C-NONE_CTA-NONE_Angle-C_M-NONE_VL-None_TR-None_G-NONE_P-NONE_S-NONE,3696 Struggling with Poop rocks CHUB || Enhancements: OFF || CBV1 || Batch 2 || 1C || 22/01/25w04,SHARE,$11,559,2025-01-22,2025-02-02,11
298,CB_2025_FEB_FB_3666_VK-JT_V03_4x5_VID_EN_NEW_C-BulletPoints_Sale_CTA-NY_Angle-W-B-C_M-TRC_VL-30s_G-F_P-OG_S-NEW,ðŸŒ¶ï¸ || US || ASC+ || ->CC141 || VIDEO Only || US+CA || 0% EXISTING CAP || 7C || 07/08.24  Ad set,VIDEO,$11,477,2025-01-20,2025-03-19,58
299,CB_2025_Jan_FB_3721_LZ-RP_V03_4x5_IMG_EN_New_C-Headline_Evergreen_CTA-NONE_Angle-W_M-NONE_VL-None_G-NONE_P-NONE_S-NONE,3721 - real men dont ad || Enhancements: OFF || CBV1 || Batch 1 || 1C || 26/01/25w05 || Kostas,SHARE,$11,351,2025-01-26,2025-01-30,4
300,CB_2025_Jan_FB_3700_SO_V03_4x5_IMG_EN_New_C-Headline_Evergreen_CTA-NONE_Angle-W-B-C_M-NONE_VL-None_G-NONE_P-NONE_S-NONE,3700 - Notion Idea #90 THE 5 RULES || Enhancements: OFF || CBV1 || Batch 1 || 1C || 21/01/25w04 || Kostas,SHARE,$10,291,2025-01-21,2025-01-30,9
301,CB_2024_Dec_FB_3601_VK-DP_V09_4x5_VID_EN_Opti_C-Dance_CTA-NY_Pain-W-B_M-JOG_VL-30s_TR-None_G-F_P-OG_S-WHAT_FB3045V01 - Copy,ðŸ’°WC || US || Advantage+ || BIG BUDGET || CC101->105->109->112->114-116->117 || BROAD || ABO || 1C || 17/01/24 RELAUNCHED Ad set,VIDEO,$10,263,2024-12-27,2025-02-06,41
302,CB_2025_Jan_FB_3715_SO-JT_V04_4x5_IMG_EN_New_C-Headline_Evergreen_CTA-SALE_Angle-W_M-NONE_VL-None_G-NONE_P-NONE_S-NONE,3715 - Notion Idea #107 In our DMs || Enhancements: OFF || CBV1 || Batch 1 || 1C || 26/01/25w05 || Kostas,SHARE,$10,582,2025-01-26,2025-01-29,3
303,CB_2024_Mar_FB_2888_JG_V01_9x16_IMG_EN_Opti_C-Benefits_CTA-NONE_Pain-W_M-NONE_VL-None_TR-None_G-NONE_P-V2_S-NONE,CBV2 || EU (UK) || ðŸ’° Advantage+ || US || BROAD || 7C || Existing_customer_5% || 15/12/24 Ad set,SHARE,$9,360,2024-12-15,2025-01-31,47
304,CB_2025_Jan_FB_3710_SO-RP_V01_4x5_IMG_EN_New_C-Headline_Evergreen_CTA-SALE_Angle-W-B-C_M-NONE_VL-None_G-NONE_P-NONE_S-NONE,3711 - VDAY top ads 2024 opti || Enhancements: OFF || CBV1 || Batch 1 || 1C || 26/01/25w05 || Kostas,SHARE,$9,279,2025-01-26,2025-01-30,4
305,CB_2025_Jan_FB_3684_CHUB_V01_4x5_IMG_EN_New_C-NONE_CTA-NONE_Angle-B_M-NONE_VL-30s_TR-None_G-M_P-NONE_S-NONE,3684 Stop scrolling belly CHUB  || Enhancements: OFF || CBV1 || Batch 1 || 1C || 19/01/25w04 || Kostas,SHARE,$8,307,2025-01-19,2025-01-23,4
306,CB_2025_Jan_FB_3697_JT_V01_4x5_IMG_EN_OPTI_C-NegativeMarketing_Sale_CTA-CTA_ANGLE-W-B-C_P-OG.png,3697 - yes its expensive (NY edition) || Enhancements: OFF || CBV1 || Batch 1 || 1C || 14/01/25w03 || Valentinas,SHARE,$8,239,2025-01-15,2025-01-20,5
307,CB_2025_Jan_FB_3704_SO_V07_4x5_IMG_EN_New_C-Headline_Evergreen_CTA-NONE_Angle-W-B-C_M-NONE_VL-None_G-NONE_P-NONE_S-NONE,3704 - Notion Idea #89 FOR REAL MEN || Enhancements: OFF || CBV1 || Batch 2 || 1C || 26/01/25w05 || Kostas,SHARE,$8,225,2025-01-26,2025-01-29,3
308,CB_2025_Jan_FB_3700_SO_V02_4x5_IMG_EN_New_C-Headline_Evergreen_CTA-NONE_Angle-W-B-C_M-NONE_VL-None_G-NONE_P-NONE_S-NONE,3700 - Notion Idea #90 THE 5 RULES || Enhancements: OFF || CBV1 || Batch 1 || 1C || 21/01/25w04 || Kostas,SHARE,$8,166,2025-01-21,2025-01-30,9
309,CB_2025_Jan_FB_3707_VK-JT_V02_4x5_IMG_EN_New_C-BulletPoints_Sale_CTA-NY_Angle-W-B-C_M-NONE_VL-None_G-NONE_P-OG_S-NONE,3712 - #108 Comics ad - VK-JT || Enhancements: OFF || CBV1 || Batch 1 || 1C || 26/01/25w05 || Kostas,SHARE,$8,277,2025-01-26,2025-01-29,3
310,CB_2023_Dec_FB_2694_DT-DP_V17_1x1_GIF_EN_New_C-NONE_CTA-NY65_None_M-NONE_VL-15s_TR-None_G-NONE_P-OG_S-NONE,ðŸ’°WC || US || Advantage+ || BIG BUDGET || CC101->105->109->112->114-116->117 || BROAD || ABO || 1C || 17/01/24 RELAUNCHED Ad set,VIDEO,$8,151,2024-01-18,2025-02-06,385
311,CB_2025_Jan_FB_3715_SO-JT_V03_4x5_IMG_EN_New_C-Headline_Evergreen_CTA-SALE_Angle-W_M-NONE_VL-None_G-NONE_P-NONE_S-NONE,3715 - Notion Idea #107 In our DMs || Enhancements: OFF || CBV1 || Batch 1 || 1C || 26/01/25w05 || Kostas,SHARE,$7,357,2025-01-26,2025-01-29,3
312,CB_2025_Jan_FB_3696_CHUB_V04_4x5_IMG_EN_New_C-NONE_CTA-NONE_Angle-C_M-NONE_VL-None_TR-None_G-NONE_P-NONE_S-NONE,3696 Struggling with Poop rocks CHUB || Enhancements: OFF || CBV1 || Batch 2 || 1C || 22/01/25w04,SHARE,$7,622,2025-01-22,2025-02-02,11
313,CB_2025_Jan_FB_3729_CHUB_V02_4x5_IMG_EN_New_C-NONE_CTA-NONE_Angle-C_M-NONE_VL-None_TR-None_G-NONE_P-OG_S-NONE,3729 - TikTokBan CHUB || Enhancements: OFF || CBV1 || Batch 1 || 1C || 20/01/25w03 || Kostas,SHARE,$7,221,2025-01-20,2025-01-24,4
314,CB_2023_May_FB_2103_MB_V02_9x16_VID_EN_Opti_C-Sale_CTA-SMR_Pain-W_M-JOG_VL-30s_TR-None_G-M-F_P-None_S-What,US || Manual Bid || BFCM || COST CAP 91 || 1C || 15/11/24,VIDEO,$7,262,2024-11-15,2025-02-27,104
315,CB_2022_Nov_FB_1218_RS_V15_9x16_IMG_EN_Opti_C-Sale_CTA-BLACK_Pain-W_M-NONE_VL-None FB1671V08,US || Manual Bid || BFCM || ROAS GOAL: 1.4 || 1C || 15/11/24,SHARE,$7,225,2024-11-15,2025-02-27,104
316,CB_2024_Jan_FB_2762_IK_V05_1x1_IMG_EN_New_C-WrittenTesti_CTA-CTA_Pain-W-B-C_M-NONE_VL-None_TR-None_G-NONE_P-V2_S-NONE,CBV2 || AU || ðŸ’° Advantage+ || US || BROAD || 7C || Existing_customer_5% || 19/12/24 Ad set,SHARE,$6,195,2024-12-19,2025-01-20,32
317,CB_2025_Jan_FB_3750_LZ-VU_V04_4x5_IMG_EN_Opti_C-NegativeMark_Evergreen_CTA-NONE_Angle-W_M-NONE_VL-None_G-NONE_P-NONE_S-NONE_FB3251V01,3750 - bioma ripoff march soft version || Enhancements: OFF || CBV1 || Batch 1 || 1C || 24/01/25w04 || Kostas,SHARE,$6,316,2025-01-24,2025-02-17,24
318,CB_2023_Jul_FB_2226_MB_V04_9x16_VID_EN_Opti_C-Testim_CTA-SMR_Pain-W_M-MIX_VL-30s_TR-None_G-F_P-None_S-Starry,US || Manual Bid || BFCM || ROAS GOAL: 1.4 || 1C || 15/11/24,VIDEO,$6,242,2024-11-15,2025-02-27,104
319,CB_2025_Jan_FB_3715_SO-JT_V05_4x5_IMG_EN_New_C-Headline_Evergreen_CTA-SALE_Angle-W_M-NONE_VL-None_G-NONE_P-NONE_S-NONE,3715 - Notion Idea #107 In our DMs || Enhancements: OFF || CBV1 || Batch 1 || 1C || 26/01/25w05 || Kostas,SHARE,$6,184,2025-01-26,2025-01-29,3
320,CB_2025_Jan_FB_3710_SO-RP_V02_4x5_IMG_EN_New_C-Headline_Evergreen_CTA-SALE_Angle-W-B-C_M-NONE_VL-None_G-NONE_P-NONE_S-NONE,3711 - VDAY top ads 2024 opti || Enhancements: OFF || CBV1 || Batch 1 || 1C || 26/01/25w05 || Kostas,SHARE,$5,234,2025-01-26,2025-01-30,4
321,CB_2025_Jan_FB_3720_DT-DP_V04_4x5_CAROUSEL_EN_New_C-BulletPoints_Evergreen_CTA-NONE_Angle-W_M-NONE_VL-None_G-NONE_P-OG_S-NONE_1,3720 - #99 Foods you can eat || Enhancements: OFF || CBV1 || Batch 1 || 1C || 26/01/25w05 || Kostas,SHARE,$5,136,2025-01-26,2025-01-29,3
322,CB_2024_Dec_FB_3639_CHUB_V03_1x1_IMG_EN_New_C-NONE_CTA-NONE_Angle-W_M-NONE_VL-None_TR-None_G-NONE_P-NONE_S-NONE,US || Product Test | Product: CB Original ||| 1D || 14/01/2025,SHARE,$5,289,2025-01-14,2025-01-20,6
323,CB_2025_Jan_FB_3683_SO_V02_4x5_IMG_EN_New_C-Headline_Evergreen_CTA-NONE_Angle-B_M-NONE_VL-None_G-NONE_P-NONE_S-NONE,3683 - Notion Idea #91 Belly Drums || Enhancements: OFF || CBV1 || Batch 1 || 1C || 19/01/25w04 || Kostas,SHARE,$5,258,2025-01-19,2025-01-23,4
324,CB_2024_Nov_FB_3305_SO-DP_V02_4x5_VID_EN_Opti_C-Sale_CTA-BF_Pain-W_M-Chris_VL-30s_TR-None_G-MF_P-Plan_S-NEW_FB2601V07,CBV2 || EU (UK) || ðŸ’° Advantage+ || US || BROAD || 7C || Existing_customer_5% || 15/12/24 Ad set,SHARE,$5,233,2024-12-19,2025-01-31,43
325,CB_2025_Jan_FB_3683_SO_V04_4x5_IMG_EN_New_C-Headline_Evergreen_CTA-NONE_Angle-B_M-NONE_VL-None_G-NONE_P-NONE_S-NONE,3683 - Notion Idea #91 Belly Drums || Enhancements: OFF || CBV1 || Batch 1 || 1C || 19/01/25w04 || Kostas,SHARE,$5,195,2025-01-19,2025-01-22,3
326,CB_2022_Mar3_FB_713_IK_V04_1x1_IMG_EN_Opti_C-WrittenTesti_HE-98_A-ExtremeBodyVisualization_HK-bodypart_Pain-W_CLR-PURPLE_BG-IMAGE_ME-MIX_MA-YOUNG,US || Manual Bid || BFCM || COST CAP 81 || 1C || 15/11/24,SHARE,$5,304,2024-11-15,2025-03-26,131
327,CB_2025_Jan_FB_3695_VK-RP_V01_4x5_IMG_EN_New_C-BulletPoints_Sale_CTA-NY_Angle-W-B-C_M-NONE_VL-None_G-NONE_P-OG_S-NONE - Copy,3695 - Weight_loss-batch_#7 || Enhancements: OFF || CBV1 || Batch 1 || 1C || 21/01/25w04 || Kostas,SHARE,$5,392,2025-01-21,2025-01-23,2
328,CB_2024_Jan_FB_2762_IK_V04_1x1_IMG_EN_New_C-WrittenTesti_CTA-CTA_Pain-W-B-C_M-NONE_VL-None_TR-None_G-NONE_P-V2_S-NONE,CBV2 || AU || ðŸ’° Advantage+ || US || BROAD || 7C || Existing_customer_5% || 19/12/24 Ad set,SHARE,$5,118,2024-12-19,2025-03-27,98
329,CB_2025_Jan_FB_3683_SO_V11_4x5_IMG_EN_New_C-Headline_Evergreen_CTA-NONE_Angle-B_M-NONE_VL-None_G-NONE_P-NONE_S-NONE,3683 - Notion Idea #91 Belly Drums || Enhancements: OFF || CBV1 || Batch 2 || 1C || 19/01/25w04 || Kostas,SHARE,$5,241,2025-01-19,2025-01-24,5
330,CB_2024_Oct_FB_3251_LZ-VU_V01_1x1_IMG_EN_New_C-NegativeMark_Evergreen_CTA-NONE_Angle-Cort_M-NONE_VL-None_G-NONE_P-NONE_S-NONE.png,US || Manual Bid || BFCM || COST CAP 91 || 1C || 15/11/24,SHARE,$4,177,2024-11-15,2025-02-27,104
331,CB_2025_Jan_FB_3671_LZ-VU_V02_4x5_IMG_EN_New_C-Headline_Evergreen_CTA-NONE_Angle-W_M-NONE_VL-None_G-NONE_P-NONE_S-NONE_FB3306V02,CBV2 || EU (UK) || ðŸ’° Advantage+ || US || BROAD || 7C || Existing_customer_5% || 15/12/24 Ad set,SHARE,$4,198,2025-01-09,2025-01-31,22
332,CB_2025_Jan_FB_3699_DT-DP_V04_4x5_IMG_EN_New_C-Headline_Evergreen_CTA-NONE_Angle-W-B_M-NONE_VL-None_G-NONE_P-OG_S-NONE,3699 - Notion idea #86 || Enhancements: OFF || CBV1 || Batch 1 || 1C || 21/01/25w04 || Kostas,SHARE,$4,106,2025-01-21,2025-01-29,8
333,CB_2025_Jan_FB_3656_JT_V03_4x5_IMG_EN_New_C-Headline_Seasonal_CTA-70_Angle-W_M-NONE_VL-None_G-NONE_P-OG_S-NONE,EU (UK) || 3656 - we_re leaving || 1C || 15/01/2025w03,SHARE,$4,199,2025-01-15,2025-01-20,5
334,CB_2024_Jan_FB_2762_IK_V04_1x1_IMG_EN_New_C-WrittenTesti_CTA-CTA_Pain-W-B-C_M-NONE_VL-None_TR-None_G-NONE_P-V2_S-NONE,CBV2 || EU (UK) || ðŸ’° Advantage+ || US || BROAD || 7C || Existing_customer_5% || 15/12/24 Ad set,SHARE,$3,110,2024-12-15,2025-01-31,47
335,CB_2023_Jul_FB_2226_MB_V04_9x16_VID_EN_Opti_C-Testim_CTA-SMR_Pain-W_M-MIX_VL-30s_TR-None_G-F_P-None_S-Starry,US || Manual Bid || BFCM || COST CAP 91 || 1C || 15/11/24,VIDEO,$3,147,2024-11-15,2025-02-27,104
336,CB_2025_Jan_FB_3696_CHUB_V02_4x5_IMG_EN_New_C-NONE_CTA-NONE_Angle-C_M-NONE_VL-None_TR-None_G-NONE_P-OG_S-NONE,3696 Struggling with Poop rocks CHUB || Enhancements: OFF || CBV1 || Batch 1 || 1C || 22/01/25w04,SHARE,$3,357,2025-01-22,2025-01-29,7
337,CB_2023_May_FB_2263_MB_V04_9x16_VID_EN_New_C-Sale_CTA-SMR_Pain-W_M-JOG_VL-45s_TR-None_G-M-F_P-None_S-Moon,CBV2 || Advantage+ || Only V1 Ads || US || 5% EXISTING CAP || BROAD || 7C || 30/12/24  Campaign Ad set,VIDEO,$3,80,2024-12-30,2025-01-22,23
338,CB_2025_Jan_FB_3697_JT_V04_4x5_IMG_EN_OPTI_C-NegativeMarketing_Sale_CTA-CTA_ANGLE-W-B-C_P-OG.png,3697 - yes its expensive (NY edition) || Enhancements: OFF || CBV1 || Batch 1 || 1C || 14/01/25w03 || Valentinas,SHARE,$2,79,2025-01-15,2025-01-20,5
339,CB_2023_Jul_FB_2217_IB_V04_9x16_VID_EN_Opti_C-Pointing_CTA-SMR_Pain-W-B_M-TRC_VL-30s_TR-None_G-F_P-None_S-FRIGGA,US || Manual Bid || BFCM || COST CAP 81 || 1C || 15/11/24,VIDEO,$2,65,2024-11-15,2025-03-16,121
340,CB_2025_Jan_FB_3750_LZ-VU_V05_4x5_IMG_EN_Opti_C-NegativeMark_Evergreen_CTA-NONE_Angle-W_M-NONE_VL-None_G-NONE_P-NONE_S-NONE_FB3251V01,3750 - bioma ripoff march soft version || Enhancements: OFF || CBV1 || Batch 1 || 1C || 24/01/25w04 || Kostas,SHARE,$2,260,2025-01-24,2025-02-17,24
341,CB_2025_Jan_FB_3699_DT-DP_V05_4x5_IMG_EN_New_C-Headline_Evergreen_CTA-NONE_Angle-W-B_M-NONE_VL-None_G-NONE_P-OG_S-NONE,3699 - Notion idea #86 || Enhancements: OFF || CBV1 || Batch 1 || 1C || 21/01/25w04 || Kostas,SHARE,$2,101,2025-01-21,2025-01-30,9
342,CB_2025_Jan_FB_3704_SO_V09_4x5_IMG_EN_New_C-Headline_Evergreen_CTA-NONE_Angle-W-B-C_M-NONE_VL-None_G-NONE_P-NONE_S-NONE,3704 - Notion Idea #89 FOR REAL MEN || Enhancements: OFF || CBV1 || Batch 2 || 1C || 26/01/25w05 || Kostas,SHARE,$2,53,2025-01-26,2025-01-29,3
343,CB_2025_Jan_FB_3696_CHUB_V01_4x5_IMG_EN_New_C-NONE_CTA-NONE_Angle-C_M-NONE_VL-None_TR-None_G-NONE_P-OG_S-NONE,3696 Struggling with Poop rocks CHUB || Enhancements: OFF || CBV1 || Batch 1 || 1C || 22/01/25w04,SHARE,$2,69,2025-01-22,2025-01-29,7
344,CB_2024_Dec_FB_3608_LZ-DP_V02_4x5_IMG_EN_New_C-Headline_Evergreen_CTA-NONE_Angle-W_M-NONE_VL-None_G-NONE_P-OG_S-NONE,3608 - CB_IMG_ notion #17 hypnosis || Enhancements: OFF || CBV1 || Batch 1 || 1C || 13/01/25w03 || Kostas,SHARE,$2,64,2025-01-13,2025-02-03,21
345,CB_2025_Jan_FB_3072_V02_4x5_IMG_EN_New_C-Headline_Seasonal_CTA-None_Angle-W_M-NONE_VL-None_G-NONE_P-OG_S-NONE,AU || 3072 EU adaptations || 1C || 15/01/2025w03,SHARE,$2,77,2025-01-15,2025-01-20,5
346,CB_2025_Jan_FB_3661_CHUB_V01_1x1_IMG_EN_New_C-NONE_CTA-NONE_Angle-C_M-NONE_VL-None_TR-None_G-NONE_P-OG_S-NONE,3661 - Pop your methane balloon ITR. || Enhancements: OFF || CBV1 || Batch 1 || 1C || 14/01/25w03 || Kostas,SHARE,$2,212,2025-01-14,2025-01-24,10
347,CB_2023_Dec_FB_2696_RS_V02_9x16_VID_EN_Opti_C-Sale_CTA-XMAS65_Pain-W-B_M-JANW_VL-30s_TR-None_G-MF_P-OG_S-WHAT_FB2284V05,ðŸ’°WC || US || Advantage+ || BIG BUDGET || CC101->105->109->112->114-116->117 || BROAD || ABO || 1C || 17/01/24 RELAUNCHED Ad set,VIDEO,$1,41,2024-01-17,2025-02-06,386
348,CB_2025_Jan_FB_3696_CHUB_V03_4x5_IMG_EN_New_C-NONE_CTA-NONE_Angle-C_M-NONE_VL-None_TR-None_G-NONE_P-OG_S-NONE,3696 Struggling with Poop rocks CHUB || Enhancements: OFF || CBV1 || Batch 1 || 1C || 22/01/25w04,SHARE,$1,50,2025-01-22,2025-01-29,7
349,CB_2025_Jan_FB_3699_DT-DP_V01_4x5_IMG_EN_New_C-Headline_Evergreen_CTA-NONE_Angle-W-B_M-NONE_VL-None_G-NONE_P-OG_S-NONE,3699 - Notion idea #86 || Enhancements: OFF || CBV1 || Batch 1 || 1C || 21/01/25w04 || Kostas,SHARE,$1,26,2025-01-21,2025-01-28,7
350,CB_2022_Mar3_FB_713_IK_V04_1x1_IMG_EN_Opti_C-WrittenTesti_HE-98_A-ExtremeBodyVisualization_HK-bodypart_Pain-W_CLR-PURPLE_BG-IMAGE_ME-MIX_MA-YOUNG,View Content || BROAD || 7C || 17/12/24,SHARE,$0,58,2024-12-17,2025-01-20,34
351,CB_2024_Dec_FB_3622_LZ-KB_V03_4x5_IMG_EN_Opti_C-NONE_Sale_CTA-XMAS_Angle-GH_M-NONE_VL-None_G-NONE_P-OG_S-NONE_FB2227V08 - Copy,US || Manual Bid || BID CAP 111 || 1C || 21/12/24,SHARE,$0,17,2024-12-22,2025-03-26,94
352,CB_2023_Dec_FB_2706_RS_V09_9x16_VID_EN_Opti_C-Sale_CTA-NY56_Pain-W_M-JOG_VL-30s_TR-None_G-F_P-OG_S-WHAT_FB1404V02,ðŸ’°WC || US || Advantage+ || BIG BUDGET || CC101->105->109->112->114-116->117 || BROAD || ABO || 1C || 17/01/24 RELAUNCHED Ad set,VIDEO,$0,20,2024-01-17,2025-02-05,385
353,CB_2024_Oct_FB_3251_LZ-VU_V01_1x1_IMG_EN_New_C-NegativeMark_Evergreen_CTA-NONE_Angle-Cort_M-NONE_VL-None_G-NONE_P-NONE_S-NONE.png,View Content || BROAD || 7C || 17/12/24,SHARE,$0,59,2024-12-17,2025-01-20,34
354,CB_2025_Jan_FB_3665_SO-DP_V03_4x5_IMG_EN_New_C-NONE_Evergreen_CTA-SALE_Angle-W_M-NONE_VL-None_G-NONE_P-NONE_S-NONE,3665 - Notion idea #72 || Enhancements: OFF || CBV1 || Batch 1 || 1C || 13/01/25w03 || Kostas,SHARE,$0,9,2025-01-14,2025-01-22,8
355,CB_2025_Jan_FB_3704_SO_V04_4x5_IMG_EN_New_C-Headline_Evergreen_CTA-NONE_Angle-W-B-C_M-NONE_VL-None_G-NONE_P-NONE_S-NONE,3704 - Notion Idea #89 FOR REAL MEN || Enhancements: OFF || CBV1 || Batch 1 || 1C || 26/01/25w05 || Kostas,SHARE,$0,16,2025-01-26,2025-02-08,13
356,CB_2024_Oct_FB_3251_LZ-VU_V01_1x1_IMG_EN_New_C-NegativeMark_Evergreen_CTA-NONE_Angle-Cort_M-NONE_VL-None_G-NONE_P-NONE_S-NONE.png,US || Manual Bid || BFCM || COST CAP 81 || 1C || 15/11/24,SHARE,$0,14,2024-11-15,2025-03-17,122
357,CB_2025_Jan_FB_3660_CHUB_V04_4x5_IMG_EN_New_C-NONE_CTA-NONE_Angle-C_M-NONE_VL-None_TR-None_G-NONE_P-NONE_S-NONE,3660 - G-nuggets winner ITR || Enhancements: OFF || CBV1 || Batch 1 || 1C || 14/01/25w03 || Kostas,SHARE,$0,16,2025-01-14,2025-01-27,13
358,CB_2023_Nov_FB_2675_DT_V01_9x16_VID_EN_Opti_C-Pointing_CTA-XMAS65_Pain-W_M-SEAN_VL-30s_TR-None_G-M_P-NONE_S-YARIN_FB2396V02,ðŸ’°WC || US || Advantage+ || BIG BUDGET || CC101->105->109->112->114-116->117 || BROAD || ABO || 1C || 17/01/24 RELAUNCHED Ad set,VIDEO,$0,18,2024-01-17,2025-02-06,386
359,CB_2024_Dec_FB_3611_CHUB_V05_4x5_IMG_EN_Opti_C-Headline_CTA-NONE_Angle-C_P-NONE_S-NONE - Copy,US || Manual Bid || BID CAP 111 || 1C || 21/12/24,SHARE,$0,5,2024-12-27,2025-03-24,87
360,CB_2023_Jul_FB_2217_IB_V04_9x16_VID_EN_Opti_C-Pointing_CTA-SMR_Pain-W-B_M-TRC_VL-30s_TR-None_G-F_P-None_S-FRIGGA,US || Manual Bid || BID CAP 111 || 1C || 21/12/24,VIDEO,$0,6,2024-12-22,2025-03-24,92
361,CB_2023_Dec_FB_2721_DA-RP_V01_9x16_VID_EN_Opti_C-Sale_CTA-65_Pain-W-B_M-HIL_VL-45s_TR-None_G-F_P-Plan_S-NEW_FB2558V02 - Copy,ðŸ’°WC || US || Advantage+ || BIG BUDGET || CC101->105->109->112->114-116->117 || BROAD || ABO || 1C || 17/01/24 RELAUNCHED Ad set,VIDEO,$0,7,2024-01-21,2025-02-04,380
362,CB_2023_Jul_FB_2226_MB_V04_9x16_VID_EN_Opti_C-Testim_CTA-SMR_Pain-W_M-MIX_VL-30s_TR-None_G-F_P-None_S-Starry,US || Manual Bid || BID CAP 111 || 1C || 21/12/24,VIDEO,$0,4,2024-12-27,2025-03-11,74
363,CB_2025_Jan_FB_3695_VK-RP_V01_4x5_IMG_EN_New_C-BulletPoints_Sale_CTA-NY_Angle-W-B-C_M-NONE_VL-None_G-NONE_P-OG_S-NONE,3695 - Weight_loss-batch_#7 || Enhancements: OFF || CBV1 || Batch 1 || 1C || 21/01/25w04 || Kostas - Copy,SHARE,$0,4,2025-01-21,2025-01-21,0
364,CB_2022_Nov_FB_1218_RS_V15_9x16_IMG_EN_Opti_C-Sale_CTA-BLACK_Pain-W_M-NONE_VL-None FB1671V08,US || Manual Bid || BFCM || COST CAP 91 || 1C || 15/11/24,SHARE,$0,2,2024-11-15,2025-02-27,104
365,CB_2023_Jul_FB_2217_IB_V04_9x16_VID_EN_Opti_C-Pointing_CTA-SMR_Pain-W-B_M-TRC_VL-30s_TR-None_G-F_P-None_S-FRIGGA,US || Manual Bid || BFCM || COST CAP 71 || 1C || 15/11/24,VIDEO,$0,3,2024-11-15,2025-03-27,132
366,CB_2023_Nov_FB_2664_MB_V08_9x16_VID_EN_Opti_C-Testim_CTA-XMAS65_Pain-W_M-MIX_VL-30s_TR-None_G-F_P-None_S-Starry,ðŸ’°WC || US || Advantage+ || BIG BUDGET || CC101->105->109->112->114-116->117 || BROAD || ABO || 1C || 17/01/24 RELAUNCHED Ad set,VIDEO,$0,5,2024-01-17,2025-02-04,384
367,CB_2023_Jul_FB_2226_MB_V04_9x16_VID_EN_Opti_C-Testim_CTA-SMR_Pain-W_M-MIX_VL-30s_TR-None_G-F_P-None_S-Starry,US || Manual Bid || BFCM || COST CAP 71 || 1C || 15/11/24,VIDEO,$0,1,2024-11-15,2025-03-27,132
368,CB_2024_Dec_FB_3639_CHUB_V03_1x1_IMG_EN_New_C-NONE_CTA-NONE_Angle-W_M-NONE_VL-None_TR-None_G-NONE_P-NONE_S-NONE,View Content || BROAD || 7C || 17/12/24,SHARE,$0,4,2025-01-09,2025-01-20,11
369,CB_2023_Jul_FB_2217_IB_V04_9x16_VID_EN_Opti_C-Pointing_CTA-SMR_Pain-W-B_M-TRC_VL-30s_TR-None_G-F_P-None_S-FRIGGA,US || Manual Bid || BID CAP 105 || 1C || 21/12/24,VIDEO,$0,1,2024-12-22,2025-03-27,95
370,CB_2025_Jan_FB_3665_SO-DP_V04_4x5_IMG_EN_New_C-NONE_Evergreen_CTA-SALE_Angle-W_M-NONE_VL-None_G-NONE_P-NONE_S-NONE,3665 - Notion idea #72 || Enhancements: OFF || CBV1 || Batch 1 || 1C || 13/01/25w03 || Kostas,SHARE,$0,1,2025-01-14,2025-01-20,6
371,CB_2024_Dec_FB_3608_LZ-DP_V01_4x5_IMG_EN_New_C-Headline_Evergreen_CTA-NONE_Angle-W_M-NONE_VL-None_G-NONE_P-OG_S-NONE,3608 - CB_IMG_ notion #17 hypnosis || Enhancements: OFF || CBV1 || Batch 1 || 1C || 13/01/25w03 || Kostas,SHARE,$0,7,2025-01-13,2025-02-03,21
372,CB_2022_Mar3_FB_713_IK_V04_1x1_IMG_EN_Opti_C-WrittenTesti_HE-98_A-ExtremeBodyVisualization_HK-bodypart_Pain-W_CLR-PURPLE_BG-IMAGE_ME-MIX_MA-YOUNG,US || Manual Bid || BFCM || COST CAP 71 || 1C || 15/11/24,SHARE,$0,1,2024-11-15,2025-03-27,132
373,CB_2023_May_FB_2103_MB_V02_9x16_VID_EN_Opti_C-Sale_CTA-SMR_Pain-W_M-JOG_VL-30s_TR-None_G-M-F_P-None_S-What,US || Manual Bid || BID CAP 111 || 1C || 21/12/24,VIDEO,$0,1,2024-12-28,2025-03-27,89
