,Ad Name,Adset Name,Creative Type,Spend In USD,Impressions,First Ad Spend Date,Last Ad Spend Date,Days ad spending
1,CB_2025_Jan_FB_3723_SO_V04_4x5_IMG_EN_New_C-NONE_Evergreen_CTA-SALE_Angle-W_M-NONE_VL-None_G-NONE_P-NONE_S-NONE,ðŸŒ¶ï¸ || US || ASC+ || ->CC141 || VIDEO Only || US+CA || 0% EXISTING CAP || 7C || 07/08.24  Ad set,SHARE,"$31,282","2,500,727",2025-02-12,2025-03-27,43
2,CB_2025_Jan_FB_3723_SO_V07_4x5_IMG_EN_New_C-NONE_Evergreen_CTA-SALE_Angle-W_M-NONE_VL-None_G-NONE_P-NONE_S-NONE,ðŸŒ¶ï¸ || US || ASC+ || ->CC141 || VIDEO Only || US+CA || 0% EXISTING CAP || 7C || 07/08.24  Ad set,SHARE,"$22,111","1,504,038",2025-02-04,2025-03-27,51
3,Dynamic_Creative_CA_Flow,WC || CA || DYNAMIC CREATIVE || ADV+ audience || 7C || 17.04.2024 || BIG BUDGET,SHARE,"$12,618","720,984",2024-04-17,2025-02-27,316
4,CB_2025_Jan_FB_3779_VK-DP_V02_1x1_VID_EN_Opti_C-BulletPoints_Evergreen_CTA-70_Angle-W-B-C_M-NONE_VL-None_G-F_P-OG_S-NEW_FB3705V02,ðŸŒ¶ï¸ || US || ASC+ || ->CC141 || VIDEO Only || US+CA || 0% EXISTING CAP || 7C || 07/08.24  Ad set,SHARE,"$11,738","893,855",2025-02-12,2025-03-19,35
5,CB_2025_Jan_FB_3736_LZ-VU_V01_4x5_IMG_EN_Opti_C-NegativeMark_Evergreen_CTA-NONE_Angle-Cort_M-NONE_VL-None_G-NONE_P-NONE_S-NONE_FB3251V01,ðŸŒ¶ï¸ || US || ASC+ || ->CC141 || VIDEO Only || US+CA || 0% EXISTING CAP || 7C || 07/08.24  Ad set,SHARE,"$3,741","139,596",2025-02-04,2025-02-17,13
6,CB_2025_Jan_FB_3723_SO_V18_4x5_IMG_EN_New_C-NONE_Evergreen_CTA-SALE_Angle-W_M-NONE_VL-None_G-NONE_P-NONE_S-NONE,ðŸŒ¶ï¸ || US || ASC+ || ->CC141 || VIDEO Only || US+CA || 0% EXISTING CAP || 7C || 07/08.24  Ad set,SHARE,"$3,656","285,590",2025-02-12,2025-02-19,7
7,CB_2023_Jul_FB_2217_IB_V04_9x16_VID_EN_Opti_C-Pointing_CTA-SMR_Pain-W-B_M-TRC_VL-30s_TR-None_G-F_P-None_S-FRIGGA,ðŸŒ¶ï¸ || US || ASC+ || ->CC141 || VIDEO Only || US+CA || 0% EXISTING CAP || 7C || 07/08.24  Ad set,VIDEO,"$3,344","111,623",2024-08-07,2025-03-27,232
8,CB_2025_Jan_FB_3718_CHUB_V05_4x5_IMG_EN_Opti_C-NONE_CTA-NONE_Angle-C_M-NONE_VL-None_TR-None_G-M_P-OG_S-NONE,ðŸŒ¶ï¸ || US || ASC+ || ->CC141 || VIDEO Only || US+CA || 0% EXISTING CAP || 7C || 07/08.24  Ad set,SHARE,"$3,043","223,507",2025-02-12,2025-03-03,19
9,CB_2025_Jan_FB_3723_SO_V07_4x5_IMG_EN_New_C-NONE_Evergreen_CTA-SALE_Angle-W_M-NONE_VL-None_G-NONE_P-NONE_S-NONE,CBV2 || US || Manual Bid: ROAS GOAL: 1.00 -> 1.1 || 7DC || 22/01/2025,SHARE,"$2,863","165,513",2025-02-11,2025-03-27,44
10,CB_2025_Jan_FB_3705_VK_V02_4x5_IMG_EN_New_C-BulletPoints_Sale_CTA-NY_Angle-W-B-C_M-NONE_VL-None_G-NONE_P-OG_S-NONE,ðŸŒ¶ï¸ || US || ASC+ || ->CC141 || VIDEO Only || US+CA || 0% EXISTING CAP || 7C || 07/08.24  Ad set,SHARE,"$2,696","142,931",2025-01-30,2025-02-19,20
11,CB_2023_Apr_FB_1989_RS_V08_9x16_VID_EN_Opti_C-Trend_CTA-SMR_Pain-W_M-MIX_VL-30s_TR-None_G-MF_P-None,ðŸŒ¶ï¸ || US || ASC+ || ->CC141 || VIDEO Only || US+CA || 0% EXISTING CAP || 7C || 07/08.24  Ad set,VIDEO,"$2,661","126,737",2024-08-07,2025-03-24,229
12,CB_2024_Sep_FB_3175_DA-KB_V04_1x1_IMG_EN_New_C-ADVRT_Evergreen_CTA-NONE_Angle-W_M-NONE_VL-None_G-NONE_P-CBV2_S-NONE_blog_colonbroomvsmammoth_cv_en,CBV2 || Advantage+ || Advertorial || Higher pricing || US || 0% EXISTING CAP || BROAD || 7C || 20/01/25  Campaign Ad set,SHARE,"$2,655","106,613",2025-01-20,2025-03-27,66
13,CB_2025_Jan_FB_3723_SO_V04_4x5_IMG_EN_New_C-NONE_Evergreen_CTA-SALE_Angle-W_M-NONE_VL-None_G-NONE_P-NONE_S-NONE,3723 - Notion Idea #92 MAN BOOBS || Enhancements: OFF || CBV1 || Batch 1 || 1C || 28/01/25w05 || Kostas,SHARE,"$2,063","140,180",2025-01-28,2025-02-21,24
14,CB_2024_Jan_FB_2764_RS_V04_9x16_VID_EN_Opti_C-SingleTesti_CTA-SALE_Pain-W_M-TRC_VL-45s_TR-None_G-F_P-OG_S-MOON_FB2263V04,EU (UK) || 2764 || Trinity Results Too Fast || 1C || 08/01/2025w02,VIDEO,"$1,987","73,920",2025-01-08,2025-03-27,78
15,CB_2025_Jan_FB_3723_SO_V18_4x5_IMG_EN_New_C-NONE_Evergreen_CTA-SALE_Angle-W_M-NONE_VL-None_G-NONE_P-NONE_S-NONE,3723 - Notion Idea #92 MAN BOOBS || Enhancements: OFF || CBV1 || Batch 4 || 1C || 28/01/25w05 || Kostas,SHARE,"$1,646","109,268",2025-01-28,2025-03-07,38
16,CB_2025_Jan_FB_3740_SO-DP_V03_4x5_IMG_EN_Opti_C-Headline_Evergreen_CTA-NONE_Angle-W_M-NONE_VL-None_G-NONE_P-OG_S-NONE_3608V03,ðŸŒ¶ï¸ || US || ASC+ || ->CC141 || VIDEO Only || US+CA || 0% EXISTING CAP || 7C || 07/08.24  Ad set,SHARE,"$1,601","105,262",2025-02-04,2025-03-03,27
17,CB_2024_Aug_FB_3097_VK-DP_V03_9x16_VID_EN_Opti_C-Benefits_CTA-SMR_Pain-W-B_M-MIX_VL-45s_TR-None_G-MF_P-OG_S-WHAT_FB2516V13,CB || US || Funnel A: React || 7DC || 04/02/2025,VIDEO,"$1,430","51,517",2025-02-05,2025-02-17,12
18,CB_2024_Jan_FB_2764_RS_V04_9x16_VID_EN_Opti_C-SingleTesti_CTA-SALE_Pain-W_M-TRC_VL-45s_TR-None_G-F_P-OG_S-MOON_FB2263V04_Page_Personal_Coach,AU || Page: Branded & 3rd Party || 2764 || Trinity Results Too Fast || 1C || 10/01/2025w02,VIDEO,"$1,368","32,255",2025-01-10,2025-03-27,76
19,CB_2024_Aug_FB_3097_VK-DP_V03_9x16_VID_EN_Opti_C-Benefits_CTA-SMR_Pain-W-B_M-MIX_VL-45s_TR-None_G-MF_P-OG_S-WHAT_FB2516V13,CB || US || Funnel B: Shopify || 7DC || 04/02/2025,VIDEO,"$1,269","39,968",2025-02-05,2025-02-17,12
20,CB_2025_Jan_FB_3072_V01_4x5_IMG_EN_New_C-Headline_Seasonal_CTA-None_Angle-W_M-NONE_VL-None_G-NONE_P-OG_S-NONE,AU || Fixed || 3072 EU adaptations || 1C || 20/01/2025w04,SHARE,"$1,210","35,113",2025-01-22,2025-02-14,23
21,CB_2025_Jan_FB_3736_LZ-VU_V01_4x5_IMG_EN_Opti_C-NegativeMark_Evergreen_CTA-NONE_Angle-Cort_M-NONE_VL-None_G-NONE_P-NONE_S-NONE_FB3251V01,3750 - bioma ripoff march soft version || Enhancements: OFF || CBV1 || Batch 1 || 1C || 24/01/25w04 || Kostas,SHARE,"$1,204","33,243",2025-02-04,2025-02-18,14
22,CB_2025_Jan_FB_3736_LZ-VU_V01_4x5_IMG_EN_Opti_C-NegativeMark_Evergreen_CTA-NONE_Angle-Cort_M-NONE_VL-None_G-NONE_P-NONE_S-NONE_FB3251V01,CBV2 || US || Manual Bid: ROAS GOAL: 0.9 -> 1.00 || 7DC || 22/01/2025,SHARE,"$1,188","37,011",2025-01-22,2025-02-14,23
23,CB_2025_Jan_FB_3779_VK-DP_V02_1x1_VID_EN_Opti_C-BulletPoints_Evergreen_CTA-70_Angle-W-B-C_M-NONE_VL-None_G-F_P-OG_S-NEW_FB3705V02,3779 - opti 3705 || Enhancements: OFF || CBV1 || Batch 1 || 1C || 04/02/25w06 || Kostas,SHARE,"$1,154","62,180",2025-02-04,2025-03-20,44
24,CB_2024_Sep_FB_3175_DA-KB_V03_1x1_IMG_EN_New_C-ADVRT_Evergreen_CTA-NONE_Angle-W_M-NONE_VL-None_G-NONE_P-CBV2_S-NONE_blog_colonbroomvsmammoth_cv_en,CBV2 || Advantage+ || Advertorial || Higher pricing || US || 0% EXISTING CAP || BROAD || 7C || 20/01/25  Campaign Ad set,SHARE,"$1,095","41,378",2025-01-20,2025-03-27,66
25,CB_2023_Jul_FB_2284_DA_V05_9x16_VID_EN_Opti_C-Sale_CTA-SMR_Pain-W_M-JANW_VL-30s_TR-None_G-M_P-None_S-WHAT_FB2103V02,ðŸŒ¶ï¸ || US || ASC+ || ->CC141 || VIDEO Only || US+CA || 0% EXISTING CAP || 7C || 07/08.24  Ad set,VIDEO,"$1,000","41,455",2024-08-07,2025-03-27,232
26,CB_2024_Nov_FB_3264_LZ_V29_4x5_VID_EN_Opti_C-NegativeMark_Sale_CTA-BF_Angle-W-B_M-LRNS_VL-30s_G-M_P-OG_S-NONE,ðŸŒ¶ï¸ || US || ASC+ || ->CC141 || VIDEO Only || US+CA || 0% EXISTING CAP || 7C || 07/08.24  Ad set,VIDEO,$973,"43,940",2024-12-04,2025-03-27,113
27,CB_2024_Aug_FB_3090_DT-DP_V02_9x16_VID_EN_Opti_C-MakingOf_CTA-CTA_Pain-W-B-C_M-POW_VL-45s_TR-None_G-M_P-OG_S-Moon_FB3029V04,ðŸŒ¶ï¸ || US || ASC+ || ->CC141 || VIDEO Only || US+CA || 0% EXISTING CAP || 7C || 07/08.24  Ad set,VIDEO,$925,"36,958",2025-01-17,2025-03-03,45
28,CB_2024_Aug_FB_3097_VK-DP_V03_9x16_VID_EN_Opti_C-Benefits_CTA-SMR_Pain-W-B_M-MIX_VL-45s_TR-None_G-MF_P-OG_S-WHAT_FB2516V13,ðŸŒ¶ï¸ || US || ASC+ || ->CC141 || VIDEO Only || US+CA || 0% EXISTING CAP || 7C || 07/08.24  Ad set,VIDEO,$921,"43,018",2024-09-04,2025-03-27,204
29,CB_2023_Aug_FB_2295_MB_V01_1x1_VID_EN_Opti_C-GIF_CTA-CTA_Pain-W-B_M-None_VL-10s_TR-None_G-None_P-None_S-None,CA || COST CAP 92->93 || 7C || 10/05/24 || V1,VIDEO,$890,"43,840",2024-05-10,2025-02-27,293
30,CB_2023_Jul_FB_2217_IB_V04_9x16_VID_EN_Opti_C-Pointing_CTA-SMR_Pain-W-B_M-TRC_VL-30s_TR-None_G-F_P-None_S-FRIGGA - Copy,CB || US || Funnel B: Shopify || 7DC || 04/02/2025,VIDEO,$856,"23,795",2025-02-05,2025-02-17,12
31,CB_2023_May_FB_2263_MB_V04_9x16_VID_EN_New_C-Sale_CTA-SMR_Pain-W_M-JOG_VL-45s_TR-None_G-M-F_P-None_S-Moon,ðŸŒ¶ï¸ || US || ASC+ || ->CC141 || VIDEO Only || US+CA || 0% EXISTING CAP || 7C || 07/08.24  Ad set,VIDEO,$854,"25,846",2024-08-07,2025-03-27,232
32,CB_2025_Jan_FB_3740_SO-DP_V03_4x5_IMG_EN_Opti_C-Headline_Evergreen_CTA-NONE_Angle-W_M-NONE_VL-None_G-NONE_P-OG_S-NONE_3608V03,3745 - 3661 Methane Balloon OPTI || Enhancements: OFF || CBV1 || Batch 1 || 1C || 30/01/25w05 || Kostas,SHARE,$848,"43,909",2025-01-30,2025-02-13,14
33,CB_2023_Jul_FB_2217_IB_V04_9x16_VID_EN_Opti_C-Pointing_CTA-SMR_Pain-W-B_M-TRC_VL-30s_TR-None_G-F_P-None_S-FRIGGA - Copy,CB || US || Funnel A: React || 7DC || 04/02/2025,VIDEO,$832,"23,305",2025-02-05,2025-02-17,12
34,CB_2025_Jan_FB_3746_CHUB-AA_V06_4x5_IMG_EN_Opti_C-NONE_CTA-NONE_Angle-C_M-NONE_VL-None_TR-None_G-NONE_P-NONE_S-NONE,3746 â€“ 3660 G-nugget OPTI v3 || Enhancements: OFF || CBV1 || Batch 2 || 1C || 30/01/25w05 || Kostas,SHARE,$814,"41,187",2025-01-30,2025-02-14,15
35,CB_2025_Jan_FB_3723_SO_V07_4x5_IMG_EN_New_C-NONE_Evergreen_CTA-SALE_Angle-W_M-NONE_VL-None_G-NONE_P-NONE_S-NONE,3723 - Notion Idea #92 MAN BOOBS || Enhancements: OFF || CBV1 || Batch 2 || 1C || 28/01/25w05 || Kostas,SHARE,$790,"57,768",2025-01-28,2025-02-13,16
36,CB_2025_Jan_FB_3738_SO-DP_V03_4x5_IMG_EN_Opti_C-NONE_Evergreen_CTA-SALE_Angle-W_M-NONE_VL-None_G-NONE_P-NONE_S-NONE3665V01,3738 - 3665_V01 OPTI || Enhancements: OFF || CBV1 || Batch 1 || 1C || 29/01/25w05 || Kostas,SHARE,$740,"44,989",2025-01-29,2025-02-22,24
37,CB_2025_Jan_FB_3747_CHUB-AA_V03_9x16_IMG_EN_Opti_C-NONE_CTA-NONE_Angle-Sale_M-NONE_VL-None_TR-None_G-NONE_P-OG_S-NONE,3747 Clean Sale [HB winner ITR] CHUB || Enhancements: OFF || CBV1 || Batch Ä… || 1C || 02/02/25w06 || Kostas,SHARE,$699,"27,550",2025-02-02,2025-03-27,53
38,CB_2025_Jan_FB_3718_CHUB_V05_4x5_IMG_EN_Opti_C-NONE_CTA-NONE_Angle-C_M-NONE_VL-None_TR-None_G-M_P-OG_S-NONE,3718 - Looking 15 people OPTI || Enhancements: OFF || CBV1 || Batch 2 || 1C || 29/01/25w05 || Kostas,SHARE,$695,"44,746",2025-01-29,2025-02-20,22
39,Soc. Media Post: even hot people have IBS problemsâ€¦ ID 1551762622434409,ðŸŒ¶ï¸ || US || ASC+ || ->CC141 || VIDEO Only || US+CA || 0% EXISTING CAP || 7C || 07/08.24  Ad set,VIDEO,$692,"51,119",2025-02-12,2025-02-13,1
40,CB_2025_Jan_FB_3766_SO_V01_4x5_IMG_EN_Opti_C-Headline_Evergreen_CTA-NONE_Angle-W-B-C_M-NONE_VL-None_G-NONE_P-NONE_S-NONE_3700V08,3766 - 3700 copy opti || Enhancements: OFF || CBV1 || Batch 1 || 1C || 03/02/25w06 || Kostas,SHARE,$683,"41,260",2025-02-04,2025-02-22,18
41,CB_2024_Feb_FB_2814_MB-DP_V05_1x1_IMG_EN_New_C-WeightLoss_CTA-None_Pain-W-B-C_M-NONE_VL-None_TR-None_G-NONE_P-V2_S-NONE,EU (UK) || clinically proven opti || 1C || 23/01/2025w04,SHARE,$682,"36,669",2025-01-23,2025-03-10,46
42,CB_2024_Dec_FB_3619_VK-JT_V02_4x5_VID_EN_New_C-BulletPoints_Sale_CTA-NY_Angle-W-B-C_M-NONE_VL-None_G-NONE_P-OG_S-NONE - Copy,CB || US || Funnel B: Shopify || 7DC || 04/02/2025,SHARE,$664,"28,469",2025-02-05,2025-02-17,12
43,CB_2025_Jan_FB_3738_SO-DP_V04_4x5_IMG_EN_Opti_C-NONE_Evergreen_CTA-SALE_Angle-W_M-NONE_VL-None_G-NONE_P-NONE_S-NONE3665V01,3738 - 3665_V01 OPTI || Enhancements: OFF || CBV1 || Batch 1 || 1C || 29/01/25w05 || Kostas,SHARE,$658,"40,807",2025-01-29,2025-02-22,24
44,CB_2024_Nov_FB_3336_CH_V17_1x1_IMG_EN_Opti_C-Headline_CTA-NONE_Angle-C_P-NONE,3336 Creative Hub â€“ Golden nuggets V1 - Opti [Not tested] || Enhancements: OFF || CBV1 || Batch 1 || 1C || 11/02/25w07 || Kostas,SHARE,$634,"43,079",2025-02-11,2025-02-21,10
45,CB_2022_Mar3_FB_713_IK_V04_1x1_IMG_EN_Opti_C-WrittenTesti_HE-98_A-ExtremeBodyVisualization_HK-bodypart_Pain-W_CLR-PURPLE_BG-IMAGE_ME-MIX_MA-YOUNG,US || Manual Bid || BFCM || ROAS GOAL: 1.4 || 1C || 15/11/24,SHARE,$632,"24,726",2024-11-15,2025-02-27,104
46,CB_2025_Jan_FB_3742_SO-DP-KB_V06_4x5_IMG_EN_Opti_C-NONE_Evergreen_CTA-SALE_Angle-W_M-NONE_VL-None_G-NONE_P-CBV2_S-NONE3665V01,3742 -  3665_V01 OPTI for PREMIUM 2 || Batch 2 || 1C || 31/01/2025w05,SHARE,$632,"38,582",2025-01-31,2025-02-18,18
47,CB_2025_Jan_FB_3740_VK-DP_V04_4x5_IMG_EN_Opti_C-Headline_Evergreen_CTA-NONE_Angle-W_M-NONE_VL-None_G-NONE_P-OG_S-NONE_FB3723V07,3797 - Man boobs-dad bod angle_IMG CB V1 - VK || Enhancements: OFF || CBV1 || Batch 1 || 7DC || 11/02/25w07 || Kostas,SHARE,$629,"31,757",2025-02-11,2025-02-17,6
48,CB_2025_Feb_FB_3792_SO-RP_V06_1x1_IMG_EN_Opti_C-NegativeMark_Sale_CTA-Vday_Angle-Cort_M-NONE_VL-None_G-NONE_P-NONE_S-NONE_FB3251V02,3792 - 3072 Valentines opti IMG || Enhancements: OFF || CBV1 || Batch 2 || 1C || 09/02/25w07 || Kostas,SHARE,$611,"25,568",2025-02-09,2025-02-17,8
49,CB_2024_Feb_FB_2814_MB-DP_V07_1x1_IMG_EN_New_C-WeightLoss_CTA-CTA_Pain-W-B-C_M-NONE_VL-None_TR-None_G-F_P-V2_S-NONE_2410V06,AU || clinically proven opti || 1C || 23/01/2025w04 || 1C || 20/01/2025w04,SHARE,$608,"20,515",2025-01-23,2025-02-12,20
50,CB_2023_Jul_FB_2217_IB_V04_9x16_VID_EN_Opti_C-Pointing_CTA-SMR_Pain-W-B_M-TRC_VL-30s_TR-None_G-F_P-None_S-FRIGGA,US || Manual Bid || BFCM || COST CAP 91 || 1C || 15/11/24,VIDEO,$608,"21,890",2024-11-15,2025-02-27,104
51,CB_2025_Jan_FB_3742_SO-DP-KB_V06_4x5_IMG_EN_Opti_C-NONE_Evergreen_CTA-SALE_Angle-W_M-NONE_VL-None_G-NONE_P-CBV2_S-NONE3665V01,CBV2 || US || Manual Bid: ROAS GOAL: 1.00 -> 1.1 || 7DC || 22/01/2025,SHARE,$608,"25,280",2025-02-11,2025-03-27,44
52,CB_2025_Feb_FB_3817_SO_V01_4x5_IMG_EN_Opti_C-NONE_Evergreen_CTA-SALE_Angle-W_M-NONE_VL-None_G-NONE_P-NONE_S-NONE_FB3723V07,CBV2 || AU || ðŸ’° Advantage+ || US || BROAD || 7C || Existing_customer_5% || 19/12/24 Ad set,SHARE,$581,"35,779",2025-02-14,2025-03-27,41
53,CB_2025_Jan_FB_3777_CHUB-KZ_V03_4x5_IMG_EN_Opti_C-NONE_CTA-NONE_Angle-C_M-NONE_VL-None_TR-None_G-NONE_P-NONE_S-NONE,3777 - 3696 Opti || Enhancements: OFF || CBV1 || Batch 1 || 1C || 11/02/25w07 || Kostas,SHARE,$571,"32,854",2025-02-11,2025-02-21,10
54,CB_2025_Jan_FB_3786_LZ_V01_1x1_IMG_EN_New_C-Educational_Evergreen_CTA-SALE_Angle-GH_M-NONE_VL-None_G-NONE_P-OG_S-NONE,3786 - #92 Notion idea gamers' diet || Enhancements: OFF || CBV1 || Batch 1 || 7C || 09/02/25w07 || Kostas,SHARE,$561,"26,092",2025-02-09,2025-02-17,8
55,CB_2025_Feb_FB_3799_SO-KB_V03_1x1_IMG_EN_New_C-A-Compare_Evergreen_CTA-NONE_Angle-W_M-NONE_VL-None_G-NONE_P-OG_S-NONE,3799 - Don_t change your habits || Enhancements: OFF || CBV1 || Batch 1 || 7DC || 12/02/25w07 || Kostas,SHARE,$547,"23,376",2025-02-12,2025-02-18,6
56,CB_2025_Jan_FB_3736_LZ-VU_V01_4x5_IMG_EN_Opti_C-NegativeMark_Evergreen_CTA-NONE_Angle-Cort_M-NONE_VL-None_G-NONE_P-NONE_S-NONE_FB3251V01,CBV2 || US || Manual Bid: ROAS GOAL: 1.00 -> 1.1 || 7DC || 22/01/2025,SHARE,$545,"16,519",2025-01-22,2025-02-14,23
57,CB_2023_May_FB_2263_MB_V04_9x16_VID_EN_New_C-Sale_CTA-SMR_Pain-W_M-JOG_VL-45s_TR-None_G-M-F_P-None_S-Moon,CBV2 || AU || ðŸ’° Advantage+ || US || BROAD || 7C || Existing_customer_5% || 19/12/24 Ad set,VIDEO,$541,"14,661",2024-12-19,2025-03-27,98
58,CB_2025_Jan_FB_3718_CHUB_V05_4x5_IMG_EN_Opti_C-NONE_CTA-NONE_Angle-C_M-NONE_VL-None_TR-None_G-M_P-OG_S-NONE,3718_CHUB || Batch 1 || 7DC || 12/02/2025w07,SHARE,$541,"29,137",2025-02-12,2025-02-20,8
59,CB_2025_Feb_FB_3817_SO_V01_4x5_IMG_EN_Opti_C-NONE_Evergreen_CTA-SALE_Angle-W_M-NONE_VL-None_G-NONE_P-NONE_S-NONE_FB3723V07,3817 - Opti Colonbroom premium bottle FB3723V07 || Batch 1 || 7DC || 12/02/2025w07,SHARE,$540,"44,575",2025-02-12,2025-02-20,8
60,CB_2025_Feb_FB_3817_SO_V01_4x5_IMG_EN_Opti_C-NONE_Evergreen_CTA-SALE_Angle-W_M-NONE_VL-None_G-NONE_P-NONE_S-NONE_FB3723V07,3817 - Opti Colonbroom premium bottle FB3723V07|| 7DC || 12/02/2025w07,SHARE,$536,"42,909",2025-02-12,2025-02-20,8
61,CB_2025_Jan_FB_3718_CHUB_V05_4x5_IMG_EN_Opti_C-NONE_CTA-NONE_Angle-C_M-NONE_VL-None_TR-None_G-M_P-OG_S-NONE,3718_CHUB || Batch 1 || 7DC || 12/02/2025w07,SHARE,$535,"34,819",2025-02-12,2025-02-25,13
62,CB_2024_Dec_FB_3619_VK-JT_V02_4x5_VID_EN_New_C-BulletPoints_Sale_CTA-NY_Angle-W-B-C_M-NONE_VL-None_G-NONE_P-OG_S-NONE - Copy,CB || US || Funnel A: React || 7DC || 04/02/2025,SHARE,$529,"22,667",2025-02-05,2025-02-17,12
63,CB_2025_Feb_FB_3806_SO-KB_V03_1x1_IMG_EN_New_C-A-Compare_Evergreen_CTA-NONE_Angle-W_M-NONE_VL-None_G-NONE_P-OG_S-NONE,"3806 - Brief Results, not resolutions || Enhancements: OFF || CBV1 || Batch 1 || 7DC || 12/02/25w07 || Kostas",SHARE,$523,"22,193",2025-02-12,2025-02-18,6
64,CB_2023_Jul_FB_2226_MB_V04_9x16_VID_EN_Opti_C-Testim_CTA-SMR_Pain-W_M-MIX_VL-30s_TR-None_G-F_P-None_S-Starry,ðŸŒ¶ï¸ || US || ASC+ || ->CC141 || VIDEO Only || US+CA || 0% EXISTING CAP || 7C || 07/08.24  Ad set,VIDEO,$520,"16,584",2024-10-28,2025-03-27,150
65,CB_2025_Jan_FB_3741_LZ-JG_V01_4x5_IMG_EN_Opti_C-Headline_Evergreen_CTA-NONE_Angle-W_M-NONE_VL-None_G-NONE_P-CBV2_S-NONE_FB3357V01,AU || 3741 - V2 dom perignon 2 || 1C || 29/01/2025w05,SHARE,$507,"23,818",2025-01-30,2025-02-20,21
66,CB_2025_Feb_FB_3809_LZ-JT_V03_1x1_IMG_EN_New_C-Educational_Evergreen_CTA-NONE_Angle-Cort_M-NONE_VL-None_G-NONE_P-NONE_S-NONE,3809 - 30 day detox RED 40 LBS || Enhancements: OFF || CBV1 || Batch 1 || 7DC || 12/02/25w07 || Kostas,SHARE,$499,"22,133",2025-02-12,2025-02-17,5
67,CB_2025_Feb_FB_3801_SO-KB_V04_1x1_IMG_EN_New_C-A-Compare_Evergreen_CTA-NONE_Angle-W_M-NONE_VL-None_G-NONE_P-OG_S-NONE,3801 - America_s favorite meal ads || Enhancements: OFF || CBV1 || Batch 1 || 7DC || 12/02/25w07 || Kostas,SHARE,$495,"26,448",2025-02-12,2025-02-17,5
68,CB_2023_Jul_FB_2217_IB_V04_9x16_VID_EN_Opti_C-Pointing_CTA-SMR_Pain-W-B_M-TRC_VL-30s_TR-None_G-F_P-None_S-FRIGGA,CBV2 || AU || ðŸ’° Advantage+ || US || BROAD || 7C || Existing_customer_5% || 19/12/24 Ad set,VIDEO,$490,"13,920",2024-12-19,2025-03-24,95
69,CB_2024_Jan_FB_2784_RS_V02_9x16_VID_EN_Opti_C-Pointing_CTA-SALE_Pain-W_M-JOG_VL-30s_TR-None_G-F_P-OG_S-OLLIE_FB2181V01,CBV2 || EU (UK) || ðŸ’° Advantage+ || US || BROAD || 7C || Existing_customer_5% || 15/12/24 Ad set,VIDEO,$488,"17,338",2025-01-09,2025-03-27,77
70,CB_2025_Feb_FB_3793_VK-DP_V01_1x1_VID_EN_Opti_C-BulletPoints_Evergreen_CTA-70_Angle-W-B-C_M-NONE_VL-None_G-F_P-OG_S-NEW_FB3705V02,3793 -  3705 test opti || Enhancements: OFF || CBV1 || Batch 1 || 1C || 11/02/25w07 || Kostas,SHARE,$482,"23,789",2025-02-11,2025-02-28,17
71,CB_2025_Feb_FB_3812_SO_V03_4x5_IMG_EN_Opti_C-NONE_Evergreen_CTA-SALE_Angle-W_M-NONE_VL-None_G-NONE_P-NONE_S-NONE_FB3723V07,3812 - 3723 Man Boobs Opti || Enhancements: OFF || CBV1 || Batch 1 || 1C || 11/02/25w07 || Kostas,SHARE,$481,"33,744",2025-02-11,2025-02-26,15
72,CB_2025_Feb_FB_3817_SO_V01_4x5_IMG_EN_Opti_C-NONE_Evergreen_CTA-SALE_Angle-W_M-NONE_VL-None_G-NONE_P-NONE_S-NONE_FB3723V07,CBV2 || EU (UK) || ðŸ’° Advantage+ || US || BROAD || 7C || Existing_customer_5% || 15/12/24 Ad set,SHARE,$479,"29,874",2025-02-14,2025-03-27,41
73,CB_2023_Dec_FB_2712_RS-DP_V02_1x1_VID_EN_Opti_C-WrittenTesti_CTA-SALE_Pain-W-B-C_M-NONE_VL-None_TR-None_G-NONE_P-V2_S-NONE_FB2227V08,CBV2 || EU (UK) || ðŸ’° Advantage+ || US || BROAD || 7C || Existing_customer_5% || 15/12/24 Ad set,SHARE,$471,"22,069",2024-12-15,2025-03-27,102
74,CB_2025_Feb_FB_3780_DT-DP_V04_9x16_VID_EN_Opti_C-MakingOf_Sale_CTA-70_Angle-W-B_M-CRAZY_VL-45s_G-M_P-OG_S-NEW_FB3264V31,3780 - Crazy Trainer Hookerization || Enhancements: OFF || CBV1 || Batch 1 || 1C || 09/02/25w07 || Kostas,SHARE,$460,"25,261",2025-02-09,2025-02-15,6
75,CB_2025_Jan_FB_3656_JT_V02_4x5_IMG_EN_New_C-Headline_Seasonal_CTA-70_Angle-W_M-NONE_VL-None_G-NONE_P-OG_S-NONE,ðŸŒ¶ï¸ || US || ASC+ || ->CC141 || VIDEO Only || US+CA || 0% EXISTING CAP || 7C || 07/08.24  Ad set,SHARE,$459,"23,736",2025-01-13,2025-03-04,50
76,CB_2023_Dec_FB_2696_RS_V03_9x16_VID_EN_Opti_C-Sale_CTA-NY65_Pain-W-B_M-JANW_VL-30s_TR-None_G-M_P-OG_S-WHAT_FB2284V05,CBV2 || AU || ðŸ’° Advantage+ || US || BROAD || 7C || Existing_customer_5% || 19/12/24 Ad set,VIDEO,$458,"16,683",2025-01-13,2025-03-27,73
77,CB_2025_Feb_FB_3804_LZ-KB_V01_1x1_VID_EN_New_C-BulletPoints_Evergreen_CTA-NONE_Angle-W-B_M-NONE_VL-None_G-NONE_P-NONE_S-NONE,3804 - fit back into your jeans || Enhancements: OFF || CBV1 || Batch 1 || 7DC || 12/02/25w07 || Kostas,SHARE,$456,"14,636",2025-02-12,2025-02-17,5
78,CB_2025_Feb_FB_3801_SO-KB_V11_1x1_IMG_EN_New_C-A-Compare_Evergreen_CTA-NONE_Angle-W_M-NONE_VL-None_G-NONE_P-OG_S-NONE,3801 - America_s favorite meal ads || Enhancements: OFF || CBV1 || Batch 3 || 7DC || 12/02/25w07 || Kostas,SHARE,$455,"18,764",2025-02-12,2025-02-18,6
79,CB_2025_Feb_FB_3799_SO-KB_V07_1x1_IMG_EN_New_C-A-Compare_Evergreen_CTA-NONE_Angle-W_M-NONE_VL-None_G-NONE_P-OG_S-NONE,3799 - Don_t change your habits || Enhancements: OFF || CBV1 || Batch 2 || 7DC || 12/02/25w07 || Kostas,SHARE,$454,"13,910",2025-02-12,2025-02-21,9
80,CB_2022_Nov_FB_1218_RS_V15_9x16_IMG_EN_Opti_C-Sale_CTA-BLACK_Pain-W_M-NONE_VL-None FB1671V08,US || Manual Bid || BFCM || ROAS GOAL: 1.4 || 1C || 15/11/24,SHARE,$449,"11,924",2024-11-15,2025-02-27,104
81,CB_2024_Aug_FB_3090_DT-DP_V02_9x16_VID_EN_Opti_C-MakingOf_CTA-CTA_Pain-W-B-C_M-POW_VL-45s_TR-None_G-M_P-OG_S-Moon_FB3029V04,CBV2 || EU (UK) || ðŸ’° Advantage+ || US || BROAD || 7C || Existing_customer_5% || 15/12/24 Ad set,SHARE,$448,"23,454",2024-12-19,2025-03-27,98
82,CB_2025_Feb_FB_3806_SO-KB_V07_1x1_IMG_EN_New_C-A-Compare_Evergreen_CTA-NONE_Angle-W_M-NONE_VL-None_G-NONE_P-OG_S-NONE,"3806 - Brief Results, not resolutions || Enhancements: OFF || CBV1 || Batch 2 || 7DC || 12/02/25w07 || Kostas",SHARE,$447,"20,053",2025-02-12,2025-02-17,5
83,CB_2025_Feb_FB_3792_SO-RP_V01_1x1_IMG_EN_Opti_C-NegativeMark_Sale_CTA-Vday_Angle-Cort_M-NONE_VL-None_G-NONE_P-NONE_S-NONE_FB3251V02,3792 - 3072 Valentines opti IMG || Enhancements: OFF || CBV1 || Batch 1 || 1C || 09/02/25w07 || Kostas,SHARE,$444,"19,179",2025-02-09,2025-02-16,7
84,CB_2025_Feb_FB_3796_LZ-DP_V03_9x16_VID_EN_New_C-Testimonial_Evergreen_CTA-SALE_Angle-W-B_M-TIFF_VL-45s_G-F_P-OG_S-NEW.mp4,3796 - CB ads everywhere || Enhancements: OFF || CBV1 || Batch 1 || 1C || 11/02/25w07 || Kostas,SHARE,$435,"20,403",2025-02-11,2025-02-17,6
85,CB_2025_Feb_FB_3782_CHUB_V04_9x16_VID_EN_New_C-NONE_CTA-NONE_Angle-None_M-NONE_VL-None_TR-None_G-NONE_P-NONE_S-NONE,Relaunch - 3782 - Political weight loss journey CHUB || Enhancements: OFF || CBV1 || Batch 2 || 1C || 11/02/25w07 || Kostas,VIDEO,$434,"21,586",2025-02-10,2025-02-17,7
86,CB_2023_Dec_FB_2712_RS-DP_V02_1x1_VID_EN_Opti_C-WrittenTesti_CTA-SALE_Pain-W-B-C_M-NONE_VL-None_TR-None_G-NONE_P-V2_S-NONE_FB2227V08,CBV2 || AU || ðŸ’° Advantage+ || US || BROAD || 7C || Existing_customer_5% || 19/12/24 Ad set,SHARE,$432,"15,505",2024-12-19,2025-03-27,98
87,CB_2025_Jan_FB_3723_SO_V07_4x5_IMG_EN_New_C-NONE_Evergreen_CTA-SALE_Angle-W_M-NONE_VL-None_G-NONE_P-NONE_S-NONE,CBV2 || US || Manual Bid: ROAS GOAL: 0.9 -> 1.00 || 7DC || 22/01/2025,SHARE,$427,"26,982",2025-02-11,2025-03-27,44
88,CB_2025_Jan_FB_3791_CHUB_V01_9x16_VID_EN_New_C-NONE_CTA-NONE_Angle-W_M-NONE_VL-None_TR-None_G-NONE_P-NONE_S-NONE,Relaunch -  3791 - TrumpTweets CHUB || Enhancements: OFF || CBV1 || Batch 1 || 1C || 11/02/25w07 || Kostas,VIDEO,$427,"23,898",2025-02-10,2025-02-14,4
89,CB_2025_Feb_FB_3793_VK-DP_V06_1x1_VID_EN_Opti_C-BulletPoints_Evergreen_CTA-70_Angle-W-B-C_M-NONE_VL-None_G-F_P-OG_S-NEW_FB3705V02,3793 -  3705 test opti || Enhancements: OFF || CBV1 || Batch 2 || 1C || 11/02/25w07 || Kostas,SHARE,$416,"21,195",2025-02-11,2025-02-17,6
90,CB_2025_Feb_FB_3784_SO-RP_V03_4x5_IMG_EN_Opti_C-Headline_Evergreen_CTA-NONE_Angle-W_M-NONE_VL-None_G-NONE_P-OG_S-NONE_FB3726V01,3784 - 3726 ad copy opti || Enhancements: OFF || CBV1 || Batch 1 || 1C || 09/02/25w07 || Kostas,SHARE,$414,"17,532",2025-02-09,2025-02-17,8
91,Dynamic_Creative_Statics_CA_Flow,WC || CA || DYNAMIC CREATIVE Static winners || ADV+ audience || 7C || 16.02.2025,SHARE,$412,"37,232",2025-02-16,2025-03-27,39
92,CB_2024_Sep_FB_3175_DA-KB_V01_1x1_IMG_EN_New_C-ADVRT_Evergreen_CTA-NONE_Angle-W_M-NONE_VL-None_G-NONE_P-CBV2_S-NONE_blog_colonbroomvsmammoth_cv_en,CBV2 || Advantage+ || Advertorial || Higher pricing || US || 0% EXISTING CAP || BROAD || 7C || 20/01/25  Campaign Ad set,SHARE,$404,"18,168",2025-01-20,2025-03-27,66
93,CB_2025_Jan_FB_3770_CHUB_V02_9x16_VID_EN_New_C-NONE_CTA-NONE_Angle-None_M-NONE_VL-None_TR-None_G-NONE_P-NONE_S-NONE,3770 - HM4Things CHUB || Enhancements: OFF || CBV1 || Batch 1 || 1C || 09/02/25w07 || Kostas,VIDEO,$397,"21,548",2025-02-09,2025-02-14,5
94,CB_2025_Feb_FB_3818_LZ-VU_V04_1x1_IMG_EN_Opti_C-Headline_Evergreen_CTA-NONE_Angle-Cort_M-NONE_VL-None_G-NONE_P-NONE_S-NONE_FB3251V01,3818 - It_s not cheap Months+holidays: April || Enhancements: OFF || CBV1 || Batch 1 || 7DC || 13/02/25w07 || Kostas,SHARE,$388,"12,218",2025-02-13,2025-02-28,15
95,CB_2025_Jan_FB_3662_CHUB_V01_1x1_IMG_EN_New_C-NONE_CTA-NONE_Angle-C_M-NONE_VL-None_TR-None_G-NONE_P-NONE_S-NONE.jpg,ðŸŒ¶ï¸ || US || ASC+ || ->CC141 || VIDEO Only || US+CA || 0% EXISTING CAP || 7C || 07/08.24  Ad set,SHARE,$384,"21,262",2025-01-13,2025-03-04,50
96,CB_2023_Jul_FB_2217_IB_V04_9x16_VID_EN_Opti_C-Pointing_CTA-SMR_Pain-W-B_M-TRC_VL-30s_TR-None_G-F_P-None_S-FRIGGA,CBV2 || EU (UK) || ðŸ’° Advantage+ || US || BROAD || 7C || Existing_customer_5% || 15/12/24 Ad set,VIDEO,$383,"19,520",2024-12-18,2025-03-27,99
97,CB_2025_Jan_FB_3723_SO_V10_4x5_IMG_EN_New_C-NONE_Evergreen_CTA-SALE_Angle-W_M-NONE_VL-None_G-NONE_P-NONE_S-NONE,3723 - Notion Idea #92 MAN BOOBS || Enhancements: OFF || CBV1 || Batch 2 || 1C || 28/01/25w05 || Kostas,SHARE,$369,"28,099",2025-01-28,2025-02-18,21
98,CB_2024_Dec_FB_3619_VK-JT_V02_4x5_VID_EN_New_C-BulletPoints_Sale_CTA-NY_Angle-W-B-C_M-NONE_VL-None_G-NONE_P-OG_S-NONE,ðŸŒ¶ï¸ || US || ASC+ || ->CC141 || VIDEO Only || US+CA || 0% EXISTING CAP || 7C || 07/08.24  Ad set,SHARE,$367,"23,686",2024-12-27,2025-03-27,90
99,CB_2025_Feb_FB_3812_SO_V08_4x5_IMG_EN_Opti_C-NONE_Evergreen_CTA-SALE_Angle-W_M-NONE_VL-None_G-NONE_P-NONE_S-NONE_FB3723V07,3812 - 3723 Man Boobs Opti || Enhancements: OFF || CBV1 || Batch 2 || 1C || 11/02/25w07 || Kostas,SHARE,$358,"26,832",2025-02-11,2025-02-21,10
100,CB_2023_May_FB_2103_MB_V02_9x16_VID_EN_Opti_C-Sale_CTA-SMR_Pain-W_M-JOG_VL-30s_TR-None_G-M-F_P-None_S-What,US || Manual Bid || BFCM || ROAS GOAL: 1.4 || 1C || 15/11/24,VIDEO,$357,"10,422",2024-11-15,2025-02-27,104
101,CB_2025_Jan_FB_3724_CHUB-AA_V02_4x5_IMG_EN_New_C-NONE_CTA-NONE_Angle-C_M-NONE_VL-None_TR-None_G-M_P-OG_S-NONE,3724 Get Regular CHUB || Enhancements: OFF || CBV1 || Batch 1 || 1C || 29/01/25w05 || Kostas,SHARE,$335,"16,574",2025-01-29,2025-02-13,15
102,CB_2025_Jan_FB_3687_DT_V04_4x5_VID_EN_Opti_C-MakingOf_Sale_CTA-VDAY_Angle-W-B-C_M-POW_VL-45s_G-M_P-OG_S-Moon_FB3090V02,3687 - Valentine_s Day Opti 3090 || Enhancements: OFF || CBV1 || Batch Ä… || 1C || 02/02/25w06 || Kostas,SHARE,$319,"15,018",2025-02-02,2025-02-19,17
103,CB_2025_Feb_FB_3812_SO_V07_4x5_IMG_EN_Opti_C-NONE_Evergreen_CTA-SALE_Angle-W_M-NONE_VL-None_G-NONE_P-NONE_S-NONE_FB3723V07,3812 - 3723 Man Boobs Opti || Enhancements: OFF || CBV1 || Batch 2 || 1C || 11/02/25w07 || Kostas,SHARE,$296,"21,587",2025-02-11,2025-02-21,10
104,CB_2025_Feb_FB_3812_SO_V12_4x5_IMG_EN_Opti_C-NONE_Evergreen_CTA-SALE_Angle-W_M-NONE_VL-None_G-NONE_P-NONE_S-NONE_FB3723V07,3812 - 3723 Man Boobs Opti || Enhancements: OFF || CBV1 || Batch 3 || 1C || 11/02/25w07 || Kostas,SHARE,$287,"18,097",2025-02-11,2025-02-22,11
105,CB_2025_Feb_FB_3796_LZ-DP_V07_9x16_VID_EN_New_C-Testimonial_Evergreen_CTA-SALE_Angle-W-B_M-MAG_VL-45s_G-F_P-OG_S-NEW,3796 - CB ads everywhere || Enhancements: OFF || CBV1 || Batch 2 || 1C || 11/02/25w07 || Kostas,VIDEO,$286,"11,355",2025-02-11,2025-02-16,5
106,CB_2025_Jan_FB_3742_SO-DP-KB_V05_4x5_IMG_EN_Opti_C-NONE_Evergreen_CTA-SALE_Angle-W_M-NONE_VL-None_G-NONE_P-CBV2_S-NONE3665V01,3742 -  3665_V01 OPTI for PREMIUM 2 || Batch 2 || 1C || 31/01/2025w05,SHARE,$284,"17,118",2025-01-31,2025-02-18,18
107,CB_2025_Jan_FB_3723_SO_V09_4x5_IMG_EN_New_C-NONE_Evergreen_CTA-SALE_Angle-W_M-NONE_VL-None_G-NONE_P-NONE_S-NONE,3723 - Notion Idea #92 MAN BOOBS || Enhancements: OFF || CBV1 || Batch 2 || 1C || 28/01/25w05 || Kostas,SHARE,$281,"23,477",2025-01-28,2025-02-18,21
108,CB_2025_Feb_FB_3807_DT-DP_V04_9x16_VID_EN_Opti_C-Pointing_Sale_CTA-70_Angle-W_M-TRC_VL-30s_G-F_P-OG_S-WHAT_FB3030V05,3807 - Green screen reaction test || Enhancements: OFF || CBV1 || Batch 2 || 7DC || 12/02/25w07 || Kostas,SHARE,$276,"11,341",2025-02-12,2025-02-17,5
109,CB_2023_Oct_FB_2516_VK_V13_9x16_VID_EN_Opti_C-Benefits_CTA-AUTUM_Pain-W-B_M-PASQ_VL-30s_TR-None_G-M_P-Plan_S-WHAT,ðŸŒ¶ï¸ || US || ASC+ || ->CC141 || VIDEO Only || US+CA || 0% EXISTING CAP || 7C || 07/08.24  Ad set,VIDEO,$269,"9,305",2024-12-19,2025-03-27,98
110,CB_2025_Jan_FB_3687_DT_V02_4x5_VID_EN_Opti_C-MakingOf_Sale_CTA-VDAY_Angle-W-B-C_M-POW_VL-45s_G-M_P-OG_S-Moon_FB3090V02,3687 - Valentine_s Day Opti 3090 || Enhancements: OFF || CBV1 || Batch Ä… || 1C || 02/02/25w06 || Kostas,SHARE,$256,"11,421",2025-02-02,2025-02-19,17
111,CB_2025_Feb_FB_3801_SO-KB_V08_1x1_IMG_EN_New_C-A-Compare_Evergreen_CTA-NONE_Angle-W_M-NONE_VL-None_G-NONE_P-OG_S-NONE,3801 - America_s favorite meal ads || Enhancements: OFF || CBV1 || Batch 2 || 7DC || 12/02/25w07 || Kostas,SHARE,$244,"9,575",2025-02-12,2025-02-17,5
112,CB_2025_Feb_FB_3801_SO-KB_V07_1x1_IMG_EN_New_C-A-Compare_Evergreen_CTA-NONE_Angle-W_M-NONE_VL-None_G-NONE_P-OG_S-NONE,3801 - America_s favorite meal ads || Enhancements: OFF || CBV1 || Batch 2 || 7DC || 12/02/25w07 || Kostas,SHARE,$244,"7,631",2025-02-12,2025-02-17,5
113,CB_2025_Feb_FB_3812_SO_V10_4x5_IMG_EN_Opti_C-NONE_Evergreen_CTA-SALE_Angle-W_M-NONE_VL-None_G-NONE_P-NONE_S-NONE_FB3723V07,3812 - 3723 Man Boobs Opti || Enhancements: OFF || CBV1 || Batch 3 || 1C || 11/02/25w07 || Kostas,SHARE,$244,"15,581",2025-02-11,2025-02-22,11
114,CB_2024_Dec_FB_3601_VK-DP_V09_4x5_VID_EN_Opti_C-Dance_CTA-NY_Pain-W-B_M-JOG_VL-30s_TR-None_G-F_P-OG_S-WHAT_FB3045V01,CBV2 || AU || ðŸ’° Advantage+ || US || BROAD || 7C || Existing_customer_5% || 19/12/24 Ad set,SHARE,$242,"8,396",2025-01-03,2025-03-27,83
115,CB_2025_Feb_FB_3784_SO-RP_V07_4x5_IMG_EN_Opti_C-Headline_Evergreen_CTA-NONE_Angle-W_M-NONE_VL-None_G-NONE_P-OG_S-NONE_FB3726V01,3784 - 3726 ad copy opti || Enhancements: OFF || CBV1 || Batch 2 || 1C || 09/02/25w07 || Kostas,SHARE,$237,"14,806",2025-02-09,2025-02-26,17
116,CB_2024_Jan_FB_2764_RS_V04_9x16_VID_EN_Opti_C-SingleTesti_CTA-SALE_Pain-W_M-TRC_VL-45s_TR-None_G-F_P-OG_S-MOON_FB2263V04_Page_Personal_Coach,CBV2 || AU || ðŸ’° Advantage+ || US || BROAD || 7C || Existing_customer_5% || 19/12/24 Ad set,VIDEO,$231,"4,616",2025-01-16,2025-03-27,70
117,CB_2025_Feb_FB_3807_DT-DP_V01_9x16_VID_EN_Opti_C-Pointing_Sale_CTA-70_Angle-W-B_M-TRC_VL-30s_G-F_P-OG_S-FRIGGA_FB2217V04,3807 - Green screen reaction test || Enhancements: OFF || CBV1 || Batch 2 || 7DC || 12/02/25w07 || Kostas,SHARE,$227,"9,754",2025-02-12,2025-02-17,5
118,CB_2025_Jan_FB_3773_CHUB_V01_9x16_VID_EN_New_C-NONE_CTA-NONE_Angle-None_M-NONE_VL-None_TR-None_G-NONE_P-NONE_S-NONE,3773 - MessageVideos || Enhancements: OFF || CBV1 || Batch 1 || 1C || 09/02/25w07 || Kostas,SHARE,$217,"8,034",2025-02-09,2025-02-14,5
119,CB_2024_Jul_FB_3043_VK-DP_V03_9x16_VID_EN_Opti_C-Dance_CTA-SMR_Pain-W-B_M-POW_VL-30s_TR-None_G-M_P-OG_S-WHAT_FB3030V01,ðŸŒ¶ï¸ || US || ASC+ || ->CC141 || VIDEO Only || US+CA || 0% EXISTING CAP || 7C || 07/08.24  Ad set,VIDEO,$212,"10,674",2024-08-27,2025-03-03,188
120,CB_2024_Nov_FB_3264_LZ_V31_4x5_VID_EN_Opti_C-MakingOf_Sale_CTA-BF_Angle-W-B_M-CRAZY_VL-45s_G-M_P-OG_S-NEW_FB3004V02,CBV2 || EU (UK) || ðŸ’° Advantage+ || US || BROAD || 7C || Existing_customer_5% || 15/12/24 Ad set,VIDEO,$210,"10,730",2024-12-19,2025-03-27,98
121,CB_2025_Feb_FB_3793_VK-DP_V07_1x1_VID_EN_Opti_C-BulletPoints_Evergreen_CTA-70_Angle-W-B-C_M-NONE_VL-None_G-F_P-OG_S-NEW_FB3705V02,3793 -  3705 test opti || Enhancements: OFF || CBV1 || Batch 2 || 1C || 11/02/25w07 || Kostas,SHARE,$206,"10,925",2025-02-11,2025-02-17,6
122,CB_2025_Feb_FB_3784_SO-RP_V06_4x5_IMG_EN_Opti_C-Headline_Evergreen_CTA-NONE_Angle-W_M-NONE_VL-None_G-NONE_P-OG_S-NONE_FB3726V01,3784 - 3726 ad copy opti || Enhancements: OFF || CBV1 || Batch 2 || 1C || 09/02/25w07 || Kostas,SHARE,$206,"13,585",2025-02-09,2025-02-26,17
123,CB_2025_Feb_FB_3782_CHUB_V06_9x16_VID_EN_New_C-NONE_CTA-NONE_Angle-None_M-NONE_VL-None_TR-None_G-NONE_P-NONE_S-NONE,Relaunch - 3782 - Political weight loss journey CHUB || Enhancements: OFF || CBV1 || Batch 2 || 1C || 11/02/25w07 || Kostas,VIDEO,$206,"7,867",2025-02-10,2025-02-17,7
124,CB_2025_Jan_FB_3742_SO-DP-KB_V04_4x5_IMG_EN_Opti_C-NONE_Evergreen_CTA-SALE_Angle-W_M-NONE_VL-None_G-NONE_P-CBV2_S-NONE3665V01,3742 -  3665_V01 OPTI for PREMIUM 2 || Batch 2 || 1C || 31/01/2025w05,SHARE,$203,"11,485",2025-01-31,2025-02-18,18
125,CB_2025_Feb_FB_3819_DT_V02_9x16_GIF_EN_Opti_C-NONE_Evergreen_CTA-None_Angle-W_M-NONE_VL-None_G-NONE_P-NONE_S-New_FB3723V04,3819 - #7 Goodbye Man boobs || Enhancements: OFF || CBV1 || Batch 1 || 7DC || 14/02/25w07 || Kostas,SHARE,$201,"9,700",2025-02-14,2025-02-22,8
126,CB_2025_Jan_FB_3741_LZ-JG_V02_4x5_IMG_EN_Opti_C-Headline_Evergreen_CTA-NONE_Angle-W_M-NONE_VL-None_G-NONE_P-CBV2_S-NONE_FB3357V01,AU || 3741 - V2 dom perignon 2 || 1C || 29/01/2025w05,SHARE,$191,"8,872",2025-01-30,2025-02-20,21
127,CB_2024_Feb_FB_2812_MB-RP_V07_9x16_VID_EN_Opti_C-Sale_CTA-C65_Pain-W_M-NONE_VL-30s_TR-None_G-MF_P-Plan_S-NEW_FB2601V04_1,ðŸŒ¶ï¸ || US || ASC+ || ->CC141 || VIDEO Only || US+CA || 0% EXISTING CAP || 7C || 07/08.24  Ad set,VIDEO,$181,"6,872",2025-02-02,2025-02-14,12
128,CB_2025_Jan_FB_3781_LZ-DP_V04_9x16_GIF_EN_Opti_C-Headline_Evergreen_CTA-NONE_Angle-W_M-NONE_VL-15s_G-NONE_P-OG_S-NEW_FB3608V03,3781 - Hypnosis GIF opti || Enhancements: OFF || CBV1 || Batch 1 || 1C || 04/02/25w06 || Kostas,SHARE,$179,"4,785",2025-02-04,2025-02-11,7
129,CB_2023_May_FB_2144_MB_V02_9x16_VID_EN_Opti_C-Sale_CTA-SMR_Pain-W_M-JOG_VL-30s_TR-None_G-M-F_P-None_S-What,CA || COST CAP 92->93 || 7C || 10/05/24 || V1,VIDEO,$173,"10,068",2024-05-10,2025-02-27,293
130,CB_2025_Feb_FB_3796_LZ-DP_V08_9x16_VID_EN_New_C-Testimonial_Evergreen_CTA-SALE_Angle-W-B_M-MAG_VL-45s_G-F_P-OG_S-NEW,3796 - CB ads everywhere || Enhancements: OFF || CBV1 || Batch 2 || 1C || 11/02/25w07 || Kostas,VIDEO,$173,"6,347",2025-02-11,2025-02-16,5
131,CB_2025_Jan_FB_3740_SO-DP_V01_4x5_IMG_EN_Opti_C-Headline_Evergreen_CTA-NONE_Angle-W_M-NONE_VL-None_G-NONE_P-OG_S-NONE_3608V03,3740 - 3608_v03 OPTI || Enhancements: OFF || CBV1 || Batch 1 || 1C || 29/01/25w05 || Kostas,SHARE,$167,"8,419",2025-01-29,2025-02-11,13
132,CB_2025_Feb_FB_3784_SO-RP_V08_4x5_IMG_EN_Opti_C-Headline_Evergreen_CTA-NONE_Angle-W_M-NONE_VL-None_G-NONE_P-OG_S-NONE_FB3726V01,3784 - 3726 ad copy opti || Enhancements: OFF || CBV1 || Batch 2 || 1C || 09/02/25w07 || Kostas,SHARE,$164,"10,951",2025-02-09,2025-02-12,3
133,CB_2025_Jan_FB_3773_CHUB_V02_9x16_VID_EN_New_C-NONE_CTA-NONE_Angle-None_M-NONE_VL-None_TR-None_G-NONE_P-NONE_S-NONE,3773 - MessageVideos || Enhancements: OFF || CBV1 || Batch 1 || 1C || 09/02/25w07 || Kostas,VIDEO,$162,"7,743",2025-02-09,2025-02-14,5
134,CB_2025_Jan_FB_3767_VK-DP_V06_9x16_VID_EN_New_C-BulletPoints_Evergreen_CTA-NONE_Angle-W-B-C_M-TRC_VL-15s_G-M_P-OG_S-NEW,3767 - Short video new idea CB V1 - DP || Enhancements: OFF || CBV1 || Batch 2 || 1C || 03/02/25w06 || Kostas,VIDEO,$158,"7,637",2025-02-04,2025-02-13,9
135,CB_2024_Feb_FB_2814_MB-DP_V07_1x1_IMG_EN_New_C-WeightLoss_CTA-CTA_Pain-W-B-C_M-NONE_VL-None_TR-None_G-F_P-V2_S-NONE_2410V06,EU (UK) || clinically proven opti || 1C || 23/01/2025w04,SHARE,$158,"5,636",2025-01-23,2025-03-10,46
136,CB_2025_Jan_FB_3767_VK-DP_V08_9x16_VID_EN_New_C-BulletPoints_Evergreen_CTA-NONE_Angle-W-B-C_M-TRC_VL-15s_G-M_P-OG_S-NEW,3767 - Short video new idea CB V1 - DP || Enhancements: OFF || CBV1 || Batch 2 || 1C || 03/02/25w06 || Kostas,VIDEO,$153,"7,442",2025-02-04,2025-02-13,9
137,CB_2025_Jan_FB_3746_CHUB-AA_V07_4x5_IMG_EN_Opti_C-NONE_CTA-NONE_Angle-C_M-NONE_VL-None_TR-None_G-NONE_P-NONE_S-NONE,3746 â€“ 3660 G-nugget OPTI v3 || Enhancements: OFF || CBV1 || Batch 2 || 1C || 30/01/25w05 || Kostas,SHARE,$150,"7,479",2025-01-30,2025-02-14,15
138,CB_2024_Nov_FB_3264_LZ_V31_4x5_VID_EN_Opti_C-MakingOf_Sale_CTA-BF_Angle-W-B_M-CRAZY_VL-45s_G-M_P-OG_S-NEW_FB3004V02,CBV2 || AU || ðŸ’° Advantage+ || US || BROAD || 7C || Existing_customer_5% || 19/12/24 Ad set,VIDEO,$148,"4,553",2024-12-19,2025-03-27,98
139,CB_2025_Feb_FB_3812_SO_V11_4x5_IMG_EN_Opti_C-NONE_Evergreen_CTA-SALE_Angle-W_M-NONE_VL-None_G-NONE_P-NONE_S-NONE_FB3723V07,3812 - 3723 Man Boobs Opti || Enhancements: OFF || CBV1 || Batch 3 || 1C || 11/02/25w07 || Kostas,SHARE,$147,"10,787",2025-02-11,2025-02-22,11
140,CB_2024_Sep_FB_3175_DA-KB_V02_1x1_IMG_EN_New_C-ADVRT_Evergreen_CTA-NONE_Angle-W_M-NONE_VL-None_G-NONE_P-CBV2_S-NONE_blog_colonbroomvsmammoth_cv_en,CBV2 || Advantage+ || Advertorial || Higher pricing || US || 0% EXISTING CAP || BROAD || 7C || 20/01/25  Campaign Ad set,SHARE,$144,"7,829",2025-01-20,2025-03-27,66
141,CB_2025_Jan_FB_3746_CHUB-AA_V05_4x5_IMG_EN_Opti_C-NONE_CTA-NONE_Angle-C_M-NONE_VL-None_TR-None_G-NONE_P-NONE_S-NONE,3746 â€“ 3660 G-nugget OPTI v3 || Enhancements: OFF || CBV1 || Batch 2 || 1C || 30/01/25w05 || Kostas,SHARE,$140,"8,296",2025-01-30,2025-02-14,15
142,CB_2025_Feb_FB_3796_LZ-DP_V01_9x16_VID_EN_New_C-Testimonial_Evergreen_CTA-SALE_Angle-W-B_M-TIFF_VL-45s_G-F_P-OG_S-NEW,3796 - CB ads everywhere || Enhancements: OFF || CBV1 || Batch 1 || 1C || 11/02/25w07 || Kostas,SHARE,$139,"6,822",2025-02-11,2025-02-17,6
143,CB_2025_Jan_FB_3759_VK_V05_4x5_VID_EN_New_C-BulletPoints_Evergreen_CTA-NONE_Angle-W-B-C_M-NONE_VL-15s_G-M_P-OG_S-NEW,3761 - testis to to video 3722 || Enhancements: OFF || CBV1 || Batch 2 || 1C || 03/02/25w06 || Kostas,SHARE,$139,"7,236",2025-02-04,2025-02-11,7
144,CB_2024_Jan_FB_2764_RS_V04_9x16_VID_EN_Opti_C-SingleTesti_CTA-SALE_Pain-W_M-TRC_VL-45s_TR-None_G-F_P-OG_S-MOON_FB2263V04,CBV2 || EU (UK) || ðŸ’° Advantage+ || US || BROAD || 7C || Existing_customer_5% || 15/12/24 Ad set,VIDEO,$137,"5,107",2025-02-04,2025-03-14,38
145,CB_2025_Feb_FB_3796_LZ-DP_V06_9x16_VID_EN_New_C-Testimonial_Evergreen_CTA-SALE_Angle-W-B_M-MAG_VL-45s_G-F_P-OG_S-NEW,3796 - CB ads everywhere || Enhancements: OFF || CBV1 || Batch 2 || 1C || 11/02/25w07 || Kostas,VIDEO,$136,"4,964",2025-02-11,2025-02-16,5
146,CB_2024_Jan_FB_2762_IK_V05_1x1_IMG_EN_New_C-WrittenTesti_CTA-CTA_Pain-W-B-C_M-NONE_VL-None_TR-None_G-NONE_P-V2_S-NONE,CBV2 || EU (UK) || ðŸ’° Advantage+ || US || BROAD || 7C || Existing_customer_5% || 15/12/24 Ad set,SHARE,$133,"5,806",2024-12-15,2025-03-27,102
147,CB_2025_Jan_FB_3742_SO-DP-KB_V01_4x5_IMG_EN_Opti_C-NONE_Evergreen_CTA-SALE_Angle-W_M-NONE_VL-None_G-NONE_P-CBV2_S-NONE3665V01,3742 -  3665_V01 OPTI for PREMIUM 3 || 1C || 31/01/2025w05,SHARE,$133,"6,342",2025-01-31,2025-02-10,10
148,CB_2025_Feb_FB_3792_SO-RP_V05_1x1_IMG_EN_Opti_C-NegativeMark_Sale_CTA-Vday_Angle-Cort_M-NONE_VL-None_G-NONE_P-NONE_S-NONE_FB3251V02,3792 - 3072 Valentines opti IMG || Enhancements: OFF || CBV1 || Batch 1 || 1C || 09/02/25w07 || Kostas,SHARE,$133,"5,369",2025-02-09,2025-02-16,7
149,CB_2025_Jan_FB_3778_DT-DP_V04_9x16_VID_EN_Opti_C-Benefits_Sale_CTA-70_Angle-W-B_M-MAN_VL-45s_G-M_P-OG_S-WHAT_FB3097V03,3778 - Opti 3097 || Enhancements: OFF || CBV1 || Batch 1 || 1C || 04/02/25w06 || Kostas,VIDEO,$128,"6,345",2025-02-04,2025-02-11,7
150,CB_2025_Jan_FB_3072_V01_4x5_IMG_EN_New_C-Headline_Seasonal_CTA-None_Angle-W_M-NONE_VL-None_G-NONE_P-OG_S-NONE,US || Manual Bid: ROAS GOAL: 1.1 -> 1.2 || 7DC || 28/01/2025,SHARE,$122,"3,275",2025-01-28,2025-02-11,14
151,CB_2025_Jan_FB_3740_SO-DP_V03_4x5_IMG_EN_Opti_C-Headline_Evergreen_CTA-NONE_Angle-W_M-NONE_VL-None_G-NONE_P-OG_S-NONE_3608V03,3740 - 3608_v03 OPTI || Enhancements: OFF || CBV1 || Batch 1 || 1C || 29/01/25w05 || Kostas,SHARE,$121,"6,287",2025-01-29,2025-02-11,13
152,CB_2025_Jan_FB_3687_DT_V01_4x5_VID_EN_Opti_C-MakingOf_Sale_CTA-VDAY_Angle-W-B-C_M-POW_VL-45s_G-M_P-OG_S-Moon_FB3090V02,3687 - Valentine_s Day Opti 3090 || Enhancements: OFF || CBV1 || Batch Ä… || 1C || 02/02/25w06 || Kostas,SHARE,$121,"6,330",2025-02-02,2025-02-19,17
153,CB_2024_Dec_FB_3601_VK-DP_V09_4x5_VID_EN_Opti_C-Dance_CTA-NY_Pain-W-B_M-JOG_VL-30s_TR-None_G-F_P-OG_S-WHAT_FB3045V01,ðŸŒ¶ï¸ || US || ASC+ || ->CC141 || VIDEO Only || US+CA || 0% EXISTING CAP || 7C || 07/08.24  Ad set,VIDEO,$120,"2,748",2024-12-27,2025-02-14,49
154,CB_2025_Jan_FB_3741_LZ-JG_V01_4x5_IMG_EN_Opti_C-Headline_Evergreen_CTA-NONE_Angle-W_M-NONE_VL-None_G-NONE_P-CBV2_S-NONE_FB3357V01,CBV2 || US || Manual Bid: ROAS GOAL: 1.00 -> 1.1 || 7DC || 22/01/2025,SHARE,$114,"4,418",2025-01-22,2025-03-27,64
155,CB_2025_Feb_FB_3812_SO_V01_4x5_IMG_EN_Opti_C-NONE_Evergreen_CTA-SALE_Angle-W_M-NONE_VL-None_G-NONE_P-NONE_S-NONE_FB3723V07,3812 - 3723 Man Boobs Opti || Enhancements: OFF || CBV1 || Batch 1 || 1C || 11/02/25w07 || Kostas,SHARE,$111,"8,877",2025-02-11,2025-02-26,15
156,CB_2025_Jan_FB_3786_LZ_V02_1x1_IMG_EN_New_C-Educational_Evergreen_CTA-SALE_Angle-GH_M-NONE_VL-None_G-NONE_P-OG_S-NONE,3786 - #92 Notion idea gamers' diet || Enhancements: OFF || CBV1 || Batch 1 || 7C || 09/02/25w07 || Kostas,SHARE,$111,"5,589",2025-02-09,2025-02-17,8
157,CB_2025_Feb_FB_3784_SO-RP_V05_4x5_IMG_EN_Opti_C-Headline_Evergreen_CTA-NONE_Angle-W_M-NONE_VL-None_G-NONE_P-OG_S-NONE_FB3726V01,3784 - 3726 ad copy opti || Enhancements: OFF || CBV1 || Batch 1 || 1C || 09/02/25w07 || Kostas,SHARE,$109,"7,656",2025-02-09,2025-02-17,8
158,CB_2025_Feb_FB_3806_SO-KB_V08_1x1_IMG_EN_New_C-A-Compare_Evergreen_CTA-NONE_Angle-W_M-NONE_VL-None_G-NONE_P-OG_S-NONE,"3806 - Brief Results, not resolutions || Enhancements: OFF || CBV1 || Batch 2 || 7DC || 12/02/25w07 || Kostas",SHARE,$104,"5,214",2025-02-12,2025-02-17,5
159,CB_2025_Jan_FB_3776_DT-DP_V03_9x16_VID_EN_New_C-SplitScreen_Sale_CTA-70_Angle-W_M-NONE_VL-15s_G-NONE_P-OG_S-NEW,3776 - New Idea - post pregnancy weight loss || Enhancements: OFF || CBV1 || Batch 1 || 1C || 04/02/25w06 || Kostas,VIDEO,$104,"3,428",2025-02-04,2025-02-11,7
160,CB_2025_Jan_FB_3791_CHUB_V02_9x16_VID_EN_New_C-NONE_CTA-NONE_Angle-W_M-NONE_VL-None_TR-None_G-NONE_P-NONE_S-NONE,Relaunch -  3791 - TrumpTweets CHUB || Enhancements: OFF || CBV1 || Batch 1 || 1C || 11/02/25w07 || Kostas,VIDEO,$104,"4,857",2025-02-10,2025-02-14,4
161,CB_2025_Jan_FB_3072_V02_4x5_IMG_EN_New_C-Headline_Seasonal_CTA-None_Angle-W_M-NONE_VL-None_G-NONE_P-OG_S-NONE,AU || Fixed || 3072 EU adaptations || 1C || 20/01/2025w04,SHARE,$103,"3,802",2025-01-20,2025-02-14,25
162,CB_2025_Jan_FB_3759_VK_V11_4x5_VID_EN_New_C-BulletPoints_Evergreen_CTA-NONE_Angle-W-B-C_M-NONE_VL-15s_G-M_P-OG_S-NEW,3761 - testis to to video 3722 || Enhancements: OFF || CBV1 || Batch 3 || 1C || 03/02/25w06 || Kostas,SHARE,$102,"4,635",2025-02-04,2025-02-11,7
163,CB_2025_Jan_FB_3724_CHUB-AA_V04_4x5_IMG_EN_New_C-NONE_CTA-NONE_Angle-C_M-NONE_VL-None_TR-None_G-M_P-none_S-NONE,3724 Get Regular CHUB || Enhancements: OFF || CBV1 || Batch 1 || 1C || 29/01/25w05 || Kostas,SHARE,$95,"5,868",2025-01-29,2025-02-13,15
164,CB_2025_Feb_FB_3784_SO-RP_V02_4x5_IMG_EN_Opti_C-Headline_Evergreen_CTA-NONE_Angle-W_M-NONE_VL-None_G-NONE_P-OG_S-NONE_FB3726V01,3784 - 3726 ad copy opti || Enhancements: OFF || CBV1 || Batch 1 || 1C || 09/02/25w07 || Kostas,SHARE,$91,"5,095",2025-02-09,2025-02-17,8
165,CB_2025_Feb_FB_3812_SO_V04_4x5_IMG_EN_Opti_C-NONE_Evergreen_CTA-SALE_Angle-W_M-NONE_VL-None_G-NONE_P-NONE_S-NONE_FB3723V07,3812 - 3723 Man Boobs Opti || Enhancements: OFF || CBV1 || Batch 1 || 1C || 11/02/25w07 || Kostas,SHARE,$91,"5,669",2025-02-11,2025-02-26,15
166,CB_2025_Feb_FB_3793_VK-DP_V04_1x1_VID_EN_Opti_C-BulletPoints_Evergreen_CTA-70_Angle-W-B-C_M-NONE_VL-None_G-F_P-OG_S-NEW_FB3705V02,3793 -  3705 test opti || Enhancements: OFF || CBV1 || Batch 1 || 1C || 11/02/25w07 || Kostas,SHARE,$89,"4,424",2025-02-11,2025-02-28,17
167,CB_2025_Jan_FB_3771_VK-DP_V01_9x16_VID_EN_New_C-BulletPoints_Evergreen_CTA-NONE_Angle-W-B-C_M-MAG_VL-15s_G-M_P-OG_S-NEW,3771 - New idea spot the lie for CB V1 - DP-VK || Enhancements: OFF || CBV1 || Batch 1 || 1C || 04/02/25w06 || Kostas,VIDEO,$88,"2,888",2025-02-04,2025-02-11,7
168,CB_2023_May_FB_2103_MB_V02_9x16_VID_EN_Opti_C-Sale_CTA-SMR_Pain-W_M-JOG_VL-30s_TR-None_G-M-F_P-None_S-What,US || Manual Bid || BFCM || COST CAP 91 || 1C || 15/11/24,VIDEO,$87,"2,696",2024-11-15,2025-02-27,104
169,CB_2025_Feb_FB_3784_SO-RP_V10_4x5_IMG_EN_Opti_C-Headline_Evergreen_CTA-NONE_Angle-W_M-NONE_VL-None_G-NONE_P-OG_S-NONE_FB3726V01,3784 - 3726 ad copy opti || Enhancements: OFF || CBV1 || Batch 2 || 1C || 09/02/25w07 || Kostas,SHARE,$81,"4,940",2025-02-09,2025-02-26,17
170,CB_2025_Feb_FB_3801_SO-KB_V06_1x1_IMG_EN_New_C-A-Compare_Evergreen_CTA-NONE_Angle-W_M-NONE_VL-None_G-NONE_P-OG_S-NONE,3801 - America_s favorite meal ads || Enhancements: OFF || CBV1 || Batch 2 || 7DC || 12/02/25w07 || Kostas,SHARE,$79,"3,482",2025-02-12,2025-02-17,5
171,CB_2025_Jan_FB_3791_CHUB_V03_9x16_VID_EN_New_C-NONE_CTA-NONE_Angle-W_M-NONE_VL-None_TR-None_G-NONE_P-NONE_S-NONE,Relaunch -  3791 - TrumpTweets CHUB || Enhancements: OFF || CBV1 || Batch 1 || 1C || 11/02/25w07 || Kostas,VIDEO,$79,"4,033",2025-02-10,2025-02-14,4
172,CB_2025_Jan_FB_3741_LZ-JG_V01_4x5_IMG_EN_Opti_C-Headline_Evergreen_CTA-NONE_Angle-W_M-NONE_VL-None_G-NONE_P-CBV2_S-NONE_FB3357V01,CBV2 || US || Manual Bid: ROAS GOAL: 0.9 -> 1.00 || 7DC || 22/01/2025,SHARE,$78,"3,666",2025-01-22,2025-03-27,64
173,CB_2025_Feb_FB_3801_SO-KB_V10_1x1_IMG_EN_New_C-A-Compare_Evergreen_CTA-NONE_Angle-W_M-NONE_VL-None_G-NONE_P-OG_S-NONE,3801 - America_s favorite meal ads || Enhancements: OFF || CBV1 || Batch 3 || 7DC || 12/02/25w07 || Kostas,SHARE,$78,"2,654",2025-02-12,2025-02-18,6
174,CB_2025_Feb_FB_3804_LZ-KB_V04_1x1_VID_EN_New_C-BulletPoints_Evergreen_CTA-NONE_Angle-GH_M-NONE_VL-None_G-NONE_P-NONE_S-NONE,3804 - fit back into your jeans || Enhancements: OFF || CBV1 || Batch 1 || 7DC || 12/02/25w07 || Kostas,SHARE,$74,"2,154",2025-02-12,2025-02-17,5
175,CB_2025_Feb_FB_3793_VK-DP_V02_1x1_VID_EN_Opti_C-BulletPoints_Evergreen_CTA-70_Angle-W-B-C_M-NONE_VL-None_G-F_P-OG_S-NEW_FB3705V02,3793 -  3705 test opti || Enhancements: OFF || CBV1 || Batch 1 || 1C || 11/02/25w07 || Kostas,SHARE,$73,"4,069",2025-02-11,2025-02-28,17
176,CB_2024_Dec_FB_3592_VK-DP_V10_4x5_VID_EN_New_C-BulletPoints_Sale_CTA-SALE_Angle-W-B-C_M-NONE_VL-30s_G-F_P-OG_S-NEW - Copy,ðŸŒ¶ï¸ || US || ASC+ || ->CC141 || VIDEO Only || US+CA || 0% EXISTING CAP || 7C || 07/08.24  Ad set,VIDEO,$71,"3,362",2024-12-21,2025-03-27,96
177,CB_2025_Feb_FB_3792_SO-RP_V03_1x1_IMG_EN_Opti_C-NegativeMark_Sale_CTA-Vday_Angle-Cort_M-NONE_VL-None_G-NONE_P-NONE_S-NONE_FB3251V02,3792 - 3072 Valentines opti IMG || Enhancements: OFF || CBV1 || Batch 1 || 1C || 09/02/25w07 || Kostas,SHARE,$71,"3,073",2025-02-09,2025-02-16,7
178,CB_2025_Feb_FB_3784_SO-RP_V01_4x5_IMG_EN_Opti_C-Headline_Evergreen_CTA-NONE_Angle-W_M-NONE_VL-None_G-NONE_P-OG_S-NONE_FB3726V01,3784 - 3726 ad copy opti || Enhancements: OFF || CBV1 || Batch 1 || 1C || 09/02/25w07 || Kostas,SHARE,$69,"4,747",2025-02-09,2025-02-17,8
179,CB_2025_Feb_FB_3819_DT_V03_9x16_GIF_EN_Opti_C-NONE_Evergreen_CTA-None_Angle-W_M-NONE_VL-None_G-NONE_P-NONE_S-New_FB3723V04,3819 - #7 Goodbye Man boobs || Enhancements: OFF || CBV1 || Batch 1 || 7DC || 14/02/25w07 || Kostas,SHARE,$69,"2,829",2025-02-14,2025-02-22,8
180,CB_2023_Dec_FB_2696_RS_V03_9x16_VID_EN_Opti_C-Sale_CTA-NY65_Pain-W-B_M-JANW_VL-30s_TR-None_G-M_P-OG_S-WHAT_FB2284V05,US || Manual Bid: ROAS GOAL: 1.1 -> 1.2 || 7DC || 28/01/2025,VIDEO,$64,"2,774",2025-01-28,2025-02-11,14
181,CB_2025_Feb_FB_3801_SO-KB_V03_1x1_IMG_EN_New_C-A-Compare_Evergreen_CTA-NONE_Angle-W_M-NONE_VL-None_G-NONE_P-OG_S-NONE,3801 - America_s favorite meal ads || Enhancements: OFF || CBV1 || Batch 1 || 7DC || 12/02/25w07 || Kostas,SHARE,$64,"2,472",2025-02-12,2025-02-17,5
182,CB_2025_Jan_FB_3745_CHUB_V02_4x5_IMG_EN_Opti_C-NONE_CTA-NONE_Angle-B_M-NONE_VL-None_TR-None_G-F_P-OG_S-NONE,3745 - 3661 Methane Balloon OPTI || Enhancements: OFF || CBV1 || Batch 1 || 1C || 30/01/25w05 || Kostas,SHARE,$64,"4,269",2025-01-30,2025-02-13,14
183,CB_2025_Jan_FB_3767_VK-DP_V03_9x16_VID_EN_New_C-BulletPoints_Evergreen_CTA-NONE_Angle-W-B-C_M-NONE_VL-15s_G-M_P-OG_S-NEW,3767 - Short video new idea CB V1 - DP || Enhancements: OFF || CBV1 || Batch 1 || 1C || 03/02/25w06 || Kostas,VIDEO,$63,"3,215",2025-02-04,2025-02-11,7
184,CB_2025_Jan_FB_3772_DT-DP_V01_4x5_VID_EN_New_C-SplitScreen_Sale_CTA-70_Angle-W_M-NONE_VL-15s_G-NONE_P-OG_S-NEW,3772 - Split-screen ads_VID CB V1 || Enhancements: OFF || CBV1 || Batch 1 || 1C || 04/02/25w06 || Kostas,VIDEO,$62,"1,928",2025-02-04,2025-02-11,7
185,CB_2024_Dec_FB_3639_CHUB_V03_1x1_IMG_EN_New_C-NONE_CTA-NONE_Angle-W_M-NONE_VL-None_TR-None_G-NONE_P-NONE_S-NONE,CBV2 || US || Manual Bid: ROAS GOAL: 0.9 -> 1.00 || 7DC || 22/01/2025,SHARE,$62,"2,249",2025-01-22,2025-02-11,20
186,CB_2025_Jan_FB_3769_DT-JT_V01_9x16_VID_EN_Opti_C-BulletPoints_Sale_CTA-70_Angle-W-B-C_M-POW_VL-30s_G-F_P-OG_S-NEW_3666V03,3769 - Opti 3666 || Enhancements: OFF || CBV1 || Batch 1 || 1C || 04/02/25w06 || Kostas,VIDEO,$61,"1,980",2025-02-04,2025-02-11,7
187,CB_2025_Feb_FB_3796_LZ-DP_V04_9x16_VID_EN_New_C-Testimonial_Evergreen_CTA-SALE_Angle-W-B_M-TIFF_VL-45s_G-F_P-OG_S-NEW,3796 - CB ads everywhere || Enhancements: OFF || CBV1 || Batch 1 || 1C || 11/02/25w07 || Kostas,VIDEO,$61,"2,342",2025-02-11,2025-02-17,6
188,CB_2025_Feb_FB_3799_SO-KB_V08_1x1_IMG_EN_New_C-A-Compare_Evergreen_CTA-NONE_Angle-W_M-NONE_VL-None_G-NONE_P-OG_S-NONE,3799 - Don_t change your habits || Enhancements: OFF || CBV1 || Batch 2 || 7DC || 12/02/25w07 || Kostas,SHARE,$60,"2,290",2025-02-12,2025-02-21,9
189,CB_2025_Feb_FB_3796_LZ-DP_V02_9x16_VID_EN_New_C-Testimonial_Evergreen_CTA-SALE_Angle-W-B_M-TIFF_VL-45s_G-F_P-OG_S-NEW,3796 - CB ads everywhere || Enhancements: OFF || CBV1 || Batch 1 || 1C || 11/02/25w07 || Kostas,VIDEO,$59,"2,335",2025-02-11,2025-02-17,6
190,CB_2025_Jan_FB_3771_VK-DP_V07_9x16_VID_EN_New_C-BulletPoints_Evergreen_CTA-70_Angle-W-B-C_M-GLAD_VL-30s_G-F_P-OG_S-NEW,3771 - New idea spot the lie for CB V1 - DP-VK || Enhancements: OFF || CBV1 || Batch 2 || 1C || 04/02/25w06 || Kostas,VIDEO,$58,"2,666",2025-02-04,2025-02-11,7
191,CB_2025_Feb_FB_3780_DT-DP_V02_9x16_VID_EN_Opti_C-MakingOf_Sale_CTA-70_Angle-W-B_M-CRAZY_VL-45s_G-M_P-OG_S-NEW_FB3264V31,3780 - Crazy Trainer Hookerization || Enhancements: OFF || CBV1 || Batch 1 || 1C || 09/02/25w07 || Kostas,VIDEO,$57,"3,304",2025-02-09,2025-02-15,6
192,CB_2025_Jan_FB_3742_SO-DP-KB_V01_4x5_IMG_EN_Opti_C-NONE_Evergreen_CTA-SALE_Angle-W_M-NONE_VL-None_G-NONE_P-CBV2_S-NONE3665V01,3742 -  3665_V01 OPTI for PREMIUM 2 || Batch 1 || 1C || 29/01/2025w05,SHARE,$57,"3,302",2025-01-30,2025-02-10,11
193,CB_2025_Jan_FB_3723_SO_V17_4x5_IMG_EN_New_C-NONE_Evergreen_CTA-SALE_Angle-W_M-NONE_VL-None_G-NONE_P-NONE_S-NONE,3723 - Notion Idea #92 MAN BOOBS || Enhancements: OFF || CBV1 || Batch 4 || 1C || 28/01/25w05 || Kostas,SHARE,$56,"3,187",2025-01-28,2025-03-07,38
194,CB_2025_Jan_FB_3773_CHUB_V03_9x16_VID_EN_New_C-NONE_CTA-NONE_Angle-None_M-NONE_VL-None_TR-None_G-NONE_P-NONE_S-NONE,3773 - MessageVideos || Enhancements: OFF || CBV1 || Batch 1 || 1C || 09/02/25w07 || Kostas,SHARE,$55,"2,832",2025-02-09,2025-02-14,5
195,CB_2025_Jan_FB_3771_VK-DP_V06_9x16_VID_EN_New_C-BulletPoints_Evergreen_CTA-70_Angle-W-B-C_M-GLAD_VL-30s_G-F_P-OG_S-NEW,3771 - New idea spot the lie for CB V1 - DP-VK || Enhancements: OFF || CBV1 || Batch 2 || 1C || 04/02/25w06 || Kostas,SHARE,$54,"2,928",2025-02-04,2025-02-11,7
196,CB_2025_Jan_FB_3772_DT-DP_V04_4x5_VID_EN_New_C-SplitScreen_Sale_CTA-70_Angle-W_M-NONE_VL-15s_G-NONE_P-OG_S-NEW,3772 - Split-screen ads_VID CB V1 || Enhancements: OFF || CBV1 || Batch 1 || 1C || 04/02/25w06 || Kostas,VIDEO,$54,"1,446",2025-02-04,2025-02-11,7
197,CB_2023_Jul_FB_2217_IB_V04_9x16_VID_EN_Opti_C-Pointing_CTA-SMR_Pain-W-B_M-TRC_VL-30s_TR-None_G-F_P-None_S-FRIGGA,US || Manual Bid: ROAS GOAL: 1.1 -> 1.2 || 7DC || 28/01/2025,VIDEO,$54,"1,999",2025-01-28,2025-02-11,14
198,CB_2023_May_FB_2263_MB_V04_9x16_VID_EN_New_C-Sale_CTA-SMR_Pain-W_M-JOG_VL-45s_TR-None_G-M-F_P-None_S-Moon,US || Manual Bid: ROAS GOAL: 1.1 -> 1.2 || 7DC || 28/01/2025,VIDEO,$53,"1,305",2025-01-28,2025-02-11,14
199,CB_2025_Jan_FB_3769_DT-JT_V03_9x16_VID_EN_Opti_C-BulletPoints_Sale_CTA-70_Angle-W-B-C_M-POW_VL-30s_G-F_P-OG_S-NEW_3666V03,3769 - Opti 3666 || Enhancements: OFF || CBV1 || Batch 1 || 1C || 04/02/25w06 || Kostas,VIDEO,$53,"2,481",2025-02-04,2025-02-11,7
200,CB_2025_Jan_FB_3767_VK-DP_V02_9x16_VID_EN_New_C-BulletPoints_Evergreen_CTA-NONE_Angle-W-B-C_M-NONE_VL-15s_G-M_P-OG_S-NEW,3767 - Short video new idea CB V1 - DP || Enhancements: OFF || CBV1 || Batch 1 || 1C || 03/02/25w06 || Kostas,VIDEO,$51,"2,296",2025-02-04,2025-02-11,7
201,CB_2025_Feb_FB_3793_VK-DP_V05_1x1_VID_EN_Opti_C-BulletPoints_Evergreen_CTA-70_Angle-W-B-C_M-NONE_VL-None_G-F_P-OG_S-NEW_FB3705V02,3793 -  3705 test opti || Enhancements: OFF || CBV1 || Batch 2 || 1C || 11/02/25w07 || Kostas,SHARE,$51,"4,425",2025-02-11,2025-02-17,6
202,CB_2024_Nov_FB_3305_SO-DP_V02_4x5_VID_EN_Opti_C-Sale_CTA-BF_Pain-W_M-Chris_VL-30s_TR-None_G-MF_P-Plan_S-NEW_FB2601V07,CBV2 || AU || ðŸ’° Advantage+ || US || BROAD || 7C || Existing_customer_5% || 19/12/24 Ad set,VIDEO,$51,"1,667",2024-12-19,2025-03-27,98
203,CB_2025_Jan_FB_3777_CHUB-KZ_V04_4x5_IMG_EN_Opti_C-NONE_CTA-NONE_Angle-C_M-NONE_VL-None_TR-None_G-NONE_P-NONE_S-NONE,3777 - 3696 Opti || Enhancements: OFF || CBV1 || Batch 1 || 1C || 11/02/25w07 || Kostas,SHARE,$51,"2,852",2025-02-11,2025-02-21,10
204,CB_2025_Feb_FB_3809_LZ-JT_V04_1x1_IMG_EN_New_C-Educational_Evergreen_CTA-NONE_Angle-W_M-NONE_VL-None_G-NONE_P-NONE_S-NONE,3809 - 30 day detox RED 40 LBS || Enhancements: OFF || CBV1 || Batch 1 || 7DC || 12/02/25w07 || Kostas,SHARE,$51,"2,714",2025-02-12,2025-02-17,5
205,CB_2025_Jan_FB_3759_VK_V01_4x5_VID_EN_New_C-BulletPoints_Evergreen_CTA-NONE_Angle-W-B-C_M-NONE_VL-15s_G-M_P-OG_S-NEW,3761 - testis to to video 3722 || Enhancements: OFF || CBV1 || Batch 1 || 1C || 03/02/25w06 || Kostas,SHARE,$50,"1,816",2025-02-04,2025-02-11,7
206,CB_2025_Jan_FB_3777_CHUB-KZ_V01_4x5_IMG_EN_Opti_C-NONE_CTA-NONE_Angle-C_M-NONE_VL-None_TR-None_G-NONE_P-NONE_S-NONE,3777 - 3696 Opti || Enhancements: OFF || CBV1 || Batch 1 || 1C || 11/02/25w07 || Kostas,SHARE,$50,"2,588",2025-02-11,2025-02-21,10
207,CB_2025_Feb_FB_3793_VK-DP_V03_1x1_VID_EN_Opti_C-BulletPoints_Evergreen_CTA-70_Angle-W-B-C_M-NONE_VL-None_G-F_P-OG_S-NEW_FB3705V02,3793 -  3705 test opti || Enhancements: OFF || CBV1 || Batch 1 || 1C || 11/02/25w07 || Kostas,SHARE,$50,"2,632",2025-02-11,2025-02-28,17
208,CB_2024_Jan_FB_2717_MB-RP_V26_9x16_VID_EN_New_C-Buzz_CTA-SALE_Pain-W-B-C_M-MIX_VL-45s_TR-None_G-MF_P-Method_S-NONE,CA || COST CAP 92->93 || 7C || 10/05/24 || V1,VIDEO,$48,"2,438",2024-08-22,2025-02-27,189
209,CB_2025_Jan_FB_3759_VK_V04_4x5_VID_EN_New_C-BulletPoints_Evergreen_CTA-NONE_Angle-W-B-C_M-NONE_VL-15s_G-M_P-OG_S-NEW,3761 - testis to to video 3722 || Enhancements: OFF || CBV1 || Batch 1 || 1C || 03/02/25w06 || Kostas,SHARE,$47,"2,339",2025-02-04,2025-02-11,7
210,CB_2024_Feb_FB_2834_DA_V04_4x5_IMG_EN_Opti_C-SingleTesti_CTA-NONE_Pain-W_M-NONE_VL-None_TR-None_G-NONE_P-V2_S-NONE_FB2759V04,CBV2 || AU || ðŸ’° Advantage+ || US || BROAD || 7C || Existing_customer_5% || 19/12/24 Ad set,SHARE,$46,"2,336",2024-12-19,2025-03-27,98
211,CB_2025_Jan_FB_3781_LZ-DP_V02_9x16_GIF_EN_Opti_C-Headline_Evergreen_CTA-NONE_Angle-W_M-NONE_VL-15s_G-NONE_P-OG_S-NEW_FB3608V03,3781 - Hypnosis GIF opti || Enhancements: OFF || CBV1 || Batch 1 || 1C || 04/02/25w06 || Kostas,SHARE,$46,"1,659",2025-02-04,2025-02-11,7
212,CB_2025_Feb_FB_3799_SO-KB_V06_1x1_IMG_EN_New_C-A-Compare_Evergreen_CTA-NONE_Angle-W_M-NONE_VL-None_G-NONE_P-OG_S-NONE,3799 - Don_t change your habits || Enhancements: OFF || CBV1 || Batch 2 || 7DC || 12/02/25w07 || Kostas,SHARE,$46,"1,803",2025-02-12,2025-02-21,9
213,CB_2025_Jan_FB_3771_VK-DP_V03_9x16_VID_EN_New_C-BulletPoints_Evergreen_CTA-NONE_Angle-W-B-C_M-MAG_VL-15s_G-M_P-OG_S-NEW,3771 - New idea spot the lie for CB V1 - DP-VK || Enhancements: OFF || CBV1 || Batch 1 || 1C || 04/02/25w06 || Kostas,VIDEO,$44,"2,463",2025-02-04,2025-02-11,7
214,CB_2024_Jan_FB_2764_RS_V04_9x16_VID_EN_Opti_C-SingleTesti_CTA-SALE_Pain-W_M-TRC_VL-45s_TR-None_G-F_P-OG_S-MOON_FB2263V04_Page_Personal_Coach,US || Manual Bid: ROAS GOAL: 1.1 -> 1.2 || 7DC || 28/01/2025,VIDEO,$44,"1,089",2025-01-28,2025-02-11,14
215,CB_2023_Jul_FB_2226_MB_V04_9x16_VID_EN_Opti_C-Testim_CTA-SMR_Pain-W_M-MIX_VL-30s_TR-None_G-F_P-None_S-Starry,US || Manual Bid || BFCM || ROAS GOAL: 1.4 || 1C || 15/11/24,VIDEO,$44,935,2024-11-15,2025-02-27,104
216,CB_2025_Feb_FB_3806_SO-KB_V04_1x1_IMG_EN_New_C-A-Compare_Evergreen_CTA-NONE_Angle-W_M-NONE_VL-None_G-NONE_P-OG_S-NONE,"3806 - Brief Results, not resolutions || Enhancements: OFF || CBV1 || Batch 1 || 7DC || 12/02/25w07 || Kostas",SHARE,$43,"2,283",2025-02-12,2025-02-18,6
217,CB_2025_Jan_FB_3723_SO_V19_4x5_IMG_EN_New_C-NONE_Evergreen_CTA-SALE_Angle-W_M-NONE_VL-None_G-NONE_P-NONE_S-NONE,3723 - Notion Idea #92 MAN BOOBS || Enhancements: OFF || CBV1 || Batch 4 || 1C || 28/01/25w05 || Kostas,SHARE,$40,"2,785",2025-01-28,2025-03-11,42
218,CB_2025_Feb_FB_3796_LZ-DP_V05_9x16_VID_EN_New_C-Testimonial_Evergreen_CTA-SALE_Angle-W-B_M-MAG_VL-45s_G-F_P-OG_S-NEW,3796 - CB ads everywhere || Enhancements: OFF || CBV1 || Batch 2 || 1C || 11/02/25w07 || Kostas,VIDEO,$40,"1,935",2025-02-11,2025-02-16,5
219,CB_2025_Feb_FB_3818_LZ-VU_V26_1x1_IMG_EN_Opti_C-Headline_Evergreen_CTA-NONE_Angle-Cort_M-NONE_VL-None_G-NONE_P-NONE_S-NONE_FB3251V01,3818 - It_s not cheap Months+holidays: April || Enhancements: OFF || CBV1 || Batch 1 || 7DC || 13/02/25w07 || Kostas,SHARE,$40,"1,081",2025-02-13,2025-02-28,15
220,CB_2025_Jan_FB_3072_V02_4x5_IMG_EN_New_C-Headline_Seasonal_CTA-None_Angle-W_M-NONE_VL-None_G-NONE_P-OG_S-NONE,CBV2 || EU (UK) || ðŸ’° Advantage+ || US || BROAD || 7C || Existing_customer_5% || 15/12/24 Ad set,SHARE,$40,"1,867",2025-01-17,2025-03-14,56
221,CB_2025_Feb_FB_3819_DT_V04_9x16_GIF_EN_Opti_C-NONE_Evergreen_CTA-None_Angle-W_M-NONE_VL-None_G-NONE_P-NONE_S-New_FB3723V04,3819 - #7 Goodbye Man boobs || Enhancements: OFF || CBV1 || Batch 1 || 7DC || 14/02/25w07 || Kostas,SHARE,$39,"1,768",2025-02-14,2025-02-20,6
222,CB_2025_Jan_FB_3740_VK-DP_V03_4x5_IMG_EN_Opti_C-Headline_Evergreen_CTA-NONE_Angle-W_M-NONE_VL-None_G-NONE_P-OG_S-NONE_3608V03,3797 - Man boobs-dad bod angle_IMG CB V1 - VK || Enhancements: OFF || CBV1 || Batch 1 || 7DC || 11/02/25w07 || Kostas,SHARE,$39,"2,143",2025-02-11,2025-02-17,6
223,CB_2024_Nov_FB_3336_CH_V18_1x1_IMG_EN_Opti_C-Headline_CTA-NONE_Angle-C_P-OG,3336 Creative Hub â€“ Golden nuggets V1 - Opti [Not tested] || Enhancements: OFF || CBV1 || Batch 1 || 1C || 11/02/25w07 || Kostas,SHARE,$39,"2,378",2025-02-11,2025-02-21,10
224,CB_2025_Feb_FB_3807_DT-DP_V03_9x16_VID_EN_Opti_C-Testimonial_CTA-70_Angle-W_M-TRC_VL-45s_G-F_P-OG_S-MOON_FB2865V04,3807 - Green screen reaction test || Enhancements: OFF || CBV1 || Batch 2 || 7DC || 12/02/25w07 || Kostas,VIDEO,$37,"1,189",2025-02-12,2025-02-17,5
225,CB_2025_Jan_FB_3798_CHUB_V02_9x16_VID_EN_New_C-NONE_CTA-NONE_Angle-None_M-NONE_VL-None_TR-None_G-NONE_P-NONE_S-NONE,3798 - ConfusedDog CHUB 2 || Enhancements: OFF || CBV1 || Batch 1 || 7DC || 16/02/25w08 || Kostas,VIDEO,$36,"1,986",2025-02-16,2025-02-20,4
226,CB_2024_Feb_FB_2834_DA_V02_4x5_IMG_EN_Opti_C-SingleTesti_CTA-NONE_Pain-W_M-NONE_VL-None_TR-None_G-NONE_P-V2_S-NONE_FB2759V04,CBV2 || AU || ðŸ’° Advantage+ || US || BROAD || 7C || Existing_customer_5% || 19/12/24 Ad set,SHARE,$36,"1,813",2024-12-19,2025-03-27,98
227,CB_2025_Feb_FB_3792_SO-RP_V07_1x1_IMG_EN_Opti_C-NegativeMark_Sale_CTA-Vday_Angle-Cort_M-NONE_VL-None_G-NONE_P-NONE_S-NONE_FB3251V02,3792 - 3072 Valentines opti IMG || Enhancements: OFF || CBV1 || Batch 2 || 1C || 09/02/25w07 || Kostas,SHARE,$36,"1,878",2025-02-09,2025-02-17,8
228,CB_2024_Oct_FB_3251_LZ-VU_V01_1x1_IMG_EN_New_C-NegativeMark_Evergreen_CTA-NONE_Angle-Cort_M-NONE_VL-None_G-NONE_P-NONE_S-NONE.png,US || Manual Bid || BFCM || ROAS GOAL: 1.4 || 1C || 15/11/24,SHARE,$35,"1,121",2024-11-15,2025-02-27,104
229,CB_2025_Jan_FB_3759_VK_V02_4x5_VID_EN_New_C-BulletPoints_Evergreen_CTA-NONE_Angle-W-B-C_M-NONE_VL-15s_G-M_P-OG_S-NEW,3761 - testis to to video 3722 || Enhancements: OFF || CBV1 || Batch 1 || 1C || 03/02/25w06 || Kostas,SHARE,$35,"2,325",2025-02-04,2025-02-11,7
230,CB_2025_Feb_FB_3807_DT-DP_V02_9x16_VID_EN_Opti_C-Testimonial_Sale_CTA-70_Angle-W_M-MIX_VL-30s_G-F_P-OG_S-Starry_FB2226V04,3807 - Green screen reaction test || Enhancements: OFF || CBV1 || Batch 2 || 7DC || 12/02/25w07 || Kostas,VIDEO,$34,724,2025-02-12,2025-02-17,5
231,CB_2025_Jan_FB_3750_LZ-VU_V01_4x5_IMG_EN_Opti_C-NegativeMark_Evergreen_CTA-NONE_Angle-W_M-NONE_VL-None_G-NONE_P-NONE_S-NONE_FB3251V01,3750 - bioma ripoff march soft version || Enhancements: OFF || CBV1 || Batch 1 || 1C || 24/01/25w04 || Kostas,SHARE,$33,936,2025-01-24,2025-02-17,24
232,CB_2025_Jan_FB_3769_DT-JT_V02_9x16_VID_EN_Opti_C-BulletPoints_Sale_CTA-70_Angle-W-B-C_M-POW_VL-30s_G-F_P-OG_S-NEW_3666V03,3769 - Opti 3666 || Enhancements: OFF || CBV1 || Batch 1 || 1C || 04/02/25w06 || Kostas,VIDEO,$32,"1,415",2025-02-04,2025-02-11,7
233,CB_2025_Feb_FB_3780_DT-DP_V01_9x16_VID_EN_Opti_C-MakingOf_Sale_CTA-70_Angle-W-B_M-CRAZY_VL-45s_G-M_P-OG_S-NEW_FB3264V31,3780 - Crazy Trainer Hookerization || Enhancements: OFF || CBV1 || Batch 1 || 1C || 09/02/25w07 || Kostas,SHARE,$31,"2,204",2025-02-09,2025-02-15,6
234,CB_2025_Jan_FB_3767_VK-DP_V04_9x16_VID_EN_New_C-BulletPoints_Evergreen_CTA-NONE_Angle-W-B-C_M-NONE_VL-15s_G-M_P-OG_S-NEW,3767 - Short video new idea CB V1 - DP || Enhancements: OFF || CBV1 || Batch 1 || 1C || 03/02/25w06 || Kostas,VIDEO,$30,"1,609",2025-02-04,2025-02-11,7
235,CB_2025_Feb_FB_3787_CHUB_V02_9x16_VID_EN_New_C-NONE_CTA-NONE_Angle-None_M-NONE_VL-None_TR-None_G-NONE_P-NONE_S-NONE,3787 - DadBod Messaging CHUB || Enhancements: OFF || CBV1 || Batch 1 || 7DC || 16/02/25w08 || Kostas,VIDEO,$29,"1,339",2025-02-16,2025-02-24,8
236,CB_2024_Oct_FB_3182_ZS-GC_V13_1x1_IMG_EN_New_C-UsVsThem_Evergreen_CTA-NONE_Angle-B-C_M-NONE_VL-None_G-NONE_P-OG_S-NONE,CBV2 || AU || ðŸ’° Advantage+ || US || BROAD || 7C || Existing_customer_5% || 19/12/24 Ad set,SHARE,$29,"1,322",2024-12-19,2025-03-27,98
237,CB_2025_Feb_FB_3792_SO-RP_V10_1x1_IMG_EN_Opti_C-NegativeMark_Sale_CTA-Vday_Angle-Cort_M-NONE_VL-None_G-NONE_P-NONE_S-NONE_FB3251V02,3792 - 3072 Valentines opti IMG || Enhancements: OFF || CBV1 || Batch 2 || 1C || 09/02/25w07 || Kostas,SHARE,$29,"1,043",2025-02-09,2025-02-17,8
238,CB_2024_Feb_FB_2814_MB-DP_V05_1x1_IMG_EN_New_C-WeightLoss_CTA-None_Pain-W-B-C_M-NONE_VL-None_TR-None_G-NONE_P-V2_S-NONE,CBV2 || EU (UK) || ðŸ’° Advantage+ || US || BROAD || 7C || Existing_customer_5% || 15/12/24 Ad set,SHARE,$28,"1,069",2025-01-31,2025-03-27,55
239,CB_2025_Feb_FB_3784_SO-RP_V04_4x5_IMG_EN_Opti_C-Headline_Evergreen_CTA-NONE_Angle-W_M-NONE_VL-None_G-NONE_P-OG_S-NONE_FB3726V01,3784 - 3726 ad copy opti || Enhancements: OFF || CBV1 || Batch 1 || 1C || 09/02/25w07 || Kostas,SHARE,$28,"2,018",2025-02-09,2025-02-17,8
240,CB_2024_Mar_FB_2888_JG_V02_9x16_IMG_EN_Opti_C-Benefits_CTA-NONE_Pain-W_M-NONE_VL-None_TR-None_G-NONE_P-V2_S-NONE,CBV2 || AU || ðŸ’° Advantage+ || US || BROAD || 7C || Existing_customer_5% || 19/12/24 Ad set,SHARE,$28,"1,869",2024-12-19,2025-03-27,98
241,CB_2025_Jan_FB_3767_VK-DP_V07_9x16_VID_EN_New_C-BulletPoints_Evergreen_CTA-NONE_Angle-W-B-C_M-TRC_VL-15s_G-M_P-OG_S-NEW,3767 - Short video new idea CB V1 - DP || Enhancements: OFF || CBV1 || Batch 2 || 1C || 03/02/25w06 || Kostas,VIDEO,$27,"1,407",2025-02-04,2025-02-13,9
242,CB_2024_Mar_FB_2888_JG_V03_9x16_IMG_EN_Opti_C-Benefits_CTA-NONE_Pain-W_M-NONE_VL-None_TR-None_G-NONE_P-V2_S-NONE,CBV2 || AU || ðŸ’° Advantage+ || US || BROAD || 7C || Existing_customer_5% || 19/12/24 Ad set,SHARE,$27,"1,063",2024-12-19,2025-03-27,98
243,CB_2025_Feb_FB_3804_LZ-KB_V02_1x1_VID_EN_New_C-BulletPoints_Evergreen_CTA-NONE_Angle-GH_M-NONE_VL-None_G-NONE_P-NONE_S-NONE,3804 - fit back into your jeans || Enhancements: OFF || CBV1 || Batch 1 || 7DC || 12/02/25w07 || Kostas,SHARE,$27,"1,153",2025-02-12,2025-02-17,5
244,CB_2025_Feb_FB_3812_SO_V05_4x5_IMG_EN_Opti_C-NONE_Evergreen_CTA-SALE_Angle-W_M-NONE_VL-None_G-NONE_P-NONE_S-NONE_FB3723V07,3812 - 3723 Man Boobs Opti || Enhancements: OFF || CBV1 || Batch 2 || 1C || 11/02/25w07 || Kostas,SHARE,$26,"1,743",2025-02-11,2025-02-21,10
245,CB_2025_Jan_FB_3776_DT-DP_V01_9x16_VID_EN_New_C-SplitScreen_Sale_CTA-70_Angle-W_M-NONE_VL-15s_G-NONE_P-OG_S-NEW,3776 - New Idea - post pregnancy weight loss || Enhancements: OFF || CBV1 || Batch 1 || 1C || 04/02/25w06 || Kostas,VIDEO,$26,897,2025-02-04,2025-02-11,7
246,CB_2023_Jul_FB_2226_MB_V04_9x16_VID_EN_Opti_C-Testim_CTA-SMR_Pain-W_M-MIX_VL-30s_TR-None_G-F_P-None_S-Starry,US || Manual Bid || BFCM || COST CAP 91 || 1C || 15/11/24,VIDEO,$25,682,2024-11-15,2025-02-27,104
247,CB_2025_Jan_FB_3777_CHUB-KZ_V02_4x5_IMG_EN_Opti_C-NONE_CTA-NONE_Angle-C_M-NONE_VL-None_TR-None_G-NONE_P-NONE_S-NONE,3777 - 3696 Opti || Enhancements: OFF || CBV1 || Batch 1 || 1C || 11/02/25w07 || Kostas,SHARE,$25,"1,510",2025-02-11,2025-02-21,10
248,CB_2025_Jan_FB_3770_CHUB_V01_9x16_VID_EN_New_C-NONE_CTA-NONE_Angle-None_M-NONE_VL-None_TR-None_G-NONE_P-NONE_S-NONE,3770 - HM4Things CHUB || Enhancements: OFF || CBV1 || Batch 1 || 1C || 09/02/25w07 || Kostas,VIDEO,$25,"1,089",2025-02-09,2025-02-14,5
249,CB_2025_Feb_FB_3787_CHUB_V01_9x16_VID_EN_New_C-NONE_CTA-NONE_Angle-None_M-NONE_VL-None_TR-None_G-NONE_P-NONE_S-NONE,3787 - DadBod Messaging CHUB || Enhancements: OFF || CBV1 || Batch 1 || 7DC || 16/02/25w08 || Kostas,SHARE,$24,969,2025-02-16,2025-02-24,8
250,CB_2023_Jul_FB_2217_IB_V04_9x16_VID_EN_Opti_C-Pointing_CTA-SMR_Pain-W-B_M-TRC_VL-30s_TR-None_G-F_P-None_S-FRIGGA,US || Manual Bid || BFCM || COST CAP 81 || 1C || 15/11/24,VIDEO,$23,746,2024-11-15,2025-03-16,121
251,CB_2025_Jan_FB_3742_SO-DP-KB_V03_4x5_IMG_EN_Opti_C-NONE_Evergreen_CTA-SALE_Angle-W_M-NONE_VL-None_G-NONE_P-CBV2_S-NONE3665V01,3742 -  3665_V01 OPTI for PREMIUM 3 || 1C || 31/01/2025w05,SHARE,$22,"1,343",2025-01-31,2025-02-10,10
252,CB_2025_Jan_FB_3772_DT-DP_V03_4x5_VID_EN_New_C-SplitScreen_Sale_CTA-70_Angle-W_M-NONE_VL-15s_G-NONE_P-OG_S-NEW,3772 - Split-screen ads_VID CB V1 || Enhancements: OFF || CBV1 || Batch 1 || 1C || 04/02/25w06 || Kostas,VIDEO,$22,711,2025-02-04,2025-02-11,7
253,CB_2025_Feb_FB_3801_SO-KB_V12_1x1_IMG_EN_New_C-A-Compare_Evergreen_CTA-NONE_Angle-W_M-NONE_VL-None_G-NONE_P-OG_S-NONE,3801 - America_s favorite meal ads || Enhancements: OFF || CBV1 || Batch 3 || 7DC || 12/02/25w07 || Kostas,SHARE,$21,853,2025-02-12,2025-02-18,6
254,CB_2025_Feb_FB_3793_VK-DP_V08_1x1_VID_EN_Opti_C-BulletPoints_Evergreen_CTA-70_Angle-W-B-C_M-NONE_VL-None_G-F_P-OG_S-NEW_FB3705V02,3793 -  3705 test opti || Enhancements: OFF || CBV1 || Batch 2 || 1C || 11/02/25w07 || Kostas,SHARE,$21,"1,521",2025-02-11,2025-02-17,6
255,CB_2025_Feb_FB_3799_SO-KB_V05_1x1_IMG_EN_New_C-A-Compare_Evergreen_CTA-NONE_Angle-W_M-NONE_VL-None_G-NONE_P-OG_S-NONE,3799 - Don_t change your habits || Enhancements: OFF || CBV1 || Batch 2 || 7DC || 12/02/25w07 || Kostas,SHARE,$21,934,2025-02-12,2025-02-21,9
256,CB_2025_Jan_FB_3742_SO-DP-KB_V06_4x5_IMG_EN_Opti_C-NONE_Evergreen_CTA-SALE_Angle-W_M-NONE_VL-None_G-NONE_P-CBV2_S-NONE3665V01,CBV2 || US || Manual Bid: ROAS GOAL: 0.9 -> 1.00 || 7DC || 22/01/2025,SHARE,$21,755,2025-02-11,2025-03-27,44
257,CB_2025_Feb_FB_3819_DT_V01_9x16_GIF_EN_Opti_C-NONE_Evergreen_CTA-None_Angle-W_M-NONE_VL-None_G-NONE_P-NONE_S-New_FB3723V04,3819 - #7 Goodbye Man boobs || Enhancements: OFF || CBV1 || Batch 1 || 7DC || 14/02/25w07 || Kostas,SHARE,$21,"1,074",2025-02-14,2025-02-21,7
258,CB_2025_Jan_FB_3746_CHUB-AA_V08_4x5_IMG_EN_Opti_C-NONE_CTA-NONE_Angle-C_M-NONE_VL-None_TR-None_G-NONE_P-NONE_S-NONE,3746 â€“ 3660 G-nugget OPTI v3 || Enhancements: OFF || CBV1 || Batch 2 || 1C || 30/01/25w05 || Kostas,SHARE,$21,"1,143",2025-01-30,2025-02-14,15
259,CB_2025_Jan_FB_3759_VK_V10_4x5_VID_EN_New_C-BulletPoints_Evergreen_CTA-NONE_Angle-W-B-C_M-NONE_VL-15s_G-M_P-OG_S-NEW,3761 - testis to to video 3722 || Enhancements: OFF || CBV1 || Batch 3 || 1C || 03/02/25w06 || Kostas,SHARE,$20,"1,560",2025-02-04,2025-02-11,7
260,CB_2025_Feb_FB_3801_SO-KB_V09_1x1_IMG_EN_New_C-A-Compare_Evergreen_CTA-NONE_Angle-W_M-NONE_VL-None_G-NONE_P-OG_S-NONE,3801 - America_s favorite meal ads || Enhancements: OFF || CBV1 || Batch 3 || 7DC || 12/02/25w07 || Kostas,SHARE,$20,673,2025-02-12,2025-02-18,6
261,CB_2025_Feb_FB_3812_SO_V09_4x5_IMG_EN_Opti_C-NONE_Evergreen_CTA-SALE_Angle-W_M-NONE_VL-None_G-NONE_P-NONE_S-NONE_FB3723V07,3812 - 3723 Man Boobs Opti || Enhancements: OFF || CBV1 || Batch 3 || 1C || 11/02/25w07 || Kostas,SHARE,$20,"1,367",2025-02-11,2025-02-22,11
262,CB_2025_Jan_FB_3750_LZ-VU_V05_4x5_IMG_EN_Opti_C-NegativeMark_Evergreen_CTA-NONE_Angle-W_M-NONE_VL-None_G-NONE_P-NONE_S-NONE_FB3251V01,3750 - bioma ripoff march soft version || Enhancements: OFF || CBV1 || Batch 1 || 1C || 24/01/25w04 || Kostas,SHARE,$19,674,2025-01-24,2025-02-17,24
263,CB_2025_Jan_FB_3771_VK-DP_V07_9x16_VID_EN_New_C-BulletPoints_Evergreen_CTA-70_Angle-W-B-C_M-GLAD_VL-30s_G-F_P-OG_S-NEW,3771 - New idea spot the lie for CB V1 - DP-VK || Enhancements: OFF || CBV1 || Batch 2 || 1C || 04/02/25w06 || Kostas,SHARE,$19,998,2025-02-04,2025-02-11,7
264,CB_2025_Jan_FB_3798_CHUB_V01_9x16_VID_EN_New_C-NONE_CTA-NONE_Angle-None_M-NONE_VL-None_TR-None_G-NONE_P-NONE_S-NONE,3798 - ConfusedDog CHUB 2 || Enhancements: OFF || CBV1 || Batch 1 || 7DC || 16/02/25w08 || Kostas,VIDEO,$19,"1,009",2025-02-16,2025-02-20,4
265,CB_2022_Mar3_FB_713_IK_V04_1x1_IMG_EN_Opti_C-WrittenTesti_HE-98_A-ExtremeBodyVisualization_HK-bodypart_Pain-W_CLR-PURPLE_BG-IMAGE_ME-MIX_MA-YOUNG,US || Manual Bid || BFCM || COST CAP 91 || 1C || 15/11/24,SHARE,$19,"1,089",2024-11-15,2025-02-27,104
266,CB_2025_Feb_FB_3797_VK-DP_V01_1x1_IMG_EN_Opti_C-BulletPoints_Evergreen_CTA-70_Angle-W-B-C_M-NONE_VL-None_G-F_P-OG_S-NEW_FB3639V03,3797 - Man boobs-dad bod angle_IMG CB V1 - VK || Enhancements: OFF || CBV1 || Batch 1 || 7DC || 11/02/25w07 || Kostas,SHARE,$19,978,2025-02-11,2025-02-17,6
267,CB_2025_Feb_FB_3804_LZ-KB_V03_1x1_VID_EN_New_C-BulletPoints_Evergreen_CTA-NONE_Angle-GH_M-NONE_VL-None_G-NONE_P-NONE_S-NONE,3804 - fit back into your jeans || Enhancements: OFF || CBV1 || Batch 1 || 7DC || 12/02/25w07 || Kostas,SHARE,$18,660,2025-02-12,2025-02-17,5
268,CB_2025_Jan_FB_3759_VK_V03_4x5_VID_EN_New_C-BulletPoints_Evergreen_CTA-NONE_Angle-W-B-C_M-NONE_VL-15s_G-M_P-OG_S-NEW,3761 - testis to to video 3722 || Enhancements: OFF || CBV1 || Batch 1 || 1C || 03/02/25w06 || Kostas,SHARE,$18,968,2025-02-04,2025-02-11,7
269,CB_2025_Feb_FB_3812_SO_V06_4x5_IMG_EN_Opti_C-NONE_Evergreen_CTA-SALE_Angle-W_M-NONE_VL-None_G-NONE_P-NONE_S-NONE_FB3723V07,3812 - 3723 Man Boobs Opti || Enhancements: OFF || CBV1 || Batch 2 || 1C || 11/02/25w07 || Kostas,SHARE,$18,"1,360",2025-02-11,2025-02-21,10
270,CB_2025_Jan_FB_3759_VK_V12_4x5_VID_EN_New_C-BulletPoints_Evergreen_CTA-NONE_Angle-W-B-C_M-NONE_VL-15s_G-M_P-OG_S-NEW,3761 - testis to to video 3722 || Enhancements: OFF || CBV1 || Batch 3 || 1C || 03/02/25w06 || Kostas,SHARE,$17,"1,012",2025-02-04,2025-02-11,7
271,CB_2025_Jan_FB_3786_LZ_V04_1x1_IMG_EN_New_C-Educational_Evergreen_CTA-SALE_Angle-GH_M-NONE_VL-None_G-NONE_P-OG_S-NONE,3786 - #92 Notion idea gamers' diet || Enhancements: OFF || CBV1 || Batch 1 || 7C || 09/02/25w07 || Kostas,SHARE,$17,785,2025-02-09,2025-02-17,8
272,CB_2025_Feb_FB_3806_SO-KB_V06_1x1_IMG_EN_New_C-A-Compare_Evergreen_CTA-NONE_Angle-W_M-NONE_VL-None_G-NONE_P-OG_S-NONE,"3806 - Brief Results, not resolutions || Enhancements: OFF || CBV1 || Batch 2 || 7DC || 12/02/25w07 || Kostas",SHARE,$17,"1,081",2025-02-12,2025-02-17,5
273,CB_2025_Jan_FB_3745_CHUB_V01_4x5_IMG_EN_Opti_C-NONE_CTA-NONE_Angle-B_M-NONE_VL-None_TR-None_G-F_P-OG_S-NONE,3745 - 3661 Methane Balloon OPTI || Enhancements: OFF || CBV1 || Batch 1 || 1C || 30/01/25w05 || Kostas,SHARE,$17,931,2025-01-30,2025-02-13,14
274,CB_2025_Feb_FB_3812_SO_V02_4x5_IMG_EN_Opti_C-NONE_Evergreen_CTA-SALE_Angle-W_M-NONE_VL-None_G-NONE_P-NONE_S-NONE_FB3723V07,3812 - 3723 Man Boobs Opti || Enhancements: OFF || CBV1 || Batch 1 || 1C || 11/02/25w07 || Kostas,SHARE,$16,"1,186",2025-02-11,2025-02-26,15
275,CB_2025_Feb_FB_3792_SO-RP_V08_1x1_IMG_EN_Opti_C-NegativeMark_Sale_CTA-Vday_Angle-Cort_M-NONE_VL-None_G-NONE_P-NONE_S-NONE_FB3251V02,3792 - 3072 Valentines opti IMG || Enhancements: OFF || CBV1 || Batch 2 || 1C || 09/02/25w07 || Kostas,SHARE,$16,726,2025-02-09,2025-02-17,8
276,CB_2025_Feb_FB_3809_LZ-JT_V02_1x1_IMG_EN_New_C-Educational_Evergreen_CTA-NONE_Angle-C_M-NONE_VL-None_G-NONE_P-NONE_S-NONE,3809 - 30 day detox RED 40 LBS || Enhancements: OFF || CBV1 || Batch 1 || 7DC || 12/02/25w07 || Kostas,SHARE,$16,776,2025-02-12,2025-02-17,5
277,CB_2025_Jan_FB_3766_SO_V02_4x5_IMG_EN_Opti_C-Headline_Evergreen_CTA-NONE_Angle-W-B-C_M-NONE_VL-None_G-NONE_P-NONE_S-NONE_3700V08,3766 - 3700 copy opti || Enhancements: OFF || CBV1 || Batch 1 || 1C || 03/02/25w06 || Kostas,SHARE,$16,"1,066",2025-02-04,2025-02-22,18
278,CB_2025_Feb_FB_3782_CHUB_V01_9x16_VID_EN_New_C-NONE_CTA-NONE_Angle-None_M-NONE_VL-None_TR-None_G-NONE_P-NONE_S-NONE,Relaunch -  3782 - Political weight loss journey CHUB || Enhancements: OFF || CBV1 || Batch 1 || 1C || 11/02/25w07 || Kostas,VIDEO,$16,844,2025-02-10,2025-02-10,0
279,CB_2025_Feb_FB_3787_CHUB_V03_9x16_VID_EN_New_C-NONE_CTA-NONE_Angle-None_M-NONE_VL-None_TR-None_G-NONE_P-NONE_S-NONE,3787 - DadBod Messaging CHUB || Enhancements: OFF || CBV1 || Batch 1 || 7DC || 16/02/25w08 || Kostas,SHARE,$16,460,2025-02-16,2025-02-24,8
280,CB_2025_Jan_FB_3742_SO-DP-KB_V01_4x5_IMG_EN_Opti_C-NONE_Evergreen_CTA-SALE_Angle-W_M-NONE_VL-None_G-NONE_P-CBV2_S-NONE3665V01,CBV2 || EU (UK) || ðŸ’° Advantage+ || US || BROAD || 7C || Existing_customer_5% || 15/12/24 Ad set,SHARE,$15,697,2025-02-04,2025-03-27,51
281,CB_2025_Jan_FB_3786_LZ_V03_1x1_IMG_EN_New_C-Educational_Evergreen_CTA-SALE_Angle-GH_M-NONE_VL-None_G-NONE_P-OG_S-NONE,3786 - #92 Notion idea gamers' diet || Enhancements: OFF || CBV1 || Batch 1 || 7C || 09/02/25w07 || Kostas,SHARE,$15,735,2025-02-09,2025-02-17,8
282,CB_2025_Jan_FB_3742_SO-DP-KB_V02_4x5_IMG_EN_Opti_C-NONE_Evergreen_CTA-SALE_Angle-W_M-NONE_VL-None_G-NONE_P-CBV2_S-NONE3665V01,3742 -  3665_V01 OPTI for PREMIUM 3 || 1C || 31/01/2025w05,SHARE,$14,811,2025-01-31,2025-02-10,10
283,CB_2025_Feb_FB_3792_SO-RP_V09_1x1_IMG_EN_Opti_C-NegativeMark_Sale_CTA-Vday_Angle-Cort_M-NONE_VL-None_G-NONE_P-NONE_S-NONE_FB3251V02,3792 - 3072 Valentines opti IMG || Enhancements: OFF || CBV1 || Batch 2 || 1C || 09/02/25w07 || Kostas,SHARE,$13,753,2025-02-09,2025-02-17,8
284,CB_2025_Feb_FB_3799_SO-KB_V02_1x1_IMG_EN_New_C-A-Compare_Evergreen_CTA-NONE_Angle-W_M-NONE_VL-None_G-NONE_P-OG_S-NONE,3799 - Don_t change your habits || Enhancements: OFF || CBV1 || Batch 1 || 7DC || 12/02/25w07 || Kostas,SHARE,$13,605,2025-02-12,2025-02-18,6
285,CB_2025_Jan_FB_3778_DT-DP_V02_9x16_VID_EN_Opti_C-Benefits_Sale_CTA-70_Angle-W-B_M-MAN_VL-45s_G-M_P-OG_S-WHAT_FB3097V03,3778 - Opti 3097 || Enhancements: OFF || CBV1 || Batch 1 || 1C || 04/02/25w06 || Kostas,VIDEO,$13,458,2025-02-04,2025-02-11,7
286,CB_2024_Mar_FB_2888_JG_V01_9x16_IMG_EN_Opti_C-Benefits_CTA-NONE_Pain-W_M-NONE_VL-None_TR-None_G-NONE_P-V2_S-NONE,CBV2 || AU || ðŸ’° Advantage+ || US || BROAD || 7C || Existing_customer_5% || 19/12/24 Ad set,SHARE,$13,568,2024-12-19,2025-03-27,98
287,CB_2024_Nov_FB_3336_CH_V15_1x1_IMG_EN_Opti_C-Headline_CTA-NONE_Angle-C_P-NONE,3336 Creative Hub â€“ Golden nuggets V1 - Opti [Not tested] || Enhancements: OFF || CBV1 || Batch 1 || 1C || 11/02/25w07 || Kostas,SHARE,$12,740,2025-02-11,2025-02-21,10
288,CB_2025_Jan_FB_3723_SO_V01_4x5_IMG_EN_New_C-NONE_Evergreen_CTA-SALE_Angle-W_M-NONE_VL-None_G-NONE_P-NONE_S-NONE,3723 - Notion Idea #92 MAN BOOBS || Enhancements: OFF || CBV1 || Batch 1 || 1C || 28/01/25w05 || Kostas,SHARE,$12,845,2025-01-28,2025-02-24,27
289,CB_2025_Feb_FB_3799_SO-KB_V02_1x1_IMG_EN_New_C-A-Compare_Evergreen_CTA-NONE_Angle-W_M-NONE_VL-None_G-NONE_P-OG_S-NONE,3801 - America_s favorite meal ads || Enhancements: OFF || CBV1 || Batch 1 || 7DC || 12/02/25w07 || Kostas,SHARE,$11,520,2025-02-12,2025-02-17,5
290,CB_2025_Jan_FB_3776_DT-DP_V02_9x16_VID_EN_New_C-SplitScreen_Sale_CTA-70_Angle-W_M-NONE_VL-15s_G-NONE_P-OG_S-NEW,3776 - New Idea - post pregnancy weight loss || Enhancements: OFF || CBV1 || Batch 1 || 1C || 04/02/25w06 || Kostas,VIDEO,$11,592,2025-02-04,2025-02-11,7
291,CB_2025_Jan_FB_3771_VK-DP_V05_9x16_VID_EN_New_C-BulletPoints_Evergreen_CTA-70_Angle-W-B-C_M-GLAD_VL-30s_G-F_P-OG_S-NEW,3771 - New idea spot the lie for CB V1 - DP-VK || Enhancements: OFF || CBV1 || Batch 2 || 1C || 04/02/25w06 || Kostas,VIDEO,$10,481,2025-02-04,2025-02-11,7
292,CB_2025_FEB_FB_3666_VK-JT_V03_4x5_VID_EN_NEW_C-BulletPoints_Sale_CTA-NY_Angle-W-B-C_M-TRC_VL-30s_G-F_P-OG_S-NEW,ðŸŒ¶ï¸ || US || ASC+ || ->CC141 || VIDEO Only || US+CA || 0% EXISTING CAP || 7C || 07/08.24  Ad set,VIDEO,$10,527,2025-01-20,2025-03-19,58
293,CB_2025_Feb_FB_3792_SO-RP_V04_1x1_IMG_EN_Opti_C-NegativeMark_Sale_CTA-Vday_Angle-Cort_M-NONE_VL-None_G-NONE_P-NONE_S-NONE_FB3251V02,3792 - 3072 Valentines opti IMG || Enhancements: OFF || CBV1 || Batch 1 || 1C || 09/02/25w07 || Kostas,SHARE,$10,482,2025-02-09,2025-02-16,7
294,CB_2023_Jul_FB_2217_IB_V04_9x16_VID_EN_Opti_C-Pointing_CTA-SMR_Pain-W-B_M-TRC_VL-30s_TR-None_G-F_P-None_S-FRIGGA,US || Manual Bid || BFCM || COST CAP 71 || 1C || 15/11/24,VIDEO,$9,305,2024-11-15,2025-03-27,132
295,CB_2025_Feb_FB_3801_SO-KB_V05_1x1_IMG_EN_New_C-A-Compare_Evergreen_CTA-NONE_Angle-W_M-NONE_VL-None_G-NONE_P-OG_S-NONE,3801 - America_s favorite meal ads || Enhancements: OFF || CBV1 || Batch 2 || 7DC || 12/02/25w07 || Kostas,SHARE,$9,425,2025-02-12,2025-02-17,5
296,CB_2024_Nov_FB_3336_CH_V16_1x1_IMG_EN_Opti_C-Headline_CTA-NONE_Angle-C_P-NONE,3336 Creative Hub â€“ Golden nuggets V1 - Opti [Not tested] || Enhancements: OFF || CBV1 || Batch 1 || 1C || 11/02/25w07 || Kostas,SHARE,$9,592,2025-02-11,2025-02-21,10
297,CB_2025_Feb_FB_3799_SO-KB_V04_1x1_IMG_EN_New_C-A-Compare_Evergreen_CTA-NONE_Angle-W_M-NONE_VL-None_G-NONE_P-OG_S-NONE,3799 - Don_t change your habits || Enhancements: OFF || CBV1 || Batch 1 || 7DC || 12/02/25w07 || Kostas,SHARE,$9,460,2025-02-12,2025-02-18,6
298,CB_2025_Feb_FB_3806_SO-KB_V05_1x1_IMG_EN_New_C-A-Compare_Evergreen_CTA-NONE_Angle-W_M-NONE_VL-None_G-NONE_P-OG_S-NONE,"3806 - Brief Results, not resolutions || Enhancements: OFF || CBV1 || Batch 2 || 7DC || 12/02/25w07 || Kostas",SHARE,$9,"1,270",2025-02-12,2025-02-17,5
299,CB_2025_Jan_FB_3767_VK-DP_V05_9x16_VID_EN_New_C-BulletPoints_Evergreen_CTA-NONE_Angle-W-B-C_M-TRC_VL-15s_G-M_P-OG_S-NEW,3767 - Short video new idea CB V1 - DP || Enhancements: OFF || CBV1 || Batch 2 || 1C || 03/02/25w06 || Kostas,VIDEO,$8,491,2025-02-04,2025-02-13,9
300,CB_2025_Jan_FB_3798_CHUB_V03_9x16_VID_EN_New_C-NONE_CTA-NONE_Angle-None_M-NONE_VL-None_TR-None_G-NONE_P-NONE_S-NONE,3798 - ConfusedDog CHUB 2 || Enhancements: OFF || CBV1 || Batch 1 || 7DC || 16/02/25w08 || Kostas,VIDEO,$8,363,2025-02-16,2025-02-20,4
301,CB_2024_Oct_FB_3251_LZ-VU_V01_1x1_IMG_EN_New_C-NegativeMark_Evergreen_CTA-NONE_Angle-Cort_M-NONE_VL-None_G-NONE_P-NONE_S-NONE.png,US || Manual Bid || BFCM || COST CAP 91 || 1C || 15/11/24,SHARE,$8,254,2024-11-15,2025-02-27,104
302,CB_2025_Jan_FB_3771_VK-DP_V02_9x16_VID_EN_New_C-BulletPoints_Evergreen_CTA-NONE_Angle-W-B-C_M-MAG_VL-15s_G-M_P-OG_S-NEW,3771 - New idea spot the lie for CB V1 - DP-VK || Enhancements: OFF || CBV1 || Batch 1 || 1C || 04/02/25w06 || Kostas,VIDEO,$8,401,2025-02-04,2025-02-11,7
303,CB_2025_Feb_FB_3792_SO-RP_V02_1x1_IMG_EN_Opti_C-NegativeMark_Sale_CTA-Vday_Angle-Cort_M-NONE_VL-None_G-NONE_P-NONE_S-NONE_FB3251V02,3792 - 3072 Valentines opti IMG || Enhancements: OFF || CBV1 || Batch 1 || 1C || 09/02/25w07 || Kostas,SHARE,$8,314,2025-02-09,2025-02-16,7
304,CB_2025_Feb_FB_3809_LZ-JT_V01_1x1_IMG_EN_New_C-Educational_Evergreen_CTA-NONE_Angle-GH_M-NONE_VL-None_G-NONE_P-NONE_S-NONE,3809 - 30 day detox RED 40 LBS || Enhancements: OFF || CBV1 || Batch 1 || 7DC || 12/02/25w07 || Kostas,SHARE,$7,374,2025-02-12,2025-02-17,5
305,CB_2025_Feb_FB_3806_SO-KB_V02_1x1_IMG_EN_New_C-A-Compare_Evergreen_CTA-NONE_Angle-W_M-NONE_VL-None_G-NONE_P-OG_S-NONE,"3806 - Brief Results, not resolutions || Enhancements: OFF || CBV1 || Batch 1 || 7DC || 12/02/25w07 || Kostas",SHARE,$7,632,2025-02-12,2025-02-18,6
306,CB_2022_Nov_FB_1218_RS_V15_9x16_IMG_EN_Opti_C-Sale_CTA-BLACK_Pain-W_M-NONE_VL-None FB1671V08,US || Manual Bid || BFCM || COST CAP 91 || 1C || 15/11/24,SHARE,$7,281,2024-11-15,2025-02-27,104
307,CB_2023_May_FB_2103_MB_V02_9x16_VID_EN_Opti_C-Sale_CTA-SMR_Pain-W_M-JOG_VL-30s_TR-None_G-M-F_P-None_S-What,US || Manual Bid || BFCM || COST CAP 71 || 1C || 15/11/24,VIDEO,$7,171,2024-11-15,2025-03-27,132
308,CB_2025_Jan_FB_3723_SO_V08_4x5_IMG_EN_New_C-NONE_Evergreen_CTA-SALE_Angle-W_M-NONE_VL-None_G-NONE_P-NONE_S-NONE,3723 - Notion Idea #92 MAN BOOBS || Enhancements: OFF || CBV1 || Batch 2 || 1C || 28/01/25w05 || Kostas,SHARE,$7,524,2025-01-28,2025-02-18,21
309,CB_2025_Jan_FB_3766_SO_V04_4x5_IMG_EN_Opti_C-Headline_Evergreen_CTA-NONE_Angle-W-B-C_M-NONE_VL-None_G-NONE_P-NONE_S-NONE_3700V08,3766 - 3700 copy opti || Enhancements: OFF || CBV1 || Batch 1 || 1C || 03/02/25w06 || Kostas,SHARE,$7,414,2025-02-04,2025-02-22,18
310,CB_2025_Feb_FB_3799_SO-KB_V01_1x1_IMG_EN_New_C-A-Compare_Evergreen_CTA-NONE_Angle-W_M-NONE_VL-None_G-NONE_P-OG_S-NONE,3801 - America_s favorite meal ads || Enhancements: OFF || CBV1 || Batch 1 || 7DC || 12/02/25w07 || Kostas,SHARE,$7,348,2025-02-12,2025-02-17,5
311,CB_2025_Feb_FB_3782_CHUB_V03_9x16_VID_EN_New_C-NONE_CTA-NONE_Angle-None_M-NONE_VL-None_TR-None_G-NONE_P-NONE_S-NONE,Relaunch - 3782 - Political weight loss journey CHUB || Enhancements: OFF || CBV1 || Batch 2 || 1C || 11/02/25w07 || Kostas,VIDEO,$6,428,2025-02-10,2025-02-17,7
312,CB_2025_Jan_FB_3772_DT-DP_V02_4x5_VID_EN_New_C-SplitScreen_Sale_CTA-70_Angle-W_M-NONE_VL-15s_G-NONE_P-OG_S-NEW,3772 - Split-screen ads_VID CB V1 || Enhancements: OFF || CBV1 || Batch 1 || 1C || 04/02/25w06 || Kostas,VIDEO,$6,207,2025-02-04,2025-02-11,7
313,CB_2025_Feb_FB_3784_SO-RP_V09_4x5_IMG_EN_Opti_C-Headline_Evergreen_CTA-NONE_Angle-W_M-NONE_VL-None_G-NONE_P-OG_S-NONE_FB3726V01,3784 - 3726 ad copy opti || Enhancements: OFF || CBV1 || Batch 2 || 1C || 09/02/25w07 || Kostas,SHARE,$6,730,2025-02-09,2025-02-26,17
314,CB_2025_Jan_FB_3781_LZ-DP_V01_9x16_GIF_EN_Opti_C-Headline_Evergreen_CTA-NONE_Angle-W_M-NONE_VL-15s_G-NONE_P-OG_S-NEW_FB3608V03,3781 - Hypnosis GIF opti || Enhancements: OFF || CBV1 || Batch 1 || 1C || 04/02/25w06 || Kostas,SHARE,$5,190,2025-02-04,2025-02-11,7
315,CB_2024_Dec_FB_3622_LZ-KB_V03_4x5_IMG_EN_Opti_C-NONE_Sale_CTA-XMAS_Angle-GH_M-NONE_VL-None_G-NONE_P-OG_S-NONE_FB2227V08 - Copy,US || Manual Bid || BID CAP 111 || 1C || 21/12/24,SHARE,$5,170,2024-12-22,2025-03-26,94
316,CB_2024_Jan_FB_2762_IK_V04_1x1_IMG_EN_New_C-WrittenTesti_CTA-CTA_Pain-W-B-C_M-NONE_VL-None_TR-None_G-NONE_P-V2_S-NONE,CBV2 || AU || ðŸ’° Advantage+ || US || BROAD || 7C || Existing_customer_5% || 19/12/24 Ad set,SHARE,$4,129,2024-12-19,2025-03-27,98
317,CB_2025_Jan_FB_3759_VK_V08_4x5_VID_EN_New_C-BulletPoints_Evergreen_CTA-NONE_Angle-W-B-C_M-NONE_VL-15s_G-M_P-OG_S-NEW,3761 - testis to to video 3722 || Enhancements: OFF || CBV1 || Batch 2 || 1C || 03/02/25w06 || Kostas,SHARE,$4,272,2025-02-04,2025-02-11,7
318,CB_2025_Jan_FB_3770_CHUB_V03_9x16_VID_EN_New_C-NONE_CTA-NONE_Angle-None_M-NONE_VL-None_TR-None_G-NONE_P-NONE_S-NONE,3770 - HM4Things CHUB || Enhancements: OFF || CBV1 || Batch 1 || 1C || 09/02/25w07 || Kostas,VIDEO,$4,227,2025-02-09,2025-02-14,5
319,CB_2025_Jan_FB_3767_VK-DP_V01_9x16_VID_EN_New_C-BulletPoints_Evergreen_CTA-NONE_Angle-W-B-C_M-NONE_VL-15s_G-M_P-OG_S-NEW,3767 - Short video new idea CB V1 - DP || Enhancements: OFF || CBV1 || Batch 1 || 1C || 03/02/25w06 || Kostas,VIDEO,$4,186,2025-02-04,2025-02-11,7
320,CB_2024_Nov_FB_3336_CH_V14_1x1_IMG_EN_Opti_C-Headline_CTA-NONE_Angle-C_P-NONE - Copy,3336 Creative Hub â€“ Golden nuggets V1 - Opti [Not tested] || Enhancements: OFF || CBV1 || Batch 1 || 1C || 11/02/25w07 || Kostas,SHARE,$3,234,2025-02-11,2025-02-20,9
321,CB_2025_Jan_FB_3742_SO-DP-KB_V03_4x5_IMG_EN_Opti_C-NONE_Evergreen_CTA-SALE_Angle-W_M-NONE_VL-None_G-NONE_P-CBV2_S-NONE3665V01,3742 -  3665_V01 OPTI for PREMIUM 2 || Batch 1 || 1C || 29/01/2025w05,SHARE,$3,129,2025-01-30,2025-02-10,11
322,CB_2025_Jan_FB_3759_VK_V09_4x5_VID_EN_New_C-BulletPoints_Evergreen_CTA-NONE_Angle-W-B-C_M-NONE_VL-15s_G-M_P-OG_S-NEW,3761 - testis to to video 3722 || Enhancements: OFF || CBV1 || Batch 3 || 1C || 03/02/25w06 || Kostas,SHARE,$3,181,2025-02-04,2025-02-11,7
323,CB_2025_Jan_FB_3742_SO-DP-KB_V02_4x5_IMG_EN_Opti_C-NONE_Evergreen_CTA-SALE_Angle-W_M-NONE_VL-None_G-NONE_P-CBV2_S-NONE3665V01,3742 -  3665_V01 OPTI for PREMIUM 2 || Batch 1 || 1C || 29/01/2025w05,SHARE,$3,154,2025-01-30,2025-02-10,11
324,CB_2025_Jan_FB_3771_VK-DP_V04_9x16_VID_EN_New_C-BulletPoints_Evergreen_CTA-NONE_Angle-W-B-C_M-MAG_VL-15s_G-M_P-OG_S-NEW 2,3771 - New idea spot the lie for CB V1 - DP-VK || Enhancements: OFF || CBV1 || Batch 1 || 1C || 04/02/25w06 || Kostas,VIDEO,$3,204,2025-02-04,2025-02-11,7
325,CB_2025_Feb_FB_3799_SO-KB_V01_1x1_IMG_EN_New_C-A-Compare_Evergreen_CTA-NONE_Angle-W_M-NONE_VL-None_G-NONE_P-OG_S-NONE - Copy,3799 - Don_t change your habits || Enhancements: OFF || CBV1 || Batch 1 || 7DC || 12/02/25w07 || Kostas,SHARE,$3,141,2025-02-12,2025-02-18,6
326,CB_2025_Jan_FB_3724_CHUB-AA_V01_4x5_IMG_EN_New_C-NONE_CTA-NONE_Angle-C_M-NONE_VL-None_TR-None_G-M_P-OG_S-NONE,3724 Get Regular CHUB || Enhancements: OFF || CBV1 || Batch 1 || 1C || 29/01/25w05 || Kostas,SHARE,$3,179,2025-01-29,2025-02-13,15
327,CB_2025_Feb_FB_3782_CHUB_V05_9x16_VID_EN_New_C-NONE_CTA-NONE_Angle-None_M-NONE_VL-None_TR-None_G-NONE_P-NONE_S-NONE,Relaunch -  3782 - Political weight loss journey CHUB || Enhancements: OFF || CBV1 || Batch 1 || 1C || 11/02/25w07 || Kostas,VIDEO,$2,134,2025-02-10,2025-02-10,0
328,CB_2025_Feb_FB_3797_VK-DP_V02_1x1_IMG_EN_Opti_C-BulletPoints_Evergreen_CTA-70_Angle-W-B-C_M-NONE_VL-None_G-F_P-OG_S-NEW_FB3726V01,3797 - Man boobs-dad bod angle_IMG CB V1 - VK || Enhancements: OFF || CBV1 || Batch 1 || 7DC || 11/02/25w07 || Kostas,SHARE,$2,146,2025-02-11,2025-02-17,6
329,CB_2025_Jan_FB_3778_DT-DP_V03_9x16_VID_EN_Opti_C-Benefits_Sale_CTA-70_Angle-W-B_M-MAN_VL-45s_G-M_P-OG_S-WHAT_FB3097V03,3778 - Opti 3097 || Enhancements: OFF || CBV1 || Batch 1 || 1C || 04/02/25w06 || Kostas,SHARE,$2,156,2025-02-04,2025-02-11,7
330,CB_2025_Feb_FB_3780_DT-DP_V03_9x16_VID_EN_Opti_C-MakingOf_Sale_CTA-70_Angle-W-B_M-CRAZY_VL-45s_G-M_P-OG_S-NEW_FB3264V31,3780 - Crazy Trainer Hookerization || Enhancements: OFF || CBV1 || Batch 1 || 1C || 09/02/25w07 || Kostas,VIDEO,$2,148,2025-02-09,2025-02-15,6
331,CB_2025_Jan_FB_3766_SO_V03_4x5_IMG_EN_Opti_C-Headline_Evergreen_CTA-NONE_Angle-W-B-C_M-NONE_VL-None_G-NONE_P-NONE_S-NONE_3700V08,3766 - 3700 copy opti || Enhancements: OFF || CBV1 || Batch 1 || 1C || 03/02/25w06 || Kostas,SHARE,$2,145,2025-02-04,2025-02-22,18
332,CB_2025_Jan_FB_3687_DT_V03_4x5_VID_EN_Opti_C-MakingOf_Sale_CTA-VDAY_Angle-W-B-C_M-POW_VL-45s_G-M_P-OG_S-Moon_FB3090V02,3687 - Valentine_s Day Opti 3090 || Enhancements: OFF || CBV1 || Batch Ä… || 1C || 02/02/25w06 || Kostas,SHARE,$2,138,2025-02-02,2025-02-19,17
333,CB_2025_Jan_FB_3723_SO_V03_4x5_IMG_EN_New_C-NONE_Evergreen_CTA-SALE_Angle-W_M-NONE_VL-None_G-NONE_P-NONE_S-NONE,3723 - Notion Idea #92 MAN BOOBS || Enhancements: OFF || CBV1 || Batch 1 || 1C || 28/01/25w05 || Kostas,SHARE,$1,110,2025-01-28,2025-02-24,27
334,CB_2025_Feb_FB_3806_SO-KB_V01_1x1_IMG_EN_New_C-A-Compare_Evergreen_CTA-NONE_Angle-W_M-NONE_VL-None_G-NONE_P-OG_S-NONE,"3806 - Brief Results, not resolutions || Enhancements: OFF || CBV1 || Batch 1 || 7DC || 12/02/25w07 || Kostas",SHARE,$1,266,2025-02-12,2025-02-18,6
335,CB_2025_Jan_FB_3769_DT-JT_V01_9x16_VID_EN_Opti_C-BulletPoints_Sale_CTA-70_Angle-W-B-C_M-POW_VL-30s_G-F_P-OG_S-NEW_3666V03,3769 - Opti 3666 || Enhancements: OFF || CBV1 || Batch 1 || 1C || 04/02/25w06 || Kostas,VIDEO,$1,75,2025-02-04,2025-02-10,6
336,CB_2024_Dec_FB_3611_CHUB_V05_4x5_IMG_EN_Opti_C-Headline_CTA-NONE_Angle-C_P-NONE_S-NONE - Copy,US || Manual Bid || BID CAP 111 || 1C || 21/12/24,SHARE,$1,58,2024-12-27,2025-03-24,87
337,CB_2023_Jul_FB_2217_IB_V04_9x16_VID_EN_Opti_C-Pointing_CTA-SMR_Pain-W-B_M-TRC_VL-30s_TR-None_G-F_P-None_S-FRIGGA,US || Manual Bid || BID CAP 111 || 1C || 21/12/24,VIDEO,$1,35,2024-12-22,2025-03-24,92
338,CB_2025_Jan_FB_3718_CHUB_V06_4x5_IMG_EN_Opti_C-NONE_CTA-NONE_Angle-C_M-NONE_VL-None_TR-None_G-M_P-OG_S-NONE,3718 - Looking 15 people OPTI || Enhancements: OFF || CBV1 || Batch 2 || 1C || 29/01/25w05 || Kostas,SHARE,$1,53,2025-01-29,2025-02-20,22
339,CB_2025_Jan_FB_3740_SO-DP_V04_4x5_IMG_EN_Opti_C-Headline_Evergreen_CTA-NONE_Angle-W_M-NONE_VL-None_G-NONE_P-OG_S-NONE_3608V03,3740 - 3608_v03 OPTI || Enhancements: OFF || CBV1 || Batch 1 || 1C || 29/01/25w05 || Kostas,SHARE,$1,41,2025-01-29,2025-02-11,13
340,CB_2025_Jan_FB_3778_DT-DP_V01_9x16_VID_EN_Opti_C-Benefits_Sale_CTA-70_Angle-W-B_M-MAN_VL-45s_G-M_P-OG_S-WHAT_FB3097V03,3778 - Opti 3097 || Enhancements: OFF || CBV1 || Batch 1 || 1C || 04/02/25w06 || Kostas,VIDEO,$1,48,2025-02-04,2025-02-11,7
341,CB_2025_Jan_FB_3740_SO-DP_V02_4x5_IMG_EN_Opti_C-Headline_Evergreen_CTA-NONE_Angle-W_M-NONE_VL-None_G-NONE_P-OG_S-NONE_3608V03,3740 - 3608_v03 OPTI || Enhancements: OFF || CBV1 || Batch 1 || 1C || 29/01/25w05 || Kostas,SHARE,$1,19,2025-01-29,2025-02-11,13
342,CB_2025_Jan_FB_3723_SO_V05_4x5_IMG_EN_New_C-NONE_Evergreen_CTA-SALE_Angle-W_M-NONE_VL-None_G-NONE_P-NONE_S-NONE,3723 - Notion Idea #92 MAN BOOBS || Enhancements: OFF || CBV1 || Batch 1 || 1C || 28/01/25w05 || Kostas,SHARE,$1,46,2025-01-28,2025-02-24,27
343,CB_2025_Jan_FB_3781_LZ-DP_V03_9x16_GIF_EN_Opti_C-Headline_Evergreen_CTA-NONE_Angle-W_M-NONE_VL-15s_G-NONE_P-OG_S-NEW_FB3608V03,3781 - Hypnosis GIF opti || Enhancements: OFF || CBV1 || Batch 1 || 1C || 04/02/25w06 || Kostas,SHARE,$1,30,2025-02-04,2025-02-11,7
344,CB_2025_Jan_FB_3723_SO_V02_4x5_IMG_EN_New_C-NONE_Evergreen_CTA-SALE_Angle-W_M-NONE_VL-None_G-NONE_P-NONE_S-NONE,3723 - Notion Idea #92 MAN BOOBS || Enhancements: OFF || CBV1 || Batch 1 || 1C || 28/01/25w05 || Kostas,SHARE,$0,30,2025-01-28,2025-02-24,27
345,CB_2025_Jan_FB_3750_LZ-VU_V04_4x5_IMG_EN_Opti_C-NegativeMark_Evergreen_CTA-NONE_Angle-W_M-NONE_VL-None_G-NONE_P-NONE_S-NONE_FB3251V01,3750 - bioma ripoff march soft version || Enhancements: OFF || CBV1 || Batch 1 || 1C || 24/01/25w04 || Kostas,SHARE,$0,19,2025-01-24,2025-02-17,24
346,CB_2025_Jan_FB_3747_CHUB-AA_V02_9x16_IMG_EN_Opti_C-NONE_CTA-NONE_Angle-Sale_M-NONE_VL-None_TR-None_G-NONE_P-OG_S-NONE,3747 Clean Sale [HB winner ITR] CHUB || Enhancements: OFF || CBV1 || Batch Ä… || 1C || 02/02/25w06 || Kostas,SHARE,$0,24,2025-02-02,2025-03-27,53
347,CB_2025_Jan_FB_3738_SO-DP_V01_4x5_IMG_EN_Opti_C-NONE_Evergreen_CTA-SALE_Angle-W_M-NONE_VL-None_G-NONE_P-NONE_S-NONE3665V01,3738 - 3665_V01 OPTI || Enhancements: OFF || CBV1 || Batch 1 || 1C || 29/01/25w05 || Kostas,SHARE,$0,13,2025-01-29,2025-02-22,24
348,CB_2025_Jan_FB_3747_CHUB-AA_V01_4x5_IMG_EN_Opti_C-NONE_CTA-NONE_Angle-Sale_M-NONE_VL-None_TR-None_G-NONE_P-OG_S-NONE,3747 Clean Sale [HB winner ITR] CHUB || Enhancements: OFF || CBV1 || Batch Ä… || 1C || 02/02/25w06 || Kostas,SHARE,$0,10,2025-02-02,2025-03-27,53
349,CB_2025_Jan_FB_3779_VK-DP_V01_1x1_VID_EN_Opti_C-BulletPoints_Evergreen_CTA-70_Angle-W-B-C_M-NONE_VL-None_G-F_P-OG_S-NEW_FB3705V02,3779 - opti 3705 || Enhancements: OFF || CBV1 || Batch 1 || 1C || 04/02/25w06 || Kostas,SHARE,$0,7,2025-02-04,2025-03-20,44
350,CB_2025_Jan_FB_3718_CHUB_V04_4x5_IMG_EN_Opti_C-NONE_CTA-NONE_Angle-C_M-NONE_VL-None_TR-None_G-M_P-OG_S-NONE,3718 - Looking 15 people OPTI || Enhancements: OFF || CBV1 || Batch 2 || 1C || 29/01/25w05 || Kostas,SHARE,$0,8,2025-01-30,2025-02-20,21
351,CB_2024_Oct_FB_3251_LZ-VU_V01_1x1_IMG_EN_New_C-NegativeMark_Evergreen_CTA-NONE_Angle-Cort_M-NONE_VL-None_G-NONE_P-NONE_S-NONE.png,US || Manual Bid || BFCM || COST CAP 71 || 1C || 15/11/24,SHARE,$0,5,2024-11-15,2025-03-26,131
352,CB_2022_Mar3_FB_713_IK_V04_1x1_IMG_EN_Opti_C-WrittenTesti_HE-98_A-ExtremeBodyVisualization_HK-bodypart_Pain-W_CLR-PURPLE_BG-IMAGE_ME-MIX_MA-YOUNG,US || Manual Bid || BFCM || COST CAP 81 || 1C || 15/11/24,SHARE,$0,9,2024-11-15,2025-03-26,131
353,CB_2025_Jan_FB_3759_VK_V06_4x5_VID_EN_New_C-BulletPoints_Evergreen_CTA-NONE_Angle-W-B-C_M-NONE_VL-15s_G-M_P-OG_S-NEW,3761 - testis to to video 3722 || Enhancements: OFF || CBV1 || Batch 2 || 1C || 03/02/25w06 || Kostas,SHARE,$0,7,2025-02-04,2025-02-10,6
354,CB_2025_Jan_FB_3723_SO_V20_4x5_IMG_EN_New_C-NONE_Evergreen_CTA-SALE_Angle-W_M-NONE_VL-None_G-NONE_P-NONE_S-NONE,3723 - Notion Idea #92 MAN BOOBS || Enhancements: OFF || CBV1 || Batch 4 || 1C || 28/01/25w05 || Kostas,SHARE,$0,11,2025-01-28,2025-03-11,42
355,CB_2025_Jan_FB_3723_SO_V16_4x5_IMG_EN_New_C-NONE_Evergreen_CTA-SALE_Angle-W_M-NONE_VL-None_G-NONE_P-NONE_S-NONE,3723 - Notion Idea #92 MAN BOOBS || Enhancements: OFF || CBV1 || Batch 4 || 1C || 28/01/25w05 || Kostas,SHARE,$0,7,2025-01-28,2025-03-11,42
356,CB_2024_Oct_FB_3251_LZ-VU_V01_1x1_IMG_EN_New_C-NegativeMark_Evergreen_CTA-NONE_Angle-Cort_M-NONE_VL-None_G-NONE_P-NONE_S-NONE.png,US || Manual Bid || BID CAP 111 || 1C || 21/12/24,SHARE,$0,1,2024-12-26,2025-02-16,52
357,CB_2025_Jan_FB_3745_CHUB_V03_4x5_IMG_EN_Opti_C-NONE_CTA-NONE_Angle-B_M-NONE_VL-None_TR-None_G-F_P-OG_S-NONE,3745 - 3661 Methane Balloon OPTI || Enhancements: OFF || CBV1 || Batch 1 || 1C || 30/01/25w05 || Kostas,SHARE,$0,7,2025-01-30,2025-02-10,11
358,CB_2024_Oct_FB_3251_LZ-VU_V01_1x1_IMG_EN_New_C-NegativeMark_Evergreen_CTA-NONE_Angle-Cort_M-NONE_VL-None_G-NONE_P-NONE_S-NONE.png,US || Manual Bid || BFCM || COST CAP 81 || 1C || 15/11/24,SHARE,$0,2,2024-11-15,2025-03-17,122
359,CB_2025_Jan_FB_3779_VK-DP_V04_1x1_VID_EN_Opti_C-BulletPoints_Evergreen_CTA-70_Angle-W-B-C_M-NONE_VL-None_G-F_P-OG_S-NEW_FB3705V02,3779 - opti 3705 || Enhancements: OFF || CBV1 || Batch 1 || 1C || 04/02/25w06 || Kostas,SHARE,$0,14,2025-02-04,2025-03-20,44
360,CB_2025_Jan_FB_3747_CHUB-AA_V04_9x16_IMG_EN_Opti_C-NONE_CTA-NONE_Angle-Sale_M-NONE_VL-None_TR-None_G-NONE_P-OG_S-NONE,3747 Clean Sale [HB winner ITR] CHUB || Enhancements: OFF || CBV1 || Batch Ä… || 1C || 02/02/25w06 || Kostas,SHARE,$0,4,2025-02-02,2025-03-27,53
361,CB_2025_Jan_FB_3779_VK-DP_V03_1x1_VID_EN_Opti_C-BulletPoints_Evergreen_CTA-70_Angle-W-B-C_M-NONE_VL-None_G-F_P-OG_S-NEW_FB3705V02,3779 - opti 3705 || Enhancements: OFF || CBV1 || Batch 1 || 1C || 04/02/25w06 || Kostas,SHARE,$0,1,2025-02-04,2025-03-20,44
362,CB_2023_May_FB_2103_MB_V02_9x16_VID_EN_Opti_C-Sale_CTA-SMR_Pain-W_M-JOG_VL-30s_TR-None_G-M-F_P-None_S-What,US || Manual Bid || BID CAP 111 || 1C || 21/12/24,VIDEO,$0,1,2024-12-28,2025-03-27,89
363,CB_2023_Jul_FB_2226_MB_V04_9x16_VID_EN_Opti_C-Testim_CTA-SMR_Pain-W_M-MIX_VL-30s_TR-None_G-F_P-None_S-Starry,US || Manual Bid || BFCM || COST CAP 71 || 1C || 15/11/24,VIDEO,$0,1,2024-11-15,2025-03-27,132
364,CB_2022_Mar3_FB_713_IK_V04_1x1_IMG_EN_Opti_C-WrittenTesti_HE-98_A-ExtremeBodyVisualization_HK-bodypart_Pain-W_CLR-PURPLE_BG-IMAGE_ME-MIX_MA-YOUNG,US || Manual Bid || BFCM || COST CAP 71 || 1C || 15/11/24,SHARE,$0,1,2024-11-15,2025-03-27,132
