,Ad Name,Adset Name,Creative Type,Spend In USD,Impressions,First Ad Spend Date,Last Ad Spend Date,Days ad spending
1,CB_2025_Feb_FB_3883_LZ-RP_V05_9x16_VID_EN_Opti_C-BulletPoints_Evergreen_CTA-SALE_Angle-W_M-JANW_VL-30s_G-M_P-OG_S-WHAT_FB2284V05,ðŸŒ¶ï¸ || US || ASC+ || ->CC141 || VIDEO Only || US+CA || 0% EXISTING CAP || 7C || 07/08.24  Ad set,VIDEO,"$27,803","1,267,351",2025-03-28,2025-04-21,24
2,CB_2025_Mar_FB_3907_CHUB-AA_V03__IMG_EN_Opti_C-Price_CTA-NONE_Angle-None_M-NONE_VL-None_TR-None_G-NONE_P-OG_S-NONE,ðŸŒ¶ï¸ || US || ASC+ || ->CC141 || VIDEO Only || US+CA || 0% EXISTING CAP || 7C || 07/08.24  Ad set,SHARE,"$15,919","673,171",2025-03-25,2025-04-21,27
3,CB_2025_Mar_FB_3907_CHUB-AA_V03__IMG_EN_Opti_C-Price_CTA-NONE_Angle-None_M-NONE_VL-None_TR-None_G-NONE_P-OG_S-NONE,CA || ASC+ || 0% EXISTING || 7DC || 18.03.2025,SHARE,"$8,823","559,363",2025-03-27,2025-04-21,25
4,CB_2025_Mar_FB_3914_DT-DP_V01_9x16_VID_EN_New_C-Trend_Sale_CTA-SPRNG_Angle-W-B-C_M-JOG_VL-30s_G-F_P-OG_S-NEW,ðŸŒ¶ï¸ || US || ASC+ || ->CC141 || VIDEO Only || US+CA || 0% EXISTING CAP || 7C || 07/08.24  Ad set,VIDEO,"$7,119","272,481",2025-03-28,2025-04-21,24
5,Dynamic_Creative_Statics_CA_Flow,WC || CA || DYNAMIC CREATIVE Static winners || ADV+ audience || 7C || 16.02.2025,SHARE,"$6,268","408,758",2025-02-16,2025-04-21,64
6,CB_2025_Mar_FB_3910_LZ-DP_V04_9x16_VID_EN_Opti_C-Testimonial_Evergreen_CTA-NONE_Angle-W_M-TRC_VL-15s_G-F_P-TRIAL_S-FRIGGA_FB2217V04.mp4,US || Free trial offer || Trial ads || Trial purchase || 7C || 19/03/25,VIDEO,"$6,091","155,469",2025-03-19,2025-04-21,33
7,CB_2023_Jul_FB_2217_IB_V04_9x16_VID_EN_Opti_C-Pointing_CTA-SMR_Pain-W-B_M-TRC_VL-30s_TR-None_G-F_P-None_S-FRIGGA,ðŸŒ¶ï¸ || US || ASC+ || ->CC141 || VIDEO Only || US+CA || 0% EXISTING CAP || 7C || 07/08.24  Ad set,VIDEO,"$5,645","186,817",2024-08-07,2025-04-21,257
8,CB_2025_Feb_FB_3827_LZ_V01_1x1_IMG_EN_Opti_C-Headline_Evergreen_CTA-NONE_Angle-W_M-NONE_VL-None_G-M_P-CBV2_S-NONE_FB3723V04,CBV2 || US || Manual Bid: ROAS GOAL: 1.00 -> 1.1 || 7DC || 22/01/2025,SHARE,"$5,639","229,926",2025-02-18,2025-04-20,61
9,CB_2023_Dec_FB_2712_RS-DP_V02_1x1_VID_EN_Opti_C-WrittenTesti_CTA-SALE_Pain-W-B-C_M-NONE_VL-None_TR-None_G-NONE_P-V2_S-NONE_FB2227V08,CBV2 || EU (UK) || ðŸ’° Advantage+ || US || BROAD || 7C || Existing_customer_5% || 15/12/24 Ad set,VIDEO,"$4,036","192,763",2025-03-31,2025-04-21,21
10,CB_2025_Mar_FB_3924_SO-DP_V03_1x1_IMG_EN_New_C-NONE_Evergreen_CTA-NONE_Angle-W-B-C_M-NONE_VL-None_G-NONE_P-OG_S-NONE,CA || ASC+ || 0% EXISTING || 7DC || 18.03.2025,SHARE,"$3,721","305,725",2025-04-12,2025-04-21,9
11,CB_2025_Mar_FB_3909_DT-DP_V03_9x16_VID_EN_New_C-Trend_Evergreen_CTA-SMRBOD_Angle-W-B-C_M-JANW_VL-30s_G-M_P-OG_S-NEW,ðŸŒ¶ï¸ || US || ASC+ || ->CC141 || VIDEO Only || US+CA || 0% EXISTING CAP || 7C || 07/08.24  Ad set,VIDEO,"$3,638","202,876",2025-04-11,2025-04-21,10
12,CB_2025_Mar_FB_3950_SO_V11_4x5_IMG_EN_New_C-NONE_Evergreen_CTA-NONE_Angle-W-B-C_M-NONE_VL-None_G-NONE_P-OG_S-NONE,3950 - Image Gen by ChatGPT || Batch 3 || Enhancements: OFF || CBV1 || 7C || 30/03/25w14,SHARE,"$3,294","181,486",2025-03-30,2025-04-21,22
13,CB_2025_Feb_FB_3883_LZ-RP_V05_9x16_VID_EN_Opti_C-BulletPoints_Evergreen_CTA-SALE_Angle-W_M-JANW_VL-30s_G-M_P-OG_S-WHAT_FB2284V05,CA || ASC+ || 0% EXISTING || 7DC || 18.03.2025,VIDEO,"$3,279","235,444",2025-03-27,2025-04-21,25
14,CB_2025_Apr_FB_3975_LZ_V03_9x16_VID_EN_New_C-Testimonial_Evergreen_CTA-SALE_Angle-W_M-LAURA_VL-15s_G-F_P-OG_S-NEW,CBV2 || EU (UK) || ðŸ’° Advantage+ || US || BROAD || 7C || Existing_customer_5% || 15/12/24 Ad set,VIDEO,"$3,254","175,086",2025-04-14,2025-04-21,7
15,CB_2025_Jan_FB_3723_SO_V04_4x5_IMG_EN_New_C-NONE_Evergreen_CTA-SALE_Angle-W_M-NONE_VL-None_G-NONE_P-NONE_S-NONE,ðŸŒ¶ï¸ || US || ASC+ || ->CC141 || VIDEO Only || US+CA || 0% EXISTING CAP || 7C || 07/08.24  Ad set,SHARE,"$3,231","175,171",2025-02-12,2025-04-21,68
16,CB_2025_Apr_FB_3975_LZ_V03_9x16_VID_EN_New_C-Testimonial_Evergreen_CTA-SALE_Angle-W_M-LAURA_VL-15s_G-F_P-OG_S-NEW,CA || ASC+ || 0% EXISTING || 7DC || 18.03.2025,VIDEO,"$3,072","247,522",2025-04-12,2025-04-20,8
17,CB_2025_Mar_FB_3907_CHUB-AA_V03__IMG_EN_Opti_C-Price_CTA-NONE_Angle-None_M-NONE_VL-None_TR-None_G-NONE_P-OG_S-NONE,US || ASC+ || Website + Shop || 7DC || Existing 0% || 24.03.2025 Ad set,SHARE,"$2,855","91,497",2025-04-04,2025-04-21,17
18,CB_2024_Sep_FB_3175_DA-KB_V04_1x1_IMG_EN_New_C-ADVRT_Evergreen_CTA-NONE_Angle-W_M-NONE_VL-None_G-NONE_P-CBV2_S-NONE_blog_colonbroomvsmammothhighprice3_cv_en,CBV2 || A/B test CTA button: Variaton || CBV2 vs Happy Mammoth || 7C || 26/03/25,SHARE,"$2,794","106,841",2025-03-26,2025-04-21,26
19,CB_2024_Sep_FB_3175_DA-KB_V04_1x1_IMG_EN_New_C-ADVRT_Evergreen_CTA-NONE_Angle-W_M-NONE_VL-None_G-NONE_P-CBV2_S-NONE_blog_colonbroomvsmammoth_cv_en,CBV2 || UK || Advantage+ || Advertorial |  || 0% EXISTING CAP || BROAD || 7C || ad set 18/03/25,SHARE,"$2,736","107,038",2025-03-18,2025-04-21,34
20,CB_2025_Apr_FB_3975_LZ_V03_9x16_VID_EN_New_C-Testimonial_Evergreen_CTA-SALE_Angle-W_M-LAURA_VL-15s_G-F_P-OG_S-NEW,CBV2 || AU || ðŸ’° Advantage+ || US || BROAD || 7C || Existing_customer_5% || 19/12/24 Ad set,VIDEO,"$2,427","133,328",2025-04-12,2025-04-21,9
21,CB_2025_Mar_FB_3924_SO-DP_V03_1x1_IMG_EN_New_C-NONE_Evergreen_CTA-NONE_Angle-W-B-C_M-NONE_VL-None_G-NONE_P-OG_S-NONE,3924 - #17 man boobs/dad bod body text IMG || Batch 1 || Enhancements: OFF || CBV1 || 7C || 24/03/25w13,SHARE,"$2,413","115,103",2025-03-24,2025-04-21,28
22,CB_2025_Feb_FB_3827_LZ_V04_1x1_IMG_EN_Opti_C-Headline_Evergreen_CTA-SALE_Angle-W_M-NONE_VL-None_G-M_P-CBV2_S-NONE_FB3779V02,CBV2 || US || Manual Bid: ROAS GOAL: 1.00 -> 1.1 || 7DC || 22/01/2025,SHARE,"$2,393","75,758",2025-02-18,2025-04-17,58
23,CB_2024_Sep_FB_3175_DA-KB_V04_1x1_IMG_EN_New_C-ADVRT_Evergreen_CTA-NONE_Angle-W_M-NONE_VL-None_G-NONE_P-CBV2_S-NONE_blog_colonbroomvsmammoth_cv_en,CBV2 || Advantage+ || Advertorial || Higher pricing || US || 0% EXISTING CAP || BROAD || 7C || 20/01/25  Campaign Ad set,SHARE,"$2,365","102,105",2025-01-20,2025-04-21,91
24,CB_2025_Apr_FB_3995_DT-DP_V01_9x16_VID_EN_Opti_C-MakingOf_Evergreen_CTA-CTA_Angle-W-B_M-CRAZY_VL-45s_G-M_P-OG_S-NEW_FB3022V01,3995 - 3022 V01 opti || Batch 1 || Enhancements: OFF || CBV1 || 7C || 11/04/25w16,VIDEO,"$2,334","137,832",2025-04-11,2025-04-21,10
25,CB_2025_Mar_FB_3914_DT-DP_V01_9x16_VID_EN_New_C-Trend_Sale_CTA-SPRNG_Angle-W-B-C_M-JOG_VL-30s_G-F_P-OG_S-NEW,US || ASC+ || Website + Shop || 7DC || Existing 0% || 24.03.2025 Ad set,VIDEO,"$2,180","82,108",2025-04-04,2025-04-21,17
26,CB_2023_Jul_FB_2217_IB_V04_9x16_VID_EN_Opti_C-Pointing_CTA-SMR_Pain-W-B_M-TRC_VL-30s_TR-None_G-F_P-None_S-FRIGGA,US || Kilo Product's leads LAL || 7C || 04/03/25,VIDEO,"$2,104","73,110",2025-03-04,2025-04-21,48
27,CB_2024_Nov_FB_3264_LZ_V29_4x5_VID_EN_Opti_C-NegativeMark_Sale_CTA-BF_Angle-W-B_M-LRNS_VL-30s_G-M_P-OG_S-NONE,ðŸŒ¶ï¸ || US || ASC+ || ->CC141 || VIDEO Only || US+CA || 0% EXISTING CAP || 7C || 07/08.24  Ad set,VIDEO,"$2,081","77,681",2024-12-04,2025-04-21,138
28,CB_2025_Mar_FB_3910_LZ-DP_V01_1x1_IMG_EN_Opti_C-Headline_Evergreen_CTA-NONE_Angle-W_M-NONE_VL-None_G-NONE_P-TRIAL_S-NONE_FB3251V02.png,US || Free trial offer || Trial ads || Trial purchase || 7C || 19/03/25,SHARE,"$2,077","86,901",2025-03-19,2025-04-21,33
29,CB_2025_Mar_FB_3914_DT-DP_V01_9x16_VID_EN_New_C-Trend_Sale_CTA-SPRNG_Angle-W-B-C_M-JOG_VL-30s_G-F_P-OG_S-NEW,CA || ASC+ || 0% EXISTING || 7DC || 18.03.2025,VIDEO,"$2,054","123,002",2025-04-01,2025-04-21,20
30,CB_2024_Apr_FB_2970_RS_V02_1x1_GIF_EN_Opti_C-WrittenTesti_CTA-CTA_Pain-W_M-NONE_VL-7s_TR-None_G-NONE_P-V2_S-NEW,CBV2 || US || Manual Bid: ROAS GOAL: 1.00 -> 1.1 || 7DC || 22/01/2025,VIDEO,"$1,945","45,725",2025-03-27,2025-04-21,25
31,CB_2025_Apr_FB_3995_DT-DP_V01_9x16_VID_EN_Opti_C-MakingOf_Evergreen_CTA-CTA_Angle-W-B_M-CRAZY_VL-45s_G-M_P-OG_S-NEW_FB3022V01,US || Kilo Product's leads LAL || 7C || 04/03/25,VIDEO,"$1,878","79,836",2025-04-14,2025-04-21,7
32,CB_2023_May_FB_2263_MB_V04_9x16_VID_EN_New_C-Sale_CTA-SMR_Pain-W_M-JOG_VL-45s_TR-None_G-M-F_P-None_S-Moon,ðŸŒ¶ï¸ || US || ASC+ || ->CC141 || VIDEO Only || US+CA || 0% EXISTING CAP || 7C || 07/08.24  Ad set,VIDEO,"$1,841","59,400",2024-08-07,2025-04-21,257
33,CB_2023_May_FB_2103_MB_V02_9x16_VID_EN_Opti_C-Sale_CTA-SMR_Pain-W_M-JOG_VL-30s_TR-None_G-M-F_P-None_S-What,US || ASC+ || Website + Shop || 7DC || Existing 0% || 24.03.2025 Ad set,VIDEO,"$1,739","59,739",2025-04-04,2025-04-21,17
34,CB_2025_Mar_FB_3914_DT-DP_V03_9x16_VID_EN_New_C-Trend_Sale_CTA-SPRNG_Angle-W-B-C_M-JOG_VL-30s_G-F_P-OG_S-NEW,"3914 - #9 GF's POV, male confidence || Batch 1 || Enhancements: OFF || CBV1 || 7C || 24/03/25w13",VIDEO,"$1,738","82,828",2025-03-24,2025-04-21,28
35,CB_2023_Dec_FB_2712_RS-DP_V02_1x1_VID_EN_Opti_C-WrittenTesti_CTA-SALE_Pain-W-B-C_M-NONE_VL-None_TR-None_G-NONE_P-V2_S-NONE_FB2227V08,CBV2 || AU || ðŸ’° Advantage+ || US || BROAD || 7C || Existing_customer_5% || 19/12/24 Ad set,SHARE,"$1,657","64,240",2024-12-19,2025-04-21,123
36,CB_2025_Apr_FB_3980_LZ-KB_V03_9x16_VID_EN_Opti_C-BulletPoints_Evergreen_CTA-SALE_Angle-W_M-PASQ_VL-30s_G-M_P-OG_S-WHAT_FB2516V13,CA || ASC+ || 0% EXISTING || 7DC || 18.03.2025,VIDEO,"$1,632","116,721",2025-04-18,2025-04-21,3
37,CB_2023_Jul_FB_2217_IB_V04_9x16_VID_EN_Opti_C-Pointing_CTA-SMR_Pain-W-B_M-TRC_VL-30s_TR-None_G-F_P-None_S-FRIGGA,CA || ASC+ || 0% EXISTING || 7DC || 18.03.2025,VIDEO,"$1,602","76,773",2025-03-18,2025-04-21,34
38,CB_2025_Mar_FB_3890_DT_V04_1x1_IMG_EN_New_C-NONE_Evergreen_CTA-None_Angle-W_M-NONE_VL-None_G-NONE_P-OG_S-NONE,US || ASC+ || Website + Shop || 7DC || Existing 0% || 24.03.2025 Ad set,SHARE,"$1,569","84,266",2025-03-24,2025-04-21,28
39,CB_2025_Mar_FB_3924_SO-DP_V03_1x1_IMG_EN_New_C-NONE_Evergreen_CTA-NONE_Angle-W-B-C_M-NONE_VL-None_G-NONE_P-OG_S-NONE,CBV2 || AU || ðŸ’° Advantage+ || US || BROAD || 7C || Existing_customer_5% || 19/12/24 Ad set,SHARE,"$1,477","103,188",2025-04-12,2025-04-21,9
40,CB_2025_Mar_FB_3914_DT-DP_V01_9x16_VID_EN_New_C-Trend_Sale_CTA-SPRNG_Angle-W-B-C_M-JOG_VL-30s_G-F_P-OG_S-NEW,CBV2 || EU (UK) || ðŸ’° Advantage+ || US || BROAD || 7C || Existing_customer_5% || 15/12/24 Ad set,VIDEO,"$1,457","68,815",2025-04-01,2025-04-21,20
41,CB_2023_Jul_FB_2226_MB_V04_9x16_VID_EN_Opti_C-Testim_CTA-SMR_Pain-W_M-MIX_VL-30s_TR-None_G-F_P-None_S-Starry,CA || ASC+ || 0% EXISTING || 7DC || 18.03.2025,VIDEO,"$1,410","69,047",2025-03-18,2025-04-21,34
42,CB_2025_Feb_FB_3827_LZ_V03_1x1_IMG_EN_Opti_C-Headline_Evergreen_CTA-SALE_Angle-W_M-NONE_VL-None_G-M_P-CBV2_S-NONE_FB3705V02,CBV2 || EU (UK) || ðŸ’° Advantage+ || US || BROAD || 7C || Existing_customer_5% || 15/12/24 Ad set,SHARE,"$1,406","51,064",2025-03-31,2025-04-21,21
43,CB_2025_Apr_FB_3992_LZ-KB_V02_4x5_IMG_EN_Opti_C-Headline_Sale_CTA-SPRNG_Angle-Cort_M-NONE_VL-None_G-NONE_P-OG_S-NONE_3865V02,3988 - IMG winners easter opti || Batch 3 || Enhancements: OFF || CBV1 || 7C || 14/04/25w16,SHARE,"$1,395","72,784",2025-04-14,2025-04-20,6
44,CB_2025_Jan_FB_3742_SO-DP-KB_V06_4x5_IMG_EN_Opti_C-NONE_Evergreen_CTA-SALE_Angle-W_M-NONE_VL-None_G-NONE_P-CBV2_S-NONE3665V01,CBV2 || US || Manual Bid: ROAS GOAL: 1.00 -> 1.1 || 7DC || 22/01/2025,SHARE,"$1,386","51,747",2025-02-11,2025-04-21,69
45,CB_2024_Sep_FB_3175_DA-KB_V04_1x1_IMG_EN_New_C-ADVRT_Evergreen_CTA-NONE_Angle-W_M-NONE_VL-None_G-NONE_P-CBV2_S-NONE_blog_colonbroomvsmammoth_cv_en,CBV2 || AU || Advantage+ || Advertorial |  || 0% EXISTING CAP || BROAD || 7C || ad set 18/03/25,SHARE,"$1,350","68,566",2025-03-20,2025-04-17,28
46,CB_2025_Mar_FB_3913_CHUB-AS_V12_1x1_IMG_EN_New_C-NONE_CTA-NONE_Angle-W_M-NONE_VL-None_TR-None_G-NONE_P-NONE_S-NONE_blog_moobs_cv_en,CBV2 || LP:HI | blog_moobs_cv_en || Batch 3 || 08/03/25,SHARE,"$1,329","50,433",2025-04-08,2025-04-21,13
47,CB_2024_Jan_FB_2764_RS_V04_9x16_VID_EN_Opti_C-SingleTesti_CTA-SALE_Pain-W_M-TRC_VL-45s_TR-None_G-F_P-OG_S-MOON_FB2263V04,EU (UK) || 2764 || Trinity Results Too Fast || 1C || 08/01/2025w02,VIDEO,"$1,283","41,004",2025-01-08,2025-04-17,99
48,CB_2025_Feb_FB_3883_LZ-RP_V05_9x16_VID_EN_Opti_C-BulletPoints_Evergreen_CTA-SALE_Angle-W_M-JANW_VL-30s_G-M_P-OG_S-WHAT_FB2284V05,CBV2 || AU || ðŸ’° Advantage+ || US || BROAD || 7C || Existing_customer_5% || 19/12/24 Ad set,VIDEO,"$1,257","59,439",2025-03-28,2025-04-21,24
49,CB_2025_Mar_FB_3891_VK_V05_1x1_IMG_EN_New_C-BulletPoints_Evergreen_CTA-65_Angle-W-B-C_M-NONE_VL-None_G-M_P-OG_S-NONE,CA || ASC+ || 0% EXISTING || 7DC || 18.03.2025,SHARE,"$1,225","101,827",2025-03-18,2025-04-20,33
50,CB_2025_Mar_FB_3907_CHUB-AA_V03_4x5_IMG_EN_Opti_C-Price_CTA-NONE_Angle-None_M-NONE_VL-None_TR-None_G-NONE_P-OG_S-NONE.png,US || Quiz: React || 7C || 04/04/25,SHARE,"$1,195","45,598",2025-04-04,2025-04-21,17
51,CB_2025_Apr_FB_3994_DT-DP_V02_9x16_VID_EN_Opti_C-MakingOf_Sale_CTA-Sale_Angle-W-B_M-NATE_VL-45s_G-M_P-OG_S-NEW_FB3033V03,3994 - 3033 V03 opti || Batch 1 || Enhancements: OFF || CBV1 || 7C || 14/04/25w16,VIDEO,"$1,168","56,169",2025-04-14,2025-04-21,7
52,CB_2025_Apr_FB_3980_LZ-KB_V03_9x16_VID_EN_Opti_C-BulletPoints_Evergreen_CTA-SALE_Angle-W_M-PASQ_VL-30s_G-M_P-OG_S-WHAT_FB2516V13,3980 - winner video man boobs opti || Batch 1 || Enhancements: OFF || CBV1 || 7C || 11/04/25w16,VIDEO,"$1,165","51,090",2025-04-11,2025-04-21,10
53,CB_2025_Feb_FB_3883_LZ-RP_V05_9x16_VID_EN_Opti_C-BulletPoints_Evergreen_CTA-SALE_Angle-W_M-JANW_VL-30s_G-M_P-OG_S-WHAT_FB2284V05.mp4,US || Quiz: Shopify || 7C || 04/04/25,VIDEO,"$1,093","43,426",2025-04-04,2025-04-21,17
54,CB_2023_Jul_FB_2284_DA_V05_9x16_VID_EN_Opti_C-Sale_CTA-SMR_Pain-W_M-JANW_VL-30s_TR-None_G-M_P-None_S-WHAT_FB2103V02,ðŸŒ¶ï¸ || US || ASC+ || ->CC141 || VIDEO Only || US+CA || 0% EXISTING CAP || 7C || 07/08.24  Ad set,VIDEO,$998,"29,443",2024-08-07,2025-04-21,257
55,CB_2025_Apr_FB_3988_LZ-KB_V01_4x5_IMG_EN_Opti_C-Headline_Sale_CTA-SPRNG_Angle-None_M-NONE_VL-None_G-NONE_P-OG_S-NONE_FB3907V03,3988 - IMG winners easter opti || Batch 2 || Enhancements: OFF || CBV1 || 7C || 14/04/25w16,SHARE,$935,"34,307",2025-04-14,2025-04-20,6
56,CB_2025_Apr_FB_3980_LZ-KB_V08_9x16_VID_EN_Opti_C-Pointing_Evergreen_CTA-SALE_Angle-W_M-POW_VL-30s_G-M_P-OG_S-MOON_FB2036V03,3980 - winner video man boobs opti || Batch 3 || Enhancements: OFF || CBV1 || 7C || 11/04/25w16,VIDEO,$923,"46,866",2025-04-11,2025-04-17,6
57,CB_2024_Jan_FB_2764_RS_V04_9x16_VID_EN_Opti_C-SingleTesti_CTA-SALE_Pain-W_M-TRC_VL-45s_TR-None_G-F_P-OG_S-MOON_FB2263V04_Page_Personal_Coach,CBV2 || AU || ðŸ’° Advantage+ || US || BROAD || 7C || Existing_customer_5% || 19/12/24 Ad set,VIDEO,$914,"19,319",2025-01-16,2025-04-21,95
58,CB_2023_Jul_FB_2217_IB_V04_9x16_VID_EN_Opti_C-Pointing_CTA-SMR_Pain-W-B_M-TRC_VL-30s_TR-None_G-F_P-None_S-FRIGGA,US || ASC+ || Website + Shop || 7DC || Existing 0% || 24.03.2025 Ad set,VIDEO,$909,"33,309",2025-03-24,2025-04-17,24
59,CB_2023_Jul_FB_2226_MB_V04_9x16_VID_EN_Opti_C-Testim_CTA-SMR_Pain-W_M-MIX_VL-30s_TR-None_G-F_P-None_S-Starry,ðŸŒ¶ï¸ || US || ASC+ || ->CC141 || VIDEO Only || US+CA || 0% EXISTING CAP || 7C || 07/08.24  Ad set,VIDEO,$861,"28,155",2024-10-28,2025-04-21,175
60,CB_2025_Feb_FB_3883_LZ-RP_V05_9x16_VID_EN_Opti_C-BulletPoints_Evergreen_CTA-SALE_Angle-W_M-JANW_VL-30s_G-M_P-OG_S-WHAT_FB2284V05.mp4,US || Quiz: React || 7C || 04/04/25,VIDEO,$845,"44,450",2025-04-04,2025-04-21,17
61,CB_2025_Feb_FB_3817_SO_V01_4x5_IMG_EN_Opti_C-NONE_Evergreen_CTA-SALE_Angle-W_M-NONE_VL-None_G-NONE_P-NONE_S-NONE_FB3723V07,CBV2 || EU (UK) || ðŸ’° Advantage+ || US || BROAD || 7C || Existing_customer_5% || 15/12/24 Ad set,SHARE,$829,"41,999",2025-02-14,2025-04-21,66
62,CB_2025_Apr_FB_3962_VK-DP_V02_9x16_VID_EN_Opti_C-Trend_Evergreen_CTA-NONE_Angle-W-B-C_M-JANW_VL-30s_G-M_P-OG_S-NEW_FB3909V03,3962 - 3909 hook opti - DP -VK || Batch 1 || Enhancements: OFF || CBV1 || 7C || 07/04/25w15,VIDEO,$825,"30,989",2025-04-07,2025-04-17,10
63,CB_2024_Sep_FB_3175_DA-KB_V04_1x1_IMG_EN_New_C-ADVRT_Evergreen_CTA-NONE_Angle-W_M-NONE_VL-None_G-NONE_P-CBV2_S-NONE_blog_colonbroomvsmammothhighprice3_cv_en,CBV2 || Advantage+ || Advertorial || Higher pricing || US || 0% EXISTING CAP || BROAD || 7C || 20/01/25  Campaign Ad set,SHARE,$803,"30,189",2025-04-16,2025-04-21,5
64,CB_2024_Sep_FB_3175_DA-KB_V04_1x1_IMG_EN_New_C-ADVRT_Evergreen_CTA-NONE_Angle-W_M-NONE_VL-None_G-NONE_P-CBV2_S-NONE_blog_colonbroomvsmammoth_cv_en,CBV2 || A/B test CTA button: Control || CBV2 vs Happy Mammoth || 7C || 26/03/25,SHARE,$785,"31,670",2025-03-26,2025-04-16,21
65,CB_2025_Apr_FB_3996_DT-DP_V01_9x16_VID_EN_Opti_C-MakingOf_Evergreen_CTA-CTA_Angle-W-B_M-CRAZY_VL-45s_G-M_P-OG_S-NEW_FB3022V03,3996 - 3022 V03 opti || Batch 1 || Enhancements: OFF || CBV1 || 7C || 11/04/25w16,VIDEO,$781,"39,794",2025-04-11,2025-04-21,10
66,CB_2025_Mar_FB_3907_CHUB-AA_V03_4x5_IMG_EN_Opti_C-Price_CTA-NONE_Angle-None_M-NONE_VL-None_TR-None_G-NONE_P-OG_S-NONE.png,US || Quiz: Shopify || 7C || 04/04/25,SHARE,$780,"30,257",2025-04-04,2025-04-17,13
67,CB_2023_May_FB_2103_MB_V02_9x16_VID_EN_Opti_C-Sale_CTA-SMR_Pain-W_M-JOG_VL-30s_TR-None_G-M-F_P-None_S-What,US || Manual Bid || BFCM || COST CAP 71 || 1C || 15/11/24,VIDEO,$780,"24,086",2024-11-15,2025-04-21,157
68,CB_2025_Apr_FB_3997_DT-DP_V01_9x16_VID_EN_Opti_C-MakingOf_Sale_CTA-SALE_Angle-W-B_M-POW_VL-45s_G-M_P-OG_S-NEW_FB3033V01,3997 - 3033 V01 opti || Batch 1 || Enhancements: OFF || CBV1 || 7C || 11/04/25w16,VIDEO,$774,"42,048",2025-04-11,2025-04-17,6
69,CB_2025_Apr_FB_3980_LZ-KB_V07_9x16_VID_EN_Opti_C-Pointing_Evergreen_CTA-SALE_Angle-W_M-POW_VL-30s_G-M_P-OG_S-MOON_FB2036V03,3980 - winner video man boobs opti || Batch 3 || Enhancements: OFF || CBV1 || 7C || 11/04/25w16,VIDEO,$769,"29,205",2025-04-11,2025-04-21,10
70,CB_2025_Apr_FB_3984_LZ-KB_V02_4x5_IMG_EN_Opti_C-BeforeAfter_Sale_CTA-SPRNG_Angle-W_M-NONE_VL-None_G-M_P-OG_S-NONE_FB3723V04,3984 - MAN BOOBS easter opti || Batch 1 || Enhancements: OFF || CBV1 || 7C || 14/04/25w16,SHARE,$767,"41,955",2025-04-14,2025-04-21,7
71,CB_2024_Apr_FB_2970_RS_V02_1x1_GIF_EN_Opti_C-WrittenTesti_CTA-CTA_Pain-W_M-NONE_VL-7s_TR-None_G-NONE_P-V2_S-NEW,CBV2 || AU || ðŸ’° Advantage+ || US || BROAD || 7C || Existing_customer_5% || 19/12/24 Ad set,VIDEO,$763,"22,979",2025-04-02,2025-04-21,19
72,CB_2023_Oct_FB_2516_VK_V13_9x16_VID_EN_Opti_C-Benefits_CTA-AUTUM_Pain-W-B_M-PASQ_VL-30s_TR-None_G-M_P-Plan_S-WHAT,ðŸŒ¶ï¸ || US || ASC+ || ->CC141 || VIDEO Only || US+CA || 0% EXISTING CAP || 7C || 07/08.24  Ad set,VIDEO,$748,"19,898",2024-12-19,2025-04-21,123
73,CB_2024_Jan_FB_2762_IK_V05_1x1_IMG_EN_New_C-WrittenTesti_CTA-CTA_Pain-W-B-C_M-NONE_VL-None_TR-None_G-NONE_P-V2_S-NONE,CBV2 || EU (UK) || ðŸ’° Advantage+ || US || BROAD || 7C || Existing_customer_5% || 15/12/24 Ad set,SHARE,$737,"24,357",2024-12-15,2025-04-21,127
74,CB_2024_Apr_FB_2970_RS_V02_1x1_GIF_EN_Opti_C-WrittenTesti_CTA-CTA_Pain-W_M-NONE_VL-7s_TR-None_G-NONE_P-V2_S-NEW,CBV2 || EU (UK) || ðŸ’° Advantage+ || US || BROAD || 7C || Existing_customer_5% || 15/12/24 Ad set,VIDEO,$720,"22,141",2025-04-02,2025-04-21,19
75,CB_2025_Mar_FB_3928_VK-DP_V02_1x1_VID_EN_Opti_C-BulletPoints_Evergreen_CTA-NONE_Angle-W-B-C_M-NONE_VL-None_G-M_P-OG_S-NONE_FB3891V05,3928 - opti 3891 kinda sorta opti with man boobs - DP-VK || Batch 1 || Enhancements: OFF || CBV1 || 7C || 24/03/25w13,SHARE,$718,"42,452",2025-03-24,2025-04-17,24
76,CB_2025_Mar_FB_3913_CHUB-AS_V09_1x1_IMG_EN_New_C-NONE_CTA-NONE_Angle-W_M-NONE_VL-None_TR-None_G-NONE_P-NONE_S-NONE_blog_moobs_cv_en,CBV2 || LP:HI | blog_moobs_cv_en || Batch 3 || 08/03/25,SHARE,$704,"32,327",2025-04-08,2025-04-21,13
77,CB_2024_Aug_FB_3097_VK-DP_V03_9x16_VID_EN_Opti_C-Benefits_CTA-SMR_Pain-W-B_M-MIX_VL-45s_TR-None_G-MF_P-OG_S-WHAT_FB2516V13,ðŸŒ¶ï¸ || US || ASC+ || ->CC141 || VIDEO Only || US+CA || 0% EXISTING CAP || 7C || 07/08.24  Ad set,VIDEO,$699,"25,203",2024-09-04,2025-04-21,229
78,CB_2024_Aug_FB_3090_DT-DP_V02_9x16_VID_EN_Opti_C-MakingOf_CTA-CTA_Pain-W-B-C_M-POW_VL-45s_TR-None_G-M_P-OG_S-Moon_FB3029V04,CBV2 || EU (UK) || ðŸ’° Advantage+ || US || BROAD || 7C || Existing_customer_5% || 15/12/24 Ad set,SHARE,$664,"35,566",2024-12-19,2025-04-21,123
79,CB_2025_Apr_FB_3975_LZ_V03_9x16_VID_EN_New_C-Testimonial_Evergreen_CTA-SALE_Angle-W_M-LAURA_VL-15s_G-F_P-OG_S-NEW,US || ASC+ || Website + Shop || 7DC || Existing 0% || 24.03.2025 Ad set,VIDEO,$653,"34,631",2025-04-12,2025-04-16,4
80,CB_2024_Dec_FB_3601_VK-DP_V09_4x5_VID_EN_Opti_C-Dance_CTA-NY_Pain-W-B_M-JOG_VL-30s_TR-None_G-F_P-OG_S-WHAT_FB3045V01,CBV2 || AU || ðŸ’° Advantage+ || US || BROAD || 7C || Existing_customer_5% || 19/12/24 Ad set,SHARE,$641,"22,816",2025-01-03,2025-04-21,108
81,CB_2025_Mar_FB_3919_LZ_V01_1x1_IMG_EN_Opti_C-Headline_Evergreen_CTA-NONE_Angle-Horm_M-NONE_VL-30s_G-M_P-OG_S-NONE_FB3891V05,CA || ASC+ || 0% EXISTING || 7DC || 18.03.2025,SHARE,$637,"45,002",2025-03-27,2025-04-21,25
82,CB_2025_Apr_FB_3987_SO-JG_V09_4x5_IMG_EN_New_C-NONE_Evergreen_CTA-NONE_Angle-W-B-C_M-NONE_VL-None_G-NONE_P-OG_S-NONE,3987 - Tax-Wars IMG JG || Batch 3 || Enhancements: OFF || CBV1 || 7C || 09/04/25w15,SHARE,$633,"29,559",2025-04-09,2025-04-19,10
83,CB_2025_Apr_FB_4002_LZ-KB_V03_9x16_VID_EN_Opti_C-Testimonial_Sale_CTA-SPRNG_Angle-W-B_M-MIX_VL-15s_G-MF_P-OG_S-WHAT_FB1989V08,4002 - video winners easter opti || Batch 2 || Enhancements: OFF || CBV1 || 7C || 14/04/25w16,VIDEO,$629,"30,189",2025-04-14,2025-04-20,6
84,CB_2025_Feb_FB_3817_SO_V01_4x5_IMG_EN_Opti_C-NONE_Evergreen_CTA-SALE_Angle-W_M-NONE_VL-None_G-NONE_P-NONE_S-NONE_FB3723V07,CBV2 || AU || ðŸ’° Advantage+ || US || BROAD || 7C || Existing_customer_5% || 19/12/24 Ad set,SHARE,$612,"29,247",2025-02-14,2025-04-21,66
85,CB_2024_Aug_FB_3097_VK-DP_V03_9x16_VID_EN_Opti_C-Benefits_CTA-SMR_Pain-W-B_M-MIX_VL-45s_TR-None_G-MF_P-OG_S-WHAT_FB2516V13,ðŸŒ¶ï¸ || US || ASC+ || ->CC141 || VIDEO Only || US+CA || 0% EXISTING CAP || 7C || 07/08.24  Ad set,VIDEO,$604,"23,946",2025-03-28,2025-04-21,24
86,CB_2025_Jan_FB_3723_SO_V04_4x5_IMG_EN_New_C-NONE_Evergreen_CTA-SALE_Angle-W_M-NONE_VL-None_G-NONE_P-NONE_S-NONE,CA || ASC+ || 0% EXISTING || 7DC || 18.03.2025,SHARE,$602,"49,462",2025-03-18,2025-04-21,34
87,CB_2025_Apr_FB_4002_LZ-KB_V01_9x16_VID_EN_Opti_C-Dance_Sale_CTA-SPRNG_Angle-W-B-C_M-POW_VL-30s_G-M_P-OG_S-WOOD_FB2176V11,4002 - video winners easter opti || Batch 1 || Enhancements: OFF || CBV1 || 7C || 14/04/25w16,VIDEO,$598,"33,888",2025-04-14,2025-04-17,3
88,CB_2025_Jan_FB_3723_SO_V07_4x5_IMG_EN_New_C-NONE_Evergreen_CTA-SALE_Angle-W_M-NONE_VL-None_G-NONE_P-NONE_S-NONE,CBV2 || US || Manual Bid: ROAS GOAL: 1.00 -> 1.1 || 7DC || 22/01/2025,SHARE,$593,"24,338",2025-02-11,2025-04-21,69
89,CB_2025_Feb_FB_3863_DT-DP_V03_9x16_VID_EN_New_C-Trend_Sale_CTA-70_Angle-W_M-POW_VL-30s_G-M_P-OG_S-NEW,ðŸŒ¶ï¸ || US || ASC+ || ->CC141 || VIDEO Only || US+CA || 0% EXISTING CAP || 7C || 07/08.24  Ad set,VIDEO,$568,"24,964",2025-03-10,2025-04-21,42
90,CB_2025_Mar_FB_3970_CHUB-AS_V05_1x1_IMG_EN_New_C-NONE_CTA-NONE_Angle-W_M-NONE_VL-None_TR-None_G-NONE_P-NONE_S-NONE_blog_stressweight_cv_en,CBV1 || LP:HI | 3970 blog_stressweight || Batch 2 || 08/04/25,SHARE,$545,"22,874",2025-04-16,2025-04-21,5
91,CB_2025_Apr_FB_3961_SO-JG_V07_4x5_IMG_EN_New_C-NONE_Evergreen_CTA-NONE_Angle-W-B-C_M-NONE_VL-None_G-NONE_P-OG_S-NONE,3961 - Action Figur || Batch 3 || Enhancements: OFF || CBV1 || 7C || 14/04/25w16,SHARE,$540,"33,416",2025-04-14,2025-04-21,7
92,CB_2025_Apr_FB_4008_SO-VG_V05_9x16_VID_EN_New_C-NONE_Evergreen_CTA-NONE_Angle-SC_M-POW_VL-25s_G-F_P-OG_S-NEW,4008 - CSC_CB VID SugarCrush || Batch 2 || Enhancements: OFF || CBV1 || 7C || 15/04/25w16,VIDEO,$539,"19,759",2025-04-15,2025-04-20,5
93,CB_2025_Apr_FB_3980_LZ-KB_V08_9x16_VID_EN_Opti_C-Pointing_Evergreen_CTA-SALE_Angle-W_M-POW_VL-30s_G-M_P-OG_S-MOON_FB2036V03,US || Kilo Product's leads LAL || 7C || 04/03/25,VIDEO,$528,"19,674",2025-04-14,2025-04-21,7
94,CB_2025_Feb_FB_3883_LZ-RP_V05_9x16_VID_EN_Opti_C-BulletPoints_Evergreen_CTA-SALE_Angle-W_M-JANW_VL-30s_G-M_P-OG_S-WHAT_FB2284V05,CBV2 || EU (UK) || ðŸ’° Advantage+ || US || BROAD || 7C || Existing_customer_5% || 15/12/24 Ad set,SHARE,$528,"26,249",2025-04-01,2025-04-21,20
95,CB_2025_Apr_FB_4007_LZ-VG_V02_9x16_VID_EN_New_C-Pointing_Evergreen_CTA-SALE_Angle-Energy_M-TRC_VL-30s_G-F_P-OG_S-NEW,4007 - CSC_CB VID Brain Fog || Batch 1 || Enhancements: OFF || CBV1 || 7C || 14/04/25w16,VIDEO,$520,"16,125",2025-04-14,2025-04-20,6
96,CB_2025_Mar_FB_3910_LZ-DP_V03_9x16_VID_EN_Opti_C-BulletPoints_Evergreen_CTA-NONE_Angle-W_M-MAN_VL-15s_G-M_P-TRIAL_S-WHAT_FB3097V03.mp4,US || Free trial offer || Trial ads || Trial purchase || 7C || 19/03/25,VIDEO,$517,"14,815",2025-03-19,2025-04-21,33
97,CB_2025_Apr_FB_4030_DT_V07_4x5_IMG_EN_New_C-Headline_Sale_CTA-SPRNG_Angle-W-B-C_M-NONE_VL-None_G-NONE_P-OG_S-NONE_FB2227V08,4030 - Easter Sale winner ads Opti || Batch 3 || Enhancements: OFF || CBV1 || 7C || 16/04/25w16,SHARE,$509,"18,537",2025-04-16,2025-04-21,5
98,CB_2025_Mar_FB_3903_VK_V01_9x16_VID_EN_New_C-BulletPoints_Evergreen_CTA-65_Angle-W-B-C_M-MIX_VL-30s_G-MF_P-OG_S-NEW,CA || ASC+ || 0% EXISTING || 7DC || 18.03.2025,VIDEO,$506,"28,560",2025-03-30,2025-04-21,22
99,CB_2025_Apr_FB_4004_CHUB-KZ_V01_9x16_VID_EN_New_C-NONE_CTA-NONE_Angle-W-B-C_M-F_VL-None_TR-None_G-NONE_P-NONE_S-NONE,4004 - CHUB LosingPCOSWeight || Batch 1 || Enhancements: OFF || CBV1 || 7C || 14/04/25w16,VIDEO,$499,"18,811",2025-04-14,2025-04-19,5
100,CB_2023_Jul_FB_2217_IB_V04_9x16_VID_EN_Opti_C-Pointing_CTA-SMR_Pain-W-B_M-TRC_VL-30s_TR-None_G-F_P-None_S-FRIGGA,CBV2 || EU (UK) || ðŸ’° Advantage+ || US || BROAD || 7C || Existing_customer_5% || 15/12/24 Ad set,VIDEO,$488,"19,246",2024-12-18,2025-04-21,124
101,CB_2025_Apr_FB_3992_LZ-KB_V04_4x5_IMG_EN_Opti_C-Headline_Sale_CTA-SPRNG_Angle-W_M-NONE_VL-None_G-NONE_P-OG_S-NONE_FB1218V15,CA || ASC+ || 0% EXISTING || 7DC || 18.03.2025,SHARE,$484,"25,742",2025-04-18,2025-04-21,3
102,CB_2025_Mar_FB_3904_DT_V01_9x16_VID_EN_New_C-Trend_Evergreen_CTA-NONE_Angle-W_M-MIX_VL-30s_G-MF_P-OG_S-New,ðŸŒ¶ï¸ || US || ASC+ || ->CC141 || VIDEO Only || US+CA || 0% EXISTING CAP || 7C || 07/08.24  Ad set,VIDEO,$478,"16,234",2025-03-28,2025-04-21,24
103,CB_2025_Apr_FB_3991_VG_V03_4x5_IMG_EN_New_C-SplitScreen_Evergreen_CTA-NONE_Angle-GH_M-NONE_VL-None_G-NONE_P-OG_S-NONE,3991 - NEW ANGLE FATTY LIVER || Batch 1 || Enhancements: OFF || CBV1 || 7C || 14/04/25w16,SHARE,$473,"31,701",2025-04-14,2025-04-20,6
104,CB_2025_Apr_FB_3980_LZ-KB_V03_9x16_VID_EN_Opti_C-BulletPoints_Evergreen_CTA-SALE_Angle-W_M-PASQ_VL-30s_G-M_P-OG_S-WHAT_FB2516V13,ðŸŒ¶ï¸ || US || ASC+ || ->CC141 || VIDEO Only || US+CA || 0% EXISTING CAP || 7C || 07/08.24  Ad set,VIDEO,$468,"20,136",2025-04-20,2025-04-21,1
105,CB_2025_Apr_FB_3963_SO-DP_V12_4x5_IMG_EN_Opti_C-NONE_Evergreen_CTA-NONE_Angle-W-B-C_M-NONE_VL-None_G-NONE_P-OG_S-NONE_FB3922V03,3963 - 3922 opti_3 batches IMG || Batch 3 || Enhancements: OFF || CBV1 || 7C || 07/04/25w15,SHARE,$467,"19,492",2025-04-07,2025-04-17,10
106,CB_2025_Mar_FB_3914_DT-DP_V01_9x16_VID_EN_New_C-Trend_Sale_CTA-SPRNG_Angle-W-B-C_M-JOG_VL-30s_G-F_P-OG_S-NEW,US || Kilo Product's leads LAL || 7C || 04/03/25,VIDEO,$464,"15,197",2025-04-06,2025-04-21,15
107,CB_2025_Apr_FB_3990_DT-DP_V01_9x16_VID_EN_Opti_C-Dance_Sale_CTA-65_Angle-W-B_M-POW_VL-30s_G-M_P-OG_S-WHAT_FB3044V03,3990 - 3043 v03 opti || Batch 1 || Enhancements: OFF || CBV1 || 7C || 11/04/25w16,VIDEO,$440,"19,153",2025-04-14,2025-04-17,3
108,CB_2025_Apr_FB_3986_DT-DP_V01_9x16_VID_EN_Opti_C-Trend_Sale_CTA-SPRNG_Angle-W-B-C_M-TRC_VL-30s_G-F_P-OG_S-NEW,3986 - GFs POV / male confidence / new actors || Batch 1 || Enhancements: OFF || CBV1 || 7C || 11/04/25w16,VIDEO,$440,"18,355",2025-04-14,2025-04-20,6
109,CB_2025_Mar_FB_3914_DT-DP_V01_9x16_VID_EN_New_C-Trend_Sale_CTA-SPRNG_Angle-W-B-C_M-JOG_VL-30s_G-F_P-OG_S-NEW,"3914 - #9 GF's POV, male confidence || Batch 1 || Enhancements: OFF || CBV1 || 7C || 24/03/25w13",VIDEO,$431,"16,335",2025-03-24,2025-04-15,22
110,CB_2025_Mar_FB_3914_DT-DP_V01_9x16_VID_EN_New_C-Trend_Sale_CTA-SPRNG_Angle-W-B-C_M-JOG_VL-30s_G-F_P-OG_S-NEW,CBV2 || AU || ðŸ’° Advantage+ || US || BROAD || 7C || Existing_customer_5% || 19/12/24 Ad set,VIDEO,$430,"16,296",2025-04-01,2025-04-21,20
111,CB_2023_Jul_FB_2284_DA_V05_9x16_VID_EN_Opti_C-Sale_CTA-SMR_Pain-W_M-JANW_VL-30s_TR-None_G-M_P-None_S-WHAT_FB2103V02,CA || ASC+ || 0% EXISTING || 7DC || 18.03.2025,VIDEO,$410,"20,652",2025-03-18,2025-04-21,34
112,CB_2023_Feb_FB_1998_LV_V02_9x16_VID_EN_Opti_C-Dance_CTA-CTA_Pain-W_M-MIX_VL-45s_TR-None_G-F_P-Plan,US || ASC+ || Website + Shop || 7DC || Existing 0% || 24.03.2025 Ad set,VIDEO,$398,"14,998",2025-04-04,2025-04-21,17
113,CB_2025_Apr_FB_3989_DT-DP_V01_9x16_VID_EN_Opti_C-MakingOf_Sale_CTA-SALE_Angle-W-B_M-ALEX_VL-45s_G-M_P-OG_S-NEW_FB3096V01,3989 - 3096 V01 opti || Batch 1 || Enhancements: OFF || CBV1 || 7C || 11/04/25w16,VIDEO,$395,"11,983",2025-04-14,2025-04-18,4
114,CB_2025_Apr_FB_3985_DT-DP_V01_9x16_VID_EN_Opti_C-Trend_Sale_CTA-SPRNG_Angle-W-B-C_M-JOG_VL-30s_G-F_P-OG_S-NEW,3985 - Opti 3914 || Batch 1 || Enhancements: OFF || CBV1 || 7C || 11/04/25w16,VIDEO,$388,"13,330",2025-04-14,2025-04-18,4
115,CB_2025_Apr_FB_3996_DT-DP_V02_9x16_VID_EN_Opti_C-MakingOf_Evergreen_CTA-CTA_Angle-W-B_M-CRAZY_VL-45s_G-M_P-OG_S-NEW_FB3022V03,3996 - 3022 V03 opti || Batch 1 || Enhancements: OFF || CBV1 || 7C || 11/04/25w16,VIDEO,$383,"20,099",2025-04-11,2025-04-17,6
116,CB_2025_Apr_FB_3987_SO-JG_V05_4x5_IMG_EN_New_C-NONE_Evergreen_CTA-NONE_Angle-W-B-C_M-NONE_VL-None_G-NONE_P-OG_S-NONE,3987 - Tax-Wars IMG JG || Batch 2 || Enhancements: OFF || CBV1 || 7C || 09/04/25w15,SHARE,$368,"15,838",2025-04-09,2025-04-18,9
117,CB_2025_Apr_FB_3967_SO_V07_9x16_VID_EN_New_C-NONE_Evergreen_CTA-65_Angle-W-B-C_M-NONE_VL-40s_G-F_P-OG_S-NEW,3967 - #127 Look at Me VID || Batch 2 || Enhancements: OFF || CBV1 || 7C || 14/04/25w16,VIDEO,$362,"11,632",2025-04-14,2025-04-20,6
118,CB_2024_Aug_FB_3097_VK-DP_V03_9x16_VID_EN_Opti_C-Benefits_CTA-SMR_Pain-W-B_M-MIX_VL-45s_TR-None_G-MF_P-OG_S-WHAT_FB2516V13,US || ASC+ || Website + Shop || 7DC || Existing 0% || 24.03.2025 Ad set,VIDEO,$360,"12,626",2025-03-24,2025-04-21,28
119,CB_2025_Apr_FB_3980_LZ-KB_V24_9x16_VID_EN_Opti_C-BulletPoints_Evergreen_CTA-SALE_Angle-W_M-MIX_VL-45s_G-MF_P-OG_S-WHAT_FB3097V03,3980 - winner video man boobs opti || Batch 6 || Enhancements: OFF || CBV1 || 7C || 11/04/25w16,VIDEO,$357,"17,711",2025-04-11,2025-04-16,5
120,CB_2023_May_FB_2263_MB_V04_9x16_VID_EN_New_C-Sale_CTA-SMR_Pain-W_M-JOG_VL-45s_TR-None_G-M-F_P-None_S-Moon,CA || ASC+ || 0% EXISTING || 7DC || 18.03.2025,VIDEO,$356,"16,445",2025-03-18,2025-04-21,34
121,CB_2023_May_FB_2263_MB_V04_9x16_VID_EN_New_C-Sale_CTA-SMR_Pain-W_M-JOG_VL-45s_TR-None_G-M-F_P-None_S-Moon,CBV2 || AU || ðŸ’° Advantage+ || US || BROAD || 7C || Existing_customer_5% || 19/12/24 Ad set,VIDEO,$330,"9,641",2024-12-19,2025-04-21,123
122,CB_2024_Feb_FB_2812_MB-RP_V07_9x16_VID_EN_Opti_C-Sale_CTA-C65_Pain-W_M-NONE_VL-30s_TR-None_G-MF_P-Plan_S-NEW_FB2601V04_1,US || Kilo Product's leads LAL || 7C || 04/03/25,VIDEO,$327,"8,079",2025-03-04,2025-04-21,48
123,CB_2025_Apr_FB_3995_DT-DP_V01_9x16_VID_EN_Opti_C-MakingOf_Evergreen_CTA-CTA_Angle-W-B_M-CRAZY_VL-45s_G-M_P-OG_S-NEW_FB3022V01,US || ASC+ || Website + Shop || 7DC || Existing 0% || 24.03.2025 Ad set,VIDEO,$327,"13,636",2025-04-13,2025-04-16,3
124,CB_2025_Apr_FB_4030_DT_V06_4x5_IMG_EN_New_C-Headline_Sale_CTA-SPRNG_Angle-W-B-C_M-NONE_VL-None_G-NONE_P-OG_S-NONE_fb3890V04,4030 - Easter Sale winner ads Opti || Batch 2 || Enhancements: OFF || CBV1 || 7C || 16/04/25w16,SHARE,$314,"14,649",2025-04-16,2025-04-19,3
125,CB_2025_Apr_FB_4030_DT_V01_4x5_IMG_EN_New_C-Headline_Sale_CTA-SPRNG_Angle-W-B-C_M-NONE_VL-None_G-NONE_P-OG_S-NONE_FB3907V03,4030 - Easter Sale winner ads Opti || Batch 1 || Enhancements: OFF || CBV1 || 7C || 16/04/25w16,SHARE,$312,"10,739",2025-04-16,2025-04-19,3
126,CB_2025_Apr_FB_4005_CHUB-FRP_V01_9x16_VID_EN_New_C-UGC_CTA-NONE_Angle-W-B_M-NONE_VL-45s_TR-None_G-F_P-OG_S-NONE,4005 - CHUB Customer reviews  || Batch 1 || Enhancements: OFF || CBV1 || 7C || 14/04/25w16,VIDEO,$307,"7,792",2025-04-14,2025-04-17,3
127,CB_2025_Apr_FB_3961_SO-JG_V08_4x5_IMG_EN_New_C-NONE_Evergreen_CTA-NONE_Angle-W-B-C_M-NONE_VL-None_G-NONE_P-OG_S-NONE,3961 - Action Figur || Batch 3 || Enhancements: OFF || CBV1 || 7C || 14/04/25w16,SHARE,$304,"18,444",2025-04-14,2025-04-21,7
128,CB_2025_Apr_FB_3986_DT-DP_V03_9x16_VID_EN_Opti_C-Trend_Sale_CTA-SPRNG_Angle-W-B-C_M-TRC_VL-30s_G-F_P-OG_S-NEW,3986 - GFs POV / male confidence / new actors || Batch 1 || Enhancements: OFF || CBV1 || 7C || 11/04/25w16,VIDEO,$299,"11,409",2025-04-14,2025-04-20,6
129,CB_2025_Apr_FB_4009_DT-VG_V03_4x5_GIF_EN_New_C-Trend_Sale_CTA-65_Angle-W_M-NONE_VL-15s_G-NONE_P-OG_S-NEW.mp4,4009 - SummerBody Man edition || Batch 1 || Enhancements: OFF || CBV1 || 7C || 14/04/25w16,VIDEO,$296,"6,534",2025-04-14,2025-04-17,3
130,CB_2025_Apr_FB_3977_DT_V03_9x16_VID_EN_New_C-Headline_Sale_CTA-65_Angle-W-B-C_M-JOG_VL-30s_G-F_P-OG_S-NEW,3977 - Sexiest Booty || Batch 1 || Enhancements: OFF || CBV1 || 7C || 14/04/25w16,VIDEO,$296,"13,131",2025-04-14,2025-04-17,3
131,CB_2024_Nov_FB_3264_LZ_V31_4x5_VID_EN_Opti_C-MakingOf_Sale_CTA-BF_Angle-W-B_M-CRAZY_VL-45s_G-M_P-OG_S-NEW_FB3004V02,CBV2 || EU (UK) || ðŸ’° Advantage+ || US || BROAD || 7C || Existing_customer_5% || 15/12/24 Ad set,VIDEO,$295,"12,316",2024-12-19,2025-04-21,123
132,CB_2024_Sep_FB_3175_DA-KB_V01_1x1_IMG_EN_New_C-ADVRT_Evergreen_CTA-NONE_Angle-W_M-NONE_VL-None_G-NONE_P-CBV2_S-NONE_blog_colonbroomvsmammothhighprice3_cv_en,CBV2 || A/B test CTA button: Variaton || CBV2 vs Happy Mammoth || 7C || 26/03/25,SHARE,$294,"18,506",2025-03-26,2025-04-21,26
133,CB_2025_Apr_FB_4000_VG_V01_4x5_IMG_EN_New_C-Headline_Evergreen_CTA-SALE_Angle-GH_M-NONE_VL-None_G-NONE_P-OG_S-NONE-1,4000 - CSC_Brain Fog new || Batch 1 || Enhancements: OFF || CBV1 || 7C || 14/04/25w16,SHARE,$278,"14,004",2025-04-14,2025-04-17,3
134,CB_2025_Feb_FB_3827_LZ_V03_1x1_IMG_EN_Opti_C-Headline_Evergreen_CTA-SALE_Angle-W_M-NONE_VL-None_G-M_P-CBV2_S-NONE_FB3705V02,CBV2 || US || Manual Bid: ROAS GOAL: 1.00 -> 1.1 || 7DC || 22/01/2025,SHARE,$275,"7,997",2025-02-18,2025-04-21,62
135,CB_2025_Apr_FB_3967_SO_V13_9x16_VID_EN_New_C-NONE_Evergreen_CTA-65_Angle-W-B-C_M-NONE_VL-55s_G-F_P-OG_S-NEW,3967 - #127 Look at Me VID || Batch 3 || Enhancements: OFF || CBV1 || 7C || 14/04/25w16,VIDEO,$273,"8,089",2025-04-14,2025-04-17,3
136,CB_2025_Apr_FB_4001_VG_V01_4x5_IMG_EN_New_C-Headline_Evergreen_CTA-SALE_Angle-B-C_M-NONE_VL-None_G-NONE_P-OG_S-NONE-2,4001 - CSC_SummerBody_Bloating || Batch 1 || Enhancements: OFF || CBV1 || 7C || 14/04/25w16,SHARE,$272,"11,296",2025-04-14,2025-04-17,3
137,CB_2025_Apr_FB_3980_LZ-KB_V08_9x16_VID_EN_Opti_C-Pointing_Evergreen_CTA-SALE_Angle-W_M-POW_VL-30s_G-M_P-OG_S-MOON_FB2036V03,US || ASC+ || Website + Shop || 7DC || Existing 0% || 24.03.2025 Ad set,VIDEO,$262,"11,780",2025-04-14,2025-04-21,7
138,CB_2025_Jan_FB_3742_SO-DP-KB_V01_4x5_IMG_EN_Opti_C-NONE_Evergreen_CTA-SALE_Angle-W_M-NONE_VL-None_G-NONE_P-CBV2_S-NONE3665V01,CBV2 || EU (UK) || ðŸ’° Advantage+ || US || BROAD || 7C || Existing_customer_5% || 15/12/24 Ad set,SHARE,$260,"12,600",2025-02-04,2025-04-21,76
139,CB_2025_Mar_FB_3903_VK_V01_9x16_VID_EN_New_C-BulletPoints_Evergreen_CTA-65_Angle-W-B-C_M-MIX_VL-30s_G-MF_P-OG_S-NEW,ðŸŒ¶ï¸ || US || ASC+ || ->CC141 || VIDEO Only || US+CA || 0% EXISTING CAP || 7C || 07/08.24  Ad set,VIDEO,$259,"8,856",2025-04-01,2025-04-21,20
140,CB_2024_Sep_FB_3175_DA-KB_V01_1x1_IMG_EN_New_C-ADVRT_Evergreen_CTA-NONE_Angle-W_M-NONE_VL-None_G-NONE_P-CBV2_S-NONE_blog_colonbroomvsmammoth_cv_en,CBV2 || Advantage+ || Advertorial || Higher pricing || US || 0% EXISTING CAP || BROAD || 7C || 20/01/25  Campaign Ad set,SHARE,$256,"12,085",2025-01-20,2025-04-21,91
141,CB_2025_Mar_FB_3913_CHUB-AS_V06_1x1_IMG_EN_New_C-NONE_CTA-NONE_Angle-W_M-NONE_VL-None_TR-None_G-NONE_P-NONE_S-NONE_blog_moobs_cv_en,CBV1 || LP:HI | blog_moobs_cv_en || Batch 2 || 30/03/25,SHARE,$253,"7,789",2025-03-30,2025-04-16,17
142,CB_2025_Jan_FB_3723_SO_V04_4x5_IMG_EN_New_C-NONE_Evergreen_CTA-SALE_Angle-W_M-NONE_VL-None_G-NONE_P-NONE_S-NONE,US || Kilo Product's leads LAL || 7C || 04/03/25,SHARE,$252,"10,623",2025-03-04,2025-04-21,48
143,CB_2025_Mar_FB_3913_CHUB-AS_V05_1x1_IMG_EN_New_C-NONE_CTA-NONE_Angle-W_M-NONE_VL-None_TR-None_G-NONE_P-NONE_S-NONE_blog_moobs_cv_en,CBV1 || LP:HI | blog_moobs_cv_en || Batch 2 || 30/03/25,SHARE,$247,"7,579",2025-03-30,2025-04-16,17
144,CB_2025_Feb_FB_3827_LZ_V03_1x1_IMG_EN_Opti_C-Headline_Evergreen_CTA-SALE_Angle-W_M-NONE_VL-None_G-M_P-CBV2_S-NONE_FB3705V02,3827 - V2 img winner opti || Batch 2 || 7C || 18/02/2025w08,SHARE,$245,"9,854",2025-02-18,2025-04-14,55
145,CB_2025_Feb_FB_3860_LZ-DP_V03_9x16_VID_EN_Opti_C-Testimonial_Evergreen_CTA-SALE_Angle-W_M-MOOD_VL-20s_G-M_P-OG_S-WOOD_FB21176V11_1,US || ASC+ || Website + Shop || 7DC || Existing 0% || 24.03.2025 Ad set,VIDEO,$243,"8,877",2025-03-24,2025-04-21,28
146,CB_2025_Apr_FB_3974_DT_V04_4x5_IMG_EN_New_C-Headline_Sale_CTA-65_Angle-W_M-NONE_VL-None_G-NONE_P-OG_S-NONE,3974 - Glow-up-shake || Batch 1 || Enhancements: OFF || CBV1 || 7C || 14/04/25w16,SHARE,$237,"8,435",2025-04-14,2025-04-17,3
147,CB_2023_Jul_FB_2284_DA_V05_9x16_VID_EN_Opti_C-Sale_CTA-SMR_Pain-W_M-JANW_VL-30s_TR-None_G-M_P-None_S-WHAT_FB2103V02,US || ASC+ || Website + Shop || 7DC || Existing 0% || 24.03.2025 Ad set,VIDEO,$235,"7,375",2025-03-24,2025-04-21,28
148,CB_2024_Jan_FB_2784_RS_V02_9x16_VID_EN_Opti_C-Pointing_CTA-SALE_Pain-W_M-JOG_VL-30s_TR-None_G-F_P-OG_S-OLLIE_FB2181V01,CBV2 || EU (UK) || ðŸ’° Advantage+ || US || BROAD || 7C || Existing_customer_5% || 15/12/24 Ad set,VIDEO,$229,"8,128",2025-01-09,2025-04-21,102
149,CB_2025_Apr_FB_4001_VG_V03_4x5_IMG_EN_New_C-Headline_Evergreen_CTA-SALE_Angle-B-C_M-NONE_VL-None_G-NONE_P-OG_S-NONE-1.png,4001 - CSC_Summer Body Manboobs edition new || Batch 1 || Enhancements: OFF || CBV1 || 7C || 14/04/25w16,SHARE,$229,"10,902",2025-04-14,2025-04-17,3
150,CB_2025_Apr_FB_3980_LZ-KB_V19_9x16_VID_EN_Opti_C-MakingOf_Evergreen_CTA-SALE_Angle-W_M-AGR_VL-45s_G-M_P-OG_S-NEW_FB3005V05,3980 - winner video man boobs opti || Batch 5 || Enhancements: OFF || CBV1 || 7C || 11/04/25w16,VIDEO,$228,"8,672",2025-04-11,2025-04-18,7
151,CB_2025_Apr_FB_3999_VG_V01_4x5_IMG_EN_New_C-Educational_Evergreen_CTA-NONE_Angle-GH_M-NONE_VL-None_G-NONE_P-OG_S-NONE-2.png,3999 - CSC_Sugar Crush new  || Batch 1 || Enhancements: OFF || CBV1 || 7C || 14/04/25w16,SHARE,$227,"7,939",2025-04-14,2025-04-17,3
152,CB_2025_Apr_FB_3967_SO_V05_9x16_VID_EN_New_C-NONE_Evergreen_CTA-65_Angle-W-B-C_M-NONE_VL-45s_G-F_P-OG_S-NEW,3967 - #127 Look at Me VID || Batch 1 || Enhancements: OFF || CBV1 || 7C || 14/04/25w16,VIDEO,$225,"10,123",2025-04-14,2025-04-17,3
153,CB_2025_Mar_FB_3914_DT-DP_V01_9x16_VID_EN_New_C-Trend_Sale_CTA-SPRNG_Angle-W-B-C_M-JOG_VL-30s_G-F_P-OG_S-NEW.mp4,US || Quiz: Shopify || 7C || 04/04/25,VIDEO,$219,"7,726",2025-04-04,2025-04-21,17
154,CB_2025_Apr_FB_3993_SO-JG_V01_9x16_VID_EN_New_C-NONE_Evergreen_CTA-NONE_Angle-W-B-C_M-NONE_VL-25s_G-F_P-OG_S-NEW,3993 - Tax-Wars VID JG || Batch 1 || Enhancements: OFF || CBV1 || 7C || 14/04/25w16,VIDEO,$216,"5,787",2025-04-14,2025-04-17,3
155,CB_2025_Apr_FB_3992_LZ-KB_V04_4x5_IMG_EN_Opti_C-Headline_Sale_CTA-SPRNG_Angle-W_M-NONE_VL-None_G-NONE_P-OG_S-NONE_FB1218V15,3988 - IMG winners easter opti || Batch 3 || Enhancements: OFF || CBV1 || 7C || 14/04/25w16,SHARE,$214,"7,940",2025-04-14,2025-04-20,6
156,CB_2023_Jul_FB_2217_IB_V04_9x16_VID_EN_Opti_C-Pointing_CTA-SMR_Pain-W-B_M-TRC_VL-30s_TR-None_G-F_P-None_S-FRIGGA,US || Manual Bid || BFCM || COST CAP 71 || 1C || 15/11/24,VIDEO,$212,"8,311",2024-11-15,2025-04-21,157
157,CB_2024_Nov_FB_3305_SO-DP_V02_4x5_VID_EN_Opti_C-Sale_CTA-BF_Pain-W_M-Chris_VL-30s_TR-None_G-MF_P-Plan_S-NEW_FB2601V07,CBV2 || AU || ðŸ’° Advantage+ || US || BROAD || 7C || Existing_customer_5% || 19/12/24 Ad set,VIDEO,$201,"7,190",2024-12-19,2025-04-21,123
158,CB_2025_Jan_FB_3723_SO_V07_4x5_IMG_EN_New_C-NONE_Evergreen_CTA-SALE_Angle-W_M-NONE_VL-None_G-NONE_P-NONE_S-NONE,CA || ASC+ || 0% EXISTING || 7DC || 18.03.2025,SHARE,$201,"14,012",2025-03-18,2025-04-21,34
159,CB_2025_Mar_FB_3909_DT-DP_V03_9x16_VID_EN_New_C-Trend_Evergreen_CTA-SMRBOD_Angle-W-B-C_M-JANW_VL-30s_G-M_P-OG_S-NEW,US || Kilo Product's leads LAL || 7C || 04/03/25,VIDEO,$197,"6,971",2025-04-06,2025-04-21,15
160,CB_2025_Feb_FB_3883_LZ-RP_V05_9x16_VID_EN_Opti_C-BulletPoints_Evergreen_CTA-SALE_Angle-W_M-JANW_VL-30s_G-M_P-OG_S-WHAT_FB2284V05,3883 - Wiiner opti man boobs t levels || Enhancements: OFF || CBV1 || Batch 1 || 7C || 10/03/25w11,VIDEO,$196,"7,367",2025-03-10,2025-04-14,35
161,CB_2024_Sep_FB_3175_DA-KB_V03_1x1_IMG_EN_New_C-ADVRT_Evergreen_CTA-NONE_Angle-W_M-NONE_VL-None_G-NONE_P-CBV2_S-NONE_blog_colonbroomvsmammoth_cv_en,CBV2 || Advantage+ || Advertorial || Higher pricing || US || 0% EXISTING CAP || BROAD || 7C || 20/01/25  Campaign Ad set,SHARE,$195,"10,010",2025-01-20,2025-04-21,91
162,CB_2025_Apr_FB_3979_DT-DP_V04_9x16_VID_EN_New_C-Headline_Sale_CTA-65_Angle-B-C_M-JOG_VL-30s_G-F_P-OG_S-NEW,3979 - Healthy gut = healthy skin || Batch 1 || Enhancements: OFF || CBV1 || 7C || 11/04/25w16,VIDEO,$194,"6,497",2025-04-14,2025-04-17,3
163,CB_2024_Sep_FB_3175_DA-KB_V03_1x1_IMG_EN_New_C-ADVRT_Evergreen_CTA-NONE_Angle-W_M-NONE_VL-None_G-NONE_P-CBV2_S-NONE_blog_colonbroomvsmammothhighprice3_cv_en,CBV2 || A/B test CTA button: Variaton || CBV2 vs Happy Mammoth || 7C || 26/03/25,SHARE,$193,"9,254",2025-03-26,2025-04-21,26
164,CB_2025_Apr_FB_3967_SO_V10_9x16_VID_EN_New_C-NONE_Evergreen_CTA-65_Angle-W-B-C_M-NONE_VL-40s_G-F_P-OG_S-NEW,3967 - #127 Look at Me VID || Batch 2 || Enhancements: OFF || CBV1 || 7C || 14/04/25w16,VIDEO,$181,"6,121",2025-04-14,2025-04-20,6
165,CB_2025_Mar_FB_3913_CHUB-AS_V04_1x1_IMG_EN_New_C-NONE_CTA-NONE_Angle-W_M-NONE_VL-None_TR-None_G-NONE_P-NONE_S-NONE_blog_moobs_cv_en,CBV2 || LP:HI | blog_moobs_cv_en || Batch 1 || 08/03/25,SHARE,$177,"7,389",2025-04-08,2025-04-16,8
166,CB_2025_Mar_FB_3935_VK-DP_V03_9x16_VID_EN_New_C-Trend_Sale_CTA-65_Angle-W_M-POW_VL-30s_G-M_P-APP_S-NEW_FB3921V02.mp4,CB App || US + CA || 7DC || 15/04/2025,VIDEO,$168,"9,740",2025-04-15,2025-04-16,1
167,CB_2025_Apr_FB_4008_SO-VG_V08_9x16_VID_EN_New_C-NONE_Evergreen_CTA-NONE_Angle-SC_M-POW_VL-25s_G-F_P-OG_S-NEW,4008 - CSC_CB VID SugarCrush || Batch 3 || Enhancements: OFF || CBV1 || 7C || 15/04/25w16,VIDEO,$162,"4,882",2025-04-15,2025-04-17,2
168,CB_2025_Apr_FB_3980_LZ-KB_V18_9x16_VID_EN_Opti_C-MakingOf_Evergreen_CTA-SALE_Angle-W_M-AGR_VL-45s_G-M_P-OG_S-NEW_FB3005V05,3980 - winner video man boobs opti || Batch 5 || Enhancements: OFF || CBV1 || 7C || 11/04/25w16,VIDEO,$160,"6,614",2025-04-11,2025-04-18,7
169,CB_2025_Apr_FB_3999_VG_V02_4x5_IMG_EN_New_C-Educational_Evergreen_CTA-NONE_Angle-GH_M-NONE_VL-None_G-NONE_P-OG_S-NONE-1.png,3999 - CSC_Sugar Crush new  || Batch 1 || Enhancements: OFF || CBV1 || 7C || 14/04/25w16,SHARE,$158,"7,224",2025-04-14,2025-04-17,3
170,CB_2025_Apr_FB_3991_VG_V02_4x5_IMG_EN_New_C-SplitScreen_Evergreen_CTA-NONE_Angle-GH_M-NONE_VL-None_G-NONE_P-OG_S-NONE-2,3991 - NEW ANGLE FATTY LIVER || Batch 1 || Enhancements: OFF || CBV1 || 7C || 14/04/25w16,SHARE,$156,"10,839",2025-04-14,2025-04-20,6
171,CB_2025_Apr_FB_4001_VG_V01_4x5_IMG_EN_New_C-Headline_Evergreen_CTA-SALE_Angle-B-C_M-NONE_VL-None_G-NONE_P-OG_S-NONE,4001 - CSC_SummerBody_Bloating || Batch 1 || Enhancements: OFF || CBV1 || 7C || 14/04/25w16,SHARE,$153,"6,557",2025-04-14,2025-04-17,3
172,CB_2025_Apr_FB_3987_SO-JG_V07_4x5_IMG_EN_New_C-NONE_Evergreen_CTA-NONE_Angle-W-B-C_M-NONE_VL-None_G-NONE_P-OG_S-NONE,3987 - Tax-Wars IMG JG || Batch 2 || Enhancements: OFF || CBV1 || 7C || 09/04/25w15,SHARE,$152,"5,192",2025-04-09,2025-04-18,9
173,CB_2025_Mar_FB_3911_DT_V03_9x16_VID_EN_Opti_C-SingleTesti_Sale_CTA-Patrick_Angle-W_M-TRC_VL-45s_G-F_P-OG_S-MOON_FB2764V04,CBV2 || EU (UK) || ðŸ’° Advantage+ || US || BROAD || 7C || Existing_customer_5% || 15/12/24 Ad set,VIDEO,$144,"6,610",2025-03-17,2025-04-21,35
174,CB_2025_Apr_FB_4008_SO-VG_V01_9x16_VID_EN_New_C-NONE_Evergreen_CTA-NONE_Angle-SC_M-POW_VL-25s_G-F_P-OG_S-NEW,4008 - CSC_CB VID SugarCrush || Batch 1 || Enhancements: OFF || CBV1 || 7C || 15/04/25w16,VIDEO,$136,"5,446",2025-04-15,2025-04-17,2
175,CB_2025_Apr_FB_3993_SO-JG_V02_9x16_VID_EN_New_C-NONE_Evergreen_CTA-NONE_Angle-W-B-C_M-NONE_VL-25s_G-F_P-OG_S-NEW,3993 - Tax-Wars VID JG || Batch 1 || Enhancements: OFF || CBV1 || 7C || 14/04/25w16,VIDEO,$136,"3,253",2025-04-14,2025-04-17,3
176,CB_2025_Apr_FB_3967_SO_V09_9x16_VID_EN_New_C-NONE_Evergreen_CTA-65_Angle-W-B-C_M-NONE_VL-40s_G-F_P-OG_S-NEW,3967 - #127 Look at Me VID || Batch 2 || Enhancements: OFF || CBV1 || 7C || 14/04/25w16,VIDEO,$135,"4,437",2025-04-14,2025-04-20,6
177,CB_2024_Feb_FB_2814_MB-DP_V05_1x1_IMG_EN_New_C-WeightLoss_CTA-None_Pain-W-B-C_M-NONE_VL-None_TR-None_G-NONE_P-V2_S-NONE,CBV2 || EU (UK) || ðŸ’° Advantage+ || US || BROAD || 7C || Existing_customer_5% || 15/12/24 Ad set,SHARE,$134,"5,642",2025-01-31,2025-04-21,80
178,CB_2025_Apr_FB_3996_DT-DP_V03_9x16_VID_EN_Opti_C-MakingOf_Evergreen_CTA-CTA_Angle-W-B_M-CRAZY_VL-45s_G-M_P-OG_S-NEW_FB3022V03,3996 - 3022 V03 opti || Batch 1 || Enhancements: OFF || CBV1 || 7C || 11/04/25w16,VIDEO,$134,"5,844",2025-04-11,2025-04-21,10
179,CB_2025_Jan_FB_3741_LZ-JG_V01_4x5_IMG_EN_Opti_C-Headline_Evergreen_CTA-NONE_Angle-W_M-NONE_VL-None_G-NONE_P-CBV2_S-NONE_FB3357V01,CBV2 || US || Manual Bid: ROAS GOAL: 1.00 -> 1.1 || 7DC || 22/01/2025,SHARE,$133,"5,010",2025-01-22,2025-04-21,89
180,CB_2024_Feb_FB_2834_DA_V04_4x5_IMG_EN_Opti_C-SingleTesti_CTA-NONE_Pain-W_M-NONE_VL-None_TR-None_G-NONE_P-V2_S-NONE_FB2759V04,CBV2 || AU || ðŸ’° Advantage+ || US || BROAD || 7C || Existing_customer_5% || 19/12/24 Ad set,SHARE,$133,"5,412",2024-12-19,2025-04-21,123
181,CB_2025_Apr_FB_4000_VG_V02_4x5_IMG_EN_New_C-Headline_Evergreen_CTA-SALE_Angle-GH_M-NONE_VL-None_G-NONE_P-OG_S-NONE-2,4000 - CSC_Brain Fog new || Batch 1 || Enhancements: OFF || CBV1 || 7C || 14/04/25w16,SHARE,$130,"6,540",2025-04-14,2025-04-17,3
182,CB_2024_Mar_FB_2888_JG_V02_9x16_IMG_EN_Opti_C-Benefits_CTA-NONE_Pain-W_M-NONE_VL-None_TR-None_G-NONE_P-V2_S-NONE,CBV2 || AU || ðŸ’° Advantage+ || US || BROAD || 7C || Existing_customer_5% || 19/12/24 Ad set,SHARE,$129,"5,029",2024-12-19,2025-04-21,123
183,CB_2023_Dec_FB_2696_RS_V03_9x16_VID_EN_Opti_C-Sale_CTA-NY65_Pain-W-B_M-JANW_VL-30s_TR-None_G-M_P-OG_S-WHAT_FB2284V05,CBV2 || AU || ðŸ’° Advantage+ || US || BROAD || 7C || Existing_customer_5% || 19/12/24 Ad set,VIDEO,$127,"4,606",2025-01-13,2025-04-21,98
184,CB_2025_Apr_FB_4007_LZ-VG_V01_9x16_VID_EN_New_C-Pointing_Evergreen_CTA-SALE_Angle-Energy_M-TRC_VL-30s_G-F_P-OG_S-NEW.mp4,4007 - CSC_CB VID Brain Fog || Batch 1 || Enhancements: OFF || CBV1 || 7C || 14/04/25w16,VIDEO,$124,"4,389",2025-04-14,2025-04-20,6
185,CB_2024_Mar_FB_2888_JG_V01_9x16_IMG_EN_Opti_C-Benefits_CTA-NONE_Pain-W_M-NONE_VL-None_TR-None_G-NONE_P-V2_S-NONE,CBV2 || AU || ðŸ’° Advantage+ || US || BROAD || 7C || Existing_customer_5% || 19/12/24 Ad set,SHARE,$123,"3,978",2024-12-19,2025-04-21,123
186,CB_2025_Apr_FB_4002_LZ-KB_V04_9x16_VID_EN_Opti_C-Sale_Sale_CTA-SPRNG_Angle-W_M-MIX_VL-30s_G-MF_P-OG_S-WHAT_FB2812V07,4002 - video winners easter opti || Batch 2 || Enhancements: OFF || CBV1 || 7C || 14/04/25w16,VIDEO,$122,"6,719",2025-04-14,2025-04-17,3
187,CB_2025_Apr_FB_3967_SO_V14_9x16_VID_EN_New_C-NONE_Evergreen_CTA-65_Angle-W-B-C_M-NONE_VL-55s_G-F_P-OG_S-NEW,3967 - #127 Look at Me VID || Batch 3 || Enhancements: OFF || CBV1 || 7C || 14/04/25w16,VIDEO,$119,"4,154",2025-04-14,2025-04-17,3
188,CB_2025_Apr_FB_4001_VG_V01_4x5_IMG_EN_New_C-Headline_Evergreen_CTA-SALE_Angle-B-C_M-NONE_VL-None_G-NONE_P-OG_S-NONE-1.png,4001 - CSC_Summer Body Manboobs edition new || Batch 1 || Enhancements: OFF || CBV1 || 7C || 14/04/25w16,SHARE,$118,"5,900",2025-04-14,2025-04-17,3
189,CB_2025_Apr_FB_4004_CHUB-KZ_V02_9x16_VID_EN_New_C-NONE_CTA-NONE_Angle-W-B-C_M-F_VL-None_TR-None_G-NONE_P-NONE_S-NONE,4004 - CHUB LosingPCOSWeight || Batch 1 || Enhancements: OFF || CBV1 || 7C || 14/04/25w16,VIDEO,$117,"4,060",2025-04-14,2025-04-19,5
190,CB_2025_Apr_FB_4008_SO-VG_V03_9x16_VID_EN_New_C-NONE_Evergreen_CTA-NONE_Angle-SC_M-POW_VL-25s_G-F_P-OG_S-NEW,4008 - CSC_CB VID SugarCrush || Batch 1 || Enhancements: OFF || CBV1 || 7C || 15/04/25w16,VIDEO,$114,"3,854",2025-04-15,2025-04-17,2
191,CB_2025_Apr_FB_3979_DT-DP_V03_9x16_VID_EN_New_C-Headline_Sale_CTA-65_Angle-B-C_M-JOG_VL-30s_G-F_P-OG_S-NEW,3979 - Healthy gut = healthy skin || Batch 1 || Enhancements: OFF || CBV1 || 7C || 11/04/25w16,VIDEO,$113,"4,664",2025-04-14,2025-04-17,3
192,CB_2025_Apr_FB_3979_DT-DP_V02_9x16_VID_EN_New_C-Headline_Sale_CTA-65_Angle-B-C_M-JOG_VL-30s_G-F_P-OG_S-NEW,3979 - Healthy gut = healthy skin || Batch 1 || Enhancements: OFF || CBV1 || 7C || 11/04/25w16,VIDEO,$112,"3,788",2025-04-14,2025-04-17,3
193,CB_2025_Apr_FB_3974_DT_V03_4x5_IMG_EN_New_C-Headline_Sale_CTA-65_Angle-W_M-NONE_VL-None_G-NONE_P-OG_S-NONE,3974 - Glow-up-shake || Batch 1 || Enhancements: OFF || CBV1 || 7C || 14/04/25w16,SHARE,$110,"3,377",2025-04-14,2025-04-17,3
194,CB_2025_Apr_FB_3977_DT_V05_9x16_VID_EN_New_C-Headline_Sale_CTA-65_Angle-W-B-C_M-JOG_VL-30s_G-F_P-OG_S-NEW,3977 - Sexiest Booty || Batch 1 || Enhancements: OFF || CBV1 || 7C || 14/04/25w16,VIDEO,$107,"5,669",2025-04-14,2025-04-17,3
195,CB_2025_Apr_FB_4001_VG_V02_4x5_IMG_EN_New_C-Headline_Evergreen_CTA-SALE_Angle-B-C_M-NONE_VL-None_G-NONE_P-OG_S-NONE-1.png,4001 - CSC_Summer Body Manboobs edition new || Batch 1 || Enhancements: OFF || CBV1 || 7C || 14/04/25w16,SHARE,$106,"5,321",2025-04-14,2025-04-17,3
196,CB_2025_Apr_FB_4007_LZ-VG_V03_9x16_VID_EN_New_C-Pointing_Evergreen_CTA-SALE_Angle-Energy_M-TRC_VL-30s_G-F_P-OG_S-NEW,4007 - CSC_CB VID Brain Fog || Batch 1 || Enhancements: OFF || CBV1 || 7C || 14/04/25w16,VIDEO,$103,"2,967",2025-04-14,2025-04-20,6
197,CB_2025_Apr_FB_3985_DT-DP_V02_9x16_VID_EN_Opti_C-Trend_Sale_CTA-SPRNG_Angle-W-B-C_M-JOG_VL-30s_G-F_P-OG_S-NEW,3985 - Opti 3914 || Batch 1 || Enhancements: OFF || CBV1 || 7C || 11/04/25w16,VIDEO,$102,"3,786",2025-04-14,2025-04-18,4
198,CB_2025_Mar_FB_3932_SO-DP_V03_4x5_VID_EN_Opti_C-BulletPoints_Evergreen_CTA-70_Angle-W-B-C_M-NONE_VL-None_G-F_P-APP_S-NEW_FB3779V02.png,CB_App || US + CA || 3932 - App ads pt. 4 IMG || App_purchase || 7DC || 19/04/2025,SHARE,$102,"3,192",2025-04-19,2025-04-21,2
199,CB_2024_Nov_FB_3264_LZ_V31_4x5_VID_EN_Opti_C-MakingOf_Sale_CTA-BF_Angle-W-B_M-CRAZY_VL-45s_G-M_P-OG_S-NEW_FB3004V02,CBV2 || AU || ðŸ’° Advantage+ || US || BROAD || 7C || Existing_customer_5% || 19/12/24 Ad set,VIDEO,$101,"3,223",2024-12-19,2025-04-21,123
200,CB_2025_Apr_FB_3975_LZ_V03_9x16_VID_EN_New_C-Testimonial_Evergreen_CTA-SALE_Angle-W_M-LAURA_VL-15s_G-F_P-OG_S-NEW,3975 - Idea #125 -X from waist || Batch 1 || Enhancements: OFF || CBV1 || 7C || 07/04/25w15,VIDEO,$99,"5,449",2025-04-07,2025-04-14,7
201,CB_2025_Apr_FB_3991_VG_V01_4x5_IMG_EN_New_C-SplitScreen_Evergreen_CTA-NONE_Angle-GH_M-NONE_VL-None_G-NONE_P-OG_S-NONE-1,3991 - NEW ANGLE FATTY LIVER || Batch 1 || Enhancements: OFF || CBV1 || 7C || 14/04/25w16,SHARE,$93,"7,109",2025-04-14,2025-04-20,6
202,CB_2025_Mar_FB_3933_VK-DP_V02_4x5_VID_EN_NEW_C-NONE_Evergreen_CTA-NONE_Angle-None_M-NONE_VL-None_G-M_P-APP_S-NONE.png,CB_App || US + CA || 3933 - APP ads pt. 3 - DP+VK ) || App_purchase || 7DC || 19/04/2025,SHARE,$92,"3,987",2025-04-19,2025-04-21,2
203,CB_2025_Mar_FB_3913_CHUB-AS_V07_1x1_IMG_EN_New_C-NONE_CTA-NONE_Angle-W_M-NONE_VL-None_TR-None_G-NONE_P-NONE_S-NONE_blog_moobs_cv_en,CBV1 || LP:HI | blog_moobs_cv_en || Batch 2 || 30/03/25,SHARE,$92,"2,199",2025-03-30,2025-04-16,17
204,CB_2025_Mar_FB_3931_VK-DP_V02_1x1_VID_EN_New_C-NONE_Evergreen_CTA-NONE_Angle-None_M-NONE_VL-None_G-M_P-APP_S-NONE.jpg,CB_App || US + CA || 3931 - APP ads pt. 2 - DP -VK || App_purchase || 7DC || 19/04/2025,SHARE,$92,"4,249",2025-04-19,2025-04-21,2
205,CB_2025_Mar_FB_3909_DT-DP_V03_9x16_VID_EN_New_C-Trend_Evergreen_CTA-SMRBOD_Angle-W-B-C_M-JANW_VL-30s_G-M_P-OG_S-NEW,3909 - Shirtless anxiety VID || Batch 1 || Enhancements: OFF || CBV1 || 7C || 24/03/25w13,VIDEO,$91,"4,714",2025-03-24,2025-04-14,21
206,CB_2025_Apr_FB_4008_SO-VG_V07_9x16_VID_EN_New_C-NONE_Evergreen_CTA-NONE_Angle-SC_M-POW_VL-25s_G-F_P-OG_S-NEW,4008 - CSC_CB VID SugarCrush || Batch 3 || Enhancements: OFF || CBV1 || 7C || 15/04/25w16,VIDEO,$91,"4,346",2025-04-15,2025-04-17,2
207,CB_2025_Jan_FB_3723_SO_V07_4x5_IMG_EN_New_C-NONE_Evergreen_CTA-SALE_Angle-W_M-NONE_VL-None_G-NONE_P-NONE_S-NONE,US || Kilo Product's leads LAL || 7C || 04/03/25,SHARE,$90,"3,448",2025-03-04,2025-04-21,48
208,CB_2025_Apr_FB_4009_DT-VG_V02_4x5_GIF_EN_New_C-Trend_Sale_CTA-65_Angle-W_M-NONE_VL-7s_G-NONE_P-OG_S-NEW,4009 - SummerBody Man edition || Batch 1 || Enhancements: OFF || CBV1 || 7C || 14/04/25w16,VIDEO,$90,"2,934",2025-04-14,2025-04-17,3
209,CB_2025_Apr_FB_4005_CHUB-FRP_V04_9x16_VID_EN_New_C-UGC_CTA-NONE_Angle-W-B_M-NONE_VL-45s_TR-None_G-F_P-OG_S-NONE,4005 - CHUB Customer reviews  || Batch 1 || Enhancements: OFF || CBV1 || 7C || 14/04/25w16,VIDEO,$86,"3,057",2025-04-14,2025-04-17,3
210,CB_2025_Mar_FB_3939_DT_V07_4x5_IMG_EN_New_C-Advertorial_Sale_CTA-65_Angle-W-B-C_M-MIX_VL-None_G-M_P-OG_S-NONE,3939 - CB Advertorial ads New Ideas || Batch 2 || Enhancements: OFF || CBV1 || 7C || 30/03/25w14,SHARE,$83,"3,218",2025-03-30,2025-04-14,15
211,CB_2025_Apr_FB_3967_SO_V02_9x16_VID_EN_New_C-NONE_Evergreen_CTA-65_Angle-W-B-C_M-NONE_VL-45s_G-F_P-OG_S-NEW,3967 - #127 Look at Me VID || Batch 1 || Enhancements: OFF || CBV1 || 7C || 14/04/25w16,VIDEO,$82,"3,518",2025-04-14,2025-04-17,3
212,CB_2025_Mar_FB_3910_LZ-DP_V02_1x1_IMG_EN_Opti_C-NegativeMark_Evergreen_CTA-NONE_Angle-W_M-NONE_VL-None_G-NONE_P-TRIAL_S-NONE_FB2227V08.png,US || Free trial offer || Trial ads || Trial purchase || 7C || 19/03/25,SHARE,$79,"2,831",2025-03-19,2025-04-21,33
213,CB_2024_Sep_FB_3175_DA-KB_V02_1x1_IMG_EN_New_C-ADVRT_Evergreen_CTA-NONE_Angle-W_M-NONE_VL-None_G-NONE_P-CBV2_S-NONE_blog_colonbroomvsmammothhighprice3_cv_en,CBV2 || A/B test CTA button: Variaton || CBV2 vs Happy Mammoth || 7C || 26/03/25,SHARE,$78,"7,639",2025-03-26,2025-04-21,26
214,CB_2025_Feb_FB_3827_LZ_V02_1x1_IMG_EN_Opti_C-Headline_Evergreen_CTA-NONE_Angle-W_M-NONE_VL-None_G-M_P-CBV2_S-NONE_FB3723V18,CBV2 || US || Manual Bid: ROAS GOAL: 1.00 -> 1.1 || 7DC || 22/01/2025,SHARE,$78,"3,460",2025-02-18,2025-04-21,62
215,CB_2025_Apr_FB_3989_DT-DP_V02_9x16_VID_EN_Opti_C-MakingOf_Sale_CTA-SALE_Angle-W-B_M-ALEX_VL-45s_G-M_P-OG_S-NEW_FB3096V01,3989 - 3096 V01 opti || Batch 1 || Enhancements: OFF || CBV1 || 7C || 11/04/25w16,VIDEO,$78,"2,681",2025-04-14,2025-04-18,4
216,CB_2024_Feb_FB_2834_DA_V02_4x5_IMG_EN_Opti_C-SingleTesti_CTA-NONE_Pain-W_M-NONE_VL-None_TR-None_G-NONE_P-V2_S-NONE_FB2759V04,CBV2 || AU || ðŸ’° Advantage+ || US || BROAD || 7C || Existing_customer_5% || 19/12/24 Ad set,SHARE,$75,"2,818",2024-12-19,2025-04-21,123
217,CB_2025_Mar_FB_3935_VK-DP_V02_9x16_VID_EN_New_C-Trend_Sale_CTA-65_Angle-W_M-POW_VL-30s_G-M_P-APP_S-NEW_FB3921V02.mp4,CB_App || US + CA || Re-launch || App_purchase || 7DC || 16/04/2025,VIDEO,$74,"2,617",2025-04-16,2025-04-18,2
218,CB_2025_Apr_FB_3980_LZ-KB_V15_9x16_VID_EN_Opti_C-MakingOf_Evergreen_CTA-SALE_Angle-W_M-AGR_VL-45s_G-M_P-OG_S-NEW_FB3005V05,3980 - winner video man boobs opti || Batch 5 || Enhancements: OFF || CBV1 || 7C || 11/04/25w16,VIDEO,$74,"2,468",2025-04-11,2025-04-18,7
219,CB_2025_Apr_FB_3993_SO-JG_V03_9x16_VID_EN_New_C-NONE_Evergreen_CTA-NONE_Angle-W-B-C_M-NONE_VL-25s_G-F_P-OG_S-NEW,3993 - Tax-Wars VID JG || Batch 1 || Enhancements: OFF || CBV1 || 7C || 14/04/25w16,VIDEO,$73,"1,726",2025-04-14,2025-04-17,3
220,CB_2025_Apr_FB_3988_LZ-KB_V02_4x5_IMG_EN_Opti_C-Headline_Sale_CTA-SPRNG_Angle-W_M-NONE_VL-None_G-M_P-OG_S-NONE_FB3890V04,3988 - IMG winners easter opti || Batch 2 || Enhancements: OFF || CBV1 || 7C || 14/04/25w16,SHARE,$73,"2,941",2025-04-14,2025-04-20,6
221,CB_2025_Mar_FB_3955_SO_V15_4x5_IMG_EN_New_C-NONE_Evergreen_CTA-NONE_Angle-W-B-C_M-NONE_VL-None_G-NONE_P-OG_S-NONE,3955 - THE GHIBLI-VERSE Trend || Batch 5 || Enhancements: OFF || CBV1 || 7C || 01/04/25w14,SHARE,$72,"3,973",2025-04-01,2025-04-14,13
222,CB_2023_Apr_FB_1989_RS_V08_9x16_VID_EN_Opti_C-Trend_CTA-SMR_Pain-W_M-MIX_VL-30s_TR-None_G-MF_P-None - Copy,CA || ASC+ || 0% EXISTING || 7DC || 18.03.2025,VIDEO,$71,"4,042",2025-03-18,2025-04-14,27
223,CB_2025_Mar_FB_3935_VK-DP_V04_9x16_VID_EN_New_C-Trend_Sale_CTA-65_Angle-W_M-POW_VL-30s_G-M_P-APP_S-NEW_FB3921V032.mp4,CB_App || US + CA || Re-launch || Trial_purchase || 7DC || 16/04/2025,VIDEO,$71,"2,710",2025-04-16,2025-04-18,2
224,CB_2025_Apr_FB_4030_DT_V07_4x5_IMG_EN_New_C-Headline_Sale_CTA-SPRNG_Angle-W-B-C_M-NONE_VL-None_G-NONE_P-OG_S-NONE_FB2227V08,US || ASC+ || Website + Shop || 7DC || Existing 0% || 24.03.2025 Ad set,SHARE,$70,"2,413",2025-04-20,2025-04-21,1
225,CB_2025_Mar_FB_3928_VK-DP_V05_1x1_VID_EN_Opti_C-BulletPoints_Evergreen_CTA-NONE_Angle-W-B-C_M-NONE_VL-None_G-M_P-OG_S-NONE_FB3891V05,3928 - opti 3891 kinda sorta opti with man boobs - DP-VK || Batch 1 || Enhancements: OFF || CBV1 || 7C || 24/03/25w13,SHARE,$69,"11,689",2025-03-24,2025-04-17,24
226,CB_2025_Mar_FB_3935_VK-DP_V01_9x16_VID_EN_New_C-Trend_Sale_CTA-65_Angle-W_M-POW_VL-30s_G-M_P-APP_S-NEW_FB3921V01.mp4,CB_App || US + CA || Re-launch || Trial_purchase || 7DC || 16/04/2025,VIDEO,$69,"2,213",2025-04-16,2025-04-18,2
227,CB_2023_Jul_FB_2227_RS_V08_1x1_IMG_EN_New_C-Sale_CTA-CTA_None_M-NONE_VL-None_TR-None_G-NONE_P-None_S-NONE,ðŸŒ¶ï¸ || US || ASC+ || ->CC141 || VIDEO Only || US+CA || 0% EXISTING CAP || 7C || 07/08.24  Ad set,SHARE,$69,"2,811",2024-09-30,2025-04-14,196
228,CB_2025_Mar_FB_3950_SO_V13_4x5_IMG_EN_New_C-NONE_Evergreen_CTA-NONE_Angle-W-B-C_M-NONE_VL-None_G-NONE_P-OG_S-NONE,3950 - Image Gen by ChatGPT || Batch 3 || Enhancements: OFF || CBV1 || 7C || 30/03/25w14,SHARE,$68,"3,868",2025-03-30,2025-04-21,22
229,CB_2025_Apr_FB_3967_SO_V06_9x16_VID_EN_New_C-NONE_Evergreen_CTA-65_Angle-W-B-C_M-NONE_VL-40s_G-F_P-OG_S-NEW,3967 - #127 Look at Me VID || Batch 2 || Enhancements: OFF || CBV1 || 7C || 14/04/25w16,VIDEO,$67,"2,451",2025-04-14,2025-04-20,6
230,CB_2024_Aug_FB_3097_VK-DP_V03_9x16_VID_EN_Opti_C-Benefits_CTA-SMR_Pain-W-B_M-MIX_VL-45s_TR-None_G-MF_P-OG_S-WHAT_FB2516V13,US || Kilo Product's leads LAL || 7C || 04/03/25,VIDEO,$66,"1,922",2025-03-04,2025-04-14,41
231,CB_2025_Jan_FB_3723_SO_V07_4x5_IMG_EN_New_C-NONE_Evergreen_CTA-SALE_Angle-W_M-NONE_VL-None_G-NONE_P-NONE_S-NONE,ðŸŒ¶ï¸ || US || ASC+ || ->CC141 || VIDEO Only || US+CA || 0% EXISTING CAP || 7C || 07/08.24  Ad set,SHARE,$66,"2,846",2025-02-04,2025-04-14,69
232,CB_2024_Sep_FB_3175_DA-KB_V02_1x1_IMG_EN_New_C-ADVRT_Evergreen_CTA-NONE_Angle-W_M-NONE_VL-None_G-NONE_P-CBV2_S-NONE_blog_colonbroomvsmammoth_cv_en,CBV2 || Advantage+ || Advertorial || Higher pricing || US || 0% EXISTING CAP || BROAD || 7C || 20/01/25  Campaign Ad set,SHARE,$65,"4,090",2025-01-20,2025-04-21,91
233,CB_2024_Oct_FB_3182_ZS-GC_V13_1x1_IMG_EN_New_C-UsVsThem_Evergreen_CTA-NONE_Angle-B-C_M-NONE_VL-None_G-NONE_P-OG_S-NONE,CBV2 || AU || ðŸ’° Advantage+ || US || BROAD || 7C || Existing_customer_5% || 19/12/24 Ad set,SHARE,$62,"2,622",2024-12-19,2025-04-21,123
234,CB_2025_Apr_FB_3999_VG_V03_4x5_IMG_EN_New_C-Educational_Evergreen_CTA-NONE_Angle-GH_M-NONE_VL-None_G-NONE_P-OG_S-NONE.png,3999 - CSC_Sugar Crush new  || Batch 1 || Enhancements: OFF || CBV1 || 7C || 14/04/25w16,SHARE,$62,"2,451",2025-04-14,2025-04-17,3
235,CB_2024_Jan_FB_2783_VK-RP_V02_1x1_IMG_EN_Opti_C-ADVRT_CTA-NONE_Pain-W_M-NONE_VL-None_TR-None_G-NONE_P-V2_S-NONE,CBV2 || AU || Advantage+ || Advertorial |  || 0% EXISTING CAP || BROAD || 7C || ad set 18/03/25,SHARE,$58,"2,962",2025-03-20,2025-04-17,28
236,CB_2025_Apr_FB_3967_SO_V04_9x16_VID_EN_New_C-NONE_Evergreen_CTA-65_Angle-W-B-C_M-NONE_VL-45s_G-F_P-OG_S-NEW,3967 - #127 Look at Me VID || Batch 1 || Enhancements: OFF || CBV1 || 7C || 14/04/25w16,VIDEO,$58,"2,536",2025-04-14,2025-04-17,3
237,CB_2025_Apr_FB_3962_VK-DP_V02_9x16_VID_EN_Opti_C-Trend_Evergreen_CTA-NONE_Angle-W-B-C_M-JANW_VL-30s_G-M_P-OG_S-NEW_FB3909V03,US || ASC+ || Website + Shop || 7DC || Existing 0% || 24.03.2025 Ad set,VIDEO,$57,"1,836",2025-04-14,2025-04-21,7
238,CB_2025_Mar_FB_3914_DT-DP_V01_9x16_VID_EN_New_C-Trend_Sale_CTA-SPRNG_Angle-W-B-C_M-JOG_VL-30s_G-F_P-OG_S-NEW.mp4,US || Quiz: React || 7C || 04/04/25,VIDEO,$56,"2,320",2025-04-04,2025-04-21,17
239,CB_2025_Mar_FB_3902_SO-JT_V01_1x1_IMG_EN_New_C-NONE_Evergreen_CTA-NONE_Angle-W-B-C_M-NONE_VL-None_G-NONE_P-OG_S-NONE,ðŸŒ¶ï¸ || US || ASC+ || ->CC141 || VIDEO Only || US+CA || 0% EXISTING CAP || 7C || 07/08.24  Ad set,SHARE,$56,"1,995",2025-03-25,2025-04-14,20
240,CB_2025_Mar_FB_3935_VK-DP_V02_9x16_VID_EN_New_C-Trend_Sale_CTA-65_Angle-W_M-POW_VL-30s_G-M_P-APP_S-NEW_FB3921V02.mp4,CB App || US + CA || 7DC || 15/04/2025,VIDEO,$56,"3,338",2025-04-15,2025-04-16,1
241,CB_2025_Mar_FB_3924_SO-DP_V03_1x1_IMG_EN_New_C-NONE_Evergreen_CTA-NONE_Angle-W-B-C_M-NONE_VL-None_G-NONE_P-OG_S-NONE,US || ASC+ || Website + Shop || 7DC || Existing 0% || 24.03.2025 Ad set,SHARE,$56,"2,849",2025-04-12,2025-04-21,9
242,CB_2025_Mar_FB_3902_SO-JT_V03_1x1_IMG_EN_New_C-NONE_Evergreen_CTA-NONE_Angle-W-B-C_M-NONE_VL-None_G-NONE_P-OG_S-NONE,ðŸŒ¶ï¸ || US || ASC+ || ->CC141 || VIDEO Only || US+CA || 0% EXISTING CAP || 7C || 07/08.24  Ad set,SHARE,$55,"1,956",2025-03-25,2025-04-21,27
243,CB_2025_Apr_FB_4008_SO-VG_V02_9x16_VID_EN_New_C-NONE_Evergreen_CTA-NONE_Angle-SC_M-POW_VL-25s_G-F_P-OG_S-NEW,4008 - CSC_CB VID SugarCrush || Batch 1 || Enhancements: OFF || CBV1 || 7C || 15/04/25w16,VIDEO,$54,"2,080",2025-04-15,2025-04-17,2
244,CB_2025_Apr_FB_3974_DT_V02_4x5_IMG_EN_New_C-Headline_Sale_CTA-65_Angle-W_M-NONE_VL-None_G-NONE_P-OG_S-NONE,3974 - Glow-up-shake || Batch 1 || Enhancements: OFF || CBV1 || 7C || 14/04/25w16,SHARE,$53,"2,224",2025-04-14,2025-04-17,3
245,CB_2025_Apr_FB_3980_LZ-KB_V13_9x16_VID_EN_Opti_C-BulletPoints_Evergreen_CTA-SALE_Angle-W_M-MIX_VL-30s_G-MF_P-OG_S-WHAT_FB1989V08,3980 - winner video man boobs opti || Batch 4 || Enhancements: OFF || CBV1 || 7C || 11/04/25w16,VIDEO,$52,"2,714",2025-04-11,2025-04-14,3
246,CB_2025_Apr_FB_3980_LZ-KB_V17_9x16_VID_EN_Opti_C-MakingOf_Evergreen_CTA-SALE_Angle-W_M-AGR_VL-45s_G-M_P-OG_S-NEW_FB3005V05,3980 - winner video man boobs opti || Batch 5 || Enhancements: OFF || CBV1 || 7C || 11/04/25w16,VIDEO,$52,"2,290",2025-04-11,2025-04-14,3
247,CB_2025_Apr_FB_4005_CHUB-FRP_V02_9x16_VID_EN_New_C-UGC_CTA-NONE_Angle-W-B_M-NONE_VL-45s_TR-None_G-F_P-OG_S-NONE,4005 - CHUB Customer reviews  || Batch 1 || Enhancements: OFF || CBV1 || 7C || 14/04/25w16,VIDEO,$51,"1,678",2025-04-14,2025-04-17,3
248,CB_2024_Dec_FB_3619_VK-JT_V02_4x5_VID_EN_New_C-BulletPoints_Sale_CTA-NY_Angle-W-B-C_M-NONE_VL-None_G-NONE_P-OG_S-NONE,ðŸŒ¶ï¸ || US || ASC+ || ->CC141 || VIDEO Only || US+CA || 0% EXISTING CAP || 7C || 07/08.24  Ad set,SHARE,$50,"2,776",2024-12-27,2025-04-21,115
249,CB_2025_Apr_FB_4008_SO-VG_V04_9x16_VID_EN_New_C-NONE_Evergreen_CTA-NONE_Angle-SC_M-POW_VL-25s_G-F_P-OG_S-NEW,4008 - CSC_CB VID SugarCrush || Batch 2 || Enhancements: OFF || CBV1 || 7C || 15/04/25w16,VIDEO,$48,"1,398",2025-04-15,2025-04-20,5
250,CB_2025_Mar_FB_3935_VK-DP_V02_9x16_VID_EN_New_C-Trend_Sale_CTA-65_Angle-W_M-POW_VL-30s_G-M_P-APP_S-NEW_FB3921V02.mp4,CB_App || US + CA || Re-launch || Trial_purchase || 7DC || 16/04/2025,VIDEO,$47,"1,824",2025-04-16,2025-04-18,2
251,CB_2025_Apr_FB_3980_LZ-KB_V05_9x16_VID_EN_Opti_C-BulletPoints_Evergreen_CTA-SALE_Angle-W_M-MIX_VL-30s_G-MF_P-OG_S-NEW_FB2812V07,3980 - winner video man boobs opti || Batch 2 || Enhancements: OFF || CBV1 || 7C || 11/04/25w16,VIDEO,$47,"1,976",2025-04-11,2025-04-14,3
252,CB_2025_Mar_FB_3924_SO-DP_V04_1x1_IMG_EN_New_C-NONE_Evergreen_CTA-NONE_Angle-W-B-C_M-NONE_VL-None_G-NONE_P-OG_S-NONE,3924 - #17 man boobs/dad bod body text IMG || Batch 1 || Enhancements: OFF || CBV1 || 7C || 24/03/25w13,SHARE,$46,"2,147",2025-03-24,2025-04-21,28
253,CB_2025_Apr_FB_4001_VG_V01_4x5_IMG_EN_New_C-Headline_Evergreen_CTA-SALE_Angle-B-C_M-NONE_VL-None_G-NONE_P-OG_S-NONE-1,4001 - CSC_SummerBody_Bloating || Batch 1 || Enhancements: OFF || CBV1 || 7C || 14/04/25w16,SHARE,$45,"2,178",2025-04-14,2025-04-17,3
254,CB_2025_Mar_FB_3956_VK_V02_4x5_IMG_EN_OPTI_C-BulletPoints_Evergreen_CTA-65_Angle-W-B-C_M-NONE_VL-None_G-M_P-OG_S-NONE_FB3956V05,3956 - LOW T OPTI 3891 -VK || Batch 1 || Enhancements: OFF || CBV1 || 7C || 07/04/25w15,SHARE,$45,"1,552",2025-04-07,2025-04-14,7
255,CB_2025_Apr_FB_3993_SO-JG_V04_9x16_VID_EN_New_C-NONE_Evergreen_CTA-NONE_Angle-W-B-C_M-NONE_VL-25s_G-F_P-OG_S-NEW,3993 - Tax-Wars VID JG || Batch 1 || Enhancements: OFF || CBV1 || 7C || 14/04/25w16,VIDEO,$45,"1,434",2025-04-14,2025-04-17,3
256,CB_2025_Mar_FB_3935_VK-DP_V01_9x16_VID_EN_New_C-Trend_Sale_CTA-65_Angle-W_M-POW_VL-30s_G-M_P-APP_S-NEW_FB3921V01.mp4,CB_App || US + CA || Re-launch || App_purchase || 7DC || 16/04/2025,VIDEO,$45,"1,509",2025-04-16,2025-04-18,2
257,CB_2025_Apr_FB_3967_SO_V01_9x16_VID_EN_New_C-NONE_Evergreen_CTA-65_Angle-W-B-C_M-NONE_VL-45s_G-F_P-OG_S-NEW,3967 - #127 Look at Me VID || Batch 1 || Enhancements: OFF || CBV1 || 7C || 14/04/25w16,VIDEO,$45,"2,818",2025-04-14,2025-04-17,3
258,CB_2025_Mar_FB_3973_CHUB-KZ_V06_1x1_IMG_EN_New_C-NONE_CTA-NONE_Angle-W_M-NONE_VL-None_TR-None_G-NONE_P-NONE_S-NONE_blog_biohacking_cv_en,CBV1 || LP:HI | 3874 Advertorial Biohacking || Biohack for 40+ Women || Batch 2 || 08/04/25,SHARE,$43,616,2025-04-08,2025-04-14,6
259,CB_2025_Apr_FB_4009_DT-VG_V01_4x5_GIF_EN_New_C-Trend_Sale_CTA-65_Angle-W_M-NONE_VL-7s_G-NONE_P-OG_S-NEW,4009 - SummerBody Man edition || Batch 1 || Enhancements: OFF || CBV1 || 7C || 14/04/25w16,VIDEO,$42,977,2025-04-14,2025-04-17,3
260,CB_2025_Apr_FB_3988_LZ-KB_V05_4x5_IMG_EN_Opti_C-Headline_Sale_CTA-SPRNG_Angle-Cort_M-NONE_VL-None_G-NONE_P-OG_S-NONE_FB1197V03,3988 - IMG winners easter opti || Batch 2 || Enhancements: OFF || CBV1 || 7C || 14/04/25w16,SHARE,$42,"1,268",2025-04-14,2025-04-20,6
261,CB_2025_Mar_FB_3970_CHUB-AS_V06_1x1_IMG_EN_New_C-NONE_CTA-NONE_Angle-W_M-NONE_VL-None_TR-None_G-NONE_P-NONE_S-NONE_blog_stressweight_cv_en,CBV1 || LP:HI | 3970 blog_stressweight || Batch 2 || 08/04/25,SHARE,$42,"2,300",2025-04-16,2025-04-21,5
262,CB_2025_Mar_FB_3970_CHUB-AS_V04_1x1_IMG_EN_New_C-NONE_CTA-NONE_Angle-W_M-NONE_VL-None_TR-None_G-NONE_P-NONE_S-NONE_blog_stressweight_cv_en,CBV1 || LP:HI | 3970 blog_stressweight || Batch 1 || 08/04/25,SHARE,$41,628,2025-04-08,2025-04-14,6
263,CB_2025_Apr_FB_3974_DT_V01_4x5_IMG_EN_New_C-Headline_Sale_CTA-65_Angle-W_M-NONE_VL-None_G-NONE_P-OG_S-NONE,3974 - Glow-up-shake || Batch 1 || Enhancements: OFF || CBV1 || 7C || 14/04/25w16,SHARE,$40,"1,581",2025-04-14,2025-04-17,3
264,CB_2022_Mar3_FB_713_IK_V04_1x1_IMG_EN_Opti_C-WrittenTesti_HE-98_A-ExtremeBodyVisualization_HK-bodypart_Pain-W_CLR-PURPLE_BG-IMAGE_ME-MIX_MA-YOUNG,US || Manual Bid || BFCM || COST CAP 81 || 1C || 15/11/24,SHARE,$40,"1,553",2024-11-15,2025-04-21,157
265,CB_2025_Apr_FB_4008_SO-VG_V09_9x16_VID_EN_New_C-NONE_Evergreen_CTA-NONE_Angle-SC_M-POW_VL-25s_G-F_P-OG_S-NEW,4008 - CSC_CB VID SugarCrush || Batch 3 || Enhancements: OFF || CBV1 || 7C || 15/04/25w16,VIDEO,$40,"1,157",2025-04-15,2025-04-17,2
266,CB_2025_Apr_FB_3977_DT_V02_9x16_VID_EN_New_C-Headline_Sale_CTA-65_Angle-W-B-C_M-JOG_VL-30s_G-F_P-OG_S-NEW,3977 - Sexiest Booty || Batch 1 || Enhancements: OFF || CBV1 || 7C || 14/04/25w16,VIDEO,$39,"2,055",2025-04-14,2025-04-17,3
267,CB_2025_Apr_FB_3984_LZ-KB_V03_4x5_IMG_EN_Opti_C-BeforeAfter_Sale_CTA-SPRNG_Angle-W_M-NONE_VL-None_G-M_P-OG_S-NONE_FB3723V07,3984 - MAN BOOBS easter opti || Batch 1 || Enhancements: OFF || CBV1 || 7C || 14/04/25w16,SHARE,$38,"1,883",2025-04-14,2025-04-21,7
268,CB_2025_Mar_FB_3970_CHUB-AS_V08_1x1_IMG_EN_New_C-NONE_CTA-NONE_Angle-W_M-NONE_VL-None_TR-None_G-NONE_P-NONE_S-NONE_blog_stressweight_cv_en,CBV1 || LP:HI | 3970 blog_stressweight || Batch 2 || 08/04/25,SHARE,$38,"1,734",2025-04-16,2025-04-21,5
269,CB_2025_Mar_FB_3935_VK-DP_V04_9x16_VID_EN_New_C-Trend_Sale_CTA-65_Angle-W_M-POW_VL-30s_G-M_P-APP_S-NEW_FB3921V032.mp4,CB App || US + CA || 7DC || 15/04/2025,VIDEO,$38,"2,227",2025-04-15,2025-04-16,1
270,CB_2025_Mar_FB_3913_CHUB-AS_V01_1x1_IMG_EN_New_C-NONE_CTA-NONE_Angle-W_M-NONE_VL-None_TR-None_G-NONE_P-NONE_S-NONE_blog_moobs_cv_en,CBV2 || LP:HI | blog_moobs_cv_en || Batch 1 || 08/03/25,SHARE,$37,"1,178",2025-04-08,2025-04-16,8
271,CB_2025_Apr_FB_3989_DT-DP_V03_9x16_VID_EN_Opti_C-MakingOf_Sale_CTA-SALE_Angle-W-B_M-ALEX_VL-45s_G-M_P-OG_S-NEW_FB3096V01,3989 - 3096 V01 opti || Batch 1 || Enhancements: OFF || CBV1 || 7C || 11/04/25w16,VIDEO,$37,"1,395",2025-04-14,2025-04-18,4
272,CB_2025_Apr_FB_4000_VG_V03_4x5_IMG_EN_New_C-Headline_Evergreen_CTA-SALE_Angle-GH_M-NONE_VL-None_G-NONE_P-OG_S-NONE,4000 - CSC_Brain Fog new || Batch 1 || Enhancements: OFF || CBV1 || 7C || 14/04/25w16,SHARE,$37,"2,002",2025-04-14,2025-04-17,3
273,CB_2025_Mar_FB_3913_CHUB-AS_V08_1x1_IMG_EN_New_C-NONE_CTA-NONE_Angle-W_M-NONE_VL-None_TR-None_G-NONE_P-NONE_S-NONE_blog_moobs_cv_en,CBV1 || LP:HI | blog_moobs_cv_en || Batch 2 || 30/03/25,SHARE,$37,"1,353",2025-03-30,2025-04-16,17
274,CB_2025_Apr_FB_3967_SO_V12_9x16_VID_EN_New_C-NONE_Evergreen_CTA-65_Angle-W-B-C_M-NONE_VL-55s_G-F_P-OG_S-NEW,3967 - #127 Look at Me VID || Batch 3 || Enhancements: OFF || CBV1 || 7C || 14/04/25w16,VIDEO,$35,"1,110",2025-04-14,2025-04-17,3
275,CB_2025_Mar_FB_3970_CHUB-AS_V10_1x1_IMG_EN_New_C-NONE_CTA-NONE_Angle-W_M-NONE_VL-None_TR-None_G-NONE_P-NONE_S-NONE_blog_stressweight_cv_en,CBV1 || LP:HI | 3970 blog_stressweight || Batch 3 || 08/04/25,SHARE,$35,"1,144",2025-04-08,2025-04-14,6
276,CB_2025_Mar_FB_3949_VK-DP_V01_9x16_VID_EN_New_C-NONE_Evergreen_CTA-NONE_Angle-W-B-C_M-TYL_VL-None_G-M_P-OG_S-NONE,CA || ASC+ || 0% EXISTING || 7DC || 18.03.2025,VIDEO,$35,"1,821",2025-04-03,2025-04-21,18
277,CB_2024_Oct_FB_3252_VK-DP_V04_4x5_VID_EN_Opti_C-MakingOf_Evergreen_CTA-SALE_Angle-W-B-C_M-JOG_VL-45s_G-F_P-OG_S-MOON_FB3090V02,ðŸŒ¶ï¸ || US || ASC+ || ->CC141 || VIDEO Only || US+CA || 0% EXISTING CAP || 7C || 07/08.24  Ad set,VIDEO,$35,"1,196",2024-11-07,2025-04-21,165
278,CB_2025_Mar_FB_3955_SO_V08_4x5_IMG_EN_New_C-NONE_Evergreen_CTA-NONE_Angle-W-B-C_M-NONE_VL-None_G-NONE_P-OG_S-NONE,3955 - THE GHIBLI-VERSE Trend || Batch 2 || Enhancements: OFF || CBV1 || 7C || 02/04/25w14,SHARE,$35,"1,099",2025-04-02,2025-04-14,12
279,CB_2025_Apr_FB_4030_DT_V08_4x5_IMG_EN_New_C-Headline_Sale_CTA-SPRNG_Angle-W-B-C_M-NONE_VL-None_G-NONE_P-OG_S-NONE_FB2227V08,4030 - Easter Sale winner ads Opti || Batch 3 || Enhancements: OFF || CBV1 || 7C || 16/04/25w16,SHARE,$35,"1,340",2025-04-16,2025-04-21,5
280,CB_2025_Apr_FB_3979_DT-DP_V01_9x16_VID_EN_New_C-Headline_Sale_CTA-65_Angle-B-C_M-JOG_VL-30s_G-F_P-OG_S-NEW,3979 - Healthy gut = healthy skin || Batch 1 || Enhancements: OFF || CBV1 || 7C || 11/04/25w16,VIDEO,$34,"1,297",2025-04-14,2025-04-17,3
281,CB_2025_Mar_FB_3935_VK-DP_V03_9x16_VID_EN_New_C-Trend_Sale_CTA-65_Angle-W_M-POW_VL-30s_G-M_P-APP_S-NEW_FB3921V02.mp4,CB_App || US + CA || Re-launch || App_purchase || 7DC || 16/04/2025,VIDEO,$33,920,2025-04-16,2025-04-18,2
282,CB_2025_Apr_FB_3998_DT-DP_V01_4x5_IMG_EN_New_C-Headline_Evergreen_CTA-68_Angle-WellBe_M-NONE_VL-None_G-NONE_P-APP_S-NONE.png,CB_App || US + CA || 3998 - SALE oriented APP img ads || App_purchase || 7DC || 19/04/2025,SHARE,$32,"1,789",2025-04-19,2025-04-20,1
283,CB_2025_Apr_FB_3967_SO_V03_9x16_VID_EN_New_C-NONE_Evergreen_CTA-65_Angle-W-B-C_M-NONE_VL-45s_G-F_P-OG_S-NEW,3967 - #127 Look at Me VID || Batch 1 || Enhancements: OFF || CBV1 || 7C || 14/04/25w16,VIDEO,$32,"1,271",2025-04-14,2025-04-17,3
284,CB_2025_Mar_FB_3973_CHUB-KZ_V03_1x1_IMG_EN_New_C-NONE_CTA-NONE_Angle-W_M-NONE_VL-None_TR-None_G-NONE_P-NONE_S-NONE_blog_biohacking_cv_en,CBV1 || LP:HI | 3874 Advertorial Biohacking || Biohack for 40+ Women || Batch 1 || 08/04/25,SHARE,$31,628,2025-04-08,2025-04-14,6
285,CB_2024_Dec_FB_3592_VK-DP_V10_4x5_VID_EN_New_C-BulletPoints_Sale_CTA-SALE_Angle-W-B-C_M-NONE_VL-30s_G-F_P-OG_S-NEW - Copy,ðŸŒ¶ï¸ || US || ASC+ || ->CC141 || VIDEO Only || US+CA || 0% EXISTING CAP || 7C || 07/08.24  Ad set,VIDEO,$30,"1,157",2024-12-21,2025-04-21,121
286,CB_2022_Mar3_FB_713_IK_V04_1x1_IMG_EN_Opti_C-WrittenTesti_HE-98_A-ExtremeBodyVisualization_HK-bodypart_Pain-W_CLR-PURPLE_BG-IMAGE_ME-MIX_MA-YOUNG,US || Manual Bid || BFCM || COST CAP 71 || 1C || 15/11/24,SHARE,$29,"1,344",2024-11-15,2025-04-21,157
287,CB_2025_Mar_FB_3928_VK-DP_V01_1x1_VID_EN_Opti_C-BulletPoints_Evergreen_CTA-NONE_Angle-W-B-C_M-NONE_VL-None_G-M_P-OG_S-NONE_FB3891V05,3928 - opti 3891 kinda sorta opti with man boobs - DP-VK || Batch 1 || Enhancements: OFF || CBV1 || 7C || 24/03/25w13,SHARE,$29,"1,646",2025-03-24,2025-04-17,24
288,CB_2025_Mar_FB_3933_VK-DP_V03_4x5_VID_EN_NEW_C-NONE_Evergreen_CTA-NONE_Angle-None_M-NONE_VL-None_G-M_P-APP_S-NONE.png,CB_App || US + CA || 3933 - APP ads pt. 3 - DP+VK ) || App_purchase || 7DC || 19/04/2025,SHARE,$28,"1,139",2025-04-19,2025-04-21,2
289,CB_2025_Apr_FB_3962_VK-DP_V02_9x16_VID_EN_Opti_C-Trend_Evergreen_CTA-NONE_Angle-W-B-C_M-JANW_VL-30s_G-M_P-OG_S-NEW_FB3909V03,US || Kilo Product's leads LAL || 7C || 04/03/25,VIDEO,$26,759,2025-04-14,2025-04-21,7
290,CB_2025_Apr_FB_3998_DT-DP_V02_4x5_IMG_EN_New_C-Headline_Evergreen_CTA-68_Angle-WellBe_M-NONE_VL-None_G-NONE_P-APP_S-NONE.png,CB_App || US + CA || 3998 - SALE oriented APP img ads || App_purchase || 7DC || 19/04/2025,SHARE,$25,"1,118",2025-04-19,2025-04-20,1
291,CB_2025_Apr_FB_3988_LZ-KB_V03_4x5_IMG_EN_Opti_C-Headline_Sale_CTA-SPRNG_Angle-Cort_M-NONE_VL-None_G-NONE_P-OG_S-NONE_FB3251V01,3988 - IMG winners easter opti || Batch 2 || Enhancements: OFF || CBV1 || 7C || 14/04/25w16,SHARE,$24,"1,169",2025-04-14,2025-04-20,6
292,CB_2025_Mar_FB_3935_VK-DP_V04_9x16_VID_EN_New_C-Trend_Sale_CTA-65_Angle-W_M-POW_VL-30s_G-M_P-APP_S-NEW_FB3921V032.mp4,CB_App || US + CA || Re-launch || App_purchase || 7DC || 16/04/2025,VIDEO,$24,786,2025-04-16,2025-04-18,2
293,CB_2025_Mar_FB_3973_CHUB-KZ_V09_1x1_IMG_EN_New_C-NONE_CTA-NONE_Angle-W_M-NONE_VL-None_TR-None_G-NONE_P-NONE_S-NONE_blog_biohacking_cv_en,CBV1 || LP:HI | 3874 Advertorial Biohacking || Biohack for 40+ Women || Batch 3 || 08/04/25,SHARE,$23,"1,051",2025-04-08,2025-04-14,6
294,CB_2025_Apr_FB_3980_LZ-KB_V16_9x16_VID_EN_Opti_C-MakingOf_Evergreen_CTA-SALE_Angle-W_M-AGR_VL-45s_G-M_P-OG_S-NEW_FB3005V05,3980 - winner video man boobs opti || Batch 5 || Enhancements: OFF || CBV1 || 7C || 11/04/25w16,VIDEO,$23,833,2025-04-11,2025-04-18,7
295,CB_2025_Apr_FB_3992_LZ-KB_V03_4x5_IMG_EN_Opti_C-Headline_Sale_CTA-SPRNG_Angle-W_M-NONE_VL-None_G-NONE_P-OG_S-NONE_FB3749V01,3988 - IMG winners easter opti || Batch 3 || Enhancements: OFF || CBV1 || 7C || 14/04/25w16,SHARE,$22,"1,084",2025-04-14,2025-04-20,6
296,CB_2025_Mar_FB_3973_CHUB-KZ_V04_1x1_IMG_EN_New_C-NONE_CTA-NONE_Angle-W_M-NONE_VL-None_TR-None_G-NONE_P-NONE_S-NONE_blog_biohacking_cv_en,CBV1 || LP:HI | 3874 Advertorial Biohacking || Biohack for 40+ Women || Batch 1 || 08/04/25,SHARE,$22,831,2025-04-08,2025-04-14,6
297,CB_2025_Apr_FB_3988_LZ-KB_V01_4x5_IMG_EN_Opti_C-Headline_Sale_CTA-SPRNG_Angle-W_M-NONE_VL-None_G-M_P-OG_S-NONE_FB3896V02,3988 - IMG winners easter opti || Batch 2 || Enhancements: OFF || CBV1 || 7C || 14/04/25w16,SHARE,$22,725,2025-04-14,2025-04-20,6
298,CB_2024_Mar_FB_2888_JG_V03_9x16_IMG_EN_Opti_C-Benefits_CTA-NONE_Pain-W_M-NONE_VL-None_TR-None_G-NONE_P-V2_S-NONE,CBV2 || AU || ðŸ’° Advantage+ || US || BROAD || 7C || Existing_customer_5% || 19/12/24 Ad set,SHARE,$21,997,2024-12-19,2025-04-21,123
299,CB_2024_Jan_FB_2797_VK-RP-RS_V02_1x1_IMG_EN_Opti_C-ADVRT_CTA-NONE_Pain-W_M-NONE_VL-None_TR-None_G-NONE_P-V2_S-NONE,CBV2 || UK || Advantage+ || Advertorial |  || 0% EXISTING CAP || BROAD || 7C || ad set 18/03/25,SHARE,$20,809,2025-03-18,2025-04-21,34
300,CB_2025_Mar_FB_3935_VK-DP_V03_9x16_VID_EN_New_C-Trend_Sale_CTA-65_Angle-W_M-POW_VL-30s_G-M_P-APP_S-NEW_FB3921V02.mp4,CB_App || US + CA || Re-launch || Trial_purchase || 7DC || 16/04/2025,VIDEO,$20,602,2025-04-16,2025-04-18,2
301,CB_2025_Apr_FB_3987_SO-JG_V12_4x5_IMG_EN_New_C-NONE_Evergreen_CTA-NONE_Angle-W-B-C_M-NONE_VL-None_G-NONE_P-OG_S-NONE,3987 - Tax-Wars IMG JG || Batch 3 || Enhancements: OFF || CBV1 || 7C || 09/04/25w15,SHARE,$20,854,2025-04-09,2025-04-19,10
302,CB_2025_Apr_FB_3967_SO_V11_9x16_VID_EN_New_C-NONE_Evergreen_CTA-65_Angle-W-B-C_M-NONE_VL-55s_G-F_P-OG_S-NEW,3967 - #127 Look at Me VID || Batch 3 || Enhancements: OFF || CBV1 || 7C || 14/04/25w16,VIDEO,$20,715,2025-04-14,2025-04-17,3
303,CB_2025_Apr_FB_4008_SO-VG_V06_9x16_VID_EN_New_C-NONE_Evergreen_CTA-NONE_Angle-SC_M-POW_VL-25s_G-F_P-OG_S-NEW,4008 - CSC_CB VID SugarCrush || Batch 2 || Enhancements: OFF || CBV1 || 7C || 15/04/25w16,VIDEO,$19,743,2025-04-15,2025-04-20,5
304,CB_2025_Mar_FB_3973_CHUB-KZ_V11_1x1_IMG_EN_New_C-NONE_CTA-NONE_Angle-W_M-NONE_VL-None_TR-None_G-NONE_P-NONE_S-NONE_blog_biohacking_cv_en,CBV1 || LP:HI | 3874 Advertorial Biohacking || Biohack for 40+ Women || Batch 3 || 08/04/25,SHARE,$19,610,2025-04-08,2025-04-14,6
305,CB_2025_Apr_FB_3984_LZ-KB_V01_4x5_IMG_EN_Opti_C-NegativeMark_Sale_CTA-SPRNG_Angle-W_M-NONE_VL-None_G-M_P-OG_S-NONE_FB3622V03,3984 - MAN BOOBS easter opti || Batch 1 || Enhancements: OFF || CBV1 || 7C || 14/04/25w16,SHARE,$19,737,2025-04-14,2025-04-21,7
306,CB_2024_Sep_FB_3175_DA-KB_V02_1x1_IMG_EN_New_C-ADVRT_Evergreen_CTA-NONE_Angle-W_M-NONE_VL-None_G-NONE_P-CBV2_S-NONE_blog_colonbroomvsmammoth_cv_en,CBV2 || A/B test CTA button: Control || CBV2 vs Happy Mammoth || 7C || 26/03/25,SHARE,$19,"1,537",2025-03-26,2025-04-16,21
307,CB_2024_Sep_FB_3175_DA-KB_V01_1x1_IMG_EN_New_C-ADVRT_Evergreen_CTA-NONE_Angle-W_M-NONE_VL-None_G-NONE_P-CBV2_S-NONE_blog_colonbroomvsmammoth_cv_en,CBV2 || A/B test CTA button: Control || CBV2 vs Happy Mammoth || 7C || 26/03/25,SHARE,$19,"1,396",2025-03-26,2025-04-16,21
308,CB_2024_Sep_FB_3175_DA-KB_V03_1x1_IMG_EN_New_C-ADVRT_Evergreen_CTA-NONE_Angle-W_M-NONE_VL-None_G-NONE_P-CBV2_S-NONE_blog_colonbroomvsmammoth_cv_en,CBV2 || A/B test CTA button: Control || CBV2 vs Happy Mammoth || 7C || 26/03/25,SHARE,$19,919,2025-03-26,2025-04-16,21
309,CB_2025_Mar_FB_3955_SO_V16_4x5_IMG_EN_New_C-NONE_Evergreen_CTA-NONE_Angle-W-B-C_M-NONE_VL-None_G-NONE_P-OG_S-NONE,3955 - THE GHIBLI-VERSE Trend || Batch 5 || Enhancements: OFF || CBV1 || 7C || 01/04/25w14,SHARE,$18,978,2025-04-01,2025-04-14,13
310,CB_2025_Apr_FB_3994_DT-DP_V01_9x16_VID_EN_Opti_C-MakingOf_Sale_CTA-Sale_Angle-W-B_M-NATE_VL-45s_G-M_P-OG_S-NEW_FB3033V03,3994 - 3033 V03 opti || Batch 1 || Enhancements: OFF || CBV1 || 7C || 14/04/25w16,VIDEO,$18,820,2025-04-14,2025-04-21,7
311,CB_2025_Mar_FB_3931_VK-DP_V03_1x1_VID_EN_New_C-NONE_Evergreen_CTA-NONE_Angle-None_M-NONE_VL-None_G-M_P-APP_S-NONE.jpg,CB_App || US + CA || 3931 - APP ads pt. 2 - DP -VK || App_purchase || 7DC || 19/04/2025,SHARE,$17,655,2025-04-19,2025-04-21,2
312,CB_2025_Apr_FB_3992_LZ-KB_V01_4x5_IMG_EN_Opti_C-Headline_Sale_CTA-SPRNG_Angle-W_M-NONE_VL-None_G-NONE_P-OG_S-NONE_FB3713V02,3988 - IMG winners easter opti || Batch 3 || Enhancements: OFF || CBV1 || 7C || 14/04/25w16,SHARE,$17,683,2025-04-14,2025-04-20,6
313,CB_2025_Mar_FB_3914_DT-DP_V02_9x16_VID_EN_New_C-Trend_Sale_CTA-SPRNG_Angle-W-B-C_M-JOG_VL-30s_G-F_P-OG_S-NEW,"3914 - #9 GF's POV, male confidence || Batch 1 || Enhancements: OFF || CBV1 || 7C || 24/03/25w13",VIDEO,$15,626,2025-03-24,2025-04-20,27
314,CB_2025_Apr_FB_3967_SO_V08_9x16_VID_EN_New_C-NONE_Evergreen_CTA-65_Angle-W-B-C_M-NONE_VL-40s_G-F_P-OG_S-NEW,3967 - #127 Look at Me VID || Batch 2 || Enhancements: OFF || CBV1 || 7C || 14/04/25w16,VIDEO,$15,691,2025-04-14,2025-04-20,6
315,CB_2025_Apr_FB_3985_DT-DP_V03_9x16_VID_EN_Opti_C-Trend_Sale_CTA-SPRNG_Angle-W-B-C_M-JOG_VL-30s_G-F_P-OG_S-NEW,3985 - Opti 3914 || Batch 1 || Enhancements: OFF || CBV1 || 7C || 11/04/25w16,VIDEO,$14,623,2025-04-14,2025-04-18,4
316,CB_2023_Jul_FB_2226_MB_V04_9x16_VID_EN_Opti_C-Testim_CTA-SMR_Pain-W_M-MIX_VL-30s_TR-None_G-F_P-None_S-Starry,US || Manual Bid || BFCM || COST CAP 71 || 1C || 15/11/24,VIDEO,$14,450,2024-11-15,2025-04-21,157
317,CB_2025_Apr_FB_3987_SO-JG_V08_4x5_IMG_EN_New_C-NONE_Evergreen_CTA-NONE_Angle-W-B-C_M-NONE_VL-None_G-NONE_P-OG_S-NONE,3987 - Tax-Wars IMG JG || Batch 2 || Enhancements: OFF || CBV1 || 7C || 09/04/25w15,SHARE,$13,554,2025-04-09,2025-04-18,9
318,CB_2025_Apr_FB_4005_CHUB-FRP_V03_9x16_VID_EN_New_C-UGC_CTA-NONE_Angle-W-B_M-NONE_VL-45s_TR-None_G-F_P-OG_S-NONE,4005 - CHUB Customer reviews  || Batch 1 || Enhancements: OFF || CBV1 || 7C || 14/04/25w16,VIDEO,$13,454,2025-04-14,2025-04-17,3
319,CB_2025_Apr_FB_4002_LZ-DP_V02_9x16_VID_EN_Opti_C-BulletPoints_Sale_CTA-SPRNG_Angle-W-B_M-MIX_VL-30s_G-MF_P-OG_S-WHAT_FB3097V03,4002 - video winners easter opti || Batch 1 || Enhancements: OFF || CBV1 || 7C || 14/04/25w16,VIDEO,$13,663,2025-04-14,2025-04-16,2
320,CB_2025_Apr_FB_3967_SO_V15_9x16_VID_EN_New_C-NONE_Evergreen_CTA-65_Angle-W-B-C_M-NONE_VL-55s_G-F_P-OG_S-NEW,3967 - #127 Look at Me VID || Batch 3 || Enhancements: OFF || CBV1 || 7C || 14/04/25w16,VIDEO,$12,498,2025-04-14,2025-04-17,3
321,CB_2025_Apr_FB_3992_LZ-KB_V05_4x5_IMG_EN_Opti_C-Headline_Sale_CTA-SPRNG_Angle-W_M-NONE_VL-None_G-NONE_P-OG_S-NONE_FB3705V02,3988 - IMG winners easter opti || Batch 3 || Enhancements: OFF || CBV1 || 7C || 14/04/25w16,SHARE,$12,542,2025-04-14,2025-04-20,6
322,CB_2024_Jan_FB_2762_IK_V04_1x1_IMG_EN_New_C-WrittenTesti_CTA-CTA_Pain-W-B-C_M-NONE_VL-None_TR-None_G-NONE_P-V2_S-NONE,CBV2 || AU || ðŸ’° Advantage+ || US || BROAD || 7C || Existing_customer_5% || 19/12/24 Ad set,SHARE,$12,456,2024-12-19,2025-04-21,123
323,CB_2025_Mar_FB_3913_CHUB-AS_V02_1x1_IMG_EN_New_C-NONE_CTA-NONE_Angle-W_M-NONE_VL-None_TR-None_G-NONE_P-NONE_S-NONE_blog_moobs_cv_en,CBV2 || LP:HI | blog_moobs_cv_en || Batch 1 || 08/03/25,SHARE,$11,581,2025-04-08,2025-04-16,8
324,CB_2025_Apr_FB_3986_DT-DP_V02_9x16_VID_EN_Opti_C-Trend_Sale_CTA-SPRNG_Angle-W-B-C_M-TRC_VL-30s_G-F_P-OG_S-NEW,3986 - GFs POV / male confidence / new actors || Batch 1 || Enhancements: OFF || CBV1 || 7C || 11/04/25w16,VIDEO,$11,480,2025-04-14,2025-04-20,6
325,CB_2025_Apr_FB_3980_LZ-KB_V02_9x16_VID_EN_Opti_C-BulletPoints_Evergreen_CTA-SALE_Angle-W_M-PASQ_VL-30s_G-M_P-OG_S-WHAT_FB2516V13,3980 - winner video man boobs opti || Batch 1 || Enhancements: OFF || CBV1 || 7C || 11/04/25w16,VIDEO,$11,369,2025-04-11,2025-04-18,7
326,CB_2025_Mar_FB_3913_CHUB-AS_V03_1x1_IMG_EN_New_C-NONE_CTA-NONE_Angle-W_M-NONE_VL-None_TR-None_G-NONE_P-NONE_S-NONE_blog_moobs_cv_en,CBV2 || LP:HI | blog_moobs_cv_en || Batch 1 || 08/03/25,SHARE,$11,400,2025-04-08,2025-04-16,8
327,CB_2025_Apr_FB_4004_CHUB-KZ_V03_9x16_VID_EN_New_C-NONE_CTA-NONE_Angle-W-B-C_M-F_VL-None_TR-None_G-NONE_P-NONE_S-NONE,4004 - CHUB LosingPCOSWeight || Batch 1 || Enhancements: OFF || CBV1 || 7C || 14/04/25w16,VIDEO,$11,438,2025-04-14,2025-04-19,5
328,CB_2025_Apr_FB_4002_LZ-RP_V05_9x16_VID_EN_Opti_C-Sale_Sale_CTA-SPRNG_Angle-W_M-MIX_VL-30s_G-MF_P-OG_S-WHAT_FB3883V05,4002 - video winners easter opti || Batch 2 || Enhancements: OFF || CBV1 || 7C || 14/04/25w16,VIDEO,$10,427,2025-04-14,2025-04-19,5
329,CB_2025_Apr_FB_4002_LZ-DP_V06_9x16_VID_EN_Opti_C-Testimonial_Sale_CTA-SPRNG_Angle-W_M-MIX_VL-30s_G-MF_P-OG_S-STARRY_FB3914V01,4002 - video winners easter opti || Batch 1 || Enhancements: OFF || CBV1 || 7C || 14/04/25w16,VIDEO,$10,385,2025-04-14,2025-04-15,1
330,CB_2025_Mar_FB_3939_DT_V06_4x5_IMG_EN_New_C-Advertorial_Sale_CTA-65_Angle-W-B-C_M-MIX_VL-None_G-M_P-OG_S-NONE,3939 - CB Advertorial ads New Ideas || Batch 2 || Enhancements: OFF || CBV1 || 7C || 30/03/25w14,SHARE,$10,343,2025-03-30,2025-04-14,15
331,CB_2025_Apr_FB_4030_DT_V05_4x5_IMG_EN_New_C-Headline_Sale_CTA-SPRNG_Angle-W-B-C_M-NONE_VL-None_G-NONE_P-OG_S-NONE_fb3890V04,4030 - Easter Sale winner ads Opti || Batch 2 || Enhancements: OFF || CBV1 || 7C || 16/04/25w16,SHARE,$10,427,2025-04-16,2025-04-18,2
332,CB_2025_Apr_FB_3987_SO-JG_V06_4x5_IMG_EN_New_C-NONE_Evergreen_CTA-NONE_Angle-W-B-C_M-NONE_VL-None_G-NONE_P-OG_S-NONE,3987 - Tax-Wars IMG JG || Batch 2 || Enhancements: OFF || CBV1 || 7C || 09/04/25w15,SHARE,$9,334,2025-04-09,2025-04-18,9
333,CB_2024_Jan_FB_2783_VK-RP_V02_1x1_IMG_EN_Opti_C-ADVRT_CTA-NONE_Pain-W_M-NONE_VL-None_TR-None_G-NONE_P-V2_S-NONE,CBV2 || UK || Advantage+ || Advertorial |  || 0% EXISTING CAP || BROAD || 7C || ad set 18/03/25,SHARE,$9,605,2025-03-18,2025-04-21,34
334,CB_2023_Jul_FB_2217_IB_V04_9x16_VID_EN_Opti_C-Pointing_CTA-SMR_Pain-W-B_M-TRC_VL-30s_TR-None_G-F_P-None_S-FRIGGA,US || Manual Bid || BID CAP 105 || 1C || 21/12/24,VIDEO,$9,295,2024-12-22,2025-04-21,120
335,CB_2025_Apr_FB_3998_DT-DP_V03_4x5_IMG_EN_New_C-Headline_Evergreen_CTA-68_Angle-WellBe_M-NONE_VL-None_G-NONE_P-APP_S-NONE.png,CB_App || US + CA || 3998 - SALE oriented APP img ads || App_purchase || 7DC || 19/04/2025,SHARE,$8,306,2025-04-19,2025-04-20,1
336,CB_2025_Apr_FB_3998_DT-DP_V04_4x5_IMG_EN_New_C-Headline_Evergreen_CTA-68_Angle-WellBe_M-NONE_VL-None_G-NONE_P-APP_S-NONE.png,CB_App || US + CA || 3998 - SALE oriented APP img ads || App_purchase || 7DC || 19/04/2025,SHARE,$8,254,2025-04-19,2025-04-20,1
337,CB_2025_Apr_FB_3977_DT_V04_9x16_VID_EN_New_C-Headline_Sale_CTA-65_Angle-W-B-C_M-JOG_VL-30s_G-F_P-OG_S-NEW,3977 - Sexiest Booty || Batch 1 || Enhancements: OFF || CBV1 || 7C || 14/04/25w16,VIDEO,$8,373,2025-04-14,2025-04-17,3
338,CB_2025_Apr_FB_4030_DT_V02_4x5_IMG_EN_New_C-Headline_Sale_CTA-SPRNG_Angle-W-B-C_M-NONE_VL-None_G-NONE_P-OG_S-NONE_FB3907V03,4030 - Easter Sale winner ads Opti || Batch 1 || Enhancements: OFF || CBV1 || 7C || 16/04/25w16,SHARE,$8,361,2025-04-16,2025-04-19,3
339,CB_2025_Mar_FB_3932_SO-DP_V01_4x5_VID_EN_Opti_C-BulletPoints_Evergreen_CTA-70_Angle-W-B-C_M-NONE_VL-None_G-F_P-APP_S-NEW_FB3779V02,CB_App || US + CA || 3932 - App ads pt. 4 IMG || App_purchase || 7DC || 19/04/2025,SHARE,$8,282,2025-04-19,2025-04-21,2
340,CB_2025_Apr_FB_4030_DT_V03_4x5_IMG_EN_New_C-Headline_Sale_CTA-SPRNG_Angle-W-B-C_M-NONE_VL-None_G-NONE_P-OG_S-NONE_FB3907V03,4030 - Easter Sale winner ads Opti || Batch 1 || Enhancements: OFF || CBV1 || 7C || 16/04/25w16,SHARE,$8,342,2025-04-16,2025-04-19,3
341,CB_2025_Mar_FB_3913_CHUB-AS_V11_1x1_IMG_EN_New_C-NONE_CTA-NONE_Angle-W_M-NONE_VL-None_TR-None_G-NONE_P-NONE_S-NONE_blog_moobs_cv_en,CBV2 || LP:HI | blog_moobs_cv_en || Batch 3 || 08/03/25,SHARE,$7,321,2025-04-08,2025-04-21,13
342,CB_2025_Mar_FB_3913_CHUB-AS_V10_1x1_IMG_EN_New_C-NONE_CTA-NONE_Angle-W_M-NONE_VL-None_TR-None_G-NONE_P-NONE_S-NONE_blog_moobs_cv_en,CBV2 || LP:HI | blog_moobs_cv_en || Batch 3 || 08/03/25,SHARE,$7,394,2025-04-08,2025-04-21,13
343,CB_2025_Mar_FB_3970_CHUB-AS_V12_1x1_IMG_EN_New_C-NONE_CTA-NONE_Angle-W_M-NONE_VL-None_TR-None_G-NONE_P-NONE_S-NONE_blog_stressweight_cv_en,CBV1 || LP:HI | 3970 blog_stressweight || Batch 3 || 08/04/25,SHARE,$7,158,2025-04-08,2025-04-14,6
344,CB_2025_Mar_FB_3935_VK-DP_V01_9x16_VID_EN_New_C-Trend_Sale_CTA-65_Angle-W_M-POW_VL-30s_G-M_P-APP_S-NEW_FB3921V01.mp4,CB App || US + CA || 7DC || 15/04/2025,VIDEO,$7,446,2025-04-15,2025-04-16,1
345,CB_2025_Apr_FB_3994_DT-DP_V03_9x16_VID_EN_Opti_C-MakingOf_Sale_CTA-Sale_Angle-W-B_M-NATE_VL-45s_G-M_P-OG_S-NEW_FB3033V03,3994 - 3033 V03 opti || Batch 1 || Enhancements: OFF || CBV1 || 7C || 14/04/25w16,VIDEO,$6,342,2025-04-14,2025-04-17,3
346,CB_2025_Mar_FB_3932_SO-DP_V02_4x5_VID_EN_Opti_C-BulletPoints_Evergreen_CTA-70_Angle-W-B-C_M-NONE_VL-None_G-F_P-APP_S-NEW_FB3779V02.png,CB_App || US + CA || 3932 - App ads pt. 4 IMG || App_purchase || 7DC || 19/04/2025,SHARE,$6,619,2025-04-19,2025-04-21,2
347,CB_2025_Mar_FB_3931_VK-DP_V01_1x1_VID_EN_New_C-NONE_Evergreen_CTA-NONE_Angle-None_M-NONE_VL-None_G-M_P-APP_S-NONE.jpg,CB_App || US + CA || 3931 - APP ads pt. 2 - DP -VK || App_purchase || 7DC || 19/04/2025,SHARE,$5,130,2025-04-19,2025-04-21,2
348,CB_2025_Mar_FB_3970_CHUB-AS_V07_1x1_IMG_EN_New_C-NONE_CTA-NONE_Angle-W_M-NONE_VL-None_TR-None_G-NONE_P-NONE_S-NONE_blog_stressweight_cv_en,CBV1 || LP:HI | 3970 blog_stressweight || Batch 2 || 08/04/25,SHARE,$5,476,2025-04-16,2025-04-21,5
349,CB_2023_May_FB_2016_MB_V04_9x16_VID_EN_Opti_C-Sale_CTA-SMR_Pain-W_M-JOG_VL-30s_TR-None_G-M_P-None_S-What,US || ASC+ || Website + Shop || 7DC || Existing 0% || 24.03.2025 Ad set,VIDEO,$5,310,2025-04-04,2025-04-21,17
350,CB_2025_Mar_FB_3955_SO-KB_V05_4x5_IMG_EN_New_C-NONE_Evergreen_CTA-NONE_Angle-W-B-C_M-NONE_VL-None_G-NONE_P-OG_S-NONE,3955 - THE GHIBLI-VERSE Trend || Batch 2 || Enhancements: OFF || CBV1 || 7C || 02/04/25w14,SHARE,$5,179,2025-04-02,2025-04-14,12
351,CB_2025_Mar_FB_3956_VK_V03_4x5_IMG_EN_OPTI_C-BulletPoints_Evergreen_CTA-65_Angle-W-B-C_M-NONE_VL-None_G-M_P-OG_S-NONE_FB3956V05,3956 - LOW T OPTI 3891 -VK || Batch 1 || Enhancements: OFF || CBV1 || 7C || 07/04/25w15,SHARE,$5,158,2025-04-07,2025-04-14,7
352,CB_2025_Apr_FB_4030_DT_V09_4x5_IMG_EN_New_C-Headline_Sale_CTA-SPRNG_Angle-W-B-C_M-NONE_VL-None_G-NONE_P-OG_S-NONE_FB2227V08,4030 - Easter Sale winner ads Opti || Batch 3 || Enhancements: OFF || CBV1 || 7C || 16/04/25w16,SHARE,$5,186,2025-04-16,2025-04-20,4
353,CB_2025_Mar_FB_3970_CHUB-AS_V09_1x1_IMG_EN_New_C-NONE_CTA-NONE_Angle-W_M-NONE_VL-None_TR-None_G-NONE_P-NONE_S-NONE_blog_stressweight_cv_en,CBV1 || LP:HI | 3970 blog_stressweight || Batch 3 || 08/04/25,SHARE,$4,108,2025-04-08,2025-04-14,6
354,CB_2025_Mar_FB_3950_SO_V12_4x5_IMG_EN_New_C-NONE_Evergreen_CTA-NONE_Angle-W-B-C_M-NONE_VL-None_G-NONE_P-OG_S-NONE,3950 - Image Gen by ChatGPT || Batch 3 || Enhancements: OFF || CBV1 || 7C || 30/03/25w14,SHARE,$4,271,2025-03-30,2025-04-21,22
355,CB_2025_Mar_FB_3970_CHUB-AS_V03_1x1_IMG_EN_New_C-NONE_CTA-NONE_Angle-W_M-NONE_VL-None_TR-None_G-NONE_P-NONE_S-NONE_blog_stressweight_cv_en,CBV1 || LP:HI | 3970 blog_stressweight || Batch 1 || 08/04/25,SHARE,$4,84,2025-04-08,2025-04-14,6
356,CB_2025_Apr_FB_3977_DT_V01_9x16_VID_EN_New_C-Headline_Sale_CTA-65_Angle-W-B-C_M-JOG_VL-30s_G-F_P-OG_S-NEW,3977 - Sexiest Booty || Batch 1 || Enhancements: OFF || CBV1 || 7C || 14/04/25w16,VIDEO,$3,155,2025-04-14,2025-04-17,3
357,CB_2025_Apr_FB_3984_LZ-KB_V04_4x5_IMG_EN_Opti_C-BeforeAfter_Sale_CTA-SPRNG_Angle-W_M-NONE_VL-None_G-M_P-OG_S-NONE_FB3723V18,3984 - MAN BOOBS easter opti || Batch 1 || Enhancements: OFF || CBV1 || 7C || 14/04/25w16,SHARE,$3,204,2025-04-14,2025-04-21,7
358,CB_2025_Mar_FB_3973_CHUB-KZ_V10_1x1_IMG_EN_New_C-NONE_CTA-NONE_Angle-W_M-NONE_VL-None_TR-None_G-NONE_P-NONE_S-NONE_blog_biohacking_cv_en,CBV1 || LP:HI | 3874 Advertorial Biohacking || Biohack for 40+ Women || Batch 3 || 08/04/25,SHARE,$3,183,2025-04-08,2025-04-14,6
359,CB_2025_Apr_FB_4030_DT_V04_4x5_IMG_EN_New_C-Headline_Sale_CTA-SPRNG_Angle-W-B-C_M-NONE_VL-None_G-NONE_P-OG_S-NONE_fb3890V04,4030 - Easter Sale winner ads Opti || Batch 2 || Enhancements: OFF || CBV1 || 7C || 16/04/25w16,SHARE,$3,129,2025-04-16,2025-04-18,2
360,CB_2025_Apr_FB_3987_SO-JG_V11_4x5_IMG_EN_New_C-NONE_Evergreen_CTA-NONE_Angle-W-B-C_M-NONE_VL-None_G-NONE_P-OG_S-NONE,3987 - Tax-Wars IMG JG || Batch 3 || Enhancements: OFF || CBV1 || 7C || 09/04/25w15,SHARE,$3,97,2025-04-09,2025-04-19,10
361,CB_2025_Mar_FB_3970_CHUB-AS_V02_1x1_IMG_EN_New_C-NONE_CTA-NONE_Angle-W_M-NONE_VL-None_TR-None_G-NONE_P-NONE_S-NONE_blog_stressweight_cv_en,CBV1 || LP:HI | 3970 blog_stressweight || Batch 1 || 08/04/25,SHARE,$3,100,2025-04-08,2025-04-14,6
362,CB_2025_Apr_FB_3990_DT-DP_V03_9x16_VID_EN_Opti_C-Dance_Sale_CTA-65_Angle-W-B_M-POW_VL-30s_G-M_P-OG_S-WHAT_FB3044V03,3990 - 3043 v03 opti || Batch 1 || Enhancements: OFF || CBV1 || 7C || 11/04/25w16,VIDEO,$3,158,2025-04-14,2025-04-17,3
363,CB_2023_Jul_FB_2217_IB_V04_9x16_VID_EN_Opti_C-Pointing_CTA-SMR_Pain-W-B_M-TRC_VL-30s_TR-None_G-F_P-None_S-FRIGGA,US || Manual Bid || BID CAP 111 || 1C || 21/12/24,VIDEO,$3,101,2024-12-22,2025-04-18,117
364,CB_2025_Mar_FB_3973_CHUB-KZ_V05_1x1_IMG_EN_New_C-NONE_CTA-NONE_Angle-W_M-NONE_VL-None_TR-None_G-NONE_P-NONE_S-NONE_blog_biohacking_cv_en,CBV1 || LP:HI | 3874 Advertorial Biohacking || Biohack for 40+ Women || Batch 2 || 08/04/25,SHARE,$3,31,2025-04-08,2025-04-14,6
365,CB_2024_Dec_FB_3622_LZ-KB_V03_4x5_IMG_EN_Opti_C-NONE_Sale_CTA-XMAS_Angle-GH_M-NONE_VL-None_G-NONE_P-OG_S-NONE_FB2227V08 - Copy,US || Manual Bid || BID CAP 111 || 1C || 21/12/24,SHARE,$3,94,2024-12-22,2025-04-21,120
366,CB_2025_Apr_FB_3980_LZ-KB_V01_9x16_VID_EN_Opti_C-BulletPoints_Evergreen_CTA-SALE_Angle-W_M-PASQ_VL-30s_G-M_P-OG_S-WHAT_FB2516V13,3980 - winner video man boobs opti || Batch 1 || Enhancements: OFF || CBV1 || 7C || 11/04/25w16,VIDEO,$2,68,2025-04-11,2025-04-20,9
367,CB_2025_Apr_FB_3987_SO-JG_V10_4x5_IMG_EN_New_C-NONE_Evergreen_CTA-NONE_Angle-W-B-C_M-NONE_VL-None_G-NONE_P-OG_S-NONE,3987 - Tax-Wars IMG JG || Batch 3 || Enhancements: OFF || CBV1 || 7C || 09/04/25w15,SHARE,$2,137,2025-04-09,2025-04-19,10
368,CB_2025_Apr_FB_3990_DT-DP_V02_9x16_VID_EN_Opti_C-Dance_Sale_CTA-65_Angle-W-B_M-POW_VL-30s_G-M_P-OG_S-WHAT_FB3044V03,3990 - 3043 v03 opti || Batch 1 || Enhancements: OFF || CBV1 || 7C || 11/04/25w16,VIDEO,$2,106,2025-04-14,2025-04-17,3
369,CB_2024_Mar_FB_2883_DA_V08_9x16_VID_ES_Opti_C-SingleTesti_CTA-SALE_Pain-W-B_M-TRC_VL-45s_TR-None_G-F_P-OG_S-MOON_FB2764V04.mp4,US || Quiz: Shopify || 7C || 04/04/25,VIDEO,$2,51,2025-04-04,2025-04-21,17
370,CB_2025_Mar_FB_3973_CHUB-KZ_V08_1x1_IMG_EN_New_C-NONE_CTA-NONE_Angle-W_M-NONE_VL-None_TR-None_G-NONE_P-NONE_S-NONE_blog_biohacking_cv_en,CBV1 || LP:HI | 3874 Advertorial Biohacking || Biohack for 40+ Women || Batch 2 || 08/04/25,SHARE,$2,48,2025-04-08,2025-04-14,6
371,CB_2025_Mar_FB_3970_CHUB-AS_V11_1x1_IMG_EN_New_C-NONE_CTA-NONE_Angle-W_M-NONE_VL-None_TR-None_G-NONE_P-NONE_S-NONE_blog_stressweight_cv_en,CBV1 || LP:HI | 3970 blog_stressweight || Batch 3 || 08/04/25,SHARE,$1,50,2025-04-08,2025-04-14,6
372,CB_2025_Mar_FB_3973_CHUB-KZ_V02_1x1_IMG_EN_New_C-NONE_CTA-NONE_Angle-W_M-NONE_VL-None_TR-None_G-NONE_P-NONE_S-NONE_blog_biohacking_cv_en,CBV1 || LP:HI | 3874 Advertorial Biohacking || Biohack for 40+ Women || Batch 1 || 08/04/25,SHARE,$1,29,2025-04-08,2025-04-14,6
373,CB_2025_Mar_FB_3928_VK-DP_V03_1x1_VID_EN_Opti_C-BulletPoints_Evergreen_CTA-NONE_Angle-W-B-C_M-NONE_VL-None_G-M_P-OG_S-NONE_FB3891V05,3928 - opti 3891 kinda sorta opti with man boobs - DP-VK || Batch 1 || Enhancements: OFF || CBV1 || 7C || 24/03/25w13,SHARE,$1,49,2025-03-24,2025-04-17,24
374,CB_2025_Apr_FB_3961_SO-JG_V09_4x5_IMG_EN_New_C-NONE_Evergreen_CTA-NONE_Angle-W-B-C_M-NONE_VL-None_G-NONE_P-OG_S-NONE,3961 - Action Figur || Batch 3 || Enhancements: OFF || CBV1 || 7C || 14/04/25w16,SHARE,$1,74,2025-04-14,2025-04-20,6
375,CB_2025_Mar_FB_3950_SO_V10_4x5_IMG_EN_New_C-NONE_Evergreen_CTA-NONE_Angle-W-B-C_M-NONE_VL-None_G-NONE_P-OG_S-NONE,3950 - Image Gen by ChatGPT || Batch 3 || Enhancements: OFF || CBV1 || 7C || 30/03/25w14,SHARE,$1,67,2025-03-30,2025-04-20,21
376,CB_2025_Mar_FB_3973_CHUB-KZ_V07_1x1_IMG_EN_New_C-NONE_CTA-NONE_Angle-W_M-NONE_VL-None_TR-None_G-NONE_P-NONE_S-NONE_blog_biohacking_cv_en,CBV1 || LP:HI | 3874 Advertorial Biohacking || Biohack for 40+ Women || Batch 2 || 08/04/25,SHARE,$1,15,2025-04-08,2025-04-14,6
377,CB_2025_Mar_FB_3955_SO-KB_V07_4x5_IMG_EN_New_C-NONE_Evergreen_CTA-NONE_Angle-W-B-C_M-NONE_VL-None_G-NONE_P-OG_S-NONE,3955 - THE GHIBLI-VERSE Trend || Batch 2 || Enhancements: OFF || CBV1 || 7C || 02/04/25w14,SHARE,$1,47,2025-04-02,2025-04-14,12
378,CB_2024_Oct_FB_3251_LZ-VU_V01_1x1_IMG_EN_New_C-NegativeMark_Evergreen_CTA-NONE_Angle-Cort_M-NONE_VL-None_G-NONE_P-NONE_S-NONE.png,US || Manual Bid || BFCM || COST CAP 71 || 1C || 15/11/24,SHARE,$1,116,2024-11-15,2025-04-21,157
379,CB_2025_Mar_FB_3950_SO_V09_4x5_IMG_EN_New_C-NONE_Evergreen_CTA-NONE_Angle-W-B-C_M-NONE_VL-None_G-NONE_P-OG_S-NONE,3950 - Image Gen by ChatGPT || Batch 3 || Enhancements: OFF || CBV1 || 7C || 30/03/25w14,SHARE,$1,59,2025-03-30,2025-04-21,22
380,CB_2025_Apr_FB_3980_LZ-KB_V09_9x16_VID_EN_Opti_C-Pointing_Evergreen_CTA-SALE_Angle-W_M-POW_VL-30s_G-M_P-OG_S-MOON_FB2036V03,3980 - winner video man boobs opti || Batch 3 || Enhancements: OFF || CBV1 || 7C || 11/04/25w16,VIDEO,$1,28,2025-04-11,2025-04-21,10
381,CB_2025_Apr_FB_3980_LZ-KB_V04_9x16_VID_EN_Opti_C-BulletPoints_Evergreen_CTA-SALE_Angle-W_M-MIX_VL-30s_G-MF_P-OG_S-NEW_FB2812V07,3980 - winner video man boobs opti || Batch 2 || Enhancements: OFF || CBV1 || 7C || 11/04/25w16,VIDEO,$1,18,2025-04-11,2025-04-14,3
382,CB_2025_Apr_FB_3980_LZ-KB_V10_9x16_VID_EN_Opti_C-Pointing_Evergreen_CTA-SALE_Angle-W_M-POW_VL-30s_G-M_P-OG_S-MOON_FB2036V03,3980 - winner video man boobs opti || Batch 3 || Enhancements: OFF || CBV1 || 7C || 11/04/25w16,VIDEO,$1,30,2025-04-11,2025-04-21,10
383,CB_2025_Mar_FB_3973_CHUB-KZ_V01_1x1_IMG_EN_New_C-NONE_CTA-NONE_Angle-W_M-NONE_VL-None_TR-None_G-NONE_P-NONE_S-NONE_blog_biohacking_cv_en,CBV1 || LP:HI | 3874 Advertorial Biohacking || Biohack for 40+ Women || Batch 1 || 08/04/25,SHARE,$0,16,2025-04-08,2025-04-14,6
384,CB_2025_Mar_FB_3973_CHUB-KZ_V12_1x1_IMG_EN_New_C-NONE_CTA-NONE_Angle-W_M-NONE_VL-None_TR-None_G-NONE_P-NONE_S-NONE_blog_biohacking_cv_en,CBV1 || LP:HI | 3874 Advertorial Biohacking || Biohack for 40+ Women || Batch 3 || 08/04/25,SHARE,$0,29,2025-04-08,2025-04-14,6
385,CB_2025_Mar_FB_3956_VK_V04_4x5_IMG_EN_OPTI_C-BulletPoints_Evergreen_CTA-65_Angle-W-B-C_M-NONE_VL-None_G-M_P-OG_S-NONE_FB3956V05,3956 - LOW T OPTI 3891 -VK || Batch 1 || Enhancements: OFF || CBV1 || 7C || 07/04/25w15,SHARE,$0,18,2025-04-07,2025-04-14,7
386,CB_2025_Mar_FB_3933_VK-DP_V01_4x5_VID_EN_NEW_C-NONE_Evergreen_CTA-NONE_Angle-None_M-NONE_VL-None_G-M_P-APP_S-NONE,CB_App || US + CA || 3933 - APP ads pt. 3 - DP+VK ) || App_purchase || 7DC || 19/04/2025,SHARE,$0,22,2025-04-19,2025-04-20,1
387,CB_2025_Mar_FB_3970_CHUB-AS_V01_1x1_IMG_EN_New_C-NONE_CTA-NONE_Angle-W_M-NONE_VL-None_TR-None_G-NONE_P-NONE_S-NONE_blog_stressweight_cv_en,CBV1 || LP:HI | 3970 blog_stressweight || Batch 1 || 08/04/25,SHARE,$0,16,2025-04-08,2025-04-14,6
388,CB_2025_Mar_FB_3955_SO-KB_V06_4x5_IMG_EN_New_C-NONE_Evergreen_CTA-NONE_Angle-W-B-C_M-NONE_VL-None_G-NONE_P-OG_S-NONE,3955 - THE GHIBLI-VERSE Trend || Batch 2 || Enhancements: OFF || CBV1 || 7C || 02/04/25w14,SHARE,$0,8,2025-04-02,2025-04-14,12
389,CB_2025_Apr_FB_3980_LZ-KB_V12_9x16_VID_EN_Opti_C-BulletPoints_Evergreen_CTA-SALE_Angle-W_M-MIX_VL-30s_G-MF_P-OG_S-WHAT_FB1989V08,3980 - winner video man boobs opti || Batch 4 || Enhancements: OFF || CBV1 || 7C || 11/04/25w16,VIDEO,$0,7,2025-04-11,2025-04-14,3
390,CB_2025_Apr_FB_3997_DT-DP_V02_9x16_VID_EN_Opti_C-MakingOf_Sale_CTA-SALE_Angle-W-B_M-POW_VL-45s_G-M_P-OG_S-NEW_FB3033V01,3997 - 3033 V01 opti || Batch 1 || Enhancements: OFF || CBV1 || 7C || 11/04/25w16,VIDEO,$0,10,2025-04-11,2025-04-16,5
391,CB_2025_Apr_FB_3962_VK-DP_V03_9x16_VID_EN_Opti_C-Trend_Evergreen_CTA-NONE_Angle-W-B-C_M-JANW_VL-30s_G-M_P-OG_S-NEW_FB3909V03,3962 - 3909 hook opti - DP -VK || Batch 1 || Enhancements: OFF || CBV1 || 7C || 07/04/25w15,VIDEO,$0,9,2025-04-07,2025-04-17,10
392,CB_2025_Mar_FB_3956_VK_V01_4x5_IMG_EN_OPTI_C-BulletPoints_Evergreen_CTA-65_Angle-W-B-C_M-NONE_VL-None_G-M_P-OG_S-NONE_FB3956V05,3956 - LOW T OPTI 3891 -VK || Batch 1 || Enhancements: OFF || CBV1 || 7C || 07/04/25w15,SHARE,$0,7,2025-04-07,2025-04-14,7
393,CB_2025_Mar_FB_3924_SO-DP_V01_1x1_IMG_EN_New_C-NONE_Evergreen_CTA-NONE_Angle-W-B-C_M-NONE_VL-None_G-NONE_P-OG_S-NONE,3924 - #17 man boobs/dad bod body text IMG || Batch 1 || Enhancements: OFF || CBV1 || 7C || 24/03/25w13,SHARE,$0,6,2025-03-24,2025-04-20,27
394,CB_2024_Mar_FB_2883_DA_V08_9x16_VID_ES_Opti_C-SingleTesti_CTA-SALE_Pain-W-B_M-TRC_VL-45s_TR-None_G-F_P-OG_S-MOON_FB2764V04.mp4,US || Quiz: React || 7C || 04/04/25,VIDEO,$0,17,2025-04-04,2025-04-21,17
395,CB_2025_Mar_FB_3928_VK-DP_V04_1x1_VID_EN_Opti_C-BulletPoints_Evergreen_CTA-NONE_Angle-W-B-C_M-NONE_VL-None_G-M_P-OG_S-NONE_FB3891V05,3928 - opti 3891 kinda sorta opti with man boobs - DP-VK || Batch 1 || Enhancements: OFF || CBV1 || 7C || 24/03/25w13,SHARE,$0,3,2025-03-24,2025-04-14,21
396,CB_2023_May_FB_2103_MB_V02_9x16_VID_EN_Opti_C-Sale_CTA-SMR_Pain-W_M-JOG_VL-30s_TR-None_G-M-F_P-None_S-What,US || Manual Bid || BID CAP 111 || 1C || 21/12/24,VIDEO,$0,3,2024-12-28,2025-04-20,113
397,CB_2025_Apr_FB_3995_DT-DP_V03_9x16_VID_EN_Opti_C-MakingOf_Evergreen_CTA-CTA_Angle-W-B_M-CRAZY_VL-45s_G-M_P-OG_S-NEW_FB3022V01,3995 - 3022 V01 opti || Batch 1 || Enhancements: OFF || CBV1 || 7C || 11/04/25w16,VIDEO,$0,8,2025-04-11,2025-04-21,10
398,CB_2025_Mar_FB_3939_DT_V05_4x5_IMG_EN_New_C-Advertorial_Sale_CTA-65_Angle-W-B-C_M-MIX_VL-None_G-M_P-OG_S-NONE,3939 - CB Advertorial ads New Ideas || Batch 2 || Enhancements: OFF || CBV1 || 7C || 30/03/25w14,SHARE,$0,3,2025-03-30,2025-04-14,15
399,CB_2025_Apr_FB_3962_VK-DP_V04_9x16_VID_EN_Opti_C-Trend_Evergreen_CTA-NONE_Angle-W-B-C_M-JANW_VL-30s_G-M_P-OG_S-NEW_FB3909V03,3962 - 3909 hook opti - DP -VK || Batch 1 || Enhancements: OFF || CBV1 || 7C || 07/04/25w15,VIDEO,$0,7,2025-04-07,2025-04-17,10
400,CB_2024_Dec_FB_3611_CHUB_V05_4x5_IMG_EN_Opti_C-Headline_CTA-NONE_Angle-C_P-NONE_S-NONE - Copy,US || Manual Bid || BID CAP 111 || 1C || 21/12/24,SHARE,$0,2,2024-12-27,2025-04-18,112
401,CB_2025_Apr_FB_3980_LZ-KB_V20_9x16_VID_EN_Opti_C-BulletPoints_Evergreen_CTA-SALE_Angle-W_M-MIX_VL-45s_G-MF_P-OG_S-WHAT_FB3097V03,3980 - winner video man boobs opti || Batch 6 || Enhancements: OFF || CBV1 || 7C || 11/04/25w16,VIDEO,$0,2,2025-04-11,2025-04-16,5
402,CB_2025_Mar_FB_3939_DT_V08_4x5_IMG_EN_New_C-Advertorial_Sale_CTA-65_Angle-W-B-C_M-MIX_VL-None_G-M_P-OG_S-NONE,3939 - CB Advertorial ads New Ideas || Batch 2 || Enhancements: OFF || CBV1 || 7C || 30/03/25w14,SHARE,$0,3,2025-03-30,2025-04-14,15
403,CB_2025_Mar_FB_3924_SO-DP_V02_1x1_IMG_EN_New_C-NONE_Evergreen_CTA-NONE_Angle-W-B-C_M-NONE_VL-None_G-NONE_P-OG_S-NONE,3924 - #17 man boobs/dad bod body text IMG || Batch 1 || Enhancements: OFF || CBV1 || 7C || 24/03/25w13,SHARE,$0,1,2025-03-24,2025-04-21,28
404,CB_2025_Apr_FB_3980_LZ-KB_V21_9x16_VID_EN_Opti_C-BulletPoints_Evergreen_CTA-SALE_Angle-W_M-MIX_VL-45s_G-MF_P-OG_S-WHAT_FB3097V03,3980 - winner video man boobs opti || Batch 6 || Enhancements: OFF || CBV1 || 7C || 11/04/25w16,VIDEO,$0,2,2025-04-11,2025-04-14,3
405,CB_2025_Feb_FB_3883_LZ-RP_V03_9x16_VID_EN_Opti_C-Testimonial_Evergreen_CTA-SALE_Angle-W_M-MIX_VL-30s_G-MF_P-OG_S-WHAT_FB1989V08,3883 - Wiiner opti man boobs t levels || Enhancements: OFF || CBV1 || Batch 1 || 7C || 10/03/25w11,VIDEO,$0,2,2025-03-10,2025-04-14,35
406,CB_2025_Apr_FB_3963_SO-DP_V10_4x5_IMG_EN_Opti_C-NONE_Evergreen_CTA-NONE_Angle-W-B-C_M-NONE_VL-None_G-NONE_P-OG_S-NONE_FB3922V03,3963 - 3922 opti_3 batches IMG || Batch 3 || Enhancements: OFF || CBV1 || 7C || 07/04/25w15,SHARE,$0,2,2025-04-07,2025-04-17,10
407,CB_2025_Apr_FB_3980_LZ-KB_V11_9x16_VID_EN_Opti_C-BulletPoints_Evergreen_CTA-SALE_Angle-W_M-MIX_VL-30s_G-MF_P-OG_S-WHAT_FB1989V08,3980 - winner video man boobs opti || Batch 4 || Enhancements: OFF || CBV1 || 7C || 11/04/25w16,VIDEO,$0,1,2025-04-11,2025-04-14,3
408,CB_2025_Apr_FB_3962_VK-DP_V01_9x16_VID_EN_Opti_C-Trend_Evergreen_CTA-NONE_Angle-W-B-C_M-JANW_VL-30s_G-M_P-OG_S-NEW_FB3909V03,3962 - 3909 hook opti - DP -VK || Batch 1 || Enhancements: OFF || CBV1 || 7C || 07/04/25w15,VIDEO,$0,1,2025-04-07,2025-04-17,10
409,CB_2025_Feb_FB_3883_LZ-RP_V01_9x16_VID_EN_Opti_C-Testimonial_Evergreen_CTA-SALE_Angle-W_M-POW_VL-45s_G-M_P-OG_S-MOON_FB3090V02,3883 - Wiiner opti man boobs t levels || Enhancements: OFF || CBV1 || Batch 1 || 7C || 10/03/25w11,VIDEO,$0,2,2025-03-10,2025-04-14,35
410,CB_2025_Apr_FB_3980_LZ-KB_V06_9x16_VID_EN_Opti_C-BulletPoints_Evergreen_CTA-SALE_Angle-W_M-MIX_VL-30s_G-MF_P-OG_S-NEW_FB2812V07,3980 - winner video man boobs opti || Batch 2 || Enhancements: OFF || CBV1 || 7C || 11/04/25w16,VIDEO,$0,1,2025-04-11,2025-04-14,3
411,CB_2025_Apr_FB_3963_SO-DP_V11_4x5_IMG_EN_Opti_C-NONE_Evergreen_CTA-NONE_Angle-W-B-C_M-NONE_VL-None_G-NONE_P-OG_S-NONE_FB3922V03,3963 - 3922 opti_3 batches IMG || Batch 3 || Enhancements: OFF || CBV1 || 7C || 07/04/25w15,SHARE,$0,1,2025-04-07,2025-04-17,10
412,CB_2025_Apr_FB_3995_DT-DP_V02_9x16_VID_EN_Opti_C-MakingOf_Evergreen_CTA-CTA_Angle-W-B_M-CRAZY_VL-45s_G-M_P-OG_S-NEW_FB3022V01,3995 - 3022 V01 opti || Batch 1 || Enhancements: OFF || CBV1 || 7C || 11/04/25w16,VIDEO,$0,1,2025-04-11,2025-04-21,10
413,CB_2025_Apr_FB_3980_LZ-KB_V23_9x16_VID_EN_Opti_C-BulletPoints_Evergreen_CTA-SALE_Angle-W_M-MIX_VL-45s_G-MF_P-OG_S-WHAT_FB3097V03,3980 - winner video man boobs opti || Batch 6 || Enhancements: OFF || CBV1 || 7C || 11/04/25w16,VIDEO,$0,1,2025-04-11,2025-04-14,3
