,Ad Name,Adset Name,Creative Type,Spend In USD,Impressions,First Ad Spend Date,Last Ad Spend Date,Days ad spending
1,CB_2025_Feb_FB_3883_LZ-RP_V05_9x16_VID_EN_Opti_C-BulletPoints_Evergreen_CTA-SALE_Angle-W_M-JANW_VL-30s_G-M_P-OG_S-WHAT_FB2284V05,🌶️ || US || ASC+ || ->CC141 || VIDEO Only || US+CA || 0% EXISTING CAP || 7C || 07/08.24  Ad set,VIDEO,"$27,858","1,214,286",2025-03-28,2025-05-12,45
2,CB_2025_Mar_FB_3907_CHUB-AA_V03__IMG_EN_Opti_C-Price_CTA-NONE_Angle-None_M-NONE_VL-None_TR-None_G-NONE_P-OG_S-NONE,🌶️ || US || ASC+ || ->CC141 || VIDEO Only || US+CA || 0% EXISTING CAP || 7C || 07/08.24  Ad set,SHARE,"$10,278","371,148",2025-03-25,2025-05-12,48
3,Dynamic_Creative_Statics_CA_Flow,WC || CA || DYNAMIC CREATIVE Static winners || ADV+ audience || 7C || 16.02.2025,SHARE,"$10,236","608,213",2025-02-16,2025-05-12,85
4,CB_2025_Mar_FB_3914_DT-DP_V01_9x16_VID_EN_New_C-Trend_Sale_CTA-SPRNG_Angle-W-B-C_M-JOG_VL-30s_G-F_P-OG_S-NEW,🌶️ || US || ASC+ || ->CC141 || VIDEO Only || US+CA || 0% EXISTING CAP || 7C || 07/08.24  Ad set,VIDEO,"$7,136","217,096",2025-03-28,2025-05-12,45
5,CB_2024_Aug_FB_3097_VK-DP_V03_9x16_VID_EN_Opti_C-Benefits_CTA-SMR_Pain-W-B_M-MIX_VL-45s_TR-None_G-MF_P-OG_S-WHAT_FB2516V13,🌶️ || US || ASC+ || ->CC141 || VIDEO Only || US+CA || 0% EXISTING CAP || 7C || 07/08.24  Ad set,VIDEO,"$6,396","264,469",2024-09-04,2025-05-12,250
6,CB_2023_Jul_FB_2217_IB_V04_9x16_VID_EN_Opti_C-Pointing_CTA-SMR_Pain-W-B_M-TRC_VL-30s_TR-None_G-F_P-None_S-FRIGGA,US || ASC+ || Website + Shop || 7DC || Existing 0% || 24.03.2025 Ad set,VIDEO,"$6,300","199,603",2025-03-24,2025-05-12,49
7,CB_2025_Apr_FB_4065_LZ-VU_V04_4x5_IMG_EN_Opti_C-NegativeMark_Evergreen_CTA-NONE_Angle-Cort_M-NONE_VL-None_G-NONE_P-NONE_S-NONE_FB3251V01,US || ASC+ || Website + Shop || 7DC || Existing 0% || 24.03.2025 Ad set,SHARE,"$6,174","234,035",2025-05-04,2025-05-12,8
8,CB_2023_Jul_FB_2217_IB_V04_9x16_VID_EN_Opti_C-Pointing_CTA-SMR_Pain-W-B_M-TRC_VL-30s_TR-None_G-F_P-None_S-FRIGGA,CA || ASC+ || 0% EXISTING || 7DC || 18.03.2025,VIDEO,"$5,675","279,628",2025-03-18,2025-05-11,54
9,CB_2025_Mar_FB_3907_CHUB-AA_V03__IMG_EN_Opti_C-Price_CTA-NONE_Angle-None_M-NONE_VL-None_TR-None_G-NONE_P-OG_S-NONE,US || ASC+ || Website + Shop || 7DC || Existing 0% || 24.03.2025 Ad set,SHARE,"$5,003","198,654",2025-04-04,2025-05-12,38
10,CB_2025_Feb_FB_3883_LZ-RP_V05_9x16_VID_EN_Opti_C-BulletPoints_Evergreen_CTA-SALE_Angle-W_M-JANW_VL-30s_G-M_P-OG_S-WHAT_FB2284V05,CA || ASC+ || 0% EXISTING || 7DC || 18.03.2025,VIDEO,"$4,445","291,153",2025-03-27,2025-05-11,45
11,CB_2023_May_FB_2103_MB_V02_9x16_VID_EN_Opti_C-Sale_CTA-SMR_Pain-W_M-JOG_VL-30s_TR-None_G-M-F_P-None_S-What,US || ASC+ || Website + Shop || 7DC || Existing 0% || 24.03.2025 Ad set,VIDEO,"$4,156","142,452",2025-04-04,2025-05-12,38
12,CB_2023_Feb_FB_1998_LV_V02_9x16_VID_EN_Opti_C-Dance_CTA-CTA_Pain-W_M-MIX_VL-45s_TR-None_G-F_P-Plan,US || ASC+ || Website + Shop || 7DC || Existing 0% || 24.03.2025 Ad set,VIDEO,"$4,106","179,389",2025-04-04,2025-05-12,38
13,CB_2023_Jul_FB_2217_IB_V04_9x16_VID_EN_Opti_C-Pointing_CTA-SMR_Pain-W-B_M-TRC_VL-30s_TR-None_G-F_P-None_S-FRIGGA,US || Kilo Product's leads LAL || 7C || 04/03/25,VIDEO,"$3,716","100,642",2025-03-04,2025-05-12,69
14,CB_2025_Apr_FB_3996_DT-DP_V01_9x16_VID_EN_Opti_C-MakingOf_Evergreen_CTA-CTA_Angle-W-B_M-CRAZY_VL-45s_G-M_P-OG_S-NEW_FB3022V03,US || ASC+ || Website + Shop || 7DC || Existing 0% || 24.03.2025 Ad set,VIDEO,"$3,529","160,826",2025-04-21,2025-05-08,17
15,CB_2025_Jan_FB_3723_SO_V04_4x5_IMG_EN_New_C-NONE_Evergreen_CTA-SALE_Angle-W_M-NONE_VL-None_G-NONE_P-NONE_S-NONE,🌶️ || US || ASC+ || ->CC141 || VIDEO Only || US+CA || 0% EXISTING CAP || 7C || 07/08.24  Ad set,SHARE,"$3,297","159,223",2025-02-12,2025-05-09,86
16,CB_2023_May_FB_2263_MB_V04_9x16_VID_EN_New_C-Sale_CTA-SMR_Pain-W_M-JOG_VL-45s_TR-None_G-M-F_P-None_S-Moon,🌶️ || US || ASC+ || ->CC141 || VIDEO Only || US+CA || 0% EXISTING CAP || 7C || 07/08.24  Ad set,VIDEO,"$3,103","80,711",2024-08-07,2025-05-12,278
17,CB_2024_Sep_FB_3175_DA-KB_V04_1x1_IMG_EN_New_C-ADVRT_Evergreen_CTA-NONE_Angle-W_M-NONE_VL-None_G-NONE_P-CBV2_S-NONE_blog_colonbroomvsmammothhighprice3_cv_en,CBV2 || Advantage+ || Advertorial || Higher pricing || US || 0% EXISTING CAP || BROAD || 7C || 20/01/25  Campaign Ad set,SHARE,"$3,085","103,256",2025-04-16,2025-05-12,26
18,CB_2025_Apr_FB_4065_LZ-VU_V01_4x5_IMG_EN_Opti_C-NegativeMark_Evergreen_CTA-NONE_Angle-Cort_M-NONE_VL-None_G-NONE_P-NONE_S-NONE_FB3251V01,CA || ASC+ || 0% EXISTING || 7DC || 18.03.2025,SHARE,"$2,892","228,203",2025-05-05,2025-05-08,3
19,CB_2023_Dec_FB_2712_RS-DP_V02_1x1_VID_EN_Opti_C-WrittenTesti_CTA-SALE_Pain-W-B-C_M-NONE_VL-None_TR-None_G-NONE_P-V2_S-NONE_FB2227V08,CBV2 || EU (UK) || 💰 Advantage+ || US || BROAD || 7C || Existing_customer_5% || 15/12/24 Ad set,VIDEO,"$2,743","118,929",2025-03-31,2025-05-12,42
20,CB_2025_Apr_FB_4040_SO_V09_4x5_IMG_EN_New_C-NONE_Evergreen_CTA-SALE_Angle-W_M-NONE_VL-None_G-NONE_P-NONE_S-NONE,🌶️ || US || ASC+ || ->CC141 || VIDEO Only || US+CA || 0% EXISTING CAP || 7C || 07/08.24  Ad set,SHARE,"$2,701","157,150",2025-05-06,2025-05-07,1
21,CB_2023_Dec_FB_2712_RS-DP_V02_1x1_VID_EN_Opti_C-WrittenTesti_CTA-SALE_Pain-W-B-C_M-NONE_VL-None_TR-None_G-NONE_P-V2_S-NONE_FB2227V08,⚫️ US || CBV2 || Advantage+ || 7C || BROAD || Existing_customer_0% || || 24/04/25 Ad set,SHARE,"$2,555","84,683",2025-04-24,2025-05-12,18
22,CB_2025_Mar_FB_3914_DT-DP_V01_9x16_VID_EN_New_C-Trend_Sale_CTA-SPRNG_Angle-W-B-C_M-JOG_VL-30s_G-F_P-OG_S-NEW,CA || ASC+ || 0% EXISTING || 7DC || 18.03.2025,VIDEO,"$2,486","125,725",2025-04-01,2025-05-11,40
23,CB_2025_Apr_FB_4065_LZ-VU_V01_4x5_IMG_EN_Opti_C-NegativeMark_Evergreen_CTA-NONE_Angle-Cort_M-NONE_VL-None_G-NONE_P-NONE_S-NONE_FB3251V01,🌶️ || US || ASC+ || ->CC141 || VIDEO Only || US+CA || 0% EXISTING CAP || 7C || 07/08.24  Ad set,SHARE,"$2,455","113,183",2025-05-01,2025-05-09,8
24,CB_2025_Mar_FB_3919_LZ_V01_1x1_IMG_EN_Opti_C-Headline_Evergreen_CTA-NONE_Angle-Horm_M-NONE_VL-30s_G-M_P-OG_S-NONE_FB3891V05,CA || ASC+ || 0% EXISTING || 7DC || 18.03.2025,SHARE,"$2,445","200,052",2025-03-27,2025-05-11,45
25,CB_2023_Jul_FB_2226_MB_V04_9x16_VID_EN_Opti_C-Testim_CTA-SMR_Pain-W_M-MIX_VL-30s_TR-None_G-F_P-None_S-Starry,🌶️ || US || ASC+ || ->CC141 || VIDEO Only || US+CA || 0% EXISTING CAP || 7C || 07/08.24  Ad set,VIDEO,"$2,295","73,241",2024-10-28,2025-05-12,196
26,CB_2025_Jan_FB_3723_SO_V04_4x5_IMG_EN_New_C-NONE_Evergreen_CTA-SALE_Angle-W_M-NONE_VL-None_G-NONE_P-NONE_S-NONE,CA || ASC+ || 0% EXISTING || 7DC || 18.03.2025,SHARE,"$2,277","170,034",2025-03-18,2025-05-11,54
27,CB_2025_Feb_FB_3827_LZ_V04_1x1_IMG_EN_Opti_C-Headline_Evergreen_CTA-SALE_Angle-W_M-NONE_VL-None_G-M_P-CBV2_S-NONE_FB3779V02,CBV2 || US || Manual Bid: ROAS GOAL: 1.00 -> 1.1 || 7DC || 22/01/2025,SHARE,"$1,997","77,321",2025-02-18,2025-05-12,83
28,CB_2023_May_FB_2263_MB_V04_9x16_VID_EN_New_C-Sale_CTA-SMR_Pain-W_M-JOG_VL-45s_TR-None_G-M-F_P-None_S-Moon,CA || ASC+ || 0% EXISTING || 7DC || 18.03.2025,VIDEO,"$1,831","78,093",2025-03-18,2025-05-11,54
29,CB_2025_Feb_FB_3821_SO-KB-JG_V16_4x5_IMG_EN_Opti_C-NONE_Evergreen_CTA-SALE_Angle-W_M-NONE_VL-None_G-NONE_P-NONE_S-NONE_FB3723V07,🌶️ || US || ASC+ || ->CC141 || VIDEO Only || US+CA || 0% EXISTING CAP || 7C || 07/08.24  Ad set,SHARE,"$1,785","88,662",2025-05-03,2025-05-12,9
30,CB_2025_Feb_FB_3827_LZ_V03_1x1_IMG_EN_Opti_C-Headline_Evergreen_CTA-SALE_Angle-W_M-NONE_VL-None_G-M_P-CBV2_S-NONE_FB3705V02,CBV2 || EU (UK) || 💰 Advantage+ || US || BROAD || 7C || Existing_customer_5% || 15/12/24 Ad set,SHARE,"$1,732","73,313",2025-03-31,2025-05-12,42
31,CB_2025_Apr_FB_3996_DT-DP_V01_9x16_VID_EN_Opti_C-MakingOf_Evergreen_CTA-CTA_Angle-W-B_M-CRAZY_VL-45s_G-M_P-OG_S-NEW_FB3022V03,3996 - 3022 V03 opti || Batch 1 || Enhancements: OFF || CBV1 || 7C || 11/04/25w16,VIDEO,"$1,596","69,850",2025-04-11,2025-05-08,27
32,CB_2025_Mar_FB_3914_DT-DP_V01_9x16_VID_EN_New_C-Trend_Sale_CTA-SPRNG_Angle-W-B-C_M-JOG_VL-30s_G-F_P-OG_S-NEW,CBV2 || EU (UK) || 💰 Advantage+ || US || BROAD || 7C || Existing_customer_5% || 15/12/24 Ad set,VIDEO,"$1,586","80,532",2025-04-01,2025-05-12,41
33,CB_2025_Apr_FB_3980_LZ-KB_V08_9x16_VID_EN_Opti_C-Pointing_Evergreen_CTA-SALE_Angle-W_M-POW_VL-30s_G-M_P-OG_S-MOON_FB2036V03,US || ASC+ || Website + Shop || 7DC || Existing 0% || 24.03.2025 Ad set,VIDEO,"$1,583","67,973",2025-04-14,2025-05-12,28
34,CB_2025_Apr_FB_3961_SO-JG_V07_4x5_IMG_EN_New_C-NONE_Evergreen_CTA-NONE_Angle-W-B-C_M-NONE_VL-None_G-NONE_P-OG_S-NONE,3961 - Action Figur || Batch 3 || Enhancements: OFF || CBV1 || 7C || 14/04/25w16,SHARE,"$1,563","91,382",2025-04-14,2025-05-08,24
35,CB_2025_Apr_FB_4030_DT_V07_4x5_IMG_EN_New_C-Headline_Sale_CTA-SPRNG_Angle-W-B-C_M-NONE_VL-None_G-NONE_P-OG_S-NONE_FB2227V08,4030 - Easter Sale winner ads Opti || Batch 3 || Enhancements: OFF || CBV1 || 7C || 16/04/25w16,SHARE,"$1,562","46,771",2025-04-16,2025-05-08,22
36,CB_2023_Aug_FB_2369_DA_V04_9x16_GIF_EN_New_C-Benefits_CTA-DISCOUNT_Pain-W-B_M-NONE_VL-15s_TR-None_G-NONE_P-V2_S-NEW - Copy,⚫️ US || CBV2 || Advantage+ || 7C || BROAD || Existing_customer_0% || || 24/04/25 Ad set,VIDEO,"$1,469","53,256",2025-04-24,2025-05-12,18
37,CB_2025_Mar_FB_3914_DT-DP_V03_9x16_VID_EN_New_C-Trend_Sale_CTA-SPRNG_Angle-W-B-C_M-JOG_VL-30s_G-F_P-OG_S-NEW,"3914 - #9 GF's POV, male confidence || Batch 1 || Enhancements: OFF || CBV1 || 7C || 24/03/25w13",VIDEO,"$1,469","62,503",2025-03-24,2025-05-08,45
38,CB_2023_Aug_FB_2369_DA_V04_9x16_GIF_EN_New_C-Benefits_CTA-DISCOUNT_Pain-W-B_M-NONE_VL-15s_TR-None_G-NONE_P-V2_S-NEW,CBV2 || US || Manual Bid: ROAS GOAL: 1.00 -> 1.1 || 7DC || 22/01/2025,VIDEO,"$1,379","41,997",2025-04-28,2025-05-12,14
39,CB_2025_Apr_FB_3996_DT-DP_V01_9x16_VID_EN_Opti_C-MakingOf_Evergreen_CTA-CTA_Angle-W-B_M-CRAZY_VL-45s_G-M_P-OG_S-NEW_FB3022V03,CBV2 || EU (UK) || 💰 Advantage+ || US || BROAD || 7C || Existing_customer_5% || 15/12/24 Ad set,VIDEO,"$1,373","71,407",2025-04-22,2025-05-12,20
40,CB_2025_Jan_FB_3779_VK-DP_V02_1x1_VID_EN_Opti_C-BulletPoints_Evergreen_CTA-70_Angle-W-B-C_M-NONE_VL-None_G-F_P-OG_S-NEW_FB3705V02,3779 - opti 3705 || Enhancements: OFF || CBV1 || Batch 1 || 1C || 04/02/25w06 || Kostas,SHARE,"$1,320","74,985",2025-02-04,2025-05-09,94
41,CB_2025_Apr_FB_4040_SO_V09_4x5_IMG_EN_New_C-NONE_Evergreen_CTA-SALE_Angle-W_M-NONE_VL-None_G-NONE_P-NONE_S-NONE,4040 - Game style happy street IMG || Batch 3 || Enhancements: OFF || CBV1 || 7C || 28/04/25w18,SHARE,"$1,094","55,403",2025-04-28,2025-05-12,14
42,CB_2025_Jan_FB_3723_SO_V07_4x5_IMG_EN_New_C-NONE_Evergreen_CTA-SALE_Angle-W_M-NONE_VL-None_G-NONE_P-NONE_S-NONE,CBV2 || US || Manual Bid: ROAS GOAL: 1.00 -> 1.1 || 7DC || 22/01/2025,SHARE,"$1,078","41,972",2025-02-11,2025-05-12,90
43,CB_2024_Aug_FB_3090_DT-DP_V02_9x16_VID_EN_Opti_C-MakingOf_CTA-CTA_Pain-W-B-C_M-POW_VL-45s_TR-None_G-M_P-OG_S-Moon_FB3029V04,⚫️ US || CBV2 || Advantage+ || 7C || BROAD || Existing_customer_0% || || 24/04/25 Ad set,VIDEO,"$1,074","63,192",2025-04-24,2025-05-12,18
44,CB_2024_Apr_FB_2970_RS_V02_1x1_GIF_EN_Opti_C-WrittenTesti_CTA-CTA_Pain-W_M-NONE_VL-7s_TR-None_G-NONE_P-V2_S-NEW,CBV2 || US || Manual Bid: ROAS GOAL: 1.00 -> 1.1 || 7DC || 22/01/2025,VIDEO,$929,"23,637",2025-03-27,2025-05-12,46
45,CB_2023_Jul_FB_2284_DA_V05_9x16_VID_EN_Opti_C-Sale_CTA-SMR_Pain-W_M-JANW_VL-30s_TR-None_G-M_P-None_S-WHAT_FB2103V02,CA || ASC+ || 0% EXISTING || 7DC || 18.03.2025,VIDEO,$917,"32,383",2025-03-18,2025-05-11,54
46,CB_2025_Jan_FB_3742_SO-DP-KB_V06_4x5_IMG_EN_Opti_C-NONE_Evergreen_CTA-SALE_Angle-W_M-NONE_VL-None_G-NONE_P-CBV2_S-NONE3665V01,CBV2 || US || Manual Bid: ROAS GOAL: 1.00 -> 1.1 || 7DC || 22/01/2025,SHARE,$878,"33,544",2025-02-11,2025-05-12,90
47,CB_2024_Sep_FB_3175_DA-KB_V04_1x1_IMG_EN_New_C-ADVRT_Evergreen_CTA-NONE_Angle-W_M-NONE_VL-None_G-NONE_P-CBV2_S-NONE_blog_colonbroomvsmammoth_cv_en,CBV2 || Advantage+ || Advertorial || Higher pricing || US || 0% EXISTING CAP || BROAD || 7C || 20/01/25  Campaign Ad set,SHARE,$853,"36,318",2025-01-20,2025-05-12,112
48,CB_2025_Feb_FB_3817_SO_V01_4x5_IMG_EN_Opti_C-NONE_Evergreen_CTA-SALE_Angle-W_M-NONE_VL-None_G-NONE_P-NONE_S-NONE_FB3723V07,CBV2 || EU (UK) || 💰 Advantage+ || US || BROAD || 7C || Existing_customer_5% || 15/12/24 Ad set,SHARE,$837,"46,272",2025-02-14,2025-05-12,87
49,CB_2025_Feb_FB_3883_LZ-RP_V05_9x16_VID_EN_Opti_C-BulletPoints_Evergreen_CTA-SALE_Angle-W_M-JANW_VL-30s_G-M_P-OG_S-WHAT_FB2284V05,CBV2 || EU (UK) || 💰 Advantage+ || US || BROAD || 7C || Existing_customer_5% || 15/12/24 Ad set,SHARE,$835,"39,288",2025-04-01,2025-05-12,41
50,CB_2025_Apr_FB_3975_LZ_V03_9x16_VID_EN_New_C-Testimonial_Evergreen_CTA-SALE_Angle-W_M-LAURA_VL-15s_G-F_P-OG_S-NEW,CBV2 || EU (UK) || 💰 Advantage+ || US || BROAD || 7C || Existing_customer_5% || 15/12/24 Ad set,VIDEO,$804,"43,734",2025-04-14,2025-05-12,28
51,CB_2025_Apr_FB_4039_SO_V01_4x5_IMG_EN_New_C-NONE_Evergreen_CTA-SALE_Angle-W_M-NONE_VL-None_G-NONE_P-NONE_S-NONE,4039 - Minecraft-inspired IMG || Batch 1 || Enhancements: OFF || CBV1 || 7C || 28/04/25w18,SHARE,$777,"33,188",2025-04-28,2025-05-12,14
52,CB_2025_Apr_FB_4065_LZ-VU_V04_4x5_IMG_EN_Opti_C-NegativeMark_Evergreen_CTA-NONE_Angle-Cort_M-NONE_VL-None_G-NONE_P-NONE_S-NONE_FB3251V01,4065 - its not cheap summer || Batch 1 || Enhancements: OFF || CBV1 || 7C || 29/04/25w18,SHARE,$765,"28,488",2025-04-29,2025-05-08,9
53,CB_2024_Aug_FB_3090_DT-DP_V02_9x16_VID_EN_Opti_C-MakingOf_CTA-CTA_Pain-W-B-C_M-POW_VL-45s_TR-None_G-M_P-OG_S-Moon_FB3029V04,CBV2 || EU (UK) || 💰 Advantage+ || US || BROAD || 7C || Existing_customer_5% || 15/12/24 Ad set,SHARE,$758,"47,656",2024-12-19,2025-05-12,144
54,CB_2025_Jan_FB_3723_SO_V04_4x5_IMG_EN_New_C-NONE_Evergreen_CTA-SALE_Angle-W_M-NONE_VL-None_G-NONE_P-NONE_S-NONE,3723 - Notion Idea #92 MAN BOOBS || Enhancements: OFF || CBV1 || Batch 1 || 1C || 28/01/25w05 || Kostas,SHARE,$732,"44,929",2025-01-28,2025-05-08,100
55,CB_2025_Apr_FB_3962_VK-DP_V02_9x16_VID_EN_Opti_C-Trend_Evergreen_CTA-NONE_Angle-W-B-C_M-JANW_VL-30s_G-M_P-OG_S-NEW_FB3909V03,US || ASC+ || Website + Shop || 7DC || Existing 0% || 24.03.2025 Ad set,VIDEO,$702,"25,512",2025-04-14,2025-05-12,28
56,CB_2023_Sep_FB_2429_DT_V03_9x16_VID_EN_Opti_C-Sale_CTA-CTA_Pain-W_M-MIX_VL-45s_TR-None_G-MF_P-V2_S-WHAT - Copy,⚫️ US || CBV2 || Advantage+ || 7C || BROAD || Existing_customer_0% || || 24/04/25 Ad set,VIDEO,$699,"30,649",2025-04-24,2025-05-12,18
57,CB_2025_Apr_FB_4067_LZ_V03_4x5_IMG_EN_Opti_C-Price_Sale_CTA-SALE_Angle-None_M-NONE_VL-None_G-NONE_P-OG_S-NONE_FB3907V03,4067 - mother's day CHUB winner opti || Batch 1 || Enhancements: OFF || CBV1 || 7C || 05/05/25w19,SHARE,$695,"21,673",2025-05-02,2025-05-12,10
58,CB_2025_Mar_FB_3924_SO-DP_V03_1x1_IMG_EN_New_C-NONE_Evergreen_CTA-NONE_Angle-W-B-C_M-NONE_VL-None_G-NONE_P-OG_S-NONE,3924 - #17 man boobs/dad bod body text IMG || Batch 1 || Enhancements: OFF || CBV1 || 7C || 24/03/25w13,SHARE,$665,"25,945",2025-03-24,2025-05-06,43
59,CB_2025_Apr_FB_4066_SO_V06_4x5_IMG_EN_Opti_C-NONE_Evergreen_CTA-NONE_Angle-W-B-C_M-NONE_VL-None_G-NONE_P-OG_S-NONE_FB3950V16,4066 - FB3950V16 Opti IMG || Batch 2 || Enhancements: OFF || CBV1 || 7C || 05/05/25w19,SHARE,$651,"41,925",2025-05-05,2025-05-12,7
60,CB_2023_Jul_FB_2217_IB_V04_9x16_VID_EN_Opti_C-Pointing_CTA-SMR_Pain-W-B_M-TRC_VL-30s_TR-None_G-F_P-None_S-FRIGGA,CBV2 || EU (UK) || 💰 Advantage+ || US || BROAD || 7C || Existing_customer_5% || 15/12/24 Ad set,VIDEO,$639,"31,670",2024-12-18,2025-05-12,145
61,CB_2024_Feb_FB_2812_MB-RP_V07_9x16_VID_EN_Opti_C-Sale_CTA-C65_Pain-W_M-NONE_VL-30s_TR-None_G-MF_P-Plan_S-NEW_FB2601V04_1,US || Kilo Product's leads LAL || 7C || 04/03/25,VIDEO,$633,"18,149",2025-03-04,2025-05-12,69
62,CB_2024_Apr_FB_2970_RS_V02_1x1_GIF_EN_Opti_C-WrittenTesti_CTA-CTA_Pain-W_M-NONE_VL-7s_TR-None_G-NONE_P-V2_S-NEW,CBV2 || EU (UK) || 💰 Advantage+ || US || BROAD || 7C || Existing_customer_5% || 15/12/24 Ad set,VIDEO,$624,"20,244",2025-04-02,2025-05-12,40
63,CB_2025_Mar_FB_3903_VK_V01_9x16_VID_EN_New_C-BulletPoints_Evergreen_CTA-65_Angle-W-B-C_M-MIX_VL-30s_G-MF_P-OG_S-NEW,CA || ASC+ || 0% EXISTING || 7DC || 18.03.2025,VIDEO,$614,"35,929",2025-03-30,2025-05-11,42
64,CB_2025_Mar_FB_3914_DT-DP_V03_9x16_VID_EN_New_C-Trend_Sale_CTA-SPRNG_Angle-W-B-C_M-JOG_VL-30s_G-F_P-OG_S-NEW,US || Kilo Product's leads LAL || 7C || 04/03/25,VIDEO,$607,"19,868",2025-04-28,2025-05-12,14
65,CB_2025_Feb_FB_3883_LZ-RP_V05_9x16_VID_EN_Opti_C-BulletPoints_Evergreen_CTA-SALE_Angle-W_M-JANW_VL-30s_G-M_P-OG_S-WHAT_FB2284V05,CBV2 || AU || 💰 Advantage+ || US || BROAD || 7C || Existing_customer_5% || 19/12/24 Ad set,VIDEO,$563,"22,523",2025-03-28,2025-05-12,45
66,CB_2025_Feb_FB_3883_LZ-RP_V05_9x16_VID_EN_Opti_C-BulletPoints_Evergreen_CTA-SALE_Angle-W_M-JANW_VL-30s_G-M_P-OG_S-WHAT_FB2284V05.mp4,US || Quiz: Shopify || 7C || 04/04/25,VIDEO,$541,"19,826",2025-04-04,2025-05-11,37
67,CB_2025_Apr_FB_4063_SO_V02_4x5_IMG_EN_New_C-NONE_Evergreen_CTA-SALE_Angle-W_M-NONE_VL-None_G-NONE_P-OG_S-NONE,4063 - Metal Binding Text IMG || Batch 1 || Enhancements: OFF || CBV1 || 7C || 05/05/25w19,SHARE,$520,"29,545",2025-05-05,2025-05-09,4
68,CB_2024_Jan_FB_2762_IK_V05_1x1_IMG_EN_New_C-WrittenTesti_CTA-CTA_Pain-W-B-C_M-NONE_VL-None_TR-None_G-NONE_P-V2_S-NONE,CBV2 || EU (UK) || 💰 Advantage+ || US || BROAD || 7C || Existing_customer_5% || 15/12/24 Ad set,SHARE,$505,"17,586",2024-12-15,2025-05-12,148
69,CB_2025_Apr_FB_4037_DT-DP_V12_9x16_VID_EN_Opti_C-Benefits_Evergreen_CTA-65_Angle-W-B_M-POW_VL-45s_G-M_P-OG_S-FRIGGA_FB2601V11,4037 - Aaron winner opti with new footage || Batch 4 || Enhancements: OFF || CBV1 || 7C || 05/05/25w19,VIDEO,$501,"22,571",2025-05-05,2025-05-09,4
70,CB_2023_Jul_FB_2284_DA_V05_9x16_VID_EN_Opti_C-Sale_CTA-SMR_Pain-W_M-JANW_VL-30s_TR-None_G-M_P-None_S-WHAT_FB2103V02,US || ASC+ || Website + Shop || 7DC || Existing 0% || 24.03.2025 Ad set,VIDEO,$479,"12,380",2025-03-24,2025-05-12,49
71,CB_2025_Apr_FB_4061_SO_V12_4x5_IMG_EN_Opti_C-NONE_Evergreen_CTA-SALE_Angle-W_M-NONE_VL-None_G-NONE_P-NONE_S-NONE_FB4032V01,4061 - FB4032V01 Opti IMG || Batch 4 || Enhancements: OFF || CBV1 || 7C || 05/05/25w19,SHARE,$460,"25,792",2025-05-05,2025-05-09,4
72,CB_2025_Jan_FB_3723_SO_V04_4x5_IMG_EN_New_C-NONE_Evergreen_CTA-SALE_Angle-W_M-NONE_VL-None_G-NONE_P-NONE_S-NONE,US || Kilo Product's leads LAL || 7C || 04/03/25,SHARE,$457,"18,205",2025-03-04,2025-05-12,69
73,CB_2025_Apr_FB_4070_KB_V03_4x5_VID_EN_New_C-NONE_CTA-SALE_Angle-None_M-NONE_VL-None_TR-None_G-F_P-OG_S-NONE,4070 - 3677 opti inspirational quotes || Batch 1 || Enhancements: OFF || CBV1 || 7C || 05/05/25w19,SHARE,$454,"23,687",2025-05-05,2025-05-09,4
74,CB_2025_Apr_FB_4037_DT-DP_V09_9x16_VID_EN_Opti_C-Dance_Sale_CTA-SMR_Angle-W-B_M-POW_VL-30s_G-M_P-OG_S-WHAT_FB3043V03,4037 - Aaron winner opti with new footage || Batch 3 || Enhancements: OFF || CBV1 || 7C || 05/05/25w19,VIDEO,$448,"23,405",2025-05-05,2025-05-09,4
75,CB_2025_Apr_FB_3995_DT-DP_V01_9x16_VID_EN_Opti_C-MakingOf_Evergreen_CTA-CTA_Angle-W-B_M-CRAZY_VL-45s_G-M_P-OG_S-NEW_FB3022V01,US || Kilo Product's leads LAL || 7C || 04/03/25,VIDEO,$436,"15,569",2025-04-14,2025-05-12,28
76,CB_2025_Feb_FB_3827_LZ_V02_1x1_IMG_EN_Opti_C-Headline_Evergreen_CTA-NONE_Angle-W_M-NONE_VL-None_G-M_P-CBV2_S-NONE_FB3723V18,CBV2 || US || Manual Bid: ROAS GOAL: 1.00 -> 1.1 || 7DC || 22/01/2025,SHARE,$426,"13,801",2025-02-18,2025-05-12,83
77,CB_2025_Feb_FB_3817_SO_V01_4x5_IMG_EN_Opti_C-NONE_Evergreen_CTA-SALE_Angle-W_M-NONE_VL-None_G-NONE_P-NONE_S-NONE_FB3723V07,CBV2 || AU || 💰 Advantage+ || US || BROAD || 7C || Existing_customer_5% || 19/12/24 Ad set,SHARE,$425,"21,875",2025-02-14,2025-05-12,87
78,CB_2025_Jan_FB_3742_SO-DP-KB_V01_4x5_IMG_EN_Opti_C-NONE_Evergreen_CTA-SALE_Angle-W_M-NONE_VL-None_G-NONE_P-CBV2_S-NONE3665V01,CBV2 || EU (UK) || 💰 Advantage+ || US || BROAD || 7C || Existing_customer_5% || 15/12/24 Ad set,SHARE,$424,"22,330",2025-02-04,2025-05-12,97
79,CB_2025_Apr_FB_4037_DT-DP_V04_9x16_VID_EN_Opti_C-Pointing_Evergreen_CTA-SALE_Angle-W_M-POW_VL-30s_G-M_P-OG_S-MOON_FB3980V08,4037 - Aaron winner opti with new footage || Batch 2 || Enhancements: OFF || CBV1 || 7C || 05/05/25w19,VIDEO,$401,"18,888",2025-05-05,2025-05-09,4
80,CB_2025_Apr_FB_4059_SO_V06_4x5_IMG_EN_Opti_C-NONE_Evergreen_CTA-SALE_Angle-W_M-NONE_VL-None_G-NONE_P-NONE_S-NONE_4006V02,4059 - FB4006V02 Opti IMG || Batch 2 || Enhancements: OFF || CBV1 || 7C || 05/05/25w19,SHARE,$400,"23,171",2025-05-05,2025-05-09,4
81,CB_2025_Apr_FB_4028_LZ-DT_V02_9x16_VID_EN_New_C-BulletPoints_Sale_CTA-SPRING_Angle-W-B-C_M-MAG_VL-30s_G-F_P-OG_S-STARRY,CBV2 || EU (UK) || 💰 Advantage+ || US || BROAD || 7C || Existing_customer_5% || 15/12/24 Ad set,VIDEO,$399,"14,414",2025-04-26,2025-05-08,12
82,CB_2025_Feb_FB_3883_LZ-RP_V05_9x16_VID_EN_Opti_C-BulletPoints_Evergreen_CTA-SALE_Angle-W_M-JANW_VL-30s_G-M_P-OG_S-WHAT_FB2284V05,⚫️ US || CBV2 || Advantage+ || 7C || BROAD || Existing_customer_0% || || 24/04/25 Ad set,VIDEO,$395,"20,090",2025-04-26,2025-05-12,16
83,CB_2023_Jul_FB_2217_IB_V04_9x16_VID_EN_Opti_C-Pointing_CTA-SMR_Pain-W-B_M-TRC_VL-30s_TR-None_G-F_P-None_S-FRIGGA,🌶️ || US || ASC+ || ->CC141 || VIDEO Only || US+CA || 0% EXISTING CAP || 7C || 07/08.24  Ad set,VIDEO,$393,"10,970",2024-08-07,2025-05-05,271
84,CB_2025_Apr_FB_4037_DT-DP_V01_9x16_VID_EN_Opti_C-Dance_Evergreen_CTA-65_Angle-W_M-POW_VL-30s_G-M_P-OG_S-WOOD_FB3850V04,4037 - Aaron winner opti with new footage || Batch 1 || Enhancements: OFF || CBV1 || 7C || 05/05/25w19,VIDEO,$389,"23,687",2025-05-05,2025-05-08,3
85,CB_2025_Feb_FB_3821_SO-KB-JG_V16_4x5_IMG_EN_Opti_C-NONE_Evergreen_CTA-SALE_Angle-W_M-NONE_VL-None_G-NONE_P-NONE_S-NONE_FB3723V07,3821 - Man boobs Opti || Batch 2 || Enhancements: OFF || CBV1 || 7C || 28/04/25w18,SHARE,$384,"14,032",2025-04-28,2025-05-08,10
86,CB_2025_Apr_FB_4061_SO_V09_4x5_IMG_EN_Opti_C-NONE_Evergreen_CTA-SALE_Angle-W_M-NONE_VL-None_G-NONE_P-NONE_S-NONE_FB4032V01,4061 - FB4032V01 Opti IMG || Batch 3 || Enhancements: OFF || CBV1 || 7C || 05/05/25w19,SHARE,$380,"20,375",2025-05-05,2025-05-08,3
87,CB_2025_Apr_FB_4054_LZ-DP_V01_9x16_VID_EN_Opti_C-MakingOf_Sale_CTA-SALE_Angle-W_M-PASQ_VL-30s_G-M_P-OG_S-NEW_FB3995V01,4054 - 3995 opti pasqualino || Batch 1 || Enhancements: OFF || CBV1 || 7C || 05/05/25w19,VIDEO,$374,"20,272",2025-05-05,2025-05-08,3
88,CB_2025_Apr_FB_4066_SO_V05_4x5_IMG_EN_Opti_C-NONE_Evergreen_CTA-NONE_Angle-W-B-C_M-NONE_VL-None_G-NONE_P-OG_S-NONE_FB3950V16,4066 - FB3950V16 Opti IMG || Batch 1 || Enhancements: OFF || CBV1 || 7C || 05/05/25w19,SHARE,$372,"22,946",2025-05-05,2025-05-09,4
89,CB_2025_Apr_FB_4065_LZ-VU_V01_4x5_IMG_EN_Opti_C-NegativeMark_Evergreen_CTA-NONE_Angle-Cort_M-NONE_VL-None_G-NONE_P-NONE_S-NONE_FB3251V01,4065 - its not cheap summer || Batch 1 || Enhancements: OFF || CBV1 || 7C || 29/04/25w18,SHARE,$372,"13,322",2025-04-29,2025-05-08,9
90,CB_2024_Jan_FB_2764_RS_V04_9x16_VID_EN_Opti_C-SingleTesti_CTA-SALE_Pain-W_M-TRC_VL-45s_TR-None_G-F_P-OG_S-MOON_FB2263V04_Page_Personal_Coach,CBV2 || AU || 💰 Advantage+ || US || BROAD || 7C || Existing_customer_5% || 19/12/24 Ad set,VIDEO,$359,"6,883",2025-01-16,2025-05-08,112
91,CB_2024_Dec_FB_3601_VK-DP_V09_4x5_VID_EN_Opti_C-Dance_CTA-NY_Pain-W-B_M-JOG_VL-30s_TR-None_G-F_P-OG_S-WHAT_FB3045V01,CBV2 || AU || 💰 Advantage+ || US || BROAD || 7C || Existing_customer_5% || 19/12/24 Ad set,SHARE,$357,"13,429",2025-01-03,2025-05-12,129
92,CB_2025_Mar_FB_3907_CHUB-AA_V03_4x5_IMG_EN_Opti_C-Price_CTA-NONE_Angle-None_M-NONE_VL-None_TR-None_G-NONE_P-OG_S-NONE.png,US || Quiz: React || 7C || 04/04/25,SHARE,$342,"12,465",2025-04-04,2025-05-06,32
93,CB_2025_Apr_FB_4026_SO_V01_4x5_IMG_EN_Opti_C-NONE_Evergreen_CTA-NONE_Angle-W_M-NONE_VL-None_G-NONE_P-OG_S-NONE_FB3950V11,4026 - FB3950V11 Opti || Batch 1 || Enhancements: OFF || CBV1 || 7C || 21/04/25w17,SHARE,$337,"18,535",2025-04-21,2025-05-07,16
94,CB_2025_Apr_FB_4061_SO_V05_4x5_IMG_EN_Opti_C-NONE_Evergreen_CTA-SALE_Angle-W_M-NONE_VL-None_G-NONE_P-NONE_S-NONE_FB4032V01,4061 - FB4032V01 Opti IMG || Batch 2 || Enhancements: OFF || CBV1 || 7C || 05/05/25w19,SHARE,$336,"18,657",2025-05-05,2025-05-08,3
95,CB_2025_Jan_FB_3723_SO_V09_4x5_IMG_EN_New_C-NONE_Evergreen_CTA-SALE_Angle-W_M-NONE_VL-None_G-NONE_P-NONE_S-NONE,3723 - Notion Idea #92 MAN BOOBS || Enhancements: OFF || CBV1 || Batch 2 || 1C || 28/01/25w05 || Kostas,SHARE,$327,"24,635",2025-01-28,2025-05-08,100
96,CB_2024_Nov_FB_3264_LZ_V31_4x5_VID_EN_Opti_C-MakingOf_Sale_CTA-BF_Angle-W-B_M-CRAZY_VL-45s_G-M_P-OG_S-NEW_FB3004V02,CBV2 || EU (UK) || 💰 Advantage+ || US || BROAD || 7C || Existing_customer_5% || 15/12/24 Ad set,VIDEO,$319,"14,131",2024-12-19,2025-05-12,144
97,CB_2025_Apr_FB_4062_SO-JG_V01_4x5_IMG_EN_Opti_C-NONE_Evergreen_CTA-NONE_Angle-W-B-C_M-NONE_VL-None_G-NONE_P-OG_S-NONE_FB3961V07,4062 - FB3961V07 Opti IMG || Batch 1 || Enhancements: OFF || CBV1 || 7C || 05/05/25w19,SHARE,$309,"17,652",2025-05-05,2025-05-08,3
98,CB_2025_Apr_FB_4066_SO_V13_4x5_IMG_EN_Opti_C-NONE_Evergreen_CTA-NONE_Angle-W-B-C_M-NONE_VL-None_G-NONE_P-OG_S-NONE_FB3950V16,4066 - FB3950V16 Opti IMG || Batch 3 || Enhancements: OFF || CBV1 || 7C || 05/05/25w19,SHARE,$308,"17,403",2025-05-05,2025-05-08,3
99,CB_2025_Apr_FB_4041_LZ-DP_V01_9x16_VID_EN_Opti_C-BulletPoints_Evergreen_CTA-SALE_Angle-Energy_M-JANW_VL-30s_G-M_P-ALPHA_S-NEW_FB3883V05,4041 - ALPHA DRIVE 3883V05 opti || shop.colonbroom.com || Batch 1 || Enhancements: OFF || T-Booster || 7C || 08/05/25w19,VIDEO,$302,"14,742",2025-05-08,2025-05-11,3
100,CB_2023_May_FB_2263_MB_V04_9x16_VID_EN_New_C-Sale_CTA-SMR_Pain-W_M-JOG_VL-45s_TR-None_G-M-F_P-None_S-Moon,CBV2 || AU || 💰 Advantage+ || US || BROAD || 7C || Existing_customer_5% || 19/12/24 Ad set,VIDEO,$299,"9,008",2024-12-19,2025-05-12,144
101,CB_2024_Apr_FB_2970_RS_V02_1x1_GIF_EN_Opti_C-WrittenTesti_CTA-CTA_Pain-W_M-NONE_VL-7s_TR-None_G-NONE_P-V2_S-NEW,CBV2 || AU || 💰 Advantage+ || US || BROAD || 7C || Existing_customer_5% || 19/12/24 Ad set,VIDEO,$292,"8,991",2025-04-02,2025-05-12,40
102,CB_2025_Mar_FB_3907_CHUB-AA_V03_4x5_IMG_EN_Opti_C-Price_CTA-NONE_Angle-None_M-NONE_VL-None_TR-None_G-NONE_P-OG_S-NONE.png,US || Quiz: Shopify || 7C || 04/04/25,SHARE,$287,"10,782",2025-04-04,2025-05-11,37
103,CB_2025_Apr_FB_4070_KB_V06_4x5_VID_EN_New_C-NONE_CTA-SALE_Angle-None_M-NONE_VL-None_TR-None_G-F_P-OG_S-NONE,4070 - 3677 opti inspirational quotes || Batch 2 || Enhancements: OFF || CBV1 || 7C || 05/05/25w19,SHARE,$284,"9,677",2025-05-05,2025-05-08,3
104,CB_2025_Jan_FB_3723_SO_V07_4x5_IMG_EN_New_C-NONE_Evergreen_CTA-SALE_Angle-W_M-NONE_VL-None_G-NONE_P-NONE_S-NONE,3723 - Notion Idea #92 MAN BOOBS || Enhancements: OFF || CBV1 || Batch 2 || 1C || 28/01/25w05 || Kostas,SHARE,$280,"18,093",2025-01-28,2025-05-08,100
105,CB_2025_Jan_FB_3757_LZ-DP_V16_9x16_VID_EN_Opti_C-BulletPoints_Evergreen_CTA-NONE_Angle-W-B-C_M-KAIT_VL-30s_G-F_P-GLP1_S-WHAT_FB3592V09,3757 - video winner opti Batch 3+4 || Enhancements: OFF || CBV1 || Batch 4 || 7C || 09/05/25w19 || Valentinas,VIDEO,$276,"16,260",2025-05-09,2025-05-12,3
106,CB_2025_Mar_FB_3914_DT-DP_V01_9x16_VID_EN_New_C-Trend_Sale_CTA-SPRNG_Angle-W-B-C_M-JOG_VL-30s_G-F_P-OG_S-NEW,CBV2 || AU || 💰 Advantage+ || US || BROAD || 7C || Existing_customer_5% || 19/12/24 Ad set,VIDEO,$275,"11,849",2025-04-01,2025-05-12,41
107,CB_2025_Mar_FB_3896_LZ_V02_1x1_IMG_EN_New_C-Headline_Evergreen_CTA-NONE_Angle-W_M-NONE_VL-None_G-M_P-OG_S-NONE,3896 - grill party img || Batch 1 || Enhancements: OFF || CBV1 || 7C || 28/04/25w18,SHARE,$267,"8,592",2025-04-28,2025-05-07,9
108,CB_2025_Feb_FB_3821_SO-KB-JG_V13_4x5_IMG_EN_Opti_C-NONE_Evergreen_CTA-SALE_Angle-W_M-NONE_VL-None_G-NONE_P-NONE_S-NONE_FB3723V07,3821 - Man boobs Opti || Batch 2 || Enhancements: OFF || CBV1 || 7C || 28/04/25w18,SHARE,$261,"9,183",2025-04-28,2025-05-07,9
109,CB_2025_Apr_FB_4070_KB_V10_4x5_VID_EN_New_C-NONE_CTA-SALE_Angle-None_M-NONE_VL-None_TR-None_G-F_P-OG_S-NONE,4070 - 3677 opti inspirational quotes || Batch 3 || Enhancements: OFF || CBV1 || 7C || 05/05/25w19,SHARE,$251,"9,825",2025-05-05,2025-05-09,4
110,CB_2025_Mar_FB_3911_DT_V03_9x16_VID_EN_Opti_C-SingleTesti_Sale_CTA-Patrick_Angle-W_M-TRC_VL-45s_G-F_P-OG_S-MOON_FB2764V04,CBV2 || EU (UK) || 💰 Advantage+ || US || BROAD || 7C || Existing_customer_5% || 15/12/24 Ad set,VIDEO,$246,"11,163",2025-03-17,2025-05-12,56
111,CB_2025_Apr_FB_4051_DT-DP_V02_4x5_IMG_EN_New_C-NONE_Evergreen_CTA-SALE_Angle-W_M-NONE_VL-None_G-NONE_P-OG_S-NONE,4051 - 3723 opti on PCOS || Batch 1 || Enhancements: OFF || CBV1 || 7C || 05/05/25w19,SHARE,$246,"13,910",2025-05-05,2025-05-09,4
112,CB_2025_Apr_FB_4029_LZ-VU_V03_4x5_IMG_EN_Opti_C-Trend_Evergreen_CTA-NONE_Angle-W_M-NONE_VL-None_G-NONE_P-OG_S-NONE_FB3671V03,4029 - diet ad opti summer || Batch 1 || Enhancements: OFF || CBV1 || 7C || 05/05/25w19,SHARE,$243,"11,862",2025-05-05,2025-05-08,3
113,CB_2025_Apr_FB_4052_LZ-DP_V01_4x5_IMG_EN_New_C-Headline_Sale_CTA-SALE_Angle-W_M-NONE_VL-None_G-M_P-OG_S-NONE,"4052 - minimal style ""SUCKS"" ads || Batch 1 || Enhancements: OFF || CBV1 || 7C || 05/05/25w19",SHARE,$243,"8,715",2025-05-05,2025-05-09,4
114,CB_2025_Apr_FB_4039_SO_V01_4x5_IMG_EN_New_C-NONE_Evergreen_CTA-SALE_Angle-W_M-NONE_VL-None_G-NONE_P-NONE_S-NONE,4039 - Minecraft-inspired IMG || Batch 1 || Enhancements: OFF || CBV1 || 7C || 05/05/25w19,SHARE,$227,"9,106",2025-05-05,2025-05-07,2
115,CB_2025_Apr_FB_4059_SO_V03_4x5_IMG_EN_Opti_C-NONE_Evergreen_CTA-SALE_Angle-W_M-NONE_VL-None_G-NONE_P-NONE_S-NONE_4006V02,4059 - FB4006V02 Opti IMG || Batch 1 || Enhancements: OFF || CBV1 || 7C || 05/05/25w19,SHARE,$221,"11,851",2025-05-05,2025-05-08,3
116,CB_2025_Apr_FB_3996_DT-DP_V01_9x16_VID_EN_Opti_C-MakingOf_Evergreen_CTA-CTA_Angle-W-B_M-CRAZY_VL-45s_G-M_P-OG_S-NEW_FB3022V03,CBV2 || AU || 💰 Advantage+ || US || BROAD || 7C || Existing_customer_5% || 19/12/24 Ad set,VIDEO,$214,"10,349",2025-04-22,2025-05-08,16
117,CB_2023_Jul_FB_2226_MB_V04_9x16_VID_EN_Opti_C-Testim_CTA-SMR_Pain-W_M-MIX_VL-30s_TR-None_G-F_P-None_S-Starry,CA || ASC+ || 0% EXISTING || 7DC || 18.03.2025,VIDEO,$214,"10,091",2025-03-18,2025-05-05,48
118,CB_2025_Feb_FB_3827_LZ_V03_1x1_IMG_EN_Opti_C-Headline_Evergreen_CTA-SALE_Angle-W_M-NONE_VL-None_G-M_P-CBV2_S-NONE_FB3705V02,CBV2 || US || Manual Bid: ROAS GOAL: 1.00 -> 1.1 || 7DC || 22/01/2025,SHARE,$208,"9,067",2025-02-18,2025-05-12,83
119,CB_2025_Apr_FB_4062_SO-JG_V05_4x5_IMG_EN_Opti_C-NONE_Evergreen_CTA-NONE_Angle-W-B-C_M-NONE_VL-None_G-NONE_P-OG_S-NONE_FB3961V07,4062 - FB3961V07 Opti IMG || Batch 2 || Enhancements: OFF || CBV1 || 7C || 05/05/25w19,SHARE,$202,"9,136",2025-05-05,2025-05-08,3
120,CB_2025_Jan_FB_3779_VK-DP_V04_1x1_VID_EN_Opti_C-BulletPoints_Evergreen_CTA-70_Angle-W-B-C_M-NONE_VL-None_G-F_P-OG_S-NEW_FB3705V02,3779 - opti 3705 || Enhancements: OFF || CBV1 || Batch 1 || 1C || 04/02/25w06 || Kostas,SHARE,$193,"13,128",2025-02-04,2025-05-09,94
121,CB_2025_Apr_FB_4056_LZ-DP_V02_9x16_VID_EN_New_C-Testimonial_Sale_CTA-SALE_Angle-W_M-JOG_VL-30s_G-F_P-OG_S-MOON,4056 - jogile facetune vid || Batch 1 || Enhancements: OFF || CBV1 || 7C || 05/05/25w19,VIDEO,$192,"9,307",2025-05-05,2025-05-07,2
122,CB_2025_Apr_FB_4069_LZ_V04_4x5_IMG_EN_New_C-Educational_Evergreen_CTA-NONE_Angle-WellBe_M-NONE_VL-None_G-NONE_P-OG_S-NONE,4069 - minimal style health ads || Batch 1 || Enhancements: OFF || CBV1 || 7C || 05/05/25w19,SHARE,$189,"10,534",2025-05-05,2025-05-07,2
123,CB_2025_Apr_FB_4070_KB_V16_4x5_VID_EN_New_C-NONE_CTA-SALE_Angle-None_M-NONE_VL-None_TR-None_G-F_P-OG_S-NONE,4070 - 3677 opti inspirational quotes || Batch 4 || Enhancements: OFF || CBV1 || 7C || 05/05/25w19,SHARE,$186,"8,230",2025-05-05,2025-05-07,2
124,CB_2025_Feb_FB_3860_LZ-DP_V03_9x16_VID_EN_Opti_C-Testimonial_Evergreen_CTA-SALE_Angle-W_M-MOOD_VL-20s_G-M_P-OG_S-WOOD_FB21176V11_1,US || ASC+ || Website + Shop || 7DC || Existing 0% || 24.03.2025 Ad set,VIDEO,$177,"8,064",2025-03-24,2025-05-07,44
125,CB_2025_Apr_FB_4059_SO_V05_4x5_IMG_EN_Opti_C-NONE_Evergreen_CTA-SALE_Angle-W_M-NONE_VL-None_G-NONE_P-NONE_S-NONE_4006V02,4059 - FB4006V02 Opti IMG || Batch 1 || Enhancements: OFF || CBV1 || 7C || 05/05/25w19,SHARE,$171,"10,295",2025-05-05,2025-05-08,3
126,CB_2025_Mar_FB_3890_DT_V04_1x1_IMG_EN_New_C-NONE_Evergreen_CTA-None_Angle-W_M-NONE_VL-None_G-NONE_P-OG_S-NONE,3890 - Your Peak Performance in 6 weeks || Enhancements: OFF || CBV1 || Batch 1 || 7C || 10/03/25w11,SHARE,$171,"7,560",2025-03-12,2025-05-06,55
127,CB_2025_Apr_FB_3996_DT-DP_V02_9x16_VID_EN_Opti_C-MakingOf_Evergreen_CTA-CTA_Angle-W-B_M-CRAZY_VL-45s_G-M_P-OG_S-NEW_FB3022V03,3996 - 3022 V03 opti || Batch 1 || Enhancements: OFF || CBV1 || 7C || 11/04/25w16,VIDEO,$170,"8,985",2025-04-11,2025-05-08,27
128,CB_2025_Apr_FB_4061_SO_V03_4x5_IMG_EN_Opti_C-NONE_Evergreen_CTA-SALE_Angle-W_M-NONE_VL-None_G-NONE_P-NONE_S-NONE_FB4032V01,4061 - FB4032V01 Opti IMG || Batch 1 || Enhancements: OFF || CBV1 || 7C || 05/05/25w19,SHARE,$168,"9,402",2025-05-05,2025-05-08,3
129,CB_2025_Apr_FB_4052_LZ-DP_V07_4x5_IMG_EN_New_C-Headline_Sale_CTA-SALE_Angle-W_M-NONE_VL-None_G-M_P-OG_S-NONE,"4052 - minimal style ""SUCKS"" ads || Batch 1 || Enhancements: OFF || CBV1 || 7C || 05/05/25w19",SHARE,$168,"5,517",2025-05-05,2025-05-09,4
130,CB_2024_Nov_FB_3305_SO-DP_V02_4x5_VID_EN_Opti_C-Sale_CTA-BF_Pain-W_M-Chris_VL-30s_TR-None_G-MF_P-Plan_S-NEW_FB2601V07,CBV2 || AU || 💰 Advantage+ || US || BROAD || 7C || Existing_customer_5% || 19/12/24 Ad set,VIDEO,$165,"6,366",2024-12-19,2025-05-12,144
131,CB_2025_May_FB_4090_SO-KB_V04_4x5_IMG_EN_Opti_C-NONE_Evergreen_CTA-Sale_Angle-W-B-C_M-NONE_VL-None_G-NONE_P-OG_S-NONE_FB3987V09,4090 - eat what you want national day opti | Batch 2 || Enhancements: OFF || CBV1 || 7C || 10/05/25w20,SHARE,$164,"8,737",2025-05-10,2025-05-12,2
132,CB_2025_Apr_FB_4061_SO_V01_4x5_IMG_EN_Opti_C-NONE_Evergreen_CTA-SALE_Angle-W_M-NONE_VL-None_G-NONE_P-NONE_S-NONE_FB4032V01,4061 - FB4032V01 Opti IMG || Batch 1 || Enhancements: OFF || CBV1 || 7C || 05/05/25w19,SHARE,$163,"9,025",2025-05-05,2025-05-08,3
133,CB_2024_Feb_FB_2814_MB-DP_V05_1x1_IMG_EN_New_C-WeightLoss_CTA-None_Pain-W-B-C_M-NONE_VL-None_TR-None_G-NONE_P-V2_S-NONE,CBV2 || EU (UK) || 💰 Advantage+ || US || BROAD || 7C || Existing_customer_5% || 15/12/24 Ad set,SHARE,$158,"7,792",2025-01-31,2025-05-12,101
134,CB_2025_Apr_FB_4062_SO-JG_V07_4x5_IMG_EN_Opti_C-NONE_Evergreen_CTA-NONE_Angle-W-B-C_M-NONE_VL-None_G-NONE_P-OG_S-NONE_FB3961V07,4062 - FB3961V07 Opti IMG || Batch 2 || Enhancements: OFF || CBV1 || 7C || 05/05/25w19,SHARE,$156,"8,596",2025-05-05,2025-05-08,3
135,CB_2025_Apr_FB_4051_DT-DP_V04_4x5_IMG_EN_New_C-NONE_Evergreen_CTA-SALE_Angle-W_M-NONE_VL-None_G-NONE_P-OG_S-NONE,4051 - 3723 opti on PCOS || Batch 1 || Enhancements: OFF || CBV1 || 7C || 05/05/25w19,SHARE,$152,"8,074",2025-05-05,2025-05-09,4
136,CB_2025_Apr_FB_4070_KB_V12_4x5_VID_EN_New_C-NONE_CTA-SALE_Angle-None_M-NONE_VL-None_TR-None_G-F_P-OG_S-NONE,4070 - 3677 opti inspirational quotes || Batch 3 || Enhancements: OFF || CBV1 || 7C || 05/05/25w19,SHARE,$149,"6,367",2025-05-05,2025-05-10,5
137,CB_2025_Apr_FB_4065_LZ-VU_V04_4x5_IMG_EN_Opti_C-NegativeMark_Evergreen_CTA-NONE_Angle-Cort_M-NONE_VL-None_G-NONE_P-NONE_S-NONE_FB3251V01,CBV2 || AU || 💰 Advantage+ || US || BROAD || 7C || Existing_customer_5% || 19/12/24 Ad set,SHARE,$144,"6,331",2025-05-04,2025-05-12,8
138,CB_2025_May_FB_4090_SO-KB_V09_4x5_IMG_EN_Opti_C-NONE_Evergreen_CTA-Sale_Angle-W-B-C_M-NONE_VL-None_G-NONE_P-OG_S-NONE_FB4006V02,4090 - eat what you want national day opti | Batch 3 || Enhancements: OFF || CBV1 || 7C || 10/05/25w20,SHARE,$142,"7,624",2025-05-10,2025-05-12,2
139,CB_2025_Feb_FB_3883_LZ-RP_V05_9x16_VID_EN_Opti_C-BulletPoints_Evergreen_CTA-SALE_Angle-W_M-JANW_VL-30s_G-M_P-OG_S-WHAT_FB2284V05.mp4,US || Quiz: React || 7C || 04/04/25,VIDEO,$140,"5,644",2025-04-04,2025-05-06,32
140,CB_2025_Apr_FB_4066_SO_V09_4x5_IMG_EN_Opti_C-NONE_Evergreen_CTA-NONE_Angle-W-B-C_M-NONE_VL-None_G-NONE_P-OG_S-NONE_FB3950V16,4066 - FB3950V16 Opti IMG || Batch 2 || Enhancements: OFF || CBV1 || 7C || 05/05/25w19,SHARE,$139,"8,287",2025-05-05,2025-05-12,7
141,CB_2025_Apr_FB_4041_LZ-DP_V04_9x16_VID_EN_Opti_C-BulletPoints_Evergreen_CTA-SALE_Angle-Energy_M-JANW_VL-30s_G-M_P-ALPHA_S-NEW_FB3883V05,T-Booster 💪 || ASC+ || US || 5% EXISTING CAP || 7C || 07/05/25 Ad set,VIDEO,$129,"6,444",2025-05-07,2025-05-08,1
142,CB_2025_Apr_FB_4041_LZ-DP_V02_9x16_VID_EN_Opti_C-BulletPoints_Evergreen_CTA-SALE_Angle-Energy_M-JANW_VL-30s_G-M_P-ALPHA_S-NEW_FB3883V05,4041 - ALPHA DRIVE 3883V05 opti || Batch 1 || Enhancements: OFF || T-Booster || 7C || 07/05/25w19,VIDEO,$121,"5,550",2025-05-07,2025-05-08,1
143,CB_2025_Apr_FB_4065_LZ-VU_V04_4x5_IMG_EN_Opti_C-NegativeMark_Evergreen_CTA-NONE_Angle-Cort_M-NONE_VL-None_G-NONE_P-NONE_S-NONE_FB3251V01,🌶️ || US || ASC+ || ->CC141 || VIDEO Only || US+CA || 0% EXISTING CAP || 7C || 07/08.24  Ad set,SHARE,$120,"5,578",2025-05-03,2025-05-05,2
144,CB_2025_Feb_FB_3878_VK_V02_1x1_IMG_EN_New_C-BulletPoints_Evergreen_CTA-NONE_Angle-W-B-C_M-NONE_VL-None_G-NONE_P-OG_S-NEW,3878 - Fat shadow || Batch 1 || Enhancements: OFF || CBV1 || 7C || 28/04/25w18,SHARE,$111,"3,211",2025-04-28,2025-05-05,7
145,CB_2025_Apr_FB_4037_DT-DP_V12_9x16_VID_EN_Opti_C-Benefits_Evergreen_CTA-65_Angle-W-B_M-POW_VL-45s_G-M_P-OG_S-FRIGGA_FB2601V11,4037 - Aaron winner opti with new footage || Batch 4 || Enhancements: OFF || CBV1 || 7C || 28/04/25w18,VIDEO,$111,"5,363",2025-04-28,2025-05-05,7
146,CB_2025_Jan_FB_3722_VK-DP_V02_4x5_IMG_EN_New_C-BulletPoints_Sale_CTA-NY_Angle-W-B-C_M-NONE_VL-None_G-M_P-OG_S-NONE,3734 - NEW IDEA cross out -VK-DP || Batch 1 || Enhancements: OFF || CBV1 || 7C || 28/04/25w18,SHARE,$108,"5,234",2025-04-28,2025-05-05,7
147,CB_2024_Dec_FB_3619_VK-JT_V02_4x5_VID_EN_New_C-BulletPoints_Sale_CTA-NY_Angle-W-B-C_M-NONE_VL-None_G-NONE_P-OG_S-NONE,🌶️ || US || ASC+ || ->CC141 || VIDEO Only || US+CA || 0% EXISTING CAP || 7C || 07/08.24  Ad set,SHARE,$108,"6,575",2024-12-27,2025-05-12,136
148,CB_2025_Apr_FB_4068_LZ_V01_9x16_VID_EN_Opti_C-BulletPoints_Sale_CTA-SALE_Angle-W-B-C_M-JOG_VL-30s_G-F_P-OG_S-WHAT_FB2103V03,4068 - mother's day vid winner opti || Batch 1 || Enhancements: OFF || CBV1 || 7C || 05/05/25w19,VIDEO,$107,"5,113",2025-05-02,2025-05-05,3
149,CB_2025_May_FB_4090_SO-KB_V02_9x16_VID_EN_Opti_C-Testimonial_Evergreen_CTA-SALE_Angle-W-B-C_M-TRC_VL-30s_G-F_P-OG_S-FRIGGA_FB3820V01,4090 - eat what you want national day opti | Batch 1 || Enhancements: OFF || CBV1 || 7C || 10/05/25w20,VIDEO,$107,"5,294",2025-05-10,2025-05-12,2
150,CB_2025_Mar_FB_3902_SO-JT_V03_1x1_IMG_EN_New_C-NONE_Evergreen_CTA-NONE_Angle-W-B-C_M-NONE_VL-None_G-NONE_P-OG_S-NONE,🌶️ || US || ASC+ || ->CC141 || VIDEO Only || US+CA || 0% EXISTING CAP || 7C || 07/08.24  Ad set,SHARE,$104,"3,197",2025-03-25,2025-05-12,48
151,CB_2025_Apr_FB_4070_KB_V11_4x5_VID_EN_New_C-NONE_CTA-SALE_Angle-None_M-NONE_VL-None_TR-None_G-F_P-OG_S-NONE,4070 - 3677 opti inspirational quotes || Batch 3 || Enhancements: OFF || CBV1 || 7C || 05/05/25w19,SHARE,$103,"4,880",2025-05-05,2025-05-10,5
152,CB_2025_Apr_FB_4029_LZ-VU_V04_4x5_IMG_EN_Opti_C-Trend_Evergreen_CTA-NONE_Angle-W_M-NONE_VL-None_G-NONE_P-OG_S-NONE_FB3671V04.pngNE_S-NONE_FB3306V04,4029 - diet ad opti summer || Batch 1 || Enhancements: OFF || CBV1 || 7C || 05/05/25w19,SHARE,$102,"4,669",2025-05-05,2025-05-08,3
153,CB_2024_Feb_FB_2834_DA_V04_4x5_IMG_EN_Opti_C-SingleTesti_CTA-NONE_Pain-W_M-NONE_VL-None_TR-None_G-NONE_P-V2_S-NONE_FB2759V04,CBV2 || AU || 💰 Advantage+ || US || BROAD || 7C || Existing_customer_5% || 19/12/24 Ad set,SHARE,$97,"3,995",2024-12-19,2025-05-12,144
154,CB_2025_Apr_FB_4067_LZ_V01_4x5_IMG_EN_Opti_C-Price_Sale_CTA-SALE_Angle-None_M-NONE_VL-None_G-NONE_P-OG_S-NONE_FB3907V03,4067 - mother's day CHUB winner opti || Batch 1 || Enhancements: OFF || CBV1 || 7C || 05/05/25w19,SHARE,$96,"4,812",2025-05-02,2025-05-12,10
155,CB_2025_Apr_FB_4070_KB_V09_4x5_VID_EN_New_C-NONE_CTA-SALE_Angle-None_M-NONE_VL-None_TR-None_G-F_P-OG_S-NONE,4070 - 3677 opti inspirational quotes || Batch 3 || Enhancements: OFF || CBV1 || 7C || 05/05/25w19,SHARE,$96,"4,488",2025-05-05,2025-05-10,5
156,CB_2024_Sep_FB_3175_DA-KB_V01_1x1_IMG_EN_New_C-ADVRT_Evergreen_CTA-NONE_Angle-W_M-NONE_VL-None_G-NONE_P-CBV2_S-NONE_blog_colonbroomvsmammoth_cv_en,CBV2 || Advantage+ || Advertorial || Higher pricing || US || 0% EXISTING CAP || BROAD || 7C || 20/01/25  Campaign Ad set,SHARE,$94,"4,733",2025-01-20,2025-05-12,112
157,CB_2025_Mar_FB_3914_DT-DP_V01_9x16_VID_EN_New_C-Trend_Sale_CTA-SPRNG_Angle-W-B-C_M-JOG_VL-30s_G-F_P-OG_S-NEW.mp4,US || Quiz: Shopify || 7C || 04/04/25,VIDEO,$93,"2,781",2025-04-04,2025-05-11,37
158,CB_2024_Jan_FB_2784_RS_V02_9x16_VID_EN_Opti_C-Pointing_CTA-SALE_Pain-W_M-JOG_VL-30s_TR-None_G-F_P-OG_S-OLLIE_FB2181V01,CBV2 || EU (UK) || 💰 Advantage+ || US || BROAD || 7C || Existing_customer_5% || 15/12/24 Ad set,VIDEO,$93,"3,645",2025-01-09,2025-05-12,123
159,CB_2025_Apr_FB_4037_DT-DP_V05_9x16_VID_EN_Opti_C-Pointing_Evergreen_CTA-SALE_Angle-W_M-POW_VL-30s_G-M_P-OG_S-MOON_FB3980V08,4037 - Aaron winner opti with new footage || Batch 2 || Enhancements: OFF || CBV1 || 7C || 05/05/25w19,VIDEO,$90,"5,287",2025-05-05,2025-05-09,4
160,CB_2025_Mar_APPLOV_3965_LZ-DP_V03_9x16_VID_EN_Opti_C-Trend_Evergreen_CTA-SALE_Angle-W-B-C_M-MIX_VL-30s_G-MF_P-OG_S-STARRY_FB3914V03,3965 - Applovin 3914 opti || Batch 1 || Enhancements: OFF || CBV1 || 7C || 28/04/25w18,VIDEO,$87,"3,026",2025-04-28,2025-05-05,7
161,CB_2025_Apr_FB_4067_LZ_V02_4x5_IMG_EN_Opti_C-Price_Sale_CTA-SALE_Angle-None_M-NONE_VL-None_G-NONE_P-OG_S-NONE_FB3907V03,4067 - mother's day CHUB winner opti || Batch 1 || Enhancements: OFF || CBV1 || 7C || 05/05/25w19,SHARE,$84,"3,781",2025-05-02,2025-05-12,10
162,CB_2025_Apr_FB_4062_SO-JG_V04_4x5_IMG_EN_Opti_C-NONE_Evergreen_CTA-NONE_Angle-W-B-C_M-NONE_VL-None_G-NONE_P-OG_S-NONE_FB3961V07,4062 - FB3961V07 Opti IMG || Batch 1 || Enhancements: OFF || CBV1 || 7C || 05/05/25w19,SHARE,$83,"4,431",2025-05-05,2025-05-08,3
163,CB_2025_Apr_FB_4066_SO_V15_4x5_IMG_EN_Opti_C-NONE_Evergreen_CTA-NONE_Angle-W-B-C_M-NONE_VL-None_G-NONE_P-OG_S-NONE_FB3950V16,4066 - FB3950V16 Opti IMG || Batch 3 || Enhancements: OFF || CBV1 || 7C || 05/05/25w19,SHARE,$82,"4,124",2025-05-05,2025-05-08,3
164,CB_2025_Jan_FB_3741_LZ-JG_V01_4x5_IMG_EN_Opti_C-Headline_Evergreen_CTA-NONE_Angle-W_M-NONE_VL-None_G-NONE_P-CBV2_S-NONE_FB3357V01,CBV2 || US || Manual Bid: ROAS GOAL: 1.00 -> 1.1 || 7DC || 22/01/2025,SHARE,$81,"3,048",2025-01-22,2025-05-12,110
165,CB_2024_Sep_FB_3175_DA-KB_V03_1x1_IMG_EN_New_C-ADVRT_Evergreen_CTA-NONE_Angle-W_M-NONE_VL-None_G-NONE_P-CBV2_S-NONE_blog_colonbroomvsmammoth_cv_en,CBV2 || Advantage+ || Advertorial || Higher pricing || US || 0% EXISTING CAP || BROAD || 7C || 20/01/25  Campaign Ad set,SHARE,$80,"3,686",2025-01-20,2025-05-12,112
166,CB_2025_Feb_FB_3827_LZ_V03_1x1_IMG_EN_Opti_C-Headline_Evergreen_CTA-SALE_Angle-W_M-NONE_VL-None_G-M_P-CBV2_S-NONE_FB3705V02,⚫️ US || CBV2 || Advantage+ || 7C || BROAD || Existing_customer_0% || || 24/04/25 Ad set,SHARE,$79,"1,833",2025-04-24,2025-05-11,17
167,CB_2025_Apr_FB_4051_DT-DP_V03_4x5_IMG_EN_New_C-NONE_Evergreen_CTA-SALE_Angle-W_M-NONE_VL-None_G-NONE_P-OG_S-NONE,4051 - 3723 opti on PCOS || Batch 1 || Enhancements: OFF || CBV1 || 7C || 05/05/25w19,SHARE,$77,"4,311",2025-05-05,2025-05-09,4
168,CB_2025_Apr_FB_4070_KB_V05_4x5_VID_EN_New_C-NONE_CTA-SALE_Angle-None_M-NONE_VL-None_TR-None_G-F_P-OG_S-NONE,4070 - 3677 opti inspirational quotes || Batch 2 || Enhancements: OFF || CBV1 || 7C || 05/05/25w19,SHARE,$77,"3,050",2025-05-05,2025-05-08,3
169,CB_2025_Apr_FB_4071_KB_V04_4x5_VID_EN_New_C-NONE_CTA-SALE_Angle-None_M-NONE_VL-None_TR-None_G-F_P-OG_S-NONE,4071 - clinically proven weight loss IMG || Batch 1 || Enhancements: OFF || CBV1 || 7C || 05/05/25w19,SHARE,$75,"3,547",2025-05-05,2025-05-07,2
170,CB_2025_Apr_FB_3981_SO_V03_4x5_IMG_EN_New_C-NONE_Evergreen_CTA-SALE_Angle-W_M-NONE_VL-None_G-NONE_P-NONE_S-NONE,US || ASC+ || Website + Shop || 7DC || Existing 0% || 24.03.2025 Ad set,SHARE,$73,"3,831",2025-04-26,2025-05-12,16
171,CB_2025_Apr_FB_4042_SO-DP_V04_4x5_IMG_EN_Opti_C-NONE_Evergreen_CTA-NONE_Angle-Energy_M-NONE_VL-None_G-NONE_P-ALPHA_S-NONE_FB2227V08,4042 - Alpha drive pt.5 IMG || Batch 1 || Enhancements: OFF || T-Booster || 7C || 07/05/25w19,SHARE,$72,"2,561",2025-05-07,2025-05-07,0
172,CB_2025_Apr_FB_4071_KB_V02_4x5_VID_EN_New_C-NONE_CTA-SALE_Angle-None_M-NONE_VL-None_TR-None_G-F_P-OG_S-NONE,4071 - clinically proven weight loss IMG || Batch 1 || Enhancements: OFF || CBV1 || 7C || 05/05/25w19,SHARE,$71,"3,762",2025-05-05,2025-05-07,2
173,CB_2024_Nov_FB_3264_LZ_V31_4x5_VID_EN_Opti_C-MakingOf_Sale_CTA-BF_Angle-W-B_M-CRAZY_VL-45s_G-M_P-OG_S-NEW_FB3004V02,CBV2 || AU || 💰 Advantage+ || US || BROAD || 7C || Existing_customer_5% || 19/12/24 Ad set,VIDEO,$71,"2,439",2024-12-19,2025-05-12,144
174,CB_2025_Apr_FB_4066_SO_V02_4x5_IMG_EN_Opti_C-NONE_Evergreen_CTA-NONE_Angle-W-B-C_M-NONE_VL-None_G-NONE_P-OG_S-NONE_FB3950V16,4066 - FB3950V16 Opti IMG || Batch 1 || Enhancements: OFF || CBV1 || 7C || 05/05/25w19,SHARE,$70,"3,892",2025-05-05,2025-05-09,4
175,CB_2025_Apr_FB_4061_SO_V02_4x5_IMG_EN_Opti_C-NONE_Evergreen_CTA-SALE_Angle-W_M-NONE_VL-None_G-NONE_P-NONE_S-NONE_FB4032V01,4061 - FB4032V01 Opti IMG || Batch 1 || Enhancements: OFF || CBV1 || 7C || 05/05/25w19,SHARE,$70,"3,583",2025-05-05,2025-05-08,3
176,CB_2025_Apr_FB_4039_SO_V04_4x5_IMG_EN_New_C-NONE_Evergreen_CTA-SALE_Angle-W_M-NONE_VL-None_G-NONE_P-NONE_S-NONE,4039 - Minecraft-inspired IMG || Batch 1 || Enhancements: OFF || CBV1 || 7C || 28/04/25w18,SHARE,$69,"2,706",2025-04-28,2025-05-12,14
177,CB_2024_Mar_FB_2888_JG_V01_9x16_IMG_EN_Opti_C-Benefits_CTA-NONE_Pain-W_M-NONE_VL-None_TR-None_G-NONE_P-V2_S-NONE,CBV2 || AU || 💰 Advantage+ || US || BROAD || 7C || Existing_customer_5% || 19/12/24 Ad set,SHARE,$64,"2,360",2024-12-19,2025-05-12,144
178,CB_2025_May_FB_4090_SO-KB_V01_9x16_VID_EN_Opti_C-Testimonial_Evergreen_CTA-SALE_Angle-W-B-C_M-TRC_VL-30s_G-F_P-OG_S-FRIGGA_FB3820V01,4090 - eat what you want national day opti | Batch 1 || Enhancements: OFF || CBV1 || 7C || 10/05/25w20,VIDEO,$63,"3,262",2025-05-10,2025-05-12,2
179,CB_2025_Apr_FB_4041_LZ-DP_V04_9x16_VID_EN_Opti_C-BulletPoints_Evergreen_CTA-SALE_Angle-Energy_M-JANW_VL-30s_G-M_P-ALPHA_S-NEW_FB3883V05,4041 - ALPHA DRIVE 3883V05 opti || shop.colonbroom.com || Batch 1 || Enhancements: OFF || T-Booster || 7C || 08/05/25w19,VIDEO,$63,"2,863",2025-05-08,2025-05-11,3
180,CB_2024_Mar_FB_2888_JG_V02_9x16_IMG_EN_Opti_C-Benefits_CTA-NONE_Pain-W_M-NONE_VL-None_TR-None_G-NONE_P-V2_S-NONE,CBV2 || AU || 💰 Advantage+ || US || BROAD || 7C || Existing_customer_5% || 19/12/24 Ad set,SHARE,$62,"2,639",2024-12-19,2025-05-12,144
181,CB_2025_Apr_FB_4041_LZ-DP_V04_9x16_VID_EN_Opti_C-BulletPoints_Evergreen_CTA-SALE_Angle-Energy_M-JANW_VL-30s_G-M_P-ALPHA_S-NEW_FB3883V05,4041 - ALPHA DRIVE 3883V05 opti || Batch 1 || Enhancements: OFF || T-Booster || 7C || 07/05/25w19,VIDEO,$61,"2,939",2025-05-07,2025-05-08,1
182,CB_2025_Apr_FB_4059_SO_V10_4x5_IMG_EN_Opti_C-NONE_Evergreen_CTA-SALE_Angle-W_M-NONE_VL-None_G-NONE_P-NONE_S-NONE_4006V02,4059 - FB4006V02 Opti IMG || Batch 2 || Enhancements: OFF || CBV1 || 7C || 05/05/25w19,SHARE,$61,"2,885",2025-05-05,2025-05-09,4
183,CB_2023_Dec_FB_2696_RS_V03_9x16_VID_EN_Opti_C-Sale_CTA-NY65_Pain-W-B_M-JANW_VL-30s_TR-None_G-M_P-OG_S-WHAT_FB2284V05,CBV2 || AU || 💰 Advantage+ || US || BROAD || 7C || Existing_customer_5% || 19/12/24 Ad set,VIDEO,$60,"2,518",2025-01-13,2025-05-12,119
184,CB_2025_Apr_FB_4037_DT-DP_V08_9x16_VID_EN_Opti_C-Dance_Sale_CTA-SMR_Angle-W-B_M-POW_VL-30s_G-M_P-OG_S-WHAT_FB3043V03,4037 - Aaron winner opti with new footage || Batch 3 || Enhancements: OFF || CBV1 || 7C || 05/05/25w19,VIDEO,$59,"2,819",2025-05-05,2025-05-09,4
185,CB_2024_Feb_FB_2834_DA_V02_4x5_IMG_EN_Opti_C-SingleTesti_CTA-NONE_Pain-W_M-NONE_VL-None_TR-None_G-NONE_P-V2_S-NONE_FB2759V04,CBV2 || AU || 💰 Advantage+ || US || BROAD || 7C || Existing_customer_5% || 19/12/24 Ad set,SHARE,$58,"2,883",2024-12-19,2025-05-12,144
186,CB_2025_Mar_FB_3949_VK-DP_V01_9x16_VID_EN_New_C-NONE_Evergreen_CTA-NONE_Angle-W-B-C_M-TYL_VL-None_G-M_P-OG_S-NONE,CA || ASC+ || 0% EXISTING || 7DC || 18.03.2025,VIDEO,$56,"2,829",2025-04-03,2025-05-11,38
187,CB_2025_Mar_FB_3909_DT-DP_V03_9x16_VID_EN_New_C-Trend_Evergreen_CTA-SMRBOD_Angle-W-B-C_M-JANW_VL-30s_G-M_P-OG_S-NEW,US || Kilo Product's leads LAL || 7C || 04/03/25,VIDEO,$56,"2,341",2025-04-06,2025-05-12,36
188,CB_2025_Apr_FB_4071_KB_V03_4x5_VID_EN_New_C-NONE_CTA-SALE_Angle-None_M-NONE_VL-None_TR-None_G-F_P-OG_S-NONE,4071 - clinically proven weight loss IMG || Batch 1 || Enhancements: OFF || CBV1 || 7C || 05/05/25w19,SHARE,$55,"2,161",2025-05-05,2025-05-07,2
189,CB_2024_Mar_FB_2888_JG_V03_9x16_IMG_EN_Opti_C-Benefits_CTA-NONE_Pain-W_M-NONE_VL-None_TR-None_G-NONE_P-V2_S-NONE,CBV2 || AU || 💰 Advantage+ || US || BROAD || 7C || Existing_customer_5% || 19/12/24 Ad set,SHARE,$53,"2,232",2024-12-19,2025-05-12,144
190,CB_2025_Apr_FB_4061_SO_V04_4x5_IMG_EN_Opti_C-NONE_Evergreen_CTA-SALE_Angle-W_M-NONE_VL-None_G-NONE_P-NONE_S-NONE_FB4032V01,4061 - FB4032V01 Opti IMG || Batch 2 || Enhancements: OFF || CBV1 || 7C || 05/05/25w19,SHARE,$52,"2,757",2025-05-05,2025-05-08,3
191,CB_2025_Apr_FB_4051_DT-DP_V01_4x5_IMG_EN_New_C-NONE_Evergreen_CTA-SALE_Angle-W_M-NONE_VL-None_G-NONE_P-OG_S-NONE,4051 - 3723 opti on PCOS || Batch 1 || Enhancements: OFF || CBV1 || 7C || 05/05/25w19,SHARE,$48,"2,618",2025-05-05,2025-05-09,4
192,CB_2024_Sep_FB_3175_DA-KB_V02_1x1_IMG_EN_New_C-ADVRT_Evergreen_CTA-NONE_Angle-W_M-NONE_VL-None_G-NONE_P-CBV2_S-NONE_blog_colonbroomvsmammoth_cv_en,CBV2 || Advantage+ || Advertorial || Higher pricing || US || 0% EXISTING CAP || BROAD || 7C || 20/01/25  Campaign Ad set,SHARE,$48,"3,090",2025-01-20,2025-05-12,112
193,CB_2025_May_FB_4090_SO-KB_V08_4x5_IMG_EN_Opti_C-NONE_Evergreen_CTA-Sale_Angle-W-B-C_M-NONE_VL-None_G-NONE_P-OG_S-NONE_FB3987V09,4090 - eat what you want national day opti | Batch 3 || Enhancements: OFF || CBV1 || 7C || 10/05/25w20,SHARE,$48,"2,559",2025-05-10,2025-05-12,2
194,CB_2025_Apr_FB_4069_LZ_V03_4x5_IMG_EN_New_C-Educational_Evergreen_CTA-SALE_Angle-WellBe_M-NONE_VL-None_G-NONE_P-OG_S-NONE,4069 - minimal style health ads || Batch 1 || Enhancements: OFF || CBV1 || 7C || 05/05/25w19,SHARE,$45,"1,901",2025-05-05,2025-05-07,2
195,CB_2025_Apr_FB_4041_LZ-DP_V02_9x16_VID_EN_Opti_C-BulletPoints_Evergreen_CTA-SALE_Angle-Energy_M-JANW_VL-30s_G-M_P-ALPHA_S-NEW_FB3883V05,4041 - ALPHA DRIVE 3883V05 opti || shop.colonbroom.com || Batch 1 || Enhancements: OFF || T-Booster || 7C || 08/05/25w19,VIDEO,$45,"2,370",2025-05-08,2025-05-11,3
196,CB_2025_Apr_FB_4066_SO_V03_4x5_IMG_EN_Opti_C-NONE_Evergreen_CTA-NONE_Angle-W-B-C_M-NONE_VL-None_G-NONE_P-OG_S-NONE_FB3950V16,4066 - FB3950V16 Opti IMG || Batch 1 || Enhancements: OFF || CBV1 || 7C || 05/05/25w19,SHARE,$45,"2,317",2025-05-05,2025-05-09,4
197,CB_2025_May_FB_4090_SO-KB_V03_9x16_VID_EN_Opti_C-Testimonial_Evergreen_CTA-SALE_Angle-W-B-C_M-TRC_VL-30s_G-F_P-OG_S-FRIGGA_FB3820V01,4090 - eat what you want national day opti | Batch 1 || Enhancements: OFF || CBV1 || 7C || 10/05/25w20,VIDEO,$40,"1,915",2025-05-10,2025-05-12,2
198,CB_2025_Jan_FB_3723_SO_V01_4x5_IMG_EN_New_C-NONE_Evergreen_CTA-SALE_Angle-W_M-NONE_VL-None_G-NONE_P-NONE_S-NONE,3723 - Notion Idea #92 MAN BOOBS || Enhancements: OFF || CBV1 || Batch 1 || 1C || 28/01/25w05 || Kostas,SHARE,$37,"2,641",2025-01-28,2025-05-08,100
199,CB_2025_Apr_FB_4052_LZ-DP_V05_4x5_IMG_EN_New_C-Headline_Sale_CTA-SALE_Angle-W_M-NONE_VL-None_G-M_P-OG_S-NONE,"4052 - minimal style ""SUCKS"" ads || Batch 1 || Enhancements: OFF || CBV1 || 7C || 05/05/25w19",SHARE,$37,"1,279",2025-05-05,2025-05-09,4
200,CB_2025_Apr_FB_4062_SO-JG_V06_4x5_IMG_EN_Opti_C-NONE_Evergreen_CTA-NONE_Angle-W-B-C_M-NONE_VL-None_G-NONE_P-OG_S-NONE_FB3961V07,4062 - FB3961V07 Opti IMG || Batch 2 || Enhancements: OFF || CBV1 || 7C || 05/05/25w19,SHARE,$36,"2,153",2025-05-05,2025-05-08,3
201,CB_2025_May_FB_4090_SO-KB_V05_4x5_IMG_EN_Opti_C-NONE_Evergreen_CTA-Sale_Angle-W-B-C_M-NONE_VL-None_G-NONE_P-OG_S-NONE_FB3987V09,4090 - eat what you want national day opti | Batch 2 || Enhancements: OFF || CBV1 || 7C || 10/05/25w20,SHARE,$36,"1,755",2025-05-10,2025-05-12,2
202,CB_2024_Oct_FB_3182_ZS-GC_V13_1x1_IMG_EN_New_C-UsVsThem_Evergreen_CTA-NONE_Angle-B-C_M-NONE_VL-None_G-NONE_P-OG_S-NONE,CBV2 || AU || 💰 Advantage+ || US || BROAD || 7C || Existing_customer_5% || 19/12/24 Ad set,SHARE,$36,"1,814",2024-12-19,2025-05-12,144
203,CB_2025_Jan_FB_3723_SO_V07_4x5_IMG_EN_New_C-NONE_Evergreen_CTA-SALE_Angle-W_M-NONE_VL-None_G-NONE_P-NONE_S-NONE,US || Kilo Product's leads LAL || 7C || 04/03/25,SHARE,$34,"1,364",2025-03-04,2025-05-12,69
204,CB_2025_Apr_FB_4044_LZ-DP_V03_4x5_IMG_EN_New_C-Headline_Evergreen_CTA-SALE_Angle-Energy_M-NONE_VL-None_G-M_P-ALPHA_S-NONE - Copy,T-Booster 💪 || ASC+ || US || 5% EXISTING CAP || 7C || 07/05/25 Ad set,SHARE,$33,"1,406",2025-05-07,2025-05-08,1
205,CB_2025_Apr_FB_4071_KB_V01_4x5_VID_EN_New_C-NONE_CTA-SALE_Angle-None_M-NONE_VL-None_TR-None_G-F_P-OG_S-NONE,4071 - clinically proven weight loss IMG || Batch 1 || Enhancements: OFF || CBV1 || 7C || 05/05/25w19,SHARE,$33,"1,655",2025-05-05,2025-05-07,2
206,CB_2025_Apr_FB_4034_LZ-DP_V01_9x16_VID_EN_Opti_C-BulletPoints_Sale_CTA-SALE_Angle-Energy_M-MIX_VL-30s_G-F_P-ALPHA_S-STARRY_FB3914V01,4034 - Alpha drive 3914 opti man+jog || Batch 1 || Enhancements: OFF || T-Booster || 7C || 07/05/25w19,VIDEO,$33,"1,471",2025-05-07,2025-05-07,0
207,CB_2025_Apr_FB_4070_KB_V14_4x5_VID_EN_New_C-NONE_CTA-SALE_Angle-None_M-NONE_VL-None_TR-None_G-F_P-OG_S-NONE,4070 - 3677 opti inspirational quotes || Batch 4 || Enhancements: OFF || CBV1 || 7C || 05/05/25w19,SHARE,$33,"1,074",2025-05-05,2025-05-07,2
208,CB_2025_Apr_FB_4041_LZ-DP_V04_9x16_VID_EN_Opti_C-BulletPoints_Evergreen_CTA-SALE_Angle-Energy_M-JANW_VL-30s_G-M_P-ALPHA_S-NEW_FB3883V05,4041 - ALPHA DRIVE 3883V05 opti || Plans page || Batch 1 || Enhancements: OFF || T-Booster || 7C || 07/05/25w19,VIDEO,$32,"1,360",2025-05-08,2025-05-08,0
209,CB_2023_Dec_FB_2712_RS-DP_V02_1x1_VID_EN_Opti_C-WrittenTesti_CTA-SALE_Pain-W-B-C_M-NONE_VL-None_TR-None_G-NONE_P-V2_S-NONE_FB2227V08,⚫️ US || CBV2 || Advantage+ || 7C || BROAD || Existing_customer_0% || || 24/04/25 Ad set,VIDEO,$28,"1,402",2025-04-24,2025-05-12,18
210,CB_2025_Apr_FB_4056_LZ-DP_V03_9x16_VID_EN_New_C-Testimonial_Sale_CTA-SALE_Angle-W_M-JOG_VL-30s_G-F_P-OG_S-MOON,4056 - jogile facetune vid || Batch 1 || Enhancements: OFF || CBV1 || 7C || 05/05/25w19,VIDEO,$27,"1,112",2025-05-05,2025-05-07,2
211,CB_2023_May_FB_2016_MB_V04_9x16_VID_EN_Opti_C-Sale_CTA-SMR_Pain-W_M-JOG_VL-30s_TR-None_G-M_P-None_S-What,US || ASC+ || Website + Shop || 7DC || Existing 0% || 24.03.2025 Ad set,VIDEO,$27,"1,171",2025-04-04,2025-05-12,38
212,CB_2025_Apr_FB_4059_SO_V07_4x5_IMG_EN_Opti_C-NONE_Evergreen_CTA-SALE_Angle-W_M-NONE_VL-None_G-NONE_P-NONE_S-NONE_4006V02,4059 - FB4006V02 Opti IMG || Batch 2 || Enhancements: OFF || CBV1 || 7C || 05/05/25w19,SHARE,$26,"1,395",2025-05-05,2025-05-09,4
213,CB_2025_Apr_FB_4066_SO_V10_4x5_IMG_EN_Opti_C-NONE_Evergreen_CTA-NONE_Angle-W-B-C_M-NONE_VL-None_G-NONE_P-OG_S-NONE_FB3950V16,4066 - FB3950V16 Opti IMG || Batch 2 || Enhancements: OFF || CBV1 || 7C || 05/05/25w19,SHARE,$26,"1,741",2025-05-05,2025-05-12,7
214,CB_2025_Apr_FB_4066_SO_V04_4x5_IMG_EN_Opti_C-NONE_Evergreen_CTA-NONE_Angle-W-B-C_M-NONE_VL-None_G-NONE_P-OG_S-NONE_FB3950V16,4066 - FB3950V16 Opti IMG || Batch 1 || Enhancements: OFF || CBV1 || 7C || 05/05/25w19,SHARE,$26,"1,361",2025-05-05,2025-05-09,4
215,CB_2025_Jan_FB_3723_SO_V10_4x5_IMG_EN_New_C-NONE_Evergreen_CTA-SALE_Angle-W_M-NONE_VL-None_G-NONE_P-NONE_S-NONE,3723 - Notion Idea #92 MAN BOOBS || Enhancements: OFF || CBV1 || Batch 2 || 1C || 28/01/25w05 || Kostas,SHARE,$26,"1,448",2025-01-28,2025-05-08,100
216,CB_2025_Apr_FB_4056_LZ-DP_V01_9x16_VID_EN_New_C-Testimonial_Sale_CTA-SALE_Angle-W_M-JOG_VL-30s_G-F_P-OG_S-MOON,4056 - jogile facetune vid || Batch 1 || Enhancements: OFF || CBV1 || 7C || 05/05/25w19,VIDEO,$25,"1,279",2025-05-05,2025-05-07,2
217,CB_2025_Apr_FB_4044_LZ-DP_V04_4x5_IMG_EN_New_C-Headline_Evergreen_CTA-SALE_Angle-Energy_M-NONE_VL-None_G-M_P-ALPHA_S-NONE - Copy,T-Booster 💪 || ASC+ || US || 5% EXISTING CAP || 7C || 07/05/25 Ad set,SHARE,$25,966,2025-05-07,2025-05-08,1
218,CB_2025_Apr_FB_4070_KB_V13_4x5_VID_EN_New_C-NONE_CTA-SALE_Angle-None_M-NONE_VL-None_TR-None_G-F_P-OG_S-NONE,4070 - 3677 opti inspirational quotes || Batch 4 || Enhancements: OFF || CBV1 || 7C || 05/05/25w19,SHARE,$25,"1,060",2025-05-05,2025-05-07,2
219,CB_2023_Aug_FB_2295_MB_V01_1x1_VID_EN_Opti_C-GIF_CTA-CTA_Pain-W-B_M-None_VL-10s_TR-None_G-None_P-None_S-None,CA || COST CAP 92->93 || 7C || 10/05/24 || V1,VIDEO,$24,"1,358",2024-05-10,2025-05-12,367
220,CB_2025_Apr_FB_4029_LZ-VU_V02_4x5_IMG_EN_Opti_C-Trend_Evergreen_CTA-NONE_Angle-W_M-NONE_VL-None_G-NONE_P-OG_S-NONE_FB3671V02,4029 - diet ad opti summer || Batch 1 || Enhancements: OFF || CBV1 || 7C || 05/05/25w19,SHARE,$23,"1,087",2025-05-05,2025-05-08,3
221,CB_2025_Apr_FB_4070_KB_V07_4x5_VID_EN_New_C-NONE_CTA-SALE_Angle-None_M-NONE_VL-None_TR-None_G-F_P-OG_S-NONE,4070 - 3677 opti inspirational quotes || Batch 2 || Enhancements: OFF || CBV1 || 7C || 05/05/25w19,SHARE,$23,990,2025-05-05,2025-05-08,3
222,CB_2025_Apr_FB_4039_SO_V02_4x5_IMG_EN_New_C-NONE_Evergreen_CTA-SALE_Angle-W_M-NONE_VL-None_G-NONE_P-NONE_S-NONE,4039 - Minecraft-inspired IMG || Batch 1 || Enhancements: OFF || CBV1 || 7C || 05/05/25w19,SHARE,$23,979,2025-05-05,2025-05-07,2
223,CB_2025_Apr_FB_4028_LZ-DT_V02_9x16_VID_EN_New_C-BulletPoints_Sale_CTA-SPRING_Angle-W-B-C_M-MAG_VL-30s_G-F_P-OG_S-STARRY,CBV2 || US || Manual Bid: ROAS GOAL: 1.00 -> 1.1 || 7DC || 22/01/2025,VIDEO,$22,686,2025-04-28,2025-05-12,14
224,CB_2025_Apr_FB_4061_SO_V11_4x5_IMG_EN_Opti_C-NONE_Evergreen_CTA-SALE_Angle-W_M-NONE_VL-None_G-NONE_P-NONE_S-NONE_FB4032V01,4061 - FB4032V01 Opti IMG || Batch 4 || Enhancements: OFF || CBV1 || 7C || 05/05/25w19,SHARE,$22,"1,109",2025-05-05,2025-05-09,4
225,CB_2025_Apr_FB_4041_LZ-DP_V02_9x16_VID_EN_Opti_C-BulletPoints_Evergreen_CTA-SALE_Angle-Energy_M-JANW_VL-30s_G-M_P-ALPHA_S-NEW_FB3883V05,4041 - ALPHA DRIVE 3883V05 opti || Plans page || Batch 1 || Enhancements: OFF || T-Booster || 7C || 07/05/25w19,VIDEO,$22,739,2025-05-07,2025-05-08,1
226,CB_2025_Apr_FB_4061_SO_V10_4x5_IMG_EN_Opti_C-NONE_Evergreen_CTA-SALE_Angle-W_M-NONE_VL-None_G-NONE_P-NONE_S-NONE_FB4032V01,4061 - FB4032V01 Opti IMG || Batch 4 || Enhancements: OFF || CBV1 || 7C || 05/05/25w19,SHARE,$21,"1,017",2025-05-05,2025-05-09,4
227,CB_2025_Mar_FB_3896_LZ_V01_1x1_IMG_EN_New_C-Headline_Evergreen_CTA-NONE_Angle-W_M-NONE_VL-None_G-M_P-OG_S-NONE,3896 - grill party img || Batch 1 || Enhancements: OFF || CBV1 || 7C || 28/04/25w18,SHARE,$21,563,2025-04-28,2025-05-07,9
228,CB_2025_Apr_FB_4066_SO_V07_4x5_IMG_EN_Opti_C-NONE_Evergreen_CTA-NONE_Angle-W-B-C_M-NONE_VL-None_G-NONE_P-OG_S-NONE_FB3950V16,4066 - FB3950V16 Opti IMG || Batch 2 || Enhancements: OFF || CBV1 || 7C || 05/05/25w19,SHARE,$20,"1,199",2025-05-05,2025-05-12,7
229,CB_2025_Mar_APPLOV_3965_LZ-DP_V01_9x16_VID_EN_Opti_C-Trend_Evergreen_CTA-SALE_Angle-W-B-C_M-MIX_VL-30s_G-MF_P-OG_S-STARRY_FB3914V01,3965 - Applovin 3914 opti || Batch 1 || Enhancements: OFF || CBV1 || 7C || 28/04/25w18,VIDEO,$20,997,2025-04-28,2025-05-05,7
230,CB_2025_Apr_FB_4061_SO_V08_4x5_IMG_EN_Opti_C-NONE_Evergreen_CTA-SALE_Angle-W_M-NONE_VL-None_G-NONE_P-NONE_S-NONE_FB4032V01,4061 - FB4032V01 Opti IMG || Batch 3 || Enhancements: OFF || CBV1 || 7C || 05/05/25w19,SHARE,$19,987,2025-05-05,2025-05-08,3
231,CB_2025_Apr_FB_4034_LZ-DP_V02_9x16_VID_EN_Opti_C-BulletPoints_Sale_CTA-SALE_Angle-Energy_M-MIX_VL-30s_G-F_P-ALPHA_S-STARRY_FB3914V01,T-Booster 💪 || ASC+ || US || 5% EXISTING CAP || 7C || 07/05/25 Ad set,VIDEO,$19,944,2025-05-07,2025-05-08,1
232,CB_2024_Jan_FB_2731_VK-MB-DP_V12_9x16_VID_EN_Opti_C-Sale_CTA-SMR_Pain-W_M-JANW_VL-30s_TR-None_G-M_P-V2_S-WHAT_FB2103V02 - Copy,⚫️ US || CBV2 || Advantage+ || 7C || BROAD || Existing_customer_0% || || 24/04/25 Ad set,VIDEO,$18,"1,089",2025-04-24,2025-05-12,18
233,CB_2025_Apr_FB_4039_SO_V04_4x5_IMG_EN_New_C-NONE_Evergreen_CTA-SALE_Angle-W_M-NONE_VL-None_G-NONE_P-NONE_S-NONE,4039 - Minecraft-inspired IMG || Batch 1 || Enhancements: OFF || CBV1 || 7C || 05/05/25w19,SHARE,$18,752,2025-05-05,2025-05-07,2
234,CB_2025_Apr_FB_4052_LZ-DP_V02_4x5_IMG_EN_New_C-Headline_Sale_CTA-SALE_Angle-W_M-NONE_VL-None_G-M_P-OG_S-NONE,"4052 - minimal style ""SUCKS"" ads || Batch 1 || Enhancements: OFF || CBV1 || 7C || 05/05/25w19",SHARE,$18,539,2025-05-05,2025-05-09,4
235,CB_2025_Apr_FB_4037_DT-DP_V06_9x16_VID_EN_Opti_C-Pointing_Evergreen_CTA-SALE_Angle-W_M-POW_VL-30s_G-M_P-OG_S-MOON_FB3980V08,4037 - Aaron winner opti with new footage || Batch 2 || Enhancements: OFF || CBV1 || 7C || 05/05/25w19,VIDEO,$18,805,2025-05-05,2025-05-09,4
236,CB_2025_Apr_FB_4056_LZ-DP_V04_9x16_VID_EN_New_C-Testimonial_Sale_CTA-SALE_Angle-W_M-JOG_VL-30s_G-F_P-OG_S-MOON,4056 - jogile facetune vid || Batch 1 || Enhancements: OFF || CBV1 || 7C || 05/05/25w19,VIDEO,$17,884,2025-05-05,2025-05-07,2
237,CB_2025_Apr_FB_4042_SO-DP_V03_4x5_IMG_EN_Opti_C-NONE_Evergreen_CTA-NONE_Angle-Energy_M-NONE_VL-None_G-NONE_P-ALPHA_S-NONE_FB2227V08,4042 - Alpha drive pt.5 IMG || Batch 1 || Enhancements: OFF || T-Booster || 7C || 07/05/25w19,SHARE,$17,714,2025-05-07,2025-05-07,0
238,CB_2025_Apr_FB_4041_LZ-DP_V04_9x16_VID_EN_Opti_C-BulletPoints_Evergreen_CTA-SALE_Angle-Energy_M-JANW_VL-30s_G-M_P-ALPHA_S-NEW_FB3883V05,4041 - ALPHA DRIVE 3883V05 opti || Trial event || Batch 1 || Enhancements: OFF || T-Booster || 7C || 07/05/25w19,VIDEO,$17,539,2025-05-08,2025-05-08,0
239,CB_2025_Apr_FB_4042_SO-DP_V04_4x5_IMG_EN_Opti_C-NONE_Evergreen_CTA-NONE_Angle-Energy_M-NONE_VL-None_G-NONE_P-ALPHA_S-NONE_FB2227V08,T-Booster 💪 || ASC+ || US || 5% EXISTING CAP || 7C || 07/05/25 Ad set,SHARE,$17,625,2025-05-07,2025-05-08,1
240,CB_2025_Apr_FB_4054_LZ-DP_V02_9x16_VID_EN_Opti_C-MakingOf_Sale_CTA-SALE_Angle-W_M-PASQ_VL-30s_G-M_P-OG_S-NEW_FB3995V01,4054 - 3995 opti pasqualino || Batch 1 || Enhancements: OFF || CBV1 || 7C || 05/05/25w19,VIDEO,$16,897,2025-05-05,2025-05-08,3
241,CB_2025_Mar_FB_3914_DT-DP_V01_9x16_VID_EN_New_C-Trend_Sale_CTA-SPRNG_Angle-W-B-C_M-JOG_VL-30s_G-F_P-OG_S-NEW.mp4,US || Quiz: React || 7C || 04/04/25,VIDEO,$16,461,2025-04-04,2025-05-06,32
242,CB_2025_Jan_FB_3757_LZ-DP_V17_9x16_VID_EN_Opti_C-NegativeMark_Evergreen_CTA-NONE_Angle-W_M-ATBJ_VL-45s_G-F_P-GLP1_S-MOON_FB3626V01.mp4,3757 - video winner opti Batch 3+4 || Enhancements: OFF || CBV1 || Batch 4 || 7C || 09/05/25w19 || Valentinas,VIDEO,$16,632,2025-05-09,2025-05-12,3
243,CB_2025_May_FB_4090_SO-KB_V07_4x5_IMG_EN_Opti_C-NONE_Evergreen_CTA-Sale_Angle-W-B-C_M-NONE_VL-None_G-NONE_P-OG_S-NONE_FB3987V09,4090 - eat what you want national day opti | Batch 2 || Enhancements: OFF || CBV1 || 7C || 10/05/25w20,SHARE,$16,798,2025-05-10,2025-05-12,2
244,CB_2025_Apr_FB_4026_SO_V04_4x5_IMG_EN_Opti_C-NONE_Evergreen_CTA-NONE_Angle-W_M-NONE_VL-None_G-NONE_P-OG_S-NONE_FB3950V11,4026 - FB3950V11 Opti || Batch 1 || Enhancements: OFF || CBV1 || 7C || 21/04/25w17,SHARE,$16,851,2025-04-21,2025-05-07,16
245,CB_2025_Apr_FB_4065_LZ-VU_V03_4x5_IMG_EN_Opti_C-NegativeMark_Evergreen_CTA-NONE_Angle-Cort_M-NONE_VL-None_G-NONE_P-NONE_S-NONE_FB3251V01,4065 - its not cheap summer || Batch 1 || Enhancements: OFF || CBV1 || 7C || 29/04/25w18,SHARE,$15,760,2025-04-29,2025-05-08,9
246,CB_2025_Apr_FB_4052_LZ-DP_V06_4x5_IMG_EN_New_C-Headline_Sale_CTA-SALE_Angle-W_M-NONE_VL-None_G-M_P-OG_S-NONE,"4052 - minimal style ""SUCKS"" ads || Batch 1 || Enhancements: OFF || CBV1 || 7C || 05/05/25w19",SHARE,$15,552,2025-05-05,2025-05-09,4
247,CB_2025_Apr_FB_4069_LZ_V02_4x5_IMG_EN_New_C-Educational_Evergreen_CTA-NONE_Angle-WellBe_M-NONE_VL-None_G-NONE_P-OG_S-NONE,4069 - minimal style health ads || Batch 1 || Enhancements: OFF || CBV1 || 7C || 05/05/25w19,SHARE,$15,783,2025-05-05,2025-05-07,2
248,CB_2025_May_FB_4090_SO-KB_V10_4x5_IMG_EN_Opti_C-NONE_Evergreen_CTA-Sale_Angle-W-B-C_M-NONE_VL-None_G-NONE_P-OG_S-NONE_FB4006V02,4090 - eat what you want national day opti | Batch 3 || Enhancements: OFF || CBV1 || 7C || 10/05/25w20,SHARE,$14,771,2025-05-10,2025-05-12,2
249,CB_2025_May_FB_4090_SO-KB_V11_4x5_IMG_EN_Opti_C-NONE_Evergreen_CTA-Sale_Angle-W-B-C_M-NONE_VL-None_G-NONE_P-OG_S-NONE_FB4006V02,4090 - eat what you want national day opti | Batch 3 || Enhancements: OFF || CBV1 || 7C || 10/05/25w20,SHARE,$14,813,2025-05-10,2025-05-12,2
250,CB_2025_Feb_FB_3827_LZ_V03_1x1_IMG_EN_Opti_C-Headline_Evergreen_CTA-SALE_Angle-W_M-NONE_VL-None_G-M_P-CBV2_S-NONE_FB3705V02,⚫️ US || CBV2 || Advantage+ || 7C || BROAD || Existing_customer_0% || || 24/04/25 Ad set,SHARE,$14,381,2025-04-25,2025-05-12,17
251,CB_2025_Apr_FB_4061_SO_V06_4x5_IMG_EN_Opti_C-NONE_Evergreen_CTA-SALE_Angle-W_M-NONE_VL-None_G-NONE_P-NONE_S-NONE_FB4032V01,4061 - FB4032V01 Opti IMG || Batch 2 || Enhancements: OFF || CBV1 || 7C || 05/05/25w19,SHARE,$14,662,2025-05-05,2025-05-08,3
252,CB_2025_Apr_FB_4042_SO-DP_V02_4x5_IMG_EN_Opti_C-NONE_Evergreen_CTA-NONE_Angle-Energy_M-NONE_VL-None_G-NONE_P-ALPHA_S-NONE_FB2227V08,4042 - Alpha drive pt.5 IMG || Batch 1 || Enhancements: OFF || T-Booster || 7C || 07/05/25w19,SHARE,$13,511,2025-05-07,2025-05-07,0
253,CB_2025_Apr_FB_4029_LZ-VU_V01_4x5_IMG_EN_Opti_C-Trend_Evergreen_CTA-NONE_Angle-W_M-NONE_VL-None_G-NONE_P-OG_S-NONE_FB3671V01,4029 - diet ad opti summer || Batch 1 || Enhancements: OFF || CBV1 || 7C || 05/05/25w19,SHARE,$13,650,2025-05-05,2025-05-08,3
254,CB_2025_Apr_FB_4069_LZ_V01_4x5_IMG_EN_New_C-Educational_Evergreen_CTA-NONE_Angle-WellBe_M-NONE_VL-None_G-NONE_P-OG_S-NONE,4069 - minimal style health ads || Batch 1 || Enhancements: OFF || CBV1 || 7C || 05/05/25w19,SHARE,$13,598,2025-05-05,2025-05-07,2
255,CB_2025_Jan_FB_3779_VK-DP_V01_1x1_VID_EN_Opti_C-BulletPoints_Evergreen_CTA-70_Angle-W-B-C_M-NONE_VL-None_G-F_P-OG_S-NEW_FB3705V02,3779 - opti 3705 || Enhancements: OFF || CBV1 || Batch 1 || 1C || 04/02/25w06 || Kostas,SHARE,$13,762,2025-02-04,2025-05-09,94
256,CB_2025_Apr_FB_4066_SO_V12_4x5_IMG_EN_Opti_C-NONE_Evergreen_CTA-NONE_Angle-W-B-C_M-NONE_VL-None_G-NONE_P-OG_S-NONE_FB3950V16,4066 - FB3950V16 Opti IMG || Batch 3 || Enhancements: OFF || CBV1 || 7C || 05/05/25w19,SHARE,$12,504,2025-05-05,2025-05-06,1
257,CB_2025_Apr_FB_4070_KB_V02_4x5_VID_EN_New_C-NONE_CTA-SALE_Angle-None_M-NONE_VL-None_TR-None_G-F_P-OG_S-NONE,4070 - 3677 opti inspirational quotes || Batch 1 || Enhancements: OFF || CBV1 || 7C || 05/05/25w19,SHARE,$11,428,2025-05-05,2025-05-09,4
258,CB_2025_Apr_FB_4040_SO_V11_4x5_IMG_EN_New_C-NONE_Evergreen_CTA-SALE_Angle-W_M-NONE_VL-None_G-NONE_P-NONE_S-NONE,4040 - Game style happy street IMG || Batch 3 || Enhancements: OFF || CBV1 || 7C || 28/04/25w18,SHARE,$11,532,2025-04-28,2025-05-12,14
259,CB_2025_Jan_FB_3723_SO_V05_4x5_IMG_EN_New_C-NONE_Evergreen_CTA-SALE_Angle-W_M-NONE_VL-None_G-NONE_P-NONE_S-NONE,3723 - Notion Idea #92 MAN BOOBS || Enhancements: OFF || CBV1 || Batch 1 || 1C || 28/01/25w05 || Kostas,SHARE,$11,835,2025-01-28,2025-05-08,100
260,CB_2025_Apr_FB_4052_LZ-DP_V03_4x5_IMG_EN_New_C-Headline_Sale_CTA-SALE_Angle-W_M-NONE_VL-None_G-M_P-OG_S-NONE,"4052 - minimal style ""SUCKS"" ads || Batch 1 || Enhancements: OFF || CBV1 || 7C || 05/05/25w19",SHARE,$11,436,2025-05-05,2025-05-09,4
261,CB_2025_Apr_FB_4054_LZ-DP_V03_9x16_VID_EN_Opti_C-MakingOf_Sale_CTA-SALE_Angle-W_M-PASQ_VL-30s_G-M_P-OG_S-NEW_FB3995V01,4054 - 3995 opti pasqualino || Batch 1 || Enhancements: OFF || CBV1 || 7C || 05/05/25w19,VIDEO,$11,517,2025-05-05,2025-05-08,3
262,CB_2025_Apr_FB_3961_SO-JG_V08_4x5_IMG_EN_New_C-NONE_Evergreen_CTA-NONE_Angle-W-B-C_M-NONE_VL-None_G-NONE_P-OG_S-NONE,3961 - Action Figur || Batch 3 || Enhancements: OFF || CBV1 || 7C || 14/04/25w16,SHARE,$11,631,2025-04-14,2025-05-08,24
263,CB_2025_Apr_FB_4052_LZ-DP_V04_4x5_IMG_EN_New_C-Headline_Sale_CTA-SALE_Angle-W_M-NONE_VL-None_G-M_P-OG_S-NONE,"4052 - minimal style ""SUCKS"" ads || Batch 1 || Enhancements: OFF || CBV1 || 7C || 05/05/25w19",SHARE,$11,231,2025-05-05,2025-05-09,4
264,CB_2025_Apr_FB_4041_LZ-DP_V01_9x16_VID_EN_Opti_C-BulletPoints_Evergreen_CTA-SALE_Angle-Energy_M-JANW_VL-30s_G-M_P-ALPHA_S-NEW_FB3883V05,4041 - ALPHA DRIVE 3883V05 opti || Plans page || Batch 1 || Enhancements: OFF || T-Booster || 7C || 07/05/25w19,VIDEO,$11,352,2025-05-08,2025-05-08,0
265,CB_2025_Apr_FB_4034_LZ-DP_V02_9x16_VID_EN_Opti_C-BulletPoints_Sale_CTA-SALE_Angle-Energy_M-MIX_VL-30s_G-F_P-ALPHA_S-STARRY_FB3914V01,4034 - Alpha drive 3914 opti man+jog || Batch 1 || Enhancements: OFF || T-Booster || 7C || 07/05/25w19,VIDEO,$10,440,2025-05-07,2025-05-07,0
266,CB_2025_Apr_FB_4059_SO_V08_4x5_IMG_EN_Opti_C-NONE_Evergreen_CTA-SALE_Angle-W_M-NONE_VL-None_G-NONE_P-NONE_S-NONE_4006V02,4059 - FB4006V02 Opti IMG || Batch 2 || Enhancements: OFF || CBV1 || 7C || 05/05/25w19,SHARE,$10,536,2025-05-05,2025-05-09,4
267,CB_2025_Apr_FB_4070_KB_V01_4x5_VID_EN_New_C-NONE_CTA-SALE_Angle-None_M-NONE_VL-None_TR-None_G-F_P-OG_S-NONE,4070 - 3677 opti inspirational quotes || Batch 1 || Enhancements: OFF || CBV1 || 7C || 05/05/25w19,SHARE,$10,433,2025-05-05,2025-05-09,4
268,CB_2025_Apr_FB_4062_SO-JG_V08_4x5_IMG_EN_Opti_C-NONE_Evergreen_CTA-NONE_Angle-W-B-C_M-NONE_VL-None_G-NONE_P-OG_S-NONE_FB3961V07,4062 - FB3961V07 Opti IMG || Batch 2 || Enhancements: OFF || CBV1 || 7C || 05/05/25w19,SHARE,$9,433,2025-05-05,2025-05-08,3
269,CB_2025_Apr_FB_4059_SO_V01_4x5_IMG_EN_Opti_C-NONE_Evergreen_CTA-SALE_Angle-W_M-NONE_VL-None_G-NONE_P-NONE_S-NONE_4006V02,4059 - FB4006V02 Opti IMG || Batch 1 || Enhancements: OFF || CBV1 || 7C || 05/05/25w19,SHARE,$9,353,2025-05-05,2025-05-08,3
270,CB_2025_Mar_FB_3914_DT-DP_V01_9x16_VID_EN_New_C-Trend_Sale_CTA-SPRNG_Angle-W-B-C_M-JOG_VL-30s_G-F_P-OG_S-NEW,US || Kilo Product's leads LAL || 7C || 04/03/25,VIDEO,$9,141,2025-04-06,2025-05-12,36
271,CB_2025_Apr_FB_4034_LZ-DP_V03_9x16_VID_EN_Opti_C-BulletPoints_Sale_CTA-SALE_Angle-Energy_M-MIX_VL-30s_G-F_P-ALPHA_S-STARRY_FB3914V01,T-Booster 💪 || ASC+ || US || 5% EXISTING CAP || 7C || 07/05/25 Ad set,VIDEO,$9,425,2025-05-07,2025-05-08,1
272,CB_2025_Apr_FB_4037_DT-DP_V03_9x16_VID_EN_Opti_C-Dance_Evergreen_CTA-65_Angle-W_M-POW_VL-30s_G-M_P-OG_S-WOOD_FB3850V04,4037 - Aaron winner opti with new footage || Batch 1 || Enhancements: OFF || CBV1 || 7C || 05/05/25w19,VIDEO,$8,342,2025-05-05,2025-05-07,2
273,CB_2025_Apr_FB_3980_LZ-KB_V08_9x16_VID_EN_Opti_C-Pointing_Evergreen_CTA-SALE_Angle-W_M-POW_VL-30s_G-M_P-OG_S-MOON_FB2036V03,US || Kilo Product's leads LAL || 7C || 04/03/25,VIDEO,$8,229,2025-04-14,2025-05-12,28
274,CB_2025_Apr_FB_4042_SO-DP_V03_4x5_IMG_EN_Opti_C-NONE_Evergreen_CTA-NONE_Angle-Energy_M-NONE_VL-None_G-NONE_P-ALPHA_S-NONE_FB2227V08,T-Booster 💪 || ASC+ || US || 5% EXISTING CAP || 7C || 07/05/25 Ad set,SHARE,$8,388,2025-05-07,2025-05-08,1
275,CB_2025_Apr_FB_4044_LZ-DP_V02_4x5_IMG_EN_New_C-Headline_Evergreen_CTA-SALE_Angle-Energy_M-NONE_VL-None_G-M_P-ALPHA_S-NONE - Copy,T-Booster 💪 || ASC+ || US || 5% EXISTING CAP || 7C || 07/05/25 Ad set,SHARE,$8,286,2025-05-07,2025-05-08,1
276,CB_2025_Apr_FB_4026_SO_V03_4x5_IMG_EN_Opti_C-NONE_Evergreen_CTA-NONE_Angle-W_M-NONE_VL-None_G-NONE_P-OG_S-NONE_FB3950V11,4026 - FB3950V11 Opti || Batch 1 || Enhancements: OFF || CBV1 || 7C || 21/04/25w17,SHARE,$8,350,2025-04-21,2025-05-07,16
277,CB_2025_Apr_FB_4034_LZ-DP_V03_9x16_VID_EN_Opti_C-BulletPoints_Sale_CTA-SALE_Angle-Energy_M-MIX_VL-30s_G-F_P-ALPHA_S-STARRY_FB3914V01,4034 - Alpha drive 3914 opti man+jog || Batch 1 || Enhancements: OFF || T-Booster || 7C || 07/05/25w19,VIDEO,$8,329,2025-05-07,2025-05-07,0
278,CB_2025_Apr_FB_4042_SO-DP_V02_4x5_IMG_EN_Opti_C-NONE_Evergreen_CTA-NONE_Angle-Energy_M-NONE_VL-None_G-NONE_P-ALPHA_S-NONE_FB2227V08,T-Booster 💪 || ASC+ || US || 5% EXISTING CAP || 7C || 07/05/25 Ad set,SHARE,$8,319,2025-05-07,2025-05-08,1
279,CB_2025_Apr_FB_4041_LZ-DP_V01_9x16_VID_EN_Opti_C-BulletPoints_Evergreen_CTA-SALE_Angle-Energy_M-JANW_VL-30s_G-M_P-ALPHA_S-NEW_FB3883V05,T-Booster 💪 || ASC+ || US || 5% EXISTING CAP || 7C || 07/05/25 Ad set,VIDEO,$8,256,2025-05-07,2025-05-08,1
280,CB_2025_Apr_FB_4039_SO_V03_4x5_IMG_EN_New_C-NONE_Evergreen_CTA-SALE_Angle-W_M-NONE_VL-None_G-NONE_P-NONE_S-NONE,4039 - Minecraft-inspired IMG || Batch 1 || Enhancements: OFF || CBV1 || 7C || 28/04/25w18,SHARE,$8,277,2025-04-28,2025-05-12,14
281,CB_2025_Apr_FB_4034_LZ-DP_V04_9x16_VID_EN_Opti_C-BulletPoints_Sale_CTA-SALE_Angle-Energy_M-MIX_VL-30s_G-F_P-ALPHA_S-STARRY_FB3914V01,T-Booster 💪 || ASC+ || US || 5% EXISTING CAP || 7C || 07/05/25 Ad set,VIDEO,$7,312,2025-05-07,2025-05-08,1
282,CB_2025_Apr_FB_4041_LZ-DP_V03_9x16_VID_EN_Opti_C-BulletPoints_Evergreen_CTA-SALE_Angle-Energy_M-JANW_VL-30s_G-M_P-ALPHA_S-NEW_FB3883V05,4041 - ALPHA DRIVE 3883V05 opti || Batch 1 || Enhancements: OFF || T-Booster || 7C || 07/05/25w19,VIDEO,$7,334,2025-05-07,2025-05-08,1
283,CB_2025_Apr_FB_4044_LZ-DP_V01_4x5_IMG_EN_New_C-Headline_Evergreen_CTA-SALE_Angle-Energy_M-NONE_VL-None_G-M_P-ALPHA_S-NONE - Copy,T-Booster 💪 || ASC+ || US || 5% EXISTING CAP || 7C || 07/05/25 Ad set,SHARE,$7,335,2025-05-07,2025-05-08,1
284,CB_2025_Apr_FB_4066_SO_V01_4x5_IMG_EN_Opti_C-NONE_Evergreen_CTA-NONE_Angle-W-B-C_M-NONE_VL-None_G-NONE_P-OG_S-NONE_FB3950V16,4066 - FB3950V16 Opti IMG || Batch 1 || Enhancements: OFF || CBV1 || 7C || 05/05/25w19,SHARE,$7,419,2025-05-05,2025-05-09,4
285,CB_2025_Apr_FB_4062_SO-JG_V03_4x5_IMG_EN_Opti_C-NONE_Evergreen_CTA-NONE_Angle-W-B-C_M-NONE_VL-None_G-NONE_P-OG_S-NONE_FB3961V07,4062 - FB3961V07 Opti IMG || Batch 1 || Enhancements: OFF || CBV1 || 7C || 05/05/25w19,SHARE,$7,315,2025-05-05,2025-05-08,3
286,CB_2025_Apr_FB_4062_SO-JG_V02_4x5_IMG_EN_Opti_C-NONE_Evergreen_CTA-NONE_Angle-W-B-C_M-NONE_VL-None_G-NONE_P-OG_S-NONE_FB3961V07,4062 - FB3961V07 Opti IMG || Batch 1 || Enhancements: OFF || CBV1 || 7C || 05/05/25w19,SHARE,$7,335,2025-05-05,2025-05-08,3
287,CB_2025_Apr_FB_4066_SO_V14_4x5_IMG_EN_Opti_C-NONE_Evergreen_CTA-NONE_Angle-W-B-C_M-NONE_VL-None_G-NONE_P-OG_S-NONE_FB3950V16,4066 - FB3950V16 Opti IMG || Batch 3 || Enhancements: OFF || CBV1 || 7C || 05/05/25w19,SHARE,$6,284,2025-05-05,2025-05-08,3
288,CB_2025_Apr_FB_4034_LZ-DP_V04_9x16_VID_EN_Opti_C-BulletPoints_Sale_CTA-SALE_Angle-Energy_M-MIX_VL-30s_G-F_P-ALPHA_S-STARRY_FB3914V01,4034 - Alpha drive 3914 opti man+jog || Batch 1 || Enhancements: OFF || T-Booster || 7C || 07/05/25w19,VIDEO,$6,294,2025-05-07,2025-05-07,0
289,CB_2024_Jan_FB_2762_IK_V04_1x1_IMG_EN_New_C-WrittenTesti_CTA-CTA_Pain-W-B-C_M-NONE_VL-None_TR-None_G-NONE_P-V2_S-NONE,CBV2 || AU || 💰 Advantage+ || US || BROAD || 7C || Existing_customer_5% || 19/12/24 Ad set,SHARE,$6,229,2024-12-19,2025-05-12,144
290,CB_2025_Apr_FB_4059_SO_V02_4x5_IMG_EN_Opti_C-NONE_Evergreen_CTA-SALE_Angle-W_M-NONE_VL-None_G-NONE_P-NONE_S-NONE_4006V02,4059 - FB4006V02 Opti IMG || Batch 1 || Enhancements: OFF || CBV1 || 7C || 05/05/25w19,SHARE,$6,261,2025-05-05,2025-05-08,3
291,CB_2025_Apr_FB_4039_SO_V02_4x5_IMG_EN_New_C-NONE_Evergreen_CTA-SALE_Angle-W_M-NONE_VL-None_G-NONE_P-NONE_S-NONE,4039 - Minecraft-inspired IMG || Batch 1 || Enhancements: OFF || CBV1 || 7C || 28/04/25w18,SHARE,$6,267,2025-04-28,2025-05-12,14
292,CB_2025_Jan_FB_3723_SO_V03_4x5_IMG_EN_New_C-NONE_Evergreen_CTA-SALE_Angle-W_M-NONE_VL-None_G-NONE_P-NONE_S-NONE,3723 - Notion Idea #92 MAN BOOBS || Enhancements: OFF || CBV1 || Batch 1 || 1C || 28/01/25w05 || Kostas,SHARE,$6,280,2025-01-28,2025-05-08,100
293,CB_2025_Apr_FB_4059_SO_V09_4x5_IMG_EN_Opti_C-NONE_Evergreen_CTA-SALE_Angle-W_M-NONE_VL-None_G-NONE_P-NONE_S-NONE_4006V02,4059 - FB4006V02 Opti IMG || Batch 2 || Enhancements: OFF || CBV1 || 7C || 05/05/25w19,SHARE,$6,374,2025-05-05,2025-05-09,4
294,CB_2025_Mar_FB_3924_SO-DP_V04_1x1_IMG_EN_New_C-NONE_Evergreen_CTA-NONE_Angle-W-B-C_M-NONE_VL-None_G-NONE_P-OG_S-NONE,3924 - #17 man boobs/dad bod body text IMG || Batch 1 || Enhancements: OFF || CBV1 || 7C || 24/03/25w13,SHARE,$5,173,2025-03-24,2025-05-06,43
295,CB_2025_Apr_FB_4034_LZ-DP_V01_9x16_VID_EN_Opti_C-BulletPoints_Sale_CTA-SALE_Angle-Energy_M-MIX_VL-30s_G-F_P-ALPHA_S-STARRY_FB3914V01,T-Booster 💪 || ASC+ || US || 5% EXISTING CAP || 7C || 07/05/25 Ad set,VIDEO,$5,320,2025-05-07,2025-05-08,1
296,CB_2025_Apr_FB_4063_SO_V01_4x5_IMG_EN_New_C-NONE_Evergreen_CTA-SALE_Angle-W_M-NONE_VL-None_G-NONE_P-OG_S-NONE,4063 - Metal Binding Text IMG || Batch 1 || Enhancements: OFF || CBV1 || 7C || 05/05/25w19,SHARE,$5,227,2025-05-05,2025-05-09,4
297,CB_2025_Apr_FB_4041_LZ-DP_V02_9x16_VID_EN_Opti_C-BulletPoints_Evergreen_CTA-SALE_Angle-Energy_M-JANW_VL-30s_G-M_P-ALPHA_S-NEW_FB3883V05,T-Booster 💪 || ASC+ || US || 5% EXISTING CAP || 7C || 07/05/25 Ad set,VIDEO,$5,178,2025-05-07,2025-05-08,1
298,CB_2025_Apr_FB_4066_SO_V08_4x5_IMG_EN_Opti_C-NONE_Evergreen_CTA-NONE_Angle-W-B-C_M-NONE_VL-None_G-NONE_P-OG_S-NONE_FB3950V16,4066 - FB3950V16 Opti IMG || Batch 2 || Enhancements: OFF || CBV1 || 7C || 05/05/25w19,SHARE,$4,294,2025-05-05,2025-05-12,7
299,CB_2025_Apr_FB_4068_LZ_V02_9x16_VID_EN_Opti_C-BulletPoints_Sale_CTA-SALE_Angle-W-B-C_M-TRC_VL-30s_G-F_P-OG_S-FRIGGA_FB2217V04,4068 - mother's day vid winner opti || Batch 1 || Enhancements: OFF || CBV1 || 7C || 05/05/25w19,VIDEO,$4,204,2025-05-02,2025-05-05,3
300,CB_2025_Mar_FB_3890_DT_V02_1x1_IMG_EN_New_C-NONE_Evergreen_CTA-None_Angle-W_M-NONE_VL-None_G-NONE_P-OG_S-NONE,3890 - Your Peak Performance in 6 weeks || Enhancements: OFF || CBV1 || Batch 1 || 7C || 10/03/25w11,SHARE,$4,177,2025-03-12,2025-05-06,55
301,CB_2025_Apr_FB_3996_DT-DP_V03_9x16_VID_EN_Opti_C-MakingOf_Evergreen_CTA-CTA_Angle-W-B_M-CRAZY_VL-45s_G-M_P-OG_S-NEW_FB3022V03,3996 - 3022 V03 opti || Batch 1 || Enhancements: OFF || CBV1 || 7C || 11/04/25w16,VIDEO,$4,201,2025-04-11,2025-05-08,27
302,CB_2025_Jan_FB_3757_LZ-DP_V20_9x16_VID_EN_Opti_C-NegativeMark_Evergreen_CTA-NONE_Angle-W-B_M-MAG_VL-45s_G-F_P-GLP1_S-WHAT_FB3311V14.mp4,3757 - video winner opti Batch 3+4 || Enhancements: OFF || CBV1 || Batch 4 || 7C || 09/05/25w19 || Valentinas,VIDEO,$4,168,2025-05-09,2025-05-12,3
303,CB_2025_Apr_FB_4037_DT-DP_V10_9x16_VID_EN_Opti_C-Benefits_Evergreen_CTA-65_Angle-W-B_M-POW_VL-45s_G-M_P-OG_S-FRIGGA_FB2601V11,4037 - Aaron winner opti with new footage || Batch 4 || Enhancements: OFF || CBV1 || 7C || 05/05/25w19,VIDEO,$4,130,2025-05-05,2025-05-09,4
304,CB_2025_Jan_FB_3757_LZ-DP_V17_9x16_VID_EN_Opti_C-NegativeMark_Evergreen_CTA-NONE_Angle-W_M-ATBJ_VL-45s_G-F_P-GLP1_S-MOON_FB3626V01.mp4,3757 - video winner opti Batch 3+4 || Enhancements: OFF || CBV1 || Batch 4 || 7C || 09/05/25w19 || Valentinas,VIDEO,$4,200,2025-05-09,2025-05-09,0
305,CB_2025_Apr_FB_4061_SO_V07_4x5_IMG_EN_Opti_C-NONE_Evergreen_CTA-SALE_Angle-W_M-NONE_VL-None_G-NONE_P-NONE_S-NONE_FB4032V01,4061 - FB4032V01 Opti IMG || Batch 3 || Enhancements: OFF || CBV1 || 7C || 05/05/25w19,SHARE,$4,203,2025-05-05,2025-05-08,3
306,CB_2025_Apr_FB_4070_KB_V15_4x5_VID_EN_New_C-NONE_CTA-SALE_Angle-None_M-NONE_VL-None_TR-None_G-F_P-OG_S-NONE,4070 - 3677 opti inspirational quotes || Batch 4 || Enhancements: OFF || CBV1 || 7C || 05/05/25w19,SHARE,$4,239,2025-05-05,2025-05-07,2
307,CB_2025_Jan_FB_3723_SO_V02_4x5_IMG_EN_New_C-NONE_Evergreen_CTA-SALE_Angle-W_M-NONE_VL-None_G-NONE_P-NONE_S-NONE,3723 - Notion Idea #92 MAN BOOBS || Enhancements: OFF || CBV1 || Batch 1 || 1C || 28/01/25w05 || Kostas,SHARE,$4,250,2025-01-28,2025-05-08,100
308,CB_2025_Apr_FB_4042_SO-DP_V01_4x5_IMG_EN_Opti_C-NONE_Evergreen_CTA-NONE_Angle-Energy_M-NONE_VL-None_G-NONE_P-ALPHA_S-NONE_FB2227V08,4042 - Alpha drive pt.5 IMG || Batch 1 || Enhancements: OFF || T-Booster || 7C || 07/05/25w19,SHARE,$4,115,2025-05-07,2025-05-07,0
309,CB_2025_Apr_FB_4037_DT-DP_V07_9x16_VID_EN_Opti_C-Dance_Sale_CTA-SMR_Angle-W-B_M-POW_VL-30s_G-M_P-OG_S-WHAT_FB3043V03,4037 - Aaron winner opti with new footage || Batch 3 || Enhancements: OFF || CBV1 || 7C || 05/05/25w19,VIDEO,$3,121,2025-05-05,2025-05-08,3
310,CB_2025_Apr_FB_4070_KB_V04_4x5_VID_EN_New_C-NONE_CTA-SALE_Angle-None_M-NONE_VL-None_TR-None_G-F_P-OG_S-NONE,4070 - 3677 opti inspirational quotes || Batch 1 || Enhancements: OFF || CBV1 || 7C || 05/05/25w19,SHARE,$3,188,2025-05-05,2025-05-07,2
311,CB_2025_Apr_FB_4041_LZ-DP_V01_9x16_VID_EN_Opti_C-BulletPoints_Evergreen_CTA-SALE_Angle-Energy_M-JANW_VL-30s_G-M_P-ALPHA_S-NEW_FB3883V05,4041 - ALPHA DRIVE 3883V05 opti || Batch 1 || Enhancements: OFF || T-Booster || 7C || 07/05/25w19,VIDEO,$3,126,2025-05-07,2025-05-08,1
312,CB_2025_Apr_FB_4037_DT-DP_V02_9x16_VID_EN_Opti_C-Dance_Evergreen_CTA-65_Angle-W_M-POW_VL-30s_G-M_P-OG_S-WOOD_FB3850V04,4037 - Aaron winner opti with new footage || Batch 1 || Enhancements: OFF || CBV1 || 7C || 05/05/25w19,VIDEO,$3,144,2025-05-05,2025-05-07,2
313,CB_2025_Apr_FB_4070_KB_V08_4x5_VID_EN_New_C-NONE_CTA-SALE_Angle-None_M-NONE_VL-None_TR-None_G-F_P-OG_S-NONE,4070 - 3677 opti inspirational quotes || Batch 2 || Enhancements: OFF || CBV1 || 7C || 05/05/25w19,SHARE,$3,147,2025-05-05,2025-05-08,3
314,CB_2025_Apr_FB_3962_VK-DP_V02_9x16_VID_EN_Opti_C-Trend_Evergreen_CTA-NONE_Angle-W-B-C_M-JANW_VL-30s_G-M_P-OG_S-NEW_FB3909V03,US || Kilo Product's leads LAL || 7C || 04/03/25,VIDEO,$2,83,2025-04-14,2025-05-12,28
315,CB_2025_Apr_FB_4026_SO_V02_4x5_IMG_EN_Opti_C-NONE_Evergreen_CTA-NONE_Angle-W_M-NONE_VL-None_G-NONE_P-OG_S-NONE_FB3950V11,4026 - FB3950V11 Opti || Batch 1 || Enhancements: OFF || CBV1 || 7C || 21/04/25w17,SHARE,$2,118,2025-04-21,2025-05-07,16
316,CB_2025_Apr_FB_4039_SO_V03_4x5_IMG_EN_New_C-NONE_Evergreen_CTA-SALE_Angle-W_M-NONE_VL-None_G-NONE_P-NONE_S-NONE,4039 - Minecraft-inspired IMG || Batch 1 || Enhancements: OFF || CBV1 || 7C || 05/05/25w19,SHARE,$2,91,2025-05-05,2025-05-07,2
317,CB_2025_Mar_APPLOV_3965_LZ-DP_V02_9x16_VID_EN_Opti_C-Trend_Evergreen_CTA-SALE_Angle-W-B-C_M-MIX_VL-30s_G-MF_P-OG_S-STARRY_FB3914V02,3965 - Applovin 3914 opti || Batch 1 || Enhancements: OFF || CBV1 || 7C || 28/04/25w18,VIDEO,$2,109,2025-04-28,2025-05-05,7
318,CB_2025_Jan_FB_3723_SO_V08_4x5_IMG_EN_New_C-NONE_Evergreen_CTA-SALE_Angle-W_M-NONE_VL-None_G-NONE_P-NONE_S-NONE,3723 - Notion Idea #92 MAN BOOBS || Enhancements: OFF || CBV1 || Batch 2 || 1C || 28/01/25w05 || Kostas,SHARE,$2,151,2025-01-28,2025-05-07,99
319,CB_2025_Apr_FB_4041_LZ-DP_V02_9x16_VID_EN_Opti_C-BulletPoints_Evergreen_CTA-SALE_Angle-Energy_M-JANW_VL-30s_G-M_P-ALPHA_S-NEW_FB3883V05,4041 - ALPHA DRIVE 3883V05 opti || Trial event || Batch 1 || Enhancements: OFF || T-Booster || 7C || 07/05/25w19,VIDEO,$2,84,2025-05-08,2025-05-08,0
320,CB_2025_Apr_FB_4041_LZ-DP_V01_9x16_VID_EN_Opti_C-BulletPoints_Evergreen_CTA-SALE_Angle-Energy_M-JANW_VL-30s_G-M_P-ALPHA_S-NEW_FB3883V05,4041 - ALPHA DRIVE 3883V05 opti || Trial event || Batch 1 || Enhancements: OFF || T-Booster || 7C || 07/05/25w19,VIDEO,$2,52,2025-05-08,2025-05-08,0
321,CB_2025_Apr_FB_4037_DT-DP_V11_9x16_VID_EN_Opti_C-Benefits_Evergreen_CTA-65_Angle-W-B_M-POW_VL-45s_G-M_P-OG_S-FRIGGA_FB2601V11,4037 - Aaron winner opti with new footage || Batch 4 || Enhancements: OFF || CBV1 || 7C || 05/05/25w19,VIDEO,$2,85,2025-05-06,2025-05-09,3
322,CB_2025_Apr_FB_4066_SO_V11_4x5_IMG_EN_Opti_C-NONE_Evergreen_CTA-NONE_Angle-W-B-C_M-NONE_VL-None_G-NONE_P-OG_S-NONE_FB3950V16,4066 - FB3950V16 Opti IMG || Batch 3 || Enhancements: OFF || CBV1 || 7C || 05/05/25w19,SHARE,$2,105,2025-05-05,2025-05-08,3
323,CB_2023_Jul_FB_2217_IB_V04_9x16_VID_EN_Opti_C-Pointing_CTA-SMR_Pain-W-B_M-TRC_VL-30s_TR-None_G-F_P-None_S-FRIGGA,US || Manual Bid || BID CAP 105 || 1C || 21/12/24,VIDEO,$2,53,2024-12-22,2025-05-11,140
324,CB_2025_May_FB_4090_SO-KB_V06_4x5_IMG_EN_Opti_C-NONE_Evergreen_CTA-Sale_Angle-W-B-C_M-NONE_VL-None_G-NONE_P-OG_S-NONE_FB3987V09,4090 - eat what you want national day opti | Batch 2 || Enhancements: OFF || CBV1 || 7C || 10/05/25w20,SHARE,$2,87,2025-05-10,2025-05-11,1
325,CB_2023_Jul_FB_2217_IB_V04_9x16_VID_EN_Opti_C-Pointing_CTA-SMR_Pain-W-B_M-TRC_VL-30s_TR-None_G-F_P-None_S-FRIGGA,US || Manual Bid || BFCM || COST CAP 71 || 1C || 15/11/24,VIDEO,$2,52,2024-11-15,2025-05-10,176
326,CB_2025_Apr_FB_4059_SO_V04_4x5_IMG_EN_Opti_C-NONE_Evergreen_CTA-SALE_Angle-W_M-NONE_VL-None_G-NONE_P-NONE_S-NONE_4006V02,4059 - FB4006V02 Opti IMG || Batch 1 || Enhancements: OFF || CBV1 || 7C || 05/05/25w19,SHARE,$2,90,2025-05-05,2025-05-08,3
327,CB_2025_Apr_FB_4042_SO-DP_V01_4x5_IMG_EN_Opti_C-NONE_Evergreen_CTA-NONE_Angle-Energy_M-NONE_VL-None_G-NONE_P-ALPHA_S-NONE_FB2227V08,T-Booster 💪 || ASC+ || US || 5% EXISTING CAP || 7C || 07/05/25 Ad set,SHARE,$2,55,2025-05-07,2025-05-08,1
328,CB_2025_Feb_FB_3821_SO-KB-JG_V14_4x5_IMG_EN_Opti_C-NONE_Evergreen_CTA-SALE_Angle-W_M-NONE_VL-None_G-NONE_P-NONE_S-NONE_FB3723V07,3821 - Man boobs Opti || Batch 2 || Enhancements: OFF || CBV1 || 7C || 28/04/25w18,SHARE,$2,51,2025-04-28,2025-05-07,9
329,CB_2025_Apr_FB_4041_LZ-DP_V03_9x16_VID_EN_Opti_C-BulletPoints_Evergreen_CTA-SALE_Angle-Energy_M-JANW_VL-30s_G-M_P-ALPHA_S-NEW_FB3883V05,4041 - ALPHA DRIVE 3883V05 opti || shop.colonbroom.com || Batch 1 || Enhancements: OFF || T-Booster || 7C || 08/05/25w19,VIDEO,$1,35,2025-05-08,2025-05-11,3
330,CB_2025_Mar_FB_3896_LZ_V03_1x1_IMG_EN_New_C-Headline_Evergreen_CTA-NONE_Angle-W_M-NONE_VL-None_G-M_P-OG_S-NONE,3896 - grill party img || Batch 1 || Enhancements: OFF || CBV1 || 7C || 28/04/25w18,SHARE,$1,45,2025-04-28,2025-05-06,8
331,CB_2023_May_FB_2103_MB_V02_9x16_VID_EN_Opti_C-Sale_CTA-SMR_Pain-W_M-JOG_VL-30s_TR-None_G-M-F_P-None_S-What,US || Manual Bid || BID CAP 111 || 1C || 21/12/24,VIDEO,$1,5,2024-12-28,2025-05-10,133
332,CB_2025_Apr_FB_4068_LZ_V03_9x16_VID_EN_Opti_C-BulletPoints_Sale_CTA-SALE_Angle-W-B-C_M-JANW_VL-30s_G-M_P-OG_S-WHAT_FB3883V05,4068 - mother's day vid winner opti || Batch 1 || Enhancements: OFF || CBV1 || 7C || 05/05/25w19,VIDEO,$1,54,2025-05-02,2025-05-05,3
333,CB_2025_Jan_FB_3722_VK-DP_V01_4x5_IMG_EN_New_C-BulletPoints_Sale_CTA-NY_Angle-W-B-C_M-NONE_VL-None_G-M_P-OG_S-NONE,3734 - NEW IDEA cross out -VK-DP || Batch 1 || Enhancements: OFF || CBV1 || 7C || 28/04/25w18,SHARE,$1,48,2025-04-28,2025-05-05,7
334,CB_2025_Jan_FB_3779_VK-DP_V03_1x1_VID_EN_Opti_C-BulletPoints_Evergreen_CTA-70_Angle-W-B-C_M-NONE_VL-None_G-F_P-OG_S-NEW_FB3705V02,3779 - opti 3705 || Enhancements: OFF || CBV1 || Batch 1 || 1C || 04/02/25w06 || Kostas,SHARE,$1,77,2025-02-04,2025-05-09,94
335,CB_2023_May_FB_2144_MB_V02_9x16_VID_EN_Opti_C-Sale_CTA-SMR_Pain-W_M-JOG_VL-30s_TR-None_G-M-F_P-None_S-What,CA || COST CAP 92->93 || 7C || 10/05/24 || V1,VIDEO,$1,70,2024-05-10,2025-05-12,367
336,CB_2025_Jan_FB_3757_LZ-DP_V19_9x16_VID_EN_Opti_C-BulletPoints_Evergreen_CTA-NONE_Angle-W-B_M-MAG_VL-30s_G-F_P-GLP1_S-WHAT_FB3311V17.mp4,3757 - video winner opti Batch 3+4 || Enhancements: OFF || CBV1 || Batch 4 || 7C || 09/05/25w19 || Valentinas,VIDEO,$1,49,2025-05-09,2025-05-12,3
337,CB_2025_Feb_FB_3821_SO-KB-JG_V15_4x5_IMG_EN_Opti_C-NONE_Evergreen_CTA-SALE_Angle-W_M-NONE_VL-None_G-NONE_P-NONE_S-NONE_FB3723V07,3821 - Man boobs Opti || Batch 2 || Enhancements: OFF || CBV1 || 7C || 28/04/25w18,SHARE,$1,39,2025-04-29,2025-05-08,9
338,CB_2025_Apr_FB_4041_LZ-DP_V03_9x16_VID_EN_Opti_C-BulletPoints_Evergreen_CTA-SALE_Angle-Energy_M-JANW_VL-30s_G-M_P-ALPHA_S-NEW_FB3883V05,T-Booster 💪 || ASC+ || US || 5% EXISTING CAP || 7C || 07/05/25 Ad set,VIDEO,$1,54,2025-05-07,2025-05-08,1
339,CB_2025_Feb_FB_3878_VK_V01_1x1_IMG_EN_New_C-BulletPoints_Evergreen_CTA-NONE_Angle-W-B-C_M-NONE_VL-None_G-NONE_P-OG_S-NEW,3878 - Fat shadow || Batch 1 || Enhancements: OFF || CBV1 || 7C || 28/04/25w18,SHARE,$1,29,2025-04-28,2025-05-05,7
340,CB_2025_Apr_FB_4065_LZ-VU_V02_4x5_IMG_EN_Opti_C-NegativeMark_Evergreen_CTA-NONE_Angle-Cort_M-NONE_VL-None_G-NONE_P-NONE_S-NONE_FB3251V01,4065 - its not cheap summer || Batch 1 || Enhancements: OFF || CBV1 || 7C || 29/04/25w18,SHARE,$1,43,2025-04-29,2025-05-08,9
341,CB_2025_Apr_FB_4063_SO_V03_4x5_IMG_EN_New_C-NONE_Evergreen_CTA-SALE_Angle-W_M-NONE_VL-None_G-NONE_P-OG_S-NONE,4063 - Metal Binding Text IMG || Batch 1 || Enhancements: OFF || CBV1 || 7C || 05/05/25w19,SHARE,$1,28,2025-05-05,2025-05-08,3
342,CB_2023_Jul_FB_2217_IB_V04_9x16_VID_EN_Opti_C-Pointing_CTA-SMR_Pain-W-B_M-TRC_VL-30s_TR-None_G-F_P-None_S-FRIGGA,US || Manual Bid || BID CAP 111 || 1C || 21/12/24,VIDEO,$1,8,2024-12-22,2025-05-09,138
343,CB_2023_May_FB_2103_MB_V02_9x16_VID_EN_Opti_C-Sale_CTA-SMR_Pain-W_M-JOG_VL-30s_TR-None_G-M-F_P-None_S-What,US || Manual Bid || BFCM || COST CAP 71 || 1C || 15/11/24,VIDEO,$0,16,2024-11-15,2025-05-08,174
344,CB_2025_Apr_FB_4041_LZ-DP_V03_9x16_VID_EN_Opti_C-BulletPoints_Evergreen_CTA-SALE_Angle-Energy_M-JANW_VL-30s_G-M_P-ALPHA_S-NEW_FB3883V05,4041 - ALPHA DRIVE 3883V05 opti || Trial event || Batch 1 || Enhancements: OFF || T-Booster || 7C || 07/05/25w19,VIDEO,$0,11,2025-05-08,2025-05-08,0
345,CB_2025_Apr_FB_4041_LZ-DP_V03_9x16_VID_EN_Opti_C-BulletPoints_Evergreen_CTA-SALE_Angle-Energy_M-JANW_VL-30s_G-M_P-ALPHA_S-NEW_FB3883V05,4041 - ALPHA DRIVE 3883V05 opti || Plans page || Batch 1 || Enhancements: OFF || T-Booster || 7C || 07/05/25w19,VIDEO,$0,18,2025-05-08,2025-05-08,0
346,CB_2025_Mar_FB_3896_LZ_V04_1x1_IMG_EN_New_C-Headline_Evergreen_CTA-NONE_Angle-W_M-NONE_VL-None_G-M_P-OG_S-NONE,3896 - grill party img || Batch 1 || Enhancements: OFF || CBV1 || 7C || 28/04/25w18,SHARE,$0,8,2025-04-28,2025-05-06,8
347,CB_2022_Mar3_FB_713_IK_V04_1x1_IMG_EN_Opti_C-WrittenTesti_HE-98_A-ExtremeBodyVisualization_HK-bodypart_Pain-W_CLR-PURPLE_BG-IMAGE_ME-MIX_MA-YOUNG,US || Manual Bid || BFCM || COST CAP 81 || 1C || 15/11/24,SHARE,$0,18,2024-11-15,2025-05-11,177
348,CB_2024_Mar_FB_2883_DA_V08_9x16_VID_ES_Opti_C-SingleTesti_CTA-SALE_Pain-W-B_M-TRC_VL-45s_TR-None_G-F_P-OG_S-MOON_FB2764V04.mp4,US || Quiz: Shopify || 7C || 04/04/25,VIDEO,$0,9,2025-04-04,2025-05-11,37
349,CB_2025_Apr_FB_4037_DT-DP_V10_9x16_VID_EN_Opti_C-Benefits_Evergreen_CTA-65_Angle-W-B_M-POW_VL-45s_G-M_P-OG_S-FRIGGA_FB2601V11,4037 - Aaron winner opti with new footage || Batch 4 || Enhancements: OFF || CBV1 || 7C || 28/04/25w18,VIDEO,$0,4,2025-04-28,2025-05-05,7
350,CB_2024_Mar_FB_2883_DA_V08_9x16_VID_ES_Opti_C-SingleTesti_CTA-SALE_Pain-W-B_M-TRC_VL-45s_TR-None_G-F_P-OG_S-MOON_FB2764V04.mp4,US || Quiz: React || 7C || 04/04/25,VIDEO,$0,4,2025-04-04,2025-05-06,32
351,CB_2025_Apr_FB_4040_SO_V10_4x5_IMG_EN_New_C-NONE_Evergreen_CTA-SALE_Angle-W_M-NONE_VL-None_G-NONE_P-NONE_S-NONE,4040 - Game style happy street IMG || Batch 3 || Enhancements: OFF || CBV1 || 7C || 28/04/25w18,SHARE,$0,11,2025-04-28,2025-05-12,14
352,CB_2023_Jul_FB_2226_MB_V04_9x16_VID_EN_Opti_C-Testim_CTA-SMR_Pain-W_M-MIX_VL-30s_TR-None_G-F_P-None_S-Starry,US || Manual Bid || BFCM || COST CAP 71 || 1C || 15/11/24,VIDEO,$0,6,2024-11-15,2025-05-12,178
353,CB_2024_Jan_FB_2717_MB-RP_V26_9x16_VID_EN_New_C-Buzz_CTA-SALE_Pain-W-B-C_M-MIX_VL-45s_TR-None_G-MF_P-Method_S-NONE,CA || COST CAP 92->93 || 7C || 10/05/24 || V1,VIDEO,$0,5,2024-08-22,2025-05-12,263
354,CB_2024_Oct_FB_3251_LZ-VU_V01_1x1_IMG_EN_New_C-NegativeMark_Evergreen_CTA-NONE_Angle-Cort_M-NONE_VL-None_G-NONE_P-NONE_S-NONE.png,US || Manual Bid || BFCM || COST CAP 71 || 1C || 15/11/24,SHARE,$0,1,2024-11-15,2025-05-11,177
355,CB_2025_Jan_FB_3722_VK-DP_V03_4x5_IMG_EN_New_C-BulletPoints_Sale_CTA-NY_Angle-W-B-C_M-NONE_VL-None_G-M_P-OG_S-NONE,3734 - NEW IDEA cross out -VK-DP || Batch 1 || Enhancements: OFF || CBV1 || 7C || 28/04/25w18,SHARE,$0,5,2025-04-28,2025-05-05,7
356,CB_2025_Apr_FB_4063_SO_V04_4x5_IMG_EN_New_C-NONE_Evergreen_CTA-SALE_Angle-W_M-NONE_VL-None_G-NONE_P-OG_S-NONE,4063 - Metal Binding Text IMG || Batch 1 || Enhancements: OFF || CBV1 || 7C || 05/05/25w19,SHARE,$0,4,2025-05-07,2025-05-09,2
357,CB_2025_Jan_FB_3722_VK-DP_V04_4x5_IMG_EN_New_C-BulletPoints_Sale_CTA-NY_Angle-W-B-C_M-NONE_VL-None_G-M_P-OG_S-NONE,3734 - NEW IDEA cross out -VK-DP || Batch 1 || Enhancements: OFF || CBV1 || 7C || 28/04/25w18,SHARE,$0,2,2025-04-28,2025-05-05,7
358,CB_2025_Feb_FB_3878_VK_V04_1x1_IMG_EN_New_C-BulletPoints_Evergreen_CTA-NONE_Angle-W-B-C_M-NONE_VL-None_G-NONE_P-OG_S-NEW,3878 - Fat shadow || Batch 1 || Enhancements: OFF || CBV1 || 7C || 28/04/25w18,SHARE,$0,4,2025-04-28,2025-05-05,7
359,CB_2025_Feb_FB_3878_VK_V03_1x1_IMG_EN_New_C-BulletPoints_Evergreen_CTA-NONE_Angle-W-B-C_M-NONE_VL-None_G-NONE_P-OG_S-NEW,3878 - Fat shadow || Batch 1 || Enhancements: OFF || CBV1 || 7C || 28/04/25w18,SHARE,$0,1,2025-04-28,2025-05-05,7
360,CB_2025_Apr_FB_4030_DT_V09_4x5_IMG_EN_New_C-Headline_Sale_CTA-SPRNG_Angle-W-B-C_M-NONE_VL-None_G-NONE_P-OG_S-NONE_FB2227V08,4030 - Easter Sale winner ads Opti || Batch 3 || Enhancements: OFF || CBV1 || 7C || 16/04/25w16,SHARE,$0,2,2025-04-16,2025-05-08,22
361,CB_2025_Mar_FB_3924_SO-DP_V02_1x1_IMG_EN_New_C-NONE_Evergreen_CTA-NONE_Angle-W-B-C_M-NONE_VL-None_G-NONE_P-OG_S-NONE,3924 - #17 man boobs/dad bod body text IMG || Batch 1 || Enhancements: OFF || CBV1 || 7C || 24/03/25w13,SHARE,$0,1,2025-03-24,2025-05-06,43
362,CB_2025_Apr_FB_4030_DT_V08_4x5_IMG_EN_New_C-Headline_Sale_CTA-SPRNG_Angle-W-B-C_M-NONE_VL-None_G-NONE_P-OG_S-NONE_FB2227V08,4030 - Easter Sale winner ads Opti || Batch 3 || Enhancements: OFF || CBV1 || 7C || 16/04/25w16,SHARE,$0,1,2025-04-16,2025-05-05,19
363,CB_2025_Apr_FB_3961_SO-JG_V09_4x5_IMG_EN_New_C-NONE_Evergreen_CTA-NONE_Angle-W-B-C_M-NONE_VL-None_G-NONE_P-OG_S-NONE,3961 - Action Figur || Batch 3 || Enhancements: OFF || CBV1 || 7C || 14/04/25w16,SHARE,$0,1,2025-04-14,2025-05-07,23
