,Ad Name,Adset Name,Creative Type,Spend In USD,Impressions,First Ad Spend Date,Last Ad Spend Date,Days ad spending
1,CB_2025_Jan_FB_3750_LZ-VU_V05_4x5_IMG_EN_Opti_C-NegativeMark_Evergreen_CTA-NONE_Angle-W_M-NONE_VL-None_G-NONE_P-NONE_S-NONE_FB3251V01,ðŸŒ¶ï¸ || US || ASC+ || ->CC141 || VIDEO Only || US+CA || 0% EXISTING CAP || 7C || 07/08.24  Ad set,SHARE,"$17,940","546,262",2025-01-24,2025-01-30,6
2,CB_2025_Jan_FB_3750_LZ-VU_V03_4x5_IMG_EN_Opti_C-NegativeMark_Evergreen_CTA-NONE_Angle-W_M-NONE_VL-None_G-NONE_P-NONE_S-NONE_FB3251V01,ðŸŒ¶ï¸ || US || ASC+ || ->CC141 || VIDEO Only || US+CA || 0% EXISTING CAP || 7C || 07/08.24  Ad set,SHARE,"$16,138","604,809",2025-01-24,2025-02-07,14
3,CB_2024_Aug_FB_3097_VK-DP_V03_9x16_VID_EN_Opti_C-Benefits_CTA-SMR_Pain-W-B_M-MIX_VL-45s_TR-None_G-MF_P-OG_S-WHAT_FB2516V13,ðŸŒ¶ï¸ || US || ASC+ || ->CC141 || VIDEO Only || US+CA || 0% EXISTING CAP || 7C || 07/08.24  Ad set,VIDEO,"$14,031","729,488",2024-09-04,2025-03-27,204
4,Dynamic_Creative_CA_Flow,WC || CA || DYNAMIC CREATIVE || ADV+ audience || 7C || 17.04.2024 || BIG BUDGET,SHARE,"$12,556","740,983",2024-04-17,2025-02-27,316
5,CB_2023_Jul_FB_2217_IB_V04_9x16_VID_EN_Opti_C-Pointing_CTA-SMR_Pain-W-B_M-TRC_VL-30s_TR-None_G-F_P-None_S-FRIGGA,ASC+ || VIDEO Only || US || 0% EXISTING CAP || 1C || 08.12.24  Ad set,VIDEO,"$8,901","253,219",2024-12-08,2025-02-05,59
6,CB_2025_Jan_FB_3736_LZ-VU_V01_4x5_IMG_EN_Opti_C-NegativeMark_Evergreen_CTA-NONE_Angle-Cort_M-NONE_VL-None_G-NONE_P-NONE_S-NONE_FB3251V01,CBV2 || US || Manual Bid: ROAS GOAL: 0.9 -> 1.00 || 7DC || 22/01/2025,SHARE,"$6,469","210,701",2025-01-22,2025-02-14,23
7,CB_2024_Nov_FB_3264_LZ_V31_4x5_VID_EN_Opti_C-MakingOf_Sale_CTA-BF_Angle-W-B_M-CRAZY_VL-45s_G-M_P-OG_S-NEW_FB3004V02,ASC+ || VIDEO Only || US || 0% EXISTING CAP || 1C || 08.12.24  Ad set,VIDEO,"$5,297","199,984",2024-12-08,2025-02-05,59
8,CB_2024_Jul_FB_3043_VK-DP_V03_9x16_VID_EN_Opti_C-Dance_CTA-SMR_Pain-W-B_M-POW_VL-30s_TR-None_G-M_P-OG_S-WHAT_FB3030V01,ðŸŒ¶ï¸ || US || ASC+ || ->CC141 || VIDEO Only || US+CA || 0% EXISTING CAP || 7C || 07/08.24  Ad set,VIDEO,"$5,206","293,758",2024-08-27,2025-03-03,188
9,CB_2023_Apr_FB_1989_RS_V08_9x16_VID_EN_Opti_C-Trend_CTA-SMR_Pain-W_M-MIX_VL-30s_TR-None_G-MF_P-None,ðŸŒ¶ï¸ || US || ASC+ || ->CC141 || VIDEO Only || US+CA || 0% EXISTING CAP || 7C || 07/08.24  Ad set,VIDEO,"$5,046","299,135",2024-08-07,2025-03-24,229
10,CB_2024_Aug_FB_3090_DT-DP_V02_9x16_VID_EN_Opti_C-MakingOf_CTA-CTA_Pain-W-B-C_M-POW_VL-45s_TR-None_G-M_P-OG_S-Moon_FB3029V04,ðŸŒ¶ï¸ || US || ASC+ || ->CC141 || VIDEO Only || US+CA || 0% EXISTING CAP || 7C || 07/08.24  Ad set,VIDEO,"$4,859","192,890",2025-01-17,2025-03-03,45
11,CB_2023_Jul_FB_2217_IB_V04_9x16_VID_EN_Opti_C-Pointing_CTA-SMR_Pain-W-B_M-TRC_VL-30s_TR-None_G-F_P-None_S-FRIGGA,ðŸŒ¶ï¸ || US || ASC+ || ->CC141 || VIDEO Only || US+CA || 0% EXISTING CAP || 7C || 07/08.24  Ad set,VIDEO,"$3,844","164,489",2024-08-07,2025-03-27,232
12,CB_2025_Jan_FB_3656_JT_V02_4x5_IMG_EN_New_C-Headline_Seasonal_CTA-70_Angle-W_M-NONE_VL-None_G-NONE_P-OG_S-NONE,ðŸŒ¶ï¸ || US || ASC+ || ->CC141 || VIDEO Only || US+CA || 0% EXISTING CAP || 7C || 07/08.24  Ad set,SHARE,"$3,067","142,475",2025-01-13,2025-03-04,50
13,CB_2025_Jan_FB_3726_LZ-JG_V01_4x5_IMG_EN_Opti_C-Headline_Evergreen_CTA-NONE_Angle-W_M-NONE_VL-None_G-NONE_P-OG_S-NONE_FB3357V01,ðŸŒ¶ï¸ || US || ASC+ || ->CC141 || VIDEO Only || US+CA || 0% EXISTING CAP || 7C || 07/08.24  Ad set,SHARE,"$3,004","170,516",2025-01-27,2025-02-03,7
14,CB_2024_Sep_FB_3175_DA-KB_V04_1x1_IMG_EN_New_C-ADVRT_Evergreen_CTA-NONE_Angle-W_M-NONE_VL-None_G-NONE_P-CBV2_S-NONE_blog_colonbroomvsmammoth_cv_en,CBV2 || Advantage+ || Advertorial || Higher pricing || US || 0% EXISTING CAP || BROAD || 7C || 20/01/25  Campaign Ad set,SHARE,"$2,280","84,235",2025-01-20,2025-03-27,66
15,CB_2023_Apr_FB_1989_RS_V08_9x16_VID_EN_Opti_C-Trend_CTA-SMR_Pain-W_M-MIX_VL-30s_TR-None_G-MF_P-None,ASC+ || VIDEO Only || US || 0% EXISTING CAP || 1C || 08.12.24  Ad set,VIDEO,"$2,221","103,958",2025-01-30,2025-02-05,6
16,CB_2024_Jan_FB_2764_RS_V04_9x16_VID_EN_Opti_C-SingleTesti_CTA-SALE_Pain-W_M-TRC_VL-45s_TR-None_G-F_P-OG_S-MOON_FB2263V04,EU (UK) || 2764 || Trinity Results Too Fast || 1C || 08/01/2025w02,VIDEO,"$1,999","85,046",2025-01-08,2025-03-27,78
17,CB_2025_Jan_FB_3705_VK_V02_4x5_IMG_EN_New_C-BulletPoints_Sale_CTA-NY_Angle-W-B-C_M-NONE_VL-None_G-NONE_P-OG_S-NONE,ðŸŒ¶ï¸ || US || ASC+ || ->CC141 || VIDEO Only || US+CA || 0% EXISTING CAP || 7C || 07/08.24  Ad set,SHARE,"$1,916","112,561",2025-01-30,2025-02-19,20
18,CB_2024_Feb_FB_2812_MB-RP_V07_9x16_VID_EN_Opti_C-Sale_CTA-C65_Pain-W_M-NONE_VL-30s_TR-None_G-MF_P-Plan_S-NEW_FB2601V04_1,ASC+ || VIDEO Only || US || 0% EXISTING CAP || 1C || 08.12.24  Ad set,VIDEO,"$1,915","70,847",2024-12-19,2025-02-05,48
19,CB_2024_Dec_FB_3608_LZ-DP_V03_4x5_IMG_EN_New_C-Headline_Evergreen_CTA-NONE_Angle-W_M-NONE_VL-None_G-NONE_P-OG_S-NONE,3608 - CB_IMG_ notion #17 hypnosis || Enhancements: OFF || CBV1 || Batch 1 || 1C || 13/01/25w03 || Kostas,SHARE,"$1,888","85,825",2025-01-13,2025-02-03,21
20,CB_2023_Jul_FB_2226_MB_V04_9x16_VID_EN_Opti_C-Testim_CTA-SMR_Pain-W_M-MIX_VL-30s_TR-None_G-F_P-None_S-Starry,ðŸŒ¶ï¸ || US || ASC+ || ->CC141 || VIDEO Only || US+CA || 0% EXISTING CAP || 7C || 07/08.24  Ad set,VIDEO,"$1,881","80,126",2024-10-28,2025-03-27,150
21,CB_2025_Jan_FB_3736_LZ-VU_V01_4x5_IMG_EN_Opti_C-NegativeMark_Evergreen_CTA-NONE_Angle-Cort_M-NONE_VL-None_G-NONE_P-NONE_S-NONE_FB3251V01,EU (UK) ||  EU adaptation || 3736 - Bioma ripoff march opti || 1C || 21/01/2025w04,SHARE,"$1,825","88,130",2025-01-21,2025-02-04,14
22,CB_2023_May_FB_2263_MB_V04_9x16_VID_EN_New_C-Sale_CTA-SMR_Pain-W_M-JOG_VL-45s_TR-None_G-M-F_P-None_S-Moon,ðŸ’°WC || US || Advantage+ || BIG BUDGET || CC101->105->109->112->114-116->117 || BROAD || ABO || 1C || 17/01/24 RELAUNCHED Ad set,VIDEO,"$1,754","47,207",2024-01-17,2025-02-06,386
23,CB_2025_Jan_FB_3726_LZ-JG_V01_4x5_IMG_EN_Opti_C-Headline_Evergreen_CTA-NONE_Angle-W_M-NONE_VL-None_G-NONE_P-OG_S-NONE_FB3357V01,3726 - domperignon opti || Enhancements: OFF || CBV1 || Batch 1 || 7C || 22/01/25w04,SHARE,"$1,608","60,342",2025-01-22,2025-02-03,12
24,CB_2023_Aug_FB_2295_MB_V01_1x1_VID_EN_Opti_C-GIF_CTA-CTA_Pain-W-B_M-None_VL-10s_TR-None_G-None_P-None_S-None,CA || COST CAP 92->93 || 7C || 10/05/24 || V1,VIDEO,"$1,523","80,488",2024-05-10,2025-02-27,293
25,CB_2024_Jan_FB_2764_RS_V04_9x16_VID_EN_Opti_C-SingleTesti_CTA-SALE_Pain-W_M-TRC_VL-45s_TR-None_G-F_P-OG_S-MOON_FB2263V04_Page_Personal_Coach,AU || Page: Branded & 3rd Party || 2764 || Trinity Results Too Fast || 1C || 10/01/2025w02,VIDEO,"$1,426","35,489",2025-01-10,2025-03-27,76
26,CB_2025_Jan_FB_3072_V01_4x5_IMG_EN_New_C-Headline_Seasonal_CTA-None_Angle-W_M-NONE_VL-None_G-NONE_P-OG_S-NONE,AU || Fixed || 3072 EU adaptations || 1C || 20/01/2025w04,SHARE,"$1,388","46,110",2025-01-22,2025-02-14,23
27,CB_2025_Jan_FB_3660_CHUB_V03_4x5_IMG_EN_New_C-NONE_CTA-NONE_Angle-C_M-NONE_VL-None_TR-None_G-NONE_P-NONE_S-NONE - Copy,US || Manual Bid: ROAS GOAL: 0.9 -> 1.00 || 7DC || 23/01/2025,SHARE,"$1,381","82,848",2025-01-23,2025-01-30,7
28,CB_2024_Feb_FB_2814_MB-DP_V07_1x1_IMG_EN_New_C-WeightLoss_CTA-CTA_Pain-W-B-C_M-NONE_VL-None_TR-None_G-F_P-V2_S-NONE_2410V06,AU || clinically proven opti || 1C || 23/01/2025w04 || 1C || 20/01/2025w04,SHARE,"$1,315","53,602",2025-01-23,2025-02-12,20
29,CB_2023_Jul_FB_2284_DA_V05_9x16_VID_EN_Opti_C-Sale_CTA-SMR_Pain-W_M-JANW_VL-30s_TR-None_G-M_P-None_S-WHAT_FB2103V02,ðŸŒ¶ï¸ || US || ASC+ || ->CC141 || VIDEO Only || US+CA || 0% EXISTING CAP || 7C || 07/08.24  Ad set,VIDEO,"$1,306","73,975",2024-08-07,2025-03-27,232
30,CB_2023_Oct_FB_2516_VK_V13_9x16_VID_EN_Opti_C-Benefits_CTA-AUTUM_Pain-W-B_M-PASQ_VL-30s_TR-None_G-M_P-Plan_S-WHAT,ASC+ || VIDEO Only || US || 0% EXISTING CAP || 1C || 08.12.24  Ad set,VIDEO,"$1,277","37,690",2024-12-20,2025-02-05,47
31,CB_2024_Dec_FB_3666_VK-JT_V04_4x5_VID_EN_Opti_C-BulletPoints_Sale_CTA-NY_Angle-W-B-C_M-TRC_VL-30s_G-F_P-OG_S-NEW,3666 - looksmaxing trend || Enhancements: OFF || CBV1 || Batch 1 || 1C || 07/01/25w02 || Kostas,SHARE,"$1,171","55,811",2025-01-07,2025-01-30,23
32,CB_2023_Oct_FB_2516_VK_V13_9x16_VID_EN_Opti_C-Benefits_CTA-AUTUM_Pain-W-B_M-PASQ_VL-30s_TR-None_G-M_P-Plan_S-WHAT,ðŸŒ¶ï¸ || US || ASC+ || ->CC141 || VIDEO Only || US+CA || 0% EXISTING CAP || 7C || 07/08.24  Ad set,VIDEO,"$1,071","44,936",2024-12-19,2025-03-27,98
33,CB_2025_Jan_FB_3696_CHUB_V02_4x5_IMG_EN_New_C-NONE_CTA-NONE_Angle-C_M-NONE_VL-None_TR-None_G-NONE_P-NONE_S-NONE,3696 Struggling with Poop rocks CHUB || Enhancements: OFF || CBV1 || Batch 2 || 1C || 22/01/25w04,SHARE,"$1,025","55,506",2025-01-22,2025-02-02,11
34,CB_2024_Dec_FB_3619_VK-JT_V02_4x5_VID_EN_New_C-BulletPoints_Sale_CTA-NY_Angle-W-B-C_M-NONE_VL-None_G-NONE_P-OG_S-NONE,ðŸŒ¶ï¸ || US || ASC+ || ->CC141 || VIDEO Only || US+CA || 0% EXISTING CAP || 7C || 07/08.24  Ad set,SHARE,"$1,016","53,346",2024-12-27,2025-03-27,90
35,CB_2024_Sep_FB_3175_DA-KB_V03_1x1_IMG_EN_New_C-ADVRT_Evergreen_CTA-NONE_Angle-W_M-NONE_VL-None_G-NONE_P-CBV2_S-NONE_blog_colonbroomvsmammoth_cv_en,CBV2 || Advantage+ || Advertorial || Higher pricing || US || 0% EXISTING CAP || BROAD || 7C || 20/01/25  Campaign Ad set,SHARE,"$1,002","39,445",2025-01-20,2025-03-27,66
36,CB_2025_Jan_FB_3705_VK_V04_4x5_IMG_EN_New_C-BulletPoints_Sale_CTA-NY_Angle-W-B-C_M-NONE_VL-None_G-NONE_P-OG_S-NONE,3705 - #87 Struggling with Dad Bod_ - VK || Enhancements: OFF || CBV1 || Batch 1 || 1C || 22/01/25w04 || Kostas,SHARE,$972,"50,274",2025-01-22,2025-02-03,12
37,CB_2025_Jan_FB_3699_DT-DP_V03_4x5_IMG_EN_New_C-Headline_Evergreen_CTA-NONE_Angle-W-B_M-NONE_VL-None_G-NONE_P-OG_S-NONE,3699 - Notion idea #86 || Enhancements: OFF || CBV1 || Batch 1 || 1C || 21/01/25w04 || Kostas,SHARE,$869,"29,863",2025-01-21,2025-01-30,9
38,CB_2025_Jan_FB_3662_CHUB_V01_1x1_IMG_EN_New_C-NONE_CTA-NONE_Angle-C_M-NONE_VL-None_TR-None_G-NONE_P-NONE_S-NONE.jpg,ðŸŒ¶ï¸ || US || ASC+ || ->CC141 || VIDEO Only || US+CA || 0% EXISTING CAP || 7C || 07/08.24  Ad set,SHARE,$845,"42,823",2025-01-13,2025-03-04,50
39,CB_2024_Dec_FB_3601_VK-DP_V09_4x5_VID_EN_Opti_C-Dance_CTA-NY_Pain-W-B_M-JOG_VL-30s_TR-None_G-F_P-OG_S-WHAT_FB3045V01,ðŸŒ¶ï¸ || US || ASC+ || ->CC141 || VIDEO Only || US+CA || 0% EXISTING CAP || 7C || 07/08.24  Ad set,VIDEO,$827,"20,341",2024-12-27,2025-02-14,49
40,CB_2023_Nov_FB_2649_VK_V06_9x16_VID_EN_Opti_C-Sale_CTA-C65_Pain-W_M-NONE_VL-30s_TR-None_G-MF_P-Plan_S-NEW_FB2601V04,ðŸ’°WC || US || Advantage+ || BIG BUDGET || CC101->105->109->112->114-116->117 || BROAD || ABO || 1C || 17/01/24 RELAUNCHED Ad set,VIDEO,$783,"28,721",2024-01-17,2025-02-06,386
41,CB_2024_Jan_FB_2764_RS_V04_9x16_VID_EN_Opti_C-SingleTesti_CTA-SALE_Pain-W_M-TRC_VL-45s_TR-None_G-F_P-OG_S-MOON_FB2263V04_Page_Personal_Coach,CBV2 || AU || ðŸ’° Advantage+ || US || BROAD || 7C || Existing_customer_5% || 19/12/24 Ad set,VIDEO,$779,"18,226",2025-01-16,2025-03-27,70
42,CB_2025_Jan_FB_3072_V01_4x5_IMG_EN_New_C-Headline_Seasonal_CTA-None_Angle-W_M-NONE_VL-None_G-NONE_P-OG_S-NONE,CBV2 || AU || ðŸ’° Advantage+ || US || BROAD || 7C || Existing_customer_5% || 19/12/24 Ad set,SHARE,$759,"24,064",2025-01-22,2025-02-07,16
43,CB_2024_Feb_FB_2814_MB-DP_V05_1x1_IMG_EN_New_C-WeightLoss_CTA-None_Pain-W-B-C_M-NONE_VL-None_TR-None_G-NONE_P-V2_S-NONE,EU (UK) || clinically proven opti || 1C || 23/01/2025w04,SHARE,$755,"40,936",2025-01-23,2025-03-10,46
44,CB_2025_Jan_FB_3726_LZ-JG_V04_4x5_IMG_EN_Opti_C-Headline_Evergreen_CTA-NONE_Angle-W_M-NONE_VL-None_G-NONE_P-OG_S-NONE_FB3357V01,3726 - domperignon opti || Enhancements: OFF || CBV1 || Batch 1 || 7C || 22/01/25w04,SHARE,$701,"25,646",2025-01-22,2025-02-03,12
45,CB_2023_Dec_FB_2696_RS_V03_9x16_VID_EN_Opti_C-Sale_CTA-NY65_Pain-W-B_M-JANW_VL-30s_TR-None_G-M_P-OG_S-WHAT_FB2284V05,CBV2 || AU || ðŸ’° Advantage+ || US || BROAD || 7C || Existing_customer_5% || 19/12/24 Ad set,VIDEO,$700,"26,328",2025-01-13,2025-03-27,73
46,CB_2023_Dec_FB_2670_MB-RP_V02_9x16_VID_EN_Opti_C-Sale_CTA-XMAS65_Pain-W_M-JOG_VL-30s_TR-None,ðŸ’°WC || US || Advantage+ || BIG BUDGET || CC101->105->109->112->114-116->117 || BROAD || ABO || 1C || 17/01/24 RELAUNCHED Ad set,VIDEO,$633,"20,713",2024-01-17,2025-02-06,386
47,CB_2025_Jan_FB_3704_SO_V02_4x5_IMG_EN_New_C-Headline_Evergreen_CTA-NONE_Angle-W-B-C_M-NONE_VL-None_G-NONE_P-NONE_S-NON,3704 - Notion Idea #89 FOR REAL MEN || Enhancements: OFF || CBV1 || Batch 1 || 1C || 26/01/25w05 || Kostas,SHARE,$603,"22,439",2025-01-26,2025-02-08,13
48,CB_2024_Jan_FB_2784_RS_V02_9x16_VID_EN_Opti_C-Pointing_CTA-SALE_Pain-W_M-JOG_VL-30s_TR-None_G-F_P-OG_S-OLLIE_FB2181V01,CBV2 || EU (UK) || ðŸ’° Advantage+ || US || BROAD || 7C || Existing_customer_5% || 15/12/24 Ad set,VIDEO,$588,"23,718",2025-01-09,2025-03-27,77
49,CB_2025_Jan_FB_3736_LZ-VU_V01_4x5_IMG_EN_Opti_C-NegativeMark_Evergreen_CTA-NONE_Angle-Cort_M-NONE_VL-None_G-NONE_P-NONE_S-NONE_FB3251V01,US || Manual Bid: ROAS GOAL: 0.9 -> 1.00 || 7DC || 23/01/2025,SHARE,$587,"18,659",2025-01-27,2025-01-30,3
50,CB_2025_Jan_FB_3696_CHUB_V04_4x5_IMG_EN_New_C-NONE_CTA-NONE_Angle-C_M-NONE_VL-None_TR-None_G-NONE_P-OG_S-NONE,3696 Struggling with Poop rocks CHUB || Enhancements: OFF || CBV1 || Batch 1 || 1C || 22/01/25w04,SHARE,$571,"44,106",2025-01-22,2025-01-29,7
51,CB_2025_Jan_FB_3740_SO-DP_V03_4x5_IMG_EN_Opti_C-Headline_Evergreen_CTA-NONE_Angle-W_M-NONE_VL-None_G-NONE_P-OG_S-NONE_3608V03,3745 - 3661 Methane Balloon OPTI || Enhancements: OFF || CBV1 || Batch 1 || 1C || 30/01/25w05 || Kostas,SHARE,$561,"34,504",2025-01-30,2025-02-13,14
52,CB_2024_Nov_FB_3264_LZ_V29_4x5_VID_EN_Opti_C-NegativeMark_Sale_CTA-BF_Angle-W-B_M-LRNS_VL-30s_G-M_P-OG_S-NONE,ðŸŒ¶ï¸ || US || ASC+ || ->CC141 || VIDEO Only || US+CA || 0% EXISTING CAP || 7C || 07/08.24  Ad set,VIDEO,$561,"28,335",2024-12-04,2025-03-27,113
53,CB_2023_Dec_FB_2712_RS-DP_V02_1x1_VID_EN_Opti_C-WrittenTesti_CTA-SALE_Pain-W-B-C_M-NONE_VL-None_TR-None_G-NONE_P-V2_S-NONE_FB2227V08,CBV2 || EU (UK) || ðŸ’° Advantage+ || US || BROAD || 7C || Existing_customer_5% || 15/12/24 Ad set,SHARE,$553,"24,683",2024-12-15,2025-03-27,102
54,CB_2023_Jul_FB_2217_IB_V04_9x16_VID_EN_Opti_C-Pointing_CTA-SMR_Pain-W-B_M-TRC_VL-30s_TR-None_G-F_P-None_S-FRIGGA,ðŸ’°WC || US || Advantage+ || BIG BUDGET || CC101->105->109->112->114-116->117 || BROAD || ABO || 1C || 17/01/24 RELAUNCHED Ad set,VIDEO,$551,"17,046",2024-01-17,2025-02-06,386
55,CB_2025_Jan_FB_3723_SO_V18_4x5_IMG_EN_New_C-NONE_Evergreen_CTA-SALE_Angle-W_M-NONE_VL-None_G-NONE_P-NONE_S-NONE,3723 - Notion Idea #92 MAN BOOBS || Enhancements: OFF || CBV1 || Batch 4 || 1C || 28/01/25w05 || Kostas,SHARE,$539,"38,413",2025-01-28,2025-03-07,38
56,CB_2025_Jan_FB_3750_LZ-VU_V01_4x5_IMG_EN_Opti_C-NegativeMark_Evergreen_CTA-NONE_Angle-W_M-NONE_VL-None_G-NONE_P-NONE_S-NONE_FB3251V01,3750 - bioma ripoff march soft version || Enhancements: OFF || CBV1 || Batch 1 || 1C || 24/01/25w04 || Kostas,SHARE,$537,"13,527",2025-01-24,2025-02-17,24
57,CB_2025_Jan_FB_3718_CHUB_V08_4x5_IMG_EN_Opti_C-NONE_CTA-NONE_Angle-C_M-NONE_VL-None_TR-None_G-M_P-OG_S-NONE,3718 - Looking 15 people OPTI || Enhancements: OFF || CBV1 || Batch 3 || 1C || 29/01/25w05 || Kostas,SHARE,$535,"30,730",2025-01-29,2025-02-08,10
58,CB_2024_Dec_FB_3601_VK-DP_V09_4x5_VID_EN_Opti_C-Dance_CTA-NY_Pain-W-B_M-JOG_VL-30s_TR-None_G-F_P-OG_S-WHAT_FB3045V01,ASC+ || VIDEO Only || US || 0% EXISTING CAP || 1C || 08.12.24  Ad set,VIDEO,$531,"13,819",2024-12-25,2025-02-05,42
59,CB_2025_Jan_FB_3723_SO_V07_4x5_IMG_EN_New_C-NONE_Evergreen_CTA-SALE_Angle-W_M-NONE_VL-None_G-NONE_P-NONE_S-NONE,3723 - Notion Idea #92 MAN BOOBS || Enhancements: OFF || CBV1 || Batch 2 || 1C || 28/01/25w05 || Kostas,SHARE,$526,"45,911",2025-01-28,2025-02-13,16
60,CB_2025_Jan_FB_3725_CHUB_V01_9x16_VID_EN_New_C-NONE_CTA-NONE_Angle-C_M-NONE_VL-30s_TR-None_G-M_P-OG_S-NONE,3725 - Drawing video || Enhancements: OFF || CBV1 || Batch 1 || 1C || 29/01/25w05 || Kostas,VIDEO,$520,"24,667",2025-01-29,2025-02-03,5
61,CB_2025_Jan_FB_3736_LZ-VU_V01_4x5_IMG_EN_Opti_C-NegativeMark_Evergreen_CTA-NONE_Angle-Cort_M-NONE_VL-None_G-NONE_P-NONE_S-NONE_FB3251V01,CBV2 || EU (UK) || ðŸ’° Advantage+ || US || BROAD || 7C || Existing_customer_5% || 15/12/24 Ad set,SHARE,$520,"20,690",2025-01-22,2025-02-04,13
62,CB_2024_Feb_FB_2812_MB-RP_V07_9x16_VID_EN_Opti_C-Sale_CTA-C65_Pain-W_M-NONE_VL-30s_TR-None_G-MF_P-Plan_S-NEW_FB2601V04_1,ðŸŒ¶ï¸ || US || ASC+ || ->CC141 || VIDEO Only || US+CA || 0% EXISTING CAP || 7C || 07/08.24  Ad set,VIDEO,$506,"36,193",2025-02-02,2025-02-14,12
63,CB_2025_Jan_FB_3718_CHUB_V05_4x5_IMG_EN_Opti_C-NONE_CTA-NONE_Angle-C_M-NONE_VL-None_TR-None_G-M_P-OG_S-NONE,3718 - Looking 15 people OPTI || Enhancements: OFF || CBV1 || Batch 2 || 1C || 29/01/25w05 || Kostas,SHARE,$495,"31,112",2025-01-29,2025-02-20,22
64,IM_CB1.png,US || VSL || Aff's image + Taboola ad || Batch 1 || Landing: new6/pre-1 || 1C || 28/01/25,SHARE,$494,"25,917",2025-01-28,2025-02-03,6
65,CB_2023_Jul_FB_2217_IB_V04_9x16_VID_EN_Opti_C-Pointing_CTA-SMR_Pain-W-B_M-TRC_VL-30s_TR-None_G-F_P-None_S-FRIGGA,CBV2 || AU || ðŸ’° Advantage+ || US || BROAD || 7C || Existing_customer_5% || 19/12/24 Ad set,VIDEO,$490,"12,746",2024-12-19,2025-03-24,95
66,CB_2025_Jan_FB_3700_SO_V08_4x5_IMG_EN_New_C-Headline_Evergreen_CTA-NONE_Angle-W-B-C_M-NONE_VL-None_G-NONE_P-NONE_S-NONE,3700 - Notion Idea #90 THE 5 RULES || Enhancements: OFF || CBV1 || Batch 1 || 1C || 21/01/25w04 || Kostas,SHARE,$472,"18,927",2025-01-21,2025-01-30,9
67,CB_2025_Jan_FB_3741_LZ-JG_V01_4x5_IMG_EN_Opti_C-Headline_Evergreen_CTA-NONE_Angle-W_M-NONE_VL-None_G-NONE_P-CBV2_S-NONE_FB3357V01,CBV2 || US || Manual Bid: ROAS GOAL: 0.9 -> 1.00 || 7DC || 22/01/2025,SHARE,$469,"20,222",2025-01-22,2025-03-27,64
68,CB_2023_May_FB_2263_MB_V04_9x16_VID_EN_New_C-Sale_CTA-SMR_Pain-W_M-JOG_VL-45s_TR-None_G-M-F_P-None_S-Moon,ðŸŒ¶ï¸ || US || ASC+ || ->CC141 || VIDEO Only || US+CA || 0% EXISTING CAP || 7C || 07/08.24  Ad set,VIDEO,$456,"13,467",2024-08-07,2025-03-27,232
69,CB_2024_Sep_FB_3175_DA-KB_V01_1x1_IMG_EN_New_C-ADVRT_Evergreen_CTA-NONE_Angle-W_M-NONE_VL-None_G-NONE_P-CBV2_S-NONE_blog_colonbroomvsmammoth_cv_en,CBV2 || Advantage+ || Advertorial || Higher pricing || US || 0% EXISTING CAP || BROAD || 7C || 20/01/25  Campaign Ad set,SHARE,$451,"19,787",2025-01-20,2025-03-27,66
70,IM_CB1.png,US || VSL || Aff's image + Taboola ad || Batch 1 || Landing: new5/pre-1 || 1C || 28/01/25,SHARE,$433,"19,241",2025-01-28,2025-02-05,8
71,CB_2023_May_FB_2263_MB_V04_9x16_VID_EN_New_C-Sale_CTA-SMR_Pain-W_M-JOG_VL-45s_TR-None_G-M-F_P-None_S-Moon,CBV2 || AU || ðŸ’° Advantage+ || US || BROAD || 7C || Existing_customer_5% || 19/12/24 Ad set,VIDEO,$423,"11,000",2024-12-19,2025-03-27,98
72,CB_2024_Dec_FB_3592_VK-DP_V10_4x5_VID_EN_New_C-BulletPoints_Sale_CTA-SALE_Angle-W-B-C_M-NONE_VL-30s_G-F_P-OG_S-NEW - Copy,ðŸŒ¶ï¸ || US || ASC+ || ->CC141 || VIDEO Only || US+CA || 0% EXISTING CAP || 7C || 07/08.24  Ad set,VIDEO,$423,"17,125",2024-12-21,2025-03-27,96
73,CB_2023_Dec_FB_2712_RS-DP_V02_1x1_VID_EN_Opti_C-WrittenTesti_CTA-SALE_Pain-W-B-C_M-NONE_VL-None_TR-None_G-NONE_P-V2_S-NONE_FB2227V08,CBV2 || AU || ðŸ’° Advantage+ || US || BROAD || 7C || Existing_customer_5% || 19/12/24 Ad set,SHARE,$418,"14,734",2024-12-19,2025-03-27,98
74,CB_2025_Jan_FB_3735_VK_V02_4x5_VID_EN_New_C-BulletPoints_Sale_CTA-NY_Angle-W-B-C_M-NONE_VL-None_G-NONE_P-OG_S-NONE,3735 - OPTI 3619 -VK || Enhancements: OFF || CBV1 || Batch 1 || 1C || 29/01/25w05 || Kostas,SHARE,$418,"24,160",2025-01-29,2025-02-07,9
75,CB_2025_Jan_FB_3722_VK-JG_V05_4x5_IMG_EN_New_C-Testimonial_Sale_CTA-NY_Angle-W-B-C_M-NONE_VL-None_G-M_P-OG_S-NONE,3722 - mens testi || Enhancements: OFF || CBV1 || Batch 2 || 1C || 28/01/25w05 || Kostas,SHARE,$410,"10,992",2025-01-28,2025-01-31,3
76,CB_2025_Jan_FB_3723_SO_V01_4x5_IMG_EN_New_C-NONE_Evergreen_CTA-SALE_Angle-W_M-NONE_VL-None_G-NONE_P-NONE_S-NONE,3723 - Notion Idea #92 MAN BOOBS || Enhancements: OFF || CBV1 || Batch 1 || 1C || 28/01/25w05 || Kostas,SHARE,$404,"29,310",2025-01-28,2025-02-24,27
77,CB_2024_Aug_FB_3090_DT-DP_V02_9x16_VID_EN_Opti_C-MakingOf_CTA-CTA_Pain-W-B-C_M-POW_VL-45s_TR-None_G-M_P-OG_S-Moon_FB3029V04,CBV2 || EU (UK) || ðŸ’° Advantage+ || US || BROAD || 7C || Existing_customer_5% || 15/12/24 Ad set,SHARE,$392,"20,519",2024-12-19,2025-03-27,98
78,CB_2024_Dec_FB_3666_VK-JT_V02_4x5_VID_EN_Opti_C-BulletPoints_Sale_CTA-NY_Angle-W-B-C_M-TRC_VL-30s_G-F_P-OG_S-FRIGGA,3666 - looksmaxing trend || Enhancements: OFF || CBV1 || Batch 1 || 1C || 07/01/25w02 || Kostas,SHARE,$389,"12,116",2025-01-07,2025-01-30,23
79,CB_2025_Jan_FB_3716_CHUB_V01_4x5_IMG_EN_Opti_C-NONE_CTA-NONE_Angle-C_M-NONE_VL-None_TR-None_G-M_P-OG_S-NONE,3716 - Valentines day event OPTI || Enhancements: OFF || CBV1 || Batch 2 || 1C || 29/01/25w05 || Kostas,SHARE,$386,"18,203",2025-01-29,2025-02-09,11
80,CB_2025_Jan_FB_3710_SO-RP_V01_4x5_IMG_EN_New_C-Headline_Evergreen_CTA-SALE_Angle-W-B-C_M-NONE_VL-None_G-NONE_P-NONE_S-NONE,3711 - VDAY top ads 2024 opti || Enhancements: OFF || CBV1 || Batch 1 || 1C || 26/01/25w05 || Kostas,SHARE,$384,"13,753",2025-01-26,2025-01-30,4
81,CB_2025_Jan_FB_3722_VK-JG_V03_4x5_IMG_EN_New_C-Testimonial_Sale_CTA-NY_Angle-W-B-C_M-NONE_VL-None_G-M_P-OG_S-NONE,3722 - mens testi || Enhancements: OFF || CBV1 || Batch 1 || 1C || 28/01/25w05 || Kostas,SHARE,$379,"11,566",2025-01-28,2025-01-31,3
82,CB_2025_Jan_FB_3718_CHUB_V02_4x5_IMG_EN_Opti_C-NONE_CTA-NONE_Angle-C_M-NONE_VL-None_TR-None_G-M_P-OG_S-NONE,3718 - Looking 15 people OPTI || Enhancements: OFF || CBV1 || Batch 1 || 1C || 29/01/25w05 || Kostas,SHARE,$371,"17,715",2025-01-29,2025-02-07,9
83,CB_2025_Jan_FB_3743_VK-DP_V01_4x5_IMG_EN_New_C-BulletPoints_Sale_CTA-NY_Angle-W-B-C_M-NONE_VL-None_G-M_P-OG_S-NEW,3743 - 974 opti with new copy || Enhancements: OFF || CBV1 || Batch 1 || 1C || 28/01/25w05 || Kostas,SHARE,$369,"16,891",2025-01-28,2025-01-31,3
84,CB_2025_Jan_FB_3705_VK_V03_4x5_IMG_EN_New_C-BulletPoints_Sale_CTA-NY_Angle-W-B-C_M-NONE_VL-None_G-NONE_P-OG_S-NONE,3705 - #87 Struggling with Dad Bod_ - VK || Enhancements: OFF || CBV1 || Batch 1 || 1C || 22/01/25w04 || Kostas,SHARE,$364,"22,009",2025-01-22,2025-01-30,8
85,CB_2024_Jan_FB_2764_RS_V04_9x16_VID_EN_Opti_C-SingleTesti_CTA-SALE_Pain-W_M-TRC_VL-45s_TR-None_G-F_P-OG_S-MOON_FB2263V04_Page_Personal_Coach,US || Manual Bid: ROAS GOAL: 1.1 || 7DC || 28/01/2025,VIDEO,$359,"8,444",2025-01-28,2025-02-11,14
86,CB_2025_FEB_FB_3666_VK-JT_V03_4x5_VID_EN_NEW_C-BulletPoints_Sale_CTA-NY_Angle-W-B-C_M-TRC_VL-30s_G-F_P-OG_S-NEW,3666 - looksmaxing trend || Enhancements: OFF || CBV1 || Batch 1 || 1C || 07/01/25w02 || Kostas,SHARE,$339,"15,123",2025-01-07,2025-01-27,20
87,CB_2025_Jan_FB_3738_SO-DP_V04_4x5_IMG_EN_Opti_C-NONE_Evergreen_CTA-SALE_Angle-W_M-NONE_VL-None_G-NONE_P-NONE_S-NONE3665V01,3738 - 3665_V01 OPTI || Enhancements: OFF || CBV1 || Batch 1 || 1C || 29/01/25w05 || Kostas,SHARE,$337,"25,244",2025-01-29,2025-02-22,24
88,CB_2025_Jan_FB_3740_SO-DP_V01_4x5_IMG_EN_Opti_C-Headline_Evergreen_CTA-NONE_Angle-W_M-NONE_VL-None_G-NONE_P-OG_S-NONE_3608V03,3740 - 3608_v03 OPTI || Enhancements: OFF || CBV1 || Batch 1 || 1C || 29/01/25w05 || Kostas,SHARE,$337,"20,772",2025-01-29,2025-02-11,13
89,CB_2025_Jan_FB_3720_DT-DP_V01_4x5_CAROUSEL_EN_New_C-BulletPoints_Evergreen_CTA-NONE_Angle-W_M-NONE_VL-None_G-NONE_P-OG_S-NONE_1,3720 - #99 Foods you can eat || Enhancements: OFF || CBV1 || Batch 1 || 1C || 26/01/25w05 || Kostas,SHARE,$318,"7,474",2025-01-26,2025-01-29,3
90,CB_2025_Jan_FB_3709_VK-JT_V03_4x5_IMG_EN_New_C-BulletPoints_Sale_CTA-NY_Angle-W-B-C_M-NONE_VL-None_G-M_P-OG_S-NONE,3709 -Notion Sigma male #109 VK-JT || Enhancements: OFF || CBV1 || Batch 1 || 1C || 29/01/25w05 || Kostas,SHARE,$315,"16,036",2025-01-29,2025-02-05,7
91,CB_2025_Jan_FB_3722_VK-JG_V09_4x5_IMG_EN_New_C-Testimonial_Sale_CTA-NY_Angle-W-B-C_M-NONE_VL-None_G-M_P-OG_S-NONE,3722 - mens testi || Enhancements: OFF || CBV1 || Batch 3 || 1C || 28/01/25w05 || Kostas,SHARE,$310,"8,388",2025-01-28,2025-01-31,3
92,IM_CB1.png,US || VSL || Aff's image + Taboola ad || Batch 1 || Landing: /quiz/pre-1 || 1C || 30/01/25,SHARE,$295,"15,270",2025-01-30,2025-02-04,5
93,CB_2025_Jan_FB_3707_VK-JT_V01_4x5_IMG_EN_New_C-BulletPoints_Sale_CTA-NY_Angle-W-B-C_M-NONE_VL-None_G-NONE_P-OG_S-NONE,3712 - #108 Comics ad - VK-JT || Enhancements: OFF || CBV1 || Batch 1 || 1C || 26/01/25w05 || Kostas,SHARE,$286,"16,539",2025-01-26,2025-01-29,3
94,CB_2024_Nov_FB_3264_LZ_V29_4x5_VID_EN_Opti_C-NegativeMark_Sale_CTA-BF_Angle-W-B_M-LRNS_VL-30s_G-M_P-OG_S-NONE - Copy,ASC+ || VIDEO Only || US || 0% EXISTING CAP || 1C || 08.12.24  Ad set,VIDEO,$284,"11,529",2025-01-30,2025-02-05,6
95,CB_2025_Jan_FB_3704_SO_V06_4x5_IMG_EN_New_C-Headline_Evergreen_CTA-NONE_Angle-W-B-C_M-NONE_VL-None_G-NONE_P-NONE_S-NONE,3704 - Notion Idea #89 FOR REAL MEN || Enhancements: OFF || CBV1 || Batch 2 || 1C || 26/01/25w05 || Kostas,SHARE,$275,"12,681",2025-01-26,2025-01-29,3
96,CB_2025_Jan_FB_3727_DT-DP_V01_4x5_VID_EN_New_C-Dance_Sale_CTA-70_Angle-W_M-POW_VL-30s_G-M_P-OG_S-NEW,3727 - Kinda new kinda opti || Enhancements: OFF || CBV1 || Batch 1 || 1C || 28/01/25w05 || Kostas,SHARE,$271,"9,263",2025-01-28,2025-01-31,3
97,CB_2025_Jan_FB_3732_SO-JT_V04_4x5_IMG_EN_New_C-Headline_Evergreen_CTA-NONE_Angle-Detox_M-NONE_VL-None_G-NONE_P-NONE_S-NONE,3732 - CB - Cortisol detox || Enhancements: OFF || CBV1 || Batch 1 || 1C || 29/01/25w05 || Kostas,SHARE,$270,"12,838",2025-01-29,2025-02-03,5
98,CB_2025_Jan_FB_3724_CHUB-AA_V04_4x5_IMG_EN_New_C-NONE_CTA-NONE_Angle-C_M-NONE_VL-None_TR-None_G-M_P-none_S-NONE,3724 Get Regular CHUB || Enhancements: OFF || CBV1 || Batch 1 || 1C || 29/01/25w05 || Kostas,SHARE,$266,"17,321",2025-01-29,2025-02-13,15
99,CB_2025_Jan_FB_3741_LZ-JG_V01_4x5_IMG_EN_Opti_C-Headline_Evergreen_CTA-NONE_Angle-W_M-NONE_VL-None_G-NONE_P-CBV2_S-NONE_FB3357V01,AU || 3741 - V2 dom perignon 2 || 1C || 29/01/2025w05,SHARE,$263,"12,659",2025-01-30,2025-02-20,21
100,CB_2025_Jan_FB_3737_DT_V01_4x5_IMG_EN_New_C-BulletPoints_Evergreen_CTA-NONE_Angle-W_M-NONE_VL-None_G-NONE_P-OG_S-NONE_FB3682V03,3737 - Opti 3682 || Enhancements: OFF || CBV1 || Batch 1 || 1C || 29/01/25w05 || Kostas,SHARE,$260,"14,970",2025-01-29,2025-02-05,7
101,CB_2025_Jan_FB_3719_LZ-JT_V03_4x5_IMG_EN_New_C-UsVsThem_Evergreen_CTA-NONE_Angle-W_M-NONE_VL-None_G-NONE_P-NONE_S-NONE,3719 - usvsthem receipts || Enhancements: OFF || CBV1 || Batch 1 || 1C || 26/01/25w05 || Kostas - Copy,SHARE,$256,"9,391",2025-01-26,2025-02-02,7
102,CB_2025_Jan_FB_3721_LZ-RP_V04_4x5_IMG_EN_New_C-Headline_Evergreen_CTA-NONE_Angle-W_M-NONE_VL-None_G-NONE_P-NONE_S-NONE,3721 - real men dont ad || Enhancements: OFF || CBV1 || Batch 1 || 1C || 26/01/25w05 || Kostas,SHARE,$256,"9,541",2025-01-26,2025-01-30,4
103,CB_2025_Jan_FB_3742_SO-DP-KB_V01_4x5_IMG_EN_Opti_C-NONE_Evergreen_CTA-SALE_Angle-W_M-NONE_VL-None_G-NONE_P-CBV2_S-NONE3665V01,3742 -  3665_V01 OPTI for PREMIUM 2 || Batch 1 || 1C || 29/01/2025w05,SHARE,$253,"14,409",2025-01-30,2025-02-10,11
104,CB_2025_Jan_FB_3746_CHUB-AA_V06_4x5_IMG_EN_Opti_C-NONE_CTA-NONE_Angle-C_M-NONE_VL-None_TR-None_G-NONE_P-NONE_S-NONE,3746 â€“ 3660 G-nugget OPTI v3 || Enhancements: OFF || CBV1 || Batch 2 || 1C || 30/01/25w05 || Kostas,SHARE,$252,"15,696",2025-01-30,2025-02-14,15
105,CB_2024_Feb_FB_2814_MB-DP_V05_1x1_IMG_EN_New_C-WeightLoss_CTA-None_Pain-W-B-C_M-NONE_VL-None_TR-None_G-NONE_P-V2_S-NONE,AU || clinically proven opti || 1C || 23/01/2025w04 || 1C || 20/01/2025w04,SHARE,$252,"11,436",2025-01-23,2025-01-28,5
106,CB_2023_Jul_FB_2284_DA_V05_9x16_VID_EN_Opti_C-Sale_CTA-SMR_Pain-W_M-JANW_VL-30s_TR-None_G-M_P-None_S-WHAT_FB2103V02 - Copy,ASC+ || VIDEO Only || US || 0% EXISTING CAP || 1C || 08.12.24  Ad set,VIDEO,$250,"10,066",2025-01-30,2025-02-05,6
107,CB_2025_Jan_FB_3717_CHUB_V03_4x5_IMG_EN_New_C-NONE_CTA-NONE_Angle-C_M-NONE_VL-None_TR-None_G-M_P-OG_S-NONE,3717 - Lunar New Year sale || Enhancements: OFF || CBV1 || Batch 1 || 1C || 29/01/25w05 || Kostas,SHARE,$249,"10,672",2025-01-29,2025-02-03,5
108,IM_CB1.png,US || VSL || Aff's image + Taboola ad || Batch 1 || Landing: new7/pre-1 || 1C || 28/01/25,SHARE,$249,"10,268",2025-01-28,2025-01-31,3
109,CB_2023_Jul_FB_2217_IB_V04_9x16_VID_EN_Opti_C-Pointing_CTA-SMR_Pain-W-B_M-TRC_VL-30s_TR-None_G-F_P-None_S-FRIGGA,CBV2 || EU (UK) || ðŸ’° Advantage+ || US || BROAD || 7C || Existing_customer_5% || 15/12/24 Ad set,VIDEO,$248,"13,951",2024-12-18,2025-03-27,99
110,IM_CB1.png,US || VSL || Aff's image + Taboola ad || Batch 1 || Landing: new3/pre-1 || 1C || 28/01/25,SHARE,$245,"10,375",2025-01-28,2025-01-31,3
111,CB_2023_May_FB_1999_LV_V01_9x16_VID_EN_New_C-Pointing_CTA-DISCOUNT_Pain-W_M-JOG_VL-30s_TR-None,ASC+ || VIDEO Only || US || 0% EXISTING CAP || 1C || 08.12.24  Ad set,VIDEO,$241,"6,623",2024-12-08,2025-01-27,50
112,CB_2024_Dec_FB_3622_LZ-DP_V03_4x5_IMG_EN_Opti_C-NONE_Sale_CTA-XMAS_Angle-GH_M-NONE_VL-None_G-NONE_P-OG_S-NONE_FB2227V08,ðŸŒ¶ï¸ || US || ASC+ || ->CC141 || VIDEO Only || US+CA || 0% EXISTING CAP || 7C || 07/08.24  Ad set,SHARE,$239,"7,686",2024-12-19,2025-01-27,39
113,CB_2025_Jan_FB_3704_SO_V01_4x5_IMG_EN_New_C-Headline_Evergreen_CTA-NONE_Angle-W-B-C_M-NONE_VL-None_G-NONE_P-NONE_S-NONE,3704 - Notion Idea #89 FOR REAL MEN || Enhancements: OFF || CBV1 || Batch 1 || 1C || 26/01/25w05 || Kostas,SHARE,$231,"6,066",2025-01-26,2025-02-08,13
114,CB_2025_Jan_FB_3733_SO-JT_V01_4x5_IMG_EN_New_C-Headline_Evergreen_CTA-NONE_Angle-Detox_M-NONE_VL-None_G-NONE_P-NONE_S-NONE,3733 - CB - Sugar detox || Enhancements: OFF || CBV1 || Batch 1 || 1C || 29/01/25w05 || Kostas,SHARE,$227,"8,523",2025-01-29,2025-02-02,4
115,CB_2024_Dec_FB_3639_CHUB_V03_1x1_IMG_EN_New_C-NONE_CTA-NONE_Angle-W_M-NONE_VL-None_TR-None_G-NONE_P-NONE_S-NONE,CBV2 || US || Manual Bid: ROAS GOAL: 0.9 -> 1.00 || 7DC || 22/01/2025,SHARE,$225,"7,734",2025-01-22,2025-02-11,20
116,CB_2025_Jan_FB_3719_LZ-JT_V02_4x5_IMG_EN_New_C-UsVsThem_Evergreen_CTA-NONE_Angle-W_M-NONE_VL-None_G-NONE_P-NONE_S-NONE,3719 - usvsthem receipts || Enhancements: OFF || CBV1 || Batch 1 || 1C || 26/01/25w05 || Kostas - Copy,SHARE,$223,"10,653",2025-01-26,2025-02-02,7
117,CB_2024_Nov_FB_3264_LZ_V31_4x5_VID_EN_Opti_C-MakingOf_Sale_CTA-BF_Angle-W-B_M-CRAZY_VL-45s_G-M_P-OG_S-NEW_FB3004V02,CBV2 || EU (UK) || ðŸ’° Advantage+ || US || BROAD || 7C || Existing_customer_5% || 15/12/24 Ad set,VIDEO,$220,"11,647",2024-12-19,2025-03-27,98
118,CB_2025_Jan_FB_3700_SO_V07_4x5_IMG_EN_New_C-Headline_Evergreen_CTA-NONE_Angle-W-B-C_M-NONE_VL-None_G-NONE_P-NONE_S-NONE,3700 - Notion Idea #90 THE 5 RULES || Enhancements: OFF || CBV1 || Batch 1 || 1C || 21/01/25w04 || Kostas,SHARE,$220,"8,721",2025-01-21,2025-01-30,9
119,CB_2025_Jan_FB_3746_CHUB-AA_V07_4x5_IMG_EN_Opti_C-NONE_CTA-NONE_Angle-C_M-NONE_VL-None_TR-None_G-NONE_P-NONE_S-NONE,3746 â€“ 3660 G-nugget OPTI v3 || Enhancements: OFF || CBV1 || Batch 2 || 1C || 30/01/25w05 || Kostas,SHARE,$219,"12,685",2025-01-30,2025-02-14,15
120,CB_2025_Jan_FB_3723_SO_V14_4x5_IMG_EN_New_C-NONE_Evergreen_CTA-SALE_Angle-W_M-NONE_VL-None_G-NONE_P-NONE_S-NONE.png,3723 - Notion Idea #92 MAN BOOBS || Enhancements: OFF || CBV1 || Batch 3 || 1C || 28/01/25w05 || Kostas,SHARE,$216,"15,452",2025-01-28,2025-01-31,3
121,CB_2025_Jan_FB_3732_SO-JT_V01_4x5_IMG_EN_New_C-Headline_Evergreen_CTA-NONE_Angle-Detox_M-NONE_VL-None_G-NONE_P-NONE_S-NONE,3732 - CB - Cortisol detox || Enhancements: OFF || CBV1 || Batch 1 || 1C || 29/01/25w05 || Kostas,SHARE,$213,"15,037",2025-01-29,2025-02-03,5
122,CB_2022_Mar3_FB_713_IK_V04_1x1_IMG_EN_Opti_C-WrittenTesti_HE-98_A-ExtremeBodyVisualization_HK-bodypart_Pain-W_CLR-PURPLE_BG-IMAGE_ME-MIX_MA-YOUNG,US || Manual Bid || BFCM || ROAS GOAL: 1.4 || 1C || 15/11/24,SHARE,$213,"8,961",2024-11-15,2025-02-27,104
123,CB_2025_Jan_FB_3742_SO-DP-KB_V01_4x5_IMG_EN_Opti_C-NONE_Evergreen_CTA-SALE_Angle-W_M-NONE_VL-None_G-NONE_P-CBV2_S-NONE3665V01,3742 -  3665_V01 OPTI for PREMIUM 3 || 1C || 31/01/2025w05,SHARE,$212,"12,370",2025-01-31,2025-02-10,10
124,CB_2023_Dec_FB_2696_RS_V03_9x16_VID_EN_Opti_C-Sale_CTA-NY65_Pain-W-B_M-JANW_VL-30s_TR-None_G-M_P-OG_S-WHAT_FB2284V05,US || Manual Bid: ROAS GOAL: 1.1 || 7DC || 28/01/2025,VIDEO,$208,"9,221",2025-01-28,2025-02-11,14
125,IM_CB1.png,US || VSL || Aff's image || Landing: Directly to VSL || 1C || 16/01/25,SHARE,$207,"4,920",2025-01-16,2025-01-28,12
126,CB_2025_Jan_FB_3731_DT-DP_V04_4x5_IMG_EN_New_C-Headline_Evergreen_CTA-NONE_Angle-W_M-NONE_VL-None_G-NONE_P-OG_S-NONE,3731 - New idea mom belly || Enhancements: OFF || CBV1 || Batch 1 || 1C || 29/01/25w05 || Kostas,SHARE,$206,"10,729",2025-01-29,2025-02-07,9
127,CB_2025_Jan_FB_3711_DT_V09_4x5_VID_EN_Opti_C-Benefits_Sale_CTA-VDAY_Angle-W-B_M-MIX_VL-45s_G-F_M-Dear_S-WHAT_FB3311V09,3711 - VDAY top ads 2024 opti 3 || Enhancements: OFF || CBV1 || Batch 2 || 1C || 29/01/25w05 || Kostas,SHARE,$205,"9,328",2025-01-29,2025-02-02,4
128,CB_2023_May_FB_2144_MB_V02_9x16_VID_EN_Opti_C-Sale_CTA-SMR_Pain-W_M-JOG_VL-30s_TR-None_G-M-F_P-None_S-What,CA || COST CAP 92->93 || 7C || 10/05/24 || V1,VIDEO,$204,"11,183",2024-05-10,2025-02-27,293
129,CB_2025_Jan_FB_3711_DT_V02_4x5_VID_EN_Opti_C-Pointing_Sale_CTA-VDAY_Angle-W-B_M-TRC_VL-30s_G-F_P-OG_S-FRIGGA_FB2217V04,3711 - VDAY top ads 2024 opti 3 || Enhancements: OFF || CBV1 || Batch 1 || 1C || 29/01/25w05 || Kostas,SHARE,$197,"8,370",2025-01-29,2025-02-09,11
130,CB_2025_Jan_FB_3728_LZ_V03_4x5_IMG_EN_CB_2025_Jan_FB_3728_LZ_V04_9x16_IMG_EN_New_C-Testimonial_Evergreen_CTA-NONE_Angle-W-C_M-NONE_VL-None_G-NONE_P-OG_S-NONE.jpg_C-Testimonial_Evergreen_CTA-NONE_Angle-W-C_M-NONE_VL-None_G-NONE_P-OG_S-NONE,3728 - grid style testimonials || Enhancements: OFF || CBV1 || Batch 1 || 1C || 28/01/25w05 || Kostas,SHARE,$196,"4,387",2025-01-28,2025-01-31,3
131,CB_2024_Dec_FB_3639_CHUB_V03_1x1_IMG_EN_New_C-NONE_CTA-NONE_Angle-W_M-NONE_VL-None_TR-None_G-NONE_P-NONE_S-NONE,ðŸŒ¶ï¸ || US || ASC+ || ->CC141 || VIDEO Only || US+CA || 0% EXISTING CAP || 7C || 07/08.24  Ad set,SHARE,$196,"7,555",2025-01-06,2025-01-27,21
132,CB_2025_Jan_FB_3737_DT_V03_4x5_IMG_EN_New_C-BulletPoints_Evergreen_CTA-NONE_Angle-W_M-NONE_VL-None_G-NONE_P-OG_S-NONE_FB3682V03,3737 - Opti 3682 || Enhancements: OFF || CBV1 || Batch 1 || 1C || 29/01/25w05 || Kostas,SHARE,$191,"12,361",2025-01-29,2025-02-05,7
133,CB_2025_Jan_FB_3738_SO-DP_V03_4x5_IMG_EN_Opti_C-NONE_Evergreen_CTA-SALE_Angle-W_M-NONE_VL-None_G-NONE_P-NONE_S-NONE3665V01,3738 - 3665_V01 OPTI || Enhancements: OFF || CBV1 || Batch 1 || 1C || 29/01/25w05 || Kostas,SHARE,$185,"14,012",2025-01-29,2025-02-22,24
134,Taboola - ColonB 3.webp,US || VSL || Aff's image || Batch 2 (mostly Taboola ads) || Landing: pre-1 || 1C || 19/01/25,SHARE,$183,"6,325",2025-01-19,2025-01-28,9
135,CB_2025_Jan_FB_3719_LZ-JT_V04_4x5_IMG_EN_New_C-UsVsThem_Evergreen_CTA-NONE_Angle-W_M-NONE_VL-None_G-NONE_P-NONE_S-NONE,3719 - usvsthem receipts || Enhancements: OFF || CBV1 || Batch 1 || 1C || 26/01/25w05 || Kostas - Copy,SHARE,$181,"6,620",2025-01-26,2025-02-02,7
136,CB_2024_Jan_FB_2762_IK_V05_1x1_IMG_EN_New_C-WrittenTesti_CTA-CTA_Pain-W-B-C_M-NONE_VL-None_TR-None_G-NONE_P-V2_S-NONE,CBV2 || EU (UK) || ðŸ’° Advantage+ || US || BROAD || 7C || Existing_customer_5% || 15/12/24 Ad set,SHARE,$177,"6,749",2024-12-15,2025-03-27,102
137,CB_2024_Dec_FB_3619_VK-JT_V02_4x5_VID_EN_New_C-BulletPoints_Sale_CTA-NY_Angle-W-B-C_M-NONE_VL-None_G-NONE_P-OG_S-NONE - Copy,ðŸ’°WC || US || Advantage+ || BIG BUDGET || CC101->105->109->112->114-116->117 || BROAD || ABO || 1C || 17/01/24 RELAUNCHED Ad set,SHARE,$176,"5,945",2024-12-27,2025-02-06,41
138,CB_2025_Jan_FB_3746_CHUB-AA_V04_4x5_IMG_EN_Opti_C-NONE_CTA-NONE_Angle-C_M-NONE_VL-None_TR-None_G-NONE_P-NONE_S-NONE,3746 â€“ 3660 G-nugget OPTI v3 || Enhancements: OFF || CBV1 || Batch 1 || 1C || 30/01/25w05 || Kostas,SHARE,$174,"10,616",2025-01-30,2025-02-02,3
139,CB_2025_Jan_FB_3721_LZ-RP_V02_4x5_IMG_EN_New_C-Headline_Evergreen_CTA-NONE_Angle-W_M-NONE_VL-None_G-NONE_P-NONE_S-NONE,3721 - real men dont ad || Enhancements: OFF || CBV1 || Batch 1 || 1C || 26/01/25w05 || Kostas,SHARE,$165,"5,704",2025-01-26,2025-01-30,4
140,CB_2025_Jan_FB_3705_VK_V02_4x5_IMG_EN_New_C-BulletPoints_Sale_CTA-NY_Angle-W-B-C_M-NONE_VL-None_G-NONE_P-OG_S-NONE,3705 - #87 Struggling with Dad Bod_ - VK || Enhancements: OFF || CBV1 || Batch 1 || 1C || 22/01/25w04 || Kostas,SHARE,$164,"9,972",2025-01-22,2025-02-03,12
141,CB_2025_Jan_FB_3656_JT_V02_4x5_IMG_EN_New_C-Headline_Seasonal_CTA-70_Angle-W_M-NONE_VL-None_G-NONE_P-OG_S-NONE,AU || 3656 - we_re leaving || 1C || 15/01/2025w03,SHARE,$160,"5,840",2025-01-15,2025-01-27,12
142,CB_2023_May_FB_2263_MB_V04_9x16_VID_EN_New_C-Sale_CTA-SMR_Pain-W_M-JOG_VL-45s_TR-None_G-M-F_P-None_S-Moon,US || Manual Bid: ROAS GOAL: 1.1 || 7DC || 28/01/2025,VIDEO,$159,"3,579",2025-01-28,2025-02-11,14
143,CB_2025_Jan_FB_3072_V01_4x5_IMG_EN_New_C-Headline_Seasonal_CTA-None_Angle-W_M-NONE_VL-None_G-NONE_P-OG_S-NONE,US || Manual Bid: ROAS GOAL: 1.1 || 7DC || 28/01/2025,SHARE,$155,"4,282",2025-01-28,2025-02-11,14
144,CB_2025_Jan_FB_3717_CHUB_V04_4x5_IMG_EN_New_C-NONE_CTA-NONE_Angle-C_M-NONE_VL-None_TR-None_G-M_P-OG_S-NONE,3717 - Lunar New Year sale || Enhancements: OFF || CBV1 || Batch 1 || 1C || 29/01/25w05 || Kostas,SHARE,$151,"6,477",2025-01-29,2025-02-03,5
145,CB_2025_Jan_FB_3724_CHUB-AA_V02_4x5_IMG_EN_New_C-NONE_CTA-NONE_Angle-C_M-NONE_VL-None_TR-None_G-M_P-OG_S-NONE,3724 Get Regular CHUB || Enhancements: OFF || CBV1 || Batch 1 || 1C || 29/01/25w05 || Kostas,SHARE,$151,"10,434",2025-01-29,2025-02-13,15
146,CB_2025_Jan_FB_3742_SO-DP-KB_V06_4x5_IMG_EN_Opti_C-NONE_Evergreen_CTA-SALE_Angle-W_M-NONE_VL-None_G-NONE_P-CBV2_S-NONE3665V01,3742 -  3665_V01 OPTI for PREMIUM 2 || Batch 2 || 1C || 31/01/2025w05,SHARE,$145,"10,406",2025-01-31,2025-02-18,18
147,CB_2025_Jan_FB_3719_LZ-JT_V01_4x5_IMG_EN_New_C-UsVsThem_Evergreen_CTA-NONE_Angle-W_M-NONE_VL-None_G-NONE_P-NONE_S-NONE,3719 - usvsthem receipts || Enhancements: OFF || CBV1 || Batch 1 || 1C || 26/01/25w05 || Kostas - Copy,SHARE,$144,"6,516",2025-01-26,2025-02-02,7
148,CB_2025_Jan_FB_3740_SO-DP_V03_4x5_IMG_EN_Opti_C-Headline_Evergreen_CTA-NONE_Angle-W_M-NONE_VL-None_G-NONE_P-OG_S-NONE_3608V03,3740 - 3608_v03 OPTI || Enhancements: OFF || CBV1 || Batch 1 || 1C || 29/01/25w05 || Kostas,SHARE,$141,"8,611",2025-01-29,2025-02-11,13
149,CB_2025_Jan_FB_3731_DT-DP_V03_4x5_IMG_EN_New_C-Headline_Evergreen_CTA-NONE_Angle-W_M-NONE_VL-None_G-NONE_P-OG_S-NONE,3731 - New idea mom belly || Enhancements: OFF || CBV1 || Batch 1 || 1C || 29/01/25w05 || Kostas,SHARE,$141,"7,263",2025-01-29,2025-02-07,9
150,CB_2025_Jan_FB_3723_SO_V10_4x5_IMG_EN_New_C-NONE_Evergreen_CTA-SALE_Angle-W_M-NONE_VL-None_G-NONE_P-NONE_S-NONE,3723 - Notion Idea #92 MAN BOOBS || Enhancements: OFF || CBV1 || Batch 2 || 1C || 28/01/25w05 || Kostas,SHARE,$137,"9,943",2025-01-28,2025-02-18,21
151,CB_2025_Jan_FB_3711_DT_V01_4x5_VID_EN_Opti_C-Sale_Sale_CTA-VDAY_Angle-W_M-JOG_VL-45s_G-M-F_P-OG_S-Moon_FB2263V04,3711 - VDAY top ads 2024 opti 3 || Enhancements: OFF || CBV1 || Batch 1 || 1C || 29/01/25w05 || Kostas,SHARE,$135,"5,804",2025-01-29,2025-02-09,11
152,CB_2025_Jan_FB_3750_LZ-VU_V02_4x5_IMG_EN_Opti_C-NegativeMark_Evergreen_CTA-NONE_Angle-W_M-NONE_VL-None_G-NONE_P-NONE_S-NONE_FB3251V01,3750 - bioma ripoff march soft version || Enhancements: OFF || CBV1 || Batch 1 || 1C || 24/01/25w04 || Kostas,SHARE,$133,"2,705",2025-01-24,2025-01-28,4
153,CB_2025_Jan_FB_3072_V02_4x5_IMG_EN_New_C-Headline_Seasonal_CTA-None_Angle-W_M-NONE_VL-None_G-NONE_P-OG_S-NONE,AU || Fixed || 3072 EU adaptations || 1C || 20/01/2025w04,SHARE,$132,"5,353",2025-01-20,2025-02-14,25
154,CB_2025_Jan_FB_3715_SO-JT_V02_4x5_IMG_EN_New_C-Headline_Evergreen_CTA-SALE_Angle-W_M-NONE_VL-None_G-NONE_P-NONE_S-NONE,3715 - Notion Idea #107 In our DMs || Enhancements: OFF || CBV1 || Batch 1 || 1C || 26/01/25w05 || Kostas,SHARE,$129,"4,177",2025-01-26,2025-01-29,3
155,CB_2022_Mar3_FB_713_IK_V04_1x1_IMG_EN_Opti_C-WrittenTesti_HE-98_A-ExtremeBodyVisualization_HK-bodypart_Pain-W_CLR-PURPLE_BG-IMAGE_ME-MIX_MA-YOUNG,US || Manual Bid || BFCM || COST CAP 91 || 1C || 15/11/24,SHARE,$127,"6,982",2024-11-15,2025-02-27,104
156,CB_2025_Jan_FB_3723_SO_V11_4x5_IMG_EN_New_C-NONE_Evergreen_CTA-SALE_Angle-W_M-NONE_VL-None_G-NONE_P-NONE_S-NONE,3723 - Notion Idea #92 MAN BOOBS || Enhancements: OFF || CBV1 || Batch 3 || 1C || 28/01/25w05 || Kostas,SHARE,$126,"8,964",2025-01-28,2025-01-31,3
157,CB_2025_Jan_FB_3746_CHUB-AA_V03_4x5_IMG_EN_Opti_C-NONE_CTA-NONE_Angle-C_M-NONE_VL-None_TR-None_G-NONE_P-NONE_S-NONE,3746 â€“ 3660 G-nugget OPTI v3 || Enhancements: OFF || CBV1 || Batch 1 || 1C || 30/01/25w05 || Kostas,SHARE,$121,"7,717",2025-01-30,2025-02-02,3
158,CB_2025_Jan_FB_3723_SO_V04_4x5_IMG_EN_New_C-NONE_Evergreen_CTA-SALE_Angle-W_M-NONE_VL-None_G-NONE_P-NONE_S-NONE,3723 - Notion Idea #92 MAN BOOBS || Enhancements: OFF || CBV1 || Batch 1 || 1C || 28/01/25w05 || Kostas,SHARE,$115,"9,006",2025-01-28,2025-02-21,24
159,CB_2025_Jan_FB_3711_DT_V03_4x5_VID_EN_Opti_C-Sale_Sale_CTA-VDAY_Angle-W_M-JOG_VL-30s_G-M-F_P-OG_S-What_FB2103V02,3711 - VDAY top ads 2024 opti 3 || Enhancements: OFF || CBV1 || Batch 1 || 1C || 29/01/25w05 || Kostas,SHARE,$115,"5,457",2025-01-29,2025-02-09,11
160,CB_2024_Dec_FB_3608_LZ-DP_V03_4x5_IMG_EN_New_C-Headline_Evergreen_CTA-NONE_Angle-W_M-NONE_VL-None_G-NONE_P-OG_S-NONE,CBV2 || EU (UK) || ðŸ’° Advantage+ || US || BROAD || 7C || Existing_customer_5% || 15/12/24 Ad set,SHARE,$114,"5,777",2025-01-23,2025-01-31,8
161,CB_2025_Jan_FB_3711_DT_V08_4x5_VID_EN_Opti_C-Testimonial_Sale_CTA-VDAY_Angle-W_M-TRC_VL-45s_G-F_P-OG_S-MOON_FB2823V02,3711 - VDAY top ads 2024 opti 3 || Enhancements: OFF || CBV1 || Batch 2 || 1C || 29/01/25w05 || Kostas,SHARE,$114,"4,966",2025-01-29,2025-02-02,4
162,CB_2025_Jan_FB_3746_CHUB-AA_V01_4x5_IMG_EN_Opti_C-NONE_CTA-NONE_Angle-C_M-NONE_VL-None_TR-None_G-NONE_P-NONE_S-NONE,3746 â€“ 3660 G-nugget OPTI v3 || Enhancements: OFF || CBV1 || Batch 1 || 1C || 30/01/25w05 || Kostas,SHARE,$113,"6,947",2025-01-30,2025-02-02,3
163,CB_2025_Jan_FB_3709_VK-JT_V01_4x5_IMG_EN_New_C-BulletPoints_Sale_CTA-NY_Angle-W-B-C_M-NONE_VL-None_G-M_P-OG_S-NONE,3709 -Notion Sigma male #109 VK-JT || Enhancements: OFF || CBV1 || Batch 1 || 1C || 29/01/25w05 || Kostas,SHARE,$112,"5,807",2025-01-29,2025-02-05,7
164,CB_2025_Jan_FB_3723_SO_V17_4x5_IMG_EN_New_C-NONE_Evergreen_CTA-SALE_Angle-W_M-NONE_VL-None_G-NONE_P-NONE_S-NONE,3723 - Notion Idea #92 MAN BOOBS || Enhancements: OFF || CBV1 || Batch 4 || 1C || 28/01/25w05 || Kostas,SHARE,$111,"6,486",2025-01-28,2025-03-07,38
165,CB_2025_Jan_FB_3721_LZ-RP_V01_4x5_IMG_EN_New_C-Headline_Evergreen_CTA-NONE_Angle-W_M-NONE_VL-None_G-NONE_P-NONE_S-NONE,3721 - real men dont ad || Enhancements: OFF || CBV1 || Batch 1 || 1C || 26/01/25w05 || Kostas,SHARE,$109,"4,841",2025-01-26,2025-01-30,4
166,CB_2025_Jan_FB_3727_DT-DP_V03_4x5_VID_EN_New_C-Dance_Sale_CTA-70_Angle-W_M-POW_VL-30s_G-M_P-OG_S-NEW,3727 - Kinda new kinda opti || Enhancements: OFF || CBV1 || Batch 1 || 1C || 28/01/25w05 || Kostas,SHARE,$109,"2,404",2025-01-28,2025-01-31,3
167,CB_2025_Jan_FB_3726_LZ-JG_V02_4x5_IMG_EN_Opti_C-Headline_Evergreen_CTA-NONE_Angle-W_M-NONE_VL-None_G-NONE_P-OG_S-NONE_FB3357V01,3726 - domperignon opti || Enhancements: OFF || CBV1 || Batch 1 || 7C || 22/01/25w04,SHARE,$103,"3,603",2025-01-22,2025-02-03,12
168,Taboola - ColonB 3.webp,US || VSL || Aff's image + Taboola ad || Batch 1 || Landing: new5/pre-1 || 1C || 28/01/25,SHARE,$102,"3,118",2025-01-28,2025-02-05,8
169,CB_2025_Jan_FB_3741_LZ-JG_V02_4x5_IMG_EN_Opti_C-Headline_Evergreen_CTA-NONE_Angle-W_M-NONE_VL-None_G-NONE_P-CBV2_S-NONE_FB3357V01,AU || 3741 - V2 dom perignon 2 || 1C || 29/01/2025w05,SHARE,$101,"4,976",2025-01-30,2025-02-20,21
170,CB_2025_Jan_FB_3731_DT-DP_V02_4x5_IMG_EN_New_C-Headline_Evergreen_CTA-NONE_Angle-W_M-NONE_VL-None_G-NONE_P-OG_S-NONE,3731 - New idea mom belly || Enhancements: OFF || CBV1 || Batch 1 || 1C || 29/01/25w05 || Kostas,SHARE,$100,"4,892",2025-01-29,2025-02-07,9
171,CB_2025_Jan_FB_3733_SO-JT_V03_4x5_IMG_EN_New_C-Headline_Evergreen_CTA-NONE_Angle-Detox_M-NONE_VL-None_G-NONE_P-NONE_S-NONE,3733 - CB - Sugar detox || Enhancements: OFF || CBV1 || Batch 1 || 1C || 29/01/25w05 || Kostas,SHARE,$100,"4,680",2025-01-29,2025-02-02,4
172,CB_2024_Nov_FB_3264_LZ_V29_4x5_VID_EN_Opti_C-NegativeMark_Sale_CTA-BF_Angle-W-B_M-LRNS_VL-30s_G-M_P-OG_S-NONE,ASC+ || VIDEO Only || US || 0% EXISTING CAP || 1C || 08.12.24  Ad set,SHARE,$98,"3,352",2024-12-08,2025-01-27,50
173,CB_2025_Jan_FB_3728_LZ_V04_4x5_IMG_EN_CB_2025_Jan_FB_3728_LZ_V04_9x16_IMG_EN_New_C-Testimonial_Evergreen_CTA-NONE_Angle-W-C_M-NONE_VL-None_G-NONE_P-OG_S-NONE.jpg_C-Testimonial_Evergreen_CTA-NONE_Angle-W-C_M-NONE_VL-None_G-NONE_P-OG_S-NONE,3728 - grid style testimonials || Enhancements: OFF || CBV1 || Batch 1 || 1C || 28/01/25w05 || Kostas,SHARE,$97,"2,577",2025-01-28,2025-01-31,3
174,CB_2025_Jan_FB_3728_LZ_V02_4x5_IMG_EN_CB_2025_Jan_FB_3728_LZ_V04_9x16_IMG_EN_New_C-Testimonial_Evergreen_CTA-NONE_Angle-W-C_M-NONE_VL-None_G-NONE_P-OG_S-NONE.jpg_C-Testimonial_Evergreen_CTA-NONE_Angle-W-C_M-NONE_VL-None_G-NONE_P-OG_S-NONE,3728 - grid style testimonials || Enhancements: OFF || CBV1 || Batch 1 || 1C || 28/01/25w05 || Kostas,SHARE,$95,"1,816",2025-01-28,2025-01-31,3
175,CB_2025_Jan_FB_3723_SO_V02_4x5_IMG_EN_New_C-NONE_Evergreen_CTA-SALE_Angle-W_M-NONE_VL-None_G-NONE_P-NONE_S-NONE,3723 - Notion Idea #92 MAN BOOBS || Enhancements: OFF || CBV1 || Batch 1 || 1C || 28/01/25w05 || Kostas,SHARE,$95,"7,514",2025-01-28,2025-02-24,27
176,CB_2025_Jan_FB_3715_SO-JT_V04_4x5_IMG_EN_New_C-Headline_Evergreen_CTA-SALE_Angle-W_M-NONE_VL-None_G-NONE_P-NONE_S-NONE,3715 - Notion Idea #107 In our DMs || Enhancements: OFF || CBV1 || Batch 1 || 1C || 26/01/25w05 || Kostas,SHARE,$89,"7,795",2025-01-26,2025-01-29,3
177,CB_2025_Jan_FB_3696_CHUB_V04_4x5_IMG_EN_New_C-NONE_CTA-NONE_Angle-C_M-NONE_VL-None_TR-None_G-NONE_P-NONE_S-NONE,3696 Struggling with Poop rocks CHUB || Enhancements: OFF || CBV1 || Batch 2 || 1C || 22/01/25w04,SHARE,$88,"5,606",2025-01-22,2025-02-02,11
178,IM_CB4.png,US || VSL || Aff's image || Landing: Directly to VSL || 1C || 16/01/25,SHARE,$87,"1,231",2025-01-16,2025-01-28,12
179,CB_2025_Jan_FB_3707_VK-JT_V03_4x5_IMG_EN_New_C-BulletPoints_Sale_CTA-NY_Angle-W-B-C_M-NONE_VL-None_G-NONE_P-OG_S-NONE,3712 - #108 Comics ad - VK-JT || Enhancements: OFF || CBV1 || Batch 1 || 1C || 26/01/25w05 || Kostas,SHARE,$85,"4,603",2025-01-26,2025-01-29,3
180,CB_2025_Jan_FB_3700_SO_V09_4x5_IMG_EN_New_C-Headline_Evergreen_CTA-NONE_Angle-W-B-C_M-NONE_VL-None_G-NONE_P-NONE_S-NONE,3700 - Notion Idea #90 THE 5 RULES || Enhancements: OFF || CBV1 || Batch 1 || 1C || 21/01/25w04 || Kostas,SHARE,$85,"3,129",2025-01-21,2025-01-30,9
181,CB_2025_Jan_FB_3726_LZ-JG_V03_4x5_IMG_EN_Opti_C-Headline_Evergreen_CTA-NONE_Angle-W_M-NONE_VL-None_G-NONE_P-OG_S-NONE_FB3357V01,3726 - domperignon opti || Enhancements: OFF || CBV1 || Batch 1 || 7C || 22/01/25w04,SHARE,$83,"2,756",2025-01-22,2025-02-03,12
182,CB_2025_Jan_FB_3722_VK-JG_V12_4x5_IMG_EN_New_C-Testimonial_Sale_CTA-NY_Angle-W-B-C_M-NONE_VL-None_G-M_P-OG_S-NONE,3722 - mens testi || Enhancements: OFF || CBV1 || Batch 3 || 1C || 28/01/25w05 || Kostas,SHARE,$81,"2,330",2025-01-28,2025-01-31,3
183,CB_2024_Sep_FB_3175_DA-KB_V02_1x1_IMG_EN_New_C-ADVRT_Evergreen_CTA-NONE_Angle-W_M-NONE_VL-None_G-NONE_P-CBV2_S-NONE_blog_colonbroomvsmammoth_cv_en,CBV2 || Advantage+ || Advertorial || Higher pricing || US || 0% EXISTING CAP || BROAD || 7C || 20/01/25  Campaign Ad set,SHARE,$78,"4,137",2025-01-20,2025-03-27,66
184,CB_2025_Jan_FB_3742_SO-DP-KB_V03_4x5_IMG_EN_Opti_C-NONE_Evergreen_CTA-SALE_Angle-W_M-NONE_VL-None_G-NONE_P-CBV2_S-NONE3665V01,3742 -  3665_V01 OPTI for PREMIUM 2 || Batch 1 || 1C || 29/01/2025w05,SHARE,$78,"4,306",2025-01-30,2025-02-10,11
185,CB_2024_Feb_FB_2814_MB-DP_V07_1x1_IMG_EN_New_C-WeightLoss_CTA-CTA_Pain-W-B-C_M-NONE_VL-None_TR-None_G-F_P-V2_S-NONE_2410V06,EU (UK) || clinically proven opti || 1C || 23/01/2025w04,SHARE,$76,"3,281",2025-01-23,2025-03-10,46
186,CB_2025_Jan_FB_3735_VK_V04_4x5_VID_EN_New_C-BulletPoints_Sale_CTA-NY_Angle-W-B-C_M-NONE_VL-None_G-NONE_P-OG_S-NONE,3735 - OPTI 3619 -VK || Enhancements: OFF || CBV1 || Batch 1 || 1C || 29/01/25w05 || Kostas,SHARE,$76,"4,386",2025-01-29,2025-02-07,9
187,CB_2025_Jan_FB_3715_SO-JT_V01_4x5_IMG_EN_New_C-Headline_Evergreen_CTA-SALE_Angle-W_M-NONE_VL-None_G-NONE_P-NONE_S-NONE,3715 - Notion Idea #107 In our DMs || Enhancements: OFF || CBV1 || Batch 1 || 1C || 26/01/25w05 || Kostas,SHARE,$76,"2,542",2025-01-26,2025-01-29,3
188,CB_2025_Jan_FB_3718_CHUB_V03_4x5_IMG_EN_Opti_C-NONE_CTA-NONE_Angle-C_M-NONE_VL-None_TR-None_G-M_P-OG_S-NONE,3718 - Looking 15 people OPTI || Enhancements: OFF || CBV1 || Batch 1 || 1C || 29/01/25w05 || Kostas,SHARE,$75,"3,414",2025-01-29,2025-02-07,9
189,CB_2025_Jan_FB_3710_SO-RP_V04_4x5_IMG_EN_New_C-Headline_Evergreen_CTA-SALE_Angle-W-B-C_M-NONE_VL-None_G-NONE_P-NONE_S-NONE,3711 - VDAY top ads 2024 opti || Enhancements: OFF || CBV1 || Batch 1 || 1C || 26/01/25w05 || Kostas,SHARE,$75,"2,101",2025-01-26,2025-01-30,4
190,CB_2025_Jan_FB_3717_CHUB_V01_4x5_IMG_EN_New_C-NONE_CTA-NONE_Angle-C_M-NONE_VL-None_TR-None_G-M_P-OG_S-NONE,3717 - Lunar New Year sale || Enhancements: OFF || CBV1 || Batch 1 || 1C || 29/01/25w05 || Kostas,SHARE,$75,"3,550",2025-01-29,2025-02-03,5
191,CB_2024_Jan_FB_2717_MB-RP_V26_9x16_VID_EN_New_C-Buzz_CTA-SALE_Pain-W-B-C_M-MIX_VL-45s_TR-None_G-MF_P-Method_S-NONE,CA || COST CAP 92->93 || 7C || 10/05/24 || V1,VIDEO,$74,"3,589",2024-08-22,2025-02-27,189
192,CB_2025_Jan_FB_3072_V02_4x5_IMG_EN_New_C-Headline_Seasonal_CTA-None_Angle-W_M-NONE_VL-None_G-NONE_P-OG_S-NONE,CBV2 || EU (UK) || ðŸ’° Advantage+ || US || BROAD || 7C || Existing_customer_5% || 15/12/24 Ad set,SHARE,$73,"3,391",2025-01-17,2025-03-14,56
193,CB_2025_Jan_FB_3728_LZ_V01_4x5_IMG_EN_CB_2025_Jan_FB_3728_LZ_V04_9x16_IMG_EN_New_C-Testimonial_Evergreen_CTA-NONE_Angle-W-C_M-NONE_VL-None_G-NONE_P-OG_S-NONE.jpg_C-Testimonial_Evergreen_CTA-NONE_Angle-W-C_M-NONE_VL-None_G-NONE_P-OG_S-NONE,3728 - grid style testimonials || Enhancements: OFF || CBV1 || Batch 1 || 1C || 28/01/25w05 || Kostas,SHARE,$72,"1,892",2025-01-28,2025-01-31,3
194,CB_2025_Jan_FB_3660_CHUB_V02_4x5_IMG_EN_New_C-NONE_CTA-NONE_Angle-C_M-NONE_VL-None_TR-None_G-NONE_P-NONE_S-NONE,3660 - G-nuggets winner ITR || Enhancements: OFF || CBV1 || Batch 1 || 1C || 14/01/25w03 || Kostas,SHARE,$72,"3,954",2025-01-14,2025-01-27,13
195,CB_2025_Jan_FB_3710_SO-RP_V05_4x5_IMG_EN_New_C-Headline_Evergreen_CTA-SALE_Angle-W-B-C_M-NONE_VL-None_G-NONE_P-NONE_S-NONE,3711 - VDAY top ads 2024 opti || Enhancements: OFF || CBV1 || Batch 1 || 1C || 26/01/25w05 || Kostas,SHARE,$70,"2,067",2025-01-26,2025-01-30,4
196,CB_2025_Jan_FB_3702_VK_V01_4x5_IMG_EN_New_C-BulletPoints_Sale_CTA-NY_Angle-W-B-C_M-NONE_VL-None_G-NONE_P-OG_S-NONE,3702 - #88 I CAN lose fat without losing muscle! VK || Enhancements: OFF || CBV1 || Batch 1 || 1C || 21/01/25w04 || Kostas,SHARE,$69,"3,000",2025-01-21,2025-01-27,6
197,CB_2025_Jan_FB_3750_LZ-VU_V03_4x5_IMG_EN_Opti_C-NegativeMark_Evergreen_CTA-NONE_Angle-W_M-NONE_VL-None_G-NONE_P-NONE_S-NONE_FB3251V01,3750 - bioma ripoff march soft version || Enhancements: OFF || CBV1 || Batch 1 || 1C || 24/01/25w04 || Kostas,SHARE,$68,"1,817",2025-01-24,2025-01-28,4
198,CB_2025_Jan_FB_3708_JT_V04_4x5_IMG_EN_New_C-Headline_Evergreen_CTA-NONE_Angle_CR_P-OG,3708 - NO MORE CRAVINGS  || Enhancements: OFF || CBV1 || Batch 1 || 1C || 22/01/25w04 || Kostas,SHARE,$66,"3,545",2025-01-22,2025-01-27,5
199,CB_2025_Jan_FB_3722_VK-JG_V07_4x5_IMG_EN_New_C-Testimonial_Sale_CTA-NY_Angle-W-B-C_M-NONE_VL-None_G-M_P-OG_S-NONE,3722 - mens testi || Enhancements: OFF || CBV1 || Batch 2 || 1C || 28/01/25w05 || Kostas,SHARE,$65,"1,495",2025-01-28,2025-01-31,3
200,CB_2025_Jan_FB_3709_VK-JT_V02_4x5_IMG_EN_New_C-BulletPoints_Sale_CTA-NY_Angle-W-B-C_M-NONE_VL-None_G-M_P-OG_S-NONE,3709 -Notion Sigma male #109 VK-JT || Enhancements: OFF || CBV1 || Batch 1 || 1C || 29/01/25w05 || Kostas,SHARE,$65,"3,848",2025-01-29,2025-02-05,7
201,CB_2025_Jan_FB_3742_SO-DP-KB_V03_4x5_IMG_EN_Opti_C-NONE_Evergreen_CTA-SALE_Angle-W_M-NONE_VL-None_G-NONE_P-CBV2_S-NONE3665V01,3742 -  3665_V01 OPTI for PREMIUM 3 || 1C || 31/01/2025w05,SHARE,$63,"2,593",2025-01-31,2025-02-10,10
202,CB_2025_Jan_FB_3715_SO-JT_V05_4x5_IMG_EN_New_C-Headline_Evergreen_CTA-SALE_Angle-W_M-NONE_VL-None_G-NONE_P-NONE_S-NONE,3715 - Notion Idea #107 In our DMs || Enhancements: OFF || CBV1 || Batch 1 || 1C || 26/01/25w05 || Kostas,SHARE,$63,"2,101",2025-01-26,2025-01-29,3
203,CB_2025_Jan_FB_3733_SO-JT_V04_4x5_IMG_EN_New_C-Headline_Evergreen_CTA-NONE_Angle-Detox_M-NONE_VL-None_G-NONE_P-NONE_S-NONE,3733 - CB - Sugar detox || Enhancements: OFF || CBV1 || Batch 1 || 1C || 29/01/25w05 || Kostas,SHARE,$63,"2,956",2025-01-29,2025-02-02,4
204,CB_2025_Jan_FB_3746_CHUB-AA_V05_4x5_IMG_EN_Opti_C-NONE_CTA-NONE_Angle-C_M-NONE_VL-None_TR-None_G-NONE_P-NONE_S-NONE,3746 â€“ 3660 G-nugget OPTI v3 || Enhancements: OFF || CBV1 || Batch 2 || 1C || 30/01/25w05 || Kostas,SHARE,$63,"3,965",2025-01-30,2025-02-14,15
205,CB_2023_Nov_FB_2648_DT_V01_1x1_GIF_EN_Opti_C-Sale_CTA-XMAS_None_M-NONE_VL-None_TR-None_G-NONE_P-OG_S-NONE,ðŸ’°WC || US || Advantage+ || BIG BUDGET || CC101->105->109->112->114-116->117 || BROAD || ABO || 1C || 17/01/24 RELAUNCHED Ad set,VIDEO,$61,"1,110",2024-01-17,2025-02-06,386
206,CB_2025_Jan_FB_3731_DT-DP_V01_4x5_IMG_EN_New_C-Headline_Evergreen_CTA-NONE_Angle-W_M-NONE_VL-None_G-NONE_P-OG_S-NONE,3731 - New idea mom belly || Enhancements: OFF || CBV1 || Batch 1 || 1C || 29/01/25w05 || Kostas,SHARE,$59,"2,943",2025-01-29,2025-02-07,9
207,CB_2025_Jan_FB_3722_VK-JG_V01_4x5_IMG_EN_New_C-Testimonial_Sale_CTA-NY_Angle-W-B-C_M-NONE_VL-None_G-M_P-OG_S-NONE,3722 - mens testi || Enhancements: OFF || CBV1 || Batch 1 || 1C || 28/01/25w05 || Kostas,SHARE,$58,"2,207",2025-01-28,2025-01-31,3
208,CB_2024_Nov_FB_3264_LZ_V31_4x5_VID_EN_Opti_C-MakingOf_Sale_CTA-BF_Angle-W-B_M-CRAZY_VL-45s_G-M_P-OG_S-NEW_FB3004V02,CBV2 || AU || ðŸ’° Advantage+ || US || BROAD || 7C || Existing_customer_5% || 19/12/24 Ad set,VIDEO,$58,"1,821",2024-12-19,2025-03-27,98
209,CB_2025_Jan_FB_3742_SO-DP-KB_V05_4x5_IMG_EN_Opti_C-NONE_Evergreen_CTA-SALE_Angle-W_M-NONE_VL-None_G-NONE_P-CBV2_S-NONE3665V01,3742 -  3665_V01 OPTI for PREMIUM 2 || Batch 2 || 1C || 31/01/2025w05,SHARE,$58,"3,911",2025-01-31,2025-02-18,18
210,CB_2023_May_FB_2103_MB_V02_9x16_VID_EN_Opti_C-Sale_CTA-SMR_Pain-W_M-JOG_VL-30s_TR-None_G-M-F_P-None_S-What,US || Manual Bid || BFCM || COST CAP 91 || 1C || 15/11/24,VIDEO,$57,"1,661",2024-11-15,2025-02-27,104
211,CB_2024_Feb_FB_2834_DA_V04_4x5_IMG_EN_Opti_C-SingleTesti_CTA-NONE_Pain-W_M-NONE_VL-None_TR-None_G-NONE_P-V2_S-NONE_FB2759V04,CBV2 || EU (UK) || ðŸ’° Advantage+ || US || BROAD || 7C || Existing_customer_5% || 15/12/24 Ad set,SHARE,$56,"2,555",2024-12-15,2025-01-31,47
212,CB_2025_Jan_FB_3704_SO_V05_4x5_IMG_EN_New_C-Headline_Evergreen_CTA-NONE_Angle-W-B-C_M-NONE_VL-None_G-NONE_P-NONE_S-NONE,3704 - Notion Idea #89 FOR REAL MEN || Enhancements: OFF || CBV1 || Batch 1 || 1C || 26/01/25w05 || Kostas,SHARE,$55,"2,097",2025-01-26,2025-02-08,13
213,CB_2024_Dec_FB_3601_VK-DP_V09_4x5_VID_EN_Opti_C-Dance_CTA-NY_Pain-W-B_M-JOG_VL-30s_TR-None_G-F_P-OG_S-WHAT_FB3045V01 - Copy,ðŸ’°WC || US || Advantage+ || BIG BUDGET || CC101->105->109->112->114-116->117 || BROAD || ABO || 1C || 17/01/24 RELAUNCHED Ad set,VIDEO,$54,"1,469",2024-12-27,2025-02-06,41
214,CB_2025_Jan_FB_3704_SO_V09_4x5_IMG_EN_New_C-Headline_Evergreen_CTA-NONE_Angle-W-B-C_M-NONE_VL-None_G-NONE_P-NONE_S-NONE,3704 - Notion Idea #89 FOR REAL MEN || Enhancements: OFF || CBV1 || Batch 2 || 1C || 26/01/25w05 || Kostas,SHARE,$54,"2,306",2025-01-26,2025-01-29,3
215,CB_2025_Jan_FB_3718_CHUB_V01_4x5_IMG_EN_Opti_C-NONE_CTA-NONE_Angle-C_M-NONE_VL-None_TR-None_G-M_P-OG_S-NONE,3718 - Looking 15 people OPTI || Enhancements: OFF || CBV1 || Batch 1 || 1C || 29/01/25w05 || Kostas,SHARE,$54,"2,795",2025-01-29,2025-02-07,9
216,CB_2025_Jan_FB_3716_CHUB_V02_4x5_IMG_EN_Opti_C-NONE_CTA-NONE_Angle-C_M-NONE_VL-None_TR-None_G-M_P-OG_S-NONE,3716 - Valentines day event OPTI || Enhancements: OFF || CBV1 || Batch 2 || 1C || 29/01/25w05 || Kostas,SHARE,$53,"2,660",2025-01-29,2025-02-09,11
217,CB_2025_Jan_FB_3723_SO_V12_4x5_IMG_EN_New_C-NONE_Evergreen_CTA-SALE_Angle-W_M-NONE_VL-None_G-NONE_P-NONE_S-NONE,3723 - Notion Idea #92 MAN BOOBS || Enhancements: OFF || CBV1 || Batch 3 || 1C || 28/01/25w05 || Kostas,SHARE,$53,"3,916",2025-01-28,2025-01-31,3
218,CB_2024_Dec_FB_3608_LZ-DP_V04_4x5_IMG_EN_New_C-Headline_Evergreen_CTA-NONE_Angle-W_M-NONE_VL-None_G-NONE_P-OG_S-NONE,US || Manual Bid: ROAS GOAL: 0.9 -> 1.00 || 7DC || 23/01/2025,SHARE,$52,"2,136",2025-01-23,2025-01-30,7
219,Taboola - ColonB 3.webp,US || VSL || Aff's image + Taboola ad || Batch 1 || Landing: /quiz/pre-1 || 1C || 30/01/25,SHARE,$50,"1,601",2025-01-30,2025-02-04,5
220,CB_2025_Jan_FB_3722_VK-JG_V10_4x5_IMG_EN_New_C-Testimonial_Sale_CTA-NY_Angle-W-B-C_M-NONE_VL-None_G-M_P-OG_S-NONE,3722 - mens testi || Enhancements: OFF || CBV1 || Batch 3 || 1C || 28/01/25w05 || Kostas,SHARE,$49,"1,583",2025-01-28,2025-01-31,3
221,CB_2025_Jan_FB_3746_CHUB-AA_V08_4x5_IMG_EN_Opti_C-NONE_CTA-NONE_Angle-C_M-NONE_VL-None_TR-None_G-NONE_P-NONE_S-NONE,3746 â€“ 3660 G-nugget OPTI v3 || Enhancements: OFF || CBV1 || Batch 2 || 1C || 30/01/25w05 || Kostas,SHARE,$49,"2,795",2025-01-30,2025-02-14,15
222,CB_2025_Jan_FB_3724_CHUB-AA_V03_4x5_IMG_EN_New_C-NONE_CTA-NONE_Angle-C_M-NONE_VL-None_TR-None_G-M_P-OG_S-NONE,3724 Get Regular CHUB || Enhancements: OFF || CBV1 || Batch 1 || 1C || 29/01/25w05 || Kostas,SHARE,$48,"3,326",2025-01-29,2025-01-31,2
223,Taboola - ColonB - 7.png,US || VSL || Aff's image || Batch 2 (mostly Taboola ads) || Landing: pre-1 || 1C || 19/01/25,SHARE,$47,"1,621",2025-01-19,2025-01-28,9
224,CB_2025_Jan_FB_3700_SO_V01_4x5_IMG_EN_New_C-Headline_Evergreen_CTA-NONE_Angle-W-B-C_M-NONE_VL-None_G-NONE_P-NONE_S-NONE,3700 - Notion Idea #90 THE 5 RULES || Enhancements: OFF || CBV1 || Batch 1 || 1C || 21/01/25w04 || Kostas,SHARE,$47,"1,779",2025-01-21,2025-01-30,9
225,CB_2025_Jan_FB_3742_SO-DP-KB_V04_4x5_IMG_EN_Opti_C-NONE_Evergreen_CTA-SALE_Angle-W_M-NONE_VL-None_G-NONE_P-CBV2_S-NONE3665V01,3742 -  3665_V01 OPTI for PREMIUM 2 || Batch 2 || 1C || 31/01/2025w05,SHARE,$46,"2,765",2025-01-31,2025-02-18,18
226,CB_2025_Jan_FB_3727_DT-DP_V02_4x5_VID_EN_New_C-Dance_Sale_CTA-70_Angle-W_M-POW_VL-30s_G-M_P-OG_S-NEW,3727 - Kinda new kinda opti || Enhancements: OFF || CBV1 || Batch 1 || 1C || 28/01/25w05 || Kostas,SHARE,$45,"1,229",2025-01-28,2025-01-31,3
227,IM_CB5.png,US || VSL || Aff's image || Landing: Directly to VSL || 1C || 16/01/25,SHARE,$45,755,2025-01-16,2025-01-28,12
228,CB_2024_Feb_FB_2834_DA_V02_4x5_IMG_EN_Opti_C-SingleTesti_CTA-NONE_Pain-W_M-NONE_VL-None_TR-None_G-NONE_P-V2_S-NONE_FB2759V04,CBV2 || EU (UK) || ðŸ’° Advantage+ || US || BROAD || 7C || Existing_customer_5% || 15/12/24 Ad set,SHARE,$44,"1,793",2024-12-15,2025-01-31,47
229,Taboola - ColonB 3.webp,US || VSL || Aff's image + Taboola ad || Batch 1 || Landing: new3/pre-1 || 1C || 28/01/25,SHARE,$43,"1,081",2025-01-28,2025-01-31,3
230,Taboola - ColonB - 17.jpg,US || VSL || Aff's image || Batch 2 (mostly Taboola ads) || Landing: pre-1 || 1C || 19/01/25,SHARE,$43,"2,037",2025-01-19,2025-01-28,9
231,CB_2023_May_FB_2103_MB_V02_9x16_VID_EN_Opti_C-Sale_CTA-SMR_Pain-W_M-JOG_VL-30s_TR-None_G-M-F_P-None_S-What,US || Manual Bid || BFCM || ROAS GOAL: 1.4 || 1C || 15/11/24,VIDEO,$43,890,2024-11-15,2025-02-27,104
232,CB_2025_Jan_FB_3656_JT_V03_4x5_IMG_EN_New_C-Headline_Seasonal_CTA-70_Angle-W_M-NONE_VL-None_G-NONE_P-OG_S-NONE,AU || 3656 - we_re leaving || 1C || 15/01/2025w03,SHARE,$42,"1,703",2025-01-15,2025-01-27,12
233,CB_2025_Jan_FB_3711_DT_V07_4x5_VID_EN_Opti_C-Testimonial_Sale_CTA-VDAY_Angle-W_M-TRC_VL-45s_G-F_P-OG_S-MOON_FB2764V04,3711 - VDAY top ads 2024 opti 3 || Enhancements: OFF || CBV1 || Batch 2 || 1C || 29/01/25w05 || Kostas,SHARE,$41,"1,941",2025-01-29,2025-02-02,4
234,CB_2025_Jan_FB_3706_DT-JG_V02_4x5_IMG_EN_New_C-Headline_Evergreen_CTA-NONE_Angle-W_M-NONE_VL-None_G-M_P-OG_S-NONE,3706 - #110 Notion || Enhancements: OFF || CBV1 || Batch 1 || 1C || 22/01/25w04 || Kostas,SHARE,$41,"2,564",2025-01-22,2025-01-27,5
235,CB_2025_Jan_FB_3737_DT_V02_4x5_IMG_EN_New_C-BulletPoints_Evergreen_CTA-NONE_Angle-W_M-NONE_VL-None_G-NONE_P-OG_S-NONE_FB3682V03,3737 - Opti 3682 || Enhancements: OFF || CBV1 || Batch 1 || 1C || 29/01/25w05 || Kostas,SHARE,$40,"3,259",2025-01-29,2025-02-05,7
236,CB_2025_Jan_FB_3724_CHUB-AA_V01_4x5_IMG_EN_New_C-NONE_CTA-NONE_Angle-C_M-NONE_VL-None_TR-None_G-M_P-OG_S-NONE,3724 Get Regular CHUB || Enhancements: OFF || CBV1 || Batch 1 || 1C || 29/01/25w05 || Kostas,SHARE,$40,"3,304",2025-01-29,2025-02-13,15
237,CB_2025_Jan_FB_3723_SO_V03_4x5_IMG_EN_New_C-NONE_Evergreen_CTA-SALE_Angle-W_M-NONE_VL-None_G-NONE_P-NONE_S-NONE,3723 - Notion Idea #92 MAN BOOBS || Enhancements: OFF || CBV1 || Batch 1 || 1C || 28/01/25w05 || Kostas,SHARE,$39,"2,699",2025-01-28,2025-02-24,27
238,Taboola - ColonB 3.webp,US || VSL || Aff's image + Taboola ad || Batch 1 || Landing: new6/pre-1 || 1C || 28/01/25,SHARE,$39,"1,141",2025-01-28,2025-02-03,6
239,CB_2025_Jan_FB_3700_SO_V04_4x5_IMG_EN_New_C-Headline_Evergreen_CTA-NONE_Angle-W-B-C_M-NONE_VL-None_G-NONE_P-NONE_S-NONE,3700 - Notion Idea #90 THE 5 RULES || Enhancements: OFF || CBV1 || Batch 1 || 1C || 21/01/25w04 || Kostas,SHARE,$38,"1,061",2025-01-21,2025-01-30,9
240,CB_2025_Jan_FB_3715_SO-JT_V03_4x5_IMG_EN_New_C-Headline_Evergreen_CTA-SALE_Angle-W_M-NONE_VL-None_G-NONE_P-NONE_S-NONE,3715 - Notion Idea #107 In our DMs || Enhancements: OFF || CBV1 || Batch 1 || 1C || 26/01/25w05 || Kostas,SHARE,$38,"2,027",2025-01-26,2025-01-29,3
241,CB_2025_Jan_FB_3723_SO_V13_4x5_IMG_EN_New_C-NONE_Evergreen_CTA-SALE_Angle-W_M-NONE_VL-None_G-NONE_P-NONE_S-NONE,3723 - Notion Idea #92 MAN BOOBS || Enhancements: OFF || CBV1 || Batch 3 || 1C || 28/01/25w05 || Kostas,SHARE,$38,"2,638",2025-01-28,2025-01-31,3
242,Taboola - ColonB 3.webp,US || VSL || Aff's image + Taboola ad || Batch 1 || Landing: new7/pre-1 || 1C || 28/01/25,SHARE,$38,874,2025-01-28,2025-01-31,3
243,CB_2025_Jan_FB_3722_VK-JG_V08_4x5_IMG_EN_New_C-Testimonial_Sale_CTA-NY_Angle-W-B-C_M-NONE_VL-None_G-M_P-OG_S-NONE,3722 - mens testi || Enhancements: OFF || CBV1 || Batch 2 || 1C || 28/01/25w05 || Kostas,SHARE,$37,"1,117",2025-01-28,2025-01-31,3
244,CB_2025_Jan_FB_3727_DT-DP_V04_4x5_VID_EN_New_C-Dance_Sale_CTA-70_Angle-W_M-POW_VL-30s_G-M_P-OG_S-NEW,3727 - Kinda new kinda opti || Enhancements: OFF || CBV1 || Batch 1 || 1C || 28/01/25w05 || Kostas,SHARE,$36,"1,197",2025-01-28,2025-01-30,2
245,CB_2025_Jan_FB_3765_SO-JT_V02_1x1_IMG_EN_New_C-Headline_Evergreen_CTA-NONE_Angle-W_M-NONE_VL-None_G-NONE_P-NONE_S-NONE,3765 - SUGAR DETOX 2 IMG || Enhancements: OFF || CBV1 || Batch Ä… || 1C || 02/02/25w06 || Kostas,SHARE,$36,"1,953",2025-02-02,2025-02-07,5
246,CB_2025_Jan_FB_3747_CHUB-AA_V03_9x16_IMG_EN_Opti_C-NONE_CTA-NONE_Angle-Sale_M-NONE_VL-None_TR-None_G-NONE_P-OG_S-NONE,3747 Clean Sale [HB winner ITR] CHUB || Enhancements: OFF || CBV1 || Batch Ä… || 1C || 02/02/25w06 || Kostas,SHARE,$36,"1,679",2025-02-02,2025-03-27,53
247,CB_2025_Jan_FB_3704_SO_V08_4x5_IMG_EN_New_C-Headline_Evergreen_CTA-NONE_Angle-W-B-C_M-NONE_VL-None_G-NONE_P-NONE_S-NONE,3704 - Notion Idea #89 FOR REAL MEN || Enhancements: OFF || CBV1 || Batch 2 || 1C || 26/01/25w05 || Kostas,SHARE,$35,852,2025-01-26,2025-01-29,3
248,CB_2024_Dec_FB_3601_VK-DP_V09_4x5_VID_EN_Opti_C-Dance_CTA-NY_Pain-W-B_M-JOG_VL-30s_TR-None_G-F_P-OG_S-WHAT_FB3045V01,CBV2 || AU || ðŸ’° Advantage+ || US || BROAD || 7C || Existing_customer_5% || 19/12/24 Ad set,SHARE,$33,918,2025-01-03,2025-03-27,83
249,CB_2025_Jan_FB_3711_DT_V06_4x5_VID_EN_Opti_C-BulletPoints_Sale_CTA-VDAY_Angle-W-B_M-Nonie_VL-45s_G-F_P-OG_S-WHAT_FB3164V02,3711 - VDAY top ads 2024 opti 3 || Enhancements: OFF || CBV1 || Batch 2 || 1C || 29/01/25w05 || Kostas,SHARE,$33,"1,377",2025-01-29,2025-02-02,4
250,CB_2025_Jan_FB_3742_SO-DP-KB_V02_4x5_IMG_EN_Opti_C-NONE_Evergreen_CTA-SALE_Angle-W_M-NONE_VL-None_G-NONE_P-CBV2_S-NONE3665V01,3742 -  3665_V01 OPTI for PREMIUM 2 || Batch 1 || 1C || 29/01/2025w05,SHARE,$32,"1,866",2025-01-30,2025-02-10,11
251,CB_2025_Jan_FB_3732_SO-JT_V03_4x5_IMG_EN_New_C-Headline_Evergreen_CTA-NONE_Angle-Detox_M-NONE_VL-None_G-NONE_P-NONE_S-NONE,3732 - CB - Cortisol detox || Enhancements: OFF || CBV1 || Batch 1 || 1C || 29/01/25w05 || Kostas,SHARE,$32,"1,899",2025-01-29,2025-02-03,5
252,CB_2022_Nov_FB_1218_RS_V15_9x16_IMG_EN_Opti_C-Sale_CTA-BLACK_Pain-W_M-NONE_VL-None FB1671V08,US || Manual Bid || BFCM || ROAS GOAL: 1.4 || 1C || 15/11/24,SHARE,$31,746,2024-11-15,2025-02-27,104
253,CB_2025_Jan_FB_3711_DT_V04_4x5_VID_EN_Opti_C-Dance_Sale_CTA-VDAY_Angle-W_M-MIX_VL-45s_G-F_P-OG_S-STARRY_FB1998V02,3711 - VDAY top ads 2024 opti 3 || Enhancements: OFF || CBV1 || Batch 1 || 1C || 29/01/25w05 || Kostas,SHARE,$31,"1,388",2025-01-29,2025-02-07,9
254,CB_2023_Oct_FB_2516_VK_V13_9x16_VID_EN_Opti_C-Benefits_CTA-AUTUM_Pain-W-B_M-PASQ_VL-30s_TR-None_G-M_P-Plan_S-WHAT,ðŸ’°WC || US || Advantage+ || BIG BUDGET || CC101->105->109->112->114-116->117 || BROAD || ABO || 1C || 17/01/24 RELAUNCHED Ad set,VIDEO,$31,"1,045",2024-01-17,2025-02-06,386
255,CB_2024_Mar_FB_2888_JG_V02_9x16_IMG_EN_Opti_C-Benefits_CTA-NONE_Pain-W_M-NONE_VL-None_TR-None_G-NONE_P-V2_S-NONE,CBV2 || AU || ðŸ’° Advantage+ || US || BROAD || 7C || Existing_customer_5% || 19/12/24 Ad set,SHARE,$31,"1,333",2024-12-19,2025-03-27,98
256,CB_2025_Jan_FB_3713_SO_V02_4x5_IMG_EN_Opti_C-Headline_Evergreen_CTA-SALE_Angle-W-B-C_M-NONE_VL-None_G-NONE_P-NONE_S-NONE3296V02,3713 - Tropical fruit Creative Opti 3296 || Enhancements: OFF || CBV1 || Batch 1 || 1C || 22/01/25w04 || Kostas,SHARE,$30,"1,992",2025-01-22,2025-01-27,5
257,CB_2025_Jan_FB_3716_CHUB_V04_4x5_IMG_EN_Opti_C-NONE_CTA-NONE_Angle-C_M-NONE_VL-None_TR-None_G-M_P-OG_S-NONE,3716 - Valentines day event OPTI || Enhancements: OFF || CBV1 || Batch 2 || 1C || 29/01/25w05 || Kostas,SHARE,$29,"1,092",2025-01-29,2025-02-09,11
258,CB_2025_Jan_FB_3713_SO_V01_4x5_IMG_EN_Opti_C-Headline_Evergreen_CTA-SALE_Angle-W-B-C_M-NONE_VL-None_G-NONE_P-NONE_S-NONE3296V02,3713 - Tropical fruit Creative Opti 3296 || Enhancements: OFF || CBV1 || Batch 1 || 1C || 22/01/25w04 || Kostas,SHARE,$28,"1,488",2025-01-22,2025-01-27,5
259,CB_2025_Jan_FB_3720_DT-DP_V03_4x5_CAROUSEL_EN_New_C-BulletPoints_Evergreen_CTA-NONE_Angle-W_M-NONE_VL-None_G-NONE_P-OG_S-NONE_1,3720 - #99 Foods you can eat || Enhancements: OFF || CBV1 || Batch 1 || 1C || 26/01/25w05 || Kostas,SHARE,$28,755,2025-01-26,2025-01-29,3
260,CB_2023_Jul_FB_2217_IB_V04_9x16_VID_EN_Opti_C-Pointing_CTA-SMR_Pain-W-B_M-TRC_VL-30s_TR-None_G-F_P-None_S-FRIGGA,US || Manual Bid || BFCM || COST CAP 91 || 1C || 15/11/24,VIDEO,$28,776,2024-11-15,2025-02-27,104
261,CB_2023_Jul_FB_2217_IB_V04_9x16_VID_EN_Opti_C-Pointing_CTA-SMR_Pain-W-B_M-TRC_VL-30s_TR-None_G-F_P-None_S-FRIGGA,US || Manual Bid: ROAS GOAL: 1.1 || 7DC || 28/01/2025,VIDEO,$28,811,2025-01-28,2025-02-11,14
262,CB_2025_Jan_FB_3743_VK-DP_V04_4x5_IMG_EN_New_C-BulletPoints_Sale_CTA-NY_Angle-W-B-C_M-NONE_VL-None_G-M_P-OG_S-NEW,3743 - 974 opti with new copy || Enhancements: OFF || CBV1 || Batch 1 || 1C || 28/01/25w05 || Kostas,SHARE,$28,"1,600",2025-01-28,2025-01-31,3
263,CB_2025_Jan_FB_3743_VK-DP_V03_4x5_IMG_EN_New_C-BulletPoints_Sale_CTA-NY_Angle-W-B-C_M-NONE_VL-None_G-M_P-OG_S-NEW,3743 - 974 opti with new copy || Enhancements: OFF || CBV1 || Batch 1 || 1C || 28/01/25w05 || Kostas,SHARE,$27,926,2025-01-28,2025-01-31,3
264,CB_2025_Jan_FB_3722_VK-JG_V06_4x5_IMG_EN_New_C-Testimonial_Sale_CTA-NY_Angle-W-B-C_M-NONE_VL-None_G-M_P-OG_S-NONE,3722 - mens testi || Enhancements: OFF || CBV1 || Batch 2 || 1C || 28/01/25w05 || Kostas,SHARE,$27,"1,055",2025-01-28,2025-01-31,3
265,CB_2025_Jan_FB_3743_VK-DP_V02_4x5_IMG_EN_New_C-BulletPoints_Sale_CTA-NY_Angle-W-B-C_M-NONE_VL-None_G-M_P-OG_S-NEW,3743 - 974 opti with new copy || Enhancements: OFF || CBV1 || Batch 1 || 1C || 28/01/25w05 || Kostas,SHARE,$27,"1,122",2025-01-28,2025-01-31,3
266,CB_2025_Jan_FB_3717_CHUB_V02_4x5_IMG_EN_New_C-NONE_CTA-NONE_Angle-C_M-NONE_VL-None_TR-None_G-M_P-OG_S-NONE,3717 - Lunar New Year sale || Enhancements: OFF || CBV1 || Batch 1 || 1C || 29/01/25w05 || Kostas,SHARE,$27,"1,371",2025-01-29,2025-02-03,5
267,CB_2024_Feb_FB_2814_MB-DP_V05_1x1_IMG_EN_New_C-WeightLoss_CTA-None_Pain-W-B-C_M-NONE_VL-None_TR-None_G-NONE_P-V2_S-NONE,CBV2 || EU (UK) || ðŸ’° Advantage+ || US || BROAD || 7C || Existing_customer_5% || 15/12/24 Ad set,SHARE,$25,"1,097",2025-01-31,2025-03-27,55
268,CB_2025_FEB_FB_3666_VK-JT_V03_4x5_VID_EN_NEW_C-BulletPoints_Sale_CTA-NY_Angle-W-B-C_M-TRC_VL-30s_G-F_P-OG_S-NEW,ðŸŒ¶ï¸ || US || ASC+ || ->CC141 || VIDEO Only || US+CA || 0% EXISTING CAP || 7C || 07/08.24  Ad set,VIDEO,$25,"1,193",2025-01-20,2025-03-19,58
269,CB_2025_Jan_FB_3660_CHUB_V03_4x5_IMG_EN_New_C-NONE_CTA-NONE_Angle-C_M-NONE_VL-None_TR-None_G-NONE_P-NONE_S-NONE,3660 - G-nuggets winner ITR || Enhancements: OFF || CBV1 || Batch 1 || 1C || 14/01/25w03 || Kostas,SHARE,$24,"1,354",2025-01-14,2025-01-27,13
270,CB_2025_Jan_FB_3711_DT_V05_4x5_VID_EN_Opti_C-MakingOf_Sale_CTA-VDAY_Angle-W-B-C_M-JOG_VL-45s_G-F_P-OG_S-MOON_FB3252V04,3711 - VDAY top ads 2024 opti 3 || Enhancements: OFF || CBV1 || Batch 1 || 1C || 29/01/25w05 || Kostas,SHARE,$24,"1,382",2025-01-29,2025-02-07,9
271,CB_2025_Jan_FB_3716_CHUB_V03_4x5_IMG_EN_Opti_C-NONE_CTA-NONE_Angle-C_M-NONE_VL-None_TR-None_G-M_P-OG_S-NONE,3716 - Valentines day event OPTI || Enhancements: OFF || CBV1 || Batch 2 || 1C || 29/01/25w05 || Kostas,SHARE,$24,868,2025-01-29,2025-02-09,11
272,CB_2025_Jan_FB_3696_CHUB_V01_4x5_IMG_EN_New_C-NONE_CTA-NONE_Angle-C_M-NONE_VL-None_TR-None_G-NONE_P-NONE_S-NONE,3696 Struggling with Poop rocks CHUB || Enhancements: OFF || CBV1 || Batch 2 || 1C || 22/01/25w04,SHARE,$23,"1,483",2025-01-22,2025-02-02,11
273,CB_2025_Jan_FB_3707_VK-JT_V02_4x5_IMG_EN_New_C-BulletPoints_Sale_CTA-NY_Angle-W-B-C_M-NONE_VL-None_G-NONE_P-OG_S-NONE,3712 - #108 Comics ad - VK-JT || Enhancements: OFF || CBV1 || Batch 1 || 1C || 26/01/25w05 || Kostas,SHARE,$23,"1,159",2025-01-26,2025-01-29,3
274,CB_2025_Jan_FB_3740_SO-DP_V04_4x5_IMG_EN_Opti_C-Headline_Evergreen_CTA-NONE_Angle-W_M-NONE_VL-None_G-NONE_P-OG_S-NONE_3608V03,3740 - 3608_v03 OPTI || Enhancements: OFF || CBV1 || Batch 1 || 1C || 29/01/25w05 || Kostas,SHARE,$23,"1,191",2025-01-29,2025-02-11,13
275,CB_2025_Jan_FB_3720_DT-DP_V04_4x5_CAROUSEL_EN_New_C-BulletPoints_Evergreen_CTA-NONE_Angle-W_M-NONE_VL-None_G-NONE_P-OG_S-NONE_1,3720 - #99 Foods you can eat || Enhancements: OFF || CBV1 || Batch 1 || 1C || 26/01/25w05 || Kostas,SHARE,$23,627,2025-01-26,2025-01-29,3
276,CB_2025_Jan_FB_3747_CHUB-AA_V01_4x5_IMG_EN_Opti_C-NONE_CTA-NONE_Angle-Sale_M-NONE_VL-None_TR-None_G-NONE_P-OG_S-NONE,3747 Clean Sale [HB winner ITR] CHUB || Enhancements: OFF || CBV1 || Batch Ä… || 1C || 02/02/25w06 || Kostas,SHARE,$23,"1,133",2025-02-02,2025-03-27,53
277,CB_2024_Oct_FB_3251_LZ-VU_V01_1x1_IMG_EN_New_C-NegativeMark_Evergreen_CTA-NONE_Angle-Cort_M-NONE_VL-None_G-NONE_P-NONE_S-NONE.png,US || Manual Bid || BFCM || ROAS GOAL: 1.4 || 1C || 15/11/24,SHARE,$22,717,2024-11-15,2025-02-27,104
278,CB_2025_Jan_FB_3692_SO_V06_4x5_IMG_EN_New_C-Headline_Evergreen_CTA-NONE_Angle-W-B-C_M-NONE_VL-None_G-NONE_P-NONE_S-NONE,3692 - Notion Idea #91 SCULPT THE MAN || Enhancements: OFF || CBV1 || Batch 1 || 1C || 20/01/25w04 || Kostas,SHARE,$22,389,2025-01-21,2025-01-27,6
279,CB_2025_Jan_FB_3704_SO_V10_4x5_IMG_EN_New_C-Headline_Evergreen_CTA-NONE_Angle-W-B-C_M-NONE_VL-None_G-NONE_P-NONE_S-NONE,3704 - Notion Idea #89 FOR REAL MEN || Enhancements: OFF || CBV1 || Batch 2 || 1C || 26/01/25w05 || Kostas,SHARE,$22,584,2025-01-26,2025-01-29,3
280,CB_2024_Feb_FB_2834_DA_V04_4x5_IMG_EN_Opti_C-SingleTesti_CTA-NONE_Pain-W_M-NONE_VL-None_TR-None_G-NONE_P-V2_S-NONE_FB2759V04,CBV2 || AU || ðŸ’° Advantage+ || US || BROAD || 7C || Existing_customer_5% || 19/12/24 Ad set,SHARE,$21,704,2024-12-19,2025-03-27,98
281,IM_CB5.png,US || VSL || Aff's image + Taboola ad || Batch 1 || Landing: new5/pre-1 || 1C || 28/01/25,SHARE,$19,647,2025-01-28,2025-02-05,8
282,IM_CB5.png,US || VSL || Aff's image + Taboola ad || Batch 1 || Landing: new6/pre-1 || 1C || 28/01/25,SHARE,$19,778,2025-01-28,2025-02-03,6
283,CB_2025_Jan_FB_3687_DT_V04_4x5_VID_EN_Opti_C-MakingOf_Sale_CTA-VDAY_Angle-W-B-C_M-POW_VL-45s_G-M_P-OG_S-Moon_FB3090V02,3687 - Valentine_s Day Opti 3090 || Enhancements: OFF || CBV1 || Batch Ä… || 1C || 02/02/25w06 || Kostas,SHARE,$19,"1,025",2025-02-02,2025-02-19,17
284,CB_2025_Jan_FB_3723_SO_V05_4x5_IMG_EN_New_C-NONE_Evergreen_CTA-SALE_Angle-W_M-NONE_VL-None_G-NONE_P-NONE_S-NONE,3723 - Notion Idea #92 MAN BOOBS || Enhancements: OFF || CBV1 || Batch 1 || 1C || 28/01/25w05 || Kostas,SHARE,$19,"1,403",2025-01-28,2025-02-24,27
285,CB_2025_Jan_FB_3721_LZ-RP_V05_4x5_IMG_EN_New_C-Headline_Evergreen_CTA-NONE_Angle-W_M-NONE_VL-None_G-NONE_P-NONE_S-NONE,3721 - real men dont ad || Enhancements: OFF || CBV1 || Batch 1 || 1C || 26/01/25w05 || Kostas,SHARE,$19,687,2025-01-26,2025-01-30,4
286,CB_2025_Jan_FB_3738_SO-DP_V01_4x5_IMG_EN_Opti_C-NONE_Evergreen_CTA-SALE_Angle-W_M-NONE_VL-None_G-NONE_P-NONE_S-NONE3665V01,3738 - 3665_V01 OPTI || Enhancements: OFF || CBV1 || Batch 1 || 1C || 29/01/25w05 || Kostas,SHARE,$18,"1,255",2025-01-29,2025-02-22,24
287,CB_2025_Jan_FB_3710_SO-RP_V03_4x5_IMG_EN_New_C-Headline_Evergreen_CTA-SALE_Angle-W-B-C_M-NONE_VL-None_G-NONE_P-NONE_S-NONE,3711 - VDAY top ads 2024 opti || Enhancements: OFF || CBV1 || Batch 1 || 1C || 26/01/25w05 || Kostas,SHARE,$18,497,2025-01-26,2025-01-30,4
288,CB_2025_Jan_FB_3687_DT_V02_4x5_VID_EN_Opti_C-MakingOf_Sale_CTA-VDAY_Angle-W-B-C_M-POW_VL-45s_G-M_P-OG_S-Moon_FB3090V02,3687 - Valentine_s Day Opti 3090 || Enhancements: OFF || CBV1 || Batch Ä… || 1C || 02/02/25w06 || Kostas,SHARE,$18,716,2025-02-02,2025-02-19,17
289,CB_2024_Dec_FB_3608_LZ-DP_V03_4x5_IMG_EN_New_C-Headline_Evergreen_CTA-NONE_Angle-W_M-NONE_VL-None_G-NONE_P-OG_S-NONE,US || Manual Bid: ROAS GOAL: 0.9 -> 1.00 || 7DC || 23/01/2025,SHARE,$17,581,2025-01-23,2025-01-30,7
290,CB_2025_Jan_FB_3732_SO-JT_V02_4x5_IMG_EN_New_C-Headline_Evergreen_CTA-NONE_Angle-Detox_M-NONE_VL-None_G-NONE_P-NONE_S-NONE,3732 - CB - Cortisol detox || Enhancements: OFF || CBV1 || Batch 1 || 1C || 29/01/25w05 || Kostas,SHARE,$17,839,2025-01-29,2025-02-03,5
291,CB_2025_Jan_FB_3745_CHUB_V01_4x5_IMG_EN_Opti_C-NONE_CTA-NONE_Angle-B_M-NONE_VL-None_TR-None_G-F_P-OG_S-NONE,3745 - 3661 Methane Balloon OPTI || Enhancements: OFF || CBV1 || Batch 1 || 1C || 30/01/25w05 || Kostas,SHARE,$16,"1,084",2025-01-30,2025-02-13,14
292,CB_2024_Nov_FB_3305_SO-DP_V02_4x5_VID_EN_Opti_C-Sale_CTA-BF_Pain-W_M-Chris_VL-30s_TR-None_G-MF_P-Plan_S-NEW_FB2601V07,CBV2 || AU || ðŸ’° Advantage+ || US || BROAD || 7C || Existing_customer_5% || 19/12/24 Ad set,VIDEO,$16,430,2024-12-19,2025-03-27,98
293,CB_2024_Dec_FB_3666_VK-JT_V03_4x5_VID_EN_Opti_C-BulletPoints_Sale_CTA-NY_Angle-W-B-C_M-TRC_VL-30s_G-F_P-OG_S-NEW,ASC+ || VIDEO Only || US || 0% EXISTING CAP || 1C || 08.12.24  Ad set,VIDEO,$16,521,2025-01-11,2025-02-05,25
294,CB_2025_Jan_FB_3737_DT_V04_4x5_IMG_EN_New_C-BulletPoints_Evergreen_CTA-NONE_Angle-W_M-NONE_VL-None_G-NONE_P-OG_S-NONE_FB3682V03,3737 - Opti 3682 || Enhancements: OFF || CBV1 || Batch 1 || 1C || 29/01/25w05 || Kostas,SHARE,$16,820,2025-01-29,2025-02-05,7
295,CB_2025_Jan_FB_3750_LZ-VU_V05_4x5_IMG_EN_Opti_C-NegativeMark_Evergreen_CTA-NONE_Angle-W_M-NONE_VL-None_G-NONE_P-NONE_S-NONE_FB3251V01,3750 - bioma ripoff march soft version || Enhancements: OFF || CBV1 || Batch 1 || 1C || 24/01/25w04 || Kostas,SHARE,$16,447,2025-01-24,2025-02-17,24
296,IM_CB3.png,US || VSL || Aff's image || Landing: Directly to VSL || 1C || 16/01/25,SHARE,$15,286,2025-01-16,2025-01-28,12
297,CB_2025_Jan_FB_3696_CHUB_V03_4x5_IMG_EN_New_C-NONE_CTA-NONE_Angle-C_M-NONE_VL-None_TR-None_G-NONE_P-NONE_S-NONE,3696 Struggling with Poop rocks CHUB || Enhancements: OFF || CBV1 || Batch 2 || 1C || 22/01/25w04,SHARE,$15,762,2025-01-22,2025-02-02,11
298,CB_2025_Jan_FB_3710_SO-RP_V02_4x5_IMG_EN_New_C-Headline_Evergreen_CTA-SALE_Angle-W-B-C_M-NONE_VL-None_G-NONE_P-NONE_S-NONE,3711 - VDAY top ads 2024 opti || Enhancements: OFF || CBV1 || Batch 1 || 1C || 26/01/25w05 || Kostas,SHARE,$14,445,2025-01-26,2025-01-30,4
299,CB_2024_Dec_FB_3608_LZ-DP_V04_4x5_IMG_EN_New_C-Headline_Evergreen_CTA-NONE_Angle-W_M-NONE_VL-None_G-NONE_P-OG_S-NONE,3608 - CB_IMG_ notion #17 hypnosis || Enhancements: OFF || CBV1 || Batch 1 || 1C || 13/01/25w03 || Kostas,SHARE,$14,693,2025-01-13,2025-02-03,21
300,CB_2024_Dec_FB_3592_VK-DP_V09_4x5_VID_EN_New_C-BulletPoints_Sale_CTA-SALE_Angle-W-B-C_M-NONE_VL-30s_G-F_P-OG_S-WHAT - Copy,ASC+ || VIDEO Only || US || 0% EXISTING CAP || 1C || 08.12.24  Ad set,VIDEO,$14,415,2024-12-20,2025-02-05,47
301,CB_2024_Feb_FB_2834_DA_V02_4x5_IMG_EN_Opti_C-SingleTesti_CTA-NONE_Pain-W_M-NONE_VL-None_TR-None_G-NONE_P-V2_S-NONE_FB2759V04,CBV2 || AU || ðŸ’° Advantage+ || US || BROAD || 7C || Existing_customer_5% || 19/12/24 Ad set,SHARE,$14,491,2024-12-19,2025-03-27,98
302,CB_2025_Jan_FB_3746_CHUB-AA_V02_4x5_IMG_EN_Opti_C-NONE_CTA-NONE_Angle-C_M-NONE_VL-None_TR-None_G-NONE_P-NONE_S-NONE,3746 â€“ 3660 G-nugget OPTI v3 || Enhancements: OFF || CBV1 || Batch 1 || 1C || 30/01/25w05 || Kostas,SHARE,$14,794,2025-01-30,2025-02-02,3
303,CB_2025_Jan_FB_3687_DT_V03_4x5_VID_EN_Opti_C-MakingOf_Sale_CTA-VDAY_Angle-W-B-C_M-POW_VL-45s_G-M_P-OG_S-Moon_FB3090V02,3687 - Valentine_s Day Opti 3090 || Enhancements: OFF || CBV1 || Batch Ä… || 1C || 02/02/25w06 || Kostas,SHARE,$14,805,2025-02-02,2025-02-19,17
304,CB_2025_Jan_FB_3733_SO-JT_V02_4x5_IMG_EN_New_C-Headline_Evergreen_CTA-NONE_Angle-Detox_M-NONE_VL-None_G-NONE_P-NONE_S-NONE,3733 - CB - Sugar detox || Enhancements: OFF || CBV1 || Batch 1 || 1C || 29/01/25w05 || Kostas,SHARE,$13,539,2025-01-29,2025-02-02,4
305,CB_2025_Jan_FB_3722_VK-JG_V02_4x5_IMG_EN_New_C-Testimonial_Sale_CTA-NY_Angle-W-B-C_M-NONE_VL-None_G-M_P-OG_S-NONE,3722 - mens testi || Enhancements: OFF || CBV1 || Batch 1 || 1C || 28/01/25w05 || Kostas,SHARE,$13,641,2025-01-28,2025-01-31,3
306,CB_2025_Jan_FB_3706_DT-JG_V04_4x5_IMG_EN_New_C-Headline_Evergreen_CTA-NONE_Angle-W_M-NONE_VL-None_G-M_P-OG_S-NONE,3706 - #110 Notion || Enhancements: OFF || CBV1 || Batch 1 || 1C || 22/01/25w04 || Kostas,SHARE,$13,691,2025-01-22,2025-01-27,5
307,CB_2025_Jan_FB_3721_LZ-RP_V03_4x5_IMG_EN_New_C-Headline_Evergreen_CTA-NONE_Angle-W_M-NONE_VL-None_G-NONE_P-NONE_S-NONE,3721 - real men dont ad || Enhancements: OFF || CBV1 || Batch 1 || 1C || 26/01/25w05 || Kostas,SHARE,$13,473,2025-01-26,2025-01-30,4
308,CB_2024_Oct_FB_3182_ZS-GC_V13_1x1_IMG_EN_New_C-UsVsThem_Evergreen_CTA-NONE_Angle-B-C_M-NONE_VL-None_G-NONE_P-OG_S-NONE,CBV2 || AU || ðŸ’° Advantage+ || US || BROAD || 7C || Existing_customer_5% || 19/12/24 Ad set,SHARE,$12,475,2024-12-19,2025-03-27,98
309,CB_2025_Jan_FB_3692_SO_V05_4x5_IMG_EN_New_C-Headline_Evergreen_CTA-NONE_Angle-W-B-C_M-NONE_VL-None_G-NONE_P-NONE_S-NONE,3692 - Notion Idea #91 SCULPT THE MAN || Enhancements: OFF || CBV1 || Batch 1 || 1C || 20/01/25w04 || Kostas,SHARE,$12,244,2025-01-21,2025-01-27,6
310,CB_2025_Jan_FB_3700_SO_V05_4x5_IMG_EN_New_C-Headline_Evergreen_CTA-NONE_Angle-W-B-C_M-NONE_VL-None_G-NONE_P-NONE_S-NONE,3700 - Notion Idea #90 THE 5 RULES || Enhancements: OFF || CBV1 || Batch 1 || 1C || 21/01/25w04 || Kostas,SHARE,$12,208,2025-01-21,2025-01-30,9
311,CB_2025_Jan_FB_3692_SO_V04_4x5_IMG_EN_New_C-Headline_Evergreen_CTA-NONE_Angle-W-B-C_M-NONE_VL-None_G-NONE_P-NONE_S-NONE,3692 - Notion Idea #91 SCULPT THE MAN || Enhancements: OFF || CBV1 || Batch 1 || 1C || 20/01/25w04 || Kostas,SHARE,$11,250,2025-01-21,2025-01-27,6
312,CB_2024_Oct_FB_3182_ZS-GC_V13_1x1_IMG_EN_New_C-UsVsThem_Evergreen_CTA-NONE_Angle-B-C_M-NONE_VL-None_G-NONE_P-OG_S-NONE,CBV2 || EU (UK) || ðŸ’° Advantage+ || US || BROAD || 7C || Existing_customer_5% || 15/12/24 Ad set,SHARE,$11,590,2024-12-15,2025-01-31,47
313,CB_2025_Jan_FB_3742_SO-DP-KB_V02_4x5_IMG_EN_Opti_C-NONE_Evergreen_CTA-SALE_Angle-W_M-NONE_VL-None_G-NONE_P-CBV2_S-NONE3665V01,3742 -  3665_V01 OPTI for PREMIUM 3 || 1C || 31/01/2025w05,SHARE,$11,592,2025-01-31,2025-02-10,10
314,CB_2025_Jan_FB_3740_SO-DP_V02_4x5_IMG_EN_Opti_C-Headline_Evergreen_CTA-NONE_Angle-W_M-NONE_VL-None_G-NONE_P-OG_S-NONE_3608V03,3740 - 3608_v03 OPTI || Enhancements: OFF || CBV1 || Batch 1 || 1C || 29/01/25w05 || Kostas,SHARE,$11,663,2025-01-29,2025-02-11,13
315,CB_2025_Jan_FB_3722_VK-JG_V11_4x5_IMG_EN_New_C-Testimonial_Sale_CTA-NY_Angle-W-B-C_M-NONE_VL-None_G-M_P-OG_S-NONE,3722 - mens testi || Enhancements: OFF || CBV1 || Batch 3 || 1C || 28/01/25w05 || Kostas,SHARE,$11,344,2025-01-28,2025-01-31,3
316,CB_2025_Jan_FB_3692_SO_V01_4x5_IMG_EN_New_C-Headline_Evergreen_CTA-NONE_Angle-W-B-C_M-NONE_VL-None_G-NONE_P-NONE_S-NONE,3692 - Notion Idea #91 SCULPT THE MAN || Enhancements: OFF || CBV1 || Batch 1 || 1C || 20/01/25w04 || Kostas,SHARE,$11,227,2025-01-21,2025-01-27,6
317,CB_2024_Mar_FB_2888_JG_V02_9x16_IMG_EN_Opti_C-Benefits_CTA-NONE_Pain-W_M-NONE_VL-None_TR-None_G-NONE_P-V2_S-NONE,CBV2 || EU (UK) || ðŸ’° Advantage+ || US || BROAD || 7C || Existing_customer_5% || 15/12/24 Ad set,SHARE,$11,730,2024-12-15,2025-01-31,47
318,CB_2025_Jan_FB_3704_SO_V07_4x5_IMG_EN_New_C-Headline_Evergreen_CTA-NONE_Angle-W-B-C_M-NONE_VL-None_G-NONE_P-NONE_S-NONE,3704 - Notion Idea #89 FOR REAL MEN || Enhancements: OFF || CBV1 || Batch 2 || 1C || 26/01/25w05 || Kostas,SHARE,$11,419,2025-01-26,2025-01-29,3
319,CB_2025_Jan_FB_3709_VK-JT_V04_4x5_IMG_EN_New_C-BulletPoints_Sale_CTA-NY_Angle-W-B-C_M-NONE_VL-None_G-M_P-OG_S-NONE,3709 -Notion Sigma male #109 VK-JT || Enhancements: OFF || CBV1 || Batch 1 || 1C || 29/01/25w05 || Kostas,SHARE,$10,530,2025-01-29,2025-02-05,7
320,CB_2025_Jan_FB_3722_VK-JG_V04_4x5_IMG_EN_New_C-Testimonial_Sale_CTA-NY_Angle-W-B-C_M-NONE_VL-None_G-M_P-OG_S-NONE,3722 - mens testi || Enhancements: OFF || CBV1 || Batch 1 || 1C || 28/01/25w05 || Kostas,SHARE,$10,239,2025-01-28,2025-01-31,3
321,CB_2025_Jan_FB_3765_SO-JT_V01_1x1_IMG_EN_New_C-Headline_Evergreen_CTA-NONE_Angle-W_M-NONE_VL-None_G-NONE_P-NONE_S-NONE,3765 - SUGAR DETOX 2 IMG || Enhancements: OFF || CBV1 || Batch Ä… || 1C || 02/02/25w06 || Kostas,SHARE,$10,541,2025-02-02,2025-02-07,5
322,CB_2022_Mar3_FB_713_IK_V04_1x1_IMG_EN_Opti_C-WrittenTesti_HE-98_A-ExtremeBodyVisualization_HK-bodypart_Pain-W_CLR-PURPLE_BG-IMAGE_ME-MIX_MA-YOUNG,US || Manual Bid || BFCM || COST CAP 81 || 1C || 15/11/24,SHARE,$10,740,2024-11-15,2025-03-26,131
323,CB_2025_Jan_FB_3735_VK_V01_4x5_VID_EN_New_C-BulletPoints_Sale_CTA-NY_Angle-W-B-C_M-NONE_VL-None_G-NONE_P-OG_S-NONE,3735 - OPTI 3619 -VK || Enhancements: OFF || CBV1 || Batch 1 || 1C || 29/01/25w05 || Kostas,SHARE,$10,633,2025-01-29,2025-02-07,9
324,CB_2025_Jan_FB_3723_SO_V19_4x5_IMG_EN_New_C-NONE_Evergreen_CTA-SALE_Angle-W_M-NONE_VL-None_G-NONE_P-NONE_S-NONE,3723 - Notion Idea #92 MAN BOOBS || Enhancements: OFF || CBV1 || Batch 4 || 1C || 28/01/25w05 || Kostas,SHARE,$9,635,2025-01-28,2025-03-11,42
325,CB_2025_Jan_FB_3745_CHUB_V02_4x5_IMG_EN_Opti_C-NONE_CTA-NONE_Angle-B_M-NONE_VL-None_TR-None_G-F_P-OG_S-NONE,3745 - 3661 Methane Balloon OPTI || Enhancements: OFF || CBV1 || Batch 1 || 1C || 30/01/25w05 || Kostas,SHARE,$9,623,2025-01-30,2025-02-13,14
326,CB_2024_Mar_FB_2888_JG_V03_9x16_IMG_EN_Opti_C-Benefits_CTA-NONE_Pain-W_M-NONE_VL-None_TR-None_G-NONE_P-V2_S-NONE,CBV2 || AU || ðŸ’° Advantage+ || US || BROAD || 7C || Existing_customer_5% || 19/12/24 Ad set,SHARE,$9,331,2024-12-19,2025-03-27,98
327,CB_2025_Jan_FB_3723_SO_V09_4x5_IMG_EN_New_C-NONE_Evergreen_CTA-SALE_Angle-W_M-NONE_VL-None_G-NONE_P-NONE_S-NONE,3723 - Notion Idea #92 MAN BOOBS || Enhancements: OFF || CBV1 || Batch 2 || 1C || 28/01/25w05 || Kostas,SHARE,$9,839,2025-01-28,2025-02-18,21
328,CB_2024_Oct_FB_3251_LZ-VU_V01_1x1_IMG_EN_New_C-NegativeMark_Evergreen_CTA-NONE_Angle-Cort_M-NONE_VL-None_G-NONE_P-NONE_S-NONE.png,US || Manual Bid || BFCM || COST CAP 91 || 1C || 15/11/24,SHARE,$9,352,2024-11-15,2025-02-27,104
329,CB_2024_Mar_FB_2888_JG_V01_9x16_IMG_EN_Opti_C-Benefits_CTA-NONE_Pain-W_M-NONE_VL-None_TR-None_G-NONE_P-V2_S-NONE,CBV2 || AU || ðŸ’° Advantage+ || US || BROAD || 7C || Existing_customer_5% || 19/12/24 Ad set,SHARE,$8,244,2024-12-19,2025-03-27,98
330,CB_2025_Jan_FB_3700_SO_V06_4x5_IMG_EN_New_C-Headline_Evergreen_CTA-NONE_Angle-W-B-C_M-NONE_VL-None_G-NONE_P-NONE_S-NONE,3700 - Notion Idea #90 THE 5 RULES || Enhancements: OFF || CBV1 || Batch 1 || 1C || 21/01/25w04 || Kostas,SHARE,$8,347,2025-01-21,2025-01-30,9
331,CB_2025_Jan_FB_3718_CHUB_V06_4x5_IMG_EN_Opti_C-NONE_CTA-NONE_Angle-C_M-NONE_VL-None_TR-None_G-M_P-OG_S-NONE,3718 - Looking 15 people OPTI || Enhancements: OFF || CBV1 || Batch 2 || 1C || 29/01/25w05 || Kostas,SHARE,$8,500,2025-01-29,2025-02-20,22
332,CB_2025_Jan_FB_3704_SO_V03_4x5_IMG_EN_New_C-Headline_Evergreen_CTA-NONE_Angle-W-B-C_M-NONE_VL-None_G-NONE_P-NONE_S-NONE,3704 - Notion Idea #89 FOR REAL MEN || Enhancements: OFF || CBV1 || Batch 1 || 1C || 26/01/25w05 || Kostas,SHARE,$8,367,2025-01-26,2025-02-08,13
333,Taboola - ColonB - 22.jpg,US || VSL || Aff's image || Batch 2 (mostly Taboola ads) || Landing: pre-1 || 1C || 19/01/25,SHARE,$8,350,2025-01-19,2025-01-28,9
334,CB_2023_Jul_FB_2226_MB_V04_9x16_VID_EN_Opti_C-Testim_CTA-SMR_Pain-W_M-MIX_VL-30s_TR-None_G-F_P-None_S-Starry,US || Manual Bid || BFCM || COST CAP 91 || 1C || 15/11/24,VIDEO,$8,315,2024-11-15,2025-02-27,104
335,IM_CB5.png,US || VSL || Aff's image + Taboola ad || Batch 1 || Landing: /quiz/pre-1 || 1C || 30/01/25,SHARE,$8,314,2025-01-30,2025-02-04,5
336,CB_2025_Jan_FB_3692_SO_V02_4x5_IMG_EN_New_C-Headline_Evergreen_CTA-NONE_Angle-W-B-C_M-NONE_VL-None_G-NONE_P-NONE_S-NONE,3692 - Notion Idea #91 SCULPT THE MAN || Enhancements: OFF || CBV1 || Batch 1 || 1C || 20/01/25w04 || Kostas,SHARE,$8,190,2025-01-21,2025-01-27,6
337,CB_2023_Jul_FB_2226_MB_V04_9x16_VID_EN_Opti_C-Testim_CTA-SMR_Pain-W_M-MIX_VL-30s_TR-None_G-F_P-None_S-Starry,US || Manual Bid || BFCM || ROAS GOAL: 1.4 || 1C || 15/11/24,VIDEO,$8,255,2024-11-15,2025-02-27,104
338,CB_2025_Jan_FB_3713_SO_V03_4x5_IMG_EN_Opti_C-Headline_Evergreen_CTA-SALE_Angle-W-B-C_M-NONE_VL-None_G-NONE_P-NONE_S-NONE3296V02,3713 - Tropical fruit Creative Opti 3296 || Enhancements: OFF || CBV1 || Batch 1 || 1C || 22/01/25w04 || Kostas,SHARE,$8,370,2025-01-22,2025-01-27,5
339,CB_2025_Jan_FB_3660_CHUB_V03_4x5_IMG_EN_New_C-NONE_CTA-NONE_Angle-C_M-NONE_VL-None_TR-None_G-NONE_P-NONE_S-NONE - Copy,CBV2 || US || Manual Bid: ROAS GOAL: 0.9 -> 1.00 || 7DC || 22/01/2025,SHARE,$8,453,2025-01-22,2025-01-27,5
340,CB_2023_Dec_FB_2694_DT-DP_V17_1x1_GIF_EN_New_C-NONE_CTA-NY65_None_M-NONE_VL-15s_TR-None_G-NONE_P-OG_S-NONE,ðŸ’°WC || US || Advantage+ || BIG BUDGET || CC101->105->109->112->114-116->117 || BROAD || ABO || 1C || 17/01/24 RELAUNCHED Ad set,VIDEO,$8,192,2024-01-18,2025-02-06,385
341,CB_2025_Jan_FB_3750_LZ-VU_V04_4x5_IMG_EN_Opti_C-NegativeMark_Evergreen_CTA-NONE_Angle-W_M-NONE_VL-None_G-NONE_P-NONE_S-NONE_FB3251V01,3750 - bioma ripoff march soft version || Enhancements: OFF || CBV1 || Batch 1 || 1C || 24/01/25w04 || Kostas,SHARE,$7,218,2025-01-24,2025-02-17,24
342,IM_CB5.png,US || VSL || Aff's image + Taboola ad || Batch 1 || Landing: new3/pre-1 || 1C || 28/01/25,SHARE,$7,195,2025-01-28,2025-01-31,3
343,IM_CB5.png,US || VSL || Aff's image + Taboola ad || Batch 1 || Landing: new7/pre-1 || 1C || 28/01/25,SHARE,$7,280,2025-01-28,2025-01-31,3
344,CB_2025_Jan_FB_3765_SO-JT_V04_1x1_IMG_EN_New_C-Headline_Evergreen_CTA-NONE_Angle-W_M-NONE_VL-None_G-NONE_P-NONE_S-NONE,3765 - SUGAR DETOX 2 IMG || Enhancements: OFF || CBV1 || Batch Ä… || 1C || 02/02/25w06 || Kostas,SHARE,$7,309,2025-02-02,2025-02-07,5
345,CB_2025_Jan_FB_3706_DT-JG_V01_4x5_IMG_EN_New_C-Headline_Evergreen_CTA-NONE_Angle-W_M-NONE_VL-None_G-M_P-OG_S-NONE,3706 - #110 Notion || Enhancements: OFF || CBV1 || Batch 1 || 1C || 22/01/25w04 || Kostas,SHARE,$6,358,2025-01-22,2025-01-27,5
346,CB_2025_Jan_FB_3718_CHUB_V07_4x5_IMG_EN_Opti_C-NONE_CTA-NONE_Angle-C_M-NONE_VL-None_TR-None_G-M_P-OG_S-NONE,3718 - Looking 15 people OPTI || Enhancements: OFF || CBV1 || Batch 3 || 1C || 29/01/25w05 || Kostas,SHARE,$6,315,2025-01-29,2025-02-05,7
347,CB_2024_Jan_FB_2762_IK_V04_1x1_IMG_EN_New_C-WrittenTesti_CTA-CTA_Pain-W-B-C_M-NONE_VL-None_TR-None_G-NONE_P-V2_S-NONE,CBV2 || AU || ðŸ’° Advantage+ || US || BROAD || 7C || Existing_customer_5% || 19/12/24 Ad set,SHARE,$6,120,2024-12-19,2025-03-27,98
348,CB_2025_Jan_FB_3720_DT-DP_V02_4x5_CAROUSEL_EN_New_C-BulletPoints_Evergreen_CTA-NONE_Angle-W_M-NONE_VL-None_G-NONE_P-OG_S-NONE_1,3720 - #99 Foods you can eat || Enhancements: OFF || CBV1 || Batch 1 || 1C || 26/01/25w05 || Kostas,SHARE,$5,208,2025-01-26,2025-01-29,3
349,CB_2025_Jan_FB_3704_SO_V04_4x5_IMG_EN_New_C-Headline_Evergreen_CTA-NONE_Angle-W-B-C_M-NONE_VL-None_G-NONE_P-NONE_S-NONE,3704 - Notion Idea #89 FOR REAL MEN || Enhancements: OFF || CBV1 || Batch 1 || 1C || 26/01/25w05 || Kostas,SHARE,$5,220,2025-01-26,2025-02-08,13
350,CB_2025_Jan_FB_3747_CHUB-AA_V02_9x16_IMG_EN_Opti_C-NONE_CTA-NONE_Angle-Sale_M-NONE_VL-None_TR-None_G-NONE_P-OG_S-NONE,3747 Clean Sale [HB winner ITR] CHUB || Enhancements: OFF || CBV1 || Batch Ä… || 1C || 02/02/25w06 || Kostas,SHARE,$5,161,2025-02-02,2025-03-27,53
351,CB_2024_Mar_FB_2888_JG_V01_9x16_IMG_EN_Opti_C-Benefits_CTA-NONE_Pain-W_M-NONE_VL-None_TR-None_G-NONE_P-V2_S-NONE,CBV2 || EU (UK) || ðŸ’° Advantage+ || US || BROAD || 7C || Existing_customer_5% || 15/12/24 Ad set,SHARE,$5,172,2024-12-15,2025-01-31,47
352,CB_2024_Mar_FB_2888_JG_V03_9x16_IMG_EN_Opti_C-Benefits_CTA-NONE_Pain-W_M-NONE_VL-None_TR-None_G-NONE_P-V2_S-NONE,CBV2 || EU (UK) || ðŸ’° Advantage+ || US || BROAD || 7C || Existing_customer_5% || 15/12/24 Ad set,SHARE,$4,276,2024-12-15,2025-01-31,47
353,CB_2025_Jan_FB_3687_DT_V01_4x5_VID_EN_Opti_C-MakingOf_Sale_CTA-VDAY_Angle-W-B-C_M-POW_VL-45s_G-M_P-OG_S-Moon_FB3090V02,3687 - Valentine_s Day Opti 3090 || Enhancements: OFF || CBV1 || Batch Ä… || 1C || 02/02/25w06 || Kostas,SHARE,$4,206,2025-02-02,2025-02-19,17
354,CB_2025_Jan_FB_3723_SO_V15_4x5_IMG_EN_New_C-NONE_Evergreen_CTA-SALE_Angle-W_M-NONE_VL-None_G-NONE_P-NONE_S-NONE,3723 - Notion Idea #92 MAN BOOBS || Enhancements: OFF || CBV1 || Batch 3 || 1C || 28/01/25w05 || Kostas,SHARE,$4,279,2025-01-28,2025-01-31,3
355,CB_2025_Jan_FB_3723_SO_V08_4x5_IMG_EN_New_C-NONE_Evergreen_CTA-SALE_Angle-W_M-NONE_VL-None_G-NONE_P-NONE_S-NONE,3723 - Notion Idea #92 MAN BOOBS || Enhancements: OFF || CBV1 || Batch 2 || 1C || 28/01/25w05 || Kostas,SHARE,$4,265,2025-01-28,2025-02-18,21
356,CB_2025_Jan_FB_3735_VK_V03_4x5_VID_EN_New_C-BulletPoints_Sale_CTA-NY_Angle-W-B-C_M-NONE_VL-None_G-NONE_P-OG_S-NONE,3735 - OPTI 3619 -VK || Enhancements: OFF || CBV1 || Batch 1 || 1C || 29/01/25w05 || Kostas,SHARE,$4,369,2025-01-29,2025-02-07,9
357,CB_2025_Jan_FB_3700_SO_V10_4x5_IMG_EN_New_C-Headline_Evergreen_CTA-NONE_Angle-W-B-C_M-NONE_VL-None_G-NONE_P-NONE_S-NONE,3700 - Notion Idea #90 THE 5 RULES || Enhancements: OFF || CBV1 || Batch 1 || 1C || 21/01/25w04 || Kostas,SHARE,$4,150,2025-01-21,2025-01-30,9
358,CB_2025_Jan_FB_3765_SO-JT_V03_1x1_IMG_EN_New_C-Headline_Evergreen_CTA-NONE_Angle-W_M-NONE_VL-None_G-NONE_P-NONE_S-NONE,3765 - SUGAR DETOX 2 IMG || Enhancements: OFF || CBV1 || Batch Ä… || 1C || 02/02/25w06 || Kostas,SHARE,$3,196,2025-02-02,2025-02-07,5
359,CB_2025_Jan_FB_3692_SO_V03_4x5_IMG_EN_New_C-Headline_Evergreen_CTA-NONE_Angle-W-B-C_M-NONE_VL-None_G-NONE_P-NONE_S-NONE,3692 - Notion Idea #91 SCULPT THE MAN || Enhancements: OFF || CBV1 || Batch 1 || 1C || 20/01/25w04 || Kostas,SHARE,$3,87,2025-01-21,2025-01-27,6
360,CB_2025_Jan_FB_3723_SO_V20_4x5_IMG_EN_New_C-NONE_Evergreen_CTA-SALE_Angle-W_M-NONE_VL-None_G-NONE_P-NONE_S-NONE,3723 - Notion Idea #92 MAN BOOBS || Enhancements: OFF || CBV1 || Batch 4 || 1C || 28/01/25w05 || Kostas,SHARE,$3,174,2025-01-28,2025-03-11,42
361,CB_2025_Jan_FB_3713_SO_V04_4x5_IMG_EN_Opti_C-Headline_Evergreen_CTA-SALE_Angle-W-B-C_M-NONE_VL-None_G-NONE_P-NONE_S-NONE3296V02,3713 - Tropical fruit Creative Opti 3296 || Enhancements: OFF || CBV1 || Batch 1 || 1C || 22/01/25w04 || Kostas,SHARE,$3,175,2025-01-22,2025-01-27,5
362,CB_2025_Jan_FB_3700_SO_V02_4x5_IMG_EN_New_C-Headline_Evergreen_CTA-NONE_Angle-W-B-C_M-NONE_VL-None_G-NONE_P-NONE_S-NONE,3700 - Notion Idea #90 THE 5 RULES || Enhancements: OFF || CBV1 || Batch 1 || 1C || 21/01/25w04 || Kostas,SHARE,$3,72,2025-01-21,2025-01-30,9
363,CB_2025_Jan_FB_3705_VK_V01_4x5_IMG_EN_New_C-BulletPoints_Sale_CTA-NY_Angle-W-B-C_M-NONE_VL-None_G-NONE_P-OG_S-NONE,3705 - #87 Struggling with Dad Bod_ - VK || Enhancements: OFF || CBV1 || Batch 1 || 1C || 22/01/25w04 || Kostas,SHARE,$2,250,2025-01-22,2025-02-03,12
364,CB_2025_Jan_FB_3699_DT-DP_V02_4x5_IMG_EN_New_C-Headline_Evergreen_CTA-NONE_Angle-W-B_M-NONE_VL-None_G-NONE_P-OG_S-NONE,3699 - Notion idea #86 || Enhancements: OFF || CBV1 || Batch 1 || 1C || 21/01/25w04 || Kostas,SHARE,$2,126,2025-01-21,2025-01-30,9
365,CB_2025_Jan_FB_3723_SO_V16_4x5_IMG_EN_New_C-NONE_Evergreen_CTA-SALE_Angle-W_M-NONE_VL-None_G-NONE_P-NONE_S-NONE,3723 - Notion Idea #92 MAN BOOBS || Enhancements: OFF || CBV1 || Batch 4 || 1C || 28/01/25w05 || Kostas,SHARE,$2,162,2025-01-28,2025-03-11,42
366,CB_2025_Jan_FB_3708_JT_V03_4x5_IMG_EN_New_C-Headline_Evergreen_CTA-NONE_Angle_CR_P-OG,3708 - NO MORE CRAVINGS  || Enhancements: OFF || CBV1 || Batch 1 || 1C || 22/01/25w04 || Kostas,SHARE,$2,166,2025-01-22,2025-01-27,5
367,CB_2022_Nov_FB_1218_RS_V15_9x16_IMG_EN_Opti_C-Sale_CTA-BLACK_Pain-W_M-NONE_VL-None FB1671V08,US || Manual Bid || BFCM || COST CAP 91 || 1C || 15/11/24,SHARE,$2,78,2024-11-15,2025-02-27,104
368,CB_2025_Jan_FB_3745_CHUB_V03_4x5_IMG_EN_Opti_C-NONE_CTA-NONE_Angle-B_M-NONE_VL-None_TR-None_G-F_P-OG_S-NONE,3745 - 3661 Methane Balloon OPTI || Enhancements: OFF || CBV1 || Batch 1 || 1C || 30/01/25w05 || Kostas,SHARE,$2,113,2025-01-30,2025-02-10,11
369,CB_2024_Dec_FB_3608_LZ-DP_V02_4x5_IMG_EN_New_C-Headline_Evergreen_CTA-NONE_Angle-W_M-NONE_VL-None_G-NONE_P-OG_S-NONE,3608 - CB_IMG_ notion #17 hypnosis || Enhancements: OFF || CBV1 || Batch 1 || 1C || 13/01/25w03 || Kostas,SHARE,$2,115,2025-01-13,2025-02-03,21
370,CB_2025_Jan_FB_3718_CHUB_V09_4x5_IMG_EN_Opti_C-NONE_CTA-NONE_Angle-C_M-NONE_VL-None_TR-None_G-M_P-OG_S-NONE,3718 - Looking 15 people OPTI || Enhancements: OFF || CBV1 || Batch 3 || 1C || 29/01/25w05 || Kostas,SHARE,$2,110,2025-01-29,2025-02-06,8
371,CB_2025_Jan_FB_3706_DT-JG_V03_4x5_IMG_EN_New_C-Headline_Evergreen_CTA-NONE_Angle-W_M-NONE_VL-None_G-M_P-OG_S-NONE,3706 - #110 Notion || Enhancements: OFF || CBV1 || Batch 1 || 1C || 22/01/25w04 || Kostas,SHARE,$2,104,2025-01-22,2025-01-27,5
372,CB_2024_Nov_FB_3305_SO-DP_V02_4x5_VID_EN_Opti_C-Sale_CTA-BF_Pain-W_M-Chris_VL-30s_TR-None_G-MF_P-Plan_S-NEW_FB2601V07,CBV2 || EU (UK) || ðŸ’° Advantage+ || US || BROAD || 7C || Existing_customer_5% || 15/12/24 Ad set,SHARE,$2,65,2024-12-19,2025-01-31,43
373,CB_2025_Jan_FB_3671_LZ-VU_V02_4x5_IMG_EN_New_C-Headline_Evergreen_CTA-NONE_Angle-W_M-NONE_VL-None_G-NONE_P-NONE_S-NONE_FB3306V02,CBV2 || EU (UK) || ðŸ’° Advantage+ || US || BROAD || 7C || Existing_customer_5% || 15/12/24 Ad set,SHARE,$2,82,2025-01-09,2025-01-31,22
374,CB_2025_Jan_FB_3718_CHUB_V04_4x5_IMG_EN_Opti_C-NONE_CTA-NONE_Angle-C_M-NONE_VL-None_TR-None_G-M_P-OG_S-NONE,3718 - Looking 15 people OPTI || Enhancements: OFF || CBV1 || Batch 2 || 1C || 29/01/25w05 || Kostas,SHARE,$2,106,2025-01-30,2025-02-20,21
375,CB_2023_Dec_FB_2706_RS_V09_9x16_VID_EN_Opti_C-Sale_CTA-NY56_Pain-W_M-JOG_VL-30s_TR-None_G-F_P-OG_S-WHAT_FB1404V02,ðŸ’°WC || US || Advantage+ || BIG BUDGET || CC101->105->109->112->114-116->117 || BROAD || ABO || 1C || 17/01/24 RELAUNCHED Ad set,VIDEO,$2,51,2024-01-17,2025-02-05,385
376,CB_2023_Dec_FB_2696_RS_V02_9x16_VID_EN_Opti_C-Sale_CTA-XMAS65_Pain-W-B_M-JANW_VL-30s_TR-None_G-MF_P-OG_S-WHAT_FB2284V05,ðŸ’°WC || US || Advantage+ || BIG BUDGET || CC101->105->109->112->114-116->117 || BROAD || ABO || 1C || 17/01/24 RELAUNCHED Ad set,VIDEO,$1,92,2024-01-17,2025-02-06,386
377,CB_2025_Jan_FB_3708_JT_V01_4x5_IMG_EN_New_C-Headline_Evergreen_CTA-NONE_Angle_CR_P-OG,3708 - NO MORE CRAVINGS  || Enhancements: OFF || CBV1 || Batch 1 || 1C || 22/01/25w04 || Kostas,SHARE,$1,133,2025-01-22,2025-01-27,5
378,CB_2025_Jan_FB_3708_JT_V02_4x5_IMG_EN_New_C-Headline_Evergreen_CTA-NONE_Angle_CR_P-OG,3708 - NO MORE CRAVINGS  || Enhancements: OFF || CBV1 || Batch 1 || 1C || 22/01/25w04 || Kostas,SHARE,$1,63,2025-01-22,2025-01-27,5
379,CB_2025_Jan_FB_3747_CHUB-AA_V04_9x16_IMG_EN_Opti_C-NONE_CTA-NONE_Angle-Sale_M-NONE_VL-None_TR-None_G-NONE_P-OG_S-NONE,3747 Clean Sale [HB winner ITR] CHUB || Enhancements: OFF || CBV1 || Batch Ä… || 1C || 02/02/25w06 || Kostas,SHARE,$1,67,2025-02-02,2025-03-27,53
380,CB_2025_Jan_FB_3699_DT-DP_V04_4x5_IMG_EN_New_C-Headline_Evergreen_CTA-NONE_Angle-W-B_M-NONE_VL-None_G-NONE_P-OG_S-NONE,3699 - Notion idea #86 || Enhancements: OFF || CBV1 || Batch 1 || 1C || 21/01/25w04 || Kostas,SHARE,$1,32,2025-01-21,2025-01-29,8
381,CB_2024_Oct_FB_3251_LZ-VU_V01_1x1_IMG_EN_New_C-NegativeMark_Evergreen_CTA-NONE_Angle-Cort_M-NONE_VL-None_G-NONE_P-NONE_S-NONE.png,US || Manual Bid || BFCM || COST CAP 81 || 1C || 15/11/24,SHARE,$1,26,2024-11-15,2025-03-17,122
382,CB_2023_Nov_FB_2675_DT_V01_9x16_VID_EN_Opti_C-Pointing_CTA-XMAS65_Pain-W_M-SEAN_VL-30s_TR-None_G-M_P-NONE_S-YARIN_FB2396V02,ðŸ’°WC || US || Advantage+ || BIG BUDGET || CC101->105->109->112->114-116->117 || BROAD || ABO || 1C || 17/01/24 RELAUNCHED Ad set,VIDEO,$1,35,2024-01-17,2025-02-06,386
383,CB_2023_Jul_FB_2217_IB_V04_9x16_VID_EN_Opti_C-Pointing_CTA-SMR_Pain-W-B_M-TRC_VL-30s_TR-None_G-F_P-None_S-FRIGGA,US || Manual Bid || BFCM || COST CAP 81 || 1C || 15/11/24,VIDEO,$1,23,2024-11-15,2025-03-16,121
384,CB_2025_Jan_FB_3700_SO_V03_4x5_IMG_EN_New_C-Headline_Evergreen_CTA-NONE_Angle-W-B-C_M-NONE_VL-None_G-NONE_P-NONE_S-NONE,3700 - Notion Idea #90 THE 5 RULES || Enhancements: OFF || CBV1 || Batch 1 || 1C || 21/01/25w04 || Kostas,SHARE,$1,16,2025-01-21,2025-01-30,9
385,CB_2024_Jan_FB_2762_IK_V04_1x1_IMG_EN_New_C-WrittenTesti_CTA-CTA_Pain-W-B-C_M-NONE_VL-None_TR-None_G-NONE_P-V2_S-NONE,CBV2 || EU (UK) || ðŸ’° Advantage+ || US || BROAD || 7C || Existing_customer_5% || 15/12/24 Ad set,SHARE,$1,40,2024-12-15,2025-01-31,47
386,CB_2023_Nov_FB_2664_MB_V08_9x16_VID_EN_Opti_C-Testim_CTA-XMAS65_Pain-W_M-MIX_VL-30s_TR-None_G-F_P-None_S-Starry,ðŸ’°WC || US || Advantage+ || BIG BUDGET || CC101->105->109->112->114-116->117 || BROAD || ABO || 1C || 17/01/24 RELAUNCHED Ad set,VIDEO,$1,14,2024-01-17,2025-02-04,384
387,CB_2025_Jan_FB_3738_SO-DP_V02_4x5_IMG_EN_Opti_C-NONE_Evergreen_CTA-SALE_Angle-W_M-NONE_VL-None_G-NONE_P-NONE_S-NONE3665V01,3738 - 3665_V01 OPTI || Enhancements: OFF || CBV1 || Batch 1 || 1C || 29/01/25w05 || Kostas,SHARE,$1,31,2025-01-29,2025-01-30,1
388,CB_2025_Jan_FB_3660_CHUB_V01_4x5_IMG_EN_New_C-NONE_CTA-NONE_Angle-C_M-NONE_VL-None_TR-None_G-NONE_P-NONE_S-NONE,3660 - G-nuggets winner ITR || Enhancements: OFF || CBV1 || Batch 1 || 1C || 14/01/25w03 || Kostas,SHARE,$0,11,2025-01-14,2025-01-27,13
389,CB_2025_Jan_FB_3696_CHUB_V02_4x5_IMG_EN_New_C-NONE_CTA-NONE_Angle-C_M-NONE_VL-None_TR-None_G-NONE_P-OG_S-NONE,3696 Struggling with Poop rocks CHUB || Enhancements: OFF || CBV1 || Batch 1 || 1C || 22/01/25w04,SHARE,$0,22,2025-01-22,2025-01-29,7
390,CB_2025_Jan_FB_3699_DT-DP_V01_4x5_IMG_EN_New_C-Headline_Evergreen_CTA-NONE_Angle-W-B_M-NONE_VL-None_G-NONE_P-OG_S-NONE,3699 - Notion idea #86 || Enhancements: OFF || CBV1 || Batch 1 || 1C || 21/01/25w04 || Kostas,SHARE,$0,6,2025-01-21,2025-01-28,7
391,CB_2024_Dec_FB_3608_LZ-DP_V01_4x5_IMG_EN_New_C-Headline_Evergreen_CTA-NONE_Angle-W_M-NONE_VL-None_G-NONE_P-OG_S-NONE,3608 - CB_IMG_ notion #17 hypnosis || Enhancements: OFF || CBV1 || Batch 1 || 1C || 13/01/25w03 || Kostas,SHARE,$0,39,2025-01-13,2025-02-03,21
392,CB_2024_Dec_FB_3622_LZ-KB_V03_4x5_IMG_EN_Opti_C-NONE_Sale_CTA-XMAS_Angle-GH_M-NONE_VL-None_G-NONE_P-OG_S-NONE_FB2227V08 - Copy,US || Manual Bid || BID CAP 111 || 1C || 21/12/24,SHARE,$0,8,2024-12-22,2025-03-26,94
393,CB_2025_Jan_FB_3699_DT-DP_V05_4x5_IMG_EN_New_C-Headline_Evergreen_CTA-NONE_Angle-W-B_M-NONE_VL-None_G-NONE_P-OG_S-NONE,3699 - Notion idea #86 || Enhancements: OFF || CBV1 || Batch 1 || 1C || 21/01/25w04 || Kostas,SHARE,$0,12,2025-01-21,2025-01-30,9
394,CB_2025_Jan_FB_3696_CHUB_V01_4x5_IMG_EN_New_C-NONE_CTA-NONE_Angle-C_M-NONE_VL-None_TR-None_G-NONE_P-OG_S-NONE,3696 Struggling with Poop rocks CHUB || Enhancements: OFF || CBV1 || Batch 1 || 1C || 22/01/25w04,SHARE,$0,9,2025-01-22,2025-01-29,7
