,Ad Name,Adset Name,Creative Type,Spend In USD,Impressions,First Ad Spend Date,Last Ad Spend Date,Days ad spending
1,CB_2025_Jun_FB_4159_VK_V09_4x5_IMG_EN_New_C-BulletPoints_Evergreen_CTA-SALE_Angle-W-B-C_M-NONE_VL-None_G-M_P-OG_S-NONE,ðŸŒ¶ï¸  || ASC+ || US || 0% EXISTING CAP || 7C || 15/05/2025  Campaign Ad set,SHARE,"$16,214","951,730",2025-06-13,2025-06-25,12
2,CB_2025_Feb_FB_3883_LZ-RP_V05_9x16_VID_EN_Opti_C-BulletPoints_Evergreen_CTA-SALE_Angle-W_M-JANW_VL-30s_G-M_P-OG_S-WHAT_FB2284V05,ðŸŒ¶ï¸  || ASC+ || US || 0% EXISTING CAP || 7C || 15/05/2025  Campaign Ad set,VIDEO,"$13,580","621,903",2025-05-15,2025-06-25,41
3,CB_2025_Jan_FB_3748_VK-DP_V01_4x5_IMG_EN_New_C-BulletPoints_Sale_CTA-NY_Angle-W-B-C_M-NONE_VL-None_G-M_P-OG_S-NONE,GLP-1 ðŸ’œ || ASC+ || US || 5% EXISTING CAP || 7C || 29/05/2025 Ad set,SHARE,"$13,168","300,097",2025-06-02,2025-06-25,23
4,CB_2025_Jan_FB_3748_VK-DP_V01_4x5_IMG_EN_New_C-BulletPoints_Sale_CTA-NY_Angle-W-B-C_M-NONE_VL-None_G-M_P-OG_S-NONE,GLP-1 ðŸ’œ || ASC+ || CA || 5% EXISTING CAP || 7C || 29/05/2025 Ad set,SHARE,"$9,163","441,006",2025-06-10,2025-06-25,15
5,CB_2025_Feb_FB_3774_SO-JT_V05_1x1_IMG_EN_New_C-Headline_Evergreen_CTA-NONE_Angle-W_M-NONE_VL-15s_G-NONE_P-GLP1_S-NONE,GLP-1 ðŸ’œ || ASC+ || US || 5% EXISTING CAP || 7C || 29/05/2025 Ad set,SHARE,"$8,795","387,783",2025-06-14,2025-06-25,11
6,CB_2023_May_FB_2103_MB_V02_9x16_VID_EN_Opti_C-Sale_CTA-SMR_Pain-W_M-JOG_VL-30s_TR-None_G-M-F_P-None_S-What - Copy,ðŸŒ¶ï¸  || ASC+ || US || 0% EXISTING CAP || 7C || 15/05/2025  Campaign Ad set,VIDEO,"$8,459","273,103",2025-05-15,2025-06-25,41
7,CB_2025_May_FB_4143_DT_V03_4x5_IMG_EN_New_C-Headline_Evergreen_CTA-65_Angle-W_M-NONE_VL-None_G-NONE_P-OG_S-NONE,ðŸŒ¶ï¸  || ASC+ || US || 0% EXISTING CAP || 7C || 15/05/2025  Campaign Ad set,SHARE,"$7,514","375,008",2025-06-14,2025-06-23,9
8,CB_2025_Jan_FB_3723_SO_V04_4x5_IMG_EN_New_C-NONE_Evergreen_CTA-SALE_Angle-W_M-NONE_VL-None_G-NONE_P-NONE_S-NONE - Copy,ðŸŒ¶ï¸  || ASC+ || US || 0% EXISTING CAP || 7C || 15/05/2025  Campaign Ad set,SHARE,"$7,415","426,045",2025-05-15,2025-06-25,41
9,Dynamic_Creative_Statics_CA_Flow,WC || CA || DYNAMIC CREATIVE Static winners || ADV+ audience || 7C || 16.02.2025,SHARE,"$6,970","501,084",2025-02-16,2025-06-25,129
10,CB_2025_Jun_FB_4145_DT-KB_V06_4x5_IMG_EN_Opti_C-BulletPoints_Sale_CTA-65_Angle-W-B-C_M-NONE_VL-None_G-M_P-OG_S-NONE_FB3891V05 - CC,ðŸ‘¨ || Father's Day || Bundle offer  || ASC+ || US || 0% EXISTING CAP || 7C || 07/06/2025 Ad set,SHARE,"$6,564","363,037",2025-06-07,2025-06-25,18
11,CB_2023_Jul_FB_2217_IB_V04_9x16_VID_EN_Opti_C-Pointing_CTA-SMR_Pain-W-B_M-TRC_VL-30s_TR-None_G-F_P-None_S-FRIGGA - Copy,ðŸŒ¶ï¸  || ASC+ || US || 0% EXISTING CAP || 7C || 15/05/2025  Campaign Ad set,VIDEO,"$6,308","211,269",2025-05-15,2025-06-25,41
12,CB_2025_Jan_FB_3751_VK-DP_V01_4x5_IMG_EN_New_C-BulletPoints_Sale_CTA-NY_Angle-W-B-C_M-NONE_VL-None_G-M_P-GLP1_S-NONE,GLP-1 ðŸ’œ || ASC+ || US || 5% EXISTING CAP || 7C || 29/05/2025 Ad set,SHARE,"$6,257","208,795",2025-06-02,2025-06-24,22
13,CB_2025_May_FB_4086_SO_V01_4x5_IMG_EN_New_C-NONE_Evergreen_CTA-NONE_Angle-W_M-NONE_VL-None_G-NONE_P-OG_S-NONE,ðŸŒ¶ï¸  || ASC+ || US || 0% EXISTING CAP || 7C || 15/05/2025  Campaign Ad set,SHARE,"$6,207","304,347",2025-05-20,2025-06-23,34
14,CB_2025_Jun_FB_4156_DT_V04_9x16_VID_EN_New_C-Testimonial_Evergreen_CTA-65_Angle-W-B-C_M-JAS_VL-30s_G-M_P-OG_S-NEW,ðŸŒ¶ï¸  || ASC+ || US || 0% EXISTING CAP || 7C || 15/05/2025  Campaign Ad set,VIDEO,"$6,199","264,362",2025-06-14,2025-06-25,11
15,CB_2025_May_FB_4100_SO-KB_V02_4x5_IMG_EN_New_C-Headline_Evergreen_CTA-NONE_Angle-W_M-NONE_VL-None_G-NONE_P-OG_S-NONE,ðŸŒ¶ï¸  || ASC+ || US || 0% EXISTING CAP || 7C || 15/05/2025  Campaign Ad set,SHARE,"$5,906","226,984",2025-06-03,2025-06-25,22
16,CB_2025_May_FB_4114_LZ-VG_V07_4x5_IMG_EN_New_C-Headline_Evergreen_CTA-NONE_Angle-C_M-NONE_VL-None_G-M_P-NONE_S-NONE,ðŸŒ¶ï¸  || ASC+ || US || 0% EXISTING CAP || 7C || 15/05/2025  Campaign Ad set,SHARE,"$5,321","248,539",2025-06-14,2025-06-25,11
17,CB_2025_Feb_FB_3774_SO-JT_V05_1x1_IMG_EN_New_C-Headline_Evergreen_CTA-NONE_Angle-W_M-NONE_VL-15s_G-NONE_P-GLP1_S-NONE,3774 - #114 SMASH GLP IMG || Batch 2 || Enhancements: OFF || GLP-1 Booster || 7C1V || 09/06/25w23,SHARE,"$4,875","207,886",2025-06-09,2025-06-25,16
18,CB_2025_Jun_FB_4159_VK_V09_4x5_IMG_EN_New_C-BulletPoints_Evergreen_CTA-SALE_Angle-W-B-C_M-NONE_VL-None_G-M_P-OG_S-NONE,CA || ASC+ || 0% EXISTING || 7DC || 12.05.2025 RESTART Ad set,SHARE,"$4,609","469,558",2025-06-14,2025-06-25,11
19,CB_2025_Jan_FB_3751_VK-DP_V01_4x5_IMG_EN_New_C-BulletPoints_Sale_CTA-NY_Angle-W-B-C_M-NONE_VL-None_G-M_P-GLP1_S-NONE,3751 - opti 3608 GLP1 - VK-DP || Batch 1 || Enhancements: OFF || GLP-1 Booster || 7C1V || 30/05/25w22,SHARE,"$4,052","164,731",2025-05-30,2025-06-25,26
20,CB_2024_Dec_FB_3622_LZ-DP_V03_4x5_IMG_EN_Opti_C-NONE_Sale_CTA-XMAS_Angle-GH_M-NONE_VL-None_G-NONE_P-OG_S-NONE_FB2227V08 - Copy,ðŸŒ¶ï¸  || ASC+ || US || 0% EXISTING CAP || 7C || 15/05/2025  Campaign Ad set,SHARE,"$3,556","113,641",2025-05-15,2025-06-25,41
21,CB_2025_Jan_FB_3748_VK-DP_V02_4x5_IMG_EN_New_C-BulletPoints_Sale_CTA-NY_Angle-W-B-C_M-NONE_VL-None_G-M_P-OG_S-NONE.png - Copy,3748 - winner ads opti - GLP1 - VK-DP || Enhancements: OFF || GLP-1 || Batch 1 || 7C || 20/02/25w09 || Valentinas,SHARE,"$3,477","128,006",2025-02-24,2025-06-25,121
22,CB_2023_Apr_FB_1989_RS_V08_9x16_VID_EN_Opti_C-Trend_CTA-SMR_Pain-W_M-MIX_VL-30s_TR-None_G-MF_P-None,ðŸŒ¶ï¸  || ASC+ || US || 0% EXISTING CAP || 7C || 15/05/2025  Campaign Ad set,VIDEO,"$3,311","110,121",2025-05-15,2025-06-25,41
23,CB_2025_Mar_FB_3914_DT-DP_V01_9x16_VID_EN_New_C-Trend_Sale_CTA-SPRNG_Angle-W-B-C_M-JOG_VL-30s_G-F_P-OG_S-NEW,ðŸŒ¶ï¸  || ASC+ || US || 0% EXISTING CAP || 7C || 15/05/2025  Campaign Ad set,VIDEO,"$3,150","98,064",2025-05-15,2025-06-25,41
24,CB_2025_Feb_FB_3827_LZ_V04_1x1_IMG_EN_Opti_C-Headline_Evergreen_CTA-SALE_Angle-W_M-NONE_VL-None_G-M_P-CBV2_S-NONE_FB3779V02,CBV2 || US || Manual Bid: ROAS GOAL: 1.00 -> 1.1 || 7DC || 22/01/2025,SHARE,"$3,103","100,405",2025-02-18,2025-06-25,127
25,CB_2025_May_FB_4100_SO_V02_4x5_IMG_EN_New_C-Headline_Evergreen_CTA-NONE_Angle-W_M-NONE_VL-None_G-NONE_P-OG_S-NONE,CA || ASC+ || 0% EXISTING || 7DC || 12.05.2025 RESTART Ad set,SHARE,"$2,552","193,310",2025-06-05,2025-06-25,20
26,CB_2025_Jan_FB_3748_VK-DP_V01_4x5_IMG_EN_New_C-BulletPoints_Sale_CTA-NY_Angle-W-B-C_M-NONE_VL-None_G-M_P-OG_S-NONE,3748 - winner ads opti - GLP1 - VK-DP || Enhancements: OFF || GLP-1 Booster || 7C1V || 30/05/25w22,SHARE,"$2,440","70,943",2025-05-30,2025-06-25,26
27,CB_2025_Jan_FB_3739_DT_V08_4x5_VID_EN_Opti_C-BulletPoints_Sale_CTA-70_Angle-W-B_M-MIX_VL-45s_G-MF_P-GLP1_S-WHAT_FB3311V10,GLP-1 ðŸ’œ || ASC+ || CA || 5% EXISTING CAP || 7C || 29/05/2025 Ad set,VIDEO,"$2,425","78,707",2025-06-10,2025-06-25,15
28,CB_2025_Jan_FB_3751_VK-DP_V01_4x5_IMG_EN_New_C-BulletPoints_Sale_CTA-NY_Angle-W-B-C_M-NONE_VL-None_G-M_P-GLP1_S-NONE,GLP-1 ðŸ’œ || ASC+ || CA || 5% EXISTING CAP || 7C || 29/05/2025 Ad set,SHARE,"$2,404","134,081",2025-06-10,2025-06-24,14
29,CB_2024_Apr_FB_2970_RS_V02_1x1_GIF_EN_Opti_C-WrittenTesti_CTA-CTA_Pain-W_M-NONE_VL-7s_TR-None_G-NONE_P-V2_S-NEW,CBV2 || US || Manual Bid: ROAS GOAL: 1.00 -> 1.1 || 7DC || 22/01/2025,VIDEO,"$2,217","67,181",2025-03-27,2025-06-25,90
30,CB_2024_Sep_FB_3175_DA-KB_V04_1x1_IMG_EN_New_C-ADVRT_Evergreen_CTA-NONE_Angle-W_M-NONE_VL-None_G-NONE_P-CBV2_S-NONE_blog_colonbroomvsmammoth_cv_en,CBV2 || Advantage+ || Advertorial || Higher pricing || US || 0% EXISTING CAP || BROAD || 7C || 20/01/25  Campaign Ad set,SHARE,"$2,142","91,513",2025-01-20,2025-06-25,156
31,CB_2025_May_FB_4086_SO_V01_4x5_IMG_EN_New_C-NONE_Evergreen_CTA-NONE_Angle-W_M-NONE_VL-None_G-NONE_P-OG_S-NONE,âš«ï¸ US || CBV2 || Advantage+ || 7C || BROAD || Existing_customer_0% || || 24/04/25 Ad set,SHARE,"$2,106","101,485",2025-05-20,2025-06-23,34
32,CB_2025_Feb_FB_3774_SO-JT_V03_1x1_IMG_EN_New_C-Headline_Evergreen_CTA-NONE_Angle-W_M-NONE_VL-15s_G-NONE_P-GLP1_S-NONE,3774 - #114 SMASH GLP IMG || Batch 1 || Enhancements: OFF || GLP-1 Booster || 7C1V || 09/06/25w23,SHARE,"$2,098","46,743",2025-06-09,2025-06-25,16
33,CB_2025_Jun_FB_4199_DT-KB_V06_4x5_IMG_EN_New_C-BulletPoints_Sale_CTA-70_Angle-W-B-C_M-NONE_VL-None_G-M_P-GLP1_S-NONE_FB3751V04,4199 - Father's Day GLP-1 Opti || Batch 1 || Enhancements: OFF || GLP-1 Booster || 7C1V || 16/06/25w25,SHARE,"$2,040","60,848",2025-06-16,2025-06-25,9
34,CB_2024_Sep_FB_3175_DA-KB_V04_1x1_IMG_EN_New_C-ADVRT_Evergreen_CTA-NONE_Angle-W_M-NONE_VL-None_G-NONE_P-CBV2_S-NONE_blog_colonbroomvsmammothhighprice3_cv_en,CBV2 || Advantage+ || Advertorial || Higher pricing || US || 0% EXISTING CAP || BROAD || 7C || 20/01/25  Campaign Ad set,SHARE,"$2,002","81,775",2025-04-16,2025-06-25,70
35,CB_2025_Jan_FB_3739_DT_V08_4x5_VID_EN_Opti_C-BulletPoints_Sale_CTA-70_Angle-W-B_M-MIX_VL-45s_G-MF_P-GLP1_S-WHAT_FB3311V10,GLP-1 ðŸ’œ || ASC+ || UK || 5% EXISTING CAP || 7C || 29/05/2025 Ad set,VIDEO,"$1,955","34,833",2025-06-10,2025-06-25,15
36,CB_2024_Aug_FB_3090_DT-DP_V02_9x16_VID_EN_Opti_C-MakingOf_CTA-CTA_Pain-W-B-C_M-POW_VL-45s_TR-None_G-M_P-OG_S-Moon_FB3029V04,âš«ï¸ US || CBV2 || Advantage+ || 7C || BROAD || Existing_customer_0% || || 24/04/25 Ad set,VIDEO,"$1,940","75,073",2025-04-24,2025-06-25,62
37,CB_2025_Jan_FB_3751_VK-DP_V01_4x5_IMG_EN_New_C-BulletPoints_Sale_CTA-NY_Angle-W-B-C_M-NONE_VL-None_G-M_P-GLP1_S-NONE,GLP-1 ðŸ’œ || ASC+ || UK || 5% EXISTING CAP || 7C || 29/05/2025 Ad set,SHARE,"$1,808","75,229",2025-06-10,2025-06-24,14
38,CB_2025_Apr_FB_4054_LZ-DP_V01_9x16_VID_EN_Opti_C-MakingOf_Sale_CTA-SALE_Angle-W_M-PASQ_VL-30s_G-M_P-OG_S-NEW_FB3995V01,CA || ASC+ || 0% EXISTING || 7DC || 12.05.2025 RESTART Ad set,VIDEO,"$1,794","139,591",2025-05-14,2025-06-25,42
39,CB_2023_Dec_FB_2712_RS-DP_V02_1x1_VID_EN_Opti_C-WrittenTesti_CTA-SALE_Pain-W-B-C_M-NONE_VL-None_TR-None_G-NONE_P-V2_S-NONE_FB2227V08,CBV2 || EU (UK) || ðŸ’° Advantage+ || US || BROAD || 7C || Existing_customer_5% || 15/12/24 Ad set,VIDEO,"$1,754","80,356",2025-03-31,2025-06-25,86
40,CB_2025_May_FB_4114_LZ-VG_V07_4x5_IMG_EN_New_C-Headline_Evergreen_CTA-NONE_Angle-C_M-NONE_VL-None_G-M_P-NONE_S-NONE,4114 - FOMO angle || Enhancements: OFF || CBV1 || Batch 3 || 7C || 02/06/25w23,SHARE,"$1,725","84,745",2025-06-02,2025-06-25,23
41,CB_2023_Sep_FB_2429_DT_V03_9x16_VID_EN_Opti_C-Sale_CTA-CTA_Pain-W_M-MIX_VL-45s_TR-None_G-MF_P-V2_S-WHAT - Copy,âš«ï¸ US || CBV2 || Advantage+ || 7C || BROAD || Existing_customer_0% || || 24/04/25 Ad set,VIDEO,"$1,663","73,176",2025-04-24,2025-06-25,62
42,CB_2025_Jun_FB_4199_DT-KB_V03_9x16_VID_EN_Opti_C-Dance_Sale_CTA-70_Angle-W_M-MIX_VL-45s_G-MF_P-GLP1_S-STARRY_FB3739V04,4199 - Father's Day GLP-1 Opti || Batch 2 || Enhancements: OFF || GLP-1 Booster || 7C1V || 16/06/25w25,VIDEO,"$1,544","68,361",2025-06-16,2025-06-25,9
43,CB_2025_May_FB_4120_DT_V06_4x5_IMG_EN_New_C-Headline_Evergreen_CTA-65_Angle-W-B-C_M-NONE_VL-None_G-NONE_P-OG_S-NONE,"4120 - #138 The Monkey, The Bear and The Ugly || Enhancements: OFF || CBV1 || Batch 2 || 7C || 02/06/25w23",SHARE,"$1,526","76,000",2025-06-02,2025-06-23,21
44,CB_2025_May_FB_4140_SO-VG_V11_4x5_IMG_EN_Opti_C-NONE_Evergreen_CTA-NONE_Angle-W_M-NONE_VL-None_G-NONE_P-OG_S-NONE_FB4040V09 - BIOMA,ðŸ‘¨ || Father's Day || Bundle offer  || ASC+ || US || 0% EXISTING CAP || 7C || 07/06/2025 Ad set,SHARE,"$1,480","64,529",2025-06-07,2025-06-25,18
45,CB_2025_Feb_FB_3816_VK-DP_V01_9x16_VID_EN_New_C-BulletPoints_Evergreen_CTA-70_Angle-W-B-C_M-JOG_VL-None_G-F_P-GLP1_S-MOON,3816 - Winner VLOG ad to GLP - VK-DP || Batch 1 || Enhancements: OFF || GLP-1 Booster || 7C1V || 16/06/25w25,VIDEO,"$1,476","28,427",2025-06-16,2025-06-25,9
46,CB_2024_Aug_FB_3097_VK-DP_V03_9x16_VID_EN_Opti_C-Benefits_CTA-SMR_Pain-W-B_M-MIX_VL-45s_TR-None_G-MF_P-OG_S-WHAT_FB2516V13,ðŸŒ¶ï¸  || ASC+ || US || 0% EXISTING CAP || 7C || 15/05/2025  Campaign Ad set,VIDEO,"$1,380","56,488",2025-05-15,2025-06-25,41
47,CB_2025_Mar_FB_3914_DT-DP_V01_9x16_VID_EN_New_C-Trend_Sale_CTA-SPRNG_Angle-W-B-C_M-JOG_VL-30s_G-F_P-OG_S-NEW,CA || ASC+ || 0% EXISTING || 7DC || 12.05.2025 RESTART Ad set,VIDEO,"$1,346","88,704",2025-05-12,2025-06-25,44
48,CB_2025_May_FB_4120_DT_V06_4x5_IMG_EN_New_C-Headline_Evergreen_CTA-65_Angle-W-B-C_M-NONE_VL-None_G-NONE_P-OG_S-NONE,ðŸŒ¶ï¸  || ASC+ || US || 0% EXISTING CAP || 7C || 15/05/2025  Campaign Ad set,SHARE,"$1,239","55,296",2025-06-16,2025-06-23,7
49,CB_2025_May_FB_4143_DT_V03_4x5_IMG_EN_New_C-Headline_Evergreen_CTA-65_Angle-W_M-NONE_VL-None_G-NONE_P-OG_S-NONE,4143 - Hormonal weight || Enhancements: OFF || CBV1 || Batch 1 || 7C || 02/06/25w23,SHARE,"$1,197","56,082",2025-06-02,2025-06-25,23
50,CB_2025_Apr_FB_4040_SO_V09_4x5_IMG_EN_New_C-NONE_Evergreen_CTA-SALE_Angle-W_M-NONE_VL-None_G-NONE_P-NONE_S-NONE,CA || INTEREST: UPCOMING BIRTHDAY || 7C || 11/05/25,SHARE,"$1,178","78,245",2025-05-28,2025-06-25,28
51,CB_2023_Aug_FB_2369_DA_V04_9x16_GIF_EN_New_C-Benefits_CTA-DISCOUNT_Pain-W-B_M-NONE_VL-15s_TR-None_G-NONE_P-V2_S-NEW,CBV2 || US || Manual Bid: ROAS GOAL: 1.00 -> 1.1 || 7DC || 22/01/2025,VIDEO,"$1,163","46,033",2025-04-28,2025-06-25,58
52,CB_2025_Feb_FB_3883_LZ-RP_V05_9x16_VID_EN_Opti_C-BulletPoints_Evergreen_CTA-SALE_Angle-W_M-JANW_VL-30s_G-M_P-OG_S-WHAT_FB2284V05,ASC+ || Angler Predictive Conversions API - Challanger A || BAU || 7DC || 10/06/2025 Ad set,VIDEO,"$1,143","50,248",2025-06-10,2025-06-25,15
53,CB_2024_Aug_FB_3090_DT-DP_V02_9x16_VID_EN_Opti_C-MakingOf_CTA-CTA_Pain-W-B-C_M-POW_VL-45s_TR-None_G-M_P-OG_S-Moon_FB3029V04,ðŸŒ¶ï¸  || ASC+ || US || 0% EXISTING CAP || 7C || 15/05/2025  Campaign Ad set,VIDEO,"$1,098","38,510",2025-05-15,2025-06-25,41
54,CB_2025_Feb_FB_3817_SO_V01_4x5_IMG_EN_Opti_C-NONE_Evergreen_CTA-SALE_Angle-W_M-NONE_VL-None_G-NONE_P-NONE_S-NONE_FB3723V07,CBV2 || EU (UK) || ðŸ’° Advantage+ || US || BROAD || 7C || Existing_customer_5% || 15/12/24 Ad set,SHARE,"$1,094","62,777",2025-02-14,2025-06-25,131
55,CB_2025_May_FB_4132_VK-DP_V01_9x16_VID_EN_New_C-BulletPoints_Evergreen_CTA-SALE_Angle-W-B-C_M-POW_VL-30s_G-M_P-OG_S-MOON,4132 - GLP benefit VID || Enhancements: OFF || CBV1 || Batch 1 || 7C || 02/06/25w23,VIDEO,"$1,055","40,642",2025-06-02,2025-06-20,18
56,CB_2025_Jun_FB_4207_CHUB-KZ_V03_4x5_IMG_EN_Opti_C-NONE_CTA-NONE_Angle-W_M-NONE_VL-None_TR-None_G-M_P-OG_S-NONE.png,4207 - CHUB SocialMediaDadBod || Enhancements: OFF || CBV1 || Batch 1 || 7C || 16/06/25w25,SHARE,"$1,036","53,826",2025-06-16,2025-06-25,9
57,CB_2025_Jun_FB_4159_VK_V09_4x5_IMG_EN_New_C-BulletPoints_Evergreen_CTA-SALE_Angle-W-B-C_M-NONE_VL-None_G-M_P-OG_S-NONE,4159 - obsessed is understatement - VK || Enhancements: OFF || CBV1 || Batch 3 || 7C || 09/06/25w24,SHARE,"$1,030","55,100",2025-06-09,2025-06-20,11
58,CB_2025_Feb_FB_3795_SO-KB_V01_1x1_IMG_EN_New_C-A-Compare_Evergreen_CTA-NONE_Angle-W_M-NONE_VL-15s_G-NONE_P-GLP1_S-NONE,3795 - Notion Idea #120 ozempic vs GLP-1 || Batch 1 || Enhancements: OFF || GLP-1 Booster || 7C1V || 16/06/25w25,SHARE,"$1,016","23,190",2025-06-17,2025-06-25,8
59,CB_2025_Jun_FB_4151_DT-KB_V02_4x5_IMG_EN_New_C-NONE_Sale_CTA-65_Angle-W-B_M-NONE_VL-None_G-NONE_P-OG_S-NONE_FB2959V07 - BIOMA,ðŸ‘¨ || Father's Day - Non spenders for 4th July Learnings || Bundle offer || ASC+ || US || 0% EXISTING CAP || 7C || 18/06/2025 Ad set,SHARE,$975,"33,888",2025-06-18,2025-06-22,4
60,CB_2025_Jan_FB_3748_VK-DP_V01_4x5_IMG_EN_New_C-BulletPoints_Sale_CTA-NY_Angle-W-B-C_M-NONE_VL-None_G-M_P-OG_S-NONE,GLP-1 ðŸ’œ || ASC+ || EU  || 7C || 14/06/2025 Ad set,SHARE,$972,"34,215",2025-06-14,2025-06-17,3
61,CB_2025_Jun_FB_4145_DT-KB_V04_4x5_IMG_EN_Opti_C-NONE_Sale_CTA-65_Angle-W-B-C_M-NONE_VL-None_G-NONE_P-OG_S-NONE_FB3924V03 - CC,ðŸ‘¨ || Father's Day || Bundle offer  || ASC+ || US || 0% EXISTING CAP || 7C || 07/06/2025 Ad set,SHARE,$924,"37,394",2025-06-07,2025-06-23,16
62,CB_2025_May_FB_4149_DT-VG_V01_9x16_VID_EN_Opti_C-Testimonial_Evergreen_CTA-SALE_Angle-W_M-MOOD_VL-30s_G-M_P-OG_S-WOOD_FB3860V03,ðŸ‘¨ || Father's Day - Non spenders for 4th July Learnings || Bundle offer || ASC+ || US || 0% EXISTING CAP || 7C || 18/06/2025 Ad set,VIDEO,$902,"39,465",2025-06-18,2025-06-22,4
63,CB_2025_Jan_FB_3753_SO_V01_4x5_IMG_EN_New_C-Headline_Evergreen_CTA-NONE_Angle-W_M-NONE_VL-None_G-NONE_P-GLP1_S-NONE,3753 - Notion Idea #111 â€œDualâ€Benefit Vennâ€ || Batch 1 || Enhancements: OFF || GLP-1 Booster || 7C1V || 02/06/25w23,SHARE,$877,"19,801",2025-06-03,2025-06-20,17
64,CB_2025_May_FB_4100_SO_V02_4x5_IMG_EN_New_C-Headline_Evergreen_CTA-NONE_Angle-W_M-NONE_VL-None_G-NONE_P-OG_S-NONE,ASC+ || Angler Predictive Conversions API - Challanger A || 7DC || 10/06/2025 Campaign Ad set,SHARE,$832,"29,953",2025-06-10,2025-06-23,13
65,CB_2025_May_FB_4091_LZ-VG_V01_4x5_IMG_EN_Opti_C-Sale_Sale_CTA-MEMO_Angle-None_M-NONE_VL-None_G-NONE_P-OG_S-NONE_FB3907V03,ASC+ || Angler Predictive Conversions API - Challanger A || BAU || 7DC || 10/06/2025 Ad set,SHARE,$823,"31,071",2025-06-10,2025-06-25,15
66,CB_2025_Jan_FB_3751_VK-DP_V02_4x5_IMG_EN_New_C-BulletPoints_Sale_CTA-NY_Angle-W-B-C_M-NONE_VL-None_G-M_P-GLP1_S-NONE,GLP-1 ðŸ’œ || ASC+ || CA || 5% EXISTING CAP || 7C || 29/05/2025 Ad set,SHARE,$823,"36,590",2025-06-16,2025-06-25,9
67,CB_2025_May_FB_4100_SO_V02_4x5_IMG_EN_New_C-Headline_Evergreen_CTA-NONE_Angle-W_M-NONE_VL-None_G-NONE_P-OG_S-NONE,ASC+ || Angler Predictive Conversions API - Challanger B || 7DC || 10/06/2025 Campaign Ad set,SHARE,$794,"34,638",2025-06-10,2025-06-25,15
68,CB_2025_Jun_FB_4168_SO-JG_V02_4x5_IMG_EN_New_C-Headline_Evergreen_CTA-NONE_Angle-W_M-NONE_VL-None_G-NONE_P-OG_S-NONE,4168 - #154_IMG_Another you || Enhancements: OFF || CBV1 || Batch 1 || 7C || 09/06/25w24,SHARE,$789,"39,381",2025-06-09,2025-06-25,16
69,CB_2025_May_FB_4140_SO-VG_V09_4x5_IMG_EN_Opti_C-NONE_Evergreen_CTA-NONE_Angle-W_M-NONE_VL-None_G-NONE_P-OG_S-NONE_FB4040V09 - BIOMA,ðŸ‘¨ || Father's Day || Bundle offer  || ASC+ || US || 0% EXISTING CAP || 7C || 07/06/2025 Ad set,SHARE,$784,"25,606",2025-06-07,2025-06-25,18
70,CB_2025_Jan_FB_3742_SO-DP-KB_V06_4x5_IMG_EN_Opti_C-NONE_Evergreen_CTA-SALE_Angle-W_M-NONE_VL-None_G-NONE_P-CBV2_S-NONE3665V01,CBV2 || US || Manual Bid: ROAS GOAL: 1.00 -> 1.1 || 7DC || 22/01/2025,SHARE,$781,"32,481",2025-02-11,2025-06-25,134
71,CB_2025_May_FB_4091_LZ-VG_V01_4x5_IMG_EN_Opti_C-Sale_Sale_CTA-MEMO_Angle-None_M-NONE_VL-None_G-NONE_P-OG_S-NONE_FB3907V03,ASC+ || Angler Predictive Conversions API - Challanger B || 7DC || 10/06/2025 Campaign Ad set,SHARE,$771,"30,936",2025-06-10,2025-06-25,15
72,CB_2025_Jan_FB_3753_SO_V04_4x5_IMG_EN_New_C-Headline_Evergreen_CTA-NONE_Angle-W_M-NONE_VL-None_G-NONE_P-GLP1_S-NONE,3753 - Notion Idea #111 â€œDualâ€Benefit Vennâ€ || Batch 1 || Enhancements: OFF || GLP-1 Booster || 7C1V || 02/06/25w23,SHARE,$770,"14,484",2025-06-03,2025-06-20,17
73,CB_2025_Jan_FB_3757_LZ-DP_V15_4x5_VID_EN_Opti_C-BulletPoints_Evergreen_CTA-NONE_Angle-W-B-C_M-KAIT_VL-30s_G-F_P-GLP1_S-NEW_FB3592V10,3757 - GLP1 video winner opti Batch 3+4 || Batch 3 || Enhancements: OFF || GLP-1 Booster || 7C1V || 30/05/25w22,SHARE,$767,"25,126",2025-05-30,2025-06-25,26
74,CB_2025_Jun_FB_4171_DT_V03_9x16_VID_EN_Opti_C-MakingOf_Sale_CTA-65_Angle-W-B_M-CRAZY_VL-45s_G-M_P-OG_S-NEW_FB3264V31 - BIOMA,ðŸ‘¨ || Father's Day || Bundle offer  || ASC+ || US || 0% EXISTING CAP || 7C || 07/06/2025 Ad set,VIDEO,$765,"34,226",2025-06-07,2025-06-25,18
75,CB_2025_Jun_FB_4179_LZ-KB_V03_4x5_IMG_EN_New_C-BeforeAfter_Evergreen_CTA-65_Angle-W-B_M-NONE_VL-None_G-M_P-OG_S-NONE,4179 - Puzzle piece || Enhancements: OFF || CBV1 || Batch 1 || 7C || 09/06/25w24,SHARE,$746,"39,442",2025-06-09,2025-06-22,13
76,CB_2023_Aug_FB_2295_MB_V01_1x1_VID_EN_Opti_C-GIF_CTA-CTA_Pain-W-B_M-None_VL-10s_TR-None_G-None_P-None_S-None,CA || INTEREST: UPCOMING BIRTHDAY || 7C || 11/05/25,VIDEO,$744,"42,226",2025-05-12,2025-06-25,44
77,CB_2025_Feb_FB_3883_LZ-RP_V05_9x16_VID_EN_Opti_C-BulletPoints_Evergreen_CTA-SALE_Angle-W_M-JANW_VL-30s_G-M_P-OG_S-WHAT_FB2284V05,ASC+ || Angler Predictive Conversions API - Challanger A || 7DC || 10/06/2025 Campaign Ad set,VIDEO,$735,"27,612",2025-06-10,2025-06-23,13
78,CB_2025_Jun_FB_4197_CHUB-KZ_V02_4x5_IMG_EN_Opti_C-NONE_CTA-NONE_Angle-W_M-NONE_VL-None_TR-None_G-M_P-OG_S-NONE,4197 - CHUB ToMyBigGuys  || Enhancements: OFF || CBV1 || Batch 1 || 7C || 16/06/25w25,SHARE,$731,"41,048",2025-06-16,2025-06-25,9
79,CB_2025_Jun_FB_4190_SO_V03_4x5_IMG_EN_New_C-Headline_Evergreen_CTA-NONE_Angle-W_M-NONE_VL-None_G-NONE_P-OG_S-NONE,4190 - BEAT THE HEAT | Refreshing Summer Drink || Enhancements: OFF || CBV1 || Batch 1 || 7C || 16/06/25w25,SHARE,$731,"31,218",2025-06-16,2025-06-23,7
80,CB_2025_Jun_FB_4194_VK-DP_V04_4x5_IMG_EN_New_C-BulletPoints_Evergreen_CTA-SALE_Angle-W-B-C_M-NONE_VL-30s_G-M_P-OG_S-NONE,"4194 - Cardboard, male body IMG - DP-VK || Enhancements: OFF || CBV1 || Batch 2 || 7C || 16/06/25w25",SHARE,$731,"36,136",2025-06-16,2025-06-23,7
81,CB_2025_May_FB_4104_DT-VG_V05_4x5_IMG_EN_New_C-Headline_Evergreen_CTA-65_Angle-W-B-C_M-NONE_VL-None_G-NONE_P-OG_S-NONE,âš«ï¸ US || CBV2 || Advantage+ || 7C || BROAD || Existing_customer_0% || || 24/04/25 Ad set,SHARE,$721,"42,035",2025-05-31,2025-06-25,25
82,CB_2025_May_FB_4080_LZ-VG_V03_4x5_IMG_EN_New_C-Headline_Evergreen_CTA-NONE_Angle-W_M-NONE_VL-None_G-M_P-OG_S-NONE,CA || ASC+ || 0% EXISTING || 7DC || 12.05.2025 RESTART Ad set,SHARE,$719,"53,783",2025-05-19,2025-06-25,37
83,CB_2023_Jul_FB_2284_DA_V05_9x16_VID_EN_Opti_C-Sale_CTA-SMR_Pain-W_M-JANW_VL-30s_TR-None_G-M_P-None_S-WHAT_FB2103V02,CA || ASC+ || 0% EXISTING || 7DC || 12.05.2025 RESTART Ad set,VIDEO,$710,"33,874",2025-05-12,2025-06-25,44
84,CB_2025_May_FB_4080_LZ-VG_V01_4x5_IMG_EN_New_C-Headline_Evergreen_CTA-NONE_Angle-W_M-NONE_VL-None_G-M_P-OG_S-NONE,ASC+ || Angler Predictive Conversions API - Challanger A || 7DC || 10/06/2025 Campaign Ad set,SHARE,$701,"38,483",2025-06-10,2025-06-23,13
85,CB_2024_Nov_FB_3305_SO-DP_V02_4x5_VID_EN_Opti_C-Sale_CTA-BF_Pain-W_M-Chris_VL-30s_TR-None_G-MF_P-Plan_S-NEW_FB2601V07 - Copy,ðŸŒ¶ï¸  || ASC+ || US || 0% EXISTING CAP || 7C || 15/05/2025  Campaign Ad set,VIDEO,$695,"21,813",2025-05-15,2025-06-25,41
86,CB_2025_Jun_FB_4215_VK-KB_V03_4x5_IMG_EN_New_C-Advertorial_Evergreen_CTA-NONE_Angle-W-B-C_M-NONE_VL-None_G-F_P-GLP1_S-NONE_blog_stressfat_cv_en,GLP-1 || Cortisol detox || blog_stressfat_cv_en || Batch 1,SHARE,$692,"16,750",2025-06-19,2025-06-25,6
87,CB_2025_Feb_FB_3883_LZ-RP_V05_9x16_VID_EN_Opti_C-BulletPoints_Evergreen_CTA-SALE_Angle-W_M-JANW_VL-30s_G-M_P-OG_S-WHAT_FB2284V05,CBV2 || EU (UK) || ðŸ’° Advantage+ || US || BROAD || 7C || Existing_customer_5% || 15/12/24 Ad set,SHARE,$688,"39,386",2025-04-01,2025-06-25,85
88,CB_2025_Apr_FB_4070_KB_V03_4x5_VID_EN_New_C-NONE_CTA-SALE_Angle-None_M-NONE_VL-None_TR-None_G-F_P-OG_S-NONE,CA || ASC+ || 0% EXISTING || 7DC || 12.05.2025 RESTART Ad set,SHARE,$662,"48,990",2025-05-13,2025-06-25,43
89,CB_2025_May_FB_4080_LZ-VG_V01_4x5_IMG_EN_New_C-Headline_Evergreen_CTA-NONE_Angle-W_M-NONE_VL-None_G-M_P-OG_S-NONE,ASC+ || Angler Predictive Conversions API - Challanger B || 7DC || 10/06/2025 Campaign Ad set,SHARE,$645,"37,385",2025-06-10,2025-06-25,15
90,CB_2025_Jan_FB_3751_VK-DP_V01_4x5_IMG_EN_New_C-BulletPoints_Sale_CTA-NY_Angle-W-B-C_M-NONE_VL-None_G-M_P-GLP1_S-NONE,GLP-1 ðŸ’œ || ASC+ || EU  || 7C || 14/06/2025 Ad set,SHARE,$645,"38,061",2025-06-14,2025-06-18,4
91,CB_2025_Jun_FB_4172_VK-VG_V04_9x16_VID_EN_New_C-BulletPoints_Evergreen_CTA-SALE_Angle-W-B-C_M-MAN_VL-30s_G-M_P-OG_S-WHAT,4172 - new actor test - VK || Enhancements: OFF || CBV1 || Batch 1 || 7C || 15/06/25w25,VIDEO,$640,"28,516",2025-06-16,2025-06-25,9
92,CB_2025_Jun_FB_4180_SO_V11_4x5_IMG_EN_Opti_C-Headline_Evergreen_CTA-NONE_Angle-W_M-NONE_VL-None_G-NONE_P-OG_S-NONE_FB4086V01,4180 - FB4086V01 Opti || Enhancements: OFF || CBV1 || Batch 2 || 7C || 09/06/25w24,SHARE,$636,"33,646",2025-06-16,2025-06-21,5
93,CB_2025_Jun_FB_4199_DT-KB_V04_4x5_IMG_EN_New_C-BulletPoints_Sale_CTA-70_Angle-W-B-C_M-NONE_VL-None_G-M_P-GLP-1_S-NONE_FB3748V01,4199 - Father's Day GLP-1 Opti || Batch 1 || Enhancements: OFF || GLP-1 Booster || 7C1V || 16/06/25w25,SHARE,$632,"17,913",2025-06-16,2025-06-25,9
94,CB_2025_Jun_FB_4206_CHUB-KZ_V02_4x5_IMG_EN_Opti_C-NONE_CTA-NONE_Angle-W_M-NONE_VL-None_TR-None_G-M_P-OG_S-NONE.png,4206 - CHUB NoMoreDadBod  || Enhancements: OFF || CBV1 || Batch 1 || 7C || 16/06/25w25,SHARE,$630,"27,488",2025-06-16,2025-06-23,7
95,CB_2025_Jun_FB_4195_DT-VG_V01_9x16_VID_EN_Opti_C-BulletPoints_Evergreen_CTA-SALE_Angle-W_M-JANW_VL-30s_G-M_P-OG_S-WHAT_FB3883V05,4195 - #153 CB as main daily routine || Enhancements: OFF || CBV1 || Batch 2 || 7C || 16/06/25w25,VIDEO,$614,"28,334",2025-06-16,2025-06-23,7
96,CB_2025_Jan_FB_3756_VK-DP_V01_4x5_IMG_EN_New_C-BulletPoints_Evergreen_CTA-NONE_Angle-W-B-C_M-NONE_VL-None_G-M_P-GLP1_S-NONE,3756 - opti 2834 GLP1 || Batch 1 || Enhancements: OFF || GLP-1 Booster || 7C1V || 30/05/25w22,SHARE,$605,"14,227",2025-05-30,2025-06-21,22
97,CB_2025_May_FB_4132_VK-DP_V01_9x16_VID_EN_New_C-BulletPoints_Evergreen_CTA-SALE_Angle-W-B-C_M-POW_VL-30s_G-M_P-OG_S-MOON,ðŸŒ¶ï¸  || ASC+ || US || 0% EXISTING CAP || 7C || 15/05/2025  Campaign Ad set,VIDEO,$598,"23,593",2025-06-13,2025-06-20,7
98,CB_2025_Jun_FB_4177_VK-VG_V05_4x5_IMG_EN_New_C-BulletPoints_Evergreen_CTA-SALE_Angle-W-B-C_M-MAN_VL-None_G-M_P-OG_S-NONE,4177 -opti 4080 - VK || Enhancements: OFF || CBV1 || Batch 2 || 7C || 09/06/25w24,SHARE,$587,"33,637",2025-06-16,2025-06-23,7
99,CB_2025_Jun_FB_4151_DT-KB_V08_4x5_IMG_EN_New_C-NONE_Sale_CTA-65_Angle-W-B_M-NONE_VL-None_G-NONE_P-OG_S-NONE_FB2959V07 - BIOMA,ðŸ‘¨ || Father's Day - Non spenders for 4th July Learnings || Bundle offer || ASC+ || US || 0% EXISTING CAP || 7C || 18/06/2025 Ad set,SHARE,$584,"21,223",2025-06-18,2025-06-22,4
100,CB_2025_Feb_FB_3827_LZ_V02_1x1_IMG_EN_Opti_C-Headline_Evergreen_CTA-NONE_Angle-W_M-NONE_VL-None_G-M_P-CBV2_S-NONE_FB3723V18,CBV2 || US || Manual Bid: ROAS GOAL: 1.00 -> 1.1 || 7DC || 22/01/2025,SHARE,$578,"25,454",2025-02-18,2025-06-25,127
101,CB_2025_Jun_FB_4190_SO_V05_4x5_IMG_EN_New_C-Headline_Evergreen_CTA-NONE_Angle-W_M-NONE_VL-None_G-NONE_P-OG_S-NONE,4190 - BEAT THE HEAT | Refreshing Summer Drink || Enhancements: OFF || CBV1 || Batch 2 || 7C || 16/06/25w25,SHARE,$570,"22,554",2025-06-16,2025-06-21,5
102,CB_2025_Feb_FB_3794_SO-JT_V03_1x1_IMG_EN_New_C-A-Compare_Evergreen_CTA-NONE_Angle-W_M-NONE_VL-15s_G-NONE_P-GLP1_S-NONE,3794 - Notion Idea #120 Me w/ GLP IMG || Batch 1 || Enhancements: OFF || GLP-1 Booster || 7C1V || 16/06/25w25,SHARE,$569,"17,592",2025-06-16,2025-06-25,9
103,CB_2025_Feb_FB_3883_LZ-RP_V05_9x16_VID_EN_Opti_C-BulletPoints_Evergreen_CTA-SALE_Angle-W_M-JANW_VL-30s_G-M_P-OG_S-WHAT_FB2284V05,ASC+ || Angler Predictive Conversions API - Challanger B || 7DC || 10/06/2025 Campaign Ad set,VIDEO,$564,"23,812",2025-06-10,2025-06-25,15
104,CB_2025_Mar_FB_3903_VK_V01_9x16_VID_EN_New_C-BulletPoints_Evergreen_CTA-65_Angle-W-B-C_M-MIX_VL-30s_G-MF_P-OG_S-NEW,CA || ASC+ || 0% EXISTING || 7DC || 12.05.2025 RESTART Ad set,VIDEO,$564,"34,676",2025-05-12,2025-06-25,44
105,CB_2025_May_FB_4128_VK-KB_V03_4x5_IMG_EN_OPTI_C-NONE_Evergreen_CTA-NONE_Angle-W_M-NONE_VL-None_G-NONE_P-OG_S-NONE_FB4086V01,ðŸŒ¶ï¸  || ASC+ || US || 0% EXISTING CAP || 7C || 15/05/2025  Campaign Ad set,SHARE,$558,"27,548",2025-05-28,2025-06-23,26
106,CB_2025_Apr_FB_3996_DT-DP_V01_9x16_VID_EN_Opti_C-MakingOf_Evergreen_CTA-CTA_Angle-W-B_M-CRAZY_VL-45s_G-M_P-OG_S-NEW_FB3022V03,CBV2 || EU (UK) || ðŸ’° Advantage+ || US || BROAD || 7C || Existing_customer_5% || 15/12/24 Ad set,VIDEO,$545,"25,947",2025-04-22,2025-06-25,64
107,CB_2025_Jun_FB_4181_LZ-VG_V04_9x16_VID_EN_New_C-BulletPoints_Evergreen_CTA-65_Angle-W-B_M-MAN_VL-30s_G-M_P-OG_S-NEW,4181 - New angle test manuel vid || Enhancements: OFF || CBV1 || Batch 1 || 7C || 16/06/25w25,VIDEO,$543,"20,852",2025-06-16,2025-06-25,9
108,CB_2025_Feb_FB_3846_SO-DP_V19_1x1_VID_EN_New_C-NONE_Evergreen_CTA-NONE_Angle-W_M-NONE_VL-None_G-NONE_P-GLP1_S-NONE,3846 - GLP1 emotional snacking IMG || Batch 3 || Enhancements: OFF || GLP-1 Booster || 7C1V || 16/06/25w25,SHARE,$532,"11,121",2025-06-16,2025-06-20,4
109,CB_2025_Feb_FB_3846_SO-DP_V16_1x1_VID_EN_New_C-NONE_Evergreen_CTA-NONE_Angle-W_M-NONE_VL-None_G-NONE_P-GLP1_S-NONE,3846 - GLP1 emotional snacking IMG || Batch 4 || Enhancements: OFF || GLP-1 Booster || 7C1V || 16/06/25w25,SHARE,$532,"7,976",2025-06-16,2025-06-20,4
110,CB_2025_May_FB_4091_LZ-VG_V01_4x5_IMG_EN_Opti_C-Sale_Sale_CTA-MEMO_Angle-None_M-NONE_VL-None_G-NONE_P-OG_S-NONE_FB3907V03,ASC+ || Angler Predictive Conversions API - Challanger A || 7DC || 10/06/2025 Campaign Ad set,SHARE,$529,"18,967",2025-06-10,2025-06-23,13
111,CB_2025_Jun_FB_4183_SO_V01_4x5_IMG_EN_New_C-Headline_Evergreen_CTA-NONE_Angle-W_M-NONE_VL-None_G-NONE_P-OG_S-NONE,4183 - Pooping a Cactus IMG || Enhancements: OFF || CBV1 || Batch 1 || 7C || 16/06/25w25,SHARE,$506,"28,961",2025-06-16,2025-06-21,5
112,CB_2025_Jun_FB_4205_VK-VG_V14_4x5_IMG_EN_New_C-BulletPoints_Evergreen_CTA-SALE_Angle-W-B-C_M-NONE_VL-30s_G-M_P-OG_S-NONE,"4205 - 4143_IMG opti_trending layouts,styles,winners || Enhancements: OFF || CBV1 || Batch 4 || 7C || 16/06/25w25",SHARE,$504,"21,646",2025-06-16,2025-06-21,5
113,CB_2025_Mar_FB_3914_DT-DP_V01_9x16_VID_EN_New_C-Trend_Sale_CTA-SPRNG_Angle-W-B-C_M-JOG_VL-30s_G-F_P-OG_S-NEW,CBV2 || EU (UK) || ðŸ’° Advantage+ || US || BROAD || 7C || Existing_customer_5% || 15/12/24 Ad set,VIDEO,$504,"26,236",2025-04-01,2025-06-25,85
114,CB_2025_May_FB_4086_SO_V01_4x5_IMG_EN_New_C-NONE_Evergreen_CTA-NONE_Angle-W_M-NONE_VL-None_G-NONE_P-OG_S-NONE,CBV2 || EU (UK) || ðŸ’° Advantage+ || US || BROAD || 7C || Existing_customer_5% || 15/12/24 Ad set,SHARE,$500,"30,664",2025-05-25,2025-06-25,31
115,CB_2023_Jul_FB_2217_IB_V04_9x16_VID_EN_Opti_C-Pointing_CTA-SMR_Pain-W-B_M-TRC_VL-30s_TR-None_G-F_P-None_S-FRIGGA,CBV2 || EU (UK) || ðŸ’° Advantage+ || US || BROAD || 7C || Existing_customer_5% || 15/12/24 Ad set,VIDEO,$498,"23,973",2024-12-18,2025-06-25,189
116,CB_2025_Jun_FB_4215_VK-KB_V07_4x5_IMG_EN_New_C-Advertorial_Evergreen_CTA-NONE_Angle-W-B-C_M-NONE_VL-None_G-F_P-GLP1_S-NONE_blog_stressfat_cv_en,GLP-1 || Cortisol detox || blog_stressfat_cv_en || Batch 2,SHARE,$495,"9,082",2025-06-19,2025-06-22,3
117,CB_2025_Jun_FB_4184_CHUB-AS_V04_4x5_IMG_EN_New_C-NONE_CTA-CTA_Angle-C_M-NONE_VL-None_TR-None_G-F_P-OG_S-NONE,4184 - CHUB Reminder || Enhancements: OFF || CBV1 || Batch 1 || 7C || 16/06/25w25,SHARE,$493,"25,851",2025-06-17,2025-06-23,6
118,CB_2023_Jul_FB_2217_IB_V04_9x16_VID_EN_Opti_C-Pointing_CTA-SMR_Pain-W-B_M-TRC_VL-30s_TR-None_G-F_P-None_S-FRIGGA,US || Manual Bid || BFCM || COST CAP 71 || 1C || 15/11/24,VIDEO,$492,"24,802",2024-11-15,2025-06-25,222
119,CB_2025_May_FB_4143_DT_V01_4x5_IMG_EN_New_C-Headline_Evergreen_CTA-65_Angle-W_M-NONE_VL-None_G-NONE_P-OG_S-NONE,4143 - Hormonal weight || Enhancements: OFF || CBV1 || Batch 1 || 7C || 02/06/25w23,SHARE,$492,"22,962",2025-06-02,2025-06-25,23
120,CB_2025_Feb_FB_3829_DT-DP_V02_9x16_VID_EN_New_C-UGC_Sale_CTA-70_Angle-W_M-TRC_VL-30s_G-F_P-GLP1_S-NEW,3829 - GLP-1 gut health angle VID || Batch 1 || Enhancements: OFF || GLP-1 Booster || 7C1V || 16/06/25w25,VIDEO,$478,"9,947",2025-06-16,2025-06-21,5
121,CB_2025_Jun_FB_4192_DT-VU_V01_4x5_IMG_EN_New_C-Headline_Evergreen_CTA-NONE_Angle-W_M-NONE_VL-None_G-M_P-OG_S-NONE,4192 - #132 Beyond Alpha adaptation - lose X cm of chest fat || Enhancements: OFF || CBV1 || Batch 2 || 7C || 16/06/25w25,SHARE,$475,"20,659",2025-06-16,2025-06-22,6
122,CB_2025_Jun_FB_4176_SO-KB_V10_4x5_IMG_EN_Opti_C-Headline_Evergreen_CTA-NONE_Angle-W_M-NONE_VL-None_G-NONE_P-OG_S-NONE_FB4100V02,4176 - FB4100V02 Opti || Enhancements: OFF || CBV1 || Batch 3 || 7C || 09/06/25w24,SHARE,$474,"18,098",2025-06-09,2025-06-20,11
123,CB_2025_May_FB_4077_VK-VG_V03_4x5_IMG_EN_New_C-Trend_Evergreen_CTA-NONE_Angle-W-B-C_M-NONE_VL-None_G-F_P-OG_S-NONE_FB3827V04,CA || ASC+ || 0% EXISTING || 7DC || 12.05.2025 RESTART Ad set,SHARE,$470,"27,701",2025-05-13,2025-06-25,43
124,CB_2025_May_FB_4080_LZ-VG_V01_4x5_IMG_EN_New_C-Headline_Evergreen_CTA-NONE_Angle-W_M-NONE_VL-None_G-M_P-OG_S-NONE,ASC+ || Angler Predictive Conversions API - Challanger A || BAU || 7DC || 10/06/2025 Ad set,SHARE,$463,"25,783",2025-06-10,2025-06-25,15
125,CB_2025_May_FB_4150_DT-KB_V06_4x5_IMG_EN_New_C-Headline_Sale_CTA-65_Angle-None_M-MIX_VL-None_G-M_P-OG_S-NONE,ðŸ‘¨ || Father's Day - Non spenders for 4th July Learnings || Bundle offer || ASC+ || US || 0% EXISTING CAP || 7C || 18/06/2025 Ad set,SHARE,$449,"19,469",2025-06-18,2025-06-22,4
126,CB_2025_Feb_FB_3835_DT-RP_V03_1x1_IMG_EN_New_C-News_Evergreen_CTA-NONE_Angle-W_M-NONE_VL-None_G-NONE_P-GLP1_S-NONE,3835 - #126 Help is here GLP IMG || Batch 1 || Enhancements: OFF || GLP-1 Booster || 7C1V || 16/06/25w25,SHARE,$434,"16,218",2025-06-16,2025-06-23,7
127,CB_2025_Jan_FB_3753_SO_V02_4x5_IMG_EN_New_C-Headline_Evergreen_CTA-NONE_Angle-W_M-NONE_VL-None_G-NONE_P-GLP1_S-NONE,3753 - Notion Idea #111 â€œDualâ€Benefit Vennâ€ || Batch 1 || Enhancements: OFF || GLP-1 Booster || 7C1V || 02/06/25w23,SHARE,$417,"13,897",2025-06-03,2025-06-20,17
128,CB_2024_Jan_FB_2762_IK_V05_1x1_IMG_EN_New_C-WrittenTesti_CTA-CTA_Pain-W-B-C_M-NONE_VL-None_TR-None_G-NONE_P-V2_S-NONE,CBV2 || EU (UK) || ðŸ’° Advantage+ || US || BROAD || 7C || Existing_customer_5% || 15/12/24 Ad set,SHARE,$415,"16,085",2024-12-15,2025-06-25,192
129,CB_2025_Feb_FB_3883_LZ-RP_V05_9x16_VID_EN_Opti_C-BulletPoints_Evergreen_CTA-SALE_Angle-W_M-JANW_VL-30s_G-M_P-OG_S-WHAT_FB2284V05,CA || INTEREST: UPCOMING BIRTHDAY || 7C || 11/05/25,VIDEO,$413,"28,923",2025-05-12,2025-06-25,44
130,CB_2025_Jun_FB_4177_VK-VG_V01_4x5_IMG_EN_New_C-BulletPoints_Evergreen_CTA-SALE_Angle-W-B-C_M-MAN_VL-None_G-M_P-OG_S-NONE,4177 -opti 4080 - VK || Enhancements: OFF || CBV1 || Batch 1 || 7C || 09/06/25w24,SHARE,$412,"23,825",2025-06-16,2025-06-20,4
131,CB_2025_May_FB_4104_DT-VG_V05_4x5_IMG_EN_New_C-Headline_Evergreen_CTA-65_Angle-W-B-C_M-NONE_VL-None_G-NONE_P-OG_S-NONE,ðŸŒ¶ï¸  || ASC+ || US || 0% EXISTING CAP || 7C || 15/05/2025  Campaign Ad set,SHARE,$411,"20,426",2025-06-03,2025-06-25,22
132,CB_2025_Apr_FB_3975_LZ_V03_9x16_VID_EN_New_C-Testimonial_Evergreen_CTA-SALE_Angle-W_M-LAURA_VL-15s_G-F_P-OG_S-NEW,CBV2 || EU (UK) || ðŸ’° Advantage+ || US || BROAD || 7C || Existing_customer_5% || 15/12/24 Ad set,VIDEO,$411,"24,441",2025-04-14,2025-06-25,72
133,CB_2025_Jan_FB_3757_LZ-DP_V14_94x5_VID_EN_Opti_C-Dance_Evergreen_CTA-NONE_Angle-W-B_M-Nonie_VL-30s_G-F_P-GLP1_S-WHAT_FB3164V03,GLP-1 ðŸ’œ || ASC+ || CA || 5% EXISTING CAP || 7C || 29/05/2025 Ad set,VIDEO,$410,"15,655",2025-06-10,2025-06-25,15
134,CB_2025_May_FB_4120_DT_V06_4x5_IMG_EN_New_C-Headline_Evergreen_CTA-65_Angle-W-B-C_M-NONE_VL-None_G-NONE_P-OG_S-NONE,CBV2 || EU (UK) || ðŸ’° Advantage+ || US || BROAD || 7C || Existing_customer_5% || 15/12/24 Ad set,SHARE,$409,"26,237",2025-06-16,2025-06-25,9
135,CB_2025_Feb_FB_3835_DT-RP_V01_1x1_IMG_EN_New_C-News_Evergreen_CTA-NONE_Angle-W_M-NONE_VL-None_G-NONE_P-GLP1_S-NONE,3835 - #126 Help is here GLP IMG || Batch 1 || Enhancements: OFF || GLP-1 Booster || 7C1V || 16/06/25w25,SHARE,$403,"16,628",2025-06-17,2025-06-23,6
136,CB_2025_Jun_FB_4198_CHUB-KZ_V01_9x16_VID_EN_Opti_C-NONE_CTA-NONE_Angle-W_M-NONE_VL-None_TR-None_G-M_P-OG_S-NONE.mp4,4198 - CHUB DadBeforeAndAfter || Enhancements: OFF || CBV1 || Batch 1 || 7C || 16/06/25w25,VIDEO,$401,"21,860",2025-06-16,2025-06-20,4
137,CB_2025_Jun_FB_4208_CHUB-KZ_V01_4x5_IMG_EN_Opti_C-NONE_CTA-NONE_Angle-W_M-NONE_VL-None_TR-None_G-M_P-OG_S-NONE.png,4208 - CHUB DadBodAi || Enhancements: OFF || CBV1 || Batch 1 || 7C || 16/06/25w25,SHARE,$400,"20,280",2025-06-16,2025-06-23,7
138,CB_2025_Mar_FB_3919_LZ_V01_1x1_IMG_EN_Opti_C-Headline_Evergreen_CTA-NONE_Angle-Horm_M-NONE_VL-30s_G-M_P-OG_S-NONE_FB3891V05,CA || ASC+ || 0% EXISTING || 7DC || 12.05.2025 RESTART Ad set,SHARE,$398,"25,820",2025-05-12,2025-06-25,44
139,CB_2025_Jun_FB_4145_SO_V12_4x5_IMG_EN_Opti_C-NONE_Evergreen_CTA-NONE_Angle-W-B-C_M-NONE_VL-None_G-NONE_P-OG_S-NONE_FB3950V16,4145 - FB3950V16 Opti || Enhancements: OFF || CBV1 || Batch 3 || 7C || 09/06/25w24,SHARE,$392,"15,552",2025-06-09,2025-06-17,8
140,CB_2025_Feb_FB_3846_SO-DP_V09_1x1_VID_EN_New_C-NONE_Evergreen_CTA-NONE_Angle-W_M-NONE_VL-None_G-NONE_P-GLP1_S-NONE,3846 - GLP1 emotional snacking IMG || Batch 1 || Enhancements: OFF || GLP-1 Booster || 7C1V || 16/06/25w25,SHARE,$385,"8,138",2025-06-16,2025-06-20,4
141,CB_2025_Jun_FB_4171_DT_V03_9x16_VID_EN_Opti_C-MakingOf_Sale_CTA-65_Angle-W-B_M-CRAZY_VL-45s_G-M_P-OG_S-NEW_FB3264V31 - CC,ðŸ‘¨ || Father's Day || Bundle offer  || ASC+ || US || 0% EXISTING CAP || 7C || 07/06/2025 Ad set,VIDEO,$381,"18,438",2025-06-07,2025-06-17,10
142,CB_2025_Jun_FB_4182_SO_V01_4x5_IMG_EN_New_C-Headline_Evergreen_CTA-NONE_Angle-W_M-NONE_VL-None_G-NONE_P-OG_S-NONE,4182 - Ferret Morning Routine || Enhancements: OFF || CBV1 || Batch 1 || 7C || 16/06/25w25,SHARE,$380,"18,993",2025-06-16,2025-06-20,4
143,CB_2025_Jun_FB_4177_VK-VG_V06_4x5_IMG_EN_New_C-BulletPoints_Evergreen_CTA-SALE_Angle-W-B-C_M-MAN_VL-None_G-M_P-OG_S-NONE,4177 -opti 4080 - VK || Enhancements: OFF || CBV1 || Batch 2 || 7C || 09/06/25w24,SHARE,$377,"17,128",2025-06-16,2025-06-25,9
144,CB_2025_Feb_FB_3794_SO-JT_V02_1x1_IMG_EN_New_C-A-Compare_Evergreen_CTA-NONE_Angle-W_M-NONE_VL-15s_G-NONE_P-GLP1_S-NONE,3794 - Notion Idea #120 Me w/ GLP IMG || Batch 1 || Enhancements: OFF || GLP-1 Booster || 7C1V || 16/06/25w25,SHARE,$374,"14,520",2025-06-17,2025-06-25,8
145,CB_2025_Feb_FB_3831_LZ-DP_V03_1x1_IMG_EN_Opti_C-BeforeAfter_Evergreen_CTA-NONE_Angle-Horm_M-NONE_VL-None_G-NONE_P-GLP1_S-NONE_FB3723V07,3831 - GLP1 Hormones and energy || Batch 1 || Enhancements: OFF || GLP-1 Booster || 7C1V || 16/06/25w25,SHARE,$372,"11,024",2025-06-16,2025-06-20,4
146,CB_2025_Jun_FB_4188_VK-DP_V02_4x5_IMG_EN_New_C-BulletPoints_Evergreen_CTA-SALE_Angle-W-B-C_M-NONE_VL-30s_G-M_P-OG_S-NONE,4188 - gym img - VK || Enhancements: OFF || CBV1 || Batch 2 || 7C || 16/06/25w25,SHARE,$372,"11,042",2025-06-16,2025-06-21,5
147,CB_2024_Dec_FB_3601_VK-DP_V09_4x5_VID_EN_Opti_C-Dance_CTA-NY_Pain-W-B_M-JOG_VL-30s_TR-None_G-F_P-OG_S-WHAT_FB3045V01 - Copy,ðŸŒ¶ï¸  || ASC+ || US || 0% EXISTING CAP || 7C || 15/05/2025  Campaign Ad set,VIDEO,$362,"10,582",2025-05-15,2025-06-25,41
148,CB_2025_May_FB_4100_SO_V02_4x5_IMG_EN_New_C-Headline_Evergreen_CTA-NONE_Angle-W_M-NONE_VL-None_G-NONE_P-OG_S-NONE,ASC+ || Angler Predictive Conversions API - Challanger A || BAU || 7DC || 10/06/2025 Ad set,SHARE,$361,"13,948",2025-06-10,2025-06-25,15
149,CB_2025_Jun_FB_4177_VK-VG_V11_4x5_IMG_EN_New_C-BulletPoints_Evergreen_CTA-SALE_Angle-W-B-C_M-MAN_VL-None_G-M_P-OG_S-NONE,4177 -opti 4080 - VK || Enhancements: OFF || CBV1 || Batch 3 || 7C || 09/06/25w24,SHARE,$355,"14,429",2025-06-16,2025-06-20,4
150,CB_2025_Jun_FB_4205_VK-VG_V11_4x5_IMG_EN_New_C-BulletPoints_Evergreen_CTA-SALE_Angle-W-B-C_M-NONE_VL-30s_G-M_P-OG_S-NONE,"4205 - 4143_IMG opti_trending layouts,styles,winners || Enhancements: OFF || CBV1 || Batch 3 || 7C || 16/06/25w25",SHARE,$353,"16,235",2025-06-16,2025-06-20,4
151,CB_2025_Feb_FB_3774_SO-JT_V06_1x1_IMG_EN_New_C-Headline_Evergreen_CTA-NONE_Angle-W_M-NONE_VL-15s_G-NONE_P-GLP1_S-NONE,GLP-1 ðŸ’œ || ASC+ || US || 5% EXISTING CAP || 7C || 29/05/2025 Ad set,SHARE,$349,"8,728",2025-06-12,2025-06-17,5
152,CB_2025_Jan_FB_4199_DT-KB_V02_9x16_VID_EN_Opti_C-NegativeMark_Sale_CTA-70_Angle-W_M-MAG_VL-45s_G-F_P-GLP1_S-MOON_FB3757V18,4199 - Father's Day GLP-1 Opti || Batch 2 || Enhancements: OFF || GLP-1 Booster || 7C1V || 16/06/25w25,VIDEO,$346,"10,868",2025-06-16,2025-06-20,4
153,CB_2025_Feb_FB_3848_LZ-DP_V07_1x1_IMG_EN_New_C-Headline_Evergreen_CTA-SALE_Angle-GH_M-NONE_VL-None_G-NONE_P-GLP1_S-NONE,3848 - GLP1 simple ads || Batch 2 || Enhancements: OFF || GLP-1 Booster || 7C1V || 16/06/25w25,SHARE,$344,"6,649",2025-06-16,2025-06-19,3
154,CB_2025_Feb_FB_3826_DT-DP_V04_9x16_VID_EN_New_C-UGC_Sale_CTA-70_Angle-W_M-TRC_VL-30s_G-F_P-GLP1_S-NEW,3826 - GLP-1 hormones and energy || Batch 1 || Enhancements: OFF || GLP-1 Booster || 7C1V || 17/06/25w25,VIDEO,$341,"5,921",2025-06-17,2025-06-21,4
155,CB_2025_Jun_FB_4205_VK-VG_V06_4x5_IMG_EN_New_C-BulletPoints_Evergreen_CTA-SALE_Angle-W-B-C_M-NONE_VL-30s_G-M_P-OG_S-NONE,"4205 - 4143_IMG opti_trending layouts,styles,winners || Enhancements: OFF || CBV1 || Batch 2 || 7C || 16/06/25w25",SHARE,$340,"10,940",2025-06-16,2025-06-21,5
156,CB_2025_Feb_FB_3846_SO-DP_V10_1x1_VID_EN_New_C-NONE_Evergreen_CTA-NONE_Angle-W_M-NONE_VL-None_G-NONE_P-GLP1_S-NONE,3846 - GLP1 emotional snacking IMG || Batch 2 || Enhancements: OFF || GLP-1 Booster || 7C1V || 16/06/25w25,SHARE,$338,"6,496",2025-06-16,2025-06-20,4
157,CB_2025_Feb_FB_3805_VK-DP_V03_1x1_IMG_EN_New_C-BulletPoints_Evergreen_CTA-70_Angle-W-B-C_M-NONE_VL-None_G-F_P-GLP1_S-NEW_FB2286V05,3805 - tetimonial opti 2286 || Batch 1 || Enhancements: OFF || GLP-1 Booster || 7C1V || 16/06/25w25,SHARE,$338,"6,329",2025-06-17,2025-06-20,3
158,CB_2025_Feb_FB_3827_LZ_V03_1x1_IMG_EN_Opti_C-Headline_Evergreen_CTA-SALE_Angle-W_M-NONE_VL-None_G-M_P-CBV2_S-NONE_FB3705V02,âš«ï¸ US || CBV2 || Advantage+ || 7C || BROAD || Existing_customer_0% || || 24/04/25 Ad set,SHARE,$338,"7,928",2025-04-25,2025-06-25,61
159,CB_2025_Jan_FB_3739_DT_V08_4x5_VID_EN_Opti_C-BulletPoints_Sale_CTA-70_Angle-W-B_M-MIX_VL-45s_G-MF_P-GLP1_S-WHAT_FB3311V10,GLP-1 ðŸ’œ || ASC+ || US || 5% EXISTING CAP || 7C || 29/05/2025 Ad set,VIDEO,$334,"5,975",2025-06-02,2025-06-25,23
160,CB_2025_Jan_FB_3723_SO_V07_4x5_IMG_EN_New_C-NONE_Evergreen_CTA-SALE_Angle-W_M-NONE_VL-None_G-NONE_P-NONE_S-NONE,CBV2 || US || Manual Bid: ROAS GOAL: 1.00 -> 1.1 || 7DC || 22/01/2025,SHARE,$327,"14,905",2025-02-11,2025-06-25,134
161,IM_CB1.png,US || VSL || Aff's image || Landing: Pre-1 Real doctor || 1C || 22/06/25,SHARE,$325,"9,362",2025-06-22,2025-06-23,1
162,CB_2025_Jun_FB_4175_SO_V08_4x5_IMG_EN_New_C-Headline_Evergreen_CTA-NONE_Angle-W_M-NONE_VL-None_G-NONE_P-OG_S-NONE,4175 - Vintage Collage IMG || Enhancements: OFF || CBV1 || Batch 2 || 7C || 09/06/25w24,SHARE,$315,"10,062",2025-06-09,2025-06-20,11
163,CB_2025_Feb_FB_3834_DT-DP_V04_9x16_VID_EN_New_C-Celebrity_Evergreen_CTA-NONE_Angle-W_M-JOG_VL-None_G-F_P-GLP1_S-NEW,3834 - GLP 1 emotional snacking || Batch 1 || Enhancements: OFF || GLP-1 Booster || 7C1V || 16/06/25w25,VIDEO,$315,"6,397",2025-06-16,2025-06-19,3
164,CB_2025_Jun_FB_4205_VK-VG_V03_4x5_IMG_EN_New_C-BulletPoints_Evergreen_CTA-SALE_Angle-W-B-C_M-NONE_VL-30s_G-M_P-OG_S-NONE,"4205 - 4143_IMG opti_trending layouts,styles,winners || Enhancements: OFF || CBV1 || Batch 1 || 7C || 16/06/25w25",SHARE,$313,"9,448",2025-06-16,2025-06-21,5
165,CB_2025_Feb_FB_3831_LZ-DP_V01_1x1_IMG_EN_Opti_C-BeforeAfter_Evergreen_CTA-NONE_Angle-Horm_M-NONE_VL-None_G-NONE_P-GLP1_S-NONE_FB3723V07,3831 - GLP1 Hormones and energy || Batch 1 || Enhancements: OFF || GLP-1 Booster || 7C1V || 16/06/25w25,SHARE,$311,"9,348",2025-06-16,2025-06-20,4
166,CB_2025_Jan_FB_3757_LZ-DP_V18_4x5_VID_EN_Opti_C-NegativeMark_Evergreen_CTA-NONE_Angle-W_M-MAG_VL-45s_G-F_P-GLP1_S-MOON_FB3311V13,GLP-1 ðŸ’œ || ASC+ || CA || 5% EXISTING CAP || 7C || 29/05/2025 Ad set,VIDEO,$310,"8,915",2025-06-10,2025-06-25,15
167,CB_2025_Jun_FB_4204_LZ-KB_V01_9x16_VID_EN_Opti_C-MakingOf_Sale_CTA-65_Angle-W-B-C_M-POW_VL-30s_G-M_P-OG_S-MOON_FB3090V02_3,4204 - Aaron 3090 fathers day optis || Gift - ColonCleanse || Enhancements: OFF || CBV1 || Batch 1 || 7C || 16/06/25w25,VIDEO,$308,"15,055",2025-06-16,2025-06-20,4
168,CB_2025_Jun_FB_4208_CHUB-KZ_V02_4x5_IMG_EN_Opti_C-NONE_CTA-NONE_Angle-W_M-NONE_VL-None_TR-None_G-M_P-OG_S-NONE.png,4208 - CHUB DadBodAi || Enhancements: OFF || CBV1 || Batch 1 || 7C || 16/06/25w25,SHARE,$306,"13,215",2025-06-16,2025-06-23,7
169,CB_2025_Jun_FB_4177_VK-VG_V18_4x5_IMG_EN_New_C-BulletPoints_Evergreen_CTA-SALE_Angle-W-B-C_M-MAN_VL-None_G-M_P-OG_S-NONE,4177 -opti 4080 - VK || Enhancements: OFF || CBV1 || Batch 5 || 7C || 09/06/25w24,SHARE,$302,"13,058",2025-06-16,2025-06-20,4
170,CB_2025_Jun_FB_4177_VK-VG_V13_4x5_IMG_EN_New_C-BulletPoints_Evergreen_CTA-SALE_Angle-W-B-C_M-MAN_VL-None_G-M_P-OG_S-NONE,4177 -opti 4080 - VK || Enhancements: OFF || CBV1 || Batch 4 || 7C || 09/06/25w24,SHARE,$302,"12,841",2025-06-16,2025-06-20,4
171,CB_2024_Aug_FB_3090_DT-DP_V02_9x16_VID_EN_Opti_C-MakingOf_CTA-CTA_Pain-W-B-C_M-POW_VL-45s_TR-None_G-M_P-OG_S-Moon_FB3029V04,CBV2 || EU (UK) || ðŸ’° Advantage+ || US || BROAD || 7C || Existing_customer_5% || 15/12/24 Ad set,SHARE,$294,"17,161",2024-12-19,2025-06-25,188
172,CB_2025_Feb_FB_3846_SO-DP_V13_1x1_VID_EN_New_C-NONE_Evergreen_CTA-NONE_Angle-W_M-NONE_VL-None_G-NONE_P-GLP1_S-NONE,3846 - GLP1 emotional snacking IMG || Batch 1 || Enhancements: OFF || GLP-1 Booster || 7C1V || 16/06/25w25,SHARE,$281,"6,648",2025-06-16,2025-06-20,4
173,CB_2025_Jun_FB_4198_CHUB-KZ_V03_9x16_VID_EN_Opti_C-NONE_CTA-NONE_Angle-W_M-NONE_VL-None_TR-None_G-M_P-OG_S-NONE,4198 - CHUB DadBeforeAndAfter || Enhancements: OFF || CBV1 || Batch 1 || 7C || 16/06/25w25,VIDEO,$281,"17,676",2025-06-17,2025-06-22,5
174,CB_2025_Jun_FB_4204_LZ-KB_V01_9x16_VID_EN_Opti_C-MakingOf_Sale_CTA-65_Angle-W-B-C_M-POW_VL-30s_G-M_P-OG_S-MOON_FB3090V02_3,4204 - Aaron 3090 fathers day optis || Enhancements: OFF || CBV1 || Batch 1 || 7C || 16/06/25w25,VIDEO,$281,"14,150",2025-06-16,2025-06-20,4
175,CB_2025_Feb_FB_3835_DT-RP_V05_1x1_IMG_EN_New_C-News_Evergreen_CTA-NONE_Angle-W_M-NONE_VL-None_G-NONE_P-GLP1_S-NONE,3835 - #126 Help is here GLP IMG || Batch 2 || Enhancements: OFF || GLP-1 Booster || 7C1V || 16/06/25w25,SHARE,$274,"5,948",2025-06-17,2025-06-19,2
176,CB_2025_Jan_FB_3751_VK-DP_V02_4x5_IMG_EN_New_C-BulletPoints_Sale_CTA-NY_Angle-W-B-C_M-NONE_VL-None_G-M_P-GLP1_S-NONE - Copy,GLP-1 ðŸ’œ || ASC+ || UK || 5% EXISTING CAP || 7C || 29/05/2025 Ad set,SHARE,$268,"8,802",2025-06-16,2025-06-25,9
177,CB_2024_Feb_FB_2814_MB-DP_V05_1x1_IMG_EN_New_C-WeightLoss_CTA-None_Pain-W-B-C_M-NONE_VL-None_TR-None_G-NONE_P-V2_S-NONE,CBV2 || EU (UK) || ðŸ’° Advantage+ || US || BROAD || 7C || Existing_customer_5% || 15/12/24 Ad set,SHARE,$266,"11,790",2025-01-31,2025-06-25,145
178,CB_2025_Jun_FB_4177_VK-VG_V10_4x5_IMG_EN_New_C-BulletPoints_Evergreen_CTA-SALE_Angle-W-B-C_M-MAN_VL-None_G-M_P-OG_S-NONE,4177 -opti 4080 - VK || Enhancements: OFF || CBV1 || Batch 3 || 7C || 09/06/25w24,SHARE,$254,"9,530",2025-06-16,2025-06-20,4
179,CB_2025_Jan_FB_3739_DT_V08_4x5_VID_EN_Opti_C-BulletPoints_Sale_CTA-70_Angle-W-B_M-MIX_VL-45s_G-MF_P-GLP1_S-WHAT_FB3311V10,GLP-1 ðŸ’œ || ASC+ || EU  || 7C || 14/06/2025 Ad set,VIDEO,$251,"6,416",2025-06-14,2025-06-18,4
180,CB_2025_Jun_FB_4200_SO-KB_V03_4x5_IMG_EN_New_C-Headline_Evergreen_CTA-NONE_Angle-W_M-NONE_VL-None_G-NONE_P-OG_S-NONE,4200 - Summer Body Statics - KB || Enhancements: OFF || CBV1 || Batch 1 || 7C || 16/06/25w25,SHARE,$244,"10,939",2025-06-16,2025-06-20,4
181,CB_2025_Jan_FB_3756_VK-DP_V03_4x5_IMG_EN_New_C-BulletPoints_Evergreen_CTA-NONE_Angle-W-B-C_M-NONE_VL-None_G-M_P-GLP1_S-NONE,GLP-1 ðŸ’œ || ASC+ || CA || 5% EXISTING CAP || 7C || 29/05/2025 Ad set,SHARE,$242,"7,046",2025-06-10,2025-06-25,15
182,CB_2025_Jun_FB_4186_DT-KB_V01_4x3_IMG_EN_New_C-Trend_Evergreen_CTA-65_Angle-W-B-C_M-MAN_VL-None_G-M_P-OG_S-NEW,4186 - #141 chat guys || Enhancements: OFF || CBV1 || Batch 1 || 7C || 16/06/25w25,SHARE,$234,"12,717",2025-06-16,2025-06-20,4
183,CB_2025_Jan_FB_3753_SO_V01_4x5_IMG_EN_New_C-Headline_Evergreen_CTA-NONE_Angle-W_M-NONE_VL-None_G-NONE_P-GLP1_S-NONE,GLP-1 ðŸ’œ || ASC+ || CA || 5% EXISTING CAP || 7C || 29/05/2025 Ad set,SHARE,$233,"9,588",2025-06-10,2025-06-25,15
184,CB_2025_Jun_FB_4196_CHUB-KZ_V01_4x5_IMG_EN_Opti_C-NONE_CTA-NONE_Angle-W_M-NONE_VL-None_TR-None_G-M_P-OG_S-NONE,4196 - CHUB WeightLoss routine || Enhancements: OFF || CBV1 || Batch 1 || 7C || 16/06/25w25,SHARE,$232,"14,684",2025-06-16,2025-06-19,3
185,CB_2025_Jun_FB_4215_VK-KB_V09_4x5_IMG_EN_New_C-Advertorial_Evergreen_CTA-NONE_Angle-W-B-C_M-NONE_VL-None_G-F_P-GLP1_S-NONE,GLP-1 || Cortisol detox || blog_stressfat_cv_en || Batch 3,SHARE,$227,"2,740",2025-06-19,2025-06-22,3
186,CB_2025_Apr_FB_4066_SO_V09_4x5_IMG_EN_Opti_C-NONE_Evergreen_CTA-NONE_Angle-W-B-C_M-NONE_VL-None_G-NONE_P-OG_S-NONE_FB3950V16,CBV2 || EU (UK) || ðŸ’° Advantage+ || US || BROAD || 7C || Existing_customer_5% || 15/12/24 Ad set,SHARE,$226,"12,561",2025-05-25,2025-06-25,31
187,CB_2025_Jun_FB_4189_SO_V05_4x5_IMG_EN_New_C-Headline_Evergreen_CTA-NONE_Angle-W_M-NONE_VL-None_G-NONE_P-OG_S-NONE,4189 - food-resembling || Enhancements: OFF || CBV1 || Batch 1 || 7C || 16/06/25w25,SHARE,$224,"8,323",2025-06-16,2025-06-20,4
188,CB_2025_Feb_FB_3834_DT-DP_V05_9x16_VID_EN_New_C-Celebrity_Evergreen_CTA-NONE_Angle-W_M-JOG_VL-None_G-F_P-GLP1_S-NEW,3834 - GLP 1 emotional snacking || Batch 1 || Enhancements: OFF || GLP-1 Booster || 7C1V || 16/06/25w25,VIDEO,$223,"4,727",2025-06-16,2025-06-21,5
189,CB_2025_Feb_FB_3848_LZ-DP_V01_1x1_IMG_EN_New_C-Headline_Evergreen_CTA-SALE_Angle-GH_M-NONE_VL-None_G-NONE_P-GLP1_S-NONE,3848 - GLP1 simple ads || Batch 1 || Enhancements: OFF || GLP-1 Booster || 7C1V || 16/06/25w25,SHARE,$222,"5,359",2025-06-16,2025-06-19,3
190,CB_2025_Jun_FB_4180_SO_V01_4x5_IMG_EN_Opti_C-Headline_Evergreen_CTA-NONE_Angle-W_M-NONE_VL-None_G-NONE_P-OG_S-NONE_FB4086V01,4180 - FB4086V01 Opti || Enhancements: OFF || CBV1 || Batch 1 || 7C || 09/06/25w24,SHARE,$221,"12,789",2025-06-16,2025-06-20,4
191,CB_2025_Jun_FB_4189_SO_V04_4x5_IMG_EN_New_C-Headline_Evergreen_CTA-NONE_Angle-W_M-NONE_VL-None_G-NONE_P-OG_S-NONE,4189 - food-resembling || Enhancements: OFF || CBV1 || Batch 2 || 7C || 16/06/25w25,SHARE,$216,"9,337",2025-06-16,2025-06-20,4
192,CB_2025_Jun_FB_4189_SO_V07_4x5_IMG_EN_New_C-Headline_Evergreen_CTA-NONE_Angle-W_M-NONE_VL-None_G-NONE_P-OG_S-NONE,4189 - food-resembling || Enhancements: OFF || CBV1 || Batch 1 || 7C || 16/06/25w25,SHARE,$214,"11,110",2025-06-16,2025-06-21,5
193,CB_2025_Jun_FB_4180_SO_V03_4x5_IMG_EN_Opti_C-Headline_Evergreen_CTA-NONE_Angle-W_M-NONE_VL-None_G-NONE_P-OG_S-NONE_FB4086V01,4180 - FB4086V01 Opti || Enhancements: OFF || CBV1 || Batch 1 || 7C || 09/06/25w24,SHARE,$212,"11,955",2025-06-16,2025-06-20,4
194,CB_2025_Jun_FB_4145_DT-KB_V08_4x5_IMG_EN_Opti_C-NONE_SALE_CTA-65_Angle-W_M-NONE_VL-None_G-NONE_P-NONE_S-NONE_FB3812V03 - CC,ðŸ‘¨ || Father's Day || Bundle offer  || ASC+ || US || 0% EXISTING CAP || 7C || 07/06/2025 Ad set,SHARE,$209,"10,635",2025-06-07,2025-06-17,10
195,CB_2025_Feb_FB_3805_VK-DP_V01_1x1_IMG_EN_New_C-BulletPoints_Evergreen_CTA-70_Angle-W-B-C_M-NONE_VL-None_G-F_P-GLP1_S-NEW_FB2286V05,3805 - tetimonial opti 2286 || Batch 1 || Enhancements: OFF || GLP-1 Booster || 7C1V || 16/06/25w25,POST_DELETED,$208,"3,694",2025-06-17,2025-06-21,4
196,CB_2025_Feb_FB_3835_DT-RP_V09_1x1_IMG_EN_New_C-News_Evergreen_CTA-NONE_Angle-W_M-NONE_VL-None_G-NONE_P-GLP1_S-NONE,3835 - #126 Help is here GLP IMG || Batch 3 || Enhancements: OFF || GLP-1 Booster || 7C1V || 16/06/25w25,SHARE,$201,"4,916",2025-06-17,2025-06-18,1
197,CB_2025_Jun_FB_4175_SO_V08_4x5_IMG_EN_New_C-Headline_Evergreen_CTA-NONE_Angle-W_M-NONE_VL-None_G-NONE_P-OG_S-NONE,ðŸŒ¶ï¸  || ASC+ || US || 0% EXISTING CAP || 7C || 15/05/2025  Campaign Ad set,SHARE,$200,"9,078",2025-06-14,2025-06-25,11
198,CB_2025_Jun_FB_4151_DT-KB_V07_4x5_IMG_EN_New_C-NONE_Sale_CTA-65_Angle-W-B_M-NONE_VL-None_G-NONE_P-OG_S-NONE_FB2959V07 - BIOMA,ðŸ‘¨ || Father's Day - Non spenders for 4th July Learnings || Bundle offer || ASC+ || US || 0% EXISTING CAP || 7C || 18/06/2025 Ad set,SHARE,$197,"5,911",2025-06-18,2025-06-22,4
199,CB_2025_Jun_FB_4215_VK-KB_V10_4x5_IMG_EN_New_C-Advertorial_Evergreen_CTA-NONE_Angle-W-B-C_M-NONE_VL-None_G-F_P-GLP1_S-NONE,GLP-1 || Cortisol detox || blog_stressfat_cv_en || Batch 3,SHARE,$192,"2,882",2025-06-19,2025-06-22,3
200,CB_2025_Jun_FB_4181_LZ-VG_V03_9x16_VID_EN_New_C-BulletPoints_Evergreen_CTA-65_Angle-W-B_M-MAN_VL-30s_G-M_P-OG_S-NEW,4181 - New angle test manuel vid || Enhancements: OFF || CBV1 || Batch 1 || 7C || 16/06/25w25,VIDEO,$192,"8,361",2025-06-16,2025-06-25,9
201,CB_2025_Feb_FB_3848_LZ-DP_V02_1x1_IMG_EN_New_C-Headline_Evergreen_CTA-SALE_Angle-GH_M-NONE_VL-None_G-NONE_P-GLP1_S-NONE,3848 - GLP1 simple ads || Batch 1 || Enhancements: OFF || GLP-1 Booster || 7C1V || 16/06/25w25,SHARE,$191,"4,522",2025-06-16,2025-06-19,3
202,CB_2025_Feb_FB_3835_DT-RP_V11_1x1_IMG_EN_New_C-News_Evergreen_CTA-NONE_Angle-W_M-NONE_VL-None_G-NONE_P-GLP1_S-NONE,3835 - #126 Help is here GLP IMG || Batch 3 || Enhancements: OFF || GLP-1 Booster || 7C1V || 16/06/25w25,SHARE,$191,"5,052",2025-06-17,2025-06-19,2
203,CB_2025_Jun_FB_4157_SO-KB_V02_4x5_IMG_EN_New_C-Headline_Evergreen_CTA-NONE_Angle-W_M-NONE_VL-None_G-NONE_P-OG_S-NONE,ðŸ‘¨ || Father's Day - Non spenders for 4th July Learnings || Bundle offer || ASC+ || US || 0% EXISTING CAP || 7C || 18/06/2025 Ad set,SHARE,$190,"8,872",2025-06-18,2025-06-22,4
204,CB_2025_Jun_FB_4177_VK-VG_V03_4x5_IMG_EN_New_C-BulletPoints_Evergreen_CTA-SALE_Angle-W-B-C_M-MAN_VL-None_G-M_P-OG_S-NONE,4177 -opti 4080 - VK || Enhancements: OFF || CBV1 || Batch 1 || 7C || 09/06/25w24,SHARE,$189,"12,433",2025-06-16,2025-06-20,4
205,CB_2025_Jun_FB_4151_DT-KB_V05_4x5_IMG_EN_New_C-NONE_Sale_CTA-65_Angle-W-B_M-NONE_VL-None_G-NONE_P-OG_S-NONE_FB2959V07 - BIOMA,ðŸ‘¨ || Father's Day - Non spenders for 4th July Learnings || Bundle offer || ASC+ || US || 0% EXISTING CAP || 7C || 18/06/2025 Ad set,SHARE,$189,"6,499",2025-06-18,2025-06-22,4
206,CB_2025_Jun_FB_4207_CHUB-KZ_V02_4x5_IMG_EN_Opti_C-NONE_CTA-NONE_Angle-W_M-NONE_VL-None_TR-None_G-M_P-OG_S-NONE,4207 - CHUB SocialMediaDadBod || Enhancements: OFF || CBV1 || Batch 1 || 7C || 16/06/25w25,SHARE,$189,"10,191",2025-06-16,2025-06-25,9
207,CB_2025_Jun_FB_4189_SO_V01_4x5_IMG_EN_New_C-Headline_Evergreen_CTA-NONE_Angle-W_M-NONE_VL-None_G-NONE_P-OG_S-NONE,4189 - food-resembling || Enhancements: OFF || CBV1 || Batch 2 || 7C || 16/06/25w25,SHARE,$179,"8,579",2025-06-16,2025-06-20,4
208,CB_2025_May_FB_4120_DT_V07_4x5_IMG_EN_New_C-Headline_Evergreen_CTA-65_Angle-W-B-C_M-NONE_VL-None_G-NONE_P-OG_S-NONE,"4120 - #138 The Monkey, The Bear and The Ugly || Enhancements: OFF || CBV1 || Batch 2 || 7C || 02/06/25w23",SHARE,$178,"7,662",2025-06-02,2025-06-25,23
209,CB_2025_Jun_FB_4186_DT-KB_V04_4x3_GIF_EN_New_C-Trend_Evergreen_CTA-65_Angle-W-B-C_M-MAN_VL-15s_G-M_P-OG_S-NEW,4186 - #141 chat guys || Enhancements: OFF || CBV1 || Batch 1 || 7C || 16/06/25w25,VIDEO,$175,"9,294",2025-06-16,2025-06-20,4
210,CB_2025_Feb_FB_3829_DT-DP_V01_9x16_VID_EN_New_C-UGC_Sale_CTA-70_Angle-W_M-TRC_VL-30s_G-F_P-GLP1_S-NEW,3829 - GLP-1 gut health angle VID || Batch 1 || Enhancements: OFF || GLP-1 Booster || 7C1V || 16/06/25w25,VIDEO,$175,"2,816",2025-06-16,2025-06-21,5
211,CB_2025_Jun_FB_4176_SO-KB_V05_4x5_IMG_EN_Opti_C-Headline_Evergreen_CTA-NONE_Angle-W_M-NONE_VL-None_G-NONE_P-OG_S-NONE_FB4100V02,4176 - FB4100V02 Opti || Enhancements: OFF || CBV1 || Batch 2 || 7C || 09/06/25w24,SHARE,$174,"6,704",2025-06-09,2025-06-17,8
212,CB_2025_Jun_FB_4204_LZ-KB_V01_9x16_VID_EN_Opti_C-MakingOf_Sale_CTA-65_Angle-W-B-C_M-POW_VL-30s_G-M_P-OG_S-MOON_FB3090V02_2,4204 - Aaron 3090 fathers day optis || Enhancements: OFF || CBV1 || Batch 1 || 7C || 16/06/25w25,VIDEO,$174,"6,185",2025-06-16,2025-06-20,4
213,CB_2025_Jun_FB_4173_LZ_V07_4x5_IMG_EN_New_C-Headline_Evergreen_CTA-NONE_Angle-W_M-NONE_VL-None_G-NONE_P-NONE_S-NONE,4173 - Block Number  || Enhancements: OFF || CBV1 || Batch 2 || 7C || 09/06/25w24,SHARE,$171,"7,609",2025-06-09,2025-06-17,8
214,CB_2025_Jan_FB_3751_VK-DP_V02_4x5_IMG_EN_New_C-BulletPoints_Sale_CTA-NY_Angle-W-B-C_M-NONE_VL-None_G-M_P-GLP1_S-NONE,3751 - opti 3608 GLP1 - VK-DP || Batch 1 || Enhancements: OFF || GLP-1 Booster || 7C1V || 30/05/25w22,SHARE,$167,"6,810",2025-05-30,2025-06-25,26
215,CB_2025_Feb_FB_3846_SO-DP_V18_1x1_VID_EN_New_C-NONE_Evergreen_CTA-NONE_Angle-W_M-NONE_VL-None_G-NONE_P-GLP1_S-NONE,3846 - GLP1 emotional snacking IMG || Batch 2 || Enhancements: OFF || GLP-1 Booster || 7C1V || 16/06/25w25,SHARE,$165,"3,916",2025-06-16,2025-06-20,4
216,CB_2025_Mar_FB_3911_DT_V03_9x16_VID_EN_Opti_C-SingleTesti_Sale_CTA-Patrick_Angle-W_M-TRC_VL-45s_G-F_P-OG_S-MOON_FB2764V04,CBV2 || EU (UK) || ðŸ’° Advantage+ || US || BROAD || 7C || Existing_customer_5% || 15/12/24 Ad set,VIDEO,$164,"7,617",2025-03-17,2025-06-25,100
217,CB_2025_Jun_FB_4156_DT_V04_9x16_VID_EN_New_C-Testimonial_Evergreen_CTA-65_Angle-W-B-C_M-JAS_VL-30s_G-M_P-OG_S-NEW,4156 - Introducing Jason || Enhancements: OFF || CBV1 || Batch 3-4 || 7C || 09/06/25w24,VIDEO,$160,"6,818",2025-06-09,2025-06-16,7
218,CB_2025_Feb_FB_3834_DT-DP_V03_9x16_VID_EN_New_C-Celebrity_Evergreen_CTA-NONE_Angle-W_M-JOG_VL-None_G-F_P-GLP1_S-NEW,3834 - GLP 1 emotional snacking || Batch 1 || Enhancements: OFF || GLP-1 Booster || 7C1V || 16/06/25w25,VIDEO,$158,"2,546",2025-06-16,2025-06-21,5
219,CB_2025_Jan_FB_3751_VK-DP_V02_4x5_IMG_EN_New_C-BulletPoints_Sale_CTA-NY_Angle-W-B-C_M-NONE_VL-None_G-M_P-GLP1_S-NONE - Copy,GLP-1 ðŸ’œ || ASC+ || US || 5% EXISTING CAP || 7C || 29/05/2025 Ad set,SHARE,$158,"4,216",2025-06-16,2025-06-25,9
220,CB_2025_Jun_FB_4184_CHUB-AS_V02_4x5_IMG_EN_New_C-NONE_CTA-CTA_Angle-C_M-NONE_VL-None_TR-None_G-F_P-OG_S-NONE,4184 - CHUB Reminder || Enhancements: OFF || CBV1 || Batch 1 || 7C || 16/06/25w25,SHARE,$158,"7,824",2025-06-16,2025-06-23,7
221,CB_2025_Jun_FB_4180_SO_V04_4x5_IMG_EN_Opti_C-Headline_Evergreen_CTA-NONE_Angle-W_M-NONE_VL-None_G-NONE_P-OG_S-NONE_FB4086V01,4180 - FB4086V01 Opti || Enhancements: OFF || CBV1 || Batch 1 || 7C || 09/06/25w24,SHARE,$151,"6,441",2025-06-16,2025-06-20,4
222,CB_2025_Feb_FB_3827_LZ_V03_1x1_IMG_EN_Opti_C-Headline_Evergreen_CTA-SALE_Angle-W_M-NONE_VL-None_G-M_P-CBV2_S-NONE_FB3705V02,CBV2 || US || Manual Bid: ROAS GOAL: 1.00 -> 1.1 || 7DC || 22/01/2025,SHARE,$150,"4,552",2025-02-18,2025-06-25,127
223,CB_2025_Jan_FB_3757_LZ-DP_V14_94x5_VID_EN_Opti_C-Dance_Evergreen_CTA-NONE_Angle-W-B_M-Nonie_VL-30s_G-F_P-GLP1_S-WHAT_FB3164V03,GLP-1 ðŸ’œ || ASC+ || EU  || 7C || 14/06/2025 Ad set,VIDEO,$150,"7,550",2025-06-14,2025-06-18,4
224,CB_2025_Jun_FB_4177_VK-VG_V16_4x5_IMG_EN_New_C-BulletPoints_Evergreen_CTA-SALE_Angle-W-B-C_M-MAN_VL-None_G-M_P-OG_S-NONE,4177 -opti 4080 - VK || Enhancements: OFF || CBV1 || Batch 4 || 7C || 09/06/25w24,SHARE,$149,"7,245",2025-06-16,2025-06-20,4
225,CB_2025_May_FB_4158_VK-VG_V12_4x5_VID_EN_Opti_C-Headline_Evergreen_CTA-SALE_Angle-W-B-C_M-NONE_VL-None_G-M_P-OG_S-NONE_FB4104V05,ðŸŒ¶ï¸  || ASC+ || US || 0% EXISTING CAP || 7C || 15/05/2025  Campaign Ad set,SHARE,$148,"7,674",2025-06-16,2025-06-25,9
226,CB_2025_Jun_FB_4204_LZ-KB_V01_9x16_VID_EN_Opti_C-MakingOf_Sale_CTA-65_Angle-W-B-C_M-POW_VL-30s_G-M_P-OG_S-MOON_FB3090V02_2,4204 - Aaron 3090 fathers day optis || Gift - ColonCleanse || Enhancements: OFF || CBV1 || Batch 1 || 7C || 16/06/25w25,VIDEO,$146,"6,613",2025-06-16,2025-06-20,4
227,CB_2025_Jun_FB_4154_DT-KB_V02_4x5_IMG_EN_Opti_C-Price_Sale_CTA-65_Angle-None_M-NONE_VL-None_G-NONE_P-OG_S-NONE_FB3907V03 - BIOMA,ðŸ‘¨ || Father's Day || Bundle offer  || ASC+ || US || 0% EXISTING CAP || 7C || 07/06/2025 Ad set,SHARE,$144,"3,859",2025-06-07,2025-06-25,18
228,CB_2025_Jun_FB_4177_VK-VG_V15_4x5_IMG_EN_New_C-BulletPoints_Evergreen_CTA-SALE_Angle-W-B-C_M-MAN_VL-None_G-M_P-OG_S-NONE,4177 -opti 4080 - VK || Enhancements: OFF || CBV1 || Batch 4 || 7C || 09/06/25w24,SHARE,$137,"5,576",2025-06-16,2025-06-20,4
229,CB_2025_May_FB_4140_SO-VG_V04_4x5_IMG_EN_Opti_C-NONE_Evergreen_CTA-NONE_Angle-W_M-NONE_VL-None_G-NONE_P-OG_S-NONE_FB3950V11 - CC,ðŸ‘¨ || Father's Day || Bundle offer  || ASC+ || US || 0% EXISTING CAP || 7C || 07/06/2025 Ad set,SHARE,$137,"7,465",2025-06-07,2025-06-25,18
230,CB_2025_Jun_FB_4177_VK-VG_V19_4x5_IMG_EN_New_C-BulletPoints_Evergreen_CTA-SALE_Angle-W-B-C_M-MAN_VL-None_G-M_P-OG_S-NONE,4177 -opti 4080 - VK || Enhancements: OFF || CBV1 || Batch 5 || 7C || 09/06/25w24,SHARE,$136,"6,091",2025-06-16,2025-06-20,4
231,CB_2025_Jun_FB_4177_VK-VG_V20_4x5_IMG_EN_New_C-BulletPoints_Evergreen_CTA-SALE_Angle-W-B-C_M-MAN_VL-None_G-M_P-OG_S-NONE,4177 -opti 4080 - VK || Enhancements: OFF || CBV1 || Batch 5 || 7C || 09/06/25w24,SHARE,$135,"4,787",2025-06-16,2025-06-20,4
232,CB_2025_Jun_FB_4157_SO-KB_V06_4x5_IMG_EN_New_C-Headline_Evergreen_CTA-NONE_Angle-W_M-NONE_VL-None_G-NONE_P-OG_S-NONE,ðŸ‘¨ || Father's Day - Non spenders for 4th July Learnings || Bundle offer || ASC+ || US || 0% EXISTING CAP || 7C || 18/06/2025 Ad set,SHARE,$132,"5,962",2025-06-18,2025-06-22,4
233,CB_2025_Feb_FB_3835_DT-RP_V02_1x1_IMG_EN_New_C-News_Evergreen_CTA-NONE_Angle-W_M-NONE_VL-None_G-NONE_P-GLP1_S-NONE,3835 - #126 Help is here GLP IMG || Batch 1 || Enhancements: OFF || GLP-1 Booster || 7C1V || 16/06/25w25,SHARE,$129,"5,756",2025-06-17,2025-06-23,6
234,CB_2025_Feb_FB_3826_DT-DP_V03_9x16_VID_EN_New_C-UGC_Sale_CTA-70_Angle-W_M-TRC_VL-30s_G-F_P-GLP1_S-NEW,3826 - GLP-1 hormones and energy || Batch 1 || Enhancements: OFF || GLP-1 Booster || 7C1V || 17/06/25w25,VIDEO,$127,"2,184",2025-06-17,2025-06-21,4
235,CB_2025_Jan_FB_3756_VK-DP_V03_4x5_IMG_EN_New_C-BulletPoints_Evergreen_CTA-NONE_Angle-W-B-C_M-NONE_VL-None_G-M_P-GLP1_S-NONE,GLP-1 ðŸ’œ || ASC+ || UK || 5% EXISTING CAP || 7C || 29/05/2025 Ad set,SHARE,$125,"2,723",2025-06-10,2025-06-25,15
236,CB_2025_Jun_FB_4205_VK-VG_V01_4x5_IMG_EN_New_C-BulletPoints_Evergreen_CTA-SALE_Angle-W-B-C_M-NONE_VL-30s_G-M_P-OG_S-NONE,"4205 - 4143_IMG opti_trending layouts,styles,winners || Enhancements: OFF || CBV1 || Batch 1 || 7C || 16/06/25w25",SHARE,$123,"4,652",2025-06-17,2025-06-21,4
237,CB_2025_Jun_FB_4215_VK-KB_V12_4x5_IMG_EN_New_C-Advertorial_Evergreen_CTA-NONE_Angle-W-B-C_M-NONE_VL-None_G-F_P-GLP1_S-NONE,GLP-1 || Cortisol detox || blog_stressfat_cv_en || Batch 3,SHARE,$123,"2,280",2025-06-19,2025-06-22,3
238,CB_2025_May_FB_4080_LZ-VG_V03_4x5_IMG_EN_New_C-Headline_Evergreen_CTA-NONE_Angle-W_M-NONE_VL-None_G-M_P-OG_S-NONE,âš«ï¸ US || CBV2 || Advantage+ || 7C || BROAD || Existing_customer_0% || || 24/04/25 Ad set,SHARE,$121,"4,498",2025-05-19,2025-06-25,37
239,CB_2025_Feb_FB_3805_VK-DP_V04_1x1_IMG_EN_New_C-BulletPoints_Evergreen_CTA-70_Angle-W-B-C_M-NONE_VL-None_G-F_P-GLP1_S-NEW_FB2286V05,3805 - tetimonial opti 2286 || Batch 1 || Enhancements: OFF || GLP-1 Booster || 7C1V || 16/06/25w25,SHARE,$120,"2,313",2025-06-16,2025-06-21,5
240,CB_2025_Jan_FB_3742_SO-DP-KB_V01_4x5_IMG_EN_Opti_C-NONE_Evergreen_CTA-SALE_Angle-W_M-NONE_VL-None_G-NONE_P-CBV2_S-NONE3665V01,CBV2 || EU (UK) || ðŸ’° Advantage+ || US || BROAD || 7C || Existing_customer_5% || 15/12/24 Ad set,SHARE,$118,"5,185",2025-02-04,2025-06-25,141
241,CB_2025_Feb_FB_3846_SO-DP_V12_1x1_VID_EN_New_C-NONE_Evergreen_CTA-NONE_Angle-W_M-NONE_VL-None_G-NONE_P-GLP1_S-NONE,3846 - GLP1 emotional snacking IMG || Batch 4 || Enhancements: OFF || GLP-1 Booster || 7C1V || 16/06/25w25,SHARE,$117,"2,627",2025-06-16,2025-06-20,4
242,CB_2025_Jun_FB_4145_DT-KB_V08_4x5_IMG_EN_Opti_C-NONE_SALE_CTA-65_Angle-W_M-NONE_VL-None_G-NONE_P-NONE_S-NONE_FB3812V03 - BIOMA,ðŸ‘¨ || Father's Day || Bundle offer  || ASC+ || US || 0% EXISTING CAP || 7C || 07/06/2025 Ad set,SHARE,$113,"5,757",2025-06-07,2025-06-25,18
243,CB_2025_May_FB_4140_SO_V05_4x5_IMG_EN_Opti_C-NONE_Evergreen_CTA-NONE_Angle-W_M-NONE_VL-None_G-NONE_P-OG_S-NONE_FB3950V11 - BIOMA,ðŸ‘¨ || Father's Day || Bundle offer  || ASC+ || US || 0% EXISTING CAP || 7C || 07/06/2025 Ad set,SHARE,$110,"6,783",2025-06-07,2025-06-25,18
244,CB_2025_Jun_FB_4157_SO-KB_V03_4x5_IMG_EN_New_C-Headline_Evergreen_CTA-NONE_Angle-W_M-NONE_VL-None_G-NONE_P-OG_S-NONE,ðŸ‘¨ || Father's Day - Non spenders for 4th July Learnings || Bundle offer || ASC+ || US || 0% EXISTING CAP || 7C || 18/06/2025 Ad set,SHARE,$110,"5,093",2025-06-18,2025-06-22,4
245,CB_2023_May_FB_2144_MB_V02_9x16_VID_EN_Opti_C-Sale_CTA-SMR_Pain-W_M-JOG_VL-30s_TR-None_G-M-F_P-None_S-What,CA || INTEREST: UPCOMING BIRTHDAY || 7C || 11/05/25,VIDEO,$109,"7,025",2025-05-12,2025-06-25,44
246,CB_2025_Jun_FB_4184_CHUB-AS_V01_4x5_IMG_EN_New_C-NONE_CTA-CTA_Angle-C_M-NONE_VL-None_TR-None_G-F_P-OG_S-NONE,4184 - CHUB Reminder || Enhancements: OFF || CBV1 || Batch 1 || 7C || 16/06/25w25,SHARE,$108,"5,165",2025-06-16,2025-06-23,7
247,CB_2025_Jan_FB_3763_SO-DP_V04_1x1_IMG_EN_New_C-Headline_Evergreen_CTA-NONE_Angle-W_M-NONE_VL-None_G-NONE_P-GLP1_S-NONE,3763 - #117 Notion idea GLP IMG || Batch 1 || Enhancements: OFF || GLP-1 Booster || 7C1V || 09/06/25w23,SHARE,$107,"3,247",2025-06-09,2025-06-16,7
248,CB_2025_Jun_FB_4200_SO-KB_V02_4x5_IMG_EN_New_C-Headline_Evergreen_CTA-NONE_Angle-W_M-NONE_VL-None_G-NONE_P-OG_S-NONE,4200 - Summer Body Statics - KB || Enhancements: OFF || CBV1 || Batch 1 || 7C || 16/06/25w25,SHARE,$107,"5,176",2025-06-16,2025-06-20,4
249,CB_2025_Jun_FB_4176_SO-KB_V02_4x5_IMG_EN_Opti_C-Headline_Evergreen_CTA-NONE_Angle-W_M-NONE_VL-None_G-NONE_P-OG_S-NONE_FB4100V02,4176 - FB4100V02 Opti || Enhancements: OFF || CBV1 || Batch 1 || 7C || 09/06/25w24,SHARE,$107,"4,988",2025-06-09,2025-06-17,8
250,CB_2025_Feb_FB_3835_DT-RP_V07_1x1_IMG_EN_New_C-News_Evergreen_CTA-NONE_Angle-W_M-NONE_VL-None_G-NONE_P-GLP1_S-NONE,3835 - #126 Help is here GLP IMG || Batch 2 || Enhancements: OFF || GLP-1 Booster || 7C1V || 16/06/25w25,SHARE,$106,"3,137",2025-06-17,2025-06-19,2
251,CB_2025_May_FB_4149_DT-VG_V02_9x16_VID_EN_Opti_C-Testimonial_Evergreen_CTA-SALE_Angle-W_M-MOOD_VL-30s_G-M_P-OG_S-WOOD_FB3860V03,ðŸ‘¨ || Father's Day || Bundle offer  || ASC+ || US || 0% EXISTING CAP || 7C || 07/06/2025 Ad set,VIDEO,$105,"5,498",2025-06-09,2025-06-25,16
252,CB_2025_Jan_FB_3757_LZ-DP_V14_94x5_VID_EN_Opti_C-Dance_Evergreen_CTA-NONE_Angle-W-B_M-Nonie_VL-30s_G-F_P-GLP1_S-WHAT_FB3164V03,3757 - GLP1 video winner opti Batch 3+4 || Batch 3 || Enhancements: OFF || GLP-1 Booster || 7C1V || 30/05/25w22,SHARE,$104,"4,240",2025-05-30,2025-06-25,26
253,CB_2025_Jun_FB_4188_VK-DP_V03_4x5_IMG_EN_New_C-BulletPoints_Evergreen_CTA-SALE_Angle-W-B-C_M-NONE_VL-30s_G-M_P-OG_S-NONE,4188 - gym img - VK || Enhancements: OFF || CBV1 || Batch 2 || 7C || 16/06/25w25,SHARE,$104,"2,885",2025-06-16,2025-06-21,5
254,CB_2025_Feb_FB_3805_VK-DP_V02_1x1_IMG_EN_New_C-BulletPoints_Evergreen_CTA-70_Angle-W-B-C_M-NONE_VL-None_G-F_P-GLP1_S-NEW_FB2286V05,3805 - tetimonial opti 2286 || Batch 1 || Enhancements: OFF || GLP-1 Booster || 7C1V || 16/06/25w25,SHARE,$103,"2,093",2025-06-16,2025-06-21,5
255,CB_2025_Jun_FB_4175_SO_V06_4x5_IMG_EN_New_C-Headline_Evergreen_CTA-NONE_Angle-W_M-NONE_VL-None_G-NONE_P-OG_S-NONE,4175 - Vintage Collage IMG || Enhancements: OFF || CBV1 || Batch 2 || 7C || 09/06/25w24,SHARE,$101,"2,429",2025-06-09,2025-06-20,11
256,CB_2025_Jun_FB_4201_LZ-VU_V02_9x16_GIF_EN_New_C-Sale_Evergreen_CTA-SALE_Angle-None_M-NONE_VL-7s_G-NONE_P-Combo_S-NONE,CC and Bioma end cards as ads || Enhancements: OFF || CBV1 || Batch 1 || 7C || 12/06/25w24,SHARE,$101,"2,490",2025-06-12,2025-06-16,4
257,CB_2025_Jan_FB_3756_VK-DP_V03_4x5_IMG_EN_New_C-BulletPoints_Evergreen_CTA-NONE_Angle-W-B-C_M-NONE_VL-None_G-M_P-GLP1_S-NONE,GLP-1 ðŸ’œ || ASC+ || EU  || 7C || 14/06/2025 Ad set,SHARE,$98,"9,189",2025-06-14,2025-06-18,4
258,CB_2025_Jun_FB_4205_VK-VG_V05_4x5_IMG_EN_New_C-BulletPoints_Evergreen_CTA-SALE_Angle-W-B-C_M-NONE_VL-30s_G-M_P-OG_S-NONE,"4205 - 4143_IMG opti_trending layouts,styles,winners || Enhancements: OFF || CBV1 || Batch 2 || 7C || 16/06/25w25",SHARE,$96,"2,915",2025-06-16,2025-06-21,5
259,CB_2025_Feb_FB_3846_SO-DP_V07_1x1_VID_EN_New_C-NONE_Evergreen_CTA-NONE_Angle-W_M-NONE_VL-None_G-NONE_P-GLP1_S-NONE,3846 - GLP1 emotional snacking IMG || Batch 3 || Enhancements: OFF || GLP-1 Booster || 7C1V || 16/06/25w25,SHARE,$95,"2,041",2025-06-16,2025-06-20,4
260,CB_2025_Feb_FB_3846_SO-DP_V02_1x1_VID_EN_New_C-NONE_Evergreen_CTA-NONE_Angle-W_M-NONE_VL-None_G-NONE_P-GLP1_S-NONE,3846 - GLP1 emotional snacking IMG || Batch 2 || Enhancements: OFF || GLP-1 Booster || 7C1V || 16/06/25w25,SHARE,$93,"2,288",2025-06-16,2025-06-20,4
261,CB_2025_Feb_FB_3835_DT-RP_V04_1x1_IMG_EN_New_C-News_Evergreen_CTA-NONE_Angle-W_M-NONE_VL-None_G-NONE_P-GLP1_S-NONE,3835 - #126 Help is here GLP IMG || Batch 1 || Enhancements: OFF || GLP-1 Booster || 7C1V || 16/06/25w25,SHARE,$92,"4,530",2025-06-17,2025-06-23,6
262,CB_2025_Jun_FB_4172_VK-VG_V03_9x16_VID_EN_New_C-BulletPoints_Evergreen_CTA-SALE_Angle-W-B-C_M-MAN_VL-30s_G-M_P-OG_S-WHAT,4172 - new actor test - VK || Enhancements: OFF || CBV1 || Batch 1 || 7C || 15/06/25w25,VIDEO,$92,"3,913",2025-06-16,2025-06-25,9
263,CB_2025_Jun_FB_4205_VK-VG_V02_4x5_IMG_EN_New_C-BulletPoints_Evergreen_CTA-SALE_Angle-W-B-C_M-NONE_VL-30s_G-M_P-OG_S-NONE,"4205 - 4143_IMG opti_trending layouts,styles,winners || Enhancements: OFF || CBV1 || Batch 1 || 7C || 16/06/25w25",SHARE,$90,"3,570",2025-06-17,2025-06-21,4
264,CB_2025_Feb_FB_3826_DT-DP_V02_9x16_VID_EN_New_C-UGC_Sale_CTA-70_Angle-W_M-TRC_VL-30s_G-F_P-GLP1_S-NEW,3826 - GLP-1 hormones and energy || Batch 1 || Enhancements: OFF || GLP-1 Booster || 7C1V || 17/06/25w25,VIDEO,$90,"1,673",2025-06-18,2025-06-21,3
265,CB_2025_Jun_FB_4200_SO-KB_V01_4x5_IMG_EN_New_C-Headline_Evergreen_CTA-NONE_Angle-W_M-NONE_VL-None_G-NONE_P-OG_S-NONE,4200 - Summer Body Statics - KB || Enhancements: OFF || CBV1 || Batch 1 || 7C || 16/06/25w25,SHARE,$88,"4,499",2025-06-16,2025-06-20,4
266,CB_2025_Jan_FB_3751_VK-DP_V02_4x5_IMG_EN_New_C-BulletPoints_Sale_CTA-NY_Angle-W-B-C_M-NONE_VL-None_G-M_P-GLP1_S-NONE - Copy,GLP-1 ðŸ’œ || ASC+ || EU  || 7C || 14/06/2025 Ad set,SHARE,$87,"4,712",2025-06-16,2025-06-18,2
267,CB_2025_Jun_FB_4205_VK-VG_V12_4x5_IMG_EN_New_C-BulletPoints_Evergreen_CTA-SALE_Angle-W-B-C_M-NONE_VL-30s_G-M_P-OG_S-NONE,"4205 - 4143_IMG opti_trending layouts,styles,winners || Enhancements: OFF || CBV1 || Batch 3 || 7C || 16/06/25w25",SHARE,$87,"3,680",2025-06-16,2025-06-20,4
268,CB_2025_Jun_FB_4195_DT-VG_V03_9x16_VID_EN_Opti_C-BulletPoints_Evergreen_CTA-SALE_Angle-W_M-JANW_VL-30s_G-M_P-OG_S-WHAT_FB3883V05_1,4195 - #153 CB as main daily routine || Enhancements: OFF || CBV1 || Batch 2 || 7C || 16/06/25w25,VIDEO,$87,"4,425",2025-06-16,2025-06-23,7
269,CB_2025_Feb_FB_3829_DT-DP_V03_9x16_VID_EN_New_C-UGC_Sale_CTA-70_Angle-W_M-TRC_VL-30s_G-F_P-GLP1_S-NEW,3829 - GLP-1 gut health angle VID || Batch 1 || Enhancements: OFF || GLP-1 Booster || 7C1V || 16/06/25w25,VIDEO,$86,"1,783",2025-06-16,2025-06-21,5
270,CB_2025_Feb_FB_3794_SO-JT_V04_1x1_IMG_EN_New_C-A-Compare_Evergreen_CTA-NONE_Angle-W_M-NONE_VL-15s_G-NONE_P-GLP1_S-NONE,3794 - Notion Idea #120 Me w/ GLP IMG || Batch 1 || Enhancements: OFF || GLP-1 Booster || 7C1V || 16/06/25w25,SHARE,$84,"2,958",2025-06-16,2025-06-25,9
271,CB_2025_Jan_FB_3753_SO_V01_4x5_IMG_EN_New_C-Headline_Evergreen_CTA-NONE_Angle-W_M-NONE_VL-None_G-NONE_P-GLP1_S-NONE,GLP-1 ðŸ’œ || ASC+ || UK || 5% EXISTING CAP || 7C || 29/05/2025 Ad set,SHARE,$82,"2,213",2025-06-10,2025-06-25,15
272,CB_2025_Jun_FB_4175_SO_V07_4x5_IMG_EN_New_C-Headline_Evergreen_CTA-NONE_Angle-W_M-NONE_VL-None_G-NONE_P-OG_S-NONE,4175 - Vintage Collage IMG || Enhancements: OFF || CBV1 || Batch 2 || 7C || 09/06/25w24,SHARE,$81,"3,425",2025-06-09,2025-06-20,11
273,CB_2025_Apr_FB_4029_LZ-VU_V03_4x5_IMG_EN_Opti_C-Trend_Evergreen_CTA-NONE_Angle-W_M-NONE_VL-None_G-NONE_P-OG_S-NONE_FB3671V03,CA || ASC+ || 0% EXISTING || 7DC || 12.05.2025 RESTART Ad set,SHARE,$80,"6,086",2025-05-14,2025-06-25,42
274,CB_2025_Jun_FB_4161_DT-VG_V07_9x16_VID_EN_New_C-BulletPoints_Evergreen_CTA-NONE_Angle-W-B-C_M-MIX_VL-15s_G-M_P-OG_S-NEW,4167 - #158 Ohealth Copy_MIX painpoints || Enhancements: OFF || CBV1 || Batch 2 || 7C || 09/06/25w24,VIDEO,$80,"2,237",2025-06-09,2025-06-16,7
275,CB_2025_Jan_FB_3757_LZ-DP_V14_94x5_VID_EN_Opti_C-Dance_Evergreen_CTA-NONE_Angle-W-B_M-Nonie_VL-30s_G-F_P-GLP1_S-WHAT_FB3164V03,GLP-1 ðŸ’œ || ASC+ || UK || 5% EXISTING CAP || 7C || 29/05/2025 Ad set,VIDEO,$79,"1,978",2025-06-10,2025-06-25,15
276,CB_2025_Feb_FB_3848_LZ-DP_V05_1x1_IMG_EN_New_C-Headline_Evergreen_CTA-SALE_Angle-GH_M-NONE_VL-None_G-NONE_P-GLP1_S-NONE,3848 - GLP1 simple ads || Batch 2 || Enhancements: OFF || GLP-1 Booster || 7C1V || 16/06/25w25,SHARE,$78,"2,100",2025-06-16,2025-06-19,3
277,CB_2025_Jun_FB_4199_DT-KB_V05_4x5_IMG_EN_New_C-BulletPoints_Sale_CTA-70_Angle-W-B-C_M-NONE_VL-None_G-M_P-GLP1_S-NONE_FB3756V03,4199 - Father's Day GLP-1 Opti || Batch 1 || Enhancements: OFF || GLP-1 Booster || 7C1V || 16/06/25w25,SHARE,$78,"1,692",2025-06-16,2025-06-25,9
278,CB_2025_Jun_FB_4192_DT-VU_V05_4x5_IMG_EN_New_C-Headline_Evergreen_CTA-NONE_Angle-W_M-NONE_VL-None_G-M_P-OG_S-NONE,4192 - #132 Beyond Alpha adaptation - lose X cm of chest fat || Enhancements: OFF || CBV1 || Batch 2 || 7C || 16/06/25w25,SHARE,$76,"3,222",2025-06-16,2025-06-22,6
279,CB_2025_Jan_FB_3741_LZ-JG_V01_4x5_IMG_EN_Opti_C-Headline_Evergreen_CTA-NONE_Angle-W_M-NONE_VL-None_G-NONE_P-CBV2_S-NONE_FB3357V01,CBV2 || US || Manual Bid: ROAS GOAL: 1.00 -> 1.1 || 7DC || 22/01/2025,SHARE,$74,"3,153",2025-01-22,2025-06-25,154
280,CB_2025_May_FB_4150_DT-KB_V02_4x5_IMG_EN_New_C-Headline_Sale_CTA-65_Angle-None_M-MIX_VL-None_G-M_P-OG_S-NONE,ðŸ‘¨ || Father's Day - Non spenders for 4th July Learnings || Bundle offer || ASC+ || US || 0% EXISTING CAP || 7C || 18/06/2025 Ad set,SHARE,$73,"3,151",2025-06-18,2025-06-22,4
281,CB_2025_Jun_FB_4215_VK-KB_V08_4x5_IMG_EN_New_C-Advertorial_Evergreen_CTA-NONE_Angle-W-B-C_M-NONE_VL-None_G-F_P-GLP1_S-NONE_blog_stressfat_cv_en,GLP-1 || Cortisol detox || blog_stressfat_cv_en || Batch 2,SHARE,$72,"1,595",2025-06-19,2025-06-22,3
282,CB_2025_Jun_FB_4189_SO_V06_4x5_IMG_EN_New_C-Headline_Evergreen_CTA-NONE_Angle-W_M-NONE_VL-None_G-NONE_P-OG_S-NONE,4189 - food-resembling || Enhancements: OFF || CBV1 || Batch 1 || 7C || 16/06/25w25,SHARE,$72,"3,303",2025-06-16,2025-06-21,5
283,CB_2025_Jun_FB_4195_DT-VG_V02_9x16_VID_EN_Opti_C-BulletPoints_Evergreen_CTA-SALE_Angle-W_M-JANW_VL-30s_G-M_P-OG_S-WHAT_FB3883V05,4195 - #153 CB as main daily routine || Enhancements: OFF || CBV1 || Batch 2 || 7C || 16/06/25w25,VIDEO,$72,"2,971",2025-06-16,2025-06-23,7
284,CB_2025_Jun_FB_4176_SO-KB_V10_4x5_IMG_EN_Opti_C-Headline_Evergreen_CTA-NONE_Angle-W_M-NONE_VL-None_G-NONE_P-OG_S-NONE_FB4100V02,ðŸŒ¶ï¸  || ASC+ || US || 0% EXISTING CAP || 7C || 15/05/2025  Campaign Ad set,SHARE,$71,"2,960",2025-06-16,2025-06-25,9
285,CB_2025_Jun_FB_4205_VK-VG_V07_4x5_IMG_EN_New_C-BulletPoints_Evergreen_CTA-SALE_Angle-W-B-C_M-NONE_VL-30s_G-M_P-OG_S-NONE,"4205 - 4143_IMG opti_trending layouts,styles,winners || Enhancements: OFF || CBV1 || Batch 2 || 7C || 16/06/25w25",SHARE,$70,"2,061",2025-06-16,2025-06-21,5
286,CB_2025_Jun_FB_4145_SO_V03_4x5_IMG_EN_Opti_C-NONE_Evergreen_CTA-NONE_Angle-W-B-C_M-NONE_VL-None_G-NONE_P-OG_S-NONE_FB3950V16,4145 - FB3950V16 Opti || Enhancements: OFF || CBV1 || Batch 1 || 7C || 09/06/25w24,SHARE,$68,"3,267",2025-06-09,2025-06-16,7
287,CB_2025_Jun_FB_4151_DT-KB_V06_4x5_IMG_EN_New_C-NONE_Sale_CTA-65_Angle-W-B_M-NONE_VL-None_G-NONE_P-OG_S-NONE_FB2959V07 - CC,ðŸ‘¨ || Father's Day || Bundle offer  || ASC+ || US || 0% EXISTING CAP || 7C || 07/06/2025 Ad set,SHARE,$68,"2,773",2025-06-07,2025-06-25,18
288,CB_2024_Dec_FB_3619_VK-JT_V02_4x5_VID_EN_New_C-BulletPoints_Sale_CTA-NY_Angle-W-B-C_M-NONE_VL-None_G-NONE_P-OG_S-NONE - Copy,ðŸŒ¶ï¸  || ASC+ || US || 0% EXISTING CAP || 7C || 15/05/2025  Campaign Ad set,SHARE,$68,"3,545",2025-05-15,2025-06-25,41
289,CB_2025_Jun_FB_4177_VK-VG_V17_4x5_IMG_EN_New_C-BulletPoints_Evergreen_CTA-SALE_Angle-W-B-C_M-MAN_VL-None_G-M_P-OG_S-NONE,4177 -opti 4080 - VK || Enhancements: OFF || CBV1 || Batch 5 || 7C || 09/06/25w24,SHARE,$67,"2,543",2025-06-16,2025-06-20,4
290,CB_2025_Jun_FB_4189_SO_V08_4x5_IMG_EN_New_C-Headline_Evergreen_CTA-NONE_Angle-W_M-NONE_VL-None_G-NONE_P-OG_S-NONE,4189 - food-resembling || Enhancements: OFF || CBV1 || Batch 1 || 7C || 16/06/25w25,SHARE,$65,"2,733",2025-06-16,2025-06-21,5
291,CB_2024_Nov_FB_3264_LZ_V31_4x5_VID_EN_Opti_C-MakingOf_Sale_CTA-BF_Angle-W-B_M-CRAZY_VL-45s_G-M_P-OG_S-NEW_FB3004V02,CBV2 || EU (UK) || ðŸ’° Advantage+ || US || BROAD || 7C || Existing_customer_5% || 15/12/24 Ad set,VIDEO,$63,"3,118",2024-12-19,2025-06-25,188
292,CB_2025_Jun_FB_4205_VK-VG_V08_4x5_IMG_EN_New_C-BulletPoints_Evergreen_CTA-SALE_Angle-W-B-C_M-NONE_VL-30s_G-M_P-OG_S-NONE,"4205 - 4143_IMG opti_trending layouts,styles,winners || Enhancements: OFF || CBV1 || Batch 2 || 7C || 16/06/25w25",SHARE,$63,"1,905",2025-06-16,2025-06-21,5
293,CB_2025_Jun_FB_4180_SO_V09_4x5_IMG_EN_Opti_C-Headline_Evergreen_CTA-NONE_Angle-W_M-NONE_VL-None_G-NONE_P-OG_S-NONE_FB4086V01,4180 - FB4086V01 Opti || Enhancements: OFF || CBV1 || Batch 2 || 7C || 09/06/25w24,SHARE,$62,"3,912",2025-06-16,2025-06-21,5
294,CB_2025_Jun_FB_4151_DT-KB_V04_4x5_IMG_EN_New_C-NONE_Sale_CTA-65_Angle-W-B_M-NONE_VL-None_G-NONE_P-OG_S-NONE_FB2959V07 - BIOMA,ðŸ‘¨ || Father's Day - Non spenders for 4th July Learnings || Bundle offer || ASC+ || US || 0% EXISTING CAP || 7C || 18/06/2025 Ad set,SHARE,$62,"1,771",2025-06-18,2025-06-22,4
295,CB_2025_Jan_FB_3757_LZ-DP_V18_4x5_VID_EN_Opti_C-NegativeMark_Evergreen_CTA-NONE_Angle-W_M-MAG_VL-45s_G-F_P-GLP1_S-MOON_FB3311V13,GLP-1 ðŸ’œ || ASC+ || EU  || 7C || 14/06/2025 Ad set,VIDEO,$61,"2,324",2025-06-14,2025-06-18,4
296,CB_2025_Jun_FB_4188_VK-DP_V01_4x5_IMG_EN_New_C-BulletPoints_Evergreen_CTA-SALE_Angle-W-B-C_M-NONE_VL-30s_G-M_P-OG_S-NONE,4188 - gym img - VK || Enhancements: OFF || CBV1 || Batch 2 || 7C || 16/06/25w25,SHARE,$61,"2,582",2025-06-16,2025-06-21,5
297,CB_2025_Jan_FB_3756_VK-DP_V03_4x5_IMG_EN_New_C-BulletPoints_Evergreen_CTA-NONE_Angle-W-B-C_M-NONE_VL-None_G-M_P-GLP1_S-NONE,GLP-1 ðŸ’œ || ASC+ || US || 5% EXISTING CAP || 7C || 29/05/2025 Ad set,SHARE,$60,"1,412",2025-06-02,2025-06-25,23
298,CB_2025_May_FB_4158_VK-VG_V09_4x5_VID_EN_Opti_C-Headline_Evergreen_CTA-SALE_Angle-W-B-C_M-NONE_VL-None_G-M_P-OG_S-NONE_FB4104V05,4158 - 4104_V05_VG Opti - VK || Enhancements: OFF || CBV1 || Batch 3-4 || 7C || 09/06/25w24,SHARE,$60,"3,080",2025-06-09,2025-06-17,8
299,CB_2025_May_FB_4140_SO_V05_4x5_IMG_EN_Opti_C-NONE_Evergreen_CTA-NONE_Angle-W_M-NONE_VL-None_G-NONE_P-OG_S-NONE_FB3950V11 - CC,ðŸ‘¨ || Father's Day || Bundle offer  || ASC+ || US || 0% EXISTING CAP || 7C || 07/06/2025 Ad set,SHARE,$60,"3,828",2025-06-07,2025-06-25,18
300,CB_2025_Jan_FB_3744_SO_V07_4x5_IMG_EN_New_C-Headline_Evergreen_CTA-NONE_Angle-W_M-NONE_VL-None_G-NONE_P-GLP1_S-NONE,GLP-1 ðŸ’œ || ASC+ || US || 5% EXISTING CAP || 7C || 29/05/2025 Ad set,SHARE,$59,"1,379",2025-06-07,2025-06-25,18
301,CB_2025_Jun_FB_4206_CHUB-KZ_V03_4x5_IMG_EN_Opti_C-NONE_CTA-NONE_Angle-W_M-NONE_VL-None_TR-None_G-M_P-OG_S-NONE.png,4206 - CHUB NoMoreDadBod  || Enhancements: OFF || CBV1 || Batch 1 || 7C || 16/06/25w25,SHARE,$58,"3,271",2025-06-16,2025-06-23,7
302,CB_2025_Jun_FB_4192_DT-VU_V06_4x5_IMG_EN_New_C-Headline_Evergreen_CTA-NONE_Angle-W_M-NONE_VL-None_G-M_P-OG_S-NONE,4192 - #132 Beyond Alpha adaptation - lose X cm of chest fat || Enhancements: OFF || CBV1 || Batch 2 || 7C || 16/06/25w25,SHARE,$58,"2,230",2025-06-16,2025-06-22,6
303,CB_2025_Feb_FB_3826_DT-DP_V01_9x16_VID_EN_New_C-UGC_Sale_CTA-70_Angle-W_M-TRC_VL-30s_G-F_P-GLP1_S-NEW,3826 - GLP-1 hormones and energy || Batch 1 || Enhancements: OFF || GLP-1 Booster || 7C1V || 17/06/25w25,POST_DELETED,$57,738,2025-06-18,2025-06-20,2
304,CB_2024_Jan_FB_2784_RS_V02_9x16_VID_EN_Opti_C-Pointing_CTA-SALE_Pain-W_M-JOG_VL-30s_TR-None_G-F_P-OG_S-OLLIE_FB2181V01,CBV2 || EU (UK) || ðŸ’° Advantage+ || US || BROAD || 7C || Existing_customer_5% || 15/12/24 Ad set,VIDEO,$56,"2,072",2025-01-09,2025-06-25,167
305,CB_2025_Jun_FB_4206_CHUB-KZ_V04_9x16_VID_EN_Opti_C-NONE_CTA-NONE_Angle-W_M-NONE_VL-None_TR-None_G-M_P-OG_S-NONE,4206 - CHUB NoMoreDadBod  || Enhancements: OFF || CBV1 || Batch 1 || 7C || 16/06/25w25,VIDEO,$56,"2,998",2025-06-16,2025-06-23,7
306,CB_2025_Jun_FB_4205_VK-VG_V04_4x5_IMG_EN_New_C-BulletPoints_Evergreen_CTA-SALE_Angle-W-B-C_M-NONE_VL-30s_G-M_P-OG_S-NONE,"4205 - 4143_IMG opti_trending layouts,styles,winners || Enhancements: OFF || CBV1 || Batch 1 || 7C || 16/06/25w25",SHARE,$55,"1,614",2025-06-16,2025-06-21,5
307,CB_2025_May_FB_4158_VK-VG_V12_4x5_VID_EN_Opti_C-Headline_Evergreen_CTA-SALE_Angle-W-B-C_M-NONE_VL-None_G-M_P-OG_S-NONE_FB4104V05,4158 - 4104_V05_VG Opti - VK || Enhancements: OFF || CBV1 || Batch 3-4 || 7C || 09/06/25w24,SHARE,$54,"3,093",2025-06-09,2025-06-17,8
308,CB_2025_May_FB_4140_SO-VG_V04_4x5_IMG_EN_Opti_C-NONE_Evergreen_CTA-NONE_Angle-W_M-NONE_VL-None_G-NONE_P-OG_S-NONE_FB3950V11 - BIOMA,ðŸ‘¨ || Father's Day || Bundle offer  || ASC+ || US || 0% EXISTING CAP || 7C || 07/06/2025 Ad set,SHARE,$54,"3,251",2025-06-07,2025-06-25,18
309,CB_2025_Feb_FB_3846_SO-DP_V14_1x1_VID_EN_New_C-NONE_Evergreen_CTA-NONE_Angle-W_M-NONE_VL-None_G-NONE_P-GLP1_S-NONE,3846 - GLP1 emotional snacking IMG || Batch 2 || Enhancements: OFF || GLP-1 Booster || 7C1V || 16/06/25w25,SHARE,$54,"1,218",2025-06-16,2025-06-20,4
310,CB_2025_Jun_FB_4196_CHUB-KZ_V02_4x5_IMG_EN_Opti_C-NONE_CTA-NONE_Angle-W_M-NONE_VL-None_TR-None_G-M_P-OG_S-NONE,4196 - CHUB WeightLoss routine || Enhancements: OFF || CBV1 || Batch 1 || 7C || 16/06/25w25,SHARE,$53,"1,717",2025-06-16,2025-06-19,3
311,CB_2025_May_FB_4146_DT_V04_9x16_VID_EN_New_C-BeforeAfter_Evergreen_CTA-SALE_Angle-W_M-JOG_VL-45s_G-F_P-OG_S-MOON,4146 - I was fat || Enhancements: OFF || CBV1 || Batch 1 || 7C || 09/06/25w24,VIDEO,$52,"2,141",2025-06-09,2025-06-16,7
312,CB_2024_Sep_FB_3135_DA-DP_V01_4x5_VID_EN_Opti_C-Pointing_Evergreen_CTA-DISCOUNT_Angle-W-B_M-ALEX_VL-30s_G-M_P-OG_S-MOON_FB3096V03,ðŸŒ¶ï¸  || ASC+ || US || 0% EXISTING CAP || 7C || 15/05/2025  Campaign Ad set,VIDEO,$52,"2,124",2025-05-15,2025-06-20,36
313,CB_2025_Jan_FB_3751_VK-DP_V04_4x5_IMG_EN_New_C-BulletPoints_Sale_CTA-NY_Angle-W-B-C_M-NONE_VL-None_G-M_P-GLP1_S-NONE,3751 - opti 3608 GLP1 - VK-DP || Batch 1 || Enhancements: OFF || GLP-1 Booster || 7C1V || 30/05/25w22,POST_DELETED,$52,"1,888",2025-05-30,2025-06-24,25
314,CB_2025_May_FB_4120_DT_V05_4x5_IMG_EN_New_C-Headline_Evergreen_CTA-65_Angle-W-B-C_M-NONE_VL-None_G-NONE_P-OG_S-NONE,"4120 - #138 The Monkey, The Bear and The Ugly || Enhancements: OFF || CBV1 || Batch 2 || 7C || 02/06/25w23",SHARE,$52,"3,011",2025-06-02,2025-06-25,23
315,CB_2025_Jun_FB_4169_DT-DP_V03_9x16_VID_EN_New_C-SocialProof_Evergreen_CTA-65_Angle-W-B-C_M-MAN_VL-30s_G-MF_P-OG_S-NEW,"4169 - 3 reasons why, GF POV || Enhancements: OFF || CBV1 || Batch 1 || 7C || 09/06/25w24",VIDEO,$50,"1,696",2025-06-09,2025-06-16,7
316,CB_2025_Jun_FB_4177_VK-VG_V14_4x5_IMG_EN_New_C-BulletPoints_Evergreen_CTA-SALE_Angle-W-B-C_M-MAN_VL-None_G-M_P-OG_S-NONE,4177 -opti 4080 - VK || Enhancements: OFF || CBV1 || Batch 4 || 7C || 09/06/25w24,SHARE,$50,"2,163",2025-06-16,2025-06-20,4
317,CB_2025_Feb_FB_3846_SO-DP_V06_1x1_VID_EN_New_C-NONE_Evergreen_CTA-NONE_Angle-W_M-NONE_VL-None_G-NONE_P-GLP1_S-NONE,3846 - GLP1 emotional snacking IMG || Batch 2 || Enhancements: OFF || GLP-1 Booster || 7C1V || 16/06/25w25,SHARE,$49,927,2025-06-17,2025-06-20,3
318,CB_2025_Jun_FB_4183_SO_V02_4x5_IMG_EN_New_C-Headline_Evergreen_CTA-NONE_Angle-W_M-NONE_VL-None_G-NONE_P-OG_S-NONE,4183 - Pooping a Cactus IMG || Enhancements: OFF || CBV1 || Batch 1 || 7C || 16/06/25w25,SHARE,$49,"2,216",2025-06-16,2025-06-21,5
319,CB_2025_May_FB_4149_DT-VG_V01_9x16_VID_EN_Opti_C-Testimonial_Evergreen_CTA-SALE_Angle-W_M-MOOD_VL-30s_G-M_P-OG_S-WOOD_FB3860V03,ðŸ‘¨ || Father's Day || Bundle offer  || ASC+ || US || 0% EXISTING CAP || 7C || 07/06/2025 Ad set,VIDEO,$48,"2,101",2025-06-09,2025-06-25,16
320,CB_2025_May_FB_4143_DT_V02_4x5_IMG_EN_New_C-Headline_Evergreen_CTA-65_Angle-W_M-NONE_VL-None_G-NONE_P-OG_S-NONE,4143 - Hormonal weight || Enhancements: OFF || CBV1 || Batch 1 || 7C || 02/06/25w23,SHARE,$48,"2,166",2025-06-02,2025-06-25,23
321,CB_2025_Jun_FB_4151_DT-KB_V06_4x5_IMG_EN_New_C-NONE_Sale_CTA-65_Angle-W-B_M-NONE_VL-None_G-NONE_P-OG_S-NONE_FB2959V07 - BIOMA,ðŸ‘¨ || Father's Day - Non spenders for 4th July Learnings || Bundle offer || ASC+ || US || 0% EXISTING CAP || 7C || 18/06/2025 Ad set,SHARE,$46,"2,316",2025-06-18,2025-06-22,4
322,CB_2025_Jun_FB_4151_DT-KB_V04_4x5_IMG_EN_New_C-NONE_Sale_CTA-65_Angle-W-B_M-NONE_VL-None_G-NONE_P-OG_S-NONE_FB2959V07 - CC,ðŸ‘¨ || Father's Day || Bundle offer  || ASC+ || US || 0% EXISTING CAP || 7C || 07/06/2025 Ad set,SHARE,$46,"1,937",2025-06-07,2025-06-25,18
323,CB_2025_Feb_FB_3848_LZ-DP_V04_1x1_IMG_EN_New_C-Headline_Evergreen_CTA-SALE_Angle-GH_M-NONE_VL-None_G-NONE_P-GLP1_S-NONE,3848 - GLP1 simple ads || Batch 1 || Enhancements: OFF || GLP-1 Booster || 7C1V || 16/06/25w25,SHARE,$45,"1,291",2025-06-16,2025-06-19,3
324,CB_2025_Jun_FB_4188_VK-DP_V04_4x5_IMG_EN_New_C-BulletPoints_Evergreen_CTA-SALE_Angle-W-B-C_M-NONE_VL-30s_G-M_P-OG_S-NONEv,4188 - gym img - VK || Enhancements: OFF || CBV1 || Batch 2 || 7C || 16/06/25w25,SHARE,$43,983,2025-06-16,2025-06-21,5
325,CB_2025_Jun_FB_4199_DT-KB_V01_9x16_VID_EN_Opti_C-Dance_Sale_CTA-70_Angle-W-B_M-Nonie_VL-30s_G-F_P-GLP1_S-WHAT_FB3757V14,4199 - Father's Day GLP-1 Opti || Batch 2 || Enhancements: OFF || GLP-1 Booster || 7C1V || 16/06/25w25,VIDEO,$43,"1,271",2025-06-16,2025-06-25,9
326,CB_2025_Feb_FB_3834_DT-DP_V01_9x16_VID_EN_New_C-Celebrity_Evergreen_CTA-NONE_Angle-W_M-JOG_VL-None_G-F_P-GLP1_S-NEW,3834 - GLP 1 emotional snacking || Batch 1 || Enhancements: OFF || GLP-1 Booster || 7C1V || 16/06/25w25,VIDEO,$42,715,2025-06-16,2025-06-21,5
327,CB_2025_Jun_FB_4208_CHUB-KZ_V04_4x5_IMG_EN_Opti_C-NONE_CTA-NONE_Angle-W_M-NONE_VL-None_TR-None_G-M_P-OG_S-NONE,4208 - CHUB DadBodAi || Enhancements: OFF || CBV1 || Batch 1 || 7C || 16/06/25w25,SHARE,$42,"1,847",2025-06-16,2025-06-23,7
328,CB_2025_Jun_FB_4192_DT-VU_V03_4x5_IMG_EN_New_C-Headline_Evergreen_CTA-NONE_Angle-W_M-NONE_VL-None_G-M_P-OG_S-NONE,4192 - #132 Beyond Alpha adaptation - lose X cm of chest fat || Enhancements: OFF || CBV1 || Batch 2 || 7C || 16/06/25w25,SHARE,$41,"1,511",2025-06-17,2025-06-22,5
329,CB_2025_Jun_FB_4205_VK-VG_V15_4x5_IMG_EN_New_C-BulletPoints_Evergreen_CTA-SALE_Angle-W-B-C_M-NONE_VL-30s_G-M_P-OG_S-NONE,"4205 - 4143_IMG opti_trending layouts,styles,winners || Enhancements: OFF || CBV1 || Batch 4 || 7C || 16/06/25w25",SHARE,$41,"1,595",2025-06-16,2025-06-21,5
330,CB_2025_Feb_FB_3848_LZ-DP_V06_1x1_IMG_EN_New_C-Headline_Evergreen_CTA-SALE_Angle-GH_M-NONE_VL-None_G-NONE_P-GLP1_S-NONE,3848 - GLP1 simple ads || Batch 2 || Enhancements: OFF || GLP-1 Booster || 7C1V || 16/06/25w25,SHARE,$41,930,2025-06-16,2025-06-19,3
331,CB_2025_Jun_FB_4176_SO-KB_V01_4x5_IMG_EN_Opti_C-Headline_Evergreen_CTA-NONE_Angle-W_M-NONE_VL-None_G-NONE_P-OG_S-NONE_FB4100V02,4176 - FB4100V02 Opti || Enhancements: OFF || CBV1 || Batch 1 || 7C || 09/06/25w24,SHARE,$40,"1,901",2025-06-09,2025-06-17,8
332,CB_2025_Jun_FB_4190_SO_V01_4x5_IMG_EN_New_C-Headline_Evergreen_CTA-NONE_Angle-W_M-NONE_VL-None_G-NONE_P-OG_S-NONE,4190 - BEAT THE HEAT | Refreshing Summer Drink || Enhancements: OFF || CBV1 || Batch 1 || 7C || 16/06/25w25,SHARE,$39,"1,352",2025-06-16,2025-06-23,7
333,CB_2025_May_FB_4158_VK-VG_V08_4x5_VID_EN_Opti_C-Headline_Evergreen_CTA-SALE_Angle-W-B-C_M-NONE_VL-None_G-M_P-OG_S-NONE_FB4104V05,4158 - 4104_V05_VG Opti - VK || Enhancements: OFF || CBV1 || Batch 3-4 || 7C || 09/06/25w24,SHARE,$38,"1,753",2025-06-09,2025-06-17,8
334,CB_2025_Jun_FB_4189_SO_V03_4x5_IMG_EN_New_C-Headline_Evergreen_CTA-NONE_Angle-W_M-NONE_VL-None_G-NONE_P-OG_S-NONE,4189 - food-resembling || Enhancements: OFF || CBV1 || Batch 2 || 7C || 16/06/25w25,SHARE,$38,"1,974",2025-06-16,2025-06-20,4
335,CB_2025_May_FB_4150_DT-KB_V03_4x5_IMG_EN_New_C-Headline_Sale_CTA-65_Angle-None_M-MIX_VL-None_G-M_P-OG_S-NONE,ðŸ‘¨ || Father's Day || Bundle offer  || ASC+ || US || 0% EXISTING CAP || 7C || 07/06/2025 Ad set,SHARE,$37,"1,412",2025-06-09,2025-06-25,16
336,CB_2025_May_FB_4150_DT-KB_V04_4x5_IMG_EN_New_C-Headline_Sale_CTA-65_Angle-None_M-MIX_VL-None_G-M_P-OG_S-NONE,ðŸ‘¨ || Father's Day - Non spenders for 4th July Learnings || Bundle offer || ASC+ || US || 0% EXISTING CAP || 7C || 18/06/2025 Ad set,SHARE,$37,"1,638",2025-06-18,2025-06-22,4
337,CB_2025_Jun_FB_4182_SO_V02_4x5_IMG_EN_New_C-Headline_Evergreen_CTA-NONE_Angle-W_M-NONE_VL-None_G-NONE_P-OG_S-NONE,4182 - Ferret Morning Routine || Enhancements: OFF || CBV1 || Batch 1 || 7C || 16/06/25w25,SHARE,$37,"1,398",2025-06-16,2025-06-20,4
338,CB_2025_Jun_FB_4181_LZ-VG_V01_9x16_VID_EN_New_C-BulletPoints_Evergreen_CTA-65_Angle-W-B_M-MAN_VL-30s_G-M_P-OG_S-NEW,4181 - New angle test manuel vid || Enhancements: OFF || CBV1 || Batch 1 || 7C || 16/06/25w25,VIDEO,$37,"1,408",2025-06-16,2025-06-24,8
339,CB_2025_Feb_FB_3846_SO-DP_V08_1x1_VID_EN_New_C-NONE_Evergreen_CTA-NONE_Angle-W_M-NONE_VL-None_G-NONE_P-GLP1_S-NONE,3846 - GLP1 emotional snacking IMG || Batch 4 || Enhancements: OFF || GLP-1 Booster || 7C1V || 16/06/25w25,SHARE,$36,729,2025-06-16,2025-06-20,4
340,CB_2025_Mar_FB_3949_VK-DP_V01_9x16_VID_EN_New_C-NONE_Evergreen_CTA-NONE_Angle-W-B-C_M-TYL_VL-None_G-M_P-OG_S-NONE,CA || ASC+ || 0% EXISTING || 7DC || 12.05.2025 RESTART Ad set,VIDEO,$36,"1,772",2025-05-12,2025-06-25,44
341,CB_2025_Jun_FB_4180_SO_V15_4x5_IMG_EN_Opti_C-Headline_Evergreen_CTA-NONE_Angle-W_M-NONE_VL-None_G-NONE_P-OG_S-NONE_FB4086V01,4180 - FB4086V01 Opti || Enhancements: OFF || CBV1 || Batch 2 || 7C || 09/06/25w24,SHARE,$36,"1,719",2025-06-16,2025-06-21,5
342,CB_2025_Jun_FB_4196_CHUB-KZ_V03_4x5_IMG_EN_Opti_C-NONE_CTA-NONE_Angle-W_M-NONE_VL-None_TR-None_G-M_P-OG_S-NONE,4196 - CHUB WeightLoss routine || Enhancements: OFF || CBV1 || Batch 1 || 7C || 16/06/25w25,SHARE,$36,"1,235",2025-06-16,2025-06-19,3
343,CB_2025_Feb_FB_3829_DT-DP_V04_9x16_VID_EN_New_C-UGC_Sale_CTA-70_Angle-W_M-TRC_VL-30s_G-F_P-GLP1_S-NEW,3829 - GLP-1 gut health angle VID || Batch 1 || Enhancements: OFF || GLP-1 Booster || 7C1V || 16/06/25w25,VIDEO,$36,624,2025-06-16,2025-06-21,5
344,CB_2025_Feb_FB_3835_DT-RP_V10_1x1_IMG_EN_New_C-News_Evergreen_CTA-NONE_Angle-W_M-NONE_VL-None_G-NONE_P-GLP1_S-NONE,3835 - #126 Help is here GLP IMG || Batch 3 || Enhancements: OFF || GLP-1 Booster || 7C1V || 16/06/25w25,SHARE,$36,"1,054",2025-06-17,2025-06-18,1
345,CB_2025_Jan_FB_3753_SO_V01_4x5_IMG_EN_New_C-Headline_Evergreen_CTA-NONE_Angle-W_M-NONE_VL-None_G-NONE_P-GLP1_S-NONE,GLP-1 ðŸ’œ || ASC+ || US || 5% EXISTING CAP || 7C || 29/05/2025 Ad set,SHARE,$35,957,2025-06-08,2025-06-25,17
346,CB_2025_Jan_FB_3757_LZ-DP_V14_94x5_VID_EN_Opti_C-Dance_Evergreen_CTA-NONE_Angle-W-B_M-Nonie_VL-30s_G-F_P-GLP1_S-WHAT_FB3164V03,GLP-1 ðŸ’œ || ASC+ || US || 5% EXISTING CAP || 7C || 29/05/2025 Ad set,VIDEO,$35,737,2025-06-03,2025-06-25,22
347,CB_2025_May_FB_4149_DT-VG_V03_9x16_VID_EN_Opti_C-Testimonial_Evergreen_CTA-SALE_Angle-W_M-MOOD_VL-30s_G-M_P-OG_S-WOOD_FB3860V03,ðŸ‘¨ || Father's Day || Bundle offer  || ASC+ || US || 0% EXISTING CAP || 7C || 07/06/2025 Ad set,VIDEO,$35,"1,922",2025-06-09,2025-06-25,16
348,CB_2025_Jun_FB_4154_DT-KB_V01_4x5_IMG_EN_Opti_C-NONE_Sale_CTA-65_ngle-W-B_M-NONE_VL-None_G-NONE_P-OG_S-NONE_FB2959V07 - BIOMA,ðŸ‘¨ || Father's Day || Bundle offer  || ASC+ || US || 0% EXISTING CAP || 7C || 07/06/2025 Ad set,SHARE,$34,"1,549",2025-06-07,2025-06-25,18
349,CB_2025_Feb_FB_3834_DT-DP_V02_9x16_VID_EN_New_C-Celebrity_Evergreen_CTA-NONE_Angle-W_M-JOG_VL-None_G-F_P-GLP1_S-NEW,3834 - GLP 1 emotional snacking || Batch 1 || Enhancements: OFF || GLP-1 Booster || 7C1V || 16/06/25w25,POST_DELETED,$34,707,2025-06-17,2025-06-21,4
350,CB_2025_Jun_FB_4176_SO-KB_V09_4x5_IMG_EN_Opti_C-Headline_Evergreen_CTA-NONE_Angle-W_M-NONE_VL-None_G-NONE_P-OG_S-NONE_FB4100V02,4176 - FB4100V02 Opti || Enhancements: OFF || CBV1 || Batch 3 || 7C || 09/06/25w24,SHARE,$34,"1,375",2025-06-09,2025-06-20,11
351,CB_2025_Feb_FB_3835_DT-RP_V08_1x1_IMG_EN_New_C-News_Evergreen_CTA-NONE_Angle-W_M-NONE_VL-None_G-NONE_P-GLP1_S-NONE,3835 - #126 Help is here GLP IMG || Batch 2 || Enhancements: OFF || GLP-1 Booster || 7C1V || 16/06/25w25,SHARE,$33,765,2025-06-17,2025-06-19,2
352,CB_2025_Jun_FB_4186_DT-KB_V02_4x3_IMG_EN_New_C-Trend_Evergreen_CTA-65_Angle-W-B-C_M-MAN_VL-None_G-M_P-OG_S-NEW,4186 - #141 chat guys || Enhancements: OFF || CBV1 || Batch 1 || 7C || 16/06/25w25,SHARE,$32,"1,734",2025-06-16,2025-06-20,4
353,CB_2025_Jun_FB_4177_VK-VG_V12_4x5_IMG_EN_New_C-BulletPoints_Evergreen_CTA-SALE_Angle-W-B-C_M-MAN_VL-None_G-M_P-OG_S-NONE,4177 -opti 4080 - VK || Enhancements: OFF || CBV1 || Batch 3 || 7C || 09/06/25w24,SHARE,$32,"1,659",2025-06-16,2025-06-20,4
354,CB_2025_May_FB_4146_DT_V01_9x16_VID_EN_New_C-BeforeAfter_Evergreen_CTA-SALE_Angle-W_M-JOG_VL-45s_G-F_P-OG_S-MOON,4146 - I was fat || Enhancements: OFF || CBV1 || Batch 1 || 7C || 09/06/25w24,VIDEO,$32,"1,328",2025-06-09,2025-06-16,7
355,CB_2025_Jun_FB_4157_SO-KB_V04_4x5_IMG_EN_New_C-Headline_Evergreen_CTA-NONE_Angle-W_M-NONE_VL-None_G-NONE_P-OG_S-NONE,ðŸ‘¨ || Father's Day - Non spenders for 4th July Learnings || Bundle offer || ASC+ || US || 0% EXISTING CAP || 7C || 18/06/2025 Ad set,SHARE,$31,"1,786",2025-06-18,2025-06-22,4
356,CB_2025_Feb_FB_3846_SO-DP_V15_1x1_VID_EN_New_C-NONE_Evergreen_CTA-NONE_Angle-W_M-NONE_VL-None_G-NONE_P-GLP1_S-NONE,3846 - GLP1 emotional snacking IMG || Batch 3 || Enhancements: OFF || GLP-1 Booster || 7C1V || 16/06/25w25,SHARE,$31,738,2025-06-16,2025-06-20,4
357,CB_2025_Jun_FB_4154_DT-KB_V02_4x5_IMG_EN_Opti_C-Price_Sale_CTA-65_Angle-None_M-NONE_VL-None_G-NONE_P-OG_S-NONE_FB3907V03 - CC,ðŸ‘¨ || Father's Day || Bundle offer  || ASC+ || US || 0% EXISTING CAP || 7C || 07/06/2025 Ad set,SHARE,$31,"1,359",2025-06-07,2025-06-25,18
358,CB_2025_Jun_FB_4151_DT-KB_V03_4x5_IMG_EN_New_C-NONE_Sale_CTA-65_Angle-W-B_M-NONE_VL-None_G-NONE_P-OG_S-NONE_FB2959V07 - BIOMA,ðŸ‘¨ || Father's Day - Non spenders for 4th July Learnings || Bundle offer || ASC+ || US || 0% EXISTING CAP || 7C || 18/06/2025 Ad set,SHARE,$31,"1,937",2025-06-18,2025-06-22,4
359,CB_2025_Jan_FB_3757_LZ-DP_V18_4x5_VID_EN_Opti_C-NegativeMark_Evergreen_CTA-NONE_Angle-W_M-MAG_VL-45s_G-F_P-GLP1_S-MOON_FB3311V13,GLP-1 ðŸ’œ || ASC+ || UK || 5% EXISTING CAP || 7C || 29/05/2025 Ad set,VIDEO,$31,596,2025-06-10,2025-06-24,14
360,CB_2025_Feb_FB_3846_SO-DP_V11_1x1_VID_EN_New_C-NONE_Evergreen_CTA-NONE_Angle-W_M-NONE_VL-None_G-NONE_P-GLP1_S-NONE,3846 - GLP1 emotional snacking IMG || Batch 3 || Enhancements: OFF || GLP-1 Booster || 7C1V || 16/06/25w25,SHARE,$30,650,2025-06-16,2025-06-20,4
361,CB_2025_Jun_FB_4192_DT-VU_V04_4x5_IMG_EN_New_C-Headline_Evergreen_CTA-NONE_Angle-W_M-NONE_VL-None_G-M_P-OG_S-NONE,4192 - #132 Beyond Alpha adaptation - lose X cm of chest fat || Enhancements: OFF || CBV1 || Batch 2 || 7C || 16/06/25w25,SHARE,$29,"1,140",2025-06-16,2025-06-22,6
362,CB_2025_Jan_FB_3757_LZ-DP_V12_4x5_VID_EN_Opti_C-Dance_Evergreen_CTA-NONE_Angle-W-B_M-Nonie_VL-15s_G-F_P-GLP1_S-WHAT_FB3204V01,3757 - GLP1 video winner opti Batch 3+4 || Batch 3 || Enhancements: OFF || GLP-1 Booster || 7C1V || 30/05/25w22,POST_DELETED,$29,"1,127",2025-05-30,2025-06-22,23
363,CB_2025_May_FB_4150_DT-KB_V05_4x5_IMG_EN_New_C-Headline_Sale_CTA-65_Angle-None_M-MIX_VL-None_G-M_P-OG_S-NONE,ðŸ‘¨ || Father's Day - Non spenders for 4th July Learnings || Bundle offer || ASC+ || US || 0% EXISTING CAP || 7C || 18/06/2025 Ad set,SHARE,$28,"1,402",2025-06-18,2025-06-22,4
364,CB_2025_Jan_FB_3757_LZ-DP_V18_4x5_VID_EN_Opti_C-NegativeMark_Evergreen_CTA-NONE_Angle-W_M-MAG_VL-45s_G-F_P-GLP1_S-MOON_FB3311V13,GLP-1 ðŸ’œ || ASC+ || US || 5% EXISTING CAP || 7C || 29/05/2025 Ad set,VIDEO,$27,529,2025-06-02,2025-06-25,23
365,CB_2025_Jun_FB_4176_SO-KB_V03_4x5_IMG_EN_Opti_C-Headline_Evergreen_CTA-NONE_Angle-W_M-NONE_VL-None_G-NONE_P-OG_S-NONE_FB4100V02,4176 - FB4100V02 Opti || Enhancements: OFF || CBV1 || Batch 1 || 7C || 09/06/25w24,SHARE,$27,"1,388",2025-06-09,2025-06-17,8
366,CB_2025_Jun_FB_4169_DT-DP_V01_9x16_VID_EN_New_C-SocialProof_Evergreen_CTA-65_Angle-W-B-C_M-MAN_VL-30s_G-MF_P-OG_S-NEW,"4169 - 3 reasons why, GF POV || Enhancements: OFF || CBV1 || Batch 1 || 7C || 09/06/25w24",VIDEO,$27,768,2025-06-09,2025-06-16,7
367,CB_2025_Jun_FB_4177_VK-VG_V04_4x5_IMG_EN_New_C-BulletPoints_Evergreen_CTA-SALE_Angle-W-B-C_M-MAN_VL-None_G-M_P-OG_S-NONE,4177 -opti 4080 - VK || Enhancements: OFF || CBV1 || Batch 1 || 7C || 09/06/25w24,SHARE,$26,"1,148",2025-06-16,2025-06-20,4
368,CB_2025_May_FB_4140_SO-VG_V11_4x5_IMG_EN_Opti_C-NONE_Evergreen_CTA-NONE_Angle-W_M-NONE_VL-None_G-NONE_P-OG_S-NONE_FB4040V09 - CC,ðŸ‘¨ || Father's Day || Bundle offer  || ASC+ || US || 0% EXISTING CAP || 7C || 07/06/2025 Ad set,SHARE,$26,"1,543",2025-06-07,2025-06-25,18
369,CB_2025_May_FB_4150_DT-KB_V03_4x5_IMG_EN_New_C-Headline_Sale_CTA-65_Angle-None_M-MIX_VL-None_G-M_P-OG_S-NONE,ðŸ‘¨ || Father's Day - Non spenders for 4th July Learnings || Bundle offer || ASC+ || US || 0% EXISTING CAP || 7C || 18/06/2025 Ad set,SHARE,$26,"1,398",2025-06-18,2025-06-22,4
370,CB_2025_Jun_FB_4194_VK-DP_V01_4x5_IMG_EN_New_C-BulletPoints_Evergreen_CTA-SALE_Angle-W-B-C_M-NONE_VL-30s_G-M_P-OG_S-NONE,"4194 - Cardboard, male body IMG - DP-VK || Enhancements: OFF || CBV1 || Batch 2 || 7C || 16/06/25w25",SHARE,$25,"1,352",2025-06-16,2025-06-22,6
371,CB_2025_Jun_FB_4145_DT-KB_V09_4x5_IMG_EN_Opti_C-Testimonial_Sale_CTA-65_Angle-W_M-NONE_VL-None_G-NONE_P-NONE_S-NONE_FB713V04 - BIOMA,ðŸ‘¨ || Father's Day || Bundle offer  || ASC+ || US || 0% EXISTING CAP || 7C || 07/06/2025 Ad set,SHARE,$25,589,2025-06-07,2025-06-16,9
372,CB_2025_Feb_FB_3846_SO-DP_V01_1x1_VID_EN_New_C-NONE_Evergreen_CTA-NONE_Angle-W_M-NONE_VL-None_G-NONE_P-GLP1_S-NONE,3846 - GLP1 emotional snacking IMG || Batch 1 || Enhancements: OFF || GLP-1 Booster || 7C1V || 16/06/25w25,SHARE,$25,810,2025-06-16,2025-06-20,4
373,CB_2025_Jan_FB_3739_DT_V01_4x5_VID_EN_Opti_C-NegativeMark_Sale_CTA-70_Angle-W_M-MIX_VL-45s_G-MF_P-GLP1_S-MOON_FB2263V05,GLP-1 ðŸ’œ || ASC+ || UK || 5% EXISTING CAP || 7C || 29/05/2025 Ad set,VIDEO,$24,477,2025-06-10,2025-06-25,15
374,CB_2025_Jan_FB_3757_LZ-DP_V13_4x5_VID_EN_Opti_C-Pointing_Evergreen_CTA-NONE_Angle-W-B-C_M-Nonie_VL-30s_G-F_P-GLP1_S-WHAT_FB3164V01,3757 - GLP1 video winner opti Batch 3+4 || Batch 3 || Enhancements: OFF || GLP-1 Booster || 7C1V || 30/05/25w22,SHARE,$24,"1,054",2025-05-30,2025-06-25,26
375,CB_2024_Oct_FB_3189_DA_V02_4x5_VID_EN_Opti_C-SingleTesti_Sale_CTA-HLWN_Angle-W_M-TRC_VL-45s_G-F_P-OG_S-MOON_FB2764V04 - Copy,ðŸŒ¶ï¸  || ASC+ || US || 0% EXISTING CAP || 7C || 15/05/2025  Campaign Ad set,SHARE,$24,965,2025-05-15,2025-06-20,36
376,CB_2025_Jun_FB_4198_CHUB-KZ_V02_9x16_VID_EN_Opti_C-NONE_CTA-NONE_Angle-W_M-NONE_VL-None_TR-None_G-M_P-OG_S-NONE.mp4,4198 - CHUB DadBeforeAndAfter || Enhancements: OFF || CBV1 || Batch 1 || 7C || 16/06/25w25,VIDEO,$24,867,2025-06-16,2025-06-22,6
377,CB_2025_Jun_FB_4168_SO-JG_V04_4x5_IMG_EN_New_C-Headline_Evergreen_CTA-NONE_Angle-W_M-NONE_VL-None_G-NONE_P-OG_S-NONE,4168 - #154_IMG_Another you || Enhancements: OFF || CBV1 || Batch 1 || 7C || 09/06/25w24,SHARE,$24,"1,365",2025-06-09,2025-06-25,16
378,CB_2025_Jun_FB_4208_CHUB-KZ_V03_4x5_IMG_EN_Opti_C-NONE_CTA-NONE_Angle-W_M-NONE_VL-None_TR-None_G-M_P-OG_S-NONE.png,4208 - CHUB DadBodAi || Enhancements: OFF || CBV1 || Batch 1 || 7C || 16/06/25w25,SHARE,$23,"1,122",2025-06-16,2025-06-23,7
379,CB_2025_Jun_FB_4182_SO_V03_4x5_IMG_EN_New_C-Headline_Evergreen_CTA-NONE_Angle-W_M-NONE_VL-None_G-NONE_P-OG_S-NONE,4182 - Ferret Morning Routine || Enhancements: OFF || CBV1 || Batch 1 || 7C || 16/06/25w25,SHARE,$23,954,2025-06-16,2025-06-20,4
380,CB_2025_Jan_FB_3753_SO_V01_4x5_IMG_EN_New_C-Headline_Evergreen_CTA-NONE_Angle-W_M-NONE_VL-None_G-NONE_P-GLP1_S-NONE,GLP-1 ðŸ’œ || ASC+ || EU  || 7C || 14/06/2025 Ad set,SHARE,$23,"1,321",2025-06-14,2025-06-18,4
381,CB_2025_Jun_FB_4180_SO_V07_4x5_IMG_EN_Opti_C-Headline_Evergreen_CTA-NONE_Angle-W_M-NONE_VL-None_G-NONE_P-OG_S-NONE_FB4086V01,4180 - FB4086V01 Opti || Enhancements: OFF || CBV1 || Batch 1 || 7C || 09/06/25w24,SHARE,$22,"1,204",2025-06-16,2025-06-20,4
382,CB_2025_Feb_FB_3848_LZ-DP_V03_1x1_IMG_EN_New_C-Headline_Evergreen_CTA-SALE_Angle-GH_M-NONE_VL-None_G-NONE_P-GLP1_S-NONE,3848 - GLP1 simple ads || Batch 1 || Enhancements: OFF || GLP-1 Booster || 7C1V || 16/06/25w25,SHARE,$22,577,2025-06-16,2025-06-19,3
383,CB_2025_Jun_FB_4172_VK-VG_V05_9x16_VID_EN_New_C-BulletPoints_Evergreen_CTA-SALE_Angle-W-B-C_M-MAN_VL-30s_G-M_P-OG_S-WHAT,4172 - new actor test - VK || Enhancements: OFF || CBV1 || Batch 1 || 7C || 15/06/25w25,VIDEO,$21,834,2025-06-16,2025-06-25,9
384,CB_2025_Feb_FB_3827_LZ_V03_1x1_IMG_EN_Opti_C-Headline_Evergreen_CTA-SALE_Angle-W_M-NONE_VL-None_G-M_P-CBV2_S-NONE_FB3705V02,âš«ï¸ US || CBV2 || Advantage+ || 7C || BROAD || Existing_customer_0% || || 24/04/25 Ad set,SHARE,$21,416,2025-04-24,2025-06-25,62
385,CB_2025_May_FB_4158_VK-VG_V10_4x5_VID_EN_Opti_C-Headline_Evergreen_CTA-SALE_Angle-W-B-C_M-NONE_VL-None_G-M_P-OG_S-NONE_FB4104V05,4158 - 4104_V05_VG Opti - VK || Enhancements: OFF || CBV1 || Batch 3-4 || 7C || 09/06/25w24,SHARE,$21,948,2025-06-09,2025-06-17,8
386,CB_2025_Jun_FB_4159_VK_V10_4x5_IMG_EN_New_C-BulletPoints_Evergreen_CTA-SALE_Angle-W-B-C_M-NONE_VL-None_G-M_P-OG_S-NONE,4159 - obsessed is understatement - VK || Enhancements: OFF || CBV1 || Batch 3 || 7C || 09/06/25w24,SHARE,$21,"1,065",2025-06-09,2025-06-20,11
387,CB_2025_May_FB_4140_SO-VG_V10_4x5_IMG_EN_Opti_C-NONE_Evergreen_CTA-NONE_Angle-W_M-NONE_VL-None_G-NONE_P-OG_S-NONE_FB4040V09 - CC,ðŸ‘¨ || Father's Day || Bundle offer  || ASC+ || US || 0% EXISTING CAP || 7C || 07/06/2025 Ad set,SHARE,$21,"1,284",2025-06-07,2025-06-25,18
388,CB_2025_Feb_FB_3794_SO-JT_V01_1x1_IMG_EN_New_C-A-Compare_Evergreen_CTA-NONE_Angle-W_M-NONE_VL-15s_G-NONE_P-GLP1_S-NONE,3794 - Notion Idea #120 Me w/ GLP IMG || Batch 1 || Enhancements: OFF || GLP-1 Booster || 7C1V || 16/06/25w25,SHARE,$21,548,2025-06-16,2025-06-25,9
389,CB_2025_Feb_FB_3795_SO-KB_V03_1x1_IMG_EN_New_C-A-Compare_Evergreen_CTA-NONE_Angle-W_M-NONE_VL-15s_G-NONE_P-GLP1_S-NONE,3795 - Notion Idea #120 ozempic vs GLP-1 || Batch 1 || Enhancements: OFF || GLP-1 Booster || 7C1V || 16/06/25w25,SHARE,$20,800,2025-06-17,2025-06-25,8
390,CB_2025_Jun_FB_4151_DT-KB_V08_4x5_IMG_EN_New_C-NONE_Sale_CTA-65_Angle-W-B_M-NONE_VL-None_G-NONE_P-OG_S-NONE_FB2959V07 - BIOMA,ðŸ‘¨ || Father's Day || Bundle offer  || ASC+ || US || 0% EXISTING CAP || 7C || 07/06/2025 Ad set,SHARE,$20,"1,263",2025-06-07,2025-06-25,18
391,CB_2025_Jun_FB_4206_CHUB-KZ_V01_4x5_IMG_EN_Opti_C-NONE_CTA-NONE_Angle-W_M-NONE_VL-None_TR-None_G-M_P-OG_S-NONE.png,4206 - CHUB NoMoreDadBod  || Enhancements: OFF || CBV1 || Batch 1 || 7C || 16/06/25w25,SHARE,$20,890,2025-06-16,2025-06-23,7
392,CB_2025_Jun_FB_4189_SO_V02_4x5_IMG_EN_New_C-Headline_Evergreen_CTA-NONE_Angle-W_M-NONE_VL-None_G-NONE_P-OG_S-NONE,4189 - food-resembling || Enhancements: OFF || CBV1 || Batch 2 || 7C || 16/06/25w25,SHARE,$20,873,2025-06-16,2025-06-20,4
393,CB_2024_Sep_FB_3175_DA-KB_V01_1x1_IMG_EN_New_C-ADVRT_Evergreen_CTA-NONE_Angle-W_M-NONE_VL-None_G-NONE_P-CBV2_S-NONE_blog_colonbroomvsmammoth_cv_en,CBV2 || Advantage+ || Advertorial || Higher pricing || US || 0% EXISTING CAP || BROAD || 7C || 20/01/25  Campaign Ad set,SHARE,$20,"1,580",2025-01-20,2025-06-25,156
394,CB_2025_Jun_FB_4157_SO-KB_V05_4x5_IMG_EN_New_C-Headline_Evergreen_CTA-NONE_Angle-W_M-NONE_VL-None_G-NONE_P-OG_S-NONE,ðŸ‘¨ || Father's Day - Non spenders for 4th July Learnings || Bundle offer || ASC+ || US || 0% EXISTING CAP || 7C || 18/06/2025 Ad set,SHARE,$19,"1,313",2025-06-18,2025-06-22,4
395,CB_2025_Jun_FB_4180_SO_V14_4x5_IMG_EN_Opti_C-Headline_Evergreen_CTA-NONE_Angle-W_M-NONE_VL-None_G-NONE_P-OG_S-NONE_FB4086V01,4180 - FB4086V01 Opti || Enhancements: OFF || CBV1 || Batch 2 || 7C || 09/06/25w24,SHARE,$18,783,2025-06-16,2025-06-21,5
396,CB_2025_Jun_FB_4151_DT-KB_V05_4x5_IMG_EN_New_C-NONE_Sale_CTA-65_Angle-W-B_M-NONE_VL-None_G-NONE_P-OG_S-NONE_FB2959V07 - BIOMA,ðŸ‘¨ || Father's Day || Bundle offer  || ASC+ || US || 0% EXISTING CAP || 7C || 07/06/2025 Ad set,SHARE,$18,586,2025-06-07,2025-06-25,18
397,CB_2024_Sep_FB_3175_DA-KB_V02_1x1_IMG_EN_New_C-ADVRT_Evergreen_CTA-NONE_Angle-W_M-NONE_VL-None_G-NONE_P-CBV2_S-NONE_blog_colonbroomvsmammoth_cv_en,CBV2 || Advantage+ || Advertorial || Higher pricing || US || 0% EXISTING CAP || BROAD || 7C || 20/01/25  Campaign Ad set,SHARE,$18,"1,300",2025-01-20,2025-06-25,156
398,CB_2025_Jun_FB_4180_SO_V08_4x5_IMG_EN_Opti_C-Headline_Evergreen_CTA-NONE_Angle-W_M-NONE_VL-None_G-NONE_P-OG_S-NONE_FB4086V01,4180 - FB4086V01 Opti || Enhancements: OFF || CBV1 || Batch 1 || 7C || 09/06/25w24,SHARE,$18,896,2025-06-16,2025-06-20,4
399,CB_2025_Jun_FB_4180_SO_V12_4x5_IMG_EN_Opti_C-Headline_Evergreen_CTA-NONE_Angle-W_M-NONE_VL-None_G-NONE_P-OG_S-NONE_FB4086V01,4180 - FB4086V01 Opti || Enhancements: OFF || CBV1 || Batch 2 || 7C || 09/06/25w24,SHARE,$17,937,2025-06-16,2025-06-21,5
400,CB_2025_Feb_FB_3795_SO-KB_V02_1x1_IMG_EN_New_C-A-Compare_Evergreen_CTA-NONE_Angle-W_M-NONE_VL-15s_G-NONE_P-GLP1_S-NONE,3795 - Notion Idea #120 ozempic vs GLP-1 || Batch 1 || Enhancements: OFF || GLP-1 Booster || 7C1V || 16/06/25w25,SHARE,$17,417,2025-06-17,2025-06-25,8
401,CB_2025_Jan_FB_3751_VK-DP_V03_4x5_IMG_EN_New_C-BulletPoints_Sale_CTA-NY_Angle-W-B-C_M-NONE_VL-None_G-M_P-GLP1_S-NONE,3751 - opti 3608 GLP1 - VK-DP || Batch 1 || Enhancements: OFF || GLP-1 Booster || 7C1V || 30/05/25w22,SHARE,$17,839,2025-05-30,2025-06-25,26
402,CB_2025_May_FB_4140_SO-VG_V01_4x5_IMG_EN_Opti_C-NONE_Evergreen_CTA-NONE_Angle-W_M-NONE_VL-None_G-NONE_P-OG_S-NONE_FB3950V11 - CC,ðŸ‘¨ || Father's Day || Bundle offer  || ASC+ || US || 0% EXISTING CAP || 7C || 07/06/2025 Ad set,SHARE,$17,938,2025-06-07,2025-06-25,18
403,CB_2025_Feb_FB_3848_LZ-DP_V08_1x1_IMG_EN_New_C-Headline_Evergreen_CTA-SALE_Angle-GH_M-NONE_VL-None_G-NONE_P-GLP1_S-NONE,3848 - GLP1 simple ads || Batch 2 || Enhancements: OFF || GLP-1 Booster || 7C1V || 16/06/25w25,SHARE,$16,493,2025-06-16,2025-06-19,3
404,CB_2025_Jun_FB_4186_DT-KB_V03_4x3_GIF_EN_New_C-Trend_Evergreen_CTA-65_Angle-W-B-C_M-MAN_VL-15s_G-M_P-OG_S-NEW,4186 - #141 chat guys || Enhancements: OFF || CBV1 || Batch 1 || 7C || 16/06/25w25,VIDEO,$16,791,2025-06-16,2025-06-20,4
405,CB_2025_Jun_FB_4177_VK-VG_V02_4x5_IMG_EN_New_C-BulletPoints_Evergreen_CTA-SALE_Angle-W-B-C_M-MAN_VL-None_G-M_P-OG_S-NONE,4177 -opti 4080 - VK || Enhancements: OFF || CBV1 || Batch 1 || 7C || 09/06/25w24,SHARE,$16,725,2025-06-16,2025-06-20,4
406,CB_2025_Jun_FB_4215_VK-KB_V11_4x5_IMG_EN_New_C-Advertorial_Evergreen_CTA-NONE_Angle-W-B-C_M-NONE_VL-None_G-F_P-GLP1_S-NONE,GLP-1 || Cortisol detox || blog_stressfat_cv_en || Batch 3,SHARE,$15,295,2025-06-19,2025-06-22,3
407,CB_2025_Jun_FB_4172_VK-VG_V01_9x16_VID_EN_New_C-BulletPoints_Evergreen_CTA-SALE_Angle-W-B-C_M-MAN_VL-30s_G-M_P-OG_S-WHAT,4172 - new actor test - VK || Enhancements: OFF || CBV1 || Batch 1 || 7C || 15/06/25w25,VIDEO,$15,715,2025-06-16,2025-06-25,9
408,CB_2025_Jun_FB_4157_SO-KB_V01_4x5_IMG_EN_New_C-Headline_Evergreen_CTA-NONE_Angle-W_M-NONE_VL-None_G-NONE_P-OG_S-NONE,ðŸ‘¨ || Father's Day - Non spenders for 4th July Learnings || Bundle offer || ASC+ || US || 0% EXISTING CAP || 7C || 18/06/2025 Ad set,SHARE,$15,805,2025-06-18,2025-06-22,4
409,CB_2025_Jun_FB_4172_VK-VG_V02_9x16_VID_EN_New_C-BulletPoints_Evergreen_CTA-SALE_Angle-W-B-C_M-MAN_VL-30s_G-M_P-OG_S-WHAT,4172 - new actor test - VK || Enhancements: OFF || CBV1 || Batch 1 || 7C || 15/06/25w25,VIDEO,$15,651,2025-06-16,2025-06-25,9
410,CB_2025_May_FB_4140_SO-VG_V15_4x5_IMG_EN_Opti_C-NONE_Evergreen_CTA-NONE_Angle-W_M-NONE_VL-None_G-NONE_P-OG_S-NONE_FB4086V01 - BIOMA,ðŸ‘¨ || Father's Day || Bundle offer  || ASC+ || US || 0% EXISTING CAP || 7C || 07/06/2025 Ad set,SHARE,$15,979,2025-06-07,2025-06-25,18
411,CB_2025_Jun_FB_4215_VK-KB_V01_4x5_IMG_EN_New_C-Advertorial_Evergreen_CTA-NONE_Angle-W-B-C_M-NONE_VL-None_G-F_P-GLP1_S-NONE_blog_stressfat_cv_en,GLP-1 || Cortisol detox || blog_stressfat_cv_en || Batch 1,SHARE,$14,357,2025-06-19,2025-06-25,6
412,CB_2025_Apr_FB_4028_LZ-DT_V02_9x16_VID_EN_New_C-BulletPoints_Sale_CTA-SPRING_Angle-W-B-C_M-MAG_VL-30s_G-F_P-OG_S-STARRY,CBV2 || US || Manual Bid: ROAS GOAL: 1.00 -> 1.1 || 7DC || 22/01/2025,VIDEO,$14,599,2025-04-28,2025-06-25,58
413,CB_2025_Jun_FB_4201_LZ-VU_V01_9x16_GIF_EN_New_C-Sale_Evergreen_CTA-SALE_Angle-None_M-NONE_VL-7s_G-NONE_P-Combo_S-NONE,CC and Bioma end cards as ads || Enhancements: OFF || CBV1 || Batch 1 || 7C || 12/06/25w24,SHARE,$14,349,2025-06-12,2025-06-16,4
414,CB_2025_Jan_FB_3744_SO_V07_4x5_IMG_EN_New_C-Headline_Evergreen_CTA-NONE_Angle-W_M-NONE_VL-None_G-NONE_P-GLP1_S-NONE,GLP-1 ðŸ’œ || ASC+ || EU  || 7C || 14/06/2025 Ad set,SHARE,$14,394,2025-06-14,2025-06-18,4
415,CB_2025_Feb_FB_3816_VK-DP_V04_9x16_VID_EN_New_C-BulletPoints_Evergreen_CTA-70_Angle-W-B-C_M-JOG_VL-None_G-F_P-GLP1_S-NEW,3816 - Winner VLOG ad to GLP - VK-DP || Batch 1 || Enhancements: OFF || GLP-1 Booster || 7C1V || 16/06/25w25,VIDEO,$14,284,2025-06-16,2025-06-25,9
416,CB_2025_Jun_FB_4205_VK-VG_V13_4x5_IMG_EN_New_C-BulletPoints_Evergreen_CTA-SALE_Angle-W-B-C_M-NONE_VL-30s_G-M_P-OG_S-NONE,"4205 - 4143_IMG opti_trending layouts,styles,winners || Enhancements: OFF || CBV1 || Batch 4 || 7C || 16/06/25w25",SHARE,$14,612,2025-06-16,2025-06-21,5
417,CB_2025_Feb_FB_3835_DT-RP_V06_1x1_IMG_EN_New_C-News_Evergreen_CTA-NONE_Angle-W_M-NONE_VL-None_G-NONE_P-GLP1_S-NONE,3835 - #126 Help is here GLP IMG || Batch 2 || Enhancements: OFF || GLP-1 Booster || 7C1V || 16/06/25w25,SHARE,$14,318,2025-06-17,2025-06-19,2
418,CB_2025_Jun_FB_4180_SO_V10_4x5_IMG_EN_Opti_C-Headline_Evergreen_CTA-NONE_Angle-W_M-NONE_VL-None_G-NONE_P-OG_S-NONE_FB4086V01,4180 - FB4086V01 Opti || Enhancements: OFF || CBV1 || Batch 2 || 7C || 09/06/25w24,SHARE,$14,500,2025-06-16,2025-06-21,5
419,CB_2025_Feb_FB_3816_VK-DP_V03_9x16_VID_EN_New_C-BulletPoints_Evergreen_CTA-70_Angle-W-B-C_M-JOG_VL-None_G-F_P-GLP1_S-NEW,3816 - Winner VLOG ad to GLP - VK-DP || Batch 1 || Enhancements: OFF || GLP-1 Booster || 7C1V || 16/06/25w25,VIDEO,$14,206,2025-06-16,2025-06-25,9
420,CB_2025_May_FB_4150_DT-KB_V06_4x5_IMG_EN_New_C-Headline_Sale_CTA-65_Angle-None_M-MIX_VL-None_G-M_P-OG_S-NONE,ðŸ‘¨ || Father's Day || Bundle offer  || ASC+ || US || 0% EXISTING CAP || 7C || 07/06/2025 Ad set,SHARE,$14,586,2025-06-09,2025-06-25,16
421,CB_2025_Jun_FB_4176_SO-KB_V04_4x5_IMG_EN_Opti_C-Headline_Evergreen_CTA-NONE_Angle-W_M-NONE_VL-None_G-NONE_P-OG_S-NONE_FB4100V02,4176 - FB4100V02 Opti || Enhancements: OFF || CBV1 || Batch 1 || 7C || 09/06/25w24,SHARE,$14,544,2025-06-09,2025-06-17,8
422,CB_2025_Jun_FB_4176_SO-KB_V06_4x5_IMG_EN_Opti_C-Headline_Evergreen_CTA-NONE_Angle-W_M-NONE_VL-None_G-NONE_P-OG_S-NONE_FB4100V02,4176 - FB4100V02 Opti || Enhancements: OFF || CBV1 || Batch 2 || 7C || 09/06/25w24,SHARE,$13,577,2025-06-09,2025-06-17,8
423,CB_2025_May_FB_4114_LZ-VG_V09_4x5_IMG_EN_New_C-Headline_Evergreen_CTA-NONE_Angle-C_M-NONE_VL-None_G-M_P-NONE_S-NONE,4114 - FOMO angle || Enhancements: OFF || CBV1 || Batch 3 || 7C || 02/06/25w23,SHARE,$13,544,2025-06-02,2025-06-25,23
424,CB_2025_Jun_FB_4197_CHUB-KZ_V01_4x5_IMG_EN_Opti_C-NONE_CTA-NONE_Angle-W_M-NONE_VL-None_TR-None_G-M_P-OG_S-NONE,4197 - CHUB ToMyBigGuys  || Enhancements: OFF || CBV1 || Batch 1 || 7C || 16/06/25w25,SHARE,$13,711,2025-06-16,2025-06-25,9
425,CB_2025_Jun_FB_4145_SO_V01_4x5_IMG_EN_Opti_C-NONE_Evergreen_CTA-NONE_Angle-W-B-C_M-NONE_VL-None_G-NONE_P-OG_S-NONE_FB3950V16,4145 - FB3950V16 Opti || Enhancements: OFF || CBV1 || Batch 1 || 7C || 09/06/25w24,SHARE,$13,641,2025-06-09,2025-06-16,7
426,CB_2025_May_FB_4080_LZ-VG_V03_4x5_IMG_EN_New_C-Headline_Evergreen_CTA-NONE_Angle-W_M-NONE_VL-None_G-M_P-OG_S-NONE - Copy,âš«ï¸ US || CBV2 || Advantage+ || 7C || BROAD || Existing_customer_0% || || 24/04/25 Ad set,SHARE,$12,462,2025-05-20,2025-06-25,36
427,CB_2023_May_FB_2103_MB_V02_9x16_VID_EN_Opti_C-Sale_CTA-SMR_Pain-W_M-JOG_VL-30s_TR-None_G-M-F_P-None_S-What,US || Manual Bid || BFCM || COST CAP 71 || 1C || 15/11/24,VIDEO,$12,503,2024-11-15,2025-06-25,222
428,CB_2025_Jun_FB_4145_DT-KB_V06_4x5_IMG_EN_Opti_C-BulletPoints_Sale_CTA-65_Angle-W-B-C_M-NONE_VL-None_G-M_P-OG_S-NONE_FB3891V05 - BIOMA,ðŸ‘¨ || Father's Day || Bundle offer  || ASC+ || US || 0% EXISTING CAP || 7C || 07/06/2025 Ad set,SHARE,$12,365,2025-06-07,2025-06-25,18
429,CB_2025_Feb_FB_3774_SO-JT_V04_1x1_IMG_EN_New_C-Headline_Evergreen_CTA-NONE_Angle-W_M-NONE_VL-15s_G-NONE_P-GLP1_S-NONE,3774 - #114 SMASH GLP IMG || Batch 2 || Enhancements: OFF || GLP-1 Booster || 7C1V || 09/06/25w23,SHARE,$12,340,2025-06-09,2025-06-24,15
430,CB_2025_Feb_FB_3846_SO-DP_V04_1x1_VID_EN_New_C-NONE_Evergreen_CTA-NONE_Angle-W_M-NONE_VL-None_G-NONE_P-GLP1_S-NONE,3846 - GLP1 emotional snacking IMG || Batch 4 || Enhancements: OFF || GLP-1 Booster || 7C1V || 16/06/25w25,SHARE,$12,369,2025-06-16,2025-06-20,4
431,IM_CB5.png,US || VSL || Aff's image || Landing: Pre-1 Real doctor || 1C || 22/06/25,SHARE,$11,241,2025-06-22,2025-06-23,1
432,CB_2025_Feb_FB_3846_SO-DP_V03_1x1_VID_EN_New_C-NONE_Evergreen_CTA-NONE_Angle-W_M-NONE_VL-None_G-NONE_P-GLP1_S-NONE,3846 - GLP1 emotional snacking IMG || Batch 3 || Enhancements: OFF || GLP-1 Booster || 7C1V || 16/06/25w25,SHARE,$11,406,2025-06-16,2025-06-20,4
433,CB_2025_May_FB_4140_SO-VG_V15_4x5_IMG_EN_Opti_C-NONE_Evergreen_CTA-NONE_Angle-W_M-NONE_VL-None_G-NONE_P-OG_S-NONE_FB4086V01 - CC,ðŸ‘¨ || Father's Day || Bundle offer  || ASC+ || US || 0% EXISTING CAP || 7C || 07/06/2025 Ad set,SHARE,$11,589,2025-06-07,2025-06-25,18
434,CB_2025_Jun_FB_4196_CHUB-KZ_V04_4x5_IMG_EN_Opti_C-NONE_CTA-NONE_Angle-W_M-NONE_VL-None_TR-None_G-M_P-OG_S-NONE,4196 - CHUB WeightLoss routine || Enhancements: OFF || CBV1 || Batch 1 || 7C || 16/06/25w25,SHARE,$11,390,2025-06-16,2025-06-19,3
435,CB_2025_Jun_FB_4181_LZ-VG_V02_9x16_VID_EN_New_C-BulletPoints_Evergreen_CTA-65_Angle-W-B_M-MAN_VL-30s_G-M_P-OG_S-NEW,4181 - New angle test manuel vid || Enhancements: OFF || CBV1 || Batch 1 || 7C || 16/06/25w25,VIDEO,$11,351,2025-06-16,2025-06-25,9
436,CB_2023_Dec_FB_2712_RS-DP_V02_1x1_VID_EN_Opti_C-WrittenTesti_CTA-SALE_Pain-W-B-C_M-NONE_VL-None_TR-None_G-NONE_P-V2_S-NONE_FB2227V08,âš«ï¸ US || CBV2 || Advantage+ || 7C || BROAD || Existing_customer_0% || || 24/04/25 Ad set,VIDEO,$11,315,2025-04-24,2025-06-25,62
437,CB_2025_Jun_FB_4154_DT-KB_V03_4x5_IMG_EN_Opti_C-Headline_Sale_CTA-65_Angle-W_M-NONE_VL-None_G-NONE_P-OG_S-NONE_3608V03 - BIOMA,ðŸ‘¨ || Father's Day || Bundle offer  || ASC+ || US || 0% EXISTING CAP || 7C || 07/06/2025 Ad set,SHARE,$11,610,2025-06-07,2025-06-25,18
438,CB_2025_May_FB_4140_SO-VG_V02_4x5_IMG_EN_Opti_C-NONE_Evergreen_CTA-NONE_Angle-W_M-NONE_VL-None_G-NONE_P-OG_S-NONE_FB3950V11 - BIOMA,ðŸ‘¨ || Father's Day || Bundle offer  || ASC+ || US || 0% EXISTING CAP || 7C || 07/06/2025 Ad set,SHARE,$11,688,2025-06-07,2025-06-25,18
439,CB_2025_Jun_FB_4182_SO_V04_4x5_IMG_EN_New_C-Headline_Evergreen_CTA-NONE_Angle-W_M-NONE_VL-None_G-NONE_P-OG_S-NONE,4182 - Ferret Morning Routine || Enhancements: OFF || CBV1 || Batch 1 || 7C || 16/06/25w25,SHARE,$11,520,2025-06-16,2025-06-20,4
440,CB_2025_Jun_FB_4168_SO-JG_V05_4x5_IMG_EN_New_C-Headline_Evergreen_CTA-NONE_Angle-W_M-NONE_VL-None_G-NONE_P-OG_S-NONE,4168 - #154_IMG_Another you || Enhancements: OFF || CBV1 || Batch 1 || 7C || 09/06/25w24,SHARE,$10,243,2025-06-09,2025-06-25,16
441,CB_2025_Feb_FB_3831_LZ-DP_V04_1x1_IMG_EN_Opti_C-BeforeAfter_Evergreen_CTA-NONE_Angle-Horm_M-NONE_VL-None_G-NONE_P-GLP1_S-NONE_FB3723V07,3831 - GLP1 Hormones and energy || Batch 1 || Enhancements: OFF || GLP-1 Booster || 7C1V || 16/06/25w25,SHARE,$10,322,2025-06-16,2025-06-20,4
442,CB_2025_Jun_FB_4145_SO_V13_4x5_IMG_EN_Opti_C-NONE_Evergreen_CTA-NONE_Angle-W-B-C_M-NONE_VL-None_G-NONE_P-OG_S-NONE_FB3950V16,4145 - FB3950V16 Opti || Enhancements: OFF || CBV1 || Batch 3 || 7C || 09/06/25w24,SHARE,$10,469,2025-06-09,2025-06-17,8
443,CB_2025_Jun_FB_4183_SO_V04_4x5_IMG_EN_New_C-Headline_Evergreen_CTA-NONE_Angle-W_M-NONE_VL-None_G-NONE_P-OG_S-NONE,4183 - Pooping a Cactus IMG || Enhancements: OFF || CBV1 || Batch 1 || 7C || 16/06/25w25,SHARE,$10,340,2025-06-16,2025-06-21,5
444,CB_2025_Jun_FB_4177_VK-VG_V09_4x5_IMG_EN_New_C-BulletPoints_Evergreen_CTA-SALE_Angle-W-B-C_M-MAN_VL-None_G-M_P-OG_S-NONE,4177 -opti 4080 - VK || Enhancements: OFF || CBV1 || Batch 3 || 7C || 09/06/25w24,SHARE,$9,441,2025-06-16,2025-06-20,4
445,CB_2025_Jun_FB_4175_SO_V05_4x5_IMG_EN_New_C-Headline_Evergreen_CTA-NONE_Angle-W_M-NONE_VL-None_G-NONE_P-OG_S-NONE,4175 - Vintage Collage IMG || Enhancements: OFF || CBV1 || Batch 2 || 7C || 09/06/25w24,SHARE,$9,390,2025-06-09,2025-06-20,11
446,CB_2025_Jun_FB_4197_CHUB-KZ_V04_4x5_IMG_EN_Opti_C-NONE_CTA-NONE_Angle-W_M-NONE_VL-None_TR-None_G-M_P-OG_S-NONE,4197 - CHUB ToMyBigGuys  || Enhancements: OFF || CBV1 || Batch 1 || 7C || 16/06/25w25,SHARE,$9,383,2025-06-16,2025-06-25,9
447,CB_2025_May_FB_4140_SO-VG_V16_4x5_IMG_EN_Opti_C-NONE_Evergreen_CTA-NONE_Angle-W_M-NONE_VL-None_G-NONE_P-OG_S-NONE_FB4086V01 - CC,ðŸ‘¨ || Father's Day || Bundle offer  || ASC+ || US || 0% EXISTING CAP || 7C || 07/06/2025 Ad set,SHARE,$9,428,2025-06-07,2025-06-25,18
448,CB_2025_Feb_FB_3816_VK-DP_V02_9x16_VID_EN_New_C-BulletPoints_Evergreen_CTA-70_Angle-W-B-C_M-JOG_VL-None_G-F_P-GLP1_S-FRIGGA,3816 - Winner VLOG ad to GLP - VK-DP || Batch 1 || Enhancements: OFF || GLP-1 Booster || 7C1V || 16/06/25w25,VIDEO,$8,185,2025-06-16,2025-06-25,9
449,CB_2025_Jun_FB_4180_SO_V13_4x5_IMG_EN_Opti_C-Headline_Evergreen_CTA-NONE_Angle-W_M-NONE_VL-None_G-NONE_P-OG_S-NONE_FB4086V01,4180 - FB4086V01 Opti || Enhancements: OFF || CBV1 || Batch 2 || 7C || 09/06/25w24,SHARE,$8,487,2025-06-16,2025-06-21,5
450,CB_2025_Jun_FB_4194_VK-DP_V05_4x5_IMG_EN_New_C-BulletPoints_Evergreen_CTA-SALE_Angle-W-B-C_M-NONE_VL-30s_G-M_P-OG_S-NONE,"4194 - Cardboard, male body IMG - DP-VK || Enhancements: OFF || CBV1 || Batch 2 || 7C || 16/06/25w25",SHARE,$8,405,2025-06-16,2025-06-22,6
451,CB_2025_Jun_FB_4151_DT-KB_V01_4x5_IMG_EN_New_C-NONE_Sale_CTA-65_Angle-W-B_M-NONE_VL-None_G-NONE_P-OG_S-NONE_FB2959V07 - BIOMA,ðŸ‘¨ || Father's Day || Bundle offer  || ASC+ || US || 0% EXISTING CAP || 7C || 07/06/2025 Ad set,SHARE,$8,347,2025-06-07,2025-06-25,18
452,CB_2025_Mar_FB_3903_VK_V01_9x16_VID_EN_New_C-BulletPoints_Evergreen_CTA-65_Angle-W-B-C_M-MIX_VL-30s_G-MF_P-OG_S-NEW,âš«ï¸ US || CBV2 || Advantage+ || 7C || BROAD || Existing_customer_0% || || 24/04/25 Ad set,VIDEO,$8,249,2025-05-13,2025-06-25,43
453,CB_2025_May_FB_4158_VK-VG_V11_4x5_VID_EN_Opti_C-Headline_Evergreen_CTA-SALE_Angle-W-B-C_M-NONE_VL-None_G-M_P-OG_S-NONE_FB4104V05,4158 - 4104_V05_VG Opti - VK || Enhancements: OFF || CBV1 || Batch 3-4 || 7C || 09/06/25w24,SHARE,$8,354,2025-06-09,2025-06-17,8
454,CB_2025_Jun_FB_4194_VK-DP_V03_4x5_IMG_EN_New_C-BulletPoints_Evergreen_CTA-SALE_Angle-W-B-C_M-NONE_VL-30s_G-M_P-OG_S-NONE,"4194 - Cardboard, male body IMG - DP-VK || Enhancements: OFF || CBV1 || Batch 2 || 7C || 16/06/25w25",SHARE,$8,347,2025-06-16,2025-06-19,3
455,CB_2025_Jun_FB_4145_DT-KB_V07_4x5_IMG_EN_Opti_C-NONE_Sale_CTA-65_Angle-W_M-NONE_VL-None_G-NONE_P-NONE_S-NONE_FB3723V04 - CC,ðŸ‘¨ || Father's Day || Bundle offer  || ASC+ || US || 0% EXISTING CAP || 7C || 07/06/2025 Ad set,SHARE,$8,416,2025-06-07,2025-06-25,18
456,CB_2025_Jun_FB_4194_VK-DP_V02_4x5_IMG_EN_New_C-BulletPoints_Evergreen_CTA-SALE_Angle-W-B-C_M-NONE_VL-30s_G-M_P-OG_S-NONE,"4194 - Cardboard, male body IMG - DP-VK || Enhancements: OFF || CBV1 || Batch 2 || 7C || 16/06/25w25",SHARE,$8,404,2025-06-16,2025-06-22,6
457,CB_2025_May_FB_4140_SO-VG_V01_4x5_IMG_EN_Opti_C-NONE_Evergreen_CTA-NONE_Angle-W_M-NONE_VL-None_G-NONE_P-OG_S-NONE_FB3950V11 - BIOMA,ðŸ‘¨ || Father's Day || Bundle offer  || ASC+ || US || 0% EXISTING CAP || 7C || 07/06/2025 Ad set,SHARE,$8,506,2025-06-07,2025-06-25,18
458,CB_2025_Feb_FB_3831_LZ-DP_V02_1x1_IMG_EN_Opti_C-BeforeAfter_Evergreen_CTA-NONE_Angle-Horm_M-NONE_VL-None_G-NONE_P-GLP1_S-NONE_FB3723V07,3831 - GLP1 Hormones and energy || Batch 1 || Enhancements: OFF || GLP-1 Booster || 7C1V || 16/06/25w25,SHARE,$8,182,2025-06-16,2025-06-20,4
459,CB_2025_Jun_FB_4205_VK-VG_V10_4x5_IMG_EN_New_C-BulletPoints_Evergreen_CTA-SALE_Angle-W-B-C_M-NONE_VL-30s_G-M_P-OG_S-NONE,"4205 - 4143_IMG opti_trending layouts,styles,winners || Enhancements: OFF || CBV1 || Batch 3 || 7C || 16/06/25w25",SHARE,$7,374,2025-06-16,2025-06-20,4
460,CB_2025_Jun_FB_4145_DT-KB_V07_4x5_IMG_EN_Opti_C-NONE_Sale_CTA-65_Angle-W_M-NONE_VL-None_G-NONE_P-NONE_S-NONE_FB3723V04 - BIOMA,ðŸ‘¨ || Father's Day || Bundle offer  || ASC+ || US || 0% EXISTING CAP || 7C || 07/06/2025 Ad set,SHARE,$7,349,2025-06-07,2025-06-25,18
461,CB_2025_Jun_FB_4151_DT-KB_V07_4x5_IMG_EN_New_C-NONE_Sale_CTA-65_Angle-W-B_M-NONE_VL-None_G-NONE_P-OG_S-NONE_FB2959V07 - BIOMA,ðŸ‘¨ || Father's Day || Bundle offer  || ASC+ || US || 0% EXISTING CAP || 7C || 07/06/2025 Ad set,SHARE,$7,411,2025-06-07,2025-06-25,18
462,CB_2025_Jun_FB_4151_DT-KB_V08_4x5_IMG_EN_New_C-NONE_Sale_CTA-65_Angle-W-B_M-NONE_VL-None_G-NONE_P-OG_S-NONE_FB2959V07 - CC,ðŸ‘¨ || Father's Day || Bundle offer  || ASC+ || US || 0% EXISTING CAP || 7C || 07/06/2025 Ad set,SHARE,$7,435,2025-06-07,2025-06-25,18
463,CB_2025_May_FB_4140_SO-VG_V13_4x5_IMG_EN_Opti_C-NONE_Evergreen_CTA-NONE_Angle-W_M-NONE_VL-None_G-NONE_P-OG_S-NONE_FB4086V01 - BIOMA,ðŸ‘¨ || Father's Day || Bundle offer  || ASC+ || US || 0% EXISTING CAP || 7C || 07/06/2025 Ad set,SHARE,$7,594,2025-06-07,2025-06-25,18
464,CB_2025_May_FB_4140_SO-VG_V14_4x5_IMG_EN_Opti_C-NONE_Evergreen_CTA-NONE_Angle-W_M-NONE_VL-None_G-NONE_P-OG_S-NONE_FB4086V01 - BIOMA,ðŸ‘¨ || Father's Day || Bundle offer  || ASC+ || US || 0% EXISTING CAP || 7C || 07/06/2025 Ad set,SHARE,$7,472,2025-06-07,2025-06-25,18
465,CB_2025_May_FB_4140_SO-VG_V03_4x5_IMG_EN_Opti_C-NONE_Evergreen_CTA-NONE_Angle-W_M-NONE_VL-None_G-NONE_P-OG_S-NONE_FB3950V11 - BIOMA,ðŸ‘¨ || Father's Day || Bundle offer  || ASC+ || US || 0% EXISTING CAP || 7C || 07/06/2025 Ad set,SHARE,$7,418,2025-06-07,2025-06-25,18
466,CB_2025_Jun_FB_4190_SO_V04_4x5_IMG_EN_New_C-Headline_Evergreen_CTA-NONE_Angle-W_M-NONE_VL-None_G-NONE_P-OG_S-NONE,4190 - BEAT THE HEAT | Refreshing Summer Drink || Enhancements: OFF || CBV1 || Batch 2 || 7C || 16/06/25w25,SHARE,$7,204,2025-06-16,2025-06-20,4
467,CB_2025_May_FB_4140_SO-VG_V07_4x5_IMG_EN_Opti_C-NONE_Evergreen_CTA-NONE_Angle-W_M-NONE_VL-None_G-NONE_P-OG_S-NONE_FB3961V07 - CC,ðŸ‘¨ || Father's Day || Bundle offer  || ASC+ || US || 0% EXISTING CAP || 7C || 07/06/2025 Ad set,SHARE,$7,328,2025-06-07,2025-06-25,18
468,CB_2024_Sep_FB_3175_DA-KB_V03_1x1_IMG_EN_New_C-ADVRT_Evergreen_CTA-NONE_Angle-W_M-NONE_VL-None_G-NONE_P-CBV2_S-NONE_blog_colonbroomvsmammoth_cv_en,CBV2 || Advantage+ || Advertorial || Higher pricing || US || 0% EXISTING CAP || BROAD || 7C || 20/01/25  Campaign Ad set,SHARE,$7,533,2025-01-20,2025-06-25,156
469,CB_2025_Jun_FB_4180_SO_V05_4x5_IMG_EN_Opti_C-Headline_Evergreen_CTA-NONE_Angle-W_M-NONE_VL-None_G-NONE_P-OG_S-NONE_FB4086V01,4180 - FB4086V01 Opti || Enhancements: OFF || CBV1 || Batch 1 || 7C || 09/06/25w24,SHARE,$7,364,2025-06-16,2025-06-20,4
470,CB_2025_Jun_FB_4195_DT-VG_V04_9x16_VID_EN_Opti_C-BulletPoints_Evergreen_CTA-SALE_Angle-W_M-JANW_VL-30s_G-M_P-OG_S-WHAT_FB3883V05_1,4195 - #153 CB as main daily routine || Enhancements: OFF || CBV1 || Batch 2 || 7C || 16/06/25w25,VIDEO,$7,346,2025-06-16,2025-06-23,7
471,CB_2025_Jun_FB_4177_VK-VG_V07_4x5_IMG_EN_New_C-BulletPoints_Evergreen_CTA-SALE_Angle-W-B-C_M-MAN_VL-None_G-M_P-OG_S-NONE,4177 -opti 4080 - VK || Enhancements: OFF || CBV1 || Batch 2 || 7C || 09/06/25w24,SHARE,$7,259,2025-06-16,2025-06-25,9
472,CB_2025_Jun_FB_4180_SO_V06_4x5_IMG_EN_Opti_C-Headline_Evergreen_CTA-NONE_Angle-W_M-NONE_VL-None_G-NONE_P-OG_S-NONE_FB4086V01,4180 - FB4086V01 Opti || Enhancements: OFF || CBV1 || Batch 1 || 7C || 09/06/25w24,SHARE,$6,316,2025-06-16,2025-06-20,4
473,CB_2025_Jan_FB_3763_SO-DP_V02_1x1_IMG_EN_New_C-Headline_Evergreen_CTA-NONE_Angle-W_M-NONE_VL-None_G-NONE_P-GLP1_S-NONE,3763 - #117 Notion idea GLP IMG || Batch 1 || Enhancements: OFF || GLP-1 Booster || 7C1V || 09/06/25w23,SHARE,$6,171,2025-06-09,2025-06-16,7
474,CB_2025_Feb_FB_3846_SO-DP_V20_1x1_VID_EN_New_C-NONE_Evergreen_CTA-NONE_Angle-W_M-NONE_VL-None_G-NONE_P-GLP1_S-NONE,3846 - GLP1 emotional snacking IMG || Batch 4 || Enhancements: OFF || GLP-1 Booster || 7C1V || 16/06/25w25,SHARE,$6,182,2025-06-16,2025-06-20,4
475,CB_2025_Jun_FB_4183_SO_V03_4x5_IMG_EN_New_C-Headline_Evergreen_CTA-NONE_Angle-W_M-NONE_VL-None_G-NONE_P-OG_S-NONE,4183 - Pooping a Cactus IMG || Enhancements: OFF || CBV1 || Batch 1 || 7C || 16/06/25w25,SHARE,$6,153,2025-06-16,2025-06-21,5
476,CB_2025_Jun_FB_4180_SO_V02_4x5_IMG_EN_Opti_C-Headline_Evergreen_CTA-NONE_Angle-W_M-NONE_VL-None_G-NONE_P-OG_S-NONE_FB4086V01,4180 - FB4086V01 Opti || Enhancements: OFF || CBV1 || Batch 1 || 7C || 09/06/25w24,SHARE,$6,288,2025-06-16,2025-06-20,4
477,CB_2025_Jun_FB_4205_VK-VG_V16_4x5_IMG_EN_New_C-BulletPoints_Evergreen_CTA-SALE_Angle-W-B-C_M-NONE_VL-30s_G-M_P-OG_S-NONE,"4205 - 4143_IMG opti_trending layouts,styles,winners || Enhancements: OFF || CBV1 || Batch 4 || 7C || 16/06/25w25",SHARE,$6,229,2025-06-16,2025-06-21,5
478,CB_2025_Jun_FB_4192_DT-VU_V02_4x5_IMG_EN_New_C-Headline_Evergreen_CTA-NONE_Angle-W_M-NONE_VL-None_G-M_P-OG_S-NONE,4192 - #132 Beyond Alpha adaptation - lose X cm of chest fat || Enhancements: OFF || CBV1 || Batch 2 || 7C || 16/06/25w25,SHARE,$6,264,2025-06-16,2025-06-22,6
479,CB_2025_Jun_FB_4159_VK_V11_4x5_IMG_EN_New_C-BulletPoints_Evergreen_CTA-SALE_Angle-W-B-C_M-NONE_VL-None_G-M_P-OG_S-NONE,4159 - obsessed is understatement - VK || Enhancements: OFF || CBV1 || Batch 3 || 7C || 09/06/25w24,SHARE,$5,320,2025-06-09,2025-06-20,11
480,CB_2025_Jun_FB_4171_DT_V04_9x16_VID_EN_New_C-Trend_Sale_CTA-65_Angle-W_M-POW_VL-30s_G-M_P-OG_S-NEW_FB3863V03 - BIOMA,ðŸ‘¨ || Father's Day || Bundle offer  || ASC+ || US || 0% EXISTING CAP || 7C || 07/06/2025 Ad set,VIDEO,$5,252,2025-06-07,2025-06-25,18
481,CB_2025_Jan_FB_3756_VK-DP_V04_4x5_IMG_EN_New_C-BulletPoints_Evergreen_CTA-NONE_Angle-W-B-C_M-NONE_VL-None_G-M_P-GLP1_S-NONE,3756 - opti 2834 GLP1 || Batch 1 || Enhancements: OFF || GLP-1 Booster || 7C1V || 30/05/25w22,SHARE,$5,251,2025-05-30,2025-06-21,22
482,CB_2025_May_FB_4114_LZ-VG_V08_4x5_IMG_EN_New_C-Headline_Evergreen_CTA-NONE_Angle-C_M-NONE_VL-None_G-M_P-NONE_S-NONE,4114 - FOMO angle || Enhancements: OFF || CBV1 || Batch 3 || 7C || 02/06/25w23,SHARE,$5,281,2025-06-02,2025-06-25,23
483,CB_2025_Jun_FB_4197_CHUB-KZ_V03_4x5_IMG_EN_Opti_C-NONE_CTA-NONE_Angle-W_M-NONE_VL-None_TR-None_G-M_P-OG_S-NONE,4197 - CHUB ToMyBigGuys  || Enhancements: OFF || CBV1 || Batch 1 || 7C || 16/06/25w25,SHARE,$5,243,2025-06-16,2025-06-25,9
484,CB_2025_Jun_FB_4207_CHUB-KZ_V01_9x16_VID_EN_Opti_C-NONE_CTA-NONE_Angle-W_M-NONE_VL-None_TR-None_G-M_P-OG_S-NONE,4207 - CHUB SocialMediaDadBod || Enhancements: OFF || CBV1 || Batch 1 || 7C || 16/06/25w25,VIDEO,$5,276,2025-06-16,2025-06-25,9
485,CB_2025_May_FB_4150_DT-KB_V04_4x5_IMG_EN_New_C-Headline_Sale_CTA-65_Angle-None_M-MIX_VL-None_G-M_P-OG_S-NONE,ðŸ‘¨ || Father's Day || Bundle offer  || ASC+ || US || 0% EXISTING CAP || 7C || 07/06/2025 Ad set,SHARE,$5,191,2025-06-09,2025-06-25,16
486,CB_2025_May_FB_4140_SO-VG_V02_4x5_IMG_EN_Opti_C-NONE_Evergreen_CTA-NONE_Angle-W_M-NONE_VL-None_G-NONE_P-OG_S-NONE_FB3950V11 - CC,ðŸ‘¨ || Father's Day || Bundle offer  || ASC+ || US || 0% EXISTING CAP || 7C || 07/06/2025 Ad set,SHARE,$5,257,2025-06-07,2025-06-25,18
487,CB_2025_Jun_FB_4173_LZ_V06_4x5_IMG_EN_New_C-Headline_Evergreen_CTA-NONE_Angle-C_M-NONE_VL-None_G-NONE_P-NONE_S-NONE,4173 - Block Number  || Enhancements: OFF || CBV1 || Batch 2 || 7C || 09/06/25w24,SHARE,$5,165,2025-06-09,2025-06-17,8
488,CB_2025_Jun_FB_4173_LZ_V08_4x5_IMG_EN_New_C-Headline_Evergreen_CTA-NONE_Angle-W_M-NONE_VL-None_G-NONE_P-NONE_S-NONE,4173 - Block Number  || Enhancements: OFF || CBV1 || Batch 2 || 7C || 09/06/25w24,SHARE,$4,238,2025-06-09,2025-06-17,8
489,CB_2025_Jun_FB_4205_VK-VG_V09_4x5_IMG_EN_New_C-BulletPoints_Evergreen_CTA-SALE_Angle-W-B-C_M-NONE_VL-30s_G-M_P-OG_S-NONE,"4205 - 4143_IMG opti_trending layouts,styles,winners || Enhancements: OFF || CBV1 || Batch 3 || 7C || 16/06/25w25",SHARE,$4,146,2025-06-16,2025-06-20,4
490,CB_2025_Jun_FB_4190_SO_V06_4x5_IMG_EN_New_C-Headline_Evergreen_CTA-NONE_Angle-W_M-NONE_VL-None_G-NONE_P-OG_S-NONE,4190 - BEAT THE HEAT | Refreshing Summer Drink || Enhancements: OFF || CBV1 || Batch 2 || 7C || 16/06/25w25,SHARE,$4,157,2025-06-16,2025-06-19,3
491,CB_2025_Jun_FB_4151_DT-KB_V01_4x5_IMG_EN_New_C-NONE_Sale_CTA-65_Angle-W-B_M-NONE_VL-None_G-NONE_P-OG_S-NONE_FB2959V07 - CC,ðŸ‘¨ || Father's Day || Bundle offer  || ASC+ || US || 0% EXISTING CAP || 7C || 07/06/2025 Ad set,SHARE,$4,223,2025-06-07,2025-06-25,18
492,CB_2025_Jun_FB_4168_SO-JG_V01_4x5_IMG_EN_New_C-Headline_Evergreen_CTA-NONE_Angle-W_M-NONE_VL-None_G-NONE_P-OG_S-NONE,4168 - #154_IMG_Another you || Enhancements: OFF || CBV1 || Batch 1 || 7C || 09/06/25w24,SHARE,$4,128,2025-06-09,2025-06-25,16
493,CB_2025_Jan_FB_3739_DT_V01_4x5_VID_EN_Opti_C-NegativeMark_Sale_CTA-70_Angle-W_M-MIX_VL-45s_G-MF_P-GLP1_S-MOON_FB2263V05,GLP-1 ðŸ’œ || ASC+ || EU  || 7C || 14/06/2025 Ad set,VIDEO,$4,98,2025-06-14,2025-06-18,4
494,CB_2023_Jul_FB_2217_IB_V04_9x16_VID_EN_Opti_C-Pointing_CTA-SMR_Pain-W-B_M-TRC_VL-30s_TR-None_G-F_P-None_S-FRIGGA,US || Manual Bid || BID CAP 105 || 1C || 21/12/24,VIDEO,$3,205,2024-12-22,2025-06-25,185
495,CB_2024_Jan_FB_2731_VK-MB-DP_V12_9x16_VID_EN_Opti_C-Sale_CTA-SMR_Pain-W_M-JANW_VL-30s_TR-None_G-M_P-V2_S-WHAT_FB2103V02 - Copy,âš«ï¸ US || CBV2 || Advantage+ || 7C || BROAD || Existing_customer_0% || || 24/04/25 Ad set,VIDEO,$3,110,2025-04-24,2025-06-25,62
496,CB_2025_Jun_FB_4145_DT-KB_V05_4x5_IMG_EN_Opti_C-Sale_Sale_CTA-65_Angle-None_M-NONE_VL-None_G-NONE_P-None_S-NONE_FB2227V08 - BIOMA,ðŸ‘¨ || Father's Day || Bundle offer  || ASC+ || US || 0% EXISTING CAP || 7C || 07/06/2025 Ad set,SHARE,$3,217,2025-06-07,2025-06-25,18
497,CB_2025_May_FB_4140_SO-VG_V08_4x5_IMG_EN_Opti_C-NONE_Evergreen_CTA-NONE_Angle-W_M-NONE_VL-None_G-NONE_P-OG_S-NONE_FB3961V07 - CC,ðŸ‘¨ || Father's Day || Bundle offer  || ASC+ || US || 0% EXISTING CAP || 7C || 07/06/2025 Ad set,SHARE,$3,235,2025-06-07,2025-06-25,18
498,CB_2025_Jan_FB_3763_SO-DP_V01_1x1_IMG_EN_New_C-Headline_Evergreen_CTA-NONE_Angle-W_M-NONE_VL-None_G-NONE_P-GLP1_S-NONE,3763 - #117 Notion idea GLP IMG || Batch 1 || Enhancements: OFF || GLP-1 Booster || 7C1V || 09/06/25w23,SHARE,$3,6,2025-06-09,2025-06-16,7
499,CB_2025_Jun_FB_4215_VK-KB_V05_4x5_IMG_EN_New_C-Advertorial_Evergreen_CTA-NONE_Angle-W-B-C_M-NONE_VL-None_G-F_P-GLP1_S-NONE_blog_stressfat_cv_en,GLP-1 || Cortisol detox || blog_stressfat_cv_en || Batch 2,SHARE,$3,148,2025-06-19,2025-06-22,3
500,CB_2023_May_FB_2103_MB_V02_9x16_VID_EN_Opti_C-Sale_CTA-SMR_Pain-W_M-JOG_VL-30s_TR-None_G-M-F_P-None_S-What,ASC+ || Angler Predictive Conversions API - Challanger A || 7DC || 10/06/2025 Campaign Ad set,VIDEO,$3,131,2025-06-10,2025-06-23,13
501,CB_2025_May_FB_4140_SO-VG_V12_4x5_IMG_EN_Opti_C-NONE_Evergreen_CTA-NONE_Angle-W_M-NONE_VL-None_G-NONE_P-OG_S-NONE_FB4040V09 - CC,ðŸ‘¨ || Father's Day || Bundle offer  || ASC+ || US || 0% EXISTING CAP || 7C || 07/06/2025 Ad set,SHARE,$3,203,2025-06-07,2025-06-25,18
502,CB_2025_Jun_FB_4168_SO-JG_V03_4x5_IMG_EN_New_C-Headline_Evergreen_CTA-NONE_Angle-W_M-NONE_VL-None_G-NONE_P-OG_S-NONE,4168 - #154_IMG_Another you || Enhancements: OFF || CBV1 || Batch 1 || 7C || 09/06/25w24,SHARE,$3,142,2025-06-10,2025-06-25,15
503,CB_2025_Feb_FB_3846_SO-DP_V17_1x1_VID_EN_New_C-NONE_Evergreen_CTA-NONE_Angle-W_M-NONE_VL-None_G-NONE_P-GLP1_S-NONE,3846 - GLP1 emotional snacking IMG || Batch 1 || Enhancements: OFF || GLP-1 Booster || 7C1V || 16/06/25w25,SHARE,$3,119,2025-06-16,2025-06-20,4
504,CB_2025_May_FB_4132_VK-DP_V04_9x16_VID_EN_New_C-BulletPoints_Evergreen_CTA-SALE_Angle-W-B-C_M-POW_VL-30s_G-M_P-OG_S-NEW,4132 - GLP benefit VID || Enhancements: OFF || CBV1 || Batch 1 || 7C || 02/06/25w23,VIDEO,$3,96,2025-06-02,2025-06-20,18
505,CB_2025_May_FB_4158_VK-VG_V07_4x5_VID_EN_Opti_C-Headline_Evergreen_CTA-SALE_Angle-W-B-C_M-NONE_VL-None_G-M_P-OG_S-NONE_FB4104V05,4158 - 4104_V05_VG Opti - VK || Enhancements: OFF || CBV1 || Batch 3-4 || 7C || 09/06/25w24,SHARE,$3,115,2025-06-09,2025-06-17,8
506,CB_2025_Feb_FB_3846_SO-DP_V05_1x1_VID_EN_New_C-NONE_Evergreen_CTA-NONE_Angle-W_M-NONE_VL-None_G-NONE_P-GLP1_S-NONE,3846 - GLP1 emotional snacking IMG || Batch 1 || Enhancements: OFF || GLP-1 Booster || 7C1V || 16/06/25w25,SHARE,$3,84,2025-06-16,2025-06-20,4
507,CB_2025_Jun_FB_4171_DT_V02_9x16_VID_EN_Opti_C-BulletPoints_Sale_CTA-65_Angle-W_M-JANW_VL-30s_G-M_P-OG_S-WHAT_FB3883V05 - CC,ðŸ‘¨ || Father's Day || Bundle offer  || ASC+ || US || 0% EXISTING CAP || 7C || 07/06/2025 Ad set,VIDEO,$3,87,2025-06-07,2025-06-25,18
508,CB_2025_Jun_FB_4145_SO_V15_4x5_IMG_EN_Opti_C-NONE_Evergreen_CTA-NONE_Angle-W-B-C_M-NONE_VL-None_G-NONE_P-OG_S-NONE_FB3950V16,4145 - FB3950V16 Opti || Enhancements: OFF || CBV1 || Batch 3 || 7C || 09/06/25w24,SHARE,$2,111,2025-06-09,2025-06-17,8
509,CB_2025_Jun_FB_4176_SO-KB_V08_4x5_IMG_EN_Opti_C-Headline_Evergreen_CTA-NONE_Angle-W_M-NONE_VL-None_G-NONE_P-OG_S-NONE_FB4100V02,4176 - FB4100V02 Opti || Enhancements: OFF || CBV1 || Batch 2 || 7C || 09/06/25w24,SHARE,$2,80,2025-06-09,2025-06-17,8
510,CB_2025_Jun_FB_4173_LZ_V05_4x5_IMG_EN_New_C-Headline_Evergreen_CTA-NONE_Angle-W_M-NONE_VL-None_G-NONE_P-NONE_S-NONE,4173 - Block Number  || Enhancements: OFF || CBV1 || Batch 2 || 7C || 09/06/25w24,SHARE,$2,114,2025-06-09,2025-06-17,8
511,CB_2025_Jun_FB_4215_VK-KB_V04_4x5_IMG_EN_New_C-Advertorial_Evergreen_CTA-NONE_Angle-W-B-C_M-NONE_VL-None_G-F_P-GLP1_S-NONE_blog_stressfat_cv_en,GLP-1 || Cortisol detox || blog_stressfat_cv_en || Batch 1,SHARE,$2,72,2025-06-19,2025-06-24,5
512,CB_2025_May_FB_4140_SO-VG_V07_4x5_IMG_EN_Opti_C-NONE_Evergreen_CTA-NONE_Angle-W_M-NONE_VL-None_G-NONE_P-OG_S-NONE_FB3961V07 - BIOMA,ðŸ‘¨ || Father's Day || Bundle offer  || ASC+ || US || 0% EXISTING CAP || 7C || 07/06/2025 Ad set,SHARE,$2,279,2025-06-07,2025-06-24,17
513,CB_2023_May_FB_2103_MB_V02_9x16_VID_EN_Opti_C-Sale_CTA-SMR_Pain-W_M-JOG_VL-30s_TR-None_G-M-F_P-None_S-What,ASC+ || Angler Predictive Conversions API - Challanger A || BAU || 7DC || 10/06/2025 Ad set,VIDEO,$2,75,2025-06-10,2025-06-24,14
514,CB_2025_Jun_FB_4177_VK-VG_V08_4x5_IMG_EN_New_C-BulletPoints_Evergreen_CTA-SALE_Angle-W-B-C_M-MAN_VL-None_G-M_P-OG_S-NONE,4177 -opti 4080 - VK || Enhancements: OFF || CBV1 || Batch 2 || 7C || 09/06/25w24,SHARE,$2,72,2025-06-16,2025-06-25,9
515,CB_2025_May_FB_4140_SO-VG_V13_4x5_IMG_EN_Opti_C-NONE_Evergreen_CTA-NONE_Angle-W_M-NONE_VL-None_G-NONE_P-OG_S-NONE_FB4086V01 - CC,ðŸ‘¨ || Father's Day || Bundle offer  || ASC+ || US || 0% EXISTING CAP || 7C || 07/06/2025 Ad set,SHARE,$2,108,2025-06-07,2025-06-25,18
516,CB_2025_May_FB_4140_SO-VG_V06_4x5_IMG_EN_Opti_C-NONE_Evergreen_CTA-NONE_Angle-W_M-NONE_VL-None_G-NONE_P-OG_S-NONE_FB3961V07 - CC,ðŸ‘¨ || Father's Day || Bundle offer  || ASC+ || US || 0% EXISTING CAP || 7C || 07/06/2025 Ad set,SHARE,$2,151,2025-06-07,2025-06-25,18
517,CB_2025_May_FB_4140_SO-VG_V16_4x5_IMG_EN_Opti_C-NONE_Evergreen_CTA-NONE_Angle-W_M-NONE_VL-None_G-NONE_P-OG_S-NONE_FB4086V01 - BIOMA,ðŸ‘¨ || Father's Day || Bundle offer  || ASC+ || US || 0% EXISTING CAP || 7C || 07/06/2025 Ad set,SHARE,$2,153,2025-06-07,2025-06-25,18
518,CB_2023_Jul_FB_2226_MB_V04_9x16_VID_EN_Opti_C-Testim_CTA-SMR_Pain-W_M-MIX_VL-30s_TR-None_G-F_P-None_S-Starry,US || Manual Bid || BFCM || COST CAP 71 || 1C || 15/11/24,VIDEO,$2,86,2024-11-15,2025-06-24,221
519,CB_2025_Jun_FB_4145_SO_V11_4x5_IMG_EN_Opti_C-NONE_Evergreen_CTA-NONE_Angle-W-B-C_M-NONE_VL-None_G-NONE_P-OG_S-NONE_FB3950V16,4145 - FB3950V16 Opti || Enhancements: OFF || CBV1 || Batch 3 || 7C || 09/06/25w24,SHARE,$2,52,2025-06-09,2025-06-17,8
520,CB_2025_Jun_FB_4180_SO_V16_4x5_IMG_EN_Opti_C-Headline_Evergreen_CTA-NONE_Angle-W_M-NONE_VL-None_G-NONE_P-OG_S-NONE_FB4086V01,4180 - FB4086V01 Opti || Enhancements: OFF || CBV1 || Batch 2 || 7C || 09/06/25w24,SHARE,$2,114,2025-06-16,2025-06-20,4
521,CB_2025_Feb_FB_3774_SO-JT_V01_1x1_IMG_EN_New_C-Headline_Evergreen_CTA-NONE_Angle-W_M-NONE_VL-15s_G-NONE_P-GLP1_S-NONE,3774 - #114 SMASH GLP IMG || Batch 1 || Enhancements: OFF || GLP-1 Booster || 7C1V || 09/06/25w23,SHARE,$2,63,2025-06-09,2025-06-25,16
522,CB_2025_May_FB_4140_SO-VG_V03_4x5_IMG_EN_Opti_C-NONE_Evergreen_CTA-NONE_Angle-W_M-NONE_VL-None_G-NONE_P-OG_S-NONE_FB3950V11 - CC,ðŸ‘¨ || Father's Day || Bundle offer  || ASC+ || US || 0% EXISTING CAP || 7C || 07/06/2025 Ad set,SHARE,$2,130,2025-06-07,2025-06-25,18
523,CB_2025_Jun_FB_4169_DT-DP_V02_9x16_VID_EN_New_C-SocialProof_Evergreen_CTA-65_Angle-W-B-C_M-MAN_VL-30s_G-MF_P-OG_S-NEW,"4169 - 3 reasons why, GF POV || Enhancements: OFF || CBV1 || Batch 1 || 7C || 09/06/25w24",VIDEO,$2,60,2025-06-09,2025-06-16,7
524,CB_2025_Jun_FB_4215_VK-KB_V04_4x5_IMG_EN_New_C-Advertorial_Evergreen_CTA-NONE_Angle-W-B-C_M-NONE_VL-None_G-F_P-GLP1_S-NONE_blog_stressfat_cv_en_blog_stressfat_cv_en,GLP-1 || Cortisol detox || blog_stressfat_cv_en || Batch 2,SHARE,$2,29,2025-06-19,2025-06-22,3
525,CB_2025_Jun_FB_4145_SO_V02_4x5_IMG_EN_Opti_C-NONE_Evergreen_CTA-NONE_Angle-W-B-C_M-NONE_VL-None_G-NONE_P-OG_S-NONE_FB3950V16,4145 - FB3950V16 Opti || Enhancements: OFF || CBV1 || Batch 1 || 7C || 09/06/25w24,SHARE,$2,64,2025-06-09,2025-06-16,7
526,CB_2023_May_FB_2103_MB_V02_9x16_VID_EN_Opti_C-Sale_CTA-SMR_Pain-W_M-JOG_VL-30s_TR-None_G-M-F_P-None_S-What,ASC+ || Angler Predictive Conversions API - Challanger B || 7DC || 10/06/2025 Campaign Ad set,VIDEO,$1,52,2025-06-10,2025-06-25,15
527,CB_2025_Jun_FB_4171_DT_V04_9x16_VID_EN_New_C-Trend_Sale_CTA-65_Angle-W_M-POW_VL-30s_G-M_P-OG_S-NEW_FB3863V03 - CC,ðŸ‘¨ || Father's Day || Bundle offer  || ASC+ || US || 0% EXISTING CAP || 7C || 07/06/2025 Ad set,VIDEO,$1,36,2025-06-07,2025-06-25,18
528,CB_2025_Jun_FB_4161_DT-VG_V05_9x16_VID_EN_New_C-BulletPoints_Evergreen_CTA-NONE_Angle-W-B-C_M-MIX_VL-15s_G-M_P-OG_S-NEW,4167 - #158 Ohealth Copy_MIX painpoints || Enhancements: OFF || CBV1 || Batch 2 || 7C || 09/06/25w24,VIDEO,$1,65,2025-06-09,2025-06-16,7
529,CB_2024_Jan_FB_2717_MB-RP_V26_9x16_VID_EN_New_C-Buzz_CTA-SALE_Pain-W-B-C_M-MIX_VL-45s_TR-None_G-MF_P-Method_S-NONE,CA || INTEREST: UPCOMING BIRTHDAY || 7C || 11/05/25,VIDEO,$1,86,2025-05-12,2025-06-25,44
530,CB_2025_Jun_FB_4157_SO-KB_V05_4x5_IMG_EN_New_C-Headline_Evergreen_CTA-NONE_Angle-W_M-NONE_VL-None_G-NONE_P-OG_S-NONE,ðŸ‘¨ || Father's Day || Bundle offer  || ASC+ || US || 0% EXISTING CAP || 7C || 07/06/2025 Ad set,SHARE,$1,110,2025-06-09,2025-06-25,16
531,CB_2025_Jun_FB_4179_LZ-KB_V04_4x5_IMG_EN_New_C-BeforeAfter_Evergreen_CTA-65_Angle-W-B_M-NONE_VL-None_G-M_P-OG_S-NONE,4179 - Puzzle piece || Enhancements: OFF || CBV1 || Batch 1 || 7C || 09/06/25w24,SHARE,$1,56,2025-06-09,2025-06-22,13
532,CB_2025_Jun_FB_4154_DT-KB_V01_4x5_IMG_EN_Opti_C-NONE_Sale_CTA-65_ngle-W-B_M-NONE_VL-None_G-NONE_P-OG_S-NONE_FB2959V07 - CC,ðŸ‘¨ || Father's Day || Bundle offer  || ASC+ || US || 0% EXISTING CAP || 7C || 07/06/2025 Ad set,SHARE,$1,75,2025-06-07,2025-06-25,18
533,CB_2025_Jun_FB_4190_SO_V02_4x5_IMG_EN_New_C-Headline_Evergreen_CTA-NONE_Angle-W_M-NONE_VL-None_G-NONE_P-OG_S-NONE,4190 - BEAT THE HEAT | Refreshing Summer Drink || Enhancements: OFF || CBV1 || Batch 1 || 7C || 16/06/25w25,SHARE,$1,41,2025-06-16,2025-06-17,1
534,CB_2025_Jun_FB_4215_VK-KB_V02_4x5_IMG_EN_New_C-Advertorial_Evergreen_CTA-NONE_Angle-W-B-C_M-NONE_VL-None_G-F_P-GLP1_S-NONE_blog_stressfat_cv_en,GLP-1 || Cortisol detox || blog_stressfat_cv_en || Batch 1,SHARE,$1,42,2025-06-19,2025-06-25,6
535,CB_2025_Jun_FB_4161_DT-VG_V08_9x16_VID_EN_New_C-BulletPoints_Evergreen_CTA-NONE_Angle-W-B-C_M-MIX_VL-15s_G-M_P-OG_S-NEW,4167 - #158 Ohealth Copy_MIX painpoints || Enhancements: OFF || CBV1 || Batch 2 || 7C || 09/06/25w24,VIDEO,$1,40,2025-06-09,2025-06-16,7
536,CB_2025_May_FB_4140_SO-VG_V06_4x5_IMG_EN_Opti_C-NONE_Evergreen_CTA-NONE_Angle-W_M-NONE_VL-None_G-NONE_P-OG_S-NONE_FB3961V07 - BIOMA,ðŸ‘¨ || Father's Day || Bundle offer  || ASC+ || US || 0% EXISTING CAP || 7C || 07/06/2025 Ad set,SHARE,$1,44,2025-06-07,2025-06-25,18
537,CB_2025_Jun_FB_4179_LZ-KB_V01_4x5_IMG_EN_New_C-BeforeAfter_Evergreen_CTA-65_Angle-W-B_M-NONE_VL-None_G-M_P-OG_S-NONE,4179 - Puzzle piece || Enhancements: OFF || CBV1 || Batch 1 || 7C || 09/06/25w24,SHARE,$1,46,2025-06-09,2025-06-22,13
538,CB_2025_May_FB_4140_SO-VG_V08_4x5_IMG_EN_Opti_C-NONE_Evergreen_CTA-NONE_Angle-W_M-NONE_VL-None_G-NONE_P-OG_S-NONE_FB3961V07 - BIOMA,ðŸ‘¨ || Father's Day || Bundle offer  || ASC+ || US || 0% EXISTING CAP || 7C || 07/06/2025 Ad set,SHARE,$1,130,2025-06-07,2025-06-24,17
539,CB_2025_Jun_FB_4171_DT_V02_9x16_VID_EN_Opti_C-BulletPoints_Sale_CTA-65_Angle-W_M-JANW_VL-30s_G-M_P-OG_S-WHAT_FB3883V05 - BIOMA,ðŸ‘¨ || Father's Day || Bundle offer  || ASC+ || US || 0% EXISTING CAP || 7C || 07/06/2025 Ad set,VIDEO,$1,66,2025-06-07,2025-06-24,17
540,CB_2025_May_FB_4146_DT_V02_9x16_VID_EN_New_C-BeforeAfter_Evergreen_CTA-SALE_Angle-W_M-JOG_VL-45s_G-F_P-OG_S-MOON,4146 - I was fat || Enhancements: OFF || CBV1 || Batch 1 || 7C || 09/06/25w24,VIDEO,$1,46,2025-06-09,2025-06-16,7
541,CB_2025_Jun_FB_4184_CHUB-AS_V03_4x5_IMG_EN_New_C-NONE_CTA-CTA_Angle-C_M-NONE_VL-None_TR-None_G-F_P-OG_S-NONE,4184 - CHUB Reminder || Enhancements: OFF || CBV1 || Batch 1 || 7C || 16/06/25w25,SHARE,$1,52,2025-06-17,2025-06-23,6
542,CB_2025_May_FB_4132_VK-DP_V02_9x16_VID_EN_New_C-BulletPoints_Evergreen_CTA-SALE_Angle-W-B-C_M-POW_VL-30s_G-M_P-OG_S-STARRY,4132 - GLP benefit VID || Enhancements: OFF || CBV1 || Batch 1 || 7C || 02/06/25w23,VIDEO,$1,46,2025-06-02,2025-06-20,18
543,IM_CB4.png,US || VSL || Aff's image || Landing: Pre-1 Real doctor || 1C || 22/06/25,SHARE,$1,38,2025-06-22,2025-06-23,1
544,CB_2022_Mar3_FB_713_IK_V04_1x1_IMG_EN_Opti_C-WrittenTesti_HE-98_A-ExtremeBodyVisualization_HK-bodypart_Pain-W_CLR-PURPLE_BG-IMAGE_ME-MIX_MA-YOUNG,US || Manual Bid || BFCM || COST CAP 71 || 1C || 15/11/24,SHARE,$1,68,2024-11-15,2025-06-24,221
545,CB_2025_May_FB_4140_SO-VG_V14_4x5_IMG_EN_Opti_C-NONE_Evergreen_CTA-NONE_Angle-W_M-NONE_VL-None_G-NONE_P-OG_S-NONE_FB4086V01 - CC,ðŸ‘¨ || Father's Day || Bundle offer  || ASC+ || US || 0% EXISTING CAP || 7C || 07/06/2025 Ad set,SHARE,$1,48,2025-06-07,2025-06-24,17
546,CB_2025_May_FB_4132_VK-DP_V03_9x16_VID_EN_New_C-BulletPoints_Evergreen_CTA-SALE_Angle-W-B-C_M-POW_VL-30s_G-M_P-OG_S-NEW,4132 - GLP benefit VID || Enhancements: OFF || CBV1 || Batch 1 || 7C || 02/06/25w23,VIDEO,$1,25,2025-06-02,2025-06-19,17
547,CB_2025_Jan_FB_3748_VK-DP_V03_4x5_IMG_EN_New_C-BulletPoints_Sale_CTA-NY_Angle-W-B-C_M-NONE_VL-None_G-M_P-OG_S-NONE.png - Copy,3748 - winner ads opti - GLP1 - VK-DP || Enhancements: OFF || GLP-1 || Batch 1 || 7C || 20/02/25w09 || Valentinas,SHARE,$1,16,2025-02-24,2025-06-23,119
548,CB_2025_Jun_FB_4151_DT-KB_V03_4x5_IMG_EN_New_C-NONE_Sale_CTA-65_Angle-W-B_M-NONE_VL-None_G-NONE_P-OG_S-NONE_FB2959V07 - BIOMA,ðŸ‘¨ || Father's Day || Bundle offer  || ASC+ || US || 0% EXISTING CAP || 7C || 07/06/2025 Ad set,SHARE,$1,102,2025-06-07,2025-06-24,17
549,CB_2025_Jun_FB_4145_SO_V04_4x5_IMG_EN_Opti_C-NONE_Evergreen_CTA-NONE_Angle-W-B-C_M-NONE_VL-None_G-NONE_P-OG_S-NONE_FB3950V16,4145 - FB3950V16 Opti || Enhancements: OFF || CBV1 || Batch 1 || 7C || 09/06/25w24,SHARE,$1,35,2025-06-09,2025-06-16,7
550,CB_2025_May_FB_4150_DT-KB_V02_4x5_IMG_EN_New_C-Headline_Sale_CTA-65_Angle-None_M-MIX_VL-None_G-M_P-OG_S-NONE,ðŸ‘¨ || Father's Day || Bundle offer  || ASC+ || US || 0% EXISTING CAP || 7C || 07/06/2025 Ad set,SHARE,$1,50,2025-06-09,2025-06-25,16
551,CB_2025_Jun_FB_4154_DT-KB_V03_4x5_IMG_EN_Opti_C-Headline_Sale_CTA-65_Angle-W_M-NONE_VL-None_G-NONE_P-OG_S-NONE_3608V03 - CC,ðŸ‘¨ || Father's Day || Bundle offer  || ASC+ || US || 0% EXISTING CAP || 7C || 07/06/2025 Ad set,SHARE,$1,101,2025-06-07,2025-06-24,17
552,CB_2025_Jun_FB_4151_DT-KB_V04_4x5_IMG_EN_New_C-NONE_Sale_CTA-65_Angle-W-B_M-NONE_VL-None_G-NONE_P-OG_S-NONE_FB2959V07 - BIOMA,ðŸ‘¨ || Father's Day || Bundle offer  || ASC+ || US || 0% EXISTING CAP || 7C || 07/06/2025 Ad set,SHARE,$1,126,2025-06-07,2025-06-25,18
553,CB_2025_Jun_FB_4151_DT-KB_V07_4x5_IMG_EN_New_C-NONE_Sale_CTA-65_Angle-W-B_M-NONE_VL-None_G-NONE_P-OG_S-NONE_FB2959V07 - CC,ðŸ‘¨ || Father's Day || Bundle offer  || ASC+ || US || 0% EXISTING CAP || 7C || 07/06/2025 Ad set,SHARE,$1,69,2025-06-07,2025-06-24,17
554,CB_2025_Jun_FB_4145_SO_V05_4x5_IMG_EN_Opti_C-NONE_Evergreen_CTA-NONE_Angle-W-B-C_M-NONE_VL-None_G-NONE_P-OG_S-NONE_FB3950V16,4145 - FB3950V16 Opti || Enhancements: OFF || CBV1 || Batch 1 || 7C || 09/06/25w24,SHARE,$1,17,2025-06-09,2025-06-16,7
555,CB_2025_Jun_FB_4171_DT_V01_9x16_VID_EN_Opti_C-MakingOf_Sale_CTA-65_Angle-W-B-C_M-POW_VL-45s_G-M_P-OG_S-Moon_FB3090V02 - BIOMA,ðŸ‘¨ || Father's Day || Bundle offer  || ASC+ || US || 0% EXISTING CAP || 7C || 07/06/2025 Ad set,VIDEO,$1,25,2025-06-07,2025-06-23,16
556,CB_2025_May_FB_4150_DT-KB_V05_4x5_IMG_EN_New_C-Headline_Sale_CTA-65_Angle-None_M-MIX_VL-None_G-M_P-OG_S-NONE,ðŸ‘¨ || Father's Day || Bundle offer  || ASC+ || US || 0% EXISTING CAP || 7C || 07/06/2025 Ad set,SHARE,$1,45,2025-06-09,2025-06-24,15
557,CB_2025_Jun_FB_4151_DT-KB_V05_4x5_IMG_EN_New_C-NONE_Sale_CTA-65_Angle-W-B_M-NONE_VL-None_G-NONE_P-OG_S-NONE_FB2959V07 - C,ðŸ‘¨ || Father's Day || Bundle offer  || ASC+ || US || 0% EXISTING CAP || 7C || 07/06/2025 Ad set,SHARE,$1,48,2025-06-07,2025-06-25,18
558,CB_2025_Jun_FB_4157_SO-KB_V03_4x5_IMG_EN_New_C-Headline_Evergreen_CTA-NONE_Angle-W_M-NONE_VL-None_G-NONE_P-OG_S-NONE,ðŸ‘¨ || Father's Day || Bundle offer  || ASC+ || US || 0% EXISTING CAP || 7C || 07/06/2025 Ad set,SHARE,$1,37,2025-06-09,2025-06-25,16
559,CB_2025_Jun_FB_4145_SO_V14_4x5_IMG_EN_Opti_C-NONE_Evergreen_CTA-NONE_Angle-W-B-C_M-NONE_VL-None_G-NONE_P-OG_S-NONE_FB3950V16,4145 - FB3950V16 Opti || Enhancements: OFF || CBV1 || Batch 3 || 7C || 09/06/25w24,SHARE,$1,17,2025-06-09,2025-06-17,8
560,CB_2025_Jun_FB_4157_SO-KB_V04_4x5_IMG_EN_New_C-Headline_Evergreen_CTA-NONE_Angle-W_M-NONE_VL-None_G-NONE_P-OG_S-NONE,ðŸ‘¨ || Father's Day || Bundle offer  || ASC+ || US || 0% EXISTING CAP || 7C || 07/06/2025 Ad set,SHARE,$1,37,2025-06-09,2025-06-25,16
561,CB_2025_May_FB_4140_SO-VG_V09_4x5_IMG_EN_Opti_C-NONE_Evergreen_CTA-NONE_Angle-W_M-NONE_VL-None_G-NONE_P-OG_S-NONE_FB4040V09 - CC,ðŸ‘¨ || Father's Day || Bundle offer  || ASC+ || US || 0% EXISTING CAP || 7C || 07/06/2025 Ad set,SHARE,$0,38,2025-06-07,2025-06-25,18
562,CB_2025_Jun_FB_4157_SO-KB_V01_4x5_IMG_EN_New_C-Headline_Evergreen_CTA-NONE_Angle-W_M-NONE_VL-None_G-NONE_P-OG_S-NONE,ðŸ‘¨ || Father's Day || Bundle offer  || ASC+ || US || 0% EXISTING CAP || 7C || 07/06/2025 Ad set,SHARE,$0,54,2025-06-09,2025-06-25,16
563,CB_2025_Jan_FB_3748_VK-DP_V03_4x5_IMG_EN_New_C-BulletPoints_Sale_CTA-NY_Angle-W-B-C_M-NONE_VL-None_G-M_P-OG_S-NONE,3748 - winner ads opti - GLP1 - VK-DP || Enhancements: OFF || GLP-1 Booster || 7C1V || 30/05/25w22,SHARE,$0,31,2025-05-30,2025-06-25,26
564,CB_2025_Jun_FB_4159_VK_V12_4x5_IMG_EN_New_C-BulletPoints_Evergreen_CTA-SALE_Angle-W-B-C_M-NONE_VL-None_G-M_P-OG_S-NONE,4159 - obsessed is understatement - VK || Enhancements: OFF || CBV1 || Batch 3 || 7C || 09/06/25w24,SHARE,$0,6,2025-06-09,2025-06-19,10
565,CB_2025_Jun_FB_4157_SO-KB_V02_4x5_IMG_EN_New_C-Headline_Evergreen_CTA-NONE_Angle-W_M-NONE_VL-None_G-NONE_P-OG_S-NONE,ðŸ‘¨ || Father's Day || Bundle offer  || ASC+ || US || 0% EXISTING CAP || 7C || 07/06/2025 Ad set,SHARE,$0,49,2025-06-09,2025-06-25,16
566,CB_2025_Jun_FB_4151_DT-KB_V02_4x5_IMG_EN_New_C-NONE_Sale_CTA-65_Angle-W-B_M-NONE_VL-None_G-NONE_P-OG_S-NONE_FB2959V07 - BIOMA,ðŸ‘¨ || Father's Day || Bundle offer  || ASC+ || US || 0% EXISTING CAP || 7C || 07/06/2025 Ad set,SHARE,$0,11,2025-06-07,2025-06-24,17
567,CB_2025_Jun_FB_4151_DT-KB_V02_4x5_IMG_EN_New_C-NONE_Sale_CTA-65_Angle-W-B_M-NONE_VL-None_G-NONE_P-OG_S-NONE_FB2959V07 - CC,ðŸ‘¨ || Father's Day || Bundle offer  || ASC+ || US || 0% EXISTING CAP || 7C || 07/06/2025 Ad set,SHARE,$0,21,2025-06-07,2025-06-24,17
568,CB_2025_Jun_FB_4161_DT-VG_V06_9x16_VID_EN_New_C-BulletPoints_Evergreen_CTA-NONE_Angle-W-B-C_M-MIX_VL-15s_G-M_P-OG_S-NEW,4167 - #158 Ohealth Copy_MIX painpoints || Enhancements: OFF || CBV1 || Batch 2 || 7C || 09/06/25w24,VIDEO,$0,13,2025-06-09,2025-06-16,7
569,CB_2025_Jun_FB_4151_DT-KB_V06_4x5_IMG_EN_New_C-NONE_Sale_CTA-65_Angle-W-B_M-NONE_VL-None_G-NONE_P-OG_S-NONE_FB2959V07 - BIOMA,ðŸ‘¨ || Father's Day || Bundle offer  || ASC+ || US || 0% EXISTING CAP || 7C || 07/06/2025 Ad set,SHARE,$0,137,2025-06-07,2025-06-25,18
570,CB_2025_Jun_FB_4176_SO-KB_V07_4x5_IMG_EN_Opti_C-Headline_Evergreen_CTA-NONE_Angle-W_M-NONE_VL-None_G-NONE_P-OG_S-NONE_FB4100V02,4176 - FB4100V02 Opti || Enhancements: OFF || CBV1 || Batch 2 || 7C || 09/06/25w24,SHARE,$0,12,2025-06-10,2025-06-17,7
571,CB_2025_Jan_FB_3748_VK-DP_V04_4x5_IMG_EN_New_C-BulletPoints_Sale_CTA-NY_Angle-W-B-C_M-NONE_VL-None_G-M_P-OG_S-NONE.png - Copy,3748 - winner ads opti - GLP1 - VK-DP || Enhancements: OFF || GLP-1 || Batch 1 || 7C || 20/02/25w09 || Valentinas,SHARE,$0,4,2025-02-24,2025-06-25,121
572,CB_2025_Jun_FB_4171_DT_V01_9x16_VID_EN_Opti_C-MakingOf_Sale_CTA-65_Angle-W-B-C_M-POW_VL-45s_G-M_P-OG_S-Moon_FB3090V02 - CC,ðŸ‘¨ || Father's Day || Bundle offer  || ASC+ || US || 0% EXISTING CAP || 7C || 07/06/2025 Ad set,VIDEO,$0,13,2025-06-07,2025-06-25,18
573,CB_2025_Jun_FB_4145_DT-KB_V09_4x5_IMG_EN_Opti_C-Testimonial_Sale_CTA-65_Angle-W_M-NONE_VL-None_G-NONE_P-NONE_S-NONE_FB713V04 - CC,ðŸ‘¨ || Father's Day || Bundle offer  || ASC+ || US || 0% EXISTING CAP || 7C || 07/06/2025 Ad set,SHARE,$0,24,2025-06-07,2025-06-24,17
574,IM_CB3.png,US || VSL || Aff's image || Landing: Pre-1 Real doctor || 1C || 22/06/25,SHARE,$0,14,2025-06-22,2025-06-23,1
575,CB_2025_Jun_FB_4157_SO-KB_V06_4x5_IMG_EN_New_C-Headline_Evergreen_CTA-NONE_Angle-W_M-NONE_VL-None_G-NONE_P-OG_S-NONE,ðŸ‘¨ || Father's Day || Bundle offer  || ASC+ || US || 0% EXISTING CAP || 7C || 07/06/2025 Ad set,SHARE,$0,26,2025-06-09,2025-06-25,16
576,CB_2025_Jan_FB_3748_VK-DP_V04_4x5_IMG_EN_New_C-BulletPoints_Sale_CTA-NY_Angle-W-B-C_M-NONE_VL-None_G-M_P-OG_S-NONE,3748 - winner ads opti - GLP1 - VK-DP || Enhancements: OFF || GLP-1 Booster || 7C1V || 30/05/25w22,SHARE,$0,24,2025-05-30,2025-06-24,25
577,CB_2025_May_FB_4146_DT_V03_9x16_VID_EN_New_C-BeforeAfter_Evergreen_CTA-SALE_Angle-W_M-JOG_VL-45s_G-F_P-OG_S-MOON,4146 - I was fat || Enhancements: OFF || CBV1 || Batch 1 || 7C || 09/06/25w24,VIDEO,$0,13,2025-06-09,2025-06-16,7
578,CB_2024_Oct_FB_3251_LZ-VU_V01_1x1_IMG_EN_New_C-NegativeMark_Evergreen_CTA-NONE_Angle-Cort_M-NONE_VL-None_G-NONE_P-NONE_S-NONE.png,US || Manual Bid || BFCM || COST CAP 71 || 1C || 15/11/24,SHARE,$0,7,2024-11-15,2025-06-25,222
579,CB_2025_Jun_FB_4156_DT_V03_9x16_VID_EN_New_C-Testimonial_Evergreen_CTA-65_Angle-W-B-C_M-JAS_VL-30s_G-M_P-OG_S-NEW,4156 - Introducing Jason || Enhancements: OFF || CBV1 || Batch 3-4 || 7C || 09/06/25w24,VIDEO,$0,5,2025-06-09,2025-06-16,7
580,CB_2025_Feb_FB_3774_SO-JT_V07_1x1_IMG_EN_New_C-Headline_Evergreen_CTA-NONE_Angle-W_M-NONE_VL-15s_G-NONE_P-GLP1_S-NONE,3774 - #114 SMASH GLP IMG || Batch 2 || Enhancements: OFF || GLP-1 Booster || 7C1V || 09/06/25w23,SHARE,$0,5,2025-06-09,2025-06-25,16
581,CB_2025_Jun_FB_4151_DT-KB_V03_4x5_IMG_EN_New_C-NONE_Sale_CTA-65_Angle-W-B_M-NONE_VL-None_G-NONE_P-OG_S-NONE_FB2959V07 - CC,ðŸ‘¨ || Father's Day || Bundle offer  || ASC+ || US || 0% EXISTING CAP || 7C || 07/06/2025 Ad set,SHARE,$0,13,2025-06-07,2025-06-24,17
582,CB_2023_Jul_FB_2217_IB_V04_9x16_VID_EN_Opti_C-Pointing_CTA-SMR_Pain-W-B_M-TRC_VL-30s_TR-None_G-F_P-None_S-FRIGGA,US || Manual Bid || BID CAP 111 || 1C || 21/12/24,VIDEO,$0,3,2024-12-22,2025-06-22,182
583,CB_2025_Jun_FB_4145_DT-KB_V05_4x5_IMG_EN_Opti_C-Sale_Sale_CTA-65_Angle-None_M-NONE_VL-None_G-NONE_P-None_S-NONE_FB2227V08 - CC,ðŸ‘¨ || Father's Day || Bundle offer  || ASC+ || US || 0% EXISTING CAP || 7C || 07/06/2025 Ad set,SHARE,$0,2,2025-06-07,2025-06-25,18
