,Ad Name,Adset Name,Creative Type,Spend In USD,Impressions,First Ad Spend Date,Last Ad Spend Date,Days ad spending
1,CB_2025_Feb_FB_3883_LZ-RP_V05_9x16_VID_EN_Opti_C-BulletPoints_Evergreen_CTA-SALE_Angle-W_M-JANW_VL-30s_G-M_P-OG_S-WHAT_FB2284V05,ðŸŒ¶ï¸ || US || ASC+ || ->CC141 || VIDEO Only || US+CA || 0% EXISTING CAP || 7C || 07/08.24  Ad set,,"$9,988","558,308",2025-03-28,2025-03-31,3
2,CB_2024_Sep_FB_3175_DA-KB_V04_1x1_IMG_EN_New_C-ADVRT_Evergreen_CTA-NONE_Angle-W_M-NONE_VL-None_G-NONE_P-CBV2_S-NONE_blog_colonbroomvsmammoth_cv_en,CBV2 || UK || Advantage+ || Advertorial |  || 0% EXISTING CAP || BROAD || 7C || ad set 18/03/25,SHARE,"$8,979","357,249",2025-03-18,2025-03-31,13
3,Dynamic_Creative_Statics_CA_Flow,WC || CA || DYNAMIC CREATIVE Static winners || ADV+ audience || 7C || 16.02.2025,SHARE,"$6,274","472,573",2025-02-16,2025-03-31,43
4,CB_2025_Feb_FB_3827_LZ_V04_1x1_IMG_EN_Opti_C-Headline_Evergreen_CTA-SALE_Angle-W_M-NONE_VL-None_G-M_P-CBV2_S-NONE_FB3779V02,CBV2 || US || Manual Bid: ROAS GOAL: 1.00 -> 1.1 || 7DC || 22/01/2025,SHARE,"$6,015","183,961",2025-02-18,2025-03-31,41
5,CB_2025_Feb_FB_3827_LZ_V01_1x1_IMG_EN_Opti_C-Headline_Evergreen_CTA-NONE_Angle-W_M-NONE_VL-None_G-M_P-CBV2_S-NONE_FB3723V04,CBV2 || US || Manual Bid: ROAS GOAL: 1.00 -> 1.1 || 7DC || 22/01/2025,SHARE,"$4,618","200,954",2025-02-18,2025-03-31,41
6,CB_2025_Mar_FB_3891_VK_V05_1x1_IMG_EN_New_C-BulletPoints_Evergreen_CTA-65_Angle-W-B-C_M-NONE_VL-None_G-M_P-OG_S-NONE - Copy,ðŸŒ¶ï¸ || US || ASC+ || ->CC141 || VIDEO Only || US+CA || 0% EXISTING CAP || 7C || 07/08.24  Ad set,,"$4,607","284,955",2025-03-15,2025-03-29,14
7,CB_2025_Feb_FB_3883_LZ-RP_V05_9x16_VID_EN_Opti_C-BulletPoints_Evergreen_CTA-SALE_Angle-W_M-JANW_VL-30s_G-M_P-OG_S-WHAT_FB2284V05,CA || ASC+ || 0% EXISTING || 7DC || 18.03.2025,VIDEO,"$4,290","400,571",2025-03-27,2025-03-31,4
8,CB_2024_Sep_FB_3175_DA-KB_V04_1x1_IMG_EN_New_C-ADVRT_Evergreen_CTA-NONE_Angle-W_M-NONE_VL-None_G-NONE_P-CBV2_S-NONE_blog_colonbroomvsmammoth_cv_en,CBV2 || Advantage+ || Advertorial || Higher pricing || US || 0% EXISTING CAP || BROAD || 7C || 20/01/25  Campaign Ad set,SHARE,"$4,131","164,024",2025-01-20,2025-03-31,70
9,CB_2025_Feb_FB_3860_LZ-DP_V03_9x16_VID_EN_Opti_C-Testimonial_Evergreen_CTA-SALE_Angle-W_M-MOOD_VL-20s_G-M_P-OG_S-WOOD_FB21176V11_1,3860 - man boobs video 2176 opti || Enhancements: OFF || CBV1 || Batch 1 || 7C || 03/03/25w10 || Valentinas,VIDEO,"$3,467","196,491",2025-03-03,2025-03-31,28
10,CB_2025_Mar_FB_3890_DT_V04_1x1_IMG_EN_New_C-NONE_Evergreen_CTA-None_Angle-W_M-NONE_VL-None_G-NONE_P-OG_S-NONE,3890 - Your Peak Performance in 6 weeks || Enhancements: OFF || CBV1 || Batch 1 || 7C || 10/03/25w11,,"$3,089","182,646",2025-03-12,2025-03-31,19
11,CB_2023_Jul_FB_2217_IB_V04_9x16_VID_EN_Opti_C-Pointing_CTA-SMR_Pain-W-B_M-TRC_VL-30s_TR-None_G-F_P-None_S-FRIGGA,ðŸŒ¶ï¸ || US || ASC+ || ->CC141 || VIDEO Only || US+CA || 0% EXISTING CAP || 7C || 07/08.24  Ad set,VIDEO,"$2,969","92,900",2024-08-07,2025-03-31,236
12,CB_2024_Sep_FB_3175_DA-KB_V04_1x1_IMG_EN_New_C-ADVRT_Evergreen_CTA-NONE_Angle-W_M-NONE_VL-None_G-NONE_P-CBV2_S-NONE_blog_colonbroomvsmammoth_cv_en,CBV2 || AU || Advantage+ || Advertorial |  || 0% EXISTING CAP || BROAD || 7C || ad set 18/03/25,SHARE,"$2,814","140,109",2025-03-20,2025-03-31,11
13,CB_2025_Jan_FB_3747_CHUB-AA_V03_9x16_IMG_EN_Opti_C-NONE_CTA-NONE_Angle-Sale_M-NONE_VL-None_TR-None_G-NONE_P-OG_S-NONE,3747 Clean Sale [HB winner ITR] CHUB || Enhancements: OFF || CBV1 || Batch Ä… || 1C || 02/02/25w06 || Kostas,SHARE,"$2,737","141,290",2025-02-02,2025-03-31,57
14,CB_2024_Sep_FB_3175_DA-KB_V04_1x1_IMG_EN_New_C-ADVRT_Evergreen_CTA-NONE_Angle-W_M-NONE_VL-None_G-NONE_P-CBV2_S-NONE_blog_colonbroomvsmammoth_cv_en,CBV2 || TOP EU || Advantage+ || Advertorial |  || 0% EXISTING CAP || BROAD || 7C || 21/03/25 Ad set,SHARE,"$2,439","102,688",2025-03-21,2025-03-31,10
15,CB_2025_Mar_FB_3910_LZ-DP_V04_9x16_VID_EN_Opti_C-Testimonial_Evergreen_CTA-NONE_Angle-W_M-TRC_VL-15s_G-F_P-TRIAL_S-FRIGGA_FB2217V04.mp4,US || Free trial offer || Trial ads || Trial purchase || 7C || 19/03/25,,"$2,275","74,631",2025-03-19,2025-03-31,12
16,CB_2024_Mar_FB_2883_DA_V08_9x16_VID_ES_Opti_C-SingleTesti_CTA-SALE_Pain-W-B_M-TRC_VL-45s_TR-None_G-F_P-OG_S-MOON_FB2764V04,LATAM ðŸ‡ªðŸ‡¸ || CBV2 || Advantage+ || 0% EXISTING CAP || BROAD || 7C || 22/03/25 Campaign Ad set,,"$2,236","131,599",2025-03-22,2025-03-31,9
17,CB_2023_Jul_FB_2217_IB_V04_9x16_VID_EN_Opti_C-Pointing_CTA-SMR_Pain-W-B_M-TRC_VL-30s_TR-None_G-F_P-None_S-FRIGGA,US || Kilo Product's leads LAL || 7C || 04/03/25,VIDEO,"$2,119","64,739",2025-03-04,2025-03-31,27
18,CB_2025_Mar_FB_3891_VK_V05_1x1_IMG_EN_New_C-BulletPoints_Evergreen_CTA-65_Angle-W-B-C_M-NONE_VL-None_G-M_P-OG_S-NONE,CA || ASC+ || 0% EXISTING || 7DC || 18.03.2025,SHARE,"$2,082","232,373",2025-03-18,2025-03-31,13
19,CB_2025_Feb_FB_3818_LZ-VU_V05_1x1_IMG_EN_Opti_C-Headline_Evergreen_CTA-NONE_Angle-Cort_M-NONE_VL-None_G-NONE_P-NONE_S-NONE_FB3251V01,ðŸŒ¶ï¸ || US || ASC+ || ->CC141 || VIDEO Only || US+CA || 0% EXISTING CAP || 7C || 07/08.24  Ad set,,"$2,035","84,091",2025-03-18,2025-03-31,13
20,CB_2025_Mar_FB_3907_CHUB-AA_V03__IMG_EN_Opti_C-Price_CTA-NONE_Angle-None_M-NONE_VL-None_TR-None_G-NONE_P-OG_S-NONE,CA || ASC+ || 0% EXISTING || 7DC || 18.03.2025,SHARE,"$2,020","142,510",2025-03-27,2025-03-31,4
21,CB_2025_Jan_FB_3742_SO-DP-KB_V06_4x5_IMG_EN_Opti_C-NONE_Evergreen_CTA-SALE_Angle-W_M-NONE_VL-None_G-NONE_P-CBV2_S-NONE3665V01,CBV2 || US || Manual Bid: ROAS GOAL: 1.00 -> 1.1 || 7DC || 22/01/2025,SHARE,"$2,001","67,866",2025-02-11,2025-03-31,48
22,CB_2024_Jan_FB_2764_RS_V04_9x16_VID_EN_Opti_C-SingleTesti_CTA-SALE_Pain-W_M-TRC_VL-45s_TR-None_G-F_P-OG_S-MOON_FB2263V04,EU (UK) || 2764 || Trinity Results Too Fast || 1C || 08/01/2025w02,VIDEO,"$1,988","48,413",2025-01-08,2025-03-31,82
23,CB_2023_Apr_FB_1989_RS_V08_9x16_VID_EN_Opti_C-Trend_CTA-SMR_Pain-W_M-MIX_VL-30s_TR-None_G-MF_P-None - Copy,CA || ASC+ || 0% EXISTING || 7DC || 18.03.2025,VIDEO,"$1,836","123,562",2025-03-18,2025-03-31,13
24,CB_2023_Dec_FB_2712_RS-DP_V02_1x1_VID_EN_Opti_C-WrittenTesti_CTA-SALE_Pain-W-B-C_M-NONE_VL-None_TR-None_G-NONE_P-V2_S-NONE_FB2227V08,CBV2 || AU || ðŸ’° Advantage+ || US || BROAD || 7C || Existing_customer_5% || 19/12/24 Ad set,SHARE,"$1,794","54,666",2024-12-19,2025-03-31,102
25,CB_2023_Jul_FB_2284_DA_V05_9x16_VID_EN_Opti_C-Sale_CTA-SMR_Pain-W_M-JANW_VL-30s_TR-None_G-M_P-None_S-WHAT_FB2103V02,ðŸŒ¶ï¸ || US || ASC+ || ->CC141 || VIDEO Only || US+CA || 0% EXISTING CAP || 7C || 07/08.24  Ad set,VIDEO,"$1,775","57,625",2024-08-07,2025-03-31,236
26,CB_2025_Mar_FB_3890_DT_V04_1x1_IMG_EN_New_C-NONE_Evergreen_CTA-None_Angle-W_M-NONE_VL-None_G-NONE_P-OG_S-NONE,US || ASC+ || Website ONLY || A/B TEST || 7DC || Existing 0% || 24.03.2025  Ad set,,"$1,691","108,559",2025-03-24,2025-03-31,7
27,CB_2023_May_FB_2263_MB_V04_9x16_VID_EN_New_C-Sale_CTA-SMR_Pain-W_M-JOG_VL-45s_TR-None_G-M-F_P-None_S-Moon,ðŸŒ¶ï¸ || US || ASC+ || ->CC141 || VIDEO Only || US+CA || 0% EXISTING CAP || 7C || 07/08.24  Ad set,VIDEO,"$1,681","47,427",2024-08-07,2025-03-31,236
28,CB_2025_Mar_FB_3907_CHUB-AA_V03__IMG_EN_Opti_C-Price_CTA-NONE_Angle-None_M-NONE_VL-None_TR-None_G-NONE_P-OG_S-NONE,ðŸŒ¶ï¸ || US || ASC+ || ->CC141 || VIDEO Only || US+CA || 0% EXISTING CAP || 7C || 07/08.24  Ad set,,"$1,663","68,503",2025-03-25,2025-03-31,6
29,CB_2025_Feb_FB_3883_LZ-RP_V05_9x16_VID_EN_Opti_C-BulletPoints_Evergreen_CTA-SALE_Angle-W_M-JANW_VL-30s_G-M_P-OG_S-WHAT_FB2284V05,3883 - Wiiner opti man boobs t levels || Enhancements: OFF || CBV1 || Batch 1 || 7C || 10/03/25w11,,"$1,551","109,885",2025-03-10,2025-03-31,21
30,CB_2025_Mar_FB_3891_VK_V05_1x1_IMG_EN_New_C-BulletPoints_Evergreen_CTA-65_Angle-W-B-C_M-NONE_VL-None_G-M_P-OG_S-NONE,US || ASC+ || Website ONLY || A/B TEST || 7DC || Existing 0% || 24.03.2025  Ad set,,"$1,518","95,817",2025-03-24,2025-03-31,7
31,CB_2023_Jul_FB_2217_IB_V04_9x16_VID_EN_Opti_C-Pointing_CTA-SMR_Pain-W-B_M-TRC_VL-30s_TR-None_G-F_P-None_S-FRIGGA,US || ASC+ || Website + Shop || 7DC || Existing 0% || 24.03.2025 Ad set,,"$1,507","47,446",2025-03-24,2025-03-31,7
32,CB_2023_Dec_FB_2712_RS-DP_V02_1x1_VID_EN_Opti_C-WrittenTesti_CTA-SALE_Pain-W-B-C_M-NONE_VL-None_TR-None_G-NONE_P-V2_S-NONE_FB2227V08,CBV2 || EU (UK) || ðŸ’° Advantage+ || US || BROAD || 7C || Existing_customer_5% || 15/12/24 Ad set,SHARE,"$1,469","40,562",2024-12-15,2025-03-31,106
33,CB_2023_Jul_FB_2217_IB_V04_9x16_VID_EN_Opti_C-Pointing_CTA-SMR_Pain-W-B_M-TRC_VL-30s_TR-None_G-F_P-None_S-FRIGGA,US || ASC+ || Website ONLY || A/B TEST || 7DC || Existing 0% || 24.03.2025  Ad set,,"$1,426","45,802",2025-03-24,2025-03-31,7
34,CB_2024_Jan_FB_2764_RS_V04_9x16_VID_EN_Opti_C-SingleTesti_CTA-SALE_Pain-W_M-TRC_VL-45s_TR-None_G-F_P-OG_S-MOON_FB2263V04_Page_Personal_Coach,CBV2 || AU || ðŸ’° Advantage+ || US || BROAD || 7C || Existing_customer_5% || 19/12/24 Ad set,VIDEO,"$1,338","25,774",2025-01-16,2025-03-31,74
35,CB_2025_Mar_FB_3884_SO_V12_9x16_IMG_EN_New_C-NONE_Evergreen_CTA-NONE_Angle-W-B-C_M-Nate_VL-15s_G-MF_P-OG_S-NEW,3884_SO || Batch 1 || 7C || 18/03/2025w12,VIDEO,"$1,331","54,571",2025-03-20,2025-03-31,11
36,CB_2025_Jan_FB_3723_SO_V04_4x5_IMG_EN_New_C-NONE_Evergreen_CTA-SALE_Angle-W_M-NONE_VL-None_G-NONE_P-NONE_S-NONE,ðŸŒ¶ï¸ || US || ASC+ || ->CC141 || VIDEO Only || US+CA || 0% EXISTING CAP || 7C || 07/08.24  Ad set,SHARE,"$1,309","83,128",2025-02-12,2025-03-31,47
37,CB_2024_Dec_FB_3601_VK-DP_V09_4x5_VID_EN_Opti_C-Dance_CTA-NY_Pain-W-B_M-JOG_VL-30s_TR-None_G-F_P-OG_S-WHAT_FB3045V01,CBV2 || AU || ðŸ’° Advantage+ || US || BROAD || 7C || Existing_customer_5% || 19/12/24 Ad set,SHARE,"$1,303","42,574",2025-01-03,2025-03-31,87
38,CB_2023_Jul_FB_2284_DA_V05_9x16_VID_EN_Opti_C-Sale_CTA-SMR_Pain-W_M-JANW_VL-30s_TR-None_G-M_P-None_S-WHAT_FB2103V02,US || ASC+ || Website + Shop || 7DC || Existing 0% || 24.03.2025 Ad set,,"$1,298","38,239",2025-03-24,2025-03-31,7
39,CB_2024_Jan_FB_2764_RS_V04_9x16_VID_EN_Opti_C-SingleTesti_CTA-SALE_Pain-W_M-TRC_VL-45s_TR-None_G-F_P-OG_S-MOON_FB2263V04_Page_Personal_Coach,AU || Page: Branded & 3rd Party || 2764 || Trinity Results Too Fast || 1C || 10/01/2025w02,VIDEO,"$1,289","28,678",2025-01-10,2025-03-28,77
40,CB_2024_Oct_FB_3214_DT-KB_V04_1x1_IMG_EN_New_C-ADVRT_Evergreen_CTA-NONE_Angle-W_M-NONE_VL-None_G-NONE_P-OG_S-NONE,CA || Advantage+ || Advertorial || 7C ||  BROAD || Existing_customer_0% || 20/03/25 Ad set,SHARE,"$1,258","99,266",2025-03-20,2025-03-31,11
41,CB_2025_Jan_FB_3723_SO_V04_4x5_IMG_EN_New_C-NONE_Evergreen_CTA-SALE_Angle-W_M-NONE_VL-None_G-NONE_P-NONE_S-NONE.png,CBV2 || AU || ðŸ’° Advantage+ || US || BROAD || 7C || Existing_customer_5% || 19/12/24 Ad set,SHARE,"$1,177","83,940",2025-02-25,2025-03-30,33
42,CB_2025_Feb_FB_3860_LZ-DP_V03_9x16_VID_EN_Opti_C-Testimonial_Evergreen_CTA-SALE_Angle-W_M-MOOD_VL-20s_G-M_P-OG_S-WOOD_FB21176V11_1,AU || 3860_LZ-DP || 7C || 18/03/2025w12,VIDEO,"$1,156","46,749",2025-03-18,2025-03-30,12
43,CB_2025_Mar_FB_3914_DT-DP_V01_9x16_VID_EN_New_C-Trend_Sale_CTA-SPRNG_Angle-W-B-C_M-JOG_VL-30s_G-F_P-OG_S-NEW,"3914 - #9 GF's POV, male confidence || Batch 1 || Enhancements: OFF || CBV1 || 7C || 24/03/25w13",,"$1,152","53,890",2025-03-24,2025-03-31,7
44,CB_2024_Mar_FB_2883_DA_V01_1x1_IMG_ES_Opti_C-WrittenTesti_CTA-60_Pain-W-B-C_M-NONE_VL-None_TR-None_G-NONE_P-V2_S-NONE_FB2712V02,LATAM ðŸ‡ªðŸ‡¸ || CBV2 || Advantage+ || 0% EXISTING CAP || BROAD || 7C || 22/03/25 Campaign Ad set,,"$1,107","93,462",2025-03-22,2025-03-31,9
45,CB_2023_Jul_FB_2226_MB_V04_9x16_VID_EN_Opti_C-Testim_CTA-SMR_Pain-W_M-MIX_VL-30s_TR-None_G-F_P-None_S-Starry,ðŸŒ¶ï¸ || US || ASC+ || ->CC141 || VIDEO Only || US+CA || 0% EXISTING CAP || 7C || 07/08.24  Ad set,VIDEO,"$1,084","27,665",2024-10-28,2025-03-31,154
46,CB_2024_Aug_FB_3097_VK-DP_V03_9x16_VID_EN_Opti_C-Benefits_CTA-SMR_Pain-W-B_M-MIX_VL-45s_TR-None_G-MF_P-OG_S-WHAT_FB2516V13,US || ASC+ || Website + Shop || 7DC || Existing 0% || 24.03.2025 Ad set,,"$1,074","37,408",2025-03-24,2025-03-31,7
47,CB_2024_Jan_FB_2797_VK-RP-RS_V02_1x1_IMG_EN_Opti_C-ADVRT_CTA-NONE_Pain-W_M-NONE_VL-None_TR-None_G-NONE_P-V2_S-NONE,CBV2 || UK || Advantage+ || Advertorial |  || 0% EXISTING CAP || BROAD || 7C || ad set 18/03/25,SHARE,"$1,071","24,551",2025-03-18,2025-03-31,13
48,CB_2024_Feb_FB_2812_MB-RP_V07_9x16_VID_EN_Opti_C-Sale_CTA-C65_Pain-W_M-NONE_VL-30s_TR-None_G-MF_P-Plan_S-NEW_FB2601V04_1,US || Kilo Product's leads LAL || 7C || 04/03/25,VIDEO,"$1,043","30,388",2025-03-04,2025-03-31,27
49,CB_2024_Aug_FB_3097_VK-DP_V03_9x16_VID_EN_Opti_C-Benefits_CTA-SMR_Pain-W-B_M-MIX_VL-45s_TR-None_G-MF_P-OG_S-WHAT_FB2516V13,ðŸŒ¶ï¸ || US || ASC+ || ->CC141 || VIDEO Only || US+CA || 0% EXISTING CAP || 7C || 07/08.24  Ad set,VIDEO,"$1,034","40,765",2024-09-04,2025-03-31,208
50,CB_2024_Nov_FB_3264_LZ_V29_4x5_VID_EN_Opti_C-NegativeMark_Sale_CTA-BF_Angle-W-B_M-LRNS_VL-30s_G-M_P-OG_S-NONE,ðŸŒ¶ï¸ || US || ASC+ || ->CC141 || VIDEO Only || US+CA || 0% EXISTING CAP || 7C || 07/08.24  Ad set,VIDEO,"$1,012","34,418",2024-12-04,2025-03-31,117
51,CB_2025_Mar_FB_3891_VK_V05_1x1_IMG_EN_New_C-BulletPoints_Evergreen_CTA-65_Angle-W-B-C_M-NONE_VL-None_G-M_P-OG_S-NONE,US || ASC+ || Website + Shop || 7DC || Existing 0% || 24.03.2025 Ad set,,"$1,009","67,024",2025-03-24,2025-03-31,7
52,CB_2023_May_FB_2263_MB_V04_9x16_VID_EN_New_C-Sale_CTA-SMR_Pain-W_M-JOG_VL-45s_TR-None_G-M-F_P-None_S-Moon,CBV2 || AU || ðŸ’° Advantage+ || US || BROAD || 7C || Existing_customer_5% || 19/12/24 Ad set,VIDEO,$990,"25,195",2024-12-19,2025-03-31,102
53,CB_2024_Mar_FB_2883_DA_V06_9x16_VID_ES_Opti_C-Pointing_CTA-CTA_Pain-W-B_M-TRC_VL-30s_TR-None_G-F_P-OG_S-FRIGGA_FB2217V04.mp4,LATAM ðŸ‡ªðŸ‡¸ || CBV2 || Advantage+ || 0% EXISTING CAP || BROAD || 7C || 22/03/25 Campaign Ad set,,$987,"67,628",2025-03-22,2025-03-31,9
54,CB_2023_Jul_FB_2284_DA_V05_9x16_VID_EN_Opti_C-Sale_CTA-SMR_Pain-W_M-JANW_VL-30s_TR-None_G-M_P-None_S-WHAT_FB2103V02,CA || ASC+ || 0% EXISTING || 7DC || 18.03.2025,VIDEO,$982,"60,296",2025-03-18,2025-03-31,13
55,CB_2025_Feb_FB_3860_LZ-DP_V03_9x16_VID_EN_Opti_C-Testimonial_Evergreen_CTA-SALE_Angle-W_M-MOOD_VL-20s_G-M_P-OG_S-WOOD_FB21176V11_1,US || ASC+ || Website + Shop || 7DC || Existing 0% || 24.03.2025 Ad set,,$970,"45,883",2025-03-24,2025-03-31,7
56,CB_2023_Jul_FB_2217_IB_V04_9x16_VID_EN_Opti_C-Pointing_CTA-SMR_Pain-W-B_M-TRC_VL-30s_TR-None_G-F_P-None_S-FRIGGA,CA || ASC+ || 0% EXISTING || 7DC || 18.03.2025,VIDEO,$967,"48,642",2025-03-18,2025-03-31,13
57,CB_2025_Mar_FB_3910_LZ-DP_V04_9x16_VID_EN_Opti_C-Testimonial_Evergreen_CTA-NONE_Angle-W_M-TRC_VL-15s_G-F_P-TRIAL_S-FRIGGA_FB2217V04.mp4,US || Free trial offer || Trial ads || ATC || 7C || 16/03/25,,$948,"42,301",2025-03-16,2025-03-31,15
58,CB_2023_Jul_FB_2226_MB_V04_9x16_VID_EN_Opti_C-Testim_CTA-SMR_Pain-W_M-MIX_VL-30s_TR-None_G-F_P-None_S-Starry,CA || ASC+ || 0% EXISTING || 7DC || 18.03.2025,VIDEO,$896,"47,083",2025-03-18,2025-03-31,13
59,CB_2023_Jul_FB_2284_DA_V05_9x16_VID_EN_Opti_C-Sale_CTA-SMR_Pain-W_M-JANW_VL-30s_TR-None_G-M_P-None_S-WHAT_FB2103V02,US || ASC+ || Website ONLY || A/B TEST || 7DC || Existing 0% || 24.03.2025  Ad set,,$892,"29,158",2025-03-24,2025-03-31,7
60,CB_2023_Jul_FB_2217_IB_V04_9x16_VID_EN_Opti_C-Pointing_CTA-SMR_Pain-W-B_M-TRC_VL-30s_TR-None_G-F_P-None_S-FRIGGA,CBV2 || EU (UK) || ðŸ’° Advantage+ || US || BROAD || 7C || Existing_customer_5% || 15/12/24 Ad set,VIDEO,$865,"38,134",2024-12-18,2025-03-31,103
61,CB_2025_Feb_FB_3863_DT-DP_V02_9x16_VID_EN_New_C-Trend_Sale_CTA-70_Angle-W_M-POW_VL-30s_G-M_P-OG_S-NEW.mp4,3863 - Aaron man boobs vid || Enhancements: OFF || CBV1 || Batch 1 || 7C || 26/02/25w09 || Valentinas,VIDEO,$859,"44,233",2025-02-26,2025-03-31,33
62,CB_2025_Mar_FB_3904_DT_V01_9x16_VID_EN_New_C-Trend_Evergreen_CTA-NONE_Angle-W_M-MIX_VL-30s_G-MF_P-OG_S-New,3904 - Notion / I thought my man was cheating on me || Enhancements: OFF || CBV1 || Batch 1 || 7C || 16/03/25w12,,$854,"36,302",2025-03-14,2025-03-31,17
63,CB_2023_Dec_FB_2696_RS_V03_9x16_VID_EN_Opti_C-Sale_CTA-NY65_Pain-W-B_M-JANW_VL-30s_TR-None_G-M_P-OG_S-WHAT_FB2284V05,CBV2 || AU || ðŸ’° Advantage+ || US || BROAD || 7C || Existing_customer_5% || 19/12/24 Ad set,VIDEO,$836,"26,798",2025-01-13,2025-03-31,77
64,CB_2025_Mar_FB_3907_CHUB-AA_V03__IMG_EN_Opti_C-Price_CTA-NONE_Angle-None_M-NONE_VL-None_TR-None_G-NONE_P-OG_S-NONE,3907 â€“ CHUB Clean Sale OPTI v2 || Enhancements: OFF || CBV1 || Batch 1 || 7C || 16/03/25w12,,$831,"29,623",2025-03-16,2025-03-31,15
65,CB_2025_Feb_FB_3827_LZ_V03_1x1_IMG_EN_Opti_C-Headline_Evergreen_CTA-SALE_Angle-W_M-NONE_VL-None_G-M_P-CBV2_S-NONE_FB3705V02,3827 - V2 img winner opti || Batch 2 || 7C || 18/02/2025w08,SHARE,$829,"29,080",2025-02-18,2025-03-31,41
66,CB_2024_Sep_FB_3175_DA-KB_V03_1x1_IMG_EN_New_C-ADVRT_Evergreen_CTA-NONE_Angle-W_M-NONE_VL-None_G-NONE_P-CBV2_S-NONE_blog_colonbroomvsmammoth_cv_en,CBV2 || Advantage+ || Advertorial || Higher pricing || US || 0% EXISTING CAP || BROAD || 7C || 20/01/25  Campaign Ad set,SHARE,$821,"33,030",2025-01-20,2025-03-31,70
67,CB_2024_Aug_FB_3090_DT-DP_V02_9x16_VID_EN_Opti_C-MakingOf_CTA-CTA_Pain-W-B-C_M-POW_VL-45s_TR-None_G-M_P-OG_S-Moon_FB3029V04,CBV2 || EU (UK) || ðŸ’° Advantage+ || US || BROAD || 7C || Existing_customer_5% || 15/12/24 Ad set,SHARE,$817,"32,475",2024-12-19,2025-03-31,102
68,CB_2025_Mar_FB_3909_DT-DP_V03_9x16_VID_EN_New_C-Trend_Evergreen_CTA-SMRBOD_Angle-W-B-C_M-JANW_VL-30s_G-M_P-OG_S-NEW,3909 - Shirtless anxiety VID || Batch 1 || Enhancements: OFF || CBV1 || 7C || 24/03/25w13,,$806,"39,848",2025-03-24,2025-03-31,7
69,CB_2025_Feb_FB_3827_LZ_V01_1x1_IMG_EN_Opti_C-Headline_Evergreen_CTA-NONE_Angle-W_M-NONE_VL-None_G-M_P-CBV2_S-NONE_FB3723V04.png,US || CBV2 || Default landing || 7C || 26/03/25,,$796,"46,353",2025-03-26,2025-03-28,2
70,CB_2025_Mar_FB_3903_VK_V01_9x16_VID_EN_New_C-BulletPoints_Evergreen_CTA-65_Angle-W-B-C_M-MIX_VL-30s_G-MF_P-OG_S-NEW,3903 - #13 My husband hides his beer belly - VK  || Batch 1 || Enhancements: OFF || CBV1 || 7C || 24/03/25w13,,$783,"34,700",2025-03-24,2025-03-31,7
71,CB_2025_Mar_FB_3922_SO-JT_V03_1x1_IMG_EN_New_C-NONE_Evergreen_CTA-NONE_Angle-W-B-C_M-NONE_VL-None_G-NONE_P-OG_S-NONE,3922 - CB V1 REDLINER || Batch 1 || Enhancements: OFF || CBV1 || 7C || 24/03/25w13,,$774,"26,817",2025-03-24,2025-03-31,7
72,CB_2023_Apr_FB_1989_RS_V08_9x16_VID_EN_Opti_C-Trend_CTA-SMR_Pain-W_M-MIX_VL-30s_TR-None_G-MF_P-None,ðŸŒ¶ï¸ || US || ASC+ || ->CC141 || VIDEO Only || US+CA || 0% EXISTING CAP || 7C || 07/08.24  Ad set,VIDEO,$773,"28,953",2024-08-07,2025-03-24,229
73,CB_2024_Apr_FB_2970_RS_V02_1x1_GIF_EN_Opti_C-WrittenTesti_CTA-CTA_Pain-W_M-NONE_VL-7s_TR-None_G-NONE_P-V2_S-NEW,2970 - XL TO M || Batch 1 || Enhancements: OFF || CBV2 || 7C || 25/03/25w13,,$766,"19,496",2025-03-24,2025-03-31,7
74,CB_2025_Mar_FB_3928_VK-DP_V05_1x1_VID_EN_Opti_C-BulletPoints_Evergreen_CTA-NONE_Angle-W-B-C_M-NONE_VL-None_G-M_P-OG_S-NONE_FB3891V05,3928 - opti 3891 kinda sorta opti with man boobs - DP-VK || Batch 1 || Enhancements: OFF || CBV1 || 7C || 24/03/25w13,,$757,"46,333",2025-03-24,2025-03-31,7
75,CB_2025_Mar_FB_3924_SO-DP_V06_1x1_IMG_EN_New_C-NONE_Evergreen_CTA-NONE_Angle-W-B-C_M-NONE_VL-None_G-NONE_P-OG_S-NONE,3924 - #17 man boobs/dad bod body text IMG || Batch 2 || Enhancements: OFF || CBV1 || 7C || 24/03/25w13,,$735,"44,370",2025-03-24,2025-03-31,7
76,CB_2025_Mar_FB_3924_SO-DP_V03_1x1_IMG_EN_New_C-NONE_Evergreen_CTA-NONE_Angle-W-B-C_M-NONE_VL-None_G-NONE_P-OG_S-NONE,3924 - #17 man boobs/dad bod body text IMG || Batch 1 || Enhancements: OFF || CBV1 || 7C || 24/03/25w13,,$732,"32,814",2025-03-24,2025-03-31,7
77,CB_2025_Feb_FB_3863_DT-DP_V03_9x16_VID_EN_New_C-Trend_Sale_CTA-70_Angle-W_M-POW_VL-30s_G-M_P-OG_S-NEW,ðŸŒ¶ï¸ || US || ASC+ || ->CC141 || VIDEO Only || US+CA || 0% EXISTING CAP || 7C || 07/08.24  Ad set,,$731,"29,805",2025-03-10,2025-03-31,21
78,CB_2024_Jan_FB_2784_RS_V02_9x16_VID_EN_Opti_C-Pointing_CTA-SALE_Pain-W_M-JOG_VL-30s_TR-None_G-F_P-OG_S-OLLIE_FB2181V01,CBV2 || EU (UK) || ðŸ’° Advantage+ || US || BROAD || 7C || Existing_customer_5% || 15/12/24 Ad set,VIDEO,$724,"17,131",2025-01-09,2025-03-31,81
79,CB_2025_Mar_FB_3891_VK_V05_1x1_IMG_EN_New_C-BulletPoints_Evergreen_CTA-65_Angle-W-B-C_M-NONE_VL-None_G-M_P-OG_S-NONE-1,3891 - LOW T LEVELS - VK || Enhancements: OFF || CBV1 || Batch 2 || 7C || 10/03/25w11,,$709,"39,866",2025-03-11,2025-03-29,18
80,CB_2024_Jan_FB_2797_VK-RP-RS_V02_1x1_IMG_EN_Opti_C-ADVRT_CTA-NONE_Pain-W_M-NONE_VL-None_TR-None_G-NONE_P-V2_S-NONE,CBV2 || AU || Advantage+ || Advertorial |  || 0% EXISTING CAP || BROAD || 7C || ad set 18/03/25,SHARE,$702,"17,368",2025-03-20,2025-03-30,10
81,CB_2025_Feb_FB_3818_LZ-VU_V18_1x1_IMG_EN_Opti_C-Headline_Evergreen_CTA-NONE_Angle-Cort_M-NONE_VL-None_G-NONE_P-NONE_S-NONE_FB3251V01,3818 - It's not cheap Months+holidays || May || Enhancements: OFF || CBV1 || 7C || 17/03/25w12,,$699,"17,904",2025-03-17,2025-03-29,12
82,CB_2025_Mar_FB_3920_VK_V12_1x1_VID_EN_Opti_C-BulletPoints_Evergreen_CTA-NONE_Angle-W-B-C_M-NONE_VL-None_G-M_P-OG_S-NONE_FB3891V05,3920 - 3891 OPTI - VK || Batch 3 || Enhancements: OFF || CBV1 || 7C || 24/03/25w13,,$692,"37,993",2025-03-24,2025-03-31,7
83,CB_2025_Mar_FB_3891_VK_V05_1x1_IMG_EN_New_C-BulletPoints_Evergreen_CTA-65_Angle-W-B-C_M-NONE_VL-None_G-M_P-OG_S-NONE,3891 - LOW T LEVELS - VK || Enhancements: OFF || CBV1 || Batch 2 || 7C || 10/03/25w11,,$677,"39,596",2025-03-11,2025-03-29,18
84,CB_2025_Mar_FB_3890_DT_V02_1x1_IMG_EN_New_C-NONE_Evergreen_CTA-None_Angle-W_M-NONE_VL-None_G-NONE_P-OG_S-NONE,ðŸŒ¶ï¸ || US || ASC+ || ->CC141 || VIDEO Only || US+CA || 0% EXISTING CAP || 7C || 07/08.24  Ad set,,$675,"31,829",2025-03-15,2025-03-31,16
85,CB_2024_Mar_FB_2883_DA_V02_1x1_IMG_ES_Opti_C-WrittenTesti_CTA-60_Pain-W-B-C_M-NONE_VL-None_TR-None_G-NONE_P-V2_S-NONE_FB2762V05,LATAM ðŸ‡ªðŸ‡¸ || CBV2 || Advantage+ || 0% EXISTING CAP || BROAD || 7C || 22/03/25 Campaign Ad set,,$673,"41,561",2025-03-22,2025-03-31,9
86,CB_2025_Feb_FB_3827_LZ_V01_1x1_IMG_EN_Opti_C-Headline_Evergreen_CTA-NONE_Angle-W_M-NONE_VL-None_G-M_P-CBV2_S-NONE_FB3723V04.png,US || CBV2 || FLOW V2 landing || 7C || 26/03/25,,$670,"38,371",2025-03-26,2025-03-28,2
87,CB_2025_Mar_FB_3890_DT_V04_1x1_IMG_EN_New_C-NONE_Evergreen_CTA-None_Angle-W_M-NONE_VL-None_G-NONE_P-OG_S-NONE,US || ASC+ || Website + Shop || 7DC || Existing 0% || 24.03.2025 Ad set,,$669,"37,216",2025-03-24,2025-03-31,7
88,CB_2025_Feb_FB_3883_LZ-RP_V05_9x16_VID_EN_Opti_C-BulletPoints_Evergreen_CTA-SALE_Angle-W_M-JANW_VL-30s_G-M_P-OG_S-WHAT_FB2284V05,CBV2 || AU || ðŸ’° Advantage+ || US || BROAD || 7C || Existing_customer_5% || 19/12/24 Ad set,VIDEO,$664,"24,566",2025-03-28,2025-03-31,3
89,CB_2024_Apr_FB_2961_DA-DP_V01_9x16_VID_EN_Opti_C-Trend_CTA-SMR_Pain-W_M-SMT_VL-15s_TR-BadReviews_G-F_P-V2_S-NEW_FB2917V06,2961 - 2917 opti || Batch 1 || Enhancements: OFF || CBV2 || 7C || 25/03/25w13,,$660,"36,310",2025-03-25,2025-03-31,6
90,CB_2025_Mar_FB_3916_VK-DP_V06_1x1_VID_EN_New_C-BulletPoints_Evergreen_CTA-NONE_Angle-W-B-C_M-NONE_VL-None_G-M_P-OG_S-NONE,3916 - #11 Date night -VK || Batch 2 || Enhancements: OFF || CBV1 || 7C || 24/03/25w13,,$654,"25,710",2025-03-24,2025-03-31,7
91,CB_2024_Sep_FB_3175_DA-KB_V04_1x1_IMG_EN_New_C-ADVRT_Evergreen_CTA-NONE_Angle-W_M-NONE_VL-None_G-NONE_P-CBV2_S-NONE_blog_colonbroomvsmammoth_cv_en,CBV2 || A/B test CTA button: Control || CBV2 vs Happy Mammoth || 7C || 26/03/25,,$646,"20,916",2025-03-26,2025-03-31,5
92,CB_2025_Mar_FB_3919_LZ_V01_1x1_IMG_EN_Opti_C-Headline_Evergreen_CTA-NONE_Angle-Horm_M-NONE_VL-30s_G-M_P-OG_S-NONE_FB3891V05,3919 - cb Spartan || Batch 1 || Enhancements: OFF || CBV1 || 7C || 24/03/25w13,,$638,"30,620",2025-03-24,2025-03-31,7
93,CB_2023_May_FB_2103_MB_V02_9x16_VID_EN_Opti_C-Sale_CTA-SMR_Pain-W_M-JOG_VL-30s_TR-None_G-M-F_P-None_S-What,US || Manual Bid || BFCM || COST CAP 71 || 1C || 15/11/24,VIDEO,$626,"20,542",2024-11-15,2025-03-31,136
94,CB_2025_Mar_FB_3934_CHUB-KZ_V03_9x16_VID_EN_New_C-NONE_CTA-NONE_Angle-None_M-NONE_VL-None_TR-None_G-NONE_P-NONE_S-NONE,3934 - CHUB FireIceHooks || Batch 1 || Enhancements: OFF || CBV1 || 7C || 24/03/25w13,,$619,"27,167",2025-03-25,2025-03-29,4
95,CB_2025_Mar_FB_3920_VK_V01_1x1_VID_EN_Opti_C-BulletPoints_Evergreen_CTA-NONE_Angle-W-B-C_M-NONE_VL-None_G-M_P-OG_S-NONE_FB3891V05,3920 - 3891 OPTI - VK || Batch 1|| Enhancements: OFF || CBV1 || 7C || 24/03/25w13,,$603,"43,809",2025-03-24,2025-03-29,5
96,CB_2024_Sep_FB_3175_DA-KB_V04_1x1_IMG_EN_New_C-ADVRT_Evergreen_CTA-NONE_Angle-W_M-NONE_VL-None_G-NONE_P-CBV2_S-NONE_blog_colonbroomvsmammothhighprice3_cv_en,CBV2 || A/B test CTA button: Variaton || CBV2 vs Happy Mammoth || 7C || 26/03/25,,$594,"19,424",2025-03-26,2025-03-31,5
97,CB_2025_Feb_FB_3817_SO_V01_4x5_IMG_EN_Opti_C-NONE_Evergreen_CTA-SALE_Angle-W_M-NONE_VL-None_G-NONE_P-NONE_S-NONE_FB3723V07,CBV2 || AU || ðŸ’° Advantage+ || US || BROAD || 7C || Existing_customer_5% || 19/12/24 Ad set,SHARE,$585,"27,942",2025-02-14,2025-03-31,45
98,CB_2025_Jan_FB_3923_VK-KB_V13_1x1_VID_EN_Opti_C-BulletPoints_Evergreen_CTA-65_Angle-W-B-C_M-NONE_VL-None_G-F_P-OG_S-NEW_FB3779V04,3923 - OPTI 3779 - VK || Batch 1 || Enhancements: OFF || CBV1 || 7C || 24/03/25w13,,$573,"17,913",2025-03-24,2025-03-31,7
99,CB_2025_Feb_FB_3860_LZ-DP_V03_9x16_VID_EN_Opti_C-Testimonial_Evergreen_CTA-SALE_Angle-W_M-MOOD_VL-20s_G-M_P-OG_S-WOOD_FB21176V11_1,US || ASC+ || Website ONLY || A/B TEST || 7DC || Existing 0% || 24.03.2025  Ad set,,$558,"28,703",2025-03-24,2025-03-31,7
100,CB_2025_Mar_FB_3918_LZ-DT_V02_9x16_VID_EN_New_C-BulletPoints_Evergreen_CTA-SALE_Angle-W-B_M-MIX_VL-30s_G-MF_P-OG_S-NEW,3918 - when my told my wife  || Batch 1 || Enhancements: OFF || CBV1 || 7C || 24/03/25w13,,$557,"30,016",2025-03-24,2025-03-29,5
101,CB_2025_Mar_FB_3929_LZ-VU_V02_1x1_IMG_EN_New_C-Educational_Evergreen_CTA-NONE_Angle-WellBe_M-NONE_VL-None_G-NONE_P-OG_S-NONE,3929 - bio age health || Batch 1 || Enhancements: OFF || CBV1 || 7C || 24/03/25w13,,$553,"31,559",2025-03-24,2025-03-29,5
102,CB_2024_Apr_FB_2943_DT_V02_9x16_VID_EN_Opti_C-Sale_CTA-CTA_Pain-W_M-MIX_VL-45s_TR-None_G-MF_P-V2_S-WHAT_FB_2429V03,2943 - Opti PPC 2429 || Batch 1 || Enhancements: OFF || CBV2 || 7C || 25/03/25w13,,$535,"27,599",2025-03-24,2025-03-31,7
103,CB_2025_Mar_FB_3915_LZ-DT_V04_9x16_VID_EN_New_C-Testimonial_Evergreen_CTA-SALE_Angle-W-B_M-JOG_VL-30s_G-F_P-OG_S-NEW,3915 - Jogile goes clubbing || Batch 1 || Enhancements: OFF || CBV1 || 7C || 24/03/25w13,,$533,"16,568",2025-03-24,2025-03-29,5
104,CB_2025_Mar_FB_3927_DT_V01_1x1_IMG_EN_New_C-NONE_Evergreen_CTA-None_Angle-W_M-NONE_VL-None_G-NONE_P-OG_S-NONE_FB3890V03,3927 - Opti 3890 || Batch 1 || Enhancements: OFF || CBV1 || 7C || 24/03/25w13,,$506,"27,968",2025-03-24,2025-03-29,5
105,CB_2023_Oct_FB_2516_VK_V13_9x16_VID_EN_Opti_C-Benefits_CTA-AUTUM_Pain-W-B_M-PASQ_VL-30s_TR-None_G-M_P-Plan_S-WHAT,ðŸŒ¶ï¸ || US || ASC+ || ->CC141 || VIDEO Only || US+CA || 0% EXISTING CAP || 7C || 07/08.24  Ad set,VIDEO,$490,"13,224",2024-12-19,2025-03-31,102
106,CB_2025_Mar_FB_3910_LZ-DP_V01_1x1_IMG_EN_Opti_C-Headline_Evergreen_CTA-NONE_Angle-W_M-NONE_VL-None_G-NONE_P-TRIAL_S-NONE_FB3251V02.png,US || Free trial offer || Trial ads || Trial purchase || 7C || 19/03/25,,$489,"19,038",2025-03-19,2025-03-31,12
107,CB_2024_Jan_FB_2797_VK-RP-RS_V02_1x1_IMG_EN_Opti_C-ADVRT_CTA-NONE_Pain-W_M-NONE_VL-None_TR-None,CA || Advantage+ || Advertorial || 7C ||  BROAD || Existing_customer_0% || 20/03/25 Ad set,SHARE,$485,"26,514",2025-03-24,2025-03-31,7
108,CB_2025_Jan_FB_3723_SO_V04_4x5_IMG_EN_New_C-NONE_Evergreen_CTA-SALE_Angle-W_M-NONE_VL-None_G-NONE_P-NONE_S-NONE,US || Kilo Product's leads LAL || 7C || 04/03/25,SHARE,$473,"23,660",2025-03-04,2025-03-31,27
109,CB_2025_Jan_FB_3742_SO-DP-KB_V06_4x5_IMG_EN_Opti_C-NONE_Evergreen_CTA-SALE_Angle-W_M-NONE_VL-None_G-NONE_P-CBV2_S-NONE3665V01.png,US || CBV2 || FLOW V2 landing || 7C || 26/03/25,,$465,"23,187",2025-03-26,2025-03-28,2
110,CB_2024_Jul_FB_3071_VK_V03_9x16_VID_EN_New_C-Benefits_CTA-SALE_Pain-B_M-TOP_VL-30s_TR-None_G-F_P-V2_S-Moon,3071 - Influencers brief 9-10 || Batch 1 || Enhancements: OFF || CBV2 || 7C || 25/03/25w13,,$453,"18,981",2025-03-24,2025-03-28,4
111,CB_2024_Jan_FB_2722_DA-RP_V02_9x16_VID_EN_New_C-Buzz_CTA-DISCOUNT_Pain-W_M-STOCK_VL-1m_TR-None_G-MF_P-V2_S-NEW,2722 - Trainspotting ads || Batch 1 || Enhancements: OFF || CBV2 || 7C || 25/03/25w13,,$452,"17,457",2025-03-24,2025-03-28,4
112,CB_2025_Feb_FB_3811_DT_V04_9x16_VID_EN_Opti_C-Sale_Sale_CTA-70_Angle-W_M-JOG_VL-45s_G-M-F_P-OG_S-Moon_FB2263V04,Relaunch || high potential ads ||  || Batch 1 || Enhancements: OFF || CBV1 || 7C || 25/03/25w13,,$449,"17,226",2025-03-25,2025-03-29,4
113,CB_2025_Feb_FB_3817_SO_V01_4x5_IMG_EN_Opti_C-NONE_Evergreen_CTA-SALE_Angle-W_M-NONE_VL-None_G-NONE_P-NONE_S-NONE_FB3723V07,CBV2 || EU (UK) || ðŸ’° Advantage+ || US || BROAD || 7C || Existing_customer_5% || 15/12/24 Ad set,SHARE,$439,"20,290",2025-02-14,2025-03-31,45
114,CB_2024_Aug_FB_3097_VK-DP_V03_9x16_VID_EN_Opti_C-Benefits_CTA-SMR_Pain-W-B_M-MIX_VL-45s_TR-None_G-MF_P-OG_S-WHAT_FB2516V13,US || ASC+ || Website ONLY || A/B TEST || 7DC || Existing 0% || 24.03.2025  Ad set,,$435,"15,696",2025-03-24,2025-03-31,7
115,CB_2024_Feb_FB_2834_DA_V02_4x5_IMG_EN_Opti_C-SingleTesti_CTA-NONE_Pain-W_M-NONE_VL-None_TR-None_G-NONE_P-V2_S-NONE_FB2759V04,CBV2 || AU || ðŸ’° Advantage+ || US || BROAD || 7C || Existing_customer_5% || 19/12/24 Ad set,SHARE,$416,"13,712",2024-12-19,2025-03-31,102
116,CB_2023_May_FB_2263_MB_V04_9x16_VID_EN_New_C-Sale_CTA-SMR_Pain-W_M-JOG_VL-45s_TR-None_G-M-F_P-None_S-Moon,CA || ASC+ || 0% EXISTING || 7DC || 18.03.2025,VIDEO,$414,"19,964",2025-03-18,2025-03-31,13
117,CB_2024_Jan_FB_2762_IK_V05_1x1_IMG_EN_New_C-WrittenTesti_CTA-CTA_Pain-W-B-C_M-NONE_VL-None_TR-None_G-NONE_P-V2_S-NONE,CBV2 || EU (UK) || ðŸ’° Advantage+ || US || BROAD || 7C || Existing_customer_5% || 15/12/24 Ad set,SHARE,$408,"14,343",2024-12-15,2025-03-31,106
118,CB_2025_Mar_FB_3916_VK-DP_V01_1x1_VID_EN_New_C-BulletPoints_Evergreen_CTA-NONE_Angle-W-B-C_M-NONE_VL-None_G-M_P-OG_S-NONE,3916 - #11 Date night -VK || Batch 1 || Enhancements: OFF || CBV1 || 7C || 24/03/25w13,,$393,"18,784",2025-03-24,2025-03-28,4
119,CB_2025_Mar_FB_3890_DT_V02_1x1_IMG_EN_New_C-NONE_Evergreen_CTA-None_Angle-W_M-NONE_VL-None_G-NONE_P-OG_S-NONE,3890 - Your Peak Performance in 6 weeks || Enhancements: OFF || CBV1 || Batch 1 || 7C || 10/03/25w11,,$392,"21,607",2025-03-12,2025-03-31,19
120,CB_2025_Mar_FB_3912_SO-DP_V02_9x16_VID_EN_Opti_C-BulletPoints_Evergreen_CTA-65_Angle-W-B-C_M-PASQ_VL-15s_G-M_P-OG_S-WHAT_FB3833V04,3912 - Admers AI tool opti VID || Batch 1 || Enhancements: OFF || CBV1 || 7C || 24/03/25w13,,$387,"10,928",2025-03-24,2025-03-28,4
121,CB_2024_Jul_FB_3071_VK_V04_9x16_VID_EN_New_C-Benefits_CTA-SALE_Pain-B_M-PINE_VL-30s_TR-None_G-F_P-V2_S-NEW,3071 - Influencers brief 9-10 || Batch 2 || Enhancements: OFF || CBV2 || 7C || 25/03/25w13,,$387,"10,598",2025-03-24,2025-03-28,4
122,CB_2025_Mar_FB_3908_SO_V03_1x1_IMG_EN_New_C-NONE_Evergreen_CTA-NONE_Angle-W-B-C_M-NONE_VL-None_G-NONE_P-OG_S-NONE,3908 - #10 White-collar || Batch_1 || Enhancements: OFF || CBV1 || 7C || 24/03/25w13,,$386,"18,124",2025-03-24,2025-03-29,5
123,CB_2023_Jul_FB_2227_RS_V08_1x1_IMG_EN_New_C-Sale_CTA-CTA_None_M-NONE_VL-None_TR-None_G-NONE_P-None_S-NONE,ðŸŒ¶ï¸ || US || ASC+ || ->CC141 || VIDEO Only || US+CA || 0% EXISTING CAP || 7C || 07/08.24  Ad set,SHARE,$385,"14,586",2024-09-30,2025-03-31,182
124,CB_2025_Mar_FB_3919_LZ_V01_1x1_IMG_EN_Opti_C-Headline_Evergreen_CTA-NONE_Angle-Horm_M-NONE_VL-30s_G-M_P-OG_S-NONE_FB3891V05,CA || ASC+ || 0% EXISTING || 7DC || 18.03.2025,SHARE,$375,"32,313",2025-03-27,2025-03-31,4
125,CB_2025_Mar_FB_3921_DT-DP_V01_9x16_VID_EN_New_C-Trend_Sale_CTA-65_Angle-W_M-POW_VL-30s_G-M_P-OG_S-NEW_FB3863V03,3921 - 3863 opti VID || Batch 1 || Enhancements: OFF || CBV1 || 7C || 24/03/25w13,,$373,"17,556",2025-03-24,2025-03-28,4
126,CB_2024_Mar_FB_2883_DA_V03_9x16_VID_ES_Opti_C-Sale_CTA-60_Pain-W-B_M-JOG_VL-30s_TR-None_G-F_P-V2_S-WHAT_FB2429V03,LATAM ðŸ‡ªðŸ‡¸ || CBV2 || Advantage+ || 0% EXISTING CAP || BROAD || 7C || 22/03/25 Campaign Ad set,,$365,"40,336",2025-03-22,2025-03-31,9
127,CB_2024_Aug_FB_3097_VK-DP_V03_9x16_VID_EN_Opti_C-Benefits_CTA-SMR_Pain-W-B_M-MIX_VL-45s_TR-None_G-MF_P-OG_S-WHAT_FB2516V13,US || Kilo Product's leads LAL || 7C || 04/03/25,VIDEO,$357,"9,914",2025-03-04,2025-03-31,27
128,CB_2024_Sep_FB_3175_DA-KB_V04_1x1_IMG_EN_New_C-ADVRT_Evergreen_CTA-NONE_Angle-W_M-NONE_VL-None_G-NONE_P-CBV2_S-NONE_blog_colonbroomvsmammoth_cv_en,CBV2 || A/B test CTA button: Control || CBV2 vs Happy Mammoth || 7C || 13/03/25,,$344,"10,416",2025-03-13,2025-03-26,13
129,CB_2025_Mar_FB_3938_CHUB-FRP_V01_9x16_VID_EN_New_C-NONE_CTA-NONE_Angle-None_M-NONE_VL-None_TR-None_G-NONE_P-NONE_S-NONE,3938 - CHUB FRP VSL style ads || Batch 1 || Enhancements: OFF || CBV1 || 7C || 24/03/25w13,,$343,"10,463",2025-03-25,2025-03-28,3
130,CB_2025_Jan_FB_3742_SO-DP-KB_V06_4x5_IMG_EN_Opti_C-NONE_Evergreen_CTA-SALE_Angle-W_M-NONE_VL-None_G-NONE_P-CBV2_S-NONE3665V01.png,US || CBV2 || Default landing || 7C || 26/03/25,,$342,"17,978",2025-03-26,2025-03-28,2
131,CB_2025_Mar_FB_3951_LZ_V02_9x16_VID_EN_New_C-Trend_Evergreen_CTA-SALE_Angle-W_M-MAN_VL-15s_G-M_P-OG_S-NEW,3951 - morning routine || Batch 1 || Enhancements: OFF || CBV2 || 7C || 27/03/25w13,,$332,"15,213",2025-03-27,2025-03-31,4
132,CB_2025_Mar_FB_3914_DT-DP_V01_9x16_VID_EN_New_C-Trend_Sale_CTA-SPRNG_Angle-W-B-C_M-JOG_VL-30s_G-F_P-OG_S-NEW,ðŸŒ¶ï¸ || US || ASC+ || ->CC141 || VIDEO Only || US+CA || 0% EXISTING CAP || 7C || 07/08.24  Ad set,,$330,"16,097",2025-03-28,2025-03-31,3
133,CB_2025_Mar_FB_3920_VK_V05_1x1_VID_EN_Opti_C-BulletPoints_Evergreen_CTA-NONE_Angle-W-B-C_M-NONE_VL-None_G-M_P-OG_S-NONE_FB3891V05,3920 - 3891 OPTI - VK || Batch 2 || Enhancements: OFF || CBV1 || 7C || 24/03/25w13,,$327,"16,134",2025-03-24,2025-03-27,3
134,CB_2025_Mar_FB_3911_DT_V03_9x16_VID_EN_Opti_C-SingleTesti_Sale_CTA-Patrick_Angle-W_M-TRC_VL-45s_G-F_P-OG_S-MOON_FB2764V04,CBV2 || EU (UK) || ðŸ’° Advantage+ || US || BROAD || 7C || Existing_customer_5% || 15/12/24 Ad set,VIDEO,$321,"14,237",2025-03-17,2025-03-31,14
135,CB_2024_Sep_FB_3175_DA-KB_V04_1x1_IMG_EN_New_C-ADVRT_Evergreen_CTA-NONE_Angle-W_M-NONE_VL-None_G-NONE_P-CBV2_S-NONE_blog_colonbroomvsmammothhighprice3_cv_en,CBV2 || A/B test CTA button: Variaton || CBV2 vs Happy Mammoth || 7C || 13/03/25,,$320,"9,025",2025-03-13,2025-03-26,13
136,CB_2024_Jan_FB_2783_VK-RP_V02_1x1_IMG_EN_Opti_C-ADVRT_CTA-NONE_Pain-W_M-NONE_VL-None_TR-None_G-NONE_P-V2_S-NONE,CBV2 || UK || Advantage+ || Advertorial |  || 0% EXISTING CAP || BROAD || 7C || ad set 18/03/25,SHARE,$318,"8,457",2025-03-18,2025-03-31,13
137,CB_2024_Feb_FB_2834_DA_V04_4x5_IMG_EN_Opti_C-SingleTesti_CTA-NONE_Pain-W_M-NONE_VL-None_TR-None_G-NONE_P-V2_S-NONE_FB2759V04,CBV2 || AU || ðŸ’° Advantage+ || US || BROAD || 7C || Existing_customer_5% || 19/12/24 Ad set,SHARE,$316,"9,518",2024-12-19,2025-03-31,102
138,CB_2025_Jan_FB_3723_SO_V04_4x5_IMG_EN_New_C-NONE_Evergreen_CTA-SALE_Angle-W_M-NONE_VL-None_G-NONE_P-NONE_S-NONE,CA || ASC+ || 0% EXISTING || 7DC || 18.03.2025,SHARE,$316,"32,130",2025-03-18,2025-03-31,13
139,CB_2025_Jan_FB_3723_SO_V07_4x5_IMG_EN_New_C-NONE_Evergreen_CTA-SALE_Angle-W_M-NONE_VL-None_G-NONE_P-NONE_S-NONE,CBV2 || US || Manual Bid: ROAS GOAL: 1.00 -> 1.1 || 7DC || 22/01/2025,SHARE,$312,"11,777",2025-02-11,2025-03-31,48
140,CB_2024_Sep_FB_3175_DA-KB_V01_1x1_IMG_EN_New_C-ADVRT_Evergreen_CTA-NONE_Angle-W_M-NONE_VL-None_G-NONE_P-CBV2_S-NONE_blog_colonbroomvsmammoth_cv_en,CBV2 || Advantage+ || Advertorial || Higher pricing || US || 0% EXISTING CAP || BROAD || 7C || 20/01/25  Campaign Ad set,SHARE,$307,"11,502",2025-01-20,2025-03-31,70
141,CB_2025_Mar_FB_3884_SO_V04_1x1_IMG_EN_New_C-NONE_Evergreen_CTA-NONE_Angle-W_M-NONE_VL-None_G-NONE_P-OG_S-NONE,3884 - Body Shaming Angle || Enhancements: OFF || CBV1 || Batch 1 || 7C || 10/03/25w11,,$299,"15,465",2025-03-12,2025-03-29,17
142,CB_2025_Mar_FB_3908_SO_V09_9x16_VID_EN_New_C-NONE_Evergreen_CTA-NONE_Angle-W-B-C_M-NONE_VL-15s_G-NONE_P-OG_S-NEW,3908 - #10 White-collar || Batch_2 || Enhancements: OFF || CBV1 || 7C || 24/03/25w13,,$281,"12,678",2025-03-24,2025-03-28,4
143,CB_2024_Oct_FB_3214_DT-KB_V03_1x1_IMG_EN_New_C-ADVRT_Evergreen_CTA-NONE_Angle-W_M-NONE_VL-None_G-NONE_P-OG_S-NONE,CA || Advantage+ || Advertorial || 7C ||  BROAD || Existing_customer_0% || 20/03/25 Ad set,SHARE,$277,"21,108",2025-03-20,2025-03-31,11
144,CB_2025_Mar_FB_3917_CHUB-AS_V03_9x16_VID_EN_New_C-NONE_CTA-NONE_Angle-None_M-NONE_VL-None_TR-None_G-NONE_P-NONE_S-NONE,3917 - CHUB Ice Phone Hook || Batch 1 || Enhancements: OFF || CBV1 || 7C || 24/03/25w13,,$266,"6,983",2025-03-24,2025-03-28,4
145,CB_2024_Jan_FB_2783_VK-RP_V02_1x1_IMG_EN_Opti_C-ADVRT_CTA-NONE_Pain-W_M-NONE_VL-None_TR-None_G-NONE_P-V2_S-NONE,CBV2 || AU || Advantage+ || Advertorial |  || 0% EXISTING CAP || BROAD || 7C || ad set 18/03/25,SHARE,$265,"13,729",2025-03-20,2025-03-31,11
146,CB_2024_Apr_FB_2970_RS_V02_1x1_GIF_EN_Opti_C-WrittenTesti_CTA-CTA_Pain-W_M-NONE_VL-7s_TR-None_G-NONE_P-V2_S-NEW,CBV2 || US || Manual Bid: ROAS GOAL: 1.00 -> 1.1 || 7DC || 22/01/2025,,$254,"5,507",2025-03-27,2025-03-31,4
147,CB_2025_Feb_FB_3827_LZ_V03_1x1_IMG_EN_Opti_C-Headline_Evergreen_CTA-SALE_Angle-W_M-NONE_VL-None_G-M_P-CBV2_S-NONE_FB3705V02,CBV2 || US || Manual Bid: ROAS GOAL: 1.00 -> 1.1 || 7DC || 22/01/2025,SHARE,$251,"6,882",2025-02-18,2025-03-31,41
148,CB_2024_Sep_FB_3175_DA-KB_V02_1x1_IMG_EN_New_C-ADVRT_Evergreen_CTA-NONE_Angle-W_M-NONE_VL-None_G-NONE_P-CBV2_S-NONE_blog_colonbroomvsmammoth_cv_en,CBV2 || Advantage+ || Advertorial || Higher pricing || US || 0% EXISTING CAP || BROAD || 7C || 20/01/25  Campaign Ad set,SHARE,$248,"14,343",2025-01-20,2025-03-31,70
149,CB_2025_Mar_FB_3902_SO-JT_V01_1x1_IMG_EN_New_C-NONE_Evergreen_CTA-NONE_Angle-W-B-C_M-NONE_VL-None_G-NONE_P-OG_S-NONE,3902 - OZEMPIC MEET YOUR MATCH / V1 || Enhancements: OFF || CBV1 || Batch 1 || 7C || 16/03/25w12,,$248,"8,184",2025-03-14,2025-03-29,15
150,CB_2025_Mar_FB_3902_SO-JT_V03_1x1_IMG_EN_New_C-NONE_Evergreen_CTA-NONE_Angle-W-B-C_M-NONE_VL-None_G-NONE_P-OG_S-NONE copy,3902 - OZEMPIC MEET YOUR MATCH / V1 || Enhancements: OFF || CBV1 || Batch 1 || 7C || 16/03/25w12,,$244,"9,393",2025-03-14,2025-03-29,15
151,CB_2025_Feb_FB_3827_LZ_V02_1x1_IMG_EN_Opti_C-Headline_Evergreen_CTA-NONE_Angle-W_M-NONE_VL-None_G-M_P-CBV2_S-NONE_FB3723V18,CBV2 || US || Manual Bid: ROAS GOAL: 1.00 -> 1.1 || 7DC || 22/01/2025,SHARE,$225,"9,605",2025-02-18,2025-03-31,41
152,CB_2024_Nov_FB_3305_SO-DP_V02_4x5_VID_EN_Opti_C-Sale_CTA-BF_Pain-W_M-Chris_VL-30s_TR-None_G-MF_P-Plan_S-NEW_FB2601V07,CBV2 || AU || ðŸ’° Advantage+ || US || BROAD || 7C || Existing_customer_5% || 19/12/24 Ad set,VIDEO,$217,"5,956",2024-12-19,2025-03-31,102
153,CB_2024_Nov_FB_3264_LZ_V31_4x5_VID_EN_Opti_C-MakingOf_Sale_CTA-BF_Angle-W-B_M-CRAZY_VL-45s_G-M_P-OG_S-NEW_FB3004V02,CBV2 || EU (UK) || ðŸ’° Advantage+ || US || BROAD || 7C || Existing_customer_5% || 15/12/24 Ad set,VIDEO,$215,"8,078",2024-12-19,2025-03-31,102
154,CB_2025_Jan_FB_3923_VK-KB_V04_1x1_VID_EN_Opti_C-BulletPoints_Evergreen_CTA-65_Angle-W-B-C_M-NONE_VL-None_G-F_P-OG_S-NEW_FB3779V04,3923 - OPTI 3779 - VK || Batch 2 || Enhancements: OFF || CBV1 || 7C || 24/03/25w13,,$213,"7,830",2025-03-24,2025-03-29,5
155,CB_2025_Feb_FB_3860_LZ-DP_V03_9x16_VID_EN_Opti_C-Testimonial_Evergreen_CTA-SALE_Angle-W_M-MOOD_VL-20s_G-M_P-OG_S-WOOD_FB21176V11_1,CBV2 || AU || ðŸ’° Advantage+ || US || BROAD || 7C || Existing_customer_5% || 19/12/24 Ad set,VIDEO,$211,"7,855",2025-03-21,2025-03-31,10
156,CB_2024_Jan_FB_2797_VK-RP-RS_V02_1x1_IMG_EN_Opti_C-ADVRT_CTA-NONE_Pain-W_M-NONE_VL-None_TR-None_G-NONE_P-V2_S-NONE,CBV2 || TOP EU || Advantage+ || Advertorial |  || 0% EXISTING CAP || BROAD || 7C || 21/03/25 Ad set,SHARE,$210,"7,122",2025-03-21,2025-03-31,10
157,CB_2024_Nov_FB_3264_LZ_V31_4x5_VID_EN_Opti_C-MakingOf_Sale_CTA-BF_Angle-W-B_M-CRAZY_VL-45s_G-M_P-OG_S-NEW_FB3004V02,CBV2 || AU || ðŸ’° Advantage+ || US || BROAD || 7C || Existing_customer_5% || 19/12/24 Ad set,VIDEO,$201,"5,422",2024-12-19,2025-03-31,102
158,CB_2025_Jan_FB_3923_VK-KB_V01_1x1_VID_EN_Opti_C-BulletPoints_Evergreen_CTA-65_Angle-W-B-C_M-NONE_VL-None_G-F_P-OG_S-NEW_FB3779V04,3923 - OPTI 3779 - VK || Batch 2 || Enhancements: OFF || CBV1 || 7C || 24/03/25w13,,$195,"6,844",2025-03-24,2025-03-29,5
159,CB_2024_Mar_FB_2883_DA_V04_9x16_GIF_ES_Opti_C-Benefits_CTA-60_Pain-W-B_M-NONE_VL-15s_TR-None_G-NONE_P-V2_S-NEW_FB2369V04.mp4,LATAM ðŸ‡ªðŸ‡¸ || CBV2 || Advantage+ || 0% EXISTING CAP || BROAD || 7C || 22/03/25 Campaign Ad set,,$194,"11,169",2025-03-22,2025-03-31,9
160,CB_2024_Feb_FB_2808_VK-DP_V09_9x16_VID_EN_Opti_C-Sale_CTA-CTA_Pain-W_M-JOG_VL-45s_TR-None_G-F_P-None_S-Moon_FB2263V04,Relaunch || high potential ads ||  || Batch 1 || Enhancements: OFF || CBV1 || 7C || 25/03/25w13,,$194,"7,139",2025-03-25,2025-03-31,6
161,CB_2023_Dec_FB_2712_RS-DP_V02_1x1_VID_EN_Opti_C-WrittenTesti_CTA-SALE_Pain-W-B-C_M-NONE_VL-None_TR-None_G-NONE_P-V2_S-NONE_FB2227V08,CBV2 || UK || Manual Bid: ROAS GOAL: 1.60 || 7DC || 21/03/2025,SHARE,$192,"6,573",2025-03-21,2025-03-26,5
162,CB_2025_Jan_FB_3723_SO_V07_4x5_IMG_EN_New_C-NONE_Evergreen_CTA-SALE_Angle-W_M-NONE_VL-None_G-NONE_P-NONE_S-NONE,US || Kilo Product's leads LAL || 7C || 04/03/25,SHARE,$191,"7,451",2025-03-04,2025-03-31,27
163,CB_2025_Mar_FB_3908_SO_V08_9x16_VID_EN_New_C-NONE_Evergreen_CTA-NONE_Angle-W-B-C_M-NONE_VL-15s_G-NONE_P-OG_S-NEW,3908 - #10 White-collar || Batch_2 || Enhancements: OFF || CBV1 || 7C || 24/03/25w13,,$186,"9,228",2025-03-24,2025-03-28,4
164,CB_2023_Dec_FB_2712_RS-DP_V02_1x1_VID_EN_Opti_C-WrittenTesti_CTA-SALE_Pain-W-B-C_M-NONE_VL-None_TR-None_G-NONE_P-V2_S-NONE_FB2227V08,US || CBV2 || Default landing || 7C || 26/03/25,,$183,"7,298",2025-03-26,2025-03-28,2
165,CB_2023_Dec_FB_2712_RS-DP_V02_1x1_VID_EN_Opti_C-WrittenTesti_CTA-SALE_Pain-W-B-C_M-NONE_VL-None_TR-None_G-NONE_P-V2_S-NONE_FB2227V08,US || CBV2 || FLOW V2 landing || 7C || 26/03/25,,$180,"5,830",2025-03-26,2025-03-28,2
166,CB_2024_Feb_FB_2814_MB-DP_V05_1x1_IMG_EN_New_C-WeightLoss_CTA-None_Pain-W-B-C_M-NONE_VL-None_TR-None_G-NONE_P-V2_S-NONE,CBV2 || EU (UK) || ðŸ’° Advantage+ || US || BROAD || 7C || Existing_customer_5% || 15/12/24 Ad set,SHARE,$177,"5,448",2025-01-31,2025-03-31,59
167,CB_2025_Jan_FB_3923_VK-KB_V02_1x1_VID_EN_Opti_C-BulletPoints_Evergreen_CTA-65_Angle-W-B-C_M-NONE_VL-None_G-F_P-OG_S-NEW_FB3779V04,3923 - OPTI 3779 - VK || Batch 2 || Enhancements: OFF || CBV1 || 7C || 24/03/25w13,,$176,"6,812",2025-03-24,2025-03-29,5
168,CB_2024_Jan_FB_2783_VK-RP_V01_1x1_IMG_EN_Opti_C-ADVRT_CTA-NONE_Pain-W_M-NONE_VL-None_TR-None_G-NONE_P-V2_S-NONE,CA || Advantage+ || Advertorial || 7C ||  BROAD || Existing_customer_0% || 20/03/25 Ad set,SHARE,$174,"13,894",2025-03-24,2025-03-31,7
169,CB_2025_Mar_FB_3908_SO_V02_1x1_IMG_EN_New_C-NONE_Evergreen_CTA-NONE_Angle-W-B-C_M-NONE_VL-None_G-NONE_P-OG_S-NONE,3908 - #10 White-collar || Batch_1 || Enhancements: OFF || CBV1 || 7C || 24/03/25w13,,$172,"7,660",2025-03-24,2025-03-29,5
170,CB_2025_Jan_FB_3723_SO_V04_4x5_IMG_EN_New_C-NONE_Evergreen_CTA-SALE_Angle-W_M-NONE_VL-None_G-NONE_P-NONE_S-NONE,US || V1 vs V2 || V1 - ORIGINAL || 2ND TRY || 7C || 17/03/25,,$166,"8,236",2025-03-17,2025-03-24,7
171,CB_2025_Jan_FB_3723_SO_V07_4x5_IMG_EN_New_C-NONE_Evergreen_CTA-SALE_Angle-W_M-NONE_VL-None_G-NONE_P-NONE_S-NONE,CA || ASC+ || 0% EXISTING || 7DC || 18.03.2025,SHARE,$164,"17,027",2025-03-18,2025-03-31,13
172,CB_2025_Mar_FB_3903_VK_V01_9x16_VID_EN_New_C-BulletPoints_Evergreen_CTA-65_Angle-W-B-C_M-MIX_VL-30s_G-MF_P-OG_S-NEW,CA || ASC+ || 0% EXISTING || 7DC || 18.03.2025,VIDEO,$158,"12,899",2025-03-30,2025-03-31,1
173,CB_2025_Mar_FB_3917_CHUB-AS_V01_9x16_VID_EN_New_C-NONE_CTA-NONE_Angle-None_M-NONE_VL-None_TR-None_G-NONE_P-NONE_S-NONE,3917 - CHUB Ice Phone Hook || Batch 1 || Enhancements: OFF || CBV1 || 7C || 24/03/25w13,,$157,"4,978",2025-03-24,2025-03-28,4
174,CB_2025_Jan_FB_3723_SO_V07_4x5_IMG_EN_New_C-NONE_Evergreen_CTA-SALE_Angle-W_M-NONE_VL-None_G-NONE_P-NONE_S-NONE,ðŸŒ¶ï¸ || US || ASC+ || ->CC141 || VIDEO Only || US+CA || 0% EXISTING CAP || 7C || 07/08.24  Ad set,SHARE,$157,"8,039",2025-02-04,2025-03-31,55
175,CB_2024_Jan_FB_2783_VK-RP_V02_1x1_IMG_EN_Opti_C-ADVRT_CTA-NONE_Pain-W_M-NONE_VL-None_TR-None_G-NONE_P-V2_S-NONE,CBV2 || TOP EU || Advantage+ || Advertorial |  || 0% EXISTING CAP || BROAD || 7C || 21/03/25 Ad set,SHARE,$153,"5,720",2025-03-21,2025-03-31,10
176,CB_2025_Jan_FB_3723_SO_V04_4x5_IMG_EN_New_C-NONE_Evergreen_CTA-SALE_Angle-W_M-NONE_VL-None_G-NONE_P-NONE_S-NONE,US || CBV2 || V1 vs V2 || V1 - ORIGINAL || 2ND TRY || 7C || 17/03/25,,$151,"7,642",2025-03-17,2025-03-24,7
177,CB_2025_Mar_FB_3904_DT_V01_9x16_VID_EN_New_C-Trend_Evergreen_CTA-NONE_Angle-W_M-MIX_VL-30s_G-MF_P-OG_S-New,ðŸŒ¶ï¸ || US || ASC+ || ->CC141 || VIDEO Only || US+CA || 0% EXISTING CAP || 7C || 07/08.24  Ad set,,$148,"7,322",2025-03-28,2025-03-31,3
178,CB_2025_Feb_FB_3818_LZ-VU_V18_1x1_IMG_EN_Opti_C-Headline_Evergreen_CTA-NONE_Angle-Cort_M-NONE_VL-None_G-NONE_P-NONE_S-NONE_FB3251V01,ðŸŒ¶ï¸ || US || ASC+ || ->CC141 || VIDEO Only || US+CA || 0% EXISTING CAP || 7C || 07/08.24  Ad set,,$144,"5,532",2025-03-25,2025-03-31,6
179,CB_2023_Jul_FB_2217_IB_V04_9x16_VID_EN_Opti_C-Pointing_CTA-SMR_Pain-W-B_M-TRC_VL-30s_TR-None_G-F_P-None_S-FRIGGA,CBV2 || AU || ðŸ’° Advantage+ || US || BROAD || 7C || Existing_customer_5% || 19/12/24 Ad set,VIDEO,$142,"4,328",2024-12-19,2025-03-24,95
180,CB_2023_Jul_FB_2217_IB_V04_9x16_VID_EN_Opti_C-Pointing_CTA-SMR_Pain-W-B_M-TRC_VL-30s_TR-None_G-F_P-None_S-FRIGGA,CBV2 || UK || Manual Bid: ROAS GOAL: 1.60 || 7DC || 21/03/2025,VIDEO,$141,"6,215",2025-03-21,2025-03-26,5
181,CB_2025_Feb_FB_3874_CHUB-KZ_V04_1x1_IMG_EN_New_C-NONE_CTA-NONE_Angle-W_M-NONE_VL-None_TR-None_G-NONE_P-NONE_S-NONE_blog_biohacking_cv_en,CBV1 || LP:HI | 3874 Advertorial Biohacking || Biohack for 40+ Women || Batch 1 || 17/07/25,,$140,"1,568",2025-03-17,2025-03-25,8
182,CB_2025_Mar_FB_3916_VK-DP_V02_1x1_VID_EN_New_C-BulletPoints_Evergreen_CTA-NONE_Angle-W-B-C_M-NONE_VL-None_G-M_P-OG_S-NONE,3916 - #11 Date night -VK || Batch 1 || Enhancements: OFF || CBV1 || 7C || 24/03/25w13,,$140,"6,311",2025-03-24,2025-03-28,4
183,CB_2025_Mar_FB_3902_SO-JT_V03_1x1_IMG_EN_New_C-NONE_Evergreen_CTA-NONE_Angle-W-B-C_M-NONE_VL-None_G-NONE_P-OG_S-NONE,3902 - OZEMPIC MEET YOUR MATCH / V1 || Enhancements: OFF || CBV1 || Batch 1 || 7C || 16/03/25w12,,$138,"5,324",2025-03-14,2025-03-29,15
184,CB_2025_Feb_FB_3874_CHUB-AA_V09_1x1_IMG_EN_New_C-NONE_CTA-NONE_Angle-W_M-NONE_VL-None_TR-None_G-NONE_P-NONE_S-NONE_blog_biohacking_cv_en,CBV1 || LP:HI | 3874 Advertorial Biohacking || Biohack for 40+ Women || Batch 3 || 17/07/25,,$136,"1,675",2025-03-17,2025-03-25,8
185,CB_2025_Jan_FB_3923_VK-KB_V12_1x1_VID_EN_Opti_C-BulletPoints_Evergreen_CTA-65_Angle-W-B-C_M-NONE_VL-None_G-F_P-OG_S-NEW_FB3779V04,3923 - OPTI 3779 - VK || Batch 1 || Enhancements: OFF || CBV1 || 7C || 24/03/25w13,,$130,"4,211",2025-03-24,2025-03-31,7
186,CB_2024_Mar_FB_2888_JG_V01_9x16_IMG_EN_Opti_C-Benefits_CTA-NONE_Pain-W_M-NONE_VL-None_TR-None_G-NONE_P-V2_S-NONE,CBV2 || AU || ðŸ’° Advantage+ || US || BROAD || 7C || Existing_customer_5% || 19/12/24 Ad set,SHARE,$128,"4,020",2024-12-19,2025-03-31,102
187,CB_2025_Mar_FB_3920_VK_V11_1x1_VID_EN_Opti_C-BulletPoints_Evergreen_CTA-NONE_Angle-W-B-C_M-NONE_VL-None_G-M_P-OG_S-NONE_FB3891V05,3920 - 3891 OPTI - VK || Batch 3 || Enhancements: OFF || CBV1 || 7C || 24/03/25w13,,$119,"6,548",2025-03-24,2025-03-31,7
188,CB_2025_Mar_FB_3919_LZ_V02_1x1_IMG_EN_Opti_C-Headline_Evergreen_CTA-NONE_Angle-Horm_M-NONE_VL-30s_G-M_P-OG_S-NONE_FB3891V05,3919 - cb Spartan || Batch 1 || Enhancements: OFF || CBV1 || 7C || 24/03/25w13,,$118,"5,489",2025-03-24,2025-03-31,7
189,CB_2025_Jan_FB_3742_SO-DP-KB_V01_4x5_IMG_EN_Opti_C-NONE_Evergreen_CTA-SALE_Angle-W_M-NONE_VL-None_G-NONE_P-CBV2_S-NONE3665V01,CBV2 || EU (UK) || ðŸ’° Advantage+ || US || BROAD || 7C || Existing_customer_5% || 15/12/24 Ad set,SHARE,$117,"4,675",2025-02-04,2025-03-31,55
190,CB_2024_Oct_FB_3214_DT-KB_V06_1x1_IMG_EN_New_C-ADVRT_Evergreen_CTA-NONE_Angle-W_M-NONE_VL-None_G-NONE_P-OG_S-NONE,CA || Advantage+ || Advertorial || 7C ||  BROAD || Existing_customer_0% || 20/03/25 Ad set,SHARE,$115,"6,960",2025-03-20,2025-03-31,11
191,CB_2025_Jan_FB_3741_LZ-JG_V01_4x5_IMG_EN_Opti_C-Headline_Evergreen_CTA-NONE_Angle-W_M-NONE_VL-None_G-NONE_P-CBV2_S-NONE_FB3357V01,CBV2 || US || Manual Bid: ROAS GOAL: 1.00 -> 1.1 || 7DC || 22/01/2025,SHARE,$115,"3,682",2025-01-22,2025-03-31,68
192,CB_2025_Mar_FB_3917_CHUB-AS_V02_9x16_VID_EN_New_C-NONE_CTA-NONE_Angle-None_M-NONE_VL-None_TR-None_G-NONE_P-NONE_S-NONE,3917 - CHUB Ice Phone Hook || Batch 1 || Enhancements: OFF || CBV1 || 7C || 24/03/25w13,,$113,"4,269",2025-03-24,2025-03-28,4
193,CB_2025_Mar_FB_3938_CHUB-FRP_V04_9x16_VID_EN_New_C-NONE_CTA-NONE_Angle-None_M-NONE_VL-None_TR-None_G-NONE_P-NONE_S-NONE,3938 - CHUB FRP VSL style ads || Batch 1 || Enhancements: OFF || CBV1 || 7C || 24/03/25w13,,$105,"4,097",2025-03-25,2025-03-28,3
194,CB_2025_Mar_FB_3921_DT-DP_V04_9x16_VID_EN_New_C-Trend_Sale_CTA-65_Angle-W_M-POW_VL-30s_G-M_P-OG_S-NEW_FB3863V03_1,3921 - 3863 opti VID || Batch 1 || Enhancements: OFF || CBV1 || 7C || 24/03/25w13,,$104,"5,013",2025-03-24,2025-03-28,4
195,CB_2025_Mar_FB_3884_SO_V03_1x1_IMG_EN_New_C-NONE_Evergreen_CTA-NONE_Angle-W_M-NONE_VL-None_G-NONE_P-OG_S-NONE,3884 - Body Shaming Angle || Enhancements: OFF || CBV1 || Batch 1 || 7C || 10/03/25w11,,$104,"5,240",2025-03-12,2025-03-29,17
196,CB_2024_Aug_FB_3090_DT-DP_V02_9x16_VID_EN_Opti_C-MakingOf_CTA-CTA_Pain-W-B-C_M-POW_VL-45s_TR-None_G-M_P-OG_S-Moon_FB3029V04,CBV2 || UK || Manual Bid: ROAS GOAL: 1.60 || 7DC || 21/03/2025,VIDEO,$98,"4,606",2025-03-21,2025-03-26,5
197,CB_2024_Apr_FB_2943_DT_V04_9x16_VID_EN_Opti_C-Sale_CTA-CTA_Pain-W_M-MIX_VL-45s_TR-None_G-MF_P-V2_S-WHAT_FB_2429V03,2943 - Opti PPC 2429 || Batch 1 || Enhancements: OFF || CBV2 || 7C || 25/03/25w13,,$96,"3,626",2025-03-24,2025-03-31,7
198,CB_2025_Mar_FB_3930_DT-KB_V04_1x1_IMG_EN_New_C-Advertorial_Sale_CTA-65_Angle-W-B-C_M-MIX_VL-None_G-M_P-OG_S-NONE,3930 - MD in Nutrition || Batch 1 || Enhancements: OFF || CBV2 || 7C || 30/03/25w14,,$96,"5,156",2025-03-30,2025-03-31,1
199,CB_2025_Mar_FB_3912_SO-DP_V01_9x16_VID_EN_Opti_C-BulletPoints_Evergreen_CTA-65_Angle-W-B-C_M-PASQ_VL-15s_G-M_P-OG_S-WHAT_FB3833V04,3912 - Admers AI tool opti VID || Batch 1 || Enhancements: OFF || CBV1 || 7C || 24/03/25w13,,$95,"3,925",2025-03-24,2025-03-28,4
200,CB_2025_Jan_FB_3723_SO_V04_4x5_IMG_EN_New_C-NONE_Evergreen_CTA-SALE_Angle-W_M-NONE_VL-None_G-NONE_P-NONE_S-NONE,US || Quiz ads || Event: Trial purchase || 7C || 24/03/25,,$95,"5,975",2025-03-24,2025-03-25,1
201,CB_2024_Dec_FB_3619_VK-JT_V02_4x5_VID_EN_New_C-BulletPoints_Sale_CTA-NY_Angle-W-B-C_M-NONE_VL-None_G-NONE_P-OG_S-NONE,ðŸŒ¶ï¸ || US || ASC+ || ->CC141 || VIDEO Only || US+CA || 0% EXISTING CAP || 7C || 07/08.24  Ad set,SHARE,$89,"3,310",2024-12-27,2025-03-31,94
202,CB_2024_Apr_FB_2943_DT_V05_9x16_VID_EN_Opti_C-Sale_CTA-CTA_Pain-W_M-MIX_VL-45s_TR-None_G-MF_P-V2_S-WHAT_FB_2429V03,2943 - Opti PPC 2429 || Batch 1 || Enhancements: OFF || CBV2 || 7C || 25/03/25w13,,$88,"4,440",2025-03-24,2025-03-31,7
203,CB_2025_Mar_FB_3927_DT_V03_1x1_IMG_EN_New_C-NONE_Evergreen_CTA-None_Angle-W_M-NONE_VL-None_G-NONE_P-OG_S-NONE_FB3890V03,3927 - Opti 3890 || Batch 1 || Enhancements: OFF || CBV1 || 7C || 24/03/25w13,,$87,"4,800",2025-03-24,2025-03-29,5
204,CB_2025_Mar_FB_3945_VK-VG_V02_4x5_VID_EN_New_C-NONE_Evergreen_CTA-NONE_Angle-W-B-C_M-NONE_VL-None_G-M_P-OG_S-NONE,3945 - BEFORE AND AFTER / SOCIAL -VK || Batch 1 || Enhancements: OFF || CBV1 || 7C || 30/03/25w14,,$85,"3,532",2025-03-30,2025-03-31,1
205,CB_2024_Mar_FB_2888_JG_V02_9x16_IMG_EN_Opti_C-Benefits_CTA-NONE_Pain-W_M-NONE_VL-None_TR-None_G-NONE_P-V2_S-NONE,CBV2 || AU || ðŸ’° Advantage+ || US || BROAD || 7C || Existing_customer_5% || 19/12/24 Ad set,SHARE,$84,"2,839",2024-12-19,2025-03-31,102
206,CB_2024_Jul_FB_3071_VK_V06_9x16_VID_EN_New_C-Benefits_CTA-SALE_Pain-B_M-PINE_VL-30s_TR-None_G-F_P-V2_S-NEW,3071 - Influencers brief 9-10 || Batch 2 || Enhancements: OFF || CBV2 || 7C || 25/03/25w13,,$83,"3,167",2025-03-24,2025-03-28,4
207,CB_2023_Jul_FB_2217_IB_V04_9x16_VID_EN_Opti_C-Pointing_CTA-SMR_Pain-W-B_M-TRC_VL-30s_TR-None_G-F_P-None_S-FRIGGA,US || Quiz ads || Event: Trial purchase || 7C || 24/03/25,,$83,"3,423",2025-03-24,2025-03-25,1
208,CB_2025_Mar_FB_3910_LZ-DP_V03_9x16_VID_EN_Opti_C-BulletPoints_Evergreen_CTA-NONE_Angle-W_M-MAN_VL-15s_G-M_P-TRIAL_S-WHAT_FB3097V03.mp4,US || Free trial offer || Trial ads || ATC || 7C || 16/03/25,,$82,"3,942",2025-03-16,2025-03-31,15
209,CB_2025_Mar_FB_3910_LZ-DP_V03_9x16_VID_EN_Opti_C-BulletPoints_Evergreen_CTA-NONE_Angle-W_M-MAN_VL-15s_G-M_P-TRIAL_S-WHAT_FB3097V03.mp4,US || Free trial offer || Trial ads || Trial purchase || 7C || 19/03/25,,$82,"2,908",2025-03-19,2025-03-31,12
210,CB_2025_Feb_FB_3827_LZ_V04_1x1_IMG_EN_Opti_C-Headline_Evergreen_CTA-SALE_Angle-W_M-NONE_VL-None_G-M_P-CBV2_S-NONE_FB3779V02,US || CBV2 || Default landing || 7C || 26/03/25,,$82,"3,490",2025-03-26,2025-03-28,2
211,CB_2025_Mar_FB_3916_VK-DP_V08_1x1_VID_EN_New_C-BulletPoints_Evergreen_CTA-NONE_Angle-W-B-C_M-NONE_VL-None_G-M_P-OG_S-NONE,3916 - #11 Date night -VK || Batch 2 || Enhancements: OFF || CBV1 || 7C || 24/03/25w13,,$80,"3,404",2025-03-24,2025-03-31,7
212,CB_2025_Feb_FB_3827_LZ_V04_1x1_IMG_EN_Opti_C-Headline_Evergreen_CTA-SALE_Angle-W_M-NONE_VL-None_G-M_P-CBV2_S-NONE_FB3779V02,US || CBV2 || FLOW V2 landing || 7C || 26/03/25,,$79,"3,133",2025-03-26,2025-03-28,2
213,CB_2025_Mar_FB_3950_SO_V23_4x5_IMG_EN_New_C-NONE_Evergreen_CTA-NONE_Angle-W-B-C_M-NONE_VL-None_G-NONE_P-OG_S-NONE,3950 - Image Gen by ChatGPT || Batch 7 || Enhancements: OFF || CBV1 || 7C || 30/03/25w14,,$76,"4,680",2025-03-30,2025-03-31,1
214,CB_2025_Mar_FB_3924_SO-DP_V08_1x1_IMG_EN_New_C-NONE_Evergreen_CTA-NONE_Angle-W-B-C_M-NONE_VL-None_G-NONE_P-OG_S-NONE,3924 - #17 man boobs/dad bod body text IMG || Batch 2 || Enhancements: OFF || CBV1 || 7C || 24/03/25w13,,$76,"4,569",2025-03-24,2025-03-31,7
215,CB_2025_Mar_FB_3902_SO-JT_V02_1x1_IMG_EN_New_C-NONE_Evergreen_CTA-NONE_Angle-W-B-C_M-NONE_VL-None_G-NONE_P-OG_S-NONE,3902 - OZEMPIC MEET YOUR MATCH / V1 || Enhancements: OFF || CBV1 || Batch 1 || 7C || 16/03/25w12,,$75,"3,013",2025-03-14,2025-03-29,15
216,CB_2025_Mar_FB_3924_SO-DP_V04_1x1_IMG_EN_New_C-NONE_Evergreen_CTA-NONE_Angle-W-B-C_M-NONE_VL-None_G-NONE_P-OG_S-NONE,3924 - #17 man boobs/dad bod body text IMG || Batch 1 || Enhancements: OFF || CBV1 || 7C || 24/03/25w13,,$72,"3,335",2025-03-24,2025-03-31,7
217,CB_2025_Mar_FB_3940_DT-DP_V01_9x16_VID_EN_New_C-Trend_Evergreen_CTA-None_Angle-W-B-C_M-_VL-None_G-M_P-OG_S-NONE,3940 - #4 Never use your GF's supplements || Batch 1 || Enhancements: OFF || CBV1 || 7C || 30/03/25w14,,$72,"3,050",2025-03-30,2025-03-31,1
218,CB_2025_Mar_FB_3912_SO-DP_V03_9x16_VID_EN_Opti_C-BulletPoints_Evergreen_CTA-65_Angle-W-B-C_M-PASQ_VL-15s_G-M_P-OG_S-WHAT_FB3833V04,3912 - Admers AI tool opti VID || Batch 1 || Enhancements: OFF || CBV1 || 7C || 24/03/25w13,,$71,"3,490",2025-03-24,2025-03-28,4
219,CB_2025_Mar_FB_3919_LZ_V03_1x1_IMG_EN_Opti_C-Headline_Evergreen_CTA-NONE_Angle-W_M-NONE_VL-30s_G-M_P-OG_S-NONE_FB3891V05,3919 - cb Spartan || Batch 1 || Enhancements: OFF || CBV1 || 7C || 24/03/25w13,,$70,"3,335",2025-03-24,2025-03-31,7
220,CB_2024_Feb_FB_2812_MB-RP_V07_9x16_VID_EN_Opti_C-Sale_CTA-C65_Pain-W_M-NONE_VL-30s_TR-None_G-MF_P-Plan_S-NEW_FB2601V04_1,US || Quiz ads || Event: Trial purchase || 7C || 24/03/25,,$68,"2,990",2025-03-24,2025-03-25,1
221,CB_2025_Mar_FB_3929_LZ-VU_V01_1x1_IMG_EN_New_C-Educational_Evergreen_CTA-NONE_Angle-WellBe_M-NONE_VL-None_G-NONE_P-OG_S-NONE,3929 - bio age health || Batch 1 || Enhancements: OFF || CBV1 || 7C || 24/03/25w13,,$66,"3,484",2025-03-24,2025-03-29,5
222,CB_2025_Mar_FB_3921_DT-DP_V03_9x16_VID_EN_New_C-Trend_Sale_CTA-65_Angle-W_M-POW_VL-30s_G-M_P-OG_S-NEW_FB3863V03,3921 - 3863 opti VID || Batch 1 || Enhancements: OFF || CBV1 || 7C || 24/03/25w13,,$66,"3,255",2025-03-24,2025-03-28,4
223,CB_2025_Mar_FB_3916_VK-DP_V05_1x1_VID_EN_New_C-BulletPoints_Evergreen_CTA-NONE_Angle-W-B-C_M-NONE_VL-None_G-M_P-OG_S-NONE,3916 - #11 Date night -VK || Batch 2 || Enhancements: OFF || CBV1 || 7C || 24/03/25w13,,$66,"2,599",2025-03-24,2025-03-31,7
224,CB_2024_Apr_FB_2943_DT_V03_9x16_VID_EN_Opti_C-Sale_CTA-CTA_Pain-W_M-MIX_VL-45s_TR-None_G-MF_P-V2_S-WHAT_FB_2429V03,2943 - Opti PPC 2429 || Batch 1 || Enhancements: OFF || CBV2 || 7C || 25/03/25w13,,$66,"3,322",2025-03-24,2025-03-31,7
225,CB_2025_Mar_FB_3950_SO_V16_4x5_IMG_EN_New_C-NONE_Evergreen_CTA-NONE_Angle-W-B-C_M-NONE_VL-None_G-NONE_P-OG_S-NONE,3950 - Image Gen by ChatGPT || Batch 4 || Enhancements: OFF || CBV1 || 7C || 30/03/25w14,,$64,"3,763",2025-03-30,2025-03-31,1
226,CB_2023_Jul_FB_2217_IB_V04_9x16_VID_EN_Opti_C-Pointing_CTA-SMR_Pain-W-B_M-TRC_VL-30s_TR-None_G-F_P-None_S-FRIGGA,US || Manual Bid || BFCM || COST CAP 71 || 1C || 15/11/24,VIDEO,$62,"2,107",2024-11-15,2025-03-31,136
227,CB_2025_Mar_FB_3918_LZ-DT_V01_9x16_VID_EN_New_C-BulletPoints_Evergreen_CTA-SALE_Angle-W-B_M-MIX_VL-30s_G-MF_P-OG_S-NEW,3918 - when my told my wife  || Batch 1 || Enhancements: OFF || CBV1 || 7C || 24/03/25w13,,$62,"3,438",2025-03-24,2025-03-29,5
228,CB_2023_Jul_FB_2226_MB_V04_9x16_VID_EN_Opti_C-Testim_CTA-SMR_Pain-W_M-MIX_VL-30s_TR-None_G-F_P-None_S-Starry,US || Manual Bid || BFCM || COST CAP 71 || 1C || 15/11/24,VIDEO,$62,"1,464",2024-11-15,2025-03-31,136
229,CB_2025_Jan_FB_3923_VK-KB_V10_1x1_VID_EN_Opti_C-BulletPoints_Evergreen_CTA-65_Angle-W-B-C_M-NONE_VL-None_G-F_P-OG_S-NEW_FB3779V04,3923 - OPTI 3779 - VK || Batch 1 || Enhancements: OFF || CBV1 || 7C || 24/03/25w13,,$61,"1,936",2025-03-24,2025-03-31,7
230,CB_2025_Mar_FB_3950_SO_V05_4x5_IMG_EN_New_C-NONE_Evergreen_CTA-NONE_Angle-W-B-C_M-NONE_VL-None_G-NONE_P-OG_S-NONE,3950 - Image Gen by ChatGPT || Batch 2 || Enhancements: OFF || CBV1 || 7C || 30/03/25w14,,$61,"2,974",2025-03-30,2025-03-31,1
231,CB_2025_Mar_FB_3938_CHUB-FRP_V03_9x16_VID_EN_New_C-NONE_CTA-NONE_Angle-None_M-NONE_VL-None_TR-None_G-NONE_P-NONE_S-NONE,3938 - CHUB FRP VSL style ads || Batch 1 || Enhancements: OFF || CBV1 || 7C || 24/03/25w13,,$61,"2,410",2025-03-25,2025-03-28,3
232,CB_2024_Oct_FB_3182_ZS-GC_V13_1x1_IMG_EN_New_C-UsVsThem_Evergreen_CTA-NONE_Angle-B-C_M-NONE_VL-None_G-NONE_P-OG_S-NONE,CBV2 || AU || ðŸ’° Advantage+ || US || BROAD || 7C || Existing_customer_5% || 19/12/24 Ad set,SHARE,$60,"2,510",2024-12-19,2025-03-31,102
233,CB_2024_Jul_FB_3071_VK_V05_9x16_VID_EN_New_C-Benefits_CTA-SALE_Pain-B_M-PINE_VL-30s_TR-None_G-F_P-V2_S-NEW,3071 - Influencers brief 9-10 || Batch 2 || Enhancements: OFF || CBV2 || 7C || 25/03/25w13,,$58,"2,143",2025-03-24,2025-03-28,4
234,CB_2025_Mar_FB_3947_LZ-VG_V02_4x5_IMG_EN_New_C-StickyNotes_Evergreen_CTA-SALE_Angle-Horm_M-NONE_VL-None_G-M_P-OG_S-NONE,3947 - low t post it notes || Batch 1 || Enhancements: OFF || CBV1 || 7C || 30/03/25w14,,$58,"2,690",2025-03-30,2025-03-31,1
235,CB_2024_Oct_FB_3252_VK-DP_V08_4x5_VID_EN_Opti_C-NegativeMark_Evergreen_CTA-SALE_Angle-W-B-C_M-JOG_VL-45s_G-F_P-OG_S-MOON_FB2263V04,Relaunch || high potential ads ||  || Batch 1 || Enhancements: OFF || CBV1 || 7C || 25/03/25w13,,$57,"2,342",2025-03-25,2025-03-31,6
236,CB_2025_Mar_FB_3951_LZ_V03_9x16_VID_EN_New_C-Trend_Evergreen_CTA-SALE_Angle-W_M-MAN_VL-15s_G-M_P-OG_S-NEW,3951 - morning routine || Batch 1 || Enhancements: OFF || CBV2 || 7C || 27/03/25w13,,$57,"2,371",2025-03-27,2025-03-31,4
237,CB_2024_Sep_FB_3175_DA-KB_V01_1x1_IMG_EN_New_C-ADVRT_Evergreen_CTA-NONE_Angle-W_M-NONE_VL-None_G-NONE_P-CBV2_S-NONE_blog_colonbroomvsmammothhighprice3_cv_en,CBV2 || A/B test CTA button: Variaton || CBV2 vs Happy Mammoth || 7C || 26/03/25,,$56,"2,389",2025-03-26,2025-03-31,5
238,CB_2024_Aug_FB_3097_VK-DP_V03_9x16_VID_EN_Opti_C-Benefits_CTA-SMR_Pain-W-B_M-MIX_VL-45s_TR-None_G-MF_P-OG_S-WHAT_FB2516V13,ðŸŒ¶ï¸ || US || ASC+ || ->CC141 || VIDEO Only || US+CA || 0% EXISTING CAP || 7C || 07/08.24  Ad set,,$54,"2,077",2025-03-28,2025-03-31,3
239,CB_2025_Mar_FB_3915_LZ-DT_V02_9x16_VID_EN_New_C-Testimonial_Evergreen_CTA-SALE_Angle-W-B_M-JOG_VL-30s_G-F_P-OG_S-NEW,3915 - Jogile goes clubbing || Batch 1 || Enhancements: OFF || CBV1 || 7C || 24/03/25w13,,$54,"2,104",2025-03-24,2025-03-29,5
240,CB_2025_Mar_FB_3943_LZ-DP_V02_4x5_IMG_EN_Opti_C-BeforeAfter_Sale_CTA-SALE_Angle-W_M-NONE_VL-NONE_G-M_P-OG_S-NONE_FB3890V04,3943 - man boobs price cta opti || Batch 1 || Enhancements: OFF || CBV1 || 7C || 30/03/25w14,,$54,"1,840",2025-03-30,2025-03-31,1
241,CB_2025_Mar_FB_3913_CHUB-AS_V05_1x1_IMG_EN_New_C-NONE_CTA-NONE_Angle-W_M-NONE_VL-None_TR-None_G-NONE_P-NONE_S-NONE_blog_moobs_cv_en,CBV1 || LP:HI | blog_moobs_cv_en || Batch 2 || 30/03/25,,$52,"2,467",2025-03-30,2025-03-31,1
242,CB_2025_Mar_FB_3908_SO_V01_1x1_IMG_EN_New_C-NONE_Evergreen_CTA-NONE_Angle-W-B-C_M-NONE_VL-None_G-NONE_P-OG_S-NONE,3908 - #10 White-collar || Batch_1 || Enhancements: OFF || CBV1 || 7C || 24/03/25w13,,$51,"2,669",2025-03-24,2025-03-29,5
243,CB_2025_Mar_FB_3944_LZ-VG_V03_4x5_IMG_EN_Opti_C-Testimonial_Evergreen_CTA-NONE_Angle-GH_M-NONE_VL-None_G-NONE_P-OG_S-NONE_FB3619V02,3944 - 3619 opti claims/testimonial || Batch 1 || Enhancements: OFF || CBV1 || 7C || 30/03/25w14,,$49,"1,486",2025-03-30,2025-03-31,1
244,CB_2025_Mar_FB_3915_LZ-DT_V01_9x16_VID_EN_New_C-Testimonial_Evergreen_CTA-SALE_Angle-W-B_M-JOG_VL-30s_G-F_P-OG_S-NEW,3915 - Jogile goes clubbing || Batch 1 || Enhancements: OFF || CBV1 || 7C || 24/03/25w13,,$48,"2,010",2025-03-24,2025-03-29,5
245,CB_2025_Mar_FB_3908_SO_V06_9x16_VID_EN_New_C-NONE_Evergreen_CTA-NONE_Angle-W-B-C_M-NONE_VL-15s_G-NONE_P-OG_S-NEW,3908 - #10 White-collar || Batch_2 || Enhancements: OFF || CBV1 || 7C || 24/03/25w13,,$48,"2,354",2025-03-24,2025-03-28,4
246,CB_2025_Mar_FB_3913_CHUB-AS_V01_1x1_IMG_EN_New_C-NONE_CTA-NONE_Angle-W_M-NONE_VL-None_TR-None_G-NONE_P-NONE_S-NONE_blog_moobs_cv_en,CBV1 || LP:HI | blog_moobs_cv_en || Batch 1 || 30/03/25,,$48,"2,471",2025-03-30,2025-03-31,1
247,CB_2025_Mar_FB_3913_CHUB-AS_V12_1x1_IMG_EN_New_C-NONE_CTA-NONE_Angle-W_M-NONE_VL-None_TR-None_G-NONE_P-NONE_S-NONE_blog_moobs_cv_en,CBV1 || LP:HI | blog_moobs_cv_en || Batch 3 || 30/03/25,,$46,"1,913",2025-03-30,2025-03-31,1
248,CB_2025_Mar_FB_3920_VK_V02_1x1_VID_EN_Opti_C-BulletPoints_Evergreen_CTA-NONE_Angle-W-B-C_M-NONE_VL-None_G-M_P-OG_S-NONE_FB3891V05,3920 - 3891 OPTI - VK || Batch 1|| Enhancements: OFF || CBV1 || 7C || 24/03/25w13,,$46,"3,552",2025-03-24,2025-03-29,5
249,CB_2025_Mar_FB_3920_VK_V06_1x1_VID_EN_Opti_C-BulletPoints_Evergreen_CTA-NONE_Angle-W-B-C_M-NONE_VL-None_G-M_P-OG_S-NONE_FB3891V05,3920 - 3891 OPTI - VK || Batch 2 || Enhancements: OFF || CBV1 || 7C || 24/03/25w13,,$44,"2,061",2025-03-24,2025-03-27,3
250,CB_2025_Mar_FB_3940_DT-DP_V05_9x16_VID_EN_New_C-Trend_Sale_CTA-65_Angle-W-B-C_M-_VL-None_G-M_P-OG_S-New,3940 - #4 Never use your GF's supplements || Batch 2 || Enhancements: OFF || CBV1 || 7C || 30/03/25w14,,$44,"1,805",2025-03-30,2025-03-31,1
251,CB_2025_Mar_FB_3910_LZ-DP_V02_1x1_IMG_EN_Opti_C-NegativeMark_Evergreen_CTA-NONE_Angle-W_M-NONE_VL-None_G-NONE_P-TRIAL_S-NONE_FB2227V08.png,US || Free trial offer || Trial ads || Trial purchase || 7C || 19/03/25,,$44,"1,679",2025-03-19,2025-03-31,12
252,CB_2025_Mar_FB_3908_SO_V04_1x1_IMG_EN_New_C-NONE_Evergreen_CTA-NONE_Angle-W-B-C_M-NONE_VL-None_G-NONE_P-OG_S-NONE,3908 - #10 White-collar || Batch_1 || Enhancements: OFF || CBV1 || 7C || 24/03/25w13,,$43,"2,331",2025-03-24,2025-03-29,5
253,CB_2024_Jul_FB_3071_VK_V02_9x16_VID_EN_New_C-Benefits_CTA-SALE_Pain-B_M-TOP_VL-30s_TR-None_G-F_P-V2_S-Moon,3071 - Influencers brief 9-10 || Batch 1 || Enhancements: OFF || CBV2 || 7C || 25/03/25w13,,$43,"1,441",2025-03-24,2025-03-28,4
254,CB_2025_Mar_FB_3950_SO_V18_4x5_IMG_EN_New_C-NONE_Evergreen_CTA-NONE_Angle-W-B-C_M-NONE_VL-None_G-NONE_P-OG_S-NONE,3950 - Image Gen by ChatGPT || Batch 5 || Enhancements: OFF || CBV1 || 7C || 30/03/25w14,,$43,"1,867",2025-03-30,2025-03-31,1
255,CB_2025_Mar_FB_3927_DT_V02_1x1_IMG_EN_New_C-NONE_Evergreen_CTA-None_Angle-W_M-NONE_VL-None_G-NONE_P-OG_S-NONE_FB3890V03,3927 - Opti 3890 || Batch 1 || Enhancements: OFF || CBV1 || 7C || 24/03/25w13,,$41,"2,328",2025-03-24,2025-03-29,5
256,CB_2025_Mar_FB_3946_LZ-VG_V03_4x5_IMG_EN_New_C-BeforeAfter_Evergreen_CTA-SALE_Angle-W-B_M-NONE_VL-None_G-M_P-OG_S-NONE,3946 - man boobs before after LZ+VG || Batch 1 || Enhancements: OFF || CBV1 || 7C || 30/03/25w14,,$41,"1,304",2025-03-30,2025-03-31,1
257,CB_2025_Jan_FB_3923_VK-KB_V09_1x1_VID_EN_Opti_C-BulletPoints_Evergreen_CTA-65_Angle-W-B-C_M-NONE_VL-None_G-F_P-OG_S-NEW_FB3779V04,3923 - OPTI 3779 - VK || Batch 1 || Enhancements: OFF || CBV1 || 7C || 24/03/25w13,,$40,"1,341",2025-03-24,2025-03-31,7
258,CB_2025_Feb_FB_3812_SO_V03_4x5_IMG_EN_Opti_C-NONE_Evergreen_CTA-SALE_Angle-W_M-NONE_VL-None_G-NONE_P-NONE_S-NONE_FB3723V07,US || CBV2 || V1 vs V2 || V1 - ORIGINAL || 2ND TRY || 7C || 17/03/25,,$38,"1,529",2025-03-17,2025-03-24,7
259,CB_2024_Mar_FB_2888_JG_V03_9x16_IMG_EN_Opti_C-Benefits_CTA-NONE_Pain-W_M-NONE_VL-None_TR-None_G-NONE_P-V2_S-NONE,CBV2 || AU || ðŸ’° Advantage+ || US || BROAD || 7C || Existing_customer_5% || 19/12/24 Ad set,SHARE,$38,"1,342",2024-12-19,2025-03-31,102
260,CB_2025_Mar_FB_3951_LZ_V03_9x16_VID_EN_New_C-Trend_Evergreen_CTA-SALE_Angle-W_M-MAN_VL-15s_G-M_P-OG_S-NEW,3951 - morning routine || Batch 1 || Enhancements: OFF || CBV1 || 7C || 30/03/25w14,,$38,"1,290",2025-03-30,2025-03-31,1
261,CB_2025_Mar_FB_3949_VK-DP_V01_9x16_VID_EN_New_C-NONE_Evergreen_CTA-NONE_Angle-W-B-C_M-TYL_VL-None_G-M_P-OG_S-NONE,"3949 - ""Never use your GF's supplements"" script for actor - VK || Batch 1 || Enhancements: OFF || CBV1 || 7C || 30/03/25w14",,$38,"1,291",2025-03-30,2025-03-31,1
262,CB_2025_Mar_FB_3952_LZ-DP_V01_9x16_VID_EN_Opti_C-NegativeMark_Evergreen_CTA-SALE_Angle-W_M-SMT_VL-15s_G-F_P-OG_S-NEW_FB3264V29,3952 - Depuff face bad reviews || Batch 1 || Enhancements: OFF || CBV1 || 7C || 30/03/25w14,,$37,"1,385",2025-03-30,2025-03-31,1
263,CB_2025_Mar_FB_3930_DT-KB_V07_1x1_IMG_EN_New_C-Advertorial_Sale_CTA-65_Angle-W-B-C_M-MIX_VL-None_G-M_P-OG_S-NONE,3930 - MD in Nutrition || Batch 2 || Enhancements: OFF || CBV2 || 7C || 30/03/25w14,,$37,"1,636",2025-03-30,2025-03-31,1
264,CB_2025_Mar_FB_3931_VK-DP_V02_9x16_VID_EN_Opti_C-NONE_Evergreen_CTA-NONE_Angle-W_M-NONE_VL-30s_G-M_P-OG_S-WOOD_FB3860V03,3942 - 3860 V03 opti - DP - VK || Batch 1 || Enhancements: OFF || CBV1 || 7C || 30/03/25w14,,$37,"1,981",2025-03-30,2025-03-31,1
265,CB_2024_Oct_FB_3214_DT-KB_V01_1x1_IMG_EN_New_C-ADVRT_Evergreen_CTA-NONE_Angle-W_M-NONE_VL-None_G-NONE_P-OG_S-NONE,CA || Advantage+ || Advertorial || 7C ||  BROAD || Existing_customer_0% || 20/03/25 Ad set,SHARE,$37,"2,829",2025-03-20,2025-03-31,11
266,CB_2024_Jan_FB_2722_DA-RP_V03_9x16_VID_EN_New_C-Buzz_CTA-DISCOUNT_Pain-W_M-STOCK_VL-30s_TR-None_G-MF_P-V2_S-NEW,2722 - Trainspotting ads || Batch 1 || Enhancements: OFF || CBV2 || 7C || 25/03/25w13,,$36,"1,508",2025-03-24,2025-03-27,3
267,CB_2024_Oct_FB_3252_VK-DP_V04_4x5_VID_EN_Opti_C-MakingOf_Evergreen_CTA-SALE_Angle-W-B-C_M-JOG_VL-45s_G-F_P-OG_S-MOON_FB3090V02,ðŸŒ¶ï¸ || US || ASC+ || ->CC141 || VIDEO Only || US+CA || 0% EXISTING CAP || 7C || 07/08.24  Ad set,VIDEO,$35,"1,064",2024-11-07,2025-03-31,144
268,CB_2025_Mar_FB_3929_LZ-VU_V03_1x1_IMG_EN_New_C-Educational_Evergreen_CTA-NONE_Angle-WellBe_M-NONE_VL-None_G-NONE_P-OG_S-NONE,3929 - bio age health || Batch 1 || Enhancements: OFF || CBV1 || 7C || 24/03/25w13,,$35,"1,861",2025-03-24,2025-03-29,5
269,CB_2025_Mar_FB_3950_SO_V20_4x5_IMG_EN_New_C-NONE_Evergreen_CTA-NONE_Angle-W-B-C_M-NONE_VL-None_G-NONE_P-OG_S-NONE,3950 - Image Gen by ChatGPT || Batch 6 || Enhancements: OFF || CBV1 || 7C || 30/03/25w14,,$35,"1,882",2025-03-30,2025-03-31,1
270,CB_2024_Apr_FB_2970_RS_V04_1x1_GIF_EN_Opti_C-WrittenTesti_CTA-CTA_Pain-W_M-NONE_VL-7s_TR-None_G-NONE_P-V2_S-NEW,2970 - XL TO M || Batch 1 || Enhancements: OFF || CBV2 || 7C || 25/03/25w13,,$35,"1,037",2025-03-24,2025-03-31,7
271,CB_2025_Mar_FB_3950_SO_V03_4x5_IMG_EN_New_C-NONE_Evergreen_CTA-NONE_Angle-W-B-C_M-NONE_VL-None_G-NONE_P-OG_S-NONE,3950 - Image Gen by ChatGPT || Batch 1 || Enhancements: OFF || CBV1 || 7C || 30/03/25w14,,$35,"1,316",2025-03-30,2025-03-31,1
272,CB_2025_Feb_FB_3812_SO_V03_4x5_IMG_EN_Opti_C-NONE_Evergreen_CTA-SALE_Angle-W_M-NONE_VL-None_G-NONE_P-NONE_S-NONE_FB3723V07,US || V1 vs V2 || V1 - ORIGINAL || 2ND TRY || 7C || 17/03/25,,$34,"1,452",2025-03-17,2025-03-24,7
273,CB_2024_Jan_FB_2722_DA-RP_V04_9x16_VID_EN_New_C-Buzz_CTA-DISCOUNT_Pain-W_M-STOCK_VL-30s_TR-None_G-MF_P-V2_S-NEW,2722 - Trainspotting ads || Batch 1 || Enhancements: OFF || CBV2 || 7C || 25/03/25w13,,$34,"1,195",2025-03-24,2025-03-27,3
274,CB_2025_Mar_FB_3908_SO_V05_9x16_VID_EN_New_C-NONE_Evergreen_CTA-NONE_Angle-W-B-C_M-NONE_VL-15s_G-NONE_P-OG_S-NEW,3908 - #10 White-collar || Batch_2 || Enhancements: OFF || CBV1 || 7C || 24/03/25w13,,$33,"1,726",2025-03-24,2025-03-28,4
275,CB_2025_Mar_FB_3939_DT_V01_4x5_IMG_EN_New_C-Advertorial_Sale_CTA-65_Angle-W-B-C_M-MIX_VL-None_G-M_P-OG_S-NONE,3939 - CB Advertorial ads New Ideas || Batch 1 || Enhancements: OFF || CBV1 || 7C || 30/03/25w14,,$31,"1,108",2025-03-30,2025-03-31,1
276,CB_2025_Mar_FB_3928_VK-DP_V01_1x1_VID_EN_Opti_C-BulletPoints_Evergreen_CTA-NONE_Angle-W-B-C_M-NONE_VL-None_G-M_P-OG_S-NONE_FB3891V05,3928 - opti 3891 kinda sorta opti with man boobs - DP-VK || Batch 1 || Enhancements: OFF || CBV1 || 7C || 24/03/25w13,,$31,"1,448",2025-03-24,2025-03-31,7
277,CB_2025_Mar_FB_3931_VK-DP_V01_9x16_VID_EN_Opti_C-NONE_Evergreen_CTA-NONE_Angle-W_M-NONE_VL-30s_G-M_P-OG_S-WOOD_FB3860V03,3942 - 3860 V03 opti - DP - VK || Batch 1 || Enhancements: OFF || CBV1 || 7C || 30/03/25w14,,$30,"1,041",2025-03-30,2025-03-31,1
278,CB_2025_Mar_FB_3922_SO-JT_V02_1x1_IMG_EN_New_C-NONE_Evergreen_CTA-NONE_Angle-W-B-C_M-NONE_VL-None_G-NONE_P-OG_S-NONE,3922 - CB V1 REDLINER || Batch 1 || Enhancements: OFF || CBV1 || 7C || 24/03/25w13,,$30,"1,156",2025-03-24,2025-03-31,7
279,CB_2024_Jan_FB_2784_RS_V02_9x16_VID_EN_Opti_C-Pointing_CTA-SALE_Pain-W_M-JOG_VL-30s_TR-None_G-F_P-OG_S-OLLIE_FB2181V01,CBV2 || UK || Manual Bid: ROAS GOAL: 1.60 || 7DC || 21/03/2025,VIDEO,$30,"1,072",2025-03-21,2025-03-26,5
280,CB_2025_Mar_FB_3939_DT_V05_4x5_IMG_EN_New_C-Advertorial_Sale_CTA-65_Angle-W-B-C_M-MIX_VL-None_G-M_P-OG_S-NONE,3939 - CB Advertorial ads New Ideas || Batch 2 || Enhancements: OFF || CBV1 || 7C || 30/03/25w14,,$30,"1,327",2025-03-30,2025-03-31,1
281,CB_2024_Jul_FB_3071_VK_V01_9x16_VID_EN_New_C-Benefits_CTA-SALE_Pain-B_M-TOP_VL-30s_TR-None_G-F_P-V2_S-Frigga,3071 - Influencers brief 9-10 || Batch 1 || Enhancements: OFF || CBV2 || 7C || 25/03/25w13,,$30,"1,383",2025-03-24,2025-03-28,4
282,CB_2024_Oct_FB_3214_DT-KB_V08_1x1_IMG_EN_New_C-ADVRT_Evergreen_CTA-NONE_Angle-W_M-NONE_VL-None_G-NONE_P-OG_S-NONE,CA || Advantage+ || Advertorial || 7C ||  BROAD || Existing_customer_0% || 20/03/25 Ad set,SHARE,$30,"1,363",2025-03-20,2025-03-31,11
283,CB_2025_Mar_FB_3916_VK-DP_V07_1x1_VID_EN_New_C-BulletPoints_Evergreen_CTA-NONE_Angle-W-B-C_M-NONE_VL-None_G-M_P-OG_S-NONE,3916 - #11 Date night -VK || Batch 2 || Enhancements: OFF || CBV1 || 7C || 24/03/25w13,,$30,"1,101",2025-03-24,2025-03-31,7
284,CB_2025_Mar_FB_3951_LZ_V02_9x16_VID_EN_New_C-Trend_Evergreen_CTA-SALE_Angle-W_M-MAN_VL-15s_G-M_P-OG_S-NEW,3951 - morning routine || Batch 1 || Enhancements: OFF || CBV1 || 7C || 30/03/25w14,,$29,918,2025-03-30,2025-03-31,1
285,CB_2025_Jan_FB_3923_VK-KB_V07_1x1_VID_EN_Opti_C-BulletPoints_Evergreen_CTA-65_Angle-W-B-C_M-NONE_VL-None_G-F_P-OG_S-NEW_FB3779V04,3923 - OPTI 3779 - VK || Batch 2 || Enhancements: OFF || CBV1 || 7C || 24/03/25w13,,$29,980,2025-03-24,2025-03-29,5
286,CB_2025_Mar_FB_3950_SO_V21_4x5_IMG_EN_New_C-NONE_Evergreen_CTA-NONE_Angle-W-B-C_M-NONE_VL-None_G-NONE_P-OG_S-NONE,3950 - Image Gen by ChatGPT || Batch 6 || Enhancements: OFF || CBV1 || 7C || 30/03/25w14,,$29,"1,618",2025-03-30,2025-03-31,1
287,CB_2025_Mar_FB_3949_VK-DP_V04_9x16_VID_EN_New_C-NONE_Evergreen_CTA-NONE_Angle-W-B-C_M-TYL_VL-None_G-M_P-OG_S-NEW,"3949 - ""Never use your GF's supplements"" script for actor - VK || Batch 2 || Enhancements: OFF || CBV1 || 7C || 30/03/25w14",,$29,868,2025-03-30,2025-03-31,1
288,CB_2025_Mar_FB_3941_LZ-DT_V03_9x16_VID_EN_New_C-Testimonial_Evergreen_CTA-SALE_Angle-GH_M-SMT_VL-30s_G-F_P-OG_S-NEW,3941 - health wellbeing new vid || Batch 1 || Enhancements: OFF || CBV1 || 7C || 30/03/25w14,,$29,964,2025-03-30,2025-03-31,1
289,CB_2023_May_FB_2103_MB_V02_9x16_VID_EN_Opti_C-Sale_CTA-SMR_Pain-W_M-JOG_VL-30s_TR-None_G-M-F_P-None_S-What,US || Manual Bid || BID CAP 111 || 1C || 21/12/24,VIDEO,$29,933,2024-12-28,2025-03-31,93
290,CB_2024_Apr_FB_2961_DA-DP_V03_9x16_VID_EN_Opti_C-Trend_CTA-SMR_Pain-W_M-SMT_VL-15s_TR-BadReviews_G-F_P-V2_S-NEW_FB2917V06,2961 - 2917 opti || Batch 1 || Enhancements: OFF || CBV2 || 7C || 25/03/25w13,,$29,"1,670",2025-03-25,2025-03-30,5
291,CB_2025_Mar_FB_3922_SO-JT_V01_1x1_IMG_EN_New_C-NONE_Evergreen_CTA-NONE_Angle-W-B-C_M-NONE_VL-None_G-NONE_P-OG_S-NONE,3922 - CB V1 REDLINER || Batch 1 || Enhancements: OFF || CBV1 || 7C || 24/03/25w13,,$28,"1,137",2025-03-24,2025-03-31,7
292,CB_2024_Oct_FB_3214_DT-KB_V07_1x1_IMG_EN_New_C-ADVRT_Evergreen_CTA-NONE_Angle-W_M-NONE_VL-None_G-NONE_P-OG_S-NONE,CA || Advantage+ || Advertorial || 7C ||  BROAD || Existing_customer_0% || 20/03/25 Ad set,SHARE,$28,"1,572",2025-03-20,2025-03-31,11
293,CB_2025_Mar_FB_3918_LZ-DT_V03_9x16_VID_EN_New_C-BulletPoints_Evergreen_CTA-SALE_Angle-W-B_M-MIX_VL-30s_G-MF_P-OG_S-NEW,3918 - when my told my wife  || Batch 1 || Enhancements: OFF || CBV1 || 7C || 24/03/25w13,,$28,"1,223",2025-03-24,2025-03-29,5
294,CB_2025_Mar_FB_3938_CHUB-FRP_V02_9x16_VID_EN_New_C-NONE_CTA-NONE_Angle-None_M-NONE_VL-None_TR-None_G-NONE_P-NONE_S-NONE,3938 - CHUB FRP VSL style ads || Batch 1 || Enhancements: OFF || CBV1 || 7C || 24/03/25w13,,$27,810,2025-03-25,2025-03-28,3
295,CB_2025_Mar_FB_3950_SO_V11_4x5_IMG_EN_New_C-NONE_Evergreen_CTA-NONE_Angle-W-B-C_M-NONE_VL-None_G-NONE_P-OG_S-NONE,3950 - Image Gen by ChatGPT || Batch 3 || Enhancements: OFF || CBV1 || 7C || 30/03/25w14,,$27,"1,491",2025-03-30,2025-03-31,1
296,CB_2025_Mar_FB_3950_SO_V17_4x5_IMG_EN_New_C-NONE_Evergreen_CTA-NONE_Angle-W-B-C_M-NONE_VL-None_G-NONE_P-OG_S-NONE,3950 - Image Gen by ChatGPT || Batch 5 || Enhancements: OFF || CBV1 || 7C || 30/03/25w14,,$27,"1,212",2025-03-30,2025-03-31,1
297,CB_2025_Jan_FB_3923_VK-KB_V03_1x1_VID_EN_Opti_C-BulletPoints_Evergreen_CTA-65_Angle-W-B-C_M-NONE_VL-None_G-F_P-OG_S-NEW_FB3779V04,3923 - OPTI 3779 - VK || Batch 2 || Enhancements: OFF || CBV1 || 7C || 24/03/25w13,,$27,937,2025-03-24,2025-03-29,5
298,CB_2025_Mar_FB_3915_LZ-DT_V03_9x16_VID_EN_New_C-Testimonial_Evergreen_CTA-SALE_Angle-W-B_M-JOG_VL-30s_G-F_P-OG_S-NEW,3915 - Jogile goes clubbing || Batch 1 || Enhancements: OFF || CBV1 || 7C || 24/03/25w13,,$27,"1,003",2025-03-24,2025-03-29,5
299,CB_2025_Mar_FB_3946_LZ-VG_V02_4x5_IMG_EN_New_C-BeforeAfter_Evergreen_CTA-SALE_Angle-W-B_M-NONE_VL-None_G-M_P-OG_S-NONE,3946 - man boobs before after LZ+VG || Batch 1 || Enhancements: OFF || CBV1 || 7C || 30/03/25w14,,$27,"1,212",2025-03-30,2025-03-31,1
300,CB_2025_Mar_FB_3950_SO_V06_4x5_IMG_EN_New_C-NONE_Evergreen_CTA-NONE_Angle-W-B-C_M-NONE_VL-None_G-NONE_P-OG_S-NONE,3950 - Image Gen by ChatGPT || Batch 2 || Enhancements: OFF || CBV1 || 7C || 30/03/25w14,,$26,"1,179",2025-03-30,2025-03-31,1
301,CB_2025_Mar_FB_3903_VK_V03_9x16_VID_EN_New_C-BulletPoints_Evergreen_CTA-65_Angle-W-B-C_M-MIX_VL-30s_G-MF_P-OG_S-MOON,3903 - #13 My husband hides his beer belly - VK  || Batch 1 || Enhancements: OFF || CBV1 || 7C || 24/03/25w13,,$26,934,2025-03-24,2025-03-30,6
302,CB_2025_Mar_FB_3928_VK-DP_V03_1x1_VID_EN_Opti_C-BulletPoints_Evergreen_CTA-NONE_Angle-W-B-C_M-NONE_VL-None_G-M_P-OG_S-NONE_FB3891V05,3928 - opti 3891 kinda sorta opti with man boobs - DP-VK || Batch 1 || Enhancements: OFF || CBV1 || 7C || 24/03/25w13,,$26,"1,569",2025-03-24,2025-03-31,7
303,CB_2025_Mar_FB_3950_SO_V19_4x5_IMG_EN_New_C-NONE_Evergreen_CTA-NONE_Angle-W-B-C_M-NONE_VL-None_G-NONE_P-OG_S-NONE,3950 - Image Gen by ChatGPT || Batch 5 || Enhancements: OFF || CBV1 || 7C || 30/03/25w14,,$26,"1,223",2025-03-30,2025-03-31,1
304,CB_2025_Mar_FB_3930_DT-KB_V11_1x1_IMG_EN_New_C-Advertorial_Sale_CTA-65_Angle-W-B-C_M-MIX_VL-None_G-M_P-OG_S-NONE,3930 - MD in Nutrition || Batch 3 || Enhancements: OFF || CBV2 || 7C || 30/03/25w14,,$25,"1,081",2025-03-30,2025-03-31,1
305,CB_2025_Mar_FB_3941_LZ-DT_V02_9x16_VID_EN_New_C-Testimonial_Evergreen_CTA-SALE_Angle-GH_M-SMT_VL-30s_G-F_P-OG_S-NEW,3941 - health wellbeing new vid || Batch 1 || Enhancements: OFF || CBV1 || 7C || 30/03/25w14,,$25,881,2025-03-30,2025-03-31,1
306,CB_2025_Mar_FB_3903_VK_V02_9x16_VID_EN_New_C-BulletPoints_Evergreen_CTA-65_Angle-W-B-C_M-MIX_VL-30s_G-MF_P-OG_S-WOOD,3903 - #13 My husband hides his beer belly - VK  || Batch 1 || Enhancements: OFF || CBV1 || 7C || 24/03/25w13,,$25,"1,157",2025-03-24,2025-03-29,5
307,CB_2025_Mar_FB_3913_CHUB-AS_V10_1x1_IMG_EN_New_C-NONE_CTA-NONE_Angle-W_M-NONE_VL-None_TR-None_G-NONE_P-NONE_S-NONE_blog_moobs_cv_en,CBV1 || LP:HI | blog_moobs_cv_en || Batch 3 || 30/03/25,,$24,"1,083",2025-03-30,2025-03-31,1
308,CB_2025_Mar_FB_3940_DT-DP_V06_9x16_VID_EN_New_C-Trend_Sale_CTA-65_Angle-W-B-C_M-_VL-None_G-M_P-OG_S-New,3940 - #4 Never use your GF's supplements || Batch 2 || Enhancements: OFF || CBV1 || 7C || 30/03/25w14,,$24,950,2025-03-30,2025-03-31,1
309,CB_2025_Jan_FB_3923_VK-KB_V05_1x1_VID_EN_Opti_C-BulletPoints_Evergreen_CTA-65_Angle-W-B-C_M-NONE_VL-None_G-F_P-OG_S-NEW_FB3779V04,3923 - OPTI 3779 - VK || Batch 2 || Enhancements: OFF || CBV1 || 7C || 24/03/25w13,,$24,860,2025-03-24,2025-03-29,5
310,CB_2025_Mar_FB_3910_LZ-DP_V01_1x1_IMG_EN_Opti_C-Headline_Evergreen_CTA-NONE_Angle-W_M-NONE_VL-None_G-NONE_P-TRIAL_S-NONE_FB3251V02.png,US || Free trial offer || Trial ads || ATC || 7C || 16/03/25,,$24,"1,256",2025-03-16,2025-03-31,15
311,CB_2025_Mar_FB_3947_LZ-VG_V03_4x5_IMG_EN_New_C-StickyNotes_Evergreen_CTA-SALE_Angle-Horm_M-NONE_VL-None_G-M_P-OG_S-NONE,3947 - low t post it notes || Batch 1 || Enhancements: OFF || CBV1 || 7C || 30/03/25w14,,$24,960,2025-03-30,2025-03-31,1
312,CB_2025_Mar_FB_3943_LZ-DP_V03_4x5_IMG_EN_Opti_C-BeforeAfter_Sale_CTA-SALE_Angle-W_M-NONE_VL-NONE_G-M_P-OG_S-NONE_FB3812V03,3943 - man boobs price cta opti || Batch 1 || Enhancements: OFF || CBV1 || 7C || 30/03/25w14,,$24,953,2025-03-30,2025-03-31,1
313,CB_2025_Mar_FB_3949_VK-DP_V05_9x16_VID_EN_New_C-NONE_Evergreen_CTA-NONE_Angle-W-B-C_M-TYL_VL-None_G-M_P-OG_S-WOOD,"3949 - ""Never use your GF's supplements"" script for actor - VK || Batch 2 || Enhancements: OFF || CBV1 || 7C || 30/03/25w14",,$23,932,2025-03-30,2025-03-31,1
314,CB_2025_Mar_FB_3927_DT_V04_1x1_IMG_EN_New_C-NONE_Evergreen_CTA-None_Angle-W_M-NONE_VL-None_G-NONE_P-OG_S-NONE_FB3890V03,3927 - Opti 3890 || Batch 1 || Enhancements: OFF || CBV1 || 7C || 24/03/25w13,,$23,"1,372",2025-03-24,2025-03-29,5
315,CB_2023_Jul_FB_2217_IB_V04_9x16_VID_EN_Opti_C-Pointing_CTA-SMR_Pain-W-B_M-TRC_VL-30s_TR-None_G-F_P-None_S-FRIGGA,US || CBV2 || V1 vs V2 || V1 - ORIGINAL || 2ND TRY || 7C || 17/03/25,,$23,871,2025-03-17,2025-03-24,7
316,CB_2025_Mar_FB_3913_CHUB-AS_V02_1x1_IMG_EN_New_C-NONE_CTA-NONE_Angle-W_M-NONE_VL-None_TR-None_G-NONE_P-NONE_S-NONE_blog_moobs_cv_en,CBV1 || LP:HI | blog_moobs_cv_en || Batch 1 || 30/03/25,,$23,954,2025-03-30,2025-03-31,1
317,CB_2024_Sep_FB_3175_DA-KB_V01_1x1_IMG_EN_New_C-ADVRT_Evergreen_CTA-NONE_Angle-W_M-NONE_VL-None_G-NONE_P-CBV2_S-NONE_blog_colonbroomvsmammothhighprice3_cv_en,CBV2 || A/B test CTA button: Variaton || CBV2 vs Happy Mammoth || 7C || 13/03/25,,$22,941,2025-03-13,2025-03-26,13
318,CB_2025_Mar_FB_3949_VK-DP_V03_9x16_VID_EN_New_C-NONE_Evergreen_CTA-NONE_Angle-W-B-C_M-TYL_VL-None_G-M_P-OG_S-NONE,"3949 - ""Never use your GF's supplements"" script for actor - VK || Batch 1 || Enhancements: OFF || CBV1 || 7C || 30/03/25w14",,$22,941,2025-03-30,2025-03-31,1
319,CB_2025_Mar_FB_3930_DT-KB_V14_1x1_IMG_EN_New_C-Advertorial_Sale_CTA-65_Angle-W-B-C_M-MIX_VL-None_G-M_P-OG_S-NONE,3930 - MD in Nutrition || Batch 4 || Enhancements: OFF || CBV2 || 7C || 30/03/25w14,,$22,781,2025-03-30,2025-03-31,1
320,CB_2025_Mar_FB_3930_DT-KB_V12_1x1_IMG_EN_New_C-Advertorial_Sale_CTA-65_Angle-W-B-C_M-MIX_VL-None_G-M_P-OG_S-NONE,3930 - MD in Nutrition || Batch 3 || Enhancements: OFF || CBV2 || 7C || 30/03/25w14,,$22,936,2025-03-30,2025-03-31,1
321,CB_2025_Jan_FB_3747_CHUB-AA_V01_4x5_IMG_EN_Opti_C-NONE_CTA-NONE_Angle-Sale_M-NONE_VL-None_TR-None_G-NONE_P-OG_S-NONE,3747 Clean Sale [HB winner ITR] CHUB || Enhancements: OFF || CBV1 || Batch Ä… || 1C || 02/02/25w06 || Kostas,SHARE,$22,"2,234",2025-02-02,2025-03-31,57
322,CB_2025_Mar_FB_3951_LZ_V04_9x16_VID_EN_New_C-Trend_Evergreen_CTA-SALE_Angle-W_M-MAN_VL-15s_G-M_P-OG_S-NEW,3951 - morning routine || Batch 1 || Enhancements: OFF || CBV2 || 7C || 27/03/25w13,,$21,"1,313",2025-03-27,2025-03-31,4
323,CB_2025_Mar_FB_3950_SO_V01_4x5_IMG_EN_New_C-NONE_Evergreen_CTA-NONE_Angle-W-B-C_M-NONE_VL-None_G-NONE_P-OG_S-NONE,3950 - Image Gen by ChatGPT || Batch 1 || Enhancements: OFF || CBV1 || 7C || 30/03/25w14,,$21,982,2025-03-30,2025-03-31,1
324,CB_2025_Mar_FB_3930_DT-KB_V03_1x1_IMG_EN_New_C-Advertorial_Sale_CTA-65_Angle-W-B-C_M-MIX_VL-None_G-M_P-OG_S-NONE,3930 - MD in Nutrition || Batch 1 || Enhancements: OFF || CBV2 || 7C || 30/03/25w14,,$20,906,2025-03-30,2025-03-31,1
325,CB_2025_Mar_FB_3930_DT-KB_V13_1x1_IMG_EN_New_C-Advertorial_Sale_CTA-65_Angle-W-B-C_M-MIX_VL-None_G-M_P-OG_S-NONE,3930 - MD in Nutrition || Batch 4 || Enhancements: OFF || CBV2 || 7C || 30/03/25w14,,$19,609,2025-03-30,2025-03-31,1
326,CB_2025_Mar_FB_3950_SO_V13_4x5_IMG_EN_New_C-NONE_Evergreen_CTA-NONE_Angle-W-B-C_M-NONE_VL-None_G-NONE_P-OG_S-NONE,3950 - Image Gen by ChatGPT || Batch 3 || Enhancements: OFF || CBV1 || 7C || 30/03/25w14,,$19,"1,079",2025-03-30,2025-03-31,1
327,CB_2025_Mar_FB_3930_DT-KB_V10_1x1_IMG_EN_New_C-Advertorial_Sale_CTA-65_Angle-W-B-C_M-MIX_VL-None_G-M_P-OG_S-NONE,3930 - MD in Nutrition || Batch 3 || Enhancements: OFF || CBV2 || 7C || 30/03/25w14,,$19,814,2025-03-30,2025-03-31,1
328,CB_2025_Mar_FB_3930_DT-KB_V16_1x1_IMG_EN_New_C-Advertorial_Sale_CTA-65_Angle-W-B-C_M-MIX_VL-None_G-M_P-OG_S-NONE,3930 - MD in Nutrition || Batch 4 || Enhancements: OFF || CBV2 || 7C || 30/03/25w14,,$19,586,2025-03-30,2025-03-31,1
329,CB_2025_Mar_FB_3949_VK-DP_V06_9x16_VID_EN_New_C-NONE_Evergreen_CTA-NONE_Angle-W-B-C_M-TYL_VL-None_G-M_P-OG_S-NEW,"3949 - ""Never use your GF's supplements"" script for actor - VK || Batch 2 || Enhancements: OFF || CBV1 || 7C || 30/03/25w14",,$19,747,2025-03-30,2025-03-31,1
330,CB_2024_Sep_FB_3175_DA-KB_V02_1x1_IMG_EN_New_C-ADVRT_Evergreen_CTA-NONE_Angle-W_M-NONE_VL-None_G-NONE_P-CBV2_S-NONE_blog_colonbroomvsmammoth_cv_en,CBV2 || A/B test CTA button: Control || CBV2 vs Happy Mammoth || 7C || 13/03/25,,$19,911,2025-03-13,2025-03-26,13
331,CB_2025_Mar_FB_3907_CHUB-AA_V01__IMG_EN_Opti_C-Price_CTA-NONE_Angle-None_M-NONE_VL-None_TR-None_G-NONE_P-OG_S-NONE,3907 â€“ CHUB Clean Sale OPTI v2 || Enhancements: OFF || CBV1 || Batch 1 || 7C || 16/03/25w12,,$18,975,2025-03-16,2025-03-31,15
332,CB_2025_Mar_FB_3940_DT-DP_V02_9x16_VID_EN_New_C-Trend_Evergreen_CTA-None_Angle-W-B-C_M-_VL-None_G-M_P-OG_S-NONE,3940 - #4 Never use your GF's supplements || Batch 1 || Enhancements: OFF || CBV1 || 7C || 30/03/25w14,,$18,713,2025-03-30,2025-03-31,1
333,CB_2025_Jan_FB_3923_VK-KB_V11_1x1_VID_EN_Opti_C-BulletPoints_Evergreen_CTA-65_Angle-W-B-C_M-NONE_VL-None_G-F_P-OG_S-NEW_FB3779V04,3923 - OPTI 3779 - VK || Batch 1 || Enhancements: OFF || CBV1 || 7C || 24/03/25w13,,$18,693,2025-03-24,2025-03-31,7
334,CB_2025_Mar_FB_3939_DT_V03_4x5_IMG_EN_New_C-Advertorial_Sale_CTA-65_Angle-W-B-C_M-MIX_VL-None_G-M_P-OG_S-NONE,3939 - CB Advertorial ads New Ideas || Batch 1 || Enhancements: OFF || CBV1 || 7C || 30/03/25w14,,$18,707,2025-03-30,2025-03-31,1
335,CB_2025_Mar_FB_3916_VK-DP_V03_1x1_VID_EN_New_C-BulletPoints_Evergreen_CTA-NONE_Angle-W-B-C_M-NONE_VL-None_G-M_P-OG_S-NONE,3916 - #11 Date night -VK || Batch 1 || Enhancements: OFF || CBV1 || 7C || 24/03/25w13,,$17,729,2025-03-24,2025-03-28,4
336,CB_2024_Dec_FB_3592_VK-DP_V10_4x5_VID_EN_New_C-BulletPoints_Sale_CTA-SALE_Angle-W-B-C_M-NONE_VL-30s_G-F_P-OG_S-NEW - Copy,ðŸŒ¶ï¸ || US || ASC+ || ->CC141 || VIDEO Only || US+CA || 0% EXISTING CAP || 7C || 07/08.24  Ad set,VIDEO,$17,624,2024-12-21,2025-03-31,100
337,CB_2025_Mar_FB_3934_CHUB-KZ_V01_9x16_VID_EN_New_C-NONE_CTA-NONE_Angle-None_M-NONE_VL-None_TR-None_G-NONE_P-NONE_S-NONE,3934 - CHUB FireIceHooks || Batch 1 || Enhancements: OFF || CBV1 || 7C || 24/03/25w13,,$17,546,2025-03-25,2025-03-29,4
338,CB_2025_Jan_FB_3747_CHUB-AA_V04_9x16_IMG_EN_Opti_C-NONE_CTA-NONE_Angle-Sale_M-NONE_VL-None_TR-None_G-NONE_P-OG_S-NONE,3747 Clean Sale [HB winner ITR] CHUB || Enhancements: OFF || CBV1 || Batch Ä… || 1C || 02/02/25w06 || Kostas,SHARE,$17,"1,444",2025-02-02,2025-03-31,57
339,CB_2025_Feb_FB_3874_CHUB-AA_V11_1x1_IMG_EN_New_C-NONE_CTA-NONE_Angle-W_M-NONE_VL-None_TR-None_G-NONE_P-NONE_S-NONE_blog_biohacking_cv_en,CBV1 || LP:HI | 3874 Advertorial Biohacking || Biohack for 40+ Women || Batch 3 || 17/07/25,,$17,160,2025-03-17,2025-03-25,8
340,CB_2025_Mar_FB_3913_CHUB-AS_V07_1x1_IMG_EN_New_C-NONE_CTA-NONE_Angle-W_M-NONE_VL-None_TR-None_G-NONE_P-NONE_S-NONE_blog_moobs_cv_en,CBV1 || LP:HI | blog_moobs_cv_en || Batch 2 || 30/03/25,,$17,563,2025-03-30,2025-03-31,1
341,CB_2025_Mar_FB_3939_DT_V07_4x5_IMG_EN_New_C-Advertorial_Sale_CTA-65_Angle-W-B-C_M-MIX_VL-None_G-M_P-OG_S-NONE,3939 - CB Advertorial ads New Ideas || Batch 2 || Enhancements: OFF || CBV1 || 7C || 30/03/25w14,,$17,671,2025-03-30,2025-03-31,1
342,CB_2023_Sep_FB_2429_DT_V03_9x16_VID_EN_Opti_C-Sale_CTA-CTA_Pain-W_M-MIX_VL-45s_TR-None_G-MF_P-V2_S-WHAT,US || CBV2 || Default landing || 7C || 26/03/25,,$16,896,2025-03-26,2025-03-28,2
343,CB_2025_Mar_FB_3939_DT_V08_4x5_IMG_EN_New_C-Advertorial_Sale_CTA-65_Angle-W-B-C_M-MIX_VL-None_G-M_P-OG_S-NONE,3939 - CB Advertorial ads New Ideas || Batch 2 || Enhancements: OFF || CBV1 || 7C || 30/03/25w14,,$16,690,2025-03-30,2025-03-31,1
344,CB_2024_Sep_FB_3175_DA-KB_V02_1x1_IMG_EN_New_C-ADVRT_Evergreen_CTA-NONE_Angle-W_M-NONE_VL-None_G-NONE_P-CBV2_S-NONE_blog_colonbroomvsmammothhighprice3_cv_en,CBV2 || A/B test CTA button: Variaton || CBV2 vs Happy Mammoth || 7C || 26/03/25,,$16,762,2025-03-26,2025-03-31,5
345,CB_2025_Mar_FB_3950_SO_V12_4x5_IMG_EN_New_C-NONE_Evergreen_CTA-NONE_Angle-W-B-C_M-NONE_VL-None_G-NONE_P-OG_S-NONE,3950 - Image Gen by ChatGPT || Batch 3 || Enhancements: OFF || CBV1 || 7C || 30/03/25w14,,$16,884,2025-03-30,2025-03-31,1
346,CB_2023_Sep_FB_2429_DT_V03_9x16_VID_EN_Opti_C-Sale_CTA-CTA_Pain-W_M-MIX_VL-45s_TR-None_G-MF_P-V2_S-WHAT,US || CBV2 || FLOW V2 landing || 7C || 26/03/25,,$16,776,2025-03-26,2025-03-28,2
347,CB_2025_Mar_FB_3939_DT_V02_4x5_IMG_EN_New_C-Advertorial_Sale_CTA-65_Angle-W-B-C_M-MIX_VL-None_G-M_P-OG_S-NONE,3939 - CB Advertorial ads New Ideas || Batch 1 || Enhancements: OFF || CBV1 || 7C || 30/03/25w14,,$16,456,2025-03-30,2025-03-31,1
348,CB_2025_Mar_FB_3891_VK_V08_1x1_IMG_EN_New_C-BulletPoints_Evergreen_CTA-65_Angle-W-B-C_M-NONE_VL-None_G-M_P-OG_S-NONE,3891 - LOW T LEVELS - VK || Enhancements: OFF || CBV1 || Batch 2 || 7C || 10/03/25w11,,$15,775,2025-03-11,2025-03-29,18
349,CB_2025_Mar_FB_3952_LZ-DP_V02_9x16_VID_EN_Opti_C-NegativeMark_Evergreen_CTA-SALE_Angle-W_M-SMT_VL-15s_G-F_P-OG_S-NEW_FB3264V29,3952 - Depuff face bad reviews || Batch 1 || Enhancements: OFF || CBV1 || 7C || 30/03/25w14,,$15,765,2025-03-30,2025-03-31,1
350,CB_2025_Mar_FB_3920_VK_V08_1x1_VID_EN_Opti_C-BulletPoints_Evergreen_CTA-NONE_Angle-W-B-C_M-NONE_VL-None_G-M_P-OG_S-NONE_FB3891V05,3920 - 3891 OPTI - VK || Batch 2 || Enhancements: OFF || CBV1 || 7C || 24/03/25w13,,$15,518,2025-03-24,2025-03-27,3
351,CB_2025_Mar_FB_3941_LZ-DT_V01_9x16_VID_EN_New_C-Testimonial_Evergreen_CTA-SALE_Angle-GH_M-SMT_VL-30s_G-F_P-OG_S-NEW,3941 - health wellbeing new vid || Batch 1 || Enhancements: OFF || CBV1 || 7C || 30/03/25w14,,$15,517,2025-03-30,2025-03-31,1
352,CB_2025_Mar_FB_3924_SO-DP_V02_1x1_IMG_EN_New_C-NONE_Evergreen_CTA-NONE_Angle-W-B-C_M-NONE_VL-None_G-NONE_P-OG_S-NONE,3924 - #17 man boobs/dad bod body text IMG || Batch 1 || Enhancements: OFF || CBV1 || 7C || 24/03/25w13,,$15,855,2025-03-24,2025-03-30,6
353,CB_2025_Mar_FB_3940_DT-DP_V03_9x16_VID_EN_New_C-Trend_Evergreen_CTA-None_Angle-W-B-C_M-_VL-None_G-M_P-OG_S-NONE,3940 - #4 Never use your GF's supplements || Batch 1 || Enhancements: OFF || CBV1 || 7C || 30/03/25w14,,$15,498,2025-03-30,2025-03-31,1
354,CB_2025_Mar_FB_3950_SO_V08_4x5_IMG_EN_New_C-NONE_Evergreen_CTA-NONE_Angle-W-B-C_M-NONE_VL-None_G-NONE_P-OG_S-NONE,3950 - Image Gen by ChatGPT || Batch 2 || Enhancements: OFF || CBV1 || 7C || 30/03/25w14,,$14,685,2025-03-30,2025-03-31,1
355,CB_2025_Mar_FB_3902_SO-JT_V01_1x1_IMG_EN_New_C-NONE_Evergreen_CTA-NONE_Angle-W-B-C_M-NONE_VL-None_G-NONE_P-OG_S-NONE,ðŸŒ¶ï¸ || US || ASC+ || ->CC141 || VIDEO Only || US+CA || 0% EXISTING CAP || 7C || 07/08.24  Ad set,,$14,568,2025-03-25,2025-03-31,6
356,CB_2025_Mar_FB_3930_DT-KB_V06_1x1_IMG_EN_New_C-Advertorial_Sale_CTA-65_Angle-W-B-C_M-MIX_VL-None_G-M_P-OG_S-NONE,3930 - MD in Nutrition || Batch 2 || Enhancements: OFF || CBV2 || 7C || 30/03/25w14,,$14,663,2025-03-30,2025-03-31,1
357,CB_2024_Oct_FB_3214_DT-KB_V02_1x1_IMG_EN_New_C-ADVRT_Evergreen_CTA-NONE_Angle-W_M-NONE_VL-None_G-NONE_P-OG_S-NONE,CA || Advantage+ || Advertorial || 7C ||  BROAD || Existing_customer_0% || 20/03/25 Ad set,SHARE,$14,"1,202",2025-03-20,2025-03-31,11
358,CB_2025_Mar_FB_3930_DT-KB_V02_1x1_IMG_EN_New_C-Advertorial_Sale_CTA-65_Angle-W-B-C_M-MIX_VL-None_G-M_P-OG_S-NONE,3930 - MD in Nutrition || Batch 1 || Enhancements: OFF || CBV2 || 7C || 30/03/25w14,,$14,747,2025-03-30,2025-03-31,1
359,CB_2024_Sep_FB_3175_DA-KB_V02_1x1_IMG_EN_New_C-ADVRT_Evergreen_CTA-NONE_Angle-W_M-NONE_VL-None_G-NONE_P-CBV2_S-NONE_blog_colonbroomvsmammoth_cv_en,CBV2 || A/B test CTA button: Control || CBV2 vs Happy Mammoth || 7C || 26/03/25,,$14,659,2025-03-26,2025-03-31,5
360,CB_2024_Sep_FB_3175_DA-KB_V03_1x1_IMG_EN_New_C-ADVRT_Evergreen_CTA-NONE_Angle-W_M-NONE_VL-None_G-NONE_P-CBV2_S-NONE_blog_colonbroomvsmammoth_cv_en,CBV2 || A/B test CTA button: Control || CBV2 vs Happy Mammoth || 7C || 13/03/25,,$14,419,2025-03-13,2025-03-26,13
361,CB_2025_Mar_FB_3914_DT-DP_V02_9x16_VID_EN_New_C-Trend_Sale_CTA-SPRNG_Angle-W-B-C_M-JOG_VL-30s_G-F_P-OG_S-NEW,"3914 - #9 GF's POV, male confidence || Batch 1 || Enhancements: OFF || CBV1 || 7C || 24/03/25w13",,$14,683,2025-03-24,2025-03-29,5
362,CB_2025_Mar_FB_3909_DT-DP_V02_9x16_VID_EN_New_C-Trend_Evergreen_CTA-SMRBOD_Angle-W-B-C_M-JANW_VL-30s_G-M_P-OG_S-NEW,3909 - Shirtless anxiety VID || Batch 1 || Enhancements: OFF || CBV1 || 7C || 24/03/25w13,,$14,671,2025-03-24,2025-03-31,7
363,CB_2023_Jul_FB_2217_IB_V04_9x16_VID_EN_Opti_C-Pointing_CTA-SMR_Pain-W-B_M-TRC_VL-30s_TR-None_G-F_P-None_S-FRIGGA,US || V1 vs V2 || V1 - ORIGINAL || 2ND TRY || 7C || 17/03/25,,$14,507,2025-03-17,2025-03-24,7
364,CB_2025_Mar_FB_3952_LZ-DP_V04_9x16_VID_EN_Opti_C-NegativeMark_Evergreen_CTA-SALE_Angle-W_M-SMT_VL-15s_G-F_P-OG_S-NEW_FB3264V29,3952 - Depuff face bad reviews || Batch 1 || Enhancements: OFF || CBV1 || 7C || 30/03/25w14,,$13,647,2025-03-30,2025-03-31,1
365,CB_2025_Mar_FB_3891_VK_V05_1x1_IMG_EN_New_C-BulletPoints_Evergreen_CTA-65_Angle-W-B-C_M-NONE_VL-None_G-M_P-OG_S-NONE,US || Quiz ads || Event: Trial purchase || 7C || 24/03/25,,$13,806,2025-03-24,2025-03-25,1
366,CB_2025_Mar_FB_3902_SO-JT_V03_1x1_IMG_EN_New_C-NONE_Evergreen_CTA-NONE_Angle-W-B-C_M-NONE_VL-None_G-NONE_P-OG_S-NONE,ðŸŒ¶ï¸ || US || ASC+ || ->CC141 || VIDEO Only || US+CA || 0% EXISTING CAP || 7C || 07/08.24  Ad set,,$12,535,2025-03-25,2025-03-31,6
367,CB_2024_Oct_FB_3214_DT-KB_V05_1x1_IMG_EN_New_C-ADVRT_Evergreen_CTA-NONE_Angle-W_M-NONE_VL-None_G-NONE_P-OG_S-NONE,CA || Advantage+ || Advertorial || 7C ||  BROAD || Existing_customer_0% || 20/03/25 Ad set,SHARE,$12,891,2025-03-20,2025-03-31,11
368,CB_2025_Mar_FB_3946_LZ-VG_V01_4x5_IMG_EN_New_C-BeforeAfter_Evergreen_CTA-SALE_Angle-W-B_M-NONE_VL-None_G-M_P-OG_S-NONE,3946 - man boobs before after LZ+VG || Batch 1 || Enhancements: OFF || CBV1 || 7C || 30/03/25w14,,$12,435,2025-03-30,2025-03-31,1
369,CB_2025_Mar_FB_3944_LZ-VG_V02_4x5_IMG_EN_Opti_C-Testimonial_Evergreen_CTA-NONE_Angle-GH_M-NONE_VL-None_G-NONE_P-OG_S-NONE_FB3619V02,3944 - 3619 opti claims/testimonial || Batch 1 || Enhancements: OFF || CBV1 || 7C || 30/03/25w14,,$12,385,2025-03-30,2025-03-31,1
370,CB_2025_Mar_FB_3930_DT-KB_V08_1x1_IMG_EN_New_C-Advertorial_Sale_CTA-65_Angle-W-B-C_M-MIX_VL-None_G-M_P-OG_S-NONE,3930 - MD in Nutrition || Batch 2 || Enhancements: OFF || CBV2 || 7C || 30/03/25w14,,$12,396,2025-03-30,2025-03-31,1
371,CB_2025_Jan_FB_3923_VK-KB_V06_1x1_VID_EN_Opti_C-BulletPoints_Evergreen_CTA-65_Angle-W-B-C_M-NONE_VL-None_G-F_P-OG_S-NEW_FB3779V04,3923 - OPTI 3779 - VK || Batch 1 || Enhancements: OFF || CBV1 || 7C || 24/03/25w13,,$12,412,2025-03-24,2025-03-30,6
372,CB_2025_Mar_FB_3909_DT-DP_V01_9x16_VID_EN_New_C-Trend_Evergreen_CTA-SMRBOD_Angle-W-B-C_M-JANW_VL-30s_G-M_P-OG_S-NEW,3909 - Shirtless anxiety VID || Batch 1 || Enhancements: OFF || CBV1 || 7C || 24/03/25w13,,$11,647,2025-03-24,2025-03-31,7
373,CB_2025_Mar_FB_3950_SO_V07_4x5_IMG_EN_New_C-NONE_Evergreen_CTA-NONE_Angle-W-B-C_M-NONE_VL-None_G-NONE_P-OG_S-NONE,3950 - Image Gen by ChatGPT || Batch 2 || Enhancements: OFF || CBV1 || 7C || 30/03/25w14,,$11,531,2025-03-30,2025-03-31,1
374,CB_2024_Sep_FB_3175_DA-KB_V01_1x1_IMG_EN_New_C-ADVRT_Evergreen_CTA-NONE_Angle-W_M-NONE_VL-None_G-NONE_P-CBV2_S-NONE_blog_colonbroomvsmammoth_cv_en,CBV2 || A/B test CTA button: Control || CBV2 vs Happy Mammoth || 7C || 26/03/25,,$11,464,2025-03-26,2025-03-31,5
375,CB_2025_Feb_FB_3874_CHUB-KZ_V01_1x1_IMG_EN_New_C-NONE_CTA-NONE_Angle-W_M-NONE_VL-None_TR-None_G-NONE_P-NONE_S-NONE_blog_biohacking_cv_en,CBV1 || LP:HI | 3874 Advertorial Biohacking || Biohack for 40+ Women || Batch 1 || 17/07/25,,$10,305,2025-03-17,2025-03-25,8
376,CB_2024_Apr_FB_2943_DT_V01_9x16_VID_EN_Opti_C-Sale_CTA-CTA_Pain-W_M-MIX_VL-45s_TR-None_G-MF_P-V2_S-WHAT_FB_2429V03,2943 - Opti PPC 2429 || Batch 1 || Enhancements: OFF || CBV2 || 7C || 25/03/25w13,,$10,420,2025-03-24,2025-03-31,7
377,CB_2024_Aug_FB_3097_VK-DP_V03_9x16_VID_EN_Opti_C-Benefits_CTA-SMR_Pain-W-B_M-MIX_VL-45s_TR-None_G-MF_P-OG_S-WHAT_FB2516V13,US || V1 vs V2 || V1 - ORIGINAL || 2ND TRY || 7C || 17/03/25,,$10,460,2025-03-17,2025-03-24,7
378,CB_2025_Mar_FB_3939_DT_V06_4x5_IMG_EN_New_C-Advertorial_Sale_CTA-65_Angle-W-B-C_M-MIX_VL-None_G-M_P-OG_S-NONE,3939 - CB Advertorial ads New Ideas || Batch 2 || Enhancements: OFF || CBV1 || 7C || 30/03/25w14,,$10,456,2025-03-30,2025-03-31,1
379,CB_2025_Mar_FB_3950_SO_V15_4x5_IMG_EN_New_C-NONE_Evergreen_CTA-NONE_Angle-W-B-C_M-NONE_VL-None_G-NONE_P-OG_S-NONE,3950 - Image Gen by ChatGPT || Batch 4 || Enhancements: OFF || CBV1 || 7C || 30/03/25w14,,$9,520,2025-03-30,2025-03-31,1
380,CB_2025_Mar_FB_3949_VK-DP_V02_9x16_VID_EN_New_C-NONE_Evergreen_CTA-NONE_Angle-W-B-C_M-TYL_VL-None_G-M_P-OG_S-NONE,"3949 - ""Never use your GF's supplements"" script for actor - VK || Batch 1 || Enhancements: OFF || CBV1 || 7C || 30/03/25w14",,$9,355,2025-03-30,2025-03-31,1
381,CB_2025_Mar_FB_3916_VK-DP_V04_1x1_VID_EN_New_C-BulletPoints_Evergreen_CTA-NONE_Angle-W-B-C_M-NONE_VL-None_G-M_P-OG_S-NONE,3916 - #11 Date night -VK || Batch 1 || Enhancements: OFF || CBV1 || 7C || 24/03/25w13,,$9,495,2025-03-24,2025-03-28,4
382,CB_2024_Aug_FB_3097_VK-DP_V03_9x16_VID_EN_Opti_C-Benefits_CTA-SMR_Pain-W-B_M-MIX_VL-45s_TR-None_G-MF_P-OG_S-WHAT_FB2516V13,US || CBV2 || V1 vs V2 || V1 - ORIGINAL || 2ND TRY || 7C || 17/03/25,,$9,332,2025-03-17,2025-03-24,7
383,CB_2025_Mar_FB_3930_DT-KB_V15_1x1_IMG_EN_New_C-Advertorial_Sale_CTA-65_Angle-W-B-C_M-MIX_VL-None_G-M_P-OG_S-NONE,3930 - MD in Nutrition || Batch 4 || Enhancements: OFF || CBV2 || 7C || 30/03/25w14,,$9,405,2025-03-30,2025-03-31,1
384,CB_2025_Mar_FB_3913_CHUB-AS_V06_1x1_IMG_EN_New_C-NONE_CTA-NONE_Angle-W_M-NONE_VL-None_TR-None_G-NONE_P-NONE_S-NONE_blog_moobs_cv_en,CBV1 || LP:HI | blog_moobs_cv_en || Batch 2 || 30/03/25,,$9,337,2025-03-30,2025-03-31,1
385,CB_2025_Mar_FB_3950_SO_V04_4x5_IMG_EN_New_C-NONE_Evergreen_CTA-NONE_Angle-W-B-C_M-NONE_VL-None_G-NONE_P-OG_S-NONE,3950 - Image Gen by ChatGPT || Batch 1 || Enhancements: OFF || CBV1 || 7C || 30/03/25w14,,$9,365,2025-03-30,2025-03-31,1
386,CB_2025_Mar_FB_3924_SO-DP_V01_1x1_IMG_EN_New_C-NONE_Evergreen_CTA-NONE_Angle-W-B-C_M-NONE_VL-None_G-NONE_P-OG_S-NONE,3924 - #17 man boobs/dad bod body text IMG || Batch 1 || Enhancements: OFF || CBV1 || 7C || 24/03/25w13,,$9,428,2025-03-24,2025-03-29,5
387,CB_2024_Sep_FB_3175_DA-KB_V01_1x1_IMG_EN_New_C-ADVRT_Evergreen_CTA-NONE_Angle-W_M-NONE_VL-None_G-NONE_P-CBV2_S-NONE_blog_colonbroomvsmammoth_cv_en,CBV2 || A/B test CTA button: Control || CBV2 vs Happy Mammoth || 7C || 13/03/25,,$9,431,2025-03-13,2025-03-26,13
388,CB_2025_Mar_FB_3913_CHUB-AS_V11_1x1_IMG_EN_New_C-NONE_CTA-NONE_Angle-W_M-NONE_VL-None_TR-None_G-NONE_P-NONE_S-NONE_blog_moobs_cv_en,CBV1 || LP:HI | blog_moobs_cv_en || Batch 3 || 30/03/25,,$9,356,2025-03-30,2025-03-31,1
389,CB_2025_Mar_FB_3924_SO-DP_V05_1x1_IMG_EN_New_C-NONE_Evergreen_CTA-NONE_Angle-W-B-C_M-NONE_VL-None_G-NONE_P-OG_S-NONE,3924 - #17 man boobs/dad bod body text IMG || Batch 2 || Enhancements: OFF || CBV1 || 7C || 24/03/25w13,,$8,426,2025-03-24,2025-03-28,4
390,CB_2025_Mar_FB_3920_VK_V09_1x1_VID_EN_Opti_C-BulletPoints_Evergreen_CTA-NONE_Angle-W-B-C_M-NONE_VL-None_G-M_P-OG_S-NONE_FB3891V05,3920 - 3891 OPTI - VK || Batch 3 || Enhancements: OFF || CBV1 || 7C || 24/03/25w13,,$8,339,2025-03-24,2025-03-31,7
391,CB_2024_Jan_FB_2722_DA-RP_V01_9x16_VID_EN_New_C-Buzz_CTA-DISCOUNT_Pain-W_M-STOCK_VL-1m_TR-None_G-MF_P-V2_S-NEW,2722 - Trainspotting ads || Batch 1 || Enhancements: OFF || CBV2 || 7C || 25/03/25w13,,$8,381,2025-03-24,2025-03-28,4
392,CB_2025_Mar_FB_3930_DT-KB_V05_1x1_IMG_EN_New_C-Advertorial_Sale_CTA-65_Angle-W-B-C_M-MIX_VL-None_G-M_P-OG_S-NONE,3930 - MD in Nutrition || Batch 2 || Enhancements: OFF || CBV2 || 7C || 30/03/25w14,,$8,393,2025-03-30,2025-03-31,1
393,CB_2025_Mar_FB_3951_LZ_V01_9x16_VID_EN_New_C-Trend_Evergreen_CTA-SALE_Angle-W_M-MAN_VL-15s_G-M_P-OG_S-NEW,3951 - morning routine || Batch 1 || Enhancements: OFF || CBV2 || 7C || 27/03/25w13,,$8,445,2025-03-27,2025-03-31,4
394,CB_2024_Aug_FB_3097_VK-DP_V03_9x16_VID_EN_Opti_C-Benefits_CTA-SMR_Pain-W-B_M-MIX_VL-45s_TR-None_G-MF_P-OG_S-WHAT_FB2516V13,US || Quiz ads || Event: Trial purchase || 7C || 24/03/25,,$8,363,2025-03-24,2025-03-25,1
395,CB_2024_Nov_FB_3331_DT-DP_V16_4x5_VID_EN_Opti_C-Sale_Sale_CTA-BF70_Angle-W_M-LAURA_VL-45s_G-M-F_P-OG_S-NEW_FB2263V04,Relaunch || high potential ads ||  || Batch 1 || Enhancements: OFF || CBV1 || 7C || 25/03/25w13,,$8,364,2025-03-25,2025-03-31,6
396,CB_2025_Mar_FB_3944_LZ-VG_V01_4x5_IMG_EN_Opti_C-Educational_Evergreen_CTA-NONE_Angle-GH_M-NONE_VL-None_G-NONE_P-OG_S-NONE_FB3619V02,3944 - 3619 opti claims/testimonial || Batch 1 || Enhancements: OFF || CBV1 || 7C || 30/03/25w14,,$8,221,2025-03-30,2025-03-31,1
397,CB_2024_Sep_FB_3175_DA-KB_V03_1x1_IMG_EN_New_C-ADVRT_Evergreen_CTA-NONE_Angle-W_M-NONE_VL-None_G-NONE_P-CBV2_S-NONE_blog_colonbroomvsmammothhighprice3_cv_en,CBV2 || A/B test CTA button: Variaton || CBV2 vs Happy Mammoth || 7C || 26/03/25,,$8,261,2025-03-26,2025-03-31,5
398,CB_2025_Mar_FB_3921_DT-DP_V02_9x16_VID_EN_New_C-Trend_Sale_CTA-65_Angle-W_M-POW_VL-30s_G-M_P-OG_S-NEW_FB3863V03,3921 - 3863 opti VID || Batch 1 || Enhancements: OFF || CBV1 || 7C || 24/03/25w13,,$7,415,2025-03-24,2025-03-28,4
399,CB_2025_Feb_FB_3860_LZ-DP_V02_9x16_VID_EN_Opti_C-Testimonial_Evergreen_CTA-SALE_Angle-W_M-MOOD_VL-20s_G-M_P-OG_S-WOOD_FB21176V11_1,3860 - man boobs video 2176 opti || Enhancements: OFF || CBV1 || Batch 1 || 7C || 03/03/25w10 || Valentinas,VIDEO,$7,417,2025-03-03,2025-03-31,28
400,CB_2025_Mar_FB_3950_SO_V24_4x5_IMG_EN_New_C-NONE_Evergreen_CTA-NONE_Angle-W-B-C_M-NONE_VL-None_G-NONE_P-OG_S-NONE,3950 - Image Gen by ChatGPT || Batch 7 || Enhancements: OFF || CBV1 || 7C || 30/03/25w14,,$7,412,2025-03-30,2025-03-31,1
401,CB_2025_Mar_FB_3939_DT_V04_4x5_IMG_EN_New_C-Advertorial_Sale_CTA-65_Angle-W-B-C_M-MIX_VL-None_G-M_P-OG_S-NONE,3939 - CB Advertorial ads New Ideas || Batch 1 || Enhancements: OFF || CBV1 || 7C || 30/03/25w14,,$7,232,2025-03-30,2025-03-31,1
402,CB_2024_Dec_FB_3622_LZ-KB_V03_4x5_IMG_EN_Opti_C-NONE_Sale_CTA-XMAS_Angle-GH_M-NONE_VL-None_G-NONE_P-OG_S-NONE_FB2227V08 - Copy,US || Manual Bid || BID CAP 111 || 1C || 21/12/24,SHARE,$7,184,2024-12-22,2025-03-31,99
