,Ad Name,Adset Name,Creative Type,Spend In USD,Impressions,First Ad Spend Date,Last Ad Spend Date,Days ad spending
1,CB_2025_Feb_FB_3883_LZ-RP_V05_9x16_VID_EN_Opti_C-BulletPoints_Evergreen_CTA-SALE_Angle-W_M-JANW_VL-30s_G-M_P-OG_S-WHAT_FB2284V05,ðŸŒ¶ï¸ || US || ASC+ || ->CC141 || VIDEO Only || US+CA || 0% EXISTING CAP || 7C || 07/08.24  Ad set,VIDEO,"$23,684","1,305,630",2025-03-28,2025-04-06,9
2,CB_2025_Mar_FB_3914_DT-DP_V01_9x16_VID_EN_New_C-Trend_Sale_CTA-SPRNG_Angle-W-B-C_M-JOG_VL-30s_G-F_P-OG_S-NEW,ðŸŒ¶ï¸ || US || ASC+ || ->CC141 || VIDEO Only || US+CA || 0% EXISTING CAP || 7C || 07/08.24  Ad set,VIDEO,"$10,012","501,901",2025-03-28,2025-04-06,9
3,CB_2024_Sep_FB_3175_DA-KB_V04_1x1_IMG_EN_New_C-ADVRT_Evergreen_CTA-NONE_Angle-W_M-NONE_VL-None_G-NONE_P-CBV2_S-NONE_blog_colonbroomvsmammoth_cv_en,CBV2 || UK || Advantage+ || Advertorial |  || 0% EXISTING CAP || BROAD || 7C || ad set 18/03/25,SHARE,"$7,611","345,818",2025-03-18,2025-04-06,19
4,Dynamic_Creative_Statics_CA_Flow,WC || CA || DYNAMIC CREATIVE Static winners || ADV+ audience || 7C || 16.02.2025,SHARE,"$5,591","437,397",2025-02-16,2025-04-06,49
5,CB_2025_Feb_FB_3883_LZ-RP_V05_9x16_VID_EN_Opti_C-BulletPoints_Evergreen_CTA-SALE_Angle-W_M-JANW_VL-30s_G-M_P-OG_S-WHAT_FB2284V05,CA || ASC+ || 0% EXISTING || 7DC || 18.03.2025,VIDEO,"$5,245","528,870",2025-03-27,2025-04-06,10
6,CB_2025_Feb_FB_3883_LZ-RP_V05_9x16_VID_EN_Opti_C-BulletPoints_Evergreen_CTA-SALE_Angle-W_M-JANW_VL-30s_G-M_P-OG_S-WHAT_FB2284V05,CBV2 || AU || ðŸ’° Advantage+ || US || BROAD || 7C || Existing_customer_5% || 19/12/24 Ad set,VIDEO,"$4,519","281,896",2025-03-28,2025-04-06,9
7,CB_2025_Mar_FB_3914_DT-DP_V01_9x16_VID_EN_New_C-Trend_Sale_CTA-SPRNG_Angle-W-B-C_M-JOG_VL-30s_G-F_P-OG_S-NEW,CA || ASC+ || 0% EXISTING || 7DC || 18.03.2025,VIDEO,"$4,382","370,292",2025-04-01,2025-04-06,5
8,CB_2025_Mar_FB_3910_LZ-DP_V04_9x16_VID_EN_Opti_C-Testimonial_Evergreen_CTA-NONE_Angle-W_M-TRC_VL-15s_G-F_P-TRIAL_S-FRIGGA_FB2217V04.mp4,US || Free trial offer || Trial ads || Trial purchase || 7C || 19/03/25,VIDEO,"$4,085","117,344",2025-03-19,2025-04-06,18
9,CB_2025_Feb_FB_3827_LZ_V04_1x1_IMG_EN_Opti_C-Headline_Evergreen_CTA-SALE_Angle-W_M-NONE_VL-None_G-M_P-CBV2_S-NONE_FB3779V02,CBV2 || US || Manual Bid: ROAS GOAL: 1.00 -> 1.1 || 7DC || 22/01/2025,SHARE,"$3,727","123,537",2025-02-18,2025-04-06,47
10,CB_2025_Mar_FB_3907_CHUB-AA_V03__IMG_EN_Opti_C-Price_CTA-NONE_Angle-None_M-NONE_VL-None_TR-None_G-NONE_P-OG_S-NONE,CA || ASC+ || 0% EXISTING || 7DC || 18.03.2025,SHARE,"$3,352","228,387",2025-03-27,2025-04-06,10
11,CB_2023_Dec_FB_2712_RS-DP_V02_1x1_VID_EN_Opti_C-WrittenTesti_CTA-SALE_Pain-W-B-C_M-NONE_VL-None_TR-None_G-NONE_P-V2_S-NONE_FB2227V08,CBV2 || EU (UK) || ðŸ’° Advantage+ || US || BROAD || 7C || Existing_customer_5% || 15/12/24 Ad set,VIDEO,"$3,226","210,148",2025-03-31,2025-04-06,6
12,CB_2025_Feb_FB_3860_LZ-DP_V03_9x16_VID_EN_Opti_C-Testimonial_Evergreen_CTA-SALE_Angle-W_M-MOOD_VL-20s_G-M_P-OG_S-WOOD_FB21176V11_1,3860 - man boobs video 2176 opti || Enhancements: OFF || CBV1 || Batch 1 || 7C || 03/03/25w10 || Valentinas,VIDEO,"$3,086","157,098",2025-03-03,2025-04-06,34
13,CB_2025_Mar_FB_3907_CHUB-AA_V03__IMG_EN_Opti_C-Price_CTA-NONE_Angle-None_M-NONE_VL-None_TR-None_G-NONE_P-OG_S-NONE,ðŸŒ¶ï¸ || US || ASC+ || ->CC141 || VIDEO Only || US+CA || 0% EXISTING CAP || 7C || 07/08.24  Ad set,SHARE,"$2,671","110,733",2025-03-25,2025-04-06,12
14,CB_2025_Feb_FB_3883_LZ-RP_V05_9x16_VID_EN_Opti_C-BulletPoints_Evergreen_CTA-SALE_Angle-W_M-JANW_VL-30s_G-M_P-OG_S-WHAT_FB2284V05,3883 - Wiiner opti man boobs t levels || Enhancements: OFF || CBV1 || Batch 1 || 7C || 10/03/25w11,VIDEO,"$2,439","171,792",2025-03-10,2025-04-06,27
15,CB_2024_Sep_FB_3175_DA-KB_V04_1x1_IMG_EN_New_C-ADVRT_Evergreen_CTA-NONE_Angle-W_M-NONE_VL-None_G-NONE_P-CBV2_S-NONE_blog_colonbroomvsmammoth_cv_en,CBV2 || AU || Advantage+ || Advertorial |  || 0% EXISTING CAP || BROAD || 7C || ad set 18/03/25,SHARE,"$2,287","120,633",2025-03-20,2025-04-06,17
16,CB_2025_Feb_FB_3827_LZ_V01_1x1_IMG_EN_Opti_C-Headline_Evergreen_CTA-NONE_Angle-W_M-NONE_VL-None_G-M_P-CBV2_S-NONE_FB3723V04,CBV2 || US || Manual Bid: ROAS GOAL: 1.00 -> 1.1 || 7DC || 22/01/2025,SHARE,"$2,182","90,532",2025-02-18,2025-04-06,47
17,CB_2023_Jul_FB_2217_IB_V04_9x16_VID_EN_Opti_C-Pointing_CTA-SMR_Pain-W-B_M-TRC_VL-30s_TR-None_G-F_P-None_S-FRIGGA,US || ASC+ || Website + Shop || 7DC || Existing 0% || 24.03.2025 Ad set,VIDEO,"$2,111","72,834",2025-03-24,2025-04-06,13
18,CB_2024_Sep_FB_3175_DA-KB_V04_1x1_IMG_EN_New_C-ADVRT_Evergreen_CTA-NONE_Angle-W_M-NONE_VL-None_G-NONE_P-CBV2_S-NONE_blog_colonbroomvsmammoth_cv_en,CBV2 || TOP EU || Advantage+ || Advertorial |  || 0% EXISTING CAP || BROAD || 7C || 21/03/25 Ad set,SHARE,"$1,876","96,211",2025-03-21,2025-04-06,16
19,CB_2023_Jul_FB_2217_IB_V04_9x16_VID_EN_Opti_C-Pointing_CTA-SMR_Pain-W-B_M-TRC_VL-30s_TR-None_G-F_P-None_S-FRIGGA,US || Kilo Product's leads LAL || 7C || 04/03/25,VIDEO,"$1,794","59,553",2025-03-04,2025-04-05,32
20,CB_2024_Sep_FB_3175_DA-KB_V04_1x1_IMG_EN_New_C-ADVRT_Evergreen_CTA-NONE_Angle-W_M-NONE_VL-None_G-NONE_P-CBV2_S-NONE_blog_colonbroomvsmammoth_cv_en,CBV2 || Advantage+ || Advertorial || Higher pricing || US || 0% EXISTING CAP || BROAD || 7C || 20/01/25  Campaign Ad set,SHARE,"$1,587","66,656",2025-01-20,2025-04-06,76
21,CB_2025_Mar_FB_3914_DT-DP_V01_9x16_VID_EN_New_C-Trend_Sale_CTA-SPRNG_Angle-W-B-C_M-JOG_VL-30s_G-F_P-OG_S-NEW,CBV2 || AU || ðŸ’° Advantage+ || US || BROAD || 7C || Existing_customer_5% || 19/12/24 Ad set,VIDEO,"$1,583","79,377",2025-04-01,2025-04-06,5
22,CB_2023_Apr_FB_1989_RS_V08_9x16_VID_EN_Opti_C-Trend_CTA-SMR_Pain-W_M-MIX_VL-30s_TR-None_G-MF_P-None - Copy,CA || ASC+ || 0% EXISTING || 7DC || 18.03.2025,VIDEO,"$1,516","96,143",2025-03-18,2025-04-06,19
23,CB_2025_Mar_FB_3914_DT-DP_V01_9x16_VID_EN_New_C-Trend_Sale_CTA-SPRNG_Angle-W-B-C_M-JOG_VL-30s_G-F_P-OG_S-NEW,"3914 - #9 GF's POV, male confidence || Batch 1 || Enhancements: OFF || CBV1 || 7C || 24/03/25w13",VIDEO,"$1,410","63,673",2025-03-24,2025-04-06,13
24,CB_2024_Jan_FB_2764_RS_V04_9x16_VID_EN_Opti_C-SingleTesti_CTA-SALE_Pain-W_M-TRC_VL-45s_TR-None_G-F_P-OG_S-MOON_FB2263V04,EU (UK) || 2764 || Trinity Results Too Fast || 1C || 08/01/2025w02,VIDEO,"$1,348","37,604",2025-01-08,2025-04-06,88
25,CB_2024_Mar_FB_2883_DA_V08_9x16_VID_ES_Opti_C-SingleTesti_CTA-SALE_Pain-W-B_M-TRC_VL-45s_TR-None_G-F_P-OG_S-MOON_FB2764V04,LATAM ðŸ‡ªðŸ‡¸ || CBV2 || Advantage+ || 0% EXISTING CAP || BROAD || 7C || 22/03/25 Campaign Ad set,VIDEO,"$1,339","77,388",2025-03-22,2025-04-04,13
26,CB_2025_Feb_FB_3818_LZ-VU_V05_1x1_IMG_EN_Opti_C-Headline_Evergreen_CTA-NONE_Angle-Cort_M-NONE_VL-None_G-NONE_P-NONE_S-NONE_FB3251V01,ðŸŒ¶ï¸ || US || ASC+ || ->CC141 || VIDEO Only || US+CA || 0% EXISTING CAP || 7C || 07/08.24  Ad set,SHARE,"$1,302","56,356",2025-03-18,2025-04-06,19
27,CB_2025_Mar_FB_3890_DT_V04_1x1_IMG_EN_New_C-NONE_Evergreen_CTA-None_Angle-W_M-NONE_VL-None_G-NONE_P-OG_S-NONE,ðŸŒ¶ï¸ || US || ASC+ || ->CC141 || VIDEO Only || US+CA || 0% EXISTING CAP || 7C || 07/08.24  Ad set,SHARE,"$1,288","80,106",2025-03-31,2025-04-06,6
28,CB_2024_Sep_FB_3175_DA-KB_V04_1x1_IMG_EN_New_C-ADVRT_Evergreen_CTA-NONE_Angle-W_M-NONE_VL-None_G-NONE_P-CBV2_S-NONE_blog_colonbroomvsmammoth_cv_en,CBV2 || A/B test CTA button: Control || CBV2 vs Happy Mammoth || 7C || 26/03/25,SHARE,"$1,275","46,891",2025-03-26,2025-04-06,11
29,CB_2024_Sep_FB_3175_DA-KB_V04_1x1_IMG_EN_New_C-ADVRT_Evergreen_CTA-NONE_Angle-W_M-NONE_VL-None_G-NONE_P-CBV2_S-NONE_blog_colonbroomvsmammothhighprice3_cv_en,CBV2 || A/B test CTA button: Variaton || CBV2 vs Happy Mammoth || 7C || 26/03/25,SHARE,"$1,217","46,408",2025-03-26,2025-04-06,11
30,CB_2023_Jul_FB_2217_IB_V04_9x16_VID_EN_Opti_C-Pointing_CTA-SMR_Pain-W-B_M-TRC_VL-30s_TR-None_G-F_P-None_S-FRIGGA,ðŸŒ¶ï¸ || US || ASC+ || ->CC141 || VIDEO Only || US+CA || 0% EXISTING CAP || 7C || 07/08.24  Ad set,VIDEO,"$1,210","38,331",2024-08-07,2025-04-06,242
31,CB_2023_Dec_FB_2712_RS-DP_V02_1x1_VID_EN_Opti_C-WrittenTesti_CTA-SALE_Pain-W-B-C_M-NONE_VL-None_TR-None_G-NONE_P-V2_S-NONE_FB2227V08,CBV2 || AU || ðŸ’° Advantage+ || US || BROAD || 7C || Existing_customer_5% || 19/12/24 Ad set,SHARE,"$1,194","41,406",2024-12-19,2025-04-06,108
32,CB_2025_Mar_FB_3909_DT-DP_V03_9x16_VID_EN_New_C-Trend_Evergreen_CTA-SMRBOD_Angle-W-B-C_M-JANW_VL-30s_G-M_P-OG_S-NEW,3909 - Shirtless anxiety VID || Batch 1 || Enhancements: OFF || CBV1 || 7C || 24/03/25w13,VIDEO,"$1,181","71,498",2025-03-24,2025-04-06,13
33,CB_2023_Jul_FB_2217_IB_V04_9x16_VID_EN_Opti_C-Pointing_CTA-SMR_Pain-W-B_M-TRC_VL-30s_TR-None_G-F_P-None_S-FRIGGA,US || ASC+ || Website ONLY || A/B TEST || 7DC || Existing 0% || 24.03.2025  Ad set,VIDEO,"$1,129","36,741",2025-03-24,2025-04-03,10
34,CB_2023_May_FB_2263_MB_V04_9x16_VID_EN_New_C-Sale_CTA-SMR_Pain-W_M-JOG_VL-45s_TR-None_G-M-F_P-None_S-Moon,ðŸŒ¶ï¸ || US || ASC+ || ->CC141 || VIDEO Only || US+CA || 0% EXISTING CAP || 7C || 07/08.24  Ad set,VIDEO,"$1,105","35,681",2024-08-07,2025-04-06,242
35,CB_2025_Feb_FB_3827_LZ_V03_1x1_IMG_EN_Opti_C-Headline_Evergreen_CTA-SALE_Angle-W_M-NONE_VL-None_G-M_P-CBV2_S-NONE_FB3705V02,3827 - V2 img winner opti || Batch 2 || 7C || 18/02/2025w08,SHARE,"$1,084","44,824",2025-02-18,2025-04-06,47
36,CB_2024_Aug_FB_3097_VK-DP_V03_9x16_VID_EN_Opti_C-Benefits_CTA-SMR_Pain-W-B_M-MIX_VL-45s_TR-None_G-MF_P-OG_S-WHAT_FB2516V13,US || ASC+ || Website + Shop || 7DC || Existing 0% || 24.03.2025 Ad set,VIDEO,"$1,021","33,085",2025-03-24,2025-04-06,13
37,CB_2025_Mar_FB_3891_VK_V05_1x1_IMG_EN_New_C-BulletPoints_Evergreen_CTA-65_Angle-W-B-C_M-NONE_VL-None_G-M_P-OG_S-NONE,CA || ASC+ || 0% EXISTING || 7DC || 18.03.2025,SHARE,$978,"110,055",2025-03-18,2025-04-06,19
38,CB_2023_May_FB_2103_MB_V02_9x16_VID_EN_Opti_C-Sale_CTA-SMR_Pain-W_M-JOG_VL-30s_TR-None_G-M-F_P-None_S-What,US || Manual Bid || BFCM || COST CAP 71 || 1C || 15/11/24,VIDEO,$974,"32,206",2024-11-15,2025-04-06,142
39,CB_2025_Mar_FB_3913_CHUB-AS_V05_1x1_IMG_EN_New_C-NONE_CTA-NONE_Angle-W_M-NONE_VL-None_TR-None_G-NONE_P-NONE_S-NONE_blog_moobs_cv_en,CBV1 || LP:HI | blog_moobs_cv_en || Batch 2 || 30/03/25,SHARE,$974,"34,017",2025-03-30,2025-04-06,7
40,CB_2025_Mar_FB_3903_VK_V01_9x16_VID_EN_New_C-BulletPoints_Evergreen_CTA-65_Angle-W-B-C_M-MIX_VL-30s_G-MF_P-OG_S-NEW,CA || ASC+ || 0% EXISTING || 7DC || 18.03.2025,VIDEO,$963,"83,455",2025-03-30,2025-04-06,7
41,CB_2023_Jul_FB_2217_IB_V04_9x16_VID_EN_Opti_C-Pointing_CTA-SMR_Pain-W-B_M-TRC_VL-30s_TR-None_G-F_P-None_S-FRIGGA,CA || ASC+ || 0% EXISTING || 7DC || 18.03.2025,VIDEO,$951,"54,399",2025-03-18,2025-04-06,19
42,CB_2025_Jan_FB_3747_CHUB-AA_V03_9x16_IMG_EN_Opti_C-NONE_CTA-NONE_Angle-Sale_M-NONE_VL-None_TR-None_G-NONE_P-OG_S-NONE,3747 Clean Sale [HB winner ITR] CHUB || Enhancements: OFF || CBV1 || Batch Ä… || 1C || 02/02/25w06 || Kostas,SHARE,$947,"47,142",2025-02-02,2025-04-02,59
43,CB_2024_Jan_FB_2797_VK-RP-RS_V02_1x1_IMG_EN_Opti_C-ADVRT_CTA-NONE_Pain-W_M-NONE_VL-None_TR-None_G-NONE_P-V2_S-NONE,CBV2 || UK || Advantage+ || Advertorial |  || 0% EXISTING CAP || BROAD || 7C || ad set 18/03/25,SHARE,$941,"27,088",2025-03-18,2025-04-06,19
44,CB_2025_Mar_FB_3914_DT-DP_V01_9x16_VID_EN_New_C-Trend_Sale_CTA-SPRNG_Angle-W-B-C_M-JOG_VL-30s_G-F_P-OG_S-NEW,CBV2 || EU (UK) || ðŸ’° Advantage+ || US || BROAD || 7C || Existing_customer_5% || 15/12/24 Ad set,VIDEO,$889,"53,102",2025-04-01,2025-04-06,5
45,CB_2025_Mar_FB_3913_CHUB-AS_V12_1x1_IMG_EN_New_C-NONE_CTA-NONE_Angle-W_M-NONE_VL-None_TR-None_G-NONE_P-NONE_S-NONE_blog_moobs_cv_en,CBV1 || LP:HI | blog_moobs_cv_en || Batch 3 || 30/03/25,SHARE,$867,"26,411",2025-03-30,2025-04-06,7
46,CB_2025_Mar_FB_3910_LZ-DP_V01_1x1_IMG_EN_Opti_C-Headline_Evergreen_CTA-NONE_Angle-W_M-NONE_VL-None_G-NONE_P-TRIAL_S-NONE_FB3251V02.png,US || Free trial offer || Trial ads || Trial purchase || 7C || 19/03/25,SHARE,$863,"35,758",2025-03-19,2025-04-06,18
47,CB_2024_Jan_FB_2764_RS_V04_9x16_VID_EN_Opti_C-SingleTesti_CTA-SALE_Pain-W_M-TRC_VL-45s_TR-None_G-F_P-OG_S-MOON_FB2263V04_Page_Personal_Coach,CBV2 || AU || ðŸ’° Advantage+ || US || BROAD || 7C || Existing_customer_5% || 19/12/24 Ad set,VIDEO,$850,"18,223",2025-01-16,2025-04-06,80
48,CB_2024_Mar_FB_2883_DA_V01_1x1_IMG_ES_Opti_C-WrittenTesti_CTA-60_Pain-W-B-C_M-NONE_VL-None_TR-None_G-NONE_P-V2_S-NONE_FB2712V02,LATAM ðŸ‡ªðŸ‡¸ || CBV2 || Advantage+ || 0% EXISTING CAP || BROAD || 7C || 22/03/25 Campaign Ad set,SHARE,$834,"81,161",2025-03-22,2025-04-04,13
49,CB_2025_Mar_FB_3928_VK-DP_V05_1x1_VID_EN_Opti_C-BulletPoints_Evergreen_CTA-NONE_Angle-W-B-C_M-NONE_VL-None_G-M_P-OG_S-NONE_FB3891V05,CA || ASC+ || 0% EXISTING || 7DC || 18.03.2025,SHARE,$832,"86,079",2025-04-03,2025-04-04,1
50,CB_2025_Mar_FB_3914_DT-DP_V01_9x16_VID_EN_New_C-Trend_Sale_CTA-SPRNG_Angle-W-B-C_M-JOG_VL-30s_G-F_P-OG_S-NEW,US || ASC+ || Website + Shop || 7DC || Existing 0% || 24.03.2025 Ad set,VIDEO,$825,"34,884",2025-04-04,2025-04-06,2
51,CB_2023_Jul_FB_2284_DA_V05_9x16_VID_EN_Opti_C-Sale_CTA-SMR_Pain-W_M-JANW_VL-30s_TR-None_G-M_P-None_S-WHAT_FB2103V02,US || ASC+ || Website + Shop || 7DC || Existing 0% || 24.03.2025 Ad set,VIDEO,$802,"21,833",2025-03-24,2025-04-06,13
52,CB_2025_Mar_FB_3903_VK_V01_9x16_VID_EN_New_C-BulletPoints_Evergreen_CTA-65_Angle-W-B-C_M-MIX_VL-30s_G-MF_P-OG_S-NEW,3903 - #13 My husband hides his beer belly - VK  || Batch 1 || Enhancements: OFF || CBV1 || 7C || 24/03/25w13,VIDEO,$775,"38,202",2025-03-24,2025-04-06,13
53,CB_2025_Mar_FB_3891_VK_V05_1x1_IMG_EN_New_C-BulletPoints_Evergreen_CTA-65_Angle-W-B-C_M-NONE_VL-None_G-M_P-OG_S-NONE,US || ASC+ || Website ONLY || A/B TEST || 7DC || Existing 0% || 24.03.2025  Ad set,SHARE,$775,"46,010",2025-03-24,2025-04-03,10
54,CB_2025_Mar_FB_3907_CHUB-AA_V03__IMG_EN_Opti_C-Price_CTA-NONE_Angle-None_M-NONE_VL-None_TR-None_G-NONE_P-OG_S-NONE,3907 â€“ CHUB Clean Sale OPTI v2 || Enhancements: OFF || CBV1 || Batch 1 || 7C || 16/03/25w12,SHARE,$766,"26,910",2025-03-16,2025-04-06,21
55,CB_2025_Mar_FB_3950_SO_V16_4x5_IMG_EN_New_C-NONE_Evergreen_CTA-NONE_Angle-W-B-C_M-NONE_VL-None_G-NONE_P-OG_S-NONE,3950 - Image Gen by ChatGPT || Batch 4 || Enhancements: OFF || CBV1 || 7C || 30/03/25w14,SHARE,$760,"52,553",2025-03-30,2025-04-06,7
56,CB_2025_Mar_FB_3928_VK-DP_V05_1x1_VID_EN_Opti_C-BulletPoints_Evergreen_CTA-NONE_Angle-W-B-C_M-NONE_VL-None_G-M_P-OG_S-NONE_FB3891V05,3928 - opti 3891 kinda sorta opti with man boobs - DP-VK || Batch 1 || Enhancements: OFF || CBV1 || 7C || 24/03/25w13,SHARE,$735,"49,635",2025-03-24,2025-04-06,13
57,CB_2025_Jan_FB_3723_SO_V04_4x5_IMG_EN_New_C-NONE_Evergreen_CTA-SALE_Angle-W_M-NONE_VL-None_G-NONE_P-NONE_S-NONE,US || Kilo Product's leads LAL || 7C || 04/03/25,SHARE,$734,"41,031",2025-03-04,2025-04-06,33
58,CB_2024_Oct_FB_3214_DT-KB_V04_1x1_IMG_EN_New_C-ADVRT_Evergreen_CTA-NONE_Angle-W_M-NONE_VL-None_G-NONE_P-OG_S-NONE,CA || Advantage+ || Advertorial || 7C ||  BROAD || Existing_customer_0% || 20/03/25 Ad set,SHARE,$729,"55,938",2025-03-20,2025-04-06,17
59,CB_2025_Mar_FB_3890_DT_V04_1x1_IMG_EN_New_C-NONE_Evergreen_CTA-None_Angle-W_M-NONE_VL-None_G-NONE_P-OG_S-NONE,US || ASC+ || Website ONLY || A/B TEST || 7DC || Existing 0% || 24.03.2025  Ad set,SHARE,$727,"41,351",2025-03-24,2025-04-03,10
60,CB_2025_Mar_FB_3924_SO-DP_V03_1x1_IMG_EN_New_C-NONE_Evergreen_CTA-NONE_Angle-W-B-C_M-NONE_VL-None_G-NONE_P-OG_S-NONE,3924 - #17 man boobs/dad bod body text IMG || Batch 1 || Enhancements: OFF || CBV1 || 7C || 24/03/25w13,SHARE,$718,"32,641",2025-03-24,2025-04-06,13
61,CB_2024_Nov_FB_3264_LZ_V29_4x5_VID_EN_Opti_C-NegativeMark_Sale_CTA-BF_Angle-W-B_M-LRNS_VL-30s_G-M_P-OG_S-NONE,ðŸŒ¶ï¸ || US || ASC+ || ->CC141 || VIDEO Only || US+CA || 0% EXISTING CAP || 7C || 07/08.24  Ad set,VIDEO,$707,"26,727",2024-12-04,2025-04-06,123
62,CB_2025_Mar_FB_3922_SO-JT_V03_1x1_IMG_EN_New_C-NONE_Evergreen_CTA-NONE_Angle-W-B-C_M-NONE_VL-None_G-NONE_P-OG_S-NONE,3922 - CB V1 REDLINER || Batch 1 || Enhancements: OFF || CBV1 || 7C || 24/03/25w13,SHARE,$655,"24,856",2025-03-24,2025-04-05,12
63,CB_2025_Mar_FB_3950_SO_V11_4x5_IMG_EN_New_C-NONE_Evergreen_CTA-NONE_Angle-W-B-C_M-NONE_VL-None_G-NONE_P-OG_S-NONE,3950 - Image Gen by ChatGPT || Batch 3 || Enhancements: OFF || CBV1 || 7C || 30/03/25w14,SHARE,$649,"43,580",2025-03-30,2025-04-06,7
64,CB_2023_Jul_FB_2226_MB_V04_9x16_VID_EN_Opti_C-Testim_CTA-SMR_Pain-W_M-MIX_VL-30s_TR-None_G-F_P-None_S-Starry,CA || ASC+ || 0% EXISTING || 7DC || 18.03.2025,VIDEO,$614,"32,383",2025-03-18,2025-04-06,19
65,CB_2025_Mar_FB_3924_SO-DP_V06_1x1_IMG_EN_New_C-NONE_Evergreen_CTA-NONE_Angle-W-B-C_M-NONE_VL-None_G-NONE_P-OG_S-NONE,3924 - #17 man boobs/dad bod body text IMG || Batch 2 || Enhancements: OFF || CBV1 || 7C || 24/03/25w13,SHARE,$614,"41,892",2025-03-24,2025-04-05,12
66,CB_2025_Mar_FB_3939_DT_V07_4x5_IMG_EN_New_C-Advertorial_Sale_CTA-65_Angle-W-B-C_M-MIX_VL-None_G-M_P-OG_S-NONE,3939 - CB Advertorial ads New Ideas || Batch 2 || Enhancements: OFF || CBV1 || 7C || 30/03/25w14,SHARE,$614,"29,156",2025-03-30,2025-04-06,7
67,CB_2025_Jan_FB_3742_SO-DP-KB_V06_4x5_IMG_EN_Opti_C-NONE_Evergreen_CTA-SALE_Angle-W_M-NONE_VL-None_G-NONE_P-CBV2_S-NONE3665V01,CBV2 || US || Manual Bid: ROAS GOAL: 1.00 -> 1.1 || 7DC || 22/01/2025,SHARE,$606,"21,000",2025-02-11,2025-04-06,54
68,CB_2025_Mar_FB_3919_LZ_V01_1x1_IMG_EN_Opti_C-Headline_Evergreen_CTA-NONE_Angle-Horm_M-NONE_VL-30s_G-M_P-OG_S-NONE_FB3891V05,CA || ASC+ || 0% EXISTING || 7DC || 18.03.2025,SHARE,$599,"48,428",2025-03-27,2025-04-06,10
69,CB_2025_Mar_FB_3890_DT_V04_1x1_IMG_EN_New_C-NONE_Evergreen_CTA-None_Angle-W_M-NONE_VL-None_G-NONE_P-OG_S-NONE,US || ASC+ || Website + Shop || 7DC || Existing 0% || 24.03.2025 Ad set,SHARE,$581,"27,931",2025-03-24,2025-04-06,13
70,CB_2025_Jan_FB_3723_SO_V04_4x5_IMG_EN_New_C-NONE_Evergreen_CTA-SALE_Angle-W_M-NONE_VL-None_G-NONE_P-NONE_S-NONE,ðŸŒ¶ï¸ || US || ASC+ || ->CC141 || VIDEO Only || US+CA || 0% EXISTING CAP || 7C || 07/08.24  Ad set,SHARE,$566,"43,606",2025-02-12,2025-04-06,53
71,CB_2024_Feb_FB_2812_MB-RP_V07_9x16_VID_EN_Opti_C-Sale_CTA-C65_Pain-W_M-NONE_VL-30s_TR-None_G-MF_P-Plan_S-NEW_FB2601V04_1,US || Kilo Product's leads LAL || 7C || 04/03/25,VIDEO,$556,"17,603",2025-03-04,2025-04-06,33
72,CB_2025_Feb_FB_3817_SO_V01_4x5_IMG_EN_Opti_C-NONE_Evergreen_CTA-SALE_Angle-W_M-NONE_VL-None_G-NONE_P-NONE_S-NONE_FB3723V07,CBV2 || AU || ðŸ’° Advantage+ || US || BROAD || 7C || Existing_customer_5% || 19/12/24 Ad set,SHARE,$535,"27,914",2025-02-14,2025-04-06,51
73,CB_2024_Dec_FB_3601_VK-DP_V09_4x5_VID_EN_Opti_C-Dance_CTA-NY_Pain-W-B_M-JOG_VL-30s_TR-None_G-F_P-OG_S-WHAT_FB3045V01,CBV2 || AU || ðŸ’° Advantage+ || US || BROAD || 7C || Existing_customer_5% || 19/12/24 Ad set,SHARE,$533,"17,027",2025-01-03,2025-04-06,93
74,CB_2025_Mar_FB_3949_VK-DP_V01_9x16_VID_EN_New_C-NONE_Evergreen_CTA-NONE_Angle-W-B-C_M-TYL_VL-None_G-M_P-OG_S-NONE,"3949 - ""Never use your GF's supplements"" script for actor - VK || Batch 1 || Enhancements: OFF || CBV1 || 7C || 30/03/25w14",VIDEO,$517,"19,343",2025-03-30,2025-04-05,6
75,CB_2024_Apr_FB_2970_RS_V02_1x1_GIF_EN_Opti_C-WrittenTesti_CTA-CTA_Pain-W_M-NONE_VL-7s_TR-None_G-NONE_P-V2_S-NEW,CBV2 || US || Manual Bid: ROAS GOAL: 1.00 -> 1.1 || 7DC || 22/01/2025,VIDEO,$512,"16,731",2025-03-27,2025-04-06,10
76,CB_2025_Mar_FB_3944_LZ-VG_V02_4x5_IMG_EN_Opti_C-Testimonial_Evergreen_CTA-NONE_Angle-GH_M-NONE_VL-None_G-NONE_P-OG_S-NONE_FB3619V02,3944 - 3619 opti claims/testimonial || Batch 1 || Enhancements: OFF || CBV1 || 7C || 30/03/25w14,SHARE,$481,"16,059",2025-03-30,2025-04-06,7
77,CB_2025_Mar_FB_3943_LZ-DP_V03_4x5_IMG_EN_Opti_C-BeforeAfter_Sale_CTA-SALE_Angle-W_M-NONE_VL-NONE_G-M_P-OG_S-NONE_FB3812V03,3943 - man boobs price cta opti || Batch 1 || Enhancements: OFF || CBV1 || 7C || 30/03/25w14,SHARE,$468,"25,201",2025-03-30,2025-04-05,6
78,CB_2025_Mar_FB_3930_DT-KB_V13_1x1_IMG_EN_New_C-Advertorial_Sale_CTA-65_Angle-W-B-C_M-MIX_VL-None_G-M_P-OG_S-NONE,3930 - MD in Nutrition || Batch 4 || Enhancements: OFF || CBV2 || 7C || 30/03/25w14,SHARE,$468,"16,300",2025-03-30,2025-04-06,7
79,CB_2023_Jul_FB_2284_DA_V05_9x16_VID_EN_Opti_C-Sale_CTA-SMR_Pain-W_M-JANW_VL-30s_TR-None_G-M_P-None_S-WHAT_FB2103V02,CA || ASC+ || 0% EXISTING || 7DC || 18.03.2025,VIDEO,$468,"27,793",2025-03-18,2025-04-06,19
80,CB_2025_Feb_FB_3863_DT-DP_V03_9x16_VID_EN_New_C-Trend_Sale_CTA-70_Angle-W_M-POW_VL-30s_G-M_P-OG_S-NEW,ðŸŒ¶ï¸ || US || ASC+ || ->CC141 || VIDEO Only || US+CA || 0% EXISTING CAP || 7C || 07/08.24  Ad set,VIDEO,$468,"20,946",2025-03-10,2025-04-06,27
81,CB_2024_Aug_FB_3097_VK-DP_V03_9x16_VID_EN_Opti_C-Benefits_CTA-SMR_Pain-W-B_M-MIX_VL-45s_TR-None_G-MF_P-OG_S-WHAT_FB2516V13,US || Kilo Product's leads LAL || 7C || 04/03/25,VIDEO,$467,"14,956",2025-03-04,2025-04-06,33
82,CB_2024_Apr_FB_2970_RS_V02_1x1_GIF_EN_Opti_C-WrittenTesti_CTA-CTA_Pain-W_M-NONE_VL-7s_TR-None_G-NONE_P-V2_S-NEW,CBV2 || AU || ðŸ’° Advantage+ || US || BROAD || 7C || Existing_customer_5% || 19/12/24 Ad set,VIDEO,$462,"13,806",2025-04-02,2025-04-06,4
83,CB_2025_Mar_FB_3884_SO_V12_9x16_IMG_EN_New_C-NONE_Evergreen_CTA-NONE_Angle-W-B-C_M-Nate_VL-15s_G-MF_P-OG_S-NEW,3884_SO || Batch 1 || 7C || 18/03/2025w12,VIDEO,$460,"18,563",2025-03-20,2025-04-02,13
84,CB_2025_Mar_FB_3927_DT_V01_1x1_IMG_EN_New_C-NONE_Evergreen_CTA-None_Angle-W_M-NONE_VL-None_G-NONE_P-OG_S-NONE_FB3890V03,3927 - Opti 3890 || Batch 1 || Enhancements: OFF || CBV1 || 7C || 24/03/25w13,SHARE,$452,"23,540",2025-03-24,2025-04-03,10
85,CB_2025_Mar_FB_3955_SO_V15_4x5_IMG_EN_New_C-NONE_Evergreen_CTA-NONE_Angle-W-B-C_M-NONE_VL-None_G-NONE_P-OG_S-NONE,3955 - THE GHIBLI-VERSE Trend || Batch 5 || Enhancements: OFF || CBV1 || 7C || 01/04/25w14,SHARE,$447,"35,442",2025-04-01,2025-04-06,5
86,CB_2025_Mar_FB_3904_DT_V01_9x16_VID_EN_New_C-Trend_Evergreen_CTA-NONE_Angle-W_M-MIX_VL-30s_G-MF_P-OG_S-New,ðŸŒ¶ï¸ || US || ASC+ || ->CC141 || VIDEO Only || US+CA || 0% EXISTING CAP || 7C || 07/08.24  Ad set,VIDEO,$445,"21,072",2025-03-28,2025-04-06,9
87,CB_2023_Jul_FB_2284_DA_V05_9x16_VID_EN_Opti_C-Sale_CTA-SMR_Pain-W_M-JANW_VL-30s_TR-None_G-M_P-None_S-WHAT_FB2103V02,ðŸŒ¶ï¸ || US || ASC+ || ->CC141 || VIDEO Only || US+CA || 0% EXISTING CAP || 7C || 07/08.24  Ad set,VIDEO,$444,"15,336",2024-08-07,2025-04-06,242
88,CB_2023_May_FB_2263_MB_V04_9x16_VID_EN_New_C-Sale_CTA-SMR_Pain-W_M-JOG_VL-45s_TR-None_G-M-F_P-None_S-Moon,CBV2 || AU || ðŸ’° Advantage+ || US || BROAD || 7C || Existing_customer_5% || 19/12/24 Ad set,VIDEO,$443,"13,129",2024-12-19,2025-04-06,108
89,CB_2024_Mar_FB_2883_DA_V03_9x16_VID_ES_Opti_C-Sale_CTA-60_Pain-W-B_M-JOG_VL-30s_TR-None_G-F_P-V2_S-WHAT_FB2429V03,LATAM ðŸ‡ªðŸ‡¸ || CBV2 || Advantage+ || 0% EXISTING CAP || BROAD || 7C || 22/03/25 Campaign Ad set,VIDEO,$440,"42,252",2025-03-22,2025-04-04,13
90,CB_2025_Mar_FB_3940_DT-DP_V05_9x16_VID_EN_New_C-Trend_Sale_CTA-65_Angle-W-B-C_M-_VL-None_G-M_P-OG_S-New,3940 - #4 Never use your GF's supplements || Batch 2 || Enhancements: OFF || CBV1 || 7C || 30/03/25w14,VIDEO,$440,"19,786",2025-03-30,2025-04-03,4
91,CB_2023_Jul_FB_2284_DA_V05_9x16_VID_EN_Opti_C-Sale_CTA-SMR_Pain-W_M-JANW_VL-30s_TR-None_G-M_P-None_S-WHAT_FB2103V02,US || ASC+ || Website ONLY || A/B TEST || 7DC || Existing 0% || 24.03.2025  Ad set,VIDEO,$439,"14,126",2025-03-24,2025-04-03,10
92,CB_2025_Mar_FB_3945_VK-VG_V02_4x5_VID_EN_New_C-NONE_Evergreen_CTA-NONE_Angle-W-B-C_M-NONE_VL-None_G-M_P-OG_S-NONE,3945 - BEFORE AND AFTER / SOCIAL -VK || Batch 1 || Enhancements: OFF || CBV1 || 7C || 30/03/25w14,SHARE,$434,"21,124",2025-03-30,2025-04-03,4
93,CB_2024_Sep_FB_3175_DA-KB_V01_1x1_IMG_EN_New_C-ADVRT_Evergreen_CTA-NONE_Angle-W_M-NONE_VL-None_G-NONE_P-CBV2_S-NONE_blog_colonbroomvsmammoth_cv_en,CBV2 || Advantage+ || Advertorial || Higher pricing || US || 0% EXISTING CAP || BROAD || 7C || 20/01/25  Campaign Ad set,SHARE,$433,"16,474",2025-01-20,2025-04-06,76
94,CB_2024_Feb_FB_2808_VK-DP_V09_9x16_VID_EN_Opti_C-Sale_CTA-CTA_Pain-W_M-JOG_VL-45s_TR-None_G-F_P-None_S-Moon_FB2263V04,Relaunch || high potential ads ||  || Batch 1 || Enhancements: OFF || CBV1 || 7C || 25/03/25w13,VIDEO,$427,"15,384",2025-03-25,2025-04-03,9
95,CB_2025_Mar_FB_3940_DT-DP_V01_9x16_VID_EN_New_C-Trend_Evergreen_CTA-None_Angle-W-B-C_M-_VL-None_G-M_P-OG_S-NONE,3940 - #4 Never use your GF's supplements || Batch 1 || Enhancements: OFF || CBV1 || 7C || 30/03/25w14,VIDEO,$423,"20,161",2025-03-30,2025-04-03,4
96,CB_2025_Mar_FB_3946_LZ-VG_V03_4x5_IMG_EN_New_C-BeforeAfter_Evergreen_CTA-SALE_Angle-W-B_M-NONE_VL-None_G-M_P-OG_S-NONE,3946 - man boobs before after LZ+VG || Batch 1 || Enhancements: OFF || CBV1 || 7C || 30/03/25w14,SHARE,$417,"18,011",2025-03-30,2025-04-03,4
97,CB_2024_Mar_FB_2883_DA_V06_9x16_VID_ES_Opti_C-Pointing_CTA-CTA_Pain-W-B_M-TRC_VL-30s_TR-None_G-F_P-OG_S-FRIGGA_FB2217V04.mp4,LATAM ðŸ‡ªðŸ‡¸ || CBV2 || Advantage+ || 0% EXISTING CAP || BROAD || 7C || 22/03/25 Campaign Ad set,VIDEO,$411,"21,170",2025-03-22,2025-04-04,13
98,CB_2025_Mar_FB_3955_SO-KB_V12_4x5_IMG_EN_New_C-NONE_Evergreen_CTA-NONE_Angle-W-B-C_M-NONE_VL-None_G-NONE_P-OG_S-NONE,3955 - THE GHIBLI-VERSE Trend || Batch 4 || Enhancements: OFF || CBV1 || 7C || 02/04/25w14,SHARE,$408,"19,817",2025-04-02,2025-04-06,4
99,CB_2025_Mar_FB_3947_LZ-VG_V02_4x5_IMG_EN_New_C-StickyNotes_Evergreen_CTA-SALE_Angle-Horm_M-NONE_VL-None_G-M_P-OG_S-NONE,3947 - low t post it notes || Batch 1 || Enhancements: OFF || CBV1 || 7C || 30/03/25w14,SHARE,$398,"23,655",2025-03-30,2025-04-03,4
100,CB_2023_Dec_FB_2712_RS-DP_V02_1x1_VID_EN_Opti_C-WrittenTesti_CTA-SALE_Pain-W-B-C_M-NONE_VL-None_TR-None_G-NONE_P-V2_S-NONE_FB2227V08,CBV2 || EU (UK) || ðŸ’° Advantage+ || US || BROAD || 7C || Existing_customer_5% || 15/12/24 Ad set,SHARE,$390,"11,243",2024-12-15,2025-04-06,112
101,CB_2025_Mar_FB_3890_DT_V02_1x1_IMG_EN_New_C-NONE_Evergreen_CTA-None_Angle-W_M-NONE_VL-None_G-NONE_P-OG_S-NONE,ðŸŒ¶ï¸ || US || ASC+ || ->CC141 || VIDEO Only || US+CA || 0% EXISTING CAP || 7C || 07/08.24  Ad set,SHARE,$389,"20,405",2025-03-15,2025-04-06,22
102,CB_2025_Feb_FB_3883_LZ-RP_V05_9x16_VID_EN_Opti_C-BulletPoints_Evergreen_CTA-SALE_Angle-W_M-JANW_VL-30s_G-M_P-OG_S-WHAT_FB2284V05.mp4,US || Quiz: React || 7C || 04/04/25,VIDEO,$387,"16,833",2025-04-04,2025-04-06,2
103,CB_2025_Mar_FB_3950_SO_V18_4x5_IMG_EN_New_C-NONE_Evergreen_CTA-NONE_Angle-W-B-C_M-NONE_VL-None_G-NONE_P-OG_S-NONE,3950 - Image Gen by ChatGPT || Batch 5 || Enhancements: OFF || CBV1 || 7C || 30/03/25w14,SHARE,$385,"23,891",2025-03-30,2025-04-03,4
104,CB_2025_Mar_FB_3950_SO_V23_4x5_IMG_EN_New_C-NONE_Evergreen_CTA-NONE_Angle-W-B-C_M-NONE_VL-None_G-NONE_P-OG_S-NONE,3950 - Image Gen by ChatGPT || Batch 7 || Enhancements: OFF || CBV1 || 7C || 30/03/25w14,SHARE,$383,"24,691",2025-03-30,2025-04-03,4
105,CB_2025_Mar_FB_3950_SO_V03_4x5_IMG_EN_New_C-NONE_Evergreen_CTA-NONE_Angle-W-B-C_M-NONE_VL-None_G-NONE_P-OG_S-NONE,3950 - Image Gen by ChatGPT || Batch 1 || Enhancements: OFF || CBV1 || 7C || 30/03/25w14,SHARE,$379,"16,250",2025-03-30,2025-04-03,4
106,CB_2024_Sep_FB_3175_DA-KB_V03_1x1_IMG_EN_New_C-ADVRT_Evergreen_CTA-NONE_Angle-W_M-NONE_VL-None_G-NONE_P-CBV2_S-NONE_blog_colonbroomvsmammoth_cv_en,CBV2 || Advantage+ || Advertorial || Higher pricing || US || 0% EXISTING CAP || BROAD || 7C || 20/01/25  Campaign Ad set,SHARE,$378,"17,246",2025-01-20,2025-04-06,76
107,CB_2025_Mar_FB_3891_VK_V05_1x1_IMG_EN_New_C-BulletPoints_Evergreen_CTA-65_Angle-W-B-C_M-NONE_VL-None_G-M_P-OG_S-NONE,US || ASC+ || Website + Shop || 7DC || Existing 0% || 24.03.2025 Ad set,SHARE,$376,"30,330",2025-03-24,2025-04-03,10
108,CB_2025_Feb_FB_3883_LZ-RP_V05_9x16_VID_EN_Opti_C-BulletPoints_Evergreen_CTA-SALE_Angle-W_M-JANW_VL-30s_G-M_P-OG_S-WHAT_FB2284V05.mp4,US || Quiz: Shopify || 7C || 04/04/25,VIDEO,$374,"16,764",2025-04-04,2025-04-06,2
109,CB_2024_Jan_FB_2783_VK-RP_V02_1x1_IMG_EN_Opti_C-ADVRT_CTA-NONE_Pain-W_M-NONE_VL-None_TR-None_G-NONE_P-V2_S-NONE,CBV2 || UK || Advantage+ || Advertorial |  || 0% EXISTING CAP || BROAD || 7C || ad set 18/03/25,SHARE,$352,"15,999",2025-03-18,2025-04-06,19
110,CB_2025_Mar_FB_3950_SO_V05_4x5_IMG_EN_New_C-NONE_Evergreen_CTA-NONE_Angle-W-B-C_M-NONE_VL-None_G-NONE_P-OG_S-NONE,3950 - Image Gen by ChatGPT || Batch 2 || Enhancements: OFF || CBV1 || 7C || 30/03/25w14,SHARE,$347,"21,559",2025-03-30,2025-04-03,4
111,CB_2025_Mar_FB_3931_VK-DP_V02_9x16_VID_EN_Opti_C-NONE_Evergreen_CTA-NONE_Angle-W_M-NONE_VL-30s_G-M_P-OG_S-WOOD_FB3860V03,3942 - 3860 V03 opti - DP - VK || Batch 1 || Enhancements: OFF || CBV1 || 7C || 30/03/25w14,VIDEO,$347,"21,274",2025-03-30,2025-04-03,4
112,CB_2025_Mar_FB_3955_SO_V02_4x5_IMG_EN_New_C-NONE_Evergreen_CTA-NONE_Angle-W-B-C_M-NONE_VL-None_G-NONE_P-OG_S-NONE,3955 - THE GHIBLI-VERSE Trend || Batch 1 || Enhancements: OFF || CBV1 || 7C || 01/04/25w14,SHARE,$339,"19,123",2025-04-01,2025-04-05,4
113,CB_2024_Jan_FB_2797_VK-RP-RS_V02_1x1_IMG_EN_Opti_C-ADVRT_CTA-NONE_Pain-W_M-NONE_VL-None_TR-None_G-NONE_P-V2_S-NONE,CBV2 || TOP EU || Advantage+ || Advertorial |  || 0% EXISTING CAP || BROAD || 7C || 21/03/25 Ad set,SHARE,$338,"11,985",2025-03-21,2025-04-06,16
114,CB_2025_Mar_FB_3913_CHUB-AS_V10_1x1_IMG_EN_New_C-NONE_CTA-NONE_Angle-W_M-NONE_VL-None_TR-None_G-NONE_P-NONE_S-NONE_blog_moobs_cv_en,CBV1 || LP:HI | blog_moobs_cv_en || Batch 3 || 30/03/25,SHARE,$327,"13,879",2025-03-30,2025-04-06,7
115,CB_2023_Jul_FB_2226_MB_V04_9x16_VID_EN_Opti_C-Testim_CTA-SMR_Pain-W_M-MIX_VL-30s_TR-None_G-F_P-None_S-Starry,ðŸŒ¶ï¸ || US || ASC+ || ->CC141 || VIDEO Only || US+CA || 0% EXISTING CAP || 7C || 07/08.24  Ad set,VIDEO,$317,"9,248",2024-10-28,2025-04-06,160
116,CB_2023_May_FB_2263_MB_V04_9x16_VID_EN_New_C-Sale_CTA-SMR_Pain-W_M-JOG_VL-45s_TR-None_G-M-F_P-None_S-Moon,CA || ASC+ || 0% EXISTING || 7DC || 18.03.2025,VIDEO,$317,"15,983",2025-03-18,2025-04-06,19
117,CB_2025_Feb_FB_3863_DT-DP_V02_9x16_VID_EN_New_C-Trend_Sale_CTA-70_Angle-W_M-POW_VL-30s_G-M_P-OG_S-NEW.mp4,3863 - Aaron man boobs vid || Enhancements: OFF || CBV1 || Batch 1 || 7C || 26/02/25w09 || Valentinas,VIDEO,$313,"17,237",2025-02-26,2025-04-02,35
118,CB_2024_Apr_FB_2970_RS_V02_1x1_GIF_EN_Opti_C-WrittenTesti_CTA-CTA_Pain-W_M-NONE_VL-7s_TR-None_G-NONE_P-V2_S-NEW,2970 - XL TO M || Batch 1 || Enhancements: OFF || CBV2 || 7C || 25/03/25w13,VIDEO,$313,"7,077",2025-03-24,2025-04-02,9
119,CB_2024_Apr_FB_2943_DT_V02_9x16_VID_EN_Opti_C-Sale_CTA-CTA_Pain-W_M-MIX_VL-45s_TR-None_G-MF_P-V2_S-WHAT_FB_2429V03,2943 - Opti PPC 2429 || Batch 1 || Enhancements: OFF || CBV2 || 7C || 25/03/25w13,VIDEO,$313,"13,043",2025-03-24,2025-04-02,9
120,CB_2025_Mar_FB_3931_VK-DP_V01_9x16_VID_EN_Opti_C-NONE_Evergreen_CTA-NONE_Angle-W_M-NONE_VL-30s_G-M_P-OG_S-WOOD_FB3860V03,3942 - 3860 V03 opti - DP - VK || Batch 1 || Enhancements: OFF || CBV1 || 7C || 30/03/25w14,VIDEO,$312,"12,502",2025-03-30,2025-04-06,7
121,CB_2024_Mar_FB_2883_DA_V02_1x1_IMG_ES_Opti_C-WrittenTesti_CTA-60_Pain-W-B-C_M-NONE_VL-None_TR-None_G-NONE_P-V2_S-NONE_FB2762V05,LATAM ðŸ‡ªðŸ‡¸ || CBV2 || Advantage+ || 0% EXISTING CAP || BROAD || 7C || 22/03/25 Campaign Ad set,SHARE,$305,"21,208",2025-03-22,2025-04-04,13
122,CB_2025_Mar_FB_3904_DT_V01_9x16_VID_EN_New_C-Trend_Evergreen_CTA-NONE_Angle-W_M-MIX_VL-30s_G-MF_P-OG_S-New,3904 - Notion / I thought my man was cheating on me || Enhancements: OFF || CBV1 || Batch 1 || 7C || 16/03/25w12,VIDEO,$300,"12,823",2025-03-14,2025-04-02,19
123,CB_2023_Dec_FB_2696_RS_V03_9x16_VID_EN_Opti_C-Sale_CTA-NY65_Pain-W-B_M-JANW_VL-30s_TR-None_G-M_P-OG_S-WHAT_FB2284V05,CBV2 || AU || ðŸ’° Advantage+ || US || BROAD || 7C || Existing_customer_5% || 19/12/24 Ad set,VIDEO,$296,"10,043",2025-01-13,2025-04-06,83
124,CB_2024_Apr_FB_2961_DA-DP_V01_9x16_VID_EN_Opti_C-Trend_CTA-SMR_Pain-W_M-SMT_VL-15s_TR-BadReviews_G-F_P-V2_S-NEW_FB2917V06,2961 - 2917 opti || Batch 1 || Enhancements: OFF || CBV2 || 7C || 25/03/25w13,VIDEO,$293,"16,470",2025-03-25,2025-04-02,8
125,CB_2025_Mar_FB_3919_LZ_V01_1x1_IMG_EN_Opti_C-Headline_Evergreen_CTA-NONE_Angle-Horm_M-NONE_VL-30s_G-M_P-OG_S-NONE_FB3891V05,3919 - cb Spartan || Batch 1 || Enhancements: OFF || CBV1 || 7C || 24/03/25w13,SHARE,$276,"12,410",2025-03-24,2025-04-02,9
126,CB_2025_Mar_FB_3910_LZ-DP_V03_9x16_VID_EN_Opti_C-BulletPoints_Evergreen_CTA-NONE_Angle-W_M-MAN_VL-15s_G-M_P-TRIAL_S-WHAT_FB3097V03.mp4,US || Free trial offer || Trial ads || Trial purchase || 7C || 19/03/25,VIDEO,$269,"8,412",2025-03-19,2025-04-06,18
127,CB_2025_Mar_FB_3920_VK_V12_1x1_VID_EN_Opti_C-BulletPoints_Evergreen_CTA-NONE_Angle-W-B-C_M-NONE_VL-None_G-M_P-OG_S-NONE_FB3891V05,3920 - 3891 OPTI - VK || Batch 3 || Enhancements: OFF || CBV1 || 7C || 24/03/25w13,SHARE,$268,"13,543",2025-03-24,2025-04-02,9
128,CB_2025_Mar_FB_3913_CHUB-AS_V01_1x1_IMG_EN_New_C-NONE_CTA-NONE_Angle-W_M-NONE_VL-None_TR-None_G-NONE_P-NONE_S-NONE_blog_moobs_cv_en,CBV1 || LP:HI | blog_moobs_cv_en || Batch 1 || 30/03/25,SHARE,$266,"11,304",2025-03-30,2025-04-06,7
129,CB_2025_Jan_FB_3923_VK-KB_V13_1x1_VID_EN_Opti_C-BulletPoints_Evergreen_CTA-65_Angle-W-B-C_M-NONE_VL-None_G-F_P-OG_S-NEW_FB3779V04,3923 - OPTI 3779 - VK || Batch 1 || Enhancements: OFF || CBV1 || 7C || 24/03/25w13,SHARE,$266,"7,587",2025-03-24,2025-04-02,9
130,CB_2024_Nov_FB_3305_SO-DP_V02_4x5_VID_EN_Opti_C-Sale_CTA-BF_Pain-W_M-Chris_VL-30s_TR-None_G-MF_P-Plan_S-NEW_FB2601V07,CBV2 || AU || ðŸ’° Advantage+ || US || BROAD || 7C || Existing_customer_5% || 19/12/24 Ad set,VIDEO,$264,"8,286",2024-12-19,2025-04-06,108
131,CB_2025_Mar_FB_3941_LZ-DT_V02_9x16_VID_EN_New_C-Testimonial_Evergreen_CTA-SALE_Angle-GH_M-SMT_VL-30s_G-F_P-OG_S-NEW,3941 - health wellbeing new vid || Batch 1 || Enhancements: OFF || CBV1 || 7C || 30/03/25w14,VIDEO,$264,"11,831",2025-03-30,2025-04-03,4
132,CB_2025_Mar_FB_3890_DT_V04_1x1_IMG_EN_New_C-NONE_Evergreen_CTA-None_Angle-W_M-NONE_VL-None_G-NONE_P-OG_S-NONE,3890 - Your Peak Performance in 6 weeks || Enhancements: OFF || CBV1 || Batch 1 || 7C || 10/03/25w11,SHARE,$258,"12,584",2025-03-12,2025-03-31,19
133,CB_2024_Jan_FB_2783_VK-RP_V02_1x1_IMG_EN_Opti_C-ADVRT_CTA-NONE_Pain-W_M-NONE_VL-None_TR-None_G-NONE_P-V2_S-NONE,CBV2 || AU || Advantage+ || Advertorial |  || 0% EXISTING CAP || BROAD || 7C || ad set 18/03/25,SHARE,$244,"13,794",2025-03-20,2025-04-06,17
134,CB_2024_Aug_FB_3097_VK-DP_V03_9x16_VID_EN_Opti_C-Benefits_CTA-SMR_Pain-W-B_M-MIX_VL-45s_TR-None_G-MF_P-OG_S-WHAT_FB2516V13,ðŸŒ¶ï¸ || US || ASC+ || ->CC141 || VIDEO Only || US+CA || 0% EXISTING CAP || 7C || 07/08.24  Ad set,VIDEO,$241,"10,881",2025-03-28,2025-04-06,9
135,CB_2025_Mar_FB_3955_SO_V11_4x5_IMG_EN_New_C-NONE_Evergreen_CTA-NONE_Angle-W-B-C_M-NONE_VL-None_G-NONE_P-OG_S-NONE,3955 - THE GHIBLI-VERSE Trend || Batch 3 || Enhancements: OFF || CBV1 || 7C || 01/04/25w14,SHARE,$239,"13,235",2025-04-01,2025-04-04,3
136,CB_2025_Mar_FB_3930_DT-KB_V04_1x1_IMG_EN_New_C-Advertorial_Sale_CTA-65_Angle-W-B-C_M-MIX_VL-None_G-M_P-OG_S-NONE,3930 - MD in Nutrition || Batch 1 || Enhancements: OFF || CBV2 || 7C || 30/03/25w14,SHARE,$239,"13,092",2025-03-30,2025-04-03,4
137,CB_2025_Mar_FB_3950_SO_V21_4x5_IMG_EN_New_C-NONE_Evergreen_CTA-NONE_Angle-W-B-C_M-NONE_VL-None_G-NONE_P-OG_S-NONE,3950 - Image Gen by ChatGPT || Batch 6 || Enhancements: OFF || CBV1 || 7C || 30/03/25w14,SHARE,$216,"12,721",2025-03-30,2025-04-02,3
138,CB_2025_Jan_FB_3723_SO_V04_4x5_IMG_EN_New_C-NONE_Evergreen_CTA-SALE_Angle-W_M-NONE_VL-None_G-NONE_P-NONE_S-NONE,CA || ASC+ || 0% EXISTING || 7DC || 18.03.2025,SHARE,$208,"21,682",2025-03-18,2025-04-06,19
139,CB_2025_Mar_FB_3913_CHUB-AS_V07_1x1_IMG_EN_New_C-NONE_CTA-NONE_Angle-W_M-NONE_VL-None_TR-None_G-NONE_P-NONE_S-NONE_blog_moobs_cv_en,CBV1 || LP:HI | blog_moobs_cv_en || Batch 2 || 30/03/25,SHARE,$202,"6,834",2025-03-30,2025-04-06,7
140,CB_2024_Feb_FB_2834_DA_V02_4x5_IMG_EN_Opti_C-SingleTesti_CTA-NONE_Pain-W_M-NONE_VL-None_TR-None_G-NONE_P-V2_S-NONE_FB2759V04,CBV2 || AU || ðŸ’° Advantage+ || US || BROAD || 7C || Existing_customer_5% || 19/12/24 Ad set,SHARE,$201,"7,176",2024-12-19,2025-04-06,108
141,CB_2025_Mar_FB_3955_SO_V08_4x5_IMG_EN_New_C-NONE_Evergreen_CTA-NONE_Angle-W-B-C_M-NONE_VL-None_G-NONE_P-OG_S-NONE,3955 - THE GHIBLI-VERSE Trend || Batch 2 || Enhancements: OFF || CBV1 || 7C || 02/04/25w14,SHARE,$198,"10,245",2025-04-02,2025-04-06,4
142,CB_2025_Mar_FB_3955_SO_V10_4x5_IMG_EN_New_C-NONE_Evergreen_CTA-NONE_Angle-W-B-C_M-NONE_VL-None_G-NONE_P-OG_S-NONE,3955 - THE GHIBLI-VERSE Trend || Batch 3 || Enhancements: OFF || CBV1 || 7C || 01/04/25w14,SHARE,$195,"11,830",2025-04-01,2025-04-05,4
143,CB_2025_Mar_FB_3913_CHUB-AS_V02_1x1_IMG_EN_New_C-NONE_CTA-NONE_Angle-W_M-NONE_VL-None_TR-None_G-NONE_P-NONE_S-NONE_blog_moobs_cv_en,CBV1 || LP:HI | blog_moobs_cv_en || Batch 1 || 30/03/25,SHARE,$195,"9,355",2025-03-30,2025-04-06,7
144,CB_2025_Mar_FB_3949_VK-DP_V04_9x16_VID_EN_New_C-NONE_Evergreen_CTA-NONE_Angle-W-B-C_M-TYL_VL-None_G-M_P-OG_S-NEW,"3949 - ""Never use your GF's supplements"" script for actor - VK || Batch 2 || Enhancements: OFF || CBV1 || 7C || 30/03/25w14",VIDEO,$192,"5,576",2025-03-30,2025-04-02,3
145,CB_2025_Mar_FB_3930_DT-KB_V08_1x1_IMG_EN_New_C-Advertorial_Sale_CTA-65_Angle-W-B-C_M-MIX_VL-None_G-M_P-OG_S-NONE,3930 - MD in Nutrition || Batch 2 || Enhancements: OFF || CBV2 || 7C || 30/03/25w14,SHARE,$191,"8,305",2025-03-30,2025-04-02,3
146,CB_2025_Mar_FB_3910_LZ-DP_V04_9x16_VID_EN_Opti_C-Testimonial_Evergreen_CTA-NONE_Angle-W_M-TRC_VL-15s_G-F_P-TRIAL_S-FRIGGA_FB2217V04.mp4,US || Free trial offer || Trial ads || ATC || 7C || 16/03/25,VIDEO,$190,"8,586",2025-03-16,2025-04-01,16
147,CB_2025_Jan_FB_3723_SO_V07_4x5_IMG_EN_New_C-NONE_Evergreen_CTA-SALE_Angle-W_M-NONE_VL-None_G-NONE_P-NONE_S-NONE,CBV2 || US || Manual Bid: ROAS GOAL: 1.00 -> 1.1 || 7DC || 22/01/2025,SHARE,$190,"7,237",2025-02-11,2025-04-06,54
148,CB_2025_Mar_FB_3930_DT-KB_V14_1x1_IMG_EN_New_C-Advertorial_Sale_CTA-65_Angle-W-B-C_M-MIX_VL-None_G-M_P-OG_S-NONE,3930 - MD in Nutrition || Batch 4 || Enhancements: OFF || CBV2 || 7C || 30/03/25w14,SHARE,$189,"5,423",2025-03-30,2025-04-06,7
149,CB_2025_Mar_FB_3943_LZ-DP_V02_4x5_IMG_EN_Opti_C-BeforeAfter_Sale_CTA-SALE_Angle-W_M-NONE_VL-NONE_G-M_P-OG_S-NONE_FB3890V04,3943 - man boobs price cta opti || Batch 1 || Enhancements: OFF || CBV1 || 7C || 30/03/25w14,SHARE,$188,"9,407",2025-03-30,2025-04-05,6
150,CB_2025_Feb_FB_3860_LZ-DP_V03_9x16_VID_EN_Opti_C-Testimonial_Evergreen_CTA-SALE_Angle-W_M-MOOD_VL-20s_G-M_P-OG_S-WOOD_FB21176V11_1,CBV2 || AU || ðŸ’° Advantage+ || US || BROAD || 7C || Existing_customer_5% || 19/12/24 Ad set,VIDEO,$187,"7,913",2025-03-21,2025-04-06,16
151,CB_2023_Oct_FB_2516_VK_V13_9x16_VID_EN_Opti_C-Benefits_CTA-AUTUM_Pain-W-B_M-PASQ_VL-30s_TR-None_G-M_P-Plan_S-WHAT,ðŸŒ¶ï¸ || US || ASC+ || ->CC141 || VIDEO Only || US+CA || 0% EXISTING CAP || 7C || 07/08.24  Ad set,VIDEO,$186,"5,571",2024-12-19,2025-04-06,108
152,CB_2023_Jul_FB_2217_IB_V04_9x16_VID_EN_Opti_C-Pointing_CTA-SMR_Pain-W-B_M-TRC_VL-30s_TR-None_G-F_P-None_S-FRIGGA,US || Manual Bid || BFCM || COST CAP 71 || 1C || 15/11/24,VIDEO,$183,"6,421",2024-11-15,2025-04-06,142
153,CB_2024_Aug_FB_3097_VK-DP_V03_9x16_VID_EN_Opti_C-Benefits_CTA-SMR_Pain-W-B_M-MIX_VL-45s_TR-None_G-MF_P-OG_S-WHAT_FB2516V13,US || ASC+ || Website ONLY || A/B TEST || 7DC || Existing 0% || 24.03.2025  Ad set,VIDEO,$177,"7,282",2025-03-24,2025-04-03,10
154,CB_2024_Feb_FB_2834_DA_V04_4x5_IMG_EN_Opti_C-SingleTesti_CTA-NONE_Pain-W_M-NONE_VL-None_TR-None_G-NONE_P-V2_S-NONE_FB2759V04,CBV2 || AU || ðŸ’° Advantage+ || US || BROAD || 7C || Existing_customer_5% || 19/12/24 Ad set,SHARE,$177,"7,180",2024-12-19,2025-04-06,108
155,CB_2025_Mar_FB_3944_LZ-VG_V01_4x5_IMG_EN_Opti_C-Educational_Evergreen_CTA-NONE_Angle-GH_M-NONE_VL-None_G-NONE_P-OG_S-NONE_FB3619V02,3944 - 3619 opti claims/testimonial || Batch 1 || Enhancements: OFF || CBV1 || 7C || 30/03/25w14,SHARE,$174,"6,225",2025-03-30,2025-04-06,7
156,CB_2025_Mar_FB_3951_LZ_V02_9x16_VID_EN_New_C-Trend_Evergreen_CTA-SALE_Angle-W_M-MAN_VL-15s_G-M_P-OG_S-NEW,3951 - morning routine || Batch 1 || Enhancements: OFF || CBV2 || 7C || 27/03/25w13,VIDEO,$173,"7,885",2025-03-27,2025-04-02,6
157,CB_2024_Jan_FB_2783_VK-RP_V02_1x1_IMG_EN_Opti_C-ADVRT_CTA-NONE_Pain-W_M-NONE_VL-None_TR-None_G-NONE_P-V2_S-NONE,CBV2 || TOP EU || Advantage+ || Advertorial |  || 0% EXISTING CAP || BROAD || 7C || 21/03/25 Ad set,SHARE,$172,"8,264",2025-03-21,2025-04-06,16
158,CB_2025_Mar_FB_3955_SO-KB_V05_4x5_IMG_EN_New_C-NONE_Evergreen_CTA-NONE_Angle-W-B-C_M-NONE_VL-None_G-NONE_P-OG_S-NONE,3955 - THE GHIBLI-VERSE Trend || Batch 2 || Enhancements: OFF || CBV1 || 7C || 02/04/25w14,SHARE,$167,"7,417",2025-04-02,2025-04-06,4
159,CB_2025_Jan_FB_3723_SO_V07_4x5_IMG_EN_New_C-NONE_Evergreen_CTA-SALE_Angle-W_M-NONE_VL-None_G-NONE_P-NONE_S-NONE,US || Kilo Product's leads LAL || 7C || 04/03/25,SHARE,$163,"7,273",2025-03-04,2025-04-06,33
160,CB_2025_Mar_FB_3951_LZ_V02_9x16_VID_EN_New_C-Trend_Evergreen_CTA-SALE_Angle-W_M-MAN_VL-15s_G-M_P-OG_S-NEW,3951 - morning routine || Batch 1 || Enhancements: OFF || CBV1 || 7C || 30/03/25w14,VIDEO,$159,"5,784",2025-03-30,2025-04-02,3
161,CB_2025_Mar_FB_3907_CHUB-AA_V03_4x5_IMG_EN_Opti_C-Price_CTA-NONE_Angle-None_M-NONE_VL-None_TR-None_G-NONE_P-OG_S-NONE.png,US || Quiz: Shopify || 7C || 04/04/25,SHARE,$158,"6,893",2025-04-04,2025-04-06,2
162,CB_2025_Mar_FB_3914_DT-DP_V01_9x16_VID_EN_New_C-Trend_Sale_CTA-SPRNG_Angle-W-B-C_M-JOG_VL-30s_G-F_P-OG_S-NEW.mp4,US || Quiz: React || 7C || 04/04/25,VIDEO,$157,"6,193",2025-04-04,2025-04-06,2
163,CB_2025_Feb_FB_3827_LZ_V03_1x1_IMG_EN_Opti_C-Headline_Evergreen_CTA-SALE_Angle-W_M-NONE_VL-None_G-M_P-CBV2_S-NONE_FB3705V02,CBV2 || US || Manual Bid: ROAS GOAL: 1.00 -> 1.1 || 7DC || 22/01/2025,SHARE,$156,"4,352",2025-02-18,2025-04-06,47
164,CB_2025_Mar_FB_3914_DT-DP_V01_9x16_VID_EN_New_C-Trend_Sale_CTA-SPRNG_Angle-W-B-C_M-JOG_VL-30s_G-F_P-OG_S-NEW.mp4,US || Quiz: Shopify || 7C || 04/04/25,VIDEO,$155,"5,496",2025-04-04,2025-04-06,2
165,CB_2025_Mar_FB_3951_LZ_V03_9x16_VID_EN_New_C-Trend_Evergreen_CTA-SALE_Angle-W_M-MAN_VL-15s_G-M_P-OG_S-NEW,3951 - morning routine || Batch 1 || Enhancements: OFF || CBV1 || 7C || 30/03/25w14,VIDEO,$149,"5,576",2025-03-30,2025-04-02,3
166,CB_2023_May_FB_2103_MB_V02_9x16_VID_EN_Opti_C-Sale_CTA-SMR_Pain-W_M-JOG_VL-30s_TR-None_G-M-F_P-None_S-What,US || ASC+ || Website + Shop || 7DC || Existing 0% || 24.03.2025 Ad set,VIDEO,$147,"5,194",2025-04-04,2025-04-06,2
167,CB_2025_Mar_FB_3907_CHUB-AA_V03_4x5_IMG_EN_Opti_C-Price_CTA-NONE_Angle-None_M-NONE_VL-None_TR-None_G-NONE_P-OG_S-NONE.png,US || Quiz: React || 7C || 04/04/25,SHARE,$145,"6,365",2025-04-04,2025-04-06,2
168,CB_2025_Mar_FB_3955_SO_V16_4x5_IMG_EN_New_C-NONE_Evergreen_CTA-NONE_Angle-W-B-C_M-NONE_VL-None_G-NONE_P-OG_S-NONE,3955 - THE GHIBLI-VERSE Trend || Batch 5 || Enhancements: OFF || CBV1 || 7C || 01/04/25w14,SHARE,$145,"11,062",2025-04-01,2025-04-06,5
169,CB_2024_Jan_FB_2784_RS_V02_9x16_VID_EN_Opti_C-Pointing_CTA-SALE_Pain-W_M-JOG_VL-30s_TR-None_G-F_P-OG_S-OLLIE_FB2181V01,CBV2 || EU (UK) || ðŸ’° Advantage+ || US || BROAD || 7C || Existing_customer_5% || 15/12/24 Ad set,VIDEO,$145,"4,283",2025-01-09,2025-04-06,87
170,CB_2024_Sep_FB_3175_DA-KB_V02_1x1_IMG_EN_New_C-ADVRT_Evergreen_CTA-NONE_Angle-W_M-NONE_VL-None_G-NONE_P-CBV2_S-NONE_blog_colonbroomvsmammoth_cv_en,CBV2 || Advantage+ || Advertorial || Higher pricing || US || 0% EXISTING CAP || BROAD || 7C || 20/01/25  Campaign Ad set,SHARE,$143,"7,779",2025-01-20,2025-04-06,76
171,CB_2025_Mar_FB_3928_VK-DP_V05_1x1_VID_EN_Opti_C-BulletPoints_Evergreen_CTA-NONE_Angle-W-B-C_M-NONE_VL-None_G-M_P-OG_S-NONE_FB3891V05,US || ASC+ || Website + Shop || 7DC || Existing 0% || 24.03.2025 Ad set,SHARE,$139,"10,601",2025-04-04,2025-04-04,0
172,CB_2025_Mar_FB_3902_SO-JT_V01_1x1_IMG_EN_New_C-NONE_Evergreen_CTA-NONE_Angle-W-B-C_M-NONE_VL-None_G-NONE_P-OG_S-NONE,ðŸŒ¶ï¸ || US || ASC+ || ->CC141 || VIDEO Only || US+CA || 0% EXISTING CAP || 7C || 07/08.24  Ad set,SHARE,$137,"5,842",2025-03-25,2025-04-06,12
173,CB_2025_Mar_FB_3930_DT-KB_V12_1x1_IMG_EN_New_C-Advertorial_Sale_CTA-65_Angle-W-B-C_M-MIX_VL-None_G-M_P-OG_S-NONE,3930 - MD in Nutrition || Batch 3 || Enhancements: OFF || CBV2 || 7C || 30/03/25w14,SHARE,$135,"5,376",2025-03-30,2025-04-02,3
174,CB_2023_Jul_FB_2227_RS_V08_1x1_IMG_EN_New_C-Sale_CTA-CTA_None_M-NONE_VL-None_TR-None_G-NONE_P-None_S-NONE,ðŸŒ¶ï¸ || US || ASC+ || ->CC141 || VIDEO Only || US+CA || 0% EXISTING CAP || 7C || 07/08.24  Ad set,SHARE,$130,"5,593",2024-09-30,2025-04-06,188
175,CB_2025_Mar_FB_3944_LZ-VG_V03_4x5_IMG_EN_Opti_C-Testimonial_Evergreen_CTA-NONE_Angle-GH_M-NONE_VL-None_G-NONE_P-OG_S-NONE_FB3619V02,3944 - 3619 opti claims/testimonial || Batch 1 || Enhancements: OFF || CBV1 || 7C || 30/03/25w14,SHARE,$125,"4,452",2025-03-30,2025-04-06,7
176,CB_2025_Mar_FB_3951_LZ_V03_9x16_VID_EN_New_C-Trend_Evergreen_CTA-SALE_Angle-W_M-MAN_VL-15s_G-M_P-OG_S-NEW,3951 - morning routine || Batch 1 || Enhancements: OFF || CBV2 || 7C || 27/03/25w13,VIDEO,$123,"5,987",2025-03-27,2025-04-02,6
177,CB_2025_Mar_FB_3903_VK_V01_9x16_VID_EN_New_C-BulletPoints_Evergreen_CTA-65_Angle-W-B-C_M-MIX_VL-30s_G-MF_P-OG_S-NEW,ðŸŒ¶ï¸ || US || ASC+ || ->CC141 || VIDEO Only || US+CA || 0% EXISTING CAP || 7C || 07/08.24  Ad set,VIDEO,$123,"5,616",2025-04-01,2025-04-06,5
178,CB_2025_Jan_FB_3723_SO_V07_4x5_IMG_EN_New_C-NONE_Evergreen_CTA-SALE_Angle-W_M-NONE_VL-None_G-NONE_P-NONE_S-NONE,ðŸŒ¶ï¸ || US || ASC+ || ->CC141 || VIDEO Only || US+CA || 0% EXISTING CAP || 7C || 07/08.24  Ad set,SHARE,$123,"7,040",2025-02-04,2025-04-06,61
179,CB_2025_Mar_FB_3930_DT-KB_V06_1x1_IMG_EN_New_C-Advertorial_Sale_CTA-65_Angle-W-B-C_M-MIX_VL-None_G-M_P-OG_S-NONE,3930 - MD in Nutrition || Batch 2 || Enhancements: OFF || CBV2 || 7C || 30/03/25w14,SHARE,$123,"5,924",2025-03-30,2025-04-02,3
180,CB_2024_Nov_FB_3264_LZ_V31_4x5_VID_EN_Opti_C-MakingOf_Sale_CTA-BF_Angle-W-B_M-CRAZY_VL-45s_G-M_P-OG_S-NEW_FB3004V02,CBV2 || AU || ðŸ’° Advantage+ || US || BROAD || 7C || Existing_customer_5% || 19/12/24 Ad set,VIDEO,$119,"3,446",2024-12-19,2025-04-06,108
181,CB_2025_Mar_FB_3931_VK-DP_V03_9x16_VID_EN_Opti_C-NONE_Evergreen_CTA-NONE_Angle-W_M-NONE_VL-30s_G-M_P-OG_S-WOOD_FB3860V03,3942 - 3860 V03 opti - DP - VK || Batch 1 || Enhancements: OFF || CBV1 || 7C || 30/03/25w14,VIDEO,$116,"6,292",2025-03-30,2025-04-06,7
182,CB_2023_Jul_FB_2217_IB_V04_9x16_VID_EN_Opti_C-Pointing_CTA-SMR_Pain-W-B_M-TRC_VL-30s_TR-None_G-F_P-None_S-FRIGGA,CBV2 || EU (UK) || ðŸ’° Advantage+ || US || BROAD || 7C || Existing_customer_5% || 15/12/24 Ad set,VIDEO,$115,"5,961",2024-12-18,2025-04-06,109
183,CB_2025_Mar_FB_3939_DT_V02_4x5_IMG_EN_New_C-Advertorial_Sale_CTA-65_Angle-W-B-C_M-MIX_VL-None_G-M_P-OG_S-NONE,3939 - CB Advertorial ads New Ideas || Batch 1 || Enhancements: OFF || CBV1 || 7C || 30/03/25w14,SHARE,$114,"4,916",2025-03-30,2025-04-02,3
184,CB_2025_Mar_FB_3950_SO_V13_4x5_IMG_EN_New_C-NONE_Evergreen_CTA-NONE_Angle-W-B-C_M-NONE_VL-None_G-NONE_P-OG_S-NONE,3950 - Image Gen by ChatGPT || Batch 3 || Enhancements: OFF || CBV1 || 7C || 30/03/25w14,SHARE,$114,"7,221",2025-03-30,2025-04-06,7
185,CB_2025_Jan_FB_3723_SO_V07_4x5_IMG_EN_New_C-NONE_Evergreen_CTA-SALE_Angle-W_M-NONE_VL-None_G-NONE_P-NONE_S-NONE,CA || ASC+ || 0% EXISTING || 7DC || 18.03.2025,SHARE,$112,"11,591",2025-03-18,2025-04-06,19
186,CB_2025_Feb_FB_3860_LZ-DP_V03_9x16_VID_EN_Opti_C-Testimonial_Evergreen_CTA-SALE_Angle-W_M-MOOD_VL-20s_G-M_P-OG_S-WOOD_FB21176V11_1,US || ASC+ || Website + Shop || 7DC || Existing 0% || 24.03.2025 Ad set,VIDEO,$112,"4,706",2025-03-24,2025-04-06,13
187,CB_2025_Mar_FB_3941_LZ-DT_V03_9x16_VID_EN_New_C-Testimonial_Evergreen_CTA-SALE_Angle-GH_M-SMT_VL-30s_G-F_P-OG_S-NEW,3941 - health wellbeing new vid || Batch 1 || Enhancements: OFF || CBV1 || 7C || 30/03/25w14,VIDEO,$106,"4,217",2025-03-30,2025-04-03,4
188,CB_2025_Mar_FB_3930_DT-KB_V02_1x1_IMG_EN_New_C-Advertorial_Sale_CTA-65_Angle-W-B-C_M-MIX_VL-None_G-M_P-OG_S-NONE,3930 - MD in Nutrition || Batch 1 || Enhancements: OFF || CBV2 || 7C || 30/03/25w14,SHARE,$104,"5,222",2025-03-30,2025-04-03,4
189,CB_2025_Mar_FB_3952_LZ-DP_V04_9x16_VID_EN_Opti_C-NegativeMark_Evergreen_CTA-SALE_Angle-W_M-SMT_VL-15s_G-F_P-OG_S-NEW_FB3264V29,3952 - Depuff face bad reviews || Batch 1 || Enhancements: OFF || CBV1 || 7C || 30/03/25w14,VIDEO,$103,"5,552",2025-03-30,2025-04-01,2
190,CB_2025_Mar_FB_3910_LZ-DP_V02_1x1_IMG_EN_Opti_C-NegativeMark_Evergreen_CTA-NONE_Angle-W_M-NONE_VL-None_G-NONE_P-TRIAL_S-NONE_FB2227V08.png,US || Free trial offer || Trial ads || Trial purchase || 7C || 19/03/25,SHARE,$102,"4,159",2025-03-19,2025-04-06,18
191,CB_2024_Aug_FB_3090_DT-DP_V02_9x16_VID_EN_Opti_C-MakingOf_CTA-CTA_Pain-W-B-C_M-POW_VL-45s_TR-None_G-M_P-OG_S-Moon_FB3029V04,CBV2 || EU (UK) || ðŸ’° Advantage+ || US || BROAD || 7C || Existing_customer_5% || 15/12/24 Ad set,SHARE,$100,"4,286",2024-12-19,2025-04-06,108
192,CB_2024_Oct_FB_3214_DT-KB_V07_1x1_IMG_EN_New_C-ADVRT_Evergreen_CTA-NONE_Angle-W_M-NONE_VL-None_G-NONE_P-OG_S-NONE,CA || Advantage+ || Advertorial || 7C ||  BROAD || Existing_customer_0% || 20/03/25 Ad set,SHARE,$99,"6,018",2025-03-20,2025-04-06,17
193,CB_2024_Mar_FB_2883_DA_V04_9x16_GIF_ES_Opti_C-Benefits_CTA-60_Pain-W-B_M-NONE_VL-15s_TR-None_G-NONE_P-V2_S-NEW_FB2369V04.mp4,LATAM ðŸ‡ªðŸ‡¸ || CBV2 || Advantage+ || 0% EXISTING CAP || BROAD || 7C || 22/03/25 Campaign Ad set,VIDEO,$99,"5,763",2025-03-22,2025-04-04,13
194,CB_2024_Mar_FB_2888_JG_V02_9x16_IMG_EN_Opti_C-Benefits_CTA-NONE_Pain-W_M-NONE_VL-None_TR-None_G-NONE_P-V2_S-NONE,CBV2 || AU || ðŸ’° Advantage+ || US || BROAD || 7C || Existing_customer_5% || 19/12/24 Ad set,SHARE,$97,"3,279",2024-12-19,2025-04-06,108
195,CB_2025_Mar_FB_3913_CHUB-AS_V04_1x1_IMG_EN_New_C-NONE_CTA-NONE_Angle-W_M-NONE_VL-None_TR-None_G-NONE_P-NONE_S-NONE_blog_moobs_cv_en,CBV1 || LP:HI | blog_moobs_cv_en || Batch 1 || 30/03/25,SHARE,$94,"4,600",2025-03-30,2025-04-06,7
196,CB_2025_Mar_FB_3907_CHUB-AA_V03__IMG_EN_Opti_C-Price_CTA-NONE_Angle-None_M-NONE_VL-None_TR-None_G-NONE_P-OG_S-NONE,US || ASC+ || Website + Shop || 7DC || Existing 0% || 24.03.2025 Ad set,SHARE,$93,"3,168",2025-04-04,2025-04-06,2
197,CB_2025_Mar_FB_3939_DT_V05_4x5_IMG_EN_New_C-Advertorial_Sale_CTA-65_Angle-W-B-C_M-MIX_VL-None_G-M_P-OG_S-NONE,3939 - CB Advertorial ads New Ideas || Batch 2 || Enhancements: OFF || CBV1 || 7C || 30/03/25w14,SHARE,$92,"3,890",2025-03-30,2025-04-06,7
198,CB_2024_Oct_FB_3214_DT-KB_V06_1x1_IMG_EN_New_C-ADVRT_Evergreen_CTA-NONE_Angle-W_M-NONE_VL-None_G-NONE_P-OG_S-NONE,CA || Advantage+ || Advertorial || 7C ||  BROAD || Existing_customer_0% || 20/03/25 Ad set,SHARE,$91,"6,020",2025-03-20,2025-04-06,17
199,CB_2024_Oct_FB_3214_DT-KB_V03_1x1_IMG_EN_New_C-ADVRT_Evergreen_CTA-NONE_Angle-W_M-NONE_VL-None_G-NONE_P-OG_S-NONE,CA || Advantage+ || Advertorial || 7C ||  BROAD || Existing_customer_0% || 20/03/25 Ad set,SHARE,$90,"6,271",2025-03-20,2025-04-06,17
200,CB_2024_Mar_FB_2888_JG_V01_9x16_IMG_EN_Opti_C-Benefits_CTA-NONE_Pain-W_M-NONE_VL-None_TR-None_G-NONE_P-V2_S-NONE,CBV2 || AU || ðŸ’° Advantage+ || US || BROAD || 7C || Existing_customer_5% || 19/12/24 Ad set,SHARE,$89,"3,068",2024-12-19,2025-04-06,108
201,CB_2025_Mar_FB_3930_DT-KB_V09_1x1_IMG_EN_New_C-Advertorial_Sale_CTA-65_Angle-W-B-C_M-MIX_VL-None_G-M_P-OG_S-NONE,3930 - MD in Nutrition || Batch 3 || Enhancements: OFF || CBV2 || 7C || 30/03/25w14,SHARE,$89,"4,048",2025-03-30,2025-04-02,3
202,CB_2025_Mar_FB_3902_SO-JT_V03_1x1_IMG_EN_New_C-NONE_Evergreen_CTA-NONE_Angle-W-B-C_M-NONE_VL-None_G-NONE_P-OG_S-NONE,ðŸŒ¶ï¸ || US || ASC+ || ->CC141 || VIDEO Only || US+CA || 0% EXISTING CAP || 7C || 07/08.24  Ad set,SHARE,$85,"5,208",2025-03-25,2025-04-06,12
203,CB_2025_Mar_FB_3939_DT_V01_4x5_IMG_EN_New_C-Advertorial_Sale_CTA-65_Angle-W-B-C_M-MIX_VL-None_G-M_P-OG_S-NONE,3939 - CB Advertorial ads New Ideas || Batch 1 || Enhancements: OFF || CBV1 || 7C || 30/03/25w14,SHARE,$83,"2,897",2025-03-30,2025-04-02,3
204,CB_2025_Mar_FB_3949_VK-DP_V03_9x16_VID_EN_New_C-NONE_Evergreen_CTA-NONE_Angle-W-B-C_M-TYL_VL-None_G-M_P-OG_S-NONE,"3949 - ""Never use your GF's supplements"" script for actor - VK || Batch 1 || Enhancements: OFF || CBV1 || 7C || 30/03/25w14",VIDEO,$83,"3,031",2025-03-30,2025-04-05,6
205,CB_2025_Feb_FB_3817_SO_V01_4x5_IMG_EN_Opti_C-NONE_Evergreen_CTA-SALE_Angle-W_M-NONE_VL-None_G-NONE_P-NONE_S-NONE_FB3723V07,CBV2 || EU (UK) || ðŸ’° Advantage+ || US || BROAD || 7C || Existing_customer_5% || 15/12/24 Ad set,SHARE,$82,"4,161",2025-02-14,2025-04-06,51
206,CB_2025_Feb_FB_3860_LZ-DP_V03_9x16_VID_EN_Opti_C-Testimonial_Evergreen_CTA-SALE_Angle-W_M-MOOD_VL-20s_G-M_P-OG_S-WOOD_FB21176V11_1,US || ASC+ || Website ONLY || A/B TEST || 7DC || Existing 0% || 24.03.2025  Ad set,VIDEO,$81,"3,755",2025-03-24,2025-04-03,10
207,CB_2024_Jan_FB_2797_VK-RP-RS_V02_1x1_IMG_EN_Opti_C-ADVRT_CTA-NONE_Pain-W_M-NONE_VL-None_TR-None,CA || Advantage+ || Advertorial || 7C ||  BROAD || Existing_customer_0% || 20/03/25 Ad set,SHARE,$77,"4,739",2025-03-24,2025-04-06,13
208,CB_2025_Mar_FB_3930_DT-KB_V03_1x1_IMG_EN_New_C-Advertorial_Sale_CTA-65_Angle-W-B-C_M-MIX_VL-None_G-M_P-OG_S-NONE,3930 - MD in Nutrition || Batch 1 || Enhancements: OFF || CBV2 || 7C || 30/03/25w14,SHARE,$73,"3,575",2025-03-30,2025-04-03,4
209,CB_2025_Mar_FB_3949_VK-DP_V06_9x16_VID_EN_New_C-NONE_Evergreen_CTA-NONE_Angle-W-B-C_M-TYL_VL-None_G-M_P-OG_S-NEW,"3949 - ""Never use your GF's supplements"" script for actor - VK || Batch 2 || Enhancements: OFF || CBV1 || 7C || 30/03/25w14",VIDEO,$73,"2,993",2025-03-30,2025-04-02,3
210,CB_2025_Mar_FB_3955_SO_V04_4x5_IMG_EN_New_C-NONE_Evergreen_CTA-NONE_Angle-W-B-C_M-NONE_VL-None_G-NONE_P-OG_S-NONE,3955 - THE GHIBLI-VERSE Trend || Batch 1 || Enhancements: OFF || CBV1 || 7C || 01/04/25w14,SHARE,$69,"3,858",2025-04-01,2025-04-05,4
211,CB_2025_Mar_FB_3930_DT-KB_V15_1x1_IMG_EN_New_C-Advertorial_Sale_CTA-65_Angle-W-B-C_M-MIX_VL-None_G-M_P-OG_S-NONE,3930 - MD in Nutrition || Batch 4 || Enhancements: OFF || CBV2 || 7C || 30/03/25w14,SHARE,$68,"2,558",2025-03-30,2025-04-06,7
212,CB_2025_Mar_FB_3950_SO_V20_4x5_IMG_EN_New_C-NONE_Evergreen_CTA-NONE_Angle-W-B-C_M-NONE_VL-None_G-NONE_P-OG_S-NONE,3950 - Image Gen by ChatGPT || Batch 6 || Enhancements: OFF || CBV1 || 7C || 30/03/25w14,SHARE,$67,"3,570",2025-03-30,2025-04-02,3
213,CB_2025_Mar_FB_3952_LZ-DP_V02_9x16_VID_EN_Opti_C-NegativeMark_Evergreen_CTA-SALE_Angle-W_M-SMT_VL-15s_G-F_P-OG_S-NEW_FB3264V29,3952 - Depuff face bad reviews || Batch 1 || Enhancements: OFF || CBV1 || 7C || 30/03/25w14,VIDEO,$67,"3,762",2025-03-30,2025-04-01,2
214,CB_2025_Feb_FB_3827_LZ_V03_1x1_IMG_EN_Opti_C-Headline_Evergreen_CTA-SALE_Angle-W_M-NONE_VL-None_G-M_P-CBV2_S-NONE_FB3705V02,CBV2 || EU (UK) || ðŸ’° Advantage+ || US || BROAD || 7C || Existing_customer_5% || 15/12/24 Ad set,SHARE,$66,"2,074",2025-03-31,2025-04-06,6
215,CB_2025_Feb_FB_3818_LZ-VU_V18_1x1_IMG_EN_Opti_C-Headline_Evergreen_CTA-NONE_Angle-Cort_M-NONE_VL-None_G-NONE_P-NONE_S-NONE_FB3251V01,ðŸŒ¶ï¸ || US || ASC+ || ->CC141 || VIDEO Only || US+CA || 0% EXISTING CAP || 7C || 07/08.24  Ad set,SHARE,$66,"2,749",2025-03-25,2025-04-02,8
216,CB_2025_Mar_FB_3949_VK-DP_V02_9x16_VID_EN_New_C-NONE_Evergreen_CTA-NONE_Angle-W-B-C_M-TYL_VL-None_G-M_P-OG_S-NONE,"3949 - ""Never use your GF's supplements"" script for actor - VK || Batch 1 || Enhancements: OFF || CBV1 || 7C || 30/03/25w14",VIDEO,$65,"2,917",2025-03-30,2025-04-05,6
217,CB_2025_Mar_FB_3939_DT_V03_4x5_IMG_EN_New_C-Advertorial_Sale_CTA-65_Angle-W-B-C_M-MIX_VL-None_G-M_P-OG_S-NONE,3939 - CB Advertorial ads New Ideas || Batch 1 || Enhancements: OFF || CBV1 || 7C || 30/03/25w14,SHARE,$65,"2,837",2025-03-30,2025-04-02,3
218,CB_2025_Mar_FB_3939_DT_V06_4x5_IMG_EN_New_C-Advertorial_Sale_CTA-65_Angle-W-B-C_M-MIX_VL-None_G-M_P-OG_S-NONE,3939 - CB Advertorial ads New Ideas || Batch 2 || Enhancements: OFF || CBV1 || 7C || 30/03/25w14,SHARE,$65,"3,225",2025-03-30,2025-04-06,7
219,CB_2025_Mar_FB_3949_VK-DP_V01_9x16_VID_EN_New_C-NONE_Evergreen_CTA-NONE_Angle-W-B-C_M-TYL_VL-None_G-M_P-OG_S-NONE,CA || ASC+ || 0% EXISTING || 7DC || 18.03.2025,VIDEO,$64,"4,204",2025-04-03,2025-04-06,3
220,CB_2025_Mar_FB_3930_DT-KB_V11_1x1_IMG_EN_New_C-Advertorial_Sale_CTA-65_Angle-W-B-C_M-MIX_VL-None_G-M_P-OG_S-NONE,3930 - MD in Nutrition || Batch 3 || Enhancements: OFF || CBV2 || 7C || 30/03/25w14,SHARE,$60,"1,972",2025-03-30,2025-04-02,3
221,CB_2025_Mar_FB_3939_DT_V04_4x5_IMG_EN_New_C-Advertorial_Sale_CTA-65_Angle-W-B-C_M-MIX_VL-None_G-M_P-OG_S-NONE,3939 - CB Advertorial ads New Ideas || Batch 1 || Enhancements: OFF || CBV1 || 7C || 30/03/25w14,SHARE,$60,"2,525",2025-03-30,2025-04-02,3
222,CB_2024_Aug_FB_3097_VK-DP_V03_9x16_VID_EN_Opti_C-Benefits_CTA-SMR_Pain-W-B_M-MIX_VL-45s_TR-None_G-MF_P-OG_S-WHAT_FB2516V13,ðŸŒ¶ï¸ || US || ASC+ || ->CC141 || VIDEO Only || US+CA || 0% EXISTING CAP || 7C || 07/08.24  Ad set,VIDEO,$60,"2,193",2024-09-04,2025-04-06,214
223,CB_2025_Mar_FB_3924_SO-DP_V04_1x1_IMG_EN_New_C-NONE_Evergreen_CTA-NONE_Angle-W-B-C_M-NONE_VL-None_G-NONE_P-OG_S-NONE,3924 - #17 man boobs/dad bod body text IMG || Batch 1 || Enhancements: OFF || CBV1 || 7C || 24/03/25w13,SHARE,$59,"2,691",2025-03-24,2025-04-06,13
224,CB_2024_Jan_FB_2783_VK-RP_V01_1x1_IMG_EN_Opti_C-ADVRT_CTA-NONE_Pain-W_M-NONE_VL-None_TR-None_G-NONE_P-V2_S-NONE,CA || Advantage+ || Advertorial || 7C ||  BROAD || Existing_customer_0% || 20/03/25 Ad set,SHARE,$59,"5,237",2025-03-24,2025-04-06,13
225,CB_2025_Feb_FB_3827_LZ_V02_1x1_IMG_EN_Opti_C-Headline_Evergreen_CTA-NONE_Angle-W_M-NONE_VL-None_G-M_P-CBV2_S-NONE_FB3723V18,CBV2 || US || Manual Bid: ROAS GOAL: 1.00 -> 1.1 || 7DC || 22/01/2025,SHARE,$57,"2,212",2025-02-18,2025-04-06,47
226,CB_2025_Mar_FB_3949_VK-DP_V05_9x16_VID_EN_New_C-NONE_Evergreen_CTA-NONE_Angle-W-B-C_M-TYL_VL-None_G-M_P-OG_S-WOOD,"3949 - ""Never use your GF's supplements"" script for actor - VK || Batch 2 || Enhancements: OFF || CBV1 || 7C || 30/03/25w14",VIDEO,$57,"2,104",2025-03-30,2025-04-02,3
227,CB_2025_Mar_FB_3955_SO-KB_V07_4x5_IMG_EN_New_C-NONE_Evergreen_CTA-NONE_Angle-W-B-C_M-NONE_VL-None_G-NONE_P-OG_S-NONE,3955 - THE GHIBLI-VERSE Trend || Batch 2 || Enhancements: OFF || CBV1 || 7C || 02/04/25w14,SHARE,$55,"3,179",2025-04-02,2025-04-06,4
228,CB_2025_Mar_FB_3930_DT-KB_V16_1x1_IMG_EN_New_C-Advertorial_Sale_CTA-65_Angle-W-B-C_M-MIX_VL-None_G-M_P-OG_S-NONE,3930 - MD in Nutrition || Batch 4 || Enhancements: OFF || CBV2 || 7C || 30/03/25w14,SHARE,$55,"1,481",2025-03-30,2025-04-06,7
229,CB_2025_Mar_FB_3955_SO-KB_V06_4x5_IMG_EN_New_C-NONE_Evergreen_CTA-NONE_Angle-W-B-C_M-NONE_VL-None_G-NONE_P-OG_S-NONE,3955 - THE GHIBLI-VERSE Trend || Batch 2 || Enhancements: OFF || CBV1 || 7C || 02/04/25w14,SHARE,$55,"2,722",2025-04-02,2025-04-06,4
230,CB_2025_Mar_FB_3920_VK_V11_1x1_VID_EN_Opti_C-BulletPoints_Evergreen_CTA-NONE_Angle-W-B-C_M-NONE_VL-None_G-M_P-OG_S-NONE_FB3891V05,3920 - 3891 OPTI - VK || Batch 3 || Enhancements: OFF || CBV1 || 7C || 24/03/25w13,SHARE,$55,"2,598",2025-03-24,2025-04-02,9
231,CB_2024_Oct_FB_3214_DT-KB_V05_1x1_IMG_EN_New_C-ADVRT_Evergreen_CTA-NONE_Angle-W_M-NONE_VL-None_G-NONE_P-OG_S-NONE,CA || Advantage+ || Advertorial || 7C ||  BROAD || Existing_customer_0% || 20/03/25 Ad set,SHARE,$55,"4,582",2025-03-20,2025-04-06,17
232,CB_2025_Mar_FB_3924_SO-DP_V08_1x1_IMG_EN_New_C-NONE_Evergreen_CTA-NONE_Angle-W-B-C_M-NONE_VL-None_G-NONE_P-OG_S-NONE,3924 - #17 man boobs/dad bod body text IMG || Batch 2 || Enhancements: OFF || CBV1 || 7C || 24/03/25w13,SHARE,$53,"3,734",2025-03-24,2025-04-05,12
233,CB_2024_Jan_FB_2762_IK_V05_1x1_IMG_EN_New_C-WrittenTesti_CTA-CTA_Pain-W-B-C_M-NONE_VL-None_TR-None_G-NONE_P-V2_S-NONE,CBV2 || EU (UK) || ðŸ’° Advantage+ || US || BROAD || 7C || Existing_customer_5% || 15/12/24 Ad set,SHARE,$52,"1,895",2024-12-15,2025-04-06,112
234,CB_2025_Mar_FB_3955_SO-KB_V13_4x5_IMG_EN_New_C-NONE_Evergreen_CTA-NONE_Angle-W-B-C_M-NONE_VL-None_G-NONE_P-OG_S-NONE,3955 - THE GHIBLI-VERSE Trend || Batch 4 || Enhancements: OFF || CBV1 || 7C || 02/04/25w14,SHARE,$49,"2,320",2025-04-02,2025-04-06,4
235,CB_2025_Mar_FB_3927_DT_V02_1x1_IMG_EN_New_C-NONE_Evergreen_CTA-None_Angle-W_M-NONE_VL-None_G-NONE_P-OG_S-NONE_FB3890V03,3927 - Opti 3890 || Batch 1 || Enhancements: OFF || CBV1 || 7C || 24/03/25w13,SHARE,$49,"2,451",2025-03-24,2025-04-03,10
236,CB_2025_Mar_FB_3950_SO_V07_4x5_IMG_EN_New_C-NONE_Evergreen_CTA-NONE_Angle-W-B-C_M-NONE_VL-None_G-NONE_P-OG_S-NONE,3950 - Image Gen by ChatGPT || Batch 2 || Enhancements: OFF || CBV1 || 7C || 30/03/25w14,SHARE,$47,"2,792",2025-03-30,2025-04-03,4
237,CB_2025_Jan_FB_3741_LZ-JG_V01_4x5_IMG_EN_Opti_C-Headline_Evergreen_CTA-NONE_Angle-W_M-NONE_VL-None_G-NONE_P-CBV2_S-NONE_FB3357V01,CBV2 || US || Manual Bid: ROAS GOAL: 1.00 -> 1.1 || 7DC || 22/01/2025,SHARE,$47,"1,688",2025-01-22,2025-04-06,74
238,CB_2025_Mar_FB_3950_SO_V04_4x5_IMG_EN_New_C-NONE_Evergreen_CTA-NONE_Angle-W-B-C_M-NONE_VL-None_G-NONE_P-OG_S-NONE,3950 - Image Gen by ChatGPT || Batch 1 || Enhancements: OFF || CBV1 || 7C || 30/03/25w14,SHARE,$47,"1,806",2025-03-30,2025-04-03,4
239,CB_2025_Mar_FB_3955_SO_V01_4x5_IMG_EN_New_C-NONE_Evergreen_CTA-NONE_Angle-W-B-C_M-NONE_VL-None_G-NONE_P-OG_S-NONE,3955 - THE GHIBLI-VERSE Trend || Batch 1 || Enhancements: OFF || CBV1 || 7C || 01/04/25w14,SHARE,$46,"2,482",2025-04-01,2025-04-05,4
240,CB_2025_Mar_FB_3930_DT-KB_V10_1x1_IMG_EN_New_C-Advertorial_Sale_CTA-65_Angle-W-B-C_M-MIX_VL-None_G-M_P-OG_S-NONE,3930 - MD in Nutrition || Batch 3 || Enhancements: OFF || CBV2 || 7C || 30/03/25w14,SHARE,$44,"1,665",2025-03-30,2025-04-02,3
241,CB_2024_Sep_FB_3175_DA-KB_V01_1x1_IMG_EN_New_C-ADVRT_Evergreen_CTA-NONE_Angle-W_M-NONE_VL-None_G-NONE_P-CBV2_S-NONE_blog_colonbroomvsmammothhighprice3_cv_en,CBV2 || A/B test CTA button: Variaton || CBV2 vs Happy Mammoth || 7C || 26/03/25,SHARE,$43,"2,248",2025-03-26,2025-04-06,11
242,CB_2023_Jul_FB_2226_MB_V04_9x16_VID_EN_Opti_C-Testim_CTA-SMR_Pain-W_M-MIX_VL-30s_TR-None_G-F_P-None_S-Starry,US || Manual Bid || BFCM || COST CAP 71 || 1C || 15/11/24,VIDEO,$43,"1,222",2024-11-15,2025-04-06,142
243,CB_2025_Mar_FB_3952_LZ-DP_V01_9x16_VID_EN_Opti_C-NegativeMark_Evergreen_CTA-SALE_Angle-W_M-SMT_VL-15s_G-F_P-OG_S-NEW_FB3264V29,3952 - Depuff face bad reviews || Batch 1 || Enhancements: OFF || CBV1 || 7C || 30/03/25w14,VIDEO,$43,"1,759",2025-03-30,2025-04-01,2
244,CB_2025_Mar_FB_3941_LZ-DT_V04_9x16_VID_EN_New_C-Testimonial_Evergreen_CTA-SALE_Angle-GH_M-SMT_VL-30s_G-F_P-OG_S-NEW,3941 - health wellbeing new vid || Batch 1 || Enhancements: OFF || CBV1 || 7C || 30/03/25w14,VIDEO,$43,"2,218",2025-03-30,2025-04-03,4
245,CB_2024_Apr_FB_2970_RS_V02_1x1_GIF_EN_Opti_C-WrittenTesti_CTA-CTA_Pain-W_M-NONE_VL-7s_TR-None_G-NONE_P-V2_S-NEW,CBV2 || EU (UK) || ðŸ’° Advantage+ || US || BROAD || 7C || Existing_customer_5% || 15/12/24 Ad set,VIDEO,$43,"1,362",2025-04-02,2025-04-06,4
246,CB_2025_Mar_FB_3947_LZ-VG_V03_4x5_IMG_EN_New_C-StickyNotes_Evergreen_CTA-SALE_Angle-Horm_M-NONE_VL-None_G-M_P-OG_S-NONE,3947 - low t post it notes || Batch 1 || Enhancements: OFF || CBV1 || 7C || 30/03/25w14,SHARE,$42,"2,526",2025-03-30,2025-04-03,4
247,CB_2025_Mar_FB_3913_CHUB-AS_V03_1x1_IMG_EN_New_C-NONE_CTA-NONE_Angle-W_M-NONE_VL-None_TR-None_G-NONE_P-NONE_S-NONE_blog_moobs_cv_en,CBV1 || LP:HI | blog_moobs_cv_en || Batch 1 || 30/03/25,SHARE,$42,"1,888",2025-03-30,2025-04-06,7
248,CB_2025_Mar_FB_3950_SO_V22_4x5_IMG_EN_New_C-NONE_Evergreen_CTA-NONE_Angle-W-B-C_M-NONE_VL-None_G-NONE_P-OG_S-NONE,3950 - Image Gen by ChatGPT || Batch 6 || Enhancements: OFF || CBV1 || 7C || 30/03/25w14,SHARE,$42,"2,523",2025-03-30,2025-04-02,3
249,CB_2025_Mar_FB_3955_SO_V09_4x5_IMG_EN_New_C-NONE_Evergreen_CTA-NONE_Angle-W-B-C_M-NONE_VL-None_G-NONE_P-OG_S-NONE,3955 - THE GHIBLI-VERSE Trend || Batch 3 || Enhancements: OFF || CBV1 || 7C || 01/04/25w14,SHARE,$42,"2,527",2025-04-01,2025-04-05,4
250,CB_2025_Mar_FB_3950_SO_V24_4x5_IMG_EN_New_C-NONE_Evergreen_CTA-NONE_Angle-W-B-C_M-NONE_VL-None_G-NONE_P-OG_S-NONE,3950 - Image Gen by ChatGPT || Batch 7 || Enhancements: OFF || CBV1 || 7C || 30/03/25w14,SHARE,$40,"2,666",2025-03-30,2025-04-03,4
251,CB_2024_Sep_FB_3175_DA-KB_V03_1x1_IMG_EN_New_C-ADVRT_Evergreen_CTA-NONE_Angle-W_M-NONE_VL-None_G-NONE_P-CBV2_S-NONE_blog_colonbroomvsmammothhighprice3_cv_en,CBV2 || A/B test CTA button: Variaton || CBV2 vs Happy Mammoth || 7C || 26/03/25,SHARE,$39,"1,617",2025-03-26,2025-04-06,11
252,CB_2025_Mar_FB_3927_DT_V03_1x1_IMG_EN_New_C-NONE_Evergreen_CTA-None_Angle-W_M-NONE_VL-None_G-NONE_P-OG_S-NONE_FB3890V03,3927 - Opti 3890 || Batch 1 || Enhancements: OFF || CBV1 || 7C || 24/03/25w13,SHARE,$39,"1,591",2025-03-24,2025-04-03,10
253,CB_2025_Mar_FB_3890_DT_V02_1x1_IMG_EN_New_C-NONE_Evergreen_CTA-None_Angle-W_M-NONE_VL-None_G-NONE_P-OG_S-NONE,3890 - Your Peak Performance in 6 weeks || Enhancements: OFF || CBV1 || Batch 1 || 7C || 10/03/25w11,SHARE,$38,"1,669",2025-03-12,2025-03-31,19
254,CB_2025_Mar_FB_3950_SO_V19_4x5_IMG_EN_New_C-NONE_Evergreen_CTA-NONE_Angle-W-B-C_M-NONE_VL-None_G-NONE_P-OG_S-NONE,3950 - Image Gen by ChatGPT || Batch 5 || Enhancements: OFF || CBV1 || 7C || 30/03/25w14,SHARE,$37,"2,412",2025-03-30,2025-04-03,4
255,CB_2025_Mar_FB_3916_VK-DP_V06_1x1_VID_EN_New_C-BulletPoints_Evergreen_CTA-NONE_Angle-W-B-C_M-NONE_VL-None_G-M_P-OG_S-NONE,3916 - #11 Date night -VK || Batch 2 || Enhancements: OFF || CBV1 || 7C || 24/03/25w13,SHARE,$35,"1,109",2025-03-24,2025-03-31,7
256,CB_2025_Feb_FB_3860_LZ-DP_V02_9x16_VID_EN_Opti_C-Testimonial_Evergreen_CTA-SALE_Angle-W_M-MOOD_VL-20s_G-M_P-OG_S-WOOD_FB21176V11_1,3860 - man boobs video 2176 opti || Enhancements: OFF || CBV1 || Batch 1 || 7C || 03/03/25w10 || Valentinas,VIDEO,$33,"1,502",2025-03-03,2025-04-06,34
257,CB_2025_Mar_FB_3941_LZ-DT_V01_9x16_VID_EN_New_C-Testimonial_Evergreen_CTA-SALE_Angle-GH_M-SMT_VL-30s_G-F_P-OG_S-NEW,3941 - health wellbeing new vid || Batch 1 || Enhancements: OFF || CBV1 || 7C || 30/03/25w14,VIDEO,$32,"1,307",2025-03-30,2025-04-03,4
258,CB_2025_Mar_FB_3911_DT_V03_9x16_VID_EN_Opti_C-SingleTesti_Sale_CTA-Patrick_Angle-W_M-TRC_VL-45s_G-F_P-OG_S-MOON_FB2764V04,CBV2 || EU (UK) || ðŸ’° Advantage+ || US || BROAD || 7C || Existing_customer_5% || 15/12/24 Ad set,VIDEO,$32,"1,395",2025-03-17,2025-04-06,20
259,CB_2025_Mar_FB_3930_DT-KB_V01_1x1_IMG_EN_New_C-Advertorial_Sale_CTA-65_Angle-W-B-C_M-MIX_VL-None_G-M_P-OG_S-NONE,3930 - MD in Nutrition || Batch 1 || Enhancements: OFF || CBV2 || 7C || 30/03/25w14,SHARE,$32,"1,538",2025-03-30,2025-04-03,4
260,CB_2024_Feb_FB_2814_MB-DP_V05_1x1_IMG_EN_New_C-WeightLoss_CTA-None_Pain-W-B-C_M-NONE_VL-None_TR-None_G-NONE_P-V2_S-NONE,CBV2 || EU (UK) || ðŸ’° Advantage+ || US || BROAD || 7C || Existing_customer_5% || 15/12/24 Ad set,SHARE,$31,"1,155",2025-01-31,2025-04-06,65
261,CB_2024_Oct_FB_3182_ZS-GC_V13_1x1_IMG_EN_New_C-UsVsThem_Evergreen_CTA-NONE_Angle-B-C_M-NONE_VL-None_G-NONE_P-OG_S-NONE,CBV2 || AU || ðŸ’° Advantage+ || US || BROAD || 7C || Existing_customer_5% || 19/12/24 Ad set,SHARE,$30,"1,408",2024-12-19,2025-04-06,108
262,CB_2024_Dec_FB_3619_VK-JT_V02_4x5_VID_EN_New_C-BulletPoints_Sale_CTA-NY_Angle-W-B-C_M-NONE_VL-None_G-NONE_P-OG_S-NONE,ðŸŒ¶ï¸ || US || ASC+ || ->CC141 || VIDEO Only || US+CA || 0% EXISTING CAP || 7C || 07/08.24  Ad set,SHARE,$29,"1,645",2024-12-27,2025-04-06,100
263,CB_2024_Dec_FB_3592_VK-DP_V10_4x5_VID_EN_New_C-BulletPoints_Sale_CTA-SALE_Angle-W-B-C_M-NONE_VL-30s_G-F_P-OG_S-NEW - Copy,ðŸŒ¶ï¸ || US || ASC+ || ->CC141 || VIDEO Only || US+CA || 0% EXISTING CAP || 7C || 07/08.24  Ad set,VIDEO,$28,"1,014",2024-12-21,2025-04-06,106
264,CB_2025_Feb_FB_3883_LZ-RP_V05_9x16_VID_EN_Opti_C-BulletPoints_Evergreen_CTA-SALE_Angle-W_M-JANW_VL-30s_G-M_P-OG_S-WHAT_FB2284V05,CBV2 || EU (UK) || ðŸ’° Advantage+ || US || BROAD || 7C || Existing_customer_5% || 15/12/24 Ad set,SHARE,$26,"1,460",2025-04-01,2025-04-06,5
265,CB_2024_Nov_FB_3264_LZ_V31_4x5_VID_EN_Opti_C-MakingOf_Sale_CTA-BF_Angle-W-B_M-CRAZY_VL-45s_G-M_P-OG_S-NEW_FB3004V02,CBV2 || EU (UK) || ðŸ’° Advantage+ || US || BROAD || 7C || Existing_customer_5% || 15/12/24 Ad set,VIDEO,$25,"1,182",2024-12-19,2025-04-06,108
266,CB_2025_Jan_FB_3923_VK-KB_V10_1x1_VID_EN_Opti_C-BulletPoints_Evergreen_CTA-65_Angle-W-B-C_M-NONE_VL-None_G-F_P-OG_S-NEW_FB3779V04,3923 - OPTI 3779 - VK || Batch 1 || Enhancements: OFF || CBV1 || 7C || 24/03/25w13,SHARE,$23,641,2025-03-24,2025-04-02,9
267,CB_2025_Mar_FB_3946_LZ-VG_V02_4x5_IMG_EN_New_C-BeforeAfter_Evergreen_CTA-SALE_Angle-W-B_M-NONE_VL-None_G-M_P-OG_S-NONE,3946 - man boobs before after LZ+VG || Batch 1 || Enhancements: OFF || CBV1 || 7C || 30/03/25w14,SHARE,$23,"1,006",2025-03-30,2025-04-03,4
268,CB_2024_Mar_FB_2888_JG_V03_9x16_IMG_EN_Opti_C-Benefits_CTA-NONE_Pain-W_M-NONE_VL-None_TR-None_G-NONE_P-V2_S-NONE,CBV2 || AU || ðŸ’° Advantage+ || US || BROAD || 7C || Existing_customer_5% || 19/12/24 Ad set,SHARE,$22,765,2024-12-19,2025-04-06,108
269,CB_2025_Mar_FB_3919_LZ_V03_1x1_IMG_EN_Opti_C-Headline_Evergreen_CTA-NONE_Angle-W_M-NONE_VL-30s_G-M_P-OG_S-NONE_FB3891V05,3919 - cb Spartan || Batch 1 || Enhancements: OFF || CBV1 || 7C || 24/03/25w13,SHARE,$22,997,2025-03-24,2025-04-02,9
270,CB_2025_Mar_FB_3950_SO_V12_4x5_IMG_EN_New_C-NONE_Evergreen_CTA-NONE_Angle-W-B-C_M-NONE_VL-None_G-NONE_P-OG_S-NONE,3950 - Image Gen by ChatGPT || Batch 3 || Enhancements: OFF || CBV1 || 7C || 30/03/25w14,SHARE,$22,"1,411",2025-03-30,2025-04-05,6
271,CB_2024_Sep_FB_3175_DA-KB_V02_1x1_IMG_EN_New_C-ADVRT_Evergreen_CTA-NONE_Angle-W_M-NONE_VL-None_G-NONE_P-CBV2_S-NONE_blog_colonbroomvsmammoth_cv_en,CBV2 || A/B test CTA button: Control || CBV2 vs Happy Mammoth || 7C || 26/03/25,SHARE,$21,"1,443",2025-03-26,2025-04-06,11
272,CB_2025_Mar_FB_3950_SO_V06_4x5_IMG_EN_New_C-NONE_Evergreen_CTA-NONE_Angle-W-B-C_M-NONE_VL-None_G-NONE_P-OG_S-NONE,3950 - Image Gen by ChatGPT || Batch 2 || Enhancements: OFF || CBV1 || 7C || 30/03/25w14,SHARE,$21,"1,065",2025-03-30,2025-04-03,4
273,CB_2025_Mar_FB_3952_LZ-DP_V03_9x16_VID_EN_Opti_C-NegativeMark_Evergreen_CTA-SALE_Angle-W_M-SMT_VL-15s_G-F_P-OG_S-NEW_FB3264V29,3952 - Depuff face bad reviews || Batch 1 || Enhancements: OFF || CBV1 || 7C || 30/03/25w14,VIDEO,$21,"1,344",2025-03-30,2025-04-01,2
274,CB_2025_Mar_FB_3928_VK-DP_V02_1x1_VID_EN_Opti_C-BulletPoints_Evergreen_CTA-NONE_Angle-W-B-C_M-NONE_VL-None_G-M_P-OG_S-NONE_FB3891V05,3928 - opti 3891 kinda sorta opti with man boobs - DP-VK || Batch 1 || Enhancements: OFF || CBV1 || 7C || 24/03/25w13,SHARE,$20,"1,295",2025-03-24,2025-04-06,13
275,CB_2024_Oct_FB_3252_VK-DP_V04_4x5_VID_EN_Opti_C-MakingOf_Evergreen_CTA-SALE_Angle-W-B-C_M-JOG_VL-45s_G-F_P-OG_S-MOON_FB3090V02,ðŸŒ¶ï¸ || US || ASC+ || ->CC141 || VIDEO Only || US+CA || 0% EXISTING CAP || 7C || 07/08.24  Ad set,VIDEO,$19,649,2024-11-07,2025-04-06,150
276,CB_2025_Mar_FB_3955_SO_V03_4x5_IMG_EN_New_C-NONE_Evergreen_CTA-NONE_Angle-W-B-C_M-NONE_VL-None_G-NONE_P-OG_S-NONE,3955 - THE GHIBLI-VERSE Trend || Batch 1 || Enhancements: OFF || CBV1 || 7C || 01/04/25w14,SHARE,$18,"1,014",2025-04-01,2025-04-05,4
277,CB_2023_May_FB_2103_MB_V02_9x16_VID_EN_Opti_C-Sale_CTA-SMR_Pain-W_M-JOG_VL-30s_TR-None_G-M-F_P-None_S-What,US || Manual Bid || BID CAP 111 || 1C || 21/12/24,VIDEO,$16,522,2024-12-28,2025-04-06,99
278,CB_2025_Mar_FB_3950_SO_V01_4x5_IMG_EN_New_C-NONE_Evergreen_CTA-NONE_Angle-W-B-C_M-NONE_VL-None_G-NONE_P-OG_S-NONE,3950 - Image Gen by ChatGPT || Batch 1 || Enhancements: OFF || CBV1 || 7C || 30/03/25w14,SHARE,$15,738,2025-03-30,2025-04-03,4
279,CB_2025_Mar_FB_3910_LZ-DP_V03_9x16_VID_EN_Opti_C-BulletPoints_Evergreen_CTA-NONE_Angle-W_M-MAN_VL-15s_G-M_P-TRIAL_S-WHAT_FB3097V03.mp4,US || Free trial offer || Trial ads || ATC || 7C || 16/03/25,VIDEO,$13,703,2025-03-16,2025-04-01,16
280,CB_2025_Mar_FB_3940_DT-DP_V06_9x16_VID_EN_New_C-Trend_Sale_CTA-65_Angle-W-B-C_M-_VL-None_G-M_P-OG_S-New,3940 - #4 Never use your GF's supplements || Batch 2 || Enhancements: OFF || CBV1 || 7C || 30/03/25w14,VIDEO,$13,466,2025-03-30,2025-04-03,4
281,CB_2025_Jan_FB_3742_SO-DP-KB_V01_4x5_IMG_EN_Opti_C-NONE_Evergreen_CTA-SALE_Angle-W_M-NONE_VL-None_G-NONE_P-CBV2_S-NONE3665V01,CBV2 || EU (UK) || ðŸ’° Advantage+ || US || BROAD || 7C || Existing_customer_5% || 15/12/24 Ad set,SHARE,$12,588,2025-02-04,2025-04-06,61
282,CB_2025_Mar_FB_3907_CHUB-AA_V01__IMG_EN_Opti_C-Price_CTA-NONE_Angle-None_M-NONE_VL-None_TR-None_G-NONE_P-OG_S-NONE,3907 â€“ CHUB Clean Sale OPTI v2 || Enhancements: OFF || CBV1 || Batch 1 || 7C || 16/03/25w12,SHARE,$12,626,2025-03-16,2025-04-06,21
283,CB_2024_Oct_FB_3214_DT-KB_V02_1x1_IMG_EN_New_C-ADVRT_Evergreen_CTA-NONE_Angle-W_M-NONE_VL-None_G-NONE_P-OG_S-NONE,CA || Advantage+ || Advertorial || 7C ||  BROAD || Existing_customer_0% || 20/03/25 Ad set,SHARE,$12,"1,017",2025-03-20,2025-04-06,17
284,CB_2025_Mar_FB_3939_DT_V08_4x5_IMG_EN_New_C-Advertorial_Sale_CTA-65_Angle-W-B-C_M-MIX_VL-None_G-M_P-OG_S-NONE,3939 - CB Advertorial ads New Ideas || Batch 2 || Enhancements: OFF || CBV1 || 7C || 30/03/25w14,SHARE,$12,476,2025-03-30,2025-04-06,7
285,CB_2024_Oct_FB_3214_DT-KB_V08_1x1_IMG_EN_New_C-ADVRT_Evergreen_CTA-NONE_Angle-W_M-NONE_VL-None_G-NONE_P-OG_S-NONE,CA || Advantage+ || Advertorial || 7C ||  BROAD || Existing_customer_0% || 20/03/25 Ad set,SHARE,$11,725,2025-03-20,2025-04-06,17
286,CB_2025_Mar_FB_3928_VK-DP_V03_1x1_VID_EN_Opti_C-BulletPoints_Evergreen_CTA-NONE_Angle-W-B-C_M-NONE_VL-None_G-M_P-OG_S-NONE_FB3891V05,3928 - opti 3891 kinda sorta opti with man boobs - DP-VK || Batch 1 || Enhancements: OFF || CBV1 || 7C || 24/03/25w13,SHARE,$11,631,2025-03-24,2025-04-06,13
287,CB_2025_Mar_FB_3913_CHUB-AS_V06_1x1_IMG_EN_New_C-NONE_CTA-NONE_Angle-W_M-NONE_VL-None_TR-None_G-NONE_P-NONE_S-NONE_blog_moobs_cv_en,CBV1 || LP:HI | blog_moobs_cv_en || Batch 2 || 30/03/25,SHARE,$10,278,2025-03-30,2025-04-06,7
288,CB_2022_Mar3_FB_713_IK_V04_1x1_IMG_EN_Opti_C-WrittenTesti_HE-98_A-ExtremeBodyVisualization_HK-bodypart_Pain-W_CLR-PURPLE_BG-IMAGE_ME-MIX_MA-YOUNG,US || Manual Bid || BFCM || COST CAP 81 || 1C || 15/11/24,SHARE,$10,456,2024-11-15,2025-04-06,142
289,CB_2024_Oct_FB_3252_VK-DP_V08_4x5_VID_EN_Opti_C-NegativeMark_Evergreen_CTA-SALE_Angle-W-B-C_M-JOG_VL-45s_G-F_P-OG_S-MOON_FB2263V04,Relaunch || high potential ads ||  || Batch 1 || Enhancements: OFF || CBV1 || 7C || 25/03/25w13,VIDEO,$9,363,2025-03-25,2025-04-03,9
290,CB_2022_Mar3_FB_713_IK_V04_1x1_IMG_EN_Opti_C-WrittenTesti_HE-98_A-ExtremeBodyVisualization_HK-bodypart_Pain-W_CLR-PURPLE_BG-IMAGE_ME-MIX_MA-YOUNG,US || Manual Bid || BFCM || COST CAP 71 || 1C || 15/11/24,SHARE,$9,591,2024-11-15,2025-04-06,142
291,CB_2025_Mar_FB_3951_LZ_V04_9x16_VID_EN_New_C-Trend_Evergreen_CTA-SALE_Angle-W_M-MAN_VL-15s_G-M_P-OG_S-NEW,3951 - morning routine || Batch 1 || Enhancements: OFF || CBV1 || 7C || 30/03/25w14,VIDEO,$9,432,2025-03-30,2025-04-02,3
292,CB_2024_Dec_FB_3622_LZ-KB_V03_4x5_IMG_EN_Opti_C-NONE_Sale_CTA-XMAS_Angle-GH_M-NONE_VL-None_G-NONE_P-OG_S-NONE_FB2227V08 - Copy,US || Manual Bid || BID CAP 111 || 1C || 21/12/24,SHARE,$9,223,2024-12-22,2025-04-06,105
293,CB_2025_Mar_FB_3955_SO-KB_V14_4x5_IMG_EN_New_C-NONE_Evergreen_CTA-NONE_Angle-W-B-C_M-NONE_VL-None_G-NONE_P-OG_S-NONE,3955 - THE GHIBLI-VERSE Trend || Batch 4 || Enhancements: OFF || CBV1 || 7C || 02/04/25w14,SHARE,$9,409,2025-04-02,2025-04-06,4
294,CB_2025_Jan_FB_3923_VK-KB_V12_1x1_VID_EN_Opti_C-BulletPoints_Evergreen_CTA-65_Angle-W-B-C_M-NONE_VL-None_G-F_P-OG_S-NEW_FB3779V04,3923 - OPTI 3779 - VK || Batch 1 || Enhancements: OFF || CBV1 || 7C || 24/03/25w13,SHARE,$8,240,2025-03-24,2025-04-02,9
295,CB_2025_Mar_FB_3930_DT-KB_V07_1x1_IMG_EN_New_C-Advertorial_Sale_CTA-65_Angle-W-B-C_M-MIX_VL-None_G-M_P-OG_S-NONE,3930 - MD in Nutrition || Batch 2 || Enhancements: OFF || CBV2 || 7C || 30/03/25w14,SHARE,$8,406,2025-03-30,2025-04-02,3
296,CB_2025_Mar_FB_3930_DT-KB_V05_1x1_IMG_EN_New_C-Advertorial_Sale_CTA-65_Angle-W-B-C_M-MIX_VL-None_G-M_P-OG_S-NONE,3930 - MD in Nutrition || Batch 2 || Enhancements: OFF || CBV2 || 7C || 30/03/25w14,SHARE,$7,344,2025-03-30,2025-04-02,3
297,CB_2025_Mar_FB_3913_CHUB-AS_V11_1x1_IMG_EN_New_C-NONE_CTA-NONE_Angle-W_M-NONE_VL-None_TR-None_G-NONE_P-NONE_S-NONE_blog_moobs_cv_en,CBV1 || LP:HI | blog_moobs_cv_en || Batch 3 || 30/03/25,SHARE,$6,177,2025-03-30,2025-04-06,7
298,CB_2023_Jul_FB_2217_IB_V04_9x16_VID_EN_Opti_C-Pointing_CTA-SMR_Pain-W-B_M-TRC_VL-30s_TR-None_G-F_P-None_S-FRIGGA,US || Manual Bid || BID CAP 111 || 1C || 21/12/24,VIDEO,$6,169,2024-12-22,2025-04-04,103
299,CB_2025_Mar_FB_3919_LZ_V02_1x1_IMG_EN_Opti_C-Headline_Evergreen_CTA-NONE_Angle-Horm_M-NONE_VL-30s_G-M_P-OG_S-NONE_FB3891V05,3919 - cb Spartan || Batch 1 || Enhancements: OFF || CBV1 || 7C || 24/03/25w13,SHARE,$5,167,2025-03-24,2025-04-02,9
300,CB_2025_Mar_FB_3913_CHUB-AS_V08_1x1_IMG_EN_New_C-NONE_CTA-NONE_Angle-W_M-NONE_VL-None_TR-None_G-NONE_P-NONE_S-NONE_blog_moobs_cv_en,CBV1 || LP:HI | blog_moobs_cv_en || Batch 2 || 30/03/25,SHARE,$5,177,2025-03-30,2025-04-06,7
301,CB_2025_Mar_FB_3950_SO_V02_4x5_IMG_EN_New_C-NONE_Evergreen_CTA-NONE_Angle-W-B-C_M-NONE_VL-None_G-NONE_P-OG_S-NONE,3950 - Image Gen by ChatGPT || Batch 1 || Enhancements: OFF || CBV1 || 7C || 30/03/25w14,SHARE,$5,241,2025-03-30,2025-04-03,4
302,CB_2025_Mar_FB_3916_VK-DP_V08_1x1_VID_EN_New_C-BulletPoints_Evergreen_CTA-NONE_Angle-W-B-C_M-NONE_VL-None_G-M_P-OG_S-NONE,3916 - #11 Date night -VK || Batch 2 || Enhancements: OFF || CBV1 || 7C || 24/03/25w13,SHARE,$5,83,2025-03-24,2025-03-31,7
303,CB_2025_Mar_FB_3940_DT-DP_V04_9x16_VID_EN_New_C-Trend_Sale_CTA-65_Angle-W-B-C_M-_VL-None_G-M_P-OG_S-New,3940 - #4 Never use your GF's supplements || Batch 2 || Enhancements: OFF || CBV1 || 7C || 30/03/25w14,VIDEO,$4,179,2025-03-30,2025-04-03,4
304,CB_2025_Mar_FB_3910_LZ-DP_V01_1x1_IMG_EN_Opti_C-Headline_Evergreen_CTA-NONE_Angle-W_M-NONE_VL-None_G-NONE_P-TRIAL_S-NONE_FB3251V02.png,US || Free trial offer || Trial ads || ATC || 7C || 16/03/25,SHARE,$4,216,2025-03-16,2025-04-01,16
305,CB_2025_Mar_FB_3928_VK-DP_V01_1x1_VID_EN_Opti_C-BulletPoints_Evergreen_CTA-NONE_Angle-W-B-C_M-NONE_VL-None_G-M_P-OG_S-NONE_FB3891V05,3928 - opti 3891 kinda sorta opti with man boobs - DP-VK || Batch 1 || Enhancements: OFF || CBV1 || 7C || 24/03/25w13,SHARE,$4,207,2025-03-24,2025-04-06,13
306,CB_2025_Mar_FB_3950_SO_V17_4x5_IMG_EN_New_C-NONE_Evergreen_CTA-NONE_Angle-W-B-C_M-NONE_VL-None_G-NONE_P-OG_S-NONE,3950 - Image Gen by ChatGPT || Batch 5 || Enhancements: OFF || CBV1 || 7C || 30/03/25w14,SHARE,$4,179,2025-03-30,2025-04-03,4
307,CB_2024_Jan_FB_2762_IK_V04_1x1_IMG_EN_New_C-WrittenTesti_CTA-CTA_Pain-W-B-C_M-NONE_VL-None_TR-None_G-NONE_P-V2_S-NONE,CBV2 || AU || ðŸ’° Advantage+ || US || BROAD || 7C || Existing_customer_5% || 19/12/24 Ad set,SHARE,$4,180,2024-12-19,2025-04-06,108
308,CB_2024_Sep_FB_3175_DA-KB_V03_1x1_IMG_EN_New_C-ADVRT_Evergreen_CTA-NONE_Angle-W_M-NONE_VL-None_G-NONE_P-CBV2_S-NONE_blog_colonbroomvsmammoth_cv_en,CBV2 || A/B test CTA button: Control || CBV2 vs Happy Mammoth || 7C || 26/03/25,SHARE,$4,134,2025-03-26,2025-04-06,11
309,CB_2025_Feb_FB_3860_LZ-DP_V01_9x16_VID_EN_Opti_C-Testimonial_Evergreen_CTA-SALE_Angle-W_M-MOOD_VL-20s_G-M_P-OG_S-WOOD_FB21176V11_1,3860 - man boobs video 2176 opti || Enhancements: OFF || CBV1 || Batch 1 || 7C || 03/03/25w10 || Valentinas,VIDEO,$4,230,2025-03-03,2025-04-06,34
310,CB_2025_Mar_FB_3950_SO_V15_4x5_IMG_EN_New_C-NONE_Evergreen_CTA-NONE_Angle-W-B-C_M-NONE_VL-None_G-NONE_P-OG_S-NONE,3950 - Image Gen by ChatGPT || Batch 4 || Enhancements: OFF || CBV1 || 7C || 30/03/25w14,SHARE,$4,277,2025-03-30,2025-04-06,7
311,CB_2025_Mar_FB_3951_LZ_V04_9x16_VID_EN_New_C-Trend_Evergreen_CTA-SALE_Angle-W_M-MAN_VL-15s_G-M_P-OG_S-NEW,3951 - morning routine || Batch 1 || Enhancements: OFF || CBV2 || 7C || 27/03/25w13,VIDEO,$4,227,2025-03-27,2025-04-02,6
312,CB_2024_Nov_FB_3331_DT-DP_V16_4x5_VID_EN_Opti_C-Sale_Sale_CTA-BF70_Angle-W_M-LAURA_VL-45s_G-M-F_P-OG_S-NEW_FB2263V04,Relaunch || high potential ads ||  || Batch 1 || Enhancements: OFF || CBV1 || 7C || 25/03/25w13,VIDEO,$4,107,2025-03-25,2025-04-03,9
313,CB_2024_Apr_FB_2943_DT_V04_9x16_VID_EN_Opti_C-Sale_CTA-CTA_Pain-W_M-MIX_VL-45s_TR-None_G-MF_P-V2_S-WHAT_FB_2429V03,2943 - Opti PPC 2429 || Batch 1 || Enhancements: OFF || CBV2 || 7C || 25/03/25w13,VIDEO,$3,97,2025-03-24,2025-04-02,9
314,CB_2025_Mar_FB_3946_LZ-VG_V01_4x5_IMG_EN_New_C-BeforeAfter_Evergreen_CTA-SALE_Angle-W-B_M-NONE_VL-None_G-M_P-OG_S-NONE,3946 - man boobs before after LZ+VG || Batch 1 || Enhancements: OFF || CBV1 || 7C || 30/03/25w14,SHARE,$3,153,2025-03-30,2025-04-03,4
315,CB_2025_Mar_FB_3927_DT_V04_1x1_IMG_EN_New_C-NONE_Evergreen_CTA-None_Angle-W_M-NONE_VL-None_G-NONE_P-OG_S-NONE_FB3890V03,3927 - Opti 3890 || Batch 1 || Enhancements: OFF || CBV1 || 7C || 24/03/25w13,SHARE,$3,147,2025-03-24,2025-04-03,10
316,CB_2025_Mar_FB_3947_LZ-VG_V01_4x5_IMG_EN_New_C-StickyNotes_Evergreen_CTA-SALE_Angle-Horm_M-NONE_VL-None_G-M_P-OG_S-NONE,3947 - low t post it notes || Batch 1 || Enhancements: OFF || CBV1 || 7C || 30/03/25w14,SHARE,$3,81,2025-03-30,2025-04-03,4
317,CB_2023_May_FB_2016_MB_V04_9x16_VID_EN_Opti_C-Sale_CTA-SMR_Pain-W_M-JOG_VL-30s_TR-None_G-M_P-None_S-What,US || ASC+ || Website + Shop || 7DC || Existing 0% || 24.03.2025 Ad set,VIDEO,$3,84,2025-04-04,2025-04-06,2
318,CB_2025_Mar_FB_3916_VK-DP_V05_1x1_VID_EN_New_C-BulletPoints_Evergreen_CTA-NONE_Angle-W-B-C_M-NONE_VL-None_G-M_P-OG_S-NONE,3916 - #11 Date night -VK || Batch 2 || Enhancements: OFF || CBV1 || 7C || 24/03/25w13,SHARE,$3,119,2025-03-24,2025-03-31,7
319,CB_2025_Mar_FB_3922_SO-JT_V01_1x1_IMG_EN_New_C-NONE_Evergreen_CTA-NONE_Angle-W-B-C_M-NONE_VL-None_G-NONE_P-OG_S-NONE,3922 - CB V1 REDLINER || Batch 1 || Enhancements: OFF || CBV1 || 7C || 24/03/25w13,SHARE,$3,78,2025-03-24,2025-04-05,12
320,CB_2024_Sep_FB_3175_DA-KB_V02_1x1_IMG_EN_New_C-ADVRT_Evergreen_CTA-NONE_Angle-W_M-NONE_VL-None_G-NONE_P-CBV2_S-NONE_blog_colonbroomvsmammothhighprice3_cv_en,CBV2 || A/B test CTA button: Variaton || CBV2 vs Happy Mammoth || 7C || 26/03/25,SHARE,$2,131,2025-03-26,2025-04-06,11
321,CB_2025_Mar_FB_3913_CHUB-AS_V09_1x1_IMG_EN_New_C-NONE_CTA-NONE_Angle-W_M-NONE_VL-None_TR-None_G-NONE_P-NONE_S-NONE_blog_moobs_cv_en,CBV1 || LP:HI | blog_moobs_cv_en || Batch 3 || 30/03/25,SHARE,$2,116,2025-03-30,2025-04-06,7
322,CB_2024_Oct_FB_3251_LZ-VU_V01_1x1_IMG_EN_New_C-NegativeMark_Evergreen_CTA-NONE_Angle-Cort_M-NONE_VL-None_G-NONE_P-NONE_S-NONE.png,US || Manual Bid || BFCM || COST CAP 71 || 1C || 15/11/24,SHARE,$2,137,2024-11-15,2025-04-06,142
323,CB_2025_Mar_FB_3950_SO_V08_4x5_IMG_EN_New_C-NONE_Evergreen_CTA-NONE_Angle-W-B-C_M-NONE_VL-None_G-NONE_P-OG_S-NONE,3950 - Image Gen by ChatGPT || Batch 2 || Enhancements: OFF || CBV1 || 7C || 30/03/25w14,SHARE,$2,134,2025-03-30,2025-04-03,4
324,CB_2025_Jan_FB_3747_CHUB-AA_V04_9x16_IMG_EN_Opti_C-NONE_CTA-NONE_Angle-Sale_M-NONE_VL-None_TR-None_G-NONE_P-OG_S-NONE,3747 Clean Sale [HB winner ITR] CHUB || Enhancements: OFF || CBV1 || Batch Ä… || 1C || 02/02/25w06 || Kostas,SHARE,$2,198,2025-02-02,2025-04-02,59
325,CB_2024_Oct_FB_3214_DT-KB_V01_1x1_IMG_EN_New_C-ADVRT_Evergreen_CTA-NONE_Angle-W_M-NONE_VL-None_G-NONE_P-OG_S-NONE,CA || Advantage+ || Advertorial || 7C ||  BROAD || Existing_customer_0% || 20/03/25 Ad set,SHARE,$2,151,2025-03-20,2025-04-01,12
326,CB_2025_Jan_FB_3747_CHUB-AA_V01_4x5_IMG_EN_Opti_C-NONE_CTA-NONE_Angle-Sale_M-NONE_VL-None_TR-None_G-NONE_P-OG_S-NONE,3747 Clean Sale [HB winner ITR] CHUB || Enhancements: OFF || CBV1 || Batch Ä… || 1C || 02/02/25w06 || Kostas,SHARE,$2,168,2025-02-02,2025-04-02,59
327,CB_2024_Apr_FB_2970_RS_V04_1x1_GIF_EN_Opti_C-WrittenTesti_CTA-CTA_Pain-W_M-NONE_VL-7s_TR-None_G-NONE_P-V2_S-NEW,2970 - XL TO M || Batch 1 || Enhancements: OFF || CBV2 || 7C || 25/03/25w13,VIDEO,$1,56,2025-03-24,2025-04-02,9
328,CB_2023_Feb_FB_1998_LV_V02_9x16_VID_EN_Opti_C-Dance_CTA-CTA_Pain-W_M-MIX_VL-45s_TR-None_G-F_P-Plan,US || ASC+ || Website + Shop || 7DC || Existing 0% || 24.03.2025 Ad set,VIDEO,$1,77,2025-04-04,2025-04-06,2
329,CB_2024_Mar_FB_2883_DA_V08_9x16_VID_ES_Opti_C-SingleTesti_CTA-SALE_Pain-W-B_M-TRC_VL-45s_TR-None_G-F_P-OG_S-MOON_FB2764V04.mp4,US || Quiz: React || 7C || 04/04/25,VIDEO,$1,38,2025-04-04,2025-04-06,2
330,CB_2025_Mar_FB_3951_LZ_V01_9x16_VID_EN_New_C-Trend_Evergreen_CTA-SALE_Angle-W_M-MAN_VL-15s_G-M_P-OG_S-NEW,3951 - morning routine || Batch 1 || Enhancements: OFF || CBV1 || 7C || 30/03/25w14,VIDEO,$1,42,2025-03-30,2025-04-02,3
331,CB_2025_Jan_FB_3923_VK-KB_V09_1x1_VID_EN_Opti_C-BulletPoints_Evergreen_CTA-65_Angle-W-B-C_M-NONE_VL-None_G-F_P-OG_S-NEW_FB3779V04,3923 - OPTI 3779 - VK || Batch 1 || Enhancements: OFF || CBV1 || 7C || 24/03/25w13,SHARE,$1,58,2025-03-24,2025-04-02,9
332,CB_2024_Apr_FB_2943_DT_V03_9x16_VID_EN_Opti_C-Sale_CTA-CTA_Pain-W_M-MIX_VL-45s_TR-None_G-MF_P-V2_S-WHAT_FB_2429V03,2943 - Opti PPC 2429 || Batch 1 || Enhancements: OFF || CBV2 || 7C || 25/03/25w13,VIDEO,$1,47,2025-03-24,2025-04-02,9
333,CB_2024_Sep_FB_3175_DA-KB_V01_1x1_IMG_EN_New_C-ADVRT_Evergreen_CTA-NONE_Angle-W_M-NONE_VL-None_G-NONE_P-CBV2_S-NONE_blog_colonbroomvsmammoth_cv_en,CBV2 || A/B test CTA button: Control || CBV2 vs Happy Mammoth || 7C || 26/03/25,SHARE,$1,77,2025-03-26,2025-04-06,11
334,CB_2025_Mar_FB_3950_SO_V25_4x5_IMG_EN_New_C-NONE_Evergreen_CTA-NONE_Angle-W-B-C_M-NONE_VL-None_G-NONE_P-OG_S-NONE,3950 - Image Gen by ChatGPT || Batch 7 || Enhancements: OFF || CBV1 || 7C || 30/03/25w14,SHARE,$1,73,2025-03-30,2025-04-03,4
335,CB_2025_Mar_FB_3928_VK-DP_V04_1x1_VID_EN_Opti_C-BulletPoints_Evergreen_CTA-NONE_Angle-W-B-C_M-NONE_VL-None_G-M_P-OG_S-NONE_FB3891V05,3928 - opti 3891 kinda sorta opti with man boobs - DP-VK || Batch 1 || Enhancements: OFF || CBV1 || 7C || 24/03/25w13,SHARE,$1,60,2025-03-24,2025-04-06,13
336,CB_2025_Jan_FB_3747_CHUB-AA_V02_9x16_IMG_EN_Opti_C-NONE_CTA-NONE_Angle-Sale_M-NONE_VL-None_TR-None_G-NONE_P-OG_S-NONE,3747 Clean Sale [HB winner ITR] CHUB || Enhancements: OFF || CBV1 || Batch Ä… || 1C || 02/02/25w06 || Kostas,SHARE,$1,140,2025-02-02,2025-04-02,59
337,CB_2024_Apr_FB_2943_DT_V05_9x16_VID_EN_Opti_C-Sale_CTA-CTA_Pain-W_M-MIX_VL-45s_TR-None_G-MF_P-V2_S-WHAT_FB_2429V03,2943 - Opti PPC 2429 || Batch 1 || Enhancements: OFF || CBV2 || 7C || 25/03/25w13,VIDEO,$1,23,2025-03-24,2025-04-02,9
338,CB_2025_Mar_FB_3950_SO_V09_4x5_IMG_EN_New_C-NONE_Evergreen_CTA-NONE_Angle-W-B-C_M-NONE_VL-None_G-NONE_P-OG_S-NONE,3950 - Image Gen by ChatGPT || Batch 3 || Enhancements: OFF || CBV1 || 7C || 30/03/25w14,SHARE,$1,64,2025-03-30,2025-04-01,2
339,CB_2024_Mar_FB_2883_DA_V08_9x16_VID_ES_Opti_C-SingleTesti_CTA-SALE_Pain-W-B_M-TRC_VL-45s_TR-None_G-F_P-OG_S-MOON_FB2764V04.mp4,US || Quiz: Shopify || 7C || 04/04/25,VIDEO,$1,15,2025-04-04,2025-04-06,2
340,CB_2025_Mar_FB_3922_SO-JT_V02_1x1_IMG_EN_New_C-NONE_Evergreen_CTA-NONE_Angle-W-B-C_M-NONE_VL-None_G-NONE_P-OG_S-NONE,3922 - CB V1 REDLINER || Batch 1 || Enhancements: OFF || CBV1 || 7C || 24/03/25w13,SHARE,$1,25,2025-03-24,2025-04-05,12
341,CB_2023_Jul_FB_2217_IB_V04_9x16_VID_EN_Opti_C-Pointing_CTA-SMR_Pain-W-B_M-TRC_VL-30s_TR-None_G-F_P-None_S-FRIGGA,US || Manual Bid || BID CAP 105 || 1C || 21/12/24,VIDEO,$1,26,2024-12-22,2025-04-05,104
342,CB_2025_Mar_FB_3920_VK_V09_1x1_VID_EN_Opti_C-BulletPoints_Evergreen_CTA-NONE_Angle-W-B-C_M-NONE_VL-None_G-M_P-OG_S-NONE_FB3891V05,3920 - 3891 OPTI - VK || Batch 3 || Enhancements: OFF || CBV1 || 7C || 24/03/25w13,SHARE,$1,34,2025-03-24,2025-04-02,9
343,CB_2025_Mar_FB_3950_SO_V14_4x5_IMG_EN_New_C-NONE_Evergreen_CTA-NONE_Angle-W-B-C_M-NONE_VL-None_G-NONE_P-OG_S-NONE,3950 - Image Gen by ChatGPT || Batch 4 || Enhancements: OFF || CBV1 || 7C || 30/03/25w14,SHARE,$1,41,2025-03-30,2025-04-06,7
344,CB_2025_Mar_FB_3950_SO_V26_4x5_IMG_EN_New_C-NONE_Evergreen_CTA-NONE_Angle-W-B-C_M-NONE_VL-None_G-NONE_P-OG_S-NONE,3950 - Image Gen by ChatGPT || Batch 7 || Enhancements: OFF || CBV1 || 7C || 30/03/25w14,SHARE,$1,26,2025-03-30,2025-04-03,4
345,CB_2024_Dec_FB_3611_CHUB_V05_4x5_IMG_EN_Opti_C-Headline_CTA-NONE_Angle-C_P-NONE_S-NONE - Copy,US || Manual Bid || BID CAP 111 || 1C || 21/12/24,SHARE,$1,23,2024-12-27,2025-04-04,98
346,CB_2025_Mar_FB_3940_DT-DP_V03_9x16_VID_EN_New_C-Trend_Evergreen_CTA-None_Angle-W-B-C_M-_VL-None_G-M_P-OG_S-NONE,3940 - #4 Never use your GF's supplements || Batch 1 || Enhancements: OFF || CBV1 || 7C || 30/03/25w14,VIDEO,$1,27,2025-03-30,2025-04-02,3
347,CB_2025_Feb_FB_3860_LZ-DP_V04_9x16_VID_EN_Opti_C-Testimonial_Evergreen_CTA-SALE_Angle-W_M-MOOD_VL-20s_G-M_P-OG_S-WOOD_FB21176V11_1,3860 - man boobs video 2176 opti || Enhancements: OFF || CBV1 || Batch 1 || 7C || 03/03/25w10 || Valentinas,VIDEO,$0,35,2025-03-03,2025-04-06,34
348,CB_2025_Mar_FB_3924_SO-DP_V01_1x1_IMG_EN_New_C-NONE_Evergreen_CTA-NONE_Angle-W-B-C_M-NONE_VL-None_G-NONE_P-OG_S-NONE,3924 - #17 man boobs/dad bod body text IMG || Batch 1 || Enhancements: OFF || CBV1 || 7C || 24/03/25w13,SHARE,$0,6,2025-03-24,2025-04-06,13
349,CB_2025_Mar_FB_3916_VK-DP_V07_1x1_VID_EN_New_C-BulletPoints_Evergreen_CTA-NONE_Angle-W-B-C_M-NONE_VL-None_G-M_P-OG_S-NONE,3916 - #11 Date night -VK || Batch 2 || Enhancements: OFF || CBV1 || 7C || 24/03/25w13,SHARE,$0,8,2025-03-24,2025-03-31,7
350,CB_2025_Jan_FB_3923_VK-KB_V11_1x1_VID_EN_Opti_C-BulletPoints_Evergreen_CTA-65_Angle-W-B-C_M-NONE_VL-None_G-F_P-OG_S-NEW_FB3779V04,3923 - OPTI 3779 - VK || Batch 1 || Enhancements: OFF || CBV1 || 7C || 24/03/25w13,SHARE,$0,17,2025-03-24,2025-04-02,9
351,CB_2025_Mar_FB_3943_LZ-DP_V01_4x5_IMG_EN_Opti_C-BeforeAfter_Sale_CTA-SALE_Angle-W_M-NONE_VL-NONE_G-M_P-OG_S-NONE_FB3723V04,3943 - man boobs price cta opti || Batch 1 || Enhancements: OFF || CBV1 || 7C || 30/03/25w14,SHARE,$0,29,2025-03-30,2025-04-05,6
352,CB_2025_Mar_FB_3910_LZ-DP_V02_1x1_IMG_EN_Opti_C-NegativeMark_Evergreen_CTA-NONE_Angle-W_M-NONE_VL-None_G-NONE_P-TRIAL_S-NONE_FB2227V08.png,US || Free trial offer || Trial ads || ATC || 7C || 16/03/25,SHARE,$0,25,2025-03-16,2025-04-01,16
353,CB_2025_Mar_FB_3909_DT-DP_V01_9x16_VID_EN_New_C-Trend_Evergreen_CTA-SMRBOD_Angle-W-B-C_M-JANW_VL-30s_G-M_P-OG_S-NEW,3909 - Shirtless anxiety VID || Batch 1 || Enhancements: OFF || CBV1 || 7C || 24/03/25w13,VIDEO,$0,16,2025-03-24,2025-04-05,12
354,CB_2025_Mar_FB_3950_SO_V10_4x5_IMG_EN_New_C-NONE_Evergreen_CTA-NONE_Angle-W-B-C_M-NONE_VL-None_G-NONE_P-OG_S-NONE,3950 - Image Gen by ChatGPT || Batch 3 || Enhancements: OFF || CBV1 || 7C || 30/03/25w14,SHARE,$0,20,2025-03-30,2025-04-02,3
355,CB_2025_Mar_FB_3907_CHUB-AA_V02__IMG_EN_Opti_C-Price_CTA-NONE_Angle-None_M-NONE_VL-None_TR-None_G-NONE_P-OG_S-NONE,3907 â€“ CHUB Clean Sale OPTI v2 || Enhancements: OFF || CBV1 || Batch 1 || 7C || 16/03/25w12,SHARE,$0,29,2025-03-16,2025-04-06,21
356,CB_2025_Mar_FB_3909_DT-DP_V02_9x16_VID_EN_New_C-Trend_Evergreen_CTA-SMRBOD_Angle-W-B-C_M-JANW_VL-30s_G-M_P-OG_S-NEW,3909 - Shirtless anxiety VID || Batch 1 || Enhancements: OFF || CBV1 || 7C || 24/03/25w13,VIDEO,$0,14,2025-03-24,2025-04-05,12
357,CB_2025_Jan_FB_3923_VK-KB_V06_1x1_VID_EN_Opti_C-BulletPoints_Evergreen_CTA-65_Angle-W-B-C_M-NONE_VL-None_G-F_P-OG_S-NEW_FB3779V04,3923 - OPTI 3779 - VK || Batch 1 || Enhancements: OFF || CBV1 || 7C || 24/03/25w13,SHARE,$0,9,2025-03-24,2025-04-02,9
358,CB_2025_Mar_FB_3951_LZ_V01_9x16_VID_EN_New_C-Trend_Evergreen_CTA-SALE_Angle-W_M-MAN_VL-15s_G-M_P-OG_S-NEW,3951 - morning routine || Batch 1 || Enhancements: OFF || CBV2 || 7C || 27/03/25w13,VIDEO,$0,10,2025-03-27,2025-04-02,6
359,CB_2025_Mar_FB_3940_DT-DP_V02_9x16_VID_EN_New_C-Trend_Evergreen_CTA-None_Angle-W-B-C_M-_VL-None_G-M_P-OG_S-NONE,3940 - #4 Never use your GF's supplements || Batch 1 || Enhancements: OFF || CBV1 || 7C || 30/03/25w14,VIDEO,$0,6,2025-03-30,2025-04-02,3
360,CB_2024_Oct_FB_3251_LZ-VU_V01_1x1_IMG_EN_New_C-NegativeMark_Evergreen_CTA-NONE_Angle-Cort_M-NONE_VL-None_G-NONE_P-NONE_S-NONE.png,US || Manual Bid || BFCM || COST CAP 81 || 1C || 15/11/24,SHARE,$0,10,2024-11-15,2025-04-01,137
361,CB_2025_Mar_FB_3904_DT_V02_9x16_VID_EN_New_C-Trend_Evergreen_CTA-NONE_Angle-W_M-MIX_VL-30s_G-MF_P-OG_S-New,3904 - Notion / I thought my man was cheating on me || Enhancements: OFF || CBV1 || Batch 1 || 7C || 16/03/25w12,VIDEO,$0,9,2025-03-14,2025-04-02,19
362,CB_2025_Mar_FB_3907_CHUB-AA_V04__IMG_EN_Opti_C-Price_CTA-NONE_Angle-None_M-NONE_VL-None_TR-None_G-NONE_P-OG_S-NONE,3907 â€“ CHUB Clean Sale OPTI v2 || Enhancements: OFF || CBV1 || Batch 1 || 7C || 16/03/25w12,SHARE,$0,30,2025-03-16,2025-04-05,20
363,CB_2024_Apr_FB_2970_RS_V01_1x1_GIF_EN_Opti_C-WrittenTesti_CTA-CTA_Pain-W_M-NONE_VL-7s_TR-None_G-NONE_P-V2_S-NEW,2970 - XL TO M || Batch 1 || Enhancements: OFF || CBV2 || 7C || 25/03/25w13,VIDEO,$0,7,2025-03-24,2025-04-02,9
364,CB_2025_Feb_FB_3863_DT-DP_V04_9x16_VID_EN_New_C-Trend_Sale_CTA-70_Angle-W_M-POW_VL-30s_G-M_P-OG_S-NEW.mp4,3863 - Aaron man boobs vid || Enhancements: OFF || CBV1 || Batch 1 || 7C || 26/02/25w09 || Valentinas,VIDEO,$0,11,2025-02-26,2025-04-02,35
365,CB_2025_Mar_FB_3903_VK_V03_9x16_VID_EN_New_C-BulletPoints_Evergreen_CTA-65_Angle-W-B-C_M-MIX_VL-30s_G-MF_P-OG_S-MOON,3903 - #13 My husband hides his beer belly - VK  || Batch 1 || Enhancements: OFF || CBV1 || 7C || 24/03/25w13,VIDEO,$0,7,2025-03-24,2025-04-06,13
366,CB_2025_Mar_FB_3920_VK_V10_1x1_VID_EN_Opti_C-BulletPoints_Evergreen_CTA-NONE_Angle-W-B-C_M-NONE_VL-None_G-M_P-OG_S-NONE_FB3891V05,3920 - 3891 OPTI - VK || Batch 3 || Enhancements: OFF || CBV1 || 7C || 24/03/25w13,SHARE,$0,7,2025-03-24,2025-04-02,9
367,CB_2025_Mar_FB_3924_SO-DP_V02_1x1_IMG_EN_New_C-NONE_Evergreen_CTA-NONE_Angle-W-B-C_M-NONE_VL-None_G-NONE_P-OG_S-NONE,3924 - #17 man boobs/dad bod body text IMG || Batch 1 || Enhancements: OFF || CBV1 || 7C || 24/03/25w13,SHARE,$0,5,2025-03-24,2025-04-04,11
368,CB_2024_Apr_FB_2943_DT_V06_9x16_VID_EN_Opti_C-Sale_CTA-CTA_Pain-W_M-MIX_VL-45s_TR-None_G-MF_P-V2_S-WHAT_FB_2429V03,2943 - Opti PPC 2429 || Batch 1 || Enhancements: OFF || CBV2 || 7C || 25/03/25w13,VIDEO,$0,3,2025-03-24,2025-04-02,9
369,CB_2024_Apr_FB_2970_RS_V03_1x1_GIF_EN_Opti_C-WrittenTesti_CTA-CTA_Pain-W_M-NONE_VL-7s_TR-None_G-NONE_P-V2_S-NEW,2970 - XL TO M || Batch 1 || Enhancements: OFF || CBV2 || 7C || 25/03/25w13,VIDEO,$0,2,2025-03-24,2025-03-31,7
370,CB_2025_Mar_FB_3903_VK_V02_9x16_VID_EN_New_C-BulletPoints_Evergreen_CTA-65_Angle-W-B-C_M-MIX_VL-30s_G-MF_P-OG_S-WOOD,3903 - #13 My husband hides his beer belly - VK  || Batch 1 || Enhancements: OFF || CBV1 || 7C || 24/03/25w13,VIDEO,$0,3,2025-03-24,2025-04-06,13
371,CB_2025_Feb_FB_3883_LZ-RP_V01_9x16_VID_EN_Opti_C-Testimonial_Evergreen_CTA-SALE_Angle-W_M-POW_VL-45s_G-M_P-OG_S-MOON_FB3090V02,3883 - Wiiner opti man boobs t levels || Enhancements: OFF || CBV1 || Batch 1 || 7C || 10/03/25w11,VIDEO,$0,1,2025-03-10,2025-03-31,21
372,CB_2025_Mar_FB_3924_SO-DP_V05_1x1_IMG_EN_New_C-NONE_Evergreen_CTA-NONE_Angle-W-B-C_M-NONE_VL-None_G-NONE_P-OG_S-NONE,3924 - #17 man boobs/dad bod body text IMG || Batch 2 || Enhancements: OFF || CBV1 || 7C || 24/03/25w13,SHARE,$0,4,2025-03-24,2025-04-03,10
373,CB_2025_Feb_FB_3883_LZ-RP_V03_9x16_VID_EN_Opti_C-Testimonial_Evergreen_CTA-SALE_Angle-W_M-MIX_VL-30s_G-MF_P-OG_S-WHAT_FB1989V08,3883 - Wiiner opti man boobs t levels || Enhancements: OFF || CBV1 || Batch 1 || 7C || 10/03/25w11,VIDEO,$0,2,2025-03-10,2025-04-05,26
374,CB_2025_Mar_FB_3914_DT-DP_V03_9x16_VID_EN_New_C-Trend_Sale_CTA-SPRNG_Angle-W-B-C_M-JOG_VL-30s_G-F_P-OG_S-NEW,"3914 - #9 GF's POV, male confidence || Batch 1 || Enhancements: OFF || CBV1 || 7C || 24/03/25w13",VIDEO,$0,1,2025-03-24,2025-04-03,10
375,CB_2025_Mar_FB_3924_SO-DP_V07_1x1_IMG_EN_New_C-NONE_Evergreen_CTA-NONE_Angle-W-B-C_M-NONE_VL-None_G-NONE_P-OG_S-NONE,3924 - #17 man boobs/dad bod body text IMG || Batch 2 || Enhancements: OFF || CBV1 || 7C || 24/03/25w13,SHARE,$0,1,2025-03-24,2025-04-02,9
376,CB_2024_Apr_FB_2943_DT_V01_9x16_VID_EN_Opti_C-Sale_CTA-CTA_Pain-W_M-MIX_VL-45s_TR-None_G-MF_P-V2_S-WHAT_FB_2429V03,2943 - Opti PPC 2429 || Batch 1 || Enhancements: OFF || CBV2 || 7C || 25/03/25w13,VIDEO,$0,2,2025-03-24,2025-04-02,9
377,CB_2025_Mar_FB_3890_DT_V01_1x1_IMG_EN_New_C-NONE_Evergreen_CTA-None_Angle-W_M-NONE_VL-None_G-NONE_P-OG_S-NONE,3890 - Your Peak Performance in 6 weeks || Enhancements: OFF || CBV1 || Batch 1 || 7C || 10/03/25w11,SHARE,$0,1,2025-03-12,2025-03-31,19
