,Ad Name,Adset Name,Creative Type,Spend In USD,Impressions,First Ad Spend Date,Last Ad Spend Date,Days ad spending
1,CB_2024_Dec_FB_CANVA_LZ-VU_V01_1x1_IMG_EN_New_C-NegativeMark_Evergreen_CTA-NONE_Angle-Cort_M-NONE_VL-None_G-NONE_P-NONE_S-NONE.png,ðŸŒ¶ï¸ || US || ASC+ || ->CC141 || VIDEO Only || US+CA || 0% EXISTING CAP || 7C || 07/08.24  Ad set,SHARE,"$55,348","2,936,414",2024-12-30,2025-01-17,18
2,CB_2024_Dec_FB_CANVA_LZ-VU_V01_1x1_IMG_EN_New_C-NegativeMark_Evergreen_CTA-NONE_Angle-Cort_M-NONE_VL-None_G-NONE_P-NONE_S-NONE.png PAUSED,ðŸŒ¶ï¸ || US || ASC+ || ->CC141 || VIDEO Only || US+CA || 0% EXISTING CAP || 7C || 07/08.24  Ad set,SHARE,"$22,460","1,168,359",2024-12-30,2025-01-17,18
3,CB_2024_Aug_FB_3090_DT-DP_V02_9x16_VID_EN_Opti_C-MakingOf_CTA-CTA_Pain-W-B-C_M-POW_VL-45s_TR-None_G-M_P-OG_S-Moon_FB3029V04,ðŸŒ¶ï¸ || US || ASC+ || ->CC141 || VIDEO Only || US+CA || 0% EXISTING CAP || 7C || 07/08.24  Ad set,VIDEO,"$16,887","958,707",2024-08-23,2025-01-15,145
4,CB_2023_Jul_FB_2217_IB_V04_9x16_VID_EN_Opti_C-Pointing_CTA-SMR_Pain-W-B_M-TRC_VL-30s_TR-None_G-F_P-None_S-FRIGGA,ðŸŒ¶ï¸ || US || ASC+ || ->CC141 || VIDEO Only || US+CA || 0% EXISTING CAP || 7C || 07/08.24  Ad set,VIDEO,"$16,639","722,637",2024-08-07,2025-03-27,232
5,CB_2023_Oct_FB_2516_VK_V13_9x16_VID_EN_Opti_C-Benefits_CTA-AUTUM_Pain-W-B_M-PASQ_VL-30s_TR-None_G-M_P-Plan_S-WHAT,ðŸŒ¶ï¸ || US || ASC+ || ->CC141 || VIDEO Only || US+CA || 0% EXISTING CAP || 7C || 07/08.24  Ad set,VIDEO,"$14,151","684,573",2024-12-19,2025-03-27,98
6,CB_2023_May_FB_1999_LV_V01_9x16_VID_EN_New_C-Pointing_CTA-DISCOUNT_Pain-W_M-JOG_VL-30s_TR-None,ASC+ || VIDEO Only || US || 0% EXISTING CAP || 1C || 08.12.24  Ad set,VIDEO,"$14,087","537,488",2024-12-08,2025-01-27,50
7,CB_2024_Oct_FB_3296_SO_V02_1x1_IMG_EN_New_C-Sale_Sale_CTA-BF_Angle-None_M-NONE_VL-None_G-NONE_P-OG_S-NONE_FB3259V02,ðŸŒ¶ï¸ || US || ASC+ || ->CC141 || VIDEO Only || US+CA || 0% EXISTING CAP || 7C || 07/08.24  Ad set,SHARE,"$10,719","642,922",2024-11-25,2025-01-11,47
8,Dynamic_Creative_CA_Flow,WC || CA || DYNAMIC CREATIVE || ADV+ audience || 7C || 17.04.2024 || BIG BUDGET,SHARE,"$10,538","636,578",2024-04-17,2025-02-27,316
9,CB_2023_Jul_FB_2217_IB_V04_9x16_VID_EN_Opti_C-Pointing_CTA-SMR_Pain-W-B_M-TRC_VL-30s_TR-None_G-F_P-None_S-FRIGGA,ASC+ || VIDEO Only || US || 0% EXISTING CAP || 1C || 08.12.24  Ad set,VIDEO,"$10,017","336,831",2024-12-08,2025-02-05,59
10,CB_2024_Feb_FB_2812_MB-RP_V07_9x16_VID_EN_Opti_C-Sale_CTA-C65_Pain-W_M-NONE_VL-30s_TR-None_G-MF_P-Plan_S-NEW_FB2601V04_1,ASC+ || VIDEO Only || US || 0% EXISTING CAP || 1C || 08.12.24  Ad set,VIDEO,"$9,158","412,948",2024-12-19,2025-02-05,48
11,CB_2023_Jul_FB_2226_MB_V04_9x16_VID_EN_Opti_C-Testim_CTA-SMR_Pain-W_M-MIX_VL-30s_TR-None_G-F_P-None_S-Starry,ðŸŒ¶ï¸ || US || ASC+ || ->CC141 || VIDEO Only || US+CA || 0% EXISTING CAP || 7C || 07/08.24  Ad set,VIDEO,"$7,762","340,526",2024-10-28,2025-03-27,150
12,CB_2024_Dec_FB_3622_LZ-KB_V03_4x5_IMG_EN_Opti_C-NONE_Sale_CTA-XMAS_Angle-GH_M-NONE_VL-None_G-NONE_P-OG_S-NONE_FB2227V08,ðŸŒ¶ï¸ || US || ASC+ || ->CC141 || VIDEO Only || US+CA || 0% EXISTING CAP || 7C || 07/08.24  Ad set,SHARE,"$6,250","288,044",2024-12-19,2025-01-27,39
13,CB_2024_Nov_FB_3264_LZ_V31_4x5_VID_EN_Opti_C-MakingOf_Sale_CTA-BF_Angle-W-B_M-CRAZY_VL-45s_G-M_P-OG_S-NEW_FB3004V02,ðŸŒ¶ï¸ || US || ASC+ || ->CC141 || VIDEO Only || US+CA || 0% EXISTING CAP || 7C || 07/08.24  Ad set,VIDEO,"$6,081","292,174",2024-11-18,2025-01-24,67
14,DPA,ASC+ || MIX || Value Optimization || US || 0% EXISTING CAP || 1C || 22.12.24  Ad set,SHARE,"$6,010","287,380",2024-12-22,2025-01-06,15
15,CB_2024_Dec_FB_3622_LZ-KB_V03_4x5_IMG_EN_Opti_C-NONE_Sale_CTA-XMAS_Angle-GH_M-NONE_VL-None_G-NONE_P-OG_S-NONE_FB2227V08,ASC+ || MIX || Value Optimization || US || 0% EXISTING CAP || 1C || 22.12.24  Ad set,SHARE,"$5,463","156,607",2024-12-22,2025-01-03,12
16,CB_2023_May_FB_1999_LV_V01_9x16_VID_EN_New_C-Pointing_CTA-DISCOUNT_Pain-W_M-JOG_VL-30s_TR-None,ASC+ || MIX || Value Optimization || US || 0% EXISTING CAP || 1C || 22.12.24  Ad set,VIDEO,"$5,328","158,939",2024-12-22,2025-01-06,15
17,CB_2024_May_FB_3029_VK-DP_V04_9x16_VID_EN_New_C-MakingOf_CTA-CTA_Pain-W-B-C_M-CRAZY_VL-45s_TR-None_G-M_P-OG_S-NEW,ASC+ || VIDEO Only || US || 0% EXISTING CAP || 1C || 08.12.24  Ad set,VIDEO,"$4,859","251,910",2024-12-08,2025-01-09,32
18,CB_2023_May_FB_2263_MB_V04_9x16_VID_EN_New_C-Sale_CTA-SMR_Pain-W_M-JOG_VL-45s_TR-None_G-M-F_P-None_S-Moon,ðŸŒ¶ï¸ || US || ASC+ || ->CC141 || VIDEO Only || US+CA || 0% EXISTING CAP || 7C || 07/08.24  Ad set,VIDEO,"$4,838","170,651",2024-08-07,2025-03-27,232
19,Dynamic_Creative_3:2:2_Video_CA_Flow,WC || CA || DYNAMIC CREATIVE | 3:2:2 || New ads || ADV+ audience || 7C || 06.09.2024 || BIG BUDGET,SHARE,"$4,220","304,165",2024-09-08,2025-01-22,136
20,CB_2024_Dec_FB_3601_VK-DP_V09_4x5_VID_EN_Opti_C-Dance_CTA-NY_Pain-W-B_M-JOG_VL-30s_TR-None_G-F_P-OG_S-WHAT_FB3045V01,ðŸŒ¶ï¸ || US || ASC+ || ->CC141 || VIDEO Only || US+CA || 0% EXISTING CAP || 7C || 07/08.24  Ad set,VIDEO,"$3,978","141,475",2024-12-27,2025-02-14,49
21,CB_2024_Oct_FB_3251_LZ-VU_V01_1x1_IMG_EN_New_C-NegativeMark_Evergreen_CTA-NONE_Angle-Cort_M-NONE_VL-None_G-NONE_P-NONE_S-NONE.png,ðŸŒ¶ï¸ || US || ASC+ || ->CC141 || VIDEO Only || US+CA || 0% EXISTING CAP || 7C || 07/08.24  Ad set,SHARE,"$3,765","129,953",2024-10-28,2024-12-30,63
22,CB_2023_May_FB_2263_MB_V04_9x16_VID_EN_New_C-Sale_CTA-SMR_Pain-W_M-JOG_VL-45s_TR-None_G-M-F_P-None_S-Moon,CBV2 || AU || ðŸ’° Advantage+ || US || BROAD || 7C || Existing_customer_5% || 19/12/24 Ad set,VIDEO,"$3,631","136,585",2024-12-19,2025-03-27,98
23,CB_2023_May_FB_2263_MB_V04_9x16_VID_EN_New_C-Sale_CTA-SMR_Pain-W_M-JOG_VL-45s_TR-None_G-M-F_P-None_S-Moon,ASC+ || MIX || Value Optimization || US || 0% EXISTING CAP || 1C || 22.12.24  Ad set,VIDEO,"$3,412","74,912",2024-12-22,2025-01-05,14
24,CB_2024_Nov_FB_3264_LZ_V29_4x5_VID_EN_Opti_C-NegativeMark_Sale_CTA-BF_Angle-W-B_M-LRNS_VL-30s_G-M_P-OG_S-NONE,ASC+ || VIDEO Only || US || 0% EXISTING CAP || 1C || 08.12.24  Ad set,SHARE,"$3,252","117,339",2024-12-08,2025-01-27,50
25,CB_2024_Sep_FB_3175_DA-KB_V04_1x1_IMG_EN_New_C-ADVRT_Evergreen_CTA-NONE_Angle-W_M-NONE_VL-None_G-NONE_P-CBV2_S-NONE_blog_colonbroomvsmammoth_cv_en,CBV2 || A/B Pricing: increased price || 3175 - CB vs Happy Mammoth advertorial || BROAD || 1C ||  22/11/24 || Kostas,SHARE,"$3,186","113,956",2024-12-22,2025-01-22,31
26,CB_2024_Dec_FB_CANVA_LZ-VU_V01_1x1_IMG_EN_New_C-NegativeMark_Evergreen_CTA-NONE_Angle-Cort_M-NONE_VL-None_G-NONE_P-NONE_S-NONE.,CBV2 || Advantage+ || US || 5% EXISTING CAP || BROAD || 7C || 30/12/24  Campaign Ad set,SHARE,"$3,070","140,612",2024-12-30,2025-01-02,3
27,CB_2024_Dec_FB_CANVA_LZ-VU_V01_1x1_IMG_EN_New_C-NegativeMark_Evergreen_CTA-NONE_Angle-Cort_M-NONE_VL-None_G-NONE_P-NONE_S-NONE.,CBV2 || Advantage+ || Only V1 Ads || US || 5% EXISTING CAP || BROAD || 7C || 30/12/24  Campaign Ad set,SHARE,"$3,069","106,684",2024-12-30,2025-01-02,3
28,CB_2023_Oct_FB_2516_VK_V13_9x16_VID_EN_Opti_C-Benefits_CTA-AUTUM_Pain-W-B_M-PASQ_VL-30s_TR-None_G-M_P-Plan_S-WHAT,ASC+ || VIDEO Only || US || 0% EXISTING CAP || 1C || 08.12.24  Ad set,VIDEO,"$3,030","124,582",2024-12-20,2025-02-05,47
29,CB_2024_Aug_FB_3090_DT-DP_V02_9x16_VID_EN_Opti_C-MakingOf_CTA-CTA_Pain-W-B-C_M-POW_VL-45s_TR-None_G-M_P-OG_S-Moon_FB3029V04,CBV2 || Advantage+ || Only V1 Ads || US || 5% EXISTING CAP || BROAD || 7C || 30/12/24  Campaign Ad set,SHARE,"$2,999","171,095",2024-12-30,2025-01-22,23
30,CB_2024_Aug_FB_3090_DT-DP_V02_9x16_VID_EN_Opti_C-MakingOf_CTA-CTA_Pain-W-B-C_M-POW_VL-45s_TR-None_G-M_P-OG_S-Moon_FB3029V04,ASC+ || VIDEO Only || US || 0% EXISTING CAP || 1C || 08.12.24  Ad set,VIDEO,"$2,919","148,407",2024-12-08,2025-01-05,28
31,CB_2024_Dec_FB_3619_VK-JT_V02_4x5_VID_EN_New_C-BulletPoints_Sale_CTA-NY_Angle-W-B-C_M-NONE_VL-None_G-NONE_P-OG_S-NONE,3619 - CB - CRAVINGS - IMG - TESTIMONIAL || Enhancements: OFF || CBV1 || Batch 1 || 1C || 23/12/24w52 || Kostas,SHARE,"$2,907","110,650",2024-12-23,2025-01-13,21
32,CB_2023_Nov_FB_2652_DA_V10_9x16_GIF_EN_Opti_C-Sale_CTA-XMAS65_None_M-NONE_VL-7s_TR-None_G-NONE_P-OG_S-NEW_FB2396V01,ðŸ’°WC || US || Advantage+ || BIG BUDGET || CC101->105->109->112->114-116 || BROAD || ABO || 1C || 17/01/24 RELAUNCHED Ad set,VIDEO,"$2,504","88,843",2024-01-17,2025-01-04,353
33,CB_2024_Oct_FB_3296_SO_V02_1x1_IMG_EN_New_C-Sale_Sale_CTA-BF_Angle-None_M-NONE_VL-None_G-NONE_P-OG_S-NONE_FB3259V02,ASC+ || MIX || Value Optimization || US || 0% EXISTING CAP || 1C || 22.12.24  Ad set,SHARE,"$2,431","84,184",2024-12-22,2025-01-06,15
34,CB_2023_Jul_FB_2217_IB_V04_9x16_VID_EN_Opti_C-Pointing_CTA-SMR_Pain-W-B_M-TRC_VL-30s_TR-None_G-F_P-None_S-FRIGGA,CBV2 || AU || ðŸ’° Advantage+ || US || BROAD || 7C || Existing_customer_5% || 19/12/24 Ad set,VIDEO,"$2,420","117,893",2024-12-19,2025-03-24,95
35,CB_2024_Oct_FB_3252_VK-DP_V04_4x5_VID_EN_Opti_C-MakingOf_Evergreen_CTA-SALE_Angle-W-B-C_M-JOG_VL-45s_G-F_P-OG_S-MOON_FB3090V02,ASC+ || VIDEO Only || US || 0% EXISTING CAP || 1C || 08.12.24  Ad set,SHARE,"$2,380","74,694",2024-12-08,2025-01-09,32
36,CB_2023_Dec_FB_2712_RS-DP_V02_1x1_VID_EN_Opti_C-WrittenTesti_CTA-SALE_Pain-W-B-C_M-NONE_VL-None_TR-None_G-NONE_P-V2_S-NONE_FB2227V08,CBV2 || AU || ðŸ’° Advantage+ || US || BROAD || 7C || Existing_customer_5% || 19/12/24 Ad set,SHARE,"$2,222","120,894",2024-12-19,2025-03-27,98
37,CB_2024_Dec_FB_3601_VK-DP_V09_4x5_VID_EN_Opti_C-Dance_CTA-NY_Pain-W-B_M-JOG_VL-30s_TR-None_G-F_P-OG_S-WHAT_FB3045V01,CBV2 || EU (UK) || ðŸ’° Advantage+ || US || BROAD || 7C || Existing_customer_5% || 15/12/24 Ad set,VIDEO,"$2,212","81,575",2024-12-27,2025-01-15,19
38,CB_2024_Oct_PIN_30_KB_V20_2x3_IMG_EN_Opti_C-Benefits_CTA-NONE_Angle-W_M-NONE_VL-None_TR-None_G-NONE_P-OG_S-NONE,US || 3rd party page: Personal Coach Nicole || Static || Batch 3 || 1C || 30/12/24,SHARE,"$2,157","102,080",2024-12-30,2025-01-06,7
39,CB_2023_Nov_FB_2649_VK_V06_9x16_VID_EN_Opti_C-Sale_CTA-C65_Pain-W_M-NONE_VL-30s_TR-None_G-MF_P-Plan_S-NEW_FB2601V04,ðŸ’°WC || US || Advantage+ || BIG BUDGET || CC101->105->109->112->114-116 || BROAD || ABO || 1C || 17/01/24 RELAUNCHED Ad set,VIDEO,"$2,145","115,074",2024-01-17,2025-02-06,386
40,CB_2023_May_FB_2263_MB_V04_9x16_VID_EN_New_C-Sale_CTA-SMR_Pain-W_M-JOG_VL-45s_TR-None_G-M-F_P-None_S-Moon,ASC+ || VIDEO Only || US || 0% EXISTING CAP || 1C || 08.12.24  Ad set,VIDEO,"$2,058","64,153",2024-12-08,2025-01-20,43
41,CB_2024_Nov_FB_3353_VK-DP_V10_4x5_IMG_EN_New_C-BulletPoints_Sale_CTA-BF70_Angle-W-B-C_M-NONE_VL-None_G-NONE_P-OG_S-NONE,3353 - NEW IDEA_ plan for age group - DP || Enhancements: OFF || CBV1 || Batch 3 || 7C || 10/12/24w50 || Kostas,SHARE,"$1,965","89,857",2024-12-10,2025-01-04,25
42,CB_2023_May_FB_2263_MB_V04_9x16_VID_EN_New_C-Sale_CTA-SMR_Pain-W_M-JOG_VL-45s_TR-None_G-M-F_P-None_S-Moon,CBV2 || EU (UK) || ðŸ’° Advantage+ || US || BROAD || 7C || Existing_customer_5% || 15/12/24 Ad set,VIDEO,"$1,915","75,068",2024-12-19,2025-01-17,29
43,CB_2023_May_FB_2103_MB_V02_9x16_VID_EN_Opti_C-Sale_CTA-SMR_Pain-W_M-JOG_VL-30s_TR-None_G-M-F_P-None_S-What,US || COST CAP 131->111->115 || Max excl. || 7C || 04/12/24,VIDEO,"$1,865","59,399",2024-12-03,2025-01-02,30
44,CB_2024_Sep_FB_3175_DA-KB_V01_1x1_IMG_EN_New_C-ADVRT_Evergreen_CTA-NONE_Angle-W_M-NONE_VL-None_G-NONE_P-CBV2_S-NONE_blog_colonbroomvsmammoth_cv_en,CBV2 || A/B Pricing: increased price || 3175 - CB vs Happy Mammoth advertorial || BROAD || 1C ||  22/11/24 || Kostas,SHARE,"$1,760","81,402",2024-12-22,2025-01-22,31
45,CB_2024_Dec_FB_3592_VK-DP_V10_4x5_VID_EN_New_C-BulletPoints_Sale_CTA-SALE_Angle-W-B-C_M-NONE_VL-30s_G-F_P-OG_S-NEW - Copy,ðŸŒ¶ï¸ || US || ASC+ || ->CC141 || VIDEO Only || US+CA || 0% EXISTING CAP || 7C || 07/08.24  Ad set,VIDEO,"$1,727","84,849",2024-12-21,2025-03-27,96
46,CB_2023_Aug_FB_2295_MB_V01_1x1_VID_EN_Opti_C-GIF_CTA-CTA_Pain-W-B_M-None_VL-10s_TR-None_G-None_P-None_S-None,CA || COST CAP 92->93 || 7C || 10/05/24 || V1,VIDEO,"$1,717","121,814",2024-05-10,2025-02-27,293
47,CB_2024_Dec_FB_3601_VK-DP_V09_4x5_VID_EN_Opti_C-Dance_CTA-NY_Pain-W-B_M-JOG_VL-30s_TR-None_G-F_P-OG_S-WHAT_FB3045V01,ASC+ || NYNM ðŸŽ† || US || 0% EXISTING CAP || 1C || 31.12.24 Ad set,VIDEO,"$1,710","50,757",2024-12-31,2025-01-02,2
48,CB_2024_Oct_PIN_30_KB_V19_2x3_IMG_EN_Opti_C-Benefits_CTA-NONE_Angle-W_M-NONE_VL-None_TR-None_G-NONE_P-OG_S-NONE,US || 3rd party page: Personal Coach Nicole || Static || Batch 3 || 1C || 30/12/24,SHARE,"$1,707","85,112",2024-12-30,2025-01-05,6
49,CB_2024_Sep_FB_3175_DA-KB_V04_1x1_IMG_EN_New_C-ADVRT_Evergreen_CTA-NONE_Angle-W_M-NONE_VL-None_G-NONE_P-CBV2_S-NONE_blog_colonbroomvsmammoth_cv_en,ðŸ“š US+CA || ASC+ || Advertorials || 7C || 15/10.24 Ad set,SHARE,"$1,612","79,357",2024-10-15,2024-12-31,77
50,CB_2024_Aug_FB_3090_DT-DP_V02_9x16_VID_EN_Opti_C-MakingOf_CTA-CTA_Pain-W-B-C_M-POW_VL-45s_TR-None_G-M_P-OG_S-Moon_FB3029V04,CBV2 || EU (UK) || ðŸ’° Advantage+ || US || BROAD || 7C || Existing_customer_5% || 15/12/24 Ad set,SHARE,"$1,570","95,204",2024-12-19,2025-03-27,98
51,CB_2024_Aug_FB_3090_DT-DP_V02_9x16_VID_EN_Opti_C-MakingOf_CTA-CTA_Pain-W-B-C_M-POW_VL-45s_TR-None_G-M_P-OG_S-Moon_FB3029V04,CBV2 || AU || ðŸ’° Advantage+ || US || BROAD || 7C || Existing_customer_5% || 19/12/24 Ad set,SHARE,"$1,450","64,525",2024-12-19,2025-01-17,29
52,CB_2024_Nov_FB_3305_SO-DP_V02_4x5_VID_EN_Opti_C-Sale_CTA-BF_Pain-W_M-Chris_VL-30s_TR-None_G-MF_P-Plan_S-NEW_FB2601V07,ðŸŒ¶ï¸ || US || ASC+ || ->CC141 || VIDEO Only || US+CA || 0% EXISTING CAP || 7C || 07/08.24  Ad set,VIDEO,"$1,423","61,334",2024-11-25,2025-01-15,51
53,CB_2023_Jul_FB_2226_MB_V04_9x16_VID_EN_Opti_C-Testim_CTA-SMR_Pain-W_M-MIX_VL-30s_TR-None_G-F_P-None_S-Starry,ASC+ || VIDEO Only || US || 0% EXISTING CAP || 1C || 08.12.24  Ad set,VIDEO,"$1,419","44,773",2024-12-08,2025-01-09,32
54,CB_2024_Dec_FB_3601_VK-DP_V09_4x5_VID_EN_Opti_C-Dance_CTA-NY_Pain-W-B_M-JOG_VL-30s_TR-None_G-F_P-OG_S-WHAT_FB3045V01 - Copy,CBV2 || AU || ðŸ’° Advantage+ || US || BROAD || 7C || Existing_customer_5% || 19/12/24 Ad set,VIDEO,"$1,292","53,132",2024-12-27,2025-01-03,7
55,CB_2024_Oct_PIN_30_KB_V18_2x3_IMG_EN_Opti_C-Benefits_CTA-NONE_Angle-W_M-NONE_VL-None_TR-None_G-NONE_P-OG_S-NONE,US || 3rd party page: Personal Coach Nicole || Static || Batch 3 || 1C || 30/12/24,SHARE,"$1,290","70,820",2024-12-30,2025-01-06,7
56,CB_2024_Oct_FB_3251_LZ-VU_V01_1x1_IMG_EN_New_C-NegativeMark_Evergreen_CTA-NONE_Angle-Cort_M-NONE_VL-None_G-NONE_P-NONE_S-NONE,UK || ASC+ || 7DC || Existing 10% || 13.11.2024 Ad set,SHARE,"$1,257","44,961",2024-11-13,2025-01-16,64
57,CB_2024_Oct_PIN_30_KB_V10_2x3_IMG_EN_Opti_C-NONE_CTA-NONE_None_M-NONE_VL-None_TR-None_G-NONE_P-OG_S-NONE,US || 3rd party page: Personal Coach Nicole || Static || Batch 2 || 1C || 30/12/24,SHARE,"$1,256","58,667",2024-12-30,2025-01-02,3
58,CB_2024_Dec_FB_3637_CHUB_V02_1x1_IMG_EN_New_C-Headline_CTA-SALE_Angle-W_M-NONE_VL-None_TR-None_G-NONE_P-NONE_S-NONE,3637 CHUB â€“ Hipno Event || Enhancements: OFF || CBV1 || Batch 1 || 1C || 30/12/24w01 || Kostas,SHARE,"$1,254","38,434",2024-12-30,2025-01-06,7
59,IMG_3513,EU (UK) || 3rd party page: Fitness Coach Nicole || Organic Ads || Batch 1 || 1C || 17/12/2024,SHARE,"$1,230","68,262",2024-12-17,2025-01-01,15
60,CB_2024_Jan_FB_2762_IK_V05_1x1_IMG_EN_New_C-WrittenTesti_CTA-CTA_Pain-W-B-C_M-NONE_VL-None_TR-None_G-NONE_P-V2_S-NONE,CBV2 || Advantage+ || Only V1 Ads || US || 5% EXISTING CAP || BROAD || 7C || 30/12/24  Campaign Ad set,SHARE,"$1,226","53,569",2024-12-30,2025-01-04,5
61,CB_2024_Feb_FB_KB_V06_1x1_IMG_EN_Opti_C-SingleTesti_CTA-NONE_Pain-W_M-NONE_VL-None_TR-None_G-NONE_P-ORG_S-NONE,US || 3rd party page: Matthew || Static || Batch 1 || 1C || 30/12/24,SHARE,"$1,216","43,138",2024-12-30,2025-01-02,3
62,CB_2024_Dec_FB_3601_VK-DP_V09_4x5_VID_EN_Opti_C-Dance_CTA-NY_Pain-W-B_M-JOG_VL-30s_TR-None_G-F_P-OG_S-WHAT_FB3045V01,3601 - New footage new actors opti (Manuel GRIDBANK) || Enhancements: OFF || CBV1 || Batch 3 || 1C || 22/12/24w52 || Valentinas,SHARE,"$1,206","35,621",2024-12-22,2025-01-02,11
63,CB_2024_Oct_FB_3252_VK-DP_V04_4x5_VID_EN_Opti_C-MakingOf_Evergreen_CTA-SALE_Angle-W-B-C_M-JOG_VL-45s_G-F_P-OG_S-MOON_FB3090V02,ðŸŒ¶ï¸ || US || ASC+ || ->CC141 || VIDEO Only || US+CA || 0% EXISTING CAP || 7C || 07/08.24  Ad set,VIDEO,"$1,179","46,429",2024-11-07,2025-03-27,140
64,CB_2023_Jul_FB_2217_IB_V04_9x16_VID_EN_Opti_C-Pointing_CTA-SMR_Pain-W-B_M-TRC_VL-30s_TR-None_G-F_P-None_S-FRIGGA,CBV2 || EU (UK) || ðŸ’° Advantage+ || US || BROAD || 7C || Existing_customer_5% || 15/12/24 Ad set,VIDEO,"$1,152","68,883",2024-12-18,2025-03-27,99
65,CB_2023_Dec_FB_2712_RS-DP_V02_1x1_VID_EN_Opti_C-WrittenTesti_CTA-SALE_Pain-W-B-C_M-NONE_VL-None_TR-None_G-NONE_P-V2_S-NONE_FB2227V08,CBV2 || EU (UK) || ðŸ’° Advantage+ || US || BROAD || 7C || Existing_customer_5% || 15/12/24 Ad set,SHARE,"$1,143","46,079",2024-12-15,2025-03-27,102
66,CB_2024_Nov_FB_3264_LZ_V31_4x5_VID_EN_Opti_C-MakingOf_Sale_CTA-BF_Angle-W-B_M-CRAZY_VL-45s_G-M_P-OG_S-NEW_FB3004V02,ASC+ || MIX || Value Optimization || US || 0% EXISTING CAP || 1C || 22.12.24  Ad set,VIDEO,"$1,141","26,462",2024-12-22,2025-01-06,15
67,CB_2023_Jul_FB_2217_IB_V04_9x16_VID_EN_Opti_C-Pointing_CTA-SMR_Pain-W-B_M-TRC_VL-30s_TR-None_G-F_P-None_S-FRIGGA,US || 3rd party page: Personal Coach Nicole || Video || Batch 1 || 1C || 30/12/24,VIDEO,"$1,110","38,284",2024-12-31,2025-01-02,2
68,CB_2024_Nov_FB_3353_VK-DP_V10_4x5_IMG_EN_New_C-BulletPoints_Sale_CTA-BF70_Angle-W-B-C_M-NONE_VL-None_G-NONE_P-OG_S-NONE,ASC+ || MIX || Value Optimization || US || 0% EXISTING CAP || 1C || 22.12.24  Ad set,SHARE,"$1,097","43,878",2024-12-31,2025-01-06,6
69,CB_2022_Nov_FB_1197_IK_V03_1x1_IMG_EN_New_C-Sale_CTA-SALE_Pain-W_M-NONE_VL-None_TR-None_M-VON,ðŸŒ¶ï¸ || US || ASC+ || ->CC141 || VIDEO Only || US+CA || 0% EXISTING CAP || 7C || 07/08.24  Ad set,SHARE,"$1,091","35,883",2024-11-08,2025-01-15,68
70,CB_2023_Jul_FB_2217_IB_V04_9x16_VID_EN_Opti_C-Pointing_CTA-SMR_Pain-W-B_M-TRC_VL-30s_TR-None_G-F_P-None_S-FRIGGA,UK || ASC+ || 7DC || Existing 10% || 13.11.2024 Ad set,VIDEO,"$1,063","60,358",2024-11-13,2025-01-16,64
71,CB_2024_Nov_FB_3264_LZ_V31_4x5_VID_EN_Opti_C-MakingOf_Sale_CTA-BF_Angle-W-B_M-CRAZY_VL-45s_G-M_P-OG_S-NEW_FB3004V02,ASC+ || VIDEO Only || US || 0% EXISTING CAP || 1C || 08.12.24  Ad set,VIDEO,"$1,036","35,385",2024-12-08,2025-02-05,59
72,CB_2024_Sep_FB_3175_DA-KB_V04_1x1_IMG_EN_New_C-ADVRT_Evergreen_CTA-NONE_Angle-W_M-NONE_VL-None_G-NONE_P-CBV2_S-NONE_blog_colonbroomvsmammoth_cv_en,CBV2 || A/B Pricing: Standard || 3175 - CB vs Happy Mammoth advertorial || BROAD || 1C ||  22/11/24 || Kostas,SHARE,"$1,027","33,433",2024-12-22,2025-01-13,22
73,CB_2024_Dec_FB_3639_CHUB_V03_1x1_IMG_EN_New_C-NONE_CTA-NONE_Angle-W_M-NONE_VL-None_TR-None_G-NONE_P-NONE_S-NONE,3639 CHUB â€“ Looking 15 people || Enhancements: OFF || CBV1 || Batch 1 || 1C || 30/12/24w01 || Kostas,SHARE,"$1,001","48,514",2024-12-30,2025-01-06,7
74,CB_2023_Dec_FB_2712_RS-DP_V02_1x1_VID_EN_Opti_C-WrittenTesti_CTA-SALE_Pain-W-B-C_M-NONE_VL-None_TR-None_G-NONE_P-V2_S-NONE_FB2227V08,UK || ASC+ || 7DC || Existing 10% || 13.11.2024 Ad set,SHARE,$987,"45,299",2024-11-13,2025-01-16,64
75,CB_2023_Jul_FB_2217_IB_V04_9x16_VID_EN_Opti_C-Pointing_CTA-SMR_Pain-W-B_M-TRC_VL-30s_TR-None_G-F_P-None_S-FRIGGA,US || COST CAP 131->111->115 || Max excl. || 7C || 04/12/24,VIDEO,$948,"33,703",2024-12-03,2025-01-02,30
76,CB_2023_Dec_FB_2712_RS-DP_V02_1x1_VID_EN_Opti_C-WrittenTesti_CTA-SALE_Pain-W-B-C_M-NONE_VL-None_TR-None_G-NONE_P-V2_S-NONE_FB2227V08,CBV2 || NZ || ðŸ’° Advantage+ || US || BROAD || 7C || Existing_customer_5% || 19/12/24 Campaign Ad set,SHARE,$916,"72,130",2024-12-19,2025-01-11,23
77,CB_2024_Aug_FB_3090_DT-DP_V02_9x16_VID_EN_Opti_C-MakingOf_CTA-CTA_Pain-W-B-C_M-POW_VL-45s_TR-None_G-M_P-OG_S-Moon_FB3029V04,US || COST CAP 131->111->115 || Max excl. || 7C || 04/12/24,VIDEO,$884,"35,086",2024-12-03,2025-01-02,30
78,CB_2023_May_FB_1999_LV_V01_9x16_VID_EN_New_C-Pointing_CTA-DISCOUNT_Pain-W_M-JOG_VL-30s_TR-None,View Content || BROAD || 7C || 17/12/24,VIDEO,$883,"92,962",2024-12-17,2025-01-20,34
79,CB_2023_May_FB_2263_MB_V04_9x16_VID_EN_New_C-Sale_CTA-SMR_Pain-W_M-JOG_VL-45s_TR-None_G-M-F_P-None_S-Moon,CBV2 || NZ || ðŸ’° Advantage+ || US || BROAD || 7C || Existing_customer_5% || 19/12/24 Campaign Ad set,VIDEO,$852,"56,024",2024-12-19,2025-01-11,23
80,CB_2024_Aug_FB_3090_DT-DP_V02_9x16_VID_EN_Opti_C-MakingOf_CTA-CTA_Pain-W-B-C_M-POW_VL-45s_TR-None_G-M_P-OG_S-Moon_FB3029V04,CBV2 || EU (DE) || ðŸ’° Advantage+ || US || BROAD || 7C || Existing_customer_5% || 29/12/24 Ad set,SHARE,$801,"51,257",2024-12-29,2025-01-02,4
81,CB_2024_Nov_FB_3264_LZ_V29_4x5_VID_EN_Opti_C-NegativeMark_Sale_CTA-BF_Angle-W-B_M-LRNS_VL-30s_G-M_P-OG_S-NONE,ASC+ || MIX || Value Optimization || US || 0% EXISTING CAP || 1C || 22.12.24  Ad set,VIDEO,$788,"22,978",2024-12-22,2025-01-01,10
82,CB_2023_May_FB_2263_MB_V04_9x16_VID_EN_New_C-Sale_CTA-SMR_Pain-W_M-JOG_VL-45s_TR-None_G-M-F_P-None_S-Moon - Copy,CBV2 || EU (DE) || ðŸ’° Advantage+ || US || BROAD || 7C || Existing_customer_5% || 29/12/24 Ad set,VIDEO,$786,"32,467",2024-12-29,2025-01-02,4
83,CB_2024_Oct_FB_3264_LZ_V15_4x5_VID_EN_Opti_C-MakingOf_Sale_CTA-BF_Angle-W-B_M-AGR_VL-30s_G-M_P-OG_S-WHAT_FB3005V02,UK || ASC+ || 7DC || Existing 10% || 13.11.2024 Ad set,SHARE,$769,"36,783",2024-11-13,2025-01-16,64
84,CB_2024_Oct_FB_3252_VK-DP_V04_4x5_VID_EN_Opti_C-MakingOf_Evergreen_CTA-SALE_Angle-W-B-C_M-JOG_VL-45s_G-F_P-OG_S-MOON_FB3090V02,UK || ASC+ || 7DC || Existing 10% || 13.11.2024 Ad set,SHARE,$744,"40,885",2024-11-13,2025-01-16,64
85,CB_2024_Dec_FB_3590_LZ-KB_V09_4x5_IMG_EN_Opti_C-Headline_Sale_CTA-NY_Angle-SC_M-NONE_VL-None_G-NONE_P-NONE_S-NONE_FB2227V08,3590 - CB - IMG - NOTION _ #53 New year - same me 2 || Enhancements: OFF || CBV1 || Batch 3 || 1C || 28/12/24w52 || Kostas,SHARE,$735,"20,606",2024-12-28,2025-01-02,5
86,CB_2023_Jul_FB_2217_IB_V04_9x16_VID_EN_Opti_C-Pointing_CTA-SMR_Pain-W-B_M-TRC_VL-30s_TR-None_G-F_P-None_S-FRIGGA,CBV2 || Advantage+ || Only V1 Ads || US || 5% EXISTING CAP || BROAD || 7C || 30/12/24  Campaign Ad set,VIDEO,$732,"30,621",2024-12-30,2025-01-22,23
87,CB_2024_Dec_FB_3601_VK-DP_V09_4x5_VID_EN_Opti_C-Dance_CTA-NY_Pain-W-B_M-JOG_VL-30s_TR-None_G-F_P-OG_S-WHAT_FB3045V01,ASC+ || VIDEO Only || US || 0% EXISTING CAP || 1C || 08.12.24  Ad set,VIDEO,$711,"19,400",2024-12-25,2025-02-05,42
88,CB_2024_Dec_FB_3619_VK-JT_V02_4x5_VID_EN_New_C-BulletPoints_Sale_CTA-NY_Angle-W-B-C_M-NONE_VL-None_G-NONE_P-OG_S-NONE,ðŸŒ¶ï¸ || US || ASC+ || ->CC141 || VIDEO Only || US+CA || 0% EXISTING CAP || 7C || 07/08.24  Ad set,SHARE,$704,"37,505",2024-12-27,2025-03-27,90
89,CB_2024_Sep_FB_3175_DA-KB_V03_1x1_IMG_EN_New_C-ADVRT_Evergreen_CTA-NONE_Angle-W_M-NONE_VL-None_G-NONE_P-CBV2_S-NONE_blog_colonbroomvsmammoth_cv_en,CBV2 || A/B Pricing: increased price || 3175 - CB vs Happy Mammoth advertorial || BROAD || 1C ||  22/11/24 || Kostas,SHARE,$631,"19,241",2024-12-22,2025-01-22,31
90,CB_2024_Aug_FB_3090_DT-DP_V02_9x16_VID_EN_Opti_C-MakingOf_CTA-CTA_Pain-W-B-C_M-POW_VL-45s_TR-None_G-M_P-OG_S-Moon_FB3029V04,ASC+ || MIX || Value Optimization || US || 0% EXISTING CAP || 1C || 22.12.24  Ad set,VIDEO,$620,"23,397",2024-12-22,2024-12-30,8
91,CB_2024_Dec_FB_3648_DT_V02_16x9_IMG_EN_Opti_C-NONE_Evergreen_CTA-NONE_Angle-None_M-NONE_VL-None_G-NONE_P-OG_S-NONE.png,US || VSL || 3648 - VSL static opti || Landing: Pre-1(New lead) -> Old lead || 1C || 31/12/24,SHARE,$612,"24,458",2024-12-31,2025-01-06,6
92,CB_2024_Nov_FB_3264_LZ_V31_4x5_VID_EN_Opti_C-MakingOf_Sale_CTA-BF_Angle-W-B_M-CRAZY_VL-45s_G-M_P-OG_S-NEW_FB3004V02,CBV2 || AU || ðŸ’° Advantage+ || US || BROAD || 7C || Existing_customer_5% || 19/12/24 Ad set,VIDEO,$584,"23,793",2024-12-19,2025-03-27,98
93,CB_2024_Jan_FB_2762_IK_V05_1x1_IMG_EN_New_C-WrittenTesti_CTA-CTA_Pain-W-B-C_M-NONE_VL-None_TR-None_G-NONE_P-V2_S-NONE,CBV2 || EU (UK) || ðŸ’° Advantage+ || US || BROAD || 7C || Existing_customer_5% || 15/12/24 Ad set,SHARE,$570,"21,744",2024-12-15,2025-03-27,102
94,CB_2024_Feb_FB_2812_MB-RP_V07_9x16_VID_EN_Opti_C-Sale_CTA-C65_Pain-W_M-NONE_VL-30s_TR-None_G-MF_P-Plan_S-NEW_FB2601V04_1,CBV2 || EU (DE) || ðŸ’° Advantage+ || US || BROAD || 7C || Existing_customer_5% || 29/12/24 Ad set,SHARE,$566,"28,502",2024-12-29,2025-01-02,4
95,CB_2023_Jul_FB_2217_IB_V04_9x16_VID_EN_Opti_C-Pointing_CTA-SMR_Pain-W-B_M-TRC_VL-30s_TR-None_G-F_P-None_S-FRIGGA,ðŸ’°WC || US || Advantage+ || BIG BUDGET || CC101->105->109->112->114-116 || BROAD || ABO || 1C || 17/01/24 RELAUNCHED Ad set,VIDEO,$566,"24,609",2024-01-17,2025-02-06,386
96,CB_2023_Jul_FB_2217_IB_V04_9x16_VID_EN_Opti_C-Pointing_CTA-SMR_Pain-W-B_M-TRC_VL-30s_TR-None_G-F_P-None_S-FRIGGA,CBV2 || NZ || ðŸ’° Advantage+ || US || BROAD || 7C || Existing_customer_5% || 19/12/24 Campaign Ad set,VIDEO,$545,"42,063",2024-12-19,2025-01-11,23
97,CB_2023_Jul_FB_2217_IB_V04_9x16_VID_EN_Opti_C-Pointing_CTA-SMR_Pain-W-B_M-TRC_VL-30s_TR-None_G-F_P-None_S-FRIGGA,CBV2 || Advantage+ || US || 5% EXISTING CAP || BROAD || 7C || 30/12/24  Campaign Ad set,VIDEO,$532,"22,091",2024-12-30,2025-01-02,3
98,CB_2023_Nov_FB_2649_VK_V06_9x16_VID_EN_Opti_C-Sale_CTA-C65_Pain-W_M-NONE_VL-30s_TR-None_G-MF_P-Plan_S-NEW_FB2601V04,ðŸ’°WC || US || Advantage+ || BIG BUDGET || CC101->105->109->112->114-116->117 || BROAD || ABO || 1C || 17/01/24 RELAUNCHED Ad set,VIDEO,$528,"26,617",2024-01-17,2025-02-06,386
99,CB_2024_Jan_FB_2762_IK_V05_1x1_IMG_EN_New_C-WrittenTesti_CTA-CTA_Pain-W-B-C_M-NONE_VL-None_TR-None_G-NONE_P-V2_S-NONE,CBV2 || AU || ðŸ’° Advantage+ || US || BROAD || 7C || Existing_customer_5% || 19/12/24 Ad set,SHARE,$518,"20,621",2024-12-19,2025-01-20,32
100,CB_2024_Jan_FB_2762_IK_V05_1x1_IMG_EN_New_C-WrittenTesti_CTA-CTA_Pain-W-B-C_M-NONE_VL-None_TR-None_G-NONE_P-V2_S-NONE,CBV2 || Advantage+ || US || 5% EXISTING CAP || BROAD || 7C || 30/12/24  Campaign Ad set,SHARE,$512,"19,786",2024-12-30,2025-01-02,3
101,CB_2024_Oct_FB_3269_LZ-VU_V01_1x1_IMG_EN_Opti_C-Headline_Sale_CTA-BF_Angle-None_M-NONE_VL-None_G-NONE_P-NONE_S-NONE_FB3251V02.png,ðŸŒ¶ï¸ || US || ASC+ || ->CC141 || VIDEO Only || US+CA || 0% EXISTING CAP || 7C || 07/08.24  Ad set,SHARE,$511,"19,207",2024-11-07,2025-01-15,69
102,CB_2024_Dec_FB_3601_VK-DP_V09_4x5_VID_EN_Opti_C-Dance_CTA-NY_Pain-W-B_M-JOG_VL-30s_TR-None_G-F_P-OG_S-WHAT_FB3045V01 - Copy,ASC+ || MIX || Value Optimization || US || 0% EXISTING CAP || 1C || 22.12.24  Ad set,VIDEO,$492,"6,690",2024-12-27,2025-01-06,10
103,CB_2024_Oct_PIN_30_KB_V21_2x3_IMG_EN_Opti_C-Benefits_CTA-NONE_Angle-W_M-NONE_VL-None_TR-None_G-NONE_P-OG_S-NONE,US || 3rd party page: Personal Coach Nicole || Static || Batch 3 || 1C || 30/12/24,SHARE,$491,"21,715",2024-12-30,2025-01-06,7
104,CB_2024_Nov_FB_3305_SO-DP_V02_4x5_VID_EN_Opti_C-Sale_CTA-BF_Pain-W_M-Chris_VL-30s_TR-None_G-MF_P-Plan_S-NEW_FB2601V07,CBV2 || AU || ðŸ’° Advantage+ || US || BROAD || 7C || Existing_customer_5% || 19/12/24 Ad set,VIDEO,$481,"18,067",2024-12-19,2025-03-27,98
105,CB_2023_Dec_FB_2712_RS-DP_V02_1x1_VID_EN_Opti_C-WrittenTesti_CTA-SALE_Pain-W-B-C_M-NONE_VL-None_TR-None_G-NONE_P-V2_S-NONE_FB2227V08,CBV2 || EU (DE) || ðŸ’° Advantage+ || US || BROAD || 7C || Existing_customer_5% || 29/12/24 Ad set,SHARE,$474,"18,108",2024-12-29,2025-01-02,4
106,CB_2024_Nov_FB_3305_SO-DP_V02_4x5_VID_EN_Opti_C-Sale_CTA-BF_Pain-W_M-Chris_VL-30s_TR-None_G-MF_P-Plan_S-NEW_FB2601V07,ASC+ || MIX || Value Optimization || US || 0% EXISTING CAP || 1C || 22.12.24  Ad set,VIDEO,$462,"9,755",2024-12-22,2025-01-03,12
107,CB_2024_Dec_FB_3601_VK-DP_V09_4x5_VID_EN_Opti_C-Dance_CTA-NY_Pain-W-B_M-JOG_VL-30s_TR-None_G-F_P-OG_S-WHAT_FB3045V01,CBV2 || NZ || ðŸ’° Advantage+ || US || BROAD || 7C || Existing_customer_5% || 19/12/24 Campaign Ad set,VIDEO,$455,"27,929",2024-12-27,2025-01-11,15
108,CB_2023_Jul_FB_2217_IB_V04_9x16_VID_EN_Opti_C-Pointing_CTA-SMR_Pain-W-B_M-TRC_VL-30s_TR-None_G-F_P-None_S-FRIGGA - Copy,CBV2 || EU (DE) || ðŸ’° Advantage+ || US || BROAD || 7C || Existing_customer_5% || 29/12/24 Ad set,VIDEO,$435,"24,422",2024-12-29,2025-01-02,4
109,CB_2024_Aug_FB_3090_DT-DP_V02_9x16_VID_EN_Opti_C-MakingOf_CTA-CTA_Pain-W-B-C_M-POW_VL-45s_TR-None_G-M_P-OG_S-Moon_FB3029V04,CBV2 || Advantage+ || US || 5% EXISTING CAP || BROAD || 7C || 30/12/24  Campaign Ad set,SHARE,$422,"19,717",2024-12-30,2025-01-02,3
110,CB_2024_Dec_FB_3582_LZ-KB_V11_4x5_IMG_EN_New_C-Headline_Evergreen_CTA-NONE_Angle-ADVTR_M-NONE_VL-None_G-NONE_P-NONE_S-NONE,CBV2 || LP:HI 3582 - secret behind the label advertorial ads || Batch 3 || BROAD || 1C ||  03/01/25 || Kostas,SHARE,$418,"5,569",2025-01-03,2025-01-06,3
111,CB_2024_Sep_FB_3175_DA-KB_V03_1x1_IMG_EN_New_C-ADVRT_Evergreen_CTA-NONE_Angle-W_M-NONE_VL-None_G-NONE_P-CBV2_S-NONE_blog_colonbroomvsmammoth_cv_en,CBV2 || A/B Pricing: Standard || 3175 - CB vs Happy Mammoth advertorial || BROAD || 1C ||  22/11/24 || Kostas,SHARE,$414,"12,393",2024-12-22,2025-01-13,22
112,20230907_101759,AU || 3rd party page: Fitness Coach Nicole || Organic Ads || Batch 1 || 1C || 03/01/2025,SHARE,$383,"16,000",2025-01-03,2025-01-09,6
113,CB_2024_Dec_FB_3648_DT_V01_16x9_IMG_EN_Opti_C-NONE_Evergreen_CTA-NONE_Angle-None_M-NONE_VL-None_G-NONE_P-OG_S-NONE.png,US || VSL || 3648 - VSL static opti || Landing: Pre-1(New lead) -> Old lead || 1C || 31/12/24,SHARE,$377,"18,787",2024-12-31,2025-01-01,1
114,CB_2024_Dec_FB_3601_VK-DP_V09_4x5_VID_EN_Opti_C-Dance_CTA-NY_Pain-W-B_M-JOG_VL-30s_TR-None_G-F_P-OG_S-WHAT_FB3045V01 - Copy,CBV2 || EU (UK) || ðŸ’° Advantage+ || US || BROAD || 7C || Existing_customer_5% || 15/12/24 Ad set,SHARE,$362,"16,521",2024-12-30,2025-01-11,12
115,CB_2024_Nov_FB_3264_LZ_V31_4x5_VID_EN_Opti_C-MakingOf_Sale_CTA-BF_Angle-W-B_M-CRAZY_VL-45s_G-M_P-OG_S-NEW_FB3004V02,CBV2 || EU (UK) || ðŸ’° Advantage+ || US || BROAD || 7C || Existing_customer_5% || 15/12/24 Ad set,VIDEO,$362,"17,083",2024-12-19,2025-03-27,98
116,CB_2023_Jul_FB_2226_MB_V04_9x16_VID_EN_Opti_C-Testim_CTA-SMR_Pain-W_M-MIX_VL-30s_TR-None_G-F_P-None_S-Starry,View Content || BROAD || 7C || 17/12/24,VIDEO,$361,"39,947",2024-12-17,2025-01-20,34
117,CB_2023_May_FB_2263_MB_V04_9x16_VID_EN_New_C-Sale_CTA-SMR_Pain-W_M-JOG_VL-45s_TR-None_G-M-F_P-None_S-Moon,US || COST CAP 131->111->115 || Max excl. || 7C || 04/12/24,VIDEO,$360,"10,640",2024-12-03,2025-01-02,30
118,CB_2024_Dec_FB_3638_CHUB_V01_9x16_VID_EN_New_C-NONE_CTA-NONE_Angle-WellBe_M-NONE_VL-30s_TR-None_G-NONE_P-NONE_S-NEW,3638 CHUB â€“ Motivational video || Enhancements: OFF || CBV1 || Batch 1 || 1C || 30/12/24w01 || Kostas,VIDEO,$360,"14,885",2024-12-30,2025-01-01,2
119,CB_2023_May_FB_2263_MB_V04_9x16_VID_EN_New_C-Sale_CTA-SMR_Pain-W_M-JOG_VL-45s_TR-None_G-M-F_P-None_S-Moon - Copy,Pricing Test || EU (UK) || 1C || Standard Price || 27/12/24,VIDEO,$356,"13,829",2024-12-28,2025-01-01,4
120,CB_2023_Jul_FB_2226_MB_V04_9x16_VID_EN_Opti_C-Testim_CTA-SMR_Pain-W_M-MIX_VL-30s_TR-None_G-F_P-None_S-Starry,ASC+ || MIX || Value Optimization || US || 0% EXISTING CAP || 1C || 22.12.24  Ad set,VIDEO,$353,"8,211",2024-12-22,2025-01-06,15
121,CB_2024_Apr_FB_2969_DT-RP_V02_9x16_IMG_EN_New_C-NONE_CTA-NONE_None_M-NONE_VL-None_TR-None_G-NONE_P-OG_S-NONE,ðŸŒ¶ï¸ || US || ASC+ || ->CC141 || VIDEO Only || US+CA || 0% EXISTING CAP || 7C || 07/08.24  Ad set,SHARE,$343,"27,231",2024-08-19,2025-01-24,158
122,CB_2023_May_FB_2263_MB_V04_9x16_VID_EN_New_C-Sale_CTA-SMR_Pain-W_M-JOG_VL-45s_TR-None_G-M-F_P-None_S-Moon,ðŸ’°WC || US || Advantage+ || BIG BUDGET || CC101->105->109->112->114-116 || BROAD || ABO || 1C || 17/01/24 RELAUNCHED Ad set,VIDEO,$333,"12,295",2024-01-17,2025-02-06,386
123,20230907_101759,NZ || 3rd party page: Fitness Coach Nicole || Organic Ads || Batch 1 || 1C || 03/01/2025,SHARE,$333,"25,056",2025-01-03,2025-01-06,3
124,CB_2024_Dec_FB_3619_VK-JT_V02_4x5_VID_EN_New_C-BulletPoints_Sale_CTA-NY_Angle-W-B-C_M-NONE_VL-None_G-NONE_P-OG_S-NONE,ASC+ || NYNM ðŸŽ† || US || 0% EXISTING CAP || 1C || 31.12.24 Ad set,SHARE,$328,"10,273",2024-12-31,2025-01-03,3
125,CB_2024_Dec_FB_3637_CHUB_V01_1x1_IMG_EN_New_C-Headline_CTA-SALE_Angle-W_M-NONE_VL-None_TR-None_G-NONE_P-NONE_S-NONE,3637 CHUB â€“ Hipno Event || Enhancements: OFF || CBV1 || Batch 1 || 1C || 30/12/24w01 || Kostas,SHARE,$321,"10,740",2024-12-30,2025-01-06,7
126,CB_2024_Dec_FB_3645_LZ-DP_V01_4x5_VID_EN_Opti_C-Testimonial_Sale_CTA-NY_Angle-W-B_M-LNC_VL-30s_G-F_P-OG_S-MOON_FB3090V02,3645 - NYNM laurencaress new footage 3090 opti || Enhancements: OFF || CBV1 || Batch 1 || 1C || 24/12/24w52 || Kostas,SHARE,$305,"8,040",2024-12-24,2024-12-31,7
127,CB_2024_Aug_FB_3090_DT-DP_V02_9x16_VID_EN_Opti_C-MakingOf_CTA-CTA_Pain-W-B-C_M-POW_VL-45s_TR-None_G-M_P-OG_S-Moon_FB3029V04,CBV2 || NZ || ðŸ’° Advantage+ || US || BROAD || 7C || Existing_customer_5% || 19/12/24 Campaign Ad set,SHARE,$303,"19,964",2024-12-19,2025-01-11,23
128,CB_2024_Dec_FB_3639_CHUB_V03_1x1_IMG_EN_New_C-NONE_CTA-NONE_Angle-W_M-NONE_VL-None_TR-None_G-NONE_P-NONE_S-NONE,ASC+ || NYNM ðŸŽ† || US || 0% EXISTING CAP || 1C || 31.12.24 Ad set,SHARE,$300,"12,345",2024-12-31,2025-01-03,3
129,CB_2024_Nov_FB_3561_SO-JT_V02_4x5_IMG_EN_New_C-NONE_Evergreen_CTA-NONE_Angle-None_M-NONE_VL-None_G-NONE_P-NONE_S-NONE,3561 - Notion Andy Warhol || Enhancements: OFF || CBV1 || Batch 1 || 1C || 27/12/24w52 || Kostas,SHARE,$295,"12,111",2024-12-27,2024-12-31,4
130,20230907_100759,EU (UK) || 3rd party page: Fitness Coach Nicole || Organic Ads || Batch 1 || 1C || 17/12/2024,SHARE,$288,"14,891",2024-12-17,2025-01-01,15
131,CB_2023_Jul_FB_2226_MB_V04_9x16_VID_EN_Opti_C-Testim_CTA-SMR_Pain-W_M-MIX_VL-30s_TR-None_G-F_P-None_S-Starry,UK || ASC+ || 7DC || Existing 10% || 13.11.2024 Ad set,SHARE,$277,"12,463",2024-11-13,2025-01-16,64
132,CB_2024_Dec_FB_3648_DT_V04_16x9_IMG_EN_Opti_C-NONE_Evergreen_CTA-NONE_Angle-None_M-NONE_VL-None_G-NONE_P-OG_S-NONE.png,US || VSL || 3648 - VSL static opti || Landing: Pre-1(New lead) -> Old lead || 1C || 31/12/24,SHARE,$268,"11,839",2024-12-31,2025-01-06,6
133,CB_2023_Dec_FB_2670_MB-RP_V02_9x16_VID_EN_Opti_C-Sale_CTA-XMAS65_Pain-W_M-JOG_VL-30s_TR-None,ðŸ’°WC || US || Advantage+ || BIG BUDGET || CC101->105->109->112->114-116->117 || BROAD || ABO || 1C || 17/01/24 RELAUNCHED Ad set,VIDEO,$261,"9,368",2024-01-17,2025-02-06,386
134,CB_2024_Dec_FB_3616_LZ-JG_V01_4x5_IMG_EN_Opti_C-Headline_Sale_CTA-XMAS_Angle-Cort_M-NONE_VL-None_G-NONE_P-NONE_S-NONE_FB3251V02,ASC+ || MIX || Value Optimization || US || 0% EXISTING CAP || 1C || 22.12.24  Ad set,SHARE,$261,"6,504",2024-12-22,2025-01-06,15
135,CB_2024_Dec_FB_3648_DT_V03_16x9_IMG_EN_Opti_C-NONE_Evergreen_CTA-NONE_Angle-None_M-NONE_VL-None_G-NONE_P-OG_S-NONE.png,US || VSL || 3648 - VSL static opti || Landing: Pre-1(New lead) -> Old lead || 1C || 31/12/24,SHARE,$252,"9,657",2024-12-31,2025-01-06,6
136,CB_2024_Dec_FB_3616_LZ-JG_V01_4x5_IMG_EN_Opti_C-Headline_Sale_CTA-XMAS_Angle-Cort_M-NONE_VL-None_G-NONE_P-NONE_S-NONE_FB3251V02,ðŸŒ¶ï¸ || US || ASC+ || ->CC141 || VIDEO Only || US+CA || 0% EXISTING CAP || 7C || 07/08.24  Ad set,SHARE,$249,"12,840",2024-12-20,2025-01-24,35
137,CB_2024_Dec_FB_3582_LZ-KB_V07_4x5_IMG_EN_New_C-Headline_Evergreen_CTA-NONE_Angle-ADVTR_M-NONE_VL-None_G-NONE_P-NONE_S-NONE,CBV2 || LP:HI 3582 - secret behind the label advertorial ads || Batch 2 || BROAD || 1C ||  03/01/25 || Kostas,SHARE,$247,"12,177",2025-01-03,2025-01-04,1
138,CB_2024_Jan_FB_2762_IK_V05_1x1_IMG_EN_New_C-WrittenTesti_CTA-CTA_Pain-W-B-C_M-NONE_VL-None_TR-None_G-NONE_P-V2_S-NONE,CBV2 || NZ || ðŸ’° Advantage+ || US || BROAD || 7C || Existing_customer_5% || 19/12/24 Campaign Ad set,SHARE,$244,"15,894",2024-12-19,2025-01-11,23
139,CB_2024_Nov_FB_3562_VK-JG_V03_4x5_IMG_EN_New_C-BulletPoints_Sale_CTA-BF70_Angle-W_M-NONE_VL-None_G-NONE_P-OG_S-NONE,US || COST CAP 131->111->115 || Max excl. || 7C || 04/12/24,SHARE,$238,"10,748",2024-12-03,2025-01-02,30
140,CB_2023_Jul_FB_2217_IB_V04_9x16_VID_EN_Opti_C-Pointing_CTA-SMR_Pain-W-B_M-TRC_VL-30s_TR-None_G-F_P-None_S-FRIGGA - Copy 2,View Content || BROAD || 7C || 17/12/24,VIDEO,$238,"27,684",2024-12-17,2025-01-20,34
141,CB_2023_May_FB_2263_MB_V04_9x16_VID_EN_New_C-Sale_CTA-SMR_Pain-W_M-JOG_VL-45s_TR-None_G-M-F_P-None_S-Moon - Copy,Pricing Test || EU (UK) || 1C || Higher Price || 27/12/24,VIDEO,$234,"9,236",2024-12-28,2025-01-01,4
142,CB_2024_Dec_FB_3648_DT_V03_16x9_IMG_EN_Opti_C-NONE_Evergreen_CTA-NONE_Angle-None_M-NONE_VL-None_G-NONE_P-OG_S-NONE.png,US || VSL || 3648 - VSL static opti || Landing: CB quiz || 1C || 01/01/25,SHARE,$234,"4,229",2025-01-02,2025-01-03,1
143,CB_2024_Feb_FB_2834_DA_V02_4x5_IMG_EN_Opti_C-SingleTesti_CTA-NONE_Pain-W_M-NONE_VL-None_TR-None_G-NONE_P-V2_S-NONE_FB2759V04,CBV2 || AU || ðŸ’° Advantage+ || US || BROAD || 7C || Existing_customer_5% || 19/12/24 Ad set,SHARE,$232,"8,861",2024-12-19,2025-03-27,98
144,CB_2024_Aug_FB_3110_DA_V01_4x5_VID_EN_Opti_C-Dance_CTA-LABOR_Pain-W-B_M-JOG_VL-30s_TR-None_G-F_P-OG_S-WHAT_FB3045V01,ðŸŒ¶ï¸ || US || ASC+ || ->CC141 || VIDEO Only || US+CA || 0% EXISTING CAP || 7C || 07/08.24  Ad set,VIDEO,$229,"7,026",2024-09-02,2025-01-24,144
145,CB_2024_Dec_FB_3644_CHUB_V03_1x1_IMG_EN_New_C-NONE_CTA-NONE_Angle-C_P-NONE,3644 CHUB Skibidi Toilet || Enhancements: OFF || CBV1 || Batch 1 || 1C || 30/12/24w01 || Kostas,SHARE,$228,"12,320",2024-12-30,2025-01-01,2
146,CB_2023_Jul_FB_2217_IB_V04_9x16_VID_EN_Opti_C-Pointing_CTA-SMR_Pain-W-B_M-TRC_VL-30s_TR-None_G-F_P-None_S-FRIGGA,US || Manual Bid || BFCM || ROAS GOAL: 1.4 || 1C || 15/11/24,VIDEO,$227,"7,791",2024-11-15,2025-01-18,64
147,CB_2024_Dec_FB_3617_VK-JT_V04_4x5_VID_EN_New_C-BulletPoints_Sale_CTA-NY_Angle-W-B-C_M-NONE_VL-None_G-NONE_P-OG_S-NONE,3617 - CB - CRAVINGS - NY SAME YOU || Enhancements: OFF || CBV1 || Batch 1 || 1C || 30/12/24w01 || Kostas,SHARE,$226,"9,531",2024-12-30,2025-01-02,3
148,CB_2024_Oct_PIN_30_KB_V12_2x3_IMG_EN_Opti_C-NONE_CTA-NONE_None_M-NONE_VL-None_TR-None_G-NONE_P-OG_S-NONE,US || 3rd party page: Personal Coach Nicole || Static || Batch 2 || 1C || 30/12/24,SHARE,$220,"8,700",2024-12-30,2025-01-02,3
149,CB_2024_Dec_FB_3617_VK-JT_V03_4x5_VID_EN_New_C-BulletPoints_Sale_CTA-NY_Angle-W-B-C_M-NONE_VL-None_G-NONE_P-OG_S-NONE,3617 - CB - CRAVINGS - NY SAME YOU || Enhancements: OFF || CBV1 || Batch 1 || 1C || 02/01/25w01 || Kostas,SHARE,$217,"10,915",2025-01-02,2025-01-05,3
150,20230907_094526,EU (UK) || 3rd party page: Fitness Coach Nicole || Organic Ads || Batch 1 || 1C || 17/12/2024,SHARE,$212,"12,114",2024-12-17,2025-01-01,15
151,20230907_101401,NZ || 3rd party page: Fitness Coach Nicole || Organic Ads || Batch 1 || 1C || 03/01/2025,SHARE,$208,"14,895",2025-01-03,2025-01-06,3
152,CB_2022_Mar3_FB_713_IK_V04_1x1_IMG_EN_Opti_C-WrittenTesti_HE-98_A-ExtremeBodyVisualization_HK-bodypart_Pain-W_CLR-PURPLE_BG-IMAGE_ME-MIX_MA-YOUNG,US || Manual Bid || BFCM || ROAS GOAL: 1.4 || 1C || 15/11/24,SHARE,$198,"9,258",2024-11-15,2025-02-27,104
153,CB_2024_Dec_FB_3582_LZ-KB_V03_4x5_IMG_EN_New_C-Headline_Evergreen_CTA-NONE_Angle-ADVTR_M-NONE_VL-None_G-NONE_P-NONE_S-NONE,CBV2 || LP:HI 3582 - secret behind the label advertorial ads || Batch 1 || BROAD || 1C ||  03/01/25 || Kostas,SHARE,$197,"5,512",2025-01-03,2025-01-05,2
154,CB_2024_Nov_FB_3264_LZ_V31_4x5_VID_EN_Opti_C-MakingOf_Sale_CTA-BF_Angle-W-B_M-CRAZY_VL-45s_G-M_P-OG_S-NEW_FB3004V02,CBV2 || Advantage+ || Only V1 Ads || US || 5% EXISTING CAP || BROAD || 7C || 30/12/24  Campaign Ad set,VIDEO,$187,"6,061",2024-12-30,2025-01-22,23
155,CB_2024_Dec_FB_3617_VK-JT_V03_4x5_VID_EN_New_C-BulletPoints_Sale_CTA-NY_Angle-W-B-C_M-NONE_VL-None_G-NONE_P-OG_S-NONE,3617 - CB - CRAVINGS - NY SAME YOU || Enhancements: OFF || CBV1 || Batch 1 || 1C || 30/12/24w01 || Kostas,SHARE,$187,"9,263",2024-12-30,2025-01-02,3
156,CB_2023_Aug_FB_2295_MB_V01_1x1_VID_EN_Opti_C-GIF_CTA-CTA_Pain-W-B_M-None_VL-10s_TR-None_G-None_P-None_S-None,CA || COST CAP 91 || 7C || 03/42/24 || V1,VIDEO,$186,"13,539",2024-05-03,2025-01-13,255
157,CB_2024_Nov_FB_3561_SO-JT_V05_4x5_IMG_EN_New_C-NONE_Evergreen_CTA-NONE_Angle-None_M-NONE_VL-None_G-NONE_P-NONE_S-NONE,3561 - Notion Andy Warhol || Enhancements: OFF || CBV1 || Batch 3 || 1C || 27/12/24w52 || Kostas,SHARE,$186,"8,338",2024-12-27,2024-12-31,4
158,CB_2024_Dec_FB_3582_LZ-KB_V04_4x5_IMG_EN_New_C-Headline_Evergreen_CTA-NONE_Angle-ADVTR_M-NONE_VL-None_G-NONE_P-NONE_S-NONE,CBV2 || LP:HI 3582 - secret behind the label advertorial ads || Batch 1 || BROAD || 1C ||  03/01/25 || Kostas,SHARE,$185,"2,686",2025-01-03,2025-01-05,2
159,CB_2024_Nov_FB_3264_LZ_V31_4x5_VID_EN_Opti_C-MakingOf_Sale_CTA-BF_Angle-W-B_M-CRAZY_VL-45s_G-M_P-OG_S-NEW_FB3004V02,CBV2 || NZ || ðŸ’° Advantage+ || US || BROAD || 7C || Existing_customer_5% || 19/12/24 Campaign Ad set,VIDEO,$180,"12,551",2024-12-19,2025-01-11,23
160,CB_2024_Feb_FB_KB_V01_1x1_IMG_EN_Opti_C-SingleTesti_CTA-NONE_Pain-W_M-NONE_VL-None_TR-None_G-NONE_P-ORG_S-NONE,US || 3rd party page: Matthew || Static || Batch 1 || 1C || 30/12/24,SHARE,$180,"6,963",2024-12-30,2025-01-03,4
161,CB_2024_Oct_PIN_30_KB_V17_2x3_IMG_EN_Opti_C-NONE_CTA-NONE_None_M-NONE_VL-None_TR-None_G-NONE_P-OG_S-NONE,US || 3rd party page: Personal Coach Nicole || Static || Batch 2 || 1C || 30/12/24,SHARE,$179,"9,062",2024-12-30,2025-01-02,3
162,CB_2023_Oct_FB_2516_VK_V13_9x16_VID_EN_Opti_C-Benefits_CTA-AUTUM_Pain-W-B_M-PASQ_VL-30s_TR-None_G-M_P-Plan_S-WHAT,ðŸ’°WC || US || Advantage+ || BIG BUDGET || CC101->105->109->112->114-116 || BROAD || ABO || 1C || 17/01/24 RELAUNCHED Ad set,VIDEO,$177,"7,790",2024-01-17,2025-02-06,386
163,CB_2023_Jul_FB_2217_IB_V04_9x16_VID_EN_Opti_C-Pointing_CTA-SMR_Pain-W-B_M-TRC_VL-30s_TR-None_G-F_P-None_S-FRIGGA,ASC+ || MIX || Value Optimization || US || 0% EXISTING CAP || 1C || 22.12.24  Ad set,VIDEO,$176,"5,110",2024-12-22,2024-12-30,8
164,CB_2024_Nov_FB_3561_SO-JT_V04_4x5_IMG_EN_New_C-NONE_Evergreen_CTA-NONE_Angle-None_M-NONE_VL-None_G-NONE_P-NONE_S-NONE,3561 - Notion Andy Warhol || Enhancements: OFF || CBV1 || Batch 2 || 1C || 27/12/24w52 || Kostas,SHARE,$174,"6,667",2024-12-27,2024-12-31,4
165,CB_2024_Dec_FB_3617_VK-JT_V04_4x5_VID_EN_New_C-BulletPoints_Sale_CTA-NY_Angle-W-B-C_M-NONE_VL-None_G-NONE_P-OG_S-NONE,3617 - CB - CRAVINGS - NY SAME YOU || Enhancements: OFF || CBV1 || Batch 1 || 1C || 02/01/25w01 || Kostas,SHARE,$171,"7,119",2025-01-02,2025-01-05,3
166,CB_2024_Nov_FB_3572_SO-JT_V02_4x5_IMG_EN_New_C-NONE_Evergreen_CTA-NONE_Angle-None_M-NONE_VL-None_G-NONE_P-NONE_S-NONE,3572 - CB - IMG - Notion - Billboard || Enhancements: OFF || CBV1 || Batch 1 || 1C || 28/12/24w52 || Kostas,SHARE,$171,"6,856",2024-12-28,2024-12-31,3
167,CB_2024_Dec_FB_3590_LZ-KB_V08_4x5_IMG_EN_Opti_C-Headline_Sale_CTA-NY_Angle-SC_M-NONE_VL-None_G-NONE_P-NONE_S-NONE_FB2227V08,3590 - CB - IMG - NOTION _ #53 New year - same me 2 || Enhancements: OFF || CBV1 || Batch 3 || 1C || 28/12/24w52 || Kostas,SHARE,$171,"4,836",2024-12-28,2024-12-31,3
168,CB_2024_Nov_FB_3353_VK-DP_V12_4x5_IMG_EN_New_C-BulletPoints_Sale_CTA-BF70_Angle-W-B-C_M-NONE_VL-None_G-NONE_P-OG_S-NONE,3353 - NEW IDEA_ plan for age group - DP || Enhancements: OFF || CBV1 || Batch 3 || 7C || 10/12/24w50 || Kostas,SHARE,$170,"7,711",2024-12-10,2025-01-04,25
169,CB_2023_Dec_FB_2712_RS-DP_V02_1x1_VID_EN_Opti_C-WrittenTesti_CTA-SALE_Pain-W-B-C_M-NONE_VL-None_TR-None_G-NONE_P-V2_S-NONE_FB2227V08,Pricing Test || EU (UK) || 1C || Higher Price || 27/12/24,SHARE,$168,"7,204",2024-12-28,2025-01-01,4
170,20230907_094526,AU || 3rd party page: Fitness Coach Nicole || Organic Ads || Batch 1 || 1C || 03/01/2025,SHARE,$162,"10,413",2025-01-03,2025-01-09,6
171,CB_2023_Dec_FB_2670_MB-RP_V02_9x16_VID_EN_Opti_C-Sale_CTA-XMAS65_Pain-W_M-JOG_VL-30s_TR-None,ðŸ’°WC || US || Advantage+ || BIG BUDGET || CC101->105->109->112->114-116 || BROAD || ABO || 1C || 17/01/24 RELAUNCHED Ad set,VIDEO,$161,"5,837",2024-01-17,2025-02-06,386
172,CB_2024_Nov_FB_3353_VK-DP_V11_4x5_IMG_EN_New_C-BulletPoints_Sale_CTA-BF70_Angle-W-B-C_M-NONE_VL-None_G-NONE_P-OG_S-NONE,3353 - NEW IDEA_ plan for age group - DP || Enhancements: OFF || CBV1 || Batch 3 || 7C || 10/12/24w50 || Kostas,SHARE,$154,"6,430",2024-12-10,2025-01-04,25
173,CB_2024_Aug_FB_3090_DT-DP_V02_9x16_VID_EN_Opti_C-MakingOf_CTA-CTA_Pain-W-B-C_M-POW_VL-45s_TR-None_G-M_P-OG_S-Moon_FB3029V04,Pricing Test || EU (UK) || 1C || Higher Price || 27/12/24,SHARE,$146,"6,406",2024-12-28,2025-01-01,4
174,CB_2024_Dec_FB_3612_JT_V02_4x5_IMG_EN_New_C-None_Sale_CTA-CTA_Angle-NONE_M-NONE_VL_None_G-NO,ASC+ || NYNM ðŸŽ† || US || 0% EXISTING CAP || 1C || 31.12.24 Ad set,SHARE,$145,"3,896",2024-12-31,2025-01-03,3
175,CB_2024_Nov_FB_3305_SO-DP_V02_4x5_VID_EN_Opti_C-Sale_CTA-BF_Pain-W_M-Chris_VL-30s_TR-None_G-MF_P-Plan_S-NEW_FB2601V07,CBV2 || NZ || ðŸ’° Advantage+ || US || BROAD || 7C || Existing_customer_5% || 19/12/24 Campaign Ad set,VIDEO,$143,"7,161",2024-12-19,2025-01-11,23
176,CB_2024_Nov_FB_3264_LZ_V31_4x5_VID_EN_Opti_C-MakingOf_Sale_CTA-BF_Angle-W-B_M-CRAZY_VL-45s_G-M_P-OG_S-NEW_FB3004V02 - Copy,CBV2 || EU (DE) || ðŸ’° Advantage+ || US || BROAD || 7C || Existing_customer_5% || 29/12/24 Ad set,VIDEO,$143,"5,371",2024-12-29,2025-01-02,4
177,CB_2024_Dec_FB_3601_VK-DP_V09_4x5_VID_EN_Opti_C-Dance_CTA-NY_Pain-W-B_M-JOG_VL-30s_TR-None_G-F_P-OG_S-WHAT_FB3045V01,CBV2 || Advantage+ || Only V1 Ads || US || 5% EXISTING CAP || BROAD || 7C || 30/12/24  Campaign Ad set,VIDEO,$140,"3,663",2024-12-30,2025-01-22,23
178,CB_2024_Dec_FB_3619_VK-JT_V02_4x5_VID_EN_New_C-BulletPoints_Sale_CTA-NY_Angle-W-B-C_M-NONE_VL-None_G-NONE_P-OG_S-NONE - Copy,ASC+ || MIX || Value Optimization || US || 0% EXISTING CAP || 1C || 22.12.24  Ad set,SHARE,$140,"5,191",2024-12-27,2025-01-06,10
179,CB_2024_Mar_FB_2853_DT-RP_V02_9x16_IMG_EN_New_C-NONE_CTA-CTA_None_M-NONE_VL-None_TR-None_G-NONE_P-V2_S-NONE.png,UK || ASC+ || 7DC || Existing 10% || 13.11.2024 Ad set,SHARE,$140,"5,498",2024-11-13,2025-01-16,64
180,CB_2024_Jan_FB_2764_RS_V04_9x16_VID_EN_Opti_C-SingleTesti_CTA-SALE_Pain-W_M-TRC_VL-45s_TR-None_G-F_P-OG_S-MOON_FB2263V04,US || 3rd party page: Personal Coach Nicole || Video || Batch 1 || 1C || 30/12/24,VIDEO,$134,"4,126",2024-12-31,2025-01-02,2
181,CB_2024_Dec_FB_3626_LZ-KB_V04_4x5_VID_EN_Opti_C-NONE_Sale_CTA-NY_Angle-W_M-ATBJ_VL-45s_G-F_P-OG_S-MOON_FB2865V04,3626 - NYNM astoldbyjas new footage 2865 trinity opti || Enhancements: OFF || CBV1 || Batch 1 || 1C || 23/12/24w52 || Kostas,SHARE,$134,"6,240",2024-12-23,2024-12-31,8
182,CB_2024_Dec_FB_3648_DT_V02_16x9_IMG_EN_Opti_C-NONE_Evergreen_CTA-NONE_Angle-None_M-NONE_VL-None_G-NONE_P-OG_S-NONE.png,US || VSL || 3648 - VSL static opti || Landing: CB quiz || 1C || 01/01/25,SHARE,$134,"2,274",2025-01-02,2025-01-03,1
183,CB_2024_Mar_FB_2888_JG_V02_9x16_IMG_EN_Opti_C-Benefits_CTA-NONE_Pain-W_M-NONE_VL-None_TR-None_G-NONE_P-V2_S-NONE,CBV2 || EU (UK) || ðŸ’° Advantage+ || US || BROAD || 7C || Existing_customer_5% || 15/12/24 Ad set,SHARE,$133,"6,611",2024-12-15,2025-01-31,47
184,CB_2024_Dec_FB_3653_LZ-VU_V01_4x5_IMG_EN_New_C-Headline_Evergreen_CTA-NONE_Angle-W_M-NONE_VL-None_G-F_P-NONE_S-NONE.png,3653 - Valentinas' Hyper targeting ad || Enhancements: OFF || CBV1 || Batch 1 || 1C || 05/01/25w01 || Valentinas,SHARE,$132,"5,934",2025-01-05,2025-01-09,4
185,CB_2023_Dec_FB_2712_RS-DP_V02_1x1_VID_EN_Opti_C-WrittenTesti_CTA-SALE_Pain-W-B-C_M-NONE_VL-None_TR-None_G-NONE_P-V2_S-NONE_FB2227V08,Pricing Test || EU (UK) || 1C || Standard Price || 27/12/24,SHARE,$132,"6,246",2024-12-28,2025-01-01,4
186,CB_2023_Nov_FB_2652_DA_V10_9x16_GIF_EN_Opti_C-Sale_CTA-XMAS65_None_M-NONE_VL-7s_TR-None_G-NONE_P-OG_S-NEW_FB2396V01,ðŸ’°WC || US || Advantage+ || BIG BUDGET || CC101->105->109->112->114-116->117 || BROAD || ABO || 1C || 17/01/24 RELAUNCHED Ad set,VIDEO,$129,"4,923",2024-01-17,2025-01-04,353
187,CB_2024_Mar_FB_2888_JG_V02_9x16_IMG_EN_Opti_C-Benefits_CTA-NONE_Pain-W_M-NONE_VL-None_TR-None_G-NONE_P-V2_S-NONE,CBV2 || Advantage+ || US || 5% EXISTING CAP || BROAD || 7C || 30/12/24  Campaign Ad set,SHARE,$126,"6,544",2024-12-30,2025-01-02,3
188,CB_2024_Nov_FB_3264_LZ_V31_4x5_VID_EN_Opti_C-MakingOf_Sale_CTA-BF_Angle-W-B_M-CRAZY_VL-45s_G-M_P-OG_S-NEW_FB3004V02,View Content || BROAD || 7C || 17/12/24,VIDEO,$122,"10,895",2024-12-17,2025-01-20,34
189,20230907_101401,AU || 3rd party page: Fitness Coach Nicole || Organic Ads || Batch 1 || 1C || 03/01/2025,SHARE,$122,"5,302",2025-01-03,2025-01-09,6
190,CB_2024_Nov_FB_3561_SO-JT_V07_4x5_IMG_EN_New_C-NONE_Evergreen_CTA-NONE_Angle-None_M-NONE_VL-None_G-NONE_P-NONE_S-NONE,3561 - Notion Andy Warhol || Enhancements: OFF || CBV1 || Batch 4 || 1C || 27/12/24w52 || Kostas,SHARE,$121,"2,783",2024-12-27,2024-12-31,4
191,CB_2024_Dec_FB_3659_LZ-VU_V01_4x5_IMG_EN_New_C-Headline_Evergreen_CTA-NONE_Angle-W_M-NONE_VL-None_G-M_P-NONE_S-NONE.png,3659 - BRO ads || Enhancements: OFF || CBV1 || Batch 1 || 1C || 05/01/25w01 || Valentinas,SHARE,$117,"3,557",2025-01-05,2025-01-09,4
192,CB_2023_May_FB_2263_MB_V04_9x16_VID_EN_New_C-Sale_CTA-SMR_Pain-W_M-JOG_VL-45s_TR-None_G-M-F_P-None_S-Moon,ðŸ’°WC || US || Advantage+ || BIG BUDGET || CC101->105->109->112->114-116->117 || BROAD || ABO || 1C || 17/01/24 RELAUNCHED Ad set,VIDEO,$115,"4,138",2024-01-17,2025-02-06,386
193,CB_2024_Dec_FB_3644_CHUB_V05_1x1_IMG_EN_New_C-NONE_CTA-NONE_Angle-C_P-NONE,3644 CHUB Skibidi Toilet || Enhancements: OFF || CBV1 || Batch 1 || 1C || 30/12/24w01 || Kostas,SHARE,$111,"4,746",2024-12-30,2025-01-01,2
194,CB_2024_Sep_FB_3175_DA-KB_V01_1x1_IMG_EN_New_C-ADVRT_Evergreen_CTA-NONE_Angle-W_M-NONE_VL-None_G-NONE_P-CBV2_S-NONE_blog_colonbroomvsmammoth_cv_en,CBV2 || A/B Pricing: Standard || 3175 - CB vs Happy Mammoth advertorial || BROAD || 1C ||  22/11/24 || Kostas,SHARE,$108,"4,707",2024-12-22,2025-01-13,22
195,CB_2024_Mar_FB_2888_JG_V03_9x16_IMG_EN_Opti_C-Benefits_CTA-NONE_Pain-W_M-NONE_VL-None_TR-None_G-NONE_P-V2_S-NONE,CBV2 || AU || ðŸ’° Advantage+ || US || BROAD || 7C || Existing_customer_5% || 19/12/24 Ad set,SHARE,$107,"4,956",2024-12-19,2025-03-27,98
196,20230907_101759,EU (UK) || 3rd party page: Fitness Coach Nicole || Organic Ads || Batch 1 || 1C || 17/12/2024,SHARE,$106,"4,135",2024-12-17,2025-01-01,15
197,CB_2024_Feb_FB_2834_DA_V02_4x5_IMG_EN_Opti_C-SingleTesti_CTA-NONE_Pain-W_M-NONE_VL-None_TR-None_G-NONE_P-V2_S-NONE_FB2759V04,CBV2 || EU (UK) || ðŸ’° Advantage+ || US || BROAD || 7C || Existing_customer_5% || 15/12/24 Ad set,SHARE,$104,"4,802",2024-12-15,2025-01-31,47
198,CB_2024_Nov_FB_3561_SO-JT_V08_4x5_IMG_EN_New_C-NONE_Evergreen_CTA-NONE_Angle-None_M-NONE_VL-None_G-NONE_P-NONE_S-NONE,3561 - Notion Andy Warhol || Enhancements: OFF || CBV1 || Batch 4 || 1C || 27/12/24w52 || Kostas,SHARE,$103,"2,822",2024-12-27,2024-12-31,4
199,CB_2024_Oct_FB_3182_ZS-GC_V13_1x1_IMG_EN_New_C-UsVsThem_Evergreen_CTA-NONE_Angle-B-C_M-NONE_VL-None_G-NONE_P-OG_S-NONE,CBV2 || AU || ðŸ’° Advantage+ || US || BROAD || 7C || Existing_customer_5% || 19/12/24 Ad set,SHARE,$102,"4,159",2024-12-19,2025-03-27,98
200,CB_2024_Mar_FB_2888_JG_V02_9x16_IMG_EN_Opti_C-Benefits_CTA-NONE_Pain-W_M-NONE_VL-None_TR-None_G-NONE_P-V2_S-NONE - Copy,CBV2 || EU (DE) || ðŸ’° Advantage+ || US || BROAD || 7C || Existing_customer_5% || 29/12/24 Ad set,SHARE,$100,"4,128",2024-12-29,2025-01-02,4
201,CB_2022_Mar3_FB_713_IK_V04_1x1_IMG_EN_Opti_C-WrittenTesti_HE-98_A-ExtremeBodyVisualization_HK-bodypart_Pain-W_CLR-PURPLE_BG-IMAGE_ME-MIX_MA-YOUNG,US || Manual Bid || BFCM || COST CAP 91 || 1C || 15/11/24,SHARE,$92,"5,336",2024-11-15,2025-02-27,104
202,CB_2023_Jul_FB_2217_IB_V04_9x16_VID_EN_Opti_C-Pointing_CTA-SMR_Pain-W-B_M-TRC_VL-30s_TR-None_G-F_P-None_S-FRIGGA,ðŸ’°WC || US || Advantage+ || BIG BUDGET || CC101->105->109->112->114-116->117 || BROAD || ABO || 1C || 17/01/24 RELAUNCHED Ad set,VIDEO,$92,"3,345",2024-01-17,2025-02-06,386
203,CB_2024_Feb_FB_2834_DA_V02_4x5_IMG_EN_Opti_C-SingleTesti_CTA-NONE_Pain-W_M-NONE_VL-None_TR-None_G-NONE_P-V2_S-NONE_FB2759V04,CBV2 || NZ || ðŸ’° Advantage+ || US || BROAD || 7C || Existing_customer_5% || 19/12/24 Campaign Ad set,SHARE,$91,"6,052",2024-12-19,2025-01-11,23
204,CB_2024_Dec_FB_3582_LZ-KB_V10_4x5_IMG_EN_New_C-Headline_Evergreen_CTA-NONE_Angle-ADVTR_M-NONE_VL-None_G-NONE_P-NONE_S-NONE,CBV2 || LP:HI 3582 - secret behind the label advertorial ads || Batch 3 || BROAD || 1C ||  03/01/25 || Kostas,SHARE,$89,"1,561",2025-01-03,2025-01-06,3
205,CB_2024_Mar_FB_2888_JG_V03_9x16_IMG_EN_Opti_C-Benefits_CTA-NONE_Pain-W_M-NONE_VL-None_TR-None_G-NONE_P-V2_S-NONE,CBV2 || NZ || ðŸ’° Advantage+ || US || BROAD || 7C || Existing_customer_5% || 19/12/24 Campaign Ad set,SHARE,$89,"5,423",2024-12-19,2025-01-11,23
206,CB_2023_May_FB_2144_MB_V02_9x16_VID_EN_Opti_C-Sale_CTA-SMR_Pain-W_M-JOG_VL-30s_TR-None_G-M-F_P-None_S-What,CA || COST CAP 92->93 || 7C || 10/05/24 || V1,VIDEO,$89,"5,599",2024-05-10,2025-02-27,293
207,CB_2024_Dec_FB_3619_VK-JT_V02_4x5_VID_EN_New_C-BulletPoints_Sale_CTA-NY_Angle-W-B-C_M-NONE_VL-None_G-NONE_P-OG_S-NONE - Copy,ASC+ || VIDEO Only || US || 0% EXISTING CAP || 1C || 08.12.24  Ad set,SHARE,$88,"2,933",2024-12-27,2025-01-09,13
208,CB_2024_Nov_FB_3264_LZ_V31_4x5_VID_EN_Opti_C-MakingOf_Sale_CTA-BF_Angle-W-B_M-CRAZY_VL-45s_G-M_P-OG_S-NEW_FB3004V02,CBV2 || Advantage+ || US || 5% EXISTING CAP || BROAD || 7C || 30/12/24  Campaign Ad set,VIDEO,$85,"2,499",2024-12-30,2025-01-02,3
209,CB_2024_Dec_FB_3637_CHUB_V03_1x1_IMG_EN_New_C-Headline_CTA-SALE_Angle-W_M-NONE_VL-None_TR-None_G-NONE_P-NONE_S-NONE,3637 CHUB â€“ Hipno Event || Enhancements: OFF || CBV1 || Batch 1 || 1C || 30/12/24w01 || Kostas,SHARE,$81,"3,193",2024-12-30,2025-01-06,7
210,CB_2024_Dec_FB_3626_LZ-KB_V01_4x5_VID_EN_Opti_C-NONE_Sale_CTA-NY_Angle-W_M-ATBJ_VL-45s_G-F_P-OG_S-MOON_FB2865V04,3626 - NYNM astoldbyjas new footage 2865 trinity opti || Enhancements: OFF || CBV1 || Batch 1 || 1C || 23/12/24w52 || Kostas,SHARE,$81,"2,356",2024-12-23,2024-12-31,8
211,CB_2024_Dec_FB_3601_VK-DP_V09_4x5_VID_EN_Opti_C-Dance_CTA-NY_Pain-W-B_M-JOG_VL-30s_TR-None_G-F_P-OG_S-WHAT_FB3045V01,CBV2 || AU || ðŸ’° Advantage+ || US || BROAD || 7C || Existing_customer_5% || 19/12/24 Ad set,SHARE,$81,"1,915",2025-01-03,2025-03-27,83
212,CB_2024_Sep_FB_3175_DA-KB_V02_1x1_IMG_EN_New_C-ADVRT_Evergreen_CTA-NONE_Angle-W_M-NONE_VL-None_G-NONE_P-CBV2_S-NONE_blog_colonbroomvsmammoth_cv_en,CBV2 || A/B Pricing: increased price || 3175 - CB vs Happy Mammoth advertorial || BROAD || 1C ||  22/11/24 || Kostas,SHARE,$80,"3,760",2024-12-22,2025-01-22,31
213,CB_2024_Dec_FB_3617_VK-JT_V02_4x5_VID_EN_New_C-BulletPoints_Sale_CTA-NY_Angle-W-B-C_M-NONE_VL-None_G-NONE_P-OG_S-NONE,3617 - CB - CRAVINGS - NY SAME YOU || Enhancements: OFF || CBV1 || Batch 1 || 1C || 02/01/25w01 || Kostas,SHARE,$80,"4,363",2025-01-02,2025-01-05,3
214,CB_2023_Jul_FB_2226_MB_V04_9x16_VID_EN_Opti_C-Testim_CTA-SMR_Pain-W_M-MIX_VL-30s_TR-None_G-F_P-None_S-Starry,CBV2 || Advantage+ || Only V1 Ads || US || 5% EXISTING CAP || BROAD || 7C || 30/12/24  Campaign Ad set,SHARE,$77,"2,367",2024-12-30,2025-01-22,23
215,20230907_100759,NZ || 3rd party page: Fitness Coach Nicole || Organic Ads || Batch 1 || 1C || 03/01/2025,SHARE,$75,"5,685",2025-01-03,2025-01-06,3
216,CB_2024_Aug_FB_3090_DT-DP_V02_9x16_VID_EN_Opti_C-MakingOf_CTA-CTA_Pain-W-B-C_M-POW_VL-45s_TR-None_G-M_P-OG_S-Moon_FB3029V04,Pricing Test || EU (UK) || 1C || Standard Price || 27/12/24,SHARE,$74,"3,378",2024-12-28,2025-01-01,4
217,CB_2024_Oct_FB_3182_ZS-GC_V13_1x1_IMG_EN_New_C-UsVsThem_Evergreen_CTA-NONE_Angle-B-C_M-NONE_VL-None_G-NONE_P-OG_S-NONE,CBV2 || Advantage+ || Only V1 Ads || US || 5% EXISTING CAP || BROAD || 7C || 30/12/24  Campaign Ad set,SHARE,$74,"5,216",2024-12-30,2025-01-22,23
218,CB_2024_Feb_FB_2834_DA_V04_4x5_IMG_EN_Opti_C-SingleTesti_CTA-NONE_Pain-W_M-NONE_VL-None_TR-None_G-NONE_P-V2_S-NONE_FB2759V04,CBV2 || AU || ðŸ’° Advantage+ || US || BROAD || 7C || Existing_customer_5% || 19/12/24 Ad set,SHARE,$73,"2,597",2024-12-19,2025-03-27,98
219,CB_2024_Mar_FB_2888_JG_V01_9x16_IMG_EN_Opti_C-Benefits_CTA-NONE_Pain-W_M-NONE_VL-None_TR-None_G-NONE_P-V2_S-NONE,CBV2 || AU || ðŸ’° Advantage+ || US || BROAD || 7C || Existing_customer_5% || 19/12/24 Ad set,SHARE,$71,"2,203",2024-12-19,2025-03-27,98
220,CB_2024_Feb_FB_2834_DA_V02_4x5_IMG_EN_Opti_C-SingleTesti_CTA-NONE_Pain-W_M-NONE_VL-None_TR-None_G-NONE_P-V2_S-NONE_FB2759V04,CBV2 || Advantage+ || US || 5% EXISTING CAP || BROAD || 7C || 30/12/24  Campaign Ad set,SHARE,$69,"3,380",2024-12-30,2025-01-02,3
221,CB_2024_Nov_FB_3264_LZ_V31_4x5_VID_EN_Opti_C-MakingOf_Sale_CTA-BF_Angle-W-B_M-CRAZY_VL-45s_G-M_P-OG_S-NEW_FB3004V02 - Copy,Pricing Test || EU (UK) || 1C || Higher Price || 27/12/24,VIDEO,$61,"2,257",2024-12-28,2025-01-01,4
222,CB_2024_Feb_FB_2834_DA_V04_4x5_IMG_EN_Opti_C-SingleTesti_CTA-NONE_Pain-W_M-NONE_VL-None_TR-None_G-NONE_P-V2_S-NONE_FB2759V04,CBV2 || NZ || ðŸ’° Advantage+ || US || BROAD || 7C || Existing_customer_5% || 19/12/24 Campaign Ad set,SHARE,$60,"2,944",2024-12-19,2025-01-11,23
223,CB_2024_Mar_FB_2864_DT-RS_V01_1x1_IMG_EN_New_C-ADVRT_CTA-CTA_None_M-NONE_VL-None_TR-None_G-NONE_P-NONE_S-NONE,ðŸ“š US+CA || ASC+ || Advertorials || 7C || 15/10.24 Ad set,SHARE,$59,"3,365",2024-10-15,2024-12-31,77
224,20230907_094526,NZ || 3rd party page: Fitness Coach Nicole || Organic Ads || Batch 1 || 1C || 03/01/2025,SHARE,$59,"6,774",2025-01-03,2025-01-06,3
225,CB_2024_Nov_FB_3342_DT-DP_V05_4x5_VID_EN_Opti_C-Testimomial_Sale_CTA-CYBER_Angle-W_M-CLARA_VL-45s_G-F_P-OG_S-MOON_FB2865V05,ðŸŒ¶ï¸ || US || ASC+ || ->CC141 || VIDEO Only || US+CA || 0% EXISTING CAP || 7C || 07/08.24  Ad set,VIDEO,$58,"2,087",2024-12-09,2025-01-24,46
226,CB_2024_Nov_FB_3353_VK-DP_V09_4x5_IMG_EN_New_C-BulletPoints_Sale_CTA-BF70_Angle-W-B-C_M-NONE_VL-None_G-NONE_P-OG_S-NONE,3353 - NEW IDEA_ plan for age group - DP || Enhancements: OFF || CBV1 || Batch 3 || 7C || 10/12/24w50 || Kostas,SHARE,$58,"2,361",2024-12-10,2025-01-04,25
227,CB_2024_Mar_FB_2888_JG_V03_9x16_IMG_EN_Opti_C-Benefits_CTA-NONE_Pain-W_M-NONE_VL-None_TR-None_G-NONE_P-V2_S-NONE,CBV2 || EU (UK) || ðŸ’° Advantage+ || US || BROAD || 7C || Existing_customer_5% || 15/12/24 Ad set,SHARE,$57,"2,825",2024-12-15,2025-01-31,47
228,CB_2024_Mar_FB_2888_JG_V02_9x16_IMG_EN_Opti_C-Benefits_CTA-NONE_Pain-W_M-NONE_VL-None_TR-None_G-NONE_P-V2_S-NONE,CBV2 || AU || ðŸ’° Advantage+ || US || BROAD || 7C || Existing_customer_5% || 19/12/24 Ad set,SHARE,$57,"2,416",2024-12-19,2025-03-27,98
229,CB_2024_Nov_FB_3561_SO-JT_V01_4x5_IMG_EN_New_C-NONE_Evergreen_CTA-NONE_Angle-None_M-NONE_VL-None_G-NONE_P-NONE_S-NONE,3561 - Notion Andy Warhol || Enhancements: OFF || CBV1 || Batch 1 || 1C || 27/12/24w52 || Kostas,SHARE,$56,"1,596",2024-12-27,2024-12-31,4
230,CB_2024_Dec_FB_3590_LZ-KB_V04_4x5_IMG_EN_Opti_C-Headline_Sale_CTA-NY_Angle-SC_M-NONE_VL-None_G-NONE_P-OG_S-NONE_FB3573V01,3590 - CB - IMG - NOTION _ #53 New year - same me 2 || Enhancements: OFF || CBV1 || Batch 1 || 1C || 28/12/24w52 || Kostas,SHARE,$56,"2,564",2024-12-28,2024-12-30,2
231,CB_2024_Mar_FB_2888_JG_V02_9x16_IMG_EN_Opti_C-Benefits_CTA-NONE_Pain-W_M-NONE_VL-None_TR-None_G-NONE_P-V2_S-NONE,CBV2 || NZ || ðŸ’° Advantage+ || US || BROAD || 7C || Existing_customer_5% || 19/12/24 Campaign Ad set,SHARE,$55,"3,939",2024-12-19,2025-01-11,23
232,CB_2024_Nov_FB_3305_SO-DP_V02_4x5_VID_EN_Opti_C-Sale_CTA-BF_Pain-W_M-Chris_VL-30s_TR-None_G-MF_P-Plan_S-NEW_FB2601V07,CBV2 || Advantage+ || Only V1 Ads || US || 5% EXISTING CAP || BROAD || 7C || 30/12/24  Campaign Ad set,VIDEO,$55,"1,714",2024-12-30,2025-01-22,23
233,CB_2024_Feb_FB_KB_V05_1x1_IMG_EN_Opti_C-SingleTesti_CTA-NONE_Pain-W_M-NONE_VL-None_TR-None_G-NONE_P-ORG_S-NONE,US || 3rd party page: Matthew || Static || Batch 1 || 1C || 30/12/24,SHARE,$53,"2,175",2024-12-30,2025-01-03,4
234,CB_2024_Oct_FB_3182_ZS-GC_V13_1x1_IMG_EN_New_C-UsVsThem_Evergreen_CTA-NONE_Angle-B-C_M-NONE_VL-None_G-NONE_P-OG_S-NONE,CBV2 || NZ || ðŸ’° Advantage+ || US || BROAD || 7C || Existing_customer_5% || 19/12/24 Campaign Ad set,SHARE,$52,"3,496",2024-12-19,2025-01-11,23
235,CB_2024_Sep_FB_3175_DA-KB_V02_1x1_IMG_EN_New_C-ADVRT_Evergreen_CTA-NONE_Angle-W_M-NONE_VL-None_G-NONE_P-CBV2_S-NONE_blog_colonbroomvsmammoth_cv_en,CBV2 || A/B Pricing: Standard || 3175 - CB vs Happy Mammoth advertorial || BROAD || 1C ||  22/11/24 || Kostas,SHARE,$51,"1,786",2024-12-22,2025-01-13,22
236,CB_2024_Nov_FB_3305_SO-DP_V02_4x5_VID_EN_Opti_C-Sale_CTA-BF_Pain-W_M-Chris_VL-30s_TR-None_G-MF_P-Plan_S-NEW_FB2601V07,CBV2 || EU (UK) || ðŸ’° Advantage+ || US || BROAD || 7C || Existing_customer_5% || 15/12/24 Ad set,SHARE,$50,"2,016",2024-12-19,2025-01-31,43
237,CB_2025_Jan_FB_3651_SO-JT_V01_4x5_IMG_EN_New_C-NONE_Evergreen_CTA-SALE_Angle-None_M-NONE_VL-None_G-NONE_P-NONE_S-NONE,3651 - NYNM - RIDDLES NOTION #77 || Enhancements: OFF || CBV1 || Batch 1 || 1C || 05/01/25w01 || Kostas,SHARE,$49,"1,731",2025-01-05,2025-01-09,4
238,CB_2024_Dec_FB_3659_LZ-VU_V03_4x5_IMG_EN_New_C-Headline_Evergreen_CTA-NONE_Angle-W_M-NONE_VL-None_G-M_P-NONE_S-NONE.png,3659 - BRO ads || Enhancements: OFF || CBV1 || Batch 1 || 1C || 05/01/25w01 || Valentinas,SHARE,$44,"1,884",2025-01-05,2025-01-09,4
239,CB_2024_Oct_FB_3182_ZS-GC_V13_1x1_IMG_EN_New_C-UsVsThem_Evergreen_CTA-NONE_Angle-B-C_M-NONE_VL-None_G-NONE_P-OG_S-NONE,CBV2 || EU (UK) || ðŸ’° Advantage+ || US || BROAD || 7C || Existing_customer_5% || 15/12/24 Ad set,SHARE,$43,"2,001",2024-12-15,2025-01-31,47
240,CB_2024_Dec_FB_3601_VK-DP_V09_4x5_VID_EN_Opti_C-Dance_CTA-NY_Pain-W-B_M-JOG_VL-30s_TR-None_G-F_P-OG_S-WHAT_FB3045V01,CBV2 || Advantage+ || US || 5% EXISTING CAP || BROAD || 7C || 30/12/24  Campaign Ad set,VIDEO,$43,"1,232",2024-12-30,2025-01-02,3
241,CB_2025_Jan_FB_3651_SO-JT_V05_4x5_IMG_EN_New_C-NONE_Evergreen_CTA-SALE_Angle-None_M-NONE_VL-None_G-NONE_P-NONE_S-NONE,3651 - NYNM - RIDDLES NOTION #77 || Enhancements: OFF || CBV1 || Batch 2 || 1C || 05/01/25w01 || Kostas,SHARE,$43,"1,292",2025-01-05,2025-01-09,4
242,CB_2024_Nov_FB_3561_SO-JT_V03_4x5_IMG_EN_New_C-NONE_Evergreen_CTA-NONE_Angle-None_M-NONE_VL-None_G-NONE_P-NONE_S-NONE,3561 - Notion Andy Warhol || Enhancements: OFF || CBV1 || Batch 2 || 1C || 27/12/24w52 || Kostas,SHARE,$43,"1,502",2024-12-27,2024-12-31,4
243,CB_2024_Nov_FB_3264_LZ_V31_4x5_VID_EN_Opti_C-MakingOf_Sale_CTA-BF_Angle-W-B_M-CRAZY_VL-45s_G-M_P-OG_S-NEW_FB3004V02 - Copy,Pricing Test || EU (UK) || 1C || Standard Price || 27/12/24,VIDEO,$42,"1,791",2024-12-28,2025-01-01,4
244,CB_2024_Jan_FB_2783_VK-RP_V01_1x1_IMG_EN_Opti_C-ADVRT_CTA-NONE_Pain-W_M-NONE_VL-None_TR-None_G-NONE_P-CBV2_S-NONE,ðŸ“š US+CA || ASC+ || Advertorials || 7C || 15/10.24 Ad set,SHARE,$42,"2,737",2024-10-15,2024-12-31,77
245,CB_2024_Dec_FB_3658_LZ-VU_V02_4x5_IMG_EN_New_C-BeforeAfter_Evergreen_CTA-NONE_Angle-W_M-NONE_VL-None_G-NONE_P-OG_S-NONE,3658 - ridge inspired humorous ads marmot || Enhancements: OFF || CBV1 || Batch 1 || 1C || 05/01/25w01 || Kostas,SHARE,$42,"1,143",2025-01-05,2025-01-09,4
246,CB_2023_Oct_FB_2516_VK_V13_9x16_VID_EN_Opti_C-Benefits_CTA-AUTUM_Pain-W-B_M-PASQ_VL-30s_TR-None_G-M_P-Plan_S-WHAT.mp4,CBV2 || EU (DE) || ðŸ’° Advantage+ || US || BROAD || 7C || Existing_customer_5% || 29/12/24 Ad set,VIDEO,$41,"1,288",2024-12-29,2025-01-02,4
247,CB_2024_Dec_FB_3639_CHUB_V01_1x1_IMG_EN_New_C-NONE_CTA-NONE_Angle-W_M-NONE_VL-None_TR-None_G-NONE_P-NONE_S-NONE,3639 CHUB â€“ Looking 15 people || Enhancements: OFF || CBV1 || Batch 1 || 1C || 30/12/24w01 || Kostas,SHARE,$40,"1,511",2024-12-30,2025-01-12,13
248,CB_2024_Dec_FB_3658_LZ-VU_V03_4x5_IMG_EN_New_C-BeforeAfter_Evergreen_CTA-NONE_Angle-W_M-NONE_VL-None_G-NONE_P-OG_S-NONE,3658 - ridge inspired humorous ads marmot || Enhancements: OFF || CBV1 || Batch 1 || 1C || 05/01/25w01 || Kostas,SHARE,$39,"1,439",2025-01-05,2025-01-09,4
249,CB_2024_Feb_FB_KB_V03_1x1_IMG_EN_Opti_C-SingleTesti_CTA-NONE_Pain-W_M-NONE_VL-None_TR-None_G-NONE_P-ORG_S-NONE,US || 3rd party page: Matthew || Static || Batch 1 || 1C || 30/12/24,SHARE,$38,"1,629",2024-12-30,2025-01-03,4
250,CB_2023_Oct_FB_2516_VK_V13_9x16_VID_EN_Opti_C-Benefits_CTA-AUTUM_Pain-W-B_M-PASQ_VL-30s_TR-None_G-M_P-Plan_S-WHAT,ðŸ’°WC || US || Advantage+ || BIG BUDGET || CC101->105->109->112->114-116->117 || BROAD || ABO || 1C || 17/01/24 RELAUNCHED Ad set,VIDEO,$37,"1,518",2024-01-17,2025-02-06,386
251,CB_2024_Dec_FB_3648_DT_V01_16x9_IMG_EN_Opti_C-NONE_Evergreen_CTA-NONE_Angle-None_M-NONE_VL-None_G-NONE_P-OG_S-NONE.png,US || VSL || 3648 - VSL static opti || Landing: CB quiz || 1C || 01/01/25,SHARE,$36,958,2025-01-02,2025-01-03,1
252,CB_2024_Dec_FB_3614_CHUB_V05_9x16_VID_EN_New_C-Headline_CTA-NONE_Angle-W_M-NONE_VL-15s_TR-None_G-NONE_P-NONE_S-NONE,3614 CHUB - Presentation ads || Enhancements: OFF || CBV1 || Batch 2 || 1C || 05/01/25w01 || Kostas,VIDEO,$35,838,2025-01-05,2025-01-09,4
253,CB_2024_Dec_FB_3590_LZ-KB_V03_4x5_IMG_EN_Opti_C-Headline_Sale_CTA-NY_Angle-W-B-C_M-NONE_VL-None_G-NONE_P-OG_S-NONE_FB3297V01,3590 - CB - IMG - NOTION _ #53 New year - same me 2 || Enhancements: OFF || CBV1 || Batch 2 || 1C || 28/12/24w52 || Kostas,SHARE,$35,"1,149",2024-12-28,2024-12-30,2
254,CB_2024_Mar_FB_2888_JG_V03_9x16_IMG_EN_Opti_C-Benefits_CTA-NONE_Pain-W_M-NONE_VL-None_TR-None_G-NONE_P-V2_S-NONE,CBV2 || Advantage+ || US || 5% EXISTING CAP || BROAD || 7C || 30/12/24  Campaign Ad set,SHARE,$34,"1,804",2024-12-30,2025-01-02,3
255,CB_2024_Dec_FB_3601_VK-DP_V09_4x5_VID_EN_Opti_C-Dance_CTA-NY_Pain-W-B_M-JOG_VL-30s_TR-None_G-F_P-OG_S-WHAT_FB3045V01 - Copy,ðŸ’°WC || US || Advantage+ || BIG BUDGET || CC101->105->109->112->114-116 || BROAD || ABO || 1C || 17/01/24 RELAUNCHED Ad set,VIDEO,$33,774,2024-12-27,2025-02-06,41
256,CB_2024_Jan_FB_2717_MB-RP_V26_9x16_VID_EN_New_C-Buzz_CTA-SALE_Pain-W-B-C_M-MIX_VL-45s_TR-None_G-MF_P-Method_S-NONE,CA || COST CAP 92->93 || 7C || 10/05/24 || V1,VIDEO,$32,"2,187",2024-08-22,2025-02-27,189
257,CB_2024_Dec_FB_3582_LZ-KB_V02_4x5_IMG_EN_New_C-Headline_Evergreen_CTA-NONE_Angle-ADVTR_M-NONE_VL-None_G-NONE_P-NONE_S-NONE,CBV2 || LP:HI 3582 - secret behind the label advertorial ads || Batch 1 || BROAD || 1C ||  03/01/25 || Kostas,SHARE,$32,515,2025-01-03,2025-01-05,2
258,CB_2024_Dec_FB_3622_LZ-KB_V03_4x5_IMG_EN_Opti_C-NONE_Sale_CTA-XMAS_Angle-GH_M-NONE_VL-None_G-NONE_P-OG_S-NONE_FB2227V08 - Copy,US || Manual Bid || BID CAP 111 || 1C || 21/12/24,SHARE,$31,"1,123",2024-12-22,2025-03-26,94
259,CB_2024_Dec_FB_3617_VK-JT_V02_4x5_VID_EN_New_C-BulletPoints_Sale_CTA-NY_Angle-W-B-C_M-NONE_VL-None_G-NONE_P-OG_S-NONE,3617 - CB - CRAVINGS - NY SAME YOU || Enhancements: OFF || CBV1 || Batch 1 || 1C || 30/12/24w01 || Kostas,SHARE,$31,"1,412",2024-12-30,2025-01-02,3
260,CB_2024_Nov_FB_3562_VK-JG_V03_4x5_IMG_EN_New_C-BulletPoints_Sale_CTA-BF70_Angle-W_M-NONE_VL-.png,UK || ASC+ || 7DC || Existing 10% || 13.11.2024 Ad set,SHARE,$30,"1,589",2024-11-28,2025-01-16,49
261,CB_2023_May_FB_2103_MB_V02_9x16_VID_EN_Opti_C-Sale_CTA-SMR_Pain-W_M-JOG_VL-30s_TR-None_G-M-F_P-None_S-What,US || Manual Bid || BFCM || COST CAP 91 || 1C || 15/11/24,VIDEO,$29,"1,235",2024-11-15,2025-02-27,104
262,CB_2024_Feb_FB_2834_DA_V04_4x5_IMG_EN_Opti_C-SingleTesti_CTA-NONE_Pain-W_M-NONE_VL-None_TR-None_G-NONE_P-V2_S-NONE_FB2759V04,CBV2 || EU (UK) || ðŸ’° Advantage+ || US || BROAD || 7C || Existing_customer_5% || 15/12/24 Ad set,SHARE,$29,"1,096",2024-12-15,2025-01-31,47
263,CB_2024_Feb_FB_KB_V02_1x1_IMG_EN_Opti_C-SingleTesti_CTA-NONE_Pain-W_M-NONE_VL-None_TR-None_G-NONE_P-ORG_S-NONE - Copy,US || 3rd party page: Matthew || Static || Batch 1 || 1C || 30/12/24,SHARE,$28,944,2024-12-30,2025-01-03,4
264,CB_2024_Dec_FB_3582_LZ-KB_V12_4x5_IMG_EN_New_C-Headline_Evergreen_CTA-NONE_Angle-ADVTR_M-NONE_VL-None_G-NONE_P-NONE_S-NONE,CBV2 || LP:HI 3582 - secret behind the label advertorial ads || Batch 3 || BROAD || 1C ||  03/01/25 || Kostas,SHARE,$28,702,2025-01-03,2025-01-06,3
265,CB_2023_May_FB_2103_MB_V02_9x16_VID_EN_Opti_C-Sale_CTA-SMR_Pain-W_M-JOG_VL-30s_TR-None_G-M-F_P-None_S-What,US || Manual Bid || BFCM || ROAS GOAL: 1.4 || 1C || 15/11/24,VIDEO,$28,564,2024-11-15,2025-02-27,104
266,CB_2024_Dec_FB_3617_VK-JT_V01_4x5_VID_EN_New_C-BulletPoints_Sale_CTA-NY_Angle-W-B-C_M-NONE_VL-None_G-NONE_P-OG_S-NONE,3617 - CB - CRAVINGS - NY SAME YOU || Enhancements: OFF || CBV1 || Batch 1 || 1C || 30/12/24w01 || Kostas,SHARE,$27,"1,177",2024-12-30,2025-01-02,3
267,CB_2023_Dec_FB_2712_RS-DP_V02_1x1_VID_EN_Opti_C-WrittenTesti_CTA-SALE_Pain-W-B-C_M-NONE_VL-None_TR-None_G-NONE_P-V2_S-NONE_FB2227V08,CBV2 || Advantage+ || US || 5% EXISTING CAP || BROAD || 7C || 30/12/24  Campaign Ad set,SHARE,$26,"1,050",2024-12-30,2025-01-02,3
268,CB_2023_Jul_FB_2217_IB_V04_9x16_VID_EN_Opti_C-Pointing_CTA-SMR_Pain-W-B_M-TRC_VL-30s_TR-None_G-F_P-None_S-FRIGGA,US || Manual Bid || BFCM || COST CAP 91 || 1C || 15/11/24,VIDEO,$25,832,2024-11-15,2025-02-27,104
269,CB_2024_Dec_FB_3653_LZ-VU_V03_4x5_IMG_EN_New_C-Headline_Evergreen_CTA-NONE_Angle-W_M-NONE_VL-None_G-F_P-NONE_S-NONE.png,3653 - Valentinas' Hyper targeting ad || Enhancements: OFF || CBV1 || Batch 1 || 1C || 05/01/25w01 || Valentinas,SHARE,$25,"1,375",2025-01-05,2025-01-09,4
270,CB_2023_Nov_FB_2648_DT_V01_1x1_GIF_EN_Opti_C-Sale_CTA-XMAS_None_M-NONE_VL-None_TR-None_G-NONE_P-OG_S-NONE,ðŸ’°WC || US || Advantage+ || BIG BUDGET || CC101->105->109->112->114-116 || BROAD || ABO || 1C || 17/01/24 RELAUNCHED Ad set,VIDEO,$25,297,2024-01-17,2025-02-06,386
271,CB_2024_Dec_FB_3627_LZ-DP_V01_4x5_VID_EN_Opti_C-NONE_Sale_CTA-NY_Angle-W_M-ATBJ_VL-30s_G-F_P-OG_S-WHAT_FB3097V03,ASC+ || NYNM ðŸŽ† || US || 0% EXISTING CAP || 1C || 31.12.24 Ad set,VIDEO,$25,470,2024-12-31,2025-01-03,3
272,CB_2022_Mar3_FB_713_IK_V04_1x1_IMG_EN_Opti_C-WrittenTesti_HE-98_A-ExtremeBodyVisualization_HK-bodypart_Pain-W_CLR-PURPLE_BG-IMAGE_ME-MIX_MA-YOUNG,UK || ASC+ || 7DC || Existing 10% || 13.11.2024 Ad set,SHARE,$25,"1,505",2024-11-14,2025-01-16,63
273,CB_2024_Jan_FB_2797_VK-RP-RS_V04_1x1_IMG_EN_Opti_C-ADVRT_CTA-NONE_Pain-W_M-NONE_VL-None_TR-None,ðŸ“š US+CA || ASC+ || Advertorials || 7C || 15/10.24 Ad set,SHARE,$24,"1,546",2024-10-15,2024-12-31,77
274,CB_2025_Jan_FB_3651_SO-JT_V06_4x5_IMG_EN_New_C-NONE_Evergreen_CTA-SALE_Angle-None_M-NONE_VL-None_G-NONE_P-NONE_S-NONE,3651 - NYNM - RIDDLES NOTION #77 || Enhancements: OFF || CBV1 || Batch 2 || 1C || 05/01/25w01 || Kostas,SHARE,$24,819,2025-01-05,2025-01-07,2
275,CB_2024_Dec_FB_3639_CHUB_V02_1x1_IMG_EN_New_C-NONE_CTA-NONE_Angle-W_M-NONE_VL-None_TR-None_G-NONE_P-NONE_S-NONE,3639 CHUB â€“ Looking 15 people || Enhancements: OFF || CBV1 || Batch 1 || 1C || 30/12/24w01 || Kostas,SHARE,$24,896,2024-12-30,2025-01-13,14
276,CB_2024_Dec_FB_3590_LZ-KB_V07_4x5_IMG_EN_Opti_C-Headline_Sale_CTA-NY_Angle-SC_M-NONE_VL-None_G-NONE_P-NONE_S-NONE_FB2227V08,3590 - CB - IMG - NOTION _ #53 New year - same me 2 || Enhancements: OFF || CBV1 || Batch 3 || 1C || 28/12/24w52 || Kostas,SHARE,$23,989,2024-12-28,2025-01-02,5
277,CB_2023_May_FB_2144_MB_V02_9x16_VID_EN_Opti_C-Sale_CTA-SMR_Pain-W_M-JOG_VL-30s_TR-None_G-M-F_P-None_S-What,CA || COST CAP 91 || 7C || 03/42/24 || V1,VIDEO,$22,"1,962",2024-05-03,2025-01-13,255
278,CB_2024_Dec_FB_3644_CHUB_V04_1x1_IMG_EN_New_C-NONE_CTA-NONE_Angle-C_P-NONE,3644 CHUB Skibidi Toilet || Enhancements: OFF || CBV1 || Batch 1 || 1C || 30/12/24w01 || Kostas,SHARE,$22,926,2024-12-30,2025-01-01,2
279,CB_2024_Jan_FB_2762_IK_V04_1x1_IMG_EN_New_C-WrittenTesti_CTA-CTA_Pain-W-B-C_M-NONE_VL-None_TR-None_G-NONE_P-V2_S-NONE,CBV2 || AU || ðŸ’° Advantage+ || US || BROAD || 7C || Existing_customer_5% || 19/12/24 Ad set,SHARE,$21,528,2024-12-19,2025-03-27,98
280,CB_2024_Dec_FB_3614_CHUB_V03_9x16_VID_EN_New_C-Headline_CTA-NONE_Angle-W_M-NONE_VL-15s_TR-None_G-NONE_P-NONE_S-NONE,3614 CHUB - Presentation ads || Enhancements: OFF || CBV1 || Batch 2 || 1C || 05/01/25w01 || Kostas,VIDEO,$21,571,2025-01-05,2025-01-09,4
281,CB_2023_May_FB_2263_MB_V04_9x16_VID_EN_New_C-Sale_CTA-SMR_Pain-W_M-JOG_VL-45s_TR-None_G-M-F_P-None_S-Moon,CBV2 || Advantage+ || Only V1 Ads || US || 5% EXISTING CAP || BROAD || 7C || 30/12/24  Campaign Ad set,VIDEO,$21,893,2024-12-30,2025-01-22,23
282,CB_2024_Dec_FB_3601_VK-DP_V12_9x16_VID_EN_Opti_C-Dance_CTA-NY_Pain-W-B_M-JOG_VL-30s_TR-None_G-F_P-OG_S-NEW_FB3045V03.mp4,3601 - New footage new actors opti (Manuel GRIDBANK) || Enhancements: OFF || CBV1 || Batch 3 || 1C || 22/12/24w52 || Valentinas,SHARE,$21,762,2024-12-22,2025-01-02,11
283,CB_2024_Oct_PIN_30_KB_V11_2x3_IMG_EN_Opti_C-NONE_CTA-NONE_None_M-NONE_VL-None_TR-None_G-NONE_P-OG_S-NONE,US || 3rd party page: Personal Coach Nicole || Static || Batch 2 || 1C || 30/12/24,SHARE,$20,679,2024-12-30,2024-12-30,0
284,CB_2024_Dec_FB_3601_VK-DP_V10_9x16_VID_EN_Opti_C-Dance_CTA-NY_Pain-W-B_M-JOG_VL-30s_TR-None_G-F_P-OG_S-NEW_FB3045V02.mp4,3601 - New footage new actors opti (Manuel GRIDBANK) || Enhancements: OFF || CBV1 || Batch 3 || 1C || 22/12/24w52 || Valentinas,SHARE,$20,624,2024-12-22,2025-01-02,11
285,CB_2025_Jan_FB_3651_SO-JT_V03_4x5_IMG_EN_New_C-NONE_Evergreen_CTA-SALE_Angle-None_M-NONE_VL-None_G-NONE_P-NONE_S-NONE,3651 - NYNM - RIDDLES NOTION #77 || Enhancements: OFF || CBV1 || Batch 1 || 1C || 05/01/25w01 || Kostas,SHARE,$20,761,2025-01-05,2025-01-15,10
286,20230907_100759,AU || 3rd party page: Fitness Coach Nicole || Organic Ads || Batch 1 || 1C || 03/01/2025,SHARE,$20,863,2025-01-03,2025-01-09,6
287,CB_2023_Nov_FB_2648_DT_V01_1x1_GIF_EN_Opti_C-Sale_CTA-XMAS_None_M-NONE_VL-None_TR-None_G-NONE_P-OG_S-NONE,ðŸ’°WC || US || Advantage+ || BIG BUDGET || CC101->105->109->112->114-116->117 || BROAD || ABO || 1C || 17/01/24 RELAUNCHED Ad set,VIDEO,$19,114,2024-01-17,2025-02-06,386
288,CB_2025_Jan_FB_3651_SO-JT_V08_4x5_IMG_EN_New_C-NONE_Evergreen_CTA-SALE_Angle-None_M-NONE_VL-None_G-NONE_P-NONE_S-NONE,3651 - NYNM - RIDDLES NOTION #77 || Enhancements: OFF || CBV1 || Batch 2 || 1C || 05/01/25w01 || Kostas,SHARE,$19,494,2025-01-05,2025-01-09,4
289,CB_2024_Dec_FB_3582_LZ-KB_V08_4x5_IMG_EN_New_C-Headline_Evergreen_CTA-NONE_Angle-ADVTR_M-NONE_VL-None_G-NONE_P-NONE_S-NONE,CBV2 || LP:HI 3582 - secret behind the label advertorial ads || Batch 2 || BROAD || 1C ||  03/01/25 || Kostas,SHARE,$18,835,2025-01-03,2025-01-04,1
290,CB_2024_Oct_FB_3251_LZ-VU_V01_1x1_IMG_EN_New_C-NegativeMark_Evergreen_CTA-NONE_Angle-Cort_M-NONE_VL-None_G-NONE_P-NONE_S-NONE.png,US || Manual Bid || BFCM || COST CAP 91 || 1C || 15/11/24,SHARE,$18,655,2024-11-15,2025-02-27,104
291,CB_2024_Mar_FB_2888_JG_V01_9x16_IMG_EN_Opti_C-Benefits_CTA-NONE_Pain-W_M-NONE_VL-None_TR-None_G-NONE_P-V2_S-NONE,CBV2 || EU (UK) || ðŸ’° Advantage+ || US || BROAD || 7C || Existing_customer_5% || 15/12/24 Ad set,SHARE,$18,662,2024-12-15,2025-01-31,47
292,CB_2024_Dec_FB_3645_LZ-DP_V03_4x5_VID_EN_Opti_C-Testimonial_Sale_CTA-NY_Angle-W-B_M-LNC_VL-30s_G-F_P-OG_S-MOON_FB3090V02,3645 - NYNM laurencaress new footage 3090 opti || Enhancements: OFF || CBV1 || Batch 1 || 1C || 24/12/24w52 || Kostas,SHARE,$17,478,2024-12-24,2024-12-31,7
293,CB_2022_Mar3_FB_713_IK_V04_1x1_IMG_EN_Opti_C-WrittenTesti_HE-98_A-ExtremeBodyVisualization_HK-bodypart_Pain-W_CLR-PURPLE_BG-IMAGE_ME-MIX_MA-YOUNG,View Content || BROAD || 7C || 17/12/24,SHARE,$17,"2,048",2024-12-17,2025-01-20,34
294,CB_2024_Dec_FB_3614_CHUB_V02_9x16_VID_EN_New_C-Headline_CTA-NONE_Angle-W_M-NONE_VL-15s_TR-None_G-NONE_P-NONE_S-NONE,3614 CHUB - Presentation ads || Enhancements: OFF || CBV1 || Batch 2 || 1C || 05/01/25w01 || Kostas,VIDEO,$17,440,2025-01-05,2025-01-09,4
295,CB_2024_Dec_FB_3582_LZ-KB_V06_4x5_IMG_EN_New_C-Headline_Evergreen_CTA-NONE_Angle-ADVTR_M-NONE_VL-None_G-NONE_P-NONE_S-NONE,CBV2 || LP:HI 3582 - secret behind the label advertorial ads || Batch 2 || BROAD || 1C ||  03/01/25 || Kostas,SHARE,$16,593,2025-01-03,2025-01-04,1
296,CB_2024_Oct_FB_3251_LZ-VU_V01_1x1_IMG_EN_New_C-NegativeMark_Evergreen_CTA-NONE_Angle-Cort_M-NONE_VL-None_G-NONE_P-NONE_S-NONE.png,US || Manual Bid || BFCM || ROAS GOAL: 1.4 || 1C || 15/11/24,SHARE,$16,538,2024-11-15,2025-02-27,104
297,CB_2024_Dec_FB_3590_LZ-KB_V01_4x5_IMG_EN_Opti_C-Headline_Sale_CTA-NY_Angle-W-B-C_M-NONE_VL-None_G-NONE_P-OG_S-NONE_FB3297V01,3590 - CB - IMG - NOTION _ #53 New year - same me 2 || Enhancements: OFF || CBV1 || Batch 2 || 1C || 28/12/24w52 || Kostas,SHARE,$15,535,2024-12-28,2024-12-30,2
298,CB_2024_Dec_FB_3619_VK-JT_V01_4x5_VID_EN_New_C-BulletPoints_Sale_CTA-NY_Angle-W-B-C_M-NONE_VL-None_G-NONE_P-OG_S-NONE,3619 - CB - CRAVINGS - IMG - TESTIMONIAL || Enhancements: OFF || CBV1 || Batch 1 || 1C || 23/12/24w52 || Kostas,SHARE,$15,537,2024-12-23,2025-01-15,23
299,CB_2024_Mar_FB_2888_JG_V01_9x16_IMG_EN_Opti_C-Benefits_CTA-NONE_Pain-W_M-NONE_VL-None_TR-None_G-NONE_P-V2_S-NONE,CBV2 || NZ || ðŸ’° Advantage+ || US || BROAD || 7C || Existing_customer_5% || 19/12/24 Campaign Ad set,SHARE,$15,806,2024-12-19,2025-01-11,23
300,CB_2025_Jan_FB_3651_SO-JT_V02_4x5_IMG_EN_New_C-NONE_Evergreen_CTA-SALE_Angle-None_M-NONE_VL-None_G-NONE_P-NONE_S-NONE,3651 - NYNM - RIDDLES NOTION #77 || Enhancements: OFF || CBV1 || Batch 1 || 1C || 05/01/25w01 || Kostas,SHARE,$15,610,2025-01-05,2025-01-15,10
301,CB_2024_Dec_FB_3622_LZ-KB_V03_4x5_IMG_EN_Opti_C-NONE_Sale_CTA-XMAS_Angle-GH_M-NONE_VL-None_G-NONE_P-OG_S-NONE_FB2227V08 - Copy,US || Manual Bid || BID CAP 105 || 1C || 21/12/24,SHARE,$15,526,2024-12-22,2025-03-11,79
302,CB_2024_Dec_FB_3644_CHUB_V01_1x1_IMG_EN_New_C-NONE_CTA-NONE_Angle-C_P-NONE,3644 CHUB Skibidi Toilet || Enhancements: OFF || CBV1 || Batch 1 || 1C || 30/12/24w01 || Kostas,SHARE,$14,609,2024-12-30,2025-01-01,2
303,CB_2024_Dec_FB_3658_LZ-VU_V04_4x5_IMG_EN_New_C-BeforeAfter_Evergreen_CTA-NONE_Angle-W_M-NONE_VL-None_G-NONE_P-OG_S-NONE,3658 - ridge inspired humorous ads marmot || Enhancements: OFF || CBV1 || Batch 1 || 1C || 05/01/25w01 || Kostas,SHARE,$14,548,2025-01-05,2025-01-09,4
304,CB_2024_Dec_FB_3614_CHUB_V01_9x16_VID_EN_New_C-Headline_CTA-NONE_Angle-W_M-NONE_VL-15s_TR-None_G-NONE_P-NONE_S-NONE,3614 CHUB - Presentation ads || Enhancements: OFF || CBV1 || Batch 2 || 1C || 05/01/25w01 || Kostas,VIDEO,$14,256,2025-01-05,2025-01-09,4
305,CB_2022_Nov_FB_1218_RS_V15_9x16_IMG_EN_Opti_C-Sale_CTA-BLACK_Pain-W_M-NONE_VL-None FB1671V08,US || Manual Bid || BFCM || ROAS GOAL: 1.4 || 1C || 15/11/24,SHARE,$13,386,2024-11-15,2025-02-27,104
306,CB_2024_Jan_FB_2762_IK_V04_1x1_IMG_EN_New_C-WrittenTesti_CTA-CTA_Pain-W-B-C_M-NONE_VL-None_TR-None_G-NONE_P-V2_S-NONE,CBV2 || NZ || ðŸ’° Advantage+ || US || BROAD || 7C || Existing_customer_5% || 19/12/24 Campaign Ad set,SHARE,$13,504,2024-12-19,2025-01-11,23
307,CB_2025_Jan_FB_3651_SO-JT_V04_4x5_IMG_EN_New_C-NONE_Evergreen_CTA-SALE_Angle-None_M-NONE_VL-None_G-NONE_P-NONE_S-NONE,3651 - NYNM - RIDDLES NOTION #77 || Enhancements: OFF || CBV1 || Batch 1 || 1C || 05/01/25w01 || Kostas,SHARE,$13,328,2025-01-05,2025-01-15,10
308,CB_2024_Feb_FB_KB_V04_1x1_IMG_EN_Opti_C-SingleTesti_CTA-NONE_Pain-W_M-NONE_VL-None_TR-None_G-NONE_P-ORG_S-NONE,US || 3rd party page: Matthew || Static || Batch 1 || 1C || 30/12/24,SHARE,$13,493,2024-12-30,2025-01-03,4
309,CB_2024_Dec_FB_3645_LZ-DP_V01_4x5_VID_EN_Opti_C-Testimonial_Sale_CTA-NY_Angle-W-B_M-LNC_VL-30s_G-F_P-OG_S-MOON_FB3090V02,ASC+ || NYNM ðŸŽ† || US || 0% EXISTING CAP || 1C || 31.12.24 Ad set,VIDEO,$12,339,2024-12-31,2025-01-03,3
310,CB_2024_Dec_FB_3582_LZ-KB_V05_4x5_IMG_EN_New_C-Headline_Evergreen_CTA-NONE_Angle-ADVTR_M-NONE_VL-None_G-NONE_P-NONE_S-NONE,CBV2 || LP:HI 3582 - secret behind the label advertorial ads || Batch 2 || BROAD || 1C ||  03/01/25 || Kostas,SHARE,$12,501,2025-01-03,2025-01-04,1
311,CB_2024_Dec_FB_3614_CHUB_V04_9x16_VID_EN_New_C-Headline_CTA-NONE_Angle-W_M-NONE_VL-15s_TR-None_G-NONE_P-NONE_S-NONE,3614 CHUB - Presentation ads || Enhancements: OFF || CBV1 || Batch 2 || 1C || 05/01/25w01 || Kostas,VIDEO,$12,399,2025-01-05,2025-01-09,4
312,CB_2024_Jan_FB_2717_MB-RP_V26_9x16_VID_EN_New_C-Buzz_CTA-SALE_Pain-W-B-C_M-MIX_VL-45s_TR-None_G-MF_P-Method_S-NONE,CA || COST CAP 91 || 7C || 03/42/24 || V1,VIDEO,$10,719,2024-05-10,2025-01-13,248
313,CB_2023_Jul_FB_2226_MB_V04_9x16_VID_EN_Opti_C-Testim_CTA-SMR_Pain-W_M-MIX_VL-30s_TR-None_G-F_P-None_S-Starry,US || Manual Bid || BFCM || COST CAP 91 || 1C || 15/11/24,VIDEO,$10,277,2024-11-15,2025-02-27,104
314,CB_2024_Dec_FB_3592_VK-DP_V09_4x5_VID_EN_New_C-BulletPoints_Sale_CTA-SALE_Angle-W-B-C_M-NONE_VL-30s_G-F_P-OG_S-WHAT - Copy,ASC+ || VIDEO Only || US || 0% EXISTING CAP || 1C || 08.12.24  Ad set,VIDEO,$9,231,2024-12-20,2025-02-05,47
315,CB_2024_Dec_FB_3590_LZ-KB_V02_4x5_IMG_EN_Opti_C-Headline_Sale_CTA-NY_Angle-W-B-C_M-NONE_VL-None_G-NONE_P-OG_S-NONE_FB3297V01,3590 - CB - IMG - NOTION _ #53 New year - same me 2 || Enhancements: OFF || CBV1 || Batch 2 || 1C || 28/12/24w52 || Kostas,SHARE,$9,316,2024-12-28,2024-12-30,2
316,CB_2025_Jan_FB_3651_SO-JT_V07_4x5_IMG_EN_New_C-NONE_Evergreen_CTA-SALE_Angle-None_M-NONE_VL-None_G-NONE_P-NONE_S-NONE,3651 - NYNM - RIDDLES NOTION #77 || Enhancements: OFF || CBV1 || Batch 2 || 1C || 05/01/25w01 || Kostas,SHARE,$9,359,2025-01-05,2025-01-09,4
317,CB_2024_Dec_FB_3659_LZ-VU_V02_4x5_IMG_EN_New_C-Headline_Evergreen_CTA-NONE_Angle-W_M-NONE_VL-None_G-M_P-NONE_S-NONE.png,3659 - BRO ads || Enhancements: OFF || CBV1 || Batch 1 || 1C || 05/01/25w01 || Valentinas,SHARE,$9,460,2025-01-05,2025-01-09,4
318,CB_2023_Dec_FB_2694_DT-DP_V17_1x1_GIF_EN_New_C-NONE_CTA-NY65_None_M-NONE_VL-15s_TR-None_G-NONE_P-OG_S-NONE,ðŸ’°WC || US || Advantage+ || BIG BUDGET || CC101->105->109->112->114-116->117 || BROAD || ABO || 1C || 17/01/24 RELAUNCHED Ad set,VIDEO,$9,78,2024-01-18,2025-02-06,385
319,CB_2024_Oct_FB_3182_ZS-GC_V13_1x1_IMG_EN_New_C-UsVsThem_Evergreen_CTA-NONE_Angle-B-C_M-NONE_VL-None_G-NONE_P-OG_S-NONE,CBV2 || Advantage+ || US || 5% EXISTING CAP || BROAD || 7C || 30/12/24  Campaign Ad set,SHARE,$8,461,2024-12-30,2025-01-02,3
320,CB_2024_Dec_FB_3582_LZ-KB_V09_4x5_IMG_EN_New_C-Headline_Evergreen_CTA-NONE_Angle-ADVTR_M-NONE_VL-None_G-NONE_P-NONE_S-NONE,CBV2 || LP:HI 3582 - secret behind the label advertorial ads || Batch 3 || BROAD || 1C ||  03/01/25 || Kostas,SHARE,$7,559,2025-01-03,2025-01-06,3
321,CB_2024_Dec_FB_3582_LZ-KB_V01_4x5_IMG_EN_New_C-Headline_Evergreen_CTA-NONE_Angle-ADVTR_M-NONE_VL-None_G-NONE_P-NONE_S-NONE,CBV2 || LP:HI 3582 - secret behind the label advertorial ads || Batch 1 || BROAD || 1C ||  03/01/25 || Kostas,SHARE,$7,292,2025-01-03,2025-01-05,2
322,CB_2023_Dec_FB_2694_DT-DP_V17_1x1_GIF_EN_New_C-NONE_CTA-NY65_None_M-NONE_VL-15s_TR-None_G-NONE_P-OG_S-NONE,ðŸ’°WC || US || Advantage+ || BIG BUDGET || CC101->105->109->112->114-116 || BROAD || ABO || 1C || 17/01/24 RELAUNCHED Ad set,VIDEO,$7,180,2024-01-18,2025-02-06,385
323,CB_2024_Dec_FB_3590_LZ-KB_V05_4x5_IMG_EN_Opti_C-Headline_Sale_CTA-NY_Angle-SC_M-NONE_VL-None_G-NONE_P-OG_S-NONE_FB3573V02,3590 - CB - IMG - NOTION _ #53 New year - same me 2 || Enhancements: OFF || CBV1 || Batch 1 || 1C || 28/12/24w52 || Kostas,SHARE,$7,202,2024-12-28,2024-12-30,2
324,CB_2024_Dec_FB_3617_VK-JT_V01_4x5_VID_EN_New_C-BulletPoints_Sale_CTA-NY_Angle-W-B-C_M-NONE_VL-None_G-NONE_P-OG_S-NONE,3617 - CB - CRAVINGS - NY SAME YOU || Enhancements: OFF || CBV1 || Batch 1 || 1C || 02/01/25w01 || Kostas,SHARE,$6,390,2025-01-02,2025-01-05,3
325,CB_2024_Oct_FB_3251_LZ-VU_V01_1x1_IMG_EN_New_C-NegativeMark_Evergreen_CTA-NONE_Angle-Cort_M-NONE_VL-None_G-NONE_P-NONE_S-NONE.png,View Content || BROAD || 7C || 17/12/24,SHARE,$6,602,2024-12-17,2025-01-20,34
326,CB_2024_Dec_FB_3626_LZ-KB_V03_4x5_VID_EN_Opti_C-NONE_Sale_CTA-NY_Angle-W_M-ATBJ_VL-45s_G-F_P-OG_S-MOON_FB2865V04,3626 - NYNM astoldbyjas new footage 2865 trinity opti || Enhancements: OFF || CBV1 || Batch 1 || 1C || 23/12/24w52 || Kostas,SHARE,$5,182,2024-12-23,2024-12-31,8
327,CB_2024_Dec_FB_3644_CHUB_V02_1x1_IMG_EN_New_C-NONE_CTA-NONE_Angle-C_P-NONE,3644 CHUB Skibidi Toilet || Enhancements: OFF || CBV1 || Batch 1 || 1C || 30/12/24w01 || Kostas,SHARE,$5,217,2024-12-30,2025-01-01,2
328,CB_2024_Dec_FB_3601_VK-DP_V11_9x16_VID_EN_Opti_C-Dance_CTA-NY_Pain-W-B_M-JOG_VL-30s_TR-None_G-F_P-OG_S-NEW_FB3045V02.mp4,3601 - New footage new actors opti (Manuel GRIDBANK) || Enhancements: OFF || CBV1 || Batch 3 || 1C || 22/12/24w52 || Valentinas,SHARE,$5,188,2024-12-22,2025-01-02,11
329,CB_2024_Jan_FB_2762_IK_V04_1x1_IMG_EN_New_C-WrittenTesti_CTA-CTA_Pain-W-B-C_M-NONE_VL-None_TR-None_G-NONE_P-V2_S-NONE,CBV2 || EU (UK) || ðŸ’° Advantage+ || US || BROAD || 7C || Existing_customer_5% || 15/12/24 Ad set,SHARE,$5,199,2024-12-15,2025-01-31,47
330,CB_2023_Jul_FB_2217_IB_V04_9x16_VID_EN_Opti_C-Pointing_CTA-SMR_Pain-W-B_M-TRC_VL-30s_TR-None_G-F_P-None_S-FRIGGA,US || Manual Bid || BFCM || COST CAP 81 || 1C || 15/11/24,VIDEO,$5,181,2024-11-15,2025-03-16,121
331,CB_2024_Nov_FB_3561_SO-JT_V06_4x5_IMG_EN_New_C-NONE_Evergreen_CTA-NONE_Angle-None_M-NONE_VL-None_G-NONE_P-NONE_S-NONE,3561 - Notion Andy Warhol || Enhancements: OFF || CBV1 || Batch 3 || 1C || 27/12/24w52 || Kostas,SHARE,$5,197,2024-12-27,2024-12-31,4
332,CB_2024_Dec_FB_3653_LZ-VU_V04_4x5_IMG_EN_New_C-Headline_Evergreen_CTA-NONE_Angle-W_M-NONE_VL-None_G-F_P-NONE_S-NONE.png,3653 - Valentinas' Hyper targeting ad || Enhancements: OFF || CBV1 || Batch 1 || 1C || 05/01/25w01 || Valentinas,SHARE,$4,181,2025-01-05,2025-01-08,3
333,CB_2024_Dec_FB_3626_LZ-KB_V01_4x5_VID_EN_Opti_C-NONE_Sale_CTA-NY_Angle-W_M-ATBJ_VL-45s_G-F_P-OG_S-MOON_FB2865V04,ASC+ || NYNM ðŸŽ† || US || 0% EXISTING CAP || 1C || 31.12.24 Ad set,VIDEO,$4,136,2024-12-31,2025-01-03,3
334,CB_2024_Dec_FB_3601_VK-DP_V09_4x5_VID_EN_Opti_C-Dance_CTA-NY_Pain-W-B_M-JOG_VL-30s_TR-None_G-F_P-OG_S-WHAT_FB3045V01 - Copy,ðŸ’°WC || US || Advantage+ || BIG BUDGET || CC101->105->109->112->114-116->117 || BROAD || ABO || 1C || 17/01/24 RELAUNCHED Ad set,VIDEO,$4,134,2024-12-27,2025-02-06,41
335,CB_2024_Nov_FB_3572_SO-JT_V03_4x5_IMG_EN_New_C-NONE_Evergreen_CTA-NONE_Angle-None_M-NONE_VL-None_G-NONE_P-NONE_S-NONE,3572 - CB - IMG - Notion - Billboard || Enhancements: OFF || CBV1 || Batch 1 || 1C || 28/12/24w52 || Kostas,SHARE,$4,159,2024-12-28,2024-12-31,3
336,CB_2024_Nov_FB_3572_SO-JT_V01_4x5_IMG_EN_New_C-NONE_Evergreen_CTA-NONE_Angle-None_M-NONE_VL-None_G-NONE_P-NONE_S-NONE,3572 - CB - IMG - Notion - Billboard || Enhancements: OFF || CBV1 || Batch 1 || 1C || 28/12/24w52 || Kostas,SHARE,$3,116,2024-12-28,2024-12-31,3
337,CB_2024_Dec_FB_3590_LZ-KB_V09_4x5_IMG_EN_Opti_C-Headline_Sale_CTA-NY_Angle-SC_M-NONE_VL-None_G-NONE_P-NONE_S-NONE_FB2227V08,ASC+ || NYNM ðŸŽ† || US || 0% EXISTING CAP || 1C || 31.12.24 Ad set,SHARE,$3,119,2024-12-31,2025-01-03,3
338,CB_2024_Dec_FB_3619_VK-JT_V04_4x5_VID_EN_New_C-BulletPoints_Sale_CTA-NY_Angle-W-B-C_M-NONE_VL-None_G-NONE_P-OG_S-NONE,3619 - CB - CRAVINGS - IMG - TESTIMONIAL || Enhancements: OFF || CBV1 || Batch 1 || 1C || 23/12/24w52 || Kostas,SHARE,$3,128,2024-12-23,2025-01-15,23
339,CB_2024_Dec_FB_3619_VK-JT_V02_4x5_VID_EN_New_C-BulletPoints_Sale_CTA-NY_Angle-W-B-C_M-NONE_VL-None_G-NONE_P-OG_S-NONE - Copy,ðŸ’°WC || US || Advantage+ || BIG BUDGET || CC101->105->109->112->114-116 || BROAD || ABO || 1C || 17/01/24 RELAUNCHED Ad set,SHARE,$3,99,2024-12-27,2025-02-06,41
340,CB_2023_Jul_FB_2226_MB_V04_9x16_VID_EN_Opti_C-Testim_CTA-SMR_Pain-W_M-MIX_VL-30s_TR-None_G-F_P-None_S-Starry,US || Manual Bid || BFCM || ROAS GOAL: 1.4 || 1C || 15/11/24,VIDEO,$3,43,2024-11-15,2025-02-27,104
341,CB_2024_Nov_FB_3572_SO-JT_V06_4x5_IMG_EN_New_C-NONE_Evergreen_CTA-NONE_Angle-None_M-NONE_VL-None_G-NONE_P-NONE_S-NONE,3572 - CB - IMG - Notion - Billboard || Enhancements: OFF || CBV1 || Batch 1 || 1C || 28/12/24w52 || Kostas,SHARE,$3,108,2024-12-28,2024-12-31,3
342,CB_2024_Dec_FB_3590_LZ-KB_V06_4x5_IMG_EN_Opti_C-Headline_Sale_CTA-NY_Angle-SC_M-NONE_VL-None_G-NONE_P-OG_S-NONE_FB3573V03,3590 - CB - IMG - NOTION _ #53 New year - same me 2 || Enhancements: OFF || CBV1 || Batch 1 || 1C || 28/12/24w52 || Kostas,SHARE,$2,86,2024-12-28,2024-12-30,2
343,CB_2024_Dec_FB_3658_LZ-VU_V01_4x5_IMG_EN_New_C-BeforeAfter_Evergreen_CTA-NONE_Angle-W_M-NONE_VL-None_G-NONE_P-OG_S-NONE,3658 - ridge inspired humorous ads marmot || Enhancements: OFF || CBV1 || Batch 1 || 1C || 05/01/25w01 || Kostas,SHARE,$2,75,2025-01-05,2025-01-09,4
344,CB_2024_Dec_FB_3653_LZ-VU_V02_4x5_IMG_EN_New_C-Headline_Evergreen_CTA-NONE_Angle-W_M-NONE_VL-None_G-F_P-NONE_S-NONE.png,3653 - Valentinas' Hyper targeting ad || Enhancements: OFF || CBV1 || Batch 1 || 1C || 05/01/25w01 || Valentinas,SHARE,$2,90,2025-01-05,2025-01-09,4
345,CB_2024_Dec_FB_3626_LZ-KB_V02_4x5_VID_EN_Opti_C-NONE_Sale_CTA-NY_Angle-W_M-ATBJ_VL-45s_G-F_P-OG_S-MOON_FB2865V04,3626 - NYNM astoldbyjas new footage 2865 trinity opti || Enhancements: OFF || CBV1 || Batch 1 || 1C || 23/12/24w52 || Kostas,SHARE,$2,73,2024-12-23,2024-12-31,8
346,CB_2023_May_FB_2263_MB_V04_9x16_VID_EN_New_C-Sale_CTA-SMR_Pain-W_M-JOG_VL-45s_TR-None_G-M-F_P-None_S-Moon,CBV2 || Advantage+ || US || 5% EXISTING CAP || BROAD || 7C || 30/12/24  Campaign Ad set,VIDEO,$2,96,2024-12-30,2025-01-02,3
347,CB_2022_Mar3_FB_713_IK_V04_1x1_IMG_EN_Opti_C-WrittenTesti_HE-98_A-ExtremeBodyVisualization_HK-bodypart_Pain-W_CLR-PURPLE_BG-IMAGE_ME-MIX_MA-YOUNG,US || Manual Bid || BFCM || COST CAP 81 || 1C || 15/11/24,SHARE,$1,82,2024-11-15,2025-03-26,131
348,CB_2023_Nov_FB_2675_DT_V01_9x16_VID_EN_Opti_C-Pointing_CTA-XMAS65_Pain-W_M-SEAN_VL-30s_TR-None_G-M_P-NONE_S-YARIN_FB2396V02,ðŸ’°WC || US || Advantage+ || BIG BUDGET || CC101->105->109->112->114-116 || BROAD || ABO || 1C || 17/01/24 RELAUNCHED Ad set,VIDEO,$1,37,2024-01-17,2025-02-06,386
349,CB_2024_Dec_FB_3619_VK-JT_V03_4x5_VID_EN_New_C-BulletPoints_Sale_CTA-NY_Angle-W-B-C_M-NONE_VL-None_G-NONE_P-OG_S-NONE,3619 - CB - CRAVINGS - IMG - TESTIMONIAL || Enhancements: OFF || CBV1 || Batch 1 || 1C || 23/12/24w52 || Kostas,SHARE,$1,106,2024-12-23,2025-01-15,23
350,CB_2024_Dec_FB_3645_LZ-DP_V02_4x5_VID_EN_Opti_C-Testimonial_Sale_CTA-NY_Angle-W-B_M-LNC_VL-30s_G-F_P-OG_S-MOON_FB3090V02,3645 - NYNM laurencaress new footage 3090 opti || Enhancements: OFF || CBV1 || Batch 1 || 1C || 24/12/24w52 || Kostas,SHARE,$1,49,2024-12-24,2024-12-31,7
351,CB_2023_Dec_FB_2721_DA-RP_V01_9x16_VID_EN_Opti_C-Sale_CTA-65_Pain-W-B_M-HIL_VL-45s_TR-None_G-F_P-Plan_S-NEW_FB2558V02 - Copy,ðŸ’°WC || US || Advantage+ || BIG BUDGET || CC101->105->109->112->114-116 || BROAD || ABO || 1C || 17/01/24 RELAUNCHED Ad set,VIDEO,$1,36,2024-01-21,2025-02-04,380
352,CB_2024_Nov_FB_3572_SO-JT_V05_4x5_IMG_EN_New_C-NONE_Evergreen_CTA-NONE_Angle-None_M-NONE_VL-None_G-NONE_P-NONE_S-NONE,3572 - CB - IMG - Notion - Billboard || Enhancements: OFF || CBV1 || Batch 1 || 1C || 28/12/24w52 || Kostas,SHARE,$1,42,2024-12-28,2024-12-31,3
353,CB_2024_Dec_FB_3619_VK-JT_V02_4x5_VID_EN_New_C-BulletPoints_Sale_CTA-NY_Angle-W-B-C_M-NONE_VL-None_G-NONE_P-OG_S-NONE - Copy,ðŸ’°WC || US || Advantage+ || BIG BUDGET || CC101->105->109->112->114-116->117 || BROAD || ABO || 1C || 17/01/24 RELAUNCHED Ad set,SHARE,$0,35,2024-12-27,2025-02-06,41
354,CB_2023_Dec_FB_2696_RS_V02_9x16_VID_EN_Opti_C-Sale_CTA-XMAS65_Pain-W-B_M-JANW_VL-30s_TR-None_G-MF_P-OG_S-WHAT_FB2284V05,ðŸ’°WC || US || Advantage+ || BIG BUDGET || CC101->105->109->112->114-116 || BROAD || ABO || 1C || 17/01/24 RELAUNCHED Ad set,VIDEO,$0,29,2024-01-17,2025-02-06,386
355,CB_2023_Jul_FB_2217_IB_V04_9x16_VID_EN_Opti_C-Pointing_CTA-SMR_Pain-W-B_M-TRC_VL-30s_TR-None_G-F_P-None_S-FRIGGA,US || Manual Bid || BID CAP 105 || 1C || 21/12/24,VIDEO,$0,5,2024-12-22,2025-03-27,95
356,CB_2022_Nov_FB_1218_RS_V15_9x16_IMG_EN_Opti_C-Sale_CTA-BLACK_Pain-W_M-NONE_VL-None FB1671V08,US || Manual Bid || BFCM || COST CAP 91 || 1C || 15/11/24,SHARE,$0,16,2024-11-15,2025-02-27,104
357,CB_2024_Dec_FB_3611_CHUB_V05_4x5_IMG_EN_Opti_C-Headline_CTA-NONE_Angle-C_P-NONE_S-NONE - Copy,US || Manual Bid || BID CAP 111 || 1C || 21/12/24,SHARE,$0,24,2024-12-27,2025-03-24,87
358,CB_2024_Nov_FB_3572_SO-JT_V04_4x5_IMG_EN_New_C-NONE_Evergreen_CTA-NONE_Angle-None_M-NONE_VL-None_G-NONE_P-NONE_S-NONE,3572 - CB - IMG - Notion - Billboard || Enhancements: OFF || CBV1 || Batch 1 || 1C || 28/12/24w52 || Kostas,SHARE,$0,14,2024-12-28,2024-12-31,3
359,CB_2023_Jul_FB_2217_IB_V04_9x16_VID_EN_Opti_C-Pointing_CTA-SMR_Pain-W-B_M-TRC_VL-30s_TR-None_G-F_P-None_S-FRIGGA,US || Manual Bid || BID CAP 111 || 1C || 21/12/24,VIDEO,$0,10,2024-12-22,2025-03-24,92
360,CB_2023_Dec_FB_2696_RS_V02_9x16_VID_EN_Opti_C-Sale_CTA-XMAS65_Pain-W-B_M-JANW_VL-30s_TR-None_G-MF_P-OG_S-WHAT_FB2284V05,ðŸ’°WC || US || Advantage+ || BIG BUDGET || CC101->105->109->112->114-116->117 || BROAD || ABO || 1C || 17/01/24 RELAUNCHED Ad set,VIDEO,$0,11,2024-01-17,2025-02-06,386
361,CB_2024_Oct_FB_3251_LZ-VU_V01_1x1_IMG_EN_New_C-NegativeMark_Evergreen_CTA-NONE_Angle-Cort_M-NONE_VL-None_G-NONE_P-NONE_S-NONE.png,US || Manual Bid || BFCM || COST CAP 81 || 1C || 15/11/24,SHARE,$0,13,2024-11-15,2025-03-17,122
362,CB_2023_Nov_FB_2675_DT_V01_9x16_VID_EN_Opti_C-Pointing_CTA-XMAS65_Pain-W_M-SEAN_VL-30s_TR-None_G-M_P-NONE_S-YARIN_FB2396V02,ðŸ’°WC || US || Advantage+ || BIG BUDGET || CC101->105->109->112->114-116->117 || BROAD || ABO || 1C || 17/01/24 RELAUNCHED Ad set,VIDEO,$0,3,2024-01-17,2025-02-06,386
363,CB_2023_May_FB_2103_MB_V02_9x16_VID_EN_Opti_C-Sale_CTA-SMR_Pain-W_M-JOG_VL-30s_TR-None_G-M-F_P-None_S-What,US || Manual Bid || BID CAP 111 || 1C || 21/12/24,VIDEO,$0,10,2024-12-28,2025-03-27,89
364,CB_2023_Dec_FB_2706_RS_V09_9x16_VID_EN_Opti_C-Sale_CTA-NY56_Pain-W_M-JOG_VL-30s_TR-None_G-F_P-OG_S-WHAT_FB1404V02,ðŸ’°WC || US || Advantage+ || BIG BUDGET || CC101->105->109->112->114-116 || BROAD || ABO || 1C || 17/01/24 RELAUNCHED Ad set,VIDEO,$0,14,2024-01-17,2025-02-05,385
365,CB_2023_Nov_FB_2664_MB_V08_9x16_VID_EN_Opti_C-Testim_CTA-XMAS65_Pain-W_M-MIX_VL-30s_TR-None_G-F_P-None_S-Starry,ðŸ’°WC || US || Advantage+ || BIG BUDGET || CC101->105->109->112->114-116->117 || BROAD || ABO || 1C || 17/01/24 RELAUNCHED Ad set,VIDEO,$0,4,2024-01-17,2025-02-04,384
366,CB_2023_Jul_FB_2226_MB_V04_9x16_VID_EN_Opti_C-Testim_CTA-SMR_Pain-W_M-MIX_VL-30s_TR-None_G-F_P-None_S-Starry,US || Manual Bid || BID CAP 111 || 1C || 21/12/24,VIDEO,$0,4,2024-12-27,2025-03-11,74
367,CB_2023_May_FB_2103_MB_V02_9x16_VID_EN_Opti_C-Sale_CTA-SMR_Pain-W_M-JOG_VL-30s_TR-None_G-M-F_P-None_S-What,US || Manual Bid || BID CAP 105 || 1C || 21/12/24,VIDEO,$0,9,2024-12-28,2025-01-19,22
368,CB_2024_Oct_FB_3251_LZ-VU_V01_1x1_IMG_EN_New_C-NegativeMark_Evergreen_CTA-NONE_Angle-Cort_M-NONE_VL-None_G-NONE_P-NONE_S-NONE.png,US || Manual Bid || BID CAP 111 || 1C || 21/12/24,SHARE,$0,3,2024-12-26,2025-02-16,52
369,CB_2023_Jul_FB_2226_MB_V04_9x16_VID_EN_Opti_C-Testim_CTA-SMR_Pain-W_M-MIX_VL-30s_TR-None_G-F_P-None_S-Starry,US || Manual Bid || BID CAP 105 || 1C || 21/12/24,VIDEO,$0,1,2024-12-29,2025-01-17,19
370,CB_2024_Dec_FB_3611_CHUB_V05_4x5_IMG_EN_Opti_C-Headline_CTA-NONE_Angle-C_P-NONE_S-NONE - Copy,US || Manual Bid || BID CAP 105 || 1C || 21/12/24,SHARE,$0,2,2024-12-28,2025-01-05,8
371,CB_2023_Dec_FB_2721_DA-RP_V01_9x16_VID_EN_Opti_C-Sale_CTA-65_Pain-W-B_M-HIL_VL-45s_TR-None_G-F_P-Plan_S-NEW_FB2558V02 - Copy,ðŸ’°WC || US || Advantage+ || BIG BUDGET || CC101->105->109->112->114-116->117 || BROAD || ABO || 1C || 17/01/24 RELAUNCHED Ad set,VIDEO,$0,3,2024-01-21,2025-02-04,380
372,CB_2024_Oct_FB_3251_LZ-VU_V01_1x1_IMG_EN_New_C-NegativeMark_Evergreen_CTA-NONE_Angle-Cort_M-NONE_VL-None_G-NONE_P-NONE_S-NONE.png,US || Manual Bid || BID CAP 105 || 1C || 21/12/24,SHARE,$0,2,2024-12-28,2025-01-29,32
373,CB_2023_Nov_FB_2664_MB_V08_9x16_VID_EN_Opti_C-Testim_CTA-XMAS65_Pain-W_M-MIX_VL-30s_TR-None_G-F_P-None_S-Starry,ðŸ’°WC || US || Advantage+ || BIG BUDGET || CC101->105->109->112->114-116 || BROAD || ABO || 1C || 17/01/24 RELAUNCHED Ad set,VIDEO,$0,8,2024-01-17,2025-02-04,384
374,CB_2023_Dec_FB_2706_RS_V09_9x16_VID_EN_Opti_C-Sale_CTA-NY56_Pain-W_M-JOG_VL-30s_TR-None_G-F_P-OG_S-WHAT_FB1404V02,ðŸ’°WC || US || Advantage+ || BIG BUDGET || CC101->105->109->112->114-116->117 || BROAD || ABO || 1C || 17/01/24 RELAUNCHED Ad set,VIDEO,$0,5,2024-01-17,2025-02-05,385
