,Ad Name,Adset Name,Creative Type,Spend In USD,Impressions,First Ad Spend Date,Last Ad Spend Date,Days ad spending
1,CB_2024_Dec_FB_CANVA_LZ-VU_V01_1x1_IMG_EN_New_C-NegativeMark_Evergreen_CTA-NONE_Angle-Cort_M-NONE_VL-None_G-NONE_P-NONE_S-NONE.png PAUSED,ðŸŒ¶ï¸ || US || ASC+ || ->CC141 || VIDEO Only || US+CA || 0% EXISTING CAP || 7C || 07/08.24  Ad set,SHARE,"$13,329","538,081",2024-12-30,2025-01-17,18
2,CB_2023_May_FB_1999_LV_V01_9x16_VID_EN_New_C-Pointing_CTA-DISCOUNT_Pain-W_M-JOG_VL-30s_TR-None,ASC+ || VIDEO Only || US || 0% EXISTING CAP || 1C || 08.12.24  Ad set,VIDEO,"$12,848","424,099",2024-12-08,2025-01-27,50
3,Dynamic_Creative_CA_Flow,WC || CA || DYNAMIC CREATIVE || ADV+ audience || 7C || 17.04.2024 || BIG BUDGET,SHARE,"$10,464","737,339",2024-04-17,2025-02-27,316
4,CB_2023_May_FB_2263_MB_V04_9x16_VID_EN_New_C-Sale_CTA-SMR_Pain-W_M-JOG_VL-45s_TR-None_G-M-F_P-None_S-Moon,ðŸŒ¶ï¸ || US || ASC+ || ->CC141 || VIDEO Only || US+CA || 0% EXISTING CAP || 7C || 07/08.24  Ad set,VIDEO,"$10,122","215,772",2024-08-07,2025-03-27,232
5,CB_2025_Jan_FB_CANVA_LZ-VU_V01_1x1_IMG_EN_New_C-NegativeMark_Evergreen_CTA-NONE_Angle-Cort_M-NONE_VL-None_G-NONE_P-NONE_S-NONE,ðŸŒ¶ï¸ || US || ASC+ || ->CC141 || VIDEO Only || US+CA || 0% EXISTING CAP || 7C || 07/08.24  Ad set,SHARE,"$9,589","397,259",2025-01-17,2025-03-14,56
6,CB_2023_Jul_FB_2217_IB_V04_9x16_VID_EN_Opti_C-Pointing_CTA-SMR_Pain-W-B_M-TRC_VL-30s_TR-None_G-F_P-None_S-FRIGGA,ðŸŒ¶ï¸ || US || ASC+ || ->CC141 || VIDEO Only || US+CA || 0% EXISTING CAP || 7C || 07/08.24  Ad set,VIDEO,"$9,273","310,962",2024-08-07,2025-03-27,232
7,CB_2023_Jul_FB_2217_IB_V04_9x16_VID_EN_Opti_C-Pointing_CTA-SMR_Pain-W-B_M-TRC_VL-30s_TR-None_G-F_P-None_S-FRIGGA,ASC+ || VIDEO Only || US || 0% EXISTING CAP || 1C || 08.12.24  Ad set,VIDEO,"$9,039","268,498",2024-12-08,2025-02-05,59
8,CB_2024_Aug_FB_3090_DT-DP_V02_9x16_VID_EN_Opti_C-MakingOf_CTA-CTA_Pain-W-B-C_M-POW_VL-45s_TR-None_G-M_P-OG_S-Moon_FB3029V04,ðŸŒ¶ï¸ || US || ASC+ || ->CC141 || VIDEO Only || US+CA || 0% EXISTING CAP || 7C || 07/08.24  Ad set,VIDEO,"$8,855","358,709",2024-08-23,2025-01-15,145
9,CB_2024_Dec_FB_3622_LZ-DP_V03_4x5_IMG_EN_Opti_C-NONE_Sale_CTA-XMAS_Angle-GH_M-NONE_VL-None_G-NONE_P-OG_S-NONE_FB2227V08,ðŸŒ¶ï¸ || US || ASC+ || ->CC141 || VIDEO Only || US+CA || 0% EXISTING CAP || 7C || 07/08.24  Ad set,SHARE,"$8,678","253,940",2024-12-19,2025-01-27,39
10,CB_2024_Nov_FB_3264_LZ_V29_4x5_VID_EN_Opti_C-NegativeMark_Sale_CTA-BF_Angle-W-B_M-LRNS_VL-30s_G-M_P-OG_S-NONE,ASC+ || VIDEO Only || US || 0% EXISTING CAP || 1C || 08.12.24  Ad set,SHARE,"$7,067","300,823",2024-12-08,2025-01-27,50
11,CB_2024_Dec_FB_3639_CHUB_V03_1x1_IMG_EN_New_C-NONE_CTA-NONE_Angle-W_M-NONE_VL-None_TR-None_G-NONE_P-NONE_S-NONE,ðŸŒ¶ï¸ || US || ASC+ || ->CC141 || VIDEO Only || US+CA || 0% EXISTING CAP || 7C || 07/08.24  Ad set,SHARE,"$6,161","240,603",2025-01-06,2025-01-27,21
12,CB_2024_Aug_FB_3090_DT-DP_V02_9x16_VID_EN_Opti_C-MakingOf_CTA-CTA_Pain-W-B-C_M-POW_VL-45s_TR-None_G-M_P-OG_S-Moon_FB3029V04,CBV2 || Advantage+ || Only V1 Ads || US || 5% EXISTING CAP || BROAD || 7C || 30/12/24  Campaign Ad set,SHARE,"$5,207","277,457",2024-12-30,2025-01-22,23
13,CB_2024_Aug_FB_3090_DT-DP_V02_9x16_VID_EN_Opti_C-MakingOf_CTA-CTA_Pain-W-B-C_M-POW_VL-45s_TR-None_G-M_P-OG_S-Moon_FB3029V04,ðŸŒ¶ï¸ || US || ASC+ || ->CC141 || VIDEO Only || US+CA || 0% EXISTING CAP || 7C || 07/08.24  Ad set,VIDEO,"$5,203","181,655",2025-01-17,2025-03-03,45
14,CB_2024_Feb_FB_2812_MB-RP_V07_9x16_VID_EN_Opti_C-Sale_CTA-C65_Pain-W_M-NONE_VL-30s_TR-None_G-MF_P-Plan_S-NEW_FB2601V04_1,ASC+ || VIDEO Only || US || 0% EXISTING CAP || 1C || 08.12.24  Ad set,VIDEO,"$5,189","228,405",2024-12-19,2025-02-05,48
15,CB_2023_Oct_FB_2516_VK_V13_9x16_VID_EN_Opti_C-Benefits_CTA-AUTUM_Pain-W-B_M-PASQ_VL-30s_TR-None_G-M_P-Plan_S-WHAT,ðŸŒ¶ï¸ || US || ASC+ || ->CC141 || VIDEO Only || US+CA || 0% EXISTING CAP || 7C || 07/08.24  Ad set,VIDEO,"$4,772","151,590",2024-12-19,2025-03-27,98
16,Dynamic_Creative_3:2:2_Video_CA_Flow,WC || CA || DYNAMIC CREATIVE | 3:2:2 || New ads || ADV+ audience || 7C || 06.09.2024 || BIG BUDGET,SHARE,"$4,188","294,623",2024-09-08,2025-01-22,136
17,CB_2024_Nov_FB_3264_LZ_V31_4x5_VID_EN_Opti_C-MakingOf_Sale_CTA-BF_Angle-W-B_M-CRAZY_VL-45s_G-M_P-OG_S-NEW_FB3004V02,ðŸŒ¶ï¸ || US || ASC+ || ->CC141 || VIDEO Only || US+CA || 0% EXISTING CAP || 7C || 07/08.24  Ad set,VIDEO,"$4,098","130,128",2024-11-18,2025-01-24,67
18,CB_2023_May_FB_2263_MB_V04_9x16_VID_EN_New_C-Sale_CTA-SMR_Pain-W_M-JOG_VL-45s_TR-None_G-M-F_P-None_S-Moon,ASC+ || VIDEO Only || US || 0% EXISTING CAP || 1C || 08.12.24  Ad set,VIDEO,"$3,722","100,078",2024-12-08,2025-01-20,43
19,CB_2023_Oct_FB_2516_VK_V13_9x16_VID_EN_Opti_C-Benefits_CTA-AUTUM_Pain-W-B_M-PASQ_VL-30s_TR-None_G-M_P-Plan_S-WHAT,ASC+ || VIDEO Only || US || 0% EXISTING CAP || 1C || 08.12.24  Ad set,VIDEO,"$3,619","117,983",2024-12-20,2025-02-05,47
20,CB_2023_Jul_FB_2226_MB_V04_9x16_VID_EN_Opti_C-Testim_CTA-SMR_Pain-W_M-MIX_VL-30s_TR-None_G-F_P-None_S-Starry,ðŸŒ¶ï¸ || US || ASC+ || ->CC141 || VIDEO Only || US+CA || 0% EXISTING CAP || 7C || 07/08.24  Ad set,VIDEO,"$3,421","88,889",2024-10-28,2025-03-27,150
21,CB_2024_Sep_FB_3175_DA-KB_V04_1x1_IMG_EN_New_C-ADVRT_Evergreen_CTA-NONE_Angle-W_M-NONE_VL-None_G-NONE_P-CBV2_S-NONE_blog_colonbroomvsmammoth_cv_en,CBV2 || A/B Pricing: increased price || 3175 - CB vs Happy Mammoth advertorial || BROAD || 1C ||  22/11/24 || Kostas,SHARE,"$3,380","100,603",2024-12-22,2025-01-22,31
22,CB_2024_Dec_FB_3601_VK-DP_V09_4x5_VID_EN_Opti_C-Dance_CTA-NY_Pain-W-B_M-JOG_VL-30s_TR-None_G-F_P-OG_S-WHAT_FB3045V01,ðŸŒ¶ï¸ || US || ASC+ || ->CC141 || VIDEO Only || US+CA || 0% EXISTING CAP || 7C || 07/08.24  Ad set,VIDEO,"$2,973","71,618",2024-12-27,2025-02-14,49
23,CB_2024_Dec_FB_3619_VK-JT_V02_4x5_VID_EN_New_C-BulletPoints_Sale_CTA-NY_Angle-W-B-C_M-NONE_VL-None_G-NONE_P-OG_S-NONE,ðŸŒ¶ï¸ || US || ASC+ || ->CC141 || VIDEO Only || US+CA || 0% EXISTING CAP || 7C || 07/08.24  Ad set,SHARE,"$2,914","116,291",2024-12-27,2025-03-27,90
24,CB_2025_FEB_FB_3666_VK-JT_V03_4x5_VID_EN_NEW_C-BulletPoints_Sale_CTA-NY_Angle-W-B-C_M-TRC_VL-30s_G-F_P-OG_S-NEW,3666 - looksmaxing trend || Enhancements: OFF || CBV1 || Batch 1 || 1C || 07/01/25w02 || Kostas,SHARE,"$2,640","165,713",2025-01-07,2025-01-27,20
25,CB_2024_Dec_FB_CANVA_LZ-VU_V01_1x1_IMG_EN_New_C-NegativeMark_Evergreen_CTA-NONE_Angle-Cort_M-NONE_VL-None_G-NONE_P-NONE_S-NONE,US || Product Test | Product: CB Original ||| 1D || 14/01/2025,SHARE,"$2,629","88,029",2025-01-14,2025-01-20,6
26,CB_2024_Dec_FB_CANVA_LZ-VU_V01_1x1_IMG_EN_New_C-NegativeMark_Evergreen_CTA-NONE_Angle-Cort_M-NONE_VL-None_G-NONE_P-NONE_S-NONE,US || Product Test | Product: CB Premium ||| 1D || 14/01/2025,SHARE,"$2,613","97,397",2025-01-14,2025-01-20,6
27,CB_2023_Nov_FB_2649_VK_V06_9x16_VID_EN_Opti_C-Sale_CTA-C65_Pain-W_M-NONE_VL-30s_TR-None_G-MF_P-Plan_S-NEW_FB2601V04,ðŸ’°WC || US || Advantage+ || BIG BUDGET || CC101->105->109->112->114-116->117 || BROAD || ABO || 1C || 17/01/24 RELAUNCHED Ad set,VIDEO,"$1,862","76,301",2024-01-17,2025-02-06,386
28,CB_2023_Dec_FB_2696_RS_V03_9x16_VID_EN_Opti_C-Sale_CTA-NY65_Pain-W-B_M-JANW_VL-30s_TR-None_G-M_P-OG_S-WHAT_FB2284V05,EU (UK) || 2696 || 1C || 08/01/2025w02,SHARE,"$1,834","97,271",2025-01-08,2025-01-20,12
29,CB_2024_Dec_FB_3592_VK-DP_V10_4x5_VID_EN_New_C-BulletPoints_Sale_CTA-SALE_Angle-W-B-C_M-NONE_VL-30s_G-F_P-OG_S-NEW - Copy,ðŸŒ¶ï¸ || US || ASC+ || ->CC141 || VIDEO Only || US+CA || 0% EXISTING CAP || 7C || 07/08.24  Ad set,VIDEO,"$1,657","58,068",2024-12-21,2025-03-27,96
30,CB_2025_Jan_FB_3695_KB_V02_4x5_IMG_EN_New_C-SocialProof_Sale_CTA-SALE_Angle-W-B-C_M-NONE_VL-None_G-NONE_P-OG_S-NONE,3695 - #105 â€œReddit postsâ€ California Fires || Enhancements: OFF || CBV1 || Batch 2 || 1C || 10/01/25w02 || Kostas,SHARE,"$1,549","108,820",2025-01-10,2025-01-22,12
31,CB_2024_Jan_FB_2764_RS_V04_9x16_VID_EN_Opti_C-SingleTesti_CTA-SALE_Pain-W_M-TRC_VL-45s_TR-None_G-F_P-OG_S-MOON_FB2263V04,EU (UK) || 2764 || Trinity Results Too Fast || 1C || 08/01/2025w02,VIDEO,"$1,434","46,113",2025-01-08,2025-03-27,78
32,CB_2024_Sep_FB_3175_DA-KB_V01_1x1_IMG_EN_New_C-ADVRT_Evergreen_CTA-NONE_Angle-W_M-NONE_VL-None_G-NONE_P-CBV2_S-NONE_blog_colonbroomvsmammoth_cv_en,CBV2 || A/B Pricing: increased price || 3175 - CB vs Happy Mammoth advertorial || BROAD || 1C ||  22/11/24 || Kostas,SHARE,"$1,342","57,548",2024-12-22,2025-01-22,31
33,CB_2024_Oct_FB_3252_VK-DP_V04_4x5_VID_EN_Opti_C-MakingOf_Evergreen_CTA-SALE_Angle-W-B-C_M-JOG_VL-45s_G-F_P-OG_S-MOON_FB3090V02,ðŸŒ¶ï¸ || US || ASC+ || ->CC141 || VIDEO Only || US+CA || 0% EXISTING CAP || 7C || 07/08.24  Ad set,VIDEO,"$1,307","28,414",2024-11-07,2025-03-27,140
34,CB_2024_Sep_FB_3175_DA-KB_V03_1x1_IMG_EN_New_C-ADVRT_Evergreen_CTA-NONE_Angle-W_M-NONE_VL-None_G-NONE_P-CBV2_S-NONE_blog_colonbroomvsmammoth_cv_en,CBV2 || A/B Pricing: increased price || 3175 - CB vs Happy Mammoth advertorial || BROAD || 1C ||  22/11/24 || Kostas,SHARE,"$1,221","37,306",2024-12-22,2025-01-22,31
35,CB_2023_Aug_FB_2295_MB_V01_1x1_VID_EN_Opti_C-GIF_CTA-CTA_Pain-W-B_M-None_VL-10s_TR-None_G-None_P-None_S-None,CA || COST CAP 92->93 || 7C || 10/05/24 || V1,VIDEO,"$1,199","64,338",2024-05-10,2025-02-27,293
36,CB_2023_Dec_FB_2696_RS_V03_9x16_VID_EN_Opti_C-Sale_CTA-NY65_Pain-W-B_M-JANW_VL-30s_TR-None_G-M_P-OG_S-WHAT_FB2284V05,CBV2 || AU || ðŸ’° Advantage+ || US || BROAD || 7C || Existing_customer_5% || 19/12/24 Ad set,VIDEO,"$1,113","52,545",2025-01-13,2025-03-27,73
37,CB_2024_Jan_FB_2784_RS_V02_9x16_VID_EN_Opti_C-Pointing_CTA-SALE_Pain-W_M-JOG_VL-30s_TR-None_G-F_P-OG_S-OLLIE_FB2181V01,CBV2 || EU (UK) || ðŸ’° Advantage+ || US || BROAD || 7C || Existing_customer_5% || 15/12/24 Ad set,VIDEO,"$1,108","54,540",2025-01-09,2025-03-27,77
38,CB_2024_Nov_FB_3264_LZ_V31_4x5_VID_EN_Opti_C-MakingOf_Sale_CTA-BF_Angle-W-B_M-CRAZY_VL-45s_G-M_P-OG_S-NEW_FB3004V02,ASC+ || VIDEO Only || US || 0% EXISTING CAP || 1C || 08.12.24  Ad set,VIDEO,"$1,099","32,750",2024-12-08,2025-02-05,59
39,CB_2024_Jan_FB_2764_RS_V04_9x16_VID_EN_Opti_C-SingleTesti_CTA-SALE_Pain-W_M-TRC_VL-45s_TR-None_G-F_P-OG_S-MOON_FB2263V04_Page_Personal_Coach,AU || Page: Branded & 3rd Party || 2764 || Trinity Results Too Fast || 1C || 10/01/2025w02,VIDEO,"$1,041","25,202",2025-01-10,2025-03-27,76
40,CB_2025_Jan_FB_3072_V01_4x5_IMG_EN_New_C-Headline_Seasonal_CTA-None_Angle-W_M-NONE_VL-None_G-NONE_P-OG_S-NONE,CBV2 || EU (UK) || ðŸ’° Advantage+ || US || BROAD || 7C || Existing_customer_5% || 15/12/24 Ad set,SHARE,"$1,027","35,820",2025-01-16,2025-01-21,5
41,CB_2023_Dec_FB_2670_MB-RP_V02_9x16_VID_EN_Opti_C-Sale_CTA-XMAS65_Pain-W_M-JOG_VL-30s_TR-None,ðŸ’°WC || US || Advantage+ || BIG BUDGET || CC101->105->109->112->114-116->117 || BROAD || ABO || 1C || 17/01/24 RELAUNCHED Ad set,VIDEO,"$1,003","40,913",2024-01-17,2025-02-06,386
42,CB_2023_May_FB_2263_MB_V04_9x16_VID_EN_New_C-Sale_CTA-SMR_Pain-W_M-JOG_VL-45s_TR-None_G-M-F_P-None_S-Moon,CBV2 || AU || ðŸ’° Advantage+ || US || BROAD || 7C || Existing_customer_5% || 19/12/24 Ad set,VIDEO,$960,"36,032",2024-12-19,2025-03-27,98
43,CB_2024_Jan_FB_2764_RS_V04_9x16_VID_EN_Opti_C-SingleTesti_CTA-SALE_Pain-W_M-TRC_VL-45s_TR-None_G-F_P-OG_S-MOON_FB2263V04_Page_Personal_Coach,CBV2 || AU || ðŸ’° Advantage+ || US || BROAD || 7C || Existing_customer_5% || 19/12/24 Ad set,VIDEO,$934,"21,936",2025-01-16,2025-03-27,70
44,CB_2025_Jan_FB_3665_SO-DP_V01_4x5_IMG_EN_New_C-NONE_Evergreen_CTA-SALE_Angle-W_M-NONE_VL-None_G-NONE_P-NONE_S-NONE,3665 - Notion idea #72 || Enhancements: OFF || CBV1 || Batch 1 || 1C || 13/01/25w03 || Kostas,SHARE,$855,"54,099",2025-01-14,2025-01-24,10
45,CB_2023_Jul_FB_2217_IB_V04_9x16_VID_EN_Opti_C-Pointing_CTA-SMR_Pain-W-B_M-TRC_VL-30s_TR-None_G-F_P-None_S-FRIGGA,UK || ASC+ || CBV2 || 7DC || Existing 10% || 13.11.2024 Ad set,VIDEO,$836,"40,626",2024-11-13,2025-01-16,64
46,CB_2023_Dec_FB_2696_RS_V03_9x16_VID_EN_Opti_C-Sale_CTA-NY65_Pain-W-B_M-JANW_VL-30s_TR-None_G-M_P-OG_S-WHAT_FB2284V05,AU || Page: Branded || 2696 || 1C || 10/01/2025w02,VIDEO,$830,"45,196",2025-01-10,2025-01-16,6
47,CB_2024_Oct_FB_3182_ZS-GC_V13_1x1_IMG_EN_New_C-UsVsThem_Evergreen_CTA-NONE_Angle-B-C_M-NONE_VL-None_G-NONE_P-OG_S-NONE,CBV2 || Advantage+ || Only V1 Ads || US || 5% EXISTING CAP || BROAD || 7C || 30/12/24  Campaign Ad set,SHARE,$815,"49,987",2024-12-30,2025-01-22,23
48,CB_2025_Jan_FB_3656_JT_V02_4x5_IMG_EN_New_C-Headline_Seasonal_CTA-70_Angle-W_M-NONE_VL-None_G-NONE_P-OG_S-NONE,ðŸŒ¶ï¸ || US || ASC+ || ->CC141 || VIDEO Only || US+CA || 0% EXISTING CAP || 7C || 07/08.24  Ad set,SHARE,$804,"34,116",2025-01-13,2025-03-04,50
49,CB_2024_Dec_FB_3666_VK-JT_V03_4x5_VID_EN_Opti_C-BulletPoints_Sale_CTA-NY_Angle-W-B-C_M-TRC_VL-30s_G-F_P-OG_S-NEW,EU (UK) || 3666 - looksmaxing trend || 1C || 15/01/2025w03,SHARE,$800,"37,863",2025-01-15,2025-01-22,7
50,CB_2025_Jan_FB_3656_JT_V02_4x5_IMG_EN_New_C-Headline_Seasonal_CTA-70_Angle-W_M-NONE_VL-None_G-NONE_P-OG_S-NONE,3656 - we_re leaving || Enhancements: OFF || CBV1 || Batch 1 || 1C || 07/01/25w02 || Kostas,SHARE,$781,"28,185",2025-01-07,2025-01-16,9
51,CB_2024_Jan_FB_2764_RS_V04_9x16_VID_EN_Opti_C-SingleTesti_CTA-SALE_Pain-W_M-TRC_VL-45s_TR-None_G-F_P-OG_S-MOON_FB2263V04_Page_Personal_Coach,CBV2 || EU (UK) || ðŸ’° Advantage+ || US || BROAD || 7C || Existing_customer_5% || 15/12/24 Ad set,VIDEO,$747,"22,569",2025-01-09,2025-01-17,8
52,CB_2025_Jan_FB_3656_JT_V02_4x5_IMG_EN_New_C-Headline_Seasonal_CTA-70_Angle-W_M-NONE_VL-None_G-NONE_P-OG_S-NONE,EU (UK) || 3656 - we_re leaving || 1C || 15/01/2025w03,SHARE,$736,"31,901",2025-01-15,2025-01-20,5
53,CB_2024_Dec_FB_3623_CHUB_V01_1x1_IMG_EN_New_C-NONE_CTA-NONE_Angle-W_M-NONE_VL-None_TR-None_G-NONE_P-NONE_S-NONE,3623 Creative Hub - Organic facebook comments || Enhancements: OFF || CBV1 || Batch 1 || 1C || 14/01/25w03 || Kostas,SHARE,$727,"49,571",2025-01-14,2025-01-19,5
54,CB_2024_Aug_FB_3090_DT-DP_V02_9x16_VID_EN_Opti_C-MakingOf_CTA-CTA_Pain-W-B-C_M-POW_VL-45s_TR-None_G-M_P-OG_S-Moon_FB3029V04,CBV2 || EU (UK) || ðŸ’° Advantage+ || US || BROAD || 7C || Existing_customer_5% || 15/12/24 Ad set,SHARE,$720,"31,944",2024-12-19,2025-03-27,98
55,CB_2023_May_FB_1999_LV_V01_9x16_VID_EN_New_C-Pointing_CTA-DISCOUNT_Pain-W_M-JOG_VL-30s_TR-None,View Content || BROAD || 7C || 17/12/24,VIDEO,$716,"80,539",2024-12-17,2025-01-20,34
56,CB_2024_Dec_FB_3601_VK-DP_V09_4x5_VID_EN_Opti_C-Dance_CTA-NY_Pain-W-B_M-JOG_VL-30s_TR-None_G-F_P-OG_S-WHAT_FB3045V01,ASC+ || VIDEO Only || US || 0% EXISTING CAP || 1C || 08.12.24  Ad set,VIDEO,$713,"18,348",2024-12-25,2025-02-05,42
57,CB_2025_Jan_FB_3072_V01_4x5_IMG_EN_New_C-Headline_Seasonal_CTA-None_Angle-W_M-NONE_VL-None_G-NONE_P-OG_S-NONE,AU || 3072 EU adaptations || 1C || 15/01/2025w03,SHARE,$703,"24,208",2025-01-15,2025-01-20,5
58,CB_2024_Dec_FB_3666_VK-JT_V03_4x5_VID_EN_Opti_C-BulletPoints_Sale_CTA-NY_Angle-W-B-C_M-TRC_VL-30s_G-F_P-OG_S-NEW,3666 - looksmaxing trend || Enhancements: OFF || CBV1 || Batch 1 || 1C || 07/01/25w02 || Kostas,SHARE,$696,"46,670",2025-01-07,2025-01-27,20
59,CB_2022_Nov_FB_1197_IK_V03_1x1_IMG_EN_New_C-Sale_CTA-SALE_Pain-W_M-NONE_VL-None_TR-None_M-VON,ðŸŒ¶ï¸ || US || ASC+ || ->CC141 || VIDEO Only || US+CA || 0% EXISTING CAP || 7C || 07/08.24  Ad set,SHARE,$683,"21,231",2024-11-08,2025-01-15,68
60,IM_CB1.png,US || VSL || Aff's image || Landing: Pre-1(New lead) -> Old lead || 1C || 10/01/25,SHARE,$664,"37,546",2025-01-10,2025-01-16,6
61,CB_2025_Jan_FB_3072_V02_4x5_IMG_EN_New_C-Headline_Seasonal_CTA-None_Angle-W_M-NONE_VL-None_G-NONE_P-OG_S-NONE,EU (UK) || 3072 EU adaptations || 1C || 15/01/2025w03,SHARE,$660,"30,189",2025-01-15,2025-01-22,7
62,CB_2024_Dec_FB_3608_LZ-DP_V03_4x5_IMG_EN_New_C-Headline_Evergreen_CTA-NONE_Angle-W_M-NONE_VL-None_G-NONE_P-OG_S-NONE,3608 - CB_IMG_ notion #17 hypnosis || Enhancements: OFF || CBV1 || Batch 1 || 1C || 13/01/25w03 || Kostas,SHARE,$646,"33,901",2025-01-13,2025-02-03,21
63,CB_2024_Nov_FB_3305_SO-DP_V02_4x5_VID_EN_Opti_C-Sale_CTA-BF_Pain-W_M-Chris_VL-30s_TR-None_G-MF_P-Plan_S-NEW_FB2601V07,ðŸŒ¶ï¸ || US || ASC+ || ->CC141 || VIDEO Only || US+CA || 0% EXISTING CAP || 7C || 07/08.24  Ad set,VIDEO,$633,"18,797",2024-11-25,2025-01-15,51
64,CB_2025_Jan_FB_3661_CHUB_V03_1x1_IMG_EN_New_C-NONE_CTA-NONE_Angle-C_M-NONE_VL-None_TR-None_G-NONE_P-OG_S-NONE,3661 - Pop your methane balloon ITR. || Enhancements: OFF || CBV1 || Batch 1 || 1C || 14/01/25w03 || Kostas,SHARE,$623,"27,159",2025-01-14,2025-01-24,10
65,CB_2025_Jan_FB_3697_JT_V03_4x5_IMG_EN_OPTI_C-NegativeMarketing_Sale_CTA-CTA_ANGLE-W-B-C_P-OG.png,3697 - yes its expensive (NY edition) || Enhancements: OFF || CBV1 || Batch 1 || 1C || 14/01/25w03 || Valentinas,SHARE,$607,"16,253",2025-01-15,2025-01-20,5
66,IM_CB1.png,US || VSL || Aff's image || Landing: Directly to VSL || 1C || 16/01/25,SHARE,$581,"22,051",2025-01-16,2025-01-28,12
67,CB_2024_Dec_FB_3608_LZ-DP_V04_4x5_IMG_EN_New_C-Headline_Evergreen_CTA-NONE_Angle-W_M-NONE_VL-None_G-NONE_P-OG_S-NONE,3608 - CB_IMG_ notion #17 hypnosis || Enhancements: OFF || CBV1 || Batch 1 || 1C || 13/01/25w03 || Kostas,SHARE,$581,"24,918",2025-01-13,2025-02-03,21
68,CB_2024_Oct_FB_3252_VK-DP_V04_4x5_VID_EN_Opti_C-MakingOf_Evergreen_CTA-SALE_Angle-W-B-C_M-JOG_VL-45s_G-F_P-OG_S-MOON_FB3090V02,UK || ASC+ || CBV2 || 7DC || Existing 10% || 13.11.2024 Ad set,SHARE,$579,"26,681",2024-11-13,2025-01-16,64
69,CB_2023_Dec_FB_2712_RS-DP_V02_1x1_VID_EN_Opti_C-WrittenTesti_CTA-SALE_Pain-W-B-C_M-NONE_VL-None_TR-None_G-NONE_P-V2_S-NONE_FB2227V08,CBV2 || EU (UK) || ðŸ’° Advantage+ || US || BROAD || 7C || Existing_customer_5% || 15/12/24 Ad set,SHARE,$547,"24,694",2024-12-15,2025-03-27,102
70,CB_2023_Jul_FB_2217_IB_V04_9x16_VID_EN_Opti_C-Pointing_CTA-SMR_Pain-W-B_M-TRC_VL-30s_TR-None_G-F_P-None_S-FRIGGA,CBV2 || AU || ðŸ’° Advantage+ || US || BROAD || 7C || Existing_customer_5% || 19/12/24 Ad set,VIDEO,$535,"16,720",2024-12-19,2025-03-24,95
71,CB_2025_Jan_FB_3656_JT_V02_4x5_IMG_EN_New_C-Headline_Seasonal_CTA-70_Angle-W_M-NONE_VL-None_G-NONE_P-OG_S-NONE,AU || 3656 - we_re leaving || 1C || 15/01/2025w03,SHARE,$508,"20,874",2025-01-15,2025-01-27,12
72,CB_2023_Jul_FB_2217_IB_V04_9x16_VID_EN_Opti_C-Pointing_CTA-SMR_Pain-W-B_M-TRC_VL-30s_TR-None_G-F_P-None_S-FRIGGA,CBV2 || Advantage+ || Only V1 Ads || US || 5% EXISTING CAP || BROAD || 7C || 30/12/24  Campaign Ad set,VIDEO,$501,"18,376",2024-12-30,2025-01-22,23
73,CB_2025_Jan_FB_3662_CHUB_V01_1x1_IMG_EN_New_C-NONE_CTA-NONE_Angle-C_M-NONE_VL-None_TR-None_G-NONE_P-NONE_S-NONE.jpg,ðŸŒ¶ï¸ || US || ASC+ || ->CC141 || VIDEO Only || US+CA || 0% EXISTING CAP || 7C || 07/08.24  Ad set,SHARE,$496,"22,773",2025-01-13,2025-03-04,50
74,CB_2024_Dec_FB_3630_LZ-DP_V07_4x5_IMG_EN_New_C-NONE_Evergreen_CTA-NONE_Angle-W_M-NONE_VL-None_G-NONE_P-NONE_S-NONE,3630 - Notion #70 apple notes || Enhancements: OFF || CBV1 || Batch 2 || 1C || 13/01/25w03 || Kostas,SHARE,$495,"29,991",2025-01-13,2025-01-16,3
75,CB_2023_Jul_FB_2226_MB_V04_9x16_VID_EN_Opti_C-Testim_CTA-SMR_Pain-W_M-MIX_VL-30s_TR-None_G-F_P-None_S-Starry,View Content || BROAD || 7C || 17/12/24,VIDEO,$450,"40,056",2024-12-17,2025-01-20,34
76,CB_2025_Jan_FB_3660_CHUB_V02_4x5_IMG_EN_New_C-NONE_CTA-NONE_Angle-C_M-NONE_VL-None_TR-None_G-NONE_P-NONE_S-NONE,3660 - G-nuggets winner ITR || Enhancements: OFF || CBV1 || Batch 1 || 1C || 14/01/25w03 || Kostas,SHARE,$433,"24,149",2025-01-14,2025-01-27,13
77,CB_2024_Dec_FB_3619_VK-JT_V01_4x5_VID_EN_New_C-BulletPoints_Sale_CTA-NY_Angle-W-B-C_M-NONE_VL-None_G-NONE_P-OG_S-NONE,3619 - CB - CRAVINGS - IMG - TESTIMONIAL || Enhancements: OFF || CBV1 || Batch 1 || 1C || 23/12/24w52 || Kostas,SHARE,$429,"18,562",2024-12-23,2025-01-15,23
78,CB_2025_Jan_FB_3662_CHUB_V01_1x1_IMG_EN_New_C-NONE_CTA-NONE_Angle-C_M-NONE_VL-None_TR-None_G-NONE_P-NONE_S-NONE.jpg,3662 - Hipno event ITR CHUB || Enhancements: OFF || CBV1 || Batch 1 || 1C || 10/01/25w02 || Valentinas,SHARE,$429,"20,413",2025-01-10,2025-01-15,5
79,CB_2023_May_FB_2263_MB_V04_9x16_VID_EN_New_C-Sale_CTA-SMR_Pain-W_M-JOG_VL-45s_TR-None_G-M-F_P-None_S-Moon,ðŸ’°WC || US || Advantage+ || BIG BUDGET || CC101->105->109->112->114-116->117 || BROAD || ABO || 1C || 17/01/24 RELAUNCHED Ad set,VIDEO,$429,"12,215",2024-01-17,2025-02-06,386
80,CB_2023_May_FB_2263_MB_V04_9x16_VID_EN_New_C-Sale_CTA-SMR_Pain-W_M-JOG_VL-45s_TR-None_G-M-F_P-None_S-Moon,Pricing Test || EU (UK) || 1C || Standard Price || 07/01/25,VIDEO,$425,"15,944",2025-01-07,2025-01-15,8
81,CB_2024_Jan_FB_2764_RS_V04_9x16_VID_EN_Opti_C-SingleTesti_CTA-SALE_Pain-W_M-TRC_VL-45s_TR-None_G-F_P-OG_S-MOON_FB2263V04_Page_Personal_Coach,EU (UK) || 2764 || Trinity Results Too Fast || 1C || 08/01/2025w02,VIDEO,$423,"16,705",2025-01-08,2025-01-15,7
82,CB_2025_Jan_FB_3680_CHUB_V05_4x5_IMG_EN_New_C-NONE_CTA-NONE_Angle-C_M-NONE_VL-None_TR-None_G-NONE_P-NONE_S-NONE,3680 - Looking for 15 people _ Trashy ITR CHUB || Enhancements: OFF || CBV1 || Batch 2 || 1C || 10/01/25w02 || Kostas,SHARE,$413,"17,512",2025-01-10,2025-01-15,5
83,CB_2025_Jan_FB_3693_LZ-JG_V02_4x5_IMG_EN_Opti_C-Headline_Evergreen_CTA-NONE_Angle-W_M-NONE_VL-None_G-NONE_P-NONE_S-NONE_FB3639V03,3693 - 3639 opti quitters_ day || Enhancements: OFF || CBV1 || Batch 2 || 1C || 10/01/25w02 || Kostas,SHARE,$413,"19,139",2025-01-10,2025-01-15,5
84,CB_2023_May_FB_2263_MB_V04_9x16_VID_EN_New_C-Sale_CTA-SMR_Pain-W_M-JOG_VL-45s_TR-None_G-M-F_P-None_S-Moon,Pricing Test || EU (UK) || 1C || Higher Price || 07/01/25,VIDEO,$409,"15,552",2025-01-07,2025-01-15,8
85,CB_2025_Jan_FB_3689_LZ-VU_V01_4x5_IMG_EN_New_C-Headline_Evergreen_CTA-NONE_Angle-W_M-NONE_VL-None_G-F_P-NONE_S-NONE,3689 - Shilute family club scales ad || Enhancements: OFF || CBV1 || Batch 1 || 1C || 15/01/25w03 || Kostas,SHARE,$399,"18,255",2025-01-15,2025-01-18,3
86,CB_2023_May_FB_2263_MB_V04_9x16_VID_EN_New_C-Sale_CTA-SMR_Pain-W_M-JOG_VL-45s_TR-None_G-M-F_P-None_S-Moon,CBV2 || EU (UK) || ðŸ’° Advantage+ || US || BROAD || 7C || Existing_customer_5% || 15/12/24 Ad set,VIDEO,$397,"15,446",2024-12-19,2025-01-17,29
87,CB_2025_Jan_FB_3660_CHUB_V03_4x5_IMG_EN_New_C-NONE_CTA-NONE_Angle-C_M-NONE_VL-None_TR-None_G-NONE_P-NONE_S-NONE,3660 - G-nuggets winner ITR || Enhancements: OFF || CBV1 || Batch 1 || 1C || 14/01/25w03 || Kostas,SHARE,$394,"22,075",2025-01-14,2025-01-27,13
88,CB_2025_Jan_FB_3671_LZ-VU_V02_4x5_IMG_EN_New_C-Headline_Evergreen_CTA-NONE_Angle-W_M-NONE_VL-None_G-NONE_P-NONE_S-NONE_FB3306V02,AU || Page: Branded || 3671 - anti inflammatory diet opti || 1C || 13/01/2025,SHARE,$387,"13,271",2025-01-13,2025-01-20,7
89,CB_2023_Dec_FB_2712_RS-DP_V02_1x1_VID_EN_Opti_C-WrittenTesti_CTA-SALE_Pain-W-B-C_M-NONE_VL-None_TR-None_G-NONE_P-V2_S-NONE_FB2227V08,CBV2 || AU || ðŸ’° Advantage+ || US || BROAD || 7C || Existing_customer_5% || 19/12/24 Ad set,SHARE,$386,"17,483",2024-12-19,2025-03-27,98
90,CB_2025_Jan_FB_3682_DT-RP_V03_4x5_IMG_EN_New_C-BulletPoints_Evergreen_CTA-NONE_Angle-W_M-NONE_VL-None_G-NONE_P-OG_S-NONE,3682 - Weight_loss-batch_#4 || Enhancements: OFF || CBV1 || Batch 1 || 1C || 15/01/25w03 || Kostas,SHARE,$371,"16,161",2025-01-15,2025-01-22,7
91,CB_2024_May_FB_3003_VK-DP_V03_9x16_VID_EN_Opti_C-Pointing_CTA-SALE_Pain-W-B-C_M-KAY_VL-30s_TR-None_G-F_P-OG_S-WHAT_FB2986V06,ðŸŒ¶ï¸ || US || ASC+ || ->CC141 || VIDEO Only || US+CA || 0% EXISTING CAP || 7C || 07/08.24  Ad set,VIDEO,$366,"13,834",2024-08-07,2025-01-24,170
92,CB_2025_Jan_FB_3674_SO-RP_V01_4x5_CAROUSEL_EN_New_C-NONE_Evergreen_CTA-NONE_Angle-W_M-NONE_VL-None_G-NONE_P-NONE_S-NONE-1,3678 - Weight_loss-batch_#2 || Enhancements: OFF || CBV1 || Batch 1 || 1C || 15/01/25w03 || Kostas,SHARE,$362,"7,698",2025-01-15,2025-01-18,3
93,CB_2024_Dec_FB_3630_LZ-DP_V03_4x5_IMG_EN_New_C-NONE_Evergreen_CTA-NONE_Angle-W_M-NONE_VL-None_G-NONE_P-NONE_S-NONE,3630 - Notion #70 apple notes || Enhancements: OFF || CBV1 || Batch 1 || 1C || 13/01/25w03 || Kostas,SHARE,$357,"18,602",2025-01-13,2025-01-16,3
94,CB_2023_Jul_FB_2226_MB_V04_9x16_VID_EN_Opti_C-Testim_CTA-SMR_Pain-W_M-MIX_VL-30s_TR-None_G-F_P-None_S-Starry,UK || ASC+ || CBV2 || 7DC || Existing 10% || 13.11.2024 Ad set,SHARE,$349,"14,854",2024-11-13,2025-01-16,64
95,CB_2023_Jul_FB_2217_IB_V04_9x16_VID_EN_Opti_C-Pointing_CTA-SMR_Pain-W-B_M-TRC_VL-30s_TR-None_G-F_P-None_S-FRIGGA,CBV2 || EU (UK) || ðŸ’° Advantage+ || US || BROAD || 7C || Existing_customer_5% || 15/12/24 Ad set,VIDEO,$332,"18,204",2024-12-18,2025-03-27,99
96,CB_2025_Jan_FB_3671_LZ-VU_V02_4x5_IMG_EN_New_C-Headline_Evergreen_CTA-NONE_Angle-W_M-NONE_VL-None_G-NONE_P-NONE_S-NONE_FB3306V02,AU || Page: Branded || 3671 - anti inflammatory diet opti || 1C || 13/01/2025,SHARE,$325,"10,279",2025-01-13,2025-01-16,3
97,CB_2023_Dec_FB_2712_RS-DP_V02_1x1_VID_EN_Opti_C-WrittenTesti_CTA-SALE_Pain-W-B-C_M-NONE_VL-None_TR-None_G-NONE_P-V2_S-NONE_FB2227V08,UK || ASC+ || CBV2 || 7DC || Existing 10% || 13.11.2024 Ad set,SHARE,$325,"13,404",2024-11-13,2025-01-16,64
98,CB_2025_Jan_FB_3671_LZ-VU_V01_4x5_IMG_EN_New_C-Headline_Evergreen_CTA-NONE_Angle-W_M-NONE_VL-None_G-NONE_P-NONE_S-NONE_FB3306V01,EU (UK) || 3671 - anti inflammatory diet opti || 1C || 08/01/2025w02,SHARE,$313,"11,148",2025-01-08,2025-01-16,8
99,CB_2025_Jan_FB_3655_DT-JT_V03_4x5_VID_EN_New_C-Educational_Sale_CTA-NY_Angle-W_M-MIX_VL-45s_G-MF_P-OG_S-NEW,3655 - CB PODCAST EDU BRIEF - NYNM || Enhancements: OFF || CBV1 || Batch 1 || 1C || 14/01/25w03 || Kostas,SHARE,$310,"10,354",2025-01-14,2025-01-18,4
100,CB_2023_Jul_FB_2217_IB_V04_9x16_VID_EN_Opti_C-Pointing_CTA-SMR_Pain-W-B_M-TRC_VL-30s_TR-None_G-F_P-None_S-FRIGGA,ðŸ’°WC || US || Advantage+ || BIG BUDGET || CC101->105->109->112->114-116->117 || BROAD || ABO || 1C || 17/01/24 RELAUNCHED Ad set,VIDEO,$306,"9,365",2024-01-17,2025-02-06,386
101,CB_2024_Oct_FB_3269_LZ-VU_V01_1x1_IMG_EN_Opti_C-Headline_Sale_CTA-BF_Angle-None_M-NONE_VL-None_G-NONE_P-NONE_S-NONE_FB3251V02.png,ðŸŒ¶ï¸ || US || ASC+ || ->CC141 || VIDEO Only || US+CA || 0% EXISTING CAP || 7C || 07/08.24  Ad set,SHARE,$298,"7,203",2024-11-07,2025-01-15,69
102,CB_2025_Jan_FB_3674_SO-JT_V02_4x5_IMG_EN_New_C-NONE_Evergreen_CTA-NONE_Angle-WellBe_M-NONE_VL-None_G-NONE_P-NONE_S-NONE,3674 - CB - TWITTER HABIT || Enhancements: OFF || CBV1 || Batch 1 || 1C || 14/01/25w03 || Kostas,SHARE,$295,"11,073",2025-01-14,2025-01-18,4
103,CB_2024_Dec_FB_3584_VK-DP_V01_4x5_VID_EN_New_C-BulletPoints_Sale_CTA-SALE_Angle-W-B-C_M-NONE_VL-30s_G-M_P-OG_S-WHAT,ðŸŒ¶ï¸ || US || ASC+ || ->CC141 || VIDEO Only || US+CA || 0% EXISTING CAP || 7C || 07/08.24  Ad set,VIDEO,$294,"9,714",2025-01-06,2025-01-24,18
104,CB_2024_Oct_FB_3251_LZ-VU_V01_1x1_IMG_EN_New_C-NegativeMark_Evergreen_CTA-NONE_Angle-Cort_M-NONE_VL-None_G-NONE_P-NONE_S-NONE,UK || ASC+ || CBV2 || 7DC || Existing 10% || 13.11.2024 Ad set,SHARE,$290,"8,184",2024-11-13,2025-01-16,64
105,CB_2024_Oct_FB_3264_LZ_V15_4x5_VID_EN_Opti_C-MakingOf_Sale_CTA-BF_Angle-W-B_M-AGR_VL-30s_G-M_P-OG_S-WHAT_FB3005V02,UK || ASC+ || CBV2 || 7DC || Existing 10% || 13.11.2024 Ad set,SHARE,$289,"12,324",2024-11-13,2025-01-16,64
106,CB_2025_Jan_FB_3657_SO-JT_V04_4x5_VID_EN_New_C-NONE_Evergreen_CTA-NY_Angle-W_M-NONE_VL-15s_G-NONE_P-NONE_S-DooWop,ðŸŒ¶ï¸ || US || ASC+ || ->CC141 || VIDEO Only || US+CA || 0% EXISTING CAP || 7C || 07/08.24  Ad set,VIDEO,$289,"12,004",2025-01-09,2025-01-24,15
107,CB_2025_Jan_FB_3669_SO-JT_V02_4x5_IMG_EN_New_C-NONE_Evergreen_CTA-NONE_Angle-W_M-NONE_VL-None_G-NONE_P-NONE_S-NONE,3669 - CB - Notion - #63 HOLYGRAIL OF... || Enhancements: OFF || CBV1 || Batch 1 || 1C || 14/01/25w03 || Kostas,SHARE,$289,"10,020",2025-01-14,2025-01-17,3
108,CB_2024_Dec_FB_3619_VK-JT_V04_4x5_VID_EN_New_C-BulletPoints_Sale_CTA-NY_Angle-W-B-C_M-NONE_VL-None_G-NONE_P-OG_S-NONE,3619 - CB - CRAVINGS - IMG - TESTIMONIAL || Enhancements: OFF || CBV1 || Batch 1 || 1C || 23/12/24w52 || Kostas,SHARE,$286,"12,458",2024-12-23,2025-01-15,23
109,CB_2024_Aug_FB_3090_DT-DP_V02_9x16_VID_EN_Opti_C-MakingOf_CTA-CTA_Pain-W-B-C_M-POW_VL-45s_TR-None_G-M_P-OG_S-Moon_FB3029V04,CBV2 || AU || ðŸ’° Advantage+ || US || BROAD || 7C || Existing_customer_5% || 19/12/24 Ad set,SHARE,$277,"11,318",2024-12-19,2025-01-17,29
110,CB_2024_Jan_FB_2762_IK_V05_1x1_IMG_EN_New_C-WrittenTesti_CTA-CTA_Pain-W-B-C_M-NONE_VL-None_TR-None_G-NONE_P-V2_S-NONE,CBV2 || EU (UK) || ðŸ’° Advantage+ || US || BROAD || 7C || Existing_customer_5% || 15/12/24 Ad set,SHARE,$268,"10,619",2024-12-15,2025-03-27,102
111,CB_2022_Mar3_FB_713_IK_V04_1x1_IMG_EN_Opti_C-WrittenTesti_HE-98_A-ExtremeBodyVisualization_HK-bodypart_Pain-W_CLR-PURPLE_BG-IMAGE_ME-MIX_MA-YOUNG,US || Manual Bid || BFCM || ROAS GOAL: 1.4 || 1C || 15/11/24,SHARE,$255,"11,106",2024-11-15,2025-02-27,104
112,CB_2025_Jan_FB_3677_LZ-VU_V03_4x5_IMG_EN_New_C-Testimonial_Evergreen_CTA-NONE_Angle-GH_M-NONE_VL-None_G-NONE_P-NONE_S-NONE.png,3677 - luxury reviews ad || Enhancements: OFF || CBV1 || Batch 1 || 1C || 10/01/25w02 || Valentinas,SHARE,$253,"8,627",2025-01-10,2025-01-15,5
113,CB_2025_Dec_FB_3672_VK-JG_V03_4x5_VID_EN_Opti_C-BulletPoints_Sale_CTA-NY_Angle-W-B-C_M-JOG_VL-30s_G-F_P-OG_S-MOON_FB3172V03,3672 - opti 3174 || Enhancements: OFF || CBV1 || Batch 1 || 1C || 14/01/25w03 || Kostas,SHARE,$252,"6,775",2025-01-14,2025-01-18,4
114,CB_2025_Jan_FB_3655_DT-JT_V02_4x5_VID_EN_New_C-Educational_Sale_CTA-NY_Angle-W_M-MIX_VL-45s_G-MF_P-OG_S-NEW,3655 - CB PODCAST EDU BRIEF - NYNM || Enhancements: OFF || CBV1 || Batch 1 || 1C || 14/01/25w03 || Kostas,SHARE,$240,"6,616",2025-01-14,2025-01-18,4
115,CB_2024_Dec_FB_3668_LZ-VU_V03_4x5_IMG_EN_New_C-Headline_Evergreen_CTA-NONE_Angle-Ozempic_M-NONE_VL-None_G-F_P-OG_S-NONE,3668 - 40s woman ozempic || Enhancements: OFF || CBV1 || Batch 1 || 1C || 14/01/25w03 || Kostas,SHARE,$237,"8,926",2025-01-14,2025-01-19,5
116,CB_2025_Jan_FB_3651_SO-JT_V02_4x5_IMG_EN_New_C-NONE_Evergreen_CTA-SALE_Angle-None_M-NONE_VL-None_G-NONE_P-NONE_S-NONE,3651 - NYNM - RIDDLES NOTION #77 || Enhancements: OFF || CBV1 || Batch 2 || 1C || 05/01/25w01 || Kostas,SHARE,$237,"11,403",2025-01-05,2025-01-15,10
117,CB_2025_Dec_FB_3672_VK-JG_V02_4x5_VID_EN_Opti_C-BulletPoints_Sale_CTA-NY_Angle-W-B-C_M-JOG_VL-30s_G-F_P-OG_S-MOON_FB3172V02,3672 - opti 3174 || Enhancements: OFF || CBV1 || Batch 1 || 1C || 14/01/25w03 || Kostas,SHARE,$233,"11,443",2025-01-14,2025-01-18,4
118,CB_2024_Dec_FB_3619_VK-JT_V02_4x5_VID_EN_New_C-BulletPoints_Sale_CTA-NY_Angle-W-B-C_M-NONE_VL-None_G-NONE_P-OG_S-NONE,3619 - CB - CRAVINGS - IMG - TESTIMONIAL || Enhancements: OFF || CBV1 || Batch 1 || 1C || 23/12/24w52 || Kostas,SHARE,$225,"8,453",2024-12-23,2025-01-13,21
119,CB_2025_Jan_FB_3675_DT-DP_V02_4x5_IMG_EN_New_C-Headline_Sale_CTA-70_Angle-C_M-MIX_VL-None_G-F_P-OG_S-NONE,3675 - Notion idea #69 || Enhancements: OFF || CBV1 || Batch 1 || 1C || 14/01/25w03 || Kostas,SHARE,$219,"9,099",2025-01-14,2025-01-17,3
120,CB_2024_Dec_FB_3668_LZ-VU_V01_4x5_IMG_EN_New_C-Headline_Evergreen_CTA-NONE_Angle-Ozempic_M-NONE_VL-None_G-F_P-OG_S-NONE,3668 - 40s woman ozempic || Enhancements: OFF || CBV1 || Batch 1 || 1C || 14/01/25w03 || Kostas,SHARE,$217,"7,058",2025-01-14,2025-01-19,5
121,CB_2025_Jan_FB_3656_JT_V03_4x5_IMG_EN_New_C-Headline_Seasonal_CTA-70_Angle-W_M-NONE_VL-None_G-NONE_P-OG_S-NONE,AU || 3656 - we_re leaving || 1C || 15/01/2025w03,SHARE,$216,"7,823",2025-01-15,2025-01-27,12
122,IM_CB1.png,US || VSL || Aff's image || Landing: QUIZ || 1C || 16/01/25,SHARE,$213,"6,893",2025-01-16,2025-01-17,1
123,CB_2025_Jan_FB_3661_CHUB_V02_1x1_IMG_EN_New_C-NONE_CTA-NONE_Angle-C_M-NONE_VL-None_TR-None_G-NONE_P-OG_S-NONE,3661 - Pop your methane balloon ITR. || Enhancements: OFF || CBV1 || Batch 1 || 1C || 14/01/25w03 || Kostas,SHARE,$213,"9,807",2025-01-14,2025-01-24,10
124,CB_2024_Apr_FB_2969_DT-RP_V02_9x16_IMG_EN_New_C-NONE_CTA-NONE_None_M-NONE_VL-None_TR-None_G-NONE_P-OG_S-NONE,ðŸŒ¶ï¸ || US || ASC+ || ->CC141 || VIDEO Only || US+CA || 0% EXISTING CAP || 7C || 07/08.24  Ad set,SHARE,$209,"12,255",2024-08-19,2025-01-24,158
125,CB_2025_Jan_FB_3695_KB_V02_4x5_IMG_EN_New_C-SocialProof_Sale_CTA-SALE_Angle-W-B-C_M-NONE_VL-None_G-NONE_P-OG_S-NONE,US || Reddit posts - California Fires || Engagement || 15/01/25,SHARE,$207,"26,055",2025-01-15,2025-01-19,4
126,CB_2025_Jan_FB_3671_LZ-VU_V03_4x5_IMG_EN_New_C-Headline_Evergreen_CTA-NONE_Angle-W_M-NONE_VL-None_G-NONE_P-NONE_S-NONE_FB3306V03,AU || Page: Branded || 3671 - anti inflammatory diet opti || 1C || 13/01/2025,SHARE,$207,"7,857",2025-01-13,2025-01-20,7
127,CB_2023_Jul_FB_2217_IB_V04_9x16_VID_EN_Opti_C-Pointing_CTA-SMR_Pain-W-B_M-TRC_VL-30s_TR-None_G-F_P-None_S-FRIGGA,US || Manual Bid || BFCM || ROAS GOAL: 1.4 || 1C || 15/11/24,VIDEO,$198,"6,575",2024-11-15,2025-01-18,64
128,Taboola - ColonB 3.webp,US || VSL || Aff's image || Batch 2 (mostly Taboola ads) || Landing: pre-1 || 1C || 19/01/25,SHARE,$195,"7,159",2025-01-19,2025-01-28,9
129,CB_2024_Jan_FB_2784_RS_V02_9x16_VID_EN_Opti_C-Pointing_CTA-SALE_Pain-W_M-JOG_VL-30s_TR-None_G-F_P-OG_S-OLLIE_FB2181V01,AU || 2784 || 1C || 08/01/2025w02,VIDEO,$188,"8,062",2025-01-10,2025-01-14,4
130,CB_2025_Jan_FB_3682_DT-RP_V04_4x5_IMG_EN_New_C-BulletPoints_Evergreen_CTA-NONE_Angle-W_M-NONE_VL-None_G-NONE_P-OG_S-NONE,3682 - Weight_loss-batch_#4 || Enhancements: OFF || CBV1 || Batch 1 || 1C || 15/01/25w03 || Kostas,SHARE,$188,"9,632",2025-01-15,2025-01-22,7
131,CB_2024_Nov_FB_3264_LZ_V31_4x5_VID_EN_Opti_C-MakingOf_Sale_CTA-BF_Angle-W-B_M-CRAZY_VL-45s_G-M_P-OG_S-NEW_FB3004V02,CBV2 || Advantage+ || Only V1 Ads || US || 5% EXISTING CAP || BROAD || 7C || 30/12/24  Campaign Ad set,VIDEO,$185,"5,011",2024-12-30,2025-01-22,23
132,CB_2024_Jan_FB_2764_RS_V04_9x16_VID_EN_Opti_C-SingleTesti_CTA-SALE_Pain-W_M-TRC_VL-45s_TR-None_G-F_P-OG_S-MOON_FB2263V04,AU || Page: Branded & 3rd Party || 2764 || Trinity Results Too Fast || 1C || 10/01/2025w02,VIDEO,$182,"6,443",2025-01-10,2025-01-14,4
133,CB_2024_Sep_FB_3175_DA-KB_V02_1x1_IMG_EN_New_C-ADVRT_Evergreen_CTA-NONE_Angle-W_M-NONE_VL-None_G-NONE_P-CBV2_S-NONE_blog_colonbroomvsmammoth_cv_en,CBV2 || A/B Pricing: increased price || 3175 - CB vs Happy Mammoth advertorial || BROAD || 1C ||  22/11/24 || Kostas,SHARE,$177,"7,939",2024-12-22,2025-01-22,31
134,CB_2024_Dec_FB_3668_LZ-VU_V04_4x5_IMG_EN_New_C-Headline_Evergreen_CTA-NONE_Angle-Ozempic_M-NONE_VL-None_G-F_P-OG_S-NONE,3668 - 40s woman ozempic || Enhancements: OFF || CBV1 || Batch 1 || 1C || 14/01/25w03 || Kostas,SHARE,$176,"5,064",2025-01-14,2025-01-17,3
135,CB_2024_Dec_FB_3668_LZ-VU_V02_4x5_IMG_EN_New_C-Headline_Evergreen_CTA-NONE_Angle-Ozempic_M-NONE_VL-None_G-F_P-OG_S-NONE,3668 - 40s woman ozempic || Enhancements: OFF || CBV1 || Batch 1 || 1C || 14/01/25w03 || Kostas,SHARE,$175,"7,035",2025-01-14,2025-01-19,5
136,CB_2025_Jan_FB_3681_LZ-VU_V03_4x5_IMG_EN_New_C-Headline_Evergreen_CTA-NONE_Angle-GH_M-NONE_VL-None_G-F_P-OG_S-NONE,3681 - hot girl drink || Enhancements: OFF || CBV1 || Batch 1 || 1C || 15/01/25w03 || Kostas,SHARE,$171,"6,366",2025-01-15,2025-01-18,3
137,CB_2023_Dec_FB_2712_RS-DP_V02_1x1_VID_EN_Opti_C-WrittenTesti_CTA-SALE_Pain-W-B-C_M-NONE_VL-None_TR-None_G-NONE_P-V2_S-NONE_FB2227V08,CBV2 || EU (UK) || MANUAL BID || CAP91 || 1C || || 15/01/25,VIDEO,$169,"7,583",2025-01-15,2025-01-17,2
138,CB_2024_Jan_FB_2764_RS_V04_9x16_VID_EN_Opti_C-SingleTesti_CTA-SALE_Pain-W_M-TRC_VL-45s_TR-None_G-F_P-OG_S-MOON_FB2263V04_Page_Personal_Coach,CBV2 || EU (UK) || MANUAL BID || CAP91 || 1C || || 15/01/25,VIDEO,$168,"5,813",2025-01-15,2025-01-17,2
139,CB_2025_Jan_FB_3671_LZ-VU_V04_4x5_IMG_EN_New_C-Headline_Evergreen_CTA-NONE_Angle-W_M-NONE_VL-None_G-NONE_P-NONE_S-NONE_FB3306V04,EU (UK) || 3671 - anti inflammatory diet opti || 1C || 08/01/2025w02,SHARE,$166,"6,469",2025-01-08,2025-01-15,7
140,CB_2025_Jan_FB_3671_LZ-VU_V04_4x5_IMG_EN_New_C-Headline_Evergreen_CTA-NONE_Angle-W_M-NONE_VL-None_G-NONE_P-NONE_S-NONE_FB3306V04,AU || Page: Branded || 3671 - anti inflammatory diet opti || 1C || 13/01/2025,SHARE,$163,"6,400",2025-01-13,2025-01-20,7
141,CB_2025_Jan_FB_3072_V01_4x5_IMG_EN_New_C-Headline_Seasonal_CTA-None_Angle-W_M-NONE_VL-None_G-NONE_P-OG_S-NONE,EU (UK) || 3072 EU adaptations || 1C || 15/01/2025w03,SHARE,$161,"5,464",2025-01-15,2025-01-16,1
142,CB_2023_May_FB_2263_MB_V04_9x16_VID_EN_New_C-Sale_CTA-SMR_Pain-W_M-JOG_VL-45s_TR-None_G-M-F_P-None_S-Moon - Copy,CBV2 || EU (UK) || MANUAL BID || CAP91 || 1C || || 15/01/25,VIDEO,$157,"5,318",2025-01-15,2025-01-17,2
143,CB_2025_Jan_FB_3681_LZ-VU_V01_4x5_IMG_EN_New_C-Headline_Evergreen_CTA-NONE_Angle-GH_M-NONE_VL-None_G-F_P-OG_S-NONE,3681 - hot girl drink || Enhancements: OFF || CBV1 || Batch 1 || 1C || 15/01/25w03 || Kostas,SHARE,$156,"5,825",2025-01-15,2025-01-17,2
144,CB_2024_Dec_FB_3639_CHUB_V03_1x1_IMG_EN_New_C-NONE_CTA-NONE_Angle-W_M-NONE_VL-None_TR-None_G-NONE_P-NONE_S-NONE,US || Product Test | Product: CB Premium ||| 1D || 14/01/2025,SHARE,$156,"7,997",2025-01-14,2025-01-20,6
145,CB_2025_Jan_FB_3681_LZ-VU_V02_4x5_IMG_EN_New_C-Headline_Evergreen_CTA-NONE_Angle-GH_M-NONE_VL-None_G-F_P-OG_S-NONE,3681 - hot girl drink || Enhancements: OFF || CBV1 || Batch 1 || 1C || 15/01/25w03 || Kostas,SHARE,$153,"5,368",2025-01-15,2025-01-18,3
146,CB_2024_Nov_FB_3264_LZ_V31_4x5_VID_EN_Opti_C-MakingOf_Sale_CTA-BF_Angle-W-B_M-CRAZY_VL-45s_G-M_P-OG_S-NEW_FB3004V02,CBV2 || EU (UK) || ðŸ’° Advantage+ || US || BROAD || 7C || Existing_customer_5% || 15/12/24 Ad set,VIDEO,$149,"5,700",2024-12-19,2025-03-27,98
147,CB_2024_Dec_FB_3601_VK-DP_V09_4x5_VID_EN_Opti_C-Dance_CTA-NY_Pain-W-B_M-JOG_VL-30s_TR-None_G-F_P-OG_S-WHAT_FB3045V01,CBV2 || EU (UK) || ðŸ’° Advantage+ || US || BROAD || 7C || Existing_customer_5% || 15/12/24 Ad set,VIDEO,$145,"3,941",2024-12-27,2025-01-15,19
148,CB_2024_Dec_FB_3639_CHUB_V03_1x1_IMG_EN_New_C-NONE_CTA-NONE_Angle-W_M-NONE_VL-None_TR-None_G-NONE_P-NONE_S-NONE,US || Product Test | Product: CB Original ||| 1D || 14/01/2025,SHARE,$141,"6,573",2025-01-14,2025-01-20,6
149,CB_2024_Jan_FB_2762_IK_V05_1x1_IMG_EN_New_C-WrittenTesti_CTA-CTA_Pain-W-B-C_M-NONE_VL-None_TR-None_G-NONE_P-V2_S-NONE,CBV2 || AU || ðŸ’° Advantage+ || US || BROAD || 7C || Existing_customer_5% || 19/12/24 Ad set,SHARE,$138,"4,921",2024-12-19,2025-01-20,32
150,CB_2025_Jan_FB_3651_SO-JT_V04_4x5_IMG_EN_New_C-NONE_Evergreen_CTA-SALE_Angle-None_M-NONE_VL-None_G-NONE_P-NONE_S-NONE,3651 - NYNM - RIDDLES NOTION #77 || Enhancements: OFF || CBV1 || Batch 2 || 1C || 05/01/25w01 || Kostas,SHARE,$137,"4,833",2025-01-05,2025-01-15,10
151,CB_2025_Jan_FB_3674_SO-JT_V04_4x5_IMG_EN_New_C-NONE_Evergreen_CTA-NONE_Angle-WellBe_M-NONE_VL-None_G-NONE_P-NONE_S-NONE,3674 - CB - TWITTER HABIT || Enhancements: OFF || CBV1 || Batch 1 || 1C || 14/01/25w03 || Kostas,SHARE,$137,"5,096",2025-01-14,2025-01-18,4
152,CB_2025_Jan_FB_3674_SO-RP_V02_4x5_CAROUSEL_EN_New_C-NONE_Evergreen_CTA-NONE_Angle-W_M-NONE_VL-None_G-NONE_P-NONE_S-NONE-1,3678 - Weight_loss-batch_#2 || Enhancements: OFF || CBV1 || Batch 1 || 1C || 15/01/25w03 || Kostas,SHARE,$134,"3,539",2025-01-15,2025-01-17,2
153,CB_2025_Jan_FB_3697_JT_V02_4x5_IMG_EN_OPTI_C-NegativeMarketing_Sale_CTA-CTA_ANGLE-W-B-C_P-OG.png,3697 - yes its expensive (NY edition) || Enhancements: OFF || CBV1 || Batch 1 || 1C || 14/01/25w03 || Valentinas,SHARE,$133,"3,332",2025-01-15,2025-01-20,5
154,CB_2024_Dec_FB_3664_LZ-VU_V03_4x5_IMG_EN_New_C-StickyNotes_Evergreen_CTA-NONE_Angle-W_M-NONE_VL-None_G-M_P-OG_S-NONE,3664 - BRO notes ads || Enhancements: OFF || CBV1 || Batch 1 || 1C || 13/01/25w03 || Kostas,SHARE,$132,"6,081",2025-01-13,2025-01-15,2
155,CB_2025_Jan_FB_3669_SO-JT_V01_4x5_IMG_EN_New_C-NONE_Evergreen_CTA-NONE_Angle-W_M-NONE_VL-None_G-NONE_P-NONE_S-NONE,3669 - CB - Notion - #63 HOLYGRAIL OF... || Enhancements: OFF || CBV1 || Batch 1 || 1C || 14/01/25w03 || Kostas,SHARE,$130,"3,971",2025-01-14,2025-01-17,3
156,CB_2025_Jan_FB_3654_DT-DP_V07_1x1_IMG_EN_New_C-Headline_Evergreen_CTA-NONE_Angle-W_M-NONE_VL-None_G-F_P-OG_S-NONE,3654 - Notion #66 Horoscopes || Enhancements: OFF || CBV1 || Batch 2 || 1C || 14/01/25w03 || Kostas,SHARE,$130,"3,859",2025-01-14,2025-01-17,3
157,CB_2025_Jan_FB_3677_LZ-VU_V02_4x5_IMG_EN_New_C-Testimonial_Evergreen_CTA-NONE_Angle-GH_M-NONE_VL-None_G-NONE_P-NONE_S-NONE.png,3677 - luxury reviews ad || Enhancements: OFF || CBV1 || Batch 1 || 1C || 10/01/25w02 || Valentinas,SHARE,$129,"4,363",2025-01-10,2025-01-15,5
158,CB_2025_Jan_FB_3671_LZ-VU_V02_4x5_IMG_EN_New_C-Headline_Evergreen_CTA-NONE_Angle-W_M-NONE_VL-None_G-NONE_P-NONE_S-NONE_FB3306V02,EU (UK) || 3671 - anti inflammatory diet opti || 1C || 08/01/2025w02,SHARE,$128,"5,173",2025-01-08,2025-01-16,8
159,CB_2024_Sep_FB_3175_DA-KB_V04_1x1_IMG_EN_New_C-ADVRT_Evergreen_CTA-NONE_Angle-W_M-NONE_VL-None_G-NONE_P-CBV2_S-NONE_blog_colonbroomvsmammoth_cv_en,CBV2 || A/B Pricing: Standard || 3175 - CB vs Happy Mammoth advertorial || BROAD || 1C ||  22/11/24 || Kostas,SHARE,$127,"3,402",2024-12-22,2025-01-13,22
160,CB_2025_Jan_FB_3654_DT-DP_V05_1x1_IMG_EN_New_C-Headline_Evergreen_CTA-NONE_Angle-W_M-NONE_VL-None_G-F_P-OG_S-NONE,3654 - Notion #66 Horoscopes || Enhancements: OFF || CBV1 || Batch 1 || 1C || 14/01/25w03 || Kostas,SHARE,$127,"4,030",2025-01-14,2025-01-17,3
161,CB_2023_Jul_FB_2217_IB_V04_9x16_VID_EN_Opti_C-Pointing_CTA-SMR_Pain-W-B_M-TRC_VL-30s_TR-None_G-F_P-None_S-FRIGGA - Copy 2,View Content || BROAD || 7C || 17/12/24,VIDEO,$126,"16,544",2024-12-17,2025-01-20,34
162,CB_2023_Jul_FB_2226_MB_V04_9x16_VID_EN_Opti_C-Testim_CTA-SMR_Pain-W_M-MIX_VL-30s_TR-None_G-F_P-None_S-Starry,CBV2 || Advantage+ || Only V1 Ads || US || 5% EXISTING CAP || BROAD || 7C || 30/12/24  Campaign Ad set,SHARE,$123,"5,404",2024-12-30,2025-01-22,23
163,CB_2024_Dec_FB_3606_DT_V03_4x5_IMG_EN_New_C-NONE_Sale_CTA-70_Angle-W_M-NONE_VL-None_G-NONE_P-OG_S-NONE,3606 - Notion - 45 Users review IMG ads || Enhancements: OFF || CBV1 || Batch 1 || 1C || 13/01/25w03 || Kostas,SHARE,$121,"3,181",2025-01-13,2025-01-15,2
164,CB_2025_Jan_FB_3654_DT-DP_V04_1x1_IMG_EN_New_C-Headline_Evergreen_CTA-NONE_Angle-W_M-NONE_VL-None_G-F_P-OG_S-NONE,3654 - Notion #66 Horoscopes || Enhancements: OFF || CBV1 || Batch 1 || 1C || 14/01/25w03 || Kostas,SHARE,$120,"3,810",2025-01-14,2025-01-17,3
165,CB_2025_Jan_FB_3686_LZ-KB_V01_4x5_IMG_EN_New_C-Headline_Evergreen_CTA-NONE_Angle-ADVTR_M-NONE_VL-None_G-NONE_P-NONE_S-NONE_FB3582V11,CBV2 || LP:HI 3686 - advertorial 3582v11 opti - secret behind the label advertorial ads || Batch 4 || Audience: Under 60 || 1C ||  10/01/25 || Kostas,SHARE,$120,"2,478",2025-01-13,2025-01-15,2
166,CB_2023_May_FB_2144_MB_V02_9x16_VID_EN_Opti_C-Sale_CTA-SMR_Pain-W_M-JOG_VL-30s_TR-None_G-M-F_P-None_S-What,CA || COST CAP 92->93 || 7C || 10/05/24 || V1,VIDEO,$118,"7,277",2024-05-10,2025-02-27,293
167,CB_2024_Dec_FB_3606_DT_V01_4x5_IMG_EN_New_C-NONE_Sale_CTA-70_Angle-W_M-NONE_VL-None_G-NONE_P-OG_S-NONE,3606 - Notion - 45 Users review IMG ads || Enhancements: OFF || CBV1 || Batch 1 || 1C || 13/01/25w03 || Kostas,SHARE,$116,"4,120",2025-01-13,2025-01-15,2
168,CB_2025_Jan_FB_3692_KB_V03_4x5_IMG_EN_New_C-SocialProof_Sale_CTA-SALE_Angle-W-B-C_M-NONE_VL-None_G-NONE_P-OG_S-NONE,3692 - Notion ideal #97 - Why She_s Not Into You || Enhancements: OFF || CBV1 || Batch 1 || 1C || 15/01/25w03 || Kostas,SHARE,$116,"8,127",2025-01-15,2025-01-16,1
169,CB_2025_Jan_FB_3682_DT-RP_V02_4x5_IMG_EN_New_C-BulletPoints_Evergreen_CTA-NONE_Angle-W_M-NONE_VL-None_G-NONE_P-OG_S-NONE,3682 - Weight_loss-batch_#4 || Enhancements: OFF || CBV1 || Batch 1 || 1C || 15/01/25w03 || Kostas,SHARE,$116,"4,711",2025-01-15,2025-01-22,7
170,CB_2025_Jan_FB_3654_DT-DP_V11_1x1_IMG_EN_New_C-Headline_Evergreen_CTA-NONE_Angle-W_M-NONE_VL-None_G-F_P-OG_S-NONE,3654 - Notion #66 Horoscopes || Enhancements: OFF || CBV1 || Batch 2 || 1C || 14/01/25w03 || Kostas,SHARE,$114,"3,104",2025-01-14,2025-01-17,3
171,CB_2024_Dec_FB_3619_VK-JT_V03_4x5_VID_EN_New_C-BulletPoints_Sale_CTA-NY_Angle-W-B-C_M-NONE_VL-None_G-NONE_P-OG_S-NONE,3619 - CB - CRAVINGS - IMG - TESTIMONIAL || Enhancements: OFF || CBV1 || Batch 1 || 1C || 23/12/24w52 || Kostas,SHARE,$114,"4,702",2024-12-23,2025-01-15,23
172,CB_2024_Dec_FB_3608_LZ-DP_V02_4x5_IMG_EN_New_C-Headline_Evergreen_CTA-NONE_Angle-W_M-NONE_VL-None_G-NONE_P-OG_S-NONE,3608 - CB_IMG_ notion #17 hypnosis || Enhancements: OFF || CBV1 || Batch 1 || 1C || 13/01/25w03 || Kostas,SHARE,$113,"4,686",2025-01-13,2025-02-03,21
173,CB_2025_Jan_FB_3674_SO-JT_V03_4x5_IMG_EN_New_C-NONE_Evergreen_CTA-NONE_Angle-WellBe_M-NONE_VL-None_G-NONE_P-NONE_S-NONE,3674 - CB - TWITTER HABIT || Enhancements: OFF || CBV1 || Batch 1 || 1C || 14/01/25w03 || Kostas,SHARE,$109,"4,913",2025-01-14,2025-01-18,4
174,CB_2025_Dec_FB_3672_VK-JG_V01_4x5_VID_EN_Opti_C-BulletPoints_Sale_CTA-NY_Angle-W-B-C_M-JOG_VL-30s_G-F_P-OG_S-WHAT_FB3172V01,3672 - opti 3174 || Enhancements: OFF || CBV1 || Batch 1 || 1C || 14/01/25w03 || Kostas,SHARE,$105,"3,269",2025-01-14,2025-01-18,4
175,CB_2025_Jan_FB_3656_JT_V03_4x5_IMG_EN_New_C-Headline_Seasonal_CTA-70_Angle-W_M-NONE_VL-None_G-NONE_P-OG_S-NONE,EU (UK) || 3656 - we_re leaving || 1C || 15/01/2025w03,SHARE,$103,"4,637",2025-01-15,2025-01-20,5
176,CB_2025_Jan_FB_3675_DT-DP_V01_4x5_IMG_EN_New_C-Headline_Sale_CTA-70_Angle-C_M-MIX_VL-None_G-F_P-OG_S-NONE,3675 - Notion idea #69 || Enhancements: OFF || CBV1 || Batch 1 || 1C || 14/01/25w03 || Kostas,SHARE,$102,"3,561",2025-01-14,2025-01-17,3
177,CB_2025_Jan_FB_3655_DT-JT_V01_4x5_VID_EN_New_C-Educational_Sale_CTA-NY_Angle-W_M-MIX_VL-45s_G-MF_P-OG_S-NEW,3655 - CB PODCAST EDU BRIEF - NYNM || Enhancements: OFF || CBV1 || Batch 1 || 1C || 14/01/25w03 || Kostas,SHARE,$101,"5,608",2025-01-14,2025-01-18,4
178,CB_2024_Dec_FB_3630_LZ-DP_V01_4x5_IMG_EN_New_C-NONE_Evergreen_CTA-NONE_Angle-B_M-NONE_VL-None_G-NONE_P-NONE_S-NONE,3630 - Notion #70 apple notes || Enhancements: OFF || CBV1 || Batch 1 || 1C || 13/01/25w03 || Kostas,SHARE,$101,"5,043",2025-01-13,2025-01-16,3
179,CB_2025_Jan_FB_3675_DT-DP_V04_4x5_IMG_EN_New_C-Headline_Sale_CTA-70_Angle-C_M-MIX_VL-None_G-F_P-OG_S-NONE,3675 - Notion idea #69 || Enhancements: OFF || CBV1 || Batch 1 || 1C || 14/01/25w03 || Kostas,SHARE,$100,"2,773",2025-01-14,2025-01-17,3
180,CB_2024_Aug_FB_3110_DA_V01_4x5_VID_EN_Opti_C-Dance_CTA-LABOR_Pain-W-B_M-JOG_VL-30s_TR-None_G-F_P-OG_S-WHAT_FB3045V01,ðŸŒ¶ï¸ || US || ASC+ || ->CC141 || VIDEO Only || US+CA || 0% EXISTING CAP || 7C || 07/08.24  Ad set,VIDEO,$99,"2,315",2024-09-02,2025-01-24,144
181,CB_2024_Nov_FB_3264_LZ_V31_4x5_VID_EN_Opti_C-MakingOf_Sale_CTA-BF_Angle-W-B_M-CRAZY_VL-45s_G-M_P-OG_S-NEW_FB3004V02,View Content || BROAD || 7C || 17/12/24,VIDEO,$99,"7,045",2024-12-17,2025-01-20,34
182,CB_2024_Dec_FB_3639_CHUB_V02_1x1_IMG_EN_New_C-NONE_CTA-NONE_Angle-W_M-NONE_VL-None_TR-None_G-NONE_P-NONE_S-NONE,3639 CHUB â€“ Looking 15 people || Enhancements: OFF || CBV1 || Batch 1 || 1C || 30/12/24w01 || Kostas,SHARE,$98,"3,641",2024-12-30,2025-01-13,14
183,CB_2024_Dec_FB_3639_CHUB_V02_1x1_IMG_EN_New_C-NONE_CTA-NONE_Angle-W_M-NONE_VL-None_TR-None_G-NONE_P-NONE_S-NONE,ðŸŒ¶ï¸ || US || ASC+ || ->CC141 || VIDEO Only || US+CA || 0% EXISTING CAP || 7C || 07/08.24  Ad set,SHARE,$97,"3,455",2025-01-09,2025-01-24,15
184,CB_2025_Jan_FB_3692_KB_V01_4x5_IMG_EN_New_C-SocialProof_Sale_CTA-SALE_Angle-W-B-C_M-NONE_VL-None_G-NONE_P-OG_S-NONE,3692 - Notion ideal #97 - Why She_s Not Into You || Enhancements: OFF || CBV1 || Batch 1 || 1C || 15/01/25w03 || Kostas,SHARE,$97,"5,664",2025-01-15,2025-01-17,2
185,CB_2024_Dec_FB_3601_VK-DP_V09_4x5_VID_EN_Opti_C-Dance_CTA-NY_Pain-W-B_M-JOG_VL-30s_TR-None_G-F_P-OG_S-WHAT_FB3045V01,CBV2 || AU || ðŸ’° Advantage+ || US || BROAD || 7C || Existing_customer_5% || 19/12/24 Ad set,SHARE,$94,"2,986",2025-01-03,2025-03-27,83
186,CB_2025_Jan_FB_3686_LZ-KB_V04_4x5_IMG_EN_New_C-Headline_Evergreen_CTA-NONE_Angle-ADVTR_M-NONE_VL-None_G-NONE_P-NONE_S-NONE_FB3582V11,CBV2 || LP:HI 3686 - advertorial 3582v11 opti - secret behind the label advertorial ads || Batch 4 || Audience: Under 60 || 1C ||  10/01/25 || Kostas,SHARE,$92,"2,210",2025-01-13,2025-01-15,2
187,CB_2025_Jan_FB_3655_JT_V02_4x5_IMG_EN_New_C-Headline_Seasonal_CTA-70_Angle-W_M-NONE_VL-None_G-NONE_P-OG_S-NONE,ðŸŒ¶ï¸ || US || ASC+ || ->CC141 || VIDEO Only || US+CA || 0% EXISTING CAP || 7C || 07/08.24  Ad set,SHARE,$91,"3,756",2025-01-13,2025-01-24,11
188,CB_2023_Dec_FB_2712_RS-DP_V02_1x1_VID_EN_Opti_C-WrittenTesti_CTA-SALE_Pain-W-B-C_M-NONE_VL-None_TR-None_G-NONE_P-V2_S-NONE_FB2227V08,Pricing Test || EU (UK) || 1C || Higher Price || 07/01/25,SHARE,$89,"3,227",2025-01-07,2025-01-15,8
189,CB_2024_Dec_FB_3664_LZ-VU_V01_4x5_IMG_EN_New_C-StickyNotes_Evergreen_CTA-NONE_Angle-W_M-NONE_VL-None_G-M_P-OG_S-NONE,3664 - BRO notes ads || Enhancements: OFF || CBV1 || Batch 1 || 1C || 13/01/25w03 || Kostas,SHARE,$88,"4,277",2025-01-13,2025-01-15,2
190,CB_2025_Jan_FB_3651_SO-JT_V03_4x5_IMG_EN_New_C-NONE_Evergreen_CTA-SALE_Angle-None_M-NONE_VL-None_G-NONE_P-NONE_S-NONE,3651 - NYNM - RIDDLES NOTION #77 || Enhancements: OFF || CBV1 || Batch 2 || 1C || 05/01/25w01 || Kostas,SHARE,$87,"4,263",2025-01-05,2025-01-15,10
191,CB_2024_Jan_FB_2784_RS_V02_9x16_VID_EN_Opti_C-Pointing_CTA-SALE_Pain-W_M-JOG_VL-30s_TR-None_G-F_P-OG_S-OLLIE_FB2181V01 - Copy,CBV2 || EU (UK) || MANUAL BID || CAP91 || 1C || || 15/01/25,VIDEO,$84,"3,145",2025-01-15,2025-01-17,2
192,CB_2023_Dec_FB_2712_RS-DP_V02_1x1_VID_EN_Opti_C-WrittenTesti_CTA-SALE_Pain-W-B-C_M-NONE_VL-None_TR-None_G-NONE_P-V2_S-NONE_FB2227V08,Pricing Test || EU (UK) || 1C || Standard Price || 07/01/25,SHARE,$83,"3,211",2025-01-07,2025-01-15,8
193,CB_2025_Jan_FB_3682_DT-RP_V01_4x5_IMG_EN_New_C-BulletPoints_Evergreen_CTA-NONE_Angle-W_M-NONE_VL-None_G-NONE_P-OG_S-NONE,3682 - Weight_loss-batch_#4 || Enhancements: OFF || CBV1 || Batch 1 || 1C || 15/01/25w03 || Kostas,SHARE,$83,"3,138",2025-01-15,2025-01-22,7
194,CB_2025_Jan_FB_3680_CHUB_V08_4x5_IMG_EN_New_C-NONE_CTA-NONE_Angle-C_M-NONE_VL-None_TR-None_G-NONE_P-NONE_S-NONE,3680 - Looking for 15 people _ Trashy ITR CHUB || Enhancements: OFF || CBV1 || Batch 2 || 1C || 10/01/25w02 || Kostas,SHARE,$80,"3,708",2025-01-10,2025-01-13,3
195,CB_2025_Jan_FB_3683_SO_V03_4x5_IMG_EN_New_C-Headline_Evergreen_CTA-NONE_Angle-B_M-NONE_VL-None_G-NONE_P-NONE_S-NONE,3683 - Notion Idea #91 Belly Drums || Enhancements: OFF || CBV1 || Batch 1 || 1C || 19/01/25w04 || Kostas,SHARE,$78,"3,860",2025-01-19,2025-01-23,4
196,CB_2022_Mar3_FB_713_IK_V04_1x1_IMG_EN_Opti_C-WrittenTesti_HE-98_A-ExtremeBodyVisualization_HK-bodypart_Pain-W_CLR-PURPLE_BG-IMAGE_ME-MIX_MA-YOUNG,US || Manual Bid || BFCM || COST CAP 91 || 1C || 15/11/24,SHARE,$77,"4,939",2024-11-15,2025-02-27,104
197,CB_2024_Dec_FB_3616_LZ-JG_V01_4x5_IMG_EN_Opti_C-Headline_Sale_CTA-XMAS_Angle-Cort_M-NONE_VL-None_G-NONE_P-NONE_S-NONE_FB3251V02,ðŸŒ¶ï¸ || US || ASC+ || ->CC141 || VIDEO Only || US+CA || 0% EXISTING CAP || 7C || 07/08.24  Ad set,SHARE,$75,"2,489",2024-12-20,2025-01-24,35
198,CB_2025_Jan_FB_3654_DT-DP_V10_1x1_IMG_EN_New_C-Headline_Evergreen_CTA-NONE_Angle-W_M-NONE_VL-None_G-F_P-OG_S-NONE,3654 - Notion #66 Horoscopes || Enhancements: OFF || CBV1 || Batch 2 || 1C || 14/01/25w03 || Kostas,SHARE,$75,"2,440",2025-01-14,2025-01-17,3
199,CB_2024_Nov_FB_3264_LZ_V31_4x5_VID_EN_Opti_C-MakingOf_Sale_CTA-BF_Angle-W-B_M-CRAZY_VL-45s_G-M_P-OG_S-NEW_FB3004V02,CBV2 || AU || ðŸ’° Advantage+ || US || BROAD || 7C || Existing_customer_5% || 19/12/24 Ad set,VIDEO,$74,"2,578",2024-12-19,2025-03-27,98
200,CB_2024_Dec_FB_3601_VK-DP_V09_4x5_VID_EN_Opti_C-Dance_CTA-NY_Pain-W-B_M-JOG_VL-30s_TR-None_G-F_P-OG_S-WHAT_FB3045V01,CBV2 || Advantage+ || Only V1 Ads || US || 5% EXISTING CAP || BROAD || 7C || 30/12/24  Campaign Ad set,VIDEO,$74,"1,642",2024-12-30,2025-01-22,23
201,CB_2025_Jan_FB_3660_CHUB_V01_4x5_IMG_EN_New_C-NONE_CTA-NONE_Angle-C_M-NONE_VL-None_TR-None_G-NONE_P-NONE_S-NONE,3660 - G-nuggets winner ITR || Enhancements: OFF || CBV1 || Batch 1 || 1C || 14/01/25w03 || Kostas,SHARE,$73,"4,321",2025-01-14,2025-01-27,13
202,CB_2025_Jan_FB_3686_LZ-KB_V03_4x5_IMG_EN_New_C-Headline_Evergreen_CTA-NONE_Angle-ADVTR_M-NONE_VL-None_G-NONE_P-NONE_S-NONE_FB3582V11,CBV2 || LP:HI 3686 - advertorial 3582v11 opti - secret behind the label advertorial ads || Batch 4 || Audience: Under 60 || 1C ||  10/01/25 || Kostas,SHARE,$72,"1,245",2025-01-13,2025-01-15,2
203,CB_2025_Jan_FB_3654_DT-DP_V08_1x1_IMG_EN_New_C-Headline_Evergreen_CTA-NONE_Angle-W_M-NONE_VL-None_G-F_P-OG_S-NONE,3654 - Notion #66 Horoscopes || Enhancements: OFF || CBV1 || Batch 2 || 1C || 14/01/25w03 || Kostas,SHARE,$71,"2,572",2025-01-14,2025-01-17,3
204,CB_2024_Feb_FB_2834_DA_V02_4x5_IMG_EN_Opti_C-SingleTesti_CTA-NONE_Pain-W_M-NONE_VL-None_TR-None_G-NONE_P-V2_S-NONE_FB2759V04,CBV2 || EU (UK) || ðŸ’° Advantage+ || US || BROAD || 7C || Existing_customer_5% || 15/12/24 Ad set,SHARE,$68,"3,165",2024-12-15,2025-01-31,47
205,CB_2024_Nov_FB_3305_SO-DP_V02_4x5_VID_EN_Opti_C-Sale_CTA-BF_Pain-W_M-Chris_VL-30s_TR-None_G-MF_P-Plan_S-NEW_FB2601V07,CBV2 || Advantage+ || Only V1 Ads || US || 5% EXISTING CAP || BROAD || 7C || 30/12/24  Campaign Ad set,VIDEO,$67,"2,124",2024-12-30,2025-01-22,23
206,CB_2025_Jan_FB_3674_SO-JT_V01_4x5_IMG_EN_New_C-NONE_Evergreen_CTA-NONE_Angle-WellBe_M-NONE_VL-None_G-NONE_P-NONE_S-NONE,3674 - CB - TWITTER HABIT || Enhancements: OFF || CBV1 || Batch 1 || 1C || 14/01/25w03 || Kostas,SHARE,$67,"3,577",2025-01-14,2025-01-18,4
207,CB_2024_Dec_FB_3664_LZ-VU_V02_4x5_IMG_EN_New_C-StickyNotes_Evergreen_CTA-NONE_Angle-W_M-NONE_VL-None_G-M_P-OG_S-NONE,3664 - BRO notes ads || Enhancements: OFF || CBV1 || Batch 1 || 1C || 13/01/25w03 || Kostas,SHARE,$67,"2,979",2025-01-13,2025-01-15,2
208,CB_2024_Dec_FB_3630_LZ-DP_V02_4x5_IMG_EN_New_C-NONE_Evergreen_CTA-NONE_Angle-CR_M-NONE_VL-None_G-NONE_P-NONE_S-NONE,3630 - Notion #70 apple notes || Enhancements: OFF || CBV1 || Batch 1 || 1C || 13/01/25w03 || Kostas,SHARE,$63,"3,251",2025-01-13,2025-01-16,3
209,CB_2024_Nov_FB_3305_SO-DP_V02_4x5_VID_EN_Opti_C-Sale_CTA-BF_Pain-W_M-Chris_VL-30s_TR-None_G-MF_P-Plan_S-NEW_FB2601V07,CBV2 || AU || ðŸ’° Advantage+ || US || BROAD || 7C || Existing_customer_5% || 19/12/24 Ad set,VIDEO,$61,"2,152",2024-12-19,2025-03-27,98
210,CB_2025_Jan_FB_3651_SO-JT_V03_4x5_IMG_EN_New_C-NONE_Evergreen_CTA-SALE_Angle-None_M-NONE_VL-None_G-NONE_P-NONE_S-NONE,ðŸŒ¶ï¸ || US || ASC+ || ->CC141 || VIDEO Only || US+CA || 0% EXISTING CAP || 7C || 07/08.24  Ad set,SHARE,$61,"2,535",2025-01-09,2025-01-24,15
211,CB_2024_Dec_FB_3623_CHUB_V04_1x1_IMG_EN_New_C-NONE_CTA-NONE_Angle-W_M-NONE_VL-None_TR-None_G-NONE_P-NONE_S-NONE,3623 Creative Hub - Organic facebook comments || Enhancements: OFF || CBV1 || Batch 1 || 1C || 14/01/25w03 || Kostas,SHARE,$60,"4,318",2025-01-14,2025-01-19,5
212,CB_2025_Jan_FB_3654_DT-DP_V06_1x1_IMG_EN_New_C-Headline_Evergreen_CTA-NONE_Angle-W_M-NONE_VL-None_G-F_P-OG_S-NONE,3654 - Notion #66 Horoscopes || Enhancements: OFF || CBV1 || Batch 1 || 1C || 14/01/25w03 || Kostas,SHARE,$60,"1,787",2025-01-14,2025-01-17,3
213,CB_2025_Jan_FB_3671_LZ-VU_V02_4x5_IMG_EN_New_C-Headline_Evergreen_CTA-NONE_Angle-W_M-NONE_VL-None_G-NONE_P-NONE_S-NONE_FB3306V02,AU || 3671 - anti inflammatory diet opti || 1C || 10/01/2025w02,SHARE,$60,"2,316",2025-01-10,2025-01-13,3
214,CB_2025_Jan_FB_3661_CHUB_V04_1x1_IMG_EN_New_C-NONE_CTA-NONE_Angle-C_M-NONE_VL-None_TR-None_G-NONE_P-OG_S-NONE,3661 - Pop your methane balloon ITR. || Enhancements: OFF || CBV1 || Batch 1 || 1C || 14/01/25w03 || Kostas,SHARE,$60,"1,852",2025-01-14,2025-01-24,10
215,CB_2023_Oct_FB_2516_VK_V13_9x16_VID_EN_Opti_C-Benefits_CTA-AUTUM_Pain-W-B_M-PASQ_VL-30s_TR-None_G-M_P-Plan_S-WHAT,ðŸ’°WC || US || Advantage+ || BIG BUDGET || CC101->105->109->112->114-116->117 || BROAD || ABO || 1C || 17/01/24 RELAUNCHED Ad set,VIDEO,$59,"2,076",2024-01-17,2025-02-06,386
216,CB_2025_Jan_FB_3697_JT_V04_4x5_IMG_EN_OPTI_C-NegativeMarketing_Sale_CTA-CTA_ANGLE-W-B-C_P-OG.png,3697 - yes its expensive (NY edition) || Enhancements: OFF || CBV1 || Batch 1 || 1C || 14/01/25w03 || Valentinas,SHARE,$58,"1,375",2025-01-15,2025-01-20,5
217,CB_2024_Oct_FB_3251_LZ-VU_V01_1x1_IMG_EN_New_C-NegativeMark_Evergreen_CTA-NONE_Angle-Cort_M-NONE_VL-None_G-NONE_P-NONE_S-NONE.png,US || Manual Bid || BFCM || ROAS GOAL: 1.4 || 1C || 15/11/24,SHARE,$57,"1,539",2024-11-15,2025-02-27,104
218,CB_2024_Feb_FB_2834_DA_V04_4x5_IMG_EN_Opti_C-SingleTesti_CTA-NONE_Pain-W_M-NONE_VL-None_TR-None_G-NONE_P-V2_S-NONE_FB2759V04,CBV2 || AU || ðŸ’° Advantage+ || US || BROAD || 7C || Existing_customer_5% || 19/12/24 Ad set,SHARE,$57,"2,655",2024-12-19,2025-03-27,98
219,CB_2025_Jan_FB_3689_LZ-VU_V03_4x5_IMG_EN_New_C-Headline_Evergreen_CTA-NONE_Angle-W_M-NONE_VL-None_G-F_P-NONE_S-NONE,3689 - Shilute family club scales ad || Enhancements: OFF || CBV1 || Batch 1 || 1C || 15/01/25w03 || Kostas,SHARE,$56,"2,094",2025-01-15,2025-01-18,3
220,CB_2025_Jan_FB_3671_LZ-VU_V02_4x5_IMG_EN_New_C-Headline_Evergreen_CTA-NONE_Angle-W_M-NONE_VL-None_G-NONE_P-NONE_S-NONE_FB3306V02,AU || 3rd party page || 3671 - anti inflammatory diet opti || 1C || 10/01/2025w02,SHARE,$55,"2,158",2025-01-10,2025-01-13,3
221,CB_2025_Jan_FB_3654_DT-DP_V01_1x1_IMG_EN_New_C-Headline_Evergreen_CTA-NONE_Angle-W_M-NONE_VL-None_G-F_P-OG_S-NONE,3654 - Notion #66 Horoscopes || Enhancements: OFF || CBV1 || Batch 1 || 1C || 14/01/25w03 || Kostas,SHARE,$55,"1,680",2025-01-14,2025-01-17,3
222,CB_2025_Jan_FB_3654_DT-DP_V03_1x1_IMG_EN_New_C-Headline_Evergreen_CTA-NONE_Angle-W_M-NONE_VL-None_G-F_P-OG_S-NONE,3654 - Notion #66 Horoscopes || Enhancements: OFF || CBV1 || Batch 1 || 1C || 14/01/25w03 || Kostas,SHARE,$55,"1,659",2025-01-14,2025-01-17,3
223,CB_2025_Jan_FB_3697_JT_V01_4x5_IMG_EN_OPTI_C-NegativeMarketing_Sale_CTA-CTA_ANGLE-W-B-C_P-OG.png,3697 - yes its expensive (NY edition) || Enhancements: OFF || CBV1 || Batch 1 || 1C || 14/01/25w03 || Valentinas,SHARE,$54,"1,518",2025-01-15,2025-01-20,5
224,CB_2025_Dec_FB_3672_VK-JG_V04_4x5_VID_EN_Opti_C-BulletPoints_Sale_CTA-NY_Angle-W-B-C_M-JOG_VL-30s_G-F_P-OG_S-MOON_FB3172V04,3672 - opti 3174 || Enhancements: OFF || CBV1 || Batch 1 || 1C || 14/01/25w03 || Kostas,SHARE,$54,"1,700",2025-01-14,2025-01-18,4
225,IM_CB4.png,US || VSL || Aff's image || Landing: QUIZ || 1C || 16/01/25,SHARE,$53,950,2025-01-16,2025-01-17,1
226,CB_2025_Jan_FB_3692_KB_V01_4x5_IMG_EN_New_C-SocialProof_Sale_CTA-SALE_Angle-W-B-C_M-NONE_VL-None_G-NONE_P-OG_S-NONE - Copy,3692 - Notion ideal #97 - Why She_s Not Into You || Enhancements: OFF || CBV1 || Batch 1 || 1C || 15/01/25w03 || Kostas,SHARE,$53,"3,083",2025-01-15,2025-01-17,2
227,CB_2024_Oct_FB_3182_ZS-GC_V13_1x1_IMG_EN_New_C-UsVsThem_Evergreen_CTA-NONE_Angle-B-C_M-NONE_VL-None_G-NONE_P-OG_S-NONE,CBV2 || AU || ðŸ’° Advantage+ || US || BROAD || 7C || Existing_customer_5% || 19/12/24 Ad set,SHARE,$52,"2,297",2024-12-19,2025-03-27,98
228,CB_2025_Jan_FB_3721_KB_V03_4x5_IMG_EN_New_C-SocialProof_Sale_CTA-SALE_Angle-W-B-C_M-NONE_VL-None_G-NONE_P-OG_S-NONE,3721 - 21.6% reads the first sentence || Enhancements: OFF || CBV1 || Batch 1 || 1C || 19/01/25w04 || Kostas,SHARE,$50,"2,710",2025-01-19,2025-01-23,4
229,CB_2024_Sep_FB_3175_DA-KB_V03_1x1_IMG_EN_New_C-ADVRT_Evergreen_CTA-NONE_Angle-W_M-NONE_VL-None_G-NONE_P-CBV2_S-NONE_blog_colonbroomvsmammoth_cv_en,CBV2 || A/B Pricing: Standard || 3175 - CB vs Happy Mammoth advertorial || BROAD || 1C ||  22/11/24 || Kostas,SHARE,$50,"1,596",2024-12-22,2025-01-13,22
230,CB_2024_Jan_FB_2717_MB-RP_V26_9x16_VID_EN_New_C-Buzz_CTA-SALE_Pain-W-B-C_M-MIX_VL-45s_TR-None_G-MF_P-Method_S-NONE,CA || COST CAP 92->93 || 7C || 10/05/24 || V1,VIDEO,$49,"2,384",2024-08-22,2025-02-27,189
231,CB_2025_Jan_FB_3665_SO-DP_V02_4x5_IMG_EN_New_C-NONE_Evergreen_CTA-SALE_Angle-W_M-NONE_VL-None_G-NONE_P-NONE_S-NONE,3665 - Notion idea #72 || Enhancements: OFF || CBV1 || Batch 1 || 1C || 13/01/25w03 || Kostas,SHARE,$48,"3,443",2025-01-14,2025-01-24,10
232,CB_2025_Jan_FB_3654_DT-DP_V02_1x1_IMG_EN_New_C-Headline_Evergreen_CTA-NONE_Angle-W_M-NONE_VL-None_G-F_P-OG_S-NONE,3654 - Notion #66 Horoscopes || Enhancements: OFF || CBV1 || Batch 1 || 1C || 14/01/25w03 || Kostas,SHARE,$47,"1,595",2025-01-14,2025-01-17,3
233,CB_2025_Jan_FB_3654_DT-DP_V09_1x1_IMG_EN_New_C-Headline_Evergreen_CTA-NONE_Angle-W_M-NONE_VL-None_G-F_P-OG_S-NONE,3654 - Notion #66 Horoscopes || Enhancements: OFF || CBV1 || Batch 2 || 1C || 14/01/25w03 || Kostas,SHARE,$47,"1,328",2025-01-14,2025-01-17,3
234,CB_2025_Jan_FB_3639_DT-DP_V04_1x1_IMG_EN_New_C-NONE_CTA-NONE_Angle-W_M-NONE_VL-None_TR-None_G-NONE_P-NONE_S-NONE_FB3639V03,3688 - Opti 3639 || Enhancements: OFF || CBV1 || Batch 1 || 1C || 19/01/25w04 || Kostas,SHARE,$46,"1,781",2025-01-19,2025-01-23,4
235,CB_2025_Jan_FB_3686_LZ-KB_V05_4x5_IMG_EN_New_C-Headline_Evergreen_CTA-NONE_Angle-ADVTR_M-NONE_VL-None_G-NONE_P-NONE_S-NONE_FB3582V11,CBV2 || LP:HI 3686 - advertorial 3582v11 opti - secret behind the label advertorial ads || Batch 5 || BROAD || 1C ||  10/01/25 || Kostas,SHARE,$45,658,2025-01-10,2025-01-13,3
236,CB_2024_Feb_FB_2834_DA_V04_4x5_IMG_EN_Opti_C-SingleTesti_CTA-NONE_Pain-W_M-NONE_VL-None_TR-None_G-NONE_P-V2_S-NONE_FB2759V04,CBV2 || EU (UK) || ðŸ’° Advantage+ || US || BROAD || 7C || Existing_customer_5% || 15/12/24 Ad set,SHARE,$45,"2,093",2024-12-15,2025-01-31,47
237,CB_2024_Sep_FB_3175_DA-KB_V01_1x1_IMG_EN_New_C-ADVRT_Evergreen_CTA-NONE_Angle-W_M-NONE_VL-None_G-NONE_P-CBV2_S-NONE_blog_colonbroomvsmammoth_cv_en,CBV2 || A/B Pricing: Standard || 3175 - CB vs Happy Mammoth advertorial || BROAD || 1C ||  22/11/24 || Kostas,SHARE,$45,"1,599",2024-12-22,2025-01-13,22
238,CB_2024_Dec_FB_3606_DT_V02_4x5_IMG_EN_New_C-NONE_Sale_CTA-70_Angle-W_M-NONE_VL-None_G-NONE_P-OG_S-NONE,3606 - Notion - 45 Users review IMG ads || Enhancements: OFF || CBV1 || Batch 1 || 1C || 13/01/25w03 || Kostas,SHARE,$44,"2,078",2025-01-13,2025-01-15,2
239,CB_2024_Feb_FB_2834_DA_V02_4x5_IMG_EN_Opti_C-SingleTesti_CTA-NONE_Pain-W_M-NONE_VL-None_TR-None_G-NONE_P-V2_S-NONE_FB2759V04,CBV2 || AU || ðŸ’° Advantage+ || US || BROAD || 7C || Existing_customer_5% || 19/12/24 Ad set,SHARE,$43,"1,845",2024-12-19,2025-03-27,98
240,CB_2023_May_FB_2103_MB_V02_9x16_VID_EN_Opti_C-Sale_CTA-SMR_Pain-W_M-JOG_VL-30s_TR-None_G-M-F_P-None_S-What,US || Manual Bid || BFCM || ROAS GOAL: 1.4 || 1C || 15/11/24,VIDEO,$42,939,2024-11-15,2025-02-27,104
241,IM_CB3.png,US || VSL || Aff's image || Landing: Directly to VSL || 1C || 16/01/25,SHARE,$40,"1,019",2025-01-16,2025-01-28,12
242,CB_2025_Jan_FB_3686_LZ-KB_V04_4x5_IMG_EN_New_C-Headline_Evergreen_CTA-NONE_Angle-ADVTR_M-NONE_VL-None_G-NONE_P-NONE_S-NONE_FB3582V11,CBV2 || LP:HI 3686 - advertorial 3582v11 opti - secret behind the label advertorial ads || Batch 4 || BROAD || 1C ||  10/01/25 || Kostas,SHARE,$40,525,2025-01-10,2025-01-13,3
243,CB_2024_Dec_FB_3606_DT_V04_4x5_IMG_EN_New_C-NONE_Sale_CTA-70_Angle-W_M-NONE_VL-None_G-NONE_P-OG_S-NONE,3606 - Notion - 45 Users review IMG ads || Enhancements: OFF || CBV1 || Batch 1 || 1C || 13/01/25w03 || Kostas,SHARE,$40,"1,107",2025-01-13,2025-01-15,2
244,CB_2025_Jan_FB_3675_DT-DP_V03_4x5_IMG_EN_New_C-Headline_Sale_CTA-70_Angle-C_M-MIX_VL-None_G-F_P-OG_S-NONE,3675 - Notion idea #69 || Enhancements: OFF || CBV1 || Batch 1 || 1C || 14/01/25w03 || Kostas,SHARE,$39,"1,009",2025-01-14,2025-01-17,3
245,CB_2025_Jan_FB_3684_CHUB_V04_4x5_IMG_EN_New_C-NONE_CTA-NONE_Angle-B_M-NONE_VL-30s_TR-None_G-M_P-NONE_S-NONE,3684 Stop scrolling belly CHUB  || Enhancements: OFF || CBV1 || Batch 1 || 1C || 19/01/25w04 || Kostas,SHARE,$38,"1,836",2025-01-19,2025-01-23,4
246,CB_2024_Nov_FB_3562_VK-JG_V03_4x5_IMG_EN_New_C-BulletPoints_Sale_CTA-BF70_Angle-W_M-NONE_VL-.png,UK || ASC+ || CBV2 || 7DC || Existing 10% || 13.11.2024 Ad set,SHARE,$38,"2,000",2024-11-28,2025-01-16,49
247,CB_2025_Jan_FB_3662_CHUB_V03_1x1_IMG_EN_New_C-NONE_CTA-NONE_Angle-C_M-NONE_VL-None_TR-None_G-NONE_P-NONE_S-NONE.jpg,3662 - Hipno event ITR CHUB || Enhancements: OFF || CBV1 || Batch 1 || 1C || 10/01/25w02 || Valentinas,SHARE,$36,"1,298",2025-01-10,2025-01-15,5
248,CB_2024_Dec_FB_3666_VK-JT_V04_4x5_VID_EN_Opti_C-BulletPoints_Sale_CTA-NY_Angle-W-B-C_M-TRC_VL-30s_G-F_P-OG_S-NEW,EU (UK) || 3666 - looksmaxing trend || 1C || 15/01/2025w03,SHARE,$35,"1,140",2025-01-15,2025-01-22,7
249,CB_2025_Jan_FB_3686_LZ-KB_V02_4x5_IMG_EN_New_C-Headline_Evergreen_CTA-NONE_Angle-ADVTR_M-NONE_VL-None_G-NONE_P-NONE_S-NONE_FB3582V11,CBV2 || LP:HI 3686 - advertorial 3582v11 opti - secret behind the label advertorial ads || Batch 4 || Audience: Under 60 || 1C ||  10/01/25 || Kostas,SHARE,$35,"1,407",2025-01-13,2025-01-15,2
250,CB_2025_Jan_FB_3671_LZ-VU_V03_4x5_IMG_EN_New_C-Headline_Evergreen_CTA-NONE_Angle-W_M-NONE_VL-None_G-NONE_P-NONE_S-NONE_FB3306V03,EU (UK) || 3671 - anti inflammatory diet opti || 1C || 08/01/2025w02,SHARE,$34,"1,645",2025-01-08,2025-01-15,7
251,CB_2025_Jan_FB_3689_LZ-VU_V02_4x5_IMG_EN_New_C-Headline_Evergreen_CTA-NONE_Angle-W_M-NONE_VL-None_G-F_P-NONE_S-NONE,3689 - Shilute family club scales ad || Enhancements: OFF || CBV1 || Batch 1 || 1C || 15/01/25w03 || Kostas,SHARE,$33,"1,411",2025-01-15,2025-01-18,3
252,CB_2025_Jan_FB_3654_DT-DP_V12_1x1_IMG_EN_New_C-Headline_Evergreen_CTA-NONE_Angle-W_M-NONE_VL-None_G-F_P-OG_S-NONE,3654 - Notion #66 Horoscopes || Enhancements: OFF || CBV1 || Batch 2 || 1C || 14/01/25w03 || Kostas,SHARE,$33,"1,108",2025-01-14,2025-01-17,3
253,CB_2024_Oct_FB_3182_ZS-GC_V13_1x1_IMG_EN_New_C-UsVsThem_Evergreen_CTA-NONE_Angle-B-C_M-NONE_VL-None_G-NONE_P-OG_S-NONE,CBV2 || EU (UK) || ðŸ’° Advantage+ || US || BROAD || 7C || Existing_customer_5% || 15/12/24 Ad set,SHARE,$32,"1,751",2024-12-15,2025-01-31,47
254,CB_2024_Aug_FB_3090_DT-DP_V02_9x16_VID_EN_Opti_C-MakingOf_CTA-CTA_Pain-W-B-C_M-POW_VL-45s_TR-None_G-M_P-OG_S-Moon_FB3029V04,Pricing Test || EU (UK) || 1C || Higher Price || 07/01/25,SHARE,$30,"1,093",2025-01-07,2025-01-15,8
255,CB_2025_Jan_FB_3656_JT_V03_4x5_IMG_EN_New_C-Headline_Seasonal_CTA-70_Angle-W_M-NONE_VL-None_G-NONE_P-OG_S-NONE,3656 - we_re leaving || Enhancements: OFF || CBV1 || Batch 1 || 1C || 07/01/25w02 || Kostas,SHARE,$30,"1,444",2025-01-07,2025-01-16,9
256,CB_2024_Dec_FB_3630_LZ-DP_V04_4x5_IMG_EN_New_C-NONE_Evergreen_CTA-NONE_Angle-Energy_M-NONE_VL-None_G-NONE_P-NONE_S-NONE,3630 - Notion #70 apple notes || Enhancements: OFF || CBV1 || Batch 1 || 1C || 13/01/25w03 || Kostas,SHARE,$30,"1,497",2025-01-13,2025-01-16,3
257,CB_2023_Jul_FB_2217_IB_V04_9x16_VID_EN_Opti_C-Pointing_CTA-SMR_Pain-W-B_M-TRC_VL-30s_TR-None_G-F_P-None_S-FRIGGA,US || Manual Bid || BFCM || COST CAP 91 || 1C || 15/11/24,VIDEO,$30,844,2024-11-15,2025-02-27,104
258,CB_2022_Mar3_FB_713_IK_V04_1x1_IMG_EN_Opti_C-WrittenTesti_HE-98_A-ExtremeBodyVisualization_HK-bodypart_Pain-W_CLR-PURPLE_BG-IMAGE_ME-MIX_MA-YOUNG,UK || ASC+ || CBV2 || 7DC || Existing 10% || 13.11.2024 Ad set,SHARE,$28,"1,806",2024-11-14,2025-01-16,63
259,CB_2023_Dec_FB_2712_RS-DP_V02_1x1_VID_EN_Opti_C-WrittenTesti_CTA-SALE_Pain-W-B-C_M-NONE_VL-None_TR-None_G-NONE_P-V2_S-NONE_FB2227V08,CBV2 || EU (UK) || MANUAL BID || CAP91 || 1C || || 15/01/25,SHARE,$28,"1,009",2025-01-15,2025-01-17,2
260,CB_2024_Mar_FB_2888_JG_V03_9x16_IMG_EN_Opti_C-Benefits_CTA-NONE_Pain-W_M-NONE_VL-None_TR-None_G-NONE_P-V2_S-NONE,CBV2 || AU || ðŸ’° Advantage+ || US || BROAD || 7C || Existing_customer_5% || 19/12/24 Ad set,SHARE,$27,"1,255",2024-12-19,2025-03-27,98
261,CB_2023_Nov_FB_2648_DT_V01_1x1_GIF_EN_Opti_C-Sale_CTA-XMAS_None_M-NONE_VL-None_TR-None_G-NONE_P-OG_S-NONE,ðŸ’°WC || US || Advantage+ || BIG BUDGET || CC101->105->109->112->114-116->117 || BROAD || ABO || 1C || 17/01/24 RELAUNCHED Ad set,VIDEO,$27,339,2024-01-17,2025-02-06,386
262,CB_2025_Jan_FB_3651_SO-JT_V03_4x5_IMG_EN_New_C-NONE_Evergreen_CTA-SALE_Angle-None_M-NONE_VL-None_G-NONE_P-NONE_S-NONE,ðŸŒ¶ï¸ || US || ASC+ || ->CC141 || VIDEO Only || US+CA || 0% EXISTING CAP || 7C || 07/08.24  Ad set,SHARE,$25,"1,272",2025-01-13,2025-01-24,11
263,CB_2024_Dec_FB_3601_VK-DP_V09_4x5_VID_EN_Opti_C-Dance_CTA-NY_Pain-W-B_M-JOG_VL-30s_TR-None_G-F_P-OG_S-WHAT_FB3045V01 - Copy,ðŸ’°WC || US || Advantage+ || BIG BUDGET || CC101->105->109->112->114-116->117 || BROAD || ABO || 1C || 17/01/24 RELAUNCHED Ad set,VIDEO,$25,632,2024-12-27,2025-02-06,41
264,CB_2025_Jan_FB_3693_LZ-JG_V01_4x5_IMG_EN_Opti_C-Headline_Evergreen_CTA-NONE_Angle-W_M-NONE_VL-None_G-NONE_P-NONE_S-NONE_FB3639V03,3693 - 3639 opti quitters_ day || Enhancements: OFF || CBV1 || Batch 2 || 1C || 10/01/25w02 || Kostas,SHARE,$25,"1,229",2025-01-10,2025-01-15,5
265,CB_2025_Jan_FB_3669_SO-JT_V05_4x5_IMG_EN_New_C-NONE_Evergreen_CTA-NONE_Angle-W_M-NONE_VL-None_G-NONE_P-NONE_S-NONE,3669 - CB - Notion - #63 HOLYGRAIL OF... || Enhancements: OFF || CBV1 || Batch 1 || 1C || 14/01/25w03 || Kostas,SHARE,$25,791,2025-01-14,2025-01-17,3
266,CB_2025_Jan_FB_3669_SO-JT_V08_4x5_IMG_EN_New_C-NONE_Evergreen_CTA-NONE_Angle-W_M-NONE_VL-None_G-NONE_P-NONE_S-NONE,3669 - CB - Notion - #63 HOLYGRAIL OF... || Enhancements: OFF || CBV1 || Batch 1 || 1C || 14/01/25w03 || Kostas,SHARE,$25,801,2025-01-14,2025-01-17,3
267,CB_2025_Jan_FB_3674_SO-JT_V05_4x5_IMG_EN_New_C-NONE_Evergreen_CTA-NONE_Angle-WellBe_M-NONE_VL-None_G-NONE_P-NONE_S-NONE,3674 - CB - TWITTER HABIT || Enhancements: OFF || CBV1 || Batch 1 || 1C || 14/01/25w03 || Kostas,SHARE,$24,761,2025-01-14,2025-01-18,4
268,CB_2025_Jan_FB_3072_V02_4x5_IMG_EN_New_C-Headline_Seasonal_CTA-None_Angle-W_M-NONE_VL-None_G-NONE_P-OG_S-NONE,CBV2 || EU (UK) || ðŸ’° Advantage+ || US || BROAD || 7C || Existing_customer_5% || 15/12/24 Ad set,SHARE,$24,"1,182",2025-01-17,2025-03-14,56
269,CB_2025_Jan_FB_3072_V02_4x5_IMG_EN_New_C-Headline_Seasonal_CTA-None_Angle-W_M-NONE_VL-None_G-NONE_P-OG_S-NONE,AU || 3072 EU adaptations || 1C || 15/01/2025w03,SHARE,$24,914,2025-01-15,2025-01-20,5
270,CB_2025_Jan_FB_3684_CHUB_V03_4x5_IMG_EN_New_C-NONE_CTA-NONE_Angle-B_M-NONE_VL-30s_TR-None_G-M_P-NONE_S-NONE,3684 Stop scrolling belly CHUB  || Enhancements: OFF || CBV1 || Batch 1 || 1C || 19/01/25w04 || Kostas,SHARE,$23,971,2025-01-19,2025-01-23,4
271,CB_2025_Jan_FB_3686_LZ-KB_V03_4x5_IMG_EN_New_C-Headline_Evergreen_CTA-NONE_Angle-ADVTR_M-NONE_VL-None_G-NONE_P-NONE_S-NONE_FB3582V11,CBV2 || LP:HI 3686 - advertorial 3582v11 opti - secret behind the label advertorial ads || Batch 4 || BROAD || 1C ||  10/01/25 || Kostas,SHARE,$23,377,2025-01-10,2025-01-13,3
272,IM_CB4.png,US || VSL || Aff's image || Landing: Directly to VSL || 1C || 16/01/25,SHARE,$22,651,2025-01-16,2025-01-28,12
273,CB_2025_Jan_FB_3693_LZ-JG_V05_4x5_IMG_EN_Opti_C-Headline_Evergreen_CTA-NONE_Angle-W_M-NONE_VL-None_G-NONE_P-NONE_S-NONE_FB3639V03,3693 - 3639 opti quitters_ day || Enhancements: OFF || CBV1 || Batch 2 || 1C || 10/01/25w02 || Kostas,SHARE,$22,"1,012",2025-01-10,2025-01-15,5
274,CB_2025_Jan_FB_3721_KB_V02_4x5_IMG_EN_New_C-SocialProof_Sale_CTA-SALE_Angle-W-B-C_M-NONE_VL-None_G-NONE_P-OG_S-NONE,3721 - 21.6% reads the first sentence || Enhancements: OFF || CBV1 || Batch 1 || 1C || 19/01/25w04 || Kostas,SHARE,$22,758,2025-01-19,2025-01-23,4
275,CB_2025_Jan_FB_3683_SO_V10_4x5_IMG_EN_New_C-Headline_Evergreen_CTA-NONE_Angle-B_M-NONE_VL-None_G-NONE_P-NONE_S-NONE,3683 - Notion Idea #91 Belly Drums || Enhancements: OFF || CBV1 || Batch 2 || 1C || 19/01/25w04 || Kostas,SHARE,$21,850,2025-01-19,2025-01-24,5
276,CB_2025_Jan_FB_3662_CHUB_V02_1x1_IMG_EN_New_C-NONE_CTA-NONE_Angle-C_M-NONE_VL-None_TR-None_G-NONE_P-NONE_S-NONE.jpg,3662 - Hipno event ITR CHUB || Enhancements: OFF || CBV1 || Batch 1 || 1C || 10/01/25w02 || Valentinas,SHARE,$21,772,2025-01-10,2025-01-15,5
277,CB_2025_Jan_FB_3671_LZ-VU_V03_4x5_IMG_EN_New_C-Headline_Evergreen_CTA-NONE_Angle-W_M-NONE_VL-None_G-NONE_P-NONE_S-NONE_FB3306V03,AU || 3rd party page || 3671 - anti inflammatory diet opti || 1C || 10/01/2025w02,SHARE,$21,955,2025-01-10,2025-01-13,3
278,CB_2024_Dec_FB_3592_VK-DP_V09_4x5_VID_EN_New_C-BulletPoints_Sale_CTA-SALE_Angle-W-B-C_M-NONE_VL-30s_G-F_P-OG_S-WHAT - Copy,ASC+ || VIDEO Only || US || 0% EXISTING CAP || 1C || 08.12.24  Ad set,VIDEO,$20,787,2024-12-20,2025-02-05,47
279,CB_2025_Jan_FB_3669_SO-JT_V07_4x5_IMG_EN_New_C-NONE_Evergreen_CTA-NONE_Angle-W_M-NONE_VL-None_G-NONE_P-NONE_S-NONE,3669 - CB - Notion - #63 HOLYGRAIL OF... || Enhancements: OFF || CBV1 || Batch 1 || 1C || 14/01/25w03 || Kostas,SHARE,$20,679,2025-01-14,2025-01-17,3
280,CB_2025_Jan_FB_3693_LZ-JG_V06_4x5_IMG_EN_Opti_C-Headline_Evergreen_CTA-NONE_Angle-W_M-NONE_VL-None_G-NONE_P-NONE_S-NONE_FB3639V03,3693 - 3639 opti quitters_ day || Enhancements: OFF || CBV1 || Batch 2 || 1C || 10/01/25w02 || Kostas,SHARE,$19,"1,138",2025-01-10,2025-01-15,5
281,CB_2025_Jan_FB_3639_DT-DP_V02_1x1_IMG_EN_New_C-NONE_CTA-NONE_Angle-W_M-NONE_VL-None_TR-None_G-NONE_P-NONE_S-NONE_FB3639V03,3688 - Opti 3639 || Enhancements: OFF || CBV1 || Batch 1 || 1C || 19/01/25w04 || Kostas,SHARE,$19,561,2025-01-19,2025-01-23,4
282,CB_2025_Jan_FB_3695_KB_V01_4x5_IMG_EN_New_C-SocialProof_Sale_CTA-SALE_Angle-W-B-C_M-NONE_VL-None_G-NONE_P-OG_S-NONE,3695 - #105 â€œReddit postsâ€ California Fires || Enhancements: OFF || CBV1 || Batch 2 || 1C || 10/01/25w02 || Kostas,SHARE,$19,"1,096",2025-01-10,2025-01-22,12
283,CB_2022_Nov_FB_1218_RS_V15_9x16_IMG_EN_Opti_C-Sale_CTA-BLACK_Pain-W_M-NONE_VL-None FB1671V08,US || Manual Bid || BFCM || ROAS GOAL: 1.4 || 1C || 15/11/24,SHARE,$19,514,2024-11-15,2025-02-27,104
284,CB_2024_Aug_FB_3090_DT-DP_V02_9x16_VID_EN_Opti_C-MakingOf_CTA-CTA_Pain-W-B-C_M-POW_VL-45s_TR-None_G-M_P-OG_S-Moon_FB3029V04,Pricing Test || EU (UK) || 1C || Standard Price || 07/01/25,SHARE,$19,767,2025-01-07,2025-01-15,8
285,CB_2024_Dec_FB_3619_VK-JT_V02_4x5_VID_EN_New_C-BulletPoints_Sale_CTA-NY_Angle-W-B-C_M-NONE_VL-None_G-NONE_P-OG_S-NONE - Copy,ðŸ’°WC || US || Advantage+ || BIG BUDGET || CC101->105->109->112->114-116->117 || BROAD || ABO || 1C || 17/01/24 RELAUNCHED Ad set,SHARE,$19,598,2024-12-27,2025-02-06,41
286,CB_2025_Jan_FB_3721_KB_V01_4x5_IMG_EN_New_C-SocialProof_Sale_CTA-SALE_Angle-W-B-C_M-NONE_VL-None_G-NONE_P-OG_S-NONE,3721 - 21.6% reads the first sentence || Enhancements: OFF || CBV1 || Batch 1 || 1C || 19/01/25w04 || Kostas,SHARE,$18,694,2025-01-19,2025-01-23,4
287,CB_2024_Mar_FB_2888_JG_V02_9x16_IMG_EN_Opti_C-Benefits_CTA-NONE_Pain-W_M-NONE_VL-None_TR-None_G-NONE_P-V2_S-NONE,CBV2 || EU (UK) || ðŸ’° Advantage+ || US || BROAD || 7C || Existing_customer_5% || 15/12/24 Ad set,SHARE,$18,922,2024-12-15,2025-01-31,47
288,CB_2025_Jan_FB_3683_SO_V07_4x5_IMG_EN_New_C-Headline_Evergreen_CTA-NONE_Angle-B_M-NONE_VL-None_G-NONE_P-NONE_S-NONE,3683 - Notion Idea #91 Belly Drums || Enhancements: OFF || CBV1 || Batch 2 || 1C || 19/01/25w04 || Kostas,SHARE,$18,948,2025-01-19,2025-01-24,5
289,CB_2024_Mar_FB_2888_JG_V01_9x16_IMG_EN_Opti_C-Benefits_CTA-NONE_Pain-W_M-NONE_VL-None_TR-None_G-NONE_P-V2_S-NONE,CBV2 || AU || ðŸ’° Advantage+ || US || BROAD || 7C || Existing_customer_5% || 19/12/24 Ad set,SHARE,$18,733,2024-12-19,2025-03-27,98
290,CB_2025_Jan_FB_3683_SO_V08_4x5_IMG_EN_New_C-Headline_Evergreen_CTA-NONE_Angle-B_M-NONE_VL-None_G-NONE_P-NONE_S-NONE,3683 - Notion Idea #91 Belly Drums || Enhancements: OFF || CBV1 || Batch 2 || 1C || 19/01/25w04 || Kostas,SHARE,$17,874,2025-01-19,2025-01-24,5
291,CB_2024_Mar_FB_2888_JG_V02_9x16_IMG_EN_Opti_C-Benefits_CTA-NONE_Pain-W_M-NONE_VL-None_TR-None_G-NONE_P-V2_S-NONE,CBV2 || AU || ðŸ’° Advantage+ || US || BROAD || 7C || Existing_customer_5% || 19/12/24 Ad set,SHARE,$17,912,2024-12-19,2025-03-27,98
292,IM_CB5.png,US || VSL || Aff's image || Landing: Directly to VSL || 1C || 16/01/25,SHARE,$17,485,2025-01-16,2025-01-28,12
293,CB_2023_Aug_FB_2295_MB_V01_1x1_VID_EN_Opti_C-GIF_CTA-CTA_Pain-W-B_M-None_VL-10s_TR-None_G-None_P-None_S-None,CA || COST CAP 91 || 7C || 03/42/24 || V1,VIDEO,$17,952,2024-05-03,2025-01-13,255
294,CB_2023_Jul_FB_2226_MB_V04_9x16_VID_EN_Opti_C-Testim_CTA-SMR_Pain-W_M-MIX_VL-30s_TR-None_G-F_P-None_S-Starry,US || Manual Bid || BFCM || ROAS GOAL: 1.4 || 1C || 15/11/24,VIDEO,$17,487,2024-11-15,2025-02-27,104
295,CB_2024_Mar_FB_2888_JG_V03_9x16_IMG_EN_Opti_C-Benefits_CTA-NONE_Pain-W_M-NONE_VL-None_TR-None_G-NONE_P-V2_S-NONE,CBV2 || EU (UK) || ðŸ’° Advantage+ || US || BROAD || 7C || Existing_customer_5% || 15/12/24 Ad set,SHARE,$17,"1,028",2024-12-15,2025-01-31,47
296,CB_2025_Jan_FB_3683_SO_V09_4x5_IMG_EN_New_C-Headline_Evergreen_CTA-NONE_Angle-B_M-NONE_VL-None_G-NONE_P-NONE_S-NONE,3683 - Notion Idea #91 Belly Drums || Enhancements: OFF || CBV1 || Batch 2 || 1C || 19/01/25w04 || Kostas,SHARE,$16,791,2025-01-19,2025-01-24,5
297,CB_2025_Jan_FB_3639_DT-DP_V01_1x1_IMG_EN_New_C-NONE_CTA-NONE_Angle-W_M-NONE_VL-None_TR-None_G-NONE_P-NONE_S-NONE_FB3639V03,3688 - Opti 3639 || Enhancements: OFF || CBV1 || Batch 1 || 1C || 19/01/25w04 || Kostas,SHARE,$16,808,2025-01-19,2025-01-23,4
298,CB_2025_Jan_FB_3683_SO_V06_4x5_IMG_EN_New_C-Headline_Evergreen_CTA-NONE_Angle-B_M-NONE_VL-None_G-NONE_P-NONE_S-NONE,3683 - Notion Idea #91 Belly Drums || Enhancements: OFF || CBV1 || Batch 2 || 1C || 19/01/25w04 || Kostas,SHARE,$16,622,2025-01-19,2025-01-24,5
299,CB_2025_Jan_FB_3693_LZ-JG_V02_4x5_IMG_EN_Opti_C-Headline_Evergreen_CTA-NONE_Angle-W_M-NONE_VL-None_G-NONE_P-NONE_S-NONE_FB3639V03,ðŸŒ¶ï¸ || US || ASC+ || ->CC141 || VIDEO Only || US+CA || 0% EXISTING CAP || 7C || 07/08.24  Ad set,SHARE,$15,735,2025-01-13,2025-01-24,11
300,CB_2024_Nov_FB_3264_LZ_V31_4x5_VID_EN_Opti_C-MakingOf_Sale_CTA-BF_Angle-W-B_M-CRAZY_VL-45s_G-M_P-OG_S-NEW_FB3004V02,Pricing Test || EU (UK) || 1C || Standard Price || 07/01/25,VIDEO,$14,390,2025-01-07,2025-01-15,8
301,CB_2025_Jan_FB_3669_SO-JT_V03_4x5_IMG_EN_New_C-NONE_Evergreen_CTA-NONE_Angle-W_M-NONE_VL-None_G-NONE_P-NONE_S-NONE,3669 - CB - Notion - #63 HOLYGRAIL OF... || Enhancements: OFF || CBV1 || Batch 1 || 1C || 14/01/25w03 || Kostas,SHARE,$13,380,2025-01-14,2025-01-16,2
302,CB_2025_Jan_FB_3669_SO-JT_V06_4x5_IMG_EN_New_C-NONE_Evergreen_CTA-NONE_Angle-W_M-NONE_VL-None_G-NONE_P-NONE_S-NONE,3669 - CB - Notion - #63 HOLYGRAIL OF... || Enhancements: OFF || CBV1 || Batch 1 || 1C || 14/01/25w03 || Kostas,SHARE,$13,342,2025-01-14,2025-01-17,3
303,CB_2024_Mar_FB_2853_DT-RP_V02_9x16_IMG_EN_New_C-NONE_CTA-CTA_None_M-NONE_VL-None_TR-None_G-NONE_P-V2_S-NONE.png,UK || ASC+ || CBV2 || 7DC || Existing 10% || 13.11.2024 Ad set,SHARE,$12,637,2024-11-13,2025-01-16,64
304,CB_2024_Dec_FB_3666_VK-JT_V03_4x5_VID_EN_Opti_C-BulletPoints_Sale_CTA-NY_Angle-W-B-C_M-TRC_VL-30s_G-F_P-OG_S-NEW,ASC+ || VIDEO Only || US || 0% EXISTING CAP || 1C || 08.12.24  Ad set,VIDEO,$12,560,2025-01-11,2025-02-05,25
305,CB_2025_Jan_FB_3671_LZ-VU_V04_4x5_IMG_EN_New_C-Headline_Evergreen_CTA-NONE_Angle-W_M-NONE_VL-None_G-NONE_P-NONE_S-NONE_FB3306V04,AU || 3671 - anti inflammatory diet opti || 1C || 10/01/2025w02,SHARE,$11,412,2025-01-10,2025-01-13,3
306,CB_2025_Jan_FB_3669_SO-JT_V04_4x5_IMG_EN_New_C-NONE_Evergreen_CTA-NONE_Angle-W_M-NONE_VL-None_G-NONE_P-NONE_S-NONE,3669 - CB - Notion - #63 HOLYGRAIL OF... || Enhancements: OFF || CBV1 || Batch 1 || 1C || 14/01/25w03 || Kostas,SHARE,$10,404,2025-01-14,2025-01-17,3
307,CB_2025_Jan_FB_3665_SO-DP_V03_4x5_IMG_EN_New_C-NONE_Evergreen_CTA-SALE_Angle-W_M-NONE_VL-None_G-NONE_P-NONE_S-NONE,3665 - Notion idea #72 || Enhancements: OFF || CBV1 || Batch 1 || 1C || 13/01/25w03 || Kostas,SHARE,$10,665,2025-01-14,2025-01-22,8
308,CB_2024_Nov_FB_3264_LZ_V31_4x5_VID_EN_Opti_C-MakingOf_Sale_CTA-BF_Angle-W-B_M-CRAZY_VL-45s_G-M_P-OG_S-NEW_FB3004V02 -,Pricing Test || EU (UK) || 1C || Higher Price || 07/01/25,VIDEO,$10,385,2025-01-07,2025-01-15,8
309,CB_2023_May_FB_2263_MB_V04_9x16_VID_EN_New_C-Sale_CTA-SMR_Pain-W_M-JOG_VL-45s_TR-None_G-M-F_P-None_S-Moon,CBV2 || Advantage+ || Only V1 Ads || US || 5% EXISTING CAP || BROAD || 7C || 30/12/24  Campaign Ad set,VIDEO,$10,359,2024-12-30,2025-01-22,23
310,CB_2024_Nov_FB_3342_DT-DP_V05_4x5_VID_EN_Opti_C-Testimomial_Sale_CTA-CYBER_Angle-W_M-CLARA_VL-45s_G-F_P-OG_S-MOON_FB2865V05,ðŸŒ¶ï¸ || US || ASC+ || ->CC141 || VIDEO Only || US+CA || 0% EXISTING CAP || 7C || 07/08.24  Ad set,VIDEO,$10,334,2024-12-09,2025-01-24,46
311,CB_2024_Dec_FB_3623_CHUB_V02_1x1_IMG_EN_New_C-NONE_CTA-NONE_Angle-W_M-NONE_VL-None_TR-None_G-NONE_P-NONE_S-NONE,3623 Creative Hub - Organic facebook comments || Enhancements: OFF || CBV1 || Batch 1 || 1C || 14/01/25w03 || Kostas,SHARE,$9,546,2025-01-14,2025-01-19,5
312,CB_2024_Dec_FB_3630_LZ-DP_V08_4x5_IMG_EN_New_C-NONE_Evergreen_CTA-NONE_Angle-Energy_M-NONE_VL-None_G-NONE_P-NONE_S-NONE,3630 - Notion #70 apple notes || Enhancements: OFF || CBV1 || Batch 2 || 1C || 13/01/25w03 || Kostas,SHARE,$9,571,2025-01-13,2025-01-16,3
313,CB_2023_May_FB_2103_MB_V02_9x16_VID_EN_Opti_C-Sale_CTA-SMR_Pain-W_M-JOG_VL-30s_TR-None_G-M-F_P-None_S-What,US || Manual Bid || BFCM || COST CAP 91 || 1C || 15/11/24,VIDEO,$9,275,2024-11-15,2025-02-27,104
314,CB_2025_Jan_FB_3639_DT-DP_V03_1x1_IMG_EN_New_C-NONE_CTA-NONE_Angle-W_M-NONE_VL-None_TR-None_G-NONE_P-NONE_S-NONE_FB3639V03,3688 - Opti 3639 || Enhancements: OFF || CBV1 || Batch 1 || 1C || 19/01/25w04 || Kostas,SHARE,$9,387,2025-01-19,2025-01-23,4
315,CB_2024_Mar_FB_2888_JG_V01_9x16_IMG_EN_Opti_C-Benefits_CTA-NONE_Pain-W_M-NONE_VL-None_TR-None_G-NONE_P-V2_S-NONE,CBV2 || EU (UK) || ðŸ’° Advantage+ || US || BROAD || 7C || Existing_customer_5% || 15/12/24 Ad set,SHARE,$9,320,2024-12-15,2025-01-31,47
316,CB_2023_Dec_FB_2694_DT-DP_V17_1x1_GIF_EN_New_C-NONE_CTA-NY65_None_M-NONE_VL-15s_TR-None_G-NONE_P-OG_S-NONE,ðŸ’°WC || US || Advantage+ || BIG BUDGET || CC101->105->109->112->114-116->117 || BROAD || ABO || 1C || 17/01/24 RELAUNCHED Ad set,VIDEO,$9,232,2024-01-18,2025-02-06,385
317,CB_2024_Oct_FB_3251_LZ-VU_V01_1x1_IMG_EN_New_C-NegativeMark_Evergreen_CTA-NONE_Angle-Cort_M-NONE_VL-None_G-NONE_P-NONE_S-NONE.png,US || Manual Bid || BFCM || COST CAP 91 || 1C || 15/11/24,SHARE,$8,339,2024-11-15,2025-02-27,104
318,CB_2024_Dec_FB_3630_LZ-DP_V06_4x5_IMG_EN_New_C-NONE_Evergreen_CTA-NONE_Angle-CR_M-NONE_VL-None_G-NONE_P-NONE_S-NONE,3630 - Notion #70 apple notes || Enhancements: OFF || CBV1 || Batch 2 || 1C || 13/01/25w03 || Kostas,SHARE,$8,401,2025-01-13,2025-01-16,3
319,IM_CB5.png,US || VSL || Aff's image || Landing: QUIZ || 1C || 16/01/25,SHARE,$8,170,2025-01-16,2025-01-17,1
320,CB_2024_Oct_FB_3251_LZ-VU_V01_1x1_IMG_EN_New_C-NegativeMark_Evergreen_CTA-NONE_Angle-Cort_M-NONE_VL-None_G-NONE_P-NONE_S-NONE.png,View Content || BROAD || 7C || 17/12/24,SHARE,$8,997,2024-12-17,2025-01-20,34
321,CB_2025_Jan_FB_3683_SO_V05_4x5_IMG_EN_New_C-Headline_Evergreen_CTA-NONE_Angle-B_M-NONE_VL-None_G-NONE_P-NONE_S-NONE,3683 - Notion Idea #91 Belly Drums || Enhancements: OFF || CBV1 || Batch 1 || 1C || 19/01/25w04 || Kostas,SHARE,$8,324,2025-01-19,2025-01-23,4
322,CB_2022_Mar3_FB_713_IK_V04_1x1_IMG_EN_Opti_C-WrittenTesti_HE-98_A-ExtremeBodyVisualization_HK-bodypart_Pain-W_CLR-PURPLE_BG-IMAGE_ME-MIX_MA-YOUNG,View Content || BROAD || 7C || 17/12/24,SHARE,$7,"1,028",2024-12-17,2025-01-20,34
323,CB_2025_Jan_FB_3684_CHUB_V08_4x5_IMG_EN_New_C-NONE_CTA-NONE_Angle-B_M-NONE_VL-30s_TR-None_G-M_P-NONE_S-NONE,3684 Stop scrolling belly CHUB  || Enhancements: OFF || CBV1 || Batch 1 || 1C || 19/01/25w04 || Kostas,SHARE,$7,338,2025-01-19,2025-01-23,4
324,CB_2025_Jan_FB_3684_CHUB_V02_4x5_IMG_EN_New_C-NONE_CTA-NONE_Angle-B_M-NONE_VL-30s_TR-None_G-M_P-NONE_S-NONE,3684 Stop scrolling belly CHUB  || Enhancements: OFF || CBV1 || Batch 1 || 1C || 19/01/25w04 || Kostas,SHARE,$7,248,2025-01-19,2025-01-23,4
325,CB_2024_Dec_FB_3630_LZ-DP_V05_4x5_IMG_EN_New_C-NONE_Evergreen_CTA-NONE_Angle-B_M-NONE_VL-None_G-NONE_P-NONE_S-NONE,3630 - Notion #70 apple notes || Enhancements: OFF || CBV1 || Batch 2 || 1C || 13/01/25w03 || Kostas,SHARE,$7,509,2025-01-13,2025-01-16,3
326,CB_2023_Jul_FB_2226_MB_V04_9x16_VID_EN_Opti_C-Testim_CTA-SMR_Pain-W_M-MIX_VL-30s_TR-None_G-F_P-None_S-Starry,US || Manual Bid || BFCM || COST CAP 91 || 1C || 15/11/24,VIDEO,$7,197,2024-11-15,2025-02-27,104
327,CB_2025_Jan_FB_3684_CHUB_V07_4x5_IMG_EN_New_C-NONE_CTA-NONE_Angle-B_M-NONE_VL-30s_TR-None_G-M_P-NONE_S-NONE,3684 Stop scrolling belly CHUB  || Enhancements: OFF || CBV1 || Batch 1 || 1C || 19/01/25w04 || Kostas,SHARE,$6,365,2025-01-19,2025-01-23,4
328,CB_2024_Dec_FB_3608_LZ-DP_V01_4x5_IMG_EN_New_C-Headline_Evergreen_CTA-NONE_Angle-W_M-NONE_VL-None_G-NONE_P-OG_S-NONE,3608 - CB_IMG_ notion #17 hypnosis || Enhancements: OFF || CBV1 || Batch 1 || 1C || 13/01/25w03 || Kostas,SHARE,$6,331,2025-01-13,2025-02-03,21
329,CB_2025_Jan_FB_3661_CHUB_V01_1x1_IMG_EN_New_C-NONE_CTA-NONE_Angle-C_M-NONE_VL-None_TR-None_G-NONE_P-OG_S-NONE,3661 - Pop your methane balloon ITR. || Enhancements: OFF || CBV1 || Batch 1 || 1C || 14/01/25w03 || Kostas,SHARE,$6,863,2025-01-14,2025-01-24,10
330,CB_2023_May_FB_2144_MB_V02_9x16_VID_EN_Opti_C-Sale_CTA-SMR_Pain-W_M-JOG_VL-30s_TR-None_G-M-F_P-None_S-What,CA || COST CAP 91 || 7C || 03/42/24 || V1,VIDEO,$5,310,2024-05-03,2025-01-13,255
331,IM_CB3.png,US || VSL || Aff's image || Landing: Pre-1(New lead) -> Old lead || 1C || 10/01/25,SHARE,$5,280,2025-01-10,2025-01-16,6
332,CB_2024_Nov_FB_3305_SO-DP_V02_4x5_VID_EN_Opti_C-Sale_CTA-BF_Pain-W_M-Chris_VL-30s_TR-None_G-MF_P-Plan_S-NEW_FB2601V07,CBV2 || EU (UK) || ðŸ’° Advantage+ || US || BROAD || 7C || Existing_customer_5% || 15/12/24 Ad set,SHARE,$5,173,2024-12-19,2025-01-31,43
333,Taboola - ColonB - 17.jpg,US || VSL || Aff's image || Batch 2 (mostly Taboola ads) || Landing: pre-1 || 1C || 19/01/25,SHARE,$5,201,2025-01-19,2025-01-28,9
334,IM_CB4.png,US || VSL || Aff's image || Landing: Pre-1(New lead) -> Old lead || 1C || 10/01/25,SHARE,$4,219,2025-01-10,2025-01-16,6
335,CB_2025_Jan_FB_3683_SO_V01_4x5_IMG_EN_New_C-Headline_Evergreen_CTA-NONE_Angle-B_M-NONE_VL-None_G-NONE_P-NONE_S-NONE,3683 - Notion Idea #91 Belly Drums || Enhancements: OFF || CBV1 || Batch 1 || 1C || 19/01/25w04 || Kostas,SHARE,$4,234,2025-01-19,2025-01-23,4
336,CB_2024_Sep_FB_3175_DA-KB_V02_1x1_IMG_EN_New_C-ADVRT_Evergreen_CTA-NONE_Angle-W_M-NONE_VL-None_G-NONE_P-CBV2_S-NONE_blog_colonbroomvsmammoth_cv_en,CBV2 || A/B Pricing: Standard || 3175 - CB vs Happy Mammoth advertorial || BROAD || 1C ||  22/11/24 || Kostas,SHARE,$4,162,2024-12-22,2025-01-13,22
337,CB_2024_Dec_FB_3666_VK-JT_V02_4x5_VID_EN_Opti_C-BulletPoints_Sale_CTA-NY_Angle-W-B-C_M-TRC_VL-30s_G-F_P-OG_S-FRIGGA,3666 - looksmaxing trend || Enhancements: OFF || CBV1 || Batch 1 || 1C || 07/01/25w02 || Kostas,SHARE,$4,159,2025-01-07,2025-01-30,23
338,CB_2024_Dec_FB_3623_CHUB_V03_1x1_IMG_EN_New_C-NONE_CTA-NONE_Angle-W_M-NONE_VL-None_TR-None_G-NONE_P-NONE_S-NONE,3623 Creative Hub - Organic facebook comments || Enhancements: OFF || CBV1 || Batch 1 || 1C || 14/01/25w03 || Kostas,SHARE,$4,182,2025-01-14,2025-01-19,5
339,CB_2025_Jan_FB_3684_CHUB_V06_4x5_IMG_EN_New_C-NONE_CTA-NONE_Angle-B_M-NONE_VL-30s_TR-None_G-M_P-NONE_S-NONE,3684 Stop scrolling belly CHUB  || Enhancements: OFF || CBV1 || Batch 1 || 1C || 19/01/25w04 || Kostas,SHARE,$4,146,2025-01-19,2025-01-23,4
340,CB_2025_Jan_FB_3662_CHUB_V04_1x1_IMG_EN_New_C-NONE_CTA-NONE_Angle-C_M-NONE_VL-None_TR-None_G-NONE_P-NONE_S-NONE.jpg,3662 - Hipno event ITR CHUB || Enhancements: OFF || CBV1 || Batch 1 || 1C || 10/01/25w02 || Valentinas,SHARE,$4,136,2025-01-10,2025-01-15,5
341,CB_2024_Jan_FB_2762_IK_V04_1x1_IMG_EN_New_C-WrittenTesti_CTA-CTA_Pain-W-B-C_M-NONE_VL-None_TR-None_G-NONE_P-V2_S-NONE,CBV2 || AU || ðŸ’° Advantage+ || US || BROAD || 7C || Existing_customer_5% || 19/12/24 Ad set,SHARE,$3,106,2024-12-19,2025-03-27,98
342,CB_2025_Jan_FB_3665_SO-DP_V04_4x5_IMG_EN_New_C-NONE_Evergreen_CTA-SALE_Angle-W_M-NONE_VL-None_G-NONE_P-NONE_S-NONE,3665 - Notion idea #72 || Enhancements: OFF || CBV1 || Batch 1 || 1C || 13/01/25w03 || Kostas,SHARE,$3,202,2025-01-14,2025-01-20,6
343,CB_2025_Jan_FB_3660_CHUB_V04_4x5_IMG_EN_New_C-NONE_CTA-NONE_Angle-C_M-NONE_VL-None_TR-None_G-NONE_P-NONE_S-NONE,3660 - G-nuggets winner ITR || Enhancements: OFF || CBV1 || Batch 1 || 1C || 14/01/25w03 || Kostas,SHARE,$3,208,2025-01-14,2025-01-27,13
344,CB_2025_Jan_FB_3680_CHUB_V06_4x5_IMG_EN_New_C-NONE_CTA-NONE_Angle-C_M-NONE_VL-None_TR-None_G-NONE_P-NONE_S-NONE,3680 - Looking for 15 people _ Trashy ITR CHUB || Enhancements: OFF || CBV1 || Batch 2 || 1C || 10/01/25w02 || Kostas,SHARE,$3,152,2025-01-10,2025-01-13,3
345,CB_2025_Jan_FB_3684_CHUB_V05_4x5_IMG_EN_New_C-NONE_CTA-NONE_Angle-B_M-NONE_VL-30s_TR-None_G-M_P-NONE_S-NONE,3684 Stop scrolling belly CHUB  || Enhancements: OFF || CBV1 || Batch 1 || 1C || 19/01/25w04 || Kostas,SHARE,$3,86,2025-01-19,2025-01-23,4
346,CB_2023_Jul_FB_2217_IB_V04_9x16_VID_EN_Opti_C-Pointing_CTA-SMR_Pain-W-B_M-TRC_VL-30s_TR-None_G-F_P-None_S-FRIGGA,US || Manual Bid || BFCM || COST CAP 81 || 1C || 15/11/24,VIDEO,$2,17,2024-11-15,2025-03-16,121
347,CB_2024_Dec_FB_3666_VK-JT_V04_4x5_VID_EN_Opti_C-BulletPoints_Sale_CTA-NY_Angle-W-B-C_M-TRC_VL-30s_G-F_P-OG_S-NEW,3666 - looksmaxing trend || Enhancements: OFF || CBV1 || Batch 1 || 1C || 07/01/25w02 || Kostas,SHARE,$2,103,2025-01-07,2025-01-30,23
348,CB_2024_Jan_FB_2762_IK_V04_1x1_IMG_EN_New_C-WrittenTesti_CTA-CTA_Pain-W-B-C_M-NONE_VL-None_TR-None_G-NONE_P-V2_S-NONE,CBV2 || EU (UK) || ðŸ’° Advantage+ || US || BROAD || 7C || Existing_customer_5% || 15/12/24 Ad set,SHARE,$2,83,2024-12-15,2025-01-31,47
349,CB_2025_Jan_FB_3671_LZ-VU_V02_4x5_IMG_EN_New_C-Headline_Evergreen_CTA-NONE_Angle-W_M-NONE_VL-None_G-NONE_P-NONE_S-NONE_FB3306V02,CBV2 || EU (UK) || ðŸ’° Advantage+ || US || BROAD || 7C || Existing_customer_5% || 15/12/24 Ad set,SHARE,$2,65,2025-01-09,2025-01-31,22
350,Taboola - ColonB - 22.jpg,US || VSL || Aff's image || Batch 2 (mostly Taboola ads) || Landing: pre-1 || 1C || 19/01/25,SHARE,$2,61,2025-01-19,2025-01-28,9
351,CB_2025_Jan_FB_3671_LZ-VU_V03_4x5_IMG_EN_New_C-Headline_Evergreen_CTA-NONE_Angle-W_M-NONE_VL-None_G-NONE_P-NONE_S-NONE_FB3306V03,AU || 3671 - anti inflammatory diet opti || 1C || 10/01/2025w02,SHARE,$2,91,2025-01-10,2025-01-13,3
352,CB_2023_Dec_FB_2696_RS_V02_9x16_VID_EN_Opti_C-Sale_CTA-XMAS65_Pain-W-B_M-JANW_VL-30s_TR-None_G-MF_P-OG_S-WHAT_FB2284V05,ðŸ’°WC || US || Advantage+ || BIG BUDGET || CC101->105->109->112->114-116->117 || BROAD || ABO || 1C || 17/01/24 RELAUNCHED Ad set,VIDEO,$1,75,2024-01-17,2025-02-06,386
353,CB_2025_Jan_FB_3683_SO_V11_4x5_IMG_EN_New_C-Headline_Evergreen_CTA-NONE_Angle-B_M-NONE_VL-None_G-NONE_P-NONE_S-NONE,3683 - Notion Idea #91 Belly Drums || Enhancements: OFF || CBV1 || Batch 2 || 1C || 19/01/25w04 || Kostas,SHARE,$1,76,2025-01-19,2025-01-24,5
354,CB_2023_Jul_FB_2217_IB_V04_9x16_VID_EN_Opti_C-Pointing_CTA-SMR_Pain-W-B_M-TRC_VL-30s_TR-None_G-F_P-None_S-FRIGGA,US || Manual Bid || BID CAP 111 || 1C || 21/12/24,VIDEO,$1,15,2024-12-22,2025-03-24,92
355,CB_2023_Nov_FB_2664_MB_V08_9x16_VID_EN_Opti_C-Testim_CTA-XMAS65_Pain-W_M-MIX_VL-30s_TR-None_G-F_P-None_S-Starry,ðŸ’°WC || US || Advantage+ || BIG BUDGET || CC101->105->109->112->114-116->117 || BROAD || ABO || 1C || 17/01/24 RELAUNCHED Ad set,VIDEO,$1,59,2024-01-17,2025-02-04,384
356,IM_CB5.png,US || VSL || Aff's image || Landing: Pre-1(New lead) -> Old lead || 1C || 10/01/25,SHARE,$1,68,2025-01-10,2025-01-16,6
357,CB_2024_Jan_FB_2717_MB-RP_V26_9x16_VID_EN_New_C-Buzz_CTA-SALE_Pain-W-B-C_M-MIX_VL-45s_TR-None_G-MF_P-Method_S-NONE,CA || COST CAP 91 || 7C || 03/42/24 || V1,VIDEO,$1,67,2024-05-10,2025-01-13,248
358,CB_2025_Jan_FB_3686_LZ-KB_V08_4x5_IMG_EN_New_C-Headline_Evergreen_CTA-NONE_Angle-ADVTR_M-NONE_VL-None_G-NONE_P-NONE_S-NONE_FB3582V11,CBV2 || LP:HI 3686 - advertorial 3582v11 opti - secret behind the label advertorial ads || Batch 5 || BROAD || 1C ||  10/01/25 || Kostas,SHARE,$1,72,2025-01-10,2025-01-13,3
359,CB_2023_Nov_FB_2675_DT_V01_9x16_VID_EN_Opti_C-Pointing_CTA-XMAS65_Pain-W_M-SEAN_VL-30s_TR-None_G-M_P-NONE_S-YARIN_FB2396V02,ðŸ’°WC || US || Advantage+ || BIG BUDGET || CC101->105->109->112->114-116->117 || BROAD || ABO || 1C || 17/01/24 RELAUNCHED Ad set,VIDEO,$1,43,2024-01-17,2025-02-06,386
360,IM_CB3.png,US || VSL || Aff's image || Landing: QUIZ || 1C || 16/01/25,SHARE,$1,11,2025-01-16,2025-01-17,1
361,CB_2025_Jan_FB_3686_LZ-KB_V06_4x5_IMG_EN_New_C-Headline_Evergreen_CTA-NONE_Angle-ADVTR_M-NONE_VL-None_G-NONE_P-NONE_S-NONE_FB3582V11,CBV2 || LP:HI 3686 - advertorial 3582v11 opti - secret behind the label advertorial ads || Batch 5 || BROAD || 1C ||  10/01/25 || Kostas,SHARE,$1,102,2025-01-10,2025-01-13,3
362,CB_2025_Jan_FB_3686_LZ-KB_V07_4x5_IMG_EN_New_C-Headline_Evergreen_CTA-NONE_Angle-ADVTR_M-NONE_VL-None_G-NONE_P-NONE_S-NONE_FB3582V11,CBV2 || LP:HI 3686 - advertorial 3582v11 opti - secret behind the label advertorial ads || Batch 5 || BROAD || 1C ||  10/01/25 || Kostas,SHARE,$1,66,2025-01-10,2025-01-13,3
363,CB_2024_Oct_FB_3251_LZ-VU_V01_1x1_IMG_EN_New_C-NegativeMark_Evergreen_CTA-NONE_Angle-Cort_M-NONE_VL-None_G-NONE_P-NONE_S-NONE.png,US || Manual Bid || BFCM || COST CAP 81 || 1C || 15/11/24,SHARE,$1,38,2024-11-15,2025-03-17,122
364,CB_2023_Dec_FB_2706_RS_V09_9x16_VID_EN_Opti_C-Sale_CTA-NY56_Pain-W_M-JOG_VL-30s_TR-None_G-F_P-OG_S-WHAT_FB1404V02,ðŸ’°WC || US || Advantage+ || BIG BUDGET || CC101->105->109->112->114-116->117 || BROAD || ABO || 1C || 17/01/24 RELAUNCHED Ad set,VIDEO,$0,35,2024-01-17,2025-02-05,385
365,CB_2023_Dec_FB_2721_DA-RP_V01_9x16_VID_EN_Opti_C-Sale_CTA-65_Pain-W-B_M-HIL_VL-45s_TR-None_G-F_P-Plan_S-NEW_FB2558V02 - Copy,ðŸ’°WC || US || Advantage+ || BIG BUDGET || CC101->105->109->112->114-116->117 || BROAD || ABO || 1C || 17/01/24 RELAUNCHED Ad set,VIDEO,$0,21,2024-01-21,2025-02-04,380
366,CB_2025_Jan_FB_3671_LZ-VU_V04_4x5_IMG_EN_New_C-Headline_Evergreen_CTA-NONE_Angle-W_M-NONE_VL-None_G-NONE_P-NONE_S-NONE_FB3306V04,AU || 3rd party page || 3671 - anti inflammatory diet opti || 1C || 10/01/2025w02,SHARE,$0,23,2025-01-10,2025-01-13,3
367,CB_2025_Jan_FB_3684_CHUB_V01_4x5_IMG_EN_New_C-NONE_CTA-NONE_Angle-B_M-NONE_VL-30s_TR-None_G-M_P-NONE_S-NONE,3684 Stop scrolling belly CHUB  || Enhancements: OFF || CBV1 || Batch 1 || 1C || 19/01/25w04 || Kostas,SHARE,$0,27,2025-01-19,2025-01-23,4
368,CB_2022_Mar3_FB_713_IK_V04_1x1_IMG_EN_Opti_C-WrittenTesti_HE-98_A-ExtremeBodyVisualization_HK-bodypart_Pain-W_CLR-PURPLE_BG-IMAGE_ME-MIX_MA-YOUNG,US || Manual Bid || BFCM || COST CAP 81 || 1C || 15/11/24,SHARE,$0,27,2024-11-15,2025-03-26,131
369,CB_2024_Dec_FB_3622_LZ-KB_V03_4x5_IMG_EN_Opti_C-NONE_Sale_CTA-XMAS_Angle-GH_M-NONE_VL-None_G-NONE_P-OG_S-NONE_FB2227V08 - Copy,US || Manual Bid || BID CAP 105 || 1C || 21/12/24,SHARE,$0,10,2024-12-22,2025-03-11,79
370,CB_2025_Jan_FB_3656_JT_V01_4x5_IMG_EN_New_C-Headline_Seasonal_CTA-70_Angle-W_M-NONE_VL-None_G-NONE_P-OG_S-NONE,3656 - we_re leaving || Enhancements: OFF || CBV1 || Batch 1 || 1C || 07/01/25w02 || Kostas,SHARE,$0,38,2025-01-07,2025-01-16,9
371,Taboola - ColonB - 7.png,US || VSL || Aff's image || Batch 2 (mostly Taboola ads) || Landing: pre-1 || 1C || 19/01/25,SHARE,$0,8,2025-01-19,2025-01-28,9
372,CB_2025_Jan_FB_3683_SO_V02_4x5_IMG_EN_New_C-Headline_Evergreen_CTA-NONE_Angle-B_M-NONE_VL-None_G-NONE_P-NONE_S-NONE,3683 - Notion Idea #91 Belly Drums || Enhancements: OFF || CBV1 || Batch 1 || 1C || 19/01/25w04 || Kostas,SHARE,$0,10,2025-01-19,2025-01-23,4
373,CB_2025_Jan_FB_3686_LZ-KB_V01_4x5_IMG_EN_New_C-Headline_Evergreen_CTA-NONE_Angle-ADVTR_M-NONE_VL-None_G-NONE_P-NONE_S-NONE_FB3582V11,CBV2 || LP:HI 3686 - advertorial 3582v11 opti - secret behind the label advertorial ads || Batch 4 || BROAD || 1C ||  10/01/25 || Kostas,SHARE,$0,14,2025-01-10,2025-01-13,3
374,CB_2025_Jan_FB_3686_LZ-KB_V02_4x5_IMG_EN_New_C-Headline_Evergreen_CTA-NONE_Angle-ADVTR_M-NONE_VL-None_G-NONE_P-NONE_S-NONE_FB3582V11,CBV2 || LP:HI 3686 - advertorial 3582v11 opti - secret behind the label advertorial ads || Batch 4 || BROAD || 1C ||  10/01/25 || Kostas,SHARE,$0,9,2025-01-10,2025-01-13,3
375,CB_2022_Nov_FB_1218_RS_V15_9x16_IMG_EN_Opti_C-Sale_CTA-BLACK_Pain-W_M-NONE_VL-None FB1671V08,US || Manual Bid || BFCM || COST CAP 91 || 1C || 15/11/24,SHARE,$0,11,2024-11-15,2025-02-27,104
376,CB_2024_Dec_FB_3622_LZ-KB_V03_4x5_IMG_EN_Opti_C-NONE_Sale_CTA-XMAS_Angle-GH_M-NONE_VL-None_G-NONE_P-OG_S-NONE_FB2227V08 - Copy,US || Manual Bid || BID CAP 111 || 1C || 21/12/24,SHARE,$0,3,2024-12-22,2025-03-26,94
377,CB_2024_Dec_FB_3639_CHUB_V03_1x1_IMG_EN_New_C-NONE_CTA-NONE_Angle-W_M-NONE_VL-None_TR-None_G-NONE_P-NONE_S-NONE,View Content || BROAD || 7C || 17/12/24,SHARE,$0,17,2025-01-09,2025-01-20,11
378,CB_2023_Jul_FB_2226_MB_V04_9x16_VID_EN_Opti_C-Testim_CTA-SMR_Pain-W_M-MIX_VL-30s_TR-None_G-F_P-None_S-Starry,US || Manual Bid || BID CAP 105 || 1C || 21/12/24,VIDEO,$0,2,2024-12-29,2025-01-17,19
379,CB_2023_Jul_FB_2217_IB_V04_9x16_VID_EN_Opti_C-Pointing_CTA-SMR_Pain-W-B_M-TRC_VL-30s_TR-None_G-F_P-None_S-FRIGGA,US || Manual Bid || BID CAP 105 || 1C || 21/12/24,VIDEO,$0,3,2024-12-22,2025-03-27,95
380,CB_2025_Jan_FB_3683_SO_V04_4x5_IMG_EN_New_C-Headline_Evergreen_CTA-NONE_Angle-B_M-NONE_VL-None_G-NONE_P-NONE_S-NONE,3683 - Notion Idea #91 Belly Drums || Enhancements: OFF || CBV1 || Batch 1 || 1C || 19/01/25w04 || Kostas,SHARE,$0,3,2025-01-19,2025-01-22,3
381,CB_2023_Jul_FB_2226_MB_V04_9x16_VID_EN_Opti_C-Testim_CTA-SMR_Pain-W_M-MIX_VL-30s_TR-None_G-F_P-None_S-Starry,US || Manual Bid || BID CAP 111 || 1C || 21/12/24,VIDEO,$0,2,2024-12-27,2025-03-11,74
382,CB_2023_May_FB_2103_MB_V02_9x16_VID_EN_Opti_C-Sale_CTA-SMR_Pain-W_M-JOG_VL-30s_TR-None_G-M-F_P-None_S-What,US || Manual Bid || BID CAP 105 || 1C || 21/12/24,VIDEO,$0,1,2024-12-28,2025-01-19,22
