,Ad Name,Adset Name,Creative Type,Spend In USD,Impressions,First Ad Spend Date,Last Ad Spend Date,Days ad spending
1,CB_2024_Dec_FB_CANVA_LZ-VU_V01_1x1_IMG_EN_New_C-NegativeMark_Evergreen_CTA-NONE_Angle-Cort_M-NONE_VL-None_G-NONE_P-NONE_S-NONE.png PAUSED,ðŸŒ¶ï¸ || US || ASC+ || ->CC141 || VIDEO Only || US+CA || 0% EXISTING CAP || 7C || 07/08.24  Ad set,SHARE,"$30,220","1,365,383",2024-12-30,2025-01-17,18
2,CB_2024_Aug_FB_3090_DT-DP_V02_9x16_VID_EN_Opti_C-MakingOf_CTA-CTA_Pain-W-B-C_M-POW_VL-45s_TR-None_G-M_P-OG_S-Moon_FB3029V04,ðŸŒ¶ï¸ || US || ASC+ || ->CC141 || VIDEO Only || US+CA || 0% EXISTING CAP || 7C || 07/08.24  Ad set,VIDEO,"$27,496","1,381,282",2024-08-23,2025-01-15,145
3,CB_2024_Dec_FB_3622_LZ-DP_V03_4x5_IMG_EN_Opti_C-NONE_Sale_CTA-XMAS_Angle-GH_M-NONE_VL-None_G-NONE_P-OG_S-NONE_FB2227V08,ðŸŒ¶ï¸ || US || ASC+ || ->CC141 || VIDEO Only || US+CA || 0% EXISTING CAP || 7C || 07/08.24  Ad set,SHARE,"$14,256","479,532",2024-12-19,2025-01-27,39
4,CB_2023_Jul_FB_2217_IB_V04_9x16_VID_EN_Opti_C-Pointing_CTA-SMR_Pain-W-B_M-TRC_VL-30s_TR-None_G-F_P-None_S-FRIGGA,ASC+ || VIDEO Only || US || 0% EXISTING CAP || 1C || 08.12.24  Ad set,VIDEO,"$13,895","480,186",2024-12-08,2025-02-05,59
5,Dynamic_Creative_CA_Flow,WC || CA || DYNAMIC CREATIVE || ADV+ audience || 7C || 17.04.2024 || BIG BUDGET,SHARE,"$10,428","753,592",2024-04-17,2025-02-27,316
6,CB_2024_Dec_FB_3639_CHUB_V03_1x1_IMG_EN_New_C-NONE_CTA-NONE_Angle-W_M-NONE_VL-None_TR-None_G-NONE_P-NONE_S-NONE,ðŸŒ¶ï¸ || US || ASC+ || ->CC141 || VIDEO Only || US+CA || 0% EXISTING CAP || 7C || 07/08.24  Ad set,SHARE,"$10,034","438,456",2025-01-06,2025-01-27,21
7,CB_2023_May_FB_1999_LV_V01_9x16_VID_EN_New_C-Pointing_CTA-DISCOUNT_Pain-W_M-JOG_VL-30s_TR-None,ASC+ || VIDEO Only || US || 0% EXISTING CAP || 1C || 08.12.24  Ad set,VIDEO,"$10,019","340,360",2024-12-08,2025-01-27,50
8,CB_2023_Jul_FB_2217_IB_V04_9x16_VID_EN_Opti_C-Pointing_CTA-SMR_Pain-W-B_M-TRC_VL-30s_TR-None_G-F_P-None_S-FRIGGA,ðŸŒ¶ï¸ || US || ASC+ || ->CC141 || VIDEO Only || US+CA || 0% EXISTING CAP || 7C || 07/08.24  Ad set,VIDEO,"$6,939","256,075",2024-08-07,2025-03-27,232
9,CB_2023_May_FB_2263_MB_V04_9x16_VID_EN_New_C-Sale_CTA-SMR_Pain-W_M-JOG_VL-45s_TR-None_G-M-F_P-None_S-Moon,ðŸŒ¶ï¸ || US || ASC+ || ->CC141 || VIDEO Only || US+CA || 0% EXISTING CAP || 7C || 07/08.24  Ad set,VIDEO,"$6,426","166,007",2024-08-07,2025-03-27,232
10,CB_2023_Oct_FB_2516_VK_V13_9x16_VID_EN_Opti_C-Benefits_CTA-AUTUM_Pain-W-B_M-PASQ_VL-30s_TR-None_G-M_P-Plan_S-WHAT,ðŸŒ¶ï¸ || US || ASC+ || ->CC141 || VIDEO Only || US+CA || 0% EXISTING CAP || 7C || 07/08.24  Ad set,VIDEO,"$5,884","214,435",2024-12-19,2025-03-27,98
11,CB_2024_Feb_FB_2812_MB-RP_V07_9x16_VID_EN_Opti_C-Sale_CTA-C65_Pain-W_M-NONE_VL-30s_TR-None_G-MF_P-Plan_S-NEW_FB2601V04_1,ASC+ || VIDEO Only || US || 0% EXISTING CAP || 1C || 08.12.24  Ad set,VIDEO,"$5,482","245,190",2024-12-19,2025-02-05,48
12,CB_2023_Jul_FB_2226_MB_V04_9x16_VID_EN_Opti_C-Testim_CTA-SMR_Pain-W_M-MIX_VL-30s_TR-None_G-F_P-None_S-Starry,ðŸŒ¶ï¸ || US || ASC+ || ->CC141 || VIDEO Only || US+CA || 0% EXISTING CAP || 7C || 07/08.24  Ad set,VIDEO,"$5,426","159,887",2024-10-28,2025-03-27,150
13,CB_2024_Aug_FB_3090_DT-DP_V02_9x16_VID_EN_Opti_C-MakingOf_CTA-CTA_Pain-W-B-C_M-POW_VL-45s_TR-None_G-M_P-OG_S-Moon_FB3029V04,CBV2 || Advantage+ || Only V1 Ads || US || 5% EXISTING CAP || BROAD || 7C || 30/12/24  Campaign Ad set,SHARE,"$5,109","297,710",2024-12-30,2025-01-22,23
14,CB_2023_Jul_FB_2252_IB_V06_9x16_VID_EN_Opti_C-Dance_CTA-SMR_Pain-W-B_M-JOG_VL-30s_TR-None_G-F_P-None_S-OLLIE_FB1999V01,ðŸŒ¶ï¸ || US || ASC+ || ->CC141 || VIDEO Only || US+CA || 0% EXISTING CAP || 7C || 07/08.24  Ad set,VIDEO,"$5,008","275,631",2024-08-07,2025-01-07,153
15,CB_2023_May_FB_2263_MB_V04_9x16_VID_EN_New_C-Sale_CTA-SMR_Pain-W_M-JOG_VL-45s_TR-None_G-M-F_P-None_S-Moon,ASC+ || VIDEO Only || US || 0% EXISTING CAP || 1C || 08.12.24  Ad set,VIDEO,"$4,718","134,656",2024-12-08,2025-01-20,43
16,Dynamic_Creative_3:2:2_Video_CA_Flow,WC || CA || DYNAMIC CREATIVE | 3:2:2 || New ads || ADV+ audience || 7C || 06.09.2024 || BIG BUDGET,SHARE,"$4,161","333,497",2024-09-08,2025-01-22,136
17,CB_2024_Oct_FB_3296_SO_V02_1x1_IMG_EN_New_C-Sale_Sale_CTA-BF_Angle-None_M-NONE_VL-None_G-NONE_P-OG_S-NONE_FB3259V02,ðŸŒ¶ï¸ || US || ASC+ || ->CC141 || VIDEO Only || US+CA || 0% EXISTING CAP || 7C || 07/08.24  Ad set,SHARE,"$4,130","230,100",2024-11-25,2025-01-11,47
18,CB_2023_Oct_FB_2516_VK_V13_9x16_VID_EN_Opti_C-Benefits_CTA-AUTUM_Pain-W-B_M-PASQ_VL-30s_TR-None_G-M_P-Plan_S-WHAT,ASC+ || VIDEO Only || US || 0% EXISTING CAP || 1C || 08.12.24  Ad set,VIDEO,"$3,910","145,487",2024-12-20,2025-02-05,47
19,CB_2024_Dec_FB_3619_VK-JT_V02_4x5_VID_EN_New_C-BulletPoints_Sale_CTA-NY_Angle-W-B-C_M-NONE_VL-None_G-NONE_P-OG_S-NONE,3619 - CB - CRAVINGS - IMG - TESTIMONIAL || Enhancements: OFF || CBV1 || Batch 1 || 1C || 23/12/24w52 || Kostas,SHARE,"$3,653","144,246",2024-12-23,2025-01-13,21
20,CB_2024_Nov_FB_3264_LZ_V29_4x5_VID_EN_Opti_C-NegativeMark_Sale_CTA-BF_Angle-W-B_M-LRNS_VL-30s_G-M_P-OG_S-NONE,ASC+ || VIDEO Only || US || 0% EXISTING CAP || 1C || 08.12.24  Ad set,SHARE,"$3,512","149,925",2024-12-08,2025-01-27,50
21,CB_2023_May_FB_2263_MB_V04_9x16_VID_EN_New_C-Sale_CTA-SMR_Pain-W_M-JOG_VL-45s_TR-None_G-M-F_P-None_S-Moon,CBV2 || AU || ðŸ’° Advantage+ || US || BROAD || 7C || Existing_customer_5% || 19/12/24 Ad set,VIDEO,"$3,326","124,703",2024-12-19,2025-03-27,98
22,CB_2024_Nov_FB_3264_LZ_V31_4x5_VID_EN_Opti_C-MakingOf_Sale_CTA-BF_Angle-W-B_M-CRAZY_VL-45s_G-M_P-OG_S-NEW_FB3004V02,ðŸŒ¶ï¸ || US || ASC+ || ->CC141 || VIDEO Only || US+CA || 0% EXISTING CAP || 7C || 07/08.24  Ad set,VIDEO,"$2,849","105,707",2024-11-18,2025-01-24,67
23,CB_2024_Sep_FB_3175_DA-KB_V04_1x1_IMG_EN_New_C-ADVRT_Evergreen_CTA-NONE_Angle-W_M-NONE_VL-None_G-NONE_P-CBV2_S-NONE_blog_colonbroomvsmammoth_cv_en,CBV2 || A/B Pricing: Standard || 3175 - CB vs Happy Mammoth advertorial || BROAD || 1C ||  22/11/24 || Kostas,SHARE,"$2,818","84,071",2024-12-22,2025-01-13,22
24,CB_2024_Dec_FB_3601_VK-DP_V09_4x5_VID_EN_Opti_C-Dance_CTA-NY_Pain-W-B_M-JOG_VL-30s_TR-None_G-F_P-OG_S-WHAT_FB3045V01,ðŸŒ¶ï¸ || US || ASC+ || ->CC141 || VIDEO Only || US+CA || 0% EXISTING CAP || 7C || 07/08.24  Ad set,VIDEO,"$2,661","65,015",2024-12-27,2025-02-14,49
25,CB_2023_Nov_FB_2649_VK_V06_9x16_VID_EN_Opti_C-Sale_CTA-C65_Pain-W_M-NONE_VL-30s_TR-None_G-MF_P-Plan_S-NEW_FB2601V04,ðŸ’°WC || US || Advantage+ || BIG BUDGET || CC101->105->109->112->114-116->117 || BROAD || ABO || 1C || 17/01/24 RELAUNCHED Ad set,VIDEO,"$2,636","122,724",2024-01-17,2025-02-06,386
26,CB_2023_May_FB_2263_MB_V04_9x16_VID_EN_New_C-Sale_CTA-SMR_Pain-W_M-JOG_VL-45s_TR-None_G-M-F_P-None_S-Moon,CBV2 || EU (UK) || ðŸ’° Advantage+ || US || BROAD || 7C || Existing_customer_5% || 15/12/24 Ad set,VIDEO,"$2,053","81,978",2024-12-19,2025-01-17,29
27,CB_2024_May_FB_3029_VK-DP_V04_9x16_VID_EN_New_C-MakingOf_CTA-CTA_Pain-W-B-C_M-CRAZY_VL-45s_TR-None_G-M_P-OG_S-NEW,ASC+ || VIDEO Only || US || 0% EXISTING CAP || 1C || 08.12.24  Ad set,VIDEO,"$2,018","115,049",2024-12-08,2025-01-09,32
28,CB_2025_Jan_FB_3657_SO-JT_V04_4x5_VID_EN_New_C-NONE_Evergreen_CTA-NY_Angle-W_M-NONE_VL-15s_G-NONE_P-NONE_S-DooWop,ðŸŒ¶ï¸ || US || ASC+ || ->CC141 || VIDEO Only || US+CA || 0% EXISTING CAP || 7C || 07/08.24  Ad set,VIDEO,"$1,948","93,805",2025-01-09,2025-01-24,15
29,CB_2024_Sep_FB_3175_DA-KB_V04_1x1_IMG_EN_New_C-ADVRT_Evergreen_CTA-NONE_Angle-W_M-NONE_VL-None_G-NONE_P-CBV2_S-NONE_blog_colonbroomvsmammoth_cv_en,CBV2 || A/B Pricing: increased price || 3175 - CB vs Happy Mammoth advertorial || BROAD || 1C ||  22/11/24 || Kostas,SHARE,"$1,853","51,487",2024-12-22,2025-01-22,31
30,CB_2024_Nov_FB_3264_LZ_V31_4x5_VID_EN_Opti_C-MakingOf_Sale_CTA-BF_Angle-W-B_M-CRAZY_VL-45s_G-M_P-OG_S-NEW_FB3004V02,ASC+ || VIDEO Only || US || 0% EXISTING CAP || 1C || 08.12.24  Ad set,VIDEO,"$1,833","68,381",2024-12-08,2025-02-05,59
31,CB_2023_Jul_FB_2217_IB_V04_9x16_VID_EN_Opti_C-Pointing_CTA-SMR_Pain-W-B_M-TRC_VL-30s_TR-None_G-F_P-None_S-FRIGGA,CBV2 || AU || ðŸ’° Advantage+ || US || BROAD || 7C || Existing_customer_5% || 19/12/24 Ad set,VIDEO,"$1,808","70,004",2024-12-19,2025-03-24,95
32,CB_2023_Dec_FB_2712_RS-DP_V02_1x1_VID_EN_Opti_C-WrittenTesti_CTA-SALE_Pain-W-B-C_M-NONE_VL-None_TR-None_G-NONE_P-V2_S-NONE_FB2227V08,CBV2 || EU (UK) || ðŸ’° Advantage+ || US || BROAD || 7C || Existing_customer_5% || 15/12/24 Ad set,SHARE,"$1,712","75,953",2024-12-15,2025-03-27,102
33,DPA,ASC+ || MIX || Value Optimization || US || 0% EXISTING CAP || 1C || 22.12.24  Ad set,SHARE,"$1,705","85,575",2024-12-22,2025-01-06,15
34,CB_2024_Sep_FB_3175_DA-KB_V01_1x1_IMG_EN_New_C-ADVRT_Evergreen_CTA-NONE_Angle-W_M-NONE_VL-None_G-NONE_P-CBV2_S-NONE_blog_colonbroomvsmammoth_cv_en,CBV2 || A/B Pricing: increased price || 3175 - CB vs Happy Mammoth advertorial || BROAD || 1C ||  22/11/24 || Kostas,SHARE,"$1,674","67,278",2024-12-22,2025-01-22,31
35,CB_2023_Aug_FB_2295_MB_V01_1x1_VID_EN_Opti_C-GIF_CTA-CTA_Pain-W-B_M-None_VL-10s_TR-None_G-None_P-None_S-None,CA || COST CAP 92->93 || 7C || 10/05/24 || V1,VIDEO,"$1,592","113,767",2024-05-10,2025-02-27,293
36,CB_2024_Dec_FB_3601_VK-DP_V09_4x5_VID_EN_Opti_C-Dance_CTA-NY_Pain-W-B_M-JOG_VL-30s_TR-None_G-F_P-OG_S-WHAT_FB3045V01,ASC+ || VIDEO Only || US || 0% EXISTING CAP || 1C || 08.12.24  Ad set,VIDEO,"$1,537","41,598",2024-12-25,2025-02-05,42
37,CB_2023_Jul_FB_2217_IB_V04_9x16_VID_EN_Opti_C-Pointing_CTA-SMR_Pain-W-B_M-TRC_VL-30s_TR-None_G-F_P-None_S-FRIGGA,UK || ASC+ || CBV2 || 7DC || Existing 10% || 13.11.2024 Ad set,VIDEO,"$1,507","85,089",2024-11-13,2025-01-16,64
38,CB_2024_Aug_FB_3090_DT-DP_V02_9x16_VID_EN_Opti_C-MakingOf_CTA-CTA_Pain-W-B-C_M-POW_VL-45s_TR-None_G-M_P-OG_S-Moon_FB3029V04,CBV2 || EU (UK) || ðŸ’° Advantage+ || US || BROAD || 7C || Existing_customer_5% || 15/12/24 Ad set,SHARE,"$1,352","76,655",2024-12-19,2025-03-27,98
39,CB_2023_Jul_FB_2226_MB_V04_9x16_VID_EN_Opti_C-Testim_CTA-SMR_Pain-W_M-MIX_VL-30s_TR-None_G-F_P-None_S-Starry,ASC+ || VIDEO Only || US || 0% EXISTING CAP || 1C || 08.12.24  Ad set,VIDEO,"$1,316","39,384",2024-12-08,2025-01-09,32
40,CB_2023_Dec_FB_2670_MB-RP_V02_9x16_VID_EN_Opti_C-Sale_CTA-XMAS65_Pain-W_M-JOG_VL-30s_TR-None,ðŸ’°WC || US || Advantage+ || BIG BUDGET || CC101->105->109->112->114-116->117 || BROAD || ABO || 1C || 17/01/24 RELAUNCHED Ad set,VIDEO,"$1,272","45,079",2024-01-17,2025-02-06,386
41,CB_2023_Dec_FB_2712_RS-DP_V02_1x1_VID_EN_Opti_C-WrittenTesti_CTA-SALE_Pain-W-B-C_M-NONE_VL-None_TR-None_G-NONE_P-V2_S-NONE_FB2227V08,CBV2 || AU || ðŸ’° Advantage+ || US || BROAD || 7C || Existing_customer_5% || 19/12/24 Ad set,SHARE,"$1,261","58,194",2024-12-19,2025-03-27,98
42,CB_2024_Dec_FB_3639_CHUB_V01_1x1_IMG_EN_New_C-NONE_CTA-NONE_Angle-W_M-NONE_VL-None_TR-None_G-NONE_P-NONE_S-NONE,3639 CHUB â€“ Looking 15 people || Enhancements: OFF || CBV1 || Batch 1 || 1C || 30/12/24w01 || Kostas,SHARE,"$1,228","43,379",2024-12-30,2025-01-12,13
43,CB_2024_Jan_FB_2784_RS_V02_9x16_VID_EN_Opti_C-Pointing_CTA-SALE_Pain-W_M-JOG_VL-30s_TR-None_G-F_P-OG_S-OLLIE_FB2181V01,CBV2 || EU (UK) || ðŸ’° Advantage+ || US || BROAD || 7C || Existing_customer_5% || 15/12/24 Ad set,VIDEO,"$1,154","54,483",2025-01-09,2025-03-27,77
44,CB_2024_Nov_FB_3305_SO-DP_V02_4x5_VID_EN_Opti_C-Sale_CTA-BF_Pain-W_M-Chris_VL-30s_TR-None_G-MF_P-Plan_S-NEW_FB2601V07,ðŸŒ¶ï¸ || US || ASC+ || ->CC141 || VIDEO Only || US+CA || 0% EXISTING CAP || 7C || 07/08.24  Ad set,VIDEO,"$1,138","34,338",2024-11-25,2025-01-15,51
45,CB_2023_May_FB_2263_MB_V04_9x16_VID_EN_New_C-Sale_CTA-SMR_Pain-W_M-JOG_VL-45s_TR-None_G-M-F_P-None_S-Moon,Pricing Test || EU (UK) || 1C || Higher Price || 07/01/25,VIDEO,"$1,044","40,823",2025-01-07,2025-01-15,8
46,CB_2024_Dec_FB_3666_VK-JT_V03_4x5_VID_EN_Opti_C-BulletPoints_Sale_CTA-NY_Angle-W-B-C_M-TRC_VL-30s_G-F_P-OG_S-NEW,3666 - looksmaxing trend || Enhancements: OFF || CBV1 || Batch 1 || 1C || 07/01/25w02 || Kostas,SHARE,"$1,008","48,091",2025-01-07,2025-01-27,20
47,CB_2023_May_FB_2263_MB_V04_9x16_VID_EN_New_C-Sale_CTA-SMR_Pain-W_M-JOG_VL-45s_TR-None_G-M-F_P-None_S-Moon,Pricing Test || EU (UK) || 1C || Standard Price || 07/01/25,VIDEO,$986,"37,437",2025-01-07,2025-01-15,8
48,CB_2024_Aug_FB_3090_DT-DP_V02_9x16_VID_EN_Opti_C-MakingOf_CTA-CTA_Pain-W-B-C_M-POW_VL-45s_TR-None_G-M_P-OG_S-Moon_FB3029V04,CBV2 || AU || ðŸ’° Advantage+ || US || BROAD || 7C || Existing_customer_5% || 19/12/24 Ad set,SHARE,$961,"42,237",2024-12-19,2025-01-17,29
49,CB_2024_Oct_FB_3252_VK-DP_V04_4x5_VID_EN_Opti_C-MakingOf_Evergreen_CTA-SALE_Angle-W-B-C_M-JOG_VL-45s_G-F_P-OG_S-MOON_FB3090V02,ðŸŒ¶ï¸ || US || ASC+ || ->CC141 || VIDEO Only || US+CA || 0% EXISTING CAP || 7C || 07/08.24  Ad set,VIDEO,$961,"22,186",2024-11-07,2025-03-27,140
50,CB_2024_Oct_FB_3252_VK-DP_V04_4x5_VID_EN_Opti_C-MakingOf_Evergreen_CTA-SALE_Angle-W-B-C_M-JOG_VL-45s_G-F_P-OG_S-MOON_FB3090V02,ASC+ || VIDEO Only || US || 0% EXISTING CAP || 1C || 08.12.24  Ad set,SHARE,$888,"25,680",2024-12-08,2025-01-09,32
51,CB_2024_Sep_FB_3175_DA-KB_V03_1x1_IMG_EN_New_C-ADVRT_Evergreen_CTA-NONE_Angle-W_M-NONE_VL-None_G-NONE_P-CBV2_S-NONE_blog_colonbroomvsmammoth_cv_en,CBV2 || A/B Pricing: Standard || 3175 - CB vs Happy Mammoth advertorial || BROAD || 1C ||  22/11/24 || Kostas,SHARE,$870,"27,884",2024-12-22,2025-01-13,22
52,CB_2025_Jan_FB_3657_SO-JT_V04_4x5_VID_EN_New_C-NONE_Evergreen_CTA-NY_Angle-W_M-NONE_VL-15s_G-NONE_P-NONE_S-DooWop,3657 - CB - TOO LATE  Notion idea #62 - NYNM 2 || Enhancements: OFF || CBV1 || Batch 1 || 1C || 07/01/25w02 || Kostas,SHARE,$857,"31,046",2025-01-07,2025-01-12,5
53,CB_2024_Dec_FB_3601_VK-DP_V09_4x5_VID_EN_Opti_C-Dance_CTA-NY_Pain-W-B_M-JOG_VL-30s_TR-None_G-F_P-OG_S-WHAT_FB3045V01,CBV2 || EU (UK) || ðŸ’° Advantage+ || US || BROAD || 7C || Existing_customer_5% || 15/12/24 Ad set,VIDEO,$850,"28,785",2024-12-27,2025-01-15,19
54,CB_2025_Jan_FB_3656_JT_V02_4x5_IMG_EN_New_C-Headline_Seasonal_CTA-70_Angle-W_M-NONE_VL-None_G-NONE_P-OG_S-NONE,3656 - we_re leaving || Enhancements: OFF || CBV1 || Batch 1 || 1C || 07/01/25w02 || Kostas,SHARE,$848,"31,780",2025-01-07,2025-01-16,9
55,CB_2022_Nov_FB_1197_IK_V03_1x1_IMG_EN_New_C-Sale_CTA-SALE_Pain-W_M-NONE_VL-None_TR-None_M-VON,ðŸŒ¶ï¸ || US || ASC+ || ->CC141 || VIDEO Only || US+CA || 0% EXISTING CAP || 7C || 07/08.24  Ad set,SHARE,$835,"26,449",2024-11-08,2025-01-15,68
56,CB_2024_Sep_FB_3175_DA-KB_V03_1x1_IMG_EN_New_C-ADVRT_Evergreen_CTA-NONE_Angle-W_M-NONE_VL-None_G-NONE_P-CBV2_S-NONE_blog_colonbroomvsmammoth_cv_en,CBV2 || A/B Pricing: increased price || 3175 - CB vs Happy Mammoth advertorial || BROAD || 1C ||  22/11/24 || Kostas,SHARE,$834,"28,475",2024-12-22,2025-01-22,31
57,CB_2024_Oct_FB_3252_VK-DP_V04_4x5_VID_EN_Opti_C-MakingOf_Evergreen_CTA-SALE_Angle-W-B-C_M-JOG_VL-45s_G-F_P-OG_S-MOON_FB3090V02,UK || ASC+ || CBV2 || 7DC || Existing 10% || 13.11.2024 Ad set,SHARE,$786,"41,553",2024-11-13,2025-01-16,64
58,CB_2023_May_FB_1999_LV_V01_9x16_VID_EN_New_C-Pointing_CTA-DISCOUNT_Pain-W_M-JOG_VL-30s_TR-None,View Content || BROAD || 7C || 17/12/24,VIDEO,$749,"71,398",2024-12-17,2025-01-20,34
59,CB_2023_Dec_FB_2696_RS_V03_9x16_VID_EN_Opti_C-Sale_CTA-NY65_Pain-W-B_M-JANW_VL-30s_TR-None_G-M_P-OG_S-WHAT_FB2284V05,EU (UK) || 2696 || 1C || 08/01/2025w02,SHARE,$745,"37,499",2025-01-08,2025-01-20,12
60,CB_2024_Oct_FB_3269_LZ-VU_V01_1x1_IMG_EN_Opti_C-Headline_Sale_CTA-BF_Angle-None_M-NONE_VL-None_G-NONE_P-NONE_S-NONE_FB3251V02.png,ðŸŒ¶ï¸ || US || ASC+ || ->CC141 || VIDEO Only || US+CA || 0% EXISTING CAP || 7C || 07/08.24  Ad set,SHARE,$732,"20,087",2024-11-07,2025-01-15,69
61,CB_2024_Oct_FB_3182_ZS-GC_V13_1x1_IMG_EN_New_C-UsVsThem_Evergreen_CTA-NONE_Angle-B-C_M-NONE_VL-None_G-NONE_P-OG_S-NONE,CBV2 || Advantage+ || Only V1 Ads || US || 5% EXISTING CAP || BROAD || 7C || 30/12/24  Campaign Ad set,SHARE,$703,"41,854",2024-12-30,2025-01-22,23
62,CB_2024_Dec_FB_3592_VK-DP_V10_4x5_VID_EN_New_C-BulletPoints_Sale_CTA-SALE_Angle-W-B-C_M-NONE_VL-30s_G-F_P-OG_S-NEW - Copy,ðŸŒ¶ï¸ || US || ASC+ || ->CC141 || VIDEO Only || US+CA || 0% EXISTING CAP || 7C || 07/08.24  Ad set,VIDEO,$701,"25,618",2024-12-21,2025-03-27,96
63,CB_2023_Jul_FB_2217_IB_V04_9x16_VID_EN_Opti_C-Pointing_CTA-SMR_Pain-W-B_M-TRC_VL-30s_TR-None_G-F_P-None_S-FRIGGA,CBV2 || Advantage+ || Only V1 Ads || US || 5% EXISTING CAP || BROAD || 7C || 30/12/24  Campaign Ad set,VIDEO,$688,"27,633",2024-12-30,2025-01-22,23
64,CB_2023_Dec_FB_2712_RS-DP_V02_1x1_VID_EN_Opti_C-WrittenTesti_CTA-SALE_Pain-W-B-C_M-NONE_VL-None_TR-None_G-NONE_P-V2_S-NONE_FB2227V08,UK || ASC+ || CBV2 || 7DC || Existing 10% || 13.11.2024 Ad set,SHARE,$620,"25,236",2024-11-13,2025-01-16,64
65,CB_2025_Jan_FB_3655_JT_V02_4x5_IMG_EN_New_C-Headline_Seasonal_CTA-70_Angle-W_M-NONE_VL-None_G-NONE_P-OG_S-NONE,3655 - nynm headlines || Enhancements: OFF || CBV1 || Batch 1 || 1C || 07/01/25w02 || Kostas,SHARE,$617,"22,479",2025-01-07,2025-01-12,5
66,IM_CB1.png,US || VSL || Aff's image || Landing: Pre-1(New lead) -> Old lead || 1C || 10/01/25,SHARE,$615,"31,511",2025-01-10,2025-01-16,6
67,CB_2023_Jul_FB_2217_IB_V04_9x16_VID_EN_Opti_C-Pointing_CTA-SMR_Pain-W-B_M-TRC_VL-30s_TR-None_G-F_P-None_S-FRIGGA,CBV2 || EU (UK) || ðŸ’° Advantage+ || US || BROAD || 7C || Existing_customer_5% || 15/12/24 Ad set,VIDEO,$610,"36,902",2024-12-18,2025-03-27,99
68,CB_2024_Dec_FB_3601_VK-DP_V09_4x5_VID_EN_Opti_C-Dance_CTA-NY_Pain-W-B_M-JOG_VL-30s_TR-None_G-F_P-OG_S-WHAT_FB3045V01 - Copy,CBV2 || EU (UK) || ðŸ’° Advantage+ || US || BROAD || 7C || Existing_customer_5% || 15/12/24 Ad set,SHARE,$584,"21,823",2024-12-30,2025-01-11,12
69,CB_2024_Dec_FB_3653_LZ-VU_V01_4x5_IMG_EN_New_C-Headline_Evergreen_CTA-NONE_Angle-W_M-NONE_VL-None_G-F_P-NONE_S-NONE.png,3653 - Valentinas' Hyper targeting ad || Enhancements: OFF || CBV1 || Batch 1 || 1C || 05/01/25w01 || Valentinas,SHARE,$536,"22,214",2025-01-05,2025-01-09,4
70,CB_2023_May_FB_2263_MB_V04_9x16_VID_EN_New_C-Sale_CTA-SMR_Pain-W_M-JOG_VL-45s_TR-None_G-M-F_P-None_S-Moon,ðŸ’°WC || US || Advantage+ || BIG BUDGET || CC101->105->109->112->114-116->117 || BROAD || ABO || 1C || 17/01/24 RELAUNCHED Ad set,VIDEO,$535,"17,376",2024-01-17,2025-02-06,386
71,CB_2024_Dec_FB_3639_CHUB_V02_1x1_IMG_EN_New_C-NONE_CTA-NONE_Angle-W_M-NONE_VL-None_TR-None_G-NONE_P-NONE_S-NONE,3639 CHUB â€“ Looking 15 people || Enhancements: OFF || CBV1 || Batch 1 || 1C || 30/12/24w01 || Kostas,SHARE,$534,"20,294",2024-12-30,2025-01-13,14
72,CB_2024_Oct_FB_3264_LZ_V15_4x5_VID_EN_Opti_C-MakingOf_Sale_CTA-BF_Angle-W-B_M-AGR_VL-30s_G-M_P-OG_S-WHAT_FB3005V02,UK || ASC+ || CBV2 || 7DC || Existing 10% || 13.11.2024 Ad set,SHARE,$512,"22,961",2024-11-13,2025-01-16,64
73,CB_2024_Dec_FB_3659_LZ-VU_V01_4x5_IMG_EN_New_C-Headline_Evergreen_CTA-NONE_Angle-W_M-NONE_VL-None_G-M_P-NONE_S-NONE.png,3659 - BRO ads || Enhancements: OFF || CBV1 || Batch 1 || 1C || 05/01/25w01 || Valentinas,SHARE,$504,"19,516",2025-01-05,2025-01-09,4
74,CB_2024_Oct_FB_3251_LZ-VU_V01_1x1_IMG_EN_New_C-NegativeMark_Evergreen_CTA-NONE_Angle-Cort_M-NONE_VL-None_G-NONE_P-NONE_S-NONE,UK || ASC+ || CBV2 || 7DC || Existing 10% || 13.11.2024 Ad set,SHARE,$500,"15,426",2024-11-13,2025-01-16,64
75,CB_2024_Jan_FB_2764_RS_V04_9x16_VID_EN_Opti_C-SingleTesti_CTA-SALE_Pain-W_M-TRC_VL-45s_TR-None_G-F_P-OG_S-MOON_FB2263V04,EU (UK) || 2764 || Trinity Results Too Fast || 1C || 08/01/2025w02,VIDEO,$495,"20,500",2025-01-08,2025-03-27,78
76,CB_2025_Jan_FB_3667_SO-JT_V04_4x5_IMG_EN_New_C-NONE_Evergreen_CTA-NY_Angle-W_M-NONE_VL-None_G-NONE_P-NONE_S-NONE,3667 - CB - Notion idea #60 EXCEL - NYNM || Enhancements: OFF || CBV1 || Batch 1 || 1C || 07/01/25w02 || Kostas,SHARE,$465,"23,889",2025-01-07,2025-01-11,4
77,VCB3.mp4,US || VSL || Aff's video || Landing: Pre-1(New lead) -> Old lead || 1C || 10/01/25,SHARE,$464,"14,696",2025-01-10,2025-01-12,2
78,CB_2024_Dec_FB_3658_LZ-VU_V02_4x5_IMG_EN_New_C-BeforeAfter_Evergreen_CTA-NONE_Angle-W_M-NONE_VL-None_G-NONE_P-OG_S-NONE,3658 - ridge inspired humorous ads marmot || Enhancements: OFF || CBV1 || Batch 1 || 1C || 05/01/25w01 || Kostas,SHARE,$457,"18,130",2025-01-05,2025-01-09,4
79,CB_2024_Dec_FB_3619_VK-JT_V02_4x5_VID_EN_New_C-BulletPoints_Sale_CTA-NY_Angle-W-B-C_M-NONE_VL-None_G-NONE_P-OG_S-NONE,ðŸŒ¶ï¸ || US || ASC+ || ->CC141 || VIDEO Only || US+CA || 0% EXISTING CAP || 7C || 07/08.24  Ad set,SHARE,$456,"19,006",2024-12-27,2025-03-27,90
80,20230907_101401,AU || 3rd party page: Fitness Coach Nicole || Organic Ads || Batch 1 || 1C || 03/01/2025,SHARE,$448,"23,206",2025-01-03,2025-01-09,6
81,CB_2023_May_FB_2263_MB_V04_9x16_VID_EN_New_C-Sale_CTA-SMR_Pain-W_M-JOG_VL-45s_TR-None_G-M-F_P-None_S-Moon,CBV2 || NZ || ðŸ’° Advantage+ || US || BROAD || 7C || Existing_customer_5% || 19/12/24 Campaign Ad set,VIDEO,$443,"26,001",2024-12-19,2025-01-11,23
82,CB_2025_Jan_FB_3662_CHUB_V01_1x1_IMG_EN_New_C-NONE_CTA-NONE_Angle-C_M-NONE_VL-None_TR-None_G-NONE_P-NONE_S-NONE.jpg,3662 - Hipno event ITR CHUB || Enhancements: OFF || CBV1 || Batch 1 || 1C || 10/01/25w02 || Valentinas,SHARE,$432,"20,813",2025-01-10,2025-01-15,5
83,CB_2023_Jul_FB_2226_MB_V04_9x16_VID_EN_Opti_C-Testim_CTA-SMR_Pain-W_M-MIX_VL-30s_TR-None_G-F_P-None_S-Starry,View Content || BROAD || 7C || 17/12/24,VIDEO,$428,"38,028",2024-12-17,2025-01-20,34
84,CB_2024_Dec_FB_3614_CHUB_V05_9x16_VID_EN_New_C-Headline_CTA-NONE_Angle-W_M-NONE_VL-15s_TR-None_G-NONE_P-NONE_S-NONE,3614 CHUB - Presentation ads || Enhancements: OFF || CBV1 || Batch 2 || 1C || 05/01/25w01 || Kostas,VIDEO,$426,"18,762",2025-01-05,2025-01-09,4
85,CB_2023_Jul_FB_2226_MB_V04_9x16_VID_EN_Opti_C-Testim_CTA-SMR_Pain-W_M-MIX_VL-30s_TR-None_G-F_P-None_S-Starry,UK || ASC+ || CBV2 || 7DC || Existing 10% || 13.11.2024 Ad set,SHARE,$419,"18,281",2024-11-13,2025-01-16,64
86,CB_2023_Jul_FB_2217_IB_V04_9x16_VID_EN_Opti_C-Pointing_CTA-SMR_Pain-W-B_M-TRC_VL-30s_TR-None_G-F_P-None_S-FRIGGA,ðŸ’°WC || US || Advantage+ || BIG BUDGET || CC101->105->109->112->114-116->117 || BROAD || ABO || 1C || 17/01/24 RELAUNCHED Ad set,VIDEO,$417,"15,329",2024-01-17,2025-02-06,386
87,CB_2024_Jan_FB_2784_RS_V02_9x16_VID_EN_Opti_C-Pointing_CTA-SALE_Pain-W_M-JOG_VL-30s_TR-None_G-F_P-OG_S-OLLIE_FB2181V01,EU (UK) || 2706 || 1C || 08/01/2025w02,VIDEO,$415,"15,906",2025-01-08,2025-01-11,3
88,CB_2024_Sep_FB_3175_DA-KB_V01_1x1_IMG_EN_New_C-ADVRT_Evergreen_CTA-NONE_Angle-W_M-NONE_VL-None_G-NONE_P-CBV2_S-NONE_blog_colonbroomvsmammoth_cv_en,CBV2 || A/B Pricing: Standard || 3175 - CB vs Happy Mammoth advertorial || BROAD || 1C ||  22/11/24 || Kostas,SHARE,$412,"14,158",2024-12-22,2025-01-13,22
89,CB_2024_Jan_FB_2784_RS_V02_9x16_VID_EN_Opti_C-Pointing_CTA-SALE_Pain-W_M-JOG_VL-30s_TR-None_G-F_P-OG_S-OLLIE_FB2181V01,EU (UK) || 2784 || 1C || 08/01/2025w02,VIDEO,$404,"19,040",2025-01-08,2025-01-11,3
90,CB_2025_Jan_FB_3686_LZ-KB_V03_4x5_IMG_EN_New_C-Headline_Evergreen_CTA-NONE_Angle-ADVTR_M-NONE_VL-None_G-NONE_P-NONE_S-NONE_FB3582V11,CBV2 || LP:HI 3686 - advertorial 3582v11 opti - secret behind the label advertorial ads || Batch 4 || BROAD || 1C ||  10/01/25 || Kostas,SHARE,$402,"4,488",2025-01-10,2025-01-13,3
91,CB_2024_Jan_FB_2764_RS_V04_9x16_VID_EN_Opti_C-SingleTesti_CTA-SALE_Pain-W_M-TRC_VL-45s_TR-None_G-F_P-OG_S-MOON_FB2263V04_Page_Personal_Coach,CBV2 || EU (UK) || ðŸ’° Advantage+ || US || BROAD || 7C || Existing_customer_5% || 15/12/24 Ad set,VIDEO,$400,"15,977",2025-01-09,2025-01-17,8
92,CB_2023_Dec_FB_2696_RS_V03_9x16_VID_EN_Opti_C-Sale_CTA-NY65_Pain-W-B_M-JANW_VL-30s_TR-None_G-M_P-OG_S-WHAT_FB2284V05,AU || Page: Branded || 2696 || 1C || 10/01/2025w02,VIDEO,$390,"16,488",2025-01-10,2025-01-16,6
93,CB_2024_Jan_FB_2784_RS_V02_9x16_VID_EN_Opti_C-Pointing_CTA-SALE_Pain-W_M-JOG_VL-30s_TR-None_G-F_P-OG_S-OLLIE_FB2181V01,AU || 2784 || 1C || 08/01/2025w02,VIDEO,$381,"15,071",2025-01-10,2025-01-14,4
94,CB_2025_Jan_FB_3656_KB_V04_4x5_IMG_EN_Opti_C-Headline_Sale_CTA-NY_Angle-SC_M-NONE_VL-None_G-NONE_P-OG_S-NONE_FB3573V03,EU (UK) || 3rd party page || Notion #53 Opti NYNM || 1C || 08/01/2025w02,SHARE,$372,"20,041",2025-01-08,2025-01-11,3
95,CB_2025_Jan_FB_3695_KB_V02_4x5_IMG_EN_New_C-SocialProof_Sale_CTA-SALE_Angle-W-B-C_M-NONE_VL-None_G-NONE_P-OG_S-NONE,3695 - #105 â€œReddit postsâ€ California Fires || Enhancements: OFF || CBV1 || Batch 2 || 1C || 10/01/25w02 || Kostas,SHARE,$372,"23,190",2025-01-10,2025-01-22,12
96,CB_2025_Jan_FB_3663_CHUB_V04_1x1_VID_EN_New_C-MakingOf_CTA-NONE_Angle-C_M-NONE_VL-30s_TR-None_G-M_P-NONE_S-NONE.mp4,CHUB 25 day challenge vids || Enhancements: OFF || CBV1 || Batch 1 || 1C || 07/01/25w02 || Valentinas,VIDEO,$363,"11,407",2025-01-07,2025-01-11,4
97,CB_2025_Jan_FB_3693_LZ-JG_V02_4x5_IMG_EN_Opti_C-Headline_Evergreen_CTA-NONE_Angle-W_M-NONE_VL-None_G-NONE_P-NONE_S-NONE_FB3639V03,3693 - 3639 opti quitters_ day || Enhancements: OFF || CBV1 || Batch 2 || 1C || 10/01/25w02 || Kostas,SHARE,$361,"17,211",2025-01-10,2025-01-15,5
98,CB_2023_Dec_FB_2712_RS-DP_V02_1x1_VID_EN_Opti_C-WrittenTesti_CTA-SALE_Pain-W-B-C_M-NONE_VL-None_TR-None_G-NONE_P-V2_S-NONE_FB2227V08,CBV2 || NZ || ðŸ’° Advantage+ || US || BROAD || 7C || Existing_customer_5% || 19/12/24 Campaign Ad set,SHARE,$352,"24,206",2024-12-19,2025-01-11,23
99,CB_2025_Jan_FB_3671_LZ-VU_V01_4x5_IMG_EN_New_C-Headline_Evergreen_CTA-NONE_Angle-W_M-NONE_VL-None_G-NONE_P-NONE_S-NONE_FB3306V01,EU (UK) || 3671 - anti inflammatory diet opti || 1C || 08/01/2025w02,SHARE,$352,"11,847",2025-01-08,2025-01-16,8
100,CB_2024_May_FB_3003_VK-DP_V03_9x16_VID_EN_Opti_C-Pointing_CTA-SALE_Pain-W-B-C_M-KAY_VL-30s_TR-None_G-F_P-OG_S-WHAT_FB2986V06,ðŸŒ¶ï¸ || US || ASC+ || ->CC141 || VIDEO Only || US+CA || 0% EXISTING CAP || 7C || 07/08.24  Ad set,VIDEO,$351,"16,081",2024-08-07,2025-01-24,170
101,CB_2025_Jan_FB_3651_SO-JT_V03_4x5_IMG_EN_New_C-NONE_Evergreen_CTA-SALE_Angle-None_M-NONE_VL-None_G-NONE_P-NONE_S-NONE,3651 - NYNM - RIDDLES NOTION #77 || Enhancements: OFF || CBV1 || Batch 2 || 1C || 05/01/25w01 || Kostas,SHARE,$351,"15,761",2025-01-05,2025-01-15,10
102,CB_2025_Jan_FB_3693_LZ-JG_V02_4x5_IMG_EN_Opti_C-Headline_Evergreen_CTA-NONE_Angle-W_M-NONE_VL-None_G-NONE_P-NONE_S-NONE_FB3639V03,3693 - 3639 opti quitters_ day || Enhancements: OFF || CBV1 || Batch 2 || 1C || 10/01/25w02 || Kostas,SHARE,$347,"15,064",2025-01-10,2025-01-12,2
103,CB_2025_Jan_FB_3656_KB_V01_4x5_IMG_EN_Opti_C-Headline_Sale_CTA-NY_Angle-SC_M-NONE_VL-None_G-NONE_P-OG_S-NONE_FB3573V03 - Copy,EU (UK) || Notion #53 Opti NYNM || 1C || 08/01/2025w02,SHARE,$340,"13,172",2025-01-08,2025-01-11,3
104,CB_2025_Jan_FB_3686_LZ-KB_V05_4x5_IMG_EN_New_C-Headline_Evergreen_CTA-NONE_Angle-ADVTR_M-NONE_VL-None_G-NONE_P-NONE_S-NONE_FB3582V11,CBV2 || LP:HI 3686 - advertorial 3582v11 opti - secret behind the label advertorial ads || Batch 5 || BROAD || 1C ||  10/01/25 || Kostas,SHARE,$340,"3,938",2025-01-10,2025-01-13,3
105,CB_2024_Jan_FB_2762_IK_V05_1x1_IMG_EN_New_C-WrittenTesti_CTA-CTA_Pain-W-B-C_M-NONE_VL-None_TR-None_G-NONE_P-V2_S-NONE,CBV2 || EU (UK) || ðŸ’° Advantage+ || US || BROAD || 7C || Existing_customer_5% || 15/12/24 Ad set,SHARE,$338,"12,090",2024-12-15,2025-03-27,102
106,20230907_101759,AU || 3rd party page: Fitness Coach Nicole || Organic Ads || Batch 1 || 1C || 03/01/2025,SHARE,$333,"11,440",2025-01-03,2025-01-09,6
107,CB_2024_Jan_FB_2762_IK_V05_1x1_IMG_EN_New_C-WrittenTesti_CTA-CTA_Pain-W-B-C_M-NONE_VL-None_TR-None_G-NONE_P-V2_S-NONE,CBV2 || AU || ðŸ’° Advantage+ || US || BROAD || 7C || Existing_customer_5% || 19/12/24 Ad set,SHARE,$309,"12,679",2024-12-19,2025-01-20,32
108,CB_2025_Jan_FB_3671_LZ-VU_V02_4x5_IMG_EN_New_C-Headline_Evergreen_CTA-NONE_Angle-W_M-NONE_VL-None_G-NONE_P-NONE_S-NONE_FB3306V02,AU || 3671 - anti inflammatory diet opti || 1C || 10/01/2025w02,SHARE,$304,"10,027",2025-01-10,2025-01-13,3
109,CB_2025_Jan_FB_3655_JT_V03_4x5_IMG_EN_New_C-Headline_Seasonal_CTA-70_Angle-W_M-NONE_VL-None_G-NONE_P-OG_S-NONE,3655 - nynm headlines || Enhancements: OFF || CBV1 || Batch 1 || 1C || 07/01/25w02 || Kostas,SHARE,$303,"9,043",2025-01-07,2025-01-12,5
110,CB_2024_Dec_FB_3629_VK-JT_V02_4x5_VID_EN_NEW_C-BulletPoints_Sale_CTA-NY_Angle-W-B-C_M-NONE_VL-None_G-M_P-OG_S-NEW,3629  -  CB - NEGATIVE MARKETING - NYNM - TRAINER 3 || Enhancements: OFF || CBV1 || Batch 1 || 1C || 07/01/25w02 || Kostas,SHARE,$303,"6,741",2025-01-07,2025-01-11,4
111,CB_2025_Jan_FB_3671_LZ-VU_V02_4x5_IMG_EN_New_C-Headline_Evergreen_CTA-NONE_Angle-W_M-NONE_VL-None_G-NONE_P-NONE_S-NONE_FB3306V02,AU || 3rd party page || 3671 - anti inflammatory diet opti || 1C || 10/01/2025w02,SHARE,$294,"10,745",2025-01-10,2025-01-13,3
112,CB_2023_Jul_FB_2217_IB_V04_9x16_VID_EN_Opti_C-Pointing_CTA-SMR_Pain-W-B_M-TRC_VL-30s_TR-None_G-F_P-None_S-FRIGGA,CBV2 || NZ || ðŸ’° Advantage+ || US || BROAD || 7C || Existing_customer_5% || 19/12/24 Campaign Ad set,VIDEO,$273,"16,712",2024-12-19,2025-01-11,23
113,CB_2024_Nov_FB_3264_LZ_V31_4x5_VID_EN_Opti_C-MakingOf_Sale_CTA-BF_Angle-W-B_M-CRAZY_VL-45s_G-M_P-OG_S-NEW_FB3004V02,CBV2 || AU || ðŸ’° Advantage+ || US || BROAD || 7C || Existing_customer_5% || 19/12/24 Ad set,VIDEO,$272,"8,753",2024-12-19,2025-03-27,98
114,CB_2024_Nov_FB_3634_VK_V02_4x5_IMG_EN_OPTI_C-BulletPoints_Sale_CTA-BF70_Angle-W-B-C_M-NONE_VL-None_G-NONE_P-OG_S-NONE_FB3353V10,3634 - 3353 opti || Enhancements: OFF || CBV1 || Batch 1 || 1C || 08/01/25w02 || Kostas,SHARE,$270,"16,923",2025-01-08,2025-01-11,3
115,CB_2025_Jan_FB_3651_SO-JT_V08_4x5_IMG_EN_New_C-NONE_Evergreen_CTA-SALE_Angle-None_M-NONE_VL-None_G-NONE_P-NONE_S-NONE,3651 - NYNM - RIDDLES NOTION #77 || Enhancements: OFF || CBV1 || Batch 2 || 1C || 05/01/25w01 || Kostas,SHARE,$264,"7,517",2025-01-05,2025-01-09,4
116,CB_2024_Jan_FB_2764_RS_V04_9x16_VID_EN_Opti_C-SingleTesti_CTA-SALE_Pain-W_M-TRC_VL-45s_TR-None_G-F_P-OG_S-MOON_FB2263V04,AU || Page: Branded & 3rd Party || 2764 || Trinity Results Too Fast || 1C || 10/01/2025w02,VIDEO,$259,"7,997",2025-01-10,2025-01-14,4
117,CB_2023_Jul_FB_2217_IB_V04_9x16_VID_EN_Opti_C-Pointing_CTA-SMR_Pain-W-B_M-TRC_VL-30s_TR-None_G-F_P-None_S-FRIGGA,US || Manual Bid || BFCM || ROAS GOAL: 1.4 || 1C || 15/11/24,VIDEO,$259,"9,088",2024-11-15,2025-01-18,64
118,CB_2024_Jan_FB_2764_RS_V04_9x16_VID_EN_Opti_C-SingleTesti_CTA-SALE_Pain-W_M-TRC_VL-45s_TR-None_G-F_P-OG_S-MOON_FB2263V04_Page_Personal_Coach,EU (UK) || 2764 || Trinity Results Too Fast || 1C || 08/01/2025w02,VIDEO,$256,"10,481",2025-01-08,2025-01-15,7
119,CB_2024_Nov_FB_3305_SO-DP_V02_4x5_VID_EN_Opti_C-Sale_CTA-BF_Pain-W_M-Chris_VL-30s_TR-None_G-MF_P-Plan_S-NEW_FB2601V07,CBV2 || AU || ðŸ’° Advantage+ || US || BROAD || 7C || Existing_customer_5% || 19/12/24 Ad set,VIDEO,$249,"8,697",2024-12-19,2025-03-27,98
120,CB_2025_Jan_FB_3656_KB_V04_4x5_IMG_EN_Opti_C-Headline_Sale_CTA-NY_Angle-SC_M-NONE_VL-None_G-NONE_P-OG_S-NONE_FB3573V03,Notion #53 Opti NYNM || Enhancements: OFF || CBV1 || Batch 1 || 1C || 07/01/25w02 || Kostas,SHARE,$248,"8,708",2025-01-07,2025-01-09,2
121,CB_2024_Dec_FB_3601_VK-DP_V09_4x5_VID_EN_Opti_C-Dance_CTA-NY_Pain-W-B_M-JOG_VL-30s_TR-None_G-F_P-OG_S-WHAT_FB3045V01,CBV2 || AU || ðŸ’° Advantage+ || US || BROAD || 7C || Existing_customer_5% || 19/12/24 Ad set,SHARE,$233,"8,524",2025-01-03,2025-03-27,83
122,CB_2023_Jul_FB_2217_IB_V04_9x16_VID_EN_Opti_C-Pointing_CTA-SMR_Pain-W-B_M-TRC_VL-30s_TR-None_G-F_P-None_S-FRIGGA,UK || ASC+ || 7DC || Existing 10% || 13.11.2024 Ad set,VIDEO,$233,"13,099",2024-11-13,2025-01-16,64
123,CB_2025_Jan_FB_3651_SO-JT_V05_4x5_IMG_EN_New_C-NONE_Evergreen_CTA-SALE_Angle-None_M-NONE_VL-None_G-NONE_P-NONE_S-NONE,3651 - NYNM - RIDDLES NOTION #77 || Enhancements: OFF || CBV1 || Batch 2 || 1C || 05/01/25w01 || Kostas,SHARE,$228,"9,242",2025-01-05,2025-01-09,4
124,CB_2025_Jan_FB_3663_CHUB_V02_1x1_VID_EN_New_C-MakingOf_CTA-NONE_Angle-C_M-NONE_VL-30s_TR-None_G-F_P-NONE_S-NONE.mp4,CHUB 25 day challenge vids || Enhancements: OFF || CBV1 || Batch 1 || 1C || 07/01/25w02 || Valentinas,VIDEO,$226,"5,445",2025-01-07,2025-01-11,4
125,CB_2025_Jan_FB_3680_CHUB_V01_4x5_IMG_EN_New_C-NONE_CTA-NONE_Angle-C_M-NONE_VL-None_TR-None_G-NONE_P-NONE_S-NONE,3680 - Looking for 15 people _ Trashy ITR CHUB || Enhancements: OFF || CBV1 || Batch 1 || 1C || 10/01/25w02 || Kostas,SHARE,$223,"8,977",2025-01-10,2025-01-12,2
126,CB_2024_Nov_FB_3264_LZ_V31_4x5_VID_EN_Opti_C-MakingOf_Sale_CTA-BF_Angle-W-B_M-CRAZY_VL-45s_G-M_P-OG_S-NEW_FB3004V02,CBV2 || Advantage+ || Only V1 Ads || US || 5% EXISTING CAP || BROAD || 7C || 30/12/24  Campaign Ad set,VIDEO,$221,"7,405",2024-12-30,2025-01-22,23
127,CB_2024_Dec_FB_3640_DT_V03_4x5_IMG_EN_New_C-GridStyle_Evergreen_CTA-None_Angle-W_M-NONE_VL-None_G-NONE_P-OG_S-NONE_FB3352V13,3640 - 3352 Opti|| Enhancements: OFF || CBV1 || Batch 1 || 1C || 08/01/25w02 || Kostas,SHARE,$210,"8,162",2025-01-08,2025-01-11,3
128,CB_2025_Jan_FB_3680_CHUB_V07_4x5_IMG_EN_New_C-NONE_CTA-NONE_Angle-C_M-NONE_VL-None_TR-None_G-NONE_P-NONE_S-NONE,3680 - Looking for 15 people _ Trashy ITR CHUB || Enhancements: OFF || CBV1 || Batch 2 || 1C || 10/01/25w02 || Kostas,SHARE,$209,"8,086",2025-01-10,2025-01-12,2
129,CB_2023_Aug_FB_2295_MB_V01_1x1_VID_EN_Opti_C-GIF_CTA-CTA_Pain-W-B_M-None_VL-10s_TR-None_G-None_P-None_S-None,CA || COST CAP 91 || 7C || 03/42/24 || V1,VIDEO,$205,"13,818",2024-05-03,2025-01-13,255
130,CB_2025_Jan_FB_3677_LZ-VU_V01_4x5_IMG_EN_New_C-Testimonial_Evergreen_CTA-NONE_Angle-GH_M-NONE_VL-None_G-NONE_P-NONE_S-NONE.png,3677 - luxury reviews ad || Enhancements: OFF || CBV1 || Batch 1 || 1C || 10/01/25w02 || Valentinas,SHARE,$202,"6,928",2025-01-10,2025-01-12,2
131,CB_2025_Jan_FB_3651_SO-JT_V02_4x5_IMG_EN_New_C-NONE_Evergreen_CTA-SALE_Angle-None_M-NONE_VL-None_G-NONE_P-NONE_S-NONE,3651 - NYNM - RIDDLES NOTION #77 || Enhancements: OFF || CBV1 || Batch 2 || 1C || 05/01/25w01 || Kostas,SHARE,$200,"8,872",2025-01-05,2025-01-15,10
132,CB_2024_Oct_PIN_30_KB_V21_2x3_IMG_EN_Opti_C-Benefits_CTA-NONE_Angle-W_M-NONE_VL-None_TR-None_G-NONE_P-OG_S-NONE,US || 3rd party page: Personal Coach Nicole || Static || Batch 3 || 1C || 30/12/24,SHARE,$200,"9,255",2024-12-30,2025-01-06,7
133,CB_2024_Nov_FB_3264_LZ_V31_4x5_VID_EN_Opti_C-MakingOf_Sale_CTA-BF_Angle-W-B_M-CRAZY_VL-45s_G-M_P-OG_S-NEW_FB3004V02,CBV2 || EU (UK) || ðŸ’° Advantage+ || US || BROAD || 7C || Existing_customer_5% || 15/12/24 Ad set,VIDEO,$195,"7,966",2024-12-19,2025-03-27,98
134,CB_2025_Jan_FB_3680_CHUB_V03_9x16_IMG_EN_New_C-NONE_CTA-NONE_Angle-C_M-NONE_VL-None_TR-None_G-NONE_P-NONE_S-NONE,3680 - Looking for 15 people _ Trashy ITR CHUB || Enhancements: OFF || CBV1 || Batch 1 || 1C || 10/01/25w02 || Kostas,SHARE,$192,"5,422",2025-01-10,2025-01-12,2
135,CB_2025_Jan_FB_3685_LZ-JT_V03_4x5_IMG_EN_New_C-NONE_Evergreen_CTA-NONE_Angle-None_M-NONE_VL-None_G-NONE_P-OG_S-NONE.png,US || VSL || Doc batch || Landing: Pre-1(New lead) -> Old lead || 1C || 10/01/25,SHARE,$190,"7,676",2025-01-10,2025-01-12,2
136,CB_2024_Apr_FB_2969_DT-RP_V02_9x16_IMG_EN_New_C-NONE_CTA-NONE_None_M-NONE_VL-None_TR-None_G-NONE_P-OG_S-NONE,ðŸŒ¶ï¸ || US || ASC+ || ->CC141 || VIDEO Only || US+CA || 0% EXISTING CAP || 7C || 07/08.24  Ad set,SHARE,$183,"12,462",2024-08-19,2025-01-24,158
137,CB_2025_Jan_FB_3655_JT_V01_4x5_IMG_EN_New_C-Headline_Seasonal_CTA-70_Angle-W_M-NONE_VL-None_G-NONE_P-OG_S-NONE,3655 - nynm headlines || Enhancements: OFF || CBV1 || Batch 1 || 1C || 07/01/25w02 || Kostas,SHARE,$181,"10,174",2025-01-07,2025-01-12,5
138,CB_2024_Dec_FB_3629_VK-JT_V01_4x5_VID_EN_NEW_C-BulletPoints_Sale_CTA-NY_Angle-W-B-C_M-NONE_VL-None_G-M_P-OG_S-NEW,3629  -  CB - NEGATIVE MARKETING - NYNM - TRAINER 3 || Enhancements: OFF || CBV1 || Batch 1 || 1C || 07/01/25w02 || Kostas,SHARE,$181,"5,798",2025-01-07,2025-01-11,4
139,CB_2025_Jan_FB_3651_SO-JT_V01_4x5_IMG_EN_New_C-NONE_Evergreen_CTA-SALE_Angle-None_M-NONE_VL-None_G-NONE_P-NONE_S-NONE,3651 - NYNM - RIDDLES NOTION #77 || Enhancements: OFF || CBV1 || Batch 2 || 1C || 05/01/25w01 || Kostas,SHARE,$178,"8,678",2025-01-05,2025-01-09,4
140,CB_2025_Jan_FB_3685_LZ-JT_V04_4x5_IMG_EN_New_C-NONE_Evergreen_CTA-NONE_Angle-None_M-NONE_VL-None_G-NONE_P-OG_S-NONE.png,US || VSL || Doc batch || Landing: Pre-1(New lead) -> Old lead || 1C || 10/01/25,SHARE,$177,"6,189",2025-01-10,2025-01-12,2
141,CB_2022_Mar3_FB_713_IK_V04_1x1_IMG_EN_Opti_C-WrittenTesti_HE-98_A-ExtremeBodyVisualization_HK-bodypart_Pain-W_CLR-PURPLE_BG-IMAGE_ME-MIX_MA-YOUNG,US || Manual Bid || BFCM || ROAS GOAL: 1.4 || 1C || 15/11/24,SHARE,$174,"7,551",2024-11-15,2025-02-27,104
142,CB_2025_Jan_FB_3680_CHUB_V08_4x5_IMG_EN_New_C-NONE_CTA-NONE_Angle-C_M-NONE_VL-None_TR-None_G-NONE_P-NONE_S-NONE,3680 - Looking for 15 people _ Trashy ITR CHUB || Enhancements: OFF || CBV1 || Batch 2 || 1C || 10/01/25w02 || Kostas,SHARE,$165,"6,943",2025-01-10,2025-01-13,3
143,CB_2024_Oct_FB_3252_VK-DP_V04_4x5_VID_EN_Opti_C-MakingOf_Evergreen_CTA-SALE_Angle-W-B-C_M-JOG_VL-45s_G-F_P-OG_S-MOON_FB3090V02,UK || ASC+ || 7DC || Existing 10% || 13.11.2024 Ad set,SHARE,$164,"8,834",2024-11-13,2025-01-16,64
144,CB_2025_Jan_FB_3671_LZ-VU_V02_4x5_IMG_EN_New_C-Headline_Evergreen_CTA-NONE_Angle-W_M-NONE_VL-None_G-NONE_P-NONE_S-NONE_FB3306V02,EU (UK) || 3671 - anti inflammatory diet opti || 1C || 08/01/2025w02,SHARE,$162,"5,406",2025-01-08,2025-01-16,8
145,CB_2024_Dec_FB_3601_VK-DP_V09_4x5_VID_EN_Opti_C-Dance_CTA-NY_Pain-W-B_M-JOG_VL-30s_TR-None_G-F_P-OG_S-WHAT_FB3045V01,CBV2 || NZ || ðŸ’° Advantage+ || US || BROAD || 7C || Existing_customer_5% || 19/12/24 Campaign Ad set,VIDEO,$160,"9,218",2024-12-27,2025-01-11,15
146,CB_2024_Oct_FB_3296_SO_V02_1x1_IMG_EN_New_C-Sale_Sale_CTA-BF_Angle-None_M-NONE_VL-None_G-NONE_P-OG_S-NONE_FB3259V02,ASC+ || MIX || Value Optimization || US || 0% EXISTING CAP || 1C || 22.12.24  Ad set,SHARE,$157,"5,895",2024-12-22,2025-01-06,15
147,CB_2024_Dec_FB_3666_VK-JT_V02_4x5_VID_EN_Opti_C-BulletPoints_Sale_CTA-NY_Angle-W-B-C_M-TRC_VL-30s_G-F_P-OG_S-FRIGGA,3666 - looksmaxing trend || Enhancements: OFF || CBV1 || Batch 1 || 1C || 07/01/25w02 || Kostas,SHARE,$155,"5,059",2025-01-07,2025-01-30,23
148,CB_2025_Jan_FB_3677_LZ-VU_V02_4x5_IMG_EN_New_C-Testimonial_Evergreen_CTA-NONE_Angle-GH_M-NONE_VL-None_G-NONE_P-NONE_S-NONE.png,3677 - luxury reviews ad || Enhancements: OFF || CBV1 || Batch 1 || 1C || 10/01/25w02 || Valentinas,SHARE,$155,"5,116",2025-01-10,2025-01-15,5
149,CB_2025_Jan_FB_3677_LZ-VU_V03_4x5_IMG_EN_New_C-Testimonial_Evergreen_CTA-NONE_Angle-GH_M-NONE_VL-None_G-NONE_P-NONE_S-NONE.png,3677 - luxury reviews ad || Enhancements: OFF || CBV1 || Batch 1 || 1C || 10/01/25w02 || Valentinas,SHARE,$155,"6,121",2025-01-10,2025-01-15,5
150,CB_2024_Aug_FB_3090_DT-DP_V02_9x16_VID_EN_Opti_C-MakingOf_CTA-CTA_Pain-W-B-C_M-POW_VL-45s_TR-None_G-M_P-OG_S-Moon_FB3029V04,CBV2 || NZ || ðŸ’° Advantage+ || US || BROAD || 7C || Existing_customer_5% || 19/12/24 Campaign Ad set,SHARE,$154,"10,451",2024-12-19,2025-01-11,23
151,CB_2023_Dec_FB_2712_RS-DP_V02_1x1_VID_EN_Opti_C-WrittenTesti_CTA-SALE_Pain-W-B-C_M-NONE_VL-None_TR-None_G-NONE_P-V2_S-NONE_FB2227V08,Pricing Test || EU (UK) || 1C || Standard Price || 07/01/25,SHARE,$152,"6,022",2025-01-07,2025-01-15,8
152,CB_2024_Oct_PIN_30_KB_V18_2x3_IMG_EN_Opti_C-Benefits_CTA-NONE_Angle-W_M-NONE_VL-None_TR-None_G-NONE_P-OG_S-NONE,US || 3rd party page: Personal Coach Nicole || Static || Batch 3 || 1C || 30/12/24,SHARE,$151,"8,713",2024-12-30,2025-01-06,7
153,CB_2023_May_FB_2144_MB_V02_9x16_VID_EN_Opti_C-Sale_CTA-SMR_Pain-W_M-JOG_VL-30s_TR-None_G-M-F_P-None_S-What,CA || COST CAP 92->93 || 7C || 10/05/24 || V1,VIDEO,$148,"8,799",2024-05-10,2025-02-27,293
154,CB_2025_Jan_FB_3693_LZ-JG_V01_4x5_IMG_EN_Opti_C-Headline_Evergreen_CTA-NONE_Angle-W_M-NONE_VL-None_G-NONE_P-NONE_S-NONE_FB3639V03,3693 - 3639 opti quitters_ day || Enhancements: OFF || CBV1 || Batch 2 || 1C || 10/01/25w02 || Kostas,SHARE,$146,"7,058",2025-01-10,2025-01-15,5
155,CB_2024_Sep_FB_3175_DA-KB_V02_1x1_IMG_EN_New_C-ADVRT_Evergreen_CTA-NONE_Angle-W_M-NONE_VL-None_G-NONE_P-CBV2_S-NONE_blog_colonbroomvsmammoth_cv_en,CBV2 || A/B Pricing: Standard || 3175 - CB vs Happy Mammoth advertorial || BROAD || 1C ||  22/11/24 || Kostas,SHARE,$144,"6,237",2024-12-22,2025-01-13,22
156,CB_2024_Dec_FB_3582_LZ-KB_V11_4x5_IMG_EN_New_C-Headline_Evergreen_CTA-NONE_Angle-ADVTR_M-NONE_VL-None_G-NONE_P-NONE_S-NONE,CBV2 || LP:HI 3582 - secret behind the label advertorial ads || Batch 3 || BROAD || 1C ||  03/01/25 || Kostas,SHARE,$143,"1,809",2025-01-03,2025-01-06,3
157,CB_2025_Jan_FB_3651_SO-JT_V04_4x5_IMG_EN_New_C-NONE_Evergreen_CTA-SALE_Angle-None_M-NONE_VL-None_G-NONE_P-NONE_S-NONE,3651 - NYNM - RIDDLES NOTION #77 || Enhancements: OFF || CBV1 || Batch 2 || 1C || 05/01/25w01 || Kostas,SHARE,$142,"6,146",2025-01-05,2025-01-15,10
158,CB_2025_Jan_FB_3663_CHUB_V01_1x1_VID_EN_New_C-MakingOf_CTA-NONE_Angle-C_M-NONE_VL-30s_TR-None_G-M_P-NONE_S-NONE.mp4,CHUB 25 day challenge vids || Enhancements: OFF || CBV1 || Batch 1 || 1C || 07/01/25w02 || Valentinas,VIDEO,$142,"2,277",2025-01-07,2025-01-09,2
159,CB_2024_Feb_FB_2834_DA_V02_4x5_IMG_EN_Opti_C-SingleTesti_CTA-NONE_Pain-W_M-NONE_VL-None_TR-None_G-NONE_P-V2_S-NONE_FB2759V04,CBV2 || AU || ðŸ’° Advantage+ || US || BROAD || 7C || Existing_customer_5% || 19/12/24 Ad set,SHARE,$138,"5,427",2024-12-19,2025-03-27,98
160,CB_2025_Jan_FB_3656_KB_V03_4x5_IMG_EN_Opti_C-Headline_Sale_CTA-NY_Angle-SC_M-NONE_VL-None_G-NONE_P-OG_S-NONE_FB3573V03.png,AU || 3rd party page || Notion #53 Opti NYNM || 1C || 08/01/2025w02,SHARE,$137,"4,607",2025-01-10,2025-01-11,1
161,CB_2024_Jan_FB_2764_RS_V04_9x16_VID_EN_Opti_C-SingleTesti_CTA-SALE_Pain-W_M-TRC_VL-45s_TR-None_G-F_P-OG_S-MOON_FB2263V04_Page_Personal_Coach,AU || Page: Branded & 3rd Party || 2764 || Trinity Results Too Fast || 1C || 10/01/2025w02,VIDEO,$136,"3,840",2025-01-10,2025-03-27,76
162,CB_2023_May_FB_1999_LV_V01_9x16_VID_EN_New_C-Pointing_CTA-DISCOUNT_Pain-W_M-JOG_VL-30s_TR-None,ASC+ || MIX || Value Optimization || US || 0% EXISTING CAP || 1C || 22.12.24  Ad set,VIDEO,$135,"3,498",2024-12-22,2025-01-06,15
163,CB_2024_Dec_FB_3584_VK-DP_V01_4x5_VID_EN_New_C-BulletPoints_Sale_CTA-SALE_Angle-W-B-C_M-NONE_VL-30s_G-M_P-OG_S-WHAT,ðŸŒ¶ï¸ || US || ASC+ || ->CC141 || VIDEO Only || US+CA || 0% EXISTING CAP || 7C || 07/08.24  Ad set,VIDEO,$133,"5,212",2025-01-06,2025-01-24,18
164,CB_2025_Jan_FB_3680_CHUB_V06_4x5_IMG_EN_New_C-NONE_CTA-NONE_Angle-C_M-NONE_VL-None_TR-None_G-NONE_P-NONE_S-NONE,3680 - Looking for 15 people _ Trashy ITR CHUB || Enhancements: OFF || CBV1 || Batch 2 || 1C || 10/01/25w02 || Kostas,SHARE,$130,"9,834",2025-01-10,2025-01-13,3
165,CB_2024_Nov_FB_3580_SO-KB_V02_4x5_IMG_EN_New_C-BulletPoints_Evergreen_CTA-NONE_Angle-W_M-NONE_VL-None_G-NONE_P-NONE_S-NONE_FB3580,3635 - 3580 #12 Donâ€™t make it harder Opti || Enhancements: OFF || CBV1 || Batch 1 || 1C || 08/01/25w02 || Kostas,SHARE,$130,"4,904",2025-01-08,2025-01-10,2
166,CB_2023_Jul_FB_2217_IB_V04_9x16_VID_EN_Opti_C-Pointing_CTA-SMR_Pain-W-B_M-TRC_VL-30s_TR-None_G-F_P-None_S-FRIGGA - Copy 2,View Content || BROAD || 7C || 17/12/24,VIDEO,$128,"16,649",2024-12-17,2025-01-20,34
167,CB_2024_Oct_FB_3182_ZS-GC_V13_1x1_IMG_EN_New_C-UsVsThem_Evergreen_CTA-NONE_Angle-B-C_M-NONE_VL-None_G-NONE_P-OG_S-NONE,CBV2 || AU || ðŸ’° Advantage+ || US || BROAD || 7C || Existing_customer_5% || 19/12/24 Ad set,SHARE,$128,"5,451",2024-12-19,2025-03-27,98
168,CB_2024_Sep_FB_3175_DA-KB_V02_1x1_IMG_EN_New_C-ADVRT_Evergreen_CTA-NONE_Angle-W_M-NONE_VL-None_G-NONE_P-CBV2_S-NONE_blog_colonbroomvsmammoth_cv_en,CBV2 || A/B Pricing: increased price || 3175 - CB vs Happy Mammoth advertorial || BROAD || 1C ||  22/11/24 || Kostas,SHARE,$128,"5,643",2024-12-22,2025-01-22,31
169,CB_2025_Jan_FB_3657_SO-JT_V01_4x5_VID_EN_New_C-NONE_Evergreen_CTA-NY_Angle-W_M-NONE_VL-15s_G-NONE_P-NONE_S-SadClown,3657 - CB - TOO LATE  Notion idea #62 - NYNM 2 || Enhancements: OFF || CBV1 || Batch 1 || 1C || 07/01/25w02 || Kostas,SHARE,$120,"3,295",2025-01-07,2025-01-12,5
170,CB_2025_Jan_FB_3671_LZ-VU_V03_4x5_IMG_EN_New_C-Headline_Evergreen_CTA-NONE_Angle-W_M-NONE_VL-None_G-NONE_P-NONE_S-NONE_FB3306V03,EU (UK) || 3671 - anti inflammatory diet opti || 1C || 08/01/2025w02,SHARE,$120,"5,053",2025-01-08,2025-01-15,7
171,CB_2023_Oct_FB_2516_VK_V13_9x16_VID_EN_Opti_C-Benefits_CTA-AUTUM_Pain-W-B_M-PASQ_VL-30s_TR-None_G-M_P-Plan_S-WHAT,ðŸ’°WC || US || Advantage+ || BIG BUDGET || CC101->105->109->112->114-116->117 || BROAD || ABO || 1C || 17/01/24 RELAUNCHED Ad set,VIDEO,$118,"4,320",2024-01-17,2025-02-06,386
172,CB_2024_Dec_FB_3619_VK-JT_V02_4x5_VID_EN_New_C-BulletPoints_Sale_CTA-NY_Angle-W-B-C_M-NONE_VL-None_G-NONE_P-OG_S-NONE - Copy,ASC+ || VIDEO Only || US || 0% EXISTING CAP || 1C || 08.12.24  Ad set,SHARE,$117,"4,166",2024-12-27,2025-01-09,13
173,CB_2025_Jan_FB_3671_LZ-VU_V04_4x5_IMG_EN_New_C-Headline_Evergreen_CTA-NONE_Angle-W_M-NONE_VL-None_G-NONE_P-NONE_S-NONE_FB3306V04,EU (UK) || 3671 - anti inflammatory diet opti || 1C || 08/01/2025w02,SHARE,$116,"4,656",2025-01-08,2025-01-15,7
174,CB_2024_Mar_FB_2888_JG_V03_9x16_IMG_EN_Opti_C-Benefits_CTA-NONE_Pain-W_M-NONE_VL-None_TR-None_G-NONE_P-V2_S-NONE,CBV2 || AU || ðŸ’° Advantage+ || US || BROAD || 7C || Existing_customer_5% || 19/12/24 Ad set,SHARE,$116,"5,376",2024-12-19,2025-03-27,98
175,CB_2025_Jan_FB_3680_CHUB_V05_4x5_IMG_EN_New_C-NONE_CTA-NONE_Angle-C_M-NONE_VL-None_TR-None_G-NONE_P-NONE_S-NONE,3680 - Looking for 15 people _ Trashy ITR CHUB || Enhancements: OFF || CBV1 || Batch 2 || 1C || 10/01/25w02 || Kostas,SHARE,$112,"4,649",2025-01-10,2025-01-15,5
176,CB_2023_Dec_FB_2712_RS-DP_V02_1x1_VID_EN_Opti_C-WrittenTesti_CTA-SALE_Pain-W-B-C_M-NONE_VL-None_TR-None_G-NONE_P-V2_S-NONE_FB2227V08,UK || ASC+ || 7DC || Existing 10% || 13.11.2024 Ad set,SHARE,$112,"4,512",2024-11-13,2025-01-16,64
177,CB_2023_Dec_FB_2712_RS-DP_V02_1x1_VID_EN_Opti_C-WrittenTesti_CTA-SALE_Pain-W-B-C_M-NONE_VL-None_TR-None_G-NONE_P-V2_S-NONE_FB2227V08,Pricing Test || EU (UK) || 1C || Higher Price || 07/01/25,SHARE,$112,"4,501",2025-01-07,2025-01-15,8
178,CB_2025_Jan_FB_3667_SO-JT_V02_4x5_IMG_EN_New_C-NONE_Evergreen_CTA-NY_Angle-W_M-NONE_VL-None_G-NONE_P-NONE_S-NONE,3667 - CB - Notion idea #60 EXCEL - NYNM || Enhancements: OFF || CBV1 || Batch 1 || 1C || 07/01/25w02 || Kostas,SHARE,$111,"6,277",2025-01-07,2025-01-11,4
179,CB_2024_Dec_FB_3640_DT_V02_4x5_IMG_EN_New_C-GridStyle_Evergreen_CTA-None_Angle-W_M-NONE_VL-None_G-NONE_P-OG_S-NONE_FB3352V13,3640 - 3352 Opti|| Enhancements: OFF || CBV1 || Batch 1 || 1C || 08/01/25w02 || Kostas,SHARE,$111,"6,113",2025-01-08,2025-01-11,3
180,CB_2024_Jan_FB_2762_IK_V05_1x1_IMG_EN_New_C-WrittenTesti_CTA-CTA_Pain-W-B-C_M-NONE_VL-None_TR-None_G-NONE_P-V2_S-NONE,CBV2 || NZ || ðŸ’° Advantage+ || US || BROAD || 7C || Existing_customer_5% || 19/12/24 Campaign Ad set,SHARE,$110,"6,401",2024-12-19,2025-01-11,23
181,20230907_094526,AU || 3rd party page: Fitness Coach Nicole || Organic Ads || Batch 1 || 1C || 03/01/2025,SHARE,$108,"7,832",2025-01-03,2025-01-09,6
182,CB_2024_Dec_FB_3616_LZ-JG_V01_4x5_IMG_EN_Opti_C-Headline_Sale_CTA-XMAS_Angle-Cort_M-NONE_VL-None_G-NONE_P-NONE_S-NONE_FB3251V02,ðŸŒ¶ï¸ || US || ASC+ || ->CC141 || VIDEO Only || US+CA || 0% EXISTING CAP || 7C || 07/08.24  Ad set,SHARE,$104,"3,512",2024-12-20,2025-01-24,35
183,CB_2025_Jan_FB_3651_SO-JT_V03_4x5_IMG_EN_New_C-NONE_Evergreen_CTA-SALE_Angle-None_M-NONE_VL-None_G-NONE_P-NONE_S-NONE,ðŸŒ¶ï¸ || US || ASC+ || ->CC141 || VIDEO Only || US+CA || 0% EXISTING CAP || 7C || 07/08.24  Ad set,SHARE,$100,"4,338",2025-01-09,2025-01-24,15
184,CB_2024_Nov_FB_3634_VK_V01_4x5_IMG_EN_OPTI_C-BulletPoints_Sale_CTA-BF70_Angle-W-B-C_M-NONE_VL-None_G-NONE_P-OG_S-NONE_FB3353V09,3634 - 3353 opti || Enhancements: OFF || CBV1 || Batch 1 || 1C || 08/01/25w02 || Kostas,SHARE,$100,"7,379",2025-01-08,2025-01-11,3
185,CB_2024_Feb_FB_2834_DA_V04_4x5_IMG_EN_Opti_C-SingleTesti_CTA-NONE_Pain-W_M-NONE_VL-None_TR-None_G-NONE_P-V2_S-NONE_FB2759V04,CBV2 || AU || ðŸ’° Advantage+ || US || BROAD || 7C || Existing_customer_5% || 19/12/24 Ad set,SHARE,$99,"4,033",2024-12-19,2025-03-27,98
186,CB_2024_Dec_FB_3629_VK-JT_V05_4x5_VID_EN_NEW_C-BulletPoints_Sale_CTA-NY_Angle-W-B-C_M-NONE_VL-None_G-M_P-OG_S-NEW,3629  -  CB - NEGATIVE MARKETING - NYNM - TRAINER 3 || Enhancements: OFF || CBV1 || Batch 1 || 1C || 07/01/25w02 || Kostas,SHARE,$97,"2,516",2025-01-07,2025-01-11,4
187,CB_2024_Oct_FB_3251_LZ-VU_V01_1x1_IMG_EN_New_C-NegativeMark_Evergreen_CTA-NONE_Angle-Cort_M-NONE_VL-None_G-NONE_P-NONE_S-NONE,UK || ASC+ || 7DC || Existing 10% || 13.11.2024 Ad set,SHARE,$93,"2,711",2024-11-13,2025-01-16,64
188,CB_2024_Nov_FB_3305_SO-DP_V02_4x5_VID_EN_Opti_C-Sale_CTA-BF_Pain-W_M-Chris_VL-30s_TR-None_G-MF_P-Plan_S-NEW_FB2601V07,CBV2 || Advantage+ || Only V1 Ads || US || 5% EXISTING CAP || BROAD || 7C || 30/12/24  Campaign Ad set,VIDEO,$93,"2,877",2024-12-30,2025-01-22,23
189,CB_2024_Feb_FB_2834_DA_V02_4x5_IMG_EN_Opti_C-SingleTesti_CTA-NONE_Pain-W_M-NONE_VL-None_TR-None_G-NONE_P-V2_S-NONE_FB2759V04,CBV2 || EU (UK) || ðŸ’° Advantage+ || US || BROAD || 7C || Existing_customer_5% || 15/12/24 Ad set,SHARE,$90,"4,178",2024-12-15,2025-01-31,47
190,CB_2023_Jul_FB_2226_MB_V04_9x16_VID_EN_Opti_C-Testim_CTA-SMR_Pain-W_M-MIX_VL-30s_TR-None_G-F_P-None_S-Starry,CBV2 || Advantage+ || Only V1 Ads || US || 5% EXISTING CAP || BROAD || 7C || 30/12/24  Campaign Ad set,SHARE,$87,"3,380",2024-12-30,2025-01-22,23
191,CB_2024_Dec_FB_3639_CHUB_V02_1x1_IMG_EN_New_C-NONE_CTA-NONE_Angle-W_M-NONE_VL-None_TR-None_G-NONE_P-NONE_S-NONE,ðŸŒ¶ï¸ || US || ASC+ || ->CC141 || VIDEO Only || US+CA || 0% EXISTING CAP || 7C || 07/08.24  Ad set,SHARE,$85,"3,206",2025-01-09,2025-01-24,15
192,CB_2024_Dec_FB_3640_DT_V01_4x5_IMG_EN_New_C-GridStyle_Evergreen_CTA-None_Angle-W_M-NONE_VL-None_G-NONE_P-OG_S-NONE_FB3352V13,3640 - 3352 Opti|| Enhancements: OFF || CBV1 || Batch 1 || 1C || 08/01/25w02 || Kostas,SHARE,$84,"3,543",2025-01-08,2025-01-11,3
193,VCB2.mp4,US || VSL || Aff's video || Landing: Pre-1(New lead) -> Old lead || 1C || 10/01/25,SHARE,$82,"2,285",2025-01-10,2025-01-12,2
194,CB_2025_Jan_FB_3671_LZ-VU_V03_4x5_IMG_EN_New_C-Headline_Evergreen_CTA-NONE_Angle-W_M-NONE_VL-None_G-NONE_P-NONE_S-NONE_FB3306V03,AU || 3rd party page || 3671 - anti inflammatory diet opti || 1C || 10/01/2025w02,SHARE,$82,"3,635",2025-01-10,2025-01-13,3
195,CB_2025_Jan_FB_3657_SO-JT_V03_4x5_VID_EN_New_C-NONE_Evergreen_CTA-NY_Angle-W_M-NONE_VL-15s_G-NONE_P-NONE_S-AngryRobot,3657 - CB - TOO LATE  Notion idea #62 - NYNM 2 || Enhancements: OFF || CBV1 || Batch 1 || 1C || 07/01/25w02 || Kostas,SHARE,$81,"2,730",2025-01-07,2025-01-12,5
196,CB_2025_Jan_FB_3667_SO-JT_V03_4x5_IMG_EN_New_C-NONE_Evergreen_CTA-NY_Angle-W_M-NONE_VL-None_G-NONE_P-NONE_S-NONE,3667 - CB - Notion idea #60 EXCEL - NYNM || Enhancements: OFF || CBV1 || Batch 1 || 1C || 07/01/25w02 || Kostas,SHARE,$79,"4,967",2025-01-07,2025-01-11,4
197,CB_2024_Dec_FB_3601_VK-DP_V09_4x5_VID_EN_Opti_C-Dance_CTA-NY_Pain-W-B_M-JOG_VL-30s_TR-None_G-F_P-OG_S-WHAT_FB3045V01,CBV2 || Advantage+ || Only V1 Ads || US || 5% EXISTING CAP || BROAD || 7C || 30/12/24  Campaign Ad set,VIDEO,$79,"2,088",2024-12-30,2025-01-22,23
198,CB_2024_Dec_FB_3648_DT_V02_16x9_IMG_EN_Opti_C-NONE_Evergreen_CTA-NONE_Angle-None_M-NONE_VL-None_G-NONE_P-OG_S-NONE.png,US || VSL || 3648 - VSL static opti || Landing: Pre-1(New lead) -> Old lead || 1C || 31/12/24,SHARE,$78,"3,235",2024-12-31,2025-01-06,6
199,CB_2024_Nov_FB_3305_SO-DP_V02_4x5_VID_EN_Opti_C-Sale_CTA-BF_Pain-W_M-Chris_VL-30s_TR-None_G-MF_P-Plan_S-NEW_FB2601V07,CBV2 || NZ || ðŸ’° Advantage+ || US || BROAD || 7C || Existing_customer_5% || 19/12/24 Campaign Ad set,VIDEO,$78,"3,710",2024-12-19,2025-01-11,23
200,CB_2024_Oct_FB_3264_LZ_V15_4x5_VID_EN_Opti_C-MakingOf_Sale_CTA-BF_Angle-W-B_M-AGR_VL-30s_G-M_P-OG_S-WHAT_FB3005V02,UK || ASC+ || 7DC || Existing 10% || 13.11.2024 Ad set,SHARE,$78,"3,266",2024-11-13,2025-01-16,64
201,CB_2024_Nov_FB_3264_LZ_V31_4x5_VID_EN_Opti_C-MakingOf_Sale_CTA-BF_Angle-W-B_M-CRAZY_VL-45s_G-M_P-OG_S-NEW_FB3004V02,View Content || BROAD || 7C || 17/12/24,VIDEO,$77,"5,874",2024-12-17,2025-01-20,34
202,CB_2023_Jul_FB_2226_MB_V04_9x16_VID_EN_Opti_C-Testim_CTA-SMR_Pain-W_M-MIX_VL-30s_TR-None_G-F_P-None_S-Starry,UK || ASC+ || 7DC || Existing 10% || 13.11.2024 Ad set,SHARE,$76,"3,575",2024-11-13,2025-01-16,64
203,CB_2024_Dec_FB_3640_DT_V04_4x5_IMG_EN_New_C-GridStyle_Evergreen_CTA-None_Angle-W_M-NONE_VL-None_G-NONE_P-OG_S-NONE_FB3352V13,3640 - 3352 Opti|| Enhancements: OFF || CBV1 || Batch 1 || 1C || 08/01/25w02 || Kostas,SHARE,$76,"2,773",2025-01-08,2025-01-11,3
204,CB_2025_Jan_FB_3656_KB_V03_4x5_IMG_EN_Opti_C-Headline_Sale_CTA-NY_Angle-SC_M-NONE_VL-None_G-NONE_P-OG_S-NONE_FB3573V03.png,EU (UK) || 3rd party page || Notion #53 Opti NYNM || 1C || 08/01/2025w02,SHARE,$74,"3,425",2025-01-08,2025-01-11,3
205,20230907_101401,NZ || 3rd party page: Fitness Coach Nicole || Organic Ads || Batch 1 || 1C || 03/01/2025,SHARE,$74,"5,519",2025-01-03,2025-01-06,3
206,CB_2025_Jan_FB_3685_LZ-JT_V02_4x5_IMG_EN_New_C-NONE_Evergreen_CTA-NONE_Angle-None_M-NONE_VL-None_G-NONE_P-OG_S-NONE.png,US || VSL || Doc batch || Landing: Pre-1(New lead) -> Old lead || 1C || 10/01/25,SHARE,$72,"3,266",2025-01-10,2025-01-12,2
207,CB_2024_Nov_FB_3580_SO-KB_V04_4x5_IMG_EN_New_C-BulletPoints_Evergreen_CTA-NONE_Angle-W_M-NONE_VL-None_G-NONE_P-NONE_S-NONE_FB3580,3635 - 3580 #12 Donâ€™t make it harder Opti || Enhancements: OFF || CBV1 || Batch 1 || 1C || 08/01/25w02 || Kostas,SHARE,$72,"2,344",2025-01-08,2025-01-10,2
208,CB_2024_Dec_FB_3629_VK-JT_V03_4x5_VID_EN_NEW_C-BulletPoints_Sale_CTA-NY_Angle-W-B-C_M-NONE_VL-None_G-M_P-OG_S-NEW,3629  -  CB - NEGATIVE MARKETING - NYNM - TRAINER 3 || Enhancements: OFF || CBV1 || Batch 1 || 1C || 07/01/25w02 || Kostas,SHARE,$71,"1,900",2025-01-07,2025-01-11,4
209,CB_2025_Jan_FB_3680_CHUB_V02_9x16_IMG_EN_New_C-NONE_CTA-NONE_Angle-C_M-NONE_VL-None_TR-None_G-NONE_P-NONE_S-NONE,3680 - Looking for 15 people _ Trashy ITR CHUB || Enhancements: OFF || CBV1 || Batch 1 || 1C || 10/01/25w02 || Kostas,SHARE,$71,"2,728",2025-01-10,2025-01-12,2
210,CB_2024_Dec_FB_3637_CHUB_V02_1x1_IMG_EN_New_C-Headline_CTA-SALE_Angle-W_M-NONE_VL-None_TR-None_G-NONE_P-NONE_S-NONE,3637 CHUB â€“ Hipno Event || Enhancements: OFF || CBV1 || Batch 1 || 1C || 30/12/24w01 || Kostas,SHARE,$70,"1,930",2024-12-30,2025-01-06,7
211,20230907_100759,AU || 3rd party page: Fitness Coach Nicole || Organic Ads || Batch 1 || 1C || 03/01/2025,SHARE,$69,"3,238",2025-01-03,2025-01-09,6
212,CB_2024_Aug_FB_3110_DA_V01_4x5_VID_EN_Opti_C-Dance_CTA-LABOR_Pain-W-B_M-JOG_VL-30s_TR-None_G-F_P-OG_S-WHAT_FB3045V01,ðŸŒ¶ï¸ || US || ASC+ || ->CC141 || VIDEO Only || US+CA || 0% EXISTING CAP || 7C || 07/08.24  Ad set,VIDEO,$69,"1,955",2024-09-02,2025-01-24,144
213,CB_2024_Nov_FB_3634_VK_V04_4x5_IMG_EN_OPTI_C-BulletPoints_Sale_CTA-BF70_Angle-W-B-C_M-NONE_VL-None_G-NONE_P-OG_S-NONE_FB3353V12,3634 - 3353 opti || Enhancements: OFF || CBV1 || Batch 1 || 1C || 08/01/25w02 || Kostas,SHARE,$68,"3,727",2025-01-08,2025-01-11,3
214,CB_2024_Nov_FB_3580_SO-KB_V03_4x5_IMG_EN_New_C-BulletPoints_Evergreen_CTA-NONE_Angle-W_M-NONE_VL-None_G-NONE_P-NONE_S-NONE_FB3580,3635 - 3580 #12 Donâ€™t make it harder Opti || Enhancements: OFF || CBV1 || Batch 1 || 1C || 08/01/25w02 || Kostas,SHARE,$66,"2,241",2025-01-08,2025-01-10,2
215,CB_2025_Jan_FB_3693_LZ-JG_V03_4x5_IMG_EN_Opti_C-Headline_Evergreen_CTA-NONE_Angle-W_M-NONE_VL-None_G-NONE_P-NONE_S-NONE_FB3639V03,3693 - 3639 opti quitters_ day || Enhancements: OFF || CBV1 || Batch 2 || 1C || 10/01/25w02 || Kostas,SHARE,$66,"3,373",2025-01-10,2025-01-12,2
216,CB_2024_Dec_FB_3614_CHUB_V03_9x16_VID_EN_New_C-Headline_CTA-NONE_Angle-W_M-NONE_VL-15s_TR-None_G-NONE_P-NONE_S-NONE,3614 CHUB - Presentation ads || Enhancements: OFF || CBV1 || Batch 2 || 1C || 05/01/25w01 || Kostas,VIDEO,$62,"1,940",2025-01-05,2025-01-09,4
217,CB_2024_Dec_FB_3639_CHUB_V03_1x1_IMG_EN_New_C-NONE_CTA-NONE_Angle-W_M-NONE_VL-None_TR-None_G-NONE_P-NONE_S-NONE,3639 CHUB â€“ Looking 15 people || Enhancements: OFF || CBV1 || Batch 1 || 1C || 30/12/24w01 || Kostas,SHARE,$62,"2,809",2024-12-30,2025-01-06,7
218,CB_2022_Mar3_FB_713_IK_V04_1x1_IMG_EN_Opti_C-WrittenTesti_HE-98_A-ExtremeBodyVisualization_HK-bodypart_Pain-W_CLR-PURPLE_BG-IMAGE_ME-MIX_MA-YOUNG,US || Manual Bid || BFCM || COST CAP 91 || 1C || 15/11/24,SHARE,$60,"3,460",2024-11-15,2025-02-27,104
219,CB_2024_Mar_FB_2888_JG_V03_9x16_IMG_EN_Opti_C-Benefits_CTA-NONE_Pain-W_M-NONE_VL-None_TR-None_G-NONE_P-V2_S-NONE,CBV2 || EU (UK) || ðŸ’° Advantage+ || US || BROAD || 7C || Existing_customer_5% || 15/12/24 Ad set,SHARE,$59,"3,073",2024-12-15,2025-01-31,47
220,CB_2025_Jan_FB_3656_KB_V04_4x5_IMG_EN_Opti_C-Headline_Sale_CTA-NY_Angle-SC_M-NONE_VL-None_G-NONE_P-OG_S-NONE_FB3573V03,AU || 3rd party page || Notion #53 Opti NYNM || 1C || 08/01/2025w02,SHARE,$58,"3,035",2025-01-10,2025-01-11,1
221,CB_2025_Jan_FB_3656_JT_V03_4x5_IMG_EN_New_C-Headline_Seasonal_CTA-70_Angle-W_M-NONE_VL-None_G-NONE_P-OG_S-NONE,3656 - we_re leaving || Enhancements: OFF || CBV1 || Batch 1 || 1C || 07/01/25w02 || Kostas,SHARE,$57,"2,694",2025-01-07,2025-01-16,9
222,CB_2025_Jan_FB_3671_LZ-VU_V04_4x5_IMG_EN_New_C-Headline_Evergreen_CTA-NONE_Angle-W_M-NONE_VL-None_G-NONE_P-NONE_S-NONE_FB3306V04,AU || 3671 - anti inflammatory diet opti || 1C || 10/01/2025w02,SHARE,$56,"1,926",2025-01-10,2025-01-13,3
223,CB_2024_Nov_FB_3264_LZ_V31_4x5_VID_EN_Opti_C-MakingOf_Sale_CTA-BF_Angle-W-B_M-CRAZY_VL-45s_G-M_P-OG_S-NEW_FB3004V02,Pricing Test || EU (UK) || 1C || Standard Price || 07/01/25,VIDEO,$56,"2,016",2025-01-07,2025-01-15,8
224,CB_2024_Nov_FB_3264_LZ_V31_4x5_VID_EN_Opti_C-MakingOf_Sale_CTA-BF_Angle-W-B_M-CRAZY_VL-45s_G-M_P-OG_S-NEW_FB3004V02,CBV2 || NZ || ðŸ’° Advantage+ || US || BROAD || 7C || Existing_customer_5% || 19/12/24 Campaign Ad set,VIDEO,$56,"2,874",2024-12-19,2025-01-11,23
225,CB_2024_Mar_FB_2853_DT-RP_V02_9x16_IMG_EN_New_C-NONE_CTA-CTA_None_M-NONE_VL-None_TR-None_G-NONE_P-V2_S-NONE.png,UK || ASC+ || CBV2 || 7DC || Existing 10% || 13.11.2024 Ad set,SHARE,$56,"2,051",2024-11-13,2025-01-16,64
226,CB_2024_Nov_FB_3264_LZ_V31_4x5_VID_EN_Opti_C-MakingOf_Sale_CTA-BF_Angle-W-B_M-CRAZY_VL-45s_G-M_P-OG_S-NEW_FB3004V02,ASC+ || MIX || Value Optimization || US || 0% EXISTING CAP || 1C || 22.12.24  Ad set,VIDEO,$55,"1,124",2024-12-22,2025-01-06,15
227,CB_2024_Oct_FB_3182_ZS-GC_V13_1x1_IMG_EN_New_C-UsVsThem_Evergreen_CTA-NONE_Angle-B-C_M-NONE_VL-None_G-NONE_P-OG_S-NONE,CBV2 || NZ || ðŸ’° Advantage+ || US || BROAD || 7C || Existing_customer_5% || 19/12/24 Campaign Ad set,SHARE,$54,"3,190",2024-12-19,2025-01-11,23
228,CB_2024_Mar_FB_2888_JG_V02_9x16_IMG_EN_Opti_C-Benefits_CTA-NONE_Pain-W_M-NONE_VL-None_TR-None_G-NONE_P-V2_S-NONE,CBV2 || EU (UK) || ðŸ’° Advantage+ || US || BROAD || 7C || Existing_customer_5% || 15/12/24 Ad set,SHARE,$53,"2,889",2024-12-15,2025-01-31,47
229,CB_2025_Jan_FB_3686_LZ-KB_V06_4x5_IMG_EN_New_C-Headline_Evergreen_CTA-NONE_Angle-ADVTR_M-NONE_VL-None_G-NONE_P-NONE_S-NONE_FB3582V11,CBV2 || LP:HI 3686 - advertorial 3582v11 opti - secret behind the label advertorial ads || Batch 5 || BROAD || 1C ||  10/01/25 || Kostas,SHARE,$51,"2,043",2025-01-10,2025-01-13,3
230,CB_2024_Mar_FB_2888_JG_V01_9x16_IMG_EN_Opti_C-Benefits_CTA-NONE_Pain-W_M-NONE_VL-None_TR-None_G-NONE_P-V2_S-NONE,CBV2 || AU || ðŸ’° Advantage+ || US || BROAD || 7C || Existing_customer_5% || 19/12/24 Ad set,SHARE,$51,"1,658",2024-12-19,2025-03-27,98
231,CB_2024_Feb_FB_2834_DA_V04_4x5_IMG_EN_Opti_C-SingleTesti_CTA-NONE_Pain-W_M-NONE_VL-None_TR-None_G-NONE_P-V2_S-NONE_FB2759V04,CBV2 || NZ || ðŸ’° Advantage+ || US || BROAD || 7C || Existing_customer_5% || 19/12/24 Campaign Ad set,SHARE,$50,"2,774",2024-12-19,2025-01-11,23
232,CB_2025_Jan_FB_3693_LZ-JG_V05_4x5_IMG_EN_Opti_C-Headline_Evergreen_CTA-NONE_Angle-W_M-NONE_VL-None_G-NONE_P-NONE_S-NONE_FB3639V03,3693 - 3639 opti quitters_ day || Enhancements: OFF || CBV1 || Batch 2 || 1C || 10/01/25w02 || Kostas,SHARE,$50,"2,590",2025-01-10,2025-01-15,5
233,CB_2025_Jan_FB_3662_CHUB_V03_1x1_IMG_EN_New_C-NONE_CTA-NONE_Angle-C_M-NONE_VL-None_TR-None_G-NONE_P-NONE_S-NONE.jpg,3662 - Hipno event ITR CHUB || Enhancements: OFF || CBV1 || Batch 1 || 1C || 10/01/25w02 || Valentinas,SHARE,$49,"1,596",2025-01-10,2025-01-15,5
234,CB_2025_Jan_FB_3686_LZ-KB_V04_4x5_IMG_EN_New_C-Headline_Evergreen_CTA-NONE_Angle-ADVTR_M-NONE_VL-None_G-NONE_P-NONE_S-NONE_FB3582V11,CBV2 || LP:HI 3686 - advertorial 3582v11 opti - secret behind the label advertorial ads || Batch 4 || BROAD || 1C ||  10/01/25 || Kostas,SHARE,$48,737,2025-01-10,2025-01-13,3
235,CB_2024_Jan_FB_2717_MB-RP_V26_9x16_VID_EN_New_C-Buzz_CTA-SALE_Pain-W-B-C_M-MIX_VL-45s_TR-None_G-MF_P-Method_S-NONE,CA || COST CAP 92->93 || 7C || 10/05/24 || V1,VIDEO,$47,"2,756",2024-08-22,2025-02-27,189
236,20230907_101759,NZ || 3rd party page: Fitness Coach Nicole || Organic Ads || Batch 1 || 1C || 03/01/2025,SHARE,$46,"2,090",2025-01-03,2025-01-06,3
237,CB_2024_Aug_FB_3090_DT-DP_V02_9x16_VID_EN_Opti_C-MakingOf_CTA-CTA_Pain-W-B-C_M-POW_VL-45s_TR-None_G-M_P-OG_S-Moon_FB3029V04,Pricing Test || EU (UK) || 1C || Higher Price || 07/01/25,SHARE,$45,"1,803",2025-01-07,2025-01-15,8
238,CB_2024_Aug_FB_3090_DT-DP_V02_9x16_VID_EN_Opti_C-MakingOf_CTA-CTA_Pain-W-B-C_M-POW_VL-45s_TR-None_G-M_P-OG_S-Moon_FB3029V04,Pricing Test || EU (UK) || 1C || Standard Price || 07/01/25,SHARE,$44,"1,973",2025-01-07,2025-01-15,8
239,CB_2024_Dec_FB_3658_LZ-VU_V03_4x5_IMG_EN_New_C-BeforeAfter_Evergreen_CTA-NONE_Angle-W_M-NONE_VL-None_G-NONE_P-OG_S-NONE,3658 - ridge inspired humorous ads marmot || Enhancements: OFF || CBV1 || Batch 1 || 1C || 05/01/25w01 || Kostas,SHARE,$43,"2,251",2025-01-05,2025-01-09,4
240,CB_2024_Mar_FB_2888_JG_V03_9x16_IMG_EN_Opti_C-Benefits_CTA-NONE_Pain-W_M-NONE_VL-None_TR-None_G-NONE_P-V2_S-NONE,CBV2 || NZ || ðŸ’° Advantage+ || US || BROAD || 7C || Existing_customer_5% || 19/12/24 Campaign Ad set,SHARE,$42,"2,425",2024-12-19,2025-01-11,23
241,CB_2025_Jan_FB_3693_LZ-JG_V01_4x5_IMG_EN_Opti_C-Headline_Evergreen_CTA-NONE_Angle-W_M-NONE_VL-None_G-NONE_P-NONE_S-NONE_FB3639V03,3693 - 3639 opti quitters_ day || Enhancements: OFF || CBV1 || Batch 2 || 1C || 10/01/25w02 || Kostas,SHARE,$42,"1,799",2025-01-10,2025-01-12,2
242,CB_2024_Nov_FB_3634_VK_V03_4x5_IMG_EN_OPTI_C-BulletPoints_Sale_CTA-BF70_Angle-W-B-C_M-NONE_VL-None_G-NONE_P-OG_S-NONE_FB3353V11,3634 - 3353 opti || Enhancements: OFF || CBV1 || Batch 1 || 1C || 08/01/25w02 || Kostas,SHARE,$42,"2,416",2025-01-08,2025-01-11,3
243,CB_2025_Jan_FB_3656_KB_V03_4x5_IMG_EN_Opti_C-Headline_Sale_CTA-NY_Angle-SC_M-NONE_VL-None_G-NONE_P-OG_S-NONE_FB3573V03,Notion #53 Opti NYNM || Enhancements: OFF || CBV1 || Batch 1 || 1C || 07/01/25w02 || Kostas,SHARE,$41,"1,885",2025-01-07,2025-01-09,2
244,CB_2024_Mar_FB_2888_JG_V02_9x16_IMG_EN_Opti_C-Benefits_CTA-NONE_Pain-W_M-NONE_VL-None_TR-None_G-NONE_P-V2_S-NONE,CBV2 || AU || ðŸ’° Advantage+ || US || BROAD || 7C || Existing_customer_5% || 19/12/24 Ad set,SHARE,$41,"2,065",2024-12-19,2025-03-27,98
245,CB_2024_Oct_FB_3182_ZS-GC_V13_1x1_IMG_EN_New_C-UsVsThem_Evergreen_CTA-NONE_Angle-B-C_M-NONE_VL-None_G-NONE_P-OG_S-NONE,CBV2 || EU (UK) || ðŸ’° Advantage+ || US || BROAD || 7C || Existing_customer_5% || 15/12/24 Ad set,SHARE,$41,"1,939",2024-12-15,2025-01-31,47
246,CB_2024_Dec_FB_3637_CHUB_V01_1x1_IMG_EN_New_C-Headline_CTA-SALE_Angle-W_M-NONE_VL-None_TR-None_G-NONE_P-NONE_S-NONE,3637 CHUB â€“ Hipno Event || Enhancements: OFF || CBV1 || Batch 1 || 1C || 30/12/24w01 || Kostas,SHARE,$40,"1,191",2024-12-30,2025-01-06,7
247,CB_2025_Jan_FB_3656_KB_V01_4x5_IMG_EN_Opti_C-Headline_Sale_CTA-NY_Angle-SC_M-NONE_VL-None_G-NONE_P-OG_S-NONE_FB3573V03,EU (UK) || 3rd party page || Notion #53 Opti NYNM || 1C || 08/01/2025w02,SHARE,$39,"1,800",2025-01-08,2025-01-11,3
248,CB_2024_Nov_FB_3264_LZ_V31_4x5_VID_EN_Opti_C-MakingOf_Sale_CTA-BF_Angle-W-B_M-CRAZY_VL-45s_G-M_P-OG_S-NEW_FB3004V02 -,Pricing Test || EU (UK) || 1C || Higher Price || 07/01/25,VIDEO,$39,"1,570",2025-01-07,2025-01-15,8
249,CB_2025_Jan_FB_3656_KB_V01_4x5_IMG_EN_Opti_C-Headline_Sale_CTA-NY_Angle-SC_M-NONE_VL-None_G-NONE_P-OG_S-NONE_FB3573V03,EU (UK) || Notion #53 Opti NYNM || 1C || 08/01/2025w02,SHARE,$38,"1,522",2025-01-08,2025-01-11,3
250,CB_2025_Jan_FB_3651_SO-JT_V07_4x5_IMG_EN_New_C-NONE_Evergreen_CTA-SALE_Angle-None_M-NONE_VL-None_G-NONE_P-NONE_S-NONE,3651 - NYNM - RIDDLES NOTION #77 || Enhancements: OFF || CBV1 || Batch 2 || 1C || 05/01/25w01 || Kostas,SHARE,$38,"2,205",2025-01-05,2025-01-09,4
251,CB_2024_Feb_FB_2834_DA_V02_4x5_IMG_EN_Opti_C-SingleTesti_CTA-NONE_Pain-W_M-NONE_VL-None_TR-None_G-NONE_P-V2_S-NONE_FB2759V04,CBV2 || NZ || ðŸ’° Advantage+ || US || BROAD || 7C || Existing_customer_5% || 19/12/24 Campaign Ad set,SHARE,$38,"2,532",2024-12-19,2025-01-11,23
252,CB_2023_May_FB_2144_MB_V02_9x16_VID_EN_Opti_C-Sale_CTA-SMR_Pain-W_M-JOG_VL-30s_TR-None_G-M-F_P-None_S-What,CA || COST CAP 91 || 7C || 03/42/24 || V1,VIDEO,$38,"2,744",2024-05-03,2025-01-13,255
253,CB_2025_Jan_FB_3662_CHUB_V02_1x1_IMG_EN_New_C-NONE_CTA-NONE_Angle-C_M-NONE_VL-None_TR-None_G-NONE_P-NONE_S-NONE.jpg,3662 - Hipno event ITR CHUB || Enhancements: OFF || CBV1 || Batch 1 || 1C || 10/01/25w02 || Valentinas,SHARE,$36,"1,398",2025-01-10,2025-01-15,5
254,CB_2024_Nov_FB_3580_SO-KB_V01_4x5_IMG_EN_New_C-BulletPoints_Evergreen_CTA-NONE_Angle-W_M-NONE_VL-None_G-NONE_P-NONE_S-NONE_FB3580,3635 - 3580 #12 Donâ€™t make it harder Opti || Enhancements: OFF || CBV1 || Batch 1 || 1C || 08/01/25w02 || Kostas,SHARE,$35,"1,155",2025-01-08,2025-01-10,2
255,CB_2024_Oct_FB_3251_LZ-VU_V01_1x1_IMG_EN_New_C-NegativeMark_Evergreen_CTA-NONE_Angle-Cort_M-NONE_VL-None_G-NONE_P-NONE_S-NONE.png,US || Manual Bid || BFCM || ROAS GOAL: 1.4 || 1C || 15/11/24,SHARE,$34,"1,095",2024-11-15,2025-02-27,104
256,CB_2025_Jan_FB_3693_LZ-JG_V06_4x5_IMG_EN_Opti_C-Headline_Evergreen_CTA-NONE_Angle-W_M-NONE_VL-None_G-NONE_P-NONE_S-NONE_FB3639V03,3693 - 3639 opti quitters_ day || Enhancements: OFF || CBV1 || Batch 2 || 1C || 10/01/25w02 || Kostas,SHARE,$34,"1,989",2025-01-10,2025-01-15,5
257,CB_2025_Jan_FB_3657_SO-JT_V02_4x5_VID_EN_New_C-NONE_Evergreen_CTA-NY_Angle-W_M-NONE_VL-15s_G-NONE_P-NONE_S-AngryRobot,3657 - CB - TOO LATE  Notion idea #62 - NYNM 2 || Enhancements: OFF || CBV1 || Batch 1 || 1C || 07/01/25w02 || Kostas,SHARE,$34,"1,345",2025-01-07,2025-01-12,5
258,CB_2024_Dec_FB_3614_CHUB_V01_9x16_VID_EN_New_C-Headline_CTA-NONE_Angle-W_M-NONE_VL-15s_TR-None_G-NONE_P-NONE_S-NONE,3614 CHUB - Presentation ads || Enhancements: OFF || CBV1 || Batch 2 || 1C || 05/01/25w01 || Kostas,VIDEO,$33,624,2025-01-05,2025-01-09,4
259,CB_2024_Dec_FB_3601_VK-DP_V09_4x5_VID_EN_Opti_C-Dance_CTA-NY_Pain-W-B_M-JOG_VL-30s_TR-None_G-F_P-OG_S-WHAT_FB3045V01 - Copy,ðŸ’°WC || US || Advantage+ || BIG BUDGET || CC101->105->109->112->114-116->117 || BROAD || ABO || 1C || 17/01/24 RELAUNCHED Ad set,VIDEO,$32,800,2024-12-27,2025-02-06,41
260,CB_2024_Dec_FB_3666_VK-JT_V04_4x5_VID_EN_Opti_C-BulletPoints_Sale_CTA-NY_Angle-W-B-C_M-TRC_VL-30s_G-F_P-OG_S-NEW,3666 - looksmaxing trend || Enhancements: OFF || CBV1 || Batch 1 || 1C || 07/01/25w02 || Kostas,SHARE,$31,"1,246",2025-01-07,2025-01-30,23
261,CB_2023_Jul_FB_2217_IB_V04_9x16_VID_EN_Opti_C-Pointing_CTA-SMR_Pain-W-B_M-TRC_VL-30s_TR-None_G-F_P-None_S-FRIGGA,US || Manual Bid || BFCM || COST CAP 91 || 1C || 15/11/24,VIDEO,$29,913,2024-11-15,2025-02-27,104
262,CB_2023_May_FB_2103_MB_V02_9x16_VID_EN_Opti_C-Sale_CTA-SMR_Pain-W_M-JOG_VL-30s_TR-None_G-M-F_P-None_S-What,US || Manual Bid || BFCM || COST CAP 91 || 1C || 15/11/24,VIDEO,$29,"2,236",2024-11-15,2025-02-27,104
263,CB_2025_Jan_FB_3680_CHUB_V04_4x5_IMG_EN_New_C-NONE_CTA-NONE_Angle-C_M-NONE_VL-None_TR-None_G-NONE_P-NONE_S-NONE,3680 - Looking for 15 people _ Trashy ITR CHUB || Enhancements: OFF || CBV1 || Batch 1 || 1C || 10/01/25w02 || Kostas,SHARE,$29,"1,542",2025-01-10,2025-01-12,2
264,CB_2023_May_FB_2103_MB_V02_9x16_VID_EN_Opti_C-Sale_CTA-SMR_Pain-W_M-JOG_VL-30s_TR-None_G-M-F_P-None_S-What,US || Manual Bid || BFCM || ROAS GOAL: 1.4 || 1C || 15/11/24,VIDEO,$28,806,2024-11-15,2025-02-27,104
265,CB_2024_Feb_FB_2834_DA_V04_4x5_IMG_EN_Opti_C-SingleTesti_CTA-NONE_Pain-W_M-NONE_VL-None_TR-None_G-NONE_P-V2_S-NONE_FB2759V04,CBV2 || EU (UK) || ðŸ’° Advantage+ || US || BROAD || 7C || Existing_customer_5% || 15/12/24 Ad set,SHARE,$28,"1,248",2024-12-15,2025-01-31,47
266,CB_2024_Mar_FB_2888_JG_V02_9x16_IMG_EN_Opti_C-Benefits_CTA-NONE_Pain-W_M-NONE_VL-None_TR-None_G-NONE_P-V2_S-NONE,CBV2 || NZ || ðŸ’° Advantage+ || US || BROAD || 7C || Existing_customer_5% || 19/12/24 Campaign Ad set,SHARE,$28,"2,220",2024-12-19,2025-01-11,23
267,CB_2023_Jul_FB_2226_MB_V04_9x16_VID_EN_Opti_C-Testim_CTA-SMR_Pain-W_M-MIX_VL-30s_TR-None_G-F_P-None_S-Starry,ASC+ || MIX || Value Optimization || US || 0% EXISTING CAP || 1C || 22.12.24  Ad set,VIDEO,$28,687,2024-12-22,2025-01-06,15
268,CB_2025_Jan_FB_3671_LZ-VU_V03_4x5_IMG_EN_New_C-Headline_Evergreen_CTA-NONE_Angle-W_M-NONE_VL-None_G-NONE_P-NONE_S-NONE_FB3306V03,AU || 3671 - anti inflammatory diet opti || 1C || 10/01/2025w02,SHARE,$27,988,2025-01-10,2025-01-13,3
269,CB_2024_Dec_FB_3601_VK-DP_V09_4x5_VID_EN_Opti_C-Dance_CTA-NY_Pain-W-B_M-JOG_VL-30s_TR-None_G-F_P-OG_S-WHAT_FB3045V01 - Copy,ASC+ || MIX || Value Optimization || US || 0% EXISTING CAP || 1C || 22.12.24  Ad set,VIDEO,$26,327,2024-12-27,2025-01-06,10
270,CB_2024_Dec_FB_3658_LZ-VU_V04_4x5_IMG_EN_New_C-BeforeAfter_Evergreen_CTA-NONE_Angle-W_M-NONE_VL-None_G-NONE_P-OG_S-NONE,3658 - ridge inspired humorous ads marmot || Enhancements: OFF || CBV1 || Batch 1 || 1C || 05/01/25w01 || Kostas,SHARE,$26,"1,297",2025-01-05,2025-01-09,4
271,CB_2022_Nov_FB_1218_RS_V15_9x16_IMG_EN_Opti_C-Sale_CTA-BLACK_Pain-W_M-NONE_VL-None FB1671V08,US || Manual Bid || BFCM || ROAS GOAL: 1.4 || 1C || 15/11/24,SHARE,$26,742,2024-11-15,2025-02-27,104
272,CB_2025_Jan_FB_3656_KB_V03_4x5_IMG_EN_Opti_C-Headline_Sale_CTA-NY_Angle-SC_M-NONE_VL-None_G-NONE_P-OG_S-NONE_FB3573V03.png,EU (UK) || Notion #53 Opti NYNM || 1C || 08/01/2025w02,SHARE,$25,"1,222",2025-01-08,2025-01-11,3
273,CB_2025_Jan_FB_3656_JT_V01_4x5_IMG_EN_New_C-Headline_Seasonal_CTA-70_Angle-W_M-NONE_VL-None_G-NONE_P-OG_S-NONE,3656 - we_re leaving || Enhancements: OFF || CBV1 || Batch 1 || 1C || 07/01/25w02 || Kostas,SHARE,$25,982,2025-01-07,2025-01-16,9
274,CB_2025_Jan_FB_3686_LZ-KB_V07_4x5_IMG_EN_New_C-Headline_Evergreen_CTA-NONE_Angle-ADVTR_M-NONE_VL-None_G-NONE_P-NONE_S-NONE_FB3582V11,CBV2 || LP:HI 3686 - advertorial 3582v11 opti - secret behind the label advertorial ads || Batch 5 || BROAD || 1C ||  10/01/25 || Kostas,SHARE,$25,622,2025-01-10,2025-01-13,3
275,CB_2024_Dec_FB_3616_LZ-JG_V01_4x5_IMG_EN_Opti_C-Headline_Sale_CTA-XMAS_Angle-Cort_M-NONE_VL-None_G-NONE_P-NONE_S-NONE_FB3251V02,ASC+ || MIX || Value Optimization || US || 0% EXISTING CAP || 1C || 22.12.24  Ad set,SHARE,$25,699,2024-12-22,2025-01-06,15
276,CB_2025_Jan_FB_3667_SO-JT_V01_4x5_IMG_EN_New_C-NONE_Evergreen_CTA-NY_Angle-W_M-NONE_VL-None_G-NONE_P-NONE_S-NONE,3667 - CB - Notion idea #60 EXCEL - NYNM || Enhancements: OFF || CBV1 || Batch 1 || 1C || 07/01/25w02 || Kostas,SHARE,$25,"1,216",2025-01-07,2025-01-11,4
277,CB_2025_Jan_FB_3662_CHUB_V04_1x1_IMG_EN_New_C-NONE_CTA-NONE_Angle-C_M-NONE_VL-None_TR-None_G-NONE_P-NONE_S-NONE.jpg,3662 - Hipno event ITR CHUB || Enhancements: OFF || CBV1 || Batch 1 || 1C || 10/01/25w02 || Valentinas,SHARE,$23,766,2025-01-10,2025-01-15,5
278,CB_2025_Jan_FB_3695_KB_V01_4x5_IMG_EN_New_C-SocialProof_Sale_CTA-SALE_Angle-W-B-C_M-NONE_VL-None_G-NONE_P-OG_S-NONE,3695 - #105 â€œReddit postsâ€ California Fires || Enhancements: OFF || CBV1 || Batch 2 || 1C || 10/01/25w02 || Kostas,SHARE,$23,"1,073",2025-01-10,2025-01-22,12
279,CB_2024_Dec_FB_3666_VK-JT_V03_4x5_VID_EN_Opti_C-BulletPoints_Sale_CTA-NY_Angle-W-B-C_M-TRC_VL-30s_G-F_P-OG_S-NEW,ASC+ || VIDEO Only || US || 0% EXISTING CAP || 1C || 08.12.24  Ad set,VIDEO,$22,775,2025-01-11,2025-02-05,25
280,CB_2024_Dec_FB_3659_LZ-VU_V03_4x5_IMG_EN_New_C-Headline_Evergreen_CTA-NONE_Angle-W_M-NONE_VL-None_G-M_P-NONE_S-NONE.png,3659 - BRO ads || Enhancements: OFF || CBV1 || Batch 1 || 1C || 05/01/25w01 || Valentinas,SHARE,$21,869,2025-01-05,2025-01-09,4
281,CB_2025_Jan_FB_3685_LZ-JT_V01_4x5_IMG_EN_New_C-NONE_Evergreen_CTA-NONE_Angle-None_M-NONE_VL-None_G-NONE_P-OG_S-NONE.png,US || VSL || Doc batch || Landing: Pre-1(New lead) -> Old lead || 1C || 10/01/25,SHARE,$21,798,2025-01-10,2025-01-12,2
282,CB_2023_Nov_FB_2648_DT_V01_1x1_GIF_EN_Opti_C-Sale_CTA-XMAS_None_M-NONE_VL-None_TR-None_G-NONE_P-OG_S-NONE,ðŸ’°WC || US || Advantage+ || BIG BUDGET || CC101->105->109->112->114-116->117 || BROAD || ABO || 1C || 17/01/24 RELAUNCHED Ad set,VIDEO,$20,332,2024-01-17,2025-02-06,386
283,CB_2025_Jan_FB_3656_KB_V02_4x5_IMG_EN_Opti_C-Headline_Sale_CTA-NY_Angle-SC_M-NONE_VL-None_G-NONE_P-OG_S-NONE_FB3573V03,EU (UK) || 3rd party page || Notion #53 Opti NYNM || 1C || 08/01/2025w02,SHARE,$19,919,2025-01-08,2025-01-11,3
284,CB_2024_Dec_FB_3653_LZ-VU_V03_4x5_IMG_EN_New_C-Headline_Evergreen_CTA-NONE_Angle-W_M-NONE_VL-None_G-F_P-NONE_S-NONE.png,3653 - Valentinas' Hyper targeting ad || Enhancements: OFF || CBV1 || Batch 1 || 1C || 05/01/25w01 || Valentinas,SHARE,$19,920,2025-01-05,2025-01-09,4
285,CB_2024_Dec_FB_3648_DT_V04_16x9_IMG_EN_Opti_C-NONE_Evergreen_CTA-NONE_Angle-None_M-NONE_VL-None_G-NONE_P-OG_S-NONE.png,US || VSL || 3648 - VSL static opti || Landing: Pre-1(New lead) -> Old lead || 1C || 31/12/24,SHARE,$18,708,2024-12-31,2025-01-06,6
286,CB_2024_Mar_FB_2888_JG_V01_9x16_IMG_EN_Opti_C-Benefits_CTA-NONE_Pain-W_M-NONE_VL-None_TR-None_G-NONE_P-V2_S-NONE,CBV2 || NZ || ðŸ’° Advantage+ || US || BROAD || 7C || Existing_customer_5% || 19/12/24 Campaign Ad set,SHARE,$17,813,2024-12-19,2025-01-11,23
287,CB_2024_Dec_FB_3582_LZ-KB_V10_4x5_IMG_EN_New_C-Headline_Evergreen_CTA-NONE_Angle-ADVTR_M-NONE_VL-None_G-NONE_P-NONE_S-NONE,CBV2 || LP:HI 3582 - secret behind the label advertorial ads || Batch 3 || BROAD || 1C ||  03/01/25 || Kostas,SHARE,$17,534,2025-01-03,2025-01-06,3
288,CB_2024_Nov_FB_3562_VK-JG_V03_4x5_IMG_EN_New_C-BulletPoints_Sale_CTA-BF70_Angle-W_M-NONE_VL-.png,UK || ASC+ || CBV2 || 7DC || Existing 10% || 13.11.2024 Ad set,SHARE,$17,898,2024-11-28,2025-01-16,49
289,CB_2022_Mar3_FB_713_IK_V04_1x1_IMG_EN_Opti_C-WrittenTesti_HE-98_A-ExtremeBodyVisualization_HK-bodypart_Pain-W_CLR-PURPLE_BG-IMAGE_ME-MIX_MA-YOUNG,UK || ASC+ || CBV2 || 7DC || Existing 10% || 13.11.2024 Ad set,SHARE,$16,"1,194",2024-11-14,2025-01-16,63
290,CB_2025_Jan_FB_3685_LZ-JT_V05_4x5_IMG_EN_New_C-NONE_Evergreen_CTA-NONE_Angle-None_M-NONE_VL-None_G-NONE_P-OG_S-NONE.png,US || VSL || Doc batch || Landing: Pre-1(New lead) -> Old lead || 1C || 10/01/25,SHARE,$16,746,2025-01-10,2025-01-12,2
291,CB_2024_Dec_FB_3619_VK-JT_V02_4x5_VID_EN_New_C-BulletPoints_Sale_CTA-NY_Angle-W-B-C_M-NONE_VL-None_G-NONE_P-OG_S-NONE - Copy,ASC+ || MIX || Value Optimization || US || 0% EXISTING CAP || 1C || 22.12.24  Ad set,SHARE,$16,425,2024-12-27,2025-01-06,10
292,20230907_100759,NZ || 3rd party page: Fitness Coach Nicole || Organic Ads || Batch 1 || 1C || 03/01/2025,SHARE,$16,885,2025-01-03,2025-01-06,3
293,CB_2025_Jan_FB_3693_LZ-JG_V04_4x5_IMG_EN_Opti_C-Headline_Evergreen_CTA-NONE_Angle-W_M-NONE_VL-None_G-NONE_P-NONE_S-NONE_FB3639V03,3693 - 3639 opti quitters_ day || Enhancements: OFF || CBV1 || Batch 2 || 1C || 10/01/25w02 || Kostas,SHARE,$16,816,2025-01-10,2025-01-12,2
294,CB_2024_Dec_FB_3648_DT_V03_16x9_IMG_EN_Opti_C-NONE_Evergreen_CTA-NONE_Angle-None_M-NONE_VL-None_G-NONE_P-OG_S-NONE.png,US || VSL || 3648 - VSL static opti || Landing: Pre-1(New lead) -> Old lead || 1C || 31/12/24,SHARE,$15,550,2024-12-31,2025-01-06,6
295,CB_2024_Dec_FB_3614_CHUB_V04_9x16_VID_EN_New_C-Headline_CTA-NONE_Angle-W_M-NONE_VL-15s_TR-None_G-NONE_P-NONE_S-NONE,3614 CHUB - Presentation ads || Enhancements: OFF || CBV1 || Batch 2 || 1C || 05/01/25w01 || Kostas,VIDEO,$15,581,2025-01-05,2025-01-09,4
296,CB_2024_Dec_FB_3592_VK-DP_V09_4x5_VID_EN_New_C-BulletPoints_Sale_CTA-SALE_Angle-W-B-C_M-NONE_VL-30s_G-F_P-OG_S-WHAT - Copy,ASC+ || VIDEO Only || US || 0% EXISTING CAP || 1C || 08.12.24  Ad set,VIDEO,$15,525,2024-12-20,2025-02-05,47
297,CB_2023_Dec_FB_2694_DT-DP_V17_1x1_GIF_EN_New_C-NONE_CTA-NY65_None_M-NONE_VL-15s_TR-None_G-NONE_P-OG_S-NONE,ðŸ’°WC || US || Advantage+ || BIG BUDGET || CC101->105->109->112->114-116->117 || BROAD || ABO || 1C || 17/01/24 RELAUNCHED Ad set,VIDEO,$15,250,2024-01-18,2025-02-06,385
298,CB_2025_Jan_FB_3651_SO-JT_V06_4x5_IMG_EN_New_C-NONE_Evergreen_CTA-SALE_Angle-None_M-NONE_VL-None_G-NONE_P-NONE_S-NONE,3651 - NYNM - RIDDLES NOTION #77 || Enhancements: OFF || CBV1 || Batch 2 || 1C || 05/01/25w01 || Kostas,SHARE,$13,858,2025-01-05,2025-01-07,2
299,CB_2024_Mar_FB_2853_DT-RP_V02_9x16_IMG_EN_New_C-NONE_CTA-CTA_None_M-NONE_VL-None_TR-None_G-NONE_P-V2_S-NONE.png,UK || ASC+ || 7DC || Existing 10% || 13.11.2024 Ad set,SHARE,$13,637,2024-11-13,2025-01-16,64
300,20230907_094526,NZ || 3rd party page: Fitness Coach Nicole || Organic Ads || Batch 1 || 1C || 03/01/2025,SHARE,$13,"1,375",2025-01-03,2025-01-06,3
301,VCB4.mp4,US || VSL || Aff's video || Landing: Pre-1(New lead) -> Old lead || 1C || 10/01/25,SHARE,$13,380,2025-01-10,2025-01-12,2
302,CB_2025_Jan_FB_3656_KB_V02_4x5_IMG_EN_Opti_C-Headline_Sale_CTA-NY_Angle-SC_M-NONE_VL-None_G-NONE_P-OG_S-NONE_FB3573V03,AU || 3rd party page || Notion #53 Opti NYNM || 1C || 08/01/2025w02,SHARE,$12,472,2025-01-10,2025-01-11,1
303,CB_2025_Jan_FB_3686_LZ-KB_V08_4x5_IMG_EN_New_C-Headline_Evergreen_CTA-NONE_Angle-ADVTR_M-NONE_VL-None_G-NONE_P-NONE_S-NONE_FB3582V11,CBV2 || LP:HI 3686 - advertorial 3582v11 opti - secret behind the label advertorial ads || Batch 5 || BROAD || 1C ||  10/01/25 || Kostas,SHARE,$12,362,2025-01-10,2025-01-13,3
304,CB_2024_Mar_FB_2888_JG_V01_9x16_IMG_EN_Opti_C-Benefits_CTA-NONE_Pain-W_M-NONE_VL-None_TR-None_G-NONE_P-V2_S-NONE,CBV2 || EU (UK) || ðŸ’° Advantage+ || US || BROAD || 7C || Existing_customer_5% || 15/12/24 Ad set,SHARE,$11,492,2024-12-15,2025-01-31,47
305,CB_2024_Oct_FB_3251_LZ-VU_V01_1x1_IMG_EN_New_C-NegativeMark_Evergreen_CTA-NONE_Angle-Cort_M-NONE_VL-None_G-NONE_P-NONE_S-NONE.png,US || Manual Bid || BFCM || COST CAP 91 || 1C || 15/11/24,SHARE,$11,495,2024-11-15,2025-02-27,104
306,CB_2024_Dec_FB_3619_VK-JT_V02_4x5_VID_EN_New_C-BulletPoints_Sale_CTA-NY_Angle-W-B-C_M-NONE_VL-None_G-NONE_P-OG_S-NONE - Copy,ðŸ’°WC || US || Advantage+ || BIG BUDGET || CC101->105->109->112->114-116->117 || BROAD || ABO || 1C || 17/01/24 RELAUNCHED Ad set,SHARE,$10,323,2024-12-27,2025-02-06,41
307,CB_2023_Jul_FB_2226_MB_V04_9x16_VID_EN_Opti_C-Testim_CTA-SMR_Pain-W_M-MIX_VL-30s_TR-None_G-F_P-None_S-Starry,US || Manual Bid || BFCM || ROAS GOAL: 1.4 || 1C || 15/11/24,VIDEO,$9,183,2024-11-15,2025-02-27,104
308,CB_2024_Jan_FB_2717_MB-RP_V26_9x16_VID_EN_New_C-Buzz_CTA-SALE_Pain-W-B-C_M-MIX_VL-45s_TR-None_G-MF_P-Method_S-NONE,CA || COST CAP 91 || 7C || 03/42/24 || V1,VIDEO,$9,814,2024-05-10,2025-01-13,248
309,CB_2024_Dec_FB_3659_LZ-VU_V02_4x5_IMG_EN_New_C-Headline_Evergreen_CTA-NONE_Angle-W_M-NONE_VL-None_G-M_P-NONE_S-NONE.png,3659 - BRO ads || Enhancements: OFF || CBV1 || Batch 1 || 1C || 05/01/25w01 || Valentinas,SHARE,$9,492,2025-01-05,2025-01-09,4
310,CB_2023_May_FB_2263_MB_V04_9x16_VID_EN_New_C-Sale_CTA-SMR_Pain-W_M-JOG_VL-45s_TR-None_G-M-F_P-None_S-Moon,CBV2 || Advantage+ || Only V1 Ads || US || 5% EXISTING CAP || BROAD || 7C || 30/12/24  Campaign Ad set,VIDEO,$9,318,2024-12-30,2025-01-22,23
311,CB_2024_Nov_FB_3305_SO-DP_V02_4x5_VID_EN_Opti_C-Sale_CTA-BF_Pain-W_M-Chris_VL-30s_TR-None_G-MF_P-Plan_S-NEW_FB2601V07,CBV2 || EU (UK) || ðŸ’° Advantage+ || US || BROAD || 7C || Existing_customer_5% || 15/12/24 Ad set,SHARE,$9,394,2024-12-19,2025-01-31,43
312,CB_2024_Dec_FB_3614_CHUB_V02_9x16_VID_EN_New_C-Headline_CTA-NONE_Angle-W_M-NONE_VL-15s_TR-None_G-NONE_P-NONE_S-NONE,3614 CHUB - Presentation ads || Enhancements: OFF || CBV1 || Batch 2 || 1C || 05/01/25w01 || Kostas,VIDEO,$8,214,2025-01-05,2025-01-09,4
313,CB_2024_Jan_FB_2762_IK_V04_1x1_IMG_EN_New_C-WrittenTesti_CTA-CTA_Pain-W-B-C_M-NONE_VL-None_TR-None_G-NONE_P-V2_S-NONE,CBV2 || AU || ðŸ’° Advantage+ || US || BROAD || 7C || Existing_customer_5% || 19/12/24 Ad set,SHARE,$8,242,2024-12-19,2025-03-27,98
314,CB_2024_Dec_FB_3622_LZ-KB_V03_4x5_IMG_EN_Opti_C-NONE_Sale_CTA-XMAS_Angle-GH_M-NONE_VL-None_G-NONE_P-OG_S-NONE_FB2227V08 - Copy,US || Manual Bid || BID CAP 105 || 1C || 21/12/24,SHARE,$7,284,2024-12-22,2025-03-11,79
315,CB_2024_Nov_FB_3342_DT-DP_V05_4x5_VID_EN_Opti_C-Testimomial_Sale_CTA-CYBER_Angle-W_M-CLARA_VL-45s_G-F_P-OG_S-MOON_FB2865V05,ðŸŒ¶ï¸ || US || ASC+ || ->CC141 || VIDEO Only || US+CA || 0% EXISTING CAP || 7C || 07/08.24  Ad set,VIDEO,$7,290,2024-12-09,2025-01-24,46
316,CB_2024_Dec_FB_3619_VK-JT_V01_4x5_VID_EN_New_C-BulletPoints_Sale_CTA-NY_Angle-W-B-C_M-NONE_VL-None_G-NONE_P-OG_S-NONE,3619 - CB - CRAVINGS - IMG - TESTIMONIAL || Enhancements: OFF || CBV1 || Batch 1 || 1C || 23/12/24w52 || Kostas,SHARE,$7,685,2024-12-23,2025-01-15,23
317,CB_2025_Jan_FB_3671_LZ-VU_V04_4x5_IMG_EN_New_C-Headline_Evergreen_CTA-NONE_Angle-W_M-NONE_VL-None_G-NONE_P-NONE_S-NONE_FB3306V04,AU || 3rd party page || 3671 - anti inflammatory diet opti || 1C || 10/01/2025w02,SHARE,$7,322,2025-01-10,2025-01-13,3
318,CB_2023_Jul_FB_2226_MB_V04_9x16_VID_EN_Opti_C-Testim_CTA-SMR_Pain-W_M-MIX_VL-30s_TR-None_G-F_P-None_S-Starry,US || Manual Bid || BFCM || COST CAP 91 || 1C || 15/11/24,VIDEO,$6,187,2024-11-15,2025-02-27,104
319,CB_2025_Jan_FB_3656_KB_V02_4x5_IMG_EN_Opti_C-Headline_Sale_CTA-NY_Angle-SC_M-NONE_VL-None_G-NONE_P-OG_S-NONE_FB3573V03,EU (UK) || Notion #53 Opti NYNM || 1C || 08/01/2025w02,SHARE,$6,269,2025-01-08,2025-01-11,3
320,CB_2024_Dec_FB_3619_VK-JT_V04_4x5_VID_EN_New_C-BulletPoints_Sale_CTA-NY_Angle-W-B-C_M-NONE_VL-None_G-NONE_P-OG_S-NONE,3619 - CB - CRAVINGS - IMG - TESTIMONIAL || Enhancements: OFF || CBV1 || Batch 1 || 1C || 23/12/24w52 || Kostas,SHARE,$6,366,2024-12-23,2025-01-15,23
321,CB_2025_Jan_FB_3686_LZ-KB_V01_4x5_IMG_EN_New_C-Headline_Evergreen_CTA-NONE_Angle-ADVTR_M-NONE_VL-None_G-NONE_P-NONE_S-NONE_FB3582V11,CBV2 || LP:HI 3686 - advertorial 3582v11 opti - secret behind the label advertorial ads || Batch 4 || BROAD || 1C ||  10/01/25 || Kostas,SHARE,$6,147,2025-01-10,2025-01-13,3
322,CB_2025_Jan_FB_3656_KB_V01_4x5_IMG_EN_Opti_C-Headline_Sale_CTA-NY_Angle-SC_M-NONE_VL-None_G-NONE_P-OG_S-NONE_FB3573V03,AU || 3rd party page || Notion #53 Opti NYNM || 1C || 08/01/2025w02,SHARE,$5,188,2025-01-10,2025-01-11,1
323,CB_2025_Jan_FB_3656_KB_V01_4x5_IMG_EN_Opti_C-Headline_Sale_CTA-NY_Angle-SC_M-NONE_VL-None_G-NONE_P-OG_S-NONE_FB3573V03,Notion #53 Opti NYNM || Enhancements: OFF || CBV1 || Batch 1 || 1C || 07/01/25w02 || Kostas,SHARE,$5,215,2025-01-07,2025-01-09,2
324,CB_2025_Jan_FB_3656_KB_V02_4x5_IMG_EN_Opti_C-Headline_Sale_CTA-NY_Angle-SC_M-NONE_VL-None_G-NONE_P-OG_S-NONE_FB3573V03,Notion #53 Opti NYNM || Enhancements: OFF || CBV1 || Batch 1 || 1C || 07/01/25w02 || Kostas,SHARE,$5,115,2025-01-07,2025-01-09,2
325,CB_2024_Dec_FB_3622_LZ-KB_V03_4x5_IMG_EN_Opti_C-NONE_Sale_CTA-XMAS_Angle-GH_M-NONE_VL-None_G-NONE_P-OG_S-NONE_FB2227V08 - Copy,US || Manual Bid || BID CAP 111 || 1C || 21/12/24,SHARE,$4,152,2024-12-22,2025-03-26,94
326,CB_2022_Mar3_FB_713_IK_V04_1x1_IMG_EN_Opti_C-WrittenTesti_HE-98_A-ExtremeBodyVisualization_HK-bodypart_Pain-W_CLR-PURPLE_BG-IMAGE_ME-MIX_MA-YOUNG,View Content || BROAD || 7C || 17/12/24,SHARE,$4,480,2024-12-17,2025-01-20,34
327,CB_2024_Dec_FB_3658_LZ-VU_V01_4x5_IMG_EN_New_C-BeforeAfter_Evergreen_CTA-NONE_Angle-W_M-NONE_VL-None_G-NONE_P-OG_S-NONE,3658 - ridge inspired humorous ads marmot || Enhancements: OFF || CBV1 || Batch 1 || 1C || 05/01/25w01 || Kostas,SHARE,$3,373,2025-01-05,2025-01-09,4
328,CB_2024_Jan_FB_2762_IK_V04_1x1_IMG_EN_New_C-WrittenTesti_CTA-CTA_Pain-W-B-C_M-NONE_VL-None_TR-None_G-NONE_P-V2_S-NONE,CBV2 || EU (UK) || ðŸ’° Advantage+ || US || BROAD || 7C || Existing_customer_5% || 15/12/24 Ad set,SHARE,$3,121,2024-12-15,2025-01-31,47
329,CB_2024_Dec_FB_3582_LZ-KB_V12_4x5_IMG_EN_New_C-Headline_Evergreen_CTA-NONE_Angle-ADVTR_M-NONE_VL-None_G-NONE_P-NONE_S-NONE,CBV2 || LP:HI 3582 - secret behind the label advertorial ads || Batch 3 || BROAD || 1C ||  03/01/25 || Kostas,SHARE,$3,191,2025-01-03,2025-01-06,3
330,CB_2024_Jan_FB_2762_IK_V04_1x1_IMG_EN_New_C-WrittenTesti_CTA-CTA_Pain-W-B-C_M-NONE_VL-None_TR-None_G-NONE_P-V2_S-NONE,CBV2 || NZ || ðŸ’° Advantage+ || US || BROAD || 7C || Existing_customer_5% || 19/12/24 Campaign Ad set,SHARE,$3,152,2024-12-19,2025-01-11,23
331,CB_2023_Jul_FB_2217_IB_V04_9x16_VID_EN_Opti_C-Pointing_CTA-SMR_Pain-W-B_M-TRC_VL-30s_TR-None_G-F_P-None_S-FRIGGA,US || Manual Bid || BFCM || COST CAP 81 || 1C || 15/11/24,VIDEO,$2,46,2024-11-15,2025-03-16,121
332,CB_2022_Mar3_FB_713_IK_V04_1x1_IMG_EN_Opti_C-WrittenTesti_HE-98_A-ExtremeBodyVisualization_HK-bodypart_Pain-W_CLR-PURPLE_BG-IMAGE_ME-MIX_MA-YOUNG,UK || ASC+ || 7DC || Existing 10% || 13.11.2024 Ad set,SHARE,$2,161,2024-11-14,2025-01-16,63
333,CB_2024_Nov_FB_3562_VK-JG_V03_4x5_IMG_EN_New_C-BulletPoints_Sale_CTA-BF70_Angle-W_M-NONE_VL-.png,UK || ASC+ || 7DC || Existing 10% || 13.11.2024 Ad set,SHARE,$2,100,2024-11-28,2025-01-16,49
334,CB_2023_Dec_FB_2696_RS_V02_9x16_VID_EN_Opti_C-Sale_CTA-XMAS65_Pain-W-B_M-JANW_VL-30s_TR-None_G-MF_P-OG_S-WHAT_FB2284V05,ðŸ’°WC || US || Advantage+ || BIG BUDGET || CC101->105->109->112->114-116->117 || BROAD || ABO || 1C || 17/01/24 RELAUNCHED Ad set,VIDEO,$2,87,2024-01-17,2025-02-06,386
335,CB_2024_Oct_FB_3251_LZ-VU_V01_1x1_IMG_EN_New_C-NegativeMark_Evergreen_CTA-NONE_Angle-Cort_M-NONE_VL-None_G-NONE_P-NONE_S-NONE.png,View Content || BROAD || 7C || 17/12/24,SHARE,$2,355,2024-12-17,2025-01-20,34
336,CB_2025_Jan_FB_3686_LZ-KB_V02_4x5_IMG_EN_New_C-Headline_Evergreen_CTA-NONE_Angle-ADVTR_M-NONE_VL-None_G-NONE_P-NONE_S-NONE_FB3582V11,CBV2 || LP:HI 3686 - advertorial 3582v11 opti - secret behind the label advertorial ads || Batch 4 || BROAD || 1C ||  10/01/25 || Kostas,SHARE,$2,57,2025-01-10,2025-01-13,3
337,CB_2023_Nov_FB_2664_MB_V08_9x16_VID_EN_Opti_C-Testim_CTA-XMAS65_Pain-W_M-MIX_VL-30s_TR-None_G-F_P-None_S-Starry,ðŸ’°WC || US || Advantage+ || BIG BUDGET || CC101->105->109->112->114-116->117 || BROAD || ABO || 1C || 17/01/24 RELAUNCHED Ad set,VIDEO,$2,82,2024-01-17,2025-02-04,384
338,VCB1.mp4,US || VSL || Aff's video || Landing: Pre-1(New lead) -> Old lead || 1C || 10/01/25,VIDEO,$2,57,2025-01-10,2025-01-12,2
339,CB_2024_Nov_FB_3353_VK-DP_V10_4x5_IMG_EN_New_C-BulletPoints_Sale_CTA-BF70_Angle-W-B-C_M-NONE_VL-None_G-NONE_P-OG_S-NONE,ASC+ || MIX || Value Optimization || US || 0% EXISTING CAP || 1C || 22.12.24  Ad set,SHARE,$2,111,2024-12-31,2025-01-06,6
340,CB_2025_Jan_FB_3685_LZ-JT_V06_4x5_IMG_EN_New_C-NONE_Evergreen_CTA-NONE_Angle-None_M-NONE_VL-None_G-NONE_P-OG_S-NONE.png,US || VSL || Doc batch || Landing: Pre-1(New lead) -> Old lead || 1C || 10/01/25,SHARE,$2,76,2025-01-10,2025-01-12,2
341,CB_2024_Oct_FB_3251_LZ-VU_V01_1x1_IMG_EN_New_C-NegativeMark_Evergreen_CTA-NONE_Angle-Cort_M-NONE_VL-None_G-NONE_P-NONE_S-NONE.png,US || Manual Bid || BFCM || COST CAP 81 || 1C || 15/11/24,SHARE,$1,66,2024-11-15,2025-03-17,122
342,CB_2025_Jan_FB_3671_LZ-VU_V02_4x5_IMG_EN_New_C-Headline_Evergreen_CTA-NONE_Angle-W_M-NONE_VL-None_G-NONE_P-NONE_S-NONE_FB3306V02,CBV2 || EU (UK) || ðŸ’° Advantage+ || US || BROAD || 7C || Existing_customer_5% || 15/12/24 Ad set,SHARE,$1,66,2025-01-09,2025-01-31,22
343,CB_2024_Dec_FB_3582_LZ-KB_V09_4x5_IMG_EN_New_C-Headline_Evergreen_CTA-NONE_Angle-ADVTR_M-NONE_VL-None_G-NONE_P-NONE_S-NONE,CBV2 || LP:HI 3582 - secret behind the label advertorial ads || Batch 3 || BROAD || 1C ||  03/01/25 || Kostas,SHARE,$1,149,2025-01-03,2025-01-06,3
344,CB_2024_Dec_FB_3619_VK-JT_V03_4x5_VID_EN_New_C-BulletPoints_Sale_CTA-NY_Angle-W-B-C_M-NONE_VL-None_G-NONE_P-OG_S-NONE,3619 - CB - CRAVINGS - IMG - TESTIMONIAL || Enhancements: OFF || CBV1 || Batch 1 || 1C || 23/12/24w52 || Kostas,SHARE,$1,190,2024-12-23,2025-01-15,23
345,CB_2024_Dec_FB_3653_LZ-VU_V04_4x5_IMG_EN_New_C-Headline_Evergreen_CTA-NONE_Angle-W_M-NONE_VL-None_G-F_P-NONE_S-NONE.png,3653 - Valentinas' Hyper targeting ad || Enhancements: OFF || CBV1 || Batch 1 || 1C || 05/01/25w01 || Valentinas,SHARE,$1,39,2025-01-05,2025-01-08,3
346,IM_CB3.png,US || VSL || Aff's image || Landing: Pre-1(New lead) -> Old lead || 1C || 10/01/25,SHARE,$1,32,2025-01-10,2025-01-16,6
347,CB_2024_Dec_FB_3637_CHUB_V03_1x1_IMG_EN_New_C-Headline_CTA-SALE_Angle-W_M-NONE_VL-None_TR-None_G-NONE_P-NONE_S-NONE,3637 CHUB â€“ Hipno Event || Enhancements: OFF || CBV1 || Batch 1 || 1C || 30/12/24w01 || Kostas,SHARE,$1,26,2024-12-30,2025-01-06,7
348,CB_2023_Dec_FB_2706_RS_V09_9x16_VID_EN_Opti_C-Sale_CTA-NY56_Pain-W_M-JOG_VL-30s_TR-None_G-F_P-OG_S-WHAT_FB1404V02,ðŸ’°WC || US || Advantage+ || BIG BUDGET || CC101->105->109->112->114-116->117 || BROAD || ABO || 1C || 17/01/24 RELAUNCHED Ad set,VIDEO,$1,36,2024-01-17,2025-02-05,385
349,CB_2023_Dec_FB_2721_DA-RP_V01_9x16_VID_EN_Opti_C-Sale_CTA-65_Pain-W-B_M-HIL_VL-45s_TR-None_G-F_P-Plan_S-NEW_FB2558V02 - Copy,ðŸ’°WC || US || Advantage+ || BIG BUDGET || CC101->105->109->112->114-116->117 || BROAD || ABO || 1C || 17/01/24 RELAUNCHED Ad set,VIDEO,$1,37,2024-01-21,2025-02-04,380
350,CB_2024_Dec_FB_3653_LZ-VU_V02_4x5_IMG_EN_New_C-Headline_Evergreen_CTA-NONE_Angle-W_M-NONE_VL-None_G-F_P-NONE_S-NONE.png,3653 - Valentinas' Hyper targeting ad || Enhancements: OFF || CBV1 || Batch 1 || 1C || 05/01/25w01 || Valentinas,SHARE,$1,58,2025-01-05,2025-01-09,4
351,CB_2022_Mar3_FB_713_IK_V04_1x1_IMG_EN_Opti_C-WrittenTesti_HE-98_A-ExtremeBodyVisualization_HK-bodypart_Pain-W_CLR-PURPLE_BG-IMAGE_ME-MIX_MA-YOUNG,US || Manual Bid || BFCM || COST CAP 81 || 1C || 15/11/24,SHARE,$0,20,2024-11-15,2025-03-26,131
352,IM_CB4.png,US || VSL || Aff's image || Landing: Pre-1(New lead) -> Old lead || 1C || 10/01/25,SHARE,$0,22,2025-01-10,2025-01-16,6
353,CB_2023_May_FB_2103_MB_V02_9x16_VID_EN_Opti_C-Sale_CTA-SMR_Pain-W_M-JOG_VL-30s_TR-None_G-M-F_P-None_S-What,US || Manual Bid || BID CAP 111 || 1C || 21/12/24,VIDEO,$0,8,2024-12-28,2025-03-27,89
354,CB_2024_Oct_PIN_30_KB_V20_2x3_IMG_EN_Opti_C-Benefits_CTA-NONE_Angle-W_M-NONE_VL-None_TR-None_G-NONE_P-OG_S-NONE,US || 3rd party page: Personal Coach Nicole || Static || Batch 3 || 1C || 30/12/24,SHARE,$0,16,2024-12-30,2025-01-06,7
355,IM_CB5.png,US || VSL || Aff's image || Landing: Pre-1(New lead) -> Old lead || 1C || 10/01/25,SHARE,$0,5,2025-01-10,2025-01-16,6
356,CB_2023_Nov_FB_2675_DT_V01_9x16_VID_EN_Opti_C-Pointing_CTA-XMAS65_Pain-W_M-SEAN_VL-30s_TR-None_G-M_P-NONE_S-YARIN_FB2396V02,ðŸ’°WC || US || Advantage+ || BIG BUDGET || CC101->105->109->112->114-116->117 || BROAD || ABO || 1C || 17/01/24 RELAUNCHED Ad set,VIDEO,$0,16,2024-01-17,2025-02-06,386
357,CB_2023_May_FB_2103_MB_V02_9x16_VID_EN_Opti_C-Sale_CTA-SMR_Pain-W_M-JOG_VL-30s_TR-None_G-M-F_P-None_S-What,US || Manual Bid || BID CAP 105 || 1C || 21/12/24,VIDEO,$0,8,2024-12-28,2025-01-19,22
358,CB_2023_Jul_FB_2217_IB_V04_9x16_VID_EN_Opti_C-Pointing_CTA-SMR_Pain-W-B_M-TRC_VL-30s_TR-None_G-F_P-None_S-FRIGGA,US || Manual Bid || BID CAP 111 || 1C || 21/12/24,VIDEO,$0,4,2024-12-22,2025-03-24,92
359,CB_2022_Nov_FB_1218_RS_V15_9x16_IMG_EN_Opti_C-Sale_CTA-BLACK_Pain-W_M-NONE_VL-None FB1671V08,US || Manual Bid || BFCM || COST CAP 91 || 1C || 15/11/24,SHARE,$0,2,2024-11-15,2025-02-27,104
360,CB_2024_Dec_FB_3639_CHUB_V03_1x1_IMG_EN_New_C-NONE_CTA-NONE_Angle-W_M-NONE_VL-None_TR-None_G-NONE_P-NONE_S-NONE,View Content || BROAD || 7C || 17/12/24,SHARE,$0,7,2025-01-09,2025-01-20,11
361,CB_2023_Jul_FB_2226_MB_V04_9x16_VID_EN_Opti_C-Testim_CTA-SMR_Pain-W_M-MIX_VL-30s_TR-None_G-F_P-None_S-Starry,US || Manual Bid || BID CAP 111 || 1C || 21/12/24,VIDEO,$0,2,2024-12-27,2025-03-11,74
