,Ad Name,Adset Name,Creative Type,Spend In USD,Impressions,First Ad Spend Date,Last Ad Spend Date,Days ad spending
1,CB_2025_Feb_FB_3883_LZ-RP_V06_9x16_VID_EN_Opti_C-MakingOf_Evergreen_CTA-SALE_Angle-W_M-CRAZY_VL-45s_G-M_P-OG_S-NEW_FB3004V02,ðŸŒ¶ï¸ || US || ASC+ || ->CC141 || VIDEO Only || US+CA || 0% EXISTING CAP || 7C || 07/08.24  Ad set,,"$12,740","710,685",2025-03-11,2025-03-17,6
2,CB_2025_Mar_FB_3891_VK_V05_1x1_IMG_EN_New_C-BulletPoints_Evergreen_CTA-65_Angle-W-B-C_M-NONE_VL-None_G-M_P-OG_S-NONE - Copy,ðŸŒ¶ï¸ || US || ASC+ || ->CC141 || VIDEO Only || US+CA || 0% EXISTING CAP || 7C || 07/08.24  Ad set,,"$10,412","611,399",2025-03-15,2025-03-27,12
3,CB_2025_Feb_FB_3863_DT-DP_V03_9x16_VID_EN_New_C-Trend_Sale_CTA-70_Angle-W_M-POW_VL-30s_G-M_P-OG_S-NEW,ðŸŒ¶ï¸ || US || ASC+ || ->CC141 || VIDEO Only || US+CA || 0% EXISTING CAP || 7C || 07/08.24  Ad set,,"$9,532","586,992",2025-03-10,2025-03-27,17
4,CB_2023_Apr_FB_1989_RS_V08_9x16_VID_EN_Opti_C-Trend_CTA-SMR_Pain-W_M-MIX_VL-30s_TR-None_G-MF_P-None,ðŸŒ¶ï¸ || US || ASC+ || ->CC141 || VIDEO Only || US+CA || 0% EXISTING CAP || 7C || 07/08.24  Ad set,VIDEO,"$7,992","339,443",2024-08-07,2025-03-24,229
5,Dynamic_Creative_Statics_CA_Flow,WC || CA || DYNAMIC CREATIVE Static winners || ADV+ audience || 7C || 16.02.2025,SHARE,"$6,268","580,034",2025-02-16,2025-03-27,39
6,CB_2025_Jan_FB_3748_VK-DP_V01_4x5_IMG_EN_New_C-BulletPoints_Sale_CTA-NY_Angle-W-B-C_M-NONE_VL-None_G-M_P-OG_S-NONE,GLP-1 ðŸ’œ || ASC+ || US || 5% EXISTING CAP || 7C || 20/02/25 . Ad set,SHARE,"$5,613","267,875",2025-02-24,2025-03-15,19
7,CB_2025_Jan_FB_3723_SO_V04_4x5_IMG_EN_New_C-NONE_Evergreen_CTA-SALE_Angle-W_M-NONE_VL-None_G-NONE_P-NONE_S-NONE,ðŸŒ¶ï¸ || US || ASC+ || ->CC141 || VIDEO Only || US+CA || 0% EXISTING CAP || 7C || 07/08.24  Ad set,SHARE,"$4,729","323,582",2025-02-12,2025-03-27,43
8,CB_2025_Feb_FB_3827_LZ_V04_1x1_IMG_EN_Opti_C-Headline_Evergreen_CTA-SALE_Angle-W_M-NONE_VL-None_G-M_P-CBV2_S-NONE_FB3779V02,CBV2 || US || Manual Bid: ROAS GOAL: 1.00 -> 1.1 || 7DC || 22/01/2025,SHARE,"$4,700","147,368",2025-02-18,2025-03-27,37
9,CB_2025_Jan_FB_3779_VK-DP_V02_1x1_VID_EN_Opti_C-BulletPoints_Evergreen_CTA-70_Angle-W-B-C_M-NONE_VL-None_G-F_P-OG_S-NEW_FB3705V02,ðŸŒ¶ï¸ || US || ASC+ || ->CC141 || VIDEO Only || US+CA || 0% EXISTING CAP || 7C || 07/08.24  Ad set,SHARE,"$4,281","214,003",2025-02-12,2025-03-19,35
10,CB_2023_Jul_FB_2217_IB_V04_9x16_VID_EN_Opti_C-Pointing_CTA-SMR_Pain-W-B_M-TRC_VL-30s_TR-None_G-F_P-None_S-FRIGGA,ðŸŒ¶ï¸ || US || ASC+ || ->CC141 || VIDEO Only || US+CA || 0% EXISTING CAP || 7C || 07/08.24  Ad set,VIDEO,"$3,417","116,386",2024-08-07,2025-03-27,232
11,CB_2023_Jul_FB_2284_DA_V05_9x16_VID_EN_Opti_C-Sale_CTA-SMR_Pain-W_M-JANW_VL-30s_TR-None_G-M_P-None_S-WHAT_FB2103V02,ðŸŒ¶ï¸ || US || ASC+ || ->CC141 || VIDEO Only || US+CA || 0% EXISTING CAP || 7C || 07/08.24  Ad set,VIDEO,"$3,347","136,219",2024-08-07,2025-03-27,232
12,CB_2025_Feb_FB_3827_LZ_V01_1x1_IMG_EN_Opti_C-Headline_Evergreen_CTA-NONE_Angle-W_M-NONE_VL-None_G-M_P-CBV2_S-NONE_FB3723V04,CBV2 || US || Manual Bid: ROAS GOAL: 1.00 -> 1.1 || 7DC || 22/01/2025,SHARE,"$3,117","145,627",2025-02-18,2025-03-27,37
13,CB_2024_Sep_FB_3175_DA-KB_V04_1x1_IMG_EN_New_C-ADVRT_Evergreen_CTA-NONE_Angle-W_M-NONE_VL-None_G-NONE_P-CBV2_S-NONE_blog_colonbroomvsmammoth_cv_en,CBV2 || Advantage+ || Advertorial || Higher pricing || US || 0% EXISTING CAP || BROAD || 7C || 20/01/25  Campaign Ad set,SHARE,"$3,020","114,676",2025-01-20,2025-03-27,66
14,CB_2025_Feb_FB_3868_VK-DP_V02_9x16_VID_EN_New_C-BulletPoints_Evergreen_CTA-NONE_Angle-W-B-C_M-NONE_VL-15s_G-M_P-OG_S-NEW.mp4,ðŸŒ¶ï¸ || US || ASC+ || ->CC141 || VIDEO Only || US+CA || 0% EXISTING CAP || 7C || 07/08.24  Ad set,,"$2,883","151,917",2025-03-12,2025-03-21,9
15,CB_2025_Jan_FB_CANVA_LZ-VU_V01_1x1_IMG_EN_New_C-NegativeMark_Evergreen_CTA-NONE_Angle-Cort_M-NONE_VL-None_G-NONE_P-NONE_S-NONE,ðŸŒ¶ï¸ || US || ASC+ || ->CC141 || VIDEO Only || US+CA || 0% EXISTING CAP || 7C || 07/08.24  Ad set,SHARE,"$2,814","120,934",2025-01-17,2025-03-14,56
16,CB_2023_Jul_FB_2217_IB_V04_9x16_VID_EN_Opti_C-Pointing_CTA-SMR_Pain-W-B_M-TRC_VL-30s_TR-None_G-F_P-None_S-FRIGGA,US || Kilo Product's leads LAL || 7C || 04/03/25,VIDEO,"$2,635","88,914",2025-03-04,2025-03-27,23
17,CB_2024_Aug_FB_3097_VK-DP_V03_9x16_VID_EN_Opti_C-Benefits_CTA-SMR_Pain-W-B_M-MIX_VL-45s_TR-None_G-MF_P-OG_S-WHAT_FB2516V13,ðŸŒ¶ï¸ || US || ASC+ || ->CC141 || VIDEO Only || US+CA || 0% EXISTING CAP || 7C || 07/08.24  Ad set,VIDEO,"$2,157","100,011",2024-09-04,2025-03-27,204
18,CB_2024_Jan_FB_2764_RS_V04_9x16_VID_EN_Opti_C-SingleTesti_CTA-SALE_Pain-W_M-TRC_VL-45s_TR-None_G-F_P-OG_S-MOON_FB2263V04,EU (UK) || 2764 || Trinity Results Too Fast || 1C || 08/01/2025w02,VIDEO,"$2,149","72,544",2025-01-08,2025-03-27,78
19,CB_2024_Jan_FB_2764_RS_V04_9x16_VID_EN_Opti_C-SingleTesti_CTA-SALE_Pain-W_M-TRC_VL-45s_TR-None_G-F_P-OG_S-MOON_FB2263V04_Page_Personal_Coach,CBV2 || AU || ðŸ’° Advantage+ || US || BROAD || 7C || Existing_customer_5% || 19/12/24 Ad set,VIDEO,"$2,115","49,255",2025-01-16,2025-03-27,70
20,CB_2023_Jul_FB_2227_RS_V08_1x1_IMG_EN_New_C-Sale_CTA-CTA_None_M-NONE_VL-None_TR-None_G-NONE_P-None_S-NONE,ðŸŒ¶ï¸ || US || ASC+ || ->CC141 || VIDEO Only || US+CA || 0% EXISTING CAP || 7C || 07/08.24  Ad set,SHARE,"$1,903","99,722",2024-09-30,2025-03-27,178
21,CB_2023_May_FB_2263_MB_V04_9x16_VID_EN_New_C-Sale_CTA-SMR_Pain-W_M-JOG_VL-45s_TR-None_G-M-F_P-None_S-Moon,ðŸŒ¶ï¸ || US || ASC+ || ->CC141 || VIDEO Only || US+CA || 0% EXISTING CAP || 7C || 07/08.24  Ad set,VIDEO,"$1,861","60,118",2024-08-07,2025-03-27,232
22,CB_2025_Feb_FB_3860_LZ-DP_V03_9x16_VID_EN_Opti_C-Testimonial_Evergreen_CTA-SALE_Angle-W_M-MOOD_VL-20s_G-M_P-OG_S-WOOD_FB21176V11_1,ðŸŒ¶ï¸ || US || ASC+ || ->CC141 || VIDEO Only || US+CA || 0% EXISTING CAP || 7C || 07/08.24  Ad set,,"$1,829","102,090",2025-03-13,2025-03-19,6
23,CB_2025_Jan_FB_3742_SO-DP-KB_V06_4x5_IMG_EN_Opti_C-NONE_Evergreen_CTA-SALE_Angle-W_M-NONE_VL-None_G-NONE_P-CBV2_S-NONE3665V01,CBV2 || US || Manual Bid: ROAS GOAL: 1.00 -> 1.1 || 7DC || 22/01/2025,SHARE,"$1,814","64,668",2025-02-11,2025-03-27,44
24,CB_2024_Nov_FB_3264_LZ_V29_4x5_VID_EN_Opti_C-NegativeMark_Sale_CTA-BF_Angle-W-B_M-LRNS_VL-30s_G-M_P-OG_S-NONE,ðŸŒ¶ï¸ || US || ASC+ || ->CC141 || VIDEO Only || US+CA || 0% EXISTING CAP || 7C || 07/08.24  Ad set,VIDEO,"$1,811","75,588",2024-12-04,2025-03-27,113
25,CB_2025_Feb_FB_3812_SO_V03_4x5_IMG_EN_Opti_C-NONE_Evergreen_CTA-SALE_Angle-W_M-NONE_VL-None_G-NONE_P-NONE_S-NONE_FB3723V07,ðŸŒ¶ï¸ || US || ASC+ || ->CC141 || VIDEO Only || US+CA || 0% EXISTING CAP || 7C || 07/08.24  Ad set,SHARE,"$1,613","96,621",2025-02-24,2025-03-15,19
26,CB_2025_Jan_FB_3757_LZ-DP_V16_9x16_VID_EN_Opti_C-BulletPoints_Evergreen_CTA-NONE_Angle-W-B-C_M-KAIT_VL-30s_G-F_P-GLP1_S-WHAT_FB3592V09,GLP-1 ðŸ’œ || ASC+ || US || 5% EXISTING CAP || 7C || 20/02/25 . Ad set,,"$1,569","66,983",2025-03-13,2025-03-18,5
27,CB_2025_Jan_FB_3757_LZ-DP_V16_9x16_VID_EN_Opti_C-BulletPoints_Evergreen_CTA-NONE_Angle-W-B-C_M-KAIT_VL-30s_G-F_P-GLP1_S-WHAT_FB3592V09,3757 - GLP1 video winner opti Batch 3+4 || Enhancements: OFF || GLP-1 || Batch 4 || 7C || 24/02/25w09 || Valentinas,VIDEO,"$1,537","79,371",2025-02-24,2025-03-18,22
28,CB_2025_Jan_FB_3762_LZ_V05_4x5_IMG_EN_Opti_C-NegativeMark_Evergreen_CTA-NONE_Angle-W_M-NONE_VL-None_G-NONE_P-GLP1_S-NONE_FB3251V01.png,3762 - Notion Idea #123 it's not cheap GLP1 || Enhancements: OFF || GLP-1 || Batch 1 || 7C || 20/02/25w09 || Valentinas,SHARE,"$1,480","66,609",2025-02-24,2025-03-18,22
29,CB_2025_Feb_FB_3787_CHUB_V01_9x16_VID_EN_New_C-NONE_CTA-NONE_Angle-None_M-NONE_VL-None_TR-None_G-NONE_P-NONE_S-NONE,ðŸŒ¶ï¸ || US || ASC+ || ->CC141 || VIDEO Only || US+CA || 0% EXISTING CAP || 7C || 07/08.24  Ad set,VIDEO,"$1,415","48,891",2025-02-21,2025-03-19,26
30,CB_2025_Jan_FB_3747_CHUB-AA_V03_9x16_IMG_EN_Opti_C-NONE_CTA-NONE_Angle-Sale_M-NONE_VL-None_TR-None_G-NONE_P-OG_S-NONE,3747 Clean Sale [HB winner ITR] CHUB || Enhancements: OFF || CBV1 || Batch Ä… || 1C || 02/02/25w06 || Kostas,SHARE,"$1,387","61,043",2025-02-02,2025-03-27,53
31,CB_2024_Jan_FB_2764_RS_V04_9x16_VID_EN_Opti_C-SingleTesti_CTA-SALE_Pain-W_M-TRC_VL-45s_TR-None_G-F_P-OG_S-MOON_FB2263V04_Page_Personal_Coach,AU || Page: Branded & 3rd Party || 2764 || Trinity Results Too Fast || 1C || 10/01/2025w02,VIDEO,"$1,349","38,891",2025-01-10,2025-03-27,76
32,CB_2025_Jan_FB_3779_VK-DP_V04_1x1_VID_EN_Opti_C-BulletPoints_Evergreen_CTA-70_Angle-W-B-C_M-NONE_VL-None_G-F_P-OG_S-NEW_FB3705V02,3779 - opti 3705 || Enhancements: OFF || CBV1 || Batch 1 || 1C || 04/02/25w06 || Kostas,SHARE,"$1,097","59,217",2025-02-04,2025-03-20,44
33,CB_2025_Feb_FB_3865_SO-JG_V17_9x16_VID_EN_Opti_C-NONE_Evergreen_CTA-NONE_Angle-W_M-NONE_VL-30_G-NONE_P-OG_S-Moon_FB3029V04,3867 - Fat Costume Suit || Enhancements: OFF || CBV1 || Batch 5 || 7C || 03/03/25w10 || Valentinas,VIDEO,"$1,072","52,793",2025-03-03,2025-03-20,17
34,CB_2023_Jul_FB_2226_MB_V04_9x16_VID_EN_Opti_C-Testim_CTA-SMR_Pain-W_M-MIX_VL-30s_TR-None_G-F_P-None_S-Starry,ðŸŒ¶ï¸ || US || ASC+ || ->CC141 || VIDEO Only || US+CA || 0% EXISTING CAP || 7C || 07/08.24  Ad set,VIDEO,"$1,069","34,177",2024-10-28,2025-03-27,150
35,CB_2025_Feb_FB_3860_LZ-DP_V03_9x16_VID_EN_Opti_C-Testimonial_Evergreen_CTA-SALE_Angle-W_M-MOOD_VL-20s_G-M_P-OG_S-WOOD_FB21176V11_1,3860 - man boobs video 2176 opti || Enhancements: OFF || CBV1 || Batch 1 || 7C || 03/03/25w10 || Valentinas,VIDEO,"$1,060","61,104",2025-03-03,2025-03-27,24
36,CB_2025_Jan_FB_3748_VK-DP_V01_4x5_IMG_EN_New_C-BulletPoints_Sale_CTA-NY_Angle-W-B-C_M-NONE_VL-None_G-M_P-OG_S-NONE.png - Copy,3748 - winner ads opti - GLP1 - VK-DP || Enhancements: OFF || GLP-1 || Batch 1 || 7C || 20/02/25w09 || Valentinas,SHARE,"$1,025","36,834",2025-02-24,2025-03-17,21
37,CB_2025_Jan_FB_3779_VK-DP_V02_1x1_VID_EN_Opti_C-BulletPoints_Evergreen_CTA-70_Angle-W-B-C_M-NONE_VL-None_G-F_P-OG_S-NEW_FB3705V02,3779 - opti 3705 || Enhancements: OFF || CBV1 || Batch 1 || 1C || 04/02/25w06 || Kostas,SHARE,$969,"50,202",2025-02-04,2025-03-20,44
38,CB_2023_Jul_FB_2217_IB_V04_9x16_VID_EN_Opti_C-Pointing_CTA-SMR_Pain-W-B_M-TRC_VL-30s_TR-None_G-F_P-None_S-FRIGGA,CBV2 || AU || ðŸ’° Advantage+ || US || BROAD || 7C || Existing_customer_5% || 19/12/24 Ad set,VIDEO,$924,"32,751",2024-12-19,2025-03-24,95
39,CB_2025_Feb_FB_3868_VK-DP_V02_9x16_VID_EN_New_C-BulletPoints_Evergreen_CTA-NONE_Angle-W-B-C_M-NONE_VL-15s_G-M_P-OG_S-NEW.mp4,3868 - What i ordered for dad bod || Enhancements: OFF || CBV1 || Batch 1 || 7C || 03/03/25w10 || Valentinas,VIDEO,$861,"39,842",2025-03-03,2025-03-20,17
40,CB_2023_Oct_FB_2516_VK_V13_9x16_VID_EN_Opti_C-Benefits_CTA-AUTUM_Pain-W-B_M-PASQ_VL-30s_TR-None_G-M_P-Plan_S-WHAT,ðŸŒ¶ï¸ || US || ASC+ || ->CC141 || VIDEO Only || US+CA || 0% EXISTING CAP || 7C || 07/08.24  Ad set,VIDEO,$817,"30,430",2024-12-19,2025-03-27,98
41,CB_2024_Sep_FB_3175_DA-KB_V03_1x1_IMG_EN_New_C-ADVRT_Evergreen_CTA-NONE_Angle-W_M-NONE_VL-None_G-NONE_P-CBV2_S-NONE_blog_colonbroomvsmammoth_cv_en,CBV2 || Advantage+ || Advertorial || Higher pricing || US || 0% EXISTING CAP || BROAD || 7C || 20/01/25  Campaign Ad set,SHARE,$814,"31,122",2025-01-20,2025-03-27,66
42,CB_2025_Jan_FB_3751_VK-DP_V02_4x5_IMG_EN_New_C-BulletPoints_Sale_CTA-NY_Angle-W-B-C_M-NONE_VL-None_G-M_P-GLP1_S-NONE.jpg,3751 - opti 3608 GLP1 - VK-DP || Enhancements: OFF || GLP-1 || Batch 1 || 7C || 20/02/25w09 || Valentinas,SHARE,$803,"40,203",2025-02-24,2025-03-15,19
43,CB_2025_Mar_FB_3896_LZ_V02_1x1_IMG_EN_New_C-Headline_Evergreen_CTA-NONE_Angle-W_M-NONE_VL-None_G-M_P-OG_S-NONE,3896 - grill party img|| Enhancements: OFF || CBV1 || Batch 1 || 7C || 10/03/25w11,,$802,"38,851",2025-03-10,2025-03-23,13
44,CB_2025_Mar_FB_3884_SO_V12_9x16_IMG_EN_New_C-NONE_Evergreen_CTA-NONE_Angle-W-B-C_M-Nate_VL-15s_G-MF_P-OG_S-NEW,3884 - Body Shaming Angle || Enhancements: OFF || CBV1 || Batch 3 || 7C || 10/03/25w11,,$801,"36,540",2025-03-10,2025-03-20,10
45,CB_2025_Jan_FB_3723_SO_V04_4x5_IMG_EN_New_C-NONE_Evergreen_CTA-SALE_Angle-W_M-NONE_VL-None_G-NONE_P-NONE_S-NONE.png,CBV2 || AU || ðŸ’° Advantage+ || US || BROAD || 7C || Existing_customer_5% || 19/12/24 Ad set,SHARE,$777,"60,205",2025-02-25,2025-03-27,30
46,CB_2025_Mar_FB_3891_VK_V05_1x1_IMG_EN_New_C-BulletPoints_Evergreen_CTA-65_Angle-W-B-C_M-NONE_VL-None_G-M_P-OG_S-NONE-1,ðŸŒ¶ï¸ || US || ASC+ || ->CC141 || VIDEO Only || US+CA || 0% EXISTING CAP || 7C || 07/08.24  Ad set,,$773,"39,700",2025-03-15,2025-03-19,4
47,CB_2023_May_FB_2103_MB_V02_9x16_VID_EN_Opti_C-Sale_CTA-SMR_Pain-W_M-JOG_VL-30s_TR-None_G-M-F_P-None_S-What,US || Manual Bid || BFCM || COST CAP 71 || 1C || 15/11/24,VIDEO,$754,"25,114",2024-11-15,2025-03-27,132
48,CB_2025_Feb_FB_3883_LZ-RP_V06_9x16_VID_EN_Opti_C-MakingOf_Evergreen_CTA-SALE_Angle-W_M-CRAZY_VL-45s_G-M_P-OG_S-NEW_FB3004V02,3883 - Wiiner opti man boobs t levels || Enhancements: OFF || CBV1 || Batch 1 || 7C || 10/03/25w11,,$744,"38,989",2025-03-10,2025-03-20,10
49,CB_2024_Feb_FB_2812_MB-RP_V07_9x16_VID_EN_Opti_C-Sale_CTA-C65_Pain-W_M-NONE_VL-30s_TR-None_G-MF_P-Plan_S-NEW_FB2601V04_1,US || Kilo Product's leads LAL || 7C || 04/03/25,VIDEO,$739,"23,126",2025-03-04,2025-03-27,23
50,CB_2024_Jan_FB_2784_RS_V02_9x16_VID_EN_Opti_C-Pointing_CTA-SALE_Pain-W_M-JOG_VL-30s_TR-None_G-F_P-OG_S-OLLIE_FB2181V01,CBV2 || EU (UK) || ðŸ’° Advantage+ || US || BROAD || 7C || Existing_customer_5% || 15/12/24 Ad set,VIDEO,$710,"29,061",2025-01-09,2025-03-27,77
51,CB_2023_Dec_FB_2712_RS-DP_V02_1x1_VID_EN_Opti_C-WrittenTesti_CTA-SALE_Pain-W-B-C_M-NONE_VL-None_TR-None_G-NONE_P-V2_S-NONE_FB2227V08,CBV2 || AU || ðŸ’° Advantage+ || US || BROAD || 7C || Existing_customer_5% || 19/12/24 Ad set,SHARE,$706,"28,334",2024-12-19,2025-03-27,98
52,CB_2025_Mar_FB_3879_VK-DP_V01_9x16_VID_EN_New_C-BulletPoints_Evergreen_CTA-65_Angle-W-B-C_M-NONE_VL-30s_G-M_P-OG_S-NEW,3879 - Gut health for muscles || Enhancements: OFF || CBV1 || Batch 1 || 7C || 10/03/25w11,,$675,"25,853",2025-03-10,2025-03-20,10
53,CB_2023_May_FB_2263_MB_V04_9x16_VID_EN_New_C-Sale_CTA-SMR_Pain-W_M-JOG_VL-45s_TR-None_G-M-F_P-None_S-Moon,CBV2 || AU || ðŸ’° Advantage+ || US || BROAD || 7C || Existing_customer_5% || 19/12/24 Ad set,VIDEO,$665,"19,561",2024-12-19,2025-03-27,98
54,CB_2025_Mar_FB_3884_SO_V15_9x16_IMG_EN_New_C-NONE_Evergreen_CTA-NONE_Angle-W-B-C_M-Nate_VL-15s_G-M_P-OG_S-NEW,3884 - Body Shaming Angle || Enhancements: OFF || CBV1 || Batch 4 || 7C || 10/03/25w11,,$665,"27,276",2025-03-10,2025-03-20,10
55,CB_2025_Feb_FB_3871_DT-DP_V04_9x16_VID_EN_Opti_C-Sale_Sale_CTA-70_Angle-W_M-JANW_VL-30s_G-M_P-OG_S-WHAT_FB2284V05.mp4,3871 - 2284 opti VID || Enhancements: OFF || CBV1 || Batch 1 || 7C || 04/03/25w10 || Valentinas,SHARE,$648,"32,387",2025-03-04,2025-03-15,11
56,CB_2025_Feb_FB_3863_DT-DP_V03_9x16_VID_EN_New_C-Trend_Sale_CTA-70_Angle-W_M-POW_VL-30s_G-M_P-OG_S-NEW.mp4,3863 - Aaron man boobs vid || Enhancements: OFF || CBV1 || Batch 1 || 7C || 26/02/25w09 || Valentinas,VIDEO,$647,"32,987",2025-02-26,2025-03-15,17
57,CB_2025_Feb_FB_3803_CHUB_V12_1x1_IMG_EN_New_C-NONE_CTA-NONE_Angle-None_M-NONE_VL-None_TR-None_G-NONE_P-NONE_S-NONE_blog_cbglp1_cv_en,Attribution Test - Standard URL || GLP-1 || LP:HI | 3803 Advertorials CHUB || Natural GLP-1 Enhancer Takes Its Place || Batch 3 || 12/07/25,,$647,"21,571",2025-03-12,2025-03-18,6
58,CB_2025_Feb_FB_3855_SO_V03_9x16_VID_EN_New_C-NONE_Evergreen_CTA-NONE_Angle-W_M-NONE_VL-30s_G-None_P-OG_S-NEW,3855 - Notion Idea #141 â€œQuestionnaireâ€ || Enhancements: OFF || CBV1 || Batch 1 || 7C || 03/03/25w10 || Valentinas,VIDEO,$646,"31,450",2025-03-03,2025-03-15,12
59,CB_2025_Mar_FB_3890_DT_V02_1x1_IMG_EN_New_C-NONE_Evergreen_CTA-None_Angle-W_M-NONE_VL-None_G-NONE_P-OG_S-NONE,3890 - Your Peak Performance in 6 weeks || Enhancements: OFF || CBV1 || Batch 1 || 7C || 10/03/25w11,,$627,"41,052",2025-03-12,2025-03-27,15
60,CB_2024_Dec_FB_3619_VK-JT_V02_4x5_VID_EN_New_C-BulletPoints_Sale_CTA-NY_Angle-W-B-C_M-NONE_VL-None_G-NONE_P-OG_S-NONE,ðŸŒ¶ï¸ || US || ASC+ || ->CC141 || VIDEO Only || US+CA || 0% EXISTING CAP || 7C || 07/08.24  Ad set,SHARE,$604,"33,804",2024-12-27,2025-03-27,90
61,CB_2023_Dec_FB_2696_RS_V03_9x16_VID_EN_Opti_C-Sale_CTA-NY65_Pain-W-B_M-JANW_VL-30s_TR-None_G-M_P-OG_S-WHAT_FB2284V05,CBV2 || AU || ðŸ’° Advantage+ || US || BROAD || 7C || Existing_customer_5% || 19/12/24 Ad set,VIDEO,$599,"22,783",2025-01-13,2025-03-27,73
62,CB_2023_Dec_FB_2712_RS-DP_V02_1x1_VID_EN_Opti_C-WrittenTesti_CTA-SALE_Pain-W-B-C_M-NONE_VL-None_TR-None_G-NONE_P-V2_S-NONE_FB2227V08,CBV2 || EU (UK) || ðŸ’° Advantage+ || US || BROAD || 7C || Existing_customer_5% || 15/12/24 Ad set,SHARE,$579,"24,721",2024-12-15,2025-03-27,102
63,CB_2025_Feb_FB_3803_CHUB_V12_1x1_IMG_EN_New_C-NONE_CTA-NONE_Angle-None_M-NONE_VL-None_TR-None_G-NONE_P-NONE_S-NONE_blog_cbglp1_cv_en,Attribution Test - NB UTM - URL || GLP-1 || LP:HI | 3803 Advertorials CHUB || Natural GLP-1 Enhancer Takes Its Place || Batch 3 || 12/07/25,,$575,"15,515",2025-03-13,2025-03-18,5
64,CB_2025_Mar_FB_3891_VK_V05_1x1_IMG_EN_New_C-BulletPoints_Evergreen_CTA-65_Angle-W-B-C_M-NONE_VL-None_G-M_P-OG_S-NONE,3891 - LOW T LEVELS - VK || Enhancements: OFF || CBV1 || Batch 2 || 7C || 10/03/25w11,,$565,"40,659",2025-03-11,2025-03-27,16
65,CB_2024_Aug_FB_3090_DT-DP_V02_9x16_VID_EN_Opti_C-MakingOf_CTA-CTA_Pain-W-B-C_M-POW_VL-45s_TR-None_G-M_P-OG_S-Moon_FB3029V04,CBV2 || EU (UK) || ðŸ’° Advantage+ || US || BROAD || 7C || Existing_customer_5% || 15/12/24 Ad set,SHARE,$556,"29,522",2024-12-19,2025-03-27,98
66,CB_2024_Dec_FB_3601_VK-DP_V09_4x5_VID_EN_Opti_C-Dance_CTA-NY_Pain-W-B_M-JOG_VL-30s_TR-None_G-F_P-OG_S-WHAT_FB3045V01,CBV2 || AU || ðŸ’° Advantage+ || US || BROAD || 7C || Existing_customer_5% || 19/12/24 Ad set,SHARE,$535,"19,976",2025-01-03,2025-03-27,83
67,CB_2025_Feb_FB_3883_LZ-RP_V04_9x16_VID_EN_Opti_C-BulletPoints_Evergreen_CTA-SALE_Angle-W_M-PASQ_VL-30s_G-M_P-OG_S-WHAT_FB2516V13,3882 - New hook aaron+trc || Enhancements: OFF || CBV1 || Batch 1 || 7C || 10/03/25w11,,$532,"24,220",2025-03-10,2025-03-15,5
68,CB_2025_Mar_FB_3891_VK_V01_1x1_IMG_EN_New_C-BulletPoints_Evergreen_CTA-65_Angle-W-B-C_M-NONE_VL-None_G-M_P-OG_S-NONE,3891 - LOW T LEVELS - VK || Enhancements: OFF || CBV1 || Batch 1 || 7C || 10/03/25w11,,$519,"34,523",2025-03-12,2025-03-15,3
69,CB_2025_Mar_FB_3884_SO_V04_1x1_IMG_EN_New_C-NONE_Evergreen_CTA-NONE_Angle-W_M-NONE_VL-None_G-NONE_P-OG_S-NONE,3884 - Body Shaming Angle || Enhancements: OFF || CBV1 || Batch 1 || 7C || 10/03/25w11,,$518,"25,110",2025-03-12,2025-03-15,3
70,CB_2023_Jul_FB_2217_IB_V04_9x16_VID_EN_Opti_C-Pointing_CTA-SMR_Pain-W-B_M-TRC_VL-30s_TR-None_G-F_P-None_S-FRIGGA,CBV2 || EU (UK) || ðŸ’° Advantage+ || US || BROAD || 7C || Existing_customer_5% || 15/12/24 Ad set,VIDEO,$515,"24,566",2024-12-18,2025-03-27,99
71,CB_2025_Mar_FB_3884_SO_V11_9x16_IMG_EN_New_C-NONE_Evergreen_CTA-NONE_Angle-W-B-C_M-Nate_VL-15s_G-MF_P-OG_S-NEW,3884 - Body Shaming Angle || Enhancements: OFF || CBV1 || Batch 2 || 7C || 10/03/25w11,,$513,"26,194",2025-03-12,2025-03-15,3
72,CB_2025_Jan_FB_3751_VK-DP_V02_4x5_IMG_EN_New_C-BulletPoints_Sale_CTA-NY_Angle-W-B-C_M-NONE_VL-None_G-M_P-GLP1_S-NONE.jpg,GLP-1 ðŸ’œ || ASC+ || US || 5% EXISTING CAP || 7C || 20/02/25 . Ad set,SHARE,$502,"22,641",2025-03-05,2025-03-18,13
73,CB_2025_Jan_FB_3723_SO_V04_4x5_IMG_EN_New_C-NONE_Evergreen_CTA-SALE_Angle-W_M-NONE_VL-None_G-NONE_P-NONE_S-NONE,US || Kilo Product's leads LAL || 7C || 04/03/25,SHARE,$485,"27,831",2025-03-04,2025-03-27,23
74,CB_2025_Feb_FB_3872_DT-DP_V04_9x16_VID_EN_Opti_C-Trend_Sale_CTA-70_Angle-W_M-MIX_VL-30s_G-MF_P-OG_FB1989V08,3872 - new hooks on winner ad || Enhancements: OFF || CBV1 || Batch 1 || 7C || 10/03/25w11,,$452,"13,551",2025-03-10,2025-03-15,5
75,CB_2025_Feb_FB_3827_LZ_V01_1x1_IMG_EN_Opti_C-Headline_Evergreen_CTA-NONE_Angle-W_M-NONE_VL-None_G-M_P-CBV2_S-NONE_FB3723V04.png,US || CBV2 || V1 vs V2 || V2 - PREMIUM || 7C || 15/03/25,,$444,"26,558",2025-03-15,2025-03-18,3
76,CB_2025_Feb_FB_3811_DT_V04_9x16_VID_EN_Opti_C-Sale_Sale_CTA-70_Angle-W_M-JOG_VL-45s_G-M-F_P-OG_S-Moon_FB2263V04,3811 - #133 Green screen timeframe hooks || Enhancements: OFF || CBV1 || Batch 1 || 7C || 19/02/25w08 || Kostas,VIDEO,$442,"13,704",2025-02-19,2025-03-11,20
77,CB_2024_Sep_FB_3175_DA-KB_V04_1x1_IMG_EN_New_C-ADVRT_Evergreen_CTA-NONE_Angle-W_M-NONE_VL-None_G-NONE_P-CBV2_S-NONE_blog_colonbroomvsmammothhighprice3_cv_en,CBV2 || A/B test CTA button: Variaton || CBV2 vs Happy Mammoth || 7C || 13/03/25,,$439,"16,176",2025-03-13,2025-03-26,13
78,CB_2025_Mar_FB_3899_LZ-VU_V02_1x1_IMG_EN_New_C-BeforeAfter_Evergreen_CTA-NONE_Angle-W_M-NONE_VL-None_G-M_P-OG_S-NONE,3899 - ejaculation angle || Enhancements: OFF || CBV1 || Batch 1 || 7C || 10/03/25w11,,$414,"27,735",2025-03-11,2025-03-15,4
79,CB_2025_Mar_FB_3889_LZ-DP_V03_1x1_IMG_EN_New_C-BeforeAfter_Evergreen_CTA-NONE_Angle-W_M-NONE_VL-None_G-M_P-OG_S-NONE_FB3821V11,3889 - Admers man boobs opti || Enhancements: OFF || CBV1 || Batch 1 || 7C || 10/03/25w11,,$411,"22,864",2025-03-12,2025-03-15,3
80,CB_2025_Jan_FB_3723_SO_V07_4x5_IMG_EN_New_C-NONE_Evergreen_CTA-SALE_Angle-W_M-NONE_VL-None_G-NONE_P-NONE_S-NONE,ðŸŒ¶ï¸ || US || ASC+ || ->CC141 || VIDEO Only || US+CA || 0% EXISTING CAP || 7C || 07/08.24  Ad set,SHARE,$408,"23,462",2025-02-04,2025-03-27,51
81,CB_2025_Mar_FB_3888_LZ-DP_V03_1x1_IMG_EN_New_C-Headline_Evergreen_CTA-SALE_Angle-W_M-NONE_VL-None_G-NONE_P-OG_S-NONE,3888 - man boobs new copy crazy visual || Enhancements: OFF || CBV1 || Batch 1 || 7C || 10/03/25w11,,$406,"18,588",2025-03-10,2025-03-15,5
82,CB_2025_Feb_FB_3883_LZ-JT_V02_9x16_VID_EN_New_C-Headline_Evergreen_CTA-NONE_Angle-B-C_M-NONE_VL-15s_G-NONE_P-OG_S-NEW,3885 - Just woke up in tears || Enhancements: OFF || CBV1 || Batch 1 || 7C || 10/03/25w11,,$405,"18,050",2025-03-10,2025-03-15,5
83,CB_2025_Feb_FB_3877_DT-DP_V04_1x1_IMG_EN_New_C-Headline_Evergreen_CTA-NONE_Angle-W-B-C_M-NONE_VL-None_G-NONE_P-OG_S-NONE.png,3877 - IMG ads for CB V1 || Enhancements: OFF || CBV1 || Batch 1 || 7C || 04/03/25w10 || Valentinas,SHARE,$379,"14,103",2025-03-04,2025-03-15,11
84,CB_2025_Mar_FB_3890_DT_V04_1x1_IMG_EN_New_C-NONE_Evergreen_CTA-None_Angle-W_M-NONE_VL-None_G-NONE_P-OG_S-NONE,3890 - Your Peak Performance in 6 weeks || Enhancements: OFF || CBV1 || Batch 1 || 7C || 10/03/25w11,,$347,"19,502",2025-03-12,2025-03-27,15
85,CB_2024_Sep_FB_3175_DA-KB_V04_1x1_IMG_EN_New_C-ADVRT_Evergreen_CTA-NONE_Angle-W_M-NONE_VL-None_G-NONE_P-CBV2_S-NONE_blog_colonbroomvsmammoth_cv_en,CBV2 || A/B test CTA button: Control || CBV2 vs Happy Mammoth || 7C || 13/03/25,,$347,"12,118",2025-03-13,2025-03-26,13
86,CB_2025_Jan_FB_3723_SO_V04_4x5_IMG_EN_New_C-NONE_Evergreen_CTA-SALE_Angle-W_M-NONE_VL-None_G-NONE_P-NONE_S-NONE,US || V1 vs V2 || V1 - ORIGINAL || 7C || 15/03/25,,$346,"19,501",2025-03-15,2025-03-18,3
87,CB_2025_Feb_FB_3817_SO_V01_4x5_IMG_EN_Opti_C-NONE_Evergreen_CTA-SALE_Angle-W_M-NONE_VL-None_G-NONE_P-NONE_S-NONE_FB3723V07,CBV2 || AU || ðŸ’° Advantage+ || US || BROAD || 7C || Existing_customer_5% || 19/12/24 Ad set,SHARE,$343,"22,095",2025-02-14,2025-03-27,41
88,CB_2025_Jan_FB_3741_LZ-JG_V01_4x5_IMG_EN_Opti_C-Headline_Evergreen_CTA-NONE_Angle-W_M-NONE_VL-None_G-NONE_P-CBV2_S-NONE_FB3357V01,CBV2 || US || Manual Bid: ROAS GOAL: 1.00 -> 1.1 || 7DC || 22/01/2025,SHARE,$329,"10,991",2025-01-22,2025-03-27,64
89,CB_2025_Mar_FB_3887_VK-DP_V01_9x16_VID_EN_Opti_C-BulletPoints_Evergreen_CTA-65_Angle-W-B-C_M-NONE_VL-None_G-M_P-OG_S-MOON_FB3090V02,3887 - 3090 opti for man boobs - VK || Enhancements: OFF || CBV1 || Batch 1 || 7C || 10/03/25w11,,$318,"12,714",2025-03-10,2025-03-15,5
90,CB_2025_Mar_FB_3896_LZ_V02_1x1_IMG_EN_New_C-Headline_Evergreen_CTA-NONE_Angle-W_M-NONE_VL-None_G-M_P-OG_S-NONE - Copy,ðŸŒ¶ï¸ || US || ASC+ || ->CC141 || VIDEO Only || US+CA || 0% EXISTING CAP || 7C || 07/08.24  Ad set,,$317,"14,065",2025-03-15,2025-03-21,6
91,CB_2025_Feb_FB_3803_CHUB_V11_1x1_IMG_EN_New_C-NONE_CTA-NONE_Angle-None_M-NONE_VL-None_TR-None_G-NONE_P-NONE_S-NONE_blog_cbglp1_cv_en,Attribution Test - NB UTM - URL || GLP-1 || LP:HI | 3803 Advertorials CHUB || Natural GLP-1 Enhancer Takes Its Place || Batch 3 || 12/07/25,,$304,"7,870",2025-03-12,2025-03-17,5
92,CB_2024_Sep_FB_3175_DA-KB_V01_1x1_IMG_EN_New_C-ADVRT_Evergreen_CTA-NONE_Angle-W_M-NONE_VL-None_G-NONE_P-CBV2_S-NONE_blog_colonbroomvsmammoth_cv_en,CBV2 || Advantage+ || Advertorial || Higher pricing || US || 0% EXISTING CAP || BROAD || 7C || 20/01/25  Campaign Ad set,SHARE,$292,"12,249",2025-01-20,2025-03-27,66
93,CB_2025_Jan_FB_3723_SO_V07_4x5_IMG_EN_New_C-NONE_Evergreen_CTA-SALE_Angle-W_M-NONE_VL-None_G-NONE_P-NONE_S-NONE,CBV2 || US || Manual Bid: ROAS GOAL: 1.00 -> 1.1 || 7DC || 22/01/2025,SHARE,$292,"12,771",2025-02-11,2025-03-27,44
94,CB_2024_Nov_FB_3264_LZ_V31_4x5_VID_EN_Opti_C-MakingOf_Sale_CTA-BF_Angle-W-B_M-CRAZY_VL-45s_G-M_P-OG_S-NEW_FB3004V02,CBV2 || AU || ðŸ’° Advantage+ || US || BROAD || 7C || Existing_customer_5% || 19/12/24 Ad set,VIDEO,$291,"9,879",2024-12-19,2025-03-27,98
95,CB_2024_Nov_FB_3305_SO-DP_V02_4x5_VID_EN_Opti_C-Sale_CTA-BF_Pain-W_M-Chris_VL-30s_TR-None_G-MF_P-Plan_S-NEW_FB2601V07,CBV2 || AU || ðŸ’° Advantage+ || US || BROAD || 7C || Existing_customer_5% || 19/12/24 Ad set,VIDEO,$275,"10,281",2024-12-19,2025-03-27,98
96,CB_2025_Mar_FB_3895_VK_V03_9x16_VID_EN_New_C-BulletPoints_Evergreen_CTA-65_Angle-W-B-C_M-NONE_VL-15s_G-M_P-OG_S-MOON,3895 - #15 Me vs Them - VK || Enhancements: OFF || CBV1 || Batch 1 || 7C || 16/03/25w12,,$271,"14,067",2025-03-14,2025-03-20,6
97,CB_2025_Feb_FB_3817_SO_V01_4x5_IMG_EN_Opti_C-NONE_Evergreen_CTA-SALE_Angle-W_M-NONE_VL-None_G-NONE_P-NONE_S-NONE_FB3723V07,CBV2 || EU (UK) || ðŸ’° Advantage+ || US || BROAD || 7C || Existing_customer_5% || 15/12/24 Ad set,SHARE,$262,"15,978",2025-02-14,2025-03-27,41
98,CB_2025_Feb_FB_3818_LZ-VU_V18_1x1_IMG_EN_Opti_C-Headline_Evergreen_CTA-NONE_Angle-Cort_M-NONE_VL-None_G-NONE_P-NONE_S-NONE_FB3251V01,3818 - It's not cheap Months+holidays || March || Enhancements: OFF || CBV1 || 7C || 14/03/25w11,,$259,"6,903",2025-03-14,2025-03-17,3
99,CB_2025_Mar_FB_3886_LZ-DP_V02_1x1_IMG_EN_Opti_C-Headline_Evergreen_CTA-SALE_Angle-W_M-NONE_VL-None_G-NONE_P-OG_S-NONE_FB3779V02,3886 - Man boobs new copy  || Enhancements: OFF || CBV1 || Batch 1 || 7C || 10/03/25w11,,$259,"10,362",2025-03-10,2025-03-15,5
100,CB_2025_Feb_FB_3803_CHUB_V11_1x1_IMG_EN_New_C-NONE_CTA-NONE_Angle-None_M-NONE_VL-None_TR-None_G-NONE_P-NONE_S-NONE_blog_cbglp1_cv_en,Attribution Test - Standard URL || GLP-1 || LP:HI | 3803 Advertorials CHUB || Natural GLP-1 Enhancer Takes Its Place || Batch 3 || 12/07/25,,$253,"6,598",2025-03-12,2025-03-18,6
101,CB_2025_Mar_FB_3887_VK-DP_V02_9x16_VID_EN_Opti_C-BulletPoints_Evergreen_CTA-65_Angle-W-B-C_M-NONE_VL-None_G-M_P-OG_S-WOOD_FB3090V02,3887 - 3090 opti for man boobs - VK || Enhancements: OFF || CBV1 || Batch 1 || 7C || 10/03/25w11,,$238,"10,775",2025-03-10,2025-03-15,5
102,CB_2024_Oct_FB_3252_VK-DP_V04_4x5_VID_EN_Opti_C-MakingOf_Evergreen_CTA-SALE_Angle-W-B-C_M-JOG_VL-45s_G-F_P-OG_S-MOON_FB3090V02,ðŸŒ¶ï¸ || US || ASC+ || ->CC141 || VIDEO Only || US+CA || 0% EXISTING CAP || 7C || 07/08.24  Ad set,VIDEO,$233,"9,256",2024-11-07,2025-03-27,140
103,CB_2025_Jan_FB_3723_SO_V20_4x5_IMG_EN_New_C-NONE_Evergreen_CTA-SALE_Angle-W_M-NONE_VL-None_G-NONE_P-NONE_S-NONE,3723 - Notion Idea #92 MAN BOOBS || Enhancements: OFF || CBV1 || Batch 4 || 1C || 28/01/25w05 || Kostas,SHARE,$225,"15,598",2025-01-28,2025-03-11,42
104,CB_2025_Feb_FB_3869_DT_V04_9x16_GIF_EN_Opti_C-NONE_Evergreen_CTA-None_Angle-W_M-NONE_VL-None_G-NONE_P-NONE_S-New_FB3723V04.mp4,3869 - Man boobs GIF opti || Enhancements: OFF || CBV1 || Batch 1 || 7C || 03/03/25w10 || Valentinas,VIDEO,$223,"10,420",2025-03-03,2025-03-11,8
105,CB_2025_Mar_FB_3906_SO-JT_V01_1x1_IMG_EN_New_C-NONE_Evergreen_CTA-NONE_Angle-W-B-C_M-NONE_VL-None_G-NONE_P-OG_S-NONE,3906 - CB V1 SUMMER BOD || Enhancements: OFF || CBV1 || Batch 1 || 7C || 16/03/25w12,,$219,"8,924",2025-03-14,2025-03-20,6
106,CB_2025_Feb_FB_3827_LZ_V02_1x1_IMG_EN_Opti_C-Headline_Evergreen_CTA-NONE_Angle-W_M-NONE_VL-None_G-M_P-CBV2_S-NONE_FB3723V18,CBV2 || US || Manual Bid: ROAS GOAL: 1.00 -> 1.1 || 7DC || 22/01/2025,SHARE,$218,"8,225",2025-02-18,2025-03-27,37
107,CB_2025_Feb_FB_3812_SO_V03_4x5_IMG_EN_Opti_C-NONE_Evergreen_CTA-SALE_Angle-W_M-NONE_VL-None_G-NONE_P-NONE_S-NONE_FB3723V07,US || V1 vs V2 || V1 - ORIGINAL || 7C || 15/03/25,,$207,"9,802",2025-03-15,2025-03-18,3
108,CB_2024_Nov_FB_3264_LZ_V31_4x5_VID_EN_Opti_C-MakingOf_Sale_CTA-BF_Angle-W-B_M-CRAZY_VL-45s_G-M_P-OG_S-NEW_FB3004V02,CBV2 || EU (UK) || ðŸ’° Advantage+ || US || BROAD || 7C || Existing_customer_5% || 15/12/24 Ad set,VIDEO,$205,"11,322",2024-12-19,2025-03-27,98
109,CB_2025_Mar_FB_3902_SO-JT_V03_1x1_IMG_EN_New_C-NONE_Evergreen_CTA-NONE_Angle-W-B-C_M-NONE_VL-None_G-NONE_P-OG_S-NONE copy,3902 - OZEMPIC MEET YOUR MATCH / V1 || Enhancements: OFF || CBV1 || Batch 1 || 7C || 16/03/25w12,,$205,"9,718",2025-03-14,2025-03-27,13
110,CB_2025_Mar_FB_3904_DT_V01_9x16_VID_EN_New_C-Trend_Evergreen_CTA-NONE_Angle-W_M-MIX_VL-30s_G-MF_P-OG_S-New,3904 - Notion / I thought my man was cheating on me || Enhancements: OFF || CBV1 || Batch 1 || 7C || 16/03/25w12,,$202,"9,448",2025-03-14,2025-03-27,13
111,CB_2025_Mar_FB_3910_LZ-JG_V01_1x1_IMG_EN_Opti_C-Headline_Evergreen_CTA-NONE_Angle-W_M-NONE_VL-None_G-NONE_P-TRIAL_S-NONE_FB3251V02.png,US || Free trial offer || Trial ads || 7C || 15/03/25,,$194,"7,935",2025-03-15,2025-03-17,2
112,CB_2025_Jan_FB_3723_SO_V04_4x5_IMG_EN_New_C-NONE_Evergreen_CTA-SALE_Angle-W_M-NONE_VL-None_G-NONE_P-NONE_S-NONE.png,US || Free trial offer || 7C || 11/03/25,,$192,"10,426",2025-03-11,2025-03-14,3
113,CB_2025_Mar_FB_3886_LZ-DP_V01_1x1_IMG_EN_Opti_C-Headline_Evergreen_CTA-SALE_Angle-W_M-NONE_VL-None_G-NONE_P-OG_S-NONE_FB3779V02,3886 - Man boobs new copy  || Enhancements: OFF || CBV1 || Batch 1 || 7C || 10/03/25w11,,$191,"7,169",2025-03-10,2025-03-15,5
114,CB_2025_Jan_FB_3742_SO-DP-KB_V06_4x5_IMG_EN_Opti_C-NONE_Evergreen_CTA-SALE_Angle-W_M-NONE_VL-None_G-NONE_P-CBV2_S-NONE3665V01,CBV2 || EU (UK) || ðŸ’° Advantage+ || US || BROAD || 7C || Existing_customer_5% || 15/12/24 Ad set,SHARE,$190,"10,189",2025-02-18,2025-03-18,28
115,CB_2024_Aug_FB_3097_VK-DP_V03_9x16_VID_EN_Opti_C-Benefits_CTA-SMR_Pain-W-B_M-MIX_VL-45s_TR-None_G-MF_P-OG_S-WHAT_FB2516V13,US || Kilo Product's leads LAL || 7C || 04/03/25,VIDEO,$186,"6,648",2025-03-04,2025-03-27,23
116,CB_2025_Mar_FB_3894_LZ_V04_1x1_IMG_EN_New_C-Testimonial_Evergreen_CTA-NONE_Angle-GH_M-NONE_VL-45s_G-M_P-OG_S-NONE,3894 - hangover angle IMG || Enhancements: OFF || CBV1 || Batch 1 || 7C || 10/03/25w11,,$185,"10,828",2025-03-10,2025-03-15,5
117,CB_2024_Sep_FB_3175_DA-KB_V02_1x1_IMG_EN_New_C-ADVRT_Evergreen_CTA-NONE_Angle-W_M-NONE_VL-None_G-NONE_P-CBV2_S-NONE_blog_colonbroomvsmammoth_cv_en,CBV2 || Advantage+ || Advertorial || Higher pricing || US || 0% EXISTING CAP || BROAD || 7C || 20/01/25  Campaign Ad set,SHARE,$178,"8,407",2025-01-20,2025-03-27,66
118,CB_2025_Jan_FB_3756_VK-DP_V03_4x5_IMG_EN_New_C-BulletPoints_Evergreen_CTA-NONE_Angle-W-B-C_M-NONE_VL-None_G-M_P-GLP1_S-NONE.png,3756 - opti 2834 GLP1 || Enhancements: OFF || GLP-1 || Batch 1 || 7C || 24/02/25w09 || Valentinas,SHARE,$171,"5,786",2025-02-24,2025-03-11,15
119,CB_2025_Mar_FB_3905_SO-JT_V02_1x1_IMG_EN_New_C-NONE_Evergreen_CTA-NONE_Angle-W-B-C_M-NONE_VL-None_G-NONE_P-OG_S-NONE,3905 - CB V1 FAUX || Enhancements: OFF || CBV1 || Batch 1 || 7C || 16/03/25w12,,$170,"6,022",2025-03-14,2025-03-20,6
120,CB_2024_Jan_FB_2762_IK_V05_1x1_IMG_EN_New_C-WrittenTesti_CTA-CTA_Pain-W-B-C_M-NONE_VL-None_TR-None_G-NONE_P-V2_S-NONE,CBV2 || EU (UK) || ðŸ’° Advantage+ || US || BROAD || 7C || Existing_customer_5% || 15/12/24 Ad set,SHARE,$157,"6,761",2024-12-15,2025-03-27,102
121,CB_2025_Mar_FB_3888_LZ-DP_V02_1x1_IMG_EN_New_C-Headline_Evergreen_CTA-SALE_Angle-W_M-NONE_VL-None_G-NONE_P-OG_S-NONE,3888 - man boobs new copy crazy visual || Enhancements: OFF || CBV1 || Batch 1 || 7C || 10/03/25w11,,$153,"6,596",2025-03-10,2025-03-15,5
122,CB_2025_Mar_FB_3886_LZ-DP_V04_1x1_IMG_EN_Opti_C-Headline_Evergreen_CTA-SALE_Angle-W_M-NONE_VL-None_G-NONE_P-OG_S-NONE_FB3779V02,3886 - Man boobs new copy  || Enhancements: OFF || CBV1 || Batch 1 || 7C || 10/03/25w11,,$151,"6,870",2025-03-10,2025-03-15,5
123,IM_CB1,US || VSL || Aff's image ||  Taboola ads||  Landing: vsl-2 || 7C || 12/03/25,SHARE,$149,"5,191",2025-03-12,2025-03-14,2
124,CB_2025_Mar_FB_3889_LZ-DP_V01_1x1_IMG_EN_New_C-BeforeAfter_Evergreen_CTA-NONE_Angle-W_M-NONE_VL-None_G-M_P-OG_S-NONE_FB3821V11,3889 - Admers man boobs opti || Enhancements: OFF || CBV1 || Batch 1 || 7C || 10/03/25w11,,$146,"6,448",2025-03-12,2025-03-15,3
125,CB_2024_Feb_FB_2834_DA_V04_4x5_IMG_EN_Opti_C-SingleTesti_CTA-NONE_Pain-W_M-NONE_VL-None_TR-None_G-NONE_P-V2_S-NONE_FB2759V04,CBV2 || AU || ðŸ’° Advantage+ || US || BROAD || 7C || Existing_customer_5% || 19/12/24 Ad set,SHARE,$145,"6,341",2024-12-19,2025-03-27,98
126,CB_2025_Feb_FB_3811_DT_V02_9x16_VID_EN_Opti_C-Pointing_Sale_CTA-70_Angle-W_M-JOG_VL-30s_G-F_P-OG_S-New_FB2103V02,3811 - #133 Green screen timeframe hooks || Enhancements: OFF || CBV1 || Batch 1 || 7C || 19/02/25w08 || Kostas,VIDEO,$145,"4,968",2025-02-19,2025-03-12,21
127,CB_2025_Mar_FB_3894_LZ_V05_1x1_IMG_EN_New_C-Testimonial_Evergreen_CTA-NONE_Angle-GH_M-NONE_VL-45s_G-M_P-OG_S-NONE,3894 - hangover angle IMG || Enhancements: OFF || CBV1 || Batch 1 || 7C || 10/03/25w11,,$144,"7,056",2025-03-10,2025-03-15,5
128,CB_2024_Dec_FB_3592_VK-DP_V10_4x5_VID_EN_New_C-BulletPoints_Sale_CTA-SALE_Angle-W-B-C_M-NONE_VL-30s_G-F_P-OG_S-NEW - Copy,ðŸŒ¶ï¸ || US || ASC+ || ->CC141 || VIDEO Only || US+CA || 0% EXISTING CAP || 7C || 07/08.24  Ad set,VIDEO,$142,"5,723",2024-12-21,2025-03-27,96
129,CB_2025_Feb_FB_3883_LZ-JT_V03_9x16_VID_EN_New_C-Headline_Evergreen_CTA-NONE_Angle-B-C_M-NONE_VL-15s_G-NONE_P-OG_S-NEW,3885 - Just woke up in tears || Enhancements: OFF || CBV1 || Batch 1 || 7C || 10/03/25w11,,$141,"5,899",2025-03-10,2025-03-15,5
130,CB_2025_Mar_FB_3894_LZ_V01_1x1_IMG_EN_New_C-Testimonial_Evergreen_CTA-NONE_Angle-GH_M-NONE_VL-45s_G-M_P-OG_S-NONE,3894 - hangover angle IMG || Enhancements: OFF || CBV1 || Batch 1 || 7C || 10/03/25w11,,$140,"9,525",2025-03-10,2025-03-15,5
131,CB_2025_Jan_FB_3756_VK-DP_V01_4x5_IMG_EN_New_C-BulletPoints_Evergreen_CTA-NONE_Angle-W-B-C_M-NONE_VL-None_G-M_P-GLP1_S-NONE.png,3756 - opti 2834 GLP1 || Enhancements: OFF || GLP-1 || Batch 1 || 7C || 24/02/25w09 || Valentinas,SHARE,$140,"5,372",2025-02-24,2025-03-11,15
132,CB_2025_Feb_FB_3877_DT-DP_V02_1x1_IMG_EN_New_C-Headline_Evergreen_CTA-NONE_Angle-W-B-C_M-NONE_VL-None_G-NONE_P-OG_S-NONE.png,3877 - IMG ads for CB V1 || Enhancements: OFF || CBV1 || Batch 1 || 7C || 04/03/25w10 || Valentinas,SHARE,$132,"4,794",2025-03-04,2025-03-15,11
133,CB_2025_Feb_FB_3827_LZ_V03_1x1_IMG_EN_Opti_C-Headline_Evergreen_CTA-SALE_Angle-W_M-NONE_VL-None_G-M_P-CBV2_S-NONE_FB3705V02,CBV2 || US || Manual Bid: ROAS GOAL: 1.00 -> 1.1 || 7DC || 22/01/2025,SHARE,$130,"4,876",2025-02-18,2025-03-27,37
134,CB_2024_Sep_FB_3175_DA-KB_V01_1x1_IMG_EN_New_C-ADVRT_Evergreen_CTA-NONE_Angle-W_M-NONE_VL-None_G-NONE_P-CBV2_S-NONE_blog_colonbroomvsmammoth_cv_en,CBV2 || A/B test CTA button: Control || CBV2 vs Happy Mammoth || 7C || 13/03/25,,$128,"5,048",2025-03-13,2025-03-26,13
135,CB_2025_Mar_FB_3890_DT_V02_1x1_IMG_EN_New_C-NONE_Evergreen_CTA-None_Angle-W_M-NONE_VL-None_G-NONE_P-OG_S-NONE,ðŸŒ¶ï¸ || US || ASC+ || ->CC141 || VIDEO Only || US+CA || 0% EXISTING CAP || 7C || 07/08.24  Ad set,,$127,"6,752",2025-03-15,2025-03-27,12
136,CB_2025_Jan_FB_3723_SO_V07_4x5_IMG_EN_New_C-NONE_Evergreen_CTA-SALE_Angle-W_M-NONE_VL-None_G-NONE_P-NONE_S-NONE,US || Kilo Product's leads LAL || 7C || 04/03/25,SHARE,$126,"5,727",2025-03-04,2025-03-27,23
137,CB_2025_Mar_FB_3911_DT_V04_9x16_VID_EN_Opti_C-Sale_Sale_CTA-Patrick_Angle-W_M-JANW_VL-30s_G-M_P-OG_S-WHAT_FB2284V05.mp4,EU (UK) || 3911 - St. Patrick day opti || 7C || 16/03/2025w11,VIDEO,$124,"6,239",2025-03-16,2025-03-18,2
138,CB_2025_Mar_FB_3879_VK-DP_V03_9x16_VID_EN_New_C-BulletPoints_Evergreen_CTA-65_Angle-W-B-C_M-NONE_VL-30s_G-M_P-OG_S-NEW,3879 - Gut health for muscles || Enhancements: OFF || CBV1 || Batch 1 || 7C || 10/03/25w11,,$122,"5,411",2025-03-10,2025-03-20,10
139,CB_2025_Feb_FB_3877_DT-DP_V01_1x1_IMG_EN_New_C-Headline_Evergreen_CTA-NONE_Angle-W-B-C_M-NONE_VL-None_G-NONE_P-OG_S-NONE.png,3877 - IMG ads for CB V1 || Enhancements: OFF || CBV1 || Batch 1 || 7C || 04/03/25w10 || Valentinas,SHARE,$113,"4,380",2025-03-04,2025-03-15,11
140,CB_2025_Mar_FB_3891_VK_V05_1x1_IMG_EN_New_C-BulletPoints_Evergreen_CTA-65_Angle-W-B-C_M-NONE_VL-None_G-M_P-OG_S-NONE-1,3891 - LOW T LEVELS - VK || Enhancements: OFF || CBV1 || Batch 2 || 7C || 10/03/25w11,,$109,"5,377",2025-03-11,2025-03-27,16
141,Taboola - ColonB,US || VSL || Aff's image ||  Taboola ads||  Landing: vsl-2 || 7C || 12/03/25,SHARE,$109,"2,838",2025-03-12,2025-03-14,2
142,CB_2025_Mar_FB_3897_SO_V08_1x1_IMG_EN_New_C-NONE_Evergreen_CTA-NONE_Angle-W-B-C_M-NONE_VL-None_G-NONE_P-OG_S-NONE,3897 - #5 Blue-collar || Enhancements: OFF || CBV1 || Batch 1-2 || 7C || 16/03/25w12,,$105,"4,917",2025-03-14,2025-03-20,6
143,CB_2025_Jan_FB_3742_SO-DP-KB_V01_4x5_IMG_EN_Opti_C-NONE_Evergreen_CTA-SALE_Angle-W_M-NONE_VL-None_G-NONE_P-CBV2_S-NONE3665V01,CBV2 || EU (UK) || ðŸ’° Advantage+ || US || BROAD || 7C || Existing_customer_5% || 15/12/24 Ad set,SHARE,$102,"5,519",2025-02-04,2025-03-27,51
144,CB_2025_Mar_FB_3905_SO-JT_V01_1x1_IMG_EN_New_C-NONE_Evergreen_CTA-NONE_Angle-W-B-C_M-NONE_VL-None_G-NONE_P-OG_S-NONE,3905 - CB V1 FAUX || Enhancements: OFF || CBV1 || Batch 1 || 7C || 16/03/25w12,,$100,"3,978",2025-03-14,2025-03-20,6
145,CB_2025_Jan_FB_3756_VK-DP_V01_4x5_IMG_EN_New_C-BulletPoints_Evergreen_CTA-NONE_Angle-W-B-C_M-NONE_VL-None_G-M_P-GLP1_S-NONE.png,GLP-1 ðŸ’œ || ASC+ || US || 5% EXISTING CAP || 7C || 20/02/25 . Ad set,SHARE,$98,"4,360",2025-03-05,2025-03-18,13
146,CB_2025_Feb_FB_3872_DT-DP_V01_9x16_VID_EN_Opti_C-Trend_Sale_CTA-70_Angle-W_M-MIX_VL-30s_G-MF_P-OG_FB1989V08,3872 - new hooks on winner ad || Enhancements: OFF || CBV1 || Batch 1 || 7C || 10/03/25w11,,$97,"2,557",2025-03-10,2025-03-15,5
147,CB_2025_Feb_FB_3883_LZ-RP_V05_9x16_VID_EN_Opti_C-BulletPoints_Evergreen_CTA-SALE_Angle-W_M-JANW_VL-30s_G-M_P-OG_S-WHAT_FB2284V05,3883 - Wiiner opti man boobs t levels || Enhancements: OFF || CBV1 || Batch 1 || 7C || 10/03/25w11,,$92,"4,937",2025-03-10,2025-03-27,17
148,CB_2025_Mar_FB_3884_SO_V14_9x16_IMG_EN_New_C-NONE_Evergreen_CTA-NONE_Angle-W-B-C_M-Nate_VL-15s_G-M_P-OG_S-NEW,3884 - Body Shaming Angle || Enhancements: OFF || CBV1 || Batch 4 || 7C || 10/03/25w11,,$90,"3,818",2025-03-10,2025-03-20,10
149,CB_2023_Jul_FB_2217_IB_V04_9x16_VID_EN_Opti_C-Pointing_CTA-SMR_Pain-W-B_M-TRC_VL-30s_TR-None_G-F_P-None_S-FRIGGA,US || Manual Bid || BFCM || COST CAP 71 || 1C || 15/11/24,VIDEO,$90,"3,369",2024-11-15,2025-03-27,132
150,Taboola - ColonB,US || VSL || Aff's image ||  Taboola ads||  Landing: vsl-2 || 7C || 12/03/25,SHARE,$89,"2,352",2025-03-12,2025-03-12,0
151,CB_2025_Mar_FB_3911_DT_V01_1x1_IMG_EN_New_C-Headline_Evergreen_CTA-Patrick_Angle-W-B-C_M-NONE_VL-None_G-NONE_P-V2_S-NONE_FB2814V01.png,EU (UK) || 3911 - St. Patrick day opti || 7C || 16/03/2025w11,SHARE,$89,"5,052",2025-03-16,2025-03-18,2
152,CB_2025_Mar_FB_3894_LZ_V02_1x1_IMG_EN_New_C-Testimonial_Evergreen_CTA-NONE_Angle-GH_M-NONE_VL-45s_G-M_P-OG_S-NONE,3894 - hangover angle IMG || Enhancements: OFF || CBV1 || Batch 1 || 7C || 10/03/25w11,,$87,"5,371",2025-03-10,2025-03-15,5
153,CB_2025_Jan_FB_3742_SO-DP-KB_V06_4x5_IMG_EN_Opti_C-NONE_Evergreen_CTA-SALE_Angle-W_M-NONE_VL-None_G-NONE_P-CBV2_S-NONE3665V01.png,US || CBV2 || V1 vs V2 || V2 - PREMIUM || 7C || 15/03/25,,$85,"4,297",2025-03-15,2025-03-18,3
154,CB_2024_Feb_FB_2834_DA_V02_4x5_IMG_EN_Opti_C-SingleTesti_CTA-NONE_Pain-W_M-NONE_VL-None_TR-None_G-NONE_P-V2_S-NONE_FB2759V04,CBV2 || AU || ðŸ’° Advantage+ || US || BROAD || 7C || Existing_customer_5% || 19/12/24 Ad set,SHARE,$81,"3,346",2024-12-19,2025-03-27,98
155,CB_2025_Mar_FB_3891_VK_V07_1x1_IMG_EN_New_C-BulletPoints_Evergreen_CTA-65_Angle-W-B-C_M-NONE_VL-None_G-M_P-OG_S-NONE,3891 - LOW T LEVELS - VK || Enhancements: OFF || CBV1 || Batch 2 || 7C || 10/03/25w11,,$78,"4,124",2025-03-11,2025-03-27,16
156,CB_2025_Mar_FB_3893_CHUB-AS_V01_9x16_VID_EN_New_C-NONE_CTA-NONE_Angle-None_M-NONE_VL-None_TR-None_G-NONE_P-NONE_S-NONE,3881 - CHUB Boomer Daughter & 3893 CHUB Boomer Mom || Enhancements: OFF || CBV1 || 7C || 16/03/25w12,,$77,"3,969",2025-03-14,2025-03-20,6
157,CB_2025_Mar_FB_3904_DT_V02_9x16_VID_EN_New_C-Trend_Evergreen_CTA-NONE_Angle-W_M-MIX_VL-30s_G-MF_P-OG_S-New,3904 - Notion / I thought my man was cheating on me || Enhancements: OFF || CBV1 || Batch 1 || 7C || 16/03/25w12,,$74,"3,430",2025-03-14,2025-03-27,13
158,CB_2025_Mar_FB_3897_SO_V07_1x1_IMG_EN_New_C-NONE_Evergreen_CTA-NONE_Angle-W-B-C_M-NONE_VL-None_G-NONE_P-OG_S-NONE,3897 - #5 Blue-collar || Enhancements: OFF || CBV1 || Batch 1-2 || 7C || 16/03/25w12,,$73,"3,061",2025-03-14,2025-03-20,6
159,CB_2025_Mar_FB_3881_CHUB-AS_V01_9x16_VID_EN_New_C-NONE_CTA-NONE_Angle-None_M-NONE_VL-None_TR-None_G-NONE_P-NONE_S-NONE,3881 - CHUB Boomer Daughter & 3893 CHUB Boomer Mom || Enhancements: OFF || CBV1 || 7C || 16/03/25w12,,$71,"3,807",2025-03-14,2025-03-20,6
160,CB_2025_Feb_FB_3883_LZ-JT_V01_9x16_VID_EN_New_C-Headline_Evergreen_CTA-NONE_Angle-B-C_M-NONE_VL-15s_G-NONE_P-OG_S-NEW,3885 - Just woke up in tears || Enhancements: OFF || CBV1 || Batch 1 || 7C || 10/03/25w11,,$69,"2,578",2025-03-10,2025-03-15,5
161,CB_2025_Mar_FB_3891_VK_V08_1x1_IMG_EN_New_C-BulletPoints_Evergreen_CTA-65_Angle-W-B-C_M-NONE_VL-None_G-M_P-OG_S-NONE,3891 - LOW T LEVELS - VK || Enhancements: OFF || CBV1 || Batch 2 || 7C || 10/03/25w11,,$65,"3,421",2025-03-11,2025-03-27,16
162,CB_2025_FEB_FB_3666_VK-JT_V03_4x5_VID_EN_NEW_C-BulletPoints_Sale_CTA-NY_Angle-W-B-C_M-TRC_VL-30s_G-F_P-OG_S-NEW,ðŸŒ¶ï¸ || US || ASC+ || ->CC141 || VIDEO Only || US+CA || 0% EXISTING CAP || 7C || 07/08.24  Ad set,VIDEO,$65,"3,296",2025-01-20,2025-03-19,58
163,CB_2025_Jan_FB_3072_V02_4x5_IMG_EN_New_C-Headline_Seasonal_CTA-None_Angle-W_M-NONE_VL-None_G-NONE_P-OG_S-NONE,CBV2 || EU (UK) || ðŸ’° Advantage+ || US || BROAD || 7C || Existing_customer_5% || 15/12/24 Ad set,SHARE,$61,"3,374",2025-01-17,2025-03-14,56
164,CB_2025_Mar_FB_3897_SO_V03_1x1_IMG_EN_New_C-NONE_Evergreen_CTA-NONE_Angle-W-B-C_M-NONE_VL-None_G-NONE_P-OG_S-NONE,3897 - #5 Blue-collar || Enhancements: OFF || CBV1 || Batch 1-2 || 7C || 16/03/25w12,,$60,"2,943",2025-03-14,2025-03-20,6
165,CB_2024_Aug_FB_3097_VK-DP_V03_9x16_VID_EN_Opti_C-Benefits_CTA-SMR_Pain-W-B_M-MIX_VL-45s_TR-None_G-MF_P-OG_S-WHAT_FB2516V13,US || Free trial offer || 7C || 11/03/25,,$59,"2,177",2025-03-11,2025-03-14,3
166,CB_2023_Jul_FB_2217_IB_V04_9x16_VID_EN_Opti_C-Pointing_CTA-SMR_Pain-W-B_M-TRC_VL-30s_TR-None_G-F_P-None_S-FRIGGA,US || Manual Bid || BFCM || COST CAP 81 || 1C || 15/11/24,VIDEO,$59,"2,405",2024-11-15,2025-03-16,121
167,CB_2024_Sep_FB_3175_DA-KB_V01_1x1_IMG_EN_New_C-ADVRT_Evergreen_CTA-NONE_Angle-W_M-NONE_VL-None_G-NONE_P-CBV2_S-NONE_blog_colonbroomvsmammothhighprice3_cv_en,CBV2 || A/B test CTA button: Variaton || CBV2 vs Happy Mammoth || 7C || 13/03/25,,$57,"2,496",2025-03-13,2025-03-26,13
168,CB_2025_Mar_FB_3881_CHUB-AS_V04_9x16_VID_EN_New_C-NONE_CTA-NONE_Angle-None_M-NONE_VL-None_TR-None_G-NONE_P-NONE_S-NONE,3881 - CHUB Boomer Daughter & 3893 CHUB Boomer Mom || Enhancements: OFF || CBV1 || 7C || 16/03/25w12,,$57,"2,764",2025-03-14,2025-03-20,6
169,CB_2024_Jan_FB_2764_RS_V04_9x16_VID_EN_Opti_C-SingleTesti_CTA-SALE_Pain-W_M-TRC_VL-45s_TR-None_G-F_P-OG_S-MOON_FB2263V04,CBV2 || EU (UK) || ðŸ’° Advantage+ || US || BROAD || 7C || Existing_customer_5% || 15/12/24 Ad set,VIDEO,$57,"1,705",2025-02-04,2025-03-14,38
170,CB_2025_Mar_FB_3887_VK-DP_V03_9x16_VID_EN_Opti_C-BulletPoints_Evergreen_CTA-65_Angle-W-B-C_M-NONE_VL-None_G-M_P-OG_S-WOOD_FB3090V02,3887 - 3090 opti for man boobs - VK || Enhancements: OFF || CBV1 || Batch 1 || 7C || 10/03/25w11,,$56,"2,644",2025-03-10,2025-03-15,5
171,CB_2025_Mar_FB_3894_LZ_V03_1x1_IMG_EN_New_C-Testimonial_Evergreen_CTA-NONE_Angle-GH_M-NONE_VL-45s_G-M_P-OG_S-NONE,3894 - hangover angle IMG || Enhancements: OFF || CBV1 || Batch 1 || 7C || 10/03/25w11,,$56,"2,642",2025-03-10,2025-03-15,5
172,CB_2024_Feb_FB_2814_MB-DP_V05_1x1_IMG_EN_New_C-WeightLoss_CTA-None_Pain-W-B-C_M-NONE_VL-None_TR-None_G-NONE_P-V2_S-NONE,CBV2 || EU (UK) || ðŸ’° Advantage+ || US || BROAD || 7C || Existing_customer_5% || 15/12/24 Ad set,SHARE,$56,"2,562",2025-01-31,2025-03-27,55
173,CB_2025_Feb_FB_3818_LZ-VU_V05_1x1_IMG_EN_Opti_C-Headline_Evergreen_CTA-NONE_Angle-Cort_M-NONE_VL-None_G-NONE_P-NONE_S-NONE_FB3251V01,3818 - It's not cheap Months+holidays || March || Enhancements: OFF || CBV1 || 7C || 14/03/25w11,,$53,"1,807",2025-03-14,2025-03-17,3
174,CB_2025_Mar_FB_3891_VK_V04_1x1_IMG_EN_New_C-BulletPoints_Evergreen_CTA-65_Angle-W-B-C_M-NONE_VL-None_G-M_P-OG_S-NONE,3891 - LOW T LEVELS - VK || Enhancements: OFF || CBV1 || Batch 1 || 7C || 10/03/25w11,,$52,"2,861",2025-03-12,2025-03-15,3
175,CB_2025_Mar_FB_3906_SO-JT_V04_1x1_IMG_EN_New_C-NONE_Evergreen_CTA-NONE_Angle-W-B-C_M-NONE_VL-None_G-NONE_P-OG_S-NONE,3906 - CB V1 SUMMER BOD || Enhancements: OFF || CBV1 || Batch 1 || 7C || 16/03/25w12,,$47,"2,061",2025-03-14,2025-03-20,6
176,Colon Broom_FB_VSL,US || VSL || VSL AS AN AD || Landing: SALES PAGE || 1C || 07/03/25,VIDEO,$46,623,2025-03-07,2025-03-10,3
177,CB_2025_Mar_FB_3905_SO-JT_V03_1x1_IMG_EN_New_C-NONE_Evergreen_CTA-NONE_Angle-W-B-C_M-NONE_VL-None_G-NONE_P-OG_S-NONE,3905 - CB V1 FAUX || Enhancements: OFF || CBV1 || Batch 1 || 7C || 16/03/25w12,,$46,"1,518",2025-03-14,2025-03-20,6
178,CB_2025_Mar_FB_3902_SO-JT_V02_1x1_IMG_EN_New_C-NONE_Evergreen_CTA-NONE_Angle-W-B-C_M-NONE_VL-None_G-NONE_P-OG_S-NONE,3902 - OZEMPIC MEET YOUR MATCH / V1 || Enhancements: OFF || CBV1 || Batch 1 || 7C || 16/03/25w12,,$45,"2,110",2025-03-14,2025-03-27,13
179,CB_2025_Mar_FB_3910_LZ-JG_V04_9x16_VID_EN_Opti_C-Testimonial_Evergreen_CTA-NONE_Angle-W_M-TRC_VL-15s_G-F_P-TRIAL_S-FRIGGA_FB2217V04.mp4,US || Free trial offer || Trial ads || ATC || 7C || 16/03/25,,$45,"1,746",2025-03-16,2025-03-27,11
180,CB_2025_Mar_FB_3888_LZ-DP_V04_1x1_IMG_EN_New_C-Headline_Evergreen_CTA-SALE_Angle-W_M-NONE_VL-None_G-NONE_P-OG_S-NONE,3888 - man boobs new copy crazy visual || Enhancements: OFF || CBV1 || Batch 1 || 7C || 10/03/25w11,,$45,"2,141",2025-03-10,2025-03-15,5
181,CB_2024_Aug_FB_3097_VK-DP_V03_9x16_VID_EN_Opti_C-Benefits_CTA-SMR_Pain-W-B_M-MIX_VL-45s_TR-None_G-MF_P-OG_S-WHAT_FB2516V13,US || V1 vs V2 || V1 - ORIGINAL || 7C || 15/03/25,,$44,"2,345",2025-03-15,2025-03-18,3
182,CB_2024_Mar_FB_2888_JG_V02_9x16_IMG_EN_Opti_C-Benefits_CTA-NONE_Pain-W_M-NONE_VL-None_TR-None_G-NONE_P-V2_S-NONE,CBV2 || AU || ðŸ’° Advantage+ || US || BROAD || 7C || Existing_customer_5% || 19/12/24 Ad set,SHARE,$44,"1,979",2024-12-19,2025-03-27,98
183,CB_2025_Mar_FB_3884_SO_V01_1x1_IMG_EN_New_C-NONE_Evergreen_CTA-NONE_Angle-W_M-NONE_VL-None_G-NONE_P-OG_S-NONE,3884 - Body Shaming Angle || Enhancements: OFF || CBV1 || Batch 1 || 7C || 10/03/25w11,,$42,"2,268",2025-03-12,2025-03-15,3
184,CB_2024_Oct_FB_3182_ZS-GC_V13_1x1_IMG_EN_New_C-UsVsThem_Evergreen_CTA-NONE_Angle-B-C_M-NONE_VL-None_G-NONE_P-OG_S-NONE,CBV2 || AU || ðŸ’° Advantage+ || US || BROAD || 7C || Existing_customer_5% || 19/12/24 Ad set,SHARE,$41,"1,656",2024-12-19,2025-03-27,98
185,CB_2025_Mar_FB_3899_LZ-VU_V03_1x1_IMG_EN_New_C-BeforeAfter_Evergreen_CTA-NONE_Angle-W_M-NONE_VL-None_G-M_P-OG_S-NONE,3899 - ejaculation angle || Enhancements: OFF || CBV1 || Batch 1 || 7C || 10/03/25w11,,$40,"2,393",2025-03-11,2025-03-15,4
186,CB_2025_Feb_FB_3872_DT-DP_V03_9x16_VID_EN_Opti_C-Trend_Sale_CTA-70_Angle-W_M-MIX_VL-30s_G-MF_P-OG_FB1989V08,3872 - new hooks on winner ad || Enhancements: OFF || CBV1 || Batch 1 || 7C || 10/03/25w11,,$40,"1,473",2025-03-10,2025-03-15,5
187,CB_2023_May_FB_2103_MB_V02_9x16_VID_EN_Opti_C-Sale_CTA-SMR_Pain-W_M-JOG_VL-30s_TR-None_G-M-F_P-None_S-What,US || Manual Bid || BID CAP 111 || 1C || 21/12/24,VIDEO,$40,"1,557",2024-12-28,2025-03-27,89
188,CB_2025_Mar_FB_3902_SO-JT_V01_1x1_IMG_EN_New_C-NONE_Evergreen_CTA-NONE_Angle-W-B-C_M-NONE_VL-None_G-NONE_P-OG_S-NONE,3902 - OZEMPIC MEET YOUR MATCH / V1 || Enhancements: OFF || CBV1 || Batch 1 || 7C || 16/03/25w12,,$39,"1,468",2025-03-14,2025-03-27,13
189,CB_2025_Mar_FB_3881_CHUB-AS_V05_9x16_VID_EN_New_C-NONE_CTA-NONE_Angle-None_M-NONE_VL-None_TR-None_G-NONE_P-NONE_S-NONE,3881 - CHUB Boomer Daughter & 3893 CHUB Boomer Mom || Enhancements: OFF || CBV1 || 7C || 16/03/25w12,,$37,"2,080",2025-03-14,2025-03-20,6
190,CB_2025_Jan_FB_3756_VK-DP_V02_4x5_IMG_EN_New_C-BulletPoints_Evergreen_CTA-NONE_Angle-W-B-C_M-NONE_VL-None_G-M_P-GLP1_S-NONE.png,3756 - opti 2834 GLP1 || Enhancements: OFF || GLP-1 || Batch 1 || 7C || 24/02/25w09 || Valentinas,SHARE,$37,"1,268",2025-02-24,2025-03-11,15
191,CB_2025_Mar_FB_3884_SO_V13_9x16_IMG_EN_New_C-NONE_Evergreen_CTA-NONE_Angle-W-B-C_M-Nate_VL-15s_G-M_P-OG_S-NEW,3884 - Body Shaming Angle || Enhancements: OFF || CBV1 || Batch 4 || 7C || 10/03/25w11,,$37,"1,865",2025-03-10,2025-03-20,10
192,CB_2025_Jan_FB_3723_SO_V19_4x5_IMG_EN_New_C-NONE_Evergreen_CTA-SALE_Angle-W_M-NONE_VL-None_G-NONE_P-NONE_S-NONE,3723 - Notion Idea #92 MAN BOOBS || Enhancements: OFF || CBV1 || Batch 4 || 1C || 28/01/25w05 || Kostas,SHARE,$37,"2,211",2025-01-28,2025-03-11,42
193,CB_2023_Dec_FB_2712_RS-DP_V02_1x1_VID_EN_Opti_C-WrittenTesti_CTA-SALE_Pain-W-B-C_M-NONE_VL-None_TR-None_G-NONE_P-V2_S-NONE_FB2227V08,US || CBV2 || V1 vs V2 || V2 - PREMIUM || 7C || 15/03/25,,$36,"1,573",2025-03-15,2025-03-18,3
194,CB_2024_Sep_FB_3175_DA-KB_V02_1x1_IMG_EN_New_C-ADVRT_Evergreen_CTA-NONE_Angle-W_M-NONE_VL-None_G-NONE_P-CBV2_S-NONE_blog_colonbroomvsmammoth_cv_en,CBV2 || A/B test CTA button: Control || CBV2 vs Happy Mammoth || 7C || 13/03/25,,$36,"1,530",2025-03-13,2025-03-26,13
195,CB_2025_Mar_FB_3884_SO_V16_9x16_IMG_EN_New_C-NONE_Evergreen_CTA-NONE_Angle-W-B-C_M-Nate_VL-15s_G-M_P-OG_S-NEW,3884 - Body Shaming Angle || Enhancements: OFF || CBV1 || Batch 4 || 7C || 10/03/25w11,,$36,"1,462",2025-03-10,2025-03-20,10
196,CB_2025_Feb_FB_3827_LZ_V04_1x1_IMG_EN_Opti_C-Headline_Evergreen_CTA-SALE_Angle-W_M-NONE_VL-None_G-M_P-CBV2_S-NONE_FB3779V02,US || CBV2 || V1 vs V2 || V2 - PREMIUM || 7C || 15/03/25,,$36,"1,582",2025-03-15,2025-03-18,3
197,CB_2024_Mar_FB_2888_JG_V03_9x16_IMG_EN_Opti_C-Benefits_CTA-NONE_Pain-W_M-NONE_VL-None_TR-None_G-NONE_P-V2_S-NONE,CBV2 || AU || ðŸ’° Advantage+ || US || BROAD || 7C || Existing_customer_5% || 19/12/24 Ad set,SHARE,$35,"1,904",2024-12-19,2025-03-27,98
198,CB_2025_Mar_FB_3904_DT_V03_9x16_VID_EN_New_C-Trend_Evergreen_CTA-NONE_Angle-W_M-MIX_VL-30s_G-MF_P-OG_S-New,3904 - Notion / I thought my man was cheating on me || Enhancements: OFF || CBV1 || Batch 1 || 7C || 16/03/25w12,,$35,"1,951",2025-03-14,2025-03-27,13
199,CB_2025_Jan_FB_3723_SO_V16_4x5_IMG_EN_New_C-NONE_Evergreen_CTA-SALE_Angle-W_M-NONE_VL-None_G-NONE_P-NONE_S-NONE,3723 - Notion Idea #92 MAN BOOBS || Enhancements: OFF || CBV1 || Batch 4 || 1C || 28/01/25w05 || Kostas,SHARE,$35,"2,654",2025-01-28,2025-03-11,42
200,CB_2025_Feb_FB_3882_LZ-JT_V02_9x16_VID_EN_Opti_C-SplitScreen_Evergreen_CTA-SALE_Angle-W-B_M-MIX_VL-45s_G-MF_P-OG_S-MOON_FB3090V02,3882 - New hook aaron+trc || Enhancements: OFF || CBV1 || Batch 1 || 7C || 10/03/25w11,,$34,"1,818",2025-03-10,2025-03-15,5
201,CB_2024_Mar_FB_2888_JG_V01_9x16_IMG_EN_Opti_C-Benefits_CTA-NONE_Pain-W_M-NONE_VL-None_TR-None_G-NONE_P-V2_S-NONE,CBV2 || AU || ðŸ’° Advantage+ || US || BROAD || 7C || Existing_customer_5% || 19/12/24 Ad set,SHARE,$34,"1,092",2024-12-19,2025-03-27,98
202,CB_2025_Mar_FB_3884_SO_V05_9x16_IMG_EN_New_C-NONE_Evergreen_CTA-NONE_Angle-W-B-C_M-Nate_VL-15s_G-MF_P-OG_S-NEW,3884 - Body Shaming Angle || Enhancements: OFF || CBV1 || Batch 2 || 7C || 10/03/25w11,,$31,"1,420",2025-03-12,2025-03-15,3
203,CB_2025_Feb_FB_3882_LZ-JT_V01_9x16_VID_EN_Opti_C-SplitScreen_Evergreen_CTA-SALE_Angle-W-B_M-MIX_VL-45s_G-MF_P-OG_S-MOON_FB3090V02,3882 - New hook aaron+trc || Enhancements: OFF || CBV1 || Batch 1 || 7C || 10/03/25w11,,$31,"1,317",2025-03-10,2025-03-15,5
204,CB_2025_Feb_FB_3803_CHUB_V10_1x1_IMG_EN_New_C-NONE_CTA-NONE_Angle-None_M-NONE_VL-None_TR-None_G-NONE_P-NONE_S-NONE_blog_cbglp1_cv_en,Attribution Test - NB UTM - URL || GLP-1 || LP:HI | 3803 Advertorials CHUB || Natural GLP-1 Enhancer Takes Its Place || Batch 3 || 12/07/25,,$30,690,2025-03-12,2025-03-13,1
205,CB_2025_Mar_FB_3907_CHUB-AA_V03__IMG_EN_Opti_C-Price_CTA-NONE_Angle-None_M-NONE_VL-None_TR-None_G-NONE_P-OG_S-NONE,3907 â€“ CHUB Clean Sale OPTI v2 || Enhancements: OFF || CBV1 || Batch 1 || 7C || 16/03/25w12,,$28,"1,010",2025-03-16,2025-03-27,11
206,CB_2025_Mar_FB_3897_SO_V06_1x1_IMG_EN_New_C-NONE_Evergreen_CTA-NONE_Angle-W-B-C_M-NONE_VL-None_G-NONE_P-OG_S-NONE,3897 - #5 Blue-collar || Enhancements: OFF || CBV1 || Batch 1-2 || 7C || 16/03/25w12,,$26,"1,159",2025-03-14,2025-03-20,6
207,CB_2025_Mar_FB_3911_DT_V02_1x1_IMG_EN_Opti_C-Headline_Evergreen_CTA-Patrick_Angle-W-B-C_M-NONE_VL-None_G-NONE_P-V2_S-NONE_FB2712V02.png,EU (UK) || 3911 - St. Patrick day opti || 7C || 16/03/2025w11,SHARE,$25,"1,243",2025-03-16,2025-03-18,2
208,CB_2025_Mar_FB_3895_VK_V02_9x16_VID_EN_New_C-BulletPoints_Evergreen_CTA-65_Angle-W-B-C_M-NONE_VL-15s_G-M_P-OG_S-MOON,3895 - #15 Me vs Them - VK || Enhancements: OFF || CBV1 || Batch 1 || 7C || 16/03/25w12,,$24,"1,248",2025-03-14,2025-03-20,6
209,CB_2025_Mar_FB_3884_SO_V03_1x1_IMG_EN_New_C-NONE_Evergreen_CTA-NONE_Angle-W_M-NONE_VL-None_G-NONE_P-OG_S-NONE,3884 - Body Shaming Angle || Enhancements: OFF || CBV1 || Batch 1 || 7C || 10/03/25w11,,$24,"1,114",2025-03-12,2025-03-15,3
210,CB_2024_Feb_FB_2814_MB-DP_V05_1x1_IMG_EN_New_C-WeightLoss_CTA-None_Pain-W-B-C_M-NONE_VL-None_TR-None_G-NONE_P-V2_S-NONE,EU (UK) || clinically proven opti || 1C || 23/01/2025w04,SHARE,$24,"1,180",2025-01-23,2025-03-10,46
211,CB_2023_Jul_FB_2226_MB_V04_9x16_VID_EN_Opti_C-Testim_CTA-SMR_Pain-W_M-MIX_VL-30s_TR-None_G-F_P-None_S-Starry,US || Manual Bid || BFCM || COST CAP 71 || 1C || 15/11/24,VIDEO,$24,656,2024-11-15,2025-03-27,132
212,CB_2024_Sep_FB_3175_DA-KB_V02_1x1_IMG_EN_New_C-ADVRT_Evergreen_CTA-NONE_Angle-W_M-NONE_VL-None_G-NONE_P-CBV2_S-NONE_blog_colonbroomvsmammothhighprice3_cv_en,CBV2 || A/B test CTA button: Variaton || CBV2 vs Happy Mammoth || 7C || 13/03/25,,$23,"1,098",2025-03-13,2025-03-26,13
213,CB_2025_Mar_FB_3884_SO_V08_9x16_IMG_EN_New_C-NONE_Evergreen_CTA-NONE_Angle-W-B-C_M-Nate_VL-15s_G-MF_P-OG_S-NEW,3884 - Body Shaming Angle || Enhancements: OFF || CBV1 || Batch 2 || 7C || 10/03/25w11,,$23,"1,018",2025-03-12,2025-03-15,3
214,CB_2025_Mar_FB_3904_DT_V04_9x16_VID_EN_New_C-Trend_Evergreen_CTA-NONE_Angle-W_M-MIX_VL-30s_G-MF_P-OG_S-New,3906 - CB V1 SUMMER BOD || Enhancements: OFF || CBV1 || Batch 1 || 7C || 16/03/25w12,,$22,"1,151",2025-03-14,2025-03-20,6
215,CB_2025_Mar_FB_3881_CHUB-AS_V03_9x16_VID_EN_New_C-NONE_CTA-NONE_Angle-None_M-NONE_VL-None_TR-None_G-NONE_P-NONE_S-NONE,3881 - CHUB Boomer Daughter & 3893 CHUB Boomer Mom || Enhancements: OFF || CBV1 || 7C || 16/03/25w12,,$22,"1,247",2025-03-14,2025-03-20,6
216,CB_2025_Mar_FB_3907_CHUB-AA_V01__IMG_EN_Opti_C-Price_CTA-NONE_Angle-None_M-NONE_VL-None_TR-None_G-NONE_P-OG_S-NONE,3907 â€“ CHUB Clean Sale OPTI v2 || Enhancements: OFF || CBV1 || Batch 1 || 7C || 16/03/25w12,,$22,852,2025-03-16,2025-03-27,11
217,CB_2025_Feb_FB_3877_DT-DP_V03_1x1_IMG_EN_New_C-Headline_Evergreen_CTA-NONE_Angle-W-B-C_M-NONE_VL-None_G-NONE_P-OG_S-NONE.png,3877 - IMG ads for CB V1 || Enhancements: OFF || CBV1 || Batch 1 || 7C || 04/03/25w10 || Valentinas,SHARE,$21,729,2025-03-04,2025-03-15,11
218,CB_2025_Mar_FB_3906_SO-JT_V03_1x1_IMG_EN_New_C-NONE_Evergreen_CTA-NONE_Angle-W-B-C_M-NONE_VL-None_G-NONE_P-OG_S-NONE,3906 - CB V1 SUMMER BOD || Enhancements: OFF || CBV1 || Batch 1 || 7C || 16/03/25w12,,$21,722,2025-03-14,2025-03-20,6
219,CB_2025_Mar_FB_3884_SO_V10_9x16_IMG_EN_New_C-NONE_Evergreen_CTA-NONE_Angle-W-B-C_M-Nate_VL-15s_G-MF_P-OG_S-NEW,3884 - Body Shaming Angle || Enhancements: OFF || CBV1 || Batch 3 || 7C || 10/03/25w11,,$20,"1,154",2025-03-10,2025-03-20,10
220,CB_2025_Jan_FB_3762_LZ_V04_4x5_IMG_EN_Opti_C-NegativeMark_Evergreen_CTA-NONE_Angle-W_M-NONE_VL-None_G-NONE_P-GLP1_S-NONE_FB3251V01.png,3762 - Notion Idea #123 it's not cheap GLP1 || Enhancements: OFF || GLP-1 || Batch 1 || 7C || 20/02/25w09 || Valentinas,SHARE,$19,896,2025-02-24,2025-03-18,22
221,CB_2025_Mar_FB_3899_LZ-VU_V01_1x1_IMG_EN_New_C-BeforeAfter_Evergreen_CTA-NONE_Angle-W_M-NONE_VL-None_G-M_P-OG_S-NONE,3899 - ejaculation angle || Enhancements: OFF || CBV1 || Batch 1 || 7C || 10/03/25w11,,$19,"1,089",2025-03-11,2025-03-15,4
222,CB_2025_Mar_FB_3890_DT_V03_1x1_IMG_EN_New_C-NONE_Evergreen_CTA-None_Angle-W_M-NONE_VL-None_G-NONE_P-OG_S-NONE,3890 - Your Peak Performance in 6 weeks || Enhancements: OFF || CBV1 || Batch 1 || 7C || 10/03/25w11,,$19,"1,056",2025-03-12,2025-03-26,14
223,CB_2025_Mar_FB_3902_SO-JT_V03_1x1_IMG_EN_New_C-NONE_Evergreen_CTA-NONE_Angle-W-B-C_M-NONE_VL-None_G-NONE_P-OG_S-NONE,3902 - OZEMPIC MEET YOUR MATCH / V1 || Enhancements: OFF || CBV1 || Batch 1 || 7C || 16/03/25w12,,$18,830,2025-03-14,2025-03-27,13
224,CB_2025_Mar_FB_3889_LZ-DP_V02_1x1_IMG_EN_New_C-BeforeAfter_Evergreen_CTA-NONE_Angle-W_M-NONE_VL-None_G-M_P-OG_S-NONE_FB3821V11,3889 - Admers man boobs opti || Enhancements: OFF || CBV1 || Batch 1 || 7C || 10/03/25w11,,$18,785,2025-03-12,2025-03-15,3
225,CB_2025_Mar_FB_3891_VK_V03_1x1_IMG_EN_New_C-BulletPoints_Evergreen_CTA-65_Angle-W-B-C_M-NONE_VL-None_G-M_P-OG_S-NONE,3891 - LOW T LEVELS - VK || Enhancements: OFF || CBV1 || Batch 1 || 7C || 10/03/25w11,,$18,948,2025-03-12,2025-03-15,3
226,CB_2025_Mar_FB_3895_VK_V01_9x16_VID_EN_New_C-BulletPoints_Evergreen_CTA-65_Angle-W-B-C_M-NONE_VL-15s_G-M_P-OG_S-WOOD,3895 - #15 Me vs Them - VK || Enhancements: OFF || CBV1 || Batch 1 || 7C || 16/03/25w12,,$18,867,2025-03-14,2025-03-20,6
227,CB_2025_Mar_FB_3879_VK-DP_V04_9x16_VID_EN_New_C-BulletPoints_Evergreen_CTA-65_Angle-W-B-C_M-NONE_VL-30s_G-M_P-OG_S-NEW,3879 - Gut health for muscles || Enhancements: OFF || CBV1 || Batch 1 || 7C || 10/03/25w11,,$18,780,2025-03-10,2025-03-20,10
228,CB_2025_Jan_FB_3779_VK-DP_V01_1x1_VID_EN_Opti_C-BulletPoints_Evergreen_CTA-70_Angle-W-B-C_M-NONE_VL-None_G-F_P-OG_S-NEW_FB3705V02,3779 - opti 3705 || Enhancements: OFF || CBV1 || Batch 1 || 1C || 04/02/25w06 || Kostas,SHARE,$17,"1,045",2025-02-04,2025-03-20,44
229,CB_2025_Mar_FB_3897_SO_V04_1x1_IMG_EN_New_C-NONE_Evergreen_CTA-NONE_Angle-W-B-C_M-NONE_VL-None_G-NONE_P-OG_S-NONE,3897 - #5 Blue-collar || Enhancements: OFF || CBV1 || Batch 1-2 || 7C || 16/03/25w12,,$17,"1,050",2025-03-14,2025-03-20,6
230,CB_2025_Mar_FB_3881_CHUB-AS_V02_9x16_VID_EN_New_C-NONE_CTA-NONE_Angle-None_M-NONE_VL-None_TR-None_G-NONE_P-NONE_S-NONE,3881 - CHUB Boomer Daughter & 3893 CHUB Boomer Mom || Enhancements: OFF || CBV1 || 7C || 16/03/25w12,,$16,"1,028",2025-03-14,2025-03-20,6
231,CB_2025_Jan_FB_3748_VK-DP_V02_4x5_IMG_EN_New_C-BulletPoints_Sale_CTA-NY_Angle-W-B-C_M-NONE_VL-None_G-M_P-OG_S-NONE.png - Copy,3748 - winner ads opti - GLP1 - VK-DP || Enhancements: OFF || GLP-1 || Batch 1 || 7C || 20/02/25w09 || Valentinas,SHARE,$16,492,2025-02-24,2025-03-18,22
232,CB_2023_Jul_FB_2217_IB_V04_9x16_VID_EN_Opti_C-Pointing_CTA-SMR_Pain-W-B_M-TRC_VL-30s_TR-None_G-F_P-None_S-FRIGGA,US || Free trial offer || 7C || 11/03/25,,$16,469,2025-03-11,2025-03-14,3
233,CB_2024_Jan_FB_2762_IK_V04_1x1_IMG_EN_New_C-WrittenTesti_CTA-CTA_Pain-W-B-C_M-NONE_VL-None_TR-None_G-NONE_P-V2_S-NONE,CBV2 || AU || ðŸ’° Advantage+ || US || BROAD || 7C || Existing_customer_5% || 19/12/24 Ad set,SHARE,$15,562,2024-12-19,2025-03-27,98
234,CB_2025_Mar_FB_3879_VK-DP_V02_9x16_VID_EN_New_C-BulletPoints_Evergreen_CTA-65_Angle-W-B-C_M-NONE_VL-30s_G-M_P-OG_S-NEW,3879 - Gut health for muscles || Enhancements: OFF || CBV1 || Batch 1 || 7C || 10/03/25w11,,$15,700,2025-03-10,2025-03-19,9
235,CB_2025_Mar_FB_3884_SO_V02_1x1_IMG_EN_New_C-NONE_Evergreen_CTA-NONE_Angle-W_M-NONE_VL-None_G-NONE_P-OG_S-NONE,3884 - Body Shaming Angle || Enhancements: OFF || CBV1 || Batch 1 || 7C || 10/03/25w11,,$15,765,2025-03-12,2025-03-15,3
236,CB_2025_Mar_FB_3884_SO_V06_9x16_IMG_EN_New_C-NONE_Evergreen_CTA-NONE_Angle-W-B-C_M-Nate_VL-15s_G-MF_P-OG_S-NEW 2,3884 - Body Shaming Angle || Enhancements: OFF || CBV1 || Batch 2 || 7C || 10/03/25w11,,$15,916,2025-03-12,2025-03-15,3
237,CB_2023_Jul_FB_2217_IB_V04_9x16_VID_EN_Opti_C-Pointing_CTA-SMR_Pain-W-B_M-TRC_VL-30s_TR-None_G-F_P-None_S-FRIGGA,US || Manual Bid || BID CAP 111 || 1C || 21/12/24,VIDEO,$15,619,2024-12-22,2025-03-24,92
238,CB_2024_Sep_FB_3175_DA-KB_V03_1x1_IMG_EN_New_C-ADVRT_Evergreen_CTA-NONE_Angle-W_M-NONE_VL-None_G-NONE_P-CBV2_S-NONE_blog_colonbroomvsmammoth_cv_en,CBV2 || A/B test CTA button: Control || CBV2 vs Happy Mammoth || 7C || 13/03/25,,$15,509,2025-03-13,2025-03-26,13
239,CB_2025_Feb_FB_3803_CHUB_V09_1x1_IMG_EN_New_C-NONE_CTA-NONE_Angle-None_M-NONE_VL-None_TR-None_G-NONE_P-NONE_S-NONE_blog_cbglp1_cv_en,Attribution Test - NB UTM - URL || GLP-1 || LP:HI | 3803 Advertorials CHUB || Natural GLP-1 Enhancer Takes Its Place || Batch 3 || 12/07/25,,$15,311,2025-03-12,2025-03-18,6
240,CB_2025_Mar_FB_3911_DT_V03_9x16_VID_EN_Opti_C-SingleTesti_Sale_CTA-Patrick_Angle-W_M-TRC_VL-45s_G-F_P-OG_S-MOON_FB2764V04,EU (UK) || 3911 - St. Patrick day opti || 7C || 16/03/2025w11,VIDEO,$14,522,2025-03-16,2025-03-18,2
241,CB_2025_Jan_FB_3762_LZ_V02_4x5_IMG_EN_Opti_C-NegativeMark_Evergreen_CTA-NONE_Angle-CR_M-NONE_VL-None_G-NONE_P-GLP1_S-NONE_FB3251V01.png,3762 - Notion Idea #123 it's not cheap GLP1 || Enhancements: OFF || GLP-1 || Batch 1 || 7C || 20/02/25w09 || Valentinas,SHARE,$14,644,2025-02-24,2025-03-13,17
242,CB_2025_Mar_FB_3907_CHUB-AA_V02__IMG_EN_Opti_C-Price_CTA-NONE_Angle-None_M-NONE_VL-None_TR-None_G-NONE_P-OG_S-NONE,3907 â€“ CHUB Clean Sale OPTI v2 || Enhancements: OFF || CBV1 || Batch 1 || 7C || 16/03/25w12,,$14,512,2025-03-16,2025-03-27,11
243,CB_2025_Feb_FB_3803_CHUB_V10_1x1_IMG_EN_New_C-NONE_CTA-NONE_Angle-None_M-NONE_VL-None_TR-None_G-NONE_P-NONE_S-NONE_blog_cbglp1_cv_en,Attribution Test - Standard URL || GLP-1 || LP:HI | 3803 Advertorials CHUB || Natural GLP-1 Enhancer Takes Its Place || Batch 3 || 12/07/25,,$14,346,2025-03-13,2025-03-18,5
244,CB_2025_Mar_FB_3896_LZ_V04_1x1_IMG_EN_New_C-Headline_Evergreen_CTA-NONE_Angle-W_M-NONE_VL-None_G-M_P-OG_S-NONE,3896 - grill party img|| Enhancements: OFF || CBV1 || Batch 1 || 7C || 10/03/25w11,,$14,663,2025-03-10,2025-03-23,13
245,CB_2025_Mar_FB_3886_LZ-DP_V03_1x1_IMG_EN_Opti_C-Headline_Evergreen_CTA-SALE_Angle-W_M-NONE_VL-None_G-NONE_P-OG_S-NONE_FB3779V02,3886 - Man boobs new copy  || Enhancements: OFF || CBV1 || Batch 1 || 7C || 10/03/25w11,,$14,659,2025-03-10,2025-03-15,5
246,CB_2025_Jan_FB_3739_DT_V05_4x5_VID_EN_Opti_C-BulletPoints_Sale_CTA-70_Angle-W-B_M-MIX_VL-45s_G-MF_P-GLP1_S-WHAT_FB3164V03,GLP-1 ðŸ’œ || ASC+ || US || 5% EXISTING CAP || 7C || 20/02/25 . Ad set,SHARE,$13,559,2025-02-24,2025-03-18,22
247,CB_2025_Mar_FB_3897_SO_V02_1x1_IMG_EN_New_C-NONE_Evergreen_CTA-NONE_Angle-W-B-C_M-NONE_VL-None_G-NONE_P-OG_S-NONE,3897 - #5 Blue-collar || Enhancements: OFF || CBV1 || Batch 1-2 || 7C || 16/03/25w12,,$12,690,2025-03-14,2025-03-20,6
248,CB_2025_Mar_FB_3896_LZ_V01_1x1_IMG_EN_New_C-Headline_Evergreen_CTA-NONE_Angle-W_M-NONE_VL-None_G-M_P-OG_S-NONE,3896 - grill party img|| Enhancements: OFF || CBV1 || Batch 1 || 7C || 10/03/25w11,,$11,574,2025-03-10,2025-03-23,13
249,CB_2025_Jan_FB_3751_VK-DP_V04_4x5_IMG_EN_New_C-BulletPoints_Sale_CTA-NY_Angle-W-B-C_M-NONE_VL-None_G-M_P-GLP1_S-NONE.jpg,3751 - opti 3608 GLP1 - VK-DP || Enhancements: OFF || GLP-1 || Batch 1 || 7C || 20/02/25w09 || Valentinas,SHARE,$11,550,2025-02-24,2025-03-15,19
250,CB_2025_Jan_FB_3751_VK-DP_V01_4x5_IMG_EN_New_C-BulletPoints_Sale_CTA-NY_Angle-W-B-C_M-NONE_VL-None_G-M_P-GLP1_S-NONE.jpg,3751 - opti 3608 GLP1 - VK-DP || Enhancements: OFF || GLP-1 || Batch 1 || 7C || 20/02/25w09 || Valentinas,SHARE,$11,448,2025-02-24,2025-03-15,19
251,CB_2025_Feb_FB_3818_LZ-VU_V17_1x1_IMG_EN_Opti_C-Headline_Evergreen_CTA-NONE_Angle-Cort_M-NONE_VL-None_G-NONE_P-NONE_S-NONE_FB3251V01,3818 - It's not cheap Months+holidays || March || Enhancements: OFF || CBV1 || 7C || 14/03/25w11,,$11,569,2025-03-14,2025-03-17,3
252,CB_2025_Jan_FB_3762_LZ_V01_4x5_IMG_EN_Opti_C-NegativeMark_Evergreen_CTA-NONE_Angle-Cort_M-NONE_VL-None_G-NONE_P-GLP1_S-NONE_FB3251V01.png,3762 - Notion Idea #123 it's not cheap GLP1 || Enhancements: OFF || GLP-1 || Batch 1 || 7C || 20/02/25w09 || Valentinas,SHARE,$11,517,2025-02-24,2025-03-18,22
253,CB_2025_Feb_FB_3872_DT-DP_V02_9x16_VID_EN_Opti_C-Trend_Sale_CTA-70_Angle-W_M-MIX_VL-30s_G-MF_P-OG_FB1989V08,3872 - new hooks on winner ad || Enhancements: OFF || CBV1 || Batch 1 || 7C || 10/03/25w11,,$11,517,2025-03-10,2025-03-15,5
254,CB_2024_Feb_FB_2814_MB-DP_V07_1x1_IMG_EN_New_C-WeightLoss_CTA-CTA_Pain-W-B-C_M-NONE_VL-None_TR-None_G-F_P-V2_S-NONE_2410V06,EU (UK) || clinically proven opti || 1C || 23/01/2025w04,SHARE,$11,478,2025-01-23,2025-03-10,46
255,IM_CB1,US || VSL || Aff's image ||  Taboola ads||  Landing: vsl-2 || 7C || 12/03/25,SHARE,$11,396,2025-03-12,2025-03-12,0
256,CB_2023_Apr_FB_1989_RS_V08_9x16_VID_EN_Opti_C-Trend_CTA-SMR_Pain-W_M-MIX_VL-30s_TR-None_G-MF_P-None FB1933V05,US || V1 vs V2 || V1 - ORIGINAL || 7C || 15/03/25,,$10,527,2025-03-15,2025-03-18,3
257,CB_2025_Mar_FB_3884_SO_V07_9x16_IMG_EN_New_C-NONE_Evergreen_CTA-NONE_Angle-W-B-C_M-Nate_VL-15s_G-MF_P-OG_S-NEW,3884 - Body Shaming Angle || Enhancements: OFF || CBV1 || Batch 2 || 7C || 10/03/25w11,,$10,568,2025-03-12,2025-03-15,3
258,CB_2025_Mar_FB_3884_SO_V09_9x16_IMG_EN_New_C-NONE_Evergreen_CTA-NONE_Angle-W-B-C_M-Nate_VL-15s_G-MF_P-OG_S-NEW,3884 - Body Shaming Angle || Enhancements: OFF || CBV1 || Batch 3 || 7C || 10/03/25w11,,$10,615,2025-03-10,2025-03-20,10
259,CB_2024_Dec_FB_3622_LZ-KB_V03_4x5_IMG_EN_Opti_C-NONE_Sale_CTA-XMAS_Angle-GH_M-NONE_VL-None_G-NONE_P-OG_S-NONE_FB2227V08 - Copy,US || Manual Bid || BID CAP 111 || 1C || 21/12/24,SHARE,$10,371,2024-12-22,2025-03-26,94
260,CB_2024_Sep_FB_3175_DA-KB_V03_1x1_IMG_EN_New_C-ADVRT_Evergreen_CTA-NONE_Angle-W_M-NONE_VL-None_G-NONE_P-CBV2_S-NONE_blog_colonbroomvsmammothhighprice3_cv_en,CBV2 || A/B test CTA button: Variaton || CBV2 vs Happy Mammoth || 7C || 13/03/25,,$9,283,2025-03-13,2025-03-26,13
261,CB_2025_Mar_FB_3897_SO_V01_1x1_IMG_EN_New_C-NONE_Evergreen_CTA-NONE_Angle-W-B-C_M-NONE_VL-None_G-NONE_P-OG_S-NONE,3897 - #5 Blue-collar || Enhancements: OFF || CBV1 || Batch 1-2 || 7C || 16/03/25w12,,$9,539,2025-03-14,2025-03-20,6
262,CB_2025_Mar_FB_3893_CHUB-AS_V04_9x16_VID_EN_New_C-NONE_CTA-NONE_Angle-None_M-NONE_VL-None_TR-None_G-NONE_P-NONE_S-NONE,3881 - CHUB Boomer Daughter & 3893 CHUB Boomer Mom || Enhancements: OFF || CBV1 || 7C || 16/03/25w12,,$9,451,2025-03-14,2025-03-20,6
263,CB_2025_Mar_FB_3890_DT_V01_1x1_IMG_EN_New_C-NONE_Evergreen_CTA-None_Angle-W_M-NONE_VL-None_G-NONE_P-OG_S-NONE,3890 - Your Peak Performance in 6 weeks || Enhancements: OFF || CBV1 || Batch 1 || 7C || 10/03/25w11,,$8,455,2025-03-12,2025-03-26,14
264,CB_2025_Mar_FB_3896_LZ_V03_1x1_IMG_EN_New_C-Headline_Evergreen_CTA-NONE_Angle-W_M-NONE_VL-None_G-M_P-OG_S-NONE,3896 - grill party img|| Enhancements: OFF || CBV1 || Batch 1 || 7C || 10/03/25w11,,$8,400,2025-03-10,2025-03-23,13
265,CB_2025_Jan_FB_3762_LZ_V03_4x5_IMG_EN_Opti_C-NegativeMark_Evergreen_CTA-NONE_Angle-CR_M-NONE_VL-None_G-NONE_P-GLP1_S-NONE_FB3251V01.png,3762 - Notion Idea #123 it's not cheap GLP1 || Enhancements: OFF || GLP-1 || Batch 1 || 7C || 20/02/25w09 || Valentinas,SHARE,$8,279,2025-02-24,2025-03-17,21
266,CB_2025_Mar_FB_3897_SO_V05_1x1_IMG_EN_New_C-NONE_Evergreen_CTA-NONE_Angle-W-B-C_M-NONE_VL-None_G-NONE_P-OG_S-NONE,3897 - #5 Blue-collar || Enhancements: OFF || CBV1 || Batch 1-2 || 7C || 16/03/25w12,,$7,423,2025-03-14,2025-03-20,6
267,CB_2025_Feb_FB_3803_CHUB_V09_1x1_IMG_EN_New_C-NONE_CTA-NONE_Angle-None_M-NONE_VL-None_TR-None_G-NONE_P-NONE_S-NONE_blog_cbglp1_cv_en,Attribution Test - Standard URL || GLP-1 || LP:HI | 3803 Advertorials CHUB || Natural GLP-1 Enhancer Takes Its Place || Batch 3 || 12/07/25,,$7,199,2025-03-12,2025-03-18,6
268,CB_2023_Jul_FB_2217_IB_V04_9x16_VID_EN_Opti_C-Pointing_CTA-SMR_Pain-W-B_M-TRC_VL-30s_TR-None_G-F_P-None_S-FRIGGA,US || V1 vs V2 || V1 - ORIGINAL || 7C || 15/03/25,,$7,395,2025-03-15,2025-03-18,3
269,CB_2025_Mar_FB_3888_LZ-DP_V01_1x1_IMG_EN_New_C-Headline_Evergreen_CTA-SALE_Angle-W_M-NONE_VL-None_G-NONE_P-OG_S-NONE,3888 - man boobs new copy crazy visual || Enhancements: OFF || CBV1 || Batch 1 || 7C || 10/03/25w11,,$7,354,2025-03-10,2025-03-15,5
270,CB_2025_Jan_FB_3739_DT_V03_4x5_VID_EN_Opti_C-Sale_Sale_CTA-70_Angle-W_M-MIX_VL-30s_G-MF_P-GLP1_S-WHAT_FB2103V03,GLP-1 ðŸ’œ || ASC+ || US || 5% EXISTING CAP || 7C || 20/02/25 . Ad set,SHARE,$7,233,2025-02-24,2025-03-17,21
271,CB_2025_Feb_FB_3882_LZ-JT_V03_9x16_VID_EN_Opti_C-SplitScreen_Evergreen_CTA-SALE_Angle-W-B_M-MIX_VL-45s_G-MF_P-OG_S-MOON_FB3090V02,3882 - New hook aaron+trc || Enhancements: OFF || CBV1 || Batch 1 || 7C || 10/03/25w11,,$7,272,2025-03-10,2025-03-15,5
272,CB_2022_Mar3_FB_713_IK_V04_1x1_IMG_EN_Opti_C-WrittenTesti_HE-98_A-ExtremeBodyVisualization_HK-bodypart_Pain-W_CLR-PURPLE_BG-IMAGE_ME-MIX_MA-YOUNG,US || Manual Bid || BFCM || COST CAP 71 || 1C || 15/11/24,SHARE,$7,631,2024-11-15,2025-03-27,132
273,CB_2025_Mar_FB_3893_CHUB-AS_V03_9x16_VID_EN_New_C-NONE_CTA-NONE_Angle-None_M-NONE_VL-None_TR-None_G-NONE_P-NONE_S-NONE,3881 - CHUB Boomer Daughter & 3893 CHUB Boomer Mom || Enhancements: OFF || CBV1 || 7C || 16/03/25w12,,$7,422,2025-03-14,2025-03-20,6
274,CB_2025_Mar_FB_3907_CHUB-AA_V04__IMG_EN_Opti_C-Price_CTA-NONE_Angle-None_M-NONE_VL-None_TR-None_G-NONE_P-OG_S-NONE,3907 â€“ CHUB Clean Sale OPTI v2 || Enhancements: OFF || CBV1 || Batch 1 || 7C || 16/03/25w12,,$6,261,2025-03-16,2025-03-27,11
275,CB_2025_Mar_FB_3906_SO-JT_V02_1x1_IMG_EN_New_C-NONE_Evergreen_CTA-NONE_Angle-W-B-C_M-NONE_VL-None_G-NONE_P-OG_S-NONE,3906 - CB V1 SUMMER BOD || Enhancements: OFF || CBV1 || Batch 1 || 7C || 16/03/25w12,,$6,317,2025-03-14,2025-03-20,6
276,CB_2024_Feb_FB_2812_MB-RP_V07_9x16_VID_EN_Opti_C-Sale_CTA-C65_Pain-W_M-NONE_VL-30s_TR-None_G-MF_P-Plan_S-NEW_FB2601V04_1,US || Free trial offer || 7C || 11/03/25,,$6,257,2025-03-11,2025-03-14,3
277,CB_2025_Mar_FB_3910_LZ-JG_V02_1x1_IMG_EN_Opti_C-NegativeMark_Evergreen_CTA-NONE_Angle-W_M-NONE_VL-None_G-NONE_P-TRIAL_S-NONE_FB2227V08.png,US || Free trial offer || Trial ads || 7C || 15/03/25,,$6,341,2025-03-15,2025-03-17,2
278,CB_2025_Jan_FB_3739_DT_V04_4x5_VID_EN_Opti_C-Dance_Sale_CTA-70_Angle-W_M-MIX_VL-45s_G-MF_P-GLP1_S-STARRY_FB1998V03,GLP-1 ðŸ’œ || ASC+ || US || 5% EXISTING CAP || 7C || 20/02/25 . Ad set,SHARE,$6,280,2025-02-24,2025-03-18,22
279,CB_2025_Mar_FB_3899_LZ-VU_V04_1x1_IMG_EN_New_C-BeforeAfter_Evergreen_CTA-NONE_Angle-W_M-NONE_VL-None_G-M_P-OG_S-NONE,3899 - ejaculation angle || Enhancements: OFF || CBV1 || Batch 1 || 7C || 10/03/25w11,,$6,278,2025-03-11,2025-03-15,4
280,CB_2025_Mar_FB_3910_LZ-JG_V04_9x16_VID_EN_Opti_C-Testimonial_Evergreen_CTA-NONE_Angle-W_M-TRC_VL-15s_G-F_P-TRIAL_S-FRIGGA_FB2217V04.mp4,US || Free trial offer || Trial ads || 7C || 15/03/25,,$5,313,2025-03-15,2025-03-17,2
281,CB_2025_Jan_FB_3747_CHUB-AA_V01_4x5_IMG_EN_Opti_C-NONE_CTA-NONE_Angle-Sale_M-NONE_VL-None_TR-None_G-NONE_P-OG_S-NONE,3747 Clean Sale [HB winner ITR] CHUB || Enhancements: OFF || CBV1 || Batch Ä… || 1C || 02/02/25w06 || Kostas,SHARE,$5,343,2025-02-02,2025-03-27,53
282,CB_2025_Feb_FB_3868_VK-DP_V04_9x16_VID_EN_New_C-BulletPoints_Evergreen_CTA-NONE_Angle-W-B-C_M-NONE_VL-15s_G-M_P-OG_S-NEW.mp4,3868 - What i ordered for dad bod || Enhancements: OFF || CBV1 || Batch 1 || 7C || 03/03/25w10 || Valentinas,VIDEO,$4,130,2025-03-03,2025-03-20,17
283,CB_2025_Jan_FB_3751_VK-DP_V03_4x5_IMG_EN_New_C-BulletPoints_Sale_CTA-NY_Angle-W-B-C_M-NONE_VL-None_G-M_P-GLP1_S-NONE.jpg,3751 - opti 3608 GLP1 - VK-DP || Enhancements: OFF || GLP-1 || Batch 1 || 7C || 20/02/25w09 || Valentinas,SHARE,$4,135,2025-02-24,2025-03-15,19
284,CB_2023_Sep_FB_2429_DT_V03_9x16_VID_EN_Opti_C-Sale_CTA-CTA_Pain-W_M-MIX_VL-45s_TR-None_G-MF_P-V2_S-WHAT,US || CBV2 || V1 vs V2 || V2 - PREMIUM || 7C || 15/03/25,,$4,234,2025-03-15,2025-03-18,3
285,CB_2025_Mar_FB_3910_LZ-JG_V03_9x16_VID_EN_Opti_C-BulletPoints_Evergreen_CTA-NONE_Angle-W_M-MAN_VL-15s_G-M_P-TRIAL_S-WHAT_FB3097V03.mp4,US || Free trial offer || Trial ads || 7C || 15/03/25,,$4,161,2025-03-15,2025-03-17,2
286,CB_2025_Mar_FB_3893_CHUB-AS_V02_9x16_VID_EN_New_C-NONE_CTA-NONE_Angle-None_M-NONE_VL-None_TR-None_G-NONE_P-NONE_S-NONE,3881 - CHUB Boomer Daughter & 3893 CHUB Boomer Mom || Enhancements: OFF || CBV1 || 7C || 16/03/25w12,,$4,245,2025-03-14,2025-03-20,6
287,CB_2025_Feb_FB_3860_LZ-DP_V02_9x16_VID_EN_Opti_C-Testimonial_Evergreen_CTA-SALE_Angle-W_M-MOOD_VL-20s_G-M_P-OG_S-WOOD_FB21176V11_1,3860 - man boobs video 2176 opti || Enhancements: OFF || CBV1 || Batch 1 || 7C || 03/03/25w10 || Valentinas,VIDEO,$4,227,2025-03-03,2025-03-27,24
288,CB_2025_Mar_FB_3891_VK_V02_1x1_IMG_EN_New_C-BulletPoints_Evergreen_CTA-65_Angle-W-B-C_M-NONE_VL-None_G-M_P-OG_S-NONE,3891 - LOW T LEVELS - VK || Enhancements: OFF || CBV1 || Batch 1 || 7C || 10/03/25w11,,$3,180,2025-03-12,2025-03-15,3
289,CB_2025_Mar_FB_3910_LZ-JG_V01_1x1_IMG_EN_Opti_C-Headline_Evergreen_CTA-NONE_Angle-W_M-NONE_VL-None_G-NONE_P-TRIAL_S-NONE_FB3251V02.png,US || Free trial offer || Trial ads || ATC || 7C || 16/03/25,,$3,122,2025-03-16,2025-03-27,11
290,CB_2025_Mar_FB_3893_CHUB-AS_V05_9x16_VID_EN_New_C-NONE_CTA-NONE_Angle-None_M-NONE_VL-None_TR-None_G-NONE_P-NONE_S-NONE,3881 - CHUB Boomer Daughter & 3893 CHUB Boomer Mom || Enhancements: OFF || CBV1 || 7C || 16/03/25w12,,$3,174,2025-03-14,2025-03-20,6
291,CB_2025_Feb_FB_3818_LZ-VU_V16_1x1_IMG_EN_Opti_C-Headline_Evergreen_CTA-NONE_Angle-Cort_M-NONE_VL-None_G-NONE_P-NONE_S-NONE_FB3251V01,3818 - It's not cheap Months+holidays || March || Enhancements: OFF || CBV1 || 7C || 14/03/25w11,,$3,114,2025-03-14,2025-03-17,3
292,CB_2025_Feb_FB_3883_LZ-RP_V03_9x16_VID_EN_Opti_C-Testimonial_Evergreen_CTA-SALE_Angle-W_M-MIX_VL-30s_G-MF_P-OG_S-WHAT_FB1989V08,3883 - Wiiner opti man boobs t levels || Enhancements: OFF || CBV1 || Batch 1 || 7C || 10/03/25w11,,$3,118,2025-03-10,2025-03-20,10
293,CB_2025_Jan_FB_3739_DT_V08_9x16_VID_EN_Opti_C-BulletPoints_Sale_CTA-70_Angle-W-B_M-MIX_VL-45s_G-MF_P-GLP1_S-WHAT_FB3311V09,GLP-1 ðŸ’œ || ASC+ || US || 5% EXISTING CAP || 7C || 20/02/25 . Ad set,SHARE,$3,84,2025-02-24,2025-03-18,22
294,CB_2024_Oct_FB_3251_LZ-VU_V01_1x1_IMG_EN_New_C-NegativeMark_Evergreen_CTA-NONE_Angle-Cort_M-NONE_VL-None_G-NONE_P-NONE_S-NONE.png,US || Manual Bid || BFCM || COST CAP 71 || 1C || 15/11/24,SHARE,$2,106,2024-11-15,2025-03-26,131
295,CB_2025_Jan_FB_3739_DT_V07_9x16_VID_EN_Opti_C-Testimonial_Sale_CTA-70_Angle-W_M-MIX_VL-45s_G-MF_P-GLP1_S-MOON_FB2823V02,GLP-1 ðŸ’œ || ASC+ || US || 5% EXISTING CAP || 7C || 20/02/25 . Ad set,SHARE,$2,100,2025-02-24,2025-03-17,21
296,CB_2025_Feb_FB_3868_VK-DP_V03_9x16_VID_EN_New_C-BulletPoints_Evergreen_CTA-NONE_Angle-W-B-C_M-NONE_VL-15s_G-M_P-OG_S-NEW.mp4,3868 - What i ordered for dad bod || Enhancements: OFF || CBV1 || Batch 1 || 7C || 03/03/25w10 || Valentinas,SHARE,$2,68,2025-03-03,2025-03-20,17
297,CB_2025_Feb_FB_3883_LZ-RP_V02_9x16_VID_EN_Opti_C-BulletPoints_Evergreen_CTA-SALE_Angle-W_M-MAN_VL-30s_G-M_P-OG_S-WHAT_FB3097V03,3883 - Wiiner opti man boobs t levels || Enhancements: OFF || CBV1 || Batch 1 || 7C || 10/03/25w11,,$2,71,2025-03-10,2025-03-16,6
298,CB_2025_Feb_FB_3869_DT_V01_9x16_GIF_EN_Opti_C-NONE_Evergreen_CTA-None_Angle-W_M-NONE_VL-None_G-NONE_P-NONE_S-New_FB3723V04,3869 - Man boobs GIF opti || Enhancements: OFF || CBV1 || Batch 1 || 7C || 03/03/25w10 || Valentinas,VIDEO,$2,49,2025-03-03,2025-03-11,8
299,CB_2025_Feb_FB_3883_LZ-RP_V01_9x16_VID_EN_Opti_C-Testimonial_Evergreen_CTA-SALE_Angle-W_M-POW_VL-45s_G-M_P-OG_S-MOON_FB3090V02,3883 - Wiiner opti man boobs t levels || Enhancements: OFF || CBV1 || Batch 1 || 7C || 10/03/25w11,,$2,124,2025-03-10,2025-03-16,6
300,CB_2025_Jan_FB_3756_VK-DP_V04_4x5_IMG_EN_New_C-BulletPoints_Evergreen_CTA-NONE_Angle-W-B-C_M-NONE_VL-None_G-M_P-GLP1_S-NONE.png,3756 - opti 2834 GLP1 || Enhancements: OFF || GLP-1 || Batch 1 || 7C || 24/02/25w09 || Valentinas,SHARE,$2,62,2025-02-24,2025-03-11,15
301,CB_2025_Jan_FB_3739_DT_V01_4x5_VID_EN_Opti_C-NegativeMark_Sale_CTA-70_Angle-W_M-MIX_VL-45s_G-MF_P-GLP1_S-MOON_FB2263V05,GLP-1 ðŸ’œ || ASC+ || US || 5% EXISTING CAP || 7C || 20/02/25 . Ad set,SHARE,$2,56,2025-02-24,2025-03-18,22
302,CB_2025_Jan_FB_3739_DT_V06_9x16_VID_EN_Opti_C-Testimonial_Sale_CTA-70_Angle-W_M-MIX_VL-45s_G-MF_P-GLP1_S-MOON_FB2764V04,GLP-1 ðŸ’œ || ASC+ || US || 5% EXISTING CAP || 7C || 20/02/25 . Ad set,SHARE,$1,55,2025-02-24,2025-03-18,22
303,CB_2025_Jan_FB_3757_LZ-DP_V19_9x16_VID_EN_Opti_C-BulletPoints_Evergreen_CTA-NONE_Angle-W-B_M-MAG_VL-30s_G-F_P-GLP1_S-WHAT_FB3311V17.mp4,3757 - GLP1 video winner opti Batch 3+4 || Enhancements: OFF || GLP-1 || Batch 4 || 7C || 24/02/25w09 || Valentinas,VIDEO,$1,50,2025-02-24,2025-03-18,22
304,CB_2025_Jan_FB_3739_DT_V09_9x16_VID_EN_Opti_C-Testimonial_Sale_CTA-70_Angle-W-B_M-MIX_VL-45s_G-MF_P-GLP1_S-MOON_FB3278V04,GLP-1 ðŸ’œ || ASC+ || US || 5% EXISTING CAP || 7C || 20/02/25 . Ad set,SHARE,$1,37,2025-02-24,2025-03-18,22
305,CB_2024_Dec_FB_3611_CHUB_V05_4x5_IMG_EN_Opti_C-Headline_CTA-NONE_Angle-C_P-NONE_S-NONE - Copy,US || Manual Bid || BID CAP 111 || 1C || 21/12/24,SHARE,$1,74,2024-12-27,2025-03-24,87
306,CB_2025_Feb_FB_3860_LZ-DP_V01_9x16_VID_EN_Opti_C-Testimonial_Evergreen_CTA-SALE_Angle-W_M-MOOD_VL-20s_G-M_P-OG_S-WOOD_FB21176V11_1,3860 - man boobs video 2176 opti || Enhancements: OFF || CBV1 || Batch 1 || 7C || 03/03/25w10 || Valentinas,VIDEO,$1,89,2025-03-03,2025-03-27,24
307,CB_2025_Feb_FB_3863_DT-DP_V02_9x16_VID_EN_New_C-Trend_Sale_CTA-70_Angle-W_M-POW_VL-30s_G-M_P-OG_S-NEW.mp4,3863 - Aaron man boobs vid || Enhancements: OFF || CBV1 || Batch 1 || 7C || 26/02/25w09 || Valentinas,VIDEO,$1,56,2025-02-26,2025-03-27,29
308,CB_2025_Feb_FB_3811_DT_V01_9x16_VID_EN_Opti_C-Pointing_Sale_CTA-70_Angle-W_M-JOG_VL-30s_G-F_P-OG_S-New_FB2103V02,3811 - #133 Green screen timeframe hooks || Enhancements: OFF || CBV1 || Batch 1 || 7C || 19/02/25w08 || Kostas,VIDEO,$1,41,2025-02-19,2025-03-12,21
309,CB_2025_Jan_FB_3747_CHUB-AA_V02_9x16_IMG_EN_Opti_C-NONE_CTA-NONE_Angle-Sale_M-NONE_VL-None_TR-None_G-NONE_P-OG_S-NONE,3747 Clean Sale [HB winner ITR] CHUB || Enhancements: OFF || CBV1 || Batch Ä… || 1C || 02/02/25w06 || Kostas,SHARE,$1,92,2025-02-02,2025-03-27,53
310,CB_2025_Jan_FB_3747_CHUB-AA_V04_9x16_IMG_EN_Opti_C-NONE_CTA-NONE_Angle-Sale_M-NONE_VL-None_TR-None_G-NONE_P-OG_S-NONE,3747 Clean Sale [HB winner ITR] CHUB || Enhancements: OFF || CBV1 || Batch Ä… || 1C || 02/02/25w06 || Kostas,SHARE,$1,89,2025-02-02,2025-03-27,53
311,CB_2025_Feb_FB_3863_DT-DP_V01_9x16_VID_EN_New_C-Trend_Sale_CTA-70_Angle-W_M-POW_VL-30s_G-M_P-OG_S-NEW,3863 - Aaron man boobs vid || Enhancements: OFF || CBV1 || Batch 1 || 7C || 26/02/25w09 || Valentinas,VIDEO,$1,47,2025-02-26,2025-03-23,25
312,CB_2025_Feb_FB_3863_DT-DP_V04_9x16_VID_EN_New_C-Trend_Sale_CTA-70_Angle-W_M-POW_VL-30s_G-M_P-OG_S-NEW.mp4,3863 - Aaron man boobs vid || Enhancements: OFF || CBV1 || Batch 1 || 7C || 26/02/25w09 || Valentinas,VIDEO,$1,44,2025-02-26,2025-03-27,29
313,CB_2025_Jan_FB_3779_VK-DP_V03_1x1_VID_EN_Opti_C-BulletPoints_Evergreen_CTA-70_Angle-W-B-C_M-NONE_VL-None_G-F_P-OG_S-NEW_FB3705V02,3779 - opti 3705 || Enhancements: OFF || CBV1 || Batch 1 || 1C || 04/02/25w06 || Kostas,SHARE,$1,53,2025-02-04,2025-03-20,44
314,CB_2025_Jan_FB_3748_VK-DP_V03_4x5_IMG_EN_New_C-BulletPoints_Sale_CTA-NY_Angle-W-B-C_M-NONE_VL-None_G-M_P-OG_S-NONE.png - Copy,3748 - winner ads opti - GLP1 - VK-DP || Enhancements: OFF || GLP-1 || Batch 1 || 7C || 20/02/25w09 || Valentinas,SHARE,$1,19,2025-02-24,2025-03-18,22
315,CB_2025_Feb_FB_3855_SO_V02_9x16_VID_EN_New_C-NONE_Evergreen_CTA-NONE_Angle-W_M-NONE_VL-30s_G-None_P-OG_S-NEW,3855 - Notion Idea #141 â€œQuestionnaireâ€ || Enhancements: OFF || CBV1 || Batch 1 || 7C || 03/03/25w10 || Valentinas,VIDEO,$1,29,2025-03-03,2025-03-15,12
316,CB_2025_Feb_FB_3855_SO_V04_9x16_VID_EN_New_C-NONE_Evergreen_CTA-NONE_Angle-W_M-NONE_VL-30s_G-None_P-OG_S-NEW,3855 - Notion Idea #141 â€œQuestionnaireâ€ || Enhancements: OFF || CBV1 || Batch 1 || 7C || 03/03/25w10 || Valentinas,VIDEO,$0,42,2025-03-03,2025-03-15,12
317,CB_2025_Feb_FB_3869_DT_V03_9x16_GIF_EN_Opti_C-NONE_Evergreen_CTA-None_Angle-W_M-NONE_VL-None_G-NONE_P-NONE_S-New_FB3723V04.mp4,3869 - Man boobs GIF opti || Enhancements: OFF || CBV1 || Batch 1 || 7C || 03/03/25w10 || Valentinas,VIDEO,$0,9,2025-03-03,2025-03-11,8
318,CB_2025_Feb_FB_3868_VK-DP_V01_9x16_VID_EN_New_C-BulletPoints_Evergreen_CTA-NONE_Angle-W-B-C_M-NONE_VL-15s_G-M_P-OG_S-NEW,3868 - What i ordered for dad bod || Enhancements: OFF || CBV1 || Batch 1 || 7C || 03/03/25w10 || Valentinas,VIDEO,$0,20,2025-03-03,2025-03-20,17
319,CB_2025_Feb_FB_3865_SO-JG_V20_9x16_VID_EN_Opti_C-NONE_Evergreen_CTA-NONE_Angle-W_M-NONE_VL-30_G-NONE_P-OG_S-Moon_FB2263V04.mp4,3867 - Fat Costume Suit || Enhancements: OFF || CBV1 || Batch 5 || 7C || 03/03/25w10 || Valentinas,VIDEO,$0,9,2025-03-03,2025-03-20,17
320,CB_2022_Mar3_FB_713_IK_V04_1x1_IMG_EN_Opti_C-WrittenTesti_HE-98_A-ExtremeBodyVisualization_HK-bodypart_Pain-W_CLR-PURPLE_BG-IMAGE_ME-MIX_MA-YOUNG,US || Manual Bid || BFCM || COST CAP 81 || 1C || 15/11/24,SHARE,$0,20,2024-11-15,2025-03-26,131
321,CB_2025_Feb_FB_3855_SO_V01_9x16_VID_EN_New_C-NONE_Evergreen_CTA-NONE_Angle-W_M-NONE_VL-30s_G-None_P-OG_S-NEW,3855 - Notion Idea #141 â€œQuestionnaireâ€ || Enhancements: OFF || CBV1 || Batch 1 || 7C || 03/03/25w10 || Valentinas,VIDEO,$0,21,2025-03-03,2025-03-15,12
322,CB_2025_Feb_FB_3865_SO-JG_V18_9x16_VID_EN_Opti_C-NONE_Evergreen_CTA-NONE_Angle-W_M-NONE_VL-30_G-NONE_P-OG_S-Moon_FB2263V04,3867 - Fat Costume Suit || Enhancements: OFF || CBV1 || Batch 5 || 7C || 03/03/25w10 || Valentinas,VIDEO,$0,5,2025-03-03,2025-03-20,17
323,CB_2025_Mar_FB_3910_LZ-JG_V03_9x16_VID_EN_Opti_C-BulletPoints_Evergreen_CTA-NONE_Angle-W_M-MAN_VL-15s_G-M_P-TRIAL_S-WHAT_FB3097V03.mp4,US || Free trial offer || Trial ads || ATC || 7C || 16/03/25,,$0,17,2025-03-16,2025-03-27,11
324,CB_2023_Jul_FB_2226_MB_V04_9x16_VID_EN_Opti_C-Testim_CTA-SMR_Pain-W_M-MIX_VL-30s_TR-None_G-F_P-None_S-Starry,US || Manual Bid || BID CAP 111 || 1C || 21/12/24,VIDEO,$0,14,2024-12-27,2025-03-11,74
325,CB_2025_Feb_FB_3865_SO-JG_V19_9x16_VID_EN_Opti_C-NONE_Evergreen_CTA-NONE_Angle-W_M-NONE_VL-30_G-NONE_P-OG_S-Moon_FB2263V04.mp4,3867 - Fat Costume Suit || Enhancements: OFF || CBV1 || Batch 5 || 7C || 03/03/25w10 || Valentinas,VIDEO,$0,4,2025-03-03,2025-03-19,16
326,CB_2025_Feb_FB_3869_DT_V02_9x16_GIF_EN_Opti_C-NONE_Evergreen_CTA-None_Angle-W_M-NONE_VL-None_G-NONE_P-NONE_S-New_FB3723V04,3869 - Man boobs GIF opti || Enhancements: OFF || CBV1 || Batch 1 || 7C || 03/03/25w10 || Valentinas,VIDEO,$0,12,2025-03-03,2025-03-11,8
327,CB_2025_Feb_FB_3871_DT-DP_V02_9x16_VID_EN_Opti_C-Sale_Sale_CTA-70_Angle-W_M-JANW_VL-30s_G-M_P-OG_S-WHAT_FB2284V05.mp4,3871 - 2284 opti VID || Enhancements: OFF || CBV1 || Batch 1 || 7C || 04/03/25w10 || Valentinas,SHARE,$0,9,2025-03-04,2025-03-15,11
328,CB_2025_Jan_FB_3748_VK-DP_V04_4x5_IMG_EN_New_C-BulletPoints_Sale_CTA-NY_Angle-W-B-C_M-NONE_VL-None_G-M_P-OG_S-NONE.png - Copy,3748 - winner ads opti - GLP1 - VK-DP || Enhancements: OFF || GLP-1 || Batch 1 || 7C || 20/02/25w09 || Valentinas,SHARE,$0,6,2025-02-24,2025-03-16,20
329,CB_2025_Jan_FB_3757_LZ-DP_V20_9x16_VID_EN_Opti_C-NegativeMark_Evergreen_CTA-NONE_Angle-W-B_M-MAG_VL-45s_G-F_P-GLP1_S-WHAT_FB3311V14.mp4,3757 - GLP1 video winner opti Batch 3+4 || Enhancements: OFF || GLP-1 || Batch 4 || 7C || 24/02/25w09 || Valentinas,VIDEO,$0,5,2025-02-24,2025-03-17,21
330,CB_2025_Feb_FB_3871_DT-DP_V03_9x16_VID_EN_Opti_C-Sale_Sale_CTA-70_Angle-W_M-JANW_VL-30s_G-M_P-OG_S-WHAT_FB2284V05.mp4,3871 - 2284 opti VID || Enhancements: OFF || CBV1 || Batch 1 || 7C || 04/03/25w10 || Valentinas,SHARE,$0,3,2025-03-04,2025-03-14,10
331,CB_2025_Feb_FB_3871_DT-DP_V01_9x16_VID_EN_Opti_C-Sale_Sale_CTA-70_Angle-W_M-JANW_VL-30s_G-M_P-OG_S-WHAT_FB2284V05,3871 - 2284 opti VID || Enhancements: OFF || CBV1 || Batch 1 || 7C || 04/03/25w10 || Valentinas,SHARE,$0,5,2025-03-04,2025-03-14,10
332,CB_2024_Oct_FB_3251_LZ-VU_V01_1x1_IMG_EN_New_C-NegativeMark_Evergreen_CTA-NONE_Angle-Cort_M-NONE_VL-None_G-NONE_P-NONE_S-NONE.png,US || Manual Bid || BFCM || COST CAP 81 || 1C || 15/11/24,SHARE,$0,3,2024-11-15,2025-03-17,122
333,CB_2025_Mar_FB_3910_LZ-JG_V02_1x1_IMG_EN_Opti_C-NegativeMark_Evergreen_CTA-NONE_Angle-W_M-NONE_VL-None_G-NONE_P-TRIAL_S-NONE_FB2227V08.png,US || Free trial offer || Trial ads || ATC || 7C || 16/03/25,,$0,2,2025-03-16,2025-03-27,11
334,CB_2025_Feb_FB_3811_DT_V03_9x16_VID_EN_Opti_C-Sale_Sale_CTA-70_Angle-W_M-JOG_VL-45s_G-M-F_P-OG_S-Moon_FB2263V04,3811 - #133 Green screen timeframe hooks || Enhancements: OFF || CBV1 || Batch 1 || 7C || 19/02/25w08 || Kostas,VIDEO,$0,5,2025-02-19,2025-03-11,20
335,CB_2025_Jan_FB_3757_LZ-DP_V17_9x16_VID_EN_Opti_C-NegativeMark_Evergreen_CTA-NONE_Angle-W_M-ATBJ_VL-45s_G-F_P-GLP1_S-MOON_FB3626V01.mp4,3757 - GLP1 video winner opti Batch 3+4 || Enhancements: OFF || GLP-1 || Batch 4 || 7C || 24/02/25w09 || Valentinas,VIDEO,$0,1,2025-02-24,2025-03-16,20
336,CB_2023_Jul_FB_2217_IB_V04_9x16_VID_EN_Opti_C-Pointing_CTA-SMR_Pain-W-B_M-TRC_VL-30s_TR-None_G-F_P-None_S-FRIGGA,US || Manual Bid || BID CAP 105 || 1C || 21/12/24,VIDEO,$0,1,2024-12-22,2025-03-27,95
337,CB_2025_Jan_FB_3757_LZ-DP_V17_9x16_VID_EN_Opti_C-NegativeMark_Evergreen_CTA-NONE_Angle-W_M-ATBJ_VL-45s_G-F_P-GLP1_S-MOON_FB3626V01.mp4,3757 - GLP1 video winner opti Batch 3+4 || Enhancements: OFF || GLP-1 || Batch 4 || 7C || 24/02/25w09 || Valentinas,VIDEO,$0,2,2025-02-24,2025-03-17,21
338,CB_2024_Dec_FB_3622_LZ-KB_V03_4x5_IMG_EN_Opti_C-NONE_Sale_CTA-XMAS_Angle-GH_M-NONE_VL-None_G-NONE_P-OG_S-NONE_FB2227V08 - Copy,US || Manual Bid || BID CAP 105 || 1C || 21/12/24,SHARE,$0,1,2024-12-22,2025-03-11,79
