,Ad Name,Adset Name,Creative Type,Spend In USD,Impressions,First Ad Spend Date,Last Ad Spend Date,Days ad spending
1,CB_2025_Feb_FB_3883_LZ-RP_V05_9x16_VID_EN_Opti_C-BulletPoints_Evergreen_CTA-SALE_Angle-W_M-JANW_VL-30s_G-M_P-OG_S-WHAT_FB2284V05,ðŸŒ¶ï¸ || US || ASC+ || ->CC141 || VIDEO Only || US+CA || 0% EXISTING CAP || 7C || 07/08.24  Ad set,VIDEO,"$26,962","1,381,330",2025-03-28,2025-05-16,49
2,CB_2025_Mar_FB_3914_DT-DP_V01_9x16_VID_EN_New_C-Trend_Sale_CTA-SPRNG_Angle-W-B-C_M-JOG_VL-30s_G-F_P-OG_S-NEW,ðŸŒ¶ï¸ || US || ASC+ || ->CC141 || VIDEO Only || US+CA || 0% EXISTING CAP || 7C || 07/08.24  Ad set,VIDEO,"$9,055","422,289",2025-03-28,2025-05-16,49
3,CB_2023_Dec_FB_2712_RS-DP_V02_1x1_VID_EN_Opti_C-WrittenTesti_CTA-SALE_Pain-W-B-C_M-NONE_VL-None_TR-None_G-NONE_P-V2_S-NONE_FB2227V08,CBV2 || EU (UK) || ðŸ’° Advantage+ || US || BROAD || 7C || Existing_customer_5% || 15/12/24 Ad set,VIDEO,"$6,798","429,560",2025-03-31,2025-06-30,91
4,CB_2025_Mar_FB_3890_DT_V04_1x1_IMG_EN_New_C-NONE_Evergreen_CTA-None_Angle-W_M-NONE_VL-None_G-NONE_P-OG_S-NONE,ðŸŒ¶ï¸ || US || ASC+ || ->CC141 || VIDEO Only || US+CA || 0% EXISTING CAP || 7C || 07/08.24  Ad set,SHARE,"$6,566","404,332",2025-03-31,2025-04-12,12
5,Dynamic_Creative_Statics_CA_Flow,WC || CA || DYNAMIC CREATIVE Static winners || ADV+ audience || 7C || 16.02.2025,SHARE,"$6,299","461,059",2025-02-16,2025-06-30,134
6,CB_2025_Mar_FB_3907_CHUB-AA_V03__IMG_EN_Opti_C-Price_CTA-NONE_Angle-None_M-NONE_VL-None_TR-None_G-NONE_P-OG_S-NONE,ðŸŒ¶ï¸ || US || ASC+ || ->CC141 || VIDEO Only || US+CA || 0% EXISTING CAP || 7C || 07/08.24  Ad set,SHARE,"$6,268","256,680",2025-03-25,2025-05-12,48
7,CB_2025_Mar_FB_3907_CHUB-AA_V03__IMG_EN_Opti_C-Price_CTA-NONE_Angle-None_M-NONE_VL-None_TR-None_G-NONE_P-OG_S-NONE,CA || ASC+ || 0% EXISTING || 7DC || 18.03.2025,SHARE,"$6,117","404,031",2025-03-27,2025-04-26,30
8,CB_2023_Jul_FB_2217_IB_V04_9x16_VID_EN_Opti_C-Pointing_CTA-SMR_Pain-W-B_M-TRC_VL-30s_TR-None_G-F_P-None_S-FRIGGA,ðŸŒ¶ï¸ || US || ASC+ || ->CC141 || VIDEO Only || US+CA || 0% EXISTING CAP || 7C || 07/08.24  Ad set,VIDEO,"$5,945","203,757",2024-08-07,2025-05-05,271
9,CB_2025_Mar_FB_3910_LZ-DP_V04_9x16_VID_EN_Opti_C-Testimonial_Evergreen_CTA-NONE_Angle-W_M-TRC_VL-15s_G-F_P-TRIAL_S-FRIGGA_FB2217V04.mp4,US || Free trial offer || Trial ads || Trial purchase || 7C || 19/03/25,VIDEO,"$5,610","141,755",2025-03-19,2025-04-29,41
10,CB_2025_Feb_FB_3883_LZ-RP_V05_9x16_VID_EN_Opti_C-BulletPoints_Evergreen_CTA-SALE_Angle-W_M-JANW_VL-30s_G-M_P-OG_S-WHAT_FB2284V05,CA || ASC+ || 0% EXISTING || 7DC || 18.03.2025,VIDEO,"$5,107","456,072",2025-03-27,2025-05-11,45
11,CB_2025_Feb_FB_3827_LZ_V01_1x1_IMG_EN_Opti_C-Headline_Evergreen_CTA-NONE_Angle-W_M-NONE_VL-None_G-M_P-CBV2_S-NONE_FB3723V04,CBV2 || US || Manual Bid: ROAS GOAL: 1.00 -> 1.1 || 7DC || 22/01/2025,SHARE,"$4,963","208,180",2025-02-18,2025-04-20,61
12,CB_2024_Sep_FB_3175_DA-KB_V04_1x1_IMG_EN_New_C-ADVRT_Evergreen_CTA-NONE_Angle-W_M-NONE_VL-None_G-NONE_P-CBV2_S-NONE_blog_colonbroomvsmammoth_cv_en,CBV2 || UK || Advantage+ || Advertorial |  || 0% EXISTING CAP || BROAD || 7C || ad set 18/03/25,SHARE,"$4,534","184,678",2025-03-18,2025-04-22,35
13,CB_2025_Feb_FB_3827_LZ_V04_1x1_IMG_EN_Opti_C-Headline_Evergreen_CTA-SALE_Angle-W_M-NONE_VL-None_G-M_P-CBV2_S-NONE_FB3779V02,CBV2 || US || Manual Bid: ROAS GOAL: 1.00 -> 1.1 || 7DC || 22/01/2025,SHARE,"$4,485","152,305",2025-02-18,2025-06-30,132
14,CB_2025_Mar_FB_3914_DT-DP_V01_9x16_VID_EN_New_C-Trend_Sale_CTA-SPRNG_Angle-W-B-C_M-JOG_VL-30s_G-F_P-OG_S-NEW,CA || ASC+ || 0% EXISTING || 7DC || 18.03.2025,VIDEO,"$3,793","277,772",2025-04-01,2025-05-11,40
15,CB_2025_Feb_FB_3883_LZ-RP_V05_9x16_VID_EN_Opti_C-BulletPoints_Evergreen_CTA-SALE_Angle-W_M-JANW_VL-30s_G-M_P-OG_S-WHAT_FB2284V05,3883 - Wiiner opti man boobs t levels || Enhancements: OFF || CBV1 || Batch 1 || 7C || 10/03/25w11,VIDEO,"$3,474","194,919",2025-03-10,2025-04-14,35
16,CB_2025_Mar_FB_3904_DT_V01_9x16_VID_EN_New_C-Trend_Evergreen_CTA-NONE_Angle-W_M-MIX_VL-30s_G-MF_P-OG_S-New,ðŸŒ¶ï¸ || US || ASC+ || ->CC141 || VIDEO Only || US+CA || 0% EXISTING CAP || 7C || 07/08.24  Ad set,VIDEO,"$3,072","136,001",2025-03-28,2025-04-30,33
17,CB_2025_Feb_FB_3883_LZ-RP_V05_9x16_VID_EN_Opti_C-BulletPoints_Evergreen_CTA-SALE_Angle-W_M-JANW_VL-30s_G-M_P-OG_S-WHAT_FB2284V05,CBV2 || AU || ðŸ’° Advantage+ || US || BROAD || 7C || Existing_customer_5% || 19/12/24 Ad set,VIDEO,"$3,028","182,485",2025-03-28,2025-05-23,56
18,CB_2025_Mar_FB_3914_DT-DP_V01_9x16_VID_EN_New_C-Trend_Sale_CTA-SPRNG_Angle-W-B-C_M-JOG_VL-30s_G-F_P-OG_S-NEW,CBV2 || EU (UK) || ðŸ’° Advantage+ || US || BROAD || 7C || Existing_customer_5% || 15/12/24 Ad set,VIDEO,"$3,016","172,393",2025-04-01,2025-06-30,90
19,CB_2025_Mar_FB_3914_DT-DP_V01_9x16_VID_EN_New_C-Trend_Sale_CTA-SPRNG_Angle-W-B-C_M-JOG_VL-30s_G-F_P-OG_S-NEW,US || Kilo Product's leads LAL || 7C || 04/03/25,VIDEO,"$2,846","82,362",2025-04-06,2025-05-15,39
20,CB_2025_Mar_FB_3890_DT_V02_1x1_IMG_EN_New_C-NONE_Evergreen_CTA-None_Angle-W_M-NONE_VL-None_G-NONE_P-OG_S-NONE,ðŸŒ¶ï¸ || US || ASC+ || ->CC141 || VIDEO Only || US+CA || 0% EXISTING CAP || 7C || 07/08.24  Ad set,SHARE,"$2,840","118,453",2025-03-15,2025-04-10,26
21,CB_2025_Feb_FB_3827_LZ_V03_1x1_IMG_EN_Opti_C-Headline_Evergreen_CTA-SALE_Angle-W_M-NONE_VL-None_G-M_P-CBV2_S-NONE_FB3705V02,3827 - V2 img winner opti || Batch 2 || 7C || 18/02/2025w08,SHARE,"$2,809","115,020",2025-02-18,2025-04-14,55
22,CB_2023_Apr_FB_1989_RS_V08_9x16_VID_EN_Opti_C-Trend_CTA-SMR_Pain-W_M-MIX_VL-30s_TR-None_G-MF_P-None - Copy,CA || ASC+ || 0% EXISTING || 7DC || 18.03.2025,VIDEO,"$2,651","165,505",2025-03-18,2025-04-14,27
23,CB_2024_Sep_FB_3175_DA-KB_V04_1x1_IMG_EN_New_C-ADVRT_Evergreen_CTA-NONE_Angle-W_M-NONE_VL-None_G-NONE_P-CBV2_S-NONE_blog_colonbroomvsmammoth_cv_en,CBV2 || AU || Advantage+ || Advertorial |  || 0% EXISTING CAP || BROAD || 7C || ad set 18/03/25,SHARE,"$2,569","121,773",2025-03-20,2025-04-17,28
24,CB_2023_Jul_FB_2217_IB_V04_9x16_VID_EN_Opti_C-Pointing_CTA-SMR_Pain-W-B_M-TRC_VL-30s_TR-None_G-F_P-None_S-FRIGGA,US || ASC+ || Website + Shop || 7DC || Existing 0% || 24.03.2025 Ad set,VIDEO,"$2,523","89,728",2025-03-24,2025-05-15,52
25,CB_2025_Mar_FB_3914_DT-DP_V01_9x16_VID_EN_New_C-Trend_Sale_CTA-SPRNG_Angle-W-B-C_M-JOG_VL-30s_G-F_P-OG_S-NEW,US || ASC+ || Website + Shop || 7DC || Existing 0% || 24.03.2025 Ad set,VIDEO,"$2,479","111,275",2025-04-04,2025-04-26,22
26,CB_2024_Jan_FB_2764_RS_V04_9x16_VID_EN_Opti_C-SingleTesti_CTA-SALE_Pain-W_M-TRC_VL-45s_TR-None_G-F_P-OG_S-MOON_FB2263V04,EU (UK) || 2764 || Trinity Results Too Fast || 1C || 08/01/2025w02,VIDEO,"$2,392","82,833",2025-01-08,2025-04-17,99
27,CB_2025_Jan_FB_3723_SO_V04_4x5_IMG_EN_New_C-NONE_Evergreen_CTA-SALE_Angle-W_M-NONE_VL-None_G-NONE_P-NONE_S-NONE,ðŸŒ¶ï¸ || US || ASC+ || ->CC141 || VIDEO Only || US+CA || 0% EXISTING CAP || 7C || 07/08.24  Ad set,SHARE,"$2,306","145,975",2025-02-12,2025-05-09,86
28,CB_2024_Sep_FB_3175_DA-KB_V04_1x1_IMG_EN_New_C-ADVRT_Evergreen_CTA-NONE_Angle-W_M-NONE_VL-None_G-NONE_P-CBV2_S-NONE_blog_colonbroomvsmammothhighprice3_cv_en,CBV2 || A/B test CTA button: Variaton || CBV2 vs Happy Mammoth || 7C || 26/03/25,SHARE,"$2,110","79,983",2025-03-26,2025-04-28,33
29,CB_2024_Sep_FB_3175_DA-KB_V04_1x1_IMG_EN_New_C-ADVRT_Evergreen_CTA-NONE_Angle-W_M-NONE_VL-None_G-NONE_P-CBV2_S-NONE_blog_colonbroomvsmammoth_cv_en,CBV2 || A/B test CTA button: Control || CBV2 vs Happy Mammoth || 7C || 26/03/25,SHARE,"$2,095","80,741",2025-03-26,2025-04-16,21
30,CB_2025_Mar_FB_3891_VK_V05_1x1_IMG_EN_New_C-BulletPoints_Evergreen_CTA-65_Angle-W-B-C_M-NONE_VL-None_G-M_P-OG_S-NONE,CA || ASC+ || 0% EXISTING || 7DC || 18.03.2025,SHARE,"$2,032","180,100",2025-03-18,2025-04-20,33
31,CB_2025_Feb_FB_3818_LZ-VU_V05_1x1_IMG_EN_Opti_C-Headline_Evergreen_CTA-NONE_Angle-Cort_M-NONE_VL-None_G-NONE_P-NONE_S-NONE_FB3251V01,ðŸŒ¶ï¸ || US || ASC+ || ->CC141 || VIDEO Only || US+CA || 0% EXISTING CAP || 7C || 07/08.24  Ad set,SHARE,"$2,027","85,739",2025-03-18,2025-04-08,21
32,CB_2024_Sep_FB_3175_DA-KB_V04_1x1_IMG_EN_New_C-ADVRT_Evergreen_CTA-NONE_Angle-W_M-NONE_VL-None_G-NONE_P-CBV2_S-NONE_blog_colonbroomvsmammoth_cv_en,CBV2 || Advantage+ || Advertorial || Higher pricing || US || 0% EXISTING CAP || BROAD || 7C || 20/01/25  Campaign Ad set,SHARE,"$1,926","82,726",2025-01-20,2025-06-30,161
33,CB_2024_Nov_FB_3264_LZ_V29_4x5_VID_EN_Opti_C-NegativeMark_Sale_CTA-BF_Angle-W-B_M-LRNS_VL-30s_G-M_P-OG_S-NONE,ðŸŒ¶ï¸ || US || ASC+ || ->CC141 || VIDEO Only || US+CA || 0% EXISTING CAP || 7C || 07/08.24  Ad set,VIDEO,"$1,892","70,189",2024-12-04,2025-04-24,141
34,CB_2025_Apr_FB_3975_LZ_V03_9x16_VID_EN_New_C-Testimonial_Evergreen_CTA-SALE_Angle-W_M-LAURA_VL-15s_G-F_P-OG_S-NEW,CA || ASC+ || 0% EXISTING || 7DC || 18.03.2025,VIDEO,"$1,834","145,491",2025-04-12,2025-04-20,8
35,CB_2023_Jul_FB_2217_IB_V04_9x16_VID_EN_Opti_C-Pointing_CTA-SMR_Pain-W-B_M-TRC_VL-30s_TR-None_G-F_P-None_S-FRIGGA,CA || ASC+ || 0% EXISTING || 7DC || 18.03.2025,VIDEO,"$1,711","95,239",2025-03-18,2025-05-11,54
36,CB_2023_May_FB_2263_MB_V04_9x16_VID_EN_New_C-Sale_CTA-SMR_Pain-W_M-JOG_VL-45s_TR-None_G-M-F_P-None_S-Moon,ðŸŒ¶ï¸ || US || ASC+ || ->CC141 || VIDEO Only || US+CA || 0% EXISTING CAP || 7C || 07/08.24  Ad set,VIDEO,"$1,703","51,977",2024-08-07,2025-05-16,282
37,CB_2025_Mar_FB_3924_SO-DP_V03_1x1_IMG_EN_New_C-NONE_Evergreen_CTA-NONE_Angle-W-B-C_M-NONE_VL-None_G-NONE_P-OG_S-NONE,CA || ASC+ || 0% EXISTING || 7DC || 18.03.2025,SHARE,"$1,599","117,401",2025-04-12,2025-05-04,22
38,CB_2025_Mar_FB_3914_DT-DP_V01_9x16_VID_EN_New_C-Trend_Sale_CTA-SPRNG_Angle-W-B-C_M-JOG_VL-30s_G-F_P-OG_S-NEW,"3914 - #9 GF's POV, male confidence || Batch 1 || Enhancements: OFF || CBV1 || 7C || 24/03/25w13",VIDEO,"$1,589","61,496",2025-03-24,2025-04-15,22
39,CB_2025_Mar_FB_3909_DT-DP_V03_9x16_VID_EN_New_C-Trend_Evergreen_CTA-SMRBOD_Angle-W-B-C_M-JANW_VL-30s_G-M_P-OG_S-NEW,3909 - Shirtless anxiety VID || Batch 1 || Enhancements: OFF || CBV1 || 7C || 24/03/25w13,VIDEO,"$1,570","89,418",2025-03-24,2025-04-14,21
40,CB_2025_Mar_FB_3950_SO_V11_4x5_IMG_EN_New_C-NONE_Evergreen_CTA-NONE_Angle-W-B-C_M-NONE_VL-None_G-NONE_P-OG_S-NONE,3950 - Image Gen by ChatGPT || Batch 3 || Enhancements: OFF || CBV1 || 7C || 30/03/25w14,SHARE,"$1,532","90,037",2025-03-30,2025-04-25,26
41,CB_2023_Dec_FB_2712_RS-DP_V02_1x1_VID_EN_Opti_C-WrittenTesti_CTA-SALE_Pain-W-B-C_M-NONE_VL-None_TR-None_G-NONE_P-V2_S-NONE_FB2227V08,CBV2 || AU || ðŸ’° Advantage+ || US || BROAD || 7C || Existing_customer_5% || 19/12/24 Ad set,SHARE,"$1,502","58,839",2024-12-19,2025-05-01,133
42,CB_2025_Mar_FB_3913_CHUB-AS_V05_1x1_IMG_EN_New_C-NONE_CTA-NONE_Angle-W_M-NONE_VL-None_TR-None_G-NONE_P-NONE_S-NONE_blog_moobs_cv_en,CBV1 || LP:HI | blog_moobs_cv_en || Batch 2 || 30/03/25,SHARE,"$1,411","58,199",2025-03-30,2025-04-16,17
43,CB_2025_Mar_FB_3910_LZ-DP_V03_9x16_VID_EN_Opti_C-BulletPoints_Evergreen_CTA-NONE_Angle-W_M-MAN_VL-15s_G-M_P-TRIAL_S-WHAT_FB3097V03.mp4,US || Free trial offer || Trial ads || Trial purchase || 7C || 19/03/25,VIDEO,"$1,409","45,246",2025-03-19,2025-04-29,41
44,CB_2024_Jan_FB_2764_RS_V04_9x16_VID_EN_Opti_C-SingleTesti_CTA-SALE_Pain-W_M-TRC_VL-45s_TR-None_G-F_P-OG_S-MOON_FB2263V04_Page_Personal_Coach,CBV2 || AU || ðŸ’° Advantage+ || US || BROAD || 7C || Existing_customer_5% || 19/12/24 Ad set,VIDEO,"$1,408","31,795",2025-01-16,2025-05-08,112
45,CB_2025_Feb_FB_3860_LZ-DP_V03_9x16_VID_EN_Opti_C-Testimonial_Evergreen_CTA-SALE_Angle-W_M-MOOD_VL-20s_G-M_P-OG_S-WOOD_FB21176V11_1,3860 - man boobs video 2176 opti || Enhancements: OFF || CBV1 || Batch 1 || 7C || 03/03/25w10 || Valentinas,VIDEO,"$1,394","58,741",2025-03-03,2025-04-12,40
46,CB_2025_Jan_FB_3723_SO_V04_4x5_IMG_EN_New_C-NONE_Evergreen_CTA-SALE_Angle-W_M-NONE_VL-None_G-NONE_P-NONE_S-NONE,US || Kilo Product's leads LAL || 7C || 04/03/25,SHARE,"$1,369","62,974",2025-03-04,2025-05-15,72
47,CB_2025_Mar_FB_3939_DT_V07_4x5_IMG_EN_New_C-Advertorial_Sale_CTA-65_Angle-W-B-C_M-MIX_VL-None_G-M_P-OG_S-NONE,3939 - CB Advertorial ads New Ideas || Batch 2 || Enhancements: OFF || CBV1 || 7C || 30/03/25w14,SHARE,"$1,368","67,306",2025-03-30,2025-04-14,15
48,CB_2025_Mar_FB_3907_CHUB-AA_V03_4x5_IMG_EN_Opti_C-Price_CTA-NONE_Angle-None_M-NONE_VL-None_TR-None_G-NONE_P-OG_S-NONE.png,US || Quiz: Shopify || 7C || 04/04/25,SHARE,"$1,365","54,164",2025-04-04,2025-05-11,37
49,CB_2025_Feb_FB_3827_LZ_V04_1x1_IMG_EN_Opti_C-Headline_Evergreen_CTA-SALE_Angle-W_M-NONE_VL-None_G-M_P-CBV2_S-NONE_FB3779V02,CBV2 || US || Manual Bid: ROAS GOAL: 1.1 || Random ads || 7DC || 08/04/2025,SHARE,"$1,347","39,703",2025-04-08,2025-04-11,3
50,CB_2025_Mar_FB_3903_VK_V01_9x16_VID_EN_New_C-BulletPoints_Evergreen_CTA-65_Angle-W-B-C_M-MIX_VL-30s_G-MF_P-OG_S-NEW,CA || ASC+ || 0% EXISTING || 7DC || 18.03.2025,VIDEO,"$1,345","104,915",2025-03-30,2025-05-11,42
51,CB_2025_Mar_FB_3919_LZ_V01_1x1_IMG_EN_Opti_C-Headline_Evergreen_CTA-NONE_Angle-Horm_M-NONE_VL-30s_G-M_P-OG_S-NONE_FB3891V05,CA || ASC+ || 0% EXISTING || 7DC || 18.03.2025,SHARE,"$1,307","102,800",2025-03-27,2025-05-11,45
52,CB_2023_Jul_FB_2226_MB_V04_9x16_VID_EN_Opti_C-Testim_CTA-SMR_Pain-W_M-MIX_VL-30s_TR-None_G-F_P-None_S-Starry,CA || ASC+ || 0% EXISTING || 7DC || 18.03.2025,VIDEO,"$1,282","67,799",2025-03-18,2025-05-05,48
53,CB_2025_Mar_FB_3924_SO-DP_V03_1x1_IMG_EN_New_C-NONE_Evergreen_CTA-NONE_Angle-W-B-C_M-NONE_VL-None_G-NONE_P-OG_S-NONE,3924 - #17 man boobs/dad bod body text IMG || Batch 1 || Enhancements: OFF || CBV1 || 7C || 24/03/25w13,SHARE,"$1,244","48,992",2025-03-24,2025-05-06,43
54,CB_2025_Feb_FB_3860_LZ-DP_V02_9x16_VID_EN_Opti_C-Testimonial_Evergreen_CTA-SALE_Angle-W_M-MOOD_VL-20s_G-M_P-OG_S-WOOD_FB21176V11_1,3860 - man boobs video 2176 opti || Enhancements: OFF || CBV1 || Batch 1 || 7C || 03/03/25w10 || Valentinas,VIDEO,"$1,230","55,420",2025-03-03,2025-04-12,40
55,CB_2023_Jul_FB_2284_DA_V05_9x16_VID_EN_Opti_C-Sale_CTA-SMR_Pain-W_M-JANW_VL-30s_TR-None_G-M_P-None_S-WHAT_FB2103V02,ðŸŒ¶ï¸ || US || ASC+ || ->CC141 || VIDEO Only || US+CA || 0% EXISTING CAP || 7C || 07/08.24  Ad set,VIDEO,"$1,197","38,440",2024-08-07,2025-04-21,257
56,CB_2025_Mar_FB_3910_LZ-DP_V01_1x1_IMG_EN_Opti_C-Headline_Evergreen_CTA-NONE_Angle-W_M-NONE_VL-None_G-NONE_P-TRIAL_S-NONE_FB3251V02.png,US || Free trial offer || Trial ads || Trial purchase || 7C || 19/03/25,SHARE,"$1,176","47,404",2025-03-19,2025-04-29,41
57,CB_2025_Mar_FB_3950_SO_V16_4x5_IMG_EN_New_C-NONE_Evergreen_CTA-NONE_Angle-W-B-C_M-NONE_VL-None_G-NONE_P-OG_S-NONE,3950 - Image Gen by ChatGPT || Batch 4 || Enhancements: OFF || CBV1 || 7C || 30/03/25w14,SHARE,"$1,140","67,145",2025-03-30,2025-04-12,13
58,CB_2024_Feb_FB_2812_MB-RP_V07_9x16_VID_EN_Opti_C-Sale_CTA-C65_Pain-W_M-NONE_VL-30s_TR-None_G-MF_P-Plan_S-NEW_FB2601V04_1,US || Kilo Product's leads LAL || 7C || 04/03/25,VIDEO,"$1,101","32,318",2025-03-04,2025-05-15,72
59,CB_2025_Apr_FB_3975_LZ_V03_9x16_VID_EN_New_C-Testimonial_Evergreen_CTA-SALE_Angle-W_M-LAURA_VL-15s_G-F_P-OG_S-NEW,3975 - Idea #125 -X from waist || Batch 1 || Enhancements: OFF || CBV1 || 7C || 07/04/25w15,VIDEO,"$1,093","55,924",2025-04-07,2025-04-14,7
60,CB_2025_Mar_FB_3955_SO_V15_4x5_IMG_EN_New_C-NONE_Evergreen_CTA-NONE_Angle-W-B-C_M-NONE_VL-None_G-NONE_P-OG_S-NONE,3955 - THE GHIBLI-VERSE Trend || Batch 5 || Enhancements: OFF || CBV1 || 7C || 01/04/25w14,SHARE,"$1,092","74,282",2025-04-01,2025-04-14,13
61,CB_2025_Mar_FB_3907_CHUB-AA_V03_4x5_IMG_EN_Opti_C-Price_CTA-NONE_Angle-None_M-NONE_VL-None_TR-None_G-NONE_P-OG_S-NONE.png,US || Quiz: React || 7C || 04/04/25,SHARE,"$1,039","43,255",2025-04-04,2025-05-06,32
62,CB_2025_Feb_FB_3883_LZ-RP_V05_9x16_VID_EN_Opti_C-BulletPoints_Evergreen_CTA-SALE_Angle-W_M-JANW_VL-30s_G-M_P-OG_S-WHAT_FB2284V05,CBV2 || US || Manual Bid: ROAS GOAL: 1.1 || Random ads || 7DC || 08/04/2025,VIDEO,$973,"42,206",2025-04-08,2025-04-11,3
63,CB_2025_Jan_FB_3742_SO-DP-KB_V06_4x5_IMG_EN_Opti_C-NONE_Evergreen_CTA-SALE_Angle-W_M-NONE_VL-None_G-NONE_P-CBV2_S-NONE3665V01,CBV2 || US || Manual Bid: ROAS GOAL: 1.00 -> 1.1 || 7DC || 22/01/2025,SHARE,$973,"34,862",2025-02-11,2025-06-30,139
64,CB_2025_Jan_FB_3723_SO_V04_4x5_IMG_EN_New_C-NONE_Evergreen_CTA-SALE_Angle-W_M-NONE_VL-None_G-NONE_P-NONE_S-NONE,CA || ASC+ || 0% EXISTING || 7DC || 18.03.2025,SHARE,$973,"97,761",2025-03-18,2025-05-11,54
65,CB_2023_Jul_FB_2226_MB_V04_9x16_VID_EN_Opti_C-Testim_CTA-SMR_Pain-W_M-MIX_VL-30s_TR-None_G-F_P-None_S-Starry,ðŸŒ¶ï¸ || US || ASC+ || ->CC141 || VIDEO Only || US+CA || 0% EXISTING CAP || 7C || 07/08.24  Ad set,VIDEO,$899,"28,217",2024-10-28,2025-05-16,200
66,CB_2025_Feb_FB_3817_SO_V01_4x5_IMG_EN_Opti_C-NONE_Evergreen_CTA-SALE_Angle-W_M-NONE_VL-None_G-NONE_P-NONE_S-NONE_FB3723V07,CBV2 || AU || ðŸ’° Advantage+ || US || BROAD || 7C || Existing_customer_5% || 19/12/24 Ad set,SHARE,$898,"56,898",2025-02-14,2025-05-23,98
67,CB_2024_Aug_FB_3097_VK-DP_V03_9x16_VID_EN_Opti_C-Benefits_CTA-SMR_Pain-W-B_M-MIX_VL-45s_TR-None_G-MF_P-OG_S-WHAT_FB2516V13,US || Kilo Product's leads LAL || 7C || 04/03/25,VIDEO,$879,"29,084",2025-03-04,2025-04-14,41
68,CB_2025_Apr_FB_3963_SO-DP_V12_4x5_IMG_EN_Opti_C-NONE_Evergreen_CTA-NONE_Angle-W-B-C_M-NONE_VL-None_G-NONE_P-OG_S-NONE_FB3922V03,3963 - 3922 opti_3 batches IMG || Batch 3 || Enhancements: OFF || CBV1 || 7C || 07/04/25w15,SHARE,$872,"32,214",2025-04-07,2025-04-17,10
69,CB_2025_Mar_FB_3914_DT-DP_V01_9x16_VID_EN_New_C-Trend_Sale_CTA-SPRNG_Angle-W-B-C_M-JOG_VL-30s_G-F_P-OG_S-NEW,CBV2 || AU || ðŸ’° Advantage+ || US || BROAD || 7C || Existing_customer_5% || 19/12/24 Ad set,VIDEO,$863,"41,784",2025-04-01,2025-05-23,52
70,CB_2025_Apr_FB_3962_VK-DP_V02_9x16_VID_EN_Opti_C-Trend_Evergreen_CTA-NONE_Angle-W-B-C_M-JANW_VL-30s_G-M_P-OG_S-NEW_FB3909V03,3962 - 3909 hook opti - DP -VK || Batch 1 || Enhancements: OFF || CBV1 || 7C || 07/04/25w15,VIDEO,$854,"44,055",2025-04-07,2025-04-17,10
71,CB_2025_Mar_FB_3907_CHUB-AA_V03__IMG_EN_Opti_C-Price_CTA-NONE_Angle-None_M-NONE_VL-None_TR-None_G-NONE_P-OG_S-NONE,US || ASC+ || Website + Shop || 7DC || Existing 0% || 24.03.2025 Ad set,SHARE,$851,"27,958",2025-04-04,2025-05-15,41
72,CB_2025_Mar_FB_3909_DT-DP_V03_9x16_VID_EN_New_C-Trend_Evergreen_CTA-SMRBOD_Angle-W-B-C_M-JANW_VL-30s_G-M_P-OG_S-NEW,ðŸŒ¶ï¸ || US || ASC+ || ->CC141 || VIDEO Only || US+CA || 0% EXISTING CAP || 7C || 07/08.24  Ad set,VIDEO,$844,"40,688",2025-04-11,2025-04-26,15
73,CB_2024_Aug_FB_3097_VK-DP_V03_9x16_VID_EN_Opti_C-Benefits_CTA-SMR_Pain-W-B_M-MIX_VL-45s_TR-None_G-MF_P-OG_S-WHAT_FB2516V13,ðŸŒ¶ï¸ || US || ASC+ || ->CC141 || VIDEO Only || US+CA || 0% EXISTING CAP || 7C || 07/08.24  Ad set,VIDEO,$832,"39,084",2025-03-28,2025-04-26,29
74,CB_2025_Mar_FB_3924_SO-DP_V03_1x1_IMG_EN_New_C-NONE_Evergreen_CTA-NONE_Angle-W-B-C_M-NONE_VL-None_G-NONE_P-OG_S-NONE,CBV2 || AU || ðŸ’° Advantage+ || US || BROAD || 7C || Existing_customer_5% || 19/12/24 Ad set,SHARE,$818,"42,619",2025-04-12,2025-05-01,19
75,CB_2023_Jul_FB_2217_IB_V04_9x16_VID_EN_Opti_C-Pointing_CTA-SMR_Pain-W-B_M-TRC_VL-30s_TR-None_G-F_P-None_S-FRIGGA,US || Manual Bid || BFCM || COST CAP 71 || 1C || 15/11/24,VIDEO,$812,"32,461",2024-11-15,2025-06-30,227
76,CB_2025_Mar_FB_3956_VK_V02_4x5_IMG_EN_OPTI_C-BulletPoints_Evergreen_CTA-65_Angle-W-B-C_M-NONE_VL-None_G-M_P-OG_S-NONE_FB3956V05,3956 - LOW T OPTI 3891 -VK || Batch 1 || Enhancements: OFF || CBV1 || 7C || 07/04/25w15,SHARE,$787,"44,418",2025-04-07,2025-04-14,7
77,CB_2024_Apr_FB_2970_RS_V02_1x1_GIF_EN_Opti_C-WrittenTesti_CTA-CTA_Pain-W_M-NONE_VL-7s_TR-None_G-NONE_P-V2_S-NEW,CBV2 || US || Manual Bid: ROAS GOAL: 1.00 -> 1.1 || 7DC || 22/01/2025,VIDEO,$766,"17,183",2025-03-27,2025-06-30,95
78,CB_2023_Dec_FB_2712_RS-DP_V02_1x1_VID_EN_Opti_C-WrittenTesti_CTA-SALE_Pain-W-B-C_M-NONE_VL-None_TR-None_G-NONE_P-V2_S-NONE_FB2227V08,CBV2 || EU (UK) || ðŸ’° Advantage+ || US || BROAD || 7C || Existing_customer_5% || 15/12/24 Ad set,SHARE,$760,"25,881",2024-12-15,2025-04-11,117
79,CB_2023_Jul_FB_2227_RS_V08_1x1_IMG_EN_New_C-Sale_CTA-CTA_None_M-NONE_VL-None_TR-None_G-NONE_P-None_S-NONE,ðŸŒ¶ï¸ || US || ASC+ || ->CC141 || VIDEO Only || US+CA || 0% EXISTING CAP || 7C || 07/08.24  Ad set,SHARE,$750,"26,254",2024-09-30,2025-04-14,196
80,CB_2025_Feb_FB_3883_LZ-RP_V05_9x16_VID_EN_Opti_C-BulletPoints_Evergreen_CTA-SALE_Angle-W_M-JANW_VL-30s_G-M_P-OG_S-WHAT_FB2284V05.mp4,US || Quiz: React || 7C || 04/04/25,VIDEO,$716,"38,801",2025-04-04,2025-05-06,32
81,CB_2025_Mar_FB_3903_VK_V01_9x16_VID_EN_New_C-BulletPoints_Evergreen_CTA-65_Angle-W-B-C_M-MIX_VL-30s_G-MF_P-OG_S-NEW,3903 - #13 My husband hides his beer belly - VK  || Batch 1 || Enhancements: OFF || CBV1 || 7C || 24/03/25w13,VIDEO,$658,"29,752",2025-03-24,2025-04-12,19
82,CB_2025_Mar_FB_3944_LZ-VG_V02_4x5_IMG_EN_Opti_C-Testimonial_Evergreen_CTA-NONE_Angle-GH_M-NONE_VL-None_G-NONE_P-OG_S-NONE_FB3619V02,3944 - 3619 opti claims/testimonial || Batch 1 || Enhancements: OFF || CBV1 || 7C || 30/03/25w14,SHARE,$638,"23,356",2025-03-30,2025-04-10,11
83,CB_2024_Apr_FB_2970_RS_V02_1x1_GIF_EN_Opti_C-WrittenTesti_CTA-CTA_Pain-W_M-NONE_VL-7s_TR-None_G-NONE_P-V2_S-NEW,CBV2 || AU || ðŸ’° Advantage+ || US || BROAD || 7C || Existing_customer_5% || 19/12/24 Ad set,VIDEO,$635,"19,991",2025-04-02,2025-05-23,51
84,CB_2025_Feb_FB_3883_LZ-RP_V05_9x16_VID_EN_Opti_C-BulletPoints_Evergreen_CTA-SALE_Angle-W_M-JANW_VL-30s_G-M_P-OG_S-WHAT_FB2284V05.mp4,US || Quiz: Shopify || 7C || 04/04/25,VIDEO,$621,"29,371",2025-04-04,2025-05-11,37
85,CB_2023_May_FB_2103_MB_V02_9x16_VID_EN_Opti_C-Sale_CTA-SMR_Pain-W_M-JOG_VL-30s_TR-None_G-M-F_P-None_S-What,US || ASC+ || Website + Shop || 7DC || Existing 0% || 24.03.2025 Ad set,VIDEO,$621,"20,926",2025-04-04,2025-05-15,41
86,CB_2025_Mar_FB_3955_SO-KB_V12_4x5_IMG_EN_New_C-NONE_Evergreen_CTA-NONE_Angle-W-B-C_M-NONE_VL-None_G-NONE_P-OG_S-NONE,3955 - THE GHIBLI-VERSE Trend || Batch 4 || Enhancements: OFF || CBV1 || 7C || 02/04/25w14,SHARE,$614,"29,526",2025-04-02,2025-04-12,10
87,CB_2025_Jan_FB_3723_SO_V07_4x5_IMG_EN_New_C-NONE_Evergreen_CTA-SALE_Angle-W_M-NONE_VL-None_G-NONE_P-NONE_S-NONE,ðŸŒ¶ï¸ || US || ASC+ || ->CC141 || VIDEO Only || US+CA || 0% EXISTING CAP || 7C || 07/08.24  Ad set,SHARE,$608,"31,778",2025-02-04,2025-04-14,69
88,CB_2025_Mar_FB_3955_SO_V08_4x5_IMG_EN_New_C-NONE_Evergreen_CTA-NONE_Angle-W-B-C_M-NONE_VL-None_G-NONE_P-OG_S-NONE,3955 - THE GHIBLI-VERSE Trend || Batch 2 || Enhancements: OFF || CBV1 || 7C || 02/04/25w14,SHARE,$607,"23,579",2025-04-02,2025-04-14,12
89,CB_2024_Aug_FB_3097_VK-DP_V03_9x16_VID_EN_Opti_C-Benefits_CTA-SMR_Pain-W-B_M-MIX_VL-45s_TR-None_G-MF_P-OG_S-WHAT_FB2516V13,US || ASC+ || Website + Shop || 7DC || Existing 0% || 24.03.2025 Ad set,VIDEO,$603,"18,726",2025-03-24,2025-04-21,28
90,CB_2025_Feb_FB_3817_SO_V01_4x5_IMG_EN_Opti_C-NONE_Evergreen_CTA-SALE_Angle-W_M-NONE_VL-None_G-NONE_P-NONE_S-NONE_FB3723V07,CBV2 || EU (UK) || ðŸ’° Advantage+ || US || BROAD || 7C || Existing_customer_5% || 15/12/24 Ad set,SHARE,$601,"33,109",2025-02-14,2025-06-30,136
91,CB_2024_Dec_FB_3601_VK-DP_V09_4x5_VID_EN_Opti_C-Dance_CTA-NY_Pain-W-B_M-JOG_VL-30s_TR-None_G-F_P-OG_S-WHAT_FB3045V01,CBV2 || AU || ðŸ’° Advantage+ || US || BROAD || 7C || Existing_customer_5% || 19/12/24 Ad set,SHARE,$589,"22,332",2025-01-03,2025-05-23,140
92,CB_2025_Mar_FB_3909_DT-DP_V03_9x16_VID_EN_New_C-Trend_Evergreen_CTA-SMRBOD_Angle-W-B-C_M-JANW_VL-30s_G-M_P-OG_S-NEW,CBV2 || AU || ðŸ’° Advantage+ || US || BROAD || 7C || Existing_customer_5% || 19/12/24 Ad set,VIDEO,$582,"32,780",2025-04-08,2025-04-12,4
93,CB_2023_Oct_FB_2516_VK_V13_9x16_VID_EN_Opti_C-Benefits_CTA-AUTUM_Pain-W-B_M-PASQ_VL-30s_TR-None_G-M_P-Plan_S-WHAT,ðŸŒ¶ï¸ || US || ASC+ || ->CC141 || VIDEO Only || US+CA || 0% EXISTING CAP || 7C || 07/08.24  Ad set,VIDEO,$577,"16,851",2024-12-19,2025-05-16,148
94,CB_2025_Mar_FB_3970_CHUB-AS_V04_1x1_IMG_EN_New_C-NONE_CTA-NONE_Angle-W_M-NONE_VL-None_TR-None_G-NONE_P-NONE_S-NONE_blog_stressweight_cv_en,CBV1 || LP:HI | 3970 blog_stressweight || Batch 1 || 08/04/25,SHARE,$576,"10,480",2025-04-08,2025-04-14,6
95,CB_2025_Mar_FB_3973_CHUB-KZ_V06_1x1_IMG_EN_New_C-NONE_CTA-NONE_Angle-W_M-NONE_VL-None_TR-None_G-NONE_P-NONE_S-NONE_blog_biohacking_cv_en,CBV1 || LP:HI | 3874 Advertorial Biohacking || Biohack for 40+ Women || Batch 2 || 08/04/25,SHARE,$570,"12,090",2025-04-08,2025-04-14,6
96,CB_2025_Mar_FB_3928_VK-DP_V05_1x1_VID_EN_Opti_C-BulletPoints_Evergreen_CTA-NONE_Angle-W-B-C_M-NONE_VL-None_G-M_P-OG_S-NONE_FB3891V05,3928 - opti 3891 kinda sorta opti with man boobs - DP-VK || Batch 1 || Enhancements: OFF || CBV1 || 7C || 24/03/25w13,SHARE,$554,"45,337",2025-03-24,2025-04-17,24
97,CB_2025_Mar_FB_3913_CHUB-AS_V12_1x1_IMG_EN_New_C-NONE_CTA-NONE_Angle-W_M-NONE_VL-None_TR-None_G-NONE_P-NONE_S-NONE_blog_moobs_cv_en,CBV2 || LP:HI | blog_moobs_cv_en || Batch 3 || 08/03/25,SHARE,$553,"21,479",2025-04-08,2025-04-26,18
98,CB_2025_Mar_FB_3913_CHUB-AS_V05_1x1_IMG_EN_New_C-NONE_CTA-NONE_Angle-W_M-NONE_VL-None_TR-None_G-NONE_P-NONE_S-NONE_blog_moobs_cv_en,CBV2 || LP:HI | blog_moobs_cv_en || Batch 2 || 08/03/25,SHARE,$542,"20,258",2025-04-08,2025-04-10,2
99,CB_2025_Mar_FB_3890_DT_V04_1x1_IMG_EN_New_C-NONE_Evergreen_CTA-None_Angle-W_M-NONE_VL-None_G-NONE_P-OG_S-NONE,US || ASC+ || Website + Shop || 7DC || Existing 0% || 24.03.2025 Ad set,SHARE,$532,"24,378",2025-03-24,2025-04-26,33
100,CB_2023_Jul_FB_2284_DA_V05_9x16_VID_EN_Opti_C-Sale_CTA-SMR_Pain-W_M-JANW_VL-30s_TR-None_G-M_P-None_S-WHAT_FB2103V02,CA || ASC+ || 0% EXISTING || 7DC || 18.03.2025,VIDEO,$529,"29,495",2025-03-18,2025-05-11,54
101,CB_2025_Mar_FB_3930_DT-KB_V13_1x1_IMG_EN_New_C-Advertorial_Sale_CTA-65_Angle-W-B-C_M-MIX_VL-None_G-M_P-OG_S-NONE,3930 - MD in Nutrition || Batch 4 || Enhancements: OFF || CBV2 || 7C || 30/03/25w14,SHARE,$496,"14,679",2025-03-30,2025-04-10,11
102,CB_2025_Mar_FB_3957_SO-DP_V03_4x5_IMG_EN_New_C-NONE_Evergreen_CTA-NONE_Angle-W-B-C_M-NONE_VL-None_G-NONE_P-OG_S-NONE,3957 - If you're googling IMG CB V1 || Batch 1 || Enhancements: OFF || CBV1 || 7C || 07/04/25w15,SHARE,$484,"17,396",2025-04-07,2025-04-11,4
103,CB_2025_Apr_FB_3987_SO-JG_V09_4x5_IMG_EN_New_C-NONE_Evergreen_CTA-NONE_Angle-W-B-C_M-NONE_VL-None_G-NONE_P-OG_S-NONE,3987 - Tax-Wars IMG JG || Batch 3 || Enhancements: OFF || CBV1 || 7C || 09/04/25w15,SHARE,$478,"22,451",2025-04-09,2025-04-19,10
104,CB_2025_Mar_FB_3936_SO-DP_V09_9x16_VID_EN_Opti_C-Dance_CTA-SMR_Pain-W-B_M-POW_VL-30s_TR-None_G-M_P-OG_S-WHAT_FB3043V03,3936 - New hook on winner ads opti || Batch 3 || Enhancements: OFF || CBV1 || 7C || 07/04/25w15,VIDEO,$473,"21,007",2025-04-07,2025-04-11,4
105,CB_2025_Apr_FB_3975_LZ_V03_9x16_VID_EN_New_C-Testimonial_Evergreen_CTA-SALE_Angle-W_M-LAURA_VL-15s_G-F_P-OG_S-NEW,CBV2 || AU || ðŸ’° Advantage+ || US || BROAD || 7C || Existing_customer_5% || 19/12/24 Ad set,VIDEO,$470,"22,752",2025-04-12,2025-04-22,10
106,CB_2023_Jul_FB_2217_IB_V04_9x16_VID_EN_Opti_C-Pointing_CTA-SMR_Pain-W-B_M-TRC_VL-30s_TR-None_G-F_P-None_S-FRIGGA,CBV2 || EU (UK) || ðŸ’° Advantage+ || US || BROAD || 7C || Existing_customer_5% || 15/12/24 Ad set,VIDEO,$454,"20,807",2024-12-18,2025-06-30,194
107,CB_2023_May_FB_2263_MB_V04_9x16_VID_EN_New_C-Sale_CTA-SMR_Pain-W_M-JOG_VL-45s_TR-None_G-M-F_P-None_S-Moon,CA || ASC+ || 0% EXISTING || 7DC || 18.03.2025,VIDEO,$451,"21,648",2025-03-18,2025-05-11,54
108,CB_2025_Mar_FB_3970_CHUB-AS_V10_1x1_IMG_EN_New_C-NONE_CTA-NONE_Angle-W_M-NONE_VL-None_TR-None_G-NONE_P-NONE_S-NONE_blog_stressweight_cv_en,CBV1 || LP:HI | 3970 blog_stressweight || Batch 3 || 08/04/25,SHARE,$449,"11,197",2025-04-08,2025-04-14,6
109,CB_2025_Mar_FB_3955_SO_V16_4x5_IMG_EN_New_C-NONE_Evergreen_CTA-NONE_Angle-W-B-C_M-NONE_VL-None_G-NONE_P-OG_S-NONE,3955 - THE GHIBLI-VERSE Trend || Batch 5 || Enhancements: OFF || CBV1 || 7C || 01/04/25w14,SHARE,$449,"28,629",2025-04-01,2025-04-14,13
110,CB_2025_Mar_FB_3928_VK-DP_V02_1x1_VID_EN_Opti_C-BulletPoints_Evergreen_CTA-NONE_Angle-W-B-C_M-NONE_VL-None_G-M_P-OG_S-NONE_FB3891V05,3928 - opti 3891 kinda sorta opti with man boobs - DP-VK || Batch 1 || Enhancements: OFF || CBV1 || 7C || 24/03/25w13,SHARE,$446,"25,789",2025-03-24,2025-04-17,24
111,CB_2025_Mar_FB_3954_VK-DT_V01_9x16_VID_EN_Opti_C-NONE_Sale_CTA-65_Angle-W-B-C_M-TYL_VL-None_G-M_P-OG_S-NONE_FB3904V02,3954 - CB Opti / 3904 - DT -VK || Batch 1 || Enhancements: OFF || CBV1 || 7C || 07/04/25w15,VIDEO,$444,"19,483",2025-04-07,2025-04-11,4
112,CB_2025_Mar_FB_3956_VK_V07_4x5_IMG_EN_OPTI_C-BulletPoints_Evergreen_CTA-65_Angle-W-B-C_M-NONE_VL-None_G-M_P-OG_S-NONE_FB3956V05,3956 - LOW T OPTI 3891 -VK || Batch 2 || Enhancements: OFF || CBV1 || 7C || 07/04/25w15,SHARE,$432,"26,226",2025-04-07,2025-04-12,5
113,CB_2025_Apr_FB_3987_SO-JG_V05_4x5_IMG_EN_New_C-NONE_Evergreen_CTA-NONE_Angle-W-B-C_M-NONE_VL-None_G-NONE_P-OG_S-NONE,3987 - Tax-Wars IMG JG || Batch 2 || Enhancements: OFF || CBV1 || 7C || 09/04/25w15,SHARE,$419,"22,158",2025-04-09,2025-04-18,9
114,CB_2024_Sep_FB_3175_DA-KB_V03_1x1_IMG_EN_New_C-ADVRT_Evergreen_CTA-NONE_Angle-W_M-NONE_VL-None_G-NONE_P-CBV2_S-NONE_blog_colonbroomvsmammoth_cv_en,CBV2 || Advantage+ || Advertorial || Higher pricing || US || 0% EXISTING CAP || BROAD || 7C || 20/01/25  Campaign Ad set,SHARE,$415,"20,317",2025-01-20,2025-06-30,161
115,CB_2025_Mar_FB_3936_SO-DP_V04_9x16_VID_EN_Opti_C-MakingOf_Evergreen_CTA-SALE_Angle-W_M-CRAZY_VL-45s_G-M_P-OG_S-NEW_FB3883V06,3936 - New hook on winner ads opti || Batch 1 || Enhancements: OFF || CBV1 || 7C || 07/04/25w15,VIDEO,$414,"19,605",2025-04-07,2025-04-10,3
116,CB_2025_Mar_FB_3902_SO-JT_V01_1x1_IMG_EN_New_C-NONE_Evergreen_CTA-NONE_Angle-W-B-C_M-NONE_VL-None_G-NONE_P-OG_S-NONE,ðŸŒ¶ï¸ || US || ASC+ || ->CC141 || VIDEO Only || US+CA || 0% EXISTING CAP || 7C || 07/08.24  Ad set,SHARE,$413,"15,758",2025-03-25,2025-04-14,20
117,CB_2025_Jan_FB_3723_SO_V07_4x5_IMG_EN_New_C-NONE_Evergreen_CTA-SALE_Angle-W_M-NONE_VL-None_G-NONE_P-NONE_S-NONE,CA || ASC+ || 0% EXISTING || 7DC || 18.03.2025,SHARE,$413,"38,049",2025-03-18,2025-04-26,39
118,CB_2023_May_FB_2263_MB_V04_9x16_VID_EN_New_C-Sale_CTA-SMR_Pain-W_M-JOG_VL-45s_TR-None_G-M-F_P-None_S-Moon,CBV2 || AU || ðŸ’° Advantage+ || US || BROAD || 7C || Existing_customer_5% || 19/12/24 Ad set,VIDEO,$412,"12,511",2024-12-19,2025-05-23,155
119,CB_2025_Mar_FB_3973_CHUB-KZ_V09_1x1_IMG_EN_New_C-NONE_CTA-NONE_Angle-W_M-NONE_VL-None_TR-None_G-NONE_P-NONE_S-NONE_blog_biohacking_cv_en,CBV1 || LP:HI | 3874 Advertorial Biohacking || Biohack for 40+ Women || Batch 3 || 08/04/25,SHARE,$404,"8,116",2025-04-08,2025-04-14,6
120,CB_2025_Mar_FB_3903_VK_V01_9x16_VID_EN_New_C-BulletPoints_Evergreen_CTA-65_Angle-W-B-C_M-MIX_VL-30s_G-MF_P-OG_S-NEW,ðŸŒ¶ï¸ || US || ASC+ || ->CC141 || VIDEO Only || US+CA || 0% EXISTING CAP || 7C || 07/08.24  Ad set,VIDEO,$395,"17,354",2025-04-01,2025-04-30,29
121,CB_2024_Aug_FB_3097_VK-DP_V03_9x16_VID_EN_Opti_C-Benefits_CTA-SMR_Pain-W-B_M-MIX_VL-45s_TR-None_G-MF_P-OG_S-WHAT_FB2516V13,ðŸŒ¶ï¸ || US || ASC+ || ->CC141 || VIDEO Only || US+CA || 0% EXISTING CAP || 7C || 07/08.24  Ad set,VIDEO,$387,"16,318",2024-09-04,2025-05-16,254
122,CB_2024_Aug_FB_3090_DT-DP_V02_9x16_VID_EN_Opti_C-MakingOf_CTA-CTA_Pain-W-B-C_M-POW_VL-45s_TR-None_G-M_P-OG_S-Moon_FB3029V04,CBV2 || EU (UK) || ðŸ’° Advantage+ || US || BROAD || 7C || Existing_customer_5% || 15/12/24 Ad set,SHARE,$378,"17,121",2024-12-19,2025-06-30,193
123,CB_2025_Apr_FB_3969_LZ-DP_V02_4x5_IMG_EN_Opti_C-Headline_Evergreen_CTA-NONE_Angle-W_M-NONE_VL-None_G-NONE_P-OG_S-NONE_FB3924V06,3969 - writing on chest opti || Batch 1 || Enhancements: OFF || CBV1 || 7C || 07/04/25w15,SHARE,$378,"23,408",2025-04-07,2025-04-10,3
124,CB_2025_Mar_FB_3936_SO-DP_V08_9x16_VID_EN_Opti_C-Sale_CTA-SMR_Pain-W_M-JANW_VL-30s_TR-None_G-M_P-None_S-WHAT_FB2284V05,3936 - New hook on winner ads opti || Batch 2 || Enhancements: OFF || CBV1 || 7C || 07/04/25w15,VIDEO,$374,"19,042",2025-04-07,2025-04-10,3
125,CB_2025_Mar_FB_3973_CHUB-KZ_V04_1x1_IMG_EN_New_C-NONE_CTA-NONE_Angle-W_M-NONE_VL-None_TR-None_G-NONE_P-NONE_S-NONE_blog_biohacking_cv_en,CBV1 || LP:HI | 3874 Advertorial Biohacking || Biohack for 40+ Women || Batch 1 || 08/04/25,SHARE,$371,"15,403",2025-04-08,2025-04-14,6
126,CB_2023_May_FB_2103_MB_V02_9x16_VID_EN_Opti_C-Sale_CTA-SMR_Pain-W_M-JOG_VL-30s_TR-None_G-M-F_P-None_S-What,US || Manual Bid || BFCM || COST CAP 71 || 1C || 15/11/24,VIDEO,$367,"10,816",2024-11-15,2025-06-30,227
127,CB_2024_Jan_FB_2762_IK_V05_1x1_IMG_EN_New_C-WrittenTesti_CTA-CTA_Pain-W-B-C_M-NONE_VL-None_TR-None_G-NONE_P-V2_S-NONE,CBV2 || EU (UK) || ðŸ’° Advantage+ || US || BROAD || 7C || Existing_customer_5% || 15/12/24 Ad set,SHARE,$366,"12,550",2024-12-15,2025-06-30,197
128,CB_2024_Sep_FB_3175_DA-KB_V01_1x1_IMG_EN_New_C-ADVRT_Evergreen_CTA-NONE_Angle-W_M-NONE_VL-None_G-NONE_P-CBV2_S-NONE_blog_colonbroomvsmammoth_cv_en,CBV2 || Advantage+ || Advertorial || Higher pricing || US || 0% EXISTING CAP || BROAD || 7C || 20/01/25  Campaign Ad set,SHARE,$338,"13,894",2025-01-20,2025-06-30,161
129,CB_2025_Mar_FB_3914_DT-DP_V01_9x16_VID_EN_New_C-Trend_Sale_CTA-SPRNG_Angle-W-B-C_M-JOG_VL-30s_G-F_P-OG_S-NEW.mp4,US || Quiz: React || 7C || 04/04/25,VIDEO,$329,"18,008",2025-04-04,2025-05-06,32
130,CB_2025_Apr_FB_3966_SO_V07_4x5_IMG_EN_New_C-NONE_Evergreen_CTA-NONE_Angle-W-B-C_M-NONE_VL-None_G-NONE_P-OG_S-NONE,3966 - #129Finally-IMGs_SO || Batch 2 || Enhancements: OFF || CBV1 || 7C || 07/04/25w15,SHARE,$317,"12,699",2025-04-07,2025-04-10,3
131,CB_2024_Jan_FB_2784_RS_V02_9x16_VID_EN_Opti_C-Pointing_CTA-SALE_Pain-W_M-JOG_VL-30s_TR-None_G-F_P-OG_S-OLLIE_FB2181V01,CBV2 || EU (UK) || ðŸ’° Advantage+ || US || BROAD || 7C || Existing_customer_5% || 15/12/24 Ad set,VIDEO,$315,"10,939",2025-01-09,2025-06-30,172
132,CB_2025_Apr_FB_3995_DT-DP_V01_9x16_VID_EN_Opti_C-MakingOf_Evergreen_CTA-CTA_Angle-W-B_M-CRAZY_VL-45s_G-M_P-OG_S-NEW_FB3022V01,3995 - 3022 V01 opti || Batch 1 || Enhancements: OFF || CBV1 || 7C || 11/04/25w16,VIDEO,$306,"15,452",2025-04-11,2025-04-26,15
133,CB_2025_Mar_FB_3913_CHUB-AS_V12_1x1_IMG_EN_New_C-NONE_CTA-NONE_Angle-W_M-NONE_VL-None_TR-None_G-NONE_P-NONE_S-NONE_blog_moobs_cv_en,CBV1 || LP:HI | blog_moobs_cv_en || Batch 3 || 30/03/25,SHARE,$306,"13,108",2025-03-30,2025-04-08,9
134,CB_2025_Feb_FB_3860_LZ-DP_V03_9x16_VID_EN_Opti_C-Testimonial_Evergreen_CTA-SALE_Angle-W_M-MOOD_VL-20s_G-M_P-OG_S-WOOD_FB21176V11_1,CBV2 || AU || ðŸ’° Advantage+ || US || BROAD || 7C || Existing_customer_5% || 19/12/24 Ad set,VIDEO,$302,"13,527",2025-03-21,2025-04-12,22
135,CB_2025_Apr_FB_3996_DT-DP_V02_9x16_VID_EN_Opti_C-MakingOf_Evergreen_CTA-CTA_Angle-W-B_M-CRAZY_VL-45s_G-M_P-OG_S-NEW_FB3022V03,3996 - 3022 V03 opti || Batch 1 || Enhancements: OFF || CBV1 || 7C || 11/04/25w16,VIDEO,$302,"15,300",2025-04-11,2025-05-08,27
136,CB_2025_Apr_FB_3980_LZ-KB_V24_9x16_VID_EN_Opti_C-BulletPoints_Evergreen_CTA-SALE_Angle-W_M-MIX_VL-45s_G-MF_P-OG_S-WHAT_FB3097V03,3980 - winner video man boobs opti || Batch 6 || Enhancements: OFF || CBV1 || 7C || 11/04/25w16,VIDEO,$294,"13,909",2025-04-11,2025-04-16,5
137,CB_2025_Apr_FB_3987_SO-JG_V04_4x5_IMG_EN_New_C-NONE_Evergreen_CTA-NONE_Angle-W-B-C_M-NONE_VL-None_G-NONE_P-OG_S-NONE,3987 - Tax-Wars IMG JG || Batch 1 || Enhancements: OFF || CBV1 || 7C || 09/04/25w15,SHARE,$291,"19,485",2025-04-09,2025-04-12,3
138,CB_2025_Apr_FB_3983_CHUB_V02_9x16_VID_EN_Opti_C-UGC_CTA-NONE_Angle-W-B_M-NONE_VL-45s_TR-None_G-F_P-OG_S-NONE,3983 â€“ CHUB PLS DO NOT DO THIS Opti || Batch 1 || Enhancements: OFF || CBV1 || 7C || 09/04/25w15,VIDEO,$290,"10,496",2025-04-09,2025-04-12,3
139,CB_2025_Mar_FB_3907_CHUB-AA_V03__IMG_EN_Opti_C-Price_CTA-NONE_Angle-None_M-NONE_VL-None_TR-None_G-NONE_P-OG_S-NONE,3907 â€“ CHUB Clean Sale OPTI v2 || Enhancements: OFF || CBV1 || Batch 1 || 7C || 16/03/25w12,SHARE,$289,"8,824",2025-03-16,2025-04-09,24
140,CB_2025_Apr_FB_3980_LZ-KB_V13_9x16_VID_EN_Opti_C-BulletPoints_Evergreen_CTA-SALE_Angle-W_M-MIX_VL-30s_G-MF_P-OG_S-WHAT_FB1989V08,3980 - winner video man boobs opti || Batch 4 || Enhancements: OFF || CBV1 || 7C || 11/04/25w16,VIDEO,$286,"15,745",2025-04-11,2025-04-14,3
141,CB_2025_Apr_FB_3961_SO_V01_4x5_IMG_EN_New_C-NONE_Evergreen_CTA-NONE_Angle-W-B-C_M-NONE_VL-None_G-NONE_P-OG_S-NONE,3961 - Action Figure IMGs || Batch 1 || Enhancements: OFF || CBV1 || 7C || 07/04/25w15,SHARE,$284,"16,580",2025-04-07,2025-04-10,3
142,CB_2025_Mar_FB_3913_CHUB-AS_V07_1x1_IMG_EN_New_C-NONE_CTA-NONE_Angle-W_M-NONE_VL-None_TR-None_G-NONE_P-NONE_S-NONE_blog_moobs_cv_en,CBV1 || LP:HI | blog_moobs_cv_en || Batch 2 || 30/03/25,SHARE,$282,"9,237",2025-03-30,2025-04-16,17
143,CB_2023_Jul_FB_2284_DA_V05_9x16_VID_EN_Opti_C-Sale_CTA-SMR_Pain-W_M-JANW_VL-30s_TR-None_G-M_P-None_S-WHAT_FB2103V02,US || ASC+ || Website + Shop || 7DC || Existing 0% || 24.03.2025 Ad set,VIDEO,$280,"7,202",2025-03-24,2025-05-15,52
144,CB_2025_Mar_FB_3913_CHUB-AS_V01_1x1_IMG_EN_New_C-NONE_CTA-NONE_Angle-W_M-NONE_VL-None_TR-None_G-NONE_P-NONE_S-NONE_blog_moobs_cv_en,CBV2 || LP:HI | blog_moobs_cv_en || Batch 1 || 08/03/25,SHARE,$280,"10,529",2025-04-08,2025-04-16,8
145,CB_2025_Mar_FB_3931_VK-DP_V01_9x16_VID_EN_Opti_C-NONE_Evergreen_CTA-NONE_Angle-W_M-NONE_VL-30s_G-M_P-OG_S-WOOD_FB3860V03,3942 - 3860 V03 opti - DP - VK || Batch 1 || Enhancements: OFF || CBV1 || 7C || 30/03/25w14,VIDEO,$277,"9,401",2025-03-30,2025-04-09,10
146,CB_2025_Apr_FB_3980_LZ-KB_V17_9x16_VID_EN_Opti_C-MakingOf_Evergreen_CTA-SALE_Angle-W_M-AGR_VL-45s_G-M_P-OG_S-NEW_FB3005V05,3980 - winner video man boobs opti || Batch 5 || Enhancements: OFF || CBV1 || 7C || 11/04/25w16,VIDEO,$273,"11,190",2025-04-11,2025-04-14,3
147,CB_2025_Apr_FB_3963_SO-DP_V09_4x5_IMG_EN_Opti_C-NONE_Evergreen_CTA-NONE_Angle-W-B-C_M-NONE_VL-None_G-NONE_P-OG_S-NONE_FB3922V03,3963 - 3922 opti_3 batches IMG || Batch 2 || Enhancements: OFF || CBV1 || 7C || 07/04/25w15,SHARE,$270,"10,606",2025-04-07,2025-04-11,4
148,CB_2025_Apr_FB_3961_SO_V04_4x5_IMG_EN_New_C-NONE_Evergreen_CTA-NONE_Angle-W-B-C_M-NONE_VL-None_G-NONE_P-OG_S-NONE,3961 - Action Figure IMGs || Batch 2 || Enhancements: OFF || CBV1 || 7C || 07/04/25w15,SHARE,$269,"15,150",2025-04-07,2025-04-10,3
149,CB_2025_Apr_FB_3980_LZ-KB_V05_9x16_VID_EN_Opti_C-BulletPoints_Evergreen_CTA-SALE_Angle-W_M-MIX_VL-30s_G-MF_P-OG_S-NEW_FB2812V07,3980 - winner video man boobs opti || Batch 2 || Enhancements: OFF || CBV1 || 7C || 11/04/25w16,VIDEO,$262,"12,279",2025-04-11,2025-04-14,3
150,CB_2025_Mar_FB_3902_SO-JT_V03_1x1_IMG_EN_New_C-NONE_Evergreen_CTA-NONE_Angle-W-B-C_M-NONE_VL-None_G-NONE_P-OG_S-NONE,ðŸŒ¶ï¸ || US || ASC+ || ->CC141 || VIDEO Only || US+CA || 0% EXISTING CAP || 7C || 07/08.24  Ad set,SHARE,$261,"14,797",2025-03-25,2025-05-12,48
151,CB_2024_Oct_FB_3214_DT-KB_V04_1x1_IMG_EN_New_C-ADVRT_Evergreen_CTA-NONE_Angle-W_M-NONE_VL-None_G-NONE_P-OG_S-NONE,CA || Advantage+ || Advertorial || 7C ||  BROAD || Existing_customer_0% || 20/03/25 Ad set,SHARE,$260,"17,451",2025-03-20,2025-04-09,20
152,CB_2025_Apr_FB_3963_SO-DP_V05_4x5_IMG_EN_Opti_C-NONE_Evergreen_CTA-NONE_Angle-W-B-C_M-NONE_VL-None_G-NONE_P-OG_S-NONE_FB3922V03,3963 - 3922 opti_3 batches IMG || Batch 1 || Enhancements: OFF || CBV1 || 7C || 07/04/25w15,SHARE,$257,"9,907",2025-04-07,2025-04-11,4
153,CB_2025_Jan_FB_3723_SO_V07_4x5_IMG_EN_New_C-NONE_Evergreen_CTA-SALE_Angle-W_M-NONE_VL-None_G-NONE_P-NONE_S-NONE,US || Kilo Product's leads LAL || 7C || 04/03/25,SHARE,$245,"10,316",2025-03-04,2025-05-15,72
154,CB_2025_Mar_FB_3973_CHUB-KZ_V03_1x1_IMG_EN_New_C-NONE_CTA-NONE_Angle-W_M-NONE_VL-None_TR-None_G-NONE_P-NONE_S-NONE_blog_biohacking_cv_en,CBV1 || LP:HI | 3874 Advertorial Biohacking || Biohack for 40+ Women || Batch 1 || 08/04/25,SHARE,$242,"6,353",2025-04-08,2025-04-14,6
155,CB_2025_Apr_FB_3997_DT-DP_V01_9x16_VID_EN_Opti_C-MakingOf_Sale_CTA-SALE_Angle-W-B_M-POW_VL-45s_G-M_P-OG_S-NEW_FB3033V01,3997 - 3033 V01 opti || Batch 1 || Enhancements: OFF || CBV1 || 7C || 11/04/25w16,VIDEO,$235,"11,110",2025-04-11,2025-04-17,6
156,CB_2025_Mar_FB_3909_DT-DP_V03_9x16_VID_EN_New_C-Trend_Evergreen_CTA-SMRBOD_Angle-W-B-C_M-JANW_VL-30s_G-M_P-OG_S-NEW,CBV2 || EU (UK) || ðŸ’° Advantage+ || US || BROAD || 7C || Existing_customer_5% || 15/12/24 Ad set,VIDEO,$231,"13,164",2025-04-08,2025-04-11,3
157,CB_2023_Dec_FB_2696_RS_V03_9x16_VID_EN_Opti_C-Sale_CTA-NY65_Pain-W-B_M-JANW_VL-30s_TR-None_G-M_P-OG_S-WHAT_FB2284V05,CBV2 || AU || ðŸ’° Advantage+ || US || BROAD || 7C || Existing_customer_5% || 19/12/24 Ad set,VIDEO,$229,"8,236",2025-01-13,2025-05-23,130
158,CB_2024_Apr_FB_2970_RS_V02_1x1_GIF_EN_Opti_C-WrittenTesti_CTA-CTA_Pain-W_M-NONE_VL-7s_TR-None_G-NONE_P-V2_S-NEW,CBV2 || EU (UK) || ðŸ’° Advantage+ || US || BROAD || 7C || Existing_customer_5% || 15/12/24 Ad set,VIDEO,$229,"5,946",2025-04-02,2025-05-19,47
159,CB_2025_Jan_FB_3723_SO_V07_4x5_IMG_EN_New_C-NONE_Evergreen_CTA-SALE_Angle-W_M-NONE_VL-None_G-NONE_P-NONE_S-NONE,CBV2 || US || Manual Bid: ROAS GOAL: 1.00 -> 1.1 || 7DC || 22/01/2025,SHARE,$228,"9,584",2025-02-11,2025-06-30,139
160,CB_2024_Jan_FB_2783_VK-RP_V02_1x1_IMG_EN_Opti_C-ADVRT_CTA-NONE_Pain-W_M-NONE_VL-None_TR-None_G-NONE_P-V2_S-NONE,CBV2 || AU || Advantage+ || Advertorial |  || 0% EXISTING CAP || BROAD || 7C || ad set 18/03/25,SHARE,$228,"11,832",2025-03-20,2025-04-17,28
161,CB_2024_Nov_FB_3264_LZ_V31_4x5_VID_EN_Opti_C-MakingOf_Sale_CTA-BF_Angle-W-B_M-CRAZY_VL-45s_G-M_P-OG_S-NEW_FB3004V02,CBV2 || EU (UK) || ðŸ’° Advantage+ || US || BROAD || 7C || Existing_customer_5% || 15/12/24 Ad set,VIDEO,$227,"10,232",2024-12-19,2025-06-30,193
162,CB_2025_Mar_FB_3973_CHUB-KZ_V11_1x1_IMG_EN_New_C-NONE_CTA-NONE_Angle-W_M-NONE_VL-None_TR-None_G-NONE_P-NONE_S-NONE_blog_biohacking_cv_en,CBV1 || LP:HI | 3874 Advertorial Biohacking || Biohack for 40+ Women || Batch 3 || 08/04/25,SHARE,$223,"8,056",2025-04-08,2025-04-14,6
163,CB_2025_Apr_FB_3966_SO_V03_4x5_IMG_EN_New_C-NONE_Evergreen_CTA-NONE_Angle-W-B-C_M-NONE_VL-None_G-NONE_P-OG_S-NONE,3966 - #129Finally-IMGs_SO || Batch 1 || Enhancements: OFF || CBV1 || 7C || 07/04/25w15,SHARE,$210,"11,034",2025-04-07,2025-04-10,3
164,CB_2024_Mar_FB_2888_JG_V02_9x16_IMG_EN_Opti_C-Benefits_CTA-NONE_Pain-W_M-NONE_VL-None_TR-None_G-NONE_P-V2_S-NONE,CBV2 || AU || ðŸ’° Advantage+ || US || BROAD || 7C || Existing_customer_5% || 19/12/24 Ad set,SHARE,$207,"8,753",2024-12-19,2025-05-23,155
165,CB_2024_Feb_FB_2834_DA_V04_4x5_IMG_EN_Opti_C-SingleTesti_CTA-NONE_Pain-W_M-NONE_VL-None_TR-None_G-NONE_P-V2_S-NONE_FB2759V04,CBV2 || AU || ðŸ’° Advantage+ || US || BROAD || 7C || Existing_customer_5% || 19/12/24 Ad set,SHARE,$207,"8,379",2024-12-19,2025-05-23,155
166,CB_2025_Apr_FB_3980_LZ-KB_V03_9x16_VID_EN_Opti_C-BulletPoints_Evergreen_CTA-SALE_Angle-W_M-PASQ_VL-30s_G-M_P-OG_S-WHAT_FB2516V13,3980 - winner video man boobs opti || Batch 1 || Enhancements: OFF || CBV1 || 7C || 11/04/25w16,VIDEO,$206,"6,046",2025-04-11,2025-04-25,14
167,CB_2025_Apr_FB_3987_SO-JG_V16_4x5_IMG_EN_New_C-NONE_Evergreen_CTA-NONE_Angle-W-B-C_M-NONE_VL-None_G-NONE_P-OG_S-NONE,3987 - Tax-Wars IMG JG || Batch 4 || Enhancements: OFF || CBV1 || 7C || 09/04/25w15,SHARE,$201,"10,758",2025-04-09,2025-04-12,3
168,CB_2025_Apr_FB_3980_LZ-KB_V08_9x16_VID_EN_Opti_C-Pointing_Evergreen_CTA-SALE_Angle-W_M-POW_VL-30s_G-M_P-OG_S-MOON_FB2036V03,3980 - winner video man boobs opti || Batch 3 || Enhancements: OFF || CBV1 || 7C || 11/04/25w16,VIDEO,$198,"9,767",2025-04-11,2025-04-17,6
169,CB_2025_Mar_FB_3913_CHUB-AS_V04_1x1_IMG_EN_New_C-NONE_CTA-NONE_Angle-W_M-NONE_VL-None_TR-None_G-NONE_P-NONE_S-NONE_blog_moobs_cv_en,CBV2 || LP:HI | blog_moobs_cv_en || Batch 1 || 08/03/25,SHARE,$198,"7,699",2025-04-08,2025-04-16,8
170,CB_2025_Apr_FB_3975_LZ_V03_9x16_VID_EN_New_C-Testimonial_Evergreen_CTA-SALE_Angle-W_M-LAURA_VL-15s_G-F_P-OG_S-NEW,US || ASC+ || Website + Shop || 7DC || Existing 0% || 24.03.2025 Ad set,VIDEO,$198,"8,557",2025-04-12,2025-04-16,4
171,CB_2024_Sep_FB_3175_DA-KB_V04_1x1_IMG_EN_New_C-ADVRT_Evergreen_CTA-NONE_Angle-W_M-NONE_VL-None_G-NONE_P-CBV2_S-NONE_blog_colonbroomvsmammoth_cv_en,CBV2 || TOP EU || Advantage+ || Advertorial |  || 0% EXISTING CAP || BROAD || 7C || 21/03/25 Ad set,SHARE,$193,"9,104",2025-03-21,2025-04-07,17
172,CB_2025_Mar_FB_3950_SO_V11_4x5_IMG_EN_New_C-NONE_Evergreen_CTA-NONE_Angle-W-B-C_M-NONE_VL-None_G-NONE_P-OG_S-NONE,US winners || W14 || Batch 1 || 7C || 09/04/2025,SHARE,$192,"13,853",2025-04-09,2025-04-12,3
173,CB_2024_Feb_FB_2834_DA_V02_4x5_IMG_EN_Opti_C-SingleTesti_CTA-NONE_Pain-W_M-NONE_VL-None_TR-None_G-NONE_P-V2_S-NONE_FB2759V04,CBV2 || AU || ðŸ’° Advantage+ || US || BROAD || 7C || Existing_customer_5% || 19/12/24 Ad set,SHARE,$181,"7,131",2024-12-19,2025-05-23,155
174,CB_2025_Apr_FB_3966_SO_V10_4x5_IMG_EN_New_C-NONE_Evergreen_CTA-NONE_Angle-W-B-C_M-NONE_VL-None_G-NONE_P-OG_S-NONE,3966 - #129Finally-IMGs_SO || Batch 3 || Enhancements: OFF || CBV1 || 7C || 07/04/25w15,SHARE,$180,"8,991",2025-04-07,2025-04-10,3
175,CB_2025_Apr_FB_3963_SO-DP_V04_4x5_IMG_EN_Opti_C-NONE_Evergreen_CTA-NONE_Angle-W-B-C_M-NONE_VL-None_G-NONE_P-OG_S-NONE_FB3922V03,3963 - 3922 opti_3 batches IMG || Batch 1 || Enhancements: OFF || CBV1 || 7C || 07/04/25w15,SHARE,$176,"7,295",2025-04-07,2025-04-11,4
176,CB_2025_Feb_FB_3827_LZ_V03_1x1_IMG_EN_Opti_C-Headline_Evergreen_CTA-SALE_Angle-W_M-NONE_VL-None_G-M_P-CBV2_S-NONE_FB3705V02,CBV2 || EU (UK) || ðŸ’° Advantage+ || US || BROAD || 7C || Existing_customer_5% || 15/12/24 Ad set,SHARE,$173,"5,299",2025-03-31,2025-05-19,49
177,CB_2025_Apr_FB_3963_SO-DP_V06_4x5_IMG_EN_Opti_C-NONE_Evergreen_CTA-NONE_Angle-W-B-C_M-NONE_VL-None_G-NONE_P-OG_S-NONE_FB3922V03,3963 - 3922 opti_3 batches IMG || Batch 2 || Enhancements: OFF || CBV1 || 7C || 07/04/25w15,SHARE,$166,"7,192",2025-04-07,2025-04-11,4
178,CB_2025_Feb_FB_3883_LZ-RP_V05_9x16_VID_EN_Opti_C-BulletPoints_Evergreen_CTA-SALE_Angle-W_M-JANW_VL-30s_G-M_P-OG_S-WHAT_FB2284V05,CBV2 || EU (UK) || ðŸ’° Advantage+ || US || BROAD || 7C || Existing_customer_5% || 15/12/24 Ad set,SHARE,$155,"7,143",2025-04-01,2025-06-30,90
179,CB_2025_Mar_FB_3950_SO_V13_4x5_IMG_EN_New_C-NONE_Evergreen_CTA-NONE_Angle-W-B-C_M-NONE_VL-None_G-NONE_P-OG_S-NONE,3950 - Image Gen by ChatGPT || Batch 3 || Enhancements: OFF || CBV1 || 7C || 30/03/25w14,SHARE,$155,"9,269",2025-03-30,2025-04-25,26
180,CB_2024_Mar_FB_2888_JG_V01_9x16_IMG_EN_Opti_C-Benefits_CTA-NONE_Pain-W_M-NONE_VL-None_TR-None_G-NONE_P-V2_S-NONE,CBV2 || AU || ðŸ’° Advantage+ || US || BROAD || 7C || Existing_customer_5% || 19/12/24 Ad set,SHARE,$147,"4,794",2024-12-19,2025-05-23,155
181,CB_2025_Feb_FB_3827_LZ_V03_1x1_IMG_EN_Opti_C-Headline_Evergreen_CTA-SALE_Angle-W_M-NONE_VL-None_G-M_P-CBV2_S-NONE_FB3705V02,CBV2 || US || Manual Bid: ROAS GOAL: 1.00 -> 1.1 || 7DC || 22/01/2025,SHARE,$145,"3,713",2025-02-18,2025-06-30,132
182,CB_2025_Feb_FB_3860_LZ-DP_V03_9x16_VID_EN_Opti_C-Testimonial_Evergreen_CTA-SALE_Angle-W_M-MOOD_VL-20s_G-M_P-OG_S-WOOD_FB21176V11_1,US || ASC+ || Website + Shop || 7DC || Existing 0% || 24.03.2025 Ad set,VIDEO,$137,"5,459",2025-03-24,2025-05-07,44
183,CB_2024_Nov_FB_3305_SO-DP_V02_4x5_VID_EN_Opti_C-Sale_CTA-BF_Pain-W_M-Chris_VL-30s_TR-None_G-MF_P-Plan_S-NEW_FB2601V07,CBV2 || AU || ðŸ’° Advantage+ || US || BROAD || 7C || Existing_customer_5% || 19/12/24 Ad set,VIDEO,$135,"4,513",2024-12-19,2025-05-23,155
184,CB_2025_Mar_FB_3956_VK_V06_4x5_IMG_EN_OPTI_C-BulletPoints_Evergreen_CTA-65_Angle-W-B-C_M-NONE_VL-None_G-M_P-OG_S-NONE_FB3956V05,3956 - LOW T OPTI 3891 -VK || Batch 2 || Enhancements: OFF || CBV1 || 7C || 07/04/25w15,SHARE,$135,"8,825",2025-04-07,2025-04-08,1
185,CB_2025_Mar_FB_3939_DT_V06_4x5_IMG_EN_New_C-Advertorial_Sale_CTA-65_Angle-W-B-C_M-MIX_VL-None_G-M_P-OG_S-NONE,3939 - CB Advertorial ads New Ideas || Batch 2 || Enhancements: OFF || CBV1 || 7C || 30/03/25w14,SHARE,$134,"6,668",2025-03-30,2025-04-14,15
186,CB_2025_Jan_FB_3723_SO_V10_4x5_IMG_EN_New_C-NONE_Evergreen_CTA-SALE_Angle-W_M-NONE_VL-None_G-NONE_P-NONE_S-NONE,US winners || W14 || Batch 1 || 7C || 09/04/2025,SHARE,$132,"9,249",2025-04-09,2025-04-12,3
187,CB_2024_Nov_FB_3264_LZ_V31_4x5_VID_EN_Opti_C-MakingOf_Sale_CTA-BF_Angle-W-B_M-CRAZY_VL-45s_G-M_P-OG_S-NEW_FB3004V02,CBV2 || AU || ðŸ’° Advantage+ || US || BROAD || 7C || Existing_customer_5% || 19/12/24 Ad set,VIDEO,$132,"4,424",2024-12-19,2025-05-23,155
188,CB_2025_Mar_FB_3930_DT-KB_V14_1x1_IMG_EN_New_C-Advertorial_Sale_CTA-65_Angle-W-B-C_M-MIX_VL-None_G-M_P-OG_S-NONE,3930 - MD in Nutrition || Batch 4 || Enhancements: OFF || CBV2 || 7C || 30/03/25w14,SHARE,$132,"4,270",2025-03-30,2025-04-10,11
189,CB_2025_Mar_FB_3955_SO-KB_V07_4x5_IMG_EN_New_C-NONE_Evergreen_CTA-NONE_Angle-W-B-C_M-NONE_VL-None_G-NONE_P-OG_S-NONE,3955 - THE GHIBLI-VERSE Trend || Batch 2 || Enhancements: OFF || CBV1 || 7C || 02/04/25w14,SHARE,$130,"6,459",2025-04-02,2025-04-14,12
190,CB_2025_Mar_FB_3910_LZ-DP_V02_1x1_IMG_EN_Opti_C-NegativeMark_Evergreen_CTA-NONE_Angle-W_M-NONE_VL-None_G-NONE_P-TRIAL_S-NONE_FB2227V08.png,US || Free trial offer || Trial ads || Trial purchase || 7C || 19/03/25,SHARE,$127,"4,874",2025-03-19,2025-04-29,41
191,CB_2025_Mar_FB_3955_SO-KB_V05_4x5_IMG_EN_New_C-NONE_Evergreen_CTA-NONE_Angle-W-B-C_M-NONE_VL-None_G-NONE_P-OG_S-NONE,3955 - THE GHIBLI-VERSE Trend || Batch 2 || Enhancements: OFF || CBV1 || 7C || 02/04/25w14,SHARE,$127,"5,393",2025-04-02,2025-04-14,12
192,CB_2024_Sep_FB_3175_DA-KB_V02_1x1_IMG_EN_New_C-ADVRT_Evergreen_CTA-NONE_Angle-W_M-NONE_VL-None_G-NONE_P-CBV2_S-NONE_blog_colonbroomvsmammoth_cv_en,CBV2 || Advantage+ || Advertorial || Higher pricing || US || 0% EXISTING CAP || BROAD || 7C || 20/01/25  Campaign Ad set,SHARE,$120,"7,230",2025-01-20,2025-06-30,161
193,CB_2025_Mar_FB_3914_DT-DP_V01_9x16_VID_EN_New_C-Trend_Sale_CTA-SPRNG_Angle-W-B-C_M-JOG_VL-30s_G-F_P-OG_S-NEW - Copy,CBV2 || US || Manual Bid: ROAS GOAL: 1.1 || Random ads || 7DC || 08/04/2025,VIDEO,$119,"3,655",2025-04-08,2025-04-11,3
194,CB_2025_Apr_FB_3966_SO_V11_4x5_IMG_EN_New_C-NONE_Evergreen_CTA-NONE_Angle-W-B-C_M-NONE_VL-None_G-NONE_P-OG_S-NONE,3966 - #129Finally-IMGs_SO || Batch 3 || Enhancements: OFF || CBV1 || 7C || 07/04/25w15,SHARE,$119,"6,583",2025-04-07,2025-04-10,3
195,CB_2024_Jan_FB_2797_VK-RP-RS_V02_1x1_IMG_EN_Opti_C-ADVRT_CTA-NONE_Pain-W_M-NONE_VL-None_TR-None_G-NONE_P-V2_S-NONE,CBV2 || UK || Advantage+ || Advertorial |  || 0% EXISTING CAP || BROAD || 7C || ad set 18/03/25,SHARE,$115,"3,313",2025-03-18,2025-04-22,35
196,CB_2025_Mar_FB_3914_DT-DP_V01_9x16_VID_EN_New_C-Trend_Sale_CTA-SPRNG_Angle-W-B-C_M-JOG_VL-30s_G-F_P-OG_S-NEW.mp4,US || Quiz: Shopify || 7C || 04/04/25,VIDEO,$110,"4,763",2025-04-04,2025-05-11,37
197,CB_2025_Mar_FB_3956_VK_V05_4x5_IMG_EN_OPTI_C-BulletPoints_Evergreen_CTA-65_Angle-W-B-C_M-NONE_VL-None_G-M_P-OG_S-NONE_FB3956V05,3956 - LOW T OPTI 3891 -VK || Batch 2 || Enhancements: OFF || CBV1 || 7C || 07/04/25w15,SHARE,$107,"5,192",2025-04-07,2025-04-12,5
198,CB_2025_Mar_FB_3970_CHUB-AS_V12_1x1_IMG_EN_New_C-NONE_CTA-NONE_Angle-W_M-NONE_VL-None_TR-None_G-NONE_P-NONE_S-NONE_blog_stressweight_cv_en,CBV1 || LP:HI | 3970 blog_stressweight || Batch 3 || 08/04/25,SHARE,$104,"2,157",2025-04-08,2025-04-14,6
199,CB_2025_Mar_FB_3924_SO-DP_V04_1x1_IMG_EN_New_C-NONE_Evergreen_CTA-NONE_Angle-W-B-C_M-NONE_VL-None_G-NONE_P-OG_S-NONE,3924 - #17 man boobs/dad bod body text IMG || Batch 1 || Enhancements: OFF || CBV1 || 7C || 24/03/25w13,SHARE,$103,"4,035",2025-03-24,2025-05-06,43
200,CB_2025_Mar_FB_3909_DT-DP_V03_9x16_VID_EN_New_C-Trend_Evergreen_CTA-SMRBOD_Angle-W-B-C_M-JANW_VL-30s_G-M_P-OG_S-NEW,US || Kilo Product's leads LAL || 7C || 04/03/25,VIDEO,$103,"4,595",2025-04-06,2025-05-15,39
201,CB_2025_Apr_FB_3980_LZ-KB_V07_9x16_VID_EN_Opti_C-Pointing_Evergreen_CTA-SALE_Angle-W_M-POW_VL-30s_G-M_P-OG_S-MOON_FB2036V03,3980 - winner video man boobs opti || Batch 3 || Enhancements: OFF || CBV1 || 7C || 11/04/25w16,VIDEO,$101,"4,977",2025-04-11,2025-04-25,14
202,CB_2025_Mar_FB_3911_DT_V03_9x16_VID_EN_Opti_C-SingleTesti_Sale_CTA-Patrick_Angle-W_M-TRC_VL-45s_G-F_P-OG_S-MOON_FB2764V04,CBV2 || EU (UK) || ðŸ’° Advantage+ || US || BROAD || 7C || Existing_customer_5% || 15/12/24 Ad set,VIDEO,$96,"4,250",2025-03-17,2025-06-30,105
203,CB_2025_Apr_FB_3966_SO_V01_4x5_IMG_EN_New_C-NONE_Evergreen_CTA-NONE_Angle-W-B-C_M-NONE_VL-None_G-NONE_P-OG_S-NONE,3966 - #129Finally-IMGs_SO || Batch 1 || Enhancements: OFF || CBV1 || 7C || 07/04/25w15,SHARE,$94,"5,524",2025-04-07,2025-04-10,3
204,CB_2025_Apr_FB_3961_SO_V05_4x5_IMG_EN_New_C-NONE_Evergreen_CTA-NONE_Angle-W-B-C_M-NONE_VL-None_G-NONE_P-OG_S-NONE,3961 - Action Figure IMGs || Batch 2 || Enhancements: OFF || CBV1 || 7C || 07/04/25w15,SHARE,$91,"4,834",2025-04-07,2025-04-10,3
205,CB_2025_Mar_FB_3970_CHUB-AS_V09_1x1_IMG_EN_New_C-NONE_CTA-NONE_Angle-W_M-NONE_VL-None_TR-None_G-NONE_P-NONE_S-NONE_blog_stressweight_cv_en,CBV1 || LP:HI | 3970 blog_stressweight || Batch 3 || 08/04/25,SHARE,$91,"2,332",2025-04-08,2025-04-14,6
206,CB_2025_Apr_FB_3972_CHUB-KZ_V01_9x16_VID_EN_New_C-NONE_CTA-NONE_Angle-W-B-C_M-F_VL-None_TR-None_G-NONE_P-NONE_S-NONE,3972 - CHUB SingingToiletUGC || Batch 1 || Enhancements: OFF || CBV1 || 7C || 09/04/25w15,VIDEO,$90,"4,731",2025-04-09,2025-04-11,2
207,CB_2025_Jan_FB_3741_LZ-JG_V01_4x5_IMG_EN_Opti_C-Headline_Evergreen_CTA-NONE_Angle-W_M-NONE_VL-None_G-NONE_P-CBV2_S-NONE_FB3357V01,CBV2 || US || Manual Bid: ROAS GOAL: 1.1 || Random ads || 7DC || 08/04/2025,SHARE,$86,"2,448",2025-04-08,2025-04-11,3
208,CB_2025_Mar_FB_3913_CHUB-AS_V06_1x1_IMG_EN_New_C-NONE_CTA-NONE_Angle-W_M-NONE_VL-None_TR-None_G-NONE_P-NONE_S-NONE_blog_moobs_cv_en,CBV1 || LP:HI | blog_moobs_cv_en || Batch 2 || 30/03/25,SHARE,$86,"2,602",2025-03-30,2025-04-16,17
209,CB_2025_Apr_FB_3987_SO-JG_V07_4x5_IMG_EN_New_C-NONE_Evergreen_CTA-NONE_Angle-W-B-C_M-NONE_VL-None_G-NONE_P-OG_S-NONE,3987 - Tax-Wars IMG JG || Batch 2 || Enhancements: OFF || CBV1 || 7C || 09/04/25w15,SHARE,$82,"3,842",2025-04-09,2025-04-18,9
210,CB_2025_Apr_FB_3987_SO-JG_V15_4x5_IMG_EN_New_C-NONE_Evergreen_CTA-NONE_Angle-W-B-C_M-NONE_VL-None_G-NONE_P-OG_S-NONE,3987 - Tax-Wars IMG JG || Batch 4 || Enhancements: OFF || CBV1 || 7C || 09/04/25w15,SHARE,$82,"4,905",2025-04-09,2025-04-12,3
211,CB_2025_Apr_FB_3961_SO_V03_4x5_IMG_EN_New_C-NONE_Evergreen_CTA-NONE_Angle-W-B-C_M-NONE_VL-None_G-NONE_P-OG_S-NONE,3961 - Action Figure IMGs || Batch 1 || Enhancements: OFF || CBV1 || 7C || 07/04/25w15,SHARE,$76,"3,961",2025-04-07,2025-04-10,3
212,CB_2025_Apr_FB_3983_CHUB_V01_9x16_VID_EN_Opti_C-UGC_CTA-NONE_Angle-W-B_M-NONE_VL-45s_TR-None_G-F_P-OG_S-NONE,3983 â€“ CHUB PLS DO NOT DO THIS Opti || Batch 1 || Enhancements: OFF || CBV1 || 7C || 09/04/25w15,VIDEO,$72,"3,046",2025-04-09,2025-04-12,3
213,CB_2025_Jan_FB_3741_LZ-JG_V01_4x5_IMG_EN_Opti_C-Headline_Evergreen_CTA-NONE_Angle-W_M-NONE_VL-None_G-NONE_P-CBV2_S-NONE_FB3357V01,CBV2 || US || Manual Bid: ROAS GOAL: 1.00 -> 1.1 || 7DC || 22/01/2025,SHARE,$72,"2,576",2025-01-22,2025-06-30,159
214,CB_2024_Dec_FB_3619_VK-JT_V02_4x5_VID_EN_New_C-BulletPoints_Sale_CTA-NY_Angle-W-B-C_M-NONE_VL-None_G-NONE_P-OG_S-NONE,ðŸŒ¶ï¸ || US || ASC+ || ->CC141 || VIDEO Only || US+CA || 0% EXISTING CAP || 7C || 07/08.24  Ad set,SHARE,$71,"3,678",2024-12-27,2025-05-16,140
215,CB_2025_Apr_FB_3966_SO_V04_4x5_IMG_EN_New_C-NONE_Evergreen_CTA-NONE_Angle-W-B-C_M-NONE_VL-None_G-NONE_P-OG_S-NONE,3966 - #129Finally-IMGs_SO || Batch 1 || Enhancements: OFF || CBV1 || 7C || 07/04/25w15,SHARE,$71,"3,372",2025-04-07,2025-04-10,3
216,CB_2024_Oct_FB_3214_DT-KB_V07_1x1_IMG_EN_New_C-ADVRT_Evergreen_CTA-NONE_Angle-W_M-NONE_VL-None_G-NONE_P-OG_S-NONE,CA || Advantage+ || Advertorial || 7C ||  BROAD || Existing_customer_0% || 20/03/25 Ad set,SHARE,$67,"4,147",2025-03-20,2025-04-09,20
217,CB_2025_Apr_FB_3997_DT-DP_V02_9x16_VID_EN_Opti_C-MakingOf_Sale_CTA-SALE_Angle-W-B_M-POW_VL-45s_G-M_P-OG_S-NEW_FB3033V01,3997 - 3033 V01 opti || Batch 1 || Enhancements: OFF || CBV1 || 7C || 11/04/25w16,VIDEO,$66,"3,539",2025-04-11,2025-04-16,5
218,CB_2025_Mar_FB_3930_DT-KB_V15_1x1_IMG_EN_New_C-Advertorial_Sale_CTA-65_Angle-W-B-C_M-MIX_VL-None_G-M_P-OG_S-NONE,3930 - MD in Nutrition || Batch 4 || Enhancements: OFF || CBV2 || 7C || 30/03/25w14,SHARE,$65,"1,966",2025-03-30,2025-04-10,11
219,CB_2025_Mar_FB_3956_VK_V03_4x5_IMG_EN_OPTI_C-BulletPoints_Evergreen_CTA-65_Angle-W-B-C_M-NONE_VL-None_G-M_P-OG_S-NONE_FB3956V05,3956 - LOW T OPTI 3891 -VK || Batch 1 || Enhancements: OFF || CBV1 || 7C || 07/04/25w15,SHARE,$65,"3,731",2025-04-07,2025-04-14,7
220,CB_2025_Apr_FB_3972_CHUB-KZ_V03_9x16_VID_EN_New_C-NONE_CTA-NONE_Angle-W-B-C_M-F_VL-None_TR-None_G-NONE_P-NONE_S-NONE,3972 - CHUB SingingToiletUGC || Batch 1 || Enhancements: OFF || CBV1 || 7C || 09/04/25w15,VIDEO,$65,"3,567",2025-04-09,2025-04-11,2
221,CB_2024_Feb_FB_2814_MB-DP_V05_1x1_IMG_EN_New_C-WeightLoss_CTA-None_Pain-W-B-C_M-NONE_VL-None_TR-None_G-NONE_P-V2_S-NONE,CBV2 || EU (UK) || ðŸ’° Advantage+ || US || BROAD || 7C || Existing_customer_5% || 15/12/24 Ad set,SHARE,$63,"2,672",2025-01-31,2025-06-30,150
222,CB_2025_Mar_FB_3970_CHUB-AS_V03_1x1_IMG_EN_New_C-NONE_CTA-NONE_Angle-W_M-NONE_VL-None_TR-None_G-NONE_P-NONE_S-NONE_blog_stressweight_cv_en,CBV1 || LP:HI | 3970 blog_stressweight || Batch 1 || 08/04/25,SHARE,$62,"1,176",2025-04-08,2025-04-14,6
223,CB_2025_Mar_FB_3954_VK-DT_V03_9x16_VID_EN_Opti_C-NONE_Sale_CTA-65_Angle-W-B-C_M-TYL_VL-None_G-M_P-OG_S-NONE_FB3904V02,3954 - CB Opti / 3904 - DT -VK || Batch 1 || Enhancements: OFF || CBV1 || 7C || 07/04/25w15,VIDEO,$62,"3,296",2025-04-07,2025-04-11,4
224,CB_2025_Mar_FB_3955_SO-KB_V13_4x5_IMG_EN_New_C-NONE_Evergreen_CTA-NONE_Angle-W-B-C_M-NONE_VL-None_G-NONE_P-OG_S-NONE,3955 - THE GHIBLI-VERSE Trend || Batch 4 || Enhancements: OFF || CBV1 || 7C || 02/04/25w14,SHARE,$62,"2,967",2025-04-02,2025-04-12,10
225,CB_2025_Apr_FB_3966_SO_V09_4x5_IMG_EN_New_C-NONE_Evergreen_CTA-NONE_Angle-W-B-C_M-NONE_VL-None_G-NONE_P-OG_S-NONE,3966 - #129Finally-IMGs_SO || Batch 3 || Enhancements: OFF || CBV1 || 7C || 07/04/25w15,SHARE,$60,"3,241",2025-04-07,2025-04-10,3
226,CB_2024_Oct_FB_3182_ZS-GC_V13_1x1_IMG_EN_New_C-UsVsThem_Evergreen_CTA-NONE_Angle-B-C_M-NONE_VL-None_G-NONE_P-OG_S-NONE,CBV2 || AU || ðŸ’° Advantage+ || US || BROAD || 7C || Existing_customer_5% || 19/12/24 Ad set,SHARE,$59,"2,938",2024-12-19,2025-05-23,155
227,CB_2025_Mar_FB_3935_VK-DP_V03_9x16_VID_EN_New_C-Trend_Sale_CTA-65_Angle-W_M-POW_VL-30s_G-M_P-APP_S-NEW_FB3921V02,ASC+ || CB App || Mixed countries || 7DC || 0% existing || 12/04/2025 Ad set,VIDEO,$58,"2,578",2025-04-12,2025-04-12,0
228,CB_2025_Apr_FB_3987_SO-JG_V12_4x5_IMG_EN_New_C-NONE_Evergreen_CTA-NONE_Angle-W-B-C_M-NONE_VL-None_G-NONE_P-OG_S-NONE,3987 - Tax-Wars IMG JG || Batch 3 || Enhancements: OFF || CBV1 || 7C || 09/04/25w15,SHARE,$57,"2,662",2025-04-09,2025-04-19,10
229,CB_2025_Mar_FB_3944_LZ-VG_V01_4x5_IMG_EN_Opti_C-Educational_Evergreen_CTA-NONE_Angle-GH_M-NONE_VL-None_G-NONE_P-OG_S-NONE_FB3619V02,3944 - 3619 opti claims/testimonial || Batch 1 || Enhancements: OFF || CBV1 || 7C || 30/03/25w14,SHARE,$57,"1,982",2025-03-30,2025-04-10,11
230,CB_2025_Mar_FB_3913_CHUB-AS_V08_1x1_IMG_EN_New_C-NONE_CTA-NONE_Angle-W_M-NONE_VL-None_TR-None_G-NONE_P-NONE_S-NONE_blog_moobs_cv_en,CBV2 || LP:HI | blog_moobs_cv_en || Batch 2 || 08/03/25,SHARE,$57,"2,032",2025-04-08,2025-04-10,2
231,CB_2025_Apr_FB_3980_LZ-KB_V01_9x16_VID_EN_Opti_C-BulletPoints_Evergreen_CTA-SALE_Angle-W_M-PASQ_VL-30s_G-M_P-OG_S-WHAT_FB2516V13,3980 - winner video man boobs opti || Batch 1 || Enhancements: OFF || CBV1 || 7C || 11/04/25w16,VIDEO,$55,"2,259",2025-04-11,2025-04-20,9
232,CB_2025_Mar_FB_3913_CHUB-AS_V10_1x1_IMG_EN_New_C-NONE_CTA-NONE_Angle-W_M-NONE_VL-None_TR-None_G-NONE_P-NONE_S-NONE_blog_moobs_cv_en,CBV1 || LP:HI | blog_moobs_cv_en || Batch 3 || 30/03/25,SHARE,$53,"2,862",2025-03-30,2025-04-08,9
233,CB_2025_Apr_FB_3980_LZ-KB_V02_9x16_VID_EN_Opti_C-BulletPoints_Evergreen_CTA-SALE_Angle-W_M-PASQ_VL-30s_G-M_P-OG_S-WHAT_FB2516V13,3980 - winner video man boobs opti || Batch 1 || Enhancements: OFF || CBV1 || 7C || 11/04/25w16,VIDEO,$52,"1,714",2025-04-11,2025-04-25,14
234,CB_2025_Mar_FB_3913_CHUB-AS_V09_1x1_IMG_EN_New_C-NONE_CTA-NONE_Angle-W_M-NONE_VL-None_TR-None_G-NONE_P-NONE_S-NONE_blog_moobs_cv_en,CBV2 || LP:HI | blog_moobs_cv_en || Batch 3 || 08/03/25,SHARE,$51,"2,086",2025-04-08,2025-04-26,18
235,CB_2025_Feb_FB_3827_LZ_V02_1x1_IMG_EN_Opti_C-Headline_Evergreen_CTA-NONE_Angle-W_M-NONE_VL-None_G-M_P-CBV2_S-NONE_FB3723V18,CBV2 || US || Manual Bid: ROAS GOAL: 1.00 -> 1.1 || 7DC || 22/01/2025,SHARE,$50,"2,366",2025-02-18,2025-06-30,132
236,CB_2025_Apr_FB_3963_SO-DP_V02_4x5_IMG_EN_Opti_C-NONE_Evergreen_CTA-NONE_Angle-W-B-C_M-NONE_VL-None_G-NONE_P-OG_S-NONE_FB3922V03,3963 - 3922 opti_3 batches IMG || Batch 1 || Enhancements: OFF || CBV1 || 7C || 07/04/25w15,SHARE,$49,"1,715",2025-04-07,2025-04-11,4
237,CB_2025_Mar_FB_3944_LZ-VG_V02_4x5_IMG_EN_Opti_C-Testimonial_Evergreen_CTA-NONE_Angle-GH_M-NONE_VL-None_G-NONE_P-OG_S-NONE_FB3619V02,US winners || W14 || Batch 1 || 7C || 09/04/2025,SHARE,$49,"2,806",2025-04-09,2025-04-12,3
238,CB_2025_Mar_FB_3973_CHUB-KZ_V10_1x1_IMG_EN_New_C-NONE_CTA-NONE_Angle-W_M-NONE_VL-None_TR-None_G-NONE_P-NONE_S-NONE_blog_biohacking_cv_en,CBV1 || LP:HI | 3874 Advertorial Biohacking || Biohack for 40+ Women || Batch 3 || 08/04/25,SHARE,$49,"2,621",2025-04-08,2025-04-14,6
239,CB_2025_Mar_FB_3973_CHUB-KZ_V05_1x1_IMG_EN_New_C-NONE_CTA-NONE_Angle-W_M-NONE_VL-None_TR-None_G-NONE_P-NONE_S-NONE_blog_biohacking_cv_en,CBV1 || LP:HI | 3874 Advertorial Biohacking || Biohack for 40+ Women || Batch 2 || 08/04/25,SHARE,$47,994,2025-04-08,2025-04-14,6
240,CB_2025_Mar_FB_3949_VK-DP_V01_9x16_VID_EN_New_C-NONE_Evergreen_CTA-NONE_Angle-W-B-C_M-TYL_VL-None_G-M_P-OG_S-NONE,CA || ASC+ || 0% EXISTING || 7DC || 18.03.2025,VIDEO,$46,"2,528",2025-04-03,2025-05-11,38
241,CB_2025_Feb_FB_3827_LZ_V03_1x1_IMG_EN_Opti_C-Headline_Evergreen_CTA-SALE_Angle-W_M-NONE_VL-None_G-M_P-CBV2_S-NONE_FB3705V02,CBV2 || US || Manual Bid: ROAS GOAL: 1.1 || Random ads || 7DC || 08/04/2025,SHARE,$44,"1,114",2025-04-08,2025-04-11,3
242,CB_2024_Jan_FB_2783_VK-RP_V02_1x1_IMG_EN_Opti_C-ADVRT_CTA-NONE_Pain-W_M-NONE_VL-None_TR-None_G-NONE_P-V2_S-NONE,CBV2 || UK || Advantage+ || Advertorial |  || 0% EXISTING CAP || BROAD || 7C || ad set 18/03/25,SHARE,$43,"1,838",2025-03-18,2025-04-22,35
243,CB_2024_Oct_FB_3214_DT-KB_V06_1x1_IMG_EN_New_C-ADVRT_Evergreen_CTA-NONE_Angle-W_M-NONE_VL-None_G-NONE_P-OG_S-NONE,CA || Advantage+ || Advertorial || 7C ||  BROAD || Existing_customer_0% || 20/03/25 Ad set,SHARE,$43,"2,700",2025-03-20,2025-04-09,20
244,CB_2025_Apr_FB_3963_SO-DP_V08_4x5_IMG_EN_Opti_C-NONE_Evergreen_CTA-NONE_Angle-W-B-C_M-NONE_VL-None_G-NONE_P-OG_S-NONE_FB3922V03,3963 - 3922 opti_3 batches IMG || Batch 2 || Enhancements: OFF || CBV1 || 7C || 07/04/25w15,SHARE,$42,"1,654",2025-04-07,2025-04-11,4
245,CB_2025_Apr_FB_3995_DT-DP_V01_9x16_VID_EN_Opti_C-MakingOf_Evergreen_CTA-CTA_Angle-W-B_M-CRAZY_VL-45s_G-M_P-OG_S-NEW_FB3022V01,US || ASC+ || Website + Shop || 7DC || Existing 0% || 24.03.2025 Ad set,VIDEO,$42,"1,554",2025-04-13,2025-04-16,3
246,CB_2025_Apr_FB_3963_SO-DP_V07_4x5_IMG_EN_Opti_C-NONE_Evergreen_CTA-NONE_Angle-W-B-C_M-NONE_VL-None_G-NONE_P-OG_S-NONE_FB3922V03,3963 - 3922 opti_3 batches IMG || Batch 2 || Enhancements: OFF || CBV1 || 7C || 07/04/25w15,SHARE,$42,"2,073",2025-04-07,2025-04-11,4
247,CB_2025_Mar_FB_3913_CHUB-AS_V03_1x1_IMG_EN_New_C-NONE_CTA-NONE_Angle-W_M-NONE_VL-None_TR-None_G-NONE_P-NONE_S-NONE_blog_moobs_cv_en,CBV2 || LP:HI | blog_moobs_cv_en || Batch 1 || 08/03/25,SHARE,$42,"1,643",2025-04-08,2025-04-16,8
248,CB_2025_Apr_FB_3987_SO-JG_V13_4x5_IMG_EN_New_C-NONE_Evergreen_CTA-NONE_Angle-W-B-C_M-NONE_VL-None_G-NONE_P-OG_S-NONE,3987 - Tax-Wars IMG JG || Batch 4 || Enhancements: OFF || CBV1 || 7C || 09/04/25w15,SHARE,$41,"2,045",2025-04-09,2025-04-12,3
249,CB_2025_Apr_FB_3987_SO-JG_V02_4x5_IMG_EN_New_C-NONE_Evergreen_CTA-NONE_Angle-W-B-C_M-NONE_VL-None_G-NONE_P-OG_S-NONE,3987 - Tax-Wars IMG JG || Batch 1 || Enhancements: OFF || CBV1 || 7C || 09/04/25w15,SHARE,$40,"2,693",2025-04-09,2025-04-12,3
250,CB_2025_Mar_FB_3973_CHUB-KZ_V01_1x1_IMG_EN_New_C-NONE_CTA-NONE_Angle-W_M-NONE_VL-None_TR-None_G-NONE_P-NONE_S-NONE_blog_biohacking_cv_en,CBV1 || LP:HI | 3874 Advertorial Biohacking || Biohack for 40+ Women || Batch 1 || 08/04/25,SHARE,$40,"1,740",2025-04-08,2025-04-14,6
251,CB_2025_Apr_FB_3987_SO-JG_V08_4x5_IMG_EN_New_C-NONE_Evergreen_CTA-NONE_Angle-W-B-C_M-NONE_VL-None_G-NONE_P-OG_S-NONE,3987 - Tax-Wars IMG JG || Batch 2 || Enhancements: OFF || CBV1 || 7C || 09/04/25w15,SHARE,$39,"1,650",2025-04-09,2025-04-18,9
252,CB_2025_Mar_FB_3928_VK-DP_V01_1x1_VID_EN_Opti_C-BulletPoints_Evergreen_CTA-NONE_Angle-W-B-C_M-NONE_VL-None_G-M_P-OG_S-NONE_FB3891V05,3928 - opti 3891 kinda sorta opti with man boobs - DP-VK || Batch 1 || Enhancements: OFF || CBV1 || 7C || 24/03/25w13,SHARE,$38,"2,268",2025-03-24,2025-04-17,24
253,CB_2025_Mar_FB_3935_VK-DP_V02_9x16_VID_EN_New_C-Trend_Sale_CTA-65_Angle-W_M-POW_VL-30s_G-M_P-APP_S-NEW_FB3921V02,ASC+ || CB App || Mixed countries || 7DC || 0% existing || 12/04/2025 Ad set,VIDEO,$38,"1,584",2025-04-12,2025-04-12,0
254,CB_2025_Apr_FB_3980_LZ-KB_V04_9x16_VID_EN_Opti_C-BulletPoints_Evergreen_CTA-SALE_Angle-W_M-MIX_VL-30s_G-MF_P-OG_S-NEW_FB2812V07,3980 - winner video man boobs opti || Batch 2 || Enhancements: OFF || CBV1 || 7C || 11/04/25w16,VIDEO,$38,"1,591",2025-04-11,2025-04-14,3
255,CB_2025_Apr_FB_3961_SO_V02_4x5_IMG_EN_New_C-NONE_Evergreen_CTA-NONE_Angle-W-B-C_M-NONE_VL-None_G-NONE_P-OG_S-NONE,3961 - Action Figure IMGs || Batch 1 || Enhancements: OFF || CBV1 || 7C || 07/04/25w15,SHARE,$38,"2,052",2025-04-07,2025-04-10,3
256,CB_2025_Apr_FB_3972_CHUB-KZ_V02_9x16_VID_EN_New_C-NONE_CTA-NONE_Angle-W-B-C_M-F_VL-None_TR-None_G-NONE_P-NONE_S-NONE,3972 - CHUB SingingToiletUGC || Batch 1 || Enhancements: OFF || CBV1 || 7C || 09/04/25w15,VIDEO,$37,"1,200",2025-04-09,2025-04-11,2
257,CB_2025_Apr_FB_3966_SO_V12_4x5_IMG_EN_New_C-NONE_Evergreen_CTA-NONE_Angle-W-B-C_M-NONE_VL-None_G-NONE_P-OG_S-NONE,3966 - #129Finally-IMGs_SO || Batch 3 || Enhancements: OFF || CBV1 || 7C || 07/04/25w15,SHARE,$35,"1,785",2025-04-07,2025-04-10,3
258,CB_2025_Apr_FB_3966_SO_V05_4x5_IMG_EN_New_C-NONE_Evergreen_CTA-NONE_Angle-W-B-C_M-NONE_VL-None_G-NONE_P-OG_S-NONE,3966 - #129Finally-IMGs_SO || Batch 2 || Enhancements: OFF || CBV1 || 7C || 07/04/25w15,SHARE,$35,"1,474",2025-04-07,2025-04-10,3
259,CB_2025_Apr_FB_3963_SO-DP_V01_4x5_IMG_EN_Opti_C-NONE_Evergreen_CTA-NONE_Angle-W-B-C_M-NONE_VL-None_G-NONE_P-OG_S-NONE_FB3922V03,3963 - 3922 opti_3 batches IMG || Batch 1 || Enhancements: OFF || CBV1 || 7C || 07/04/25w15,SHARE,$35,"1,300",2025-04-07,2025-04-11,4
260,CB_2024_Dec_FB_3592_VK-DP_V10_4x5_VID_EN_New_C-BulletPoints_Sale_CTA-SALE_Angle-W-B-C_M-NONE_VL-30s_G-F_P-OG_S-NEW - Copy,ðŸŒ¶ï¸ || US || ASC+ || ->CC141 || VIDEO Only || US+CA || 0% EXISTING CAP || 7C || 07/08.24  Ad set,VIDEO,$35,"1,436",2024-12-21,2025-04-30,130
261,CB_2025_Jan_FB_3742_SO-DP-KB_V01_4x5_IMG_EN_Opti_C-NONE_Evergreen_CTA-SALE_Angle-W_M-NONE_VL-None_G-NONE_P-CBV2_S-NONE3665V01,CBV2 || EU (UK) || ðŸ’° Advantage+ || US || BROAD || 7C || Existing_customer_5% || 15/12/24 Ad set,SHARE,$35,"1,767",2025-02-04,2025-06-30,146
262,CB_2025_Mar_FB_3973_CHUB-KZ_V02_1x1_IMG_EN_New_C-NONE_CTA-NONE_Angle-W_M-NONE_VL-None_TR-None_G-NONE_P-NONE_S-NONE_blog_biohacking_cv_en,CBV1 || LP:HI | 3874 Advertorial Biohacking || Biohack for 40+ Women || Batch 1 || 08/04/25,SHARE,$34,"1,621",2025-04-08,2025-04-14,6
263,CB_2025_Mar_FB_3973_CHUB-KZ_V08_1x1_IMG_EN_New_C-NONE_CTA-NONE_Angle-W_M-NONE_VL-None_TR-None_G-NONE_P-NONE_S-NONE_blog_biohacking_cv_en,CBV1 || LP:HI | 3874 Advertorial Biohacking || Biohack for 40+ Women || Batch 2 || 08/04/25,SHARE,$33,"1,268",2025-04-08,2025-04-14,6
264,CB_2024_Oct_FB_3252_VK-DP_V04_4x5_VID_EN_Opti_C-MakingOf_Evergreen_CTA-SALE_Angle-W-B-C_M-JOG_VL-45s_G-F_P-OG_S-MOON_FB3090V02,ðŸŒ¶ï¸ || US || ASC+ || ->CC141 || VIDEO Only || US+CA || 0% EXISTING CAP || 7C || 07/08.24  Ad set,VIDEO,$33,"1,038",2024-11-07,2025-04-30,174
265,CB_2025_Mar_FB_3913_CHUB-AS_V08_1x1_IMG_EN_New_C-NONE_CTA-NONE_Angle-W_M-NONE_VL-None_TR-None_G-NONE_P-NONE_S-NONE_blog_moobs_cv_en,CBV1 || LP:HI | blog_moobs_cv_en || Batch 2 || 30/03/25,SHARE,$32,"1,171",2025-03-30,2025-04-16,17
266,CB_2025_Mar_FB_3936_SO-DP_V07_9x16_VID_EN_Opti_C-Trend_CTA-SMR_Pain-W_M-MIX_VL-30s_TR-None_G-MF_P-None FB1989V08,3936 - New hook on winner ads opti || Batch 2 || Enhancements: OFF || CBV1 || 7C || 07/04/25w15,VIDEO,$31,"1,749",2025-04-07,2025-04-10,3
267,CB_2024_Apr_FB_2970_RS_V02_1x1_GIF_EN_Opti_C-WrittenTesti_CTA-CTA_Pain-W_M-NONE_VL-7s_TR-None_G-NONE_P-V2_S-NEW - Copy,CBV2 || US || Manual Bid: ROAS GOAL: 1.1 || Random ads || 7DC || 08/04/2025,VIDEO,$30,766,2025-04-08,2025-04-11,3
268,CB_2025_Mar_FB_3970_CHUB-AS_V11_1x1_IMG_EN_New_C-NONE_CTA-NONE_Angle-W_M-NONE_VL-None_TR-None_G-NONE_P-NONE_S-NONE_blog_stressweight_cv_en,CBV1 || LP:HI | 3970 blog_stressweight || Batch 3 || 08/04/25,SHARE,$29,653,2025-04-08,2025-04-14,6
269,CB_2025_Apr_FB_3961_SO_V06_4x5_IMG_EN_New_C-NONE_Evergreen_CTA-NONE_Angle-W-B-C_M-NONE_VL-None_G-NONE_P-OG_S-NONE,3961 - Action Figure IMGs || Batch 2 || Enhancements: OFF || CBV1 || 7C || 07/04/25w15,SHARE,$29,"1,497",2025-04-07,2025-04-10,3
270,CB_2025_Mar_FB_3973_CHUB-KZ_V07_1x1_IMG_EN_New_C-NONE_CTA-NONE_Angle-W_M-NONE_VL-None_TR-None_G-NONE_P-NONE_S-NONE_blog_biohacking_cv_en,CBV1 || LP:HI | 3874 Advertorial Biohacking || Biohack for 40+ Women || Batch 2 || 08/04/25,SHARE,$29,717,2025-04-08,2025-04-14,6
271,CB_2024_Jan_FB_2797_VK-RP-RS_V02_1x1_IMG_EN_Opti_C-ADVRT_CTA-NONE_Pain-W_M-NONE_VL-None_TR-None,CA || Advantage+ || Advertorial || 7C ||  BROAD || Existing_customer_0% || 20/03/25 Ad set,SHARE,$29,"1,675",2025-03-24,2025-04-09,16
272,CB_2024_Sep_FB_3175_DA-KB_V03_1x1_IMG_EN_New_C-ADVRT_Evergreen_CTA-NONE_Angle-W_M-NONE_VL-None_G-NONE_P-CBV2_S-NONE_blog_colonbroomvsmammothhighprice3_cv_en,CBV2 || A/B test CTA button: Variaton || CBV2 vs Happy Mammoth || 7C || 26/03/25,SHARE,$27,"1,141",2025-03-26,2025-04-28,33
273,CB_2024_Sep_FB_3175_DA-KB_V02_1x1_IMG_EN_New_C-ADVRT_Evergreen_CTA-NONE_Angle-W_M-NONE_VL-None_G-NONE_P-CBV2_S-NONE_blog_colonbroomvsmammoth_cv_en,CBV2 || A/B test CTA button: Control || CBV2 vs Happy Mammoth || 7C || 26/03/25,SHARE,$27,"1,823",2025-03-26,2025-04-16,21
274,CB_2025_Mar_FB_3950_SO_V16_4x5_IMG_EN_New_C-NONE_Evergreen_CTA-NONE_Angle-W-B-C_M-NONE_VL-None_G-NONE_P-OG_S-NONE,US winners || W14 || Batch 1 || 7C || 09/04/2025,SHARE,$27,"1,904",2025-04-09,2025-04-12,3
275,CB_2024_Sep_FB_3175_DA-KB_V03_1x1_IMG_EN_New_C-ADVRT_Evergreen_CTA-NONE_Angle-W_M-NONE_VL-None_G-NONE_P-CBV2_S-NONE_blog_colonbroomvsmammoth_cv_en,CBV2 || A/B test CTA button: Control || CBV2 vs Happy Mammoth || 7C || 26/03/25,SHARE,$25,"1,101",2025-03-26,2025-04-16,21
276,CB_2024_Mar_FB_2888_JG_V03_9x16_IMG_EN_Opti_C-Benefits_CTA-NONE_Pain-W_M-NONE_VL-None_TR-None_G-NONE_P-V2_S-NONE,CBV2 || AU || ðŸ’° Advantage+ || US || BROAD || 7C || Existing_customer_5% || 19/12/24 Ad set,SHARE,$25,"1,064",2024-12-19,2025-05-23,155
277,CB_2025_Mar_FB_3956_VK_V04_4x5_IMG_EN_OPTI_C-BulletPoints_Evergreen_CTA-65_Angle-W-B-C_M-NONE_VL-None_G-M_P-OG_S-NONE_FB3956V05,3956 - LOW T OPTI 3891 -VK || Batch 1 || Enhancements: OFF || CBV1 || 7C || 07/04/25w15,SHARE,$24,"1,293",2025-04-07,2025-04-14,7
278,CB_2024_Oct_FB_3214_DT-KB_V03_1x1_IMG_EN_New_C-ADVRT_Evergreen_CTA-NONE_Angle-W_M-NONE_VL-None_G-NONE_P-OG_S-NONE,CA || Advantage+ || Advertorial || 7C ||  BROAD || Existing_customer_0% || 20/03/25 Ad set,SHARE,$24,"1,378",2025-03-20,2025-04-09,20
279,CB_2025_Mar_FB_3935_VK-DP_V04_9x16_VID_EN_New_C-Trend_Sale_CTA-65_Angle-W_M-POW_VL-30s_G-M_P-APP_S-NEW_FB3921V032,ASC+ || CB App || Mixed countries || 7DC || 0% existing || 12/04/2025 Ad set,VIDEO,$23,896,2025-04-12,2025-04-12,0
280,CB_2025_Mar_FB_3970_CHUB-AS_V02_1x1_IMG_EN_New_C-NONE_CTA-NONE_Angle-W_M-NONE_VL-None_TR-None_G-NONE_P-NONE_S-NONE_blog_stressweight_cv_en,CBV1 || LP:HI | 3970 blog_stressweight || Batch 1 || 08/04/25,SHARE,$23,"1,193",2025-04-08,2025-04-14,6
281,CB_2025_Mar_FB_3973_CHUB-KZ_V12_1x1_IMG_EN_New_C-NONE_CTA-NONE_Angle-W_M-NONE_VL-None_TR-None_G-NONE_P-NONE_S-NONE_blog_biohacking_cv_en,CBV1 || LP:HI | 3874 Advertorial Biohacking || Biohack for 40+ Women || Batch 3 || 08/04/25,SHARE,$23,"1,804",2025-04-08,2025-04-14,6
282,CB_2024_Oct_FB_3214_DT-KB_V05_1x1_IMG_EN_New_C-ADVRT_Evergreen_CTA-NONE_Angle-W_M-NONE_VL-None_G-NONE_P-OG_S-NONE,CA || Advantage+ || Advertorial || 7C ||  BROAD || Existing_customer_0% || 20/03/25 Ad set,SHARE,$23,"1,575",2025-03-20,2025-04-09,20
283,CB_2025_Mar_FB_3913_CHUB-AS_V02_1x1_IMG_EN_New_C-NONE_CTA-NONE_Angle-W_M-NONE_VL-None_TR-None_G-NONE_P-NONE_S-NONE_blog_moobs_cv_en,CBV2 || LP:HI | blog_moobs_cv_en || Batch 1 || 08/03/25,SHARE,$23,"1,284",2025-04-08,2025-04-16,8
284,CB_2025_Mar_FB_3930_DT-KB_V16_1x1_IMG_EN_New_C-Advertorial_Sale_CTA-65_Angle-W-B-C_M-MIX_VL-None_G-M_P-OG_S-NONE,3930 - MD in Nutrition || Batch 4 || Enhancements: OFF || CBV2 || 7C || 30/03/25w14,SHARE,$22,798,2025-03-30,2025-04-10,11
285,CB_2025_Apr_FB_3966_SO_V08_4x5_IMG_EN_New_C-NONE_Evergreen_CTA-NONE_Angle-W-B-C_M-NONE_VL-None_G-NONE_P-OG_S-NONE,3966 - #129Finally-IMGs_SO || Batch 2 || Enhancements: OFF || CBV1 || 7C || 07/04/25w15,SHARE,$22,"1,137",2025-04-07,2025-04-10,3
286,CB_2024_Jan_FB_2783_VK-RP_V01_1x1_IMG_EN_Opti_C-ADVRT_CTA-NONE_Pain-W_M-NONE_VL-None_TR-None_G-NONE_P-V2_S-NONE,CA || Advantage+ || Advertorial || 7C ||  BROAD || Existing_customer_0% || 20/03/25 Ad set,SHARE,$22,"2,241",2025-03-24,2025-04-09,16
287,CB_2025_Apr_FB_3972_CHUB-KZ_V05_9x16_VID_EN_New_C-NONE_CTA-NONE_Angle-W-B-C_M-F_VL-None_TR-None_G-NONE_P-NONE_S-NONE,3972 - CHUB SingingToiletUGC || Batch 1 || Enhancements: OFF || CBV1 || 7C || 09/04/25w15,VIDEO,$21,"1,170",2025-04-09,2025-04-11,2
288,CB_2025_Mar_FB_3955_SO-KB_V06_4x5_IMG_EN_New_C-NONE_Evergreen_CTA-NONE_Angle-W-B-C_M-NONE_VL-None_G-NONE_P-OG_S-NONE,3955 - THE GHIBLI-VERSE Trend || Batch 2 || Enhancements: OFF || CBV1 || 7C || 02/04/25w14,SHARE,$21,"1,059",2025-04-02,2025-04-14,12
289,CB_2025_Mar_FB_3937_LZ-DP_V01_9x16_VID_EN_New_C-Testimonial_Evergreen_CTA-NONE_Angle-W_M-MIX_VL-15s_G-MF_P-APP_S-WHAT,ASC+ || CB App || Mixed countries || 7DC || 0% existing || 12/04/2025 Ad set,VIDEO,$21,809,2025-04-12,2025-04-12,0
290,CB_2025_Apr_FB_3966_SO_V02_4x5_IMG_EN_New_C-NONE_Evergreen_CTA-NONE_Angle-W-B-C_M-NONE_VL-None_G-NONE_P-OG_S-NONE,3966 - #129Finally-IMGs_SO || Batch 1 || Enhancements: OFF || CBV1 || 7C || 07/04/25w15,SHARE,$21,"1,064",2025-04-07,2025-04-10,3
291,CB_2025_Mar_FB_3913_CHUB-AS_V04_1x1_IMG_EN_New_C-NONE_CTA-NONE_Angle-W_M-NONE_VL-None_TR-None_G-NONE_P-NONE_S-NONE_blog_moobs_cv_en,CBV1 || LP:HI | blog_moobs_cv_en || Batch 1 || 30/03/25,SHARE,$20,730,2025-03-30,2025-04-07,8
292,CB_2025_Mar_FB_3937_LZ-DP_V04_9x16_VID_EN_New_C-Testimonial_Evergreen_CTA-NONE_Angle-W_M-MIX_VL-15s_G-MF_P-APP_S-WHAT,ASC+ || CB App || Mixed countries || 7DC || 0% existing || 12/04/2025 Ad set,VIDEO,$20,703,2025-04-12,2025-04-12,0
293,CB_2025_Mar_FB_3936_SO-DP_V05_9x16_VID_EN_Opti_C-MakingOf_CTA-CTA_Pain-W-B-C_M-POW_VL-45s_TR-None_G-M_P-OG_S-Moon_FB3090V02,3936 - New hook on winner ads opti || Batch 2 || Enhancements: OFF || CBV1 || 7C || 07/04/25w15,VIDEO,$19,"1,129",2025-04-07,2025-04-10,3
294,CB_2025_Mar_FB_3913_CHUB-AS_V02_1x1_IMG_EN_New_C-NONE_CTA-NONE_Angle-W_M-NONE_VL-None_TR-None_G-NONE_P-NONE_S-NONE_blog_moobs_cv_en,CBV1 || LP:HI | blog_moobs_cv_en || Batch 1 || 30/03/25,SHARE,$19,"1,202",2025-03-30,2025-04-07,8
295,CB_2025_Mar_FB_3956_VK_V08_4x5_IMG_EN_OPTI_C-BulletPoints_Evergreen_CTA-65_Angle-W-B-C_M-NONE_VL-None_G-M_P-OG_S-NONE_FB3956V05,3956 - LOW T OPTI 3891 -VK || Batch 2 || Enhancements: OFF || CBV1 || 7C || 07/04/25w15,SHARE,$18,985,2025-04-07,2025-04-12,5
296,CB_2025_Apr_FB_3987_SO-JG_V06_4x5_IMG_EN_New_C-NONE_Evergreen_CTA-NONE_Angle-W-B-C_M-NONE_VL-None_G-NONE_P-OG_S-NONE,3987 - Tax-Wars IMG JG || Batch 2 || Enhancements: OFF || CBV1 || 7C || 09/04/25w15,SHARE,$18,863,2025-04-09,2025-04-18,9
297,CB_2025_Apr_FB_3997_DT-DP_V03_9x16_VID_EN_Opti_C-MakingOf_Sale_CTA-SALE_Angle-W-B_M-POW_VL-45s_G-M_P-OG_S-NEW_FB3033V01,3997 - 3033 V01 opti || Batch 1 || Enhancements: OFF || CBV1 || 7C || 11/04/25w16,VIDEO,$18,593,2025-04-11,2025-04-13,2
298,CB_2025_Apr_FB_3966_SO_V06_4x5_IMG_EN_New_C-NONE_Evergreen_CTA-NONE_Angle-W-B-C_M-NONE_VL-None_G-NONE_P-OG_S-NONE,3966 - #129Finally-IMGs_SO || Batch 2 || Enhancements: OFF || CBV1 || 7C || 07/04/25w15,SHARE,$18,895,2025-04-07,2025-04-10,3
299,CB_2025_Apr_FB_3980_LZ-KB_V19_9x16_VID_EN_Opti_C-MakingOf_Evergreen_CTA-SALE_Angle-W_M-AGR_VL-45s_G-M_P-OG_S-NEW_FB3005V05,3980 - winner video man boobs opti || Batch 5 || Enhancements: OFF || CBV1 || 7C || 11/04/25w16,VIDEO,$18,657,2025-04-11,2025-04-18,7
300,CB_2024_Sep_FB_3175_DA-KB_V01_1x1_IMG_EN_New_C-ADVRT_Evergreen_CTA-NONE_Angle-W_M-NONE_VL-None_G-NONE_P-CBV2_S-NONE_blog_colonbroomvsmammothhighprice3_cv_en,CBV2 || A/B test CTA button: Variaton || CBV2 vs Happy Mammoth || 7C || 26/03/25,SHARE,$16,"1,165",2025-03-26,2025-04-28,33
301,CB_2024_Jan_FB_2797_VK-RP-RS_V02_1x1_IMG_EN_Opti_C-ADVRT_CTA-NONE_Pain-W_M-NONE_VL-None_TR-None_G-NONE_P-V2_S-NONE,CBV2 || TOP EU || Advantage+ || Advertorial |  || 0% EXISTING CAP || BROAD || 7C || 21/03/25 Ad set,SHARE,$16,662,2025-03-21,2025-04-07,17
302,CB_2024_Sep_FB_3175_DA-KB_V01_1x1_IMG_EN_New_C-ADVRT_Evergreen_CTA-NONE_Angle-W_M-NONE_VL-None_G-NONE_P-CBV2_S-NONE_blog_colonbroomvsmammoth_cv_en,CBV2 || A/B test CTA button: Control || CBV2 vs Happy Mammoth || 7C || 26/03/25,SHARE,$16,"1,158",2025-03-26,2025-04-16,21
303,CB_2023_Jul_FB_2226_MB_V04_9x16_VID_EN_Opti_C-Testim_CTA-SMR_Pain-W_M-MIX_VL-30s_TR-None_G-F_P-None_S-Starry,US || Manual Bid || BFCM || COST CAP 71 || 1C || 15/11/24,VIDEO,$16,365,2024-11-15,2025-06-28,225
304,CB_2025_Mar_FB_3939_DT_V05_4x5_IMG_EN_New_C-Advertorial_Sale_CTA-65_Angle-W-B-C_M-MIX_VL-None_G-M_P-OG_S-NONE,3939 - CB Advertorial ads New Ideas || Batch 2 || Enhancements: OFF || CBV1 || 7C || 30/03/25w14,SHARE,$15,590,2025-03-30,2025-04-14,15
305,CB_2025_Apr_FB_3995_DT-DP_V03_9x16_VID_EN_Opti_C-MakingOf_Evergreen_CTA-CTA_Angle-W-B_M-CRAZY_VL-45s_G-M_P-OG_S-NEW_FB3022V01,3995 - 3022 V01 opti || Batch 1 || Enhancements: OFF || CBV1 || 7C || 11/04/25w16,VIDEO,$14,616,2025-04-11,2025-04-26,15
306,CB_2025_Apr_FB_3969_LZ-DP_V01_4x5_IMG_EN_Opti_C-Headline_Evergreen_CTA-SALE_Angle-W_M-NONE_VL-None_G-NONE_P-OG_S-NONE_FB3924V06,3969 - writing on chest opti || Batch 1 || Enhancements: OFF || CBV1 || 7C || 07/04/25w15,SHARE,$13,591,2025-04-07,2025-04-10,3
307,CB_2025_Mar_FB_3913_CHUB-AS_V01_1x1_IMG_EN_New_C-NONE_CTA-NONE_Angle-W_M-NONE_VL-None_TR-None_G-NONE_P-NONE_S-NONE_blog_moobs_cv_en,CBV1 || LP:HI | blog_moobs_cv_en || Batch 1 || 30/03/25,SHARE,$13,679,2025-03-30,2025-04-07,8
308,CB_2025_Mar_FB_3957_SO-DP_V02_4x5_IMG_EN_New_C-NONE_Evergreen_CTA-NONE_Angle-W-B-C_M-NONE_VL-None_G-NONE_P-OG_S-NONE,3957 - If you're googling IMG CB V1 || Batch 1 || Enhancements: OFF || CBV1 || 7C || 07/04/25w15,SHARE,$13,491,2025-04-07,2025-04-09,2
309,CB_2025_Apr_FB_3987_SO-JG_V03_4x5_IMG_EN_New_C-NONE_Evergreen_CTA-NONE_Angle-W-B-C_M-NONE_VL-None_G-NONE_P-OG_S-NONE,3987 - Tax-Wars IMG JG || Batch 1 || Enhancements: OFF || CBV1 || 7C || 09/04/25w15,SHARE,$12,658,2025-04-09,2025-04-12,3
310,CB_2024_Sep_FB_3175_DA-KB_V02_1x1_IMG_EN_New_C-ADVRT_Evergreen_CTA-NONE_Angle-W_M-NONE_VL-None_G-NONE_P-CBV2_S-NONE_blog_colonbroomvsmammothhighprice3_cv_en,CBV2 || A/B test CTA button: Variaton || CBV2 vs Happy Mammoth || 7C || 26/03/25,SHARE,$12,709,2025-03-26,2025-04-28,33
311,CB_2025_Mar_FB_3913_CHUB-AS_V11_1x1_IMG_EN_New_C-NONE_CTA-NONE_Angle-W_M-NONE_VL-None_TR-None_G-NONE_P-NONE_S-NONE_blog_moobs_cv_en,CBV2 || LP:HI | blog_moobs_cv_en || Batch 3 || 08/03/25,SHARE,$11,328,2025-04-08,2025-04-26,18
312,CB_2025_Apr_FB_3962_VK-DP_V03_9x16_VID_EN_Opti_C-Trend_Evergreen_CTA-NONE_Angle-W-B-C_M-JANW_VL-30s_G-M_P-OG_S-NEW_FB3909V03,3962 - 3909 hook opti - DP -VK || Batch 1 || Enhancements: OFF || CBV1 || 7C || 07/04/25w15,VIDEO,$11,726,2025-04-07,2025-04-17,10
313,CB_2025_Mar_FB_3928_VK-DP_V03_1x1_VID_EN_Opti_C-BulletPoints_Evergreen_CTA-NONE_Angle-W-B-C_M-NONE_VL-None_G-M_P-OG_S-NONE_FB3891V05,3928 - opti 3891 kinda sorta opti with man boobs - DP-VK || Batch 1 || Enhancements: OFF || CBV1 || 7C || 24/03/25w13,SHARE,$11,565,2025-03-24,2025-04-17,24
314,CB_2025_Apr_FB_3980_LZ-KB_V18_9x16_VID_EN_Opti_C-MakingOf_Evergreen_CTA-SALE_Angle-W_M-AGR_VL-45s_G-M_P-OG_S-NEW_FB3005V05,3980 - winner video man boobs opti || Batch 5 || Enhancements: OFF || CBV1 || 7C || 11/04/25w16,VIDEO,$11,454,2025-04-11,2025-04-18,7
315,CB_2025_Mar_FB_3931_VK-DP_V03_9x16_VID_EN_Opti_C-NONE_Evergreen_CTA-NONE_Angle-W_M-NONE_VL-30s_G-M_P-OG_S-WOOD_FB3860V03,3942 - 3860 V03 opti - DP - VK || Batch 1 || Enhancements: OFF || CBV1 || 7C || 30/03/25w14,VIDEO,$11,504,2025-03-30,2025-04-09,10
316,CB_2024_Oct_FB_3214_DT-KB_V08_1x1_IMG_EN_New_C-ADVRT_Evergreen_CTA-NONE_Angle-W_M-NONE_VL-None_G-NONE_P-OG_S-NONE,CA || Advantage+ || Advertorial || 7C ||  BROAD || Existing_customer_0% || 20/03/25 Ad set,SHARE,$11,646,2025-03-20,2025-04-09,20
317,CB_2025_Mar_FB_3956_VK_V01_4x5_IMG_EN_OPTI_C-BulletPoints_Evergreen_CTA-65_Angle-W-B-C_M-NONE_VL-None_G-M_P-OG_S-NONE_FB3956V05,3956 - LOW T OPTI 3891 -VK || Batch 1 || Enhancements: OFF || CBV1 || 7C || 07/04/25w15,SHARE,$11,316,2025-04-07,2025-04-14,7
318,CB_2025_Mar_FB_3957_SO-DP_V01_4x5_IMG_EN_New_C-NONE_Evergreen_CTA-NONE_Angle-W-B-C_M-NONE_VL-None_G-NONE_P-OG_S-NONE,3957 - If you're googling IMG CB V1 || Batch 1 || Enhancements: OFF || CBV1 || 7C || 07/04/25w15,SHARE,$11,412,2025-04-07,2025-04-10,3
319,CB_2025_Apr_FB_3980_LZ-KB_V12_9x16_VID_EN_Opti_C-BulletPoints_Evergreen_CTA-SALE_Angle-W_M-MIX_VL-30s_G-MF_P-OG_S-WHAT_FB1989V08,3980 - winner video man boobs opti || Batch 4 || Enhancements: OFF || CBV1 || 7C || 11/04/25w16,VIDEO,$11,399,2025-04-11,2025-04-14,3
320,CB_2025_Apr_FB_3972_CHUB-KZ_V04_9x16_VID_EN_New_C-NONE_CTA-NONE_Angle-W-B-C_M-F_VL-None_TR-None_G-NONE_P-NONE_S-NONE,3972 - CHUB SingingToiletUGC || Batch 1 || Enhancements: OFF || CBV1 || 7C || 09/04/25w15,VIDEO,$11,549,2025-04-09,2025-04-11,2
321,CB_2025_Mar_FB_3936_SO-DP_V03_9x16_VID_EN_Opti_C-Dance_Sale_CTA-70_Angle-W_M-POW_VL-30s_G-M_P-OG_S-WOOD_FB3850V04,3936 - New hook on winner ads opti || Batch 1 || Enhancements: OFF || CBV1 || 7C || 07/04/25w15,VIDEO,$10,642,2025-04-07,2025-04-10,3
322,CB_2024_Jan_FB_2783_VK-RP_V02_1x1_IMG_EN_Opti_C-ADVRT_CTA-NONE_Pain-W_M-NONE_VL-None_TR-None_G-NONE_P-V2_S-NONE,CBV2 || TOP EU || Advantage+ || Advertorial |  || 0% EXISTING CAP || BROAD || 7C || 21/03/25 Ad set,SHARE,$10,545,2025-03-21,2025-04-07,17
323,CB_2025_Mar_FB_3924_SO-DP_V03_1x1_IMG_EN_New_C-NONE_Evergreen_CTA-NONE_Angle-W-B-C_M-NONE_VL-None_G-NONE_P-OG_S-NONE,US || ASC+ || Website + Shop || 7DC || Existing 0% || 24.03.2025 Ad set,SHARE,$10,380,2025-04-12,2025-05-03,21
324,CB_2025_Apr_FB_3987_SO-JG_V11_4x5_IMG_EN_New_C-NONE_Evergreen_CTA-NONE_Angle-W-B-C_M-NONE_VL-None_G-NONE_P-OG_S-NONE,3987 - Tax-Wars IMG JG || Batch 3 || Enhancements: OFF || CBV1 || 7C || 09/04/25w15,SHARE,$10,461,2025-04-09,2025-04-19,10
325,CB_2025_Apr_FB_3980_LZ-KB_V21_9x16_VID_EN_Opti_C-BulletPoints_Evergreen_CTA-SALE_Angle-W_M-MIX_VL-45s_G-MF_P-OG_S-WHAT_FB3097V03,3980 - winner video man boobs opti || Batch 6 || Enhancements: OFF || CBV1 || 7C || 11/04/25w16,VIDEO,$10,485,2025-04-11,2025-04-14,3
326,CB_2025_Mar_FB_3937_LZ-DP_V03_9x16_VID_EN_New_C-Testimonial_Evergreen_CTA-NONE_Angle-W_M-MIX_VL-15s_G-MF_P-APP_S-WHAT,ASC+ || CB App || Mixed countries || 7DC || 0% existing || 12/04/2025 Ad set,VIDEO,$9,431,2025-04-12,2025-04-12,0
327,CB_2025_Mar_FB_3935_VK-DP_V01_9x16_VID_EN_New_C-Trend_Sale_CTA-65_Angle-W_M-POW_VL-30s_G-M_P-APP_S-NEW_FB3921V01,ASC+ || CB App || Mixed countries || 7DC || 0% existing || 12/04/2025 Ad set,VIDEO,$8,372,2025-04-12,2025-04-12,0
328,CB_2025_Apr_FB_3980_LZ-KB_V06_9x16_VID_EN_Opti_C-BulletPoints_Evergreen_CTA-SALE_Angle-W_M-MIX_VL-30s_G-MF_P-OG_S-NEW_FB2812V07,3980 - winner video man boobs opti || Batch 2 || Enhancements: OFF || CBV1 || 7C || 11/04/25w16,VIDEO,$8,393,2025-04-11,2025-04-14,3
329,CB_2025_Apr_FB_3980_LZ-KB_V14_9x16_VID_EN_Opti_C-BulletPoints_Evergreen_CTA-SALE_Angle-W_M-MIX_VL-30s_G-MF_P-OG_S-WHAT_FB1989V08,3980 - winner video man boobs opti || Batch 4 || Enhancements: OFF || CBV1 || 7C || 11/04/25w16,VIDEO,$8,361,2025-04-11,2025-04-13,2
330,CB_2024_Jan_FB_2762_IK_V04_1x1_IMG_EN_New_C-WrittenTesti_CTA-CTA_Pain-W-B-C_M-NONE_VL-None_TR-None_G-NONE_P-V2_S-NONE,CBV2 || AU || ðŸ’° Advantage+ || US || BROAD || 7C || Existing_customer_5% || 19/12/24 Ad set,SHARE,$8,330,2024-12-19,2025-05-23,155
331,CB_2025_Apr_FB_3980_LZ-KB_V10_9x16_VID_EN_Opti_C-Pointing_Evergreen_CTA-SALE_Angle-W_M-POW_VL-30s_G-M_P-OG_S-MOON_FB2036V03,3980 - winner video man boobs opti || Batch 3 || Enhancements: OFF || CBV1 || 7C || 11/04/25w16,VIDEO,$8,336,2025-04-11,2025-04-24,13
332,CB_2025_Apr_FB_3987_SO-JG_V10_4x5_IMG_EN_New_C-NONE_Evergreen_CTA-NONE_Angle-W-B-C_M-NONE_VL-None_G-NONE_P-OG_S-NONE,3987 - Tax-Wars IMG JG || Batch 3 || Enhancements: OFF || CBV1 || 7C || 09/04/25w15,SHARE,$8,452,2025-04-09,2025-04-19,10
333,CB_2025_Mar_FB_3970_CHUB-AS_V01_1x1_IMG_EN_New_C-NONE_CTA-NONE_Angle-W_M-NONE_VL-None_TR-None_G-NONE_P-NONE_S-NONE_blog_stressweight_cv_en,CBV1 || LP:HI | 3970 blog_stressweight || Batch 1 || 08/04/25,SHARE,$8,224,2025-04-08,2025-04-14,6
334,CB_2025_Apr_FB_3975_LZ_V01_9x16_VID_EN_New_C-Testimonial_Evergreen_CTA-SALE_Angle-W_M-LAURA_VL-15s_G-F_P-OG_S-NEW,3975 - Idea #125 -X from waist || Batch 1 || Enhancements: OFF || CBV1 || 7C || 07/04/25w15,VIDEO,$7,280,2025-04-07,2025-04-10,3
335,CB_2025_Apr_FB_3963_SO-DP_V11_4x5_IMG_EN_Opti_C-NONE_Evergreen_CTA-NONE_Angle-W-B-C_M-NONE_VL-None_G-NONE_P-OG_S-NONE_FB3922V03,3963 - 3922 opti_3 batches IMG || Batch 3 || Enhancements: OFF || CBV1 || 7C || 07/04/25w15,SHARE,$7,279,2025-04-07,2025-04-17,10
336,CB_2025_Apr_FB_3987_SO-JG_V14_4x5_IMG_EN_New_C-NONE_Evergreen_CTA-NONE_Angle-W-B-C_M-NONE_VL-None_G-NONE_P-OG_S-NONE,3987 - Tax-Wars IMG JG || Batch 4 || Enhancements: OFF || CBV1 || 7C || 09/04/25w15,SHARE,$7,415,2025-04-09,2025-04-12,3
337,CB_2022_Mar3_FB_713_IK_V04_1x1_IMG_EN_Opti_C-WrittenTesti_HE-98_A-ExtremeBodyVisualization_HK-bodypart_Pain-W_CLR-PURPLE_BG-IMAGE_ME-MIX_MA-YOUNG,US || Manual Bid || BFCM || COST CAP 71 || 1C || 15/11/24,SHARE,$7,299,2024-11-15,2025-06-29,226
338,CB_2025_Mar_FB_3913_CHUB-AS_V10_1x1_IMG_EN_New_C-NONE_CTA-NONE_Angle-W_M-NONE_VL-None_TR-None_G-NONE_P-NONE_S-NONE_blog_moobs_cv_en,CBV2 || LP:HI | blog_moobs_cv_en || Batch 3 || 08/03/25,SHARE,$7,359,2025-04-08,2025-04-26,18
339,CB_2025_Apr_FB_3969_LZ-DP_V02_4x5_IMG_EN_Opti_C-Headline_Evergreen_CTA-SALE_Angle-W_M-NONE_VL-None_G-NONE_P-OG_S-NONE_FB3924V06,3969 - writing on chest opti || Batch 1 || Enhancements: OFF || CBV1 || 7C || 07/04/25w15,SHARE,$6,351,2025-04-07,2025-04-08,1
340,CB_2025_Mar_FB_3954_VK-DT_V04_9x16_VID_EN_Opti_C-NONE_Evergreen_CTA-NONE_Angle-W-B-C_M-TYL_VL-None_G-M_P-OG_S-NONE_FB3904V02,3954 - CB Opti / 3904 - DT -VK || Batch 1 || Enhancements: OFF || CBV1 || 7C || 07/04/25w15,VIDEO,$6,369,2025-04-07,2025-04-11,4
341,CB_2025_Apr_FB_3980_LZ-KB_V11_9x16_VID_EN_Opti_C-BulletPoints_Evergreen_CTA-SALE_Angle-W_M-MIX_VL-30s_G-MF_P-OG_S-WHAT_FB1989V08,3980 - winner video man boobs opti || Batch 4 || Enhancements: OFF || CBV1 || 7C || 11/04/25w16,VIDEO,$6,220,2025-04-11,2025-04-14,3
342,CB_2025_Apr_FB_3980_LZ-KB_V15_9x16_VID_EN_Opti_C-MakingOf_Evergreen_CTA-SALE_Angle-W_M-AGR_VL-45s_G-M_P-OG_S-NEW_FB3005V05,3980 - winner video man boobs opti || Batch 5 || Enhancements: OFF || CBV1 || 7C || 11/04/25w16,VIDEO,$6,206,2025-04-11,2025-04-18,7
343,CB_2025_Mar_FB_3913_CHUB-AS_V07_1x1_IMG_EN_New_C-NONE_CTA-NONE_Angle-W_M-NONE_VL-None_TR-None_G-NONE_P-NONE_S-NONE_blog_moobs_cv_en,CBV2 || LP:HI | blog_moobs_cv_en || Batch 2 || 08/03/25,SHARE,$6,198,2025-04-08,2025-04-10,2
344,CB_2025_Apr_FB_3980_LZ-KB_V20_9x16_VID_EN_Opti_C-BulletPoints_Evergreen_CTA-SALE_Angle-W_M-MIX_VL-45s_G-MF_P-OG_S-WHAT_FB3097V03,3980 - winner video man boobs opti || Batch 6 || Enhancements: OFF || CBV1 || 7C || 11/04/25w16,VIDEO,$6,219,2025-04-11,2025-04-16,5
345,CB_2025_Apr_FB_3987_SO-JG_V01_4x5_IMG_EN_New_C-NONE_Evergreen_CTA-NONE_Angle-W-B-C_M-NONE_VL-None_G-NONE_P-OG_S-NONE,3987 - Tax-Wars IMG JG || Batch 1 || Enhancements: OFF || CBV1 || 7C || 09/04/25w15,SHARE,$6,295,2025-04-09,2025-04-12,3
346,CB_2025_Mar_FB_3913_CHUB-AS_V06_1x1_IMG_EN_New_C-NONE_CTA-NONE_Angle-W_M-NONE_VL-None_TR-None_G-NONE_P-NONE_S-NONE_blog_moobs_cv_en,CBV2 || LP:HI | blog_moobs_cv_en || Batch 2 || 08/03/25,SHARE,$6,281,2025-04-08,2025-04-10,2
347,CB_2025_Mar_FB_3957_SO-DP_V04_4x5_IMG_EN_New_C-NONE_Evergreen_CTA-NONE_Angle-W-B-C_M-NONE_VL-None_G-NONE_P-OG_S-NONE,3957 - If you're googling IMG CB V1 || Batch 1 || Enhancements: OFF || CBV1 || 7C || 07/04/25w15,SHARE,$5,185,2025-04-07,2025-04-09,2
348,CB_2023_Jul_FB_2217_IB_V04_9x16_VID_EN_Opti_C-Pointing_CTA-SMR_Pain-W-B_M-TRC_VL-30s_TR-None_G-F_P-None_S-FRIGGA,US || Manual Bid || BID CAP 105 || 1C || 21/12/24,VIDEO,$5,184,2024-12-22,2025-06-30,190
349,CB_2025_Apr_FB_3996_DT-DP_V03_9x16_VID_EN_Opti_C-MakingOf_Evergreen_CTA-CTA_Angle-W-B_M-CRAZY_VL-45s_G-M_P-OG_S-NEW_FB3022V03,3996 - 3022 V03 opti || Batch 1 || Enhancements: OFF || CBV1 || 7C || 11/04/25w16,VIDEO,$5,229,2025-04-11,2025-05-08,27
350,CB_2025_Apr_FB_3980_LZ-KB_V22_9x16_VID_EN_Opti_C-BulletPoints_Evergreen_CTA-SALE_Angle-W_M-MIX_VL-45s_G-MF_P-OG_S-WHAT_FB3097V03,3980 - winner video man boobs opti || Batch 6 || Enhancements: OFF || CBV1 || 7C || 11/04/25w16,VIDEO,$5,129,2025-04-11,2025-04-13,2
351,CB_2025_Mar_FB_3944_LZ-VG_V03_4x5_IMG_EN_Opti_C-Testimonial_Evergreen_CTA-NONE_Angle-GH_M-NONE_VL-None_G-NONE_P-OG_S-NONE_FB3619V02,3944 - 3619 opti claims/testimonial || Batch 1 || Enhancements: OFF || CBV1 || 7C || 30/03/25w14,SHARE,$4,250,2025-03-30,2025-04-10,11
352,CB_2025_Apr_FB_3997_DT-DP_V04_9x16_VID_EN_Opti_C-MakingOf_Sale_CTA-SALE_Angle-W-B_M-POW_VL-45s_G-M_P-OG_S-NEW_FB3033V01,3997 - 3033 V01 opti || Batch 1 || Enhancements: OFF || CBV1 || 7C || 11/04/25w16,VIDEO,$4,156,2025-04-11,2025-04-13,2
353,CB_2025_Mar_FB_3907_CHUB-AA_V01__IMG_EN_Opti_C-Price_CTA-NONE_Angle-None_M-NONE_VL-None_TR-None_G-NONE_P-OG_S-NONE,3907 â€“ CHUB Clean Sale OPTI v2 || Enhancements: OFF || CBV1 || Batch 1 || 7C || 16/03/25w12,SHARE,$4,250,2025-03-16,2025-04-09,24
354,CB_2025_Mar_FB_3937_LZ-DP_V02_9x16_VID_EN_New_C-Testimonial_Evergreen_CTA-NONE_Angle-W_M-MIX_VL-15s_G-MF_P-APP_S-WHAT,ASC+ || CB App || Mixed countries || 7DC || 0% existing || 12/04/2025 Ad set,VIDEO,$4,189,2025-04-12,2025-04-12,0
355,CB_2025_Mar_FB_3954_VK-DT_V02_9x16_VID_EN_Opti_C-NONE_Evergreen_CTA-NONE_Angle-W-B-C_M-TYL_VL-None_G-M_P-OG_S-NONE_FB3904V02,3954 - CB Opti / 3904 - DT -VK || Batch 1 || Enhancements: OFF || CBV1 || 7C || 07/04/25w15,VIDEO,$4,199,2025-04-07,2025-04-11,4
356,CB_2025_Apr_FB_3962_VK-DP_V01_9x16_VID_EN_Opti_C-Trend_Evergreen_CTA-NONE_Angle-W-B-C_M-JANW_VL-30s_G-M_P-OG_S-NEW_FB3909V03,3962 - 3909 hook opti - DP -VK || Batch 1 || Enhancements: OFF || CBV1 || 7C || 07/04/25w15,VIDEO,$4,187,2025-04-07,2025-04-17,10
357,CB_2025_Mar_FB_3936_SO-DP_V06_9x16_VID_EN_Opti_C-Benefits_CTA-SMR_Pain-W-B_M-MIX_VL-45s_TR-None_G-MF_P-OG_S-WHAT_FB3097V03,3936 - New hook on winner ads opti || Batch 2 || Enhancements: OFF || CBV1 || 7C || 07/04/25w15,VIDEO,$4,227,2025-04-07,2025-04-10,3
358,CB_2023_Jul_FB_2217_IB_V04_9x16_VID_EN_Opti_C-Pointing_CTA-SMR_Pain-W-B_M-TRC_VL-30s_TR-None_G-F_P-None_S-FRIGGA,US || Manual Bid || BID CAP 111 || 1C || 21/12/24,VIDEO,$4,178,2024-12-22,2025-06-22,182
359,CB_2025_Apr_FB_3975_LZ_V02_9x16_VID_EN_New_C-Testimonial_Evergreen_CTA-SALE_Angle-W_M-LAURA_VL-15s_G-F_P-OG_S-NEW,3975 - Idea #125 -X from waist || Batch 1 || Enhancements: OFF || CBV1 || 7C || 07/04/25w15,VIDEO,$4,136,2025-04-07,2025-04-13,6
360,CB_2024_Oct_FB_3214_DT-KB_V02_1x1_IMG_EN_New_C-ADVRT_Evergreen_CTA-NONE_Angle-W_M-NONE_VL-None_G-NONE_P-OG_S-NONE,CA || Advantage+ || Advertorial || 7C ||  BROAD || Existing_customer_0% || 20/03/25 Ad set,SHARE,$4,295,2025-03-20,2025-04-09,20
361,CB_2025_Apr_FB_3980_LZ-KB_V16_9x16_VID_EN_Opti_C-MakingOf_Evergreen_CTA-SALE_Angle-W_M-AGR_VL-45s_G-M_P-OG_S-NEW_FB3005V05,3980 - winner video man boobs opti || Batch 5 || Enhancements: OFF || CBV1 || 7C || 11/04/25w16,VIDEO,$3,105,2025-04-11,2025-04-18,7
362,CB_2023_Feb_FB_1998_LV_V02_9x16_VID_EN_Opti_C-Dance_CTA-CTA_Pain-W_M-MIX_VL-45s_TR-None_G-F_P-Plan,US || ASC+ || Website + Shop || 7DC || Existing 0% || 24.03.2025 Ad set,VIDEO,$3,147,2025-04-04,2025-05-15,41
363,CB_2025_Mar_FB_3936_SO-DP_V02_9x16_VID_EN_Opti_C-Pointing_CTA-SMR_Pain-W_M-POW_VL-30s_TR-None_G-F_S-Moon_FB2036V03,3936 - New hook on winner ads opti || Batch 1 || Enhancements: OFF || CBV1 || 7C || 07/04/25w15,VIDEO,$3,174,2025-04-07,2025-04-09,2
364,CB_2025_Apr_FB_3963_SO-DP_V10_4x5_IMG_EN_Opti_C-NONE_Evergreen_CTA-NONE_Angle-W-B-C_M-NONE_VL-None_G-NONE_P-OG_S-NONE_FB3922V03,3963 - 3922 opti_3 batches IMG || Batch 3 || Enhancements: OFF || CBV1 || 7C || 07/04/25w15,SHARE,$3,104,2025-04-07,2025-04-17,10
365,CB_2022_Mar3_FB_713_IK_V04_1x1_IMG_EN_Opti_C-WrittenTesti_HE-98_A-ExtremeBodyVisualization_HK-bodypart_Pain-W_CLR-PURPLE_BG-IMAGE_ME-MIX_MA-YOUNG,US || Manual Bid || BFCM || COST CAP 81 || 1C || 15/11/24,SHARE,$2,134,2024-11-15,2025-05-31,197
366,CB_2025_Apr_FB_3962_VK-DP_V04_9x16_VID_EN_Opti_C-Trend_Evergreen_CTA-NONE_Angle-W-B-C_M-JANW_VL-30s_G-M_P-OG_S-NEW_FB3909V03,3962 - 3909 hook opti - DP -VK || Batch 1 || Enhancements: OFF || CBV1 || 7C || 07/04/25w15,VIDEO,$2,192,2025-04-07,2025-04-17,10
367,CB_2023_May_FB_2016_MB_V04_9x16_VID_EN_Opti_C-Sale_CTA-SMR_Pain-W_M-JOG_VL-30s_TR-None_G-M_P-None_S-What,US || ASC+ || Website + Shop || 7DC || Existing 0% || 24.03.2025 Ad set,VIDEO,$2,119,2025-04-04,2025-05-15,41
368,CB_2025_Mar_FB_3936_SO-DP_V01_9x16_VID_EN_Opti_C-Benefits_CTA-AUTUM_Pain-W-B_M-PASQ_VL45s_TR-None_G-M_P-Plan_S-WHAT_FB2516V13,3936 - New hook on winner ads opti || Batch 1 || Enhancements: OFF || CBV1 || 7C || 07/04/25w15,VIDEO,$2,112,2025-04-07,2025-04-09,2
369,CB_2025_Apr_FB_3980_LZ-KB_V23_9x16_VID_EN_Opti_C-BulletPoints_Evergreen_CTA-SALE_Angle-W_M-MIX_VL-45s_G-MF_P-OG_S-WHAT_FB3097V03,3980 - winner video man boobs opti || Batch 6 || Enhancements: OFF || CBV1 || 7C || 11/04/25w16,VIDEO,$2,85,2025-04-11,2025-04-14,3
370,CB_2025_Mar_FB_3939_DT_V08_4x5_IMG_EN_New_C-Advertorial_Sale_CTA-65_Angle-W-B-C_M-MIX_VL-None_G-M_P-OG_S-NONE,3939 - CB Advertorial ads New Ideas || Batch 2 || Enhancements: OFF || CBV1 || 7C || 30/03/25w14,SHARE,$2,84,2025-03-30,2025-04-14,15
371,CB_2025_Apr_FB_3980_LZ-KB_V09_9x16_VID_EN_Opti_C-Pointing_Evergreen_CTA-SALE_Angle-W_M-POW_VL-30s_G-M_P-OG_S-MOON_FB2036V03,3980 - winner video man boobs opti || Batch 3 || Enhancements: OFF || CBV1 || 7C || 11/04/25w16,VIDEO,$2,81,2025-04-11,2025-04-25,14
372,CB_2025_Apr_FB_3996_DT-DP_V01_9x16_VID_EN_Opti_C-MakingOf_Evergreen_CTA-CTA_Angle-W-B_M-CRAZY_VL-45s_G-M_P-OG_S-NEW_FB3022V03,3996 - 3022 V03 opti || Batch 1 || Enhancements: OFF || CBV1 || 7C || 11/04/25w16,VIDEO,$2,93,2025-04-11,2025-05-08,27
373,CB_2024_Mar_FB_2883_DA_V08_9x16_VID_ES_Opti_C-SingleTesti_CTA-SALE_Pain-W-B_M-TRC_VL-45s_TR-None_G-F_P-OG_S-MOON_FB2764V04.mp4,US || Quiz: React || 7C || 04/04/25,VIDEO,$1,57,2025-04-04,2025-05-06,32
374,CB_2025_Mar_FB_3913_CHUB-AS_V11_1x1_IMG_EN_New_C-NONE_CTA-NONE_Angle-W_M-NONE_VL-None_TR-None_G-NONE_P-NONE_S-NONE_blog_moobs_cv_en,CBV1 || LP:HI | blog_moobs_cv_en || Batch 3 || 30/03/25,SHARE,$1,51,2025-03-30,2025-04-08,9
375,CB_2025_Feb_FB_3860_LZ-DP_V01_9x16_VID_EN_Opti_C-Testimonial_Evergreen_CTA-SALE_Angle-W_M-MOOD_VL-20s_G-M_P-OG_S-WOOD_FB21176V11_1,3860 - man boobs video 2176 opti || Enhancements: OFF || CBV1 || Batch 1 || 7C || 03/03/25w10 || Valentinas,VIDEO,$1,118,2025-03-03,2025-04-12,40
376,CB_2025_Apr_FB_3995_DT-DP_V02_9x16_VID_EN_Opti_C-MakingOf_Evergreen_CTA-CTA_Angle-W-B_M-CRAZY_VL-45s_G-M_P-OG_S-NEW_FB3022V01,3995 - 3022 V01 opti || Batch 1 || Enhancements: OFF || CBV1 || 7C || 11/04/25w16,VIDEO,$1,39,2025-04-11,2025-04-26,15
377,CB_2024_Mar_FB_2883_DA_V08_9x16_VID_ES_Opti_C-SingleTesti_CTA-SALE_Pain-W-B_M-TRC_VL-45s_TR-None_G-F_P-OG_S-MOON_FB2764V04.mp4,US || Quiz: Shopify || 7C || 04/04/25,VIDEO,$1,29,2025-04-04,2025-05-11,37
378,CB_2025_Mar_FB_3950_SO_V12_4x5_IMG_EN_New_C-NONE_Evergreen_CTA-NONE_Angle-W-B-C_M-NONE_VL-None_G-NONE_P-OG_S-NONE,3950 - Image Gen by ChatGPT || Batch 3 || Enhancements: OFF || CBV1 || 7C || 30/03/25w14,SHARE,$1,43,2025-03-30,2025-04-25,26
379,CB_2025_Mar_FB_3913_CHUB-AS_V09_1x1_IMG_EN_New_C-NONE_CTA-NONE_Angle-W_M-NONE_VL-None_TR-None_G-NONE_P-NONE_S-NONE_blog_moobs_cv_en,CBV1 || LP:HI | blog_moobs_cv_en || Batch 3 || 30/03/25,SHARE,$1,27,2025-03-30,2025-04-08,9
380,CB_2025_Mar_FB_3928_VK-DP_V04_1x1_VID_EN_Opti_C-BulletPoints_Evergreen_CTA-NONE_Angle-W-B-C_M-NONE_VL-None_G-M_P-OG_S-NONE_FB3891V05,3928 - opti 3891 kinda sorta opti with man boobs - DP-VK || Batch 1 || Enhancements: OFF || CBV1 || 7C || 24/03/25w13,SHARE,$1,39,2025-03-24,2025-04-14,21
381,CB_2025_Mar_FB_3913_CHUB-AS_V03_1x1_IMG_EN_New_C-NONE_CTA-NONE_Angle-W_M-NONE_VL-None_TR-None_G-NONE_P-NONE_S-NONE_blog_moobs_cv_en,CBV1 || LP:HI | blog_moobs_cv_en || Batch 1 || 30/03/25,SHARE,$1,32,2025-03-30,2025-04-07,8
382,CB_2025_Mar_FB_3950_SO_V15_4x5_IMG_EN_New_C-NONE_Evergreen_CTA-NONE_Angle-W-B-C_M-NONE_VL-None_G-NONE_P-OG_S-NONE,3950 - Image Gen by ChatGPT || Batch 4 || Enhancements: OFF || CBV1 || 7C || 30/03/25w14,SHARE,$1,44,2025-03-30,2025-04-12,13
383,CB_2025_Mar_FB_3924_SO-DP_V01_1x1_IMG_EN_New_C-NONE_Evergreen_CTA-NONE_Angle-W-B-C_M-NONE_VL-None_G-NONE_P-OG_S-NONE,3924 - #17 man boobs/dad bod body text IMG || Batch 1 || Enhancements: OFF || CBV1 || 7C || 24/03/25w13,SHARE,$0,1,2025-03-24,2025-05-02,39
384,CB_2025_Mar_FB_3907_CHUB-AA_V02__IMG_EN_Opti_C-Price_CTA-NONE_Angle-None_M-NONE_VL-None_TR-None_G-NONE_P-OG_S-NONE,3907 â€“ CHUB Clean Sale OPTI v2 || Enhancements: OFF || CBV1 || Batch 1 || 7C || 16/03/25w12,SHARE,$0,16,2025-03-16,2025-04-09,24
385,CB_2024_Oct_FB_3251_LZ-VU_V01_1x1_IMG_EN_New_C-NegativeMark_Evergreen_CTA-NONE_Angle-Cort_M-NONE_VL-None_G-NONE_P-NONE_S-NONE.png,US || Manual Bid || BFCM || COST CAP 71 || 1C || 15/11/24,SHARE,$0,78,2024-11-15,2025-06-28,225
386,CB_2025_Mar_FB_3950_SO_V09_4x5_IMG_EN_New_C-NONE_Evergreen_CTA-NONE_Angle-W-B-C_M-NONE_VL-None_G-NONE_P-OG_S-NONE,3950 - Image Gen by ChatGPT || Batch 3 || Enhancements: OFF || CBV1 || 7C || 30/03/25w14,SHARE,$0,5,2025-03-30,2025-04-21,22
387,CB_2025_Mar_FB_3909_DT-DP_V01_9x16_VID_EN_New_C-Trend_Evergreen_CTA-SMRBOD_Angle-W-B-C_M-JANW_VL-30s_G-M_P-OG_S-NEW,3909 - Shirtless anxiety VID || Batch 1 || Enhancements: OFF || CBV1 || 7C || 24/03/25w13,VIDEO,$0,11,2025-03-24,2025-04-13,20
388,CB_2025_Mar_FB_3950_SO_V10_4x5_IMG_EN_New_C-NONE_Evergreen_CTA-NONE_Angle-W-B-C_M-NONE_VL-None_G-NONE_P-OG_S-NONE,3950 - Image Gen by ChatGPT || Batch 3 || Enhancements: OFF || CBV1 || 7C || 30/03/25w14,SHARE,$0,10,2025-03-30,2025-04-25,26
389,CB_2025_Mar_FB_3914_DT-DP_V02_9x16_VID_EN_New_C-Trend_Sale_CTA-SPRNG_Angle-W-B-C_M-JOG_VL-30s_G-F_P-OG_S-NEW,"3914 - #9 GF's POV, male confidence || Batch 1 || Enhancements: OFF || CBV1 || 7C || 24/03/25w13",VIDEO,$0,6,2025-03-24,2025-05-01,38
390,CB_2025_Feb_FB_3883_LZ-RP_V03_9x16_VID_EN_Opti_C-Testimonial_Evergreen_CTA-SALE_Angle-W_M-MIX_VL-30s_G-MF_P-OG_S-WHAT_FB1989V08,3883 - Wiiner opti man boobs t levels || Enhancements: OFF || CBV1 || Batch 1 || 7C || 10/03/25w11,VIDEO,$0,9,2025-03-10,2025-04-14,35
391,CB_2025_Mar_FB_3907_CHUB-AA_V04__IMG_EN_Opti_C-Price_CTA-NONE_Angle-None_M-NONE_VL-None_TR-None_G-NONE_P-OG_S-NONE,3907 â€“ CHUB Clean Sale OPTI v2 || Enhancements: OFF || CBV1 || Batch 1 || 7C || 16/03/25w12,SHARE,$0,8,2025-03-16,2025-04-09,24
392,CB_2025_Mar_FB_3909_DT-DP_V02_9x16_VID_EN_New_C-Trend_Evergreen_CTA-SMRBOD_Angle-W-B-C_M-JANW_VL-30s_G-M_P-OG_S-NEW,3909 - Shirtless anxiety VID || Batch 1 || Enhancements: OFF || CBV1 || 7C || 24/03/25w13,VIDEO,$0,5,2025-03-24,2025-04-12,19
393,CB_2025_Mar_FB_3950_SO_V14_4x5_IMG_EN_New_C-NONE_Evergreen_CTA-NONE_Angle-W-B-C_M-NONE_VL-None_G-NONE_P-OG_S-NONE,3950 - Image Gen by ChatGPT || Batch 4 || Enhancements: OFF || CBV1 || 7C || 30/03/25w14,SHARE,$0,7,2025-03-30,2025-04-12,13
394,CB_2023_May_FB_2103_MB_V02_9x16_VID_EN_Opti_C-Sale_CTA-SMR_Pain-W_M-JOG_VL-30s_TR-None_G-M-F_P-None_S-What,US || Manual Bid || BID CAP 111 || 1C || 21/12/24,VIDEO,$0,2,2024-12-28,2025-06-14,168
395,CB_2025_Mar_FB_3924_SO-DP_V02_1x1_IMG_EN_New_C-NONE_Evergreen_CTA-NONE_Angle-W-B-C_M-NONE_VL-None_G-NONE_P-OG_S-NONE,3924 - #17 man boobs/dad bod body text IMG || Batch 1 || Enhancements: OFF || CBV1 || 7C || 24/03/25w13,SHARE,$0,4,2025-03-24,2025-05-06,43
396,CB_2025_Mar_FB_3914_DT-DP_V03_9x16_VID_EN_New_C-Trend_Sale_CTA-SPRNG_Angle-W-B-C_M-JOG_VL-30s_G-F_P-OG_S-NEW,"3914 - #9 GF's POV, male confidence || Batch 1 || Enhancements: OFF || CBV1 || 7C || 24/03/25w13",VIDEO,$0,2,2025-03-24,2025-05-08,45
397,CB_2025_Mar_FB_3903_VK_V02_9x16_VID_EN_New_C-BulletPoints_Evergreen_CTA-65_Angle-W-B-C_M-MIX_VL-30s_G-MF_P-OG_S-WOOD,3903 - #13 My husband hides his beer belly - VK  || Batch 1 || Enhancements: OFF || CBV1 || 7C || 24/03/25w13,VIDEO,$0,4,2025-03-24,2025-04-09,16
398,CB_2025_Mar_FB_3955_SO-KB_V14_4x5_IMG_EN_New_C-NONE_Evergreen_CTA-NONE_Angle-W-B-C_M-NONE_VL-None_G-NONE_P-OG_S-NONE,3955 - THE GHIBLI-VERSE Trend || Batch 4 || Enhancements: OFF || CBV1 || 7C || 02/04/25w14,SHARE,$0,5,2025-04-02,2025-04-12,10
399,CB_2025_Mar_FB_3903_VK_V03_9x16_VID_EN_New_C-BulletPoints_Evergreen_CTA-65_Angle-W-B-C_M-MIX_VL-30s_G-MF_P-OG_S-MOON,3903 - #13 My husband hides his beer belly - VK  || Batch 1 || Enhancements: OFF || CBV1 || 7C || 24/03/25w13,VIDEO,$0,1,2025-03-24,2025-04-08,15
400,CB_2025_Feb_FB_3883_LZ-RP_V01_9x16_VID_EN_Opti_C-Testimonial_Evergreen_CTA-SALE_Angle-W_M-POW_VL-45s_G-M_P-OG_S-MOON_FB3090V02,3883 - Wiiner opti man boobs t levels || Enhancements: OFF || CBV1 || Batch 1 || 7C || 10/03/25w11,VIDEO,$0,1,2025-03-10,2025-04-14,35
401,CB_2025_Feb_FB_3860_LZ-DP_V04_9x16_VID_EN_Opti_C-Testimonial_Evergreen_CTA-SALE_Angle-W_M-MOOD_VL-20s_G-M_P-OG_S-WOOD_FB21176V11_1,3860 - man boobs video 2176 opti || Enhancements: OFF || CBV1 || Batch 1 || 7C || 03/03/25w10 || Valentinas,VIDEO,$0,1,2025-03-03,2025-04-09,37
402,CB_2024_Dec_FB_3622_LZ-KB_V03_4x5_IMG_EN_Opti_C-NONE_Sale_CTA-XMAS_Angle-GH_M-NONE_VL-None_G-NONE_P-OG_S-NONE_FB2227V08 - Copy,US || Manual Bid || BID CAP 111 || 1C || 21/12/24,SHARE,$0,1,2024-12-22,2025-04-23,122
