,Ad Name,Adset Name,Creative Type,Spend In USD,Impressions,First Ad Spend Date,Last Ad Spend Date,Days ad spending
1,CB_2025_Jan_FB_3723_SO_V04_4x5_IMG_EN_New_C-NONE_Evergreen_CTA-SALE_Angle-W_M-NONE_VL-None_G-NONE_P-NONE_S-NONE,ðŸŒ¶ï¸ || US || ASC+ || ->CC141 || VIDEO Only || US+CA || 0% EXISTING CAP || 7C || 07/08.24  Ad set,SHARE,"$17,038","1,346,574",2025-02-12,2025-03-27,43
2,CB_2025_Jan_FB_3779_VK-DP_V02_1x1_VID_EN_Opti_C-BulletPoints_Evergreen_CTA-70_Angle-W-B-C_M-NONE_VL-None_G-F_P-OG_S-NEW_FB3705V02,ðŸŒ¶ï¸ || US || ASC+ || ->CC141 || VIDEO Only || US+CA || 0% EXISTING CAP || 7C || 07/08.24  Ad set,SHARE,"$13,325","786,271",2025-02-12,2025-03-19,35
3,CB_2023_Apr_FB_1989_RS_V08_9x16_VID_EN_Opti_C-Trend_CTA-SMR_Pain-W_M-MIX_VL-30s_TR-None_G-MF_P-None,ðŸŒ¶ï¸ || US || ASC+ || ->CC141 || VIDEO Only || US+CA || 0% EXISTING CAP || 7C || 07/08.24  Ad set,VIDEO,"$12,105","631,043",2024-08-07,2025-03-24,229
4,CB_2025_Feb_FB_3818_LZ-VU_V04_1x1_IMG_EN_Opti_C-Headline_Evergreen_CTA-NONE_Angle-Cort_M-NONE_VL-None_G-NONE_P-NONE_S-NONE_FB3251V01,ðŸŒ¶ï¸ || US || ASC+ || ->CC141 || VIDEO Only || US+CA || 0% EXISTING CAP || 7C || 07/08.24  Ad set,SHARE,"$11,947","601,166",2025-02-17,2025-03-03,14
5,CB_2025_Feb_FB_3812_SO_V03_4x5_IMG_EN_Opti_C-NONE_Evergreen_CTA-SALE_Angle-W_M-NONE_VL-None_G-NONE_P-NONE_S-NONE_FB3723V07,ðŸŒ¶ï¸ || US || ASC+ || ->CC141 || VIDEO Only || US+CA || 0% EXISTING CAP || 7C || 07/08.24  Ad set,SHARE,"$9,188","721,556",2025-02-24,2025-03-15,19
6,CB_2025_Jan_FB_3718_CHUB_V05_4x5_IMG_EN_Opti_C-NONE_CTA-NONE_Angle-C_M-NONE_VL-None_TR-None_G-M_P-OG_S-NONE,ðŸŒ¶ï¸ || US || ASC+ || ->CC141 || VIDEO Only || US+CA || 0% EXISTING CAP || 7C || 07/08.24  Ad set,SHARE,"$8,348","536,624",2025-02-12,2025-03-03,19
7,CB_2023_Jul_FB_2217_IB_V04_9x16_VID_EN_Opti_C-Pointing_CTA-SMR_Pain-W-B_M-TRC_VL-30s_TR-None_G-F_P-None_S-FRIGGA,ðŸŒ¶ï¸ || US || ASC+ || ->CC141 || VIDEO Only || US+CA || 0% EXISTING CAP || 7C || 07/08.24  Ad set,VIDEO,"$7,774","314,393",2024-08-07,2025-03-27,232
8,Dynamic_Creative_Statics_CA_Flow,WC || CA || DYNAMIC CREATIVE Static winners || ADV+ audience || 7C || 16.02.2025,SHARE,"$6,324","502,223",2025-02-16,2025-03-27,39
9,Dynamic_Creative_CA_Flow,WC || CA || DYNAMIC CREATIVE || ADV+ audience || 7C || 17.04.2024 || BIG BUDGET,SHARE,"$6,073","331,675",2024-04-17,2025-02-27,316
10,CB_2024_Aug_FB_3097_VK-DP_V03_9x16_VID_EN_Opti_C-Benefits_CTA-SMR_Pain-W-B_M-MIX_VL-45s_TR-None_G-MF_P-OG_S-WHAT_FB2516V13,ðŸŒ¶ï¸ || US || ASC+ || ->CC141 || VIDEO Only || US+CA || 0% EXISTING CAP || 7C || 07/08.24  Ad set,VIDEO,"$5,773","321,668",2024-09-04,2025-03-27,204
11,CB_2023_Jul_FB_2284_DA_V05_9x16_VID_EN_Opti_C-Sale_CTA-SMR_Pain-W_M-JANW_VL-30s_TR-None_G-M_P-None_S-WHAT_FB2103V02,ðŸŒ¶ï¸ || US || ASC+ || ->CC141 || VIDEO Only || US+CA || 0% EXISTING CAP || 7C || 07/08.24  Ad set,VIDEO,"$5,389","273,605",2024-08-07,2025-03-27,232
12,CB_2024_Aug_FB_3090_DT-DP_V02_9x16_VID_EN_Opti_C-MakingOf_CTA-CTA_Pain-W-B-C_M-POW_VL-45s_TR-None_G-M_P-OG_S-Moon_FB3029V04,ðŸŒ¶ï¸ || US || ASC+ || ->CC141 || VIDEO Only || US+CA || 0% EXISTING CAP || 7C || 07/08.24  Ad set,VIDEO,"$5,176","240,831",2025-01-17,2025-03-03,45
13,CB_2025_Feb_FB_3850_DT-DP_V04_9x16_VID_EN_Opti_C-Dance_Sale_CTA-70_Angle-W_M-POW_VL-30s_G-M_P-OG_S-WOOD_FB2176V11,ðŸŒ¶ï¸ || US || ASC+ || ->CC141 || VIDEO Only || US+CA || 0% EXISTING CAP || 7C || 07/08.24  Ad set,VIDEO,"$4,875","299,917",2025-02-28,2025-03-01,1
14,CB_2023_Jul_FB_2226_MB_V04_9x16_VID_EN_Opti_C-Testim_CTA-SMR_Pain-W_M-MIX_VL-30s_TR-None_G-F_P-None_S-Starry,ðŸŒ¶ï¸ || US || ASC+ || ->CC141 || VIDEO Only || US+CA || 0% EXISTING CAP || 7C || 07/08.24  Ad set,VIDEO,"$4,457","185,693",2024-10-28,2025-03-27,150
15,CB_2025_Feb_FB_3787_CHUB_V01_9x16_VID_EN_New_C-NONE_CTA-NONE_Angle-None_M-NONE_VL-None_TR-None_G-NONE_P-NONE_S-NONE,ðŸŒ¶ï¸ || US || ASC+ || ->CC141 || VIDEO Only || US+CA || 0% EXISTING CAP || 7C || 07/08.24  Ad set,VIDEO,"$3,763","206,860",2025-02-21,2025-03-19,26
16,CB_2025_Jan_FB_3723_SO_V18_4x5_IMG_EN_New_C-NONE_Evergreen_CTA-SALE_Angle-W_M-NONE_VL-None_G-NONE_P-NONE_S-NONE,ðŸŒ¶ï¸ || US || ASC+ || ->CC141 || VIDEO Only || US+CA || 0% EXISTING CAP || 7C || 07/08.24  Ad set,SHARE,"$3,709","251,707",2025-02-24,2025-02-27,3
17,CB_2025_Jan_FB_3740_SO-DP_V03_4x5_IMG_EN_Opti_C-Headline_Evergreen_CTA-NONE_Angle-W_M-NONE_VL-None_G-NONE_P-OG_S-NONE_3608V03,ðŸŒ¶ï¸ || US || ASC+ || ->CC141 || VIDEO Only || US+CA || 0% EXISTING CAP || 7C || 07/08.24  Ad set,SHARE,"$3,638","222,909",2025-02-04,2025-03-03,27
18,CB_2024_Nov_FB_3264_LZ_V29_4x5_VID_EN_Opti_C-NegativeMark_Sale_CTA-BF_Angle-W-B_M-LRNS_VL-30s_G-M_P-OG_S-NONE,ðŸŒ¶ï¸ || US || ASC+ || ->CC141 || VIDEO Only || US+CA || 0% EXISTING CAP || 7C || 07/08.24  Ad set,VIDEO,"$3,230","163,922",2024-12-04,2025-03-27,113
19,CB_2025_Jan_FB_3723_SO_V07_4x5_IMG_EN_New_C-NONE_Evergreen_CTA-SALE_Angle-W_M-NONE_VL-None_G-NONE_P-NONE_S-NONE,ðŸŒ¶ï¸ || US || ASC+ || ->CC141 || VIDEO Only || US+CA || 0% EXISTING CAP || 7C || 07/08.24  Ad set,SHARE,"$2,890","175,120",2025-02-04,2025-03-27,51
20,CB_2024_Sep_FB_3175_DA-KB_V04_1x1_IMG_EN_New_C-ADVRT_Evergreen_CTA-NONE_Angle-W_M-NONE_VL-None_G-NONE_P-CBV2_S-NONE_blog_colonbroomvsmammoth_cv_en,CBV2 || Advantage+ || Advertorial || Higher pricing || US || 0% EXISTING CAP || BROAD || 7C || 20/01/25  Campaign Ad set,SHARE,"$2,556","100,798",2025-01-20,2025-03-27,66
21,CB_2025_Feb_FB_3827_LZ_V04_1x1_IMG_EN_Opti_C-Headline_Evergreen_CTA-SALE_Angle-W_M-NONE_VL-None_G-M_P-CBV2_S-NONE_FB3779V02,CBV2 || US || Manual Bid: ROAS GOAL: 1.00 -> 1.1 || 7DC || 22/01/2025,SHARE,"$2,524","80,422",2025-02-18,2025-03-27,37
22,CB_2024_Jul_FB_3043_VK-DP_V03_9x16_VID_EN_Opti_C-Dance_CTA-SMR_Pain-W-B_M-POW_VL-30s_TR-None_G-M_P-OG_S-WHAT_FB3030V01,ðŸŒ¶ï¸ || US || ASC+ || ->CC141 || VIDEO Only || US+CA || 0% EXISTING CAP || 7C || 07/08.24  Ad set,VIDEO,"$2,207","130,576",2024-08-27,2025-03-03,188
23,CB_2024_Jan_FB_2764_RS_V04_9x16_VID_EN_Opti_C-SingleTesti_CTA-SALE_Pain-W_M-TRC_VL-45s_TR-None_G-F_P-OG_S-MOON_FB2263V04,EU (UK) || 2764 || Trinity Results Too Fast || 1C || 08/01/2025w02,VIDEO,"$2,002","69,276",2025-01-08,2025-03-27,78
24,CB_2023_May_FB_2263_MB_V04_9x16_VID_EN_New_C-Sale_CTA-SMR_Pain-W_M-JOG_VL-45s_TR-None_G-M-F_P-None_S-Moon,ðŸŒ¶ï¸ || US || ASC+ || ->CC141 || VIDEO Only || US+CA || 0% EXISTING CAP || 7C || 07/08.24  Ad set,VIDEO,"$1,817","59,756",2024-08-07,2025-03-27,232
25,CB_2025_Feb_FB_3811_DT_V04_9x16_VID_EN_Opti_C-Sale_Sale_CTA-70_Angle-W_M-JOG_VL-45s_G-M-F_P-OG_S-Moon_FB2263V04,3811 - #133 Green screen timeframe hooks || Enhancements: OFF || CBV1 || Batch 1 || 7C || 19/02/25w08 || Kostas,VIDEO,"$1,599","45,202",2025-02-19,2025-03-11,20
26,CB_2025_Jan_FB_3723_SO_V17_4x5_IMG_EN_New_C-NONE_Evergreen_CTA-SALE_Angle-W_M-NONE_VL-None_G-NONE_P-NONE_S-NONE,3723 - Notion Idea #92 MAN BOOBS || Enhancements: OFF || CBV1 || Batch 4 || 1C || 28/01/25w05 || Kostas,SHARE,"$1,548","101,123",2025-01-28,2025-03-07,38
27,CB_2025_Jan_FB_3723_SO_V18_4x5_IMG_EN_New_C-NONE_Evergreen_CTA-SALE_Angle-W_M-NONE_VL-None_G-NONE_P-NONE_S-NONE,3723 - Notion Idea #92 MAN BOOBS || Enhancements: OFF || CBV1 || Batch 4 || 1C || 28/01/25w05 || Kostas,SHARE,"$1,526","102,194",2025-01-28,2025-03-07,38
28,CB_2024_Sep_FB_3175_DA-KB_V03_1x1_IMG_EN_New_C-ADVRT_Evergreen_CTA-NONE_Angle-W_M-NONE_VL-None_G-NONE_P-CBV2_S-NONE_blog_colonbroomvsmammoth_cv_en,CBV2 || Advantage+ || Advertorial || Higher pricing || US || 0% EXISTING CAP || BROAD || 7C || 20/01/25  Campaign Ad set,SHARE,"$1,452","49,420",2025-01-20,2025-03-27,66
29,CB_2023_Oct_FB_2516_VK_V13_9x16_VID_EN_Opti_C-Benefits_CTA-AUTUM_Pain-W-B_M-PASQ_VL-30s_TR-None_G-M_P-Plan_S-WHAT,ðŸŒ¶ï¸ || US || ASC+ || ->CC141 || VIDEO Only || US+CA || 0% EXISTING CAP || 7C || 07/08.24  Ad set,VIDEO,"$1,400","55,210",2024-12-19,2025-03-27,98
30,CB_2024_Jan_FB_2764_RS_V04_9x16_VID_EN_Opti_C-SingleTesti_CTA-SALE_Pain-W_M-TRC_VL-45s_TR-None_G-F_P-OG_S-MOON_FB2263V04_Page_Personal_Coach,AU || Page: Branded & 3rd Party || 2764 || Trinity Results Too Fast || 1C || 10/01/2025w02,VIDEO,"$1,370","33,451",2025-01-10,2025-03-27,76
31,CB_2025_Jan_FB_3747_CHUB-AA_V03_9x16_IMG_EN_Opti_C-NONE_CTA-NONE_Angle-Sale_M-NONE_VL-None_TR-None_G-NONE_P-OG_S-NONE,3747 Clean Sale [HB winner ITR] CHUB || Enhancements: OFF || CBV1 || Batch Ä… || 1C || 02/02/25w06 || Kostas,SHARE,"$1,314","56,659",2025-02-02,2025-03-27,53
32,CB_2025_Feb_FB_3827_LZ_V01_1x1_IMG_EN_Opti_C-Headline_Evergreen_CTA-NONE_Angle-W_M-NONE_VL-None_G-M_P-CBV2_S-NONE_FB3723V04,CBV2 || US || Manual Bid: ROAS GOAL: 1.00 -> 1.1 || 7DC || 22/01/2025,SHARE,"$1,299","72,627",2025-02-18,2025-03-27,37
33,CB_2025_Jan_FB_3656_JT_V02_4x5_IMG_EN_New_C-Headline_Seasonal_CTA-70_Angle-W_M-NONE_VL-None_G-NONE_P-OG_S-NONE,ðŸŒ¶ï¸ || US || ASC+ || ->CC141 || VIDEO Only || US+CA || 0% EXISTING CAP || 7C || 07/08.24  Ad set,SHARE,"$1,248","57,632",2025-01-13,2025-03-04,50
34,CB_2025_Jan_FB_3766_SO_V01_4x5_IMG_EN_Opti_C-Headline_Evergreen_CTA-NONE_Angle-W-B-C_M-NONE_VL-None_G-NONE_P-NONE_S-NONE_3700V08,ðŸŒ¶ï¸ || US || ASC+ || ->CC141 || VIDEO Only || US+CA || 0% EXISTING CAP || 7C || 07/08.24  Ad set,SHARE,"$1,115","81,729",2025-02-18,2025-02-27,9
35,CB_2023_May_FB_2103_MB_V02_9x16_VID_EN_Opti_C-Sale_CTA-SMR_Pain-W_M-JOG_VL-30s_TR-None_G-M-F_P-None_S-What,US || Manual Bid || BFCM || ROAS GOAL: 1.4 || 1C || 15/11/24,VIDEO,"$1,070","35,929",2024-11-15,2025-02-27,104
36,CB_2025_Jan_FB_3779_VK-DP_V02_1x1_VID_EN_Opti_C-BulletPoints_Evergreen_CTA-70_Angle-W-B-C_M-NONE_VL-None_G-F_P-OG_S-NEW_FB3705V02,3779 - opti 3705 || Enhancements: OFF || CBV1 || Batch 1 || 1C || 04/02/25w06 || Kostas,SHARE,$964,"59,385",2025-02-04,2025-03-20,44
37,CB_2025_Jan_FB_3779_VK-DP_V02_1x1_VID_EN_Opti_C-BulletPoints_Evergreen_CTA-70_Angle-W-B-C_M-NONE_VL-None_G-F_P-OG_S-NEW_FB3705V02,US || Manual Bid || CC119 || 7C || 28/02/25,SHARE,$963,"76,068",2025-02-28,2025-03-04,4
38,CB_2025_Jan_FB_3779_VK-DP_V02_1x1_VID_EN_Opti_C-BulletPoints_Evergreen_CTA-70_Angle-W-B-C_M-NONE_VL-None_G-F_P-OG_S-NEW_FB3705V02.png,CB || US || Funnel B: Shopify || 7DC || 2nd try || 26/02/2025,SHARE,$892,"32,834",2025-02-26,2025-03-04,6
39,CB_2025_Jan_FB_3723_SO_V04_4x5_IMG_EN_New_C-NONE_Evergreen_CTA-SALE_Angle-W_M-NONE_VL-None_G-NONE_P-NONE_S-NONE.png,CB || US || Funnel A: React || 7DC || 2nd try || 26/02/2025,SHARE,$877,"51,031",2025-02-26,2025-03-04,6
40,CB_2025_Jan_FB_3723_SO_V07_4x5_IMG_EN_New_C-NONE_Evergreen_CTA-SALE_Angle-W_M-NONE_VL-None_G-NONE_P-NONE_S-NONE,US || Manual Bid || CC119 || 7C || 28/02/25,SHARE,$865,"69,221",2025-02-28,2025-03-04,4
41,CB_2025_Jan_FB_3742_SO-DP-KB_V06_4x5_IMG_EN_Opti_C-NONE_Evergreen_CTA-SALE_Angle-W_M-NONE_VL-None_G-NONE_P-CBV2_S-NONE3665V01,CBV2 || US || Manual Bid: ROAS GOAL: 1.00 -> 1.1 || 7DC || 22/01/2025,SHARE,$812,"30,816",2025-02-11,2025-03-27,44
42,CB_2023_Aug_FB_2295_MB_V01_1x1_VID_EN_Opti_C-GIF_CTA-CTA_Pain-W-B_M-None_VL-10s_TR-None_G-None_P-None_S-None,CA || COST CAP 92->93 || 7C || 10/05/24 || V1,VIDEO,$806,"41,288",2024-05-10,2025-02-27,293
43,CB_2025_Feb_FB_3827_LZ_V04_1x1_IMG_EN_Opti_C-Headline_Evergreen_CTA-SALE_Angle-W_M-NONE_VL-None_G-M_P-CBV2_S-NONE_FB3779V02,3827 - V2 img winner opti || Batch 2 || 7C || 18/02/2025w08,SHARE,$778,"47,770",2025-02-18,2025-03-07,17
44,CB_2025_Jan_FB_3662_CHUB_V01_1x1_IMG_EN_New_C-NONE_CTA-NONE_Angle-C_M-NONE_VL-None_TR-None_G-NONE_P-NONE_S-NONE.jpg,ðŸŒ¶ï¸ || US || ASC+ || ->CC141 || VIDEO Only || US+CA || 0% EXISTING CAP || 7C || 07/08.24  Ad set,SHARE,$731,"36,650",2025-01-13,2025-03-04,50
45,CB_2025_Jan_FB_3748_VK-DP_V01_4x5_IMG_EN_New_C-BulletPoints_Sale_CTA-NY_Angle-W-B-C_M-NONE_VL-None_G-M_P-OG_S-NONE,GLP-1 ðŸ’œ || ASC+ || US || 5% EXISTING CAP || 7C || 20/02/25 . Ad set,SHARE,$718,"26,617",2025-02-24,2025-03-15,19
46,CB_2024_Jan_FB_2784_RS_V02_9x16_VID_EN_Opti_C-Pointing_CTA-SALE_Pain-W_M-JOG_VL-30s_TR-None_G-F_P-OG_S-OLLIE_FB2181V01,CBV2 || EU (UK) || ðŸ’° Advantage+ || US || BROAD || 7C || Existing_customer_5% || 15/12/24 Ad set,VIDEO,$664,"27,198",2025-01-09,2025-03-27,77
47,CB_2024_Feb_FB_2814_MB-DP_V05_1x1_IMG_EN_New_C-WeightLoss_CTA-None_Pain-W-B-C_M-NONE_VL-None_TR-None_G-NONE_P-V2_S-NONE,EU (UK) || clinically proven opti || 1C || 23/01/2025w04,SHARE,$663,"32,010",2025-01-23,2025-03-10,46
48,CB_2024_Dec_FB_3619_VK-JT_V02_4x5_VID_EN_New_C-BulletPoints_Sale_CTA-NY_Angle-W-B-C_M-NONE_VL-None_G-NONE_P-OG_S-NONE,ðŸŒ¶ï¸ || US || ASC+ || ->CC141 || VIDEO Only || US+CA || 0% EXISTING CAP || 7C || 07/08.24  Ad set,SHARE,$599,"32,123",2024-12-27,2025-03-27,90
49,CB_2025_Jan_FB_3723_SO_V04_4x5_IMG_EN_New_C-NONE_Evergreen_CTA-SALE_Angle-W_M-NONE_VL-None_G-NONE_P-NONE_S-NONE,US || Manual Bid || CC119 || 7C || 28/02/25,SHARE,$591,"61,846",2025-02-28,2025-03-04,4
50,CB_2024_Dec_FB_3592_VK-DP_V10_4x5_VID_EN_New_C-BulletPoints_Sale_CTA-SALE_Angle-W-B-C_M-NONE_VL-30s_G-F_P-OG_S-NEW - Copy,ðŸŒ¶ï¸ || US || ASC+ || ->CC141 || VIDEO Only || US+CA || 0% EXISTING CAP || 7C || 07/08.24  Ad set,VIDEO,$572,"29,964",2024-12-21,2025-03-27,96
51,CB_2025_Feb_FB_3863_DT-DP_V03_9x16_VID_EN_New_C-Trend_Sale_CTA-70_Angle-W_M-POW_VL-30s_G-M_P-OG_S-NEW.mp4,3863 - Aaron man boobs vid || Enhancements: OFF || CBV1 || Batch 1 || 7C || 26/02/25w09 || Valentinas,VIDEO,$568,"28,491",2025-02-26,2025-03-15,17
52,CB_2023_Jul_FB_2217_IB_V04_9x16_VID_EN_Opti_C-Pointing_CTA-SMR_Pain-W-B_M-TRC_VL-30s_TR-None_G-F_P-None_S-FRIGGA,US || Manual Bid || BFCM || COST CAP 91 || 1C || 15/11/24,VIDEO,$553,"20,691",2024-11-15,2025-02-27,104
53,CB_2025_Feb_FB_3850_DT-DP_V04_9x16_VID_EN_Opti_C-Dance_Sale_CTA-70_Angle-W_M-POW_VL-30s_G-M_P-OG_S-WOOD_FB2176V11.mp4,3850 - Man boobs/dad bod opti on videos || Enhancements: OFF || CBV1 || Batch 1 || 7C || 26/02/25w09 || Valentinas,VIDEO,$545,"29,717",2025-02-26,2025-03-03,5
54,CB_2023_Jul_FB_2217_IB_V04_9x16_VID_EN_Opti_C-Pointing_CTA-SMR_Pain-W-B_M-TRC_VL-30s_TR-None_G-F_P-None_S-FRIGGA,US || Manual Bid || BFCM || COST CAP 71 || 1C || 15/11/24,VIDEO,$529,"19,156",2024-11-15,2025-03-27,132
55,CB_2025_Feb_FB_3818_LZ-VU_V04_1x1_IMG_EN_Opti_C-Headline_Evergreen_CTA-NONE_Angle-Cort_M-NONE_VL-None_G-NONE_P-NONE_S-NONE_FB3251V01,3818 - It_s not cheap Months+holidays: April || Enhancements: OFF || CBV1 || Batch 1 || 7DC || 13/02/25w07 || Kostas,SHARE,$505,"21,011",2025-02-13,2025-02-28,15
56,CB_2025_Jan_FB_3739_DT_V02_4x5_VID_EN_Opti_C-Pointing_Sale_CTA-70_Angle-W_M-MIX_VL-30s_G-MF_P-GLP1_S-FRIGGA_FB2217V05,GLP-1 ðŸ’œ || ASC+ || US || 5% EXISTING CAP || 7C || 20/02/25 . Ad set,SHARE,$474,"23,140",2025-02-24,2025-03-06,10
57,CB_2025_Feb_FB_3833_VK_V04_9x16_VID_EN_New_C-BulletPoints_Evergreen_CTA-70_Angle-W-B-C_M-PASQ_VL-15s_G-M_P-OG_S-WHAT.mp4,3833 - do not mix -VK || Enhancements: OFF || CBV1 || Batch 1 || 7C || 26/02/25w09 || Valentinas,VIDEO,$470,"26,368",2025-02-26,2025-03-08,10
58,CB_2025_Jan_FB_3723_SO_V04_4x5_IMG_EN_New_C-NONE_Evergreen_CTA-SALE_Angle-W_M-NONE_VL-None_G-NONE_P-NONE_S-NONE.png,CBV2 || AU || ðŸ’° Advantage+ || US || BROAD || 7C || Existing_customer_5% || 19/12/24 Ad set,SHARE,$469,"30,035",2025-02-25,2025-03-27,30
59,CB_2023_Dec_FB_2712_RS-DP_V02_1x1_VID_EN_Opti_C-WrittenTesti_CTA-SALE_Pain-W-B-C_M-NONE_VL-None_TR-None_G-NONE_P-V2_S-NONE_FB2227V08,CBV2 || EU (UK) || ðŸ’° Advantage+ || US || BROAD || 7C || Existing_customer_5% || 15/12/24 Ad set,SHARE,$468,"21,533",2024-12-15,2025-03-27,102
60,CB_2025_Feb_FB_3862_LZ_V04_1x1_IMG_EN_New_C-Testimonial_Evergreen_CTA-NONE_Angle-W-B_M-NONE_VL-None_G-NONE_P-OG_S-NONE.png,3862 - sleek looking ads || Enhancements: OFF || CBV1 || Batch 1 || 7C || 26/02/25w09 || Valentinas,SHARE,$448,"15,554",2025-02-26,2025-03-03,5
61,CB_2025_Feb_FB_3821_SO-KB-JG_V09_4x5_IMG_EN_Opti_C-NONE_Evergreen_CTA-SALE_Angle-W_M-NONE_VL-None_G-NONE_P-NONE_S-NONE_FB3723V07,3821 - Man boobs Opti || Enhancements: OFF || CBV1 || Batch 3 || 7C || 19/02/25w08 || Kostas,SHARE,$414,"21,441",2025-02-19,2025-03-09,18
62,CB_2025_Feb_FB_3793_VK-DP_V01_1x1_VID_EN_Opti_C-BulletPoints_Evergreen_CTA-70_Angle-W-B-C_M-NONE_VL-None_G-F_P-OG_S-NEW_FB3705V02,3793 -  3705 test opti || Enhancements: OFF || CBV1 || Batch 1 || 1C || 11/02/25w07 || Kostas,SHARE,$394,"20,643",2025-02-11,2025-02-28,17
63,CB_2024_Aug_FB_3097_VK-DP_V03_9x16_VID_EN_Opti_C-Benefits_CTA-SMR_Pain-W-B_M-MIX_VL-45s_TR-None_G-MF_P-OG_S-WHAT_FB2516V13,CB || US || Funnel A: React || 7DC || 2nd try || 26/02/2025,VIDEO,$390,"18,100",2025-02-26,2025-03-04,6
64,CB_2024_Oct_FB_3252_VK-DP_V04_4x5_VID_EN_Opti_C-MakingOf_Evergreen_CTA-SALE_Angle-W-B-C_M-JOG_VL-45s_G-F_P-OG_S-MOON_FB3090V02,ðŸŒ¶ï¸ || US || ASC+ || ->CC141 || VIDEO Only || US+CA || 0% EXISTING CAP || 7C || 07/08.24  Ad set,VIDEO,$382,"16,349",2024-11-07,2025-03-27,140
65,CB_2024_Aug_FB_3090_DT-DP_V02_9x16_VID_EN_Opti_C-MakingOf_CTA-CTA_Pain-W-B-C_M-POW_VL-45s_TR-None_G-M_P-OG_S-Moon_FB3029V04,CBV2 || EU (UK) || ðŸ’° Advantage+ || US || BROAD || 7C || Existing_customer_5% || 15/12/24 Ad set,SHARE,$371,"18,892",2024-12-19,2025-03-27,98
66,CB_2023_May_FB_2263_MB_V04_9x16_VID_EN_New_C-Sale_CTA-SMR_Pain-W_M-JOG_VL-45s_TR-None_G-M-F_P-None_S-Moon,CBV2 || AU || ðŸ’° Advantage+ || US || BROAD || 7C || Existing_customer_5% || 19/12/24 Ad set,VIDEO,$371,"9,911",2024-12-19,2025-03-27,98
67,CB_2025_Feb_FB_3827_LZ_V01_1x1_IMG_EN_Opti_C-Headline_Evergreen_CTA-NONE_Angle-W_M-NONE_VL-None_G-M_P-CBV2_S-NONE_FB3723V04,3827 - V2 img winner opti || Batch 1 || 7C || 18/02/2025w08,SHARE,$371,"31,010",2025-02-18,2025-02-25,7
68,CB_2025_Feb_FB_3817_SO_V01_4x5_IMG_EN_Opti_C-NONE_Evergreen_CTA-SALE_Angle-W_M-NONE_VL-None_G-NONE_P-NONE_S-NONE_FB3723V07,CBV2 || EU (UK) || ðŸ’° Advantage+ || US || BROAD || 7C || Existing_customer_5% || 15/12/24 Ad set,SHARE,$365,"22,040",2025-02-14,2025-03-27,41
69,CB_2025_Feb_FB_3824_CHUB_V01_9x16_VID_EN_New_C-NONE_CTA-NONE_Angle-None_M-NONE_VL-None_TR-None_G-NONE_P-NONE_S-NONE,3824 - Testimonial (I Regret) CHUB || Enhancements: OFF || CBV1 || Batch 1 || 7C || 25/02/25w09 || Valentinas,VIDEO,$356,"12,326",2025-02-25,2025-02-28,3
70,CB_2025_Jan_FB_3723_SO_V04_4x5_IMG_EN_New_C-NONE_Evergreen_CTA-SALE_Angle-W_M-NONE_VL-None_G-NONE_P-NONE_S-NONE.png,CB || US || Funnel B: Shopify || 7DC || 2nd try || 26/02/2025,SHARE,$350,"21,573",2025-02-26,2025-03-04,6
71,CB_2024_Sep_FB_3175_DA-KB_V01_1x1_IMG_EN_New_C-ADVRT_Evergreen_CTA-NONE_Angle-W_M-NONE_VL-None_G-NONE_P-CBV2_S-NONE_blog_colonbroomvsmammoth_cv_en,CBV2 || Advantage+ || Advertorial || Higher pricing || US || 0% EXISTING CAP || BROAD || 7C || 20/01/25  Campaign Ad set,SHARE,$349,"13,362",2025-01-20,2025-03-27,66
72,CB_2023_Jul_FB_2217_IB_V04_9x16_VID_EN_Opti_C-Pointing_CTA-SMR_Pain-W-B_M-TRC_VL-30s_TR-None_G-F_P-None_S-FRIGGA,CBV2 || AU || ðŸ’° Advantage+ || US || BROAD || 7C || Existing_customer_5% || 19/12/24 Ad set,VIDEO,$348,"10,245",2024-12-19,2025-03-24,95
73,CB_2025_Feb_FB_3817_SO_V01_4x5_IMG_EN_Opti_C-NONE_Evergreen_CTA-SALE_Angle-W_M-NONE_VL-None_G-NONE_P-NONE_S-NONE_FB3723V07,CBV2 || AU || ðŸ’° Advantage+ || US || BROAD || 7C || Existing_customer_5% || 19/12/24 Ad set,SHARE,$341,"23,755",2025-02-14,2025-03-27,41
74,CB_2025_Feb_FB_3818_LZ-VU_V04_1x1_IMG_EN_Opti_C-Headline_Evergreen_CTA-NONE_Angle-Cort_M-NONE_VL-None_G-NONE_P-NONE_S-NONE_FB3251V01,US || Manual Bid || CC119 || 7C || 28/02/25,SHARE,$319,"17,517",2025-02-28,2025-03-04,4
75,CB_2025_Feb_FB_3856_CHUB-KZ_V04_9x16_VID_EN_New_C-NONE_CTA-NONE_Angle-None_M-M_VL-None_TR-None_G-NONE_P-NONE_S-NONE.mp4,3856 - What's more toxic CHUB || Enhancements: OFF || CBV1 || Batch 2 || 7C || 25/02/25w09 || Valentinas,VIDEO,$307,"12,284",2025-02-25,2025-02-28,3
76,CB_2025_Jan_FB_3723_SO_V07_4x5_IMG_EN_New_C-NONE_Evergreen_CTA-SALE_Angle-W_M-NONE_VL-None_G-NONE_P-NONE_S-NONE,CBV2 || US || Manual Bid: ROAS GOAL: 1.00 -> 1.1 || 7DC || 22/01/2025,SHARE,$299,"13,684",2025-02-11,2025-03-27,44
77,CB_2023_Dec_FB_2696_RS_V03_9x16_VID_EN_Opti_C-Sale_CTA-NY65_Pain-W-B_M-JANW_VL-30s_TR-None_G-M_P-OG_S-WHAT_FB2284V05,CBV2 || AU || ðŸ’° Advantage+ || US || BROAD || 7C || Existing_customer_5% || 19/12/24 Ad set,VIDEO,$298,"11,323",2025-01-13,2025-03-27,73
78,CB_2023_Jul_FB_2217_IB_V04_9x16_VID_EN_Opti_C-Pointing_CTA-SMR_Pain-W-B_M-TRC_VL-30s_TR-None_G-F_P-None_S-FRIGGA,CBV2 || EU (UK) || ðŸ’° Advantage+ || US || BROAD || 7C || Existing_customer_5% || 15/12/24 Ad set,VIDEO,$292,"13,496",2024-12-18,2025-03-27,99
79,CB_2023_Dec_FB_2712_RS-DP_V02_1x1_VID_EN_Opti_C-WrittenTesti_CTA-SALE_Pain-W-B-C_M-NONE_VL-None_TR-None_G-NONE_P-V2_S-NONE_FB2227V08,CBV2 || AU || ðŸ’° Advantage+ || US || BROAD || 7C || Existing_customer_5% || 19/12/24 Ad set,SHARE,$286,"10,204",2024-12-19,2025-03-27,98
80,CB_2024_Dec_FB_3601_VK-DP_V09_4x5_VID_EN_Opti_C-Dance_CTA-NY_Pain-W-B_M-JOG_VL-30s_TR-None_G-F_P-OG_S-WHAT_FB3045V01,CBV2 || AU || ðŸ’° Advantage+ || US || BROAD || 7C || Existing_customer_5% || 19/12/24 Ad set,SHARE,$285,"10,108",2025-01-03,2025-03-27,83
81,CB_2023_May_FB_2103_MB_V02_9x16_VID_EN_Opti_C-Sale_CTA-SMR_Pain-W_M-JOG_VL-30s_TR-None_G-M-F_P-None_S-What,US || Manual Bid || BFCM || COST CAP 71 || 1C || 15/11/24,VIDEO,$274,"10,105",2024-11-15,2025-03-27,132
82,CB_2025_Feb_FB_3865_SO-VU_V04_4x5_IMG_EN_Opti_C-NONE_Evergreen_CTA-NONE_Angle-Cort_M-NONE_VL-None_G-NONE_P-OG_S-NONE-1.png,3865 - HELLO! Idea Nr.23 || Enhancements: OFF || CBV1 || Batch 1 || 7C || 26/02/25w09 || Valentinas,SHARE,$267,"15,458",2025-02-26,2025-03-03,5
83,CB_2025_Feb_FB_3864_DT-VU_V02_1x1_IMG_EN_Opti_C-Trend_Sale_CTA-65_Angle-W_M-NONE_VL-None_G-NONE_P-OG_S-NONE.png,3864 - weight loss event towards man boobs || Enhancements: OFF || CBV1 || Batch 1 || 7C || 26/02/25w09 || Valentinas,SHARE,$267,"13,549",2025-02-26,2025-03-03,5
84,CB_2025_Feb_FB_3854_LZ-DP_V05_1x1_IMG_EN_Opti_C-Headline_Evergreen_CTA-NONE_Angle-W_M-NONE_VL-None_G-M_P-OG_S-NONE_FB3723V07.png,3854 - Man boobs opti || Enhancements: OFF || CBV1 || Batch 1 || 7C || 26/02/25w09 || Valentinas,SHARE,$243,"14,258",2025-02-26,2025-03-03,5
85,CB_2025_Feb_FB_3856_CHUB-KZ_V03_9x16_VID_EN_New_C-NONE_CTA-NONE_Angle-None_M-M_VL-None_TR-None_G-NONE_P-NONE_S-NONE.mp4,3856 - What's more toxic CHUB || Enhancements: OFF || CBV1 || Batch 1 || 7C || 25/02/25w09 || Valentinas,VIDEO,$237,"9,477",2025-02-25,2025-02-28,3
86,CB_2025_Feb_FB_3845_VK_V02_9x16_VID_EN_New_C-BulletPoints_Evergreen_CTA-70_Angle-W-B-C_M-POW_VL-15s_G-M_P-OG_S-NEW.mp4,3849 - #135 My routine to lose weight - VK || Enhancements: OFF || CBV1 || Batch 1 || 7C || 26/02/25w09 || Valentinas,VIDEO,$222,"11,843",2025-02-26,2025-02-28,2
87,CB_2025_Jan_FB_3701_CHUB_V01_9x16_VID_EN_New_C-NONE_CTA-NONE_Angle-C_M-NONE_VL-None_TR-None_G-M_P-OG_S-NONE,3701 - 25 Day challenge UGC CHUB || Enhancements: OFF || CBV1 || Batch 1 || 7C || 25/02/25w09 || Valentinas,VIDEO,$216,"7,065",2025-02-25,2025-02-28,3
88,CB_2025_Feb_FB_3864_DT-VU_V03_1x1_IMG_EN_Opti_C-Trend_Sale_CTA-65_Angle-W_M-NONE_VL-None_G-NONE_P-OG_S-NONE.png,3864 - weight loss event towards man boobs || Enhancements: OFF || CBV1 || Batch 1 || 7C || 26/02/25w09 || Valentinas,SHARE,$210,"10,284",2025-02-26,2025-03-03,5
89,CB_2025_Feb_FB_3857_DT-JG_V03_9x16_VID_EN_New_C-NONE_Evergreen_CTA-NONE_Angle-W_M-POW_VL-30s_G-M_P-OG_S-NEW.mp4,3857 - #5 Fiber First || Enhancements: OFF || CBV1 || Batch 1 || 7C || 25/02/25w09 || Valentinas,VIDEO,$207,"10,063",2025-02-25,2025-02-28,3
90,CB_2025_Feb_FB_3854_LZ-DP_V01_1x1_IMG_EN_Opti_C-Headline_Evergreen_CTA-NONE_Angle-W_M-NONE_VL-None_G-M_P-OG_S-NONE_FB3723V07.png,3854 - Man boobs opti || Enhancements: OFF || CBV1 || Batch 1 || 7C || 26/02/25w09 || Valentinas,SHARE,$204,"12,503",2025-02-26,2025-03-04,6
91,CB_2025_Feb_FB_3844_CHUB_V04_9x16_VID_EN_New_C-NONE_CTA-NONE_Angle-None_M-NONE_VL-None_TR-None_G-NONE_P-NONE_S-NONE.mp4,3844 - Do not do this CHUB || Enhancements: OFF || CBV1 || Batch 1 || 7C || 25/02/25w09 || Valentinas,VIDEO,$201,"7,716",2025-02-25,2025-02-28,3
92,CB_2025_Jan_FB_3779_VK-DP_V04_1x1_VID_EN_Opti_C-BulletPoints_Evergreen_CTA-70_Angle-W-B-C_M-NONE_VL-None_G-F_P-OG_S-NEW_FB3705V02,3779 - opti 3705 || Enhancements: OFF || CBV1 || Batch 1 || 1C || 04/02/25w06 || Kostas,SHARE,$200,"10,649",2025-02-04,2025-03-20,44
93,CB_2025_Feb_FB_3861_LZ-DP_V02_1x1_IMG_EN_New_C-Headline_Evergreen_CTA-NONE_Angle-W_M-NONE_VL-None_G-M_P-OG_S-NONE.png,3861 - Man boobs transformation img || Enhancements: OFF || CBV1 || Batch 1 || 7C || 26/02/25w09 || Valentinas,SHARE,$197,"9,873",2025-02-26,2025-03-03,5
94,CB_2025_Jan_FB_3742_SO-DP-KB_V06_4x5_IMG_EN_Opti_C-NONE_Evergreen_CTA-SALE_Angle-W_M-NONE_VL-None_G-NONE_P-CBV2_S-NONE3665V01,CBV2 || EU (UK) || ðŸ’° Advantage+ || US || BROAD || 7C || Existing_customer_5% || 15/12/24 Ad set,SHARE,$189,"9,701",2025-02-18,2025-03-18,28
95,CB_2025_Feb_FB_3827_LZ_V04_1x1_IMG_EN_Opti_C-Headline_Evergreen_CTA-SALE_Angle-W_M-NONE_VL-None_G-M_P-CBV2_S-NONE_FB3779V02,3827 - V2 img winner opti || Batch 2 || 7C || 18/02/2025w08,SHARE,$189,"10,262",2025-02-18,2025-02-25,7
96,CB_2025_Jan_FB_3718_CHUB_V05_4x5_IMG_EN_Opti_C-NONE_CTA-NONE_Angle-C_M-NONE_VL-None_TR-None_G-M_P-OG_S-NONE,3718_CHUB || Batch 1 || 7DC || 12/02/2025w07,SHARE,$186,"10,363",2025-02-12,2025-02-25,13
97,CB_2025_Feb_FB_3865_SO-VU_V01_4x5_IMG_EN_Opti_C-NONE_Evergreen_CTA-NONE_Angle-Cort_M-NONE_VL-None_G-NONE_P-OG_S-NONE.png,3865 - HELLO! Idea Nr.23 || Enhancements: OFF || CBV1 || Batch 1 || 7C || 26/02/25w09 || Valentinas,SHARE,$185,"7,679",2025-02-26,2025-03-03,5
98,CB_2025_Feb_FB_3810_CHUB_V02_9x16_VID_EN_New_C-NONE_CTA-NONE_Angle-None_M-NONE_VL-None_TR-None_G-NONE_P-NONE_S-NONE.mp4,3810 - Educational Video CHUB || Enhancements: OFF || CBV1 || Batch 1 || 7C || 25/02/25w09 || Valentinas,VIDEO,$181,"6,963",2025-02-25,2025-02-28,3
99,CB_2025_Jan_FB_3718_CHUB_V05_4x5_IMG_EN_Opti_C-NONE_CTA-NONE_Angle-C_M-NONE_VL-None_TR-None_G-M_P-OG_S-NONE,US || Manual Bid || CC119 || 7C || 28/02/25,SHARE,$181,"10,976",2025-02-28,2025-03-04,4
100,CB_2025_Jan_FB_3762_LZ_V05_4x5_IMG_EN_Opti_C-NegativeMark_Evergreen_CTA-NONE_Angle-W_M-NONE_VL-None_G-NONE_P-GLP1_S-NONE_FB3251V01.png,3762 - Notion Idea #123 it's not cheap GLP1 || Enhancements: OFF || GLP-1 || Batch 1 || 7C || 20/02/25w09 || Valentinas,SHARE,$177,"9,190",2025-02-24,2025-03-18,22
101,CB_2025_Feb_FB_3816_VK-JT_V02_1x1_IMG_EN_New_C-BulletPoints_Evergreen_CTA-70_Angle-W-B-C_M-JOG_VL-None_G-NONE_P-OG_S-NEW_FB3656V02,3822 - OPTI 3656 -VK || Enhancements: OFF || CBV1 || Batch 1 || 7C || 19/02/25w08 || Kostas,SHARE,$177,"6,360",2025-02-19,2025-02-26,7
102,CB_2025_Feb_FB_3820_LZ_V01_9x16_VID_EN_Opti_C-Testimonial_Evergreen_CTA-SALE_Angle-W-B-C_M-TRC_VL-30s_G-F_P-OG_S-FRIGGA_FB2217V04,3820 - Calorie deficit hooks || Enhancements: OFF || CBV1 || Batch 1 || 7C || 19/02/25w08 || Kostas,VIDEO,$176,"9,742",2025-02-19,2025-02-26,7
103,CB_2025_Feb_FB_3861_LZ-DP_V04_1x1_IMG_EN_New_C-Headline_Evergreen_CTA-NONE_Angle-W_M-NONE_VL-None_G-M_P-OG_S-NONE.png,3861 - Man boobs transformation img || Enhancements: OFF || CBV1 || Batch 1 || 7C || 26/02/25w09 || Valentinas,SHARE,$176,"9,074",2025-02-26,2025-03-03,5
104,CB_2024_Feb_FB_2814_MB-DP_V07_1x1_IMG_EN_New_C-WeightLoss_CTA-CTA_Pain-W-B-C_M-NONE_VL-None_TR-None_G-F_P-V2_S-NONE_2410V06,EU (UK) || clinically proven opti || 1C || 23/01/2025w04,SHARE,$176,"7,837",2025-01-23,2025-03-10,46
105,CB_2024_Sep_FB_3175_DA-KB_V02_1x1_IMG_EN_New_C-ADVRT_Evergreen_CTA-NONE_Angle-W_M-NONE_VL-None_G-NONE_P-CBV2_S-NONE_blog_colonbroomvsmammoth_cv_en,CBV2 || Advantage+ || Advertorial || Higher pricing || US || 0% EXISTING CAP || BROAD || 7C || 20/01/25  Campaign Ad set,SHARE,$176,"10,056",2025-01-20,2025-03-27,66
106,CB_2025_Jan_FB_3764_LZ-RP_V02_9x16_VID_EN_New_C-BulletPoints_Evergreen_CTA-NONE_Angle-W_M-MAN_VL-45s_G-M_P-GLP1_S-NEW.mp4,3764 - Notion idea #128 Biggest mistakes || Enhancements: OFF || GLP-1 || Batch 1 || 7C || 20/02/25w09 || Valentinas,VIDEO,$169,"8,051",2025-02-24,2025-03-06,10
107,CB_2025_Feb_FB_3856_CHUB-KZ_V08_9x16_VID_EN_New_C-NONE_CTA-NONE_Angle-None_M-F_VL-None_TR-None_G-NONE_P-NONE_S-NONE.mp4,3856 - What's more toxic CHUB || Enhancements: OFF || CBV1 || Batch 3 || 7C || 25/02/25w09 || Valentinas,VIDEO,$167,"6,494",2025-02-25,2025-02-28,3
108,CB_2025_Jan_FB_3072_V02_4x5_IMG_EN_New_C-Headline_Seasonal_CTA-None_Angle-W_M-NONE_VL-None_G-NONE_P-OG_S-NONE,CBV2 || EU (UK) || ðŸ’° Advantage+ || US || BROAD || 7C || Existing_customer_5% || 15/12/24 Ad set,SHARE,$167,"8,372",2025-01-17,2025-03-14,56
109,CB_2025_Jan_FB_3751_VK-DP_V02_4x5_IMG_EN_New_C-BulletPoints_Sale_CTA-NY_Angle-W-B-C_M-NONE_VL-None_G-M_P-GLP1_S-NONE.jpg,3751 - opti 3608 GLP1 - VK-DP || Enhancements: OFF || GLP-1 || Batch 1 || 7C || 20/02/25w09 || Valentinas,SHARE,$167,"8,266",2025-02-24,2025-03-15,19
110,CB_2025_Jan_FB_3749_VK-DP_V01_4x5_IMG_EN_New_C-BulletPoints_Sale_CTA-NY_Angle-W-B-C_M-NONE_VL-None_G-M_P-GLP1_S-NONE.jpg,3749 - beer belly opti GLP1- VK=DP || Enhancements: OFF || GLP-1 || Batch 1 || 7C || 20/02/25w09 || Valentinas,SHARE,$167,"7,654",2025-02-24,2025-03-08,12
111,CB_2025_Feb_FB_3814_CHUB_V01_9x16_VID_EN_New_C-NONE_CTA-NONE_Angle-None_M-NONE_VL-None_TR-None_G-NONE_P-NONE_S-NONE.mp4,3814 - 5 Warning Signs CHUB || Enhancements: OFF || CBV1 || Batch 1 || 7C || 25/02/25w09 || Valentinas,VIDEO,$163,"6,233",2025-02-25,2025-02-28,3
112,CB_2024_Jan_FB_2762_IK_V05_1x1_IMG_EN_New_C-WrittenTesti_CTA-CTA_Pain-W-B-C_M-NONE_VL-None_TR-None_G-NONE_P-V2_S-NONE,CBV2 || EU (UK) || ðŸ’° Advantage+ || US || BROAD || 7C || Existing_customer_5% || 15/12/24 Ad set,SHARE,$150,"5,758",2024-12-15,2025-03-27,102
113,CB_2025_Feb_FB_3812_SO_V01_4x5_IMG_EN_Opti_C-NONE_Evergreen_CTA-SALE_Angle-W_M-NONE_VL-None_G-NONE_P-NONE_S-NONE_FB3723V07,3812 - 3723 Man Boobs Opti || Enhancements: OFF || CBV1 || Batch 1 || 1C || 11/02/25w07 || Kostas,SHARE,$149,"11,988",2025-02-11,2025-02-26,15
114,CB_2025_Jan_FB_3748_VK-DP_V01_4x5_IMG_EN_New_C-BulletPoints_Sale_CTA-NY_Angle-W-B-C_M-NONE_VL-None_G-M_P-OG_S-NONE.png - Copy,3748 - winner ads opti - GLP1 - VK-DP || Enhancements: OFF || GLP-1 || Batch 1 || 7C || 20/02/25w09 || Valentinas,SHARE,$148,"3,920",2025-02-24,2025-03-17,21
115,CB_2023_Jul_FB_2217_IB_V04_9x16_VID_EN_Opti_C-Pointing_CTA-SMR_Pain-W-B_M-TRC_VL-30s_TR-None_G-F_P-None_S-FRIGGA,US || Manual Bid || BFCM || COST CAP 81 || 1C || 15/11/24,VIDEO,$145,"5,151",2024-11-15,2025-03-16,121
116,CB_2025_Feb_FB_3784_SO-RP_V10_4x5_IMG_EN_Opti_C-Headline_Evergreen_CTA-NONE_Angle-W_M-NONE_VL-None_G-NONE_P-OG_S-NONE_FB3726V01,3784 - 3726 ad copy opti || Enhancements: OFF || CBV1 || Batch 2 || 1C || 09/02/25w07 || Kostas,SHARE,$145,"7,814",2025-02-09,2025-02-26,17
117,CB_2025_Feb_FB_3814_CHUB_V02_9x16_VID_EN_New_C-NONE_CTA-NONE_Angle-None_M-NONE_VL-None_TR-None_G-NONE_P-NONE_S-NONE.mp4,3814 - 5 Warning Signs CHUB || Enhancements: OFF || CBV1 || Batch 1 || 7C || 25/02/25w09 || Valentinas,VIDEO,$140,"5,433",2025-02-25,2025-02-28,3
118,CB_2025_Jan_FB_3741_LZ-JG_V01_4x5_IMG_EN_Opti_C-Headline_Evergreen_CTA-NONE_Angle-W_M-NONE_VL-None_G-NONE_P-CBV2_S-NONE_FB3357V01,CBV2 || US || Manual Bid: ROAS GOAL: 1.00 -> 1.1 || 7DC || 22/01/2025,SHARE,$138,"4,722",2025-01-22,2025-03-27,64
119,CB_2023_May_FB_2103_MB_V02_9x16_VID_EN_Opti_C-Sale_CTA-SMR_Pain-W_M-JOG_VL-30s_TR-None_G-M-F_P-None_S-What,US || Manual Bid || BFCM || COST CAP 91 || 1C || 15/11/24,VIDEO,$134,"4,791",2024-11-15,2025-02-27,104
120,CB_2025_Feb_FB_3861_LZ-DP_V01_1x1_IMG_EN_New_C-Headline_Evergreen_CTA-NONE_Angle-W_M-NONE_VL-None_G-M_P-OG_S-NONE.png,3861 - Man boobs transformation img || Enhancements: OFF || CBV1 || Batch 1 || 7C || 26/02/25w09 || Valentinas,SHARE,$130,"6,466",2025-02-26,2025-03-03,5
121,CB_2025_Feb_FB_3830_LZ_V02_9x16_VID_EN_New_C-Testimonial_Evergreen_CTA-SALE_Angle-W-B-C_M-GLAD_VL-15s_G-F_P-OG_S-NEW.mp4,3830 - I googled my symptoms || Enhancements: OFF || CBV1 || Batch 1 || 7C || 26/02/25w09 || Valentinas,VIDEO,$127,"5,053",2025-02-26,2025-02-28,2
122,CB_2025_Feb_FB_3866_VK-RP_V03_1x1_IMG_EN_New_C-BulletPoints_Evergreen_CTA-NONE_Angle-W-B-C_M-NONE_VL-None_G-NONE_P-OG_S-NEW.jpg,3866 - Sticky notes || Enhancements: OFF || CBV1 || Batch 1 || 7C || 26/02/25w09 || Valentinas,SHARE,$125,"5,440",2025-02-26,2025-02-28,2
123,CB_2022_Nov_FB_1218_RS_V15_9x16_IMG_EN_Opti_C-Sale_CTA-BLACK_Pain-W_M-NONE_VL-None FB1671V08,US || Manual Bid || BFCM || ROAS GOAL: 1.4 || 1C || 15/11/24,SHARE,$118,"2,660",2024-11-15,2025-02-27,104
124,CB_2025_Feb_FB_3865_SO-VU_V03_4x5_IMG_EN_Opti_C-NONE_Evergreen_CTA-NONE_Angle-Cort_M-NONE_VL-None_G-NONE_P-OG_S-NONE.png,3865 - HELLO! Idea Nr.23 || Enhancements: OFF || CBV1 || Batch 1 || 7C || 26/02/25w09 || Valentinas,SHARE,$112,"5,136",2025-02-26,2025-03-03,5
125,CB_2025_Feb_FB_3821_SO-KB-JG_V11_4x5_IMG_EN_Opti_C-NONE_Evergreen_CTA-SALE_Angle-W_M-NONE_VL-None_G-NONE_P-NONE_S-NONE_FB3723V07,3821 - Man boobs Opti || Enhancements: OFF || CBV1 || Batch 3 || 7C || 19/02/25w08 || Kostas,SHARE,$110,"6,558",2025-02-19,2025-03-09,18
126,CB_2025_Feb_FB_3810_CHUB_V03_9x16_VID_EN_New_C-NONE_CTA-NONE_Angle-None_M-NONE_VL-None_TR-None_G-NONE_P-NONE_S-NONE.mp4,3810 - Educational Video CHUB || Enhancements: OFF || CBV1 || Batch 1 || 7C || 25/02/25w09 || Valentinas,VIDEO,$109,"3,356",2025-02-25,2025-02-28,3
127,CB_2024_Jan_FB_2764_RS_V04_9x16_VID_EN_Opti_C-SingleTesti_CTA-SALE_Pain-W_M-TRC_VL-45s_TR-None_G-F_P-OG_S-MOON_FB2263V04_Page_Personal_Coach,CBV2 || AU || ðŸ’° Advantage+ || US || BROAD || 7C || Existing_customer_5% || 19/12/24 Ad set,VIDEO,$105,"1,974",2025-01-16,2025-03-27,70
128,CB_2025_Feb_FB_3856_CHUB-KZ_V06_9x16_VID_EN_New_C-NONE_CTA-NONE_Angle-None_M-F_VL-None_TR-None_G-NONE_P-NONE_S-NONE.mp4,3856 - What's more toxic CHUB || Enhancements: OFF || CBV1 || Batch 3 || 7C || 25/02/25w09 || Valentinas,VIDEO,$104,"4,757",2025-02-25,2025-02-28,3
129,CB_2024_Nov_FB_3264_LZ_V31_4x5_VID_EN_Opti_C-MakingOf_Sale_CTA-BF_Angle-W-B_M-CRAZY_VL-45s_G-M_P-OG_S-NEW_FB3004V02,CBV2 || EU (UK) || ðŸ’° Advantage+ || US || BROAD || 7C || Existing_customer_5% || 15/12/24 Ad set,VIDEO,$103,"5,140",2024-12-19,2025-03-27,98
130,CB_2025_Jan_FB_3757_LZ-DP_V16_9x16_VID_EN_Opti_C-BulletPoints_Evergreen_CTA-NONE_Angle-W-B-C_M-KAIT_VL-30s_G-F_P-GLP1_S-WHAT_FB3592V09,3757 - GLP1 video winner opti Batch 3+4 || Enhancements: OFF || GLP-1 || Batch 4 || 7C || 24/02/25w09 || Valentinas,VIDEO,$103,"4,481",2025-02-24,2025-03-18,22
131,CB_2024_Nov_FB_3264_LZ_V31_4x5_VID_EN_Opti_C-MakingOf_Sale_CTA-BF_Angle-W-B_M-CRAZY_VL-45s_G-M_P-OG_S-NEW_FB3004V02,CBV2 || AU || ðŸ’° Advantage+ || US || BROAD || 7C || Existing_customer_5% || 19/12/24 Ad set,VIDEO,$102,"3,286",2024-12-19,2025-03-27,98
132,CB_2025_Feb_FB_3793_VK-DP_V04_1x1_VID_EN_Opti_C-BulletPoints_Evergreen_CTA-70_Angle-W-B-C_M-NONE_VL-None_G-F_P-OG_S-NEW_FB3705V02,3793 -  3705 test opti || Enhancements: OFF || CBV1 || Batch 1 || 1C || 11/02/25w07 || Kostas,SHARE,$101,"4,340",2025-02-11,2025-02-28,17
133,CB_2024_Aug_FB_3097_VK-DP_V03_9x16_VID_EN_Opti_C-Benefits_CTA-SMR_Pain-W-B_M-MIX_VL-45s_TR-None_G-MF_P-OG_S-WHAT_FB2516V13,CB || US || Funnel B: Shopify || 7DC || 2nd try || 26/02/2025,VIDEO,$96,"3,674",2025-02-26,2025-03-04,6
134,CB_2023_May_FB_2144_MB_V02_9x16_VID_EN_Opti_C-Sale_CTA-SMR_Pain-W_M-JOG_VL-30s_TR-None_G-M-F_P-None_S-What,CA || COST CAP 92->93 || 7C || 10/05/24 || V1,VIDEO,$92,"5,487",2024-05-10,2025-02-27,293
135,CB_2025_Feb_FB_3830_LZ_V01_9x16_VID_EN_New_C-Testimonial_Evergreen_CTA-SALE_Angle-W-B-C_M-TRC_VL-15s_G-F_P-OG_S-NEW,3830 - I googled my symptoms || Enhancements: OFF || CBV1 || Batch 1 || 7C || 26/02/25w09 || Valentinas,VIDEO,$90,"3,072",2025-02-26,2025-02-28,2
136,CB_2025_Feb_FB_3854_LZ-DP_V03_1x1_IMG_EN_Opti_C-Headline_Evergreen_CTA-NONE_Angle-W_M-NONE_VL-None_G-M_P-OG_S-NONE_FB3723V07.png,3854 - Man boobs opti || Enhancements: OFF || CBV1 || Batch 1 || 7C || 26/02/25w09 || Valentinas,SHARE,$87,"4,881",2025-02-26,2025-03-03,5
137,CB_2025_Feb_FB_3833_VK_V03_9x16_VID_EN_New_C-BulletPoints_Evergreen_CTA-70_Angle-W-B-C_M-MAN_VL-15s_G-M_P-OG_S-WHAT.mp4,3833 - do not mix -VK || Enhancements: OFF || CBV1 || Batch 1 || 7C || 26/02/25w09 || Valentinas,VIDEO,$84,"3,630",2025-02-26,2025-03-08,10
138,CB_2025_Feb_FB_3812_SO_V04_4x5_IMG_EN_Opti_C-NONE_Evergreen_CTA-SALE_Angle-W_M-NONE_VL-None_G-NONE_P-NONE_S-NONE_FB3723V07,3812 - 3723 Man Boobs Opti || Enhancements: OFF || CBV1 || Batch 1 || 1C || 11/02/25w07 || Kostas,SHARE,$83,"5,986",2025-02-11,2025-02-26,15
139,CB_2025_Feb_FB_3827_LZ_V02_1x1_IMG_EN_Opti_C-Headline_Evergreen_CTA-NONE_Angle-W_M-NONE_VL-None_G-M_P-CBV2_S-NONE_FB3723V18,CBV2 || US || Manual Bid: ROAS GOAL: 1.00 -> 1.1 || 7DC || 22/01/2025,SHARE,$82,"4,262",2025-02-18,2025-03-27,37
140,CB_2025_Feb_FB_3821_SO-KB-JG_V09_4x5_IMG_EN_Opti_C-NONE_Evergreen_CTA-SALE_Angle-W_M-NONE_VL-None_G-NONE_P-NONE_S-NONE_FB3723V07,3701 - 25 Day challenge UGC CHUB || Enhancements: OFF || CBV1 || Batch 1 || 7C || 25/02/25w09 || Valentinas,VIDEO,$78,"2,983",2025-02-25,2025-02-28,3
141,CB_2025_Feb_FB_3864_DT-VU_V01_1x1_IMG_EN_Opti_C-Trend_Sale_CTA-65_Angle-W_M-NONE_VL-None_G-NONE_P-OG_S-NONE.png,3864 - weight loss event towards man boobs || Enhancements: OFF || CBV1 || Batch 1 || 7C || 26/02/25w09 || Valentinas,SHARE,$77,"3,931",2025-02-26,2025-03-03,5
142,CB_2025_Feb_FB_3787_CHUB_V01_9x16_VID_EN_New_C-NONE_CTA-NONE_Angle-None_M-NONE_VL-None_TR-None_G-NONE_P-NONE_S-NONE,3787 - DadBod Messaging CHUB || Enhancements: OFF || CBV1 || Batch 1 || 7DC || 16/02/25w08 || Kostas,SHARE,$72,"2,560",2025-02-16,2025-02-24,8
143,CB_2025_Feb_FB_3861_LZ-DP_V03_1x1_IMG_EN_New_C-Headline_Evergreen_CTA-NONE_Angle-W_M-NONE_VL-None_G-M_P-OG_S-NONE.png,3861 - Man boobs transformation img || Enhancements: OFF || CBV1 || Batch 1 || 7C || 26/02/25w09 || Valentinas,SHARE,$72,"4,123",2025-02-26,2025-03-03,5
144,CB_2025_Feb_FB_3856_CHUB-KZ_V07_9x16_VID_EN_New_C-NONE_CTA-NONE_Angle-None_M-F_VL-None_TR-None_G-NONE_P-NONE_S-NONE.mp4,3856 - What's more toxic CHUB || Enhancements: OFF || CBV1 || Batch 3 || 7C || 25/02/25w09 || Valentinas,VIDEO,$69,"2,654",2025-02-25,2025-02-28,3
145,CB_2025_Feb_FB_3866_VK-RP_V04_1x1_IMG_EN_New_C-BulletPoints_Evergreen_CTA-NONE_Angle-W-B-C_M-NONE_VL-None_G-NONE_P-OG_S-NEW.jpg,3866 - Sticky notes || Enhancements: OFF || CBV1 || Batch 1 || 7C || 26/02/25w09 || Valentinas,SHARE,$67,"2,812",2025-02-26,2025-02-28,2
146,CB_2025_Feb_FB_3844_CHUB_V06_9x16_VID_EN_New_C-NONE_CTA-NONE_Angle-None_M-NONE_VL-None_TR-None_G-NONE_P-NONE_S-NONE.mp4,3810 - Educational Video CHUB || Enhancements: OFF || CBV1 || Batch 1 || 7C || 25/02/25w09 || Valentinas,VIDEO,$66,"3,023",2025-02-25,2025-02-28,3
147,CB_2025_Feb_FB_3862_LZ_V03_1x1_IMG_EN_New_C-Testimonial_Evergreen_CTA-NONE_Angle-W-B_M-NONE_VL-None_G-NONE_P-OG_S-NONE.png,3862 - sleek looking ads || Enhancements: OFF || CBV1 || Batch 1 || 7C || 26/02/25w09 || Valentinas,SHARE,$66,"2,063",2025-02-26,2025-03-03,5
148,CB_2022_Mar3_FB_713_IK_V04_1x1_IMG_EN_Opti_C-WrittenTesti_HE-98_A-ExtremeBodyVisualization_HK-bodypart_Pain-W_CLR-PURPLE_BG-IMAGE_ME-MIX_MA-YOUNG,US || Manual Bid || BFCM || ROAS GOAL: 1.4 || 1C || 15/11/24,SHARE,$66,"2,222",2024-11-15,2025-02-27,104
149,CB_2025_Feb_FB_3784_SO-RP_V07_4x5_IMG_EN_Opti_C-Headline_Evergreen_CTA-NONE_Angle-W_M-NONE_VL-None_G-NONE_P-OG_S-NONE_FB3726V01,3784 - 3726 ad copy opti || Enhancements: OFF || CBV1 || Batch 2 || 1C || 09/02/25w07 || Kostas,SHARE,$65,"4,085",2025-02-09,2025-02-26,17
150,CB_2025_Feb_FB_3812_SO_V03_4x5_IMG_EN_Opti_C-NONE_Evergreen_CTA-SALE_Angle-W_M-NONE_VL-None_G-NONE_P-NONE_S-NONE_FB3723V07,3812 - 3723 Man Boobs Opti || Enhancements: OFF || CBV1 || Batch 1 || 1C || 11/02/25w07 || Kostas,SHARE,$63,"3,912",2025-02-11,2025-02-26,15
151,CB_2025_Feb_FB_3857_DT-JG_V02_9x16_VID_EN_New_C-NONE_Evergreen_CTA-NONE_Angle-W_M-POW_VL-30s_G-M_P-OG_S-NEW.mp4,3857 - #5 Fiber First || Enhancements: OFF || CBV1 || Batch 1 || 7C || 25/02/25w09 || Valentinas,VIDEO,$63,"3,227",2025-02-25,2025-02-28,3
152,CB_2025_Feb_FB_3827_LZ_V03_1x1_IMG_EN_Opti_C-Headline_Evergreen_CTA-SALE_Angle-W_M-NONE_VL-None_G-M_P-CBV2_S-NONE_FB3705V02,3827 - V2 img winner opti || Batch 2 || 7C || 18/02/2025w08,SHARE,$62,"3,028",2025-02-18,2025-03-07,17
153,CB_2025_Jan_FB_3762_LZ_V02_4x5_IMG_EN_Opti_C-NegativeMark_Evergreen_CTA-NONE_Angle-CR_M-NONE_VL-None_G-NONE_P-GLP1_S-NONE_FB3251V01.png,3762 - Notion Idea #123 it's not cheap GLP1 || Enhancements: OFF || GLP-1 || Batch 1 || 7C || 20/02/25w09 || Valentinas,SHARE,$62,"2,733",2025-02-24,2025-03-13,17
154,CB_2025_Jan_FB_3756_VK-DP_V01_4x5_IMG_EN_New_C-BulletPoints_Evergreen_CTA-NONE_Angle-W-B-C_M-NONE_VL-None_G-M_P-GLP1_S-NONE.png,3756 - opti 2834 GLP1 || Enhancements: OFF || GLP-1 || Batch 1 || 7C || 24/02/25w09 || Valentinas,SHARE,$61,"2,284",2025-02-24,2025-03-11,15
155,CB_2025_Jan_FB_3701_CHUB_V02_9x16_VID_EN_New_C-NONE_CTA-NONE_Angle-C_M-NONE_VL-None_TR-None_G-M_P-OG_S-NONE.mp4,3701 - 25 Day challenge UGC CHUB || Enhancements: OFF || CBV1 || Batch 1 || 7C || 25/02/25w09 || Valentinas,VIDEO,$61,"2,518",2025-02-25,2025-02-28,3
156,CB_2025_Feb_FB_3866_VK-RP_V02_1x1_IMG_EN_New_C-BulletPoints_Evergreen_CTA-NONE_Angle-W-B-C_M-NONE_VL-None_G-NONE_P-OG_S-NEW.jpg,3866 - Sticky notes || Enhancements: OFF || CBV1 || Batch 1 || 7C || 26/02/25w09 || Valentinas,SHARE,$60,"2,578",2025-02-26,2025-02-28,2
157,CB_2025_Jan_FB_3739_DT_V03_4x5_VID_EN_Opti_C-Sale_Sale_CTA-70_Angle-W_M-MIX_VL-30s_G-MF_P-GLP1_S-WHAT_FB2103V03,GLP-1 ðŸ’œ || ASC+ || US || 5% EXISTING CAP || 7C || 20/02/25 . Ad set,SHARE,$58,"1,900",2025-02-24,2025-03-17,21
158,CB_2025_Feb_FB_3844_CHUB_V01_9x16_VID_EN_New_C-NONE_CTA-NONE_Angle-None_M-NONE_VL-None_TR-None_G-NONE_P-NONE_S-NONE,3844 - Do not do this CHUB || Enhancements: OFF || CBV1 || Batch 1 || 7C || 25/02/25w09 || Valentinas,VIDEO,$56,"2,214",2025-02-25,2025-02-28,3
159,CB_2025_Feb_FB_3802_VK-DP_V03_1x1_IMG_EN_Opti_C-BulletPoints_Evergreen_CTA-70_Angle-W-B-C_M-NONE_VL-None_G-F_P-GLP1_S-NEW_FB2762V05.jpg,3802 - 7 hot benefits GLP VK || Enhancements: OFF || GLP-1 || Batch 1 || 7C || 24/02/25w09 || Valentinas,SHARE,$55,"2,593",2025-02-24,2025-03-07,11
160,CB_2025_Jan_FB_3748_VK-DP_V03_4x5_IMG_EN_New_C-BulletPoints_Sale_CTA-NY_Angle-W-B-C_M-NONE_VL-None_G-M_P-OG_S-NONE.png - Copy,3749 - beer belly opti GLP1- VK=DP || Enhancements: OFF || GLP-1 || Batch 1 || 7C || 20/02/25w09 || Valentinas,SHARE,$54,"2,907",2025-02-24,2025-03-08,12
161,CB_2025_Feb_FB_3775_SO-JT_V04_9x16_VID_EN_New_C-Headline_Evergreen_CTA-NONE_Angle-W_M-NONE_VL-7s_G-NONE_P-GLP1_S-euphoria,3775 - CB / GLP-1 / VID BATCH || Enhancements: OFF || GLP-1 || Batch 1 || 7C || 24/02/25w09 || Valentinas,VIDEO,$54,"1,659",2025-02-24,2025-03-06,10
162,CB_2025_Jan_FB_3779_VK-DP_V02_1x1_VID_EN_Opti_C-BulletPoints_Evergreen_CTA-70_Angle-W-B-C_M-NONE_VL-None_G-F_P-OG_S-NEW_FB3705V02.png,CB || US || Funnel A: React || 7DC || 2nd try || 26/02/2025,SHARE,$53,"2,299",2025-02-26,2025-03-04,6
163,CB_2025_Feb_FB_3856_CHUB-KZ_V02_9x16_VID_EN_New_C-NONE_CTA-NONE_Angle-None_M-M_VL-None_TR-None_G-NONE_P-NONE_S-NONE.mp4,3856 - What's more toxic CHUB || Enhancements: OFF || CBV1 || Batch 1 || 7C || 25/02/25w09 || Valentinas,VIDEO,$51,"2,375",2025-02-25,2025-02-28,3
164,CB_2025_Feb_FB_3775_SO-JT_V03_9x16_VID_EN_New_C-Headline_Evergreen_CTA-NONE_Angle-W_M-NONE_VL-7s_G-NONE_P-GLP1_S-workout.mp4,3775 - CB / GLP-1 / VID BATCH || Enhancements: OFF || GLP-1 || Batch 1 || 7C || 24/02/25w09 || Valentinas,VIDEO,$51,"1,686",2025-02-24,2025-03-06,10
165,CB_2025_Feb_FB_3814_CHUB_V03_9x16_VID_EN_New_C-NONE_CTA-NONE_Angle-None_M-NONE_VL-None_TR-None_G-NONE_P-NONE_S-NONE.mp4,3814 - 5 Warning Signs CHUB || Enhancements: OFF || CBV1 || Batch 1 || 7C || 25/02/25w09 || Valentinas,VIDEO,$49,"1,770",2025-02-25,2025-02-28,3
166,CB_2025_Jan_FB_3739_DT_V05_4x5_VID_EN_Opti_C-BulletPoints_Sale_CTA-70_Angle-W-B_M-MIX_VL-45s_G-MF_P-GLP1_S-WHAT_FB3164V03,GLP-1 ðŸ’œ || ASC+ || US || 5% EXISTING CAP || 7C || 20/02/25 . Ad set,SHARE,$48,"1,951",2025-02-24,2025-03-18,22
167,CB_2025_Feb_FB_3827_LZ_V03_1x1_IMG_EN_Opti_C-Headline_Evergreen_CTA-SALE_Angle-W_M-NONE_VL-None_G-M_P-CBV2_S-NONE_FB3705V02,CBV2 || US || Manual Bid: ROAS GOAL: 1.00 -> 1.1 || 7DC || 22/01/2025,SHARE,$48,"1,962",2025-02-18,2025-03-27,37
168,CB_2025_Feb_FB_3844_CHUB_V05_9x16_VID_EN_New_C-NONE_CTA-NONE_Angle-None_M-NONE_VL-None_TR-None_G-NONE_P-NONE_S-NONE.mp4,3844 - Do not do this CHUB || Enhancements: OFF || CBV1 || Batch 1 || 7C || 25/02/25w09 || Valentinas,VIDEO,$48,"1,998",2025-02-25,2025-02-27,2
169,CB_2025_Jan_FB_3748_VK-DP_V02_4x5_IMG_EN_New_C-BulletPoints_Sale_CTA-NY_Angle-W-B-C_M-NONE_VL-None_G-M_P-OG_S-NONE.png - Copy,3748 - winner ads opti - GLP1 - VK-DP || Enhancements: OFF || GLP-1 || Batch 1 || 7C || 20/02/25w09 || Valentinas,SHARE,$45,"1,953",2025-02-24,2025-03-18,22
170,CB_2024_Nov_FB_3305_SO-DP_V02_4x5_VID_EN_Opti_C-Sale_CTA-BF_Pain-W_M-Chris_VL-30s_TR-None_G-MF_P-Plan_S-NEW_FB2601V07,CBV2 || AU || ðŸ’° Advantage+ || US || BROAD || 7C || Existing_customer_5% || 19/12/24 Ad set,VIDEO,$43,"1,397",2024-12-19,2025-03-27,98
171,CB_2024_Feb_FB_2834_DA_V04_4x5_IMG_EN_Opti_C-SingleTesti_CTA-NONE_Pain-W_M-NONE_VL-None_TR-None_G-NONE_P-V2_S-NONE_FB2759V04,CBV2 || AU || ðŸ’° Advantage+ || US || BROAD || 7C || Existing_customer_5% || 19/12/24 Ad set,SHARE,$43,"1,576",2024-12-19,2025-03-27,98
172,CB_2025_Feb_FB_3816_VK-JT_V04_1x1_IMG_EN_New_C-BulletPoints_Evergreen_CTA-70_Angle-W-B-C_M-JOG_VL-None_G-NONE_P-OG_S-NEW_FB3656V02,3822 - OPTI 3656 -VK || Enhancements: OFF || CBV1 || Batch 1 || 7C || 19/02/25w08 || Kostas,SHARE,$41,"2,185",2025-02-19,2025-02-25,6
173,CB_2025_Feb_FB_3821_SO-KB-JG_V13_4x5_IMG_EN_Opti_C-NONE_Evergreen_CTA-SALE_Angle-W_M-NONE_VL-None_G-NONE_P-NONE_S-NONE_FB3723V07,3812 - 3723 Man Boobs Opti || Enhancements: OFF || CBV1 || Batch 4 || 7C || 19/02/25w08 || Kostas,SHARE,$40,"2,099",2025-02-18,2025-02-24,6
174,CB_2025_Jan_FB_3751_VK-DP_V01_4x5_IMG_EN_New_C-BulletPoints_Sale_CTA-NY_Angle-W-B-C_M-NONE_VL-None_G-M_P-GLP1_S-NONE.jpg,3751 - opti 3608 GLP1 - VK-DP || Enhancements: OFF || GLP-1 || Batch 1 || 7C || 20/02/25w09 || Valentinas,SHARE,$40,"1,649",2025-02-24,2025-03-15,19
175,CB_2025_Feb_FB_3802_VK-DP_V05_1x1_IMG_EN_Opti_C-BulletPoints_Evergreen_CTA-70_Angle-W-B-C_M-NONE_VL-None_G-F_P-GLP1_S-NEW_FB2762V05.jpg,3802 - 7 hot benefits GLP VK || Enhancements: OFF || GLP-1 || Batch 1 || 7C || 24/02/25w09 || Valentinas,SHARE,$39,"1,151",2025-02-24,2025-03-07,11
176,CB_2025_Feb_FB_3856_CHUB-KZ_V01_9x16_VID_EN_New_C-NONE_CTA-NONE_Angle-None_M-M_VL-None_TR-None_G-NONE_P-NONE_S-NONE.mp4,3856 - What's more toxic CHUB || Enhancements: OFF || CBV1 || Batch 1 || 7C || 25/02/25w09 || Valentinas,VIDEO,$39,"1,582",2025-02-25,2025-02-28,3
177,CB_2025_Jan_FB_3723_SO_V01_4x5_IMG_EN_New_C-NONE_Evergreen_CTA-SALE_Angle-W_M-NONE_VL-None_G-NONE_P-NONE_S-NONE,3723 - Notion Idea #92 MAN BOOBS || Enhancements: OFF || CBV1 || Batch 1 || 1C || 28/01/25w05 || Kostas,SHARE,$39,"2,640",2025-01-28,2025-02-24,27
178,CB_2025_Feb_FB_3812_SO_V05_4x5_IMG_EN_Opti_C-NONE_Evergreen_CTA-SALE_Angle-W_M-NONE_VL-None_G-NONE_P-NONE_S-NONE_FB3723V07,3812 - 3723 Man Boobs Opti || Enhancements: OFF || CBV1 || Batch 5 || 7C || 19/02/25w08 || Kostas,SHARE,$38,"2,480",2025-02-19,2025-02-24,5
179,CB_2024_Mar_FB_2888_JG_V02_9x16_IMG_EN_Opti_C-Benefits_CTA-NONE_Pain-W_M-NONE_VL-None_TR-None_G-NONE_P-V2_S-NONE,CBV2 || AU || ðŸ’° Advantage+ || US || BROAD || 7C || Existing_customer_5% || 19/12/24 Ad set,SHARE,$38,"1,852",2024-12-19,2025-03-27,98
180,CB_2025_Feb_FB_3857_DT-JG_V04_9x16_VID_EN_New_C-NONE_Evergreen_CTA-NONE_Angle-W_M-POW_VL-30s_G-M_P-OG_S-NEW.mp4,3857 - #5 Fiber First || Enhancements: OFF || CBV1 || Batch 1 || 7C || 25/02/25w09 || Valentinas,VIDEO,$38,"1,682",2025-02-25,2025-02-28,3
181,CB_2023_Jul_FB_2217_IB_V04_9x16_VID_EN_Opti_C-Pointing_CTA-SMR_Pain-W-B_M-TRC_VL-30s_TR-None_G-F_P-None_S-FRIGGA,CB || US || Funnel A: React || 7DC || 2nd try || 26/02/2025,VIDEO,$37,"1,500",2025-02-26,2025-03-04,6
182,CB_2025_Jan_FB_3756_VK-DP_V03_4x5_IMG_EN_New_C-BulletPoints_Evergreen_CTA-NONE_Angle-W-B-C_M-NONE_VL-None_G-M_P-GLP1_S-NONE.png,3756 - opti 2834 GLP1 || Enhancements: OFF || GLP-1 || Batch 1 || 7C || 24/02/25w09 || Valentinas,SHARE,$35,"1,311",2025-02-24,2025-03-11,15
183,CB_2025_Jan_FB_3764_LZ-RP_V04_9x16_VID_EN_New_C-BulletPoints_Evergreen_CTA-NONE_Angle-W_M-MAN_VL-45s_G-M_P-GLP1_S-NEW.mp4,3764 - Notion idea #128 Biggest mistakes || Enhancements: OFF || GLP-1 || Batch 1 || 7C || 20/02/25w09 || Valentinas,VIDEO,$34,"1,005",2025-02-24,2025-03-06,10
184,CB_2025_Jan_FB_3757_LZ-DP_V12_9x16_VID_EN_Opti_C-Dance_Evergreen_CTA-NONE_Angle-W-B_M-Nonie_VL-15s_G-F_P-GLP1_S-WHAT_FB3204V01.mp4,3757 - GLP1 video winner opti Batch 3+4 || Enhancements: OFF || GLP-1 || Batch 3 || 7C || 24/02/25w09 || Valentinas,VIDEO,$34,"1,344",2025-02-24,2025-03-06,10
185,CB_2025_Jan_FB_3757_LZ-DP_V15_9x16_VID_EN_Opti_C-BulletPoints_Evergreen_CTA-NONE_Angle-W-B-C_M-KAIT_VL-30s_G-F_P-GLP1_S-NEW_FB3592V10.mp4,3757 - GLP1 video winner opti Batch 3+4 || Enhancements: OFF || GLP-1 || Batch 3 || 7C || 24/02/25w09 || Valentinas,VIDEO,$32,"1,393",2025-02-24,2025-03-06,10
186,CB_2025_Feb_FB_3833_VK_V02_9x16_VID_EN_New_C-BulletPoints_Evergreen_CTA-70_Angle-W-B-C_M-JOG_VL-15s_G-F_P-OG_S-NEW.mp4,3833 - do not mix -VK || Enhancements: OFF || CBV1 || Batch 1 || 7C || 26/02/25w09 || Valentinas,VIDEO,$32,"1,422",2025-02-26,2025-03-08,10
187,CB_2024_Jan_FB_2764_RS_V04_9x16_VID_EN_Opti_C-SingleTesti_CTA-SALE_Pain-W_M-TRC_VL-45s_TR-None_G-F_P-OG_S-MOON_FB2263V04,CBV2 || EU (UK) || ðŸ’° Advantage+ || US || BROAD || 7C || Existing_customer_5% || 15/12/24 Ad set,VIDEO,$32,984,2025-02-04,2025-03-14,38
188,CB_2025_Jan_FB_3739_DT_V04_4x5_VID_EN_Opti_C-Dance_Sale_CTA-70_Angle-W_M-MIX_VL-45s_G-MF_P-GLP1_S-STARRY_FB1998V03,GLP-1 ðŸ’œ || ASC+ || US || 5% EXISTING CAP || 7C || 20/02/25 . Ad set,SHARE,$30,"1,346",2025-02-24,2025-03-18,22
189,CB_2025_Jan_FB_3748_VK-DP_V03_4x5_IMG_EN_New_C-BulletPoints_Sale_CTA-NY_Angle-W-B-C_M-NONE_VL-None_G-M_P-OG_S-NONE.png - Copy,3748 - winner ads opti - GLP1 - VK-DP || Enhancements: OFF || GLP-1 || Batch 1 || 7C || 20/02/25w09 || Valentinas,SHARE,$29,"1,316",2025-02-24,2025-03-18,22
190,CB_2025_Feb_FB_3862_LZ_V01_1x1_IMG_EN_New_C-Testimonial_Evergreen_CTA-NONE_Angle-W-B_M-NONE_VL-None_G-NONE_P-OG_S-NONE.png,3862 - sleek looking ads || Enhancements: OFF || CBV1 || Batch 1 || 7C || 26/02/25w09 || Valentinas,SHARE,$28,968,2025-02-26,2025-03-03,5
191,CB_2024_Feb_FB_2834_DA_V02_4x5_IMG_EN_Opti_C-SingleTesti_CTA-NONE_Pain-W_M-NONE_VL-None_TR-None_G-NONE_P-V2_S-NONE_FB2759V04,CBV2 || AU || ðŸ’° Advantage+ || US || BROAD || 7C || Existing_customer_5% || 19/12/24 Ad set,SHARE,$28,"1,269",2024-12-19,2025-03-27,98
192,CB_2025_Feb_FB_3856_CHUB-KZ_V05_9x16_VID_EN_New_C-NONE_CTA-NONE_Angle-None_M-M_VL-None_TR-None_G-NONE_P-NONE_S-NONE.mp4,3856 - What's more toxic CHUB || Enhancements: OFF || CBV1 || Batch 2 || 7C || 25/02/25w09 || Valentinas,VIDEO,$27,"1,182",2025-02-25,2025-02-28,3
193,CB_2025_Jan_FB_3723_SO_V19_4x5_IMG_EN_New_C-NONE_Evergreen_CTA-SALE_Angle-W_M-NONE_VL-None_G-NONE_P-NONE_S-NONE,3723 - Notion Idea #92 MAN BOOBS || Enhancements: OFF || CBV1 || Batch 4 || 1C || 28/01/25w05 || Kostas,SHARE,$27,"2,210",2025-01-28,2025-03-11,42
194,CB_2025_Feb_FB_3862_LZ_V02_1x1_IMG_EN_New_C-Testimonial_Evergreen_CTA-NONE_Angle-W-B_M-NONE_VL-None_G-NONE_P-OG_S-NONE.png,3862 - sleek looking ads || Enhancements: OFF || CBV1 || Batch 1 || 7C || 26/02/25w09 || Valentinas,SHARE,$25,"1,005",2025-02-26,2025-03-03,5
195,CB_2025_Jan_FB_3757_LZ-DP_V19_9x16_VID_EN_Opti_C-BulletPoints_Evergreen_CTA-NONE_Angle-W-B_M-MAG_VL-30s_G-F_P-GLP1_S-WHAT_FB3311V17.mp4,3757 - GLP1 video winner opti Batch 3+4 || Enhancements: OFF || GLP-1 || Batch 4 || 7C || 24/02/25w09 || Valentinas,VIDEO,$25,"1,140",2025-02-24,2025-03-18,22
196,CB_2025_Feb_FB_3844_CHUB_V02_9x16_VID_EN_New_C-NONE_CTA-NONE_Angle-None_M-NONE_VL-None_TR-None_G-NONE_P-NONE_S-NONE.mp4,3844 - Do not do this CHUB || Enhancements: OFF || CBV1 || Batch 1 || 7C || 25/02/25w09 || Valentinas,VIDEO,$24,"1,121",2025-02-25,2025-02-28,3
197,CB_2025_Feb_FB_3827_LZ_V02_1x1_IMG_EN_Opti_C-Headline_Evergreen_CTA-NONE_Angle-W_M-NONE_VL-None_G-M_P-CBV2_S-NONE_FB3723V18,3827 - V2 img winner opti || Batch 1 || 7C || 18/02/2025w08,SHARE,$24,"1,522",2025-02-18,2025-02-25,7
198,CB_2025_Feb_FB_3833_VK_V01_9x16_VID_EN_New_C-BulletPoints_Evergreen_CTA-70_Angle-W-B-C_M-TRC_VL-15s_G-F_P-OG_S-NEW.mp4,3833 - do not mix -VK || Enhancements: OFF || CBV1 || Batch 1 || 7C || 26/02/25w09 || Valentinas,VIDEO,$24,999,2025-02-26,2025-03-08,10
199,CB_2025_Feb_FB_3857_DT-JG_V01_9x16_VID_EN_New_C-NONE_Evergreen_CTA-NONE_Angle-W_M-POW_VL-30s_G-M_P-OG_S-NEW,3857 - #5 Fiber First || Enhancements: OFF || CBV1 || Batch 1 || 7C || 25/02/25w09 || Valentinas,VIDEO,$24,"1,237",2025-02-25,2025-02-28,3
200,CB_2025_Jan_FB_3723_SO_V02_4x5_IMG_EN_New_C-NONE_Evergreen_CTA-SALE_Angle-W_M-NONE_VL-None_G-NONE_P-NONE_S-NONE,3723 - Notion Idea #92 MAN BOOBS || Enhancements: OFF || CBV1 || Batch 1 || 1C || 28/01/25w05 || Kostas,SHARE,$23,"1,949",2025-01-28,2025-02-24,27
201,CB_2025_Feb_FB_3854_LZ-DP_V04_1x1_IMG_EN_Opti_C-Headline_Evergreen_CTA-NONE_Angle-W_M-NONE_VL-None_G-M_P-OG_S-NONE_FB3723V07-1.png,3854 - Man boobs opti || Enhancements: OFF || CBV1 || Batch 1 || 7C || 26/02/25w09 || Valentinas,SHARE,$22,"1,142",2025-02-26,2025-03-03,5
202,CB_2025_Jan_FB_3742_SO-DP-KB_V01_4x5_IMG_EN_Opti_C-NONE_Evergreen_CTA-SALE_Angle-W_M-NONE_VL-None_G-NONE_P-CBV2_S-NONE3665V01,CBV2 || EU (UK) || ðŸ’° Advantage+ || US || BROAD || 7C || Existing_customer_5% || 15/12/24 Ad set,SHARE,$22,895,2025-02-04,2025-03-27,51
203,CB_2025_Feb_FB_3864_DT-VU_V04_1x1_IMG_EN_Opti_C-Trend_Sale_CTA-65_Angle-W_M-NONE_VL-None_G-NONE_P-OG_S-NONE.png,3864 - weight loss event towards man boobs || Enhancements: OFF || CBV1 || Batch 1 || 7C || 26/02/25w09 || Valentinas,SHARE,$20,"1,086",2025-02-26,2025-03-03,5
204,CB_2024_Feb_FB_2814_MB-DP_V05_1x1_IMG_EN_New_C-WeightLoss_CTA-None_Pain-W-B-C_M-NONE_VL-None_TR-None_G-NONE_P-V2_S-NONE,CBV2 || EU (UK) || ðŸ’° Advantage+ || US || BROAD || 7C || Existing_customer_5% || 15/12/24 Ad set,SHARE,$20,824,2025-01-31,2025-03-27,55
205,CB_2025_FEB_FB_3666_VK-JT_V03_4x5_VID_EN_NEW_C-BulletPoints_Sale_CTA-NY_Angle-W-B-C_M-TRC_VL-30s_G-F_P-OG_S-NEW,ðŸŒ¶ï¸ || US || ASC+ || ->CC141 || VIDEO Only || US+CA || 0% EXISTING CAP || 7C || 07/08.24  Ad set,VIDEO,$20,784,2025-01-20,2025-03-19,58
206,CB_2023_Jul_FB_2226_MB_V04_9x16_VID_EN_Opti_C-Testim_CTA-SMR_Pain-W_M-MIX_VL-30s_TR-None_G-F_P-None_S-Starry,US || Manual Bid || BFCM || COST CAP 71 || 1C || 15/11/24,VIDEO,$20,540,2024-11-15,2025-03-27,132
207,CB_2025_Jan_FB_3747_CHUB-AA_V01_4x5_IMG_EN_Opti_C-NONE_CTA-NONE_Angle-Sale_M-NONE_VL-None_TR-None_G-NONE_P-OG_S-NONE,3747 Clean Sale [HB winner ITR] CHUB || Enhancements: OFF || CBV1 || Batch Ä… || 1C || 02/02/25w06 || Kostas,SHARE,$20,"1,183",2025-02-02,2025-03-27,53
208,CB_2025_Jan_FB_3739_DT_V07_9x16_VID_EN_Opti_C-Testimonial_Sale_CTA-70_Angle-W_M-MIX_VL-45s_G-MF_P-GLP1_S-MOON_FB2823V02,GLP-1 ðŸ’œ || ASC+ || US || 5% EXISTING CAP || 7C || 20/02/25 . Ad set,SHARE,$20,632,2025-02-24,2025-03-17,21
209,CB_2025_Jan_FB_3757_LZ-DP_V13_9x16_VID_EN_Opti_C-Pointing_Evergreen_CTA-NONE_Angle-W-B-C_M-Nonie_VL-30s_G-F_P-GLP1_S-WHAT_FB3164V01.mp4,3757 - GLP1 video winner opti Batch 3+4 || Enhancements: OFF || GLP-1 || Batch 3 || 7C || 24/02/25w09 || Valentinas,VIDEO,$19,787,2025-02-24,2025-03-06,10
210,CB_2025_Feb_FB_3784_SO-RP_V06_4x5_IMG_EN_Opti_C-Headline_Evergreen_CTA-NONE_Angle-W_M-NONE_VL-None_G-NONE_P-OG_S-NONE_FB3726V01,3784 - 3726 ad copy opti || Enhancements: OFF || CBV1 || Batch 2 || 1C || 09/02/25w07 || Kostas,SHARE,$18,"1,357",2025-02-09,2025-02-26,17
211,CB_2023_Jul_FB_2217_IB_V04_9x16_VID_EN_Opti_C-Pointing_CTA-SMR_Pain-W-B_M-TRC_VL-30s_TR-None_G-F_P-None_S-FRIGGA,CB || US || Funnel B: Shopify || 7DC || 2nd try || 26/02/2025,VIDEO,$18,606,2025-02-26,2025-03-04,6
212,CB_2024_Oct_FB_3182_ZS-GC_V13_1x1_IMG_EN_New_C-UsVsThem_Evergreen_CTA-NONE_Angle-B-C_M-NONE_VL-None_G-NONE_P-OG_S-NONE,CBV2 || AU || ðŸ’° Advantage+ || US || BROAD || 7C || Existing_customer_5% || 19/12/24 Ad set,SHARE,$18,630,2024-12-19,2025-03-27,98
213,CB_2025_Jan_FB_3751_VK-DP_V03_4x5_IMG_EN_New_C-BulletPoints_Sale_CTA-NY_Angle-W-B-C_M-NONE_VL-None_G-M_P-GLP1_S-NONE.jpg,3751 - opti 3608 GLP1 - VK-DP || Enhancements: OFF || GLP-1 || Batch 1 || 7C || 20/02/25w09 || Valentinas,SHARE,$18,797,2025-02-24,2025-03-15,19
214,CB_2025_Feb_FB_3821_SO-KB-JG_V10_4x5_IMG_EN_Opti_C-NONE_Evergreen_CTA-SALE_Angle-W_M-NONE_VL-None_G-NONE_P-NONE_S-NONE_FB3723V07,3821 - Man boobs Opti || Enhancements: OFF || CBV1 || Batch 3 || 7C || 19/02/25w08 || Kostas,SHARE,$17,"1,004",2025-02-19,2025-03-09,18
215,CB_2024_Jan_FB_2717_MB-RP_V26_9x16_VID_EN_New_C-Buzz_CTA-SALE_Pain-W-B-C_M-MIX_VL-45s_TR-None_G-MF_P-Method_S-NONE,CA || COST CAP 92->93 || 7C || 10/05/24 || V1,VIDEO,$17,822,2024-08-22,2025-02-27,189
216,CB_2025_Jan_FB_3756_VK-DP_V02_4x5_IMG_EN_New_C-BulletPoints_Evergreen_CTA-NONE_Angle-W-B-C_M-NONE_VL-None_G-M_P-GLP1_S-NONE.png,3756 - opti 2834 GLP1 || Enhancements: OFF || GLP-1 || Batch 1 || 7C || 24/02/25w09 || Valentinas,SHARE,$17,786,2025-02-24,2025-03-11,15
217,CB_2025_Jan_FB_3757_LZ-DP_V14_9x16_VID_EN_Opti_C-Dance_Evergreen_CTA-NONE_Angle-W-B_M-Nonie_VL-30s_G-F_P-GLP1_S-WHAT_FB3164V03.mp4,3757 - GLP1 video winner opti Batch 3+4 || Enhancements: OFF || GLP-1 || Batch 3 || 7C || 24/02/25w09 || Valentinas,VIDEO,$17,748,2025-02-24,2025-03-06,10
218,CB_2024_Mar_FB_2888_JG_V03_9x16_IMG_EN_Opti_C-Benefits_CTA-NONE_Pain-W_M-NONE_VL-None_TR-None_G-NONE_P-V2_S-NONE,CBV2 || AU || ðŸ’° Advantage+ || US || BROAD || 7C || Existing_customer_5% || 19/12/24 Ad set,SHARE,$17,700,2024-12-19,2025-03-27,98
219,CB_2024_Mar_FB_2888_JG_V01_9x16_IMG_EN_Opti_C-Benefits_CTA-NONE_Pain-W_M-NONE_VL-None_TR-None_G-NONE_P-V2_S-NONE,CBV2 || AU || ðŸ’° Advantage+ || US || BROAD || 7C || Existing_customer_5% || 19/12/24 Ad set,SHARE,$17,507,2024-12-19,2025-03-27,98
220,CB_2025_Jan_FB_3739_DT_V09_9x16_VID_EN_Opti_C-Testimonial_Sale_CTA-70_Angle-W-B_M-MIX_VL-45s_G-MF_P-GLP1_S-MOON_FB3278V04,GLP-1 ðŸ’œ || ASC+ || US || 5% EXISTING CAP || 7C || 20/02/25 . Ad set,SHARE,$15,632,2025-02-24,2025-03-18,22
221,CB_2025_Feb_FB_3787_CHUB_V03_9x16_VID_EN_New_C-NONE_CTA-NONE_Angle-None_M-NONE_VL-None_TR-None_G-NONE_P-NONE_S-NONE,3787 - DadBod Messaging CHUB || Enhancements: OFF || CBV1 || Batch 1 || 7DC || 16/02/25w08 || Kostas,SHARE,$14,458,2025-02-16,2025-02-24,8
222,CB_2025_Feb_FB_3802_VK-DP_V02_1x1_IMG_EN_Opti_C-BulletPoints_Evergreen_CTA-70_Angle-W-B-C_M-NONE_VL-None_G-F_P-GLP1_S-NEW_FB2762V05.jpg,3802 - 7 hot benefits GLP VK || Enhancements: OFF || GLP-1 || Batch 1 || 7C || 24/02/25w09 || Valentinas,SHARE,$14,395,2025-02-24,2025-03-07,11
223,CB_2023_Jul_FB_2226_MB_V04_9x16_VID_EN_Opti_C-Testim_CTA-SMR_Pain-W_M-MIX_VL-30s_TR-None_G-F_P-None_S-Starry,US || Manual Bid || BFCM || ROAS GOAL: 1.4 || 1C || 15/11/24,VIDEO,$13,314,2024-11-15,2025-02-27,104
224,CB_2023_Jul_FB_2226_MB_V04_9x16_VID_EN_Opti_C-Testim_CTA-SMR_Pain-W_M-MIX_VL-30s_TR-None_G-F_P-None_S-Starry,US || Manual Bid || BFCM || COST CAP 91 || 1C || 15/11/24,VIDEO,$12,455,2024-11-15,2025-02-27,104
225,CB_2025_Jan_FB_3739_DT_V01_4x5_VID_EN_Opti_C-NegativeMark_Sale_CTA-70_Angle-W_M-MIX_VL-45s_G-MF_P-GLP1_S-MOON_FB2263V05,GLP-1 ðŸ’œ || ASC+ || US || 5% EXISTING CAP || 7C || 20/02/25 . Ad set,SHARE,$12,519,2025-02-24,2025-03-18,22
226,CB_2025_Feb_FB_3854_LZ-DP_V02_1x1_IMG_EN_Opti_C-Headline_Evergreen_CTA-NONE_Angle-W_M-NONE_VL-None_G-M_P-OG_S-NONE_FB3723V07.png,3854 - Man boobs opti || Enhancements: OFF || CBV1 || Batch 1 || 7C || 26/02/25w09 || Valentinas,SHARE,$12,602,2025-02-26,2025-03-03,5
227,CB_2025_Feb_FB_3865_SO-VU_V02_4x5_IMG_EN_Opti_C-NONE_Evergreen_CTA-NONE_Angle-Cort_M-NONE_VL-None_G-NONE_P-OG_S-NONE.png,3865 - HELLO! Idea Nr.23 || Enhancements: OFF || CBV1 || Batch 1 || 7C || 26/02/25w09 || Valentinas,SHARE,$12,336,2025-02-26,2025-03-03,5
228,CB_2025_Feb_FB_3844_CHUB_V05_9x16_VID_EN_New_C-NONE_CTA-NONE_Angle-None_M-NONE_VL-None_TR-None_G-NONE_P-NONE_S-NONE.mp4 - Copy,3844 - Do not do this CHUB || Enhancements: OFF || CBV1 || Batch 1 || 7C || 25/02/25w09 || Valentinas,VIDEO,$11,629,2025-02-25,2025-02-27,2
229,CB_2025_Jan_FB_3723_SO_V03_4x5_IMG_EN_New_C-NONE_Evergreen_CTA-SALE_Angle-W_M-NONE_VL-None_G-NONE_P-NONE_S-NONE,3723 - Notion Idea #92 MAN BOOBS || Enhancements: OFF || CBV1 || Batch 1 || 1C || 28/01/25w05 || Kostas,SHARE,$11,745,2025-01-28,2025-02-24,27
230,CB_2024_Oct_FB_3251_LZ-VU_V01_1x1_IMG_EN_New_C-NegativeMark_Evergreen_CTA-NONE_Angle-Cort_M-NONE_VL-None_G-NONE_P-NONE_S-NONE.png,US || Manual Bid || BFCM || ROAS GOAL: 1.4 || 1C || 15/11/24,SHARE,$11,364,2024-11-15,2025-02-27,104
231,CB_2025_Jan_FB_3757_LZ-DP_V11_9x16_VID_EN_Opti_C-NegativeMark_Evergreen_CTA-NONE_Angle-W_M-GLAD_VL-45s_G-F_P-GLP1_S-MOON_FB3278V01,3757 - GLP1 video winner opti Batch 3+4 || Enhancements: OFF || GLP-1 || Batch 3 || 7C || 24/02/25w09 || Valentinas,VIDEO,$11,557,2025-02-24,2025-03-06,10
232,CB_2025_Jan_FB_3739_DT_V06_9x16_VID_EN_Opti_C-Testimonial_Sale_CTA-70_Angle-W_M-MIX_VL-45s_G-MF_P-GLP1_S-MOON_FB2764V04,GLP-1 ðŸ’œ || ASC+ || US || 5% EXISTING CAP || 7C || 20/02/25 . Ad set,SHARE,$10,370,2025-02-24,2025-03-18,22
233,CB_2025_Feb_FB_3850_DT-DP_V01_9x16_VID_EN_Opti_C-Trend_Sale_CTA-70_Angle-W_M-MIX_VL-30s_G-MF_P-OG_S-WHAT FB1989V08.mp4,3850 - Man boobs/dad bod opti on videos || Enhancements: OFF || CBV1 || Batch 1 || 7C || 26/02/25w09 || Valentinas,VIDEO,$10,441,2025-02-26,2025-03-03,5
234,CB_2025_Feb_FB_3844_CHUB_V03_9x16_VID_EN_New_C-NONE_CTA-NONE_Angle-None_M-NONE_VL-None_TR-None_G-NONE_P-NONE_S-NONE.mp4,3844 - Do not do this CHUB || Enhancements: OFF || CBV1 || Batch 1 || 7C || 25/02/25w09 || Valentinas,VIDEO,$10,445,2025-02-25,2025-02-27,2
235,CB_2025_Feb_FB_3818_LZ-VU_V26_1x1_IMG_EN_Opti_C-Headline_Evergreen_CTA-NONE_Angle-Cort_M-NONE_VL-None_G-NONE_P-NONE_S-NONE_FB3251V01,3818 - It_s not cheap Months+holidays: April || Enhancements: OFF || CBV1 || Batch 1 || 7DC || 13/02/25w07 || Kostas,SHARE,$10,287,2025-02-13,2025-02-28,15
236,CB_2025_Feb_FB_3802_VK-DP_V01_1x1_IMG_EN_Opti_C-BulletPoints_Evergreen_CTA-70_Angle-W-B-C_M-NONE_VL-None_G-F_P-GLP1_S-NEW_FB2762V05.png,3802 - 7 hot benefits GLP VK || Enhancements: OFF || GLP-1 || Batch 1 || 7C || 24/02/25w09 || Valentinas,SHARE,$10,291,2025-02-24,2025-03-07,11
237,CB_2025_Jan_FB_3764_LZ-RP_V01_9x16_VID_EN_New_C-BulletPoints_Evergreen_CTA-NONE_Angle-W_M-MAN_VL-45s_G-M_P-GLP1_S-NEW,3764 - Notion idea #128 Biggest mistakes || Enhancements: OFF || GLP-1 || Batch 1 || 7C || 20/02/25w09 || Valentinas,VIDEO,$9,290,2025-02-24,2025-03-06,10
238,CB_2025_Jan_FB_3739_DT_V08_9x16_VID_EN_Opti_C-BulletPoints_Sale_CTA-70_Angle-W-B_M-MIX_VL-45s_G-MF_P-GLP1_S-WHAT_FB3311V09,GLP-1 ðŸ’œ || ASC+ || US || 5% EXISTING CAP || 7C || 20/02/25 . Ad set,SHARE,$9,291,2025-02-24,2025-03-18,22
239,CB_2025_Feb_FB_3850_DT-DP_V03_9x16_VID_EN_Opti_C-Pointing_Sale_CTA-70_Angle-W_M-POW_VL-30s_G-F_S-Moon_FB2036V03.mp4,3850 - Man boobs/dad bod opti on videos || Enhancements: OFF || CBV1 || Batch 1 || 7C || 26/02/25w09 || Valentinas,VIDEO,$8,378,2025-02-26,2025-03-03,5
240,CB_2025_Feb_FB_3866_VK-RP_V01_1x1_IMG_EN_New_C-BulletPoints_Evergreen_CTA-NONE_Angle-W-B-C_M-NONE_VL-None_G-NONE_P-OG_S-NEW.jpg,3866 - Sticky notes || Enhancements: OFF || CBV1 || Batch 1 || 7C || 26/02/25w09 || Valentinas,SHARE,$8,399,2025-02-26,2025-02-28,2
241,CB_2025_Jan_FB_3751_VK-DP_V04_4x5_IMG_EN_New_C-BulletPoints_Sale_CTA-NY_Angle-W-B-C_M-NONE_VL-None_G-M_P-GLP1_S-NONE.jpg,3751 - opti 3608 GLP1 - VK-DP || Enhancements: OFF || GLP-1 || Batch 1 || 7C || 20/02/25w09 || Valentinas,SHARE,$8,328,2025-02-24,2025-03-15,19
242,CB_2025_Feb_FB_3830_LZ_V03_9x16_VID_EN_New_C-Testimonial_Evergreen_CTA-SALE_Angle-W-B-C_M-GLAD_VL-15s_G-F_P-OG_S-NEW.mp4,3830 - I googled my symptoms || Enhancements: OFF || CBV1 || Batch 1 || 7C || 26/02/25w09 || Valentinas,VIDEO,$7,252,2025-02-26,2025-02-28,2
243,CB_2025_Jan_FB_3723_SO_V05_4x5_IMG_EN_New_C-NONE_Evergreen_CTA-SALE_Angle-W_M-NONE_VL-None_G-NONE_P-NONE_S-NONE,3723 - Notion Idea #92 MAN BOOBS || Enhancements: OFF || CBV1 || Batch 1 || 1C || 28/01/25w05 || Kostas,SHARE,$7,521,2025-01-28,2025-02-24,27
244,CB_2025_Feb_FB_3850_DT-DP_V02_9x16_VID_EN_Opti_C-Benefits_Sale_CTA-70_Angle-W-B_M-MIX_VL-45s_G-MF_P-OG_S-WHAT_FB3097V03.mp4,3850 - Man boobs/dad bod opti on videos || Enhancements: OFF || CBV1 || Batch 1 || 7C || 26/02/25w09 || Valentinas,VIDEO,$7,337,2025-02-26,2025-03-03,5
245,CB_2025_Feb_FB_3775_SO-JT_V02_9x16_VID_EN_New_C-Headline_Evergreen_CTA-NONE_Angle-W_M-NONE_VL-7s_G-NONE_P-GLP1_S-Grind_To_The_Top.mp4,3775 - CB / GLP-1 / VID BATCH || Enhancements: OFF || GLP-1 || Batch 1 || 7C || 24/02/25w09 || Valentinas,VIDEO,$7,197,2025-02-24,2025-03-06,10
246,CB_2025_Feb_FB_3802_VK-DP_V04_1x1_IMG_EN_Opti_C-BulletPoints_Evergreen_CTA-70_Angle-W-B-C_M-NONE_VL-None_G-F_P-GLP1_S-NEW_FB2762V05.jpg,3802 - 7 hot benefits GLP VK || Enhancements: OFF || GLP-1 || Batch 1 || 7C || 24/02/25w09 || Valentinas,SHARE,$7,292,2025-02-24,2025-03-07,11
247,CB_2025_Jan_FB_3748_VK-DP_V04_4x5_IMG_EN_New_C-BulletPoints_Sale_CTA-NY_Angle-W-B-C_M-NONE_VL-None_G-M_P-OG_S-NONE.png - Copy,3748 - winner ads opti - GLP1 - VK-DP || Enhancements: OFF || GLP-1 || Batch 1 || 7C || 20/02/25w09 || Valentinas,SHARE,$6,241,2025-02-24,2025-03-16,20
248,CB_2025_Feb_FB_3845_VK_V01_9x16_VID_EN_New_C-BulletPoints_Evergreen_CTA-70_Angle-W-B-C_M-POW_VL-15s_G-M_P-OG_S-NEW,3849 - #135 My routine to lose weight - VK || Enhancements: OFF || CBV1 || Batch 1 || 7C || 26/02/25w09 || Valentinas,VIDEO,$6,314,2025-02-26,2025-02-26,0
249,CB_2025_Feb_FB_3775_SO-JT_V04_9x16_VID_EN_New_C-Headline_Evergreen_CTA-NONE_Angle-W_M-NONE_VL-7s_G-NONE_P-GLP1_S-euphoria.mp4,3775 - CB / GLP-1 / VID BATCH || Enhancements: OFF || GLP-1 || Batch 1 || 7C || 24/02/25w09 || Valentinas,VIDEO,$6,165,2025-02-24,2025-03-06,10
250,CB_2022_Mar3_FB_713_IK_V04_1x1_IMG_EN_Opti_C-WrittenTesti_HE-98_A-ExtremeBodyVisualization_HK-bodypart_Pain-W_CLR-PURPLE_BG-IMAGE_ME-MIX_MA-YOUNG,US || Manual Bid || BFCM || COST CAP 71 || 1C || 15/11/24,SHARE,$6,318,2024-11-15,2025-03-27,132
251,CB_2025_Feb_FB_3845_VK_V04_9x16_VID_EN_New_C-BulletPoints_Evergreen_CTA-70_Angle-W-B-C_M-NATE_VL-15s_G-M_P-OG_S-NEW.mp4,3849 - #135 My routine to lose weight - VK || Enhancements: OFF || CBV1 || Batch 1 || 7C || 26/02/25w09 || Valentinas,VIDEO,$6,242,2025-02-26,2025-02-26,0
252,CB_2025_Feb_FB_3830_LZ_V04_9x16_VID_EN_New_C-Testimonial_Evergreen_CTA-SALE_Angle-W-B-C_M-TRC_VL-15s_G-F_P-OG_S-NEW.mp4,3830 - I googled my symptoms || Enhancements: OFF || CBV1 || Batch 1 || 7C || 26/02/25w09 || Valentinas,VIDEO,$5,257,2025-02-26,2025-02-28,2
253,CB_2025_Feb_FB_3827_LZ_V03_1x1_IMG_EN_Opti_C-Headline_Evergreen_CTA-SALE_Angle-W_M-NONE_VL-None_G-M_P-CBV2_S-NONE_FB3705V02,3827 - V2 img winner opti || Batch 2 || 7C || 18/02/2025w08,SHARE,$5,279,2025-02-18,2025-03-27,37
254,CB_2022_Mar3_FB_713_IK_V04_1x1_IMG_EN_Opti_C-WrittenTesti_HE-98_A-ExtremeBodyVisualization_HK-bodypart_Pain-W_CLR-PURPLE_BG-IMAGE_ME-MIX_MA-YOUNG,US || Manual Bid || BFCM || COST CAP 91 || 1C || 15/11/24,SHARE,$5,298,2024-11-15,2025-02-27,104
255,CB_2025_Jan_FB_3747_CHUB-AA_V04_9x16_IMG_EN_Opti_C-NONE_CTA-NONE_Angle-Sale_M-NONE_VL-None_TR-None_G-NONE_P-OG_S-NONE,3747 Clean Sale [HB winner ITR] CHUB || Enhancements: OFF || CBV1 || Batch Ä… || 1C || 02/02/25w06 || Kostas,SHARE,$4,341,2025-02-02,2025-03-27,53
256,CB_2025_Jan_FB_3762_LZ_V04_4x5_IMG_EN_Opti_C-NegativeMark_Evergreen_CTA-NONE_Angle-W_M-NONE_VL-None_G-NONE_P-GLP1_S-NONE_FB3251V01.png,3762 - Notion Idea #123 it's not cheap GLP1 || Enhancements: OFF || GLP-1 || Batch 1 || 7C || 20/02/25w09 || Valentinas,SHARE,$4,239,2025-02-24,2025-03-18,22
257,CB_2024_Jan_FB_2762_IK_V04_1x1_IMG_EN_New_C-WrittenTesti_CTA-CTA_Pain-W-B-C_M-NONE_VL-None_TR-None_G-NONE_P-V2_S-NONE,CBV2 || AU || ðŸ’° Advantage+ || US || BROAD || 7C || Existing_customer_5% || 19/12/24 Ad set,SHARE,$4,126,2024-12-19,2025-03-27,98
258,CB_2025_Jan_FB_3723_SO_V20_4x5_IMG_EN_New_C-NONE_Evergreen_CTA-SALE_Angle-W_M-NONE_VL-None_G-NONE_P-NONE_S-NONE,3723 - Notion Idea #92 MAN BOOBS || Enhancements: OFF || CBV1 || Batch 4 || 1C || 28/01/25w05 || Kostas,SHARE,$4,292,2025-01-28,2025-03-11,42
259,CB_2025_Jan_FB_3723_SO_V16_4x5_IMG_EN_New_C-NONE_Evergreen_CTA-SALE_Angle-W_M-NONE_VL-None_G-NONE_P-NONE_S-NONE,3723 - Notion Idea #92 MAN BOOBS || Enhancements: OFF || CBV1 || Batch 4 || 1C || 28/01/25w05 || Kostas,SHARE,$4,298,2025-01-28,2025-03-11,42
260,CB_2025_Feb_FB_3811_DT_V02_9x16_VID_EN_Opti_C-Pointing_Sale_CTA-70_Angle-W_M-JOG_VL-30s_G-F_P-OG_S-New_FB2103V02,3811 - #133 Green screen timeframe hooks || Enhancements: OFF || CBV1 || Batch 1 || 7C || 19/02/25w08 || Kostas,VIDEO,$4,96,2025-02-19,2025-03-12,21
261,CB_2025_Feb_FB_3812_SO_V07_4x5_IMG_EN_Opti_C-NONE_Evergreen_CTA-SALE_Angle-W_M-NONE_VL-None_G-NONE_P-NONE_S-NONE_FB3723V07,3812 - 3723 Man Boobs Opti || Enhancements: OFF || CBV1 || Batch 5 || 7C || 19/02/25w08 || Kostas,SHARE,$4,160,2025-02-19,2025-02-24,5
262,CB_2024_Oct_FB_3251_LZ-VU_V01_1x1_IMG_EN_New_C-NegativeMark_Evergreen_CTA-NONE_Angle-Cort_M-NONE_VL-None_G-NONE_P-NONE_S-NONE.png,US || Manual Bid || BFCM || COST CAP 71 || 1C || 15/11/24,SHARE,$3,119,2024-11-15,2025-03-26,131
263,CB_2025_Jan_FB_3749_VK-DP_V03_4x5_IMG_EN_New_C-BulletPoints_Sale_CTA-NY_Angle-W-B-C_M-NONE_VL-None_G-M_P-GLP1_S-NONE.jpg,3749 - beer belly opti GLP1- VK=DP || Enhancements: OFF || GLP-1 || Batch 1 || 7C || 20/02/25w09 || Valentinas,SHARE,$3,96,2025-02-24,2025-03-08,12
264,CB_2025_Jan_FB_3747_CHUB-AA_V02_9x16_IMG_EN_Opti_C-NONE_CTA-NONE_Angle-Sale_M-NONE_VL-None_TR-None_G-NONE_P-OG_S-NONE,3747 Clean Sale [HB winner ITR] CHUB || Enhancements: OFF || CBV1 || Batch Ä… || 1C || 02/02/25w06 || Kostas,SHARE,$3,202,2025-02-02,2025-03-27,53
265,CB_2025_Feb_FB_3845_VK_V03_9x16_VID_EN_New_C-BulletPoints_Evergreen_CTA-70_Angle-W-B-C_M-POW_VL-15s_G-M_P-OG_S-NEW.mp4,3849 - #135 My routine to lose weight - VK || Enhancements: OFF || CBV1 || Batch 1 || 7C || 26/02/25w09 || Valentinas,VIDEO,$3,165,2025-02-26,2025-02-26,0
266,CB_2025_Jan_FB_3757_LZ-DP_V20_9x16_VID_EN_Opti_C-NegativeMark_Evergreen_CTA-NONE_Angle-W-B_M-MAG_VL-45s_G-F_P-GLP1_S-WHAT_FB3311V14.mp4,3757 - GLP1 video winner opti Batch 3+4 || Enhancements: OFF || GLP-1 || Batch 4 || 7C || 24/02/25w09 || Valentinas,VIDEO,$3,112,2025-02-24,2025-03-17,21
267,CB_2025_Jan_FB_3757_LZ-DP_V17_9x16_VID_EN_Opti_C-NegativeMark_Evergreen_CTA-NONE_Angle-W_M-ATBJ_VL-45s_G-F_P-GLP1_S-MOON_FB3626V01.mp4,3757 - GLP1 video winner opti Batch 3+4 || Enhancements: OFF || GLP-1 || Batch 4 || 7C || 24/02/25w09 || Valentinas,VIDEO,$3,117,2025-02-24,2025-03-16,20
268,CB_2025_Jan_FB_3756_VK-DP_V04_4x5_IMG_EN_New_C-BulletPoints_Evergreen_CTA-NONE_Angle-W-B-C_M-NONE_VL-None_G-M_P-GLP1_S-NONE.png,3756 - opti 2834 GLP1 || Enhancements: OFF || GLP-1 || Batch 1 || 7C || 24/02/25w09 || Valentinas,SHARE,$3,122,2025-02-24,2025-03-11,15
269,CB_2025_Jan_FB_3764_LZ-RP_V05_9x16_VID_EN_New_C-BulletPoints_Evergreen_CTA-NONE_Angle-W_M-MAN_VL-45s_G-M_P-GLP1_S-NEW.mp4,3764 - Notion idea #128 Biggest mistakes || Enhancements: OFF || GLP-1 || Batch 1 || 7C || 20/02/25w09 || Valentinas,VIDEO,$3,179,2025-02-24,2025-03-06,10
270,CB_2025_Feb_FB_3793_VK-DP_V03_1x1_VID_EN_Opti_C-BulletPoints_Evergreen_CTA-70_Angle-W-B-C_M-NONE_VL-None_G-F_P-OG_S-NEW_FB3705V02,3793 -  3705 test opti || Enhancements: OFF || CBV1 || Batch 1 || 1C || 11/02/25w07 || Kostas,SHARE,$3,117,2025-02-11,2025-02-28,17
271,CB_2024_Dec_FB_3619_VK-JT_V02_4x5_VID_EN_New_C-BulletPoints_Sale_CTA-NY_Angle-W-B-C_M-NONE_VL-None_G-NONE_P-OG_S-NONE,CB || US || Funnel B: Shopify || 7DC || 2nd try || 26/02/2025,SHARE,$2,256,2025-02-26,2025-03-04,6
272,CB_2024_Dec_FB_3619_VK-JT_V02_4x5_VID_EN_New_C-BulletPoints_Sale_CTA-NY_Angle-W-B-C_M-NONE_VL-None_G-NONE_P-OG_S-NONE,CB || US || Funnel A: React || 7DC || 2nd try || 26/02/2025,SHARE,$2,247,2025-02-26,2025-03-04,6
273,CB_2025_Feb_FB_3811_DT_V03_9x16_VID_EN_Opti_C-Sale_Sale_CTA-70_Angle-W_M-JOG_VL-45s_G-M-F_P-OG_S-Moon_FB2263V04,3811 - #133 Green screen timeframe hooks || Enhancements: OFF || CBV1 || Batch 1 || 7C || 19/02/25w08 || Kostas,VIDEO,$2,13,2025-02-19,2025-03-11,20
274,CB_2022_Mar3_FB_713_IK_V04_1x1_IMG_EN_Opti_C-WrittenTesti_HE-98_A-ExtremeBodyVisualization_HK-bodypart_Pain-W_CLR-PURPLE_BG-IMAGE_ME-MIX_MA-YOUNG,US || Manual Bid || BFCM || COST CAP 81 || 1C || 15/11/24,SHARE,$2,115,2024-11-15,2025-03-26,131
275,CB_2023_Jul_FB_2217_IB_V04_9x16_VID_EN_Opti_C-Pointing_CTA-SMR_Pain-W-B_M-TRC_VL-30s_TR-None_G-F_P-None_S-FRIGGA,US || Manual Bid || BID CAP 111 || 1C || 21/12/24,VIDEO,$2,58,2024-12-22,2025-03-24,92
276,CB_2025_Feb_FB_3820_LZ_V03_9x16_VID_EN_Opti_C-Testimonial_Evergreen_CTA-SALE_Angle-W-B-C_M-TRC_VL-30s_G-F_P-OG_S-FRIGGA_FB2217V04_1,3820 - Calorie deficit hooks || Enhancements: OFF || CBV1 || Batch 1 || 7C || 19/02/25w08 || Kostas,VIDEO,$2,60,2025-02-19,2025-02-26,7
277,CB_2025_Feb_FB_3816_VK-JT_V01_1x1_IMG_EN_New_C-BulletPoints_Evergreen_CTA-70_Angle-W-B-C_M-JOG_VL-None_G-NONE_P-OG_S-NEW_FB3656V02,3822 - OPTI 3656 -VK || Enhancements: OFF || CBV1 || Batch 1 || 7C || 19/02/25w08 || Kostas,SHARE,$2,41,2025-02-19,2025-02-26,7
278,CB_2025_Jan_FB_3764_LZ-RP_V03_9x16_VID_EN_New_C-BulletPoints_Evergreen_CTA-NONE_Angle-W_M-MAN_VL-45s_G-M_P-GLP1_S-NEW.mp4,3764 - Notion idea #128 Biggest mistakes || Enhancements: OFF || GLP-1 || Batch 1 || 7C || 20/02/25w09 || Valentinas,VIDEO,$2,66,2025-02-24,2025-03-06,10
279,CB_2025_Feb_FB_3863_DT-DP_V01_9x16_VID_EN_New_C-Trend_Sale_CTA-70_Angle-W_M-POW_VL-30s_G-M_P-OG_S-NEW,3863 - Aaron man boobs vid || Enhancements: OFF || CBV1 || Batch 1 || 7C || 26/02/25w09 || Valentinas,VIDEO,$2,101,2025-02-26,2025-03-23,25
280,CB_2025_Jan_FB_3749_VK-DP_V02_4x5_IMG_EN_New_C-BulletPoints_Sale_CTA-NY_Angle-W-B-C_M-NONE_VL-None_G-M_P-GLP1_S-NONE.jpg,3749 - beer belly opti GLP1- VK=DP || Enhancements: OFF || GLP-1 || Batch 1 || 7C || 20/02/25w09 || Valentinas,SHARE,$2,51,2025-02-24,2025-03-08,12
281,CB_2024_Oct_FB_3251_LZ-VU_V01_1x1_IMG_EN_New_C-NegativeMark_Evergreen_CTA-NONE_Angle-Cort_M-NONE_VL-None_G-NONE_P-NONE_S-NONE.png,US || Manual Bid || BFCM || COST CAP 91 || 1C || 15/11/24,SHARE,$2,37,2024-11-15,2025-02-27,104
282,CB_2025_Jan_FB_3762_LZ_V01_4x5_IMG_EN_Opti_C-NegativeMark_Evergreen_CTA-NONE_Angle-Cort_M-NONE_VL-None_G-NONE_P-GLP1_S-NONE_FB3251V01.png,3762 - Notion Idea #123 it's not cheap GLP1 || Enhancements: OFF || GLP-1 || Batch 1 || 7C || 20/02/25w09 || Valentinas,SHARE,$2,66,2025-02-24,2025-03-18,22
283,CB_2025_Feb_FB_3811_DT_V01_9x16_VID_EN_Opti_C-Pointing_Sale_CTA-70_Angle-W_M-JOG_VL-30s_G-F_P-OG_S-New_FB2103V02,3811 - #133 Green screen timeframe hooks || Enhancements: OFF || CBV1 || Batch 1 || 7C || 19/02/25w08 || Kostas,VIDEO,$1,54,2025-02-19,2025-03-12,21
284,CB_2022_Nov_FB_1218_RS_V15_9x16_IMG_EN_Opti_C-Sale_CTA-BLACK_Pain-W_M-NONE_VL-None FB1671V08,US || Manual Bid || BFCM || COST CAP 91 || 1C || 15/11/24,SHARE,$1,50,2024-11-15,2025-02-27,104
285,CB_2025_Jan_FB_3779_VK-DP_V01_1x1_VID_EN_Opti_C-BulletPoints_Evergreen_CTA-70_Angle-W-B-C_M-NONE_VL-None_G-F_P-OG_S-NEW_FB3705V02,3779 - opti 3705 || Enhancements: OFF || CBV1 || Batch 1 || 1C || 04/02/25w06 || Kostas,SHARE,$1,117,2025-02-04,2025-03-20,44
286,CB_2025_Feb_FB_3816_VK-JT_V03_1x1_IMG_EN_New_C-BulletPoints_Evergreen_CTA-70_Angle-W-B-C_M-JOG_VL-None_G-NONE_P-OG_S-NEW_FB3656V02,3822 - OPTI 3656 -VK || Enhancements: OFF || CBV1 || Batch 1 || 7C || 19/02/25w08 || Kostas,SHARE,$1,54,2025-02-19,2025-02-26,7
287,CB_2025_Jan_FB_3762_LZ_V03_4x5_IMG_EN_Opti_C-NegativeMark_Evergreen_CTA-NONE_Angle-CR_M-NONE_VL-None_G-NONE_P-GLP1_S-NONE_FB3251V01.png,3762 - Notion Idea #123 it's not cheap GLP1 || Enhancements: OFF || GLP-1 || Batch 1 || 7C || 20/02/25w09 || Valentinas,SHARE,$1,29,2025-02-24,2025-03-17,21
288,CB_2025_Feb_FB_3812_SO_V08_4x5_IMG_EN_Opti_C-NONE_Evergreen_CTA-SALE_Angle-W_M-NONE_VL-None_G-NONE_P-NONE_S-NONE_FB3723V07,3812 - 3723 Man Boobs Opti || Enhancements: OFF || CBV1 || Batch 5 || 7C || 19/02/25w08 || Kostas,SHARE,$1,46,2025-02-19,2025-02-24,5
289,CB_2025_Feb_FB_3863_DT-DP_V04_9x16_VID_EN_New_C-Trend_Sale_CTA-70_Angle-W_M-POW_VL-30s_G-M_P-OG_S-NEW.mp4,3863 - Aaron man boobs vid || Enhancements: OFF || CBV1 || Batch 1 || 7C || 26/02/25w09 || Valentinas,VIDEO,$1,38,2025-02-26,2025-03-27,29
290,CB_2025_Feb_FB_3821_SO-KB-JG_V16_4x5_IMG_EN_Opti_C-NONE_Evergreen_CTA-SALE_Angle-W_M-NONE_VL-None_G-NONE_P-NONE_S-NONE_FB3723V07,3812 - 3723 Man Boobs Opti || Enhancements: OFF || CBV1 || Batch 4 || 7C || 19/02/25w08 || Kostas,SHARE,$1,44,2025-02-18,2025-02-24,6
291,CB_2023_May_FB_2103_MB_V02_9x16_VID_EN_Opti_C-Sale_CTA-SMR_Pain-W_M-JOG_VL-30s_TR-None_G-M-F_P-None_S-What,US || Manual Bid || BID CAP 111 || 1C || 21/12/24,VIDEO,$1,27,2024-12-28,2025-03-27,89
292,CB_2025_Feb_FB_3793_VK-DP_V02_1x1_VID_EN_Opti_C-BulletPoints_Evergreen_CTA-70_Angle-W-B-C_M-NONE_VL-None_G-F_P-OG_S-NEW_FB3705V02,3793 -  3705 test opti || Enhancements: OFF || CBV1 || Batch 1 || 1C || 11/02/25w07 || Kostas,SHARE,$1,50,2025-02-11,2025-02-28,17
293,CB_2025_Feb_FB_3812_SO_V06_4x5_IMG_EN_Opti_C-NONE_Evergreen_CTA-SALE_Angle-W_M-NONE_VL-None_G-NONE_P-NONE_S-NONE_FB3723V07,3812 - 3723 Man Boobs Opti || Enhancements: OFF || CBV1 || Batch 5 || 7C || 19/02/25w08 || Kostas,SHARE,$0,21,2025-02-19,2025-02-24,5
294,CB_2025_Feb_FB_3784_SO-RP_V09_4x5_IMG_EN_Opti_C-Headline_Evergreen_CTA-NONE_Angle-W_M-NONE_VL-None_G-NONE_P-OG_S-NONE_FB3726V01,3784 - 3726 ad copy opti || Enhancements: OFF || CBV1 || Batch 2 || 1C || 09/02/25w07 || Kostas,SHARE,$0,20,2025-02-09,2025-02-26,17
295,CB_2025_Feb_FB_3787_CHUB_V02_9x16_VID_EN_New_C-NONE_CTA-NONE_Angle-None_M-NONE_VL-None_TR-None_G-NONE_P-NONE_S-NONE,3787 - DadBod Messaging CHUB || Enhancements: OFF || CBV1 || Batch 1 || 7DC || 16/02/25w08 || Kostas,VIDEO,$0,11,2025-02-16,2025-02-24,8
296,CB_2025_Feb_FB_3863_DT-DP_V02_9x16_VID_EN_New_C-Trend_Sale_CTA-70_Angle-W_M-POW_VL-30s_G-M_P-OG_S-NEW.mp4,3863 - Aaron man boobs vid || Enhancements: OFF || CBV1 || Batch 1 || 7C || 26/02/25w09 || Valentinas,VIDEO,$0,19,2025-02-26,2025-03-27,29
297,CB_2025_Feb_FB_3812_SO_V02_4x5_IMG_EN_Opti_C-NONE_Evergreen_CTA-SALE_Angle-W_M-NONE_VL-None_G-NONE_P-NONE_S-NONE_FB3723V07,3812 - 3723 Man Boobs Opti || Enhancements: OFF || CBV1 || Batch 1 || 1C || 11/02/25w07 || Kostas,SHARE,$0,30,2025-02-11,2025-02-26,15
298,CB_2025_Jan_FB_3779_VK-DP_V03_1x1_VID_EN_Opti_C-BulletPoints_Evergreen_CTA-70_Angle-W-B-C_M-NONE_VL-None_G-F_P-OG_S-NEW_FB3705V02,3779 - opti 3705 || Enhancements: OFF || CBV1 || Batch 1 || 1C || 04/02/25w06 || Kostas,SHARE,$0,11,2025-02-04,2025-03-20,44
299,CB_2025_Jan_FB_3757_LZ-DP_V17_9x16_VID_EN_Opti_C-NegativeMark_Evergreen_CTA-NONE_Angle-W_M-ATBJ_VL-45s_G-F_P-GLP1_S-MOON_FB3626V01.mp4,3757 - GLP1 video winner opti Batch 3+4 || Enhancements: OFF || GLP-1 || Batch 4 || 7C || 24/02/25w09 || Valentinas,VIDEO,$0,13,2025-02-24,2025-03-17,21
300,CB_2025_Feb_FB_3820_LZ_V04_9x16_VID_EN_Opti_C-Testimonial_Evergreen_CTA-SALE_Angle-W-B-C_M-TRC_VL-30s_G-F_P-OG_S-FRIGGA_FB2217V04,3820 - Calorie deficit hooks || Enhancements: OFF || CBV1 || Batch 1 || 7C || 19/02/25w08 || Kostas,VIDEO,$0,8,2025-02-19,2025-02-26,7
301,CB_2024_Oct_FB_3251_LZ-VU_V01_1x1_IMG_EN_New_C-NegativeMark_Evergreen_CTA-NONE_Angle-Cort_M-NONE_VL-None_G-NONE_P-NONE_S-NONE.png,US || Manual Bid || BFCM || COST CAP 81 || 1C || 15/11/24,SHARE,$0,7,2024-11-15,2025-03-17,122
302,CB_2025_Feb_FB_3820_LZ_V02_9x16_VID_EN_Opti_C-Testimonial_Evergreen_CTA-SALE_Angle-W-B-C_M-TRC_VL-30s_G-F_P-OG_S-FRIGGA_FB2217V04_1,3820 - Calorie deficit hooks || Enhancements: OFF || CBV1 || Batch 1 || 7C || 19/02/25w08 || Kostas,VIDEO,$0,1,2025-02-19,2025-02-24,5
303,CB_2025_Feb_FB_3821_SO-KB-JG_V15_4x5_IMG_EN_Opti_C-NONE_Evergreen_CTA-SALE_Angle-W_M-NONE_VL-None_G-NONE_P-NONE_S-NONE_FB3723V07,3812 - 3723 Man Boobs Opti || Enhancements: OFF || CBV1 || Batch 4 || 7C || 19/02/25w08 || Kostas,SHARE,$0,3,2025-02-18,2025-02-24,6
304,CB_2025_Feb_FB_3821_SO-KB-JG_V14_4x5_IMG_EN_Opti_C-NONE_Evergreen_CTA-SALE_Angle-W_M-NONE_VL-None_G-NONE_P-NONE_S-NONE_FB3723V07,3812 - 3723 Man Boobs Opti || Enhancements: OFF || CBV1 || Batch 4 || 7C || 19/02/25w08 || Kostas,SHARE,$0,2,2025-02-18,2025-02-24,6
305,CB_2024_Dec_FB_3622_LZ-KB_V03_4x5_IMG_EN_Opti_C-NONE_Sale_CTA-XMAS_Angle-GH_M-NONE_VL-None_G-NONE_P-OG_S-NONE_FB2227V08 - Copy,US || Manual Bid || BID CAP 111 || 1C || 21/12/24,SHARE,$0,1,2024-12-22,2025-03-26,94
