,Ad Name,Adset Name,Creative Type,Spend In USD,Impressions,First Ad Spend Date,Last Ad Spend Date,Days ad spending
1,CB_2023_Apr_FB_1989_RS_V08_9x16_VID_EN_Opti_C-Trend_CTA-SMR_Pain-W_M-MIX_VL-30s_TR-None_G-MF_P-None,🌶️ || US || ASC+ || ->CC141 || VIDEO Only || US+CA || 0% EXISTING CAP || 7C || 07/08.24  Ad set,VIDEO,"$22,508","1,208,460",2024-08-07,2025-03-24,229
2,CB_2025_Jan_FB_3723_SO_V04_4x5_IMG_EN_New_C-NONE_Evergreen_CTA-SALE_Angle-W_M-NONE_VL-None_G-NONE_P-NONE_S-NONE,🌶️ || US || ASC+ || ->CC141 || VIDEO Only || US+CA || 0% EXISTING CAP || 7C || 07/08.24  Ad set,SHARE,"$13,318","1,068,309",2025-02-12,2025-03-27,43
3,CB_2024_Aug_FB_3097_VK-DP_V03_9x16_VID_EN_Opti_C-Benefits_CTA-SMR_Pain-W-B_M-MIX_VL-45s_TR-None_G-MF_P-OG_S-WHAT_FB2516V13,🌶️ || US || ASC+ || ->CC141 || VIDEO Only || US+CA || 0% EXISTING CAP || 7C || 07/08.24  Ad set,VIDEO,"$10,574","573,106",2024-09-04,2025-03-27,204
4,CB_2023_Jul_FB_2217_IB_V04_9x16_VID_EN_Opti_C-Pointing_CTA-SMR_Pain-W-B_M-TRC_VL-30s_TR-None_G-F_P-None_S-FRIGGA,🌶️ || US || ASC+ || ->CC141 || VIDEO Only || US+CA || 0% EXISTING CAP || 7C || 07/08.24  Ad set,VIDEO,"$9,704","392,165",2024-08-07,2025-03-27,232
5,CB_2025_Feb_FB_3812_SO_V03_4x5_IMG_EN_Opti_C-NONE_Evergreen_CTA-SALE_Angle-W_M-NONE_VL-None_G-NONE_P-NONE_S-NONE_FB3723V07,🌶️ || US || ASC+ || ->CC141 || VIDEO Only || US+CA || 0% EXISTING CAP || 7C || 07/08.24  Ad set,SHARE,"$8,316","593,115",2025-02-24,2025-03-15,19
6,CB_2023_Jul_FB_2284_DA_V05_9x16_VID_EN_Opti_C-Sale_CTA-SMR_Pain-W_M-JANW_VL-30s_TR-None_G-M_P-None_S-WHAT_FB2103V02,🌶️ || US || ASC+ || ->CC141 || VIDEO Only || US+CA || 0% EXISTING CAP || 7C || 07/08.24  Ad set,VIDEO,"$7,891","373,099",2024-08-07,2025-03-27,232
7,CB_2025_Feb_FB_3787_CHUB_V01_9x16_VID_EN_New_C-NONE_CTA-NONE_Angle-None_M-NONE_VL-None_TR-None_G-NONE_P-NONE_S-NONE,🌶️ || US || ASC+ || ->CC141 || VIDEO Only || US+CA || 0% EXISTING CAP || 7C || 07/08.24  Ad set,VIDEO,"$7,601","405,411",2025-02-21,2025-03-19,26
8,CB_2023_Jul_FB_2227_RS_V08_1x1_IMG_EN_New_C-Sale_CTA-CTA_None_M-NONE_VL-None_TR-None_G-NONE_P-None_S-NONE,🌶️ || US || ASC+ || ->CC141 || VIDEO Only || US+CA || 0% EXISTING CAP || 7C || 07/08.24  Ad set,SHARE,"$7,031","476,514",2024-09-30,2025-03-27,178
9,Dynamic_Creative_Statics_CA_Flow,WC || CA || DYNAMIC CREATIVE Static winners || ADV+ audience || 7C || 16.02.2025,SHARE,"$6,326","506,511",2025-02-16,2025-03-27,39
10,CB_2023_Jul_FB_2226_MB_V04_9x16_VID_EN_Opti_C-Testim_CTA-SMR_Pain-W_M-MIX_VL-30s_TR-None_G-F_P-None_S-Starry,🌶️ || US || ASC+ || ->CC141 || VIDEO Only || US+CA || 0% EXISTING CAP || 7C || 07/08.24  Ad set,VIDEO,"$5,782","232,967",2024-10-28,2025-03-27,150
11,CB_2025_Jan_FB_3779_VK-DP_V02_1x1_VID_EN_Opti_C-BulletPoints_Evergreen_CTA-70_Angle-W-B-C_M-NONE_VL-None_G-F_P-OG_S-NEW_FB3705V02,🌶️ || US || ASC+ || ->CC141 || VIDEO Only || US+CA || 0% EXISTING CAP || 7C || 07/08.24  Ad set,SHARE,"$4,513","302,381",2025-02-12,2025-03-19,35
12,CB_2024_Nov_FB_3264_LZ_V29_4x5_VID_EN_Opti_C-NegativeMark_Sale_CTA-BF_Angle-W-B_M-LRNS_VL-30s_G-M_P-OG_S-NONE,🌶️ || US || ASC+ || ->CC141 || VIDEO Only || US+CA || 0% EXISTING CAP || 7C || 07/08.24  Ad set,VIDEO,"$4,448","240,358",2024-12-04,2025-03-27,113
13,CB_2025_Jan_FB_3748_VK-DP_V01_4x5_IMG_EN_New_C-BulletPoints_Sale_CTA-NY_Angle-W-B-C_M-NONE_VL-None_G-M_P-OG_S-NONE,GLP-1 💜 || ASC+ || US || 5% EXISTING CAP || 7C || 20/02/25 . Ad set,SHARE,"$4,088","173,086",2025-02-24,2025-03-15,19
14,CB_2023_May_FB_2263_MB_V04_9x16_VID_EN_New_C-Sale_CTA-SMR_Pain-W_M-JOG_VL-45s_TR-None_G-M-F_P-None_S-Moon,🌶️ || US || ASC+ || ->CC141 || VIDEO Only || US+CA || 0% EXISTING CAP || 7C || 07/08.24  Ad set,VIDEO,"$4,040","138,862",2024-08-07,2025-03-27,232
15,CB_2024_Sep_FB_3175_DA-KB_V04_1x1_IMG_EN_New_C-ADVRT_Evergreen_CTA-NONE_Angle-W_M-NONE_VL-None_G-NONE_P-CBV2_S-NONE_blog_colonbroomvsmammoth_cv_en,CBV2 || Advantage+ || Advertorial || Higher pricing || US || 0% EXISTING CAP || BROAD || 7C || 20/01/25  Campaign Ad set,SHARE,"$3,549","148,427",2025-01-20,2025-03-27,66
16,CB_2025_Feb_FB_3827_LZ_V04_1x1_IMG_EN_Opti_C-Headline_Evergreen_CTA-SALE_Angle-W_M-NONE_VL-None_G-M_P-CBV2_S-NONE_FB3779V02,CBV2 || US || Manual Bid: ROAS GOAL: 1.00 -> 1.1 || 7DC || 22/01/2025,SHARE,"$3,336","105,387",2025-02-18,2025-03-27,37
17,CB_2023_Oct_FB_2516_VK_V13_9x16_VID_EN_Opti_C-Benefits_CTA-AUTUM_Pain-W-B_M-PASQ_VL-30s_TR-None_G-M_P-Plan_S-WHAT,🌶️ || US || ASC+ || ->CC141 || VIDEO Only || US+CA || 0% EXISTING CAP || 7C || 07/08.24  Ad set,VIDEO,"$3,131","133,963",2024-12-19,2025-03-27,98
18,CB_2025_Jan_FB_3751_VK-DP_V02_4x5_IMG_EN_New_C-BulletPoints_Sale_CTA-NY_Angle-W-B-C_M-NONE_VL-None_G-M_P-GLP1_S-NONE.jpg,GLP-1 💜 || ASC+ || US || 5% EXISTING CAP || 7C || 20/02/25 . Ad set,SHARE,"$2,565","124,649",2025-03-05,2025-03-18,13
19,CB_2025_Feb_FB_3827_LZ_V01_1x1_IMG_EN_Opti_C-Headline_Evergreen_CTA-NONE_Angle-W_M-NONE_VL-None_G-M_P-CBV2_S-NONE_FB3723V04,CBV2 || US || Manual Bid: ROAS GOAL: 1.00 -> 1.1 || 7DC || 22/01/2025,SHARE,"$2,519","134,322",2025-02-18,2025-03-27,37
20,CB_2023_Jul_FB_2217_IB_V04_9x16_VID_EN_Opti_C-Pointing_CTA-SMR_Pain-W-B_M-TRC_VL-30s_TR-None_G-F_P-None_S-FRIGGA,US || Kilo Product's leads LAL || 7C || 04/03/25,VIDEO,"$2,222","74,945",2025-03-04,2025-03-27,23
21,CB_2024_Jan_FB_2764_RS_V04_9x16_VID_EN_Opti_C-SingleTesti_CTA-SALE_Pain-W_M-TRC_VL-45s_TR-None_G-F_P-OG_S-MOON_FB2263V04,EU (UK) || 2764 || Trinity Results Too Fast || 1C || 08/01/2025w02,VIDEO,"$1,997","67,999",2025-01-08,2025-03-27,78
22,CB_2025_Jan_FB_3723_SO_V07_4x5_IMG_EN_New_C-NONE_Evergreen_CTA-SALE_Angle-W_M-NONE_VL-None_G-NONE_P-NONE_S-NONE,🌶️ || US || ASC+ || ->CC141 || VIDEO Only || US+CA || 0% EXISTING CAP || 7C || 07/08.24  Ad set,SHARE,"$1,885","127,896",2025-02-04,2025-03-27,51
23,CB_2024_Dec_FB_3619_VK-JT_V02_4x5_VID_EN_New_C-BulletPoints_Sale_CTA-NY_Angle-W-B-C_M-NONE_VL-None_G-NONE_P-OG_S-NONE,🌶️ || US || ASC+ || ->CC141 || VIDEO Only || US+CA || 0% EXISTING CAP || 7C || 07/08.24  Ad set,SHARE,"$1,877","120,489",2024-12-27,2025-03-27,90
24,CB_2025_Feb_FB_3811_DT_V04_9x16_VID_EN_Opti_C-Sale_Sale_CTA-70_Angle-W_M-JOG_VL-45s_G-M-F_P-OG_S-Moon_FB2263V04,3811 - #133 Green screen timeframe hooks || Enhancements: OFF || CBV1 || Batch 1 || 7C || 19/02/25w08 || Kostas,VIDEO,"$1,754","61,077",2025-02-19,2025-03-11,20
25,CB_2025_Feb_FB_3818_LZ-VU_V04_1x1_IMG_EN_Opti_C-Headline_Evergreen_CTA-NONE_Angle-Cort_M-NONE_VL-None_G-NONE_P-NONE_S-NONE_FB3251V01,🌶️ || US || ASC+ || ->CC141 || VIDEO Only || US+CA || 0% EXISTING CAP || 7C || 07/08.24  Ad set,SHARE,"$1,546","81,653",2025-02-17,2025-03-03,14
26,CB_2024_Sep_FB_3175_DA-KB_V03_1x1_IMG_EN_New_C-ADVRT_Evergreen_CTA-NONE_Angle-W_M-NONE_VL-None_G-NONE_P-CBV2_S-NONE_blog_colonbroomvsmammoth_cv_en,CBV2 || Advantage+ || Advertorial || Higher pricing || US || 0% EXISTING CAP || BROAD || 7C || 20/01/25  Campaign Ad set,SHARE,"$1,545","61,278",2025-01-20,2025-03-27,66
27,CB_2025_Jan_FB_3723_SO_V18_4x5_IMG_EN_New_C-NONE_Evergreen_CTA-SALE_Angle-W_M-NONE_VL-None_G-NONE_P-NONE_S-NONE,3723 - Notion Idea #92 MAN BOOBS || Enhancements: OFF || CBV1 || Batch 4 || 1C || 28/01/25w05 || Kostas,SHARE,"$1,525","97,323",2025-01-28,2025-03-07,38
28,CB_2024_Jan_FB_2764_RS_V04_9x16_VID_EN_Opti_C-SingleTesti_CTA-SALE_Pain-W_M-TRC_VL-45s_TR-None_G-F_P-OG_S-MOON_FB2263V04_Page_Personal_Coach,CBV2 || AU || 💰 Advantage+ || US || BROAD || 7C || Existing_customer_5% || 19/12/24 Ad set,VIDEO,"$1,406","33,572",2025-01-16,2025-03-27,70
29,CB_2025_Jan_FB_3747_CHUB-AA_V03_9x16_IMG_EN_Opti_C-NONE_CTA-NONE_Angle-Sale_M-NONE_VL-None_TR-None_G-NONE_P-OG_S-NONE,3747 Clean Sale [HB winner ITR] CHUB || Enhancements: OFF || CBV1 || Batch ą || 1C || 02/02/25w06 || Kostas,SHARE,"$1,389","58,180",2025-02-02,2025-03-27,53
30,CB_2024_Jan_FB_2764_RS_V04_9x16_VID_EN_Opti_C-SingleTesti_CTA-SALE_Pain-W_M-TRC_VL-45s_TR-None_G-F_P-OG_S-MOON_FB2263V04_Page_Personal_Coach,AU || Page: Branded & 3rd Party || 2764 || Trinity Results Too Fast || 1C || 10/01/2025w02,VIDEO,"$1,373","38,513",2025-01-10,2025-03-27,76
31,CB_2025_Feb_FB_3821_SO-KB-JG_V11_4x5_IMG_EN_Opti_C-NONE_Evergreen_CTA-SALE_Angle-W_M-NONE_VL-None_G-NONE_P-NONE_S-NONE_FB3723V07,3821 - Man boobs Opti || Enhancements: OFF || CBV1 || Batch 3 || 7C || 19/02/25w08 || Kostas,SHARE,"$1,295","79,170",2025-02-19,2025-03-09,18
32,CB_2025_Feb_FB_3833_VK_V04_9x16_VID_EN_New_C-BulletPoints_Evergreen_CTA-70_Angle-W-B-C_M-PASQ_VL-15s_G-M_P-OG_S-WHAT.mp4,3833 - do not mix -VK || Enhancements: OFF || CBV1 || Batch 1 || 7C || 26/02/25w09 || Valentinas,VIDEO,"$1,165","58,512",2025-02-26,2025-03-08,10
33,CB_2025_Jan_FB_3779_VK-DP_V04_1x1_VID_EN_Opti_C-BulletPoints_Evergreen_CTA-70_Angle-W-B-C_M-NONE_VL-None_G-F_P-OG_S-NEW_FB3705V02,3779 - opti 3705 || Enhancements: OFF || CBV1 || Batch 1 || 1C || 04/02/25w06 || Kostas,SHARE,"$1,138","55,414",2025-02-04,2025-03-20,44
34,CB_2024_Feb_FB_2812_MB-RP_V07_9x16_VID_EN_Opti_C-Sale_CTA-C65_Pain-W_M-NONE_VL-30s_TR-None_G-MF_P-Plan_S-NEW_FB2601V04_1,US || Kilo Product's leads LAL || 7C || 04/03/25,VIDEO,"$1,055","37,040",2025-03-04,2025-03-27,23
35,CB_2025_Jan_FB_3748_VK-DP_V01_4x5_IMG_EN_New_C-BulletPoints_Sale_CTA-NY_Angle-W-B-C_M-NONE_VL-None_G-M_P-OG_S-NONE.png - Copy,3748 - winner ads opti - GLP1 - VK-DP || Enhancements: OFF || GLP-1 || Batch 1 || 7C || 20/02/25w09 || Valentinas,SHARE,"$1,023","32,146",2025-02-24,2025-03-17,21
36,CB_2025_Jan_FB_3751_VK-DP_V02_4x5_IMG_EN_New_C-BulletPoints_Sale_CTA-NY_Angle-W-B-C_M-NONE_VL-None_G-M_P-GLP1_S-NONE.jpg,3751 - opti 3608 GLP1 - VK-DP || Enhancements: OFF || GLP-1 || Batch 1 || 7C || 20/02/25w09 || Valentinas,SHARE,$981,"50,677",2025-02-24,2025-03-15,19
37,CB_2025_Jan_FB_3779_VK-DP_V02_1x1_VID_EN_Opti_C-BulletPoints_Evergreen_CTA-70_Angle-W-B-C_M-NONE_VL-None_G-F_P-OG_S-NEW_FB3705V02,3779 - opti 3705 || Enhancements: OFF || CBV1 || Batch 1 || 1C || 04/02/25w06 || Kostas,SHARE,$978,"49,083",2025-02-04,2025-03-20,44
38,CB_2025_Jan_FB_3742_SO-DP-KB_V06_4x5_IMG_EN_Opti_C-NONE_Evergreen_CTA-SALE_Angle-W_M-NONE_VL-None_G-NONE_P-CBV2_S-NONE3665V01,CBV2 || US || Manual Bid: ROAS GOAL: 1.00 -> 1.1 || 7DC || 22/01/2025,SHARE,$978,"37,600",2025-02-11,2025-03-27,44
39,CB_2025_Jan_FB_3757_LZ-DP_V16_9x16_VID_EN_Opti_C-BulletPoints_Evergreen_CTA-NONE_Angle-W-B-C_M-KAIT_VL-30s_G-F_P-GLP1_S-WHAT_FB3592V09,3757 - GLP1 video winner opti Batch 3+4 || Enhancements: OFF || GLP-1 || Batch 4 || 7C || 24/02/25w09 || Valentinas,VIDEO,$972,"37,178",2025-02-24,2025-03-18,22
40,CB_2025_Feb_FB_3821_SO-KB-JG_V09_4x5_IMG_EN_Opti_C-NONE_Evergreen_CTA-SALE_Angle-W_M-NONE_VL-None_G-NONE_P-NONE_S-NONE_FB3723V07,3821 - Man boobs Opti || Enhancements: OFF || CBV1 || Batch 3 || 7C || 19/02/25w08 || Kostas,SHARE,$917,"64,217",2025-02-19,2025-03-09,18
41,CB_2024_Oct_FB_3252_VK-DP_V04_4x5_VID_EN_Opti_C-MakingOf_Evergreen_CTA-SALE_Angle-W-B-C_M-JOG_VL-45s_G-F_P-OG_S-MOON_FB3090V02,🌶️ || US || ASC+ || ->CC141 || VIDEO Only || US+CA || 0% EXISTING CAP || 7C || 07/08.24  Ad set,VIDEO,$887,"45,371",2024-11-07,2025-03-27,140
42,CB_2025_Feb_FB_3863_DT-DP_V03_9x16_VID_EN_New_C-Trend_Sale_CTA-70_Angle-W_M-POW_VL-30s_G-M_P-OG_S-NEW.mp4,3863 - Aaron man boobs vid || Enhancements: OFF || CBV1 || Batch 1 || 7C || 26/02/25w09 || Valentinas,VIDEO,$881,"46,929",2025-02-26,2025-03-15,17
43,CB_2023_Jul_FB_2217_IB_V04_9x16_VID_EN_Opti_C-Pointing_CTA-SMR_Pain-W-B_M-TRC_VL-30s_TR-None_G-F_P-None_S-FRIGGA,CBV2 || AU || 💰 Advantage+ || US || BROAD || 7C || Existing_customer_5% || 19/12/24 Ad set,VIDEO,$832,"27,494",2024-12-19,2025-03-24,95
44,CB_2025_Feb_FB_3868_VK-DP_V02_9x16_VID_EN_New_C-BulletPoints_Evergreen_CTA-NONE_Angle-W-B-C_M-NONE_VL-15s_G-M_P-OG_S-NEW.mp4,3868 - What i ordered for dad bod || Enhancements: OFF || CBV1 || Batch 1 || 7C || 03/03/25w10 || Valentinas,VIDEO,$829,"43,548",2025-03-03,2025-03-20,17
45,CB_2025_Jan_FB_3762_LZ_V05_4x5_IMG_EN_Opti_C-NegativeMark_Evergreen_CTA-NONE_Angle-W_M-NONE_VL-None_G-NONE_P-GLP1_S-NONE_FB3251V01.png,3762 - Notion Idea #123 it's not cheap GLP1 || Enhancements: OFF || GLP-1 || Batch 1 || 7C || 20/02/25w09 || Valentinas,SHARE,$817,"37,367",2025-02-24,2025-03-18,22
46,CB_2025_Jan_FB_3718_CHUB_V05_4x5_IMG_EN_Opti_C-NONE_CTA-NONE_Angle-C_M-NONE_VL-None_TR-None_G-M_P-OG_S-NONE,🌶️ || US || ASC+ || ->CC141 || VIDEO Only || US+CA || 0% EXISTING CAP || 7C || 07/08.24  Ad set,SHARE,$791,"49,328",2025-02-12,2025-03-03,19
47,CB_2025_Feb_FB_3869_DT_V04_9x16_GIF_EN_Opti_C-NONE_Evergreen_CTA-None_Angle-W_M-NONE_VL-None_G-NONE_P-NONE_S-New_FB3723V04.mp4,3869 - Man boobs GIF opti || Enhancements: OFF || CBV1 || Batch 1 || 7C || 03/03/25w10 || Valentinas,VIDEO,$781,"36,724",2025-03-03,2025-03-11,8
48,CB_2025_Feb_FB_3855_SO_V03_9x16_VID_EN_New_C-NONE_Evergreen_CTA-NONE_Angle-W_M-NONE_VL-30s_G-None_P-OG_S-NEW,3855 - Notion Idea #141 “Questionnaire” || Enhancements: OFF || CBV1 || Batch 1 || 7C || 03/03/25w10 || Valentinas,VIDEO,$762,"42,571",2025-03-03,2025-03-15,12
49,CB_2025_Feb_FB_3865_SO-JG_V17_9x16_VID_EN_Opti_C-NONE_Evergreen_CTA-NONE_Angle-W_M-NONE_VL-30_G-NONE_P-OG_S-Moon_FB3029V04,3867 - Fat Costume Suit || Enhancements: OFF || CBV1 || Batch 5 || 7C || 03/03/25w10 || Valentinas,VIDEO,$747,"36,514",2025-03-03,2025-03-20,17
50,CB_2025_Feb_FB_3871_DT-DP_V04_9x16_VID_EN_Opti_C-Sale_Sale_CTA-70_Angle-W_M-JANW_VL-30s_G-M_P-OG_S-WHAT_FB2284V05.mp4,3871 - 2284 opti VID || Enhancements: OFF || CBV1 || Batch 1 || 7C || 04/03/25w10 || Valentinas,SHARE,$668,"35,054",2025-03-04,2025-03-15,11
51,CB_2024_Feb_FB_2814_MB-DP_V05_1x1_IMG_EN_New_C-WeightLoss_CTA-None_Pain-W-B-C_M-NONE_VL-None_TR-None_G-NONE_P-V2_S-NONE,EU (UK) || clinically proven opti || 1C || 23/01/2025w04,SHARE,$649,"31,442",2025-01-23,2025-03-10,46
52,CB_2023_May_FB_2263_MB_V04_9x16_VID_EN_New_C-Sale_CTA-SMR_Pain-W_M-JOG_VL-45s_TR-None_G-M-F_P-None_S-Moon,CBV2 || AU || 💰 Advantage+ || US || BROAD || 7C || Existing_customer_5% || 19/12/24 Ad set,VIDEO,$635,"19,480",2024-12-19,2025-03-27,98
53,CB_2023_May_FB_2103_MB_V02_9x16_VID_EN_Opti_C-Sale_CTA-SMR_Pain-W_M-JOG_VL-30s_TR-None_G-M-F_P-None_S-What,US || Manual Bid || BFCM || COST CAP 71 || 1C || 15/11/24,VIDEO,$616,"21,307",2024-11-15,2025-03-27,132
54,CB_2024_Jan_FB_2784_RS_V02_9x16_VID_EN_Opti_C-Pointing_CTA-SALE_Pain-W_M-JOG_VL-30s_TR-None_G-F_P-OG_S-OLLIE_FB2181V01,CBV2 || EU (UK) || 💰 Advantage+ || US || BROAD || 7C || Existing_customer_5% || 15/12/24 Ad set,VIDEO,$599,"26,485",2025-01-09,2025-03-27,77
55,CB_2024_Sep_FB_3175_DA-KB_V01_1x1_IMG_EN_New_C-ADVRT_Evergreen_CTA-NONE_Angle-W_M-NONE_VL-None_G-NONE_P-CBV2_S-NONE_blog_colonbroomvsmammoth_cv_en,CBV2 || Advantage+ || Advertorial || Higher pricing || US || 0% EXISTING CAP || BROAD || 7C || 20/01/25  Campaign Ad set,SHARE,$587,"24,933",2025-01-20,2025-03-27,66
56,CB_2025_Feb_FB_3865_SO-JG_V08_4x5_GIF_EN_New_C-NONE_Evergreen_CTA-NONE_Angle-W_M-NONE_VL-None_G-NONE_P-OG_S-NONE.gif,3867 - Fat Costume Suit || Enhancements: OFF || CBV1 || Batch 2 || 7C || 03/03/25w10 || Valentinas,VIDEO,$585,"27,751",2025-03-03,2025-03-08,5
57,CB_2025_Feb_FB_3865_SO-JG_V09_9x16_VID_EN_Opti_C-NONE_Evergreen_CTA-NONE_Angle-W_M-NONE_VL-30_G-NONE_P-OG_S-WHAT_FB2284V05,3867 - Fat Costume Suit || Enhancements: OFF || CBV1 || Batch 3 || 7C || 03/03/25w10 || Valentinas,VIDEO,$585,"23,916",2025-03-03,2025-03-08,5
58,CB_2025_Feb_FB_3855_SO_V07_9x16_VID_EN_New_C-NONE_Evergreen_CTA-NONE_Angle-W_M-NONE_VL-45s_G-None_P-OG_S-NEW,3855 - Notion Idea #141 “Questionnaire” || Enhancements: OFF || CBV1 || Batch 2 || 7C || 03/03/25w10 || Valentinas,VIDEO,$577,"29,562",2025-03-03,2025-03-08,5
59,CB_2025_Jan_FB_3723_SO_V17_4x5_IMG_EN_New_C-NONE_Evergreen_CTA-SALE_Angle-W_M-NONE_VL-None_G-NONE_P-NONE_S-NONE,3723 - Notion Idea #92 MAN BOOBS || Enhancements: OFF || CBV1 || Batch 4 || 1C || 28/01/25w05 || Kostas,SHARE,$568,"40,721",2025-01-28,2025-03-07,38
60,CB_2025_Feb_FB_3865_SO-JG_V01_4x5_GIF_EN_New_C-NONE_Evergreen_CTA-NONE_Angle-W_M-NONE_VL-None_G-NONE_P-OG_S-NONE,3867 - Fat Costume Suit || Enhancements: OFF || CBV1 || Batch 1 || 7C || 03/03/25w10 || Valentinas,VIDEO,$556,"27,089",2025-03-03,2025-03-08,5
61,CB_2024_Dec_FB_3601_VK-DP_V09_4x5_VID_EN_Opti_C-Dance_CTA-NY_Pain-W-B_M-JOG_VL-30s_TR-None_G-F_P-OG_S-WHAT_FB3045V01,CBV2 || AU || 💰 Advantage+ || US || BROAD || 7C || Existing_customer_5% || 19/12/24 Ad set,SHARE,$554,"20,488",2025-01-03,2025-03-27,83
62,CB_2025_Jan_FB_3723_SO_V04_4x5_IMG_EN_New_C-NONE_Evergreen_CTA-SALE_Angle-W_M-NONE_VL-None_G-NONE_P-NONE_S-NONE.png,CBV2 || AU || 💰 Advantage+ || US || BROAD || 7C || Existing_customer_5% || 19/12/24 Ad set,SHARE,$541,"42,744",2025-02-25,2025-03-27,30
63,CB_2023_Dec_FB_2712_RS-DP_V02_1x1_VID_EN_Opti_C-WrittenTesti_CTA-SALE_Pain-W-B-C_M-NONE_VL-None_TR-None_G-NONE_P-V2_S-NONE_FB2227V08,CBV2 || AU || 💰 Advantage+ || US || BROAD || 7C || Existing_customer_5% || 19/12/24 Ad set,SHARE,$535,"23,193",2024-12-19,2025-03-27,98
64,CB_2025_Feb_FB_3860_LZ-DP_V03_9x16_VID_EN_Opti_C-Testimonial_Evergreen_CTA-SALE_Angle-W_M-MOOD_VL-20s_G-M_P-OG_S-WOOD_FB21176V11_1,3860 - man boobs video 2176 opti || Enhancements: OFF || CBV1 || Batch 1 || 7C || 03/03/25w10 || Valentinas,VIDEO,$533,"30,852",2025-03-03,2025-03-27,24
65,CB_2023_Dec_FB_2696_RS_V03_9x16_VID_EN_Opti_C-Sale_CTA-NY65_Pain-W-B_M-JANW_VL-30s_TR-None_G-M_P-OG_S-WHAT_FB2284V05,CBV2 || AU || 💰 Advantage+ || US || BROAD || 7C || Existing_customer_5% || 19/12/24 Ad set,VIDEO,$526,"20,477",2025-01-13,2025-03-27,73
66,CB_2024_Aug_FB_3090_DT-DP_V02_9x16_VID_EN_Opti_C-MakingOf_CTA-CTA_Pain-W-B-C_M-POW_VL-45s_TR-None_G-M_P-OG_S-Moon_FB3029V04,🌶️ || US || ASC+ || ->CC141 || VIDEO Only || US+CA || 0% EXISTING CAP || 7C || 07/08.24  Ad set,VIDEO,$525,"23,882",2025-01-17,2025-03-03,45
67,CB_2025_Jan_FB_3756_VK-DP_V01_4x5_IMG_EN_New_C-BulletPoints_Evergreen_CTA-NONE_Angle-W-B-C_M-NONE_VL-None_G-M_P-GLP1_S-NONE.png,3756 - opti 2834 GLP1 || Enhancements: OFF || GLP-1 || Batch 1 || 7C || 24/02/25w09 || Valentinas,SHARE,$521,"20,886",2025-02-24,2025-03-11,15
68,CB_2025_Feb_FB_3865_SO-JG_V16_9x16_VID_EN_Opti_C-NONE_Evergreen_CTA-NONE_Angle-W_M-NONE_VL-30_G-NONE_P-OG_S-WHAT_FB3030V05.mp4,3867 - Fat Costume Suit || Enhancements: OFF || CBV1 || Batch 4 || 7C || 03/03/25w10 || Valentinas,VIDEO,$520,"24,887",2025-03-03,2025-03-08,5
69,CB_2025_Feb_FB_3827_LZ_V04_1x1_IMG_EN_Opti_C-Headline_Evergreen_CTA-SALE_Angle-W_M-NONE_VL-None_G-M_P-CBV2_S-NONE_FB3779V02,3827 - V2 img winner opti || Batch 2 || 7C || 18/02/2025w08,SHARE,$518,"34,014",2025-02-18,2025-03-07,17
70,CB_2025_Jan_FB_3718_CHUB_V05_4x5_IMG_EN_Opti_C-NONE_CTA-NONE_Angle-C_M-NONE_VL-None_TR-None_G-M_P-OG_S-NONE,US || Kilo Product's leads LAL || 7C || 04/03/25,SHARE,$511,"23,995",2025-03-04,2025-03-06,2
71,CB_2023_Jul_FB_2217_IB_V04_9x16_VID_EN_Opti_C-Pointing_CTA-SMR_Pain-W-B_M-TRC_VL-30s_TR-None_G-F_P-None_S-FRIGGA,CBV2 || EU (UK) || 💰 Advantage+ || US || BROAD || 7C || Existing_customer_5% || 15/12/24 Ad set,VIDEO,$505,"26,121",2024-12-18,2025-03-27,99
72,CB_2025_Jan_FB_3748_VK-DP_V03_4x5_IMG_EN_New_C-BulletPoints_Sale_CTA-NY_Angle-W-B-C_M-NONE_VL-None_G-M_P-OG_S-NONE.png - Copy,3749 - beer belly opti GLP1- VK=DP || Enhancements: OFF || GLP-1 || Batch 1 || 7C || 20/02/25w09 || Valentinas,SHARE,$501,"28,086",2025-02-24,2025-03-08,12
73,CB_2025_Feb_FB_3880_CHUB-KZ_V01_9x16_VID_EN_New_C-…-None_M-W_VL-None_TR-None_G-NONE_P-NONE_S-NONE.mp4,3880 - BloatFreeBrunch CHUB || Enhancements: OFF || CBV1 || Batch 1 || 7C || 03/03/25w10 || Valentinas,VIDEO,$473,"11,088",2025-03-03,2025-03-08,5
74,CB_2025_Jan_FB_3723_SO_V04_4x5_IMG_EN_New_C-NONE_Evergreen_CTA-SALE_Angle-W_M-NONE_VL-None_G-NONE_P-NONE_S-NONE,US || Kilo Product's leads LAL || 7C || 04/03/25,SHARE,$464,"27,883",2025-03-04,2025-03-27,23
75,CB_2025_Feb_FB_3858_VK_V02_1x1_IMG_EN_New_C-BulletPoints_Evergreen_CTA-70_Angle-W-B-C_M-NONE_VL-None_G-NONE_P-OG_S-NONE,3858 - Retro ads -VK || Enhancements: OFF || CBV1 || Batch 1 || 7C || 03/03/25w10 || Valentinas,SHARE,$444,"19,064",2025-03-03,2025-03-08,5
76,CB_2025_Jan_FB_3656_JT_V02_4x5_IMG_EN_New_C-Headline_Seasonal_CTA-70_Angle-W_M-NONE_VL-None_G-NONE_P-OG_S-NONE,🌶️ || US || ASC+ || ->CC141 || VIDEO Only || US+CA || 0% EXISTING CAP || 7C || 07/08.24  Ad set,SHARE,$442,"24,597",2025-01-13,2025-03-04,50
77,CB_2025_Jan_FB_3740_SO-DP_V03_4x5_IMG_EN_Opti_C-Headline_Evergreen_CTA-NONE_Angle-W_M-NONE_VL-None_G-NONE_P-OG_S-NONE_3608V03,🌶️ || US || ASC+ || ->CC141 || VIDEO Only || US+CA || 0% EXISTING CAP || 7C || 07/08.24  Ad set,SHARE,$442,"27,422",2025-02-04,2025-03-03,27
78,CB_2025_Feb_FB_3871_DT-DP_V04_9x16_VID_EN_Opti_C-Sale_Sale_CTA-70_Angle-W_M-JANW_VL-30s_G-M_P-OG_S-WHAT_FB2284V05.mp4,3871 - 2284 opti VID || Enhancements: OFF || CBV1 || Batch 1 || 7C1V || 04/03/25w10 || Valentinas,SHARE,$440,"26,265",2025-03-04,2025-03-08,4
79,CB_2025_Feb_FB_3817_SO_V01_4x5_IMG_EN_Opti_C-NONE_Evergreen_CTA-SALE_Angle-W_M-NONE_VL-None_G-NONE_P-NONE_S-NONE_FB3723V07,CBV2 || AU || 💰 Advantage+ || US || BROAD || 7C || Existing_customer_5% || 19/12/24 Ad set,SHARE,$416,"33,708",2025-02-14,2025-03-27,41
80,CB_2024_Aug_FB_3090_DT-DP_V02_9x16_VID_EN_Opti_C-MakingOf_CTA-CTA_Pain-W-B-C_M-POW_VL-45s_TR-None_G-M_P-OG_S-Moon_FB3029V04,CBV2 || EU (UK) || 💰 Advantage+ || US || BROAD || 7C || Existing_customer_5% || 15/12/24 Ad set,SHARE,$416,"23,379",2024-12-19,2025-03-27,98
81,CB_2024_Dec_FB_3592_VK-DP_V10_4x5_VID_EN_New_C-BulletPoints_Sale_CTA-SALE_Angle-W-B-C_M-NONE_VL-30s_G-F_P-OG_S-NEW - Copy,🌶️ || US || ASC+ || ->CC141 || VIDEO Only || US+CA || 0% EXISTING CAP || 7C || 07/08.24  Ad set,VIDEO,$416,"18,884",2024-12-21,2025-03-27,96
82,CB_2023_Dec_FB_2712_RS-DP_V02_1x1_VID_EN_Opti_C-WrittenTesti_CTA-SALE_Pain-W-B-C_M-NONE_VL-None_TR-None_G-NONE_P-V2_S-NONE_FB2227V08,CBV2 || EU (UK) || 💰 Advantage+ || US || BROAD || 7C || Existing_customer_5% || 15/12/24 Ad set,SHARE,$403,"19,421",2024-12-15,2025-03-27,102
83,CB_2025_Feb_FB_3869_DT_V06_9x16_IMG_EN_Opti_C-NONE_Evergreen_CTA-None_Angle-W_M-NONE_VL-None_G-NONE_P-NONE_S-New_FB3723V04,3869 - Man boobs GIF opti || Enhancements: OFF || CBV1 || Batch 2 || 7C || 03/03/25w10 || Valentinas,SHARE,$395,"24,578",2025-03-03,2025-03-08,5
84,CB_2025_Feb_FB_3876_VK-DP_V02_9x16_VID_EN_New_C-BulletPoints_Evergreen_CTA-NONE_Angle-W-B-C_M-NONE_VL-15s_G-M_P-OG_S-NEW.mp4,3876 - Saggy butt VID - VK || Enhancements: OFF || CBV1 || Batch 1 || 7C || 04/03/25w10 || Valentinas,SHARE,$392,"16,383",2025-03-04,2025-03-08,4
85,CB_2025_Feb_FB_3818_LZ-VU_V04_1x1_IMG_EN_Opti_C-Headline_Evergreen_CTA-NONE_Angle-Cort_M-NONE_VL-None_G-NONE_P-NONE_S-NONE_FB3251V01,US || Manual Bid || CC119 || 7C || 28/02/25,SHARE,$391,"20,344",2025-02-28,2025-03-04,4
86,CB_2025_Feb_FB_3802_VK-DP_V05_1x1_IMG_EN_Opti_C-BulletPoints_Evergreen_CTA-70_Angle-W-B-C_M-NONE_VL-None_G-F_P-GLP1_S-NEW_FB2762V05.jpg,3802 - 7 hot benefits GLP VK || Enhancements: OFF || GLP-1 || Batch 1 || 7C || 24/02/25w09 || Valentinas,SHARE,$381,"12,282",2025-02-24,2025-03-07,11
87,CB_2025_Feb_FB_3873_LZ_V03_9x16_VID_EN_New_C-Comment_Evergreen_CTA-NONE_Angle-W_M-NONE_VL-15s_G-NONE_P-OG_S-NEW.mp4,3873 - Sleek video ads || Enhancements: OFF || CBV1 || Batch 1 || 7C1V || 04/03/25w10 || Valentinas,VIDEO,$380,"15,072",2025-03-04,2025-03-08,4
88,CB_2025_Jan_FB_3779_VK-DP_V02_1x1_VID_EN_Opti_C-BulletPoints_Evergreen_CTA-70_Angle-W-B-C_M-NONE_VL-None_G-F_P-OG_S-NEW_FB3705V02,US || Manual Bid || CC119 || 7C || 28/02/25,SHARE,$352,"30,049",2025-02-28,2025-03-04,4
89,CB_2025_Jan_FB_3779_VK-DP_V02_1x1_VID_EN_Opti_C-BulletPoints_Evergreen_CTA-70_Angle-W-B-C_M-NONE_VL-None_G-F_P-OG_S-NEW_FB3705V02,US || Kilo Product's leads LAL || 7C || 04/03/25,SHARE,$346,"13,028",2025-03-04,2025-03-06,2
90,CB_2025_Feb_FB_3873_LZ_V03_9x16_VID_EN_New_C-Comment_Evergreen_CTA-NONE_Angle-W_M-NONE_VL-15s_G-NONE_P-OG_S-NEW.mp4,3873 - Sleek video ads || Enhancements: OFF || CBV1 || Batch 1 || 7C || 04/03/25w10 || Valentinas,VIDEO,$338,"9,815",2025-03-04,2025-03-08,4
91,Colon Broom_FB_VSL,US || VSL || VSL AS AN AD || Landing: SALES PAGE || 1C || 07/03/25,VIDEO,$331,"6,874",2025-03-07,2025-03-10,3
92,CB_2025_Feb_FB_3828_SO-KB_V04_9x16_VID_EN_New_C-NONE_Evergreen_CTA-NONE_Angle-W_M-Pow_VL-35s_G-M_P-OG_S-NEW,"3828 - Brainstorm #6 ""my trainer got me to try""  || Enhancements: OFF || CBV1 || Batch 1 || 7C || 03/03/25w10 || Valentinas",VIDEO,$324,"14,908",2025-03-03,2025-03-08,5
93,CB_2025_Feb_FB_3845_VK-JT_V03_9x16_VID_EN_New_C-BulletPoints_Evergreen_CTA-70_Angle-W-B-C_M-TRC_VL-15s_G-NONE_P-OG_S-NEW,"3845 - SOCIAL VIDEO, painful food - JT-VK || Enhancements: OFF || CBV1 || Batch 1 || 7C || 03/03/25w10 || Valentinas",VIDEO,$323,"13,824",2025-03-03,2025-03-08,5
94,CB_2025_Jan_FB_3764_LZ-RP_V02_9x16_VID_EN_New_C-BulletPoints_Evergreen_CTA-NONE_Angle-W_M-MAN_VL-45s_G-M_P-GLP1_S-NEW.mp4,3764 - Notion idea #128 Biggest mistakes || Enhancements: OFF || GLP-1 || Batch 1 || 7C || 20/02/25w09 || Valentinas,VIDEO,$304,"13,345",2025-02-24,2025-03-06,10
95,CB_2025_Jan_FB_3723_SO_V07_4x5_IMG_EN_New_C-NONE_Evergreen_CTA-SALE_Angle-W_M-NONE_VL-None_G-NONE_P-NONE_S-NONE,CBV2 || US || Manual Bid: ROAS GOAL: 1.00 -> 1.1 || 7DC || 22/01/2025,SHARE,$294,"14,644",2025-02-11,2025-03-27,44
96,CB_2025_Jan_FB_3779_VK-DP_V02_1x1_VID_EN_Opti_C-BulletPoints_Evergreen_CTA-70_Angle-W-B-C_M-NONE_VL-None_G-F_P-OG_S-NEW_FB3705V02.png,CB || US || Funnel B: Shopify || 7DC || 2nd try || 26/02/2025,SHARE,$291,"11,561",2025-02-26,2025-03-04,6
97,CB_2023_Jul_FB_2217_IB_V04_9x16_VID_EN_Opti_C-Pointing_CTA-SMR_Pain-W-B_M-TRC_VL-30s_TR-None_G-F_P-None_S-FRIGGA,US || Manual Bid || BFCM || COST CAP 71 || 1C || 15/11/24,VIDEO,$289,"9,624",2024-11-15,2025-03-27,132
98,CB_2024_Nov_FB_3264_LZ_V31_4x5_VID_EN_Opti_C-MakingOf_Sale_CTA-BF_Angle-W-B_M-CRAZY_VL-45s_G-M_P-OG_S-NEW_FB3004V02,CBV2 || AU || 💰 Advantage+ || US || BROAD || 7C || Existing_customer_5% || 19/12/24 Ad set,VIDEO,$286,"10,136",2024-12-19,2025-03-27,98
99,CB_2025_Feb_FB_3775_SO-JT_V03_9x16_VID_EN_New_C-Headline_Evergreen_CTA-NONE_Angle-W_M-NONE_VL-7s_G-NONE_P-GLP1_S-workout.mp4,3775 - CB / GLP-1 / VID BATCH || Enhancements: OFF || GLP-1 || Batch 1 || 7C || 24/02/25w09 || Valentinas,VIDEO,$280,"9,493",2025-02-24,2025-03-06,10
100,CB_2025_Feb_FB_3827_LZ_V02_1x1_IMG_EN_Opti_C-Headline_Evergreen_CTA-NONE_Angle-W_M-NONE_VL-None_G-M_P-CBV2_S-NONE_FB3723V18,CBV2 || US || Manual Bid: ROAS GOAL: 1.00 -> 1.1 || 7DC || 22/01/2025,SHARE,$271,"12,718",2025-02-18,2025-03-27,37
101,CB_2024_Jul_FB_3043_VK-DP_V03_9x16_VID_EN_Opti_C-Dance_CTA-SMR_Pain-W-B_M-POW_VL-30s_TR-None_G-M_P-OG_S-WHAT_FB3030V01,🌶️ || US || ASC+ || ->CC141 || VIDEO Only || US+CA || 0% EXISTING CAP || 7C || 07/08.24  Ad set,VIDEO,$270,"16,651",2024-08-27,2025-03-03,188
102,CB_2025_Jan_FB_3756_VK-DP_V03_4x5_IMG_EN_New_C-BulletPoints_Evergreen_CTA-NONE_Angle-W-B-C_M-NONE_VL-None_G-M_P-GLP1_S-NONE.png,3756 - opti 2834 GLP1 || Enhancements: OFF || GLP-1 || Batch 1 || 7C || 24/02/25w09 || Valentinas,SHARE,$265,"8,130",2025-02-24,2025-03-11,15
103,CB_2025_Feb_FB_3870_LZ-DP_V02_9x16_VID_EN_New_C-Educational_Evergreen_CTA-SALE_Angle-W-B-C_M-TRC_VL-30s_G-F_P-OG_S-FRIGGA_1,3870 - TRC new idea educational UGC || Enhancements: OFF || CBV1 || Batch 1 || 7C || 03/03/25w10 || Valentinas,VIDEO,$259,"9,954",2025-03-03,2025-03-06,3
104,CB_2025_Jan_FB_3756_VK-DP_V02_4x5_IMG_EN_New_C-BulletPoints_Evergreen_CTA-NONE_Angle-W-B-C_M-NONE_VL-None_G-M_P-GLP1_S-NONE.png,3756 - opti 2834 GLP1 || Enhancements: OFF || GLP-1 || Batch 1 || 7C || 24/02/25w09 || Valentinas,SHARE,$253,"9,527",2025-02-24,2025-03-11,15
105,CB_2024_Aug_FB_3097_VK-DP_V03_9x16_VID_EN_Opti_C-Benefits_CTA-SMR_Pain-W-B_M-MIX_VL-45s_TR-None_G-MF_P-OG_S-WHAT_FB2516V13,CB || US || Funnel A: React || 7DC || 2nd try || 26/02/2025,VIDEO,$243,"12,486",2025-02-26,2025-03-04,6
106,CB_2025_Jan_FB_3723_SO_V20_4x5_IMG_EN_New_C-NONE_Evergreen_CTA-SALE_Angle-W_M-NONE_VL-None_G-NONE_P-NONE_S-NONE,3723 - Notion Idea #92 MAN BOOBS || Enhancements: OFF || CBV1 || Batch 4 || 1C || 28/01/25w05 || Kostas,SHARE,$232,"15,062",2025-01-28,2025-03-11,42
107,CB_2025_Feb_FB_3877_DT-DP_V02_1x1_IMG_EN_New_C-Headline_Evergreen_CTA-NONE_Angle-W-B-C_M-NONE_VL-None_G-NONE_P-OG_S-NONE.png,3877 - IMG ads for CB V1 || Enhancements: OFF || CBV1 || Batch 1 || 7C1V || 04/03/25w10 || Valentinas,SHARE,$231,"14,906",2025-03-04,2025-03-08,4
108,CB_2025_Feb_FB_3877_DT-DP_V02_1x1_IMG_EN_New_C-Headline_Evergreen_CTA-NONE_Angle-W-B-C_M-NONE_VL-None_G-NONE_P-OG_S-NONE.png,3877 - IMG ads for CB V1 || Enhancements: OFF || CBV1 || Batch 1 || 7C || 04/03/25w10 || Valentinas,SHARE,$227,"12,327",2025-03-04,2025-03-15,11
109,CB_2024_Sep_FB_3175_DA-KB_V02_1x1_IMG_EN_New_C-ADVRT_Evergreen_CTA-NONE_Angle-W_M-NONE_VL-None_G-NONE_P-CBV2_S-NONE_blog_colonbroomvsmammoth_cv_en,CBV2 || Advantage+ || Advertorial || Higher pricing || US || 0% EXISTING CAP || BROAD || 7C || 20/01/25  Campaign Ad set,SHARE,$227,"13,112",2025-01-20,2025-03-27,66
110,CB_2025_Jan_FB_3741_LZ-JG_V01_4x5_IMG_EN_Opti_C-Headline_Evergreen_CTA-NONE_Angle-W_M-NONE_VL-None_G-NONE_P-CBV2_S-NONE_FB3357V01,CBV2 || US || Manual Bid: ROAS GOAL: 1.00 -> 1.1 || 7DC || 22/01/2025,SHARE,$225,"7,920",2025-01-22,2025-03-27,64
111,CB_2024_Aug_FB_3097_VK-DP_V03_9x16_VID_EN_Opti_C-Benefits_CTA-SMR_Pain-W-B_M-MIX_VL-45s_TR-None_G-MF_P-OG_S-WHAT_FB2516V13,US || Kilo Product's leads LAL || 7C || 04/03/25,VIDEO,$222,"6,844",2025-03-04,2025-03-27,23
112,CB_2025_Feb_FB_3877_DT-DP_V04_1x1_IMG_EN_New_C-Headline_Evergreen_CTA-NONE_Angle-W-B-C_M-NONE_VL-None_G-NONE_P-OG_S-NONE.png,3877 - IMG ads for CB V1 || Enhancements: OFF || CBV1 || Batch 1 || 7C || 04/03/25w10 || Valentinas,SHARE,$220,"7,721",2025-03-04,2025-03-15,11
113,CB_2025_Jan_FB_3723_SO_V07_4x5_IMG_EN_New_C-NONE_Evergreen_CTA-SALE_Angle-W_M-NONE_VL-None_G-NONE_P-NONE_S-NONE,US || Kilo Product's leads LAL || 7C || 04/03/25,SHARE,$212,"10,568",2025-03-04,2025-03-27,23
114,CB_2025_Jan_FB_3662_CHUB_V01_1x1_IMG_EN_New_C-NONE_CTA-NONE_Angle-C_M-NONE_VL-None_TR-None_G-NONE_P-NONE_S-NONE.jpg,🌶️ || US || ASC+ || ->CC141 || VIDEO Only || US+CA || 0% EXISTING CAP || 7C || 07/08.24  Ad set,SHARE,$210,"11,761",2025-01-13,2025-03-04,50
115,CB_2025_Feb_FB_3828_SO-KB_V03_9x16_VID_EN_New_C-NONE_Evergreen_CTA-NONE_Angle-W_M-Pow_VL-40s_G-M_P-OG_S-NEW,"3828 - Brainstorm #6 ""my trainer got me to try""  || Enhancements: OFF || CBV1 || Batch 1 || 7C || 03/03/25w10 || Valentinas",VIDEO,$210,"7,819",2025-03-03,2025-03-08,5
116,CB_2025_Jan_FB_3762_LZ_V02_4x5_IMG_EN_Opti_C-NegativeMark_Evergreen_CTA-NONE_Angle-CR_M-NONE_VL-None_G-NONE_P-GLP1_S-NONE_FB3251V01.png,3762 - Notion Idea #123 it's not cheap GLP1 || Enhancements: OFF || GLP-1 || Batch 1 || 7C || 20/02/25w09 || Valentinas,SHARE,$210,"9,394",2025-02-24,2025-03-13,17
117,CB_2025_Jan_FB_3723_SO_V19_4x5_IMG_EN_New_C-NONE_Evergreen_CTA-SALE_Angle-W_M-NONE_VL-None_G-NONE_P-NONE_S-NONE,3723 - Notion Idea #92 MAN BOOBS || Enhancements: OFF || CBV1 || Batch 4 || 1C || 28/01/25w05 || Kostas,SHARE,$209,"15,472",2025-01-28,2025-03-11,42
118,CB_2025_Feb_FB_3874_CHUB-KZ_V04_1x1_IMG_EN_New_C-NONE_CTA-NONE_Angle-W_M-NONE_VL-None_TR-None_G-NONE_P-NONE_S-NONE_blog_biohacking_cv_en,CBV1 || LP:HI | 3874 Advertorial Biohacking || Biohack for 40+ Women || Batch 1 || 07/07/25,SHARE,$208,"3,108",2025-03-07,2025-03-09,2
119,CB_2025_Feb_FB_3817_SO_V01_4x5_IMG_EN_Opti_C-NONE_Evergreen_CTA-SALE_Angle-W_M-NONE_VL-None_G-NONE_P-NONE_S-NONE_FB3723V07,CBV2 || EU (UK) || 💰 Advantage+ || US || BROAD || 7C || Existing_customer_5% || 15/12/24 Ad set,SHARE,$206,"13,544",2025-02-14,2025-03-27,41
120,CB_2025_Feb_FB_3860_LZ-DP_V02_9x16_VID_EN_Opti_C-Testimonial_Evergreen_CTA-SALE_Angle-W_M-MOOD_VL-20s_G-M_P-OG_S-WOOD_FB21176V11_1,3860 - man boobs video 2176 opti || Enhancements: OFF || CBV1 || Batch 1 || 7C || 03/03/25w10 || Valentinas,VIDEO,$206,"10,874",2025-03-03,2025-03-27,24
121,CB_2025_Feb_FB_3589_CHUB-KZ_V04_1x1_IMG_EN_New_C-NONE_CTA-NONE_Angle-None_M-NONE_VL-None_TR-None_G-NONE_P-NONE_S-NONE_blog_menopausesolutionnew_cv_en,CBV1 || LP:HI | 3859 - Blog_HormonalReset CHUB || The Little Known “Hormonal Reset” || Batch 1 || 07/07/25,SHARE,$205,"2,540",2025-03-07,2025-03-09,2
122,CB_2025_Jan_FB_3757_LZ-DP_V14_9x16_VID_EN_Opti_C-Dance_Evergreen_CTA-NONE_Angle-W-B_M-Nonie_VL-30s_G-F_P-GLP1_S-WHAT_FB3164V03.mp4,3757 - GLP1 video winner opti Batch 3+4 || Enhancements: OFF || GLP-1 || Batch 3 || 7C || 24/02/25w09 || Valentinas,VIDEO,$201,"6,760",2025-02-24,2025-03-06,10
123,CB_2025_Feb_FB_3803_CHUB_V12_1x1_IMG_EN_New_C-NONE_CTA-NONE_Angle-None_M-NONE_VL-None_TR-None_G-NONE_P-NONE_S-NONE_blog_cbglp1_cv_en,GLP-1 || LP:HI | 3803 Advertorials CHUB || Natural GLP-1 Enhancer Takes Its Place || Batch 3 || 07/07/25,SHARE,$198,"5,840",2025-03-07,2025-03-09,2
124,CB_2025_Feb_FB_3877_DT-DP_V01_1x1_IMG_EN_New_C-Headline_Evergreen_CTA-NONE_Angle-W-B-C_M-NONE_VL-None_G-NONE_P-OG_S-NONE.png,3877 - IMG ads for CB V1 || Enhancements: OFF || CBV1 || Batch 1 || 7C || 04/03/25w10 || Valentinas,SHARE,$195,"9,876",2025-03-04,2025-03-15,11
125,CB_2024_Feb_FB_2814_MB-DP_V07_1x1_IMG_EN_New_C-WeightLoss_CTA-CTA_Pain-W-B-C_M-NONE_VL-None_TR-None_G-F_P-V2_S-NONE_2410V06,EU (UK) || clinically proven opti || 1C || 23/01/2025w04,SHARE,$193,"9,215",2025-01-23,2025-03-10,46
126,CB_2025_Jan_FB_3718_CHUB_V05_4x5_IMG_EN_Opti_C-NONE_CTA-NONE_Angle-C_M-NONE_VL-None_TR-None_G-M_P-OG_S-NONE,US || Manual Bid || CC119 || 7C || 28/02/25,SHARE,$192,"10,103",2025-02-28,2025-03-04,4
127,CB_2025_Feb_FB_3803_CHUB_V02_1x1_IMG_EN_New_C-NONE_CTA-NONE_Angle-None_M-NONE_VL-None_TR-None_G-NONE_P-NONE_S-NONE_blog_cbglp1_cv_en,GLP-1 || LP:HI | 3803 Advertorials CHUB || Natural GLP-1 Enhancer Takes Its Place || Batch 1 || 07/07/25 || Kostas,SHARE,$181,"7,637",2025-03-07,2025-03-09,2
128,CB_2025_Feb_FB_3845_VK-JT_V02_9x16_VID_EN_New_C-BulletPoints_Evergreen_CTA-70_Angle-W-B-C_M-TRC_VL-15s_G-NONE_P-OG_S-FRIGGA,"3845 - SOCIAL VIDEO, painful food - JT-VK || Enhancements: OFF || CBV1 || Batch 1 || 7C || 03/03/25w10 || Valentinas",VIDEO,$181,"7,969",2025-03-03,2025-03-08,5
129,CB_2025_Feb_FB_3854_LZ-DP_V01_1x1_IMG_EN_Opti_C-Headline_Evergreen_CTA-NONE_Angle-W_M-NONE_VL-None_G-M_P-OG_S-NONE_FB3723V07.png,3854 - Man boobs opti || Enhancements: OFF || CBV1 || Batch 1 || 7C || 26/02/25w09 || Valentinas,SHARE,$178,"11,272",2025-02-26,2025-03-04,6
130,CB_2025_Jan_FB_3723_SO_V04_4x5_IMG_EN_New_C-NONE_Evergreen_CTA-SALE_Angle-W_M-NONE_VL-None_G-NONE_P-NONE_S-NONE.png,CB || US || Funnel A: React || 7DC || 2nd try || 26/02/2025,SHARE,$177,"9,886",2025-02-26,2025-03-04,6
131,CB_2025_Feb_FB_3847_LZ-DP_V02_9x16_VID_EN_Opti_C-Testimonial_Evergreen_CTA-SALE_Angle-W-B-C_M-MAN_VL-30s_G-M_P-OG_S-WHAT_FB3097V03,3847 - #131 Notion idea i dare you to skip this ad hook Manuel || Enhancements: OFF || CBV1 || Batch 1 || 7C || 03/03/25w10 || Valentinas,VIDEO,$173,"5,469",2025-03-03,2025-03-06,3
132,CB_2024_Nov_FB_3264_LZ_V31_4x5_VID_EN_Opti_C-MakingOf_Sale_CTA-BF_Angle-W-B_M-CRAZY_VL-45s_G-M_P-OG_S-NEW_FB3004V02,CBV2 || EU (UK) || 💰 Advantage+ || US || BROAD || 7C || Existing_customer_5% || 15/12/24 Ad set,VIDEO,$172,"9,560",2024-12-19,2025-03-27,98
133,CB_2025_Jan_FB_3749_VK-DP_V01_4x5_IMG_EN_New_C-BulletPoints_Sale_CTA-NY_Angle-W-B-C_M-NONE_VL-None_G-M_P-GLP1_S-NONE.jpg,3749 - beer belly opti GLP1- VK=DP || Enhancements: OFF || GLP-1 || Batch 1 || 7C || 20/02/25w09 || Valentinas,SHARE,$168,"6,779",2025-02-24,2025-03-08,12
134,CB_2025_Feb_FB_3803_CHUB_V05_1x1_IMG_EN_New_C-NONE_CTA-NONE_Angle-None_M-NONE_VL-None_TR-None_G-NONE_P-NONE_S-NONE_blog_cbglp1_cv_en,GLP-1 || LP:HI | 3803 Advertorials CHUB || Natural GLP-1 Enhancer Takes Its Place || Batch 2 || 07/07/25 || Kostas,SHARE,$168,"3,740",2025-03-07,2025-03-09,2
135,CB_2024_Jan_FB_2762_IK_V05_1x1_IMG_EN_New_C-WrittenTesti_CTA-CTA_Pain-W-B-C_M-NONE_VL-None_TR-None_G-NONE_P-V2_S-NONE,CBV2 || EU (UK) || 💰 Advantage+ || US || BROAD || 7C || Existing_customer_5% || 15/12/24 Ad set,SHARE,$166,"6,852",2024-12-15,2025-03-27,102
136,CB_2025_Jan_FB_3742_SO-DP-KB_V06_4x5_IMG_EN_Opti_C-NONE_Evergreen_CTA-SALE_Angle-W_M-NONE_VL-None_G-NONE_P-CBV2_S-NONE3665V01,CBV2 || EU (UK) || 💰 Advantage+ || US || BROAD || 7C || Existing_customer_5% || 15/12/24 Ad set,SHARE,$154,"8,852",2025-02-18,2025-03-18,28
137,CB_2024_Nov_FB_3305_SO-DP_V02_4x5_VID_EN_Opti_C-Sale_CTA-BF_Pain-W_M-Chris_VL-30s_TR-None_G-MF_P-Plan_S-NEW_FB2601V07,CBV2 || AU || 💰 Advantage+ || US || BROAD || 7C || Existing_customer_5% || 19/12/24 Ad set,VIDEO,$150,"4,840",2024-12-19,2025-03-27,98
138,CB_2025_Feb_FB_3875_CHUB-AS_V01_9x16_VID_EN_New_C-NONE_CTA-NONE_Angle-None_M-NONE_VL-None_TR-None_G-NONE_P-NONE_S-NONE.mp4,3875 CHUB Do Not Do This - Guy || Enhancements: OFF || CBV1 || Batch 1 || 7C || 03/03/25w10 || Valentinas,VIDEO,$147,"7,480",2025-03-04,2025-03-06,2
139,CB_2025_Feb_FB_3847_LZ-DP_V04_9x16_VID_EN_Opti_C-Testimonial_Evergreen_CTA-SALE_Angle-W-B-C_M-MAN_VL-30s_G-M_P-OG_S-WHAT_FB3097V03.mp4,3847 - #131 Notion idea i dare you to skip this ad hook Manuel || Enhancements: OFF || CBV1 || Batch 1 || 7C || 03/03/25w10 || Valentinas,VIDEO,$144,"5,363",2025-03-03,2025-03-06,3
140,CB_2025_Feb_FB_3869_DT_V05_9x16_IMG_EN_Opti_C-NONE_Evergreen_CTA-None_Angle-W_M-NONE_VL-None_G-NONE_P-NONE_S-New_FB3723V04,3869 - Man boobs GIF opti || Enhancements: OFF || CBV1 || Batch 2 || 7C || 03/03/25w10 || Valentinas,SHARE,$143,"7,391",2025-03-03,2025-03-08,5
141,CB_2025_Feb_FB_3589_CHUB-KZ_V11_9x16_VID_EN_New_C-NONE_CTA-NONE_Angle-None_M-NONE_VL-None_TR-None_G-NONE_P-NONE_S-NONE_blog_menopausesolutionnew_cv_en,CBV1 || LP:HI | 3859 - Blog_HormonalReset CHUB || The Little Known “Hormonal Reset” || Batch 3 || 07/07/25,VIDEO,$128,"1,714",2025-03-07,2025-03-09,2
142,CB_2025_FEB_FB_3666_VK-JT_V03_4x5_VID_EN_NEW_C-BulletPoints_Sale_CTA-NY_Angle-W-B-C_M-TRC_VL-30s_G-F_P-OG_S-NEW,🌶️ || US || ASC+ || ->CC141 || VIDEO Only || US+CA || 0% EXISTING CAP || 7C || 07/08.24  Ad set,VIDEO,$128,"8,053",2025-01-20,2025-03-19,58
143,CB_2025_Feb_FB_3589_CHUB-KZ_V07_9x16_VID_EN_New_C-NONE_CTA-NONE_Angle-None_M-NONE_VL-None_TR-None_G-NONE_P-NONE_S-NONE_blog_menopausesolutionnew_cv_en,CBV1 || LP:HI | 3859 - Blog_HormonalReset CHUB || The Little Known “Hormonal Reset” || Batch 2 || 07/07/25,VIDEO,$127,"2,440",2025-03-07,2025-03-09,2
144,CB_2025_Feb_FB_3880_CHUB-KZ_V02_9x16_VID_EN_New_C-…-None_M-W_VL-None_TR-None_G-NONE_P-NONE_S-NONE.mp4,3880 - BloatFreeBrunch CHUB || Enhancements: OFF || CBV1 || Batch 1 || 7C || 03/03/25w10 || Valentinas,VIDEO,$123,"4,586",2025-03-03,2025-03-08,5
145,CB_2023_Jul_FB_2217_IB_V04_9x16_VID_EN_Opti_C-Pointing_CTA-SMR_Pain-W-B_M-TRC_VL-30s_TR-None_G-F_P-None_S-FRIGGA,US || Manual Bid || BFCM || COST CAP 81 || 1C || 15/11/24,VIDEO,$119,"4,064",2024-11-15,2025-03-16,121
146,CB_2025_Jan_FB_3072_V02_4x5_IMG_EN_New_C-Headline_Seasonal_CTA-None_Angle-W_M-NONE_VL-None_G-NONE_P-OG_S-NONE,CBV2 || EU (UK) || 💰 Advantage+ || US || BROAD || 7C || Existing_customer_5% || 15/12/24 Ad set,SHARE,$118,"6,388",2025-01-17,2025-03-14,56
147,CB_2025_Feb_FB_3877_DT-DP_V01_1x1_IMG_EN_New_C-Headline_Evergreen_CTA-NONE_Angle-W-B-C_M-NONE_VL-None_G-NONE_P-OG_S-NONE.png,3877 - IMG ads for CB V1 || Enhancements: OFF || CBV1 || Batch 1 || 7C1V || 04/03/25w10 || Valentinas,SHARE,$117,"6,011",2025-03-04,2025-03-08,4
148,CB_2025_Feb_FB_3874_CHUB-AA_V09_1x1_IMG_EN_New_C-NONE_CTA-NONE_Angle-W_M-NONE_VL-None_TR-None_G-NONE_P-NONE_S-NONE_blog_biohacking_cv_en,CBV1 || LP:HI | 3874 Advertorial Biohacking || Biohack for 40+ Women || Batch 3 || 07/07/25,SHARE,$111,"2,312",2025-03-07,2025-03-09,2
149,CB_2025_Feb_FB_3860_LZ-DP_V01_9x16_VID_EN_Opti_C-Testimonial_Evergreen_CTA-SALE_Angle-W_M-MOOD_VL-20s_G-M_P-OG_S-WOOD_FB21176V11_1,3860 - man boobs video 2176 opti || Enhancements: OFF || CBV1 || Batch 1 || 7C || 03/03/25w10 || Valentinas,VIDEO,$103,"4,988",2025-03-03,2025-03-27,24
150,CB_2025_Feb_FB_3875_CHUB-AS_V03_9x16_VID_EN_New_C-NONE_CTA-NONE_Angle-None_M-NONE_VL-None_TR-None_G-NONE_P-NONE_S-NONE.mp4,3875 CHUB Do Not Do This - Guy || Enhancements: OFF || CBV1 || Batch 1 || 7C || 03/03/25w10 || Valentinas,VIDEO,$102,"4,260",2025-03-04,2025-03-06,2
151,CB_2025_Feb_FB_3845_VK-JT_V01_9x16_VID_EN_New_C-BulletPoints_Evergreen_CTA-70_Angle-W-B-C_M-TRC_VL-15s_G-NONE_P-OG_S-NEW,"3845 - SOCIAL VIDEO, painful food - JT-VK || Enhancements: OFF || CBV1 || Batch 1 || 7C || 03/03/25w10 || Valentinas",VIDEO,$101,"3,723",2025-03-03,2025-03-08,5
152,CB_2024_Feb_FB_2834_DA_V04_4x5_IMG_EN_Opti_C-SingleTesti_CTA-NONE_Pain-W_M-NONE_VL-None_TR-None_G-NONE_P-V2_S-NONE_FB2759V04,CBV2 || AU || 💰 Advantage+ || US || BROAD || 7C || Existing_customer_5% || 19/12/24 Ad set,SHARE,$99,"4,102",2024-12-19,2025-03-27,98
153,CB_2025_Feb_FB_3874_CHUB-KZ_V08_1x1_IMG_EN_New_C-NONE_CTA-NONE_Angle-W_M-NONE_VL-None_TR-None_G-NONE_P-NONE_S-NONE_blog_biohacking_cv_en,CBV1 || LP:HI | 3874 Advertorial Biohacking || Biohack for 40+ Women || Batch 2 || 07/07/25,SHARE,$96,"2,538",2025-03-07,2025-03-09,2
154,CB_2025_Feb_FB_3802_VK-DP_V02_1x1_IMG_EN_Opti_C-BulletPoints_Evergreen_CTA-70_Angle-W-B-C_M-NONE_VL-None_G-F_P-GLP1_S-NEW_FB2762V05.jpg,3802 - 7 hot benefits GLP VK || Enhancements: OFF || GLP-1 || Batch 1 || 7C || 24/02/25w09 || Valentinas,SHARE,$93,"3,769",2025-02-24,2025-03-07,11
155,CB_2025_Jan_FB_3723_SO_V04_4x5_IMG_EN_New_C-NONE_Evergreen_CTA-SALE_Angle-W_M-NONE_VL-None_G-NONE_P-NONE_S-NONE,US || Manual Bid || CC119 || 7C || 28/02/25,SHARE,$92,"8,122",2025-02-28,2025-03-04,4
156,CB_2025_Feb_FB_3874_CHUB-AA_V11_1x1_IMG_EN_New_C-NONE_CTA-NONE_Angle-W_M-NONE_VL-None_TR-None_G-NONE_P-NONE_S-NONE_blog_biohacking_cv_en,CBV1 || LP:HI | 3874 Advertorial Biohacking || Biohack for 40+ Women || Batch 3 || 07/07/25,SHARE,$90,"2,929",2025-03-07,2025-03-09,2
157,CB_2025_Jan_FB_3756_VK-DP_V01_4x5_IMG_EN_New_C-BulletPoints_Evergreen_CTA-NONE_Angle-W-B-C_M-NONE_VL-None_G-M_P-GLP1_S-NONE.png,GLP-1 💜 || ASC+ || US || 5% EXISTING CAP || 7C || 20/02/25 . Ad set,SHARE,$89,"3,869",2025-03-05,2025-03-18,13
158,CB_2025_Feb_FB_3874_CHUB-KZ_V05_1x1_IMG_EN_New_C-NONE_CTA-NONE_Angle-W_M-NONE_VL-None_TR-None_G-NONE_P-NONE_S-NONE_blog_biohacking_cv_en,CBV1 || LP:HI | 3874 Advertorial Biohacking || Biohack for 40+ Women || Batch 2 || 07/07/25,SHARE,$85,"2,139",2025-03-07,2025-03-09,2
159,CB_2025_Feb_FB_3873_LZ_V02_9x16_VID_EN_New_C-Comment_Evergreen_CTA-NONE_Angle-W_M-NONE_VL-15s_G-NONE_P-OG_S-NEW.mp4,3873 - Sleek video ads || Enhancements: OFF || CBV1 || Batch 1 || 7C || 04/03/25w10 || Valentinas,VIDEO,$83,"2,582",2025-03-04,2025-03-08,4
160,CB_2025_Jan_FB_3723_SO_V04_4x5_IMG_EN_New_C-NONE_Evergreen_CTA-SALE_Angle-W_M-NONE_VL-None_G-NONE_P-NONE_S-NONE.png,CB || US || Funnel B: Shopify || 7DC || 2nd try || 26/02/2025,SHARE,$82,"4,412",2025-02-26,2025-03-04,6
161,CB_2025_Feb_FB_3833_VK_V03_9x16_VID_EN_New_C-BulletPoints_Evergreen_CTA-70_Angle-W-B-C_M-MAN_VL-15s_G-M_P-OG_S-WHAT.mp4,3833 - do not mix -VK || Enhancements: OFF || CBV1 || Batch 1 || 7C || 26/02/25w09 || Valentinas,VIDEO,$79,"3,323",2025-02-26,2025-03-08,10
162,CB_2025_Jan_FB_3723_SO_V07_4x5_IMG_EN_New_C-NONE_Evergreen_CTA-SALE_Angle-W_M-NONE_VL-None_G-NONE_P-NONE_S-NONE,US || Manual Bid || CC119 || 7C || 28/02/25,SHARE,$77,"5,920",2025-02-28,2025-03-04,4
163,CB_2025_Feb_FB_3858_VK_V01_1x1_IMG_EN_New_C-BulletPoints_Evergreen_CTA-70_Angle-W-B-C_M-NONE_VL-None_G-NONE_P-OG_S-NONE,3858 - Retro ads -VK || Enhancements: OFF || CBV1 || Batch 1 || 7C || 03/03/25w10 || Valentinas,SHARE,$72,"3,992",2025-03-03,2025-03-08,5
164,CB_2024_Aug_FB_3097_VK-DP_V03_9x16_VID_EN_Opti_C-Benefits_CTA-SMR_Pain-W-B_M-MIX_VL-45s_TR-None_G-MF_P-OG_S-WHAT_FB2516V13,CB || US || Funnel B: Shopify || 7DC || 2nd try || 26/02/2025,VIDEO,$72,"2,688",2025-02-26,2025-03-04,6
165,CB_2024_Feb_FB_2834_DA_V02_4x5_IMG_EN_Opti_C-SingleTesti_CTA-NONE_Pain-W_M-NONE_VL-None_TR-None_G-NONE_P-V2_S-NONE_FB2759V04,CBV2 || AU || 💰 Advantage+ || US || BROAD || 7C || Existing_customer_5% || 19/12/24 Ad set,SHARE,$68,"2,885",2024-12-19,2025-03-27,98
166,CB_2025_Jan_FB_3723_SO_V16_4x5_IMG_EN_New_C-NONE_Evergreen_CTA-SALE_Angle-W_M-NONE_VL-None_G-NONE_P-NONE_S-NONE,3723 - Notion Idea #92 MAN BOOBS || Enhancements: OFF || CBV1 || Batch 4 || 1C || 28/01/25w05 || Kostas,SHARE,$68,"4,603",2025-01-28,2025-03-11,42
167,CB_2025_Feb_FB_3877_DT-DP_V04_1x1_IMG_EN_New_C-Headline_Evergreen_CTA-NONE_Angle-W-B-C_M-NONE_VL-None_G-NONE_P-OG_S-NONE.png,3877 - IMG ads for CB V1 || Enhancements: OFF || CBV1 || Batch 1 || 7C1V || 04/03/25w10 || Valentinas,SHARE,$68,"3,366",2025-03-04,2025-03-08,4
168,CB_2025_Jan_FB_3757_LZ-DP_V19_9x16_VID_EN_Opti_C-BulletPoints_Evergreen_CTA-NONE_Angle-W-B_M-MAG_VL-30s_G-F_P-GLP1_S-WHAT_FB3311V17.mp4,3757 - GLP1 video winner opti Batch 3+4 || Enhancements: OFF || GLP-1 || Batch 4 || 7C || 24/02/25w09 || Valentinas,VIDEO,$66,"2,604",2025-02-24,2025-03-18,22
169,CB_2025_Feb_FB_3873_LZ_V02_9x16_VID_EN_New_C-Comment_Evergreen_CTA-NONE_Angle-W_M-NONE_VL-15s_G-NONE_P-OG_S-NEW.mp4,3873 - Sleek video ads || Enhancements: OFF || CBV1 || Batch 1 || 7C1V || 04/03/25w10 || Valentinas,VIDEO,$65,"2,597",2025-03-04,2025-03-08,4
170,CB_2025_Feb_FB_3858_VK_V04_1x1_IMG_EN_New_C-BulletPoints_Evergreen_CTA-70_Angle-W-B-C_M-NONE_VL-None_G-NONE_P-OG_S-NONE,3858 - Retro ads -VK || Enhancements: OFF || CBV1 || Batch 1 || 7C || 03/03/25w10 || Valentinas,SHARE,$64,"2,982",2025-03-03,2025-03-08,5
171,CB_2025_Feb_FB_3589_CHUB-KZ_V05_9x16_VID_EN_New_C-NONE_CTA-NONE_Angle-None_M-NONE_VL-None_TR-None_G-NONE_P-NONE_S-NONE_blog_menopausesolutionnew_cv_en,CBV1 || LP:HI | 3859 - Blog_HormonalReset CHUB || The Little Known “Hormonal Reset” || Batch 2 || 07/07/25,VIDEO,$62,"1,468",2025-03-07,2025-03-09,2
172,CB_2025_Feb_FB_3828_SO-KB_V02_9x16_VID_EN_New_C-NONE_Evergreen_CTA-NONE_Angle-W_M-Pow_VL-35s_G-M_P-OG_S-NEW,"3828 - Brainstorm #6 ""my trainer got me to try""  || Enhancements: OFF || CBV1 || Batch 1 || 7C || 03/03/25w10 || Valentinas",VIDEO,$62,"1,918",2025-03-03,2025-03-08,5
173,CB_2025_Feb_FB_3827_LZ_V03_1x1_IMG_EN_Opti_C-Headline_Evergreen_CTA-SALE_Angle-W_M-NONE_VL-None_G-M_P-CBV2_S-NONE_FB3705V02,CBV2 || US || Manual Bid: ROAS GOAL: 1.00 -> 1.1 || 7DC || 22/01/2025,SHARE,$61,"2,687",2025-02-18,2025-03-27,37
174,CB_2025_Feb_FB_3855_SO_V04_9x16_VID_EN_New_C-NONE_Evergreen_CTA-NONE_Angle-W_M-NONE_VL-30s_G-None_P-OG_S-NEW,3855 - Notion Idea #141 “Questionnaire” || Enhancements: OFF || CBV1 || Batch 1 || 7C || 03/03/25w10 || Valentinas,VIDEO,$61,"3,500",2025-03-03,2025-03-15,12
175,CB_2024_Jan_FB_2764_RS_V04_9x16_VID_EN_Opti_C-SingleTesti_CTA-SALE_Pain-W_M-TRC_VL-45s_TR-None_G-F_P-OG_S-MOON_FB2263V04,CBV2 || EU (UK) || 💰 Advantage+ || US || BROAD || 7C || Existing_customer_5% || 15/12/24 Ad set,VIDEO,$59,"1,881",2025-02-04,2025-03-14,38
176,CB_2025_Feb_FB_3875_CHUB-AS_V04_9x16_VID_EN_New_C-NONE_CTA-NONE_Angle-None_M-NONE_VL-None_TR-None_G-NONE_P-NONE_S-NONE.mp4,3875 CHUB Do Not Do This - Guy || Enhancements: OFF || CBV1 || Batch 1 || 7C || 03/03/25w10 || Valentinas,VIDEO,$59,"2,843",2025-03-04,2025-03-06,2
177,CB_2025_Feb_FB_3876_VK-DP_V03_9x16_VID_EN_New_C-BulletPoints_Evergreen_CTA-NONE_Angle-W-B-C_M-NONE_VL-15s_G-M_P-OG_S-NEW.mp4,3876 - Saggy butt VID - VK || Enhancements: OFF || CBV1 || Batch 1 || 7C || 04/03/25w10 || Valentinas,SHARE,$57,"2,842",2025-03-04,2025-03-08,4
178,CB_2025_Feb_FB_3589_CHUB-KZ_V12_9x16_VID_EN_New_C-NONE_CTA-NONE_Angle-None_M-NONE_VL-None_TR-None_G-NONE_P-NONE_S-NONE_blog_menopausesolutionnew_cv_en,CBV1 || LP:HI | 3859 - Blog_HormonalReset CHUB || The Little Known “Hormonal Reset” || Batch 3 || 07/07/25,VIDEO,$55,"1,227",2025-03-07,2025-03-09,2
179,CB_2025_Feb_FB_3864_DT-VU_V03_1x1_IMG_EN_Opti_C-Trend_Sale_CTA-65_Angle-W_M-NONE_VL-None_G-NONE_P-OG_S-NONE.png,3864 - weight loss event towards man boobs || Enhancements: OFF || CBV1 || Batch 1 || 7C || 26/02/25w09 || Valentinas,SHARE,$54,"3,201",2025-02-26,2025-03-03,5
180,CB_2025_Jan_FB_3749_VK-DP_V03_4x5_IMG_EN_New_C-BulletPoints_Sale_CTA-NY_Angle-W-B-C_M-NONE_VL-None_G-M_P-GLP1_S-NONE.jpg,3749 - beer belly opti GLP1- VK=DP || Enhancements: OFF || GLP-1 || Batch 1 || 7C || 20/02/25w09 || Valentinas,SHARE,$52,"2,054",2025-02-24,2025-03-08,12
181,CB_2025_Feb_FB_3877_DT-DP_V03_1x1_IMG_EN_New_C-Headline_Evergreen_CTA-NONE_Angle-W-B-C_M-NONE_VL-None_G-NONE_P-OG_S-NONE.png,3877 - IMG ads for CB V1 || Enhancements: OFF || CBV1 || Batch 1 || 7C || 04/03/25w10 || Valentinas,SHARE,$51,"1,942",2025-03-04,2025-03-15,11
182,CB_2025_Feb_FB_3869_DT_V08_9x16_IMG_EN_Opti_C-NONE_Evergreen_CTA-None_Angle-W_M-NONE_VL-None_G-NONE_P-NONE_S-New_FB3723V04,3869 - Man boobs GIF opti || Enhancements: OFF || CBV1 || Batch 2 || 7C || 03/03/25w10 || Valentinas,SHARE,$51,"2,900",2025-03-03,2025-03-08,5
183,CB_2025_Feb_FB_3850_DT-DP_V04_9x16_VID_EN_Opti_C-Dance_Sale_CTA-70_Angle-W_M-POW_VL-30s_G-M_P-OG_S-WOOD_FB2176V11.mp4,3850 - Man boobs/dad bod opti on videos || Enhancements: OFF || CBV1 || Batch 1 || 7C || 26/02/25w09 || Valentinas,VIDEO,$49,"2,640",2025-02-26,2025-03-03,5
184,CB_2025_Feb_FB_3865_SO-JG_V14_9x16_VID_EN_Opti_C-NONE_Evergreen_CTA-NONE_Angle-W_M-NONE_VL-30_G-NONE_P-OG_S-WHAT_FB2284V05.mp4,3867 - Fat Costume Suit || Enhancements: OFF || CBV1 || Batch 4 || 7C || 03/03/25w10 || Valentinas,VIDEO,$48,"2,475",2025-03-03,2025-03-08,5
185,CB_2025_Feb_FB_3589_CHUB-KZ_V10_9x16_VID_EN_New_C-NONE_CTA-NONE_Angle-None_M-NONE_VL-None_TR-None_G-NONE_P-NONE_S-NONE_blog_menopausesolutionnew_cv_en,CBV1 || LP:HI | 3859 - Blog_HormonalReset CHUB || The Little Known “Hormonal Reset” || Batch 3 || 07/07/25,VIDEO,$47,971,2025-03-07,2025-03-09,2
186,CB_2025_Feb_FB_3869_DT_V01_9x16_GIF_EN_Opti_C-NONE_Evergreen_CTA-None_Angle-W_M-NONE_VL-None_G-NONE_P-NONE_S-New_FB3723V04,3869 - Man boobs GIF opti || Enhancements: OFF || CBV1 || Batch 1 || 7C || 03/03/25w10 || Valentinas,VIDEO,$46,"1,484",2025-03-03,2025-03-11,8
187,CB_2025_Feb_FB_3873_LZ_V01_9x16_VID_EN_New_C-Comment_Evergreen_CTA-NONE_Angle-W_M-NONE_VL-15s_G-NONE_P-OG_S-NEW,3873 - Sleek video ads || Enhancements: OFF || CBV1 || Batch 1 || 7C || 04/03/25w10 || Valentinas,VIDEO,$45,"1,502",2025-03-04,2025-03-08,4
188,CB_2025_Feb_FB_3870_LZ-DP_V01_9x16_VID_EN_New_C-Educational_Evergreen_CTA-SALE_Angle-W-B-C_M-TRC_VL-30s_G-F_P-OG_S-FRIGGA,3870 - TRC new idea educational UGC || Enhancements: OFF || CBV1 || Batch 1 || 7C || 03/03/25w10 || Valentinas,VIDEO,$44,"2,042",2025-03-03,2025-03-06,3
189,CB_2025_Feb_FB_3827_LZ_V03_1x1_IMG_EN_Opti_C-Headline_Evergreen_CTA-SALE_Angle-W_M-NONE_VL-None_G-M_P-CBV2_S-NONE_FB3705V02,3827 - V2 img winner opti || Batch 2 || 7C || 18/02/2025w08,SHARE,$44,"2,268",2025-02-18,2025-03-07,17
190,CB_2025_Feb_FB_3877_DT-DP_V03_1x1_IMG_EN_New_C-Headline_Evergreen_CTA-NONE_Angle-W-B-C_M-NONE_VL-None_G-NONE_P-OG_S-NONE.png,3877 - IMG ads for CB V1 || Enhancements: OFF || CBV1 || Batch 1 || 7C1V || 04/03/25w10 || Valentinas,SHARE,$42,"2,104",2025-03-04,2025-03-08,4
191,CB_2025_Feb_FB_3865_SO-VU_V01_4x5_IMG_EN_Opti_C-NONE_Evergreen_CTA-NONE_Angle-Cort_M-NONE_VL-None_G-NONE_P-OG_S-NONE.png,3865 - HELLO! Idea Nr.23 || Enhancements: OFF || CBV1 || Batch 1 || 7C || 26/02/25w09 || Valentinas,SHARE,$42,"2,076",2025-02-26,2025-03-03,5
192,CB_2025_Jan_FB_3757_LZ-DP_V13_9x16_VID_EN_Opti_C-Pointing_Evergreen_CTA-NONE_Angle-W-B-C_M-Nonie_VL-30s_G-F_P-GLP1_S-WHAT_FB3164V01.mp4,3757 - GLP1 video winner opti Batch 3+4 || Enhancements: OFF || GLP-1 || Batch 3 || 7C || 24/02/25w09 || Valentinas,VIDEO,$40,"1,389",2025-02-24,2025-03-06,10
193,CB_2025_Feb_FB_3862_LZ_V04_1x1_IMG_EN_New_C-Testimonial_Evergreen_CTA-NONE_Angle-W-B_M-NONE_VL-None_G-NONE_P-OG_S-NONE.png,3862 - sleek looking ads || Enhancements: OFF || CBV1 || Batch 1 || 7C || 26/02/25w09 || Valentinas,SHARE,$40,986,2025-02-26,2025-03-03,5
194,CB_2025_Feb_FB_3833_VK_V02_9x16_VID_EN_New_C-BulletPoints_Evergreen_CTA-70_Angle-W-B-C_M-JOG_VL-15s_G-F_P-OG_S-NEW.mp4,3833 - do not mix -VK || Enhancements: OFF || CBV1 || Batch 1 || 7C || 26/02/25w09 || Valentinas,VIDEO,$40,"2,033",2025-02-26,2025-03-08,10
195,CB_2025_Jan_FB_3751_VK-DP_V01_4x5_IMG_EN_New_C-BulletPoints_Sale_CTA-NY_Angle-W-B-C_M-NONE_VL-None_G-M_P-GLP1_S-NONE.jpg,3751 - opti 3608 GLP1 - VK-DP || Enhancements: OFF || GLP-1 || Batch 1 || 7C || 20/02/25w09 || Valentinas,SHARE,$40,"1,666",2025-02-24,2025-03-15,19
196,CB_2025_Feb_FB_3861_LZ-DP_V02_1x1_IMG_EN_New_C-Headline_Evergreen_CTA-NONE_Angle-W_M-NONE_VL-None_G-M_P-OG_S-NONE.png,3861 - Man boobs transformation img || Enhancements: OFF || CBV1 || Batch 1 || 7C || 26/02/25w09 || Valentinas,SHARE,$38,"2,015",2025-02-26,2025-03-03,5
197,CB_2025_Feb_FB_3870_LZ-DP_V04_9x16_VID_EN_New_C-Educational_Evergreen_CTA-SALE_Angle-W-B-C_M-TRC_VL-30s_G-F_P-OG_S-FRIGGA,3870 - TRC new idea educational UGC || Enhancements: OFF || CBV1 || Batch 1 || 7C || 03/03/25w10 || Valentinas,VIDEO,$38,"1,785",2025-03-03,2025-03-06,3
198,CB_2025_Feb_FB_3828_SO-KB_V01_9x16_VID_EN_New_C-NONE_Evergreen_CTA-NONE_Angle-W_M-Pow_VL-40s_G-M_P-OG_S-NEW,"3828 - Brainstorm #6 ""my trainer got me to try""  || Enhancements: OFF || CBV1 || Batch 1 || 7C || 03/03/25w10 || Valentinas",VIDEO,$37,"1,681",2025-03-03,2025-03-08,5
199,CB_2025_Jan_FB_3757_LZ-DP_V15_9x16_VID_EN_Opti_C-BulletPoints_Evergreen_CTA-NONE_Angle-W-B-C_M-KAIT_VL-30s_G-F_P-GLP1_S-NEW_FB3592V10.mp4,3757 - GLP1 video winner opti Batch 3+4 || Enhancements: OFF || GLP-1 || Batch 3 || 7C || 24/02/25w09 || Valentinas,VIDEO,$36,"1,127",2025-02-24,2025-03-06,10
200,CB_2025_Jan_FB_3739_DT_V05_4x5_VID_EN_Opti_C-BulletPoints_Sale_CTA-70_Angle-W-B_M-MIX_VL-45s_G-MF_P-GLP1_S-WHAT_FB3164V03,GLP-1 💜 || ASC+ || US || 5% EXISTING CAP || 7C || 20/02/25 . Ad set,SHARE,$34,"1,528",2025-02-24,2025-03-18,22
201,CB_2025_Feb_FB_3865_SO-JG_V18_9x16_VID_EN_Opti_C-NONE_Evergreen_CTA-NONE_Angle-W_M-NONE_VL-30_G-NONE_P-OG_S-Moon_FB2263V04,3867 - Fat Costume Suit || Enhancements: OFF || CBV1 || Batch 5 || 7C || 03/03/25w10 || Valentinas,VIDEO,$34,"1,948",2025-03-03,2025-03-20,17
202,CB_2025_Feb_FB_3874_CHUB-KZ_V07_1x1_IMG_EN_New_C-NONE_CTA-NONE_Angle-W_M-NONE_VL-None_TR-None_G-NONE_P-NONE_S-NONE_blog_biohacking_cv_en,CBV1 || LP:HI | 3874 Advertorial Biohacking || Biohack for 40+ Women || Batch 2 || 07/07/25,SHARE,$33,890,2025-03-07,2025-03-09,2
203,CB_2025_Feb_FB_3869_DT_V07_9x16_IMG_EN_Opti_C-NONE_Evergreen_CTA-None_Angle-W_M-NONE_VL-None_G-NONE_P-NONE_S-New_FB3723V04,3869 - Man boobs GIF opti || Enhancements: OFF || CBV1 || Batch 2 || 7C || 03/03/25w10 || Valentinas,SHARE,$33,"2,076",2025-03-03,2025-03-08,5
204,CB_2025_Feb_FB_3833_VK_V01_9x16_VID_EN_New_C-BulletPoints_Evergreen_CTA-70_Angle-W-B-C_M-TRC_VL-15s_G-F_P-OG_S-NEW.mp4,3833 - do not mix -VK || Enhancements: OFF || CBV1 || Batch 1 || 7C || 26/02/25w09 || Valentinas,VIDEO,$32,"1,490",2025-02-26,2025-03-08,10
205,CB_2024_Mar_FB_2888_JG_V03_9x16_IMG_EN_Opti_C-Benefits_CTA-NONE_Pain-W_M-NONE_VL-None_TR-None_G-NONE_P-V2_S-NONE,CBV2 || AU || 💰 Advantage+ || US || BROAD || 7C || Existing_customer_5% || 19/12/24 Ad set,SHARE,$31,"1,587",2024-12-19,2025-03-27,98
206,CB_2025_Feb_FB_3865_SO-JG_V20_9x16_VID_EN_Opti_C-NONE_Evergreen_CTA-NONE_Angle-W_M-NONE_VL-30_G-NONE_P-OG_S-Moon_FB2263V04.mp4,3867 - Fat Costume Suit || Enhancements: OFF || CBV1 || Batch 5 || 7C || 03/03/25w10 || Valentinas,VIDEO,$31,"1,536",2025-03-03,2025-03-20,17
207,CB_2025_Feb_FB_3803_CHUB_V07_1x1_IMG_EN_New_C-NONE_CTA-NONE_Angle-None_M-NONE_VL-None_TR-None_G-NONE_P-NONE_S-NONE_blog_cbglp1_cv_en,GLP-1 || LP:HI | 3803 Advertorials CHUB || Natural GLP-1 Enhancer Takes Its Place || Batch 2 || 07/07/25 || Kostas,SHARE,$31,643,2025-03-07,2025-03-09,2
208,CB_2023_Jul_FB_2226_MB_V04_9x16_VID_EN_Opti_C-Testim_CTA-SMR_Pain-W_M-MIX_VL-30s_TR-None_G-F_P-None_S-Starry,US || Manual Bid || BFCM || COST CAP 71 || 1C || 15/11/24,VIDEO,$30,992,2024-11-15,2025-03-27,132
209,CB_2025_Feb_FB_3874_CHUB-AA_V12_1x1_IMG_EN_New_C-NONE_CTA-NONE_Angle-W_M-NONE_VL-None_TR-None_G-NONE_P-NONE_S-NONE_blog_biohacking_cv_en,CBV1 || LP:HI | 3874 Advertorial Biohacking || Biohack for 40+ Women || Batch 3 || 07/07/25,SHARE,$30,"1,290",2025-03-07,2025-03-09,2
210,CB_2025_Feb_FB_3821_SO-KB-JG_V10_4x5_IMG_EN_Opti_C-NONE_Evergreen_CTA-SALE_Angle-W_M-NONE_VL-None_G-NONE_P-NONE_S-NONE_FB3723V07,3821 - Man boobs Opti || Enhancements: OFF || CBV1 || Batch 3 || 7C || 19/02/25w08 || Kostas,SHARE,$29,"1,982",2025-02-19,2025-03-09,18
211,CB_2024_Oct_FB_3182_ZS-GC_V13_1x1_IMG_EN_New_C-UsVsThem_Evergreen_CTA-NONE_Angle-B-C_M-NONE_VL-None_G-NONE_P-OG_S-NONE,CBV2 || AU || 💰 Advantage+ || US || BROAD || 7C || Existing_customer_5% || 19/12/24 Ad set,SHARE,$28,"1,338",2024-12-19,2025-03-27,98
212,CB_2025_Jan_FB_3739_DT_V02_4x5_VID_EN_Opti_C-Pointing_Sale_CTA-70_Angle-W_M-MIX_VL-30s_G-MF_P-GLP1_S-FRIGGA_FB2217V05,GLP-1 💜 || ASC+ || US || 5% EXISTING CAP || 7C || 20/02/25 . Ad set,SHARE,$25,"1,156",2025-02-24,2025-03-06,10
213,CB_2025_Feb_FB_3803_CHUB_V06_1x1_IMG_EN_New_C-NONE_CTA-NONE_Angle-None_M-NONE_VL-None_TR-None_G-NONE_P-NONE_S-NONE_blog_cbglp1_cv_en,GLP-1 || LP:HI | 3803 Advertorials CHUB || Natural GLP-1 Enhancer Takes Its Place || Batch 2 || 07/07/25 || Kostas,SHARE,$25,687,2025-03-07,2025-03-09,2
214,CB_2024_Mar_FB_2888_JG_V02_9x16_IMG_EN_Opti_C-Benefits_CTA-NONE_Pain-W_M-NONE_VL-None_TR-None_G-NONE_P-V2_S-NONE,CBV2 || AU || 💰 Advantage+ || US || BROAD || 7C || Existing_customer_5% || 19/12/24 Ad set,SHARE,$25,"1,172",2024-12-19,2025-03-27,98
215,CB_2025_Feb_FB_3803_CHUB_V01_1x1_IMG_EN_New_C-NONE_CTA-NONE_Angle-None_M-NONE_VL-None_TR-None_G-NONE_P-NONE_S-NONE_blog_cbglp1_cv_en,GLP-1 || LP:HI | 3803 Advertorials CHUB || Natural GLP-1 Enhancer Takes Its Place || Batch 1 || 07/07/25 || Kostas,SHARE,$25,775,2025-03-07,2025-03-09,2
216,CB_2025_Feb_FB_3589_CHUB-KZ_V09_9x16_VID_EN_New_C-NONE_CTA-NONE_Angle-None_M-NONE_VL-None_TR-None_G-NONE_P-NONE_S-NONE_blog_menopausesolutionnew_cv_en,CBV1 || LP:HI | 3859 - Blog_HormonalReset CHUB || The Little Known “Hormonal Reset” || Batch 3 || 07/07/25,VIDEO,$24,876,2025-03-07,2025-03-09,2
217,CB_2025_Jan_FB_3748_VK-DP_V02_4x5_IMG_EN_New_C-BulletPoints_Sale_CTA-NY_Angle-W-B-C_M-NONE_VL-None_G-M_P-OG_S-NONE.png - Copy,3748 - winner ads opti - GLP1 - VK-DP || Enhancements: OFF || GLP-1 || Batch 1 || 7C || 20/02/25w09 || Valentinas,SHARE,$24,971,2025-02-24,2025-03-18,22
218,CB_2024_Mar_FB_2888_JG_V01_9x16_IMG_EN_Opti_C-Benefits_CTA-NONE_Pain-W_M-NONE_VL-None_TR-None_G-NONE_P-V2_S-NONE,CBV2 || AU || 💰 Advantage+ || US || BROAD || 7C || Existing_customer_5% || 19/12/24 Ad set,SHARE,$23,662,2024-12-19,2025-03-27,98
219,CB_2022_Mar3_FB_713_IK_V04_1x1_IMG_EN_Opti_C-WrittenTesti_HE-98_A-ExtremeBodyVisualization_HK-bodypart_Pain-W_CLR-PURPLE_BG-IMAGE_ME-MIX_MA-YOUNG,US || Manual Bid || BFCM || COST CAP 71 || 1C || 15/11/24,SHARE,$23,"1,180",2024-11-15,2025-03-27,132
220,CB_2025_Jan_FB_3751_VK-DP_V04_4x5_IMG_EN_New_C-BulletPoints_Sale_CTA-NY_Angle-W-B-C_M-NONE_VL-None_G-M_P-GLP1_S-NONE.jpg,3751 - opti 3608 GLP1 - VK-DP || Enhancements: OFF || GLP-1 || Batch 1 || 7C || 20/02/25w09 || Valentinas,SHARE,$23,"1,002",2025-02-24,2025-03-15,19
221,CB_2025_Feb_FB_3847_LZ-DP_V03_9x16_VID_EN_Opti_C-Testimonial_Evergreen_CTA-SALE_Angle-W-B-C_M-MAN_VL-30s_G-M_P-OG_S-WHAT_FB3097V03,3847 - #131 Notion idea i dare you to skip this ad hook Manuel || Enhancements: OFF || CBV1 || Batch 1 || 7C || 03/03/25w10 || Valentinas,VIDEO,$22,"1,147",2025-03-03,2025-03-06,3
222,CB_2025_Jan_FB_3742_SO-DP-KB_V01_4x5_IMG_EN_Opti_C-NONE_Evergreen_CTA-SALE_Angle-W_M-NONE_VL-None_G-NONE_P-CBV2_S-NONE3665V01,CBV2 || EU (UK) || 💰 Advantage+ || US || BROAD || 7C || Existing_customer_5% || 15/12/24 Ad set,SHARE,$22,"1,187",2025-02-04,2025-03-27,51
223,CB_2025_Feb_FB_3865_SO-JG_V03_4x5_GIF_EN_New_C-NONE_Evergreen_CTA-NONE_Angle-W_M-NONE_VL-None_G-NONE_P-OG_S-NONE,3867 - Fat Costume Suit || Enhancements: OFF || CBV1 || Batch 1 || 7C || 03/03/25w10 || Valentinas,VIDEO,$22,819,2025-03-03,2025-03-08,5
224,CB_2025_Feb_FB_3803_CHUB_V11_1x1_IMG_EN_New_C-NONE_CTA-NONE_Angle-None_M-NONE_VL-None_TR-None_G-NONE_P-NONE_S-NONE_blog_cbglp1_cv_en,GLP-1 || LP:HI | 3803 Advertorials CHUB || Natural GLP-1 Enhancer Takes Its Place || Batch 3 || 07/07/25,SHARE,$21,620,2025-03-07,2025-03-09,2
225,CB_2025_Feb_FB_3865_SO-JG_V13_9x16_VID_EN_Opti_C-NONE_Evergreen_CTA-NONE_Angle-W_M-NONE_VL-30_G-NONE_P-OG_S-WHAT_FB2284V05,3867 - Fat Costume Suit || Enhancements: OFF || CBV1 || Batch 4 || 7C || 03/03/25w10 || Valentinas,VIDEO,$21,"1,108",2025-03-03,2025-03-08,5
226,CB_2025_Feb_FB_3858_VK_V03_1x1_IMG_EN_New_C-BulletPoints_Evergreen_CTA-70_Angle-W-B-C_M-NONE_VL-None_G-NONE_P-OG_S-NONE,3858 - Retro ads -VK || Enhancements: OFF || CBV1 || Batch 1 || 7C || 03/03/25w10 || Valentinas,SHARE,$21,"1,113",2025-03-03,2025-03-08,5
227,CB_2025_Feb_FB_3589_CHUB-KZ_V08_9x16_VID_EN_New_C-NONE_CTA-NONE_Angle-None_M-NONE_VL-None_TR-None_G-NONE_P-NONE_S-NONE_blog_menopausesolutionnew_cv_en,CBV1 || LP:HI | 3859 - Blog_HormonalReset CHUB || The Little Known “Hormonal Reset” || Batch 2 || 07/07/25,VIDEO,$20,441,2025-03-07,2025-03-09,2
228,CB_2025_Feb_FB_3775_SO-JT_V04_9x16_VID_EN_New_C-Headline_Evergreen_CTA-NONE_Angle-W_M-NONE_VL-7s_G-NONE_P-GLP1_S-euphoria,3775 - CB / GLP-1 / VID BATCH || Enhancements: OFF || GLP-1 || Batch 1 || 7C || 24/02/25w09 || Valentinas,VIDEO,$20,684,2025-02-24,2025-03-06,10
229,CB_2025_Feb_FB_3847_LZ-DP_V01_9x16_VID_EN_Opti_C-Testimonial_Evergreen_CTA-SALE_Angle-W-B-C_M-MAN_VL-30s_G-M_P-OG_S-WHAT_FB3097V03,3847 - #131 Notion idea i dare you to skip this ad hook Manuel || Enhancements: OFF || CBV1 || Batch 1 || 7C || 03/03/25w10 || Valentinas,VIDEO,$20,850,2025-03-03,2025-03-06,3
230,CB_2025_Feb_FB_3870_LZ-DP_V03_9x16_VID_EN_New_C-Educational_Evergreen_CTA-SALE_Angle-W-B-C_M-TRC_VL-30s_G-F_P-OG_S-FRIGGA_2,3870 - TRC new idea educational UGC || Enhancements: OFF || CBV1 || Batch 1 || 7C || 03/03/25w10 || Valentinas,VIDEO,$20,987,2025-03-03,2025-03-06,3
231,CB_2024_Feb_FB_2814_MB-DP_V05_1x1_IMG_EN_New_C-WeightLoss_CTA-None_Pain-W-B-C_M-NONE_VL-None_TR-None_G-NONE_P-V2_S-NONE,CBV2 || EU (UK) || 💰 Advantage+ || US || BROAD || 7C || Existing_customer_5% || 15/12/24 Ad set,SHARE,$19,800,2025-01-31,2025-03-27,55
232,CB_2025_Feb_FB_3875_CHUB-AS_V02_9x16_VID_EN_New_C-NONE_CTA-NONE_Angle-None_M-NONE_VL-None_TR-None_G-NONE_P-NONE_S-NONE.mp4,3875 CHUB Do Not Do This - Guy || Enhancements: OFF || CBV1 || Batch 1 || 7C || 03/03/25w10 || Valentinas,VIDEO,$19,735,2025-03-04,2025-03-06,2
233,CB_2025_Feb_FB_3802_VK-DP_V01_1x1_IMG_EN_Opti_C-BulletPoints_Evergreen_CTA-70_Angle-W-B-C_M-NONE_VL-None_G-F_P-GLP1_S-NEW_FB2762V05.png,3802 - 7 hot benefits GLP VK || Enhancements: OFF || GLP-1 || Batch 1 || 7C || 24/02/25w09 || Valentinas,SHARE,$17,761,2025-02-24,2025-03-07,11
234,CB_2025_Jan_FB_3756_VK-DP_V04_4x5_IMG_EN_New_C-BulletPoints_Evergreen_CTA-NONE_Angle-W-B-C_M-NONE_VL-None_G-M_P-GLP1_S-NONE.png,3756 - opti 2834 GLP1 || Enhancements: OFF || GLP-1 || Batch 1 || 7C || 24/02/25w09 || Valentinas,SHARE,$17,637,2025-02-24,2025-03-11,15
235,CB_2025_Feb_FB_3802_VK-DP_V03_1x1_IMG_EN_Opti_C-BulletPoints_Evergreen_CTA-70_Angle-W-B-C_M-NONE_VL-None_G-F_P-GLP1_S-NEW_FB2762V05.jpg,3802 - 7 hot benefits GLP VK || Enhancements: OFF || GLP-1 || Batch 1 || 7C || 24/02/25w09 || Valentinas,SHARE,$16,853,2025-02-24,2025-03-07,11
236,CB_2025_Jan_FB_3757_LZ-DP_V11_9x16_VID_EN_Opti_C-NegativeMark_Evergreen_CTA-NONE_Angle-W_M-GLAD_VL-45s_G-F_P-GLP1_S-MOON_FB3278V01,3757 - GLP1 video winner opti Batch 3+4 || Enhancements: OFF || GLP-1 || Batch 3 || 7C || 24/02/25w09 || Valentinas,VIDEO,$16,700,2025-02-24,2025-03-06,10
237,CB_2025_Feb_FB_3865_SO-JG_V04_4x5_GIF_EN_New_C-NONE_Evergreen_CTA-NONE_Angle-W_M-NONE_VL-None_G-NONE_P-OG_S-NONE,3867 - Fat Costume Suit || Enhancements: OFF || CBV1 || Batch 1 || 7C || 03/03/25w10 || Valentinas,VIDEO,$16,696,2025-03-03,2025-03-07,4
238,CB_2023_Jul_FB_2217_IB_V04_9x16_VID_EN_Opti_C-Pointing_CTA-SMR_Pain-W-B_M-TRC_VL-30s_TR-None_G-F_P-None_S-FRIGGA,CB || US || Funnel A: React || 7DC || 2nd try || 26/02/2025,VIDEO,$16,681,2025-02-26,2025-03-04,6
239,CB_2025_Jan_FB_3739_DT_V03_4x5_VID_EN_Opti_C-Sale_Sale_CTA-70_Angle-W_M-MIX_VL-30s_G-MF_P-GLP1_S-WHAT_FB2103V03,GLP-1 💜 || ASC+ || US || 5% EXISTING CAP || 7C || 20/02/25 . Ad set,SHARE,$16,595,2025-02-24,2025-03-17,21
240,CB_2025_Jan_FB_3739_DT_V04_4x5_VID_EN_Opti_C-Dance_Sale_CTA-70_Angle-W_M-MIX_VL-45s_G-MF_P-GLP1_S-STARRY_FB1998V03,GLP-1 💜 || ASC+ || US || 5% EXISTING CAP || 7C || 20/02/25 . Ad set,SHARE,$15,794,2025-02-24,2025-03-18,22
241,CB_2025_Jan_FB_3762_LZ_V04_4x5_IMG_EN_Opti_C-NegativeMark_Evergreen_CTA-NONE_Angle-W_M-NONE_VL-None_G-NONE_P-GLP1_S-NONE_FB3251V01.png,3762 - Notion Idea #123 it's not cheap GLP1 || Enhancements: OFF || GLP-1 || Batch 1 || 7C || 20/02/25w09 || Valentinas,SHARE,$15,631,2025-02-24,2025-03-18,22
242,CB_2025_Feb_FB_3854_LZ-DP_V05_1x1_IMG_EN_Opti_C-Headline_Evergreen_CTA-NONE_Angle-W_M-NONE_VL-None_G-M_P-OG_S-NONE_FB3723V07.png,3854 - Man boobs opti || Enhancements: OFF || CBV1 || Batch 1 || 7C || 26/02/25w09 || Valentinas,SHARE,$14,"1,030",2025-02-26,2025-03-03,5
243,CB_2025_Feb_FB_3589_CHUB-KZ_V02_1x1_IMG_EN_New_C-NONE_CTA-NONE_Angle-None_M-NONE_VL-None_TR-None_G-NONE_P-NONE_S-NONE_blog_menopausesolutionnew_cv_en,CBV1 || LP:HI | 3859 - Blog_HormonalReset CHUB || The Little Known “Hormonal Reset” || Batch 1 || 07/07/25,SHARE,$14,248,2025-03-07,2025-03-09,2
244,CB_2025_Feb_FB_3855_SO_V05_9x16_VID_EN_New_C-NONE_Evergreen_CTA-NONE_Angle-W_M-NONE_VL-45s_G-None_P-OG_S-NEW,3855 - Notion Idea #141 “Questionnaire” || Enhancements: OFF || CBV1 || Batch 2 || 7C || 03/03/25w10 || Valentinas,VIDEO,$14,636,2025-03-03,2025-03-07,4
245,CB_2025_Feb_FB_3589_CHUB-KZ_V06_9x16_VID_EN_New_C-NONE_CTA-NONE_Angle-None_M-NONE_VL-None_TR-None_G-NONE_P-NONE_S-NONE_blog_menopausesolutionnew_cv_en,CBV1 || LP:HI | 3859 - Blog_HormonalReset CHUB || The Little Known “Hormonal Reset” || Batch 2 || 07/07/25,VIDEO,$14,442,2025-03-07,2025-03-09,2
246,CB_2025_Feb_FB_3803_CHUB_V03_1x1_IMG_EN_New_C-NONE_CTA-NONE_Angle-None_M-NONE_VL-None_TR-None_G-NONE_P-NONE_S-NONE_blog_cbglp1_cv_en,GLP-1 || LP:HI | 3803 Advertorials CHUB || Natural GLP-1 Enhancer Takes Its Place || Batch 1 || 07/07/25 || Kostas,SHARE,$13,397,2025-03-07,2025-03-09,2
247,CB_2025_Feb_FB_3871_DT-DP_V01_9x16_VID_EN_Opti_C-Sale_Sale_CTA-70_Angle-W_M-JANW_VL-30s_G-M_P-OG_S-WHAT_FB2284V05,3871 - 2284 opti VID || Enhancements: OFF || CBV1 || Batch 1 || 7C || 04/03/25w10 || Valentinas,SHARE,$13,668,2025-03-04,2025-03-14,10
248,CB_2025_Feb_FB_3865_SO-JG_V19_9x16_VID_EN_Opti_C-NONE_Evergreen_CTA-NONE_Angle-W_M-NONE_VL-30_G-NONE_P-OG_S-Moon_FB2263V04.mp4,3867 - Fat Costume Suit || Enhancements: OFF || CBV1 || Batch 5 || 7C || 03/03/25w10 || Valentinas,VIDEO,$13,533,2025-03-03,2025-03-19,16
249,CB_2025_Feb_FB_3873_LZ_V01_9x16_VID_EN_New_C-Comment_Evergreen_CTA-NONE_Angle-W_M-NONE_VL-15s_G-NONE_P-OG_S-NEW,3873 - Sleek video ads || Enhancements: OFF || CBV1 || Batch 1 || 7C1V || 04/03/25w10 || Valentinas,VIDEO,$12,725,2025-03-04,2025-03-08,4
250,CB_2025_Feb_FB_3876_VK-DP_V01_9x16_VID_EN_New_C-BulletPoints_Evergreen_CTA-NONE_Angle-W-B-C_M-NONE_VL-15s_G-M_P-OG_S-NEW.mp4,3876 - Saggy butt VID - VK || Enhancements: OFF || CBV1 || Batch 1 || 7C || 04/03/25w10 || Valentinas,SHARE,$12,581,2025-03-04,2025-03-08,4
251,CB_2024_Jan_FB_2762_IK_V04_1x1_IMG_EN_New_C-WrittenTesti_CTA-CTA_Pain-W-B-C_M-NONE_VL-None_TR-None_G-NONE_P-V2_S-NONE,CBV2 || AU || 💰 Advantage+ || US || BROAD || 7C || Existing_customer_5% || 19/12/24 Ad set,SHARE,$12,499,2024-12-19,2025-03-27,98
252,CB_2025_Jan_FB_3779_VK-DP_V02_1x1_VID_EN_Opti_C-BulletPoints_Evergreen_CTA-70_Angle-W-B-C_M-NONE_VL-None_G-F_P-OG_S-NEW_FB3705V02.png,CB || US || Funnel A: React || 7DC || 2nd try || 26/02/2025,SHARE,$11,642,2025-02-26,2025-03-04,6
253,CB_2025_Feb_FB_3869_DT_V02_9x16_GIF_EN_Opti_C-NONE_Evergreen_CTA-None_Angle-W_M-NONE_VL-None_G-NONE_P-NONE_S-New_FB3723V04,3869 - Man boobs GIF opti || Enhancements: OFF || CBV1 || Batch 1 || 7C || 03/03/25w10 || Valentinas,VIDEO,$11,304,2025-03-03,2025-03-11,8
254,CB_2025_Feb_FB_3874_CHUB-KZ_V06_1x1_IMG_EN_New_C-NONE_CTA-NONE_Angle-W_M-NONE_VL-None_TR-None_G-NONE_P-NONE_S-NONE_blog_biohacking_cv_en,CBV1 || LP:HI | 3874 Advertorial Biohacking || Biohack for 40+ Women || Batch 2 || 07/07/25,SHARE,$11,289,2025-03-07,2025-03-09,2
255,CB_2025_Jan_FB_3757_LZ-DP_V12_9x16_VID_EN_Opti_C-Dance_Evergreen_CTA-NONE_Angle-W-B_M-Nonie_VL-15s_G-F_P-GLP1_S-WHAT_FB3204V01.mp4,3757 - GLP1 video winner opti Batch 3+4 || Enhancements: OFF || GLP-1 || Batch 3 || 7C || 24/02/25w09 || Valentinas,VIDEO,$10,425,2025-02-24,2025-03-06,10
256,CB_2025_Feb_FB_3868_VK-DP_V04_9x16_VID_EN_New_C-BulletPoints_Evergreen_CTA-NONE_Angle-W-B-C_M-NONE_VL-15s_G-M_P-OG_S-NEW.mp4,3868 - What i ordered for dad bod || Enhancements: OFF || CBV1 || Batch 1 || 7C || 03/03/25w10 || Valentinas,VIDEO,$9,390,2025-03-03,2025-03-20,17
257,CB_2025_Jan_FB_3739_DT_V08_9x16_VID_EN_Opti_C-BulletPoints_Sale_CTA-70_Angle-W-B_M-MIX_VL-45s_G-MF_P-GLP1_S-WHAT_FB3311V09,GLP-1 💜 || ASC+ || US || 5% EXISTING CAP || 7C || 20/02/25 . Ad set,SHARE,$9,279,2025-02-24,2025-03-18,22
258,CB_2025_Feb_FB_3871_DT-DP_V01_9x16_VID_EN_Opti_C-Sale_Sale_CTA-70_Angle-W_M-JANW_VL-30s_G-M_P-OG_S-WHAT_FB2284V05,3871 - 2284 opti VID || Enhancements: OFF || CBV1 || Batch 1 || 7C1V || 04/03/25w10 || Valentinas,SHARE,$9,552,2025-03-04,2025-03-08,4
259,CB_2025_Feb_FB_3874_CHUB-KZ_V02_1x1_IMG_EN_New_C-NONE_CTA-NONE_Angle-W_M-NONE_VL-None_TR-None_G-NONE_P-NONE_S-NONE_blog_biohacking_cv_en,CBV1 || LP:HI | 3874 Advertorial Biohacking || Biohack for 40+ Women || Batch 1 || 07/07/25,SHARE,$9,143,2025-03-07,2025-03-09,2
260,CB_2025_Feb_FB_3803_CHUB_V10_1x1_IMG_EN_New_C-NONE_CTA-NONE_Angle-None_M-NONE_VL-None_TR-None_G-NONE_P-NONE_S-NONE_blog_cbglp1_cv_en,GLP-1 || LP:HI | 3803 Advertorials CHUB || Natural GLP-1 Enhancer Takes Its Place || Batch 3 || 07/07/25,SHARE,$9,192,2025-03-07,2025-03-09,2
261,CB_2025_Feb_FB_3865_SO-JG_V15_9x16_VID_EN_Opti_C-NONE_Evergreen_CTA-NONE_Angle-W_M-NONE_VL-30_G-NONE_P-OG_S-MOON_FB3090V02,3867 - Fat Costume Suit || Enhancements: OFF || CBV1 || Batch 4 || 7C || 03/03/25w10 || Valentinas,VIDEO,$8,436,2025-03-03,2025-03-08,5
262,CB_2025_Feb_FB_3860_LZ-DP_V04_9x16_VID_EN_Opti_C-Testimonial_Evergreen_CTA-SALE_Angle-W_M-MOOD_VL-20s_G-M_P-OG_S-WOOD_FB21176V11_1,3860 - man boobs video 2176 opti || Enhancements: OFF || CBV1 || Batch 1 || 7C || 03/03/25w10 || Valentinas,VIDEO,$8,339,2025-03-03,2025-03-26,23
263,CB_2025_Feb_FB_3803_CHUB_V04_1x1_IMG_EN_New_C-NONE_CTA-NONE_Angle-None_M-NONE_VL-None_TR-None_G-NONE_P-NONE_S-NONE_blog_cbglp1_cv_en,GLP-1 || LP:HI | 3803 Advertorials CHUB || Natural GLP-1 Enhancer Takes Its Place || Batch 1 || 07/07/25 || Kostas,SHARE,$8,253,2025-03-07,2025-03-09,2
264,CB_2025_Jan_FB_3739_DT_V07_9x16_VID_EN_Opti_C-Testimonial_Sale_CTA-70_Angle-W_M-MIX_VL-45s_G-MF_P-GLP1_S-MOON_FB2823V02,GLP-1 💜 || ASC+ || US || 5% EXISTING CAP || 7C || 20/02/25 . Ad set,SHARE,$8,329,2025-02-24,2025-03-17,21
265,CB_2025_Feb_FB_3869_DT_V03_9x16_GIF_EN_Opti_C-NONE_Evergreen_CTA-None_Angle-W_M-NONE_VL-None_G-NONE_P-NONE_S-New_FB3723V04.mp4,3869 - Man boobs GIF opti || Enhancements: OFF || CBV1 || Batch 1 || 7C || 03/03/25w10 || Valentinas,VIDEO,$7,267,2025-03-03,2025-03-11,8
266,CB_2025_Feb_FB_3855_SO_V06_9x16_VID_EN_New_C-NONE_Evergreen_CTA-NONE_Angle-W_M-NONE_VL-45s_G-None_P-OG_S-NEW,3855 - Notion Idea #141 “Questionnaire” || Enhancements: OFF || CBV1 || Batch 2 || 7C || 03/03/25w10 || Valentinas,VIDEO,$7,283,2025-03-03,2025-03-08,5
267,CB_2025_Feb_FB_3589_CHUB-KZ_V01_1x1_IMG_EN_New_C-NONE_CTA-NONE_Angle-None_M-NONE_VL-None_TR-None_G-NONE_P-NONE_S-NONE_blog_menopausesolutionnew_cv_en,CBV1 || LP:HI | 3859 - Blog_HormonalReset CHUB || The Little Known “Hormonal Reset” || Batch 1 || 07/07/25,SHARE,$7,112,2025-03-07,2025-03-09,2
268,CB_2025_Feb_FB_3865_SO-JG_V02_4x5_GIF_EN_New_C-NONE_Evergreen_CTA-NONE_Angle-W_M-NONE_VL-None_G-NONE_P-OG_S-NONE,3867 - Fat Costume Suit || Enhancements: OFF || CBV1 || Batch 1 || 7C || 03/03/25w10 || Valentinas,VIDEO,$7,310,2025-03-03,2025-03-08,5
269,CB_2025_Feb_FB_3865_SO-JG_V10_9x16_VID_EN_Opti_C-NONE_Evergreen_CTA-NONE_Angle-W_M-NONE_VL-30_G-NONE_P-OG_S-WHAT_FB2284V05,3867 - Fat Costume Suit || Enhancements: OFF || CBV1 || Batch 3 || 7C || 03/03/25w10 || Valentinas,VIDEO,$7,303,2025-03-03,2025-03-08,5
270,CB_2025_Feb_FB_3803_CHUB_V08_1x1_IMG_EN_New_C-NONE_CTA-NONE_Angle-None_M-NONE_VL-None_TR-None_G-NONE_P-NONE_S-NONE_blog_cbglp1_cv_en,GLP-1 || LP:HI | 3803 Advertorials CHUB || Natural GLP-1 Enhancer Takes Its Place || Batch 2 || 07/07/25 || Kostas,SHARE,$7,127,2025-03-07,2025-03-09,2
271,CB_2024_Oct_FB_3251_LZ-VU_V01_1x1_IMG_EN_New_C-NegativeMark_Evergreen_CTA-NONE_Angle-Cort_M-NONE_VL-None_G-NONE_P-NONE_S-NONE.png,US || Manual Bid || BFCM || COST CAP 71 || 1C || 15/11/24,SHARE,$7,207,2024-11-15,2025-03-26,131
272,CB_2025_Feb_FB_3865_SO-JG_V12_9x16_VID_EN_Opti_C-NONE_Evergreen_CTA-NONE_Angle-W_M-NONE_VL-30_G-NONE_P-OG_S-WHAT_FB2284V05,3867 - Fat Costume Suit || Enhancements: OFF || CBV1 || Batch 3 || 7C || 03/03/25w10 || Valentinas,VIDEO,$7,417,2025-03-03,2025-03-07,4
273,CB_2025_Jan_FB_3749_VK-DP_V02_4x5_IMG_EN_New_C-BulletPoints_Sale_CTA-NY_Angle-W-B-C_M-NONE_VL-None_G-M_P-GLP1_S-NONE.jpg,3749 - beer belly opti GLP1- VK=DP || Enhancements: OFF || GLP-1 || Batch 1 || 7C || 20/02/25w09 || Valentinas,SHARE,$6,260,2025-02-24,2025-03-08,12
274,CB_2025_Feb_FB_3871_DT-DP_V03_9x16_VID_EN_Opti_C-Sale_Sale_CTA-70_Angle-W_M-JANW_VL-30s_G-M_P-OG_S-WHAT_FB2284V05.mp4,3871 - 2284 opti VID || Enhancements: OFF || CBV1 || Batch 1 || 7C || 04/03/25w10 || Valentinas,SHARE,$6,357,2025-03-04,2025-03-14,10
275,CB_2023_Jul_FB_2217_IB_V04_9x16_VID_EN_Opti_C-Pointing_CTA-SMR_Pain-W-B_M-TRC_VL-30s_TR-None_G-F_P-None_S-FRIGGA,CB || US || Funnel B: Shopify || 7DC || 2nd try || 26/02/2025,VIDEO,$6,219,2025-02-26,2025-03-04,6
276,CB_2025_Jan_FB_3764_LZ-RP_V04_9x16_VID_EN_New_C-BulletPoints_Evergreen_CTA-NONE_Angle-W_M-MAN_VL-45s_G-M_P-GLP1_S-NEW.mp4,3764 - Notion idea #128 Biggest mistakes || Enhancements: OFF || GLP-1 || Batch 1 || 7C || 20/02/25w09 || Valentinas,VIDEO,$6,184,2025-02-24,2025-03-06,10
277,CB_2025_Feb_FB_3874_CHUB-KZ_V03_1x1_IMG_EN_New_C-NONE_CTA-NONE_Angle-W_M-NONE_VL-None_TR-None_G-NONE_P-NONE_S-NONE_blog_biohacking_cv_en,CBV1 || LP:HI | 3874 Advertorial Biohacking || Biohack for 40+ Women || Batch 1 || 07/07/25,SHARE,$6,75,2025-03-07,2025-03-09,2
278,CB_2025_Jan_FB_3762_LZ_V01_4x5_IMG_EN_Opti_C-NegativeMark_Evergreen_CTA-NONE_Angle-Cort_M-NONE_VL-None_G-NONE_P-GLP1_S-NONE_FB3251V01.png,3762 - Notion Idea #123 it's not cheap GLP1 || Enhancements: OFF || GLP-1 || Batch 1 || 7C || 20/02/25w09 || Valentinas,SHARE,$6,275,2025-02-24,2025-03-18,22
279,CB_2025_Jan_FB_3747_CHUB-AA_V01_4x5_IMG_EN_Opti_C-NONE_CTA-NONE_Angle-Sale_M-NONE_VL-None_TR-None_G-NONE_P-OG_S-NONE,3747 Clean Sale [HB winner ITR] CHUB || Enhancements: OFF || CBV1 || Batch ą || 1C || 02/02/25w06 || Kostas,SHARE,$6,308,2025-02-02,2025-03-27,53
280,CB_2025_Feb_FB_3854_LZ-DP_V03_1x1_IMG_EN_Opti_C-Headline_Evergreen_CTA-NONE_Angle-W_M-NONE_VL-None_G-M_P-OG_S-NONE_FB3723V07.png,3854 - Man boobs opti || Enhancements: OFF || CBV1 || Batch 1 || 7C || 26/02/25w09 || Valentinas,SHARE,$6,293,2025-02-26,2025-03-03,5
281,CB_2025_Feb_FB_3865_SO-JG_V07_4x5_GIF_EN_New_C-NONE_Evergreen_CTA-NONE_Angle-W_M-NONE_VL-None_G-NONE_P-OG_S-NONE.gif,3867 - Fat Costume Suit || Enhancements: OFF || CBV1 || Batch 2 || 7C || 03/03/25w10 || Valentinas,VIDEO,$6,104,2025-03-03,2025-03-08,5
282,CB_2025_Feb_FB_3874_CHUB-KZ_V01_1x1_IMG_EN_New_C-NONE_CTA-NONE_Angle-W_M-NONE_VL-None_TR-None_G-NONE_P-NONE_S-NONE_blog_biohacking_cv_en,CBV1 || LP:HI | 3874 Advertorial Biohacking || Biohack for 40+ Women || Batch 1 || 07/07/25,SHARE,$6,92,2025-03-07,2025-03-09,2
283,CB_2025_Feb_FB_3868_VK-DP_V03_9x16_VID_EN_New_C-BulletPoints_Evergreen_CTA-NONE_Angle-W-B-C_M-NONE_VL-15s_G-M_P-OG_S-NEW.mp4,3868 - What i ordered for dad bod || Enhancements: OFF || CBV1 || Batch 1 || 7C || 03/03/25w10 || Valentinas,SHARE,$6,226,2025-03-03,2025-03-20,17
284,CB_2025_Feb_FB_3874_CHUB-AA_V10_1x1_IMG_EN_New_C-NONE_CTA-NONE_Angle-W_M-NONE_VL-None_TR-None_G-NONE_P-NONE_S-NONE_blog_biohacking_cv_en,CBV1 || LP:HI | 3874 Advertorial Biohacking || Biohack for 40+ Women || Batch 3 || 07/07/25,SHARE,$5,286,2025-03-07,2025-03-09,2
285,CB_2025_Feb_FB_3855_SO_V02_9x16_VID_EN_New_C-NONE_Evergreen_CTA-NONE_Angle-W_M-NONE_VL-30s_G-None_P-OG_S-NEW,3855 - Notion Idea #141 “Questionnaire” || Enhancements: OFF || CBV1 || Batch 1 || 7C || 03/03/25w10 || Valentinas,VIDEO,$5,255,2025-03-03,2025-03-15,12
286,CB_2025_Jan_FB_3751_VK-DP_V03_4x5_IMG_EN_New_C-BulletPoints_Sale_CTA-NY_Angle-W-B-C_M-NONE_VL-None_G-M_P-GLP1_S-NONE.jpg,3751 - opti 3608 GLP1 - VK-DP || Enhancements: OFF || GLP-1 || Batch 1 || 7C || 20/02/25w09 || Valentinas,SHARE,$5,151,2025-02-24,2025-03-15,19
287,CB_2025_Feb_FB_3871_DT-DP_V02_9x16_VID_EN_Opti_C-Sale_Sale_CTA-70_Angle-W_M-JANW_VL-30s_G-M_P-OG_S-WHAT_FB2284V05.mp4,3871 - 2284 opti VID || Enhancements: OFF || CBV1 || Batch 1 || 7C || 04/03/25w10 || Valentinas,SHARE,$5,263,2025-03-04,2025-03-15,11
288,CB_2025_Feb_FB_3775_SO-JT_V04_9x16_VID_EN_New_C-Headline_Evergreen_CTA-NONE_Angle-W_M-NONE_VL-7s_G-NONE_P-GLP1_S-euphoria.mp4,3775 - CB / GLP-1 / VID BATCH || Enhancements: OFF || GLP-1 || Batch 1 || 7C || 24/02/25w09 || Valentinas,VIDEO,$5,123,2025-02-24,2025-03-06,10
289,CB_2025_Jan_FB_3764_LZ-RP_V01_9x16_VID_EN_New_C-BulletPoints_Evergreen_CTA-NONE_Angle-W_M-MAN_VL-45s_G-M_P-GLP1_S-NEW,3764 - Notion idea #128 Biggest mistakes || Enhancements: OFF || GLP-1 || Batch 1 || 7C || 20/02/25w09 || Valentinas,VIDEO,$5,114,2025-02-24,2025-03-06,10
290,CB_2025_Feb_FB_3865_SO-JG_V05_4x5_GIF_EN_New_C-NONE_Evergreen_CTA-NONE_Angle-W_M-NONE_VL-None_G-NONE_P-OG_S-NONE.gif,3867 - Fat Costume Suit || Enhancements: OFF || CBV1 || Batch 2 || 7C || 03/03/25w10 || Valentinas,VIDEO,$4,125,2025-03-03,2025-03-04,1
291,CB_2025_Feb_FB_3865_SO-JG_V06_4x5_GIF_EN_New_C-NONE_Evergreen_CTA-NONE_Angle-W_M-NONE_VL-None_G-NONE_P-OG_S-NONE.gif,3867 - Fat Costume Suit || Enhancements: OFF || CBV1 || Batch 2 || 7C || 03/03/25w10 || Valentinas,VIDEO,$4,198,2025-03-03,2025-03-07,4
292,CB_2025_Feb_FB_3861_LZ-DP_V01_1x1_IMG_EN_New_C-Headline_Evergreen_CTA-NONE_Angle-W_M-NONE_VL-None_G-M_P-OG_S-NONE.png,3861 - Man boobs transformation img || Enhancements: OFF || CBV1 || Batch 1 || 7C || 26/02/25w09 || Valentinas,SHARE,$4,163,2025-02-26,2025-03-03,5
293,CB_2025_Feb_FB_3871_DT-DP_V02_9x16_VID_EN_Opti_C-Sale_Sale_CTA-70_Angle-W_M-JANW_VL-30s_G-M_P-OG_S-WHAT_FB2284V05.mp4,3871 - 2284 opti VID || Enhancements: OFF || CBV1 || Batch 1 || 7C1V || 04/03/25w10 || Valentinas,SHARE,$4,251,2025-03-04,2025-03-07,3
294,CB_2025_Feb_FB_3855_SO_V08_9x16_VID_EN_New_C-NONE_Evergreen_CTA-NONE_Angle-W_M-NONE_VL-45s_G-None_P-OG_S-NEW,3855 - Notion Idea #141 “Questionnaire” || Enhancements: OFF || CBV1 || Batch 2 || 7C || 03/03/25w10 || Valentinas,VIDEO,$4,193,2025-03-03,2025-03-08,5
295,CB_2025_Feb_FB_3865_SO-JG_V11_9x16_VID_EN_Opti_C-NONE_Evergreen_CTA-NONE_Angle-W_M-NONE_VL-30_G-NONE_P-OG_S-WHAT_FB2284V05,3867 - Fat Costume Suit || Enhancements: OFF || CBV1 || Batch 3 || 7C || 03/03/25w10 || Valentinas,VIDEO,$4,129,2025-03-03,2025-03-06,3
296,CB_2025_Feb_FB_3861_LZ-DP_V04_1x1_IMG_EN_New_C-Headline_Evergreen_CTA-NONE_Angle-W_M-NONE_VL-None_G-M_P-OG_S-NONE.png,3861 - Man boobs transformation img || Enhancements: OFF || CBV1 || Batch 1 || 7C || 26/02/25w09 || Valentinas,SHARE,$3,147,2025-02-26,2025-03-03,5
297,CB_2025_Jan_FB_3739_DT_V06_9x16_VID_EN_Opti_C-Testimonial_Sale_CTA-70_Angle-W_M-MIX_VL-45s_G-MF_P-GLP1_S-MOON_FB2764V04,GLP-1 💜 || ASC+ || US || 5% EXISTING CAP || 7C || 20/02/25 . Ad set,SHARE,$3,109,2025-02-24,2025-03-18,22
298,CB_2025_Jan_FB_3762_LZ_V03_4x5_IMG_EN_Opti_C-NegativeMark_Evergreen_CTA-NONE_Angle-CR_M-NONE_VL-None_G-NONE_P-GLP1_S-NONE_FB3251V01.png,3762 - Notion Idea #123 it's not cheap GLP1 || Enhancements: OFF || GLP-1 || Batch 1 || 7C || 20/02/25w09 || Valentinas,SHARE,$3,163,2025-02-24,2025-03-17,21
299,CB_2025_Feb_FB_3871_DT-DP_V03_9x16_VID_EN_Opti_C-Sale_Sale_CTA-70_Angle-W_M-JANW_VL-30s_G-M_P-OG_S-WHAT_FB2284V05.mp4,3871 - 2284 opti VID || Enhancements: OFF || CBV1 || Batch 1 || 7C1V || 04/03/25w10 || Valentinas,SHARE,$3,213,2025-03-04,2025-03-07,3
300,CB_2025_Feb_FB_3811_DT_V02_9x16_VID_EN_Opti_C-Pointing_Sale_CTA-70_Angle-W_M-JOG_VL-30s_G-F_P-OG_S-New_FB2103V02,3811 - #133 Green screen timeframe hooks || Enhancements: OFF || CBV1 || Batch 1 || 7C || 19/02/25w08 || Kostas,VIDEO,$3,103,2025-02-19,2025-03-12,21
301,CB_2025_Feb_FB_3811_DT_V01_9x16_VID_EN_Opti_C-Pointing_Sale_CTA-70_Angle-W_M-JOG_VL-30s_G-F_P-OG_S-New_FB2103V02,3811 - #133 Green screen timeframe hooks || Enhancements: OFF || CBV1 || Batch 1 || 7C || 19/02/25w08 || Kostas,VIDEO,$3,83,2025-02-19,2025-03-12,21
302,CB_2025_Feb_FB_3865_SO-VU_V04_4x5_IMG_EN_Opti_C-NONE_Evergreen_CTA-NONE_Angle-Cort_M-NONE_VL-None_G-NONE_P-OG_S-NONE-1.png,3865 - HELLO! Idea Nr.23 || Enhancements: OFF || CBV1 || Batch 1 || 7C || 26/02/25w09 || Valentinas,SHARE,$3,82,2025-02-26,2025-03-03,5
303,CB_2022_Mar3_FB_713_IK_V04_1x1_IMG_EN_Opti_C-WrittenTesti_HE-98_A-ExtremeBodyVisualization_HK-bodypart_Pain-W_CLR-PURPLE_BG-IMAGE_ME-MIX_MA-YOUNG,US || Manual Bid || BFCM || COST CAP 81 || 1C || 15/11/24,SHARE,$2,137,2024-11-15,2025-03-26,131
304,CB_2025_Feb_FB_3862_LZ_V01_1x1_IMG_EN_New_C-Testimonial_Evergreen_CTA-NONE_Angle-W-B_M-NONE_VL-None_G-NONE_P-OG_S-NONE.png,3862 - sleek looking ads || Enhancements: OFF || CBV1 || Batch 1 || 7C || 26/02/25w09 || Valentinas,SHARE,$2,64,2025-02-26,2025-03-03,5
305,CB_2025_Jan_FB_3747_CHUB-AA_V04_9x16_IMG_EN_Opti_C-NONE_CTA-NONE_Angle-Sale_M-NONE_VL-None_TR-None_G-NONE_P-OG_S-NONE,3747 Clean Sale [HB winner ITR] CHUB || Enhancements: OFF || CBV1 || Batch ą || 1C || 02/02/25w06 || Kostas,SHARE,$2,171,2025-02-02,2025-03-27,53
306,CB_2025_Feb_FB_3862_LZ_V02_1x1_IMG_EN_New_C-Testimonial_Evergreen_CTA-NONE_Angle-W-B_M-NONE_VL-None_G-NONE_P-OG_S-NONE.png,3862 - sleek looking ads || Enhancements: OFF || CBV1 || Batch 1 || 7C || 26/02/25w09 || Valentinas,SHARE,$2,104,2025-02-26,2025-03-03,5
307,CB_2025_Jan_FB_3739_DT_V09_9x16_VID_EN_Opti_C-Testimonial_Sale_CTA-70_Angle-W-B_M-MIX_VL-45s_G-MF_P-GLP1_S-MOON_FB3278V04,GLP-1 💜 || ASC+ || US || 5% EXISTING CAP || 7C || 20/02/25 . Ad set,SHARE,$2,115,2025-02-24,2025-03-18,22
308,CB_2025_Feb_FB_3802_VK-DP_V04_1x1_IMG_EN_Opti_C-BulletPoints_Evergreen_CTA-70_Angle-W-B-C_M-NONE_VL-None_G-F_P-GLP1_S-NEW_FB2762V05.jpg,3802 - 7 hot benefits GLP VK || Enhancements: OFF || GLP-1 || Batch 1 || 7C || 24/02/25w09 || Valentinas,SHARE,$2,113,2025-02-24,2025-03-07,11
309,CB_2025_Jan_FB_3748_VK-DP_V03_4x5_IMG_EN_New_C-BulletPoints_Sale_CTA-NY_Angle-W-B-C_M-NONE_VL-None_G-M_P-OG_S-NONE.png - Copy,3748 - winner ads opti - GLP1 - VK-DP || Enhancements: OFF || GLP-1 || Batch 1 || 7C || 20/02/25w09 || Valentinas,SHARE,$2,72,2025-02-24,2025-03-18,22
310,CB_2025_Jan_FB_3739_DT_V01_4x5_VID_EN_Opti_C-NegativeMark_Sale_CTA-70_Angle-W_M-MIX_VL-45s_G-MF_P-GLP1_S-MOON_FB2263V05,GLP-1 💜 || ASC+ || US || 5% EXISTING CAP || 7C || 20/02/25 . Ad set,SHARE,$2,107,2025-02-24,2025-03-18,22
311,CB_2025_Feb_FB_3865_SO-VU_V03_4x5_IMG_EN_Opti_C-NONE_Evergreen_CTA-NONE_Angle-Cort_M-NONE_VL-None_G-NONE_P-OG_S-NONE.png,3865 - HELLO! Idea Nr.23 || Enhancements: OFF || CBV1 || Batch 1 || 7C || 26/02/25w09 || Valentinas,SHARE,$2,90,2025-02-26,2025-03-03,5
312,CB_2023_Jul_FB_2217_IB_V04_9x16_VID_EN_Opti_C-Pointing_CTA-SMR_Pain-W-B_M-TRC_VL-30s_TR-None_G-F_P-None_S-FRIGGA,US || Manual Bid || BID CAP 111 || 1C || 21/12/24,VIDEO,$2,70,2024-12-22,2025-03-24,92
313,CB_2025_Jan_FB_3757_LZ-DP_V20_9x16_VID_EN_Opti_C-NegativeMark_Evergreen_CTA-NONE_Angle-W-B_M-MAG_VL-45s_G-F_P-GLP1_S-WHAT_FB3311V14.mp4,3757 - GLP1 video winner opti Batch 3+4 || Enhancements: OFF || GLP-1 || Batch 4 || 7C || 24/02/25w09 || Valentinas,VIDEO,$2,74,2025-02-24,2025-03-17,21
314,CB_2025_Feb_FB_3854_LZ-DP_V04_1x1_IMG_EN_Opti_C-Headline_Evergreen_CTA-NONE_Angle-W_M-NONE_VL-None_G-M_P-OG_S-NONE_FB3723V07-1.png,3854 - Man boobs opti || Enhancements: OFF || CBV1 || Batch 1 || 7C || 26/02/25w09 || Valentinas,SHARE,$2,77,2025-02-26,2025-03-03,5
315,CB_2025_Feb_FB_3775_SO-JT_V02_9x16_VID_EN_New_C-Headline_Evergreen_CTA-NONE_Angle-W_M-NONE_VL-7s_G-NONE_P-GLP1_S-Grind_To_The_Top.mp4,3775 - CB / GLP-1 / VID BATCH || Enhancements: OFF || GLP-1 || Batch 1 || 7C || 24/02/25w09 || Valentinas,VIDEO,$1,51,2025-02-24,2025-03-06,10
316,CB_2025_Feb_FB_3803_CHUB_V09_1x1_IMG_EN_New_C-NONE_CTA-NONE_Angle-None_M-NONE_VL-None_TR-None_G-NONE_P-NONE_S-NONE_blog_cbglp1_cv_en,GLP-1 || LP:HI | 3803 Advertorials CHUB || Natural GLP-1 Enhancer Takes Its Place || Batch 3 || 07/07/25,SHARE,$1,33,2025-03-07,2025-03-09,2
317,CB_2025_Feb_FB_3862_LZ_V03_1x1_IMG_EN_New_C-Testimonial_Evergreen_CTA-NONE_Angle-W-B_M-NONE_VL-None_G-NONE_P-OG_S-NONE.png,3862 - sleek looking ads || Enhancements: OFF || CBV1 || Batch 1 || 7C || 26/02/25w09 || Valentinas,SHARE,$1,39,2025-02-26,2025-03-03,5
318,CB_2025_Jan_FB_3747_CHUB-AA_V02_9x16_IMG_EN_Opti_C-NONE_CTA-NONE_Angle-Sale_M-NONE_VL-None_TR-None_G-NONE_P-OG_S-NONE,3747 Clean Sale [HB winner ITR] CHUB || Enhancements: OFF || CBV1 || Batch ą || 1C || 02/02/25w06 || Kostas,SHARE,$1,100,2025-02-02,2025-03-27,53
319,CB_2025_Feb_FB_3864_DT-VU_V04_1x1_IMG_EN_Opti_C-Trend_Sale_CTA-65_Angle-W_M-NONE_VL-None_G-NONE_P-OG_S-NONE.png,3864 - weight loss event towards man boobs || Enhancements: OFF || CBV1 || Batch 1 || 7C || 26/02/25w09 || Valentinas,SHARE,$1,45,2025-02-26,2025-03-03,5
320,CB_2025_Jan_FB_3779_VK-DP_V01_1x1_VID_EN_Opti_C-BulletPoints_Evergreen_CTA-70_Angle-W-B-C_M-NONE_VL-None_G-F_P-OG_S-NEW_FB3705V02,3779 - opti 3705 || Enhancements: OFF || CBV1 || Batch 1 || 1C || 04/02/25w06 || Kostas,SHARE,$1,79,2025-02-04,2025-03-20,44
321,CB_2025_Feb_FB_3868_VK-DP_V01_9x16_VID_EN_New_C-BulletPoints_Evergreen_CTA-NONE_Angle-W-B-C_M-NONE_VL-15s_G-M_P-OG_S-NEW,3868 - What i ordered for dad bod || Enhancements: OFF || CBV1 || Batch 1 || 7C || 03/03/25w10 || Valentinas,VIDEO,$1,48,2025-03-03,2025-03-20,17
322,CB_2025_Jan_FB_3757_LZ-DP_V17_9x16_VID_EN_Opti_C-NegativeMark_Evergreen_CTA-NONE_Angle-W_M-ATBJ_VL-45s_G-F_P-GLP1_S-MOON_FB3626V01.mp4,3757 - GLP1 video winner opti Batch 3+4 || Enhancements: OFF || GLP-1 || Batch 4 || 7C || 24/02/25w09 || Valentinas,VIDEO,$1,20,2025-02-24,2025-03-16,20
323,CB_2024_Oct_FB_3251_LZ-VU_V01_1x1_IMG_EN_New_C-NegativeMark_Evergreen_CTA-NONE_Angle-Cort_M-NONE_VL-None_G-NONE_P-NONE_S-NONE.png,US || Manual Bid || BFCM || COST CAP 81 || 1C || 15/11/24,SHARE,$1,14,2024-11-15,2025-03-17,122
324,CB_2025_Jan_FB_3748_VK-DP_V04_4x5_IMG_EN_New_C-BulletPoints_Sale_CTA-NY_Angle-W-B-C_M-NONE_VL-None_G-M_P-OG_S-NONE.png - Copy,3748 - winner ads opti - GLP1 - VK-DP || Enhancements: OFF || GLP-1 || Batch 1 || 7C || 20/02/25w09 || Valentinas,SHARE,$1,38,2025-02-24,2025-03-16,20
325,CB_2025_Feb_FB_3864_DT-VU_V02_1x1_IMG_EN_Opti_C-Trend_Sale_CTA-65_Angle-W_M-NONE_VL-None_G-NONE_P-OG_S-NONE.png,3864 - weight loss event towards man boobs || Enhancements: OFF || CBV1 || Batch 1 || 7C || 26/02/25w09 || Valentinas,SHARE,$1,31,2025-02-26,2025-03-03,5
326,CB_2024_Dec_FB_3622_LZ-KB_V03_4x5_IMG_EN_Opti_C-NONE_Sale_CTA-XMAS_Angle-GH_M-NONE_VL-None_G-NONE_P-OG_S-NONE_FB2227V08 - Copy,US || Manual Bid || BID CAP 111 || 1C || 21/12/24,SHARE,$1,18,2024-12-22,2025-03-26,94
327,CB_2025_Feb_FB_3855_SO_V01_9x16_VID_EN_New_C-NONE_Evergreen_CTA-NONE_Angle-W_M-NONE_VL-30s_G-None_P-OG_S-NEW,3855 - Notion Idea #141 “Questionnaire” || Enhancements: OFF || CBV1 || Batch 1 || 7C || 03/03/25w10 || Valentinas,VIDEO,$1,44,2025-03-03,2025-03-15,12
328,CB_2024_Dec_FB_3619_VK-JT_V02_4x5_VID_EN_New_C-BulletPoints_Sale_CTA-NY_Angle-W-B-C_M-NONE_VL-None_G-NONE_P-OG_S-NONE,CB || US || Funnel A: React || 7DC || 2nd try || 26/02/2025,SHARE,$1,60,2025-02-26,2025-03-04,6
329,CB_2025_Feb_FB_3589_CHUB-KZ_V03_1x1_IMG_EN_New_C-NONE_CTA-NONE_Angle-None_M-NONE_VL-None_TR-None_G-NONE_P-NONE_S-NONE_blog_menopausesolutionnew_cv_en,CBV1 || LP:HI | 3859 - Blog_HormonalReset CHUB || The Little Known “Hormonal Reset” || Batch 1 || 07/07/25,SHARE,$0,14,2025-03-07,2025-03-09,2
330,CB_2025_Jan_FB_3764_LZ-RP_V05_9x16_VID_EN_New_C-BulletPoints_Evergreen_CTA-NONE_Angle-W_M-MAN_VL-45s_G-M_P-GLP1_S-NEW.mp4,3764 - Notion idea #128 Biggest mistakes || Enhancements: OFF || GLP-1 || Batch 1 || 7C || 20/02/25w09 || Valentinas,VIDEO,$0,26,2025-02-24,2025-03-06,10
331,CB_2025_Jan_FB_3764_LZ-RP_V03_9x16_VID_EN_New_C-BulletPoints_Evergreen_CTA-NONE_Angle-W_M-MAN_VL-45s_G-M_P-GLP1_S-NEW.mp4,3764 - Notion idea #128 Biggest mistakes || Enhancements: OFF || GLP-1 || Batch 1 || 7C || 20/02/25w09 || Valentinas,VIDEO,$0,26,2025-02-24,2025-03-06,10
332,CB_2025_Feb_FB_3864_DT-VU_V01_1x1_IMG_EN_Opti_C-Trend_Sale_CTA-65_Angle-W_M-NONE_VL-None_G-NONE_P-OG_S-NONE.png,3864 - weight loss event towards man boobs || Enhancements: OFF || CBV1 || Batch 1 || 7C || 26/02/25w09 || Valentinas,SHARE,$0,17,2025-02-26,2025-03-03,5
333,CB_2024_Dec_FB_3619_VK-JT_V02_4x5_VID_EN_New_C-BulletPoints_Sale_CTA-NY_Angle-W-B-C_M-NONE_VL-None_G-NONE_P-OG_S-NONE,CB || US || Funnel B: Shopify || 7DC || 2nd try || 26/02/2025,SHARE,$0,25,2025-02-26,2025-03-04,6
334,CB_2024_Dec_FB_3611_CHUB_V05_4x5_IMG_EN_Opti_C-Headline_CTA-NONE_Angle-C_P-NONE_S-NONE - Copy,US || Manual Bid || BID CAP 111 || 1C || 21/12/24,SHARE,$0,18,2024-12-27,2025-03-24,87
335,CB_2025_Jan_FB_3757_LZ-DP_V17_9x16_VID_EN_Opti_C-NegativeMark_Evergreen_CTA-NONE_Angle-W_M-ATBJ_VL-45s_G-F_P-GLP1_S-MOON_FB3626V01.mp4,3757 - GLP1 video winner opti Batch 3+4 || Enhancements: OFF || GLP-1 || Batch 4 || 7C || 24/02/25w09 || Valentinas,VIDEO,$0,9,2025-02-24,2025-03-17,21
336,CB_2025_Feb_FB_3811_DT_V03_9x16_VID_EN_Opti_C-Sale_Sale_CTA-70_Angle-W_M-JOG_VL-45s_G-M-F_P-OG_S-Moon_FB2263V04,3811 - #133 Green screen timeframe hooks || Enhancements: OFF || CBV1 || Batch 1 || 7C || 19/02/25w08 || Kostas,VIDEO,$0,15,2025-02-19,2025-03-11,20
337,CB_2025_Jan_FB_3779_VK-DP_V03_1x1_VID_EN_Opti_C-BulletPoints_Evergreen_CTA-70_Angle-W-B-C_M-NONE_VL-None_G-F_P-OG_S-NEW_FB3705V02,3779 - opti 3705 || Enhancements: OFF || CBV1 || Batch 1 || 1C || 04/02/25w06 || Kostas,SHARE,$0,8,2025-02-04,2025-03-20,44
338,CB_2025_Feb_FB_3863_DT-DP_V02_9x16_VID_EN_New_C-Trend_Sale_CTA-70_Angle-W_M-POW_VL-30s_G-M_P-OG_S-NEW.mp4,3863 - Aaron man boobs vid || Enhancements: OFF || CBV1 || Batch 1 || 7C || 26/02/25w09 || Valentinas,VIDEO,$0,10,2025-02-26,2025-03-27,29
339,CB_2025_Feb_FB_3854_LZ-DP_V02_1x1_IMG_EN_Opti_C-Headline_Evergreen_CTA-NONE_Angle-W_M-NONE_VL-None_G-M_P-OG_S-NONE_FB3723V07.png,3854 - Man boobs opti || Enhancements: OFF || CBV1 || Batch 1 || 7C || 26/02/25w09 || Valentinas,SHARE,$0,5,2025-02-26,2025-03-03,5
340,CB_2025_Feb_FB_3861_LZ-DP_V03_1x1_IMG_EN_New_C-Headline_Evergreen_CTA-NONE_Angle-W_M-NONE_VL-None_G-M_P-OG_S-NONE.png,3861 - Man boobs transformation img || Enhancements: OFF || CBV1 || Batch 1 || 7C || 26/02/25w09 || Valentinas,SHARE,$0,5,2025-02-26,2025-03-03,5
341,CB_2025_Feb_FB_3863_DT-DP_V04_9x16_VID_EN_New_C-Trend_Sale_CTA-70_Angle-W_M-POW_VL-30s_G-M_P-OG_S-NEW.mp4,3863 - Aaron man boobs vid || Enhancements: OFF || CBV1 || Batch 1 || 7C || 26/02/25w09 || Valentinas,VIDEO,$0,4,2025-02-26,2025-03-27,29
342,CB_2023_Jul_FB_2217_IB_V04_9x16_VID_EN_Opti_C-Pointing_CTA-SMR_Pain-W-B_M-TRC_VL-30s_TR-None_G-F_P-None_S-FRIGGA,US || Manual Bid || BID CAP 105 || 1C || 21/12/24,VIDEO,$0,1,2024-12-22,2025-03-27,95
343,CB_2025_Feb_FB_3850_DT-DP_V03_9x16_VID_EN_Opti_C-Pointing_Sale_CTA-70_Angle-W_M-POW_VL-30s_G-F_S-Moon_FB2036V03.mp4,3850 - Man boobs/dad bod opti on videos || Enhancements: OFF || CBV1 || Batch 1 || 7C || 26/02/25w09 || Valentinas,VIDEO,$0,6,2025-02-26,2025-03-03,5
344,CB_2025_Feb_FB_3865_SO-VU_V02_4x5_IMG_EN_Opti_C-NONE_Evergreen_CTA-NONE_Angle-Cort_M-NONE_VL-None_G-NONE_P-OG_S-NONE.png,3865 - HELLO! Idea Nr.23 || Enhancements: OFF || CBV1 || Batch 1 || 7C || 26/02/25w09 || Valentinas,SHARE,$0,2,2025-02-26,2025-03-03,5
345,CB_2023_May_FB_2103_MB_V02_9x16_VID_EN_Opti_C-Sale_CTA-SMR_Pain-W_M-JOG_VL-30s_TR-None_G-M-F_P-None_S-What,US || Manual Bid || BID CAP 111 || 1C || 21/12/24,VIDEO,$0,2,2024-12-28,2025-03-27,89
346,CB_2025_Feb_FB_3850_DT-DP_V02_9x16_VID_EN_Opti_C-Benefits_Sale_CTA-70_Angle-W-B_M-MIX_VL-45s_G-MF_P-OG_S-WHAT_FB3097V03.mp4,3850 - Man boobs/dad bod opti on videos || Enhancements: OFF || CBV1 || Batch 1 || 7C || 26/02/25w09 || Valentinas,VIDEO,$0,1,2025-02-26,2025-03-03,5
347,CB_2025_Feb_FB_3850_DT-DP_V01_9x16_VID_EN_Opti_C-Trend_Sale_CTA-70_Angle-W_M-MIX_VL-30s_G-MF_P-OG_S-WHAT FB1989V08.mp4,3850 - Man boobs/dad bod opti on videos || Enhancements: OFF || CBV1 || Batch 1 || 7C || 26/02/25w09 || Valentinas,VIDEO,$0,1,2025-02-26,2025-03-03,5
